n,id,title,url,image
1,q_ZxW4Eqa,"En foco. El fallo de la Corte sobre las clases presenciales, un golpe a la soberbia y el autoritarismo",https://www.clarin.com/opinion/golpe-soberbia-autoritarismo_0_q_ZxW4Eqa.html,https://images.clarin.com/2021/05/04/hCcohl5Ko_720x0__1.jpg
2,SIasHnhXw,Nación vs. Ciudad. El Gobierno minimiza el fallo y apura una ley para regular las restricciones,https://www.clarin.com/politica/gobierno-decidio-reforzar-respuesta-corte-suprema-afirma-seguira-actuando-igual-pandemia_0_SIasHnhXw.html,https://images.clarin.com/2021/05/04/YAlr2hOoW_720x0__1.jpg
3,Cp84_QLUe,Pelea por las clases. Larreta ordenó no celebrar y apunta a retomar la relación con Alberto F.,https://www.clarin.com/politica/horacio-rodriguez-larreta-dio-orden-celebrar-fallo-apunta-retomar-relacion-alberto-fernandez_0_Cp84_QLUe.html,https://images.clarin.com/2021/04/16/_BMHeErPf_720x0__1.jpg
4,xA-mBswCB,"Escenario. Sin otras vacunas a la vista, el Gobierno apuesta a que Biden libere dosis",https://www.clarin.com/politica/vacunas-vista-gobierno-espera-joe-biden-libere-dosis-argentina_0_xA-mBswCB.html,https://images.clarin.com/2021/05/04/nnxBncRcl_720x0__1.jpg
5,ydzcK7L3r,Del editor. Madrid avisa: con peste va más gente a votar,https://www.clarin.com/opinion/madrid-avisa-peste-va-gente-votar_0_ydzcK7L3r.html,https://images.clarin.com/2021/05/04/0MMgyG2h5_720x0__1.jpg
6,u58wziAZM,"Líder de Podemos. Tras la derrota en Madrid, Pablo Iglesias anunció que deja la política",https://www.clarin.com/mundo/derrota-madrid-lider-podemos-pablo-iglesias-anuncio-deja-politica_0_u58wziAZM.html,https://images.clarin.com/2021/05/04/qru-S3QMI_1256x620__2.jpg#1620164691607
7,bCSmbjFQ6,Por la Copa. Boca perdió en Ecuador y se terminó su racha ganadora,https://www.clarin.com/deportes/barcelona-vs-boca-copa-liga-profesional-futbol-previa-alineaciones-directo_0_bCSmbjFQ6.html,https://images.clarin.com/2021/05/04/4zNV5BMUi_720x0__1.jpg
8,3wYFDqstn,En Guayaquil. La jugada que hizo volar a Russo y generó tensión en Boca-Barcelona,https://www.clarin.com/deportes/video-llevaron-puesto-miguel-angel-russo-volo-aire-vivio-instante-tension_0_3wYFDqstn.html,https://images.clarin.com/2021/05/04/BWxpXhhuL_720x0__1.jpg
9,L_JAGRp4T,Horas decisivas. Pizzi dejará de ser el técnico de Racing y asoma Mohamed como reemplazo,https://www.clarin.com/deportes/juan-antonio-pizzi-dejara-tecnico-racing-asoma-antonio-mohamed-reemplazante_0_L_JAGRp4T.html,https://images.clarin.com/2021/05/04/u4kMcNWQL_720x0__1.jpg
10,r-Q3uojeP,Foco Económico. Martín Guzmán se metió en el laberinto K y queda a la intemperie,https://www.clarin.com/economia/martin-guzman-metio-laberinto-k-queda-intemperie_0_r-Q3uojeP.html,https://images.clarin.com/2021/05/04/81Lxacgwb_720x0__1.jpg
11,LUQvq2ssN,"Especial Clarín. Guernica, 6 meses después: jinetes armados y desalojados sin solución",https://www.clarin.com/sociedad/guernica-meses-despues-jinetes-armados-desalojados-solucion_0_LUQvq2ssN.html,https://images.clarin.com/2020/10/29/VgR88izG5_1256x620__2.jpg#1620055955933
12,q_ZxW4Eqa,"En foco. El fallo de la Corte sobre las clases presenciales, un golpe a la soberbia y el autoritarismo",https://www.clarin.com/opinion/golpe-soberbia-autoritarismo_0_q_ZxW4Eqa.html,https://images.clarin.com/2021/05/04/hCcohl5Ko_720x0__1.jpg
13,SIasHnhXw,Nación vs. Ciudad. El Gobierno minimiza el fallo y apura una ley para regular las restricciones,https://www.clarin.com/politica/gobierno-decidio-reforzar-respuesta-corte-suprema-afirma-seguira-actuando-igual-pandemia_0_SIasHnhXw.html,https://images.clarin.com/2021/05/04/YAlr2hOoW_720x0__1.jpg
14,Cp84_QLUe,Pelea por las clases. Larreta ordenó no celebrar y apunta a retomar la relación con Alberto F.,https://www.clarin.com/politica/horacio-rodriguez-larreta-dio-orden-celebrar-fallo-apunta-retomar-relacion-alberto-fernandez_0_Cp84_QLUe.html,https://images.clarin.com/2021/04/16/_BMHeErPf_720x0__1.jpg
15,xA-mBswCB,"Escenario. Sin otras vacunas a la vista, el Gobierno apuesta a que Biden libere dosis",https://www.clarin.com/politica/vacunas-vista-gobierno-espera-joe-biden-libere-dosis-argentina_0_xA-mBswCB.html,https://images.clarin.com/2021/05/04/nnxBncRcl_720x0__1.jpg
16,ydzcK7L3r,Del editor. Madrid avisa: con peste va más gente a votar,https://www.clarin.com/opinion/madrid-avisa-peste-va-gente-votar_0_ydzcK7L3r.html,https://images.clarin.com/2021/05/04/0MMgyG2h5_720x0__1.jpg
17,u58wziAZM,"Líder de Podemos. Tras la derrota en Madrid, Pablo Iglesias anunció que deja la política",https://www.clarin.com/mundo/derrota-madrid-lider-podemos-pablo-iglesias-anuncio-deja-politica_0_u58wziAZM.html,https://images.clarin.com/2021/05/04/qru-S3QMI_1256x620__2.jpg#1620164691607
18,bCSmbjFQ6,Por la Copa. Boca perdió en Ecuador y se terminó su racha ganadora,https://www.clarin.com/deportes/barcelona-vs-boca-copa-liga-profesional-futbol-previa-alineaciones-directo_0_bCSmbjFQ6.html,https://images.clarin.com/2021/05/04/4zNV5BMUi_720x0__1.jpg
19,-CgRH9siv,"NBA. Deck, encendido: récord de puntos y su primer triple en la derrota del Thunder",https://www.clarin.com/deportes/gabriel-deck-encendido-nba-record-puntos-primer-triple-derrota-thunder_0_-CgRH9siv.html,https://images.clarin.com/2021/05/05/bcKfrTHQt_720x0__1.jpg
20,PFrN-BIVV,Copa Sudamericana. Independiente luchó contra todo y rescató un valioso empate ante Bahía,https://www.clarin.com/deportes/bahia-vs-independiente-copa-sudamericana-previa-alineaciones-directo_0_PFrN-BIVV.html,https://images.clarin.com/2021/05/04/dasa1Why8_720x0__1.jpg
21,1-rRFWwTJ,Champions League. El City le dio una clase de fútbol al PSG y jugará la final por primera vez,https://www.clarin.com/deportes/manchester-city-vs-paris-saint-germain-champions-league-previa-alineaciones-directo_0_1-rRFWwTJ.html,https://images.clarin.com/2021/05/04/zRGR4q_yo_720x0__1.jpg
22,B9k1doylR,Copa Libertadores. Vélez ganó con autoridad en Chile y obtuvo sus primeros puntos,https://www.clarin.com/deportes/union-calera-vs-velez-sarsfield-copa-libertadores-formaciones-hora-minuto-minuto_0_B9k1doylR.html,https://images.clarin.com/2021/05/04/nDeyeDhOV_720x0__1.jpg
23,iGQyRtNBU,Fútbol local. Ya están los horarios para la última fecha de la primera fase,https://www.clarin.com/deportes/copa-liga-profesional-futbol-horarios-ultima-fecha-primera-fase_0_iGQyRtNBU.html,https://images.clarin.com/2020/02/22/pkd0Safb_720x0__1.jpg
24,bdH4wOCbp,Tras la Recopa. Rony fue imparable y Palmeiras superó a Defensa y Justicia,https://www.clarin.com/deportes/defensa-justicia-vs-palmeiras-copa-libertadores-formaciones-hora-minuto-minuto_0_bdH4wOCbp.html,https://images.clarin.com/2021/05/04/rPreOHneM_720x0__1.jpg
25,beyw7G-Qa,No va a Colombia. River jugará el jueves con Santa Fe en Paraguay por la Libertadores,https://www.clarin.com/deportes/river-viaja-colombia-suspendio-partido-copa-libertadores_0_beyw7G-Qa.html,https://images.clarin.com/2021/05/04/8SUAJ9WRJ_1256x620__2.jpg#1620159710001
26,w1vwXkp_S,"Dolor en el fútbol. Por complicaciones del Covid murió Omar ""Indio"" Gómez, gloria de Quilmes",https://www.clarin.com/deportes/murio-exfutbolista-omar-indio-gomez-66-anos-internado-coronavirus_0_w1vwXkp_S.html,https://images.clarin.com/2021/05/04/f-dl4aRmB_720x0__1.jpg
27,qR5t32bV9,AMIA. Cristina pidió que anulen la causa de encubrimiento a los autores del atentado,https://www.clarin.com/politica/cristina-kirchner-pidio-nulidad-causa-memorandum-iran_0_qR5t32bV9.html,https://images.clarin.com/2021/05/04/8e6lMO-uJ_720x0__1.jpg
28,YCN0RXhU9,Contradicciones. Qué decía Fernández en 2013 sobre la Corte Suprema y Cristina Kirchner,https://www.clarin.com/politica/decia-alberto-fernandez-2013-corte-suprema-cristina-kirchner_0_YCN0RXhU9.html,https://images.clarin.com/2021/03/01/PfGXoVpg__720x0__1.jpg
29,BJQZVKvfU,España. Contundente triunfo del Partido Popular en las elecciones de Madrid,https://www.clarin.com/mundo/espana-partido-popular-gana-elecciones-regionales-madrid-sondeo_0_BJQZVKvfU.html,https://images.clarin.com/2021/05/04/60kBIKkIk_1200x0__2.jpg#1620153440717
30,WPYFphx5H,Política sin clósets. Guerrera habló sobre cómo es ser el primer ministro nacional abiertamente gay,https://www.clarin.com/politica/alexis-guerrera-hablo-primer-ministro-nacional-abiertamente-gay_0_WPYFphx5H.html,https://images.clarin.com/2021/05/03/dYvjL02PY_720x0__1.jpg
31,2sc6voun2,Por su vacuna. Pfizer reportó ganancias por US$ 4.900 millones en un trimestre,https://www.clarin.com/economia/vacuna-coronavirus-pfizer-reporto-ganancias-us-4-900-millones-trimestre_0_2sc6voun2.html,https://images.clarin.com/2021/05/04/J_7Br2p5g_720x0__1.jpg
32,LMyziFl_p,Crisis social. Otra noche violenta en Colombia: incendiaron puestos policiales en Bogotá,https://www.clarin.com/mundo/noche-violenta-colombia-incendiaron-puestos-policiales-bogota_0_LMyziFl_p.html,https://images.clarin.com/2021/05/05/yQ1VetFgx_720x0__1.jpg
33,cnJgQcCZr,Pacto con Irán. Los errores y las omisiones del video de Cristina narrado por Pablo Echarri,https://www.clarin.com/politica/pacto-iran-errores-omisiones-video-narrado-pablo-echarri-defiende-cristina-kirchner_0_cnJgQcCZr.html,https://images.clarin.com/2015/07/14/SkvmSZyEx_720x0.jpg
34,ZJuoi_H3k,Reporte diario. Vuelve a crecer la cifra de casos: 26.238 contagios en las últimas 24 horas,https://www.clarin.com/sociedad/coronavirus-argentina-confirman-26-238-nuevos-casos-ultimas-24-horas_0_ZJuoi_H3k.html,https://images.clarin.com/2021/05/04/bqSUni_BC_1256x620__2.jpg#1620146734597
35,L3jrJ7h4b,Pitidos y zumbidos. Tinnitus: de qué se trata la condición que afecta a Luis Miguel,https://www.clarin.com/buena-vida/tinnitus-trata-condicion-afecta-luis-miguel_0_L3jrJ7h4b.html,https://images.clarin.com/2021/04/21/rzxQKcDfT_720x0__1.jpg
36,TWtMwO7S2,El divorcio de Bill Gates. Millonaria división de bienes: así queda la fortuna del cuarto hombre más rico,https://www.clarin.com/tecnologia/divorcio-bill-gates-millonaria-division-bienes-melinda-queda-fortuna-cuarto-hombre-rico-mundo_0_TWtMwO7S2.html,https://images.clarin.com/2021/05/03/T6v1M52bP_720x0__1.jpg
37,-iFRYwdZk,Apps. Cómo crear emojis y stickers animados con tu cara en WhatsApp,https://www.clarin.com/tecnologia/crear-emojis-stickers-animados-cara-whatsapp_0_-iFRYwdZk.html,https://images.clarin.com/2021/05/04/BMi5ScyKB_720x0__1.jpg
38,6HFxR0Y-G,Generación resiliente. Lucas Malaisi: por qué deberíamos priorizar las emociones antes que las matemáticas,https://www.clarin.com/familias/lucas-malaisi-escuelas-seguimos-priorizando-cuenta-matematica-emocion-seguiremos-parte-problema-_0_6HFxR0Y-G.html,https://images.clarin.com/2019/10/25/j3nuow3R_720x0__1.jpg
39,TIvzJMQth,El fin de una era. Windows 10 eliminará Adobe Flash Player en junio,https://www.clarin.com/tecnologia/windows-eliminara-completamente-adobe-flash-player-windows-10-junio_0_TIvzJMQth.html,https://images.clarin.com/2020/12/29/ed5UnOdwG_720x0__1.jpg
40,YYnQNgfB3,"Informe de la SAP. Por qué aconsejan ""marihuana cero"" durante el embarazo",https://www.clarin.com/buena-vida/aconsejan-marihuana-cero-embarazo_0_YYnQNgfB3.html,https://images.clarin.com/2021/05/03/T6ll7fw21_720x0__1.jpg
41,Ajt4KUz1t,"Relajación. Qué son los videos ASMR, el nuevo ansiolítico de los jóvenes",https://www.clarin.com/buena-vida/videos-asmr-nuevo-ansiolitico-jovenes_0_Ajt4KUz1t.html,https://images.clarin.com/2021/05/04/pYmaqeVFN_720x0__1.jpg
42,eC_qvaGi_,Salud. Día Mundial del asma: qué es un buen control y cómo se logra,https://www.clarin.com/buena-vida/dia-mundial-asma-buen-control-logra_0_eC_qvaGi_.html,https://images.clarin.com/2021/05/03/vuLj6v95i_720x0__1.jpg
43,-1uN8vZDS,Victoria y Cristina. Las gemelas de Julio Iglesias cumplieron 20 años,https://www.clarin.com/viste/gemelas-julio-iglesias-cumplieron-20-anos-quemaron-redes_0_-1uN8vZDS.html,https://images.clarin.com/2021/05/03/_Juh-xm3-_720x0__1.jpg
44,wMd9wicDp,Michael Hernández. El chico que soñaba con ser asesino y mató de 40 puñaladas a un compañero en la escuela,https://www.clarin.com/internacional/muerte-michael-hernandez-chico-sonaba-asesino-mato-40-punaladas-companero-escuela_0_wMd9wicDp.html,https://images.clarin.com/2021/05/03/iP_QeDCRd_720x0__1.jpg
45,m2TbMJ31M,"Pandemia y kilos. Will Smith mostró su barriga y se sinceró: ""Estoy peor que nunca""",https://www.clarin.com/internacional/espectaculos/will-smith-mostro-barriga-sincero-peor-_0_m2TbMJ31M.html,https://images.clarin.com/2021/05/04/JI-PqMsyK_720x0__1.jpg
46,JmxcLo7YE,En redes. Pidió trabajo como empleada doméstica y recibió propuestas para prostituirse,https://www.clarin.com/internacional/pidio-trabajo-empleada-domestica-recibio-varias-propuestas-prostituirse_0_JmxcLo7YE.html,https://images.clarin.com/2021/05/04/go4TaHtjL_720x0__1.jpg
47,6ThzrQlWV,Estados Unidos. Pescaron un esturión de tamaño humano que nació hace más de 100 años,https://www.clarin.com/viste/pescaron-esturion-tamano-humano-nacio-hace-100-anos_0_6ThzrQlWV.html,https://images.clarin.com/2021/05/03/LG_FNdVJU_720x0__1.jpg
48,1F2-ct2z5,Perú. Tiene 121 años y es la persona más longeva en ser vacunada contra el Covid-19,https://www.clarin.com/viste/121-anos-persona-longeva-vacunada-covid-19_0_1F2-ct2z5.html,https://images.clarin.com/2021/05/04/hpzPo1uBf_720x0__1.jpg
49,DpukpkKZJ,Política y corrupción. La AFIP avaló que Cristóbal López levante la quiebra de Oil Combustibles,https://www.clarin.com/politica/afip-avalo-cristobal-lopez-levante-quiebra-oil-combustibles_0_DpukpkKZJ.html,https://images.clarin.com/2019/06/19/PmqyXBOJg_720x0__1.jpg
50,FMzV3zc9x,Publicó un comunicado. Respuesta oficial: los 20 puntos del Gobierno para rechazar el fallo de la Corte,https://www.clarin.com/politica/respuesta-oficial-20-puntos-gobierno-rechazar-fallo-corte-suprema-clases-presenciales_0_FMzV3zc9x.html,https://images.clarin.com/2019/05/30/VsHZe9Akh_720x0__1.jpg
51,OJsGVHBnc,"Entrevista en TV. Elisa Carrió comparó a Alberto Fernández con ""un pañal""",https://www.clarin.com/politica/elisa-carrio-comparo-alberto-fernandez-panal-_0_OJsGVHBnc.html,https://images.clarin.com/2021/05/04/uIj-Xwbn4_720x0__1.jpg
52,aK4_ci685,Entre privados. Avanza la negociación con China para producir la vacuna Sinopharm,https://www.clarin.com/politica/avanza-negociacion-china-producir-argentina-vacuna-sinopharm_0_aK4_ci685.html,https://images.clarin.com/2021/04/21/9DIF3cjmE_720x0__1.jpg
53,BOB82dgJ1,Expresó su repudio. El contundente mensaje de Shakira por la represión en Colombia,https://www.clarin.com/internacional/represion-colombia-contundente-mensaje-shakira-presidente-ivan-duque_0_BOB82dgJ1.html,https://images.clarin.com/2021/05/04/CcZkCx-uw_720x0__1.jpg
54,J8G2LkOE0,"Vicente López. Golpes y amenazas con cuchillos por una cuenta ""desorbitante"" en un restaurant top",https://www.clarin.com/zonales/batalla-campal-cuenta-desorbitante-restaurant-top-amenazaron-cuchillos-mozos-boxearon-_0_J8G2LkOE0.html,https://images.clarin.com/2021/05/04/ixxjjhHy5_720x0__1.jpg
55,GrEpJLfcn,"""Mamá duerme"". Murió junto a su beba de 2 meses y fue su hijo de 3 años el que alertó al papá",https://www.clarin.com/sociedad/murio-junto-beba-2-meses-hijo-3-anos-alerto-papa-mama-durmiendo-_0_GrEpJLfcn.html,https://images.clarin.com/2021/05/04/4EfeSx8cY_720x0__1.jpg
56,6Uts6asgR,"Dura nota. El País de España apuntó contra ""la incapacidad de Alberto Fernández"" ",https://www.clarin.com/politica/dura-nota-pais-espana-apunta-incapacidad-alberto-fernandez-destituir-subsecretario-_0_6Uts6asgR.html,https://images.clarin.com/2021/04/30/2PnlZ5zkj_720x0__1.jpg
57,W3G_tjooZ,Caso Cedric Tornay. Misteriosas muertes en el Vaticano resurgen con el pedido dramático de una mujer,https://www.clarin.com/mundo/caso-cedric-tornay-misteriosas-muertes-vaticano-resurgen-pedido-desesperado-mujer_0_W3G_tjooZ.html,https://images.clarin.com/2021/05/04/epqYNwFOh_1256x620__2.jpg#1620135594411
58,cjIav-e1w,Diferencias notorias. ¿Cuánto dinero hace falta tener para ser parte del 1% más rico de un país?,https://www.clarin.com/mundo/-dinero-hace-falta-tener-parte-ciento-rico-pais-_0_cjIav-e1w.html,https://images.clarin.com/2021/05/03/FrsHQ9kYC_1200x0__2.jpg#1620063289701
59,lFeN6M6_i,Alta demanda. Efecto pandemia: hay listas de espera para alquilar casas en countries,https://www.clarin.com/arq/inmobiliario/lista-espera-alquilar-casas-countries_0_lFeN6M6_i.html,https://images.clarin.com/2021/05/03/2AqlNf-MJ_720x0__1.jpg
60,xiGy2qUhN,Emprendedores. Inventaron una botella para tomar mate sin bombilla y venden a 47 países,https://www.clarin.com/gourmet/inventaron-botella-tomar-mate-bombilla-venden-dolares-47-paises_0_xiGy2qUhN.html,https://images.clarin.com/2021/05/03/o9cxfWHRM_1256x620__2.jpg#1620081565673
61,v0cFE-E6v,El niño de la burbuja. La conmovedora historia del chico que vivió y murió aislado,https://www.clarin.com/viva/nino-burbuja-conmovedora-historia-chico-vivio-murio-aislado_0_v0cFE-E6v.html,https://images.clarin.com/2021/05/03/gGZba1E-c_720x0__1.jpg
62,utSMd-QNa,Lanzado por China. Un enorme cohete está a punto de entrar en la atmósfera y caer de forma descontrolada,https://www.clarin.com/tecnologia/enorme-cohete-chino-punto-entrar-atmosfera-caer-forma-descontrolada_0_utSMd-QNa.html,https://images.clarin.com/2017/04/20/HJnYIE8Cl_720x0.jpg
63,LHuBB3bJp,Un clásico del barrio. Reabre el bar al que iba el Che Guevara y le devolverá el budín de pan a Palermo Viejo,https://www.clarin.com/ciudades/reabre-montecarlo-bar-iba-che-guevara-devolvera-budin-pan-palermo-viejo_0_LHuBB3bJp.html,https://images.clarin.com/2021/05/03/LzTbhiHOe_1256x620__2.jpg#1620090100430
64,SSl4Rs2ub,Desde Argentina. Lanzan mundialmente un nuevo fungicida para soja y maní,https://www.clarin.com/rural/lanzan-mundialmente-nuevo-fungicida-soja-mani_0_SSl4Rs2ub.html,https://images.clarin.com/2021/04/14/OWQDLPsAj_720x0__1.jpg
65,-_CXn9WYL,"Las claves. Trasplante pelo por pelo, la única forma de volver a tener cabello",https://www.clarin.com/brandstudio/trasplante-pelo-pelo--unica-forma-volver-tener-cabello_0_-_CXn9WYL.html,https://images.clarin.com/2021/05/03/o03w7j6k-_720x0__1.jpg
