n,id,title,url,image
1,HAmymg1VH,"Ruptura en el Gobierno. Insultos, gritos y traiciones: la historia secreta de la crisis entre Alberto Fernández y Cristina Kirchner",https://www.clarin.com/opinion/insultos-gritos-traiciones-historia-secreta-crisis-alberto-fernandez-cristina-kirchner_0_HAmymg1VH.html,https://images.clarin.com/2021/09/16/ZKhoqNNM0_720x0__1.jpg
2,V7RFEAmN4,Se agrava la crisis. Cristina lleva al límite la presión sobre Alberto Fernández,https://www.clarin.com/politica/dura-carta-cristina-kirchner-tenso-maximo-vinculo-presidente-exigio-cambios-urgentes-gabinete_0_V7RFEAmN4.html,https://images.clarin.com/2021/09/13/vmvTGup2Q_720x0__1.jpg
3,8VSeqm2s_,Embestida. La carta completa de Cristina Kirchner contra Alberto Fernández,https://www.clarin.com/politica/carta-completa-cristina-kirchner-alberto-fernandez_0_8VSeqm2s_.html,https://images.clarin.com/2021/07/24/nXNT2WSr8_720x0__1.jpg
4,_fc02ME5V,Del Editor. Un mini 2001 con perfume peronista,https://www.clarin.com/opinion/mini-2001-perfume-peronista_0__fc02ME5V.html,https://images.clarin.com/2021/09/16/fKFs3g89R_720x0__1.jpg
5,O_RjGbcmT,En busca de apoyo. Cuáles son los dos gobernadores a los que Alberto les ofreció sumarse al Gabinete,https://www.clarin.com/politica/alberto-fernandez-ofrecio-gobernadores-sumarse-gabinete-dijeron_0_O_RjGbcmT.html,https://images.clarin.com/2021/09/16/5q862eDky_720x0__1.jpg
6,E-R_m-fhW,Cobertura minuto a minuto. Cumbre en Olivos hasta la madrugada entre el Presidente y sus ministros leales,https://www.clarin.com/politica/carta-cristina-kirchner-oposicion-trata-irresponsabilidad-precedentes-_0_E-R_m-fhW.html,https://images.clarin.com/2021/09/16/fuU9bQjhQ_720x0__1.jpg
7,2Q7Diezae,"Audio explosivo. Fuerte carga de una diputada ultra K contra el Presidente: le dijo ""ocupa"" y ""mequetrefe""",https://www.clarin.com/politica/durisimo-ataque-diputada-cristina-kirchner-presidente-dijo-ocupa-mequetrefe-atrincherado-_0_2Q7Diezae.html,https://images.clarin.com/2021/07/22/L_Cu9efk7_720x0__1.jpg
8,xyzM0QCnJ,"""Busca apretar públicamente"". Lanata habló de ""guerra total"" tras la carta de Cristina al Presidente",https://www.clarin.com/politica/carta-cristina-kirchner-jorge-lanata-presidente-solo-puede-acatar-romper-definitivamente-_0_xyzM0QCnJ.html,https://images.clarin.com/2021/09/16/6o2fP4U7q_720x0__1.jpg
9,WEanW0eQJ,Consejos para lograrlo. Cómo aumentar el límite de la tarjeta de crédito: cuáles son los requisitos,https://www.clarin.com/servicios/aumentar-limite-tarjeta-credito-requisitos_0_WEanW0eQJ.html,https://images.clarin.com/2019/08/12/UmaBT-YvG_720x0__1.jpg
10,PpGwt3760,"Análisis. El Frente de Dos, en su momento más delirante",https://www.clarin.com/politica/frente-momento-delirante_0_PpGwt3760.html,https://images.clarin.com/2021/09/13/hGM1XfA_1_720x0__1.jpg
11,IMWqtWJGf,"Biondi, en la mira. Cristina acusó al vocero presidencial de ""operaciones"" en su contra",https://www.clarin.com/politica/embestida-cristina-kirchner-juan-pablo-biondi-vocero-presidencial_0_IMWqtWJGf.html,https://images.clarin.com/2021/09/16/f_0GQyMin_1256x620__2.jpg#1631831846227
12,HpJPfjxli,"En la Ciudad. Más flexibilizaciones: ya no hay límites para encuentros sociales, restoranes y locales",https://www.clarin.com/ciudades/ciudad-flexibiliza-restricciones-limite-ocupacion-reuniones-sociales-comercios_0_HpJPfjxli.html,https://images.clarin.com/2021/09/16/4RVQIsK_Z_1256x620__2.jpg#1631838314776
13,DHomryawI,La pandemia. Tercera dosis contra el Covid: 8 preguntas sobre a quiénes y cuándo se aplicaría,https://www.clarin.com/sociedad/tercera-dosis-covid-8-preguntas-aplicaria_0_DHomryawI.html,https://images.clarin.com/2021/05/15/wnI529QKA_1256x620__2.jpg#1631666505037
14,MthCWbYjh,Especial Clarín. Las mejores series y películas que vimos en pandemia,https://www.clarin.com/espectaculos/tv/emmy-2021-premian-mejores-series-peliculas-vimos-pandemia_0_MthCWbYjh.html,https://images.clarin.com/2021/09/16/HKNMg6yJp_720x0__1.jpg
15,E6CXu0Wga,"Aprender a invertir. Ocho cursos cortos, gratis y online para convertirse en un experto en finanzas",https://www.clarin.com/servicios/aprender-invertir-8-cursos-cortos-gratis-online-convertirse-experto-finanzas_0_E6CXu0Wga.html,https://images.clarin.com/2020/04/29/uGnnmC_wy_720x0__1.jpg
16,af9AkwN2I,Dolor inmenso. A los 44 años murió la actriz Agustina Posse,https://www.clarin.com/fama/murio-agustina-posse-44-anos_0_af9AkwN2I.html,https://images.clarin.com/2021/09/16/0egHHCM2v_720x0__1.jpg
17,38g3dI0VU,Violencia de género. Femicidio en Ramos Mejía: mató a su pareja embarazada y se pegó un tiro,https://www.clarin.com/policiales/femicidio-ramos-mejia-mato-pareja-embarazada-pego-tiro_0_38g3dI0VU.html,https://images.clarin.com/2021/09/16/wDYIKxhVG_720x0__1.jpg
18,04kcVMc7x,Se llama Emilio. Nació el hijo de Alberto Cormillot y Estefanía Pasquini,https://www.clarin.com/fama/nacio-hijo-alberto-cormillot-estefania-pasquini_0_04kcVMc7x.html,https://images.clarin.com/2021/03/24/ZaqOjyW7j_720x0__1.jpg
19,c9wEFuYIR,"Se preparó en Europa. La historia de Hernán Losada, el argentino que es el DT más joven de la MLS",https://www.clarin.com/deportes/historia-hernan-losada-argentino-dt-joven-mls_0_c9wEFuYIR.html,https://images.clarin.com/2021/08/05/KF5llyRn__720x0__1.jpg
20,DWkimkC2T,Insólito error. Estuvo 18 días preso porque se llama igual que un acusado de abuso de menores,https://www.clarin.com/policiales/18-dias-preso-llama-igual-acusado-abuso-menores_0_DWkimkC2T.html,https://images.clarin.com/2021/09/16/XdSCAtgTd_1256x620__2.jpg#1631825814056
21,AFefdR4E3,"Para el fin de semana. Diez escapadas: turismo rural, asado y paseos a caballo",https://www.clarin.com/viajes/10-escapadas-turismo-rural-asado-paseos-caballo_0_AFefdR4E3.html,https://images.clarin.com/2021/09/14/UGcBbnPpx_720x0__1.jpg
22,UO2DuH1Ia,Confitería La Ideal. Los secretos de la restauración de un ícono porteño,https://www.clarin.com/ciudades/confiteria-ideal-sigue-restauracion-icono-porteno-centenario_0_UO2DuH1Ia.html,https://images.clarin.com/2021/09/16/ROMQkF5WI_720x0__1.jpg
23,7lETaWd__,"¿Cuál es la mejor táctica?. El desafío de Pochettino: cómo hacer rendir al ""Dream Team"" de Messi, Neymar y Mbappé",https://www.clarin.com/deportes/dilema-pochettino-psg-hacer-funcionar-dream-team-messi-neymar-mbappe_0_7lETaWd__.html,https://images.clarin.com/2021/09/15/UKiku-Gf3_1256x620__4.jpg#1631834807092
24,NE2ATyKWQ,Oportunidades. Una aerolínea internacional busca cubrir 3.500 puestos: cómo aplicar desde Argentina,https://www.clarin.com/viajes/aerolinea-internacional-busca-cubrir-3-500-puestos-argentinos-pueden-aplicar_0_NE2ATyKWQ.html,https://images.clarin.com/2021/09/16/nOCp8yQXu_720x0__1.jpg
25,9Z6h_7QqS,"Otra tragedia en la familia. Quién era Nicolás Nardelli, el dueño de Vicentin que murió a los 37 años",https://www.clarin.com/rural/nicolas-nardelli-heredero-amplia-tragedia-familiar-vicentin_0_9Z6h_7QqS.html,https://images.clarin.com/2021/09/16/0CNAzlbTo_720x0__1.jpg
26,Wfs2Lq9b9,"Investigación judicial. Así conoció Maradona a Luque y Cosachov, los médicos imputados por su muerte",https://www.clarin.com/policiales/conocio-diego-maradona-leopoldo-luque-agustina-cosachov-medicos-imputados-muerte_0_Wfs2Lq9b9.html,https://images.clarin.com/2021/09/16/vihH6BM_v_1256x620__2.jpg#1631814763254
27,ZQA5NOUrv,Alimentación. Fitonutrientes: por qué y cómo incorporar estos antioxidantes naturales,https://www.clarin.com/buena-vida/fitonutrientes-incorporar-antioxidantes-naturales_0_ZQA5NOUrv.html,https://images.clarin.com/2021/09/10/s6ap3LByn_720x0__1.jpg
28,f1hynA_hx,"La cadena ""Carne"". Cómo son las hamburguesas argentinas del chef del mejor restorán del mundo",https://www.clarin.com/gourmet/hamburguesas-argentinas-chef-mejor-restaurante-mundo_0_f1hynA_hx.html,https://images.clarin.com/2021/09/16/U-S6__Wpr_1256x620__2.jpg#1631799369820
29,,"Historias visuales. El Mundo en Fotos, con las mejores imágenes de la actualidad",,
30,HAmymg1VH,"Ruptura en el Gobierno. Insultos, gritos y traiciones: la historia secreta de la crisis entre Alberto Fernández y Cristina Kirchner",https://www.clarin.com/opinion/insultos-gritos-traiciones-historia-secreta-crisis-alberto-fernandez-cristina-kirchner_0_HAmymg1VH.html,https://images.clarin.com/2021/09/16/ZKhoqNNM0_720x0__1.jpg
31,V7RFEAmN4,Se agrava la crisis. Cristina lleva al límite la presión sobre Alberto Fernández,https://www.clarin.com/politica/dura-carta-cristina-kirchner-tenso-maximo-vinculo-presidente-exigio-cambios-urgentes-gabinete_0_V7RFEAmN4.html,https://images.clarin.com/2021/09/13/vmvTGup2Q_720x0__1.jpg
32,8VSeqm2s_,Embestida. La carta completa de Cristina Kirchner contra Alberto Fernández,https://www.clarin.com/politica/carta-completa-cristina-kirchner-alberto-fernandez_0_8VSeqm2s_.html,https://images.clarin.com/2021/07/24/nXNT2WSr8_720x0__1.jpg
33,_fc02ME5V,Del Editor. Un mini 2001 con perfume peronista,https://www.clarin.com/opinion/mini-2001-perfume-peronista_0__fc02ME5V.html,https://images.clarin.com/2021/09/16/fKFs3g89R_720x0__1.jpg
34,O_RjGbcmT,En busca de apoyo. Cuáles son los dos gobernadores a los que Alberto les ofreció sumarse al Gabinete,https://www.clarin.com/politica/alberto-fernandez-ofrecio-gobernadores-sumarse-gabinete-dijeron_0_O_RjGbcmT.html,https://images.clarin.com/2021/09/16/5q862eDky_720x0__1.jpg
35,E-R_m-fhW,Cobertura minuto a minuto. Cumbre en Olivos hasta la madrugada entre el Presidente y sus ministros leales,https://www.clarin.com/politica/carta-cristina-kirchner-oposicion-trata-irresponsabilidad-precedentes-_0_E-R_m-fhW.html,https://images.clarin.com/2021/09/16/fuU9bQjhQ_720x0__1.jpg
36,2Q7Diezae,"Audio explosivo. Fuerte carga de una diputada ultra K contra el Presidente: le dijo ""ocupa"" y ""mequetrefe""",https://www.clarin.com/politica/durisimo-ataque-diputada-cristina-kirchner-presidente-dijo-ocupa-mequetrefe-atrincherado-_0_2Q7Diezae.html,https://images.clarin.com/2021/07/22/L_Cu9efk7_720x0__1.jpg
37,xyzM0QCnJ,"""Busca apretar públicamente"". Lanata habló de ""guerra total"" tras la carta de Cristina al Presidente",https://www.clarin.com/politica/carta-cristina-kirchner-jorge-lanata-presidente-solo-puede-acatar-romper-definitivamente-_0_xyzM0QCnJ.html,https://images.clarin.com/2021/09/16/6o2fP4U7q_720x0__1.jpg
38,2q9ie4r2d,A 20 años del atentado. El último sobreviviente de las Torres Gemelas,https://www.clarin.com/mundo/ultimo-sobreviviente_0_2q9ie4r2d.html,https://images.clarin.com/2021/09/07/PWjdezPAa_720x0__1.jpg
39,sR_xbLpUK,Escándalo internacional. La inquietante historia detrás de las 12 valijas con droga en la embajada rusa,https://www.clarin.com/policiales/espias-diplomaticos-policias-inquietante-trama-12-narcovalijas-embajada-rusa_0_sR_xbLpUK.html,https://images.clarin.com/2021/09/02/Wt5VOz0v2_720x0__1.jpg
40,j5owUSw_W,En alza. Criptomonedas: ¿cuánta plata se puede ganar con una PC desde el living de casa?,https://www.clarin.com/especiales/criptomonedas-plata-puede-ganar-pc-living-casa-_0_j5owUSw_W.html,https://images.clarin.com/2021/08/16/SZDgaDM6F_720x0__1.jpg
41,nLkI_EbdH,Jagger vs. McCartney. Cuál es la verdad sobre la grieta entre los Beatles y los Rolling Stones,https://www.clarin.com/espectaculos/beatles-vs-rolling-stones-grieta-existio-sigue-abierta_0_nLkI_EbdH.html,https://images.clarin.com/2021/08/30/PyFd0KEYI_720x0__1.jpg
42,BcMyO3JBA,Asombra a Europa. Sébastien Haller: la increíble historia del perfecto tapado de la Champions League,https://www.clarin.com/deportes/sebastien-haller-increible-historia-perfecto-tapado-champions-league_0_BcMyO3JBA.html,https://images.clarin.com/2021/09/16/ISMCY0_yi_720x0__1.jpg
43,Y450cO5k2,"Básquet. El ""Che"" García y la Selección: ""Es el sueño de todo coach de acá y también de afuera""",https://www.clarin.com/deportes/che-garcia-nuevo-coach-seleccion-basquet-presentacion-sueno-coach-argentina-primer-nivel_0_Y450cO5k2.html,https://images.clarin.com/2018/01/14/r1abfPY4f_720x0__1.jpg
44,Ngez9SPZD,"Lo compartió Leo. Thiago, Mateo y Ciro Messi: baile y pogo al ritmo del tema que Bizarrap le hizo a su papá",https://www.clarin.com/deportes/thiago-mateo-ciro-messi-baile-pogo-ritmo-tema-bizarrap-hizo-papa_0_Ngez9SPZD.html,https://images.clarin.com/2021/09/16/DGqjHoWmK_720x0__1.jpg
45,jntdSJTeF,"En plena Champions. Robaron su caja fuerte mientras jugaba con Chelsea y mostró los videos: ""Cobardes""",https://www.clarin.com/deportes/robaron-caja-fuerte-casa-jugaba-partido-champions-mostro-videos-pide-ayuda_0_jntdSJTeF.html,https://images.clarin.com/2021/09/16/CGuTfZ-X__720x0__1.jpg
46,n3g1YMtcM,Después de 16 años. La vuelta al templo del tenis es el punto saliente de la fecha de Copa Davis,https://www.clarin.com/deportes/rival-deberia-complicar-vuelta-templo-tenis-punto-saliente-fecha-copa-davis_0_n3g1YMtcM.html,https://images.clarin.com/2021/09/16/RPW07T3SJ_720x0__1.jpg
47,VriMollkl,"Piñas y botellazos. Violento choque entre hinchas del Leicester, el Napoli y la policía",https://www.clarin.com/deportes/violento-choque-hinchas-leicester-napoli-policia-pinas-botellazos-palos-cintazos_0_VriMollkl.html,https://images.clarin.com/2021/09/16/k6rNjQyn6_720x0__1.jpg
48,zVWEy2lW7,"El impacto en la economía. En la pelea entre Alberto y Cristina, ¿de qué lado se paran los mercados?",https://www.clarin.com/economia/pelea-alberto-cristina-lado-paran-mercados-_0_zVWEy2lW7.html,https://images.clarin.com/2019/08/12/WMzsVWJww_720x0__1.jpg
49,H2f8PzPVz,"Tarifas, precios e Hidrovía. Tres incógnitas pendientes si se concretan cambios en el Gabinete",https://www.clarin.com/economia/tarifas-precios-hidrovia-incognitas-pendientes-concretan-cambios-gabinete_0_H2f8PzPVz.html,https://images.clarin.com/2021/09/16/4Rf-JKUnp_1256x620__2.jpg#1631796284736
50,QyZRaw6np,Dinámica de los precios. Hasta cuándo se podrá mantener la inflación por debajo del 3% mensual,https://www.clarin.com/economia/podra-mantener-inflacion-debajo-3-mensual_0_QyZRaw6np.html,https://images.clarin.com/2021/07/16/NuSHxeFfd_720x0__1.jpg
51,ZmCiqFo6S,"Turbulencia política. Hernán Lacunza: ""No firmar con el FMI no es una opción""",https://www.clarin.com/economia/hernan-lacunza-firmar-fmi-opcion-_0_ZmCiqFo6S.html,https://images.clarin.com/2021/08/31/M100rNn5k_720x0__1.jpg
52,Z3CKd5G7e,Alianza. Marcos Galperin se une a un ex Mercado Libre para comprar futuros unicornios,https://www.clarin.com/economia/cofundadores-mercado-libre-asocian-comprar-startups_0_Z3CKd5G7e.html,https://images.clarin.com/2020/09/03/bFrMmT0v3_720x0__1.jpg
53,yTymS5LH1,Presupuesto 2022. Disminuye la partida para el pago de las sentencias a los jubilados,https://www.clarin.com/economia/presupuesto-2022-disminuye-partida-pago-sentencias-jubilados_0_yTymS5LH1.html,https://images.clarin.com/2021/05/18/a2cTZwCtK_1256x620__3.jpg#1631813865666
54,Vi9gSk3dL,Clive Sinclair. Murió el creador de una de las primeras computadoras hogareñas de la historia,https://www.clarin.com/tecnologia/murio-clive-sinclair-creador-zx-spectrum-primeras-computadoras-hogarenas-historia_0_Vi9gSk3dL.html,https://images.clarin.com/2021/09/16/cVqhnOmru_720x0__1.jpg
55,Lsu5yQd1b,"Tendencias. Cuál es el primer país de Latinoamérica que ofrecerá ""turismo de vacunas""",https://www.clarin.com/viajes/primer-pais-latinoamerica-ofrecera-turismo-vacunas-_0_Lsu5yQd1b.html,https://images.clarin.com/2016/12/28/BkG6ptZBx_720x0.jpg
56,F_gBsuqJJ,"Longevidad. ¿Qué dieta es más saludable, la mediterránea o la japonesa?",https://www.clarin.com/buena-vida/-dieta-saludable-mediterranea-japonesa-_0_F_gBsuqJJ.html,https://images.clarin.com/2021/09/16/Yc6qcUuNz_720x0__1.jpg
57,WAI2sowpz,Ad Astra. La misteriosa y exclusiva escuela creada por Elon Musk donde estudian sus hijos,https://www.clarin.com/tecnologia/ad-astra-misteriosa-exclusiva-escuela-creada-elon-musk-estudian-hijos_0_WAI2sowpz.html,https://images.clarin.com/2021/09/15/GH2HuCJuQ_720x0__1.jpg
58,rM7L8IEbJ,"Sexo ""real"". Sex Education 3: el aporte de Netflix a la sexualidad",https://www.clarin.com/relaciones/sex-education-3-aporte-netflix-sexualidad_0_rM7L8IEbJ.html,https://images.clarin.com/2021/09/16/K4swd_22B_1256x620__2.jpg#1631821921624
59,eWEjCLIQN,"Feng Shui. ""Detox"" primaveral del hogar: limpieza energética para atraer buenas vibras",https://www.clarin.com/familias/-detox-primaveral-hogar-limpieza-energetica-atraer-buenas-vibras_0_eWEjCLIQN.html,https://images.clarin.com/2021/09/15/oZjYGEZel_720x0__1.jpg
60,95Fq0aC1M,"Clásicos ochentosos. La historia en la que se habría inspirado Spielberg para hacer ""E.T. """,https://www.clarin.com/internacional/espana/historia-inspirado-steven-spielberg-hacer-t-extraterrestre-_0_95Fq0aC1M.html,https://images.clarin.com/2020/04/16/uSGOIOTw7_1256x620__2.jpg#1631732398284
61,v-OqHpIXV,"Crítica I. Cry Macho, de y con Clint Eastwood: los machos sí lloran",https://www.clarin.com/espectaculos/cine/cry-macho-clint-eastwood-machos-lloran_0_v-OqHpIXV.html,https://images.clarin.com/2021/08/06/wGtC-NTpP_720x0__1.jpg
62,QOTN8h1C0,Crítica II. Venganza implacable y un impecable Liam Neeson,https://www.clarin.com/espectaculos/cine/venganza-implacable-impecable-liam-neeson_0_QOTN8h1C0.html,https://images.clarin.com/2021/09/15/Kafj6IXZu_720x0__1.jpg
63,Z23r_ehrB,Insólito caso en Virginia. Con un dron quisieron tirar un paquete misterioso en la cárcel pero cayó en una escuela,https://www.clarin.com/internacional/estados-unidos/dron-quisieron-tirar-paquete-misterioso-carcel-cayo-escuela_0_Z23r_ehrB.html,https://images.clarin.com/2021/09/16/arKYWrvJf_720x0__1.jpg
64,byEvaJGWo,"Presentación. Citroën develó el nuevo C3, el compacto con estilo SUV que llega en 2022",https://www.clarin.com/autos/citroen-develo-nuevo-c3-compacto-estilo-suv-llegara-principios-2022_0_byEvaJGWo.html,https://images.clarin.com/2021/09/16/46HYVeFGo_720x0__1.jpg
65,LcBg1hXcD,Récord. Crecen las ventas de autos híbridos y eléctricos en el país,https://www.clarin.com/autos/venta-autos-hibridos-electricos-crecio-133-pais_0_LcBg1hXcD.html,https://images.clarin.com/2018/11/21/QnbMsvMuK_720x0__1.jpg
66,MwlJKydET,"¿Todo legal?. Una participante de ""Bake Off"" se cansó de las críticas, respondió con ironía y publicó el reglamento",https://www.clarin.com/fama/participante-bake-off-canso-acusacion-acomodo-publico-reglamento-certamen_0_MwlJKydET.html,https://images.clarin.com/2021/09/16/ghQHpj__x_720x0__1.jpg
67,noWa1SN4L,"""¡Esto no se hace!"". Los Pimpinela se llevaron una increíble sorpresa con una participante en ""La Voz""",https://www.clarin.com/fama/pimpinela-llevaron-increible-sorpresa-participante-voz-_0_noWa1SN4L.html,https://images.clarin.com/2021/09/16/emanpDd5e_720x0__1.jpg
68,OSKej933X,Crece el escándalo. Trascendió un supuesto engaño de Fort a Marengo: ¿jugó a dos puntas con otra famosa?,https://www.clarin.com/fama/salio-luz-supuesta-infidelidad-eduardo-fort-rocio-marengo-jugo-puntas-famosa-_0_OSKej933X.html,https://images.clarin.com/2021/09/16/3VAsioIoF_720x0__1.jpg
69,-3b4oaNEL,"Inesperado. Gastón Marote renunció a ""Nosotros a la mañana"" y explicó el motivo en vivo",https://www.clarin.com/fama/gaston-marote-renuncio-manana-explico-motivo-sorpresiva-decision_0_-3b4oaNEL.html,https://images.clarin.com/2021/09/16/WWKUhDh25_720x0__1.jpg
70,xWVn8wjOt,A distancia. Ganar dinero contestando encuestas desde casa: las 10 páginas que mejor pagan,https://www.clarin.com/servicios/ganar-dinero-extra-contestando-encuestas-casa-10-paginas-mejor-pagan_0_xWVn8wjOt.html,https://images.clarin.com/2015/03/25/BJgENZx14g_720x0.jpg
71,GZdPfKtw4,"Crisis política. La encuesta que muestra a todo el Gabinete reprobado, incluido Wado de Pedro",https://www.clarin.com/politica/crisis-gobierno-encuesta-muestra-gabinete-reprobado-incluido-wado-pedro_0_GZdPfKtw4.html,https://images.clarin.com/2021/09/16/MFUgh40dy_720x0__1.jpg
72,j68LWXfIi,Arranca hoy. Liquidan bicicletas con hasta 40% de descuento y cuotas: dónde se consiguen,https://www.clarin.com/servicios/liquidan-bicicletas-40-descuento-cuotas-consiguen_0_j68LWXfIi.html,https://images.clarin.com/2021/09/13/dANkY1NZL_720x0__1.jpg
73,gEwZ9j4aL,"""Jubilación de lujo"". Manu Ginóbili, hoy: viaja sin parar y juega a todo menos al básquet",https://www.clarin.com/deportes/manu-ginobili-hoy-familia-viajando-parar-jugando-basquet_0_gEwZ9j4aL.html,https://images.clarin.com/2021/09/13/SKle28Hh8_720x0__1.jpg
74,Pi132vPui,De emergencia. El Gobierno evalúa nuevos créditos a tasa 0 a trabajadores en blanco,https://www.clarin.com/economia/gobierno-evalua-extender-creditos-tasa-cero-trabajadores-blanco_0_Pi132vPui.html,https://images.clarin.com/2021/08/03/6HLPYjbEc_720x0__1.jpg
75,9brn5OgJa,"Primera persona. Yo participé del sorteo de la casa de ""El Chapo"" Guzmán en la lotería mexicana",https://www.clarin.com/mundo/participe-sorteo-casa-chapo-guzman-loteria-mexicana_0_9brn5OgJa.html,https://images.clarin.com/2021/09/16/OETn_-rlC_1256x620__2.jpg#1631792980937
