n,id,title,url,image
1,jeVmkgp8R,"Rumbo a las PASO. El reparto en el Frente de Todos: uno por uno, a quiénes responden los candidatos a diputados en Provincia",https://www.clarin.com/politica/reparto-frente-responden-candidatos-diputados-provincia_0_jeVmkgp8R.html,https://images.clarin.com/2021/07/24/M6XQMkK1L_720x0__1.jpg
2,DJg1wmBx0,Aseguraron medalla. Las Leonas sacaron su chapa ante India e irán por el ansiado oro en Tokio,https://www.clarin.com/deportes/leonas-sacaron-chapa-india-iran-ansiado-oro-tokio_0_DJg1wmBx0.html,https://images.clarin.com/2021/08/04/kakb7HuW9_720x0__1.jpg
3,kEsiACDGH,Exclusivo de Clarín. Vanina Oneto explica las diferencias entre estas Leonas y las de Sídney 2000,https://www.clarin.com/deportes/vanina-oneto-diferencia-sidney-2000-pibas-felices-quieren-ir-_0_kEsiACDGH.html,https://images.clarin.com/2021/08/04/_fFNPvPY3_720x0__1.jpg
4,f8RDyU3Nk,"Coronavirus. Delta: las dos caras de su  ""virulencia"" y qué chances hay de terminar en el hospital",https://www.clarin.com/sociedad/variante-delta-caras-virulencia-chances-terminar-hospital_0_f8RDyU3Nk.html,https://images.clarin.com/2021/07/20/cHG4ZwcsM_1256x620__2.jpg#1627994715481
5,4v0STxT36,"Muy pocos la conocen. Cómo es la única caja de ahorro que ""blinda"" el dinero contra la inflación",https://www.clarin.com/servicios/unica-caja-ahorro-blinda-dinero-inflacion_0_4v0STxT36.html,https://images.clarin.com/2021/08/03/6HLPYjbEc_720x0__1.jpg
6,0RbohUjnh,Familias destruidas. La tragedia de tres amigas muertas en un departamento de Mar del Plata,https://www.clarin.com/sociedad/tragedia-amigas-murieron-departamento-mar-plata_0_0RbohUjnh.html,https://images.clarin.com/2021/08/03/UyJRnGZrW_1256x620__2.jpg#1628039747754
7,R7i5kyZ3D,"Del editor. Un juez rico y poderoso, un socio asesinado y una historia de extorsiones y sacapresos",https://www.clarin.com/opinion/juez-rico-poderoso-socio-asesinado-historia-extorsiones-sacapresos_0_R7i5kyZ3D.html,https://images.clarin.com/2021/08/03/WedndF-84_720x0__1.jpg
8,W1llDQpbC,Incentivos. Impuesto a las Ganancias y Bienes Personales: las nuevas exenciones oficializadas hoy,https://www.clarin.com/economia/gobierno-oficializo-modificacion-impuesto-ganancias-bienes-personales_0_W1llDQpbC.html,https://images.clarin.com/2020/12/17/uUAdm0S_9_720x0__1.jpg
9,3X7mNwSNp,"Freno al Covid. Nuevas pistas sobre la efectividad de las vacunas, en un revelador estudio en Chile",https://www.clarin.com/mundo/nuevas-pistas-efectividad-vacunas-covid-revelador-estudio-hecho-chile_0_3X7mNwSNp.html,https://images.clarin.com/2021/08/03/4Jojy0ZDr_1256x620__2.jpg#1628075404524
10,GiXeqNJ3m,Tras la polémica. El Gobierno confirmó que en septiembre llegan las primeras dosis de Pfizer,https://www.clarin.com/politica/coronavirus-gobierno-confirmo-septiembre-llegan-primeras-dosis-vacuna-pfizer_0_GiXeqNJ3m.html,https://images.clarin.com/2021/08/04/_pWwSMOWX_720x0__1.jpg
11,ekjD33AhF,Especial Clarín. Vida de influencer: pueden ganar hasta $150.000 por un video de 15 segundos,https://www.clarin.com/sociedad/intimidad-joven-vive-fama-redes-trabajar-influencer_0_ekjD33AhF.html,https://images.clarin.com/2021/07/30/RgX4-_vq2_720x0__1.jpg
12,nwiPcmi4z,"Visitas a Olivos. Cafiero respaldó el pedido de expulsión de Iglesias de Diputados: ""Son discursos cargados de odio y misoginia""",https://www.clarin.com/politica/santiago-cafiero-respaldo-pedido-expulsion-fernando-iglesias-diputados-discursos-cargados-odio-misoginia-_0_nwiPcmi4z.html,https://images.clarin.com/2020/06/18/upbjKe8Ng_720x0__1.jpg
13,1nrEkobSj,Triple crimen de la efedrina. Liberaron al empresario Pérez Corradi luego de que EE.UU. desistiera de su extradición,https://www.clarin.com/politica/triple-crimen-efedrina-liberaron-empresario-perez-corradi-luego-ee-uu-desistiera-extradicion_0_1nrEkobSj.html,https://images.clarin.com/2016/10/12/Bklp1ePCXg_720x0.jpg
14,7LcmgFimL,"Nuevos rumbos. Julieta Díaz, Julieta Zylberberg y Gonzalo Heredia: actores en busca de otro destino",https://www.clarin.com/espectaculos/musica/julieta-diaz-julieta-zylberberg-gonzalo-heredia-actores-busca-destino_0_7LcmgFimL.html,https://images.clarin.com/2021/08/03/n95oWhLd-_720x0__1.jpg
15,a2HtpBtpOc,"Inversión de 371 mil dólares. Córdoba inaugura Serafín, una nueva supercomputadora que homenajea a Fontanarrosa",https://www.clarin.com/tecnologia/cordoba-inaugura-serafin-nueva-supercomputadora-homenajea-fontanarrosa_0_a2HtpBtpOc.html,https://images.clarin.com/2021/08/04/vwz7V4jne_720x0__1.jpg
16,ftVestV2W,Avanzada K. Pacto con Irán: Zannini se suma al plan de Cristina Kirchner y presiona para que cierren la causa,https://www.clarin.com/politica/pacto-iran-carlos-zannini-suma-plan-cristina-kirchner-presiona-cierren-causa_0_ftVestV2W.html,https://images.clarin.com/2021/08/04/nZXoPcH8d_720x0__1.jpg
17,DzhPt-R0h,Inmunización. Vacunarse en una ciudad y recibir la segunda dosis en otra: cómo hacer,https://www.clarin.com/ciudades/crecen-consultas-vacunaron-ciudad-quieren-recibir-segunda-dosis-hacer-_0_DzhPt-R0h.html,https://images.clarin.com/2021/08/03/MoGxIz0i3_1256x620__2.jpg#1628026703178
18,88P5ucjun,A 20 años del último show. Redonditos de Ricota y la crónica de un final no anunciado,https://www.clarin.com/espectaculos/musica/20-anos-ultimo-show-redonditos-ricota-cronica-final-anunciado_0_88P5ucjun.html,https://images.clarin.com/2021/08/03/Kx-4yZD1n_1256x620__2.jpg#1628032244638
19,vhCmX-YIl,"Entrevista. Diego Peretti: ""La grieta es un negocio que le da plata y poder a mucha gente""",https://www.clarin.com/viva/diego-peretti-grieta-negocio-da-plata-poder-mucha-gente-_0_vhCmX-YIl.html,https://images.clarin.com/2021/08/03/_LjtB0eqs_720x0__1.jpg
20,T1iUO1JEl,Compra y venta. Aumento de precios: cuánto cuesta tu auto usado en agosto,https://www.clarin.com/autos/aumento-precios-cuesta-auto-usado-agosto_0_T1iUO1JEl.html,https://images.clarin.com/2020/12/08/UXE8alkMl_720x0__1.jpg
21,BLTQLn-1I,Antecedentes familiares. 5 hábitos que ayudan a reducir el riesgo genético de cáncer,https://www.clarin.com/buena-vida/5-habitos-ayudan-reducir-riesgo-genetico-cancer_0_BLTQLn-1I.html,https://images.clarin.com/2021/08/03/kYfUtJ7yh_720x0__1.jpg
22,vo2N5kpIe,Incentivos. Super Viaje BA: descuentos en alojamiento y transporte para turistas que visiten la Ciudad,https://www.clarin.com/viajes/super-viaje-ba-descuentos-alojamiento-transporte-turistas-visiten-ciudad_0_vo2N5kpIe.html,https://images.clarin.com/2021/04/01/mo4z4djJY_720x0__1.jpg
23,MoEMzjIC1,"Curiosidades. Icaria, la isla griega de las leyendas y el secreto de la longevidad",https://www.clarin.com/viajes/icaria-isla-griega-leyendas-secreto-longevidad_0_MoEMzjIC1.html,https://images.clarin.com/2021/08/02/ZKmebiO4E_720x0__1.jpg
24,,Historias visuales. Fotogalería con las 100 grandes imágenes del día,,
25,jeVmkgp8R,"Rumbo a las PASO. El reparto en el Frente de Todos: uno por uno, a quiénes responden los candidatos a diputados en Provincia",https://www.clarin.com/politica/reparto-frente-responden-candidatos-diputados-provincia_0_jeVmkgp8R.html,https://images.clarin.com/2021/07/24/M6XQMkK1L_720x0__1.jpg
26,DJg1wmBx0,Aseguraron medalla. Las Leonas sacaron su chapa ante India e irán por el ansiado oro en Tokio,https://www.clarin.com/deportes/leonas-sacaron-chapa-india-iran-ansiado-oro-tokio_0_DJg1wmBx0.html,https://images.clarin.com/2021/08/04/kakb7HuW9_720x0__1.jpg
27,kEsiACDGH,Exclusivo de Clarín. Vanina Oneto explica las diferencias entre estas Leonas y las de Sídney 2000,https://www.clarin.com/deportes/vanina-oneto-diferencia-sidney-2000-pibas-felices-quieren-ir-_0_kEsiACDGH.html,https://images.clarin.com/2021/08/04/_fFNPvPY3_720x0__1.jpg
28,f8RDyU3Nk,"Coronavirus. Delta: las dos caras de su  ""virulencia"" y qué chances hay de terminar en el hospital",https://www.clarin.com/sociedad/variante-delta-caras-virulencia-chances-terminar-hospital_0_f8RDyU3Nk.html,https://images.clarin.com/2021/07/20/cHG4ZwcsM_1256x620__2.jpg#1627994715481
29,4v0STxT36,"Muy pocos la conocen. Cómo es la única caja de ahorro que ""blinda"" el dinero contra la inflación",https://www.clarin.com/servicios/unica-caja-ahorro-blinda-dinero-inflacion_0_4v0STxT36.html,https://images.clarin.com/2021/08/03/6HLPYjbEc_720x0__1.jpg
30,0RbohUjnh,Familias destruidas. La tragedia de tres amigas muertas en un departamento de Mar del Plata,https://www.clarin.com/sociedad/tragedia-amigas-murieron-departamento-mar-plata_0_0RbohUjnh.html,https://images.clarin.com/2021/08/03/UyJRnGZrW_1256x620__2.jpg#1628039747754
31,,Ventajas. Conocé todas las novedades de Flow,,
32,48CiiFc3g,"Acuerdo con los bonistas. Deuda: a un año del canje, qué pasó con los bonos y el riesgo país",https://www.clarin.com/economia/deuda-ano-bonos-canje-cayeron-35-riesgo-pais-baja-1-600-puntos_0_48CiiFc3g.html,https://images.clarin.com/2019/02/20/nghzoxwJG_720x0__1.jpg
33,-szoiNT5l,Startup en crecimiento. Una empresa argentina apuesta a las proteínas vegetales y logró inversiones por U$S 3 millones,https://www.clarin.com/rural/empresa-argentina-apuesta-proteinas-vegetales-logro-captar-inversiones-s-3-millones_0_-szoiNT5l.html,https://images.clarin.com/2021/08/04/7Pgoa9CJO_720x0__1.jpg
34,_xfqn3TSB,"Impuestos. Ganancias, Bienes Personales y Monotributo: qué reclaman los contadores a la AFIP",https://www.clarin.com/economia/ganancias-bienes-personales-monotributo-reclaman-afip-solucione-problemas-pagina-web_0__xfqn3TSB.html,https://images.clarin.com/2021/08/03/9DnG7DNJM_720x0__1.jpg
35,GLLGmxtvp,Línea blanca. Samsung cierra un acuerdo con BGH para producir aires en Tierra del Fuego,https://www.clarin.com/economia/samsung-cierra-acuerdo-bgh-producir-aires-tierra-fuego_0_GLLGmxtvp.html,https://images.clarin.com/2021/08/03/QAQGHcYXh_720x0__1.jpg
36,KALAGbtPc,Datos oficiales. La recaudación de julio subió 67% contra el mismo mes de 2020,https://www.clarin.com/economia/recaudacion-julio-subio-67-mismo-mes-2020_0_KALAGbtPc.html,https://images.clarin.com/2021/06/16/nsSqQkba__720x0__1.jpg
37,QgFogFbeR,Alivio fiscal. Ganancias: en septiembre subiría el piso de $ 150.000,https://www.clarin.com/economia/impuesto-ganancias-septiembre-subiria-piso-150-000_0_QgFogFbeR.html,https://images.clarin.com/2021/04/26/ZGV-9LFhL_720x0__1.jpg
38,pvVA3X_YN,Emprender en Argentina. Saphirus cuenta cómo iniciar un emprendimiento de manera sencilla y rápida,https://www.clarin.com/brandstudio/saphirus-cuenta-iniciar-emprendimiento-manera-sencilla-rapida_0_pvVA3X_YN.html,https://images.clarin.com/2021/07/28/Ty2rBvxwE_720x0__1.jpg
39,BLUXQgFMs,Un paseo imperdible. Cómo es la ruta de los chocolates y los licores en tierras bonaerenses,https://www.clarin.com/brandstudio/ruta-chocolates-licores-tierras-bonaerenses_0_BLUXQgFMs.html,https://images.clarin.com/2021/07/30/ht2bKy0oK_720x0__1.jpg
40,-RLOfxJrP,Empresas. Arrancó en una lancha y hoy tiene una de las pesqueras más grandes del país,https://www.clarin.com/brandstudio/arranco-lancha-hijos-hoy-pesqueras-grandes-pais_0_-RLOfxJrP.html,https://images.clarin.com/2021/07/29/5bbzqZssO_720x0__1.jpg
41,,Ventajas. Conocé todas las novedades de Flow,,
42,JiNPrMYlA,Sexualidad. Infancias transgénero: cómo acompañar a tus hijos e hijas,https://www.clarin.com/familias/infancias-transgenero-acompanar-hijos-hijas_0_JiNPrMYlA.html,https://images.clarin.com/2021/08/03/5rFkyjNEV_720x0__1.jpg
43,03FsmxjHl,Turismo. Mendoza lanzó una promoción para viajar en temporada baja,https://www.clarin.com/viajes/mendoza-lanzo-promocion-viajar-temporada-baja_0_03FsmxjHl.html,https://images.clarin.com/2019/02/27/tHA3oggKf_720x0__1.jpg
44,8d0GTfzYM,Más privacidad. Visualización única en WhatsApp: ya se pueden enviar fotos y videos que desaparecen después de verse,https://www.clarin.com/tecnologia/visualizacion-unica-whatsapp-pueden-enviar-fotos-videos-desaparecen-despues-verse_0_8d0GTfzYM.html,https://images.clarin.com/2021/08/04/h2xtOpMEu_720x0__1.jpg
45,dMIdzDQ1T,Nutrición. Dieta keto: quiénes no deberían practicarla y por qué,https://www.clarin.com/buena-vida/dieta-keto-deberian-practicarla_0_dMIdzDQ1T.html,https://images.clarin.com/2021/08/03/2PFO7_U9Y_720x0__1.jpg
46,SfvUuqqBm,"¿Y el del medio?. Hermanos: cómo es su personalidad, del mayor al menor",https://www.clarin.com/familias/hermanos-personalidad-mayor-menor_0_SfvUuqqBm.html,https://images.clarin.com/2021/07/26/HNrHNfTVw_1256x620__2.jpg#1627999639891
47,IlsQlKWCd,"Ranking 2021. 6 restaurantes argentinos, entre los 25 mejores de Sudamérica según TripAdvisor",https://www.clarin.com/gourmet/6-restaurantes-argentinos-25-mejores-sudamerica-tripadvisor_0_IlsQlKWCd.html,https://images.clarin.com/2018/12/06/KOiDPNrmk_720x0__1.jpg
48,2gOL0fs0E,"Pamela Smart, la maestra asesina. Sedujo a un alumno de 16, tuvo sexo y lo convenció de matar a su marido",https://www.clarin.com/internacional/sedujo-alumno-16-anos-sexo-convencio-matar-marido-pamela-smart-maestra-asesina_0_2gOL0fs0E.html,https://images.clarin.com/2021/08/04/NZC3r6Vtn_720x0__1.jpg
49,i59cv_DcP,Sorpresa científica. Así obtuvo la Tierra su oxígeno y los días pasaron de tener 6 horas a las actuales 24,https://www.clarin.com/viste/obtuvo-tierra-oxigeno-dias-pasaron-tener-6-horas-actuales-24_0_i59cv_DcP.html,https://images.clarin.com/2021/04/21/33T1TiTKa_720x0__1.jpg
50,KUSD8zvVl,Insólito. Un jubilado va a prisión por tener un tanque de guerra escondido en su garage,https://www.clarin.com/viste/jubilado-va-prision-tener-tanque-guerra-escondido-garage_0_KUSD8zvVl.html,https://images.clarin.com/2021/08/03/V_M-QwZdl_720x0__1.jpg
51,sq02kY3Ah,"Tiene 42 años. Colmillos y lengua bífida: el hombre que se transformó en el ""orco infernal""",https://www.clarin.com/internacional/tatuajes-mutilaciones-colmillos-lengua-bifida-hombre-transformo-orco-infernal-_0_sq02kY3Ah.html,https://images.clarin.com/2021/07/30/4_g2cbALw_1256x620__2.jpg#1627944274224
52,yJFob72-G,Astrología. Portal del León: qué es y cuáles son las energías que se despiertan,https://www.clarin.com/astrologia/portal-leon-2021-energias-despiertan_0_yJFob72-G.html,https://images.clarin.com/2021/08/03/F_TO8seiq_720x0__1.jpg
53,P7uERCgxz,"Juzgado. Condena a muerte en suspenso para un oso polar ""problemático"" en Groenlandia",https://www.clarin.com/viste/condena-muerte-suspenso-oso-polar-groenlandia_0_P7uERCgxz.html,https://images.clarin.com/2016/09/14/BJnKvUfUx_720x0.jpg
54,K_DSF0-7x,La Casa Blanca recluta . Un ejército de influencers para luchar contra los antivacunas,https://www.clarin.com/new-york-times-international-weekly/casa-blanca-recluta-ejercito-influencers-luchar-antivacunas_0_K_DSF0-7x.html,https://images.clarin.com/2021/08/03/NwTYCX5gs_1256x620__2.jpg#1627997966699
55,Na9DUoR7w,Curiosidad. Un hipódromo donde la velocidad no importa,https://www.clarin.com/new-york-times-international-weekly/hipodromo-velocidad-importa_0_Na9DUoR7w.html,https://images.clarin.com/2021/08/03/Dsj41VCH__1256x620__3.jpg#1628018632976
56,QI5lV_-zx,"""Infierno"".  La vida en la ciudad más aterrorizada de México",https://www.clarin.com/new-york-times-international-weekly/-vivimos-infierno-dentro-ciudad-aterrorizada-mexico_0_QI5lV_-zx.html,https://images.clarin.com/2021/08/03/_7xla2_zJ_1256x620__2.jpg#1628019043757
57,QuCljr9fWz,Avance crucial. 99 científicos descifraron el genoma humano completo,https://www.clarin.com/new-york-times-international-weekly/99-cientificos-descifraron-genoma-humano-completo_0_QuCljr9fWz.html,https://images.clarin.com/2021/08/03/GfYRlBysR_1256x620__2.jpg#1628016848560
58,hUjUZwGUd,"Alivio en su entorno. Luego del coma por covid, Mario Ishii dejó el hospital caminando y entre aplausos",https://www.clarin.com/zonales/video-luego-coma-coronavirus-mario-ishii-dejo-hospital-caminando-aplausos_0_hUjUZwGUd.html,https://images.clarin.com/2021/08/02/PihQeLoJU_720x0__1.jpg
59,ccqj1SexE,En Ingeniero Budge. En otra gran feria pegada a La Salada exigen que también les permitan volver a vender,https://www.clarin.com/zonales/terminantes-lomas-aseguran-feria-olimpo-volvera-funcionar_0_ccqj1SexE.html,https://images.clarin.com/2021/07/30/3AQTGBXWC_720x0__1.jpg
60,9WryN4oRp,"Solidaridad. Una fundación para pacientes con cáncer, con apoyo de Messi y más famosos",https://www.clarin.com/zonales/ayudita-seleccion-enorme-vocacion-solidaria-da-batalla-cancer_0_9WryN4oRp.html,https://images.clarin.com/2021/07/26/3F6SwpreV_720x0__1.jpg
61,NTmrHq2kF,Gloria de Deportivo Español. El hombre récord del fútbol argentino: 333 partidos seguidos en Primera División,https://www.clarin.com/zonales/pedro-catalano-arquero-hace-35-anos-empezo-convertirse-record-futbol-argentino_0_NTmrHq2kF.html,https://images.clarin.com/2021/07/19/QSvKxqyIq_720x0__1.jpg
62,g0qCZmwyl,"Tras el pase a la final. Noel Barrionuevo: ""Holanda es nuestro eterno rival y queremos ganar""",https://www.clarin.com/deportes/noel-barrionuevo-holanda-eterno-rival-queremos-ganar-_0_g0qCZmwyl.html,https://images.clarin.com/2021/08/04/aGTILTqa9_720x0__1.jpg
63,pdoP5F4Wn,"Opinión. Las Leonas, el seleccionado más importante de la historia del deporte argentino",https://www.clarin.com/deportes/polideportivo/leonas-seleccionado-importante-historia-deporte-argentino_0_pdoP5F4Wn.html,https://images.clarin.com/2021/08/04/NhcKBkSTt_720x0__1.jpg
64,-RLLWMkRr,"Decatlón. La cruel historia de Van der Plaetsen, que sumó otro dolor con una durísima caída",https://www.clarin.com/deportes/tokio-2020-cruel-historia-thomas-van-der-plaetsen-sumo-dolor-durisima-caida_0_-RLLWMkRr.html,https://images.clarin.com/2021/08/04/KuhoV3E8-_1256x620__2.jpg#1628049559029
65,KAjGiLLcE,En fotos. Las mejores imágenes de la jornada en Tokio 2020,https://www.clarin.com/deportes/tokio-2020-sifan-hassan-atleta-hizo-viral-caida-triunfo-1-500-metros-oro-5-000_0_KAjGiLLcE.html,https://images.clarin.com/2021/08/02/DaNhIBwzR_720x0__1.jpg
66,H-OnT_g8k,Lucão. El voleibolista brasileño que explicó por qué juega con mascarilla,https://www.clarin.com/deportes/lucao-voleibolista-brasileno-explico-juega-mascarilla_0_H-OnT_g8k.html,https://images.clarin.com/2021/07/26/9GP6Cme3j_720x0__1.jpg
67,wQR9eLJh7,"Lidera en el golf. Madelene Sagstrom, la sueca que se ""liberó"" tras contar que fue abusada",https://www.clarin.com/deportes/madelene-sagstrom-sueca-libero-contar-abusada-lidera-golf_0_wQR9eLJh7.html,https://images.clarin.com/2021/08/04/JKb_2Gvg__720x0__1.jpg
68,lWpZXXWv7,"Se animó, pero.... El baile del caño de Viviana Saccone en ""ShowMatch""",https://www.clarin.com/fama/showmatch-viviana-saccone-pudo-salir-airosa-baile-cano_0_lWpZXXWv7.html,https://images.clarin.com/2021/08/04/p_cHzerJM_720x0__1.jpg
69,hVBIL45u9,Inesperado. Un escándalo entre Ernestina Pais y Mirtha Legrand podría terminar en la Justicia,https://www.clarin.com/fama/ernestina-pais-defendio-acusacion-plagio-mirtha-legrand_0_hVBIL45u9.html,https://images.clarin.com/2021/08/03/UzrPZPIAG_720x0__1.jpg
70,EVnUwpy51,Fuerte testimonio. Estremecedor relato de Morena Rial sobre maltrato familiar,https://www.clarin.com/fama/estremecedor-relato-morena-rial-maltrato-madre-ponia-cera-quemarnos-_0_EVnUwpy51.html,https://images.clarin.com/2020/09/26/SdM0W281y_720x0__1.jpg
71,TLETW-7S0,Humor en vivo. Picante chiste de Jey Mammón para Florencia Peña sobre su visita a la Quinta de Olivos,https://www.clarin.com/fama/picante-chiste-jey-mammon-florencia-pena-visita-quinta-olivos_0_TLETW-7S0.html,https://images.clarin.com/2021/08/03/gqHAhL5OE_720x0__1.jpg
72,v0RbpQpUR,Nuevas tendencias. Autos usados: cuáles son los sitios web más seguros para comprar online,https://www.clarin.com/servicios/autos-usados-sitios-web-seguros-comprar-online_0_v0RbpQpUR.html,https://images.clarin.com/2021/04/26/ZGV-9LFhL_720x0__1.jpg
73,F1RIZ57dX,Escenario. Un año de la explosión en Beirut: una tragedia que es reflejo de un Líbano arrasado,https://www.clarin.com/mundo/ano-explosion-beirut-tragedia-reflejo-libano-arrasado_0_F1RIZ57dX.html,https://images.clarin.com/2021/08/04/itg18JKXo_1256x620__2.jpg#1628081865963
74,eszF2sp1R,"Tragedia en El Líbano. La explosión en primera persona: ""Pasar por ahí todavía me da escalofríos""",https://www.clarin.com/mundo/ano-explosion-beirut-pasar-ahi-todavia-da-escalofrios-_0_eszF2sp1R.html,https://images.clarin.com/2021/08/03/61kHEgH4N_720x0__1.jpg
75,-q299cc9X,La interna opositora. Por qué Elisa Carrió está tan enojada con Facundo Manes,https://www.clarin.com/politica/elecciones-2021-elisa-carrio-enojada-facundo-manes_0_-q299cc9X.html,https://images.clarin.com/2020/11/15/M7UJuJPX4_720x0__1.jpg
76,_iL6qp9Q2,Coronavirus. Anticuerpos a full: qué se sabe del contagio después de la vacuna,https://www.clarin.com/sociedad/-anticuerpos-full-sabe-contagio-despues-vacuna_0__iL6qp9Q2.html,https://images.clarin.com/2021/07/22/9FLeqLfC5_720x0__1.jpg
77,jWOZLem86,Van Basten. Calvario físico y bancarrota: el ex futbolista que volvió de las tinieblas,https://www.clarin.com/historias/mala-praxis-calvario-fisico-bancarrota-marco-van-basten-ex-futbolista-volvio-tinieblas_0_jWOZLem86.html,https://images.clarin.com/2021/08/01/jhOrw3nRV_720x0__1.jpg
78,mPfZC-Otu,Secretos del campo. Todos los usos del maíz: de los pañales al alcohol en gel,https://www.clarin.com/rural/puchero-panales-alcohol-gel-revolucion-maiz_0_mPfZC-Otu.html,https://images.clarin.com/2021/07/28/FpbOIphOn_720x0__1.jpg
79,-xaCAz8-Y,"Escenas del crimen. Nahir Galarza, la joven que mató a su novio y se convertirá en serie",https://www.clarin.com/policiales/escenas-crimen-nahir-galarza-joven-mato-novio-convertira-serie_0_-xaCAz8-Y.html,https://images.clarin.com/2021/07/22/VXVJQo_0W_720x0__1.jpg
80,wXrCrtaXH,"Salud. Psoriasis, la enfermedad que explotó en la pandemia",https://www.clarin.com/buena-vida/psoriasis-enfermedad-exploto-pandemia_0_wXrCrtaXH.html,https://images.clarin.com/2021/05/31/saNJQi-UR_720x0__1.jpg
81,VZDnTeZmk,Radiografía del horror. Auschwitz: así era el mayor campo de concentración de los nazis,https://www.clarin.com/mundo/holocausto-campo-concentracion-nazi-auschwitz-nuevo-aniversario-liberacion_0_VZDnTeZmk.html,https://images.clarin.com/2021/01/27/js5e-EO_z_720x0__1.jpg
82,1ZUPbp4_e,Copa Argentina. Boca vs. River: ¿querés que te cuente el cuento de la buena pipa?,https://www.clarin.com/deportes/boca-vs-river-queres-cuente-cuento-buena-pipa-_0_1ZUPbp4_e.html,https://images.clarin.com/2021/08/03/fxz-MRL4C_720x0__1.jpg
83,gVoeA3tK1,Antes del Superclásico. La relación entre River y Boca está tirante y en Núñez apuntan contra Riquelme,https://www.clarin.com/deportes/relacion-river-boca-vuelve-tirante-nunez-apuntan-riquelme_0_gVoeA3tK1.html,https://images.clarin.com/2020/01/21/-UByUT-W_720x0__1.jpg
84,0vgkOGpPV,Fútbol argentino. La Liga Profesional definió el formato para 2022: dos torneos de 28 equipos y dos descensos,https://www.clarin.com/deportes/liga-profesional-definio-formato-2022-28-equipos-apenas-descensos_0_0vgkOGpPV.html,https://images.clarin.com/2021/08/03/w09RLpGfI_720x0__1.jpg
85,HJ-GpWIIc,En Ibiza. Messi y Neymar se reencontraron después de la final de la Copa América,https://www.clarin.com/deportes/lionel-messi-neymar-reencontraron-ibiza-despues-final-copa-america_0_HJ-GpWIIc.html,https://images.clarin.com/2021/08/03/ss5whXj0u_720x0__1.jpg
86,JmaSaOmYh,Países Bajos. Un ex jugador del Ajax murió tras ser baleado en la cabeza durante una fiesta,https://www.clarin.com/deportes/ex-jugador-ajax-murio-baleado-cabeza-fiesta_0_JmaSaOmYh.html,https://images.clarin.com/2021/08/03/qs-DmOW6g_720x0__1.jpg
87,nWoz57JQH,"Mercado europeo. Cuti Romero, el defensor argentino más caro de la historia",https://www.clarin.com/deportes/cuti-romero-chico-mueve-millones-convirtio-defensor-argentino-caro-historia_0_nWoz57JQH.html,https://images.clarin.com/2021/06/03/wQI_7k6mp_720x0__1.jpg
