n,id,title,url,image
1,3YRHm75af,Nuevas restricciones. Las medidas que se discuten en la Ciudad: cierre de comercios a las 18 y secundaria virtual,https://www.clarin.com/politica/cierre-comercios-18-secundaria-virtual-nuevas-restricciones-discute-ciudad-proxima-etapa_0_3YRHm75af.html,https://images.clarin.com/2021/04/16/_BMHeErPf_720x0__1.jpg
2,DQN0OqOjO,Más controles. No descartan rever habilitaciones y permisos para circular,https://www.clarin.com/sociedad/nuevas-restricciones-coronavirus-volveran-empadronar-trabajadores-esenciales_0_DQN0OqOjO.html,https://images.clarin.com/2020/04/30/w0b0RMsDrw_720x0__1.jpg
3,QuHmBpRsA,"Coronavirus. En plena segunda ola, Provincia advierte de una tercera ""más potente y sin margen""",https://www.clarin.com/sociedad/plena-segunda-ola-coronavirus-provincia-advierten-tercera-potente-margen-_0_QuHmBpRsA.html,https://images.clarin.com/2020/07/29/TW28tgSEF_720x0__1.jpg
4,2iSC5lEDO,"Mensaje a piqueteros. ""No permitiremos movilizaciones que entren en bloque a la Ciudad""",https://www.clarin.com/politica/mensaje-gobierno-piqueteros-permitiremos-movilizaciones-entren-bloque-ciudad-_0_2iSC5lEDO.html,https://images.clarin.com/2021/04/29/f4jZNK9te_720x0__1.jpg
5,TkaHMcjQq,Segunda ola de Covid. Las tres claves que analiza el Gobierno para un posible acuerdo con Pfizer por las vacunas,https://www.clarin.com/sociedad/coronavirus-claves-analiza-gobierno-posible-acuerdo-pfizer-vacunas_0_TkaHMcjQq.html,https://images.clarin.com/2021/04/28/SFsQHs-0O_720x0__1.jpg
6,uDNJlXa0T,Del editor. Cómo es el nuevo calendario de la épica K,https://www.clarin.com/opinion/viene-nuevo-calendario-epica-k_0_uDNJlXa0T.html,https://images.clarin.com/2016/09/19/HJWa_Mr0Xe_720x0.jpg
7,hJopQFtIQ,100 días de Biden. Una presidencia que cambió el tono de EE.UU.,https://www.clarin.com/mundo/cien-dias-joe-biden-temas-presidencia-cambio-tono-unidos_0_hJopQFtIQ.html,https://images.clarin.com/2021/04/29/n4AiG2Tfx_1256x620__2.jpg#1619694351837
8,9psN04c4D,NBA. Campazzo la rompió: récord y su primer doble-doble,https://www.clarin.com/deportes/historico-campazzo-rompio-consiguio-primer-doble-doble-nba_0_9psN04c4D.html,https://images.clarin.com/2021/04/29/l2smst17q_1256x620__2.jpg#1619667364132
9,yZS_Q_abx,Crack cordobés. Qué dijo  Campazzo al recibir una ovación tras su mejor noche en la NBA,https://www.clarin.com/deportes/dijo-facundo-campazzo-recibir-ovacion-mejor-noche-carrera-nba_0_yZS_Q_abx.html,https://images.clarin.com/2021/04/29/MKX3OEjS8_1256x620__2.jpg#1619670966826
10,TdbU1S75I,Otra variante. La crisis del coronavirus en la India preocupa al planeta,https://www.clarin.com/mundo/coronavirus-crisis-india-preocupa-planeta-_0_TdbU1S75I.html,https://images.clarin.com/2021/04/28/NkuP1WGgp_1256x620__2.jpg#1619613481813
11,vnfTUIssW,Opinión. ¿Se avecina una guerra entre China y EE.UU.?,https://www.clarin.com/new-york-times-international-weekly/-avecina-guerra-china-ee-uu-_0_vnfTUIssW.html,https://images.clarin.com/2020/12/10/MngrMSzYq_1256x620__2.jpg#1619615901078
12,5O02E5a7v,Ciberdelitos. La industria de la difamación,https://www.clarin.com/new-york-times-international-weekly/industria-difamacion_0_5O02E5a7v.html,https://images.clarin.com/2021/04/28/d-DMYTSKZ_1256x620__2.jpg#1619622130241
13,tF8B4HQZ_,Metamateriales. Muy pronto harán realidad lo que hoy es ciencia ficción,https://www.clarin.com/new-york-times-international-weekly/metamateriales-haran-realidad-ciencia-ficcion_0_tF8B4HQZ_.html,https://images.clarin.com/2021/04/28/6jFf8Zvpa_1256x620__2.jpg#1619624863100
14,G6deTp_ha,Vacunas. Cómo Europa selló un acuerdo con Pfizer con textos y llamadas,https://www.clarin.com/new-york-times-international-weekly/europa-sello-acuerdo-pfizer-textos-llamadas_0_G6deTp_ha.html,https://images.clarin.com/2021/04/28/0AYUtFIvU_720x0__1.jpg
15,3YRHm75af,Nuevas restricciones. Las medidas que se discuten en la Ciudad: cierre de comercios a las 18 y secundaria virtual,https://www.clarin.com/politica/cierre-comercios-18-secundaria-virtual-nuevas-restricciones-discute-ciudad-proxima-etapa_0_3YRHm75af.html,https://images.clarin.com/2021/04/16/_BMHeErPf_720x0__1.jpg
16,DQN0OqOjO,Más controles. No descartan rever habilitaciones y permisos para circular,https://www.clarin.com/sociedad/nuevas-restricciones-coronavirus-volveran-empadronar-trabajadores-esenciales_0_DQN0OqOjO.html,https://images.clarin.com/2020/04/30/w0b0RMsDrw_720x0__1.jpg
17,QuHmBpRsA,"Coronavirus. En plena segunda ola, Provincia advierte de una tercera ""más potente y sin margen""",https://www.clarin.com/sociedad/plena-segunda-ola-coronavirus-provincia-advierten-tercera-potente-margen-_0_QuHmBpRsA.html,https://images.clarin.com/2020/07/29/TW28tgSEF_720x0__1.jpg
18,2iSC5lEDO,"Mensaje a piqueteros. ""No permitiremos movilizaciones que entren en bloque a la Ciudad""",https://www.clarin.com/politica/mensaje-gobierno-piqueteros-permitiremos-movilizaciones-entren-bloque-ciudad-_0_2iSC5lEDO.html,https://images.clarin.com/2021/04/29/f4jZNK9te_720x0__1.jpg
19,TkaHMcjQq,Segunda ola de Covid. Las tres claves que analiza el Gobierno para un posible acuerdo con Pfizer por las vacunas,https://www.clarin.com/sociedad/coronavirus-claves-analiza-gobierno-posible-acuerdo-pfizer-vacunas_0_TkaHMcjQq.html,https://images.clarin.com/2021/04/28/SFsQHs-0O_720x0__1.jpg
20,uDNJlXa0T,Del editor. Cómo es el nuevo calendario de la épica K,https://www.clarin.com/opinion/viene-nuevo-calendario-epica-k_0_uDNJlXa0T.html,https://images.clarin.com/2016/09/19/HJWa_Mr0Xe_720x0.jpg
21,hJopQFtIQ,100 días de Biden. Una presidencia que cambió el tono de EE.UU.,https://www.clarin.com/mundo/cien-dias-joe-biden-temas-presidencia-cambio-tono-unidos_0_hJopQFtIQ.html,https://images.clarin.com/2021/04/29/n4AiG2Tfx_1256x620__2.jpg#1619694351837
22,ib6BbJb5g,"Copa Libertadores. River no brilló, pero fue contundente y le alcanzó para superar a Junior",https://www.clarin.com/deportes/river-plate-vs-junior-copa-libertadores-previa-alineaciones-directo_0_ib6BbJb5g.html,https://images.clarin.com/2021/04/28/ufbvFM6I4_720x0__1.jpg
23,GAOts6BdT,"NBA. Deck, listo para debutar: la ""odisea"" que pasó hasta llegar al gran día",https://www.clarin.com/deportes/gabriel-deck-listo-debutar-nba-odisea-paso-llegar-gran-dia_0_GAOts6BdT.html,https://images.clarin.com/2021/04/28/-0Zhlc7YN_600x338__2.jpg#1619654509464
24,os6V13qH0,Ex Real Madrid. La confesión de Metzelder: aceptó haber compartido pornografía infantil y pidió perdón,https://www.clarin.com/deportes/confesion-christoph-metzelder-acepto-compartido-pornografia-infantil-pidio-perdon-victimas_0_os6V13qH0.html,https://images.clarin.com/2021/04/29/iWc2L5H9b_720x0__1.jpg
25,pUaf643tq,"Copa Sudamericana. Independiente reaccionó a tiempo, se lo dio vuelta a Torque y es líder",https://www.clarin.com/deportes/independiente-vs-montevideo-city-torque-copa-sudamericana-previa-alineaciones-directo_0_pUaf643tq.html,https://images.clarin.com/2021/04/28/aAhUufGKi_720x0__1.jpg
26,ME6NqQKhC,"Copa Sudamericana. Central le dio otro golpe a San Lorenzo, que se complica y sigue sin sumar",https://www.clarin.com/deportes/rosario-central-vs-san-lorenzo-copa-sudamericana-previa-alineaciones-directo_0_ME6NqQKhC.html,https://images.clarin.com/2021/04/28/YqpiS7zTE_720x0__1.jpg
27,waPpK2PJq,2-1 al PSG. El City dio el golpe en París y quedó cerca de la final,https://www.clarin.com/deportes/paris-saint-germain-vs-manchester-city-champions-league-previa-alineaciones-directo_0_waPpK2PJq.html,https://images.clarin.com/2021/04/28/s0rdIELoI_720x0__1.jpg
28,ZhHi5kzBN,"""Hoy somos familia"". Ricardo Gareca contó por primera vez que reconoció a una hija extramatrimonial",https://www.clarin.com/deportes/ricardo-gareca-conto-primera-vez-reconocio-hija-extramatrimonial-fuerte-hoy-familia-_0_ZhHi5kzBN.html,https://images.clarin.com/2021/04/28/hwNgUgWWK_720x0__1.jpg
29,GU9O0brHK,Cierra en 48 horas. Subastan unos botines históricos de Messi a un precio millonario,https://www.clarin.com/deportes/subastan-botines-historicos-lionel-messi-precio-millonario-motivos-solidarios_0_GU9O0brHK.html,https://images.clarin.com/2020/12/23/dO1m8m6KL_720x0__1.jpg
30,aKfGrAdRf,Boletín Oficial. Congelan el precio del oxígeno e intiman a productores que garanticen provisión,https://www.clarin.com/sociedad/coronavirus-gobierno-congelo-precio-oxigeno-intimo-productores-garantizar-suministro_0_aKfGrAdRf.html,https://images.clarin.com/2021/04/28/jyPHOad2s_720x0__1.jpg
31,We-Zmi8e2,"Bares y restaurantes. Desde que cierran a las 19, la merienda es la hora pico y se sirve más alcohol a la tarde",https://www.clarin.com/ciudades/bares-restaurantes-cierran-19--merienda-hora-pico-sirve-alcohol-tarde_0_We-Zmi8e2.html,https://images.clarin.com/2021/04/28/nVpw-B_Rx_720x0__1.jpg
32,rQu1wspJ9,Opositor a Putin. Navalny apareció en público por primera vez tras su huelga de hambre,https://www.clarin.com/mundo/alexei-navalny-aparecio-publico-primera-vez-huelga-hambre_0_rQu1wspJ9.html,https://images.clarin.com/2021/04/29/fyqZ1mzpw_1256x620__2.jpg#1619699764302
33,_SYqO9II1,ELA. Cómo es la enfermedad que padece Esteban Bullrich,https://www.clarin.com/buena-vida/ela-enfermedad-padece-esteban-bullrich_0__SYqO9II1.html,https://images.clarin.com/2018/07/17/rkmR8ghmX_720x0__1.jpg
34,WKLgLCxSC,De Maipú. Un intendente viajó a EE.UU. de vacaciones y no cumplió con el aislamiento al volver,https://www.clarin.com/sociedad/intendente-bonaerense-viajo-unidos-vacaciones-regresar-cumplio-aislamiento_0_WKLgLCxSC.html,https://images.clarin.com/2021/04/29/yOK77y0Et_720x0__1.jpg
35,1D2S58b7E,"Narcotráfico. Itatí: 18 toneladas de marihuana que implican a narcos, intendentes y un juez",https://www.clarin.com/policiales/itati-18-toneladas-marihuana-implican-narcos--intendentes--policias-juez_0_1D2S58b7E.html,https://images.clarin.com/2019/09/04/Qc6aD7-HY_1256x620__2.jpg#1619647109185
36,ObuyjMmkg,Importante inversión. Siguen las obras de repavimentación en Acceso Oeste,https://www.clarin.com/brandstudio/siguen-obras-repavimentacion-acceso-oeste_0_ObuyjMmkg.html,https://images.clarin.com/2021/04/27/vLtZVebnV_720x0__1.jpg
37,HrkNvHVwG,22 y 23 de abril. La cebada argentina fue protagonista en CEBAR 2021,https://www.clarin.com/brandstudio/cebada-argentina-protagonista-cebar-2021_0_HrkNvHVwG.html,https://images.clarin.com/2021/04/28/_A862-ynH_720x0__1.jpg
38,qp84dvdQC,Reactivar el turismo. Galápagos busca ser el primer archipiélago de América Latina libre de coronavirus,https://www.clarin.com/viajes/galapagos-busca-primer-archipielago-america-latina-libre-coronavirus-reactivar-turismo_0_qp84dvdQC.html,https://images.clarin.com/2021/04/28/1lBm1QIPc_720x0__1.jpg
39,TwUFjHF9h,Estudio. Cuál es el superhéroe favorito de los argentinos,https://www.clarin.com/tecnologia/superheroe-favorito-argentinos-analisis-busquedas_0_TwUFjHF9h.html,https://images.clarin.com/2017/11/15/ryubyB5yG_720x0.jpg
40,H7umnso9C,Cuando el amor no basta. Cómo resolver los malos hábitos de comunicación en la pareja,https://www.clarin.com/relaciones/amor-basta-resolver-malos-habitos-comunicacion-pareja_0_H7umnso9C.html,https://images.clarin.com/2021/04/28/zYJ6z97Zd_720x0__1.jpg
41,rhH4xqXig,Encuesta. Segunda ola: ¿somos conscientes de los riesgos?,https://www.clarin.com/buena-vida/segunda-ola-conscientes-riesgos_0_rhH4xqXig.html,https://images.clarin.com/2021/04/28/HfP0kjJX0_720x0__1.jpg
42,zypLFF46N,Disciplina sin enojos. Consejos para tranquilizar y poner límites a los chicos sin gritar,https://www.clarin.com/familias/como-tranquilizar-y-poner-limites-a-los-chicos-sin-gritar_0_zypLFF46N.html,https://images.clarin.com/2018/09/10/H1yzTdH_7_720x0__1.jpg
43,6SzT1G_8U,Test drive. Honda Pilot: el SUV con espacio para 8 personas,https://www.clarin.com/autos/analisis-honda-pilot-suv-espacio-8-personas_0_6SzT1G_8U.html,https://images.clarin.com/2021/04/28/7r403T_iU_720x0__1.jpg
44,s-KQRZcsV,En Copenhague. FIFA 21: Argentina se clasificó a la eNations Cup,https://www.clarin.com/brandstudio/fifa-21-argentina-clasifico-enations-cup_0_s-KQRZcsV.html,https://images.clarin.com/2021/04/26/sVLQIK8el_720x0__1.jpg
45,bcNPdYyK2,"""Disaster Girl"". Gana 473.000 dólares vendiendo la imagen original detrás de su meme",https://www.clarin.com/tecnologia/-disaster-girl-gana-473-000-dolares-vendiendo-nft-imagen-original-detras-meme_0_bcNPdYyK2.html,https://images.clarin.com/2021/04/29/rGZKf5Vhw_720x0__1.jpg
46,rxbKyz0xM,Turismo. Abiertas o cerradas: qué atracciones del mundo pueden visitarse en pandemia,https://www.clarin.com/viajes/abiertas-cerradas-atracciones-mundo-pueden-visitarse-pandemia_0_rxbKyz0xM.html,https://images.clarin.com/2021/04/28/YRn9siqs8_720x0__1.jpg
47,yjtli2S1v,Japón. Salió con 4.000 mujeres y a los 77 años lo asesinó su esposa de 25,https://www.clarin.com/viste/salio-4-000-mujeres-77-anos-asesino-esposa-25_0_yjtli2S1v.html,https://images.clarin.com/2021/04/28/5rqZHaBzN_720x0__1.jpg
48,bY3kD0TQs,A 76 años. La muerte de Mussolini: cómo está ahora el lugar donde lo colgaron de los pies,https://www.clarin.com/internacional/video-muerte-mussolini-italia_0_bY3kD0TQs.html,https://images.clarin.com/2020/04/28/nj_UDqwN1_720x0__1.jpg
49,R4ko_cm4S,"EE.UU.. Murió un bebé al que su madre alimentó con una dieta vegana ""basada"" en la Biblia",https://www.clarin.com/internacional/murio-bebe-madre-alimento-dieta-vegana-basada-biblia-_0_R4ko_cm4S.html,https://images.clarin.com/2021/04/28/vf9ZG1sle_720x0__1.jpg
50,KZyEAi-Tu,Fabulosa. La casa que se construye con un contenedor y tiene agua y luz gratis,https://www.clarin.com/viste/casa-construye-contenedor-reciclado-agua-luz-gratis_0_KZyEAi-Tu.html,https://images.clarin.com/2021/04/28/0JrjX-jM8_720x0__1.jpg
51,1x85XqSh7,Nuevo estudio nacional. Ranking incómodo: quiénes son los gobernadores con peor imagen del país,https://www.clarin.com/politica/ranking-incomodo-gobernadores-peor-imagen-pais_0_1x85XqSh7.html,https://images.clarin.com/2019/07/24/ZW6Wc-XDl_720x0__1.jpg
52,s6Bkb_DNK,Para principiantes. El ABC de invertir en la Bolsa: cómo se hace y cuánto se puede ganar,https://www.clarin.com/servicios/abc-invertir-bolsa-hace-puede-ganar_0_s6Bkb_DNK.html,https://images.clarin.com/2021/04/28/7LwDzESBK_720x0__1.jpg
53,5Xpfw5_Bc,Cómo inscribirse. Bono por desempleo y Empleo Joven: quiénes pueden recibir $ 10.000,https://www.clarin.com/economia/bono-desempleo-empleo-joven-pueden-recibir-10-000_0_5Xpfw5_Bc.html,https://images.clarin.com/2021/04/23/JNxRi-Ng4_720x0__1.jpg
54,Os8KkRif7,Soledad Aquino. Candelaria Tinelli confirmó que su madre necesita un trasplante de hígado,https://www.clarin.com/fama/candelaria-tinelli-confirmo-madre-soledad-aquino-necesita-trasplante-higado_0_Os8KkRif7.html,https://images.clarin.com/2018/11/05/R1E3ika5I_720x0__1.jpg
55,01yNvJG6h2,En auge. Bicicletas: qué garajes deben aceptarlas y cuánto pueden cobrar como máximo,https://www.clarin.com/servicios/bicicletas-auge-garajes-deben-aceptarlas-pueden-cobrar-maximo_0_01yNvJG6h2.html,https://images.clarin.com/2020/10/02/VxYw5GrCX_720x0__1.jpg
56,020Jcq-PB,Vacunas y polémica. Arroyo confirmó el plan de dar 70.000 dosis a movimientos sociales,https://www.clarin.com/politica/vacunas-movimientos-sociales-daniel-arroyo-confirmo-70-000-justificado-_0_020Jcq-PB.html,https://images.clarin.com/2021/04/29/NFO1IL6se_720x0__1.jpg
57,PAMWoqqbf,El futuro del Loco. Bielsa habló sobre su continuidad en Leeds y admitió su principal defecto en Inglaterra,https://www.clarin.com/deportes/marcelo-bielsa-hablo-continuidad-leeds-reconocio-principal-defecto-llego-inglaterra_0_PAMWoqqbf.html,https://images.clarin.com/2021/04/29/nXOB1t5C2_720x0__1.jpg
58,p21HXoHuH,"Belleza con propósito. Avon relanza su marca con una provocativa campaña: ""Mirá de nuevo""",https://www.clarin.com/brandstudio/avon-relanza-marca-provocativa-campana-mira-nuevo-_0_p21HXoHuH.html,https://images.clarin.com/2021/04/28/Wep4EUHo5_720x0__1.jpg
59,S-B0BvZj4,"Andre Agassi y sus anécdotas increíbles. El primer cheque, un padre maltratador y el mito de la final que jugó con peluca",https://www.clarin.com/deportes/tenis/andre-agassi-primer-cheque-padre-maltratador-mito-final-roland-garros-jugo-peluca_0_S-B0BvZj4.html,https://images.clarin.com/2021/04/29/DuOmxc7Mn_720x0__1.jpg
60,zppSoDMR4,Belleza. Un siglo de Chanel N° 5: secretos del perfume más vendido de la historia,https://www.clarin.com/viva/siglo-chanel-n-5-secretos-perfume-vendido-historia_0_zppSoDMR4.html,https://images.clarin.com/2021/04/28/Ct_yV4-98_720x0__1.jpg
61,-89gYL7pJ,Tendencias. El fenómeno del turismo rural: qué elige la gente,https://www.clarin.com/viajes/fenomeno-turismo-rural-elige-gente_0_-89gYL7pJ.html,https://images.clarin.com/2021/02/08/kW9lKpxqM_720x0__1.jpg
62,C5Jx2fr2c,"Turismo. Prosperidad y abandono: Hashima, la isla fantasma de Japón",https://www.clarin.com/viajes/prosperidad-abandono-hashima-isla-fantasma-japon_0_C5Jx2fr2c.html,https://images.clarin.com/2021/04/27/gpg-j78gq_720x0__1.jpg
63,TXpbvWTIK,Profilaxis. Buscan convivientes de personas con Covid para probar si una droga evita el contagio,https://www.clarin.com/buena-vida/buscan-convivientes-personas-coronavirus-probar-droga-evita-contagio_0_TXpbvWTIK.html,https://images.clarin.com/2021/04/28/B7A9FYTNJ_720x0__1.jpg
64,xBmk7yihu,"Empresas B. Cuatro historias de empresarios que le encontraron la vuelta a la ""sustentabilidad""",https://www.clarin.com/economia/historias-empresarios-encontraron-vuelta-economica-sustentabilidad_0_xBmk7yihu.html,https://images.clarin.com/2019/09/29/mts4BzKJ_720x0__1.jpg
65,1ODCDhH9A,"Basado en hechos reales. La historia oculta de ""los seis chinos del Titanic"" sale a la luz un siglo después",https://www.clarin.com/mundo/historia-oculta-chinos-titanic-sale-luz-siglo-despues_0_1ODCDhH9A.html,https://images.clarin.com/2021/04/28/1kaSUg3rS_720x0__1.jpg
66,Jp6jicqo4,Con acento argentino. Día Internacional del Jazz: tres generaciones y una misma pasión,https://www.clarin.com/espectaculos/musica/dia-internacional-jazz-generaciones-misma-pasion-compartida_0_Jp6jicqo4.html,https://images.clarin.com/2021/04/28/pa0BzK4SL_720x0__1.jpg
67,L1vr0RRyq,"Cumpliría 85 años. Alejandra Pizarnik, la poeta ""maldita"" que fue a lo más hondo",https://www.clarin.com/cultura/alejandra-pizarnik-cumpliria-85-anos-poeta-maldita-hondo_0_L1vr0RRyq.html,https://images.clarin.com/2020/06/16/W5oQ90JVg_1256x620__2.jpg#1619691106501
68,S-B0BvZj4,"Andre Agassi y sus anécdotas increíbles. El primer cheque, un padre maltratador y el mito de la final que jugó con peluca",https://www.clarin.com/deportes/tenis/andre-agassi-primer-cheque-padre-maltratador-mito-final-roland-garros-jugo-peluca_0_S-B0BvZj4.html,https://images.clarin.com/2021/04/29/DuOmxc7Mn_720x0__1.jpg
69,zppSoDMR4,Belleza. Un siglo de Chanel N° 5: secretos del perfume más vendido de la historia,https://www.clarin.com/viva/siglo-chanel-n-5-secretos-perfume-vendido-historia_0_zppSoDMR4.html,https://images.clarin.com/2021/04/28/Ct_yV4-98_720x0__1.jpg
70,-89gYL7pJ,Tendencias. El fenómeno del turismo rural: qué elige la gente,https://www.clarin.com/viajes/fenomeno-turismo-rural-elige-gente_0_-89gYL7pJ.html,https://images.clarin.com/2021/02/08/kW9lKpxqM_720x0__1.jpg
71,C5Jx2fr2c,"Turismo. Prosperidad y abandono: Hashima, la isla fantasma de Japón",https://www.clarin.com/viajes/prosperidad-abandono-hashima-isla-fantasma-japon_0_C5Jx2fr2c.html,https://images.clarin.com/2021/04/27/gpg-j78gq_720x0__1.jpg
72,TXpbvWTIK,Profilaxis. Buscan convivientes de personas con Covid para probar si una droga evita el contagio,https://www.clarin.com/buena-vida/buscan-convivientes-personas-coronavirus-probar-droga-evita-contagio_0_TXpbvWTIK.html,https://images.clarin.com/2021/04/28/B7A9FYTNJ_720x0__1.jpg
73,xBmk7yihu,"Empresas B. Cuatro historias de empresarios que le encontraron la vuelta a la ""sustentabilidad""",https://www.clarin.com/economia/historias-empresarios-encontraron-vuelta-economica-sustentabilidad_0_xBmk7yihu.html,https://images.clarin.com/2019/09/29/mts4BzKJ_720x0__1.jpg
74,1ODCDhH9A,"Basado en hechos reales. La historia oculta de ""los seis chinos del Titanic"" sale a la luz un siglo después",https://www.clarin.com/mundo/historia-oculta-chinos-titanic-sale-luz-siglo-despues_0_1ODCDhH9A.html,https://images.clarin.com/2021/04/28/1kaSUg3rS_720x0__1.jpg
75,Jp6jicqo4,Con acento argentino. Día Internacional del Jazz: tres generaciones y una misma pasión,https://www.clarin.com/espectaculos/musica/dia-internacional-jazz-generaciones-misma-pasion-compartida_0_Jp6jicqo4.html,https://images.clarin.com/2021/04/28/pa0BzK4SL_720x0__1.jpg
76,L1vr0RRyq,"Cumpliría 85 años. Alejandra Pizarnik, la poeta ""maldita"" que fue a lo más hondo",https://www.clarin.com/cultura/alejandra-pizarnik-cumpliria-85-anos-poeta-maldita-hondo_0_L1vr0RRyq.html,https://images.clarin.com/2020/06/16/W5oQ90JVg_1256x620__2.jpg#1619691106501
