n,id,title,url,image
1,GpZZwAWVO,"Habló de ""un momento crítico"". El Gobierno no sabe cuándo llegarán nuevas vacunas y Vizzotti pide salir ""solo a trabajar""",https://www.clarin.com/politica/coronavirus-carla-vizzotti-momento-critico-salgan-trabajar_0_GpZZwAWVO.html,https://images.clarin.com/2021/04/06/ByeR50PwR_720x0__1.jpg
2,9Czi4dyZ8,Mucha preocupación. En Provincia ya anticipan que antes del fin de semana habría nuevas restricciones,https://www.clarin.com/politica/segunda-ola-coronavirus-provincia-anticipan-fin-semana-nuevas-restricciones_0_9Czi4dyZ8.html,https://images.clarin.com/2019/12/09/HVzyOZZ1_720x0__1.jpg
3,17xWixfqp,"Ante el aumento de casos. Nación y Ciudad piden usar barbijo en las casas, incluso con quienes se convive",https://www.clarin.com/sociedad/nacion-ciudad-recomiendan-usar-barbijo-casas-incluso-convive_0_17xWixfqp.html,https://images.clarin.com/2021/02/22/z_6VDk2og_1256x620__2.jpg#1618408945690
4,EOass7nU9,En todo el país. La ANMAT autorizó la venta libre en farmacias del test rápido de coronavirus,https://www.clarin.com/sociedad/anmat-autorizo-venta-libre-farmacias-test-rapido-coronavirus_0_EOass7nU9.html,https://images.clarin.com/2021/02/11/_Glr73oO3_720x0__1.jpg
5,th-OoTzfh,Ensayos de vacunas. El país es uno de los que más voluntarios aportó pero menos contratos cerró,https://www.clarin.com/sociedad/coronavirus-argentina-pais-region-ensayos-vacunas-contratos-cerro_0_th-OoTzfh.html,https://images.clarin.com/2021/04/01/KQcty7POd_1256x620__2.jpg#1618105151107
6,DmhknuMpq,"Tenía 82 años. Murió Bernie Madoff, el autor de la mayor estafa piramidal de la historia",https://www.clarin.com/mundo/82-anos-fallecio-prision-bernie-madoff_0_DmhknuMpq.html,https://images.clarin.com/2021/04/14/mgwmvE-Q1_1256x620__2.jpg#1618411654114
7,rGbDjzHzB,Restricciones y vacunas. España entra en la cuarta ola: ¿por qué?,https://www.clarin.com/mundo/pesar-emergencia-vacunacion-espana-entra-cuarta-ola-coronavirus-_0_rGbDjzHzB.html,https://images.clarin.com/2021/03/28/6Thx1OI5c_1256x620__2.jpg#1618396992718
8,pNeIT-Vq3,Por primera vez. Miden la fórmula Máximo-Massa (y al revés) para la Presidencia: los números,https://www.clarin.com/politica/encuesta-midio-formulas-presidenciales-2023-grieta-jose-luis-espert-javier-milei_0_pNeIT-Vq3.html,https://images.clarin.com/2021/03/27/MUW8o07xw_720x0__1.jpg
9,PTcP509JY,"En redes. Bullrich, dura con De Pedro: ""Devolvé la plata, las vacunas y la dignidad""",https://www.clarin.com/politica/patricia-bullrich-dura-wado-pedro-devolve-plata-vacunas-dignidad-_0_PTcP509JY.html,https://images.clarin.com/2018/11/01/g4TRb_cEZ_720x0__1.jpg
10,bE2SZyBrs,"Precios Cuidados. Las 10 ""gangas"" del nuevo listado para ahorrar hasta un 60% en el súper",https://www.clarin.com/servicios/precios-cuidados-10-gangas-nuevo-listado-ahorrar-60-super_0_bE2SZyBrs.html,https://images.clarin.com/2021/02/03/UHIv5SKiz_720x0__1.jpg
11,FbGcuI55-,Especial Clarín. Viaje a una obra de arte: así se hace un mural de 65 metros de altura,https://www.clarin.com/cultura/martin-ron-muralismo-muralista-arte_0_FbGcuI55-.html,https://images.clarin.com/2021/04/07/arhw6r0s4_720x0__1.jpg
12,6OPxcYRBj,"Coronavirus. Así es ""el milagro de los siete minutos"", el secreto de la limpieza en Japón",https://www.clarin.com/mundo/coronavirus-milagro-minutos-secreto-limpieza-japon_0_6OPxcYRBj.html,https://images.clarin.com/2020/07/03/CqWTtQYod_1256x620__2.jpg#1618403182796
13,AncmMJN2h,En pandemia. El consumo excesivo de alcohol aumentó. Cómo bajarlo,https://www.clarin.com/new-york-times-international-weekly/consumo-excesivo-alcohol-aumento-pandemia-hacer-reducirlo_0_AncmMJN2h.html,https://images.clarin.com/2021/04/13/jbXtXwa5Q_720x0__1.jpg
14,H0T3_h-Cv,Modern Love. ¡Mi ridículo sistema de citas sí funciona!,https://www.clarin.com/new-york-times-international-weekly/modern-love-ridiculo-sistema-citas-funciona-_0_H0T3_h-Cv.html,https://images.clarin.com/2021/04/13/kVgrCnVFB_720x0__1.jpg
15,GpZZwAWVO,"Habló de ""un momento crítico"". El Gobierno no sabe cuándo llegarán nuevas vacunas y Vizzotti pide salir ""solo a trabajar""",https://www.clarin.com/politica/coronavirus-carla-vizzotti-momento-critico-salgan-trabajar_0_GpZZwAWVO.html,https://images.clarin.com/2021/04/06/ByeR50PwR_720x0__1.jpg
16,9Czi4dyZ8,Mucha preocupación. En Provincia ya anticipan que antes del fin de semana habría nuevas restricciones,https://www.clarin.com/politica/segunda-ola-coronavirus-provincia-anticipan-fin-semana-nuevas-restricciones_0_9Czi4dyZ8.html,https://images.clarin.com/2019/12/09/HVzyOZZ1_720x0__1.jpg
17,17xWixfqp,"Ante el aumento de casos. Nación y Ciudad piden usar barbijo en las casas, incluso con quienes se convive",https://www.clarin.com/sociedad/nacion-ciudad-recomiendan-usar-barbijo-casas-incluso-convive_0_17xWixfqp.html,https://images.clarin.com/2021/02/22/z_6VDk2og_1256x620__2.jpg#1618408945690
18,EOass7nU9,En todo el país. La ANMAT autorizó la venta libre en farmacias del test rápido de coronavirus,https://www.clarin.com/sociedad/anmat-autorizo-venta-libre-farmacias-test-rapido-coronavirus_0_EOass7nU9.html,https://images.clarin.com/2021/02/11/_Glr73oO3_720x0__1.jpg
19,th-OoTzfh,Ensayos de vacunas. El país es uno de los que más voluntarios aportó pero menos contratos cerró,https://www.clarin.com/sociedad/coronavirus-argentina-pais-region-ensayos-vacunas-contratos-cerro_0_th-OoTzfh.html,https://images.clarin.com/2021/04/01/KQcty7POd_1256x620__2.jpg#1618105151107
20,DmhknuMpq,"Tenía 82 años. Murió Bernie Madoff, el autor de la mayor estafa piramidal de la historia",https://www.clarin.com/mundo/82-anos-fallecio-prision-bernie-madoff_0_DmhknuMpq.html,https://images.clarin.com/2021/04/14/mgwmvE-Q1_1256x620__2.jpg#1618411654114
21,rGbDjzHzB,Restricciones y vacunas. España entra en la cuarta ola: ¿por qué?,https://www.clarin.com/mundo/pesar-emergencia-vacunacion-espana-entra-cuarta-ola-coronavirus-_0_rGbDjzHzB.html,https://images.clarin.com/2021/03/28/6Thx1OI5c_1256x620__2.jpg#1618396992718
22,rd0zb1Nc5,Masters 1000. Para el Peque Schwartzman fue debut y despedida en Montecarlo,https://www.clarin.com/deportes/tenis/schwartzman-ruud-montecarlo_0_rd0zb1Nc5.html,https://images.clarin.com/2021/04/14/-07KbTmS-_720x0__1.jpg
23,SbKpBIJ-x,"Polémica. Llega el VAR al fútbol argentino, la única liga importante que todavía no lo adoptó",https://www.clarin.com/deportes/llega-var-futbol-argentino-unica-liga-importante-todavia-adopto-_0_SbKpBIJ-x.html,https://images.clarin.com/2021/04/13/2uVJKM7r2_720x0__1.jpg
24,bHSkKVjr9,Champions League. Pochettino: aquel pibe de Murphy que hoy quiere que París sea una fiesta,https://www.clarin.com/deportes/futbol-internacional/mauricio-pochettino-pibe-murphy-hoy-quiere-paris-fiesta_0_bHSkKVjr9.html,https://images.clarin.com/2021/04/13/XQhq_CI0j_1256x620__2.jpg#1618401994341
25,Wcupy94lp,Empató en Brasilia. San Lorenzo no pudo con Santos y ahora jugará la Copa Sudamericana,https://www.clarin.com/deportes/santos-vs-san-lorenzo-copa-libertadores-previa-alineaciones-directo_0_Wcupy94lp.html,https://images.clarin.com/2021/04/13/mnLBm6956_720x0__1.jpg
26,xq71KNJNl,"Ya piensa en Boca. Holan, cuestionado por la formación contra San Lorenzo",https://www.clarin.com/deportes/futbol-internacional/holan-santos-libertadores-grupo-boca_0_xq71KNJNl.html,https://images.clarin.com/2021/04/14/molAKrpBk_720x0__1.jpg
27,NvFQgRExI,"Despliegue y gol. Del ADN de Montiel a la zurda de Angileri: los laterales, las armas letales de River",https://www.clarin.com/deportes/adn-montiel-zurda-angileri-laterales-armas-letales-river-gallardo_0_NvFQgRExI.html,https://images.clarin.com/2021/01/27/mwKqZEW_B_720x0__1.jpg
28,gEuWFq9k1,Neymar. La canchereada contra Kimmich y una comparación machista,https://www.clarin.com/deportes/festejo-neymar-canchereada-kimmich-comparacion-machista-levanto-criticas_0_gEuWFq9k1.html,https://images.clarin.com/2021/04/14/D142dJYuE_720x0__1.jpg
29,KSpvUHJAd,Durísima sanción. Suspendieron de por vida a un tenista argentino por arreglo de partidos,https://www.clarin.com/deportes/suspendieron-vida-tenista-argentino-arreglo-partidos_0_KSpvUHJAd.html,https://images.clarin.com/2021/04/13/pZDMC8nL9_1256x620__2.jpg#1618325218827
30,HAzmhyIFH,Escenario alarmante. Vacunas y terapia intensiva: respuestas a las 10 preguntas de la segunda ola ,https://www.clarin.com/sociedad/segunda-ola-covid-pocas-vacunas-contagios-curva-angustia-10-preguntas_0_HAzmhyIFH.html,https://images.clarin.com/2021/04/13/HbzT_6vMR_720x0__1.jpg
31,2QLUqktOe,Registro oficial. Alquileres: vence el plazo para registrar los contratos en la AFIP,https://www.clarin.com/economia/alquileres-vence-plazo-registrar-contratos-afip_0_2QLUqktOe.html,https://images.clarin.com/2020/06/22/0H4tKdqKy_720x0__1.jpg
32,z0saz2ZiN,Ataque a una comisaría. Medio siglo de cárcel: jura que es inocente y que se llama igual que el verdadero culpable,https://www.clarin.com/policiales/condenaron-50-anos-ataque-comisaria-jura-inocente-llama-igual-verdadero-culpable_0_z0saz2ZiN.html,https://images.clarin.com/2021/04/14/vv5LdglTh_720x0__1.jpg
33,qGKdc-ZXm,Caos de tránsito. Otro día de protestas en la Ciudad pese a la crisis sanitaria por el coronavirus,https://www.clarin.com/ciudades/dia-protestas-ciudad-pese-crisis-sanitaria-coronavirus_0_qGKdc-ZXm.html,https://images.clarin.com/2021/04/14/zR5imUqim_720x0__1.jpg
34,cDCu8YkQ-,"Criptomonedas. Con un nuevo récord del Bitcoin, debuta la mayor plataforma de cripto en el Nasdaq",https://www.clarin.com/economia/nuevo-record-bitcoin-debuta-mayor-plataforma-cripto-nasdaq_0_cDCu8YkQ-.html,https://images.clarin.com/2021/04/14/-lpi7FEyQ_720x0__1.jpg
35,afKRNV850,Gira por Europa. Guzmán se reunió con el Papa en el Vaticano para hablar de la deuda,https://www.clarin.com/economia/martin-guzman-reunio-papa-francisco-vaticano-hablar-deuda_0_afKRNV850.html,https://images.clarin.com/2021/04/14/6PWdxNOzk_720x0__1.jpg
36,-Jky4cunz,Gratuita. Ya está abierta la inscripción para CEBAR 2021,https://www.clarin.com/brandstudio/abierta-inscripcion-cebar-2021_0_-Jky4cunz.html,https://images.clarin.com/2021/04/07/p-NvQgRSJ_720x0__1.jpg
37,0Ja1jLUri,"Historia. Venecia, la joya de Italia, cumple 1.600 años en soledad",https://www.clarin.com/mundo/turistas-luchando-inundaciones-venecia-cumple-1-600-anos_0_0Ja1jLUri.html,https://images.clarin.com/2021/04/05/z_7QrCD3k_720x0__1.jpg
38,UGqXNYNOg,Actividad física. Ejercicio y salud mental: la paradoja de la pandemia y consejos para superarla,https://www.clarin.com/buena-vida/ejercicio-salud-mental-paradoja-pandemia-consejos-superarla_0_UGqXNYNOg.html,https://images.clarin.com/2021/02/05/V1-Hrvr1M_720x0__1.jpg
39,q6qgfbJvL,"Turismo. Antiguos túneles y gastronomía en altura, propuestas para disfrutar en la Ciudad",https://www.clarin.com/viajes/antiguos-tuneles-gastronomia-altura-propuestas-disfrutar-ciudad-buenos-aires_0_q6qgfbJvL.html,https://images.clarin.com/2021/04/01/9ATithSiJ_720x0__1.jpg
40,DSjuSSaMV,Cristales energéticos. ¿Cuándo una piedra se transforma en vehículo de energía?,https://www.clarin.com/astrologia/cristales-energeticos-piedra-transforma-vehiculo-energia-_0_DSjuSSaMV.html,https://images.clarin.com/2021/04/13/SfEKJw1kos_720x0__1.jpg
41,mOsOOryVb,Hallazgo y mejoras. Ven el momento exacto de pérdida de conciencia durante la anestesia,https://www.clarin.com/buena-vida/ven-imagenes-momento-exacto-perdida-conciencia-anestesia_0_mOsOOryVb.html,https://images.clarin.com/2021/04/14/kDI-heYoy_720x0__1.jpg
42,d3xhBBTsE,"Para conocer. Escapadas: Altamira, el pueblo en el que tiempo pasa más lento",https://www.clarin.com/viajes/escapadas-altamira-pueblo-tiempo-pasa-lento_0_d3xhBBTsE.html,https://images.clarin.com/2021/04/13/IY49evjiu_720x0__1.jpg
43,Nt8Hxut52,Pareja. Cómo olvidar de una vez por todas a tu ex,https://www.clarin.com/relaciones/olvidar-vez-todas-ex_0_Nt8Hxut52.html,https://images.clarin.com/2021/04/13/2jyBVYJFv_720x0__1.jpg
44,fIFWGS2dn,Empresas. Soluciones flexibles para un nuevo nivel en comunicación y gestión,https://www.clarin.com/brandstudio/soluciones-flexibles-mejorar-empresa-acceder-nuevo-nivel-comunicacion-gestion_0_fIFWGS2dn.html,https://images.clarin.com/2021/03/23/w_tsthIau_720x0__1.jpg
45,XM4NmtMgh,"Histórico. Sale un video inédito de Lennon ensayando ""Give Peace a Chance""",https://www.clarin.com/viste/sale-luz-video-inedito-john-lennon-ensayando-give-peace-chance-_0_XM4NmtMgh.html,https://images.clarin.com/2021/04/14/_iVxB89Yb_720x0__1.jpg
46,gzEnxvuFF,En España. La asombrosa carta del director de un colegio a los padres de los alumnos,https://www.clarin.com/internacional/asombrosa-carta-director-colegio-padres-alumnos-sacan-buenas-notas-quiten-confianza-_0_gzEnxvuFF.html,https://images.clarin.com/2021/04/13/_7RdEh7oO_720x0__1.jpg
47,NARA_NEcO,"70 años. Personajes inolvidables de la TV: Pipo Mancera, el dueño del rating",https://www.clarin.com/espectaculos/tv/personajes-inolvidables-70-anos-tv-pipo-mancera--dueno-rating-60_0_NARA_NEcO.html,https://images.clarin.com/2011/08/29/ryr4qWkEe_720x0.jpg
48,7PbXg9dFo,"Italia. En plena misa, un cura confesó ""estar enamorado"" y cuelga los hábitos",https://www.clarin.com/internacional/misa-frente-fieles-cura-confeso-enamorado-cuelga-habitos_0_7PbXg9dFo.html,https://images.clarin.com/2021/04/13/jOhtfIJuq_720x0__1.jpg
49,GqKSa_DIv,Intriga. Una mujer compró un saco y en su interior encontró un terrorífico mensaje,https://www.clarin.com/viste/mujer-compro-saco-interior-encontro-terrorifico-mensaje_0_GqKSa_DIv.html,https://images.clarin.com/2021/04/13/bPf38ZCAz_720x0__1.jpg
50,4SvWAEeMj,Suiza. Acuñó la moneda más pequeña del mundo con Einstein sacando la lengua,https://www.clarin.com/viste/suiza-acuno-moneda-pequena-mundo-einstein-sacando-lengua_0_4SvWAEeMj.html,https://images.clarin.com/2021/04/13/BvW6gVYTY_720x0__1.jpg
51,gdOCSOLD7,El artículo 17. La llave que tienen los gobernadores para restringir y que Nación les recrimina no usar,https://www.clarin.com/politica/nacion-gobernadores-quieren-pagar-costo-nuevas-restricciones-demoran-definicion_0_gdOCSOLD7.html,https://images.clarin.com/2021/04/07/kaxgaB6Z8_1256x620__2.jpg#1618398119588
52,Q9-CZKgYN,Cambios en Ciudad. Larreta toca el Gabinete: un hombre de su confianza presidirá una fundación del Papa,https://www.clarin.com/politica/horacio-rodriguez-larreta-toca-gabinete-guino-roma-hombre-confianza-presidira-fundacion-papa_0_Q9-CZKgYN.html,https://images.clarin.com/2019/11/15/ws2B2-Lj_720x0__1.jpg
53,OK2U0EXNv,Interna opositora. No hubo acuerdo en Juntos por el Cambio por las PASO y seguirán discutiendo,https://www.clarin.com/politica/tension-juntos-cambio-acuerdo-paso-seguiran-discutiendo-responder-gobierno_0_OK2U0EXNv.html,https://images.clarin.com/2021/03/22/1YICQE4--_720x0__1.jpg
54,bvNQu2qy5,Discusión electoral. El bloque de Lavagna pide votar ahora la boleta única de papel para 2023,https://www.clarin.com/politica/lavagnismo-pide-wado-pedro-votar-ahora-implementacion-boleta-unica-papel-2023_0_bvNQu2qy5.html,https://images.clarin.com/2021/04/14/HM-uEfwLg_720x0__1.jpg
55,tpVdxYlP9,"En 16 meses. El Gobierno sumó un 52% más de planes de empleo, pero no logra frenar las protestas",https://www.clarin.com/politica/16-meses-gobierno-sumo-52-ciento-planes-empleo-logra-contener-protesta-social_0_tpVdxYlP9.html,https://images.clarin.com/2021/04/08/GQvWK09tA_720x0__1.jpg
56,XSxGYailV,Una chica de 24 años. La trama política detrás de otra vacunación trucha,https://www.clarin.com/politica/trama-politica-detras-vacunacion-vip-joven-24-anos-merlo_0_XSxGYailV.html,https://images.clarin.com/2021/04/13/n16hhSeCB_1256x620__2.jpg#1618372339497
57,xHzCRKrK9,Pueden confundir. Cuáles son las alergias de otoño más comunes,https://www.clarin.com/buena-vida/cuales-son-las-alergias-de-otono-mas-comunes_0_xHzCRKrK9.html,https://images.clarin.com/2017/10/03/BknBpL-nZ_720x0.jpg
58,bmoXpgqK7,Crece el escándalo. Hallan más vacunos robados en el campo de Alperovich,https://www.clarin.com/rural/encuentran-vacunos-robados-campo-senador-jose-alperovich-suman-momento-267-animales_0_bmoXpgqK7.html,https://images.clarin.com/2021/04/12/G1idgcjZP_720x0__1.jpg
59,F05sI0XvS,"Series y escritores. Violencia, corrupción y... talento:  qué busca (y encuentra) Netflix en la Argentina",https://www.clarin.com/historias/violencia--corrupcion-talento--busca-encuentra-netflix-argentina_0_F05sI0XvS.html,https://images.clarin.com/2021/04/13/GZek4-yIA_720x0__1.jpg
60,YbYZbAzKP,La muerte de Felipe. Isabel II retoma sus actividades y se sentará sola durante el funeral,https://www.clarin.com/mundo/muerte-principe-felipe-isabel-ii-retoma-actividades-sentara-sola-funeral_0_YbYZbAzKP.html,https://images.clarin.com/2021/04/14/u73xK3fEy_1256x620__2.jpg#1618409522864
61,v0Y2oygf0,Valores Religiosos. El día que San José se quiso divorciar de la Virgen María,https://www.clarin.com/sociedad/dia-san-jose-quiso-divorciar-virgen-maria_0_v0Y2oygf0.html,https://images.clarin.com/2021/04/14/M3IoqWF23_720x0__1.jpg
62,JqLPkVw07,Gaming. PlayStation 5 recibe su primera gran actualización: todos los detalles,https://www.clarin.com/tecnologia/playstation-5-recibe-primera-gran-actualizacion-detalles_0_JqLPkVw07.html,https://images.clarin.com/2021/02/24/gjNPuhuTj_720x0__1.jpg
63,m05Ubb_iP,Mirá el video. La increíble casa rodante de medio millón de dólares con dos baños,https://www.clarin.com/autos/video-increible-casa-rodante-medio-millon-dolares-banos-sotano_0_m05Ubb_iP.html,https://images.clarin.com/2021/04/13/269uvakl0_720x0__1.jpg
64,LwTnEi5e8,Finanzas personales. Ahorrar o invertir: qué conviene más para hacer rendir el dinero,https://www.clarin.com/servicios/ahorrar-invertir-conveniente-hacer-rendir-dinero_0_LwTnEi5e8.html,https://images.clarin.com/2018/12/10/awW8a6XhU_720x0__1.jpg
65,LAFRRk4_R,Ciberseguridad. La letra chica de las apps de Android: por qué es riesgoso aceptar todos los permisos,https://www.clarin.com/tecnologia/letra-chica-apps-android-riesgoso-aceptar-permisos_0_LAFRRk4_R.html,https://images.clarin.com/2021/02/24/ksi_R6i8-_720x0__1.jpg
66,dkWC9u3yt,Estreno. Mortal Kombat: a pura sangre y violencia,https://www.clarin.com/espectaculos/cine/mortal-kombat-pura-sangre-violencia_0_dkWC9u3yt.html,https://images.clarin.com/2021/04/09/AGgvvUZhW_720x0__1.jpg
67,rGq3cGt79,17 de abril. Se viene el primer festival virtual de América,https://www.clarin.com/brandstudio/viene-primer-festival-virtual-america_0_rGq3cGt79.html,https://images.clarin.com/2021/04/13/bCVMQM41E_1256x620__2.jpg#1618342226195
68,F05sI0XvS,"Series y escritores. Violencia, corrupción y... talento:  qué busca (y encuentra) Netflix en la Argentina",https://www.clarin.com/historias/violencia--corrupcion-talento--busca-encuentra-netflix-argentina_0_F05sI0XvS.html,https://images.clarin.com/2021/04/13/GZek4-yIA_720x0__1.jpg
69,YbYZbAzKP,La muerte de Felipe. Isabel II retoma sus actividades y se sentará sola durante el funeral,https://www.clarin.com/mundo/muerte-principe-felipe-isabel-ii-retoma-actividades-sentara-sola-funeral_0_YbYZbAzKP.html,https://images.clarin.com/2021/04/14/u73xK3fEy_1256x620__2.jpg#1618409522864
70,v0Y2oygf0,Valores Religiosos. El día que San José se quiso divorciar de la Virgen María,https://www.clarin.com/sociedad/dia-san-jose-quiso-divorciar-virgen-maria_0_v0Y2oygf0.html,https://images.clarin.com/2021/04/14/M3IoqWF23_720x0__1.jpg
71,JqLPkVw07,Gaming. PlayStation 5 recibe su primera gran actualización: todos los detalles,https://www.clarin.com/tecnologia/playstation-5-recibe-primera-gran-actualizacion-detalles_0_JqLPkVw07.html,https://images.clarin.com/2021/02/24/gjNPuhuTj_720x0__1.jpg
72,m05Ubb_iP,Mirá el video. La increíble casa rodante de medio millón de dólares con dos baños,https://www.clarin.com/autos/video-increible-casa-rodante-medio-millon-dolares-banos-sotano_0_m05Ubb_iP.html,https://images.clarin.com/2021/04/13/269uvakl0_720x0__1.jpg
73,LwTnEi5e8,Finanzas personales. Ahorrar o invertir: qué conviene más para hacer rendir el dinero,https://www.clarin.com/servicios/ahorrar-invertir-conveniente-hacer-rendir-dinero_0_LwTnEi5e8.html,https://images.clarin.com/2018/12/10/awW8a6XhU_720x0__1.jpg
74,LAFRRk4_R,Ciberseguridad. La letra chica de las apps de Android: por qué es riesgoso aceptar todos los permisos,https://www.clarin.com/tecnologia/letra-chica-apps-android-riesgoso-aceptar-permisos_0_LAFRRk4_R.html,https://images.clarin.com/2021/02/24/ksi_R6i8-_720x0__1.jpg
75,dkWC9u3yt,Estreno. Mortal Kombat: a pura sangre y violencia,https://www.clarin.com/espectaculos/cine/mortal-kombat-pura-sangre-violencia_0_dkWC9u3yt.html,https://images.clarin.com/2021/04/09/AGgvvUZhW_720x0__1.jpg
76,rGq3cGt79,17 de abril. Se viene el primer festival virtual de América,https://www.clarin.com/brandstudio/viene-primer-festival-virtual-america_0_rGq3cGt79.html,https://images.clarin.com/2021/04/13/bCVMQM41E_1256x620__2.jpg#1618342226195
