n,id,title,url,image
1,rdMv2ikkCj,"Vencen US$ 1.100 millones. Dos dirigentes cercanos a Cristina ya hablan de no acordar con el FMI: ""El default no es el peor de los remedios""",https://www.clarin.com/politica/dirigentes-cercanos-cristina-kirchner-hablan-acordar-fmi-default-peor-remedios-_0_rdMv2ikkCj.html,https://images.clarin.com/2020/10/05/J1lGJg7Q__720x0__1.jpg
2,e3ej1s4zfa,Mercados financieros. El dólar blue llega a $ 220 y marca un nuevo récord histórico,https://www.clarin.com/economia/dolar-blue-llega-220-marca-nuevo-record-historico_0_e3ej1s4zfa.html,https://images.clarin.com/2021/03/22/VosNxnRmN_720x0__1.jpg
3,1LpLsVJdXC,"Tenía 47 años. Quién era Federico Mazzoni, el cordobés asesinado en Playa del Carmen",https://www.clarin.com/sociedad/federico-mazzoni-cordobes-asesinado-bar-playa-carmen_0_1LpLsVJdXC.html,https://images.clarin.com/2022/01/26/HZHeKhOZj_720x0__1.jpg
4,1EMxPyU6MQ,"¿Ataque sicario?. La hermana del argentino asesinado: ""Su jefe denunció algo que no debía""",https://www.clarin.com/sociedad/hablo-hermana-argentino-asesinado-playa-carmen-apunto-narcos-policias-jefe-denuncio-debia-_0_1EMxPyU6MQ.html,https://images.clarin.com/2022/01/26/ApvMBSO-N_720x0__1.jpg
5,GJDYnkMSQt,Crédito ultra subsidiado. Aires y heladeras en 30 cuotas: qué se consigue a días de que venza el plan oficial,https://www.clarin.com/servicios/aires-heladeras-30-cuotas-consigue-dias-venza-plan-oficial_0_GJDYnkMSQt.html,https://images.clarin.com/2022/01/25/kNWOi3ikA_720x0__1.jpg
6,Eh8zlQE93b,Media y larga distancia. Provincia: desde mañana exigirán pase sanitario para viajar en micro,https://www.clarin.com/sociedad/provincia-manana-exigiran-pase-sanitario-viajar-micro_0_Eh8zlQE93b.html,https://images.clarin.com/2019/01/22/Em2-NWTAj_720x0__1.jpg
7,1KV794Dgxx,"Del editor al lector. Ricardo Alfonsín y Polak, cara y ceca de la política argentina en la embajada de Madrid",https://www.clarin.com/opinion/ricardo-alfonsin-polak-cara-ceca-politica-argentina-embajada-madrid_0_1KV794Dgxx.html,https://images.clarin.com/2022/01/26/Ae1bZH5AD_720x0__1.jpg
8,8su6VnFfTf,Tenía 6 años. Qué reveló la autopsia a la nena que fue al hospital por un raspón y murió,https://www.clarin.com/sociedad/revelo-autopsia-nena-6-anos-hospital-raspon-murio_0_8su6VnFfTf.html,https://images.clarin.com/2022/01/20/TQIP-fhN6_720x0__1.jpg
9,RM5kZumzjT,Comercio electrónico. Mercado Libre y una medida drástica para frenar la venta de iPhone truchos,https://www.clarin.com/tecnologia/mercado-libre-medida-drastica-frenar-venta-iphone-truchos-falsos-productos-apple_0_RM5kZumzjT.html,https://images.clarin.com/2022/01/25/eHB6fUSO__720x0__1.jpg
10,j2DHfGhun6,Crisis en Ucrania. Rusia lanza grandes maniobras en el mar Negro con más de 20 barcos,https://www.clarin.com/mundo/crisis-ucrania-rusia-lanza-grandes-maniobras-mar-negro-20-barcos_0_j2DHfGhun6.html,https://images.clarin.com/2022/01/26/GxxcRYyXa_1256x620__2.jpg#1643202602892
11,Nf1TH6prJI,Murió en 2020. Kobe Bryant: la herencia y el conflicto que separó a su viuda de su propia madre,https://www.clarin.com/deportes/anos-muerte-kobe-bryant-millonaria-herencia-conflicto-separo-viuda-propia-madre_0_Nf1TH6prJI.html,https://images.clarin.com/2022/01/25/fMfLlyNE8_720x0__1.jpg
12,PXExhdZd2D,"Mercado europeo. Juventus le ofrece una renovación a ""la baja"" a Paulo Dybala y crece el conflicto",https://www.clarin.com/deportes/dybala-juventus-futuro-oferta-inferior_0_PXExhdZd2D.html,https://images.clarin.com/2022/01/26/v3uri4Ldz_720x0__1.jpg
13,bYUTGsE2Ux,"Polémica frase de Infantino. ""Debemos dar esperanza a los africanos para que no tengan que cruzar el Mediterráneo""",https://www.clarin.com/deportes/desagradable-frase-gianni-infantino-dar-esperanza-africanos-cruzar-mediterraneo-_0_bYUTGsE2Ux.html,https://images.clarin.com/2022/01/26/ecqjmfQJX_720x0__1.jpg
14,32VBhGItUA,La pandemia. Aislados en la misma casa: 8 claves para convivir con un caso positivo,https://www.clarin.com/sociedad/aislados-misma-casa-8-claves-convivir-caso-covid-positivo-evitar-contagiarse_0_32VBhGItUA.html,https://images.clarin.com/2022/01/25/RZgg16u3Y_1256x620__2.jpg#1643157060925
15,MwB0mCUNsy,Nuevo criterio. Covid: qué provincias testean sólo a mayores de 60 y a grupos de riesgo,https://www.clarin.com/sociedad/nuevo-criterio-casos-positivos-covid-provincias-testean-solo-mayores-60-grupos-riesgo_0_MwB0mCUNsy.html,https://images.clarin.com/2022/01/20/LTy55Tc1R_1256x620__2.jpg#1643153357766
16,N7bQ7c7i8s,"Misterio en Corrientes. Norma, la mujer que vivió dos años con el cadáver de su madre en una cama",https://www.clarin.com/sociedad/misterio-norma-mujer-vivio-anos-cadaver-madre-cama_0_N7bQ7c7i8s.html,https://images.clarin.com/2022/01/25/xG5wDPn0I_1256x620__2.jpg#1643132118063
17,wLQwBFIhVC,Denuncia amenazas. La esposa del carnicero asesinado en un súper chino negó que haya sido un robo,https://www.clarin.com/policiales/mujer-carnicero-asesinado-supermercado-chino-nego-robo-denuncia-amenazas_0_wLQwBFIhVC.html,https://images.clarin.com/2022/01/26/LpsePdt6a_720x0__1.jpg
18,J7Vj6guBKa,Estrena su reality. Georgina Rodríguez y la intimidad de su vida junto a Cristiano Ronaldo,https://www.clarin.com/deportes/georgina-rodriguez-intimidad-vida-junto-cristiano-ronaldo-tarde-medio-ano-ubicarme-casa-_0_J7Vj6guBKa.html,https://images.clarin.com/2021/07/06/nFdiqDhKs_720x0__1.jpg
19,mn7mWvCNPU,Especial Clarín. Tensión en Ucrania: ¿es posible una guerra entre Rusia y Estados Unidos?,https://www.clarin.com/mundo/tension-baltico-posible-desate-guerra-rusia-ucrania-_0_mn7mWvCNPU.html,https://images.clarin.com/2022/01/21/OFwRbM7SD_720x0__1.jpg
20,AEZicEljM8,Guía paso a paso. Cortes de luz: cómo pedir el resarcimiento económico a Edenor y Edesur,https://www.clarin.com/servicios/cortes-luz-pedir-resarcimiento-economico-edenor-edesur_0_AEZicEljM8.html,https://images.clarin.com/2016/02/18/Hkgc-PyJ4e_720x0.jpg
21,awlT7rbDtS,Sexualidad. King out: cuando la penetración está prohibida,https://www.clarin.com/relaciones/king-out-penetracion-prohibida_0_awlT7rbDtS.html,https://images.clarin.com/2022/01/25/Lj25f69kx_720x0__1.jpg
22,sMfgU6yUcD,"Personaje. Zorrito Von Quintiero: ""Soy un custodio de la obra solista de Charly""",https://www.clarin.com/viva/zorrito-von-quintiero-custodio-obra-solista-charly-_0_sMfgU6yUcD.html,https://images.clarin.com/2020/03/27/Cnz06z7X4_720x0__1.jpg
23,ekhdUIzx2H,Psicología. ¿Es real que el tiempo lo cura todo? 4 actitudes que podés tomar frente al dolor,https://www.clarin.com/buena-vida/-real-tiempo-cura-4-actitudes-podes-tomar-frente-dolor_0_ekhdUIzx2H.html,https://images.clarin.com/2022/01/26/M1zF1OXtM_720x0__1.jpg
24,mdWVLtxtUS,"Diálogo entre dos referentes. Rosa Montero y Emmanuel Carrère: cómo escribir una realidad ""poco fiable""",https://www.clarin.com/cultura/rosa-montero-emmanuel-carrere-charla-literatura-mestiza-siglo-xxi_0_mdWVLtxtUS.html,https://images.clarin.com/2022/01/25/VRBHP30Ae_720x0__1.jpg
25,gWU93nT1Ts,"Temporada 2022. Todas las fotos del verano en Mar del Plata, Pinamar y Punta del Este",https://www.clarin.com/fotogalerias/todas-fotos-verano-mar-plata-pinamar-punta-clarin_5_gWU93nT1Ts.html,
26,f2mpj0ZPKE,Historias visuales. Las imágenes más destacadas del día en Argentina y el mundo,https://www.clarin.com/fotogalerias/historias-visuales-dia-fotos-imagenes-destacadas-argentina-mundo_5_f2mpj0ZPKE.html,
27,HNs6ILWGW8,Conflicto fronterizo. Exportadores piden que Argentina y Chile se pongan de acuerdo para dejar pasar los camiones varados,https://www.clarin.com/economia/exportadores-piden-argentina-chile-pongan-acuerdo-dejar-pasar-camiones-varados_0_HNs6ILWGW8.html,https://images.clarin.com/2022/01/19/1wX7NdD4y_720x0__1.jpg
28,dIICePd4d2,Salarios 2022. Las empresas le ponen piso a la inflación y planean incrementos de hasta 51%,https://www.clarin.com/economia/salarios-2022-empresas-ponen-piso-inflacion-planean-incrementos-51-_0_dIICePd4d2.html,https://images.clarin.com/2021/11/24/JLxccO2Ok_720x0__1.jpg
29,Hf70izbmr8,"Consumo. Ahora 12: se renovaría el lunes, pero los bancos dudan sobre la tasa",https://www.clarin.com/economia/ahora-12-plan-cuotas-renovaria-lunes-bancos-dudan-tasa-interes_0_Hf70izbmr8.html,https://images.clarin.com/2021/09/16/4Rf-JKUnp_720x0__1.jpg
30,Bjx9LJSoyi,Prometen ganancias extraordinarias. Llueven estafas piramidales: avanzan las investigaciones y emiten alertas,https://www.clarin.com/economia/estafas-piramidales-hermetismo-avanzan-investigaciones-piden-gente-incauta-_0_Bjx9LJSoyi.html,https://images.clarin.com/2021/12/06/cKpZIi9_C_720x0__1.jpg
31,vwNN4nPPxS,"Informe regional. La inflación en América Latina, otra dolorosa secuela de la pandemia",https://www.clarin.com/mundo/inflacion-america-latina-dolorosa-secuela-pandemia-2021_0_vwNN4nPPxS.html,https://images.clarin.com/2022/01/12/a2cfL5P8p_720x0__1.jpg
32,blkf79KECs,"Tecnológicas. Satellogic debuta en el Nasdaq: podría ser el nuevo ""unicornio"" argentino",https://www.clarin.com/economia/satellogic-debuta-nasdaq-podria-convertirse-nuevo-unicornio-argentino_0_blkf79KECs.html,https://images.clarin.com/2020/08/29/0_-pRWKo7_720x0__1.jpg
33,3n25f92NWR,"Ideales para el verano. Licuados, jugos y smoothies saludables: recetas y consejos para prepararlos",https://www.clarin.com/gourmet/licuados-jugos-smoothies-saludables-recetas-consejos-prepararlos_0_3n25f92NWR.html,https://images.clarin.com/2017/12/28/ByrSwTGmf_1256x620__2.jpg#1643136963955
34,DfG0G7ANPw,Veterinaria y pediatría. Mascotas y bebés: qué hacer con nuestros animales ante la llegada de un hijo,https://www.clarin.com/familias/mascotas-bebes-hacer-animales-llegada-hijo_0_DfG0G7ANPw.html,https://images.clarin.com/2022/01/24/dHIkZJTsL_720x0__1.jpg
35,7ePhHiHlR9,"Redes sociales. Un estudio reveló la clave para tener más ""me gusta"" en las fotos de Instagram",https://www.clarin.com/tecnologia/estudio-revelo-clave-tener-gusta-fotos-instagram_0_7ePhHiHlR9.html,https://images.clarin.com/2018/10/10/udrIPiHry_720x0__1.jpg
36,NPFVsMsdjs,En Eslovaquia. El AirCar ya está habilitado como auto volador y dicen que puede viajar por toda Europa,https://www.clarin.com/autos/aircar-habilitado-auto-volador-dicen-puede-viajar-toda-europa_0_NPFVsMsdjs.html,https://images.clarin.com/2021/06/30/HXL2AG6PJ_720x0__1.jpg
37,1trwOw5rCA,Estudio. ¿Te preocupás demasiado? Así aumenta tu riesgo de enfermarte,https://www.clarin.com/buena-vida/-preocupas-demasiado-aumenta-riesgo-enfermarte_0_1trwOw5rCA.html,https://images.clarin.com/2022/01/25/3MFAJTM2E_720x0__1.jpg
38,prxwZnv-l,Vacaciones. 10 parques temáticos para divertirse en verano en el Partido de la Costa,https://www.clarin.com/viajes/10-parques-tematicos-divertirse-verano-partido-costa_0_prxwZnv-l.html,https://images.clarin.com/2022/01/12/QynM2eU1q_720x0__1.jpg
39,Apc5OIl8Ay,"Se llevaban 54 años. Ex conejita Playboy contó la ""asquerosa"" experiencia del sexo con Hugh Hefner",https://www.clarin.com/internacional/ex-conejita-playboy-conto-asquerosa-experiencia-tener-sexo-hugh-hefner-mecanico-robotico-_0_Apc5OIl8Ay.html,https://images.clarin.com/2022/01/25/ZV4aiNRBk_720x0__1.jpg
40,JtTaKaEGva,"Ver para creer. Video: un ""muerto"" vuelve a la vida y sale caminando de la morgue",https://www.clarin.com/internacional/video-muerto-vuelve-vida-sale-caminando-morgue_0_JtTaKaEGva.html,https://images.clarin.com/2022/01/25/EmURAiLbi_720x0__1.jpg
41,mpiL4Ih9ks,"Historias del crimen. ""Niño consentido"": el joven que masacró a sus padres y buscó fama en un reality",https://www.clarin.com/internacional/-nino-consentido-cyril-jaquet-merino-adolescente-masacro-padres-busco-fama-reality_0_mpiL4Ih9ks.html,https://images.clarin.com/2022/01/25/ZEVAkaHge_720x0__1.jpg
42,uOI08OypyV,"El ""Monje Loco"". Del culto sexual y las profecías al poder sanador: la inquietante vida de Rasputín",https://www.clarin.com/internacional/culto-sexual-profecias-poder-sanador-inquietante-historia-rasputin-monje-loco-_0_uOI08OypyV.html,https://images.clarin.com/2022/01/24/Gzj3LXTb3_1256x620__2.jpg#1643018092355
43,FNLyiOy2ps,Reino Unido. Se hizo una cirugía estética y lleva tres años sin poder cerrar los ojos,https://www.clarin.com/internacional/hizo-cirugia-estetica-lleva-anos-poder-cerrar-ojos_0_FNLyiOy2ps.html,https://images.clarin.com/2022/01/25/rj3rNx-Ak_720x0__1.jpg
44,RUBJx90dFC,Historia santa. La escalera de mármol que subió Jesús para su juicio con Poncio Pilato,https://www.clarin.com/viste/escalera-marmol-subio-jesus-juicio-poncio-pilato_0_RUBJx90dFC.html,https://images.clarin.com/2019/04/11/KLSRAqd45_720x0__1.jpg
45,qOweMMKRd9,Tecnología de vanguardia. La fórmula que asegura la calidad y el desarrollo inteligente de los combustibles,https://www.clarin.com/brandstudio/formula-asegura-calidad-desarrollo-inteligente-combustibles_0_qOweMMKRd9.html,https://images.clarin.com/2022/01/25/PUOAPNIBX_720x0__1.jpg
46,WhOmyN5V4,"Verano 2022. Ford Go, lo último entre las plataformas de carsharing, llegó a Pinamar y Cariló",https://www.clarin.com/autos/ford-go-ultimo-plataformas-carsharing-desembarco-pinamar-carilo_0_WhOmyN5V4.html,https://images.clarin.com/2022/01/21/tCMDU5RPO_720x0__1.jpg
47,qedV4ey0o,Conexión total para el verano. Los beneficios en Internet fija y móvil a los que podés acceder,https://www.clarin.com/brandstudio/beneficios-internet-fija-movil-podes-acceder_0_qedV4ey0o.html,https://images.clarin.com/2022/01/17/t1z5URbaE_720x0__1.jpg
48,f0ZqWxsfCE,La pick-up RAM. Una de las grandes atracciones para poner a prueba junto a los especialistas,https://www.clarin.com/autos/pick-up-ram-grandes-atracciones-poner-prueba-junto-especialistas_0_f0ZqWxsfCE.html,https://images.clarin.com/2022/01/21/bXAaTuWTx_720x0__1.jpg
49,3RCMj9TCsE,Futsal masculino. La selección ultima detalles para la Copa América,https://www.clarin.com/brandstudio/seleccion-ultima-detalles-copa-america_0_3RCMj9TCsE.html,https://images.clarin.com/2022/01/26/Xf3pqLLwF_720x0__1.jpg
50,EqCgGYauIF,"Imparable. El año récord de Toyota: líder en ventas, y primera en producción y exportación",https://www.clarin.com/autos/ano-record-toyota-lider-absoluta-ventas-primera-produccion-exportacion_0_EqCgGYauIF.html,https://images.clarin.com/2022/01/21/EZ_scPfJ2_720x0__1.jpg
51,2RaPx7CJud,Estudio. La evolución radical de la variante ómicron,https://www.clarin.com/new-york-times-international-weekly/evolucion-radical-variante-omicron_0_2RaPx7CJud.html,https://images.clarin.com/2022/01/25/AuLh8tLN3_1256x620__2.jpg#1643151564238
52,SbgcooQd4w,Estudio. ¿Por qué el alcohol interfiere con mi sueño?,https://www.clarin.com/new-york-times-international-weekly/-alcohol-interfiere-sueno-_0_SbgcooQd4w.html,https://images.clarin.com/2022/01/25/zK4UgmTox_1256x620__2.jpg#1643150558865
53,PvB5IFt8Lu,Avance crucial. Un nuevo mapa de la burbuja local del Sol,https://www.clarin.com/new-york-times-international-weekly/nuevo-mapa-burbuja-local-sol_0_PvB5IFt8Lu.html,https://images.clarin.com/2022/01/25/VIjjclrdm_1256x620__2.jpg#1643154659713
54,xFxKEWwUDt,Análisis. Un tesoro de fotos antiguas podría revelar el futuro de estos glaciares árticos,https://www.clarin.com/new-york-times-international-weekly/tesoro-fotos-antiguas-podria-revelar-futuro-glaciares-articos_0_xFxKEWwUDt.html,https://images.clarin.com/2022/01/25/6eUA-la0J_720x0__1.jpg
55,Yl0q7wD5t,Integró la Selección. La defensora que pregunta por qué Gallardo no deja jugar a las mujeres en el Monumental,https://www.clarin.com/zonales/padre-dejaba-jugar-futbol-ahora-figura-river-seleccion_0_Yl0q7wD5t.html,https://images.clarin.com/2022/01/12/Lgj4SdYNv_720x0__1.jpg
56,NgxFYEHt5c,Hurlingham. A un mes de la desaparición de una mujer se desvanece la única pista que había,https://www.clarin.com/zonales/cumplio-mes-desaparicion-mujer-retraso-desvanece-unica-pista_0_NgxFYEHt5c.html,https://images.clarin.com/2022/01/06/bKdli1_O2_720x0__1.jpg
57,2ymnZjJpGd,Talentos del Conurbano. La fileteadora que causó sensación en China y sueña con ver su arte en todo Castelar,https://www.clarin.com/zonales/fileteadora-castelar-llego-arte-china-suena-verla-barrio_0_2ymnZjJpGd.html,https://images.clarin.com/2022/01/17/P1oY17Tsf_720x0__1.jpg
58,Ltd-aq7jR,Trujui Rugby. El proyecto de un jugador veterano del GBA y su hijo para no dejar a nadie afuera,https://www.clarin.com/zonales/trujui-rugby-club-nace-mano-apellido-hizo-historia-mariano-moreno_0_Ltd-aq7jR.html,https://images.clarin.com/2022/01/04/DZNHRPOKP_720x0__1.jpg
59,xw1etPBSXs,"""No voy a permitir que diga eso"". Verónica Lozano frenó en vivo a una entrevistada que intentó justificar un abuso sexual",https://www.clarin.com/fama/veronica-lozano-freno-vivo-entrevistada-intento-justificar-abuso-sexual_0_xw1etPBSXs.html,https://images.clarin.com/2022/01/26/9o3INqU_9_720x0__1.jpg
60,e2eshg7jCz,"Se picó en ""MasterChef Celebrity"". La firme advertencia de Joaquín Levinton a Malena Guinzburg: ""Te ganaste un enemigo""",https://www.clarin.com/fama/firme-advertencia-joaquin-levinton-malena-guinzburg-ganaste-enemigo-_0_e2eshg7jCz.html,https://images.clarin.com/2022/01/26/YIw3v-oMe_720x0__1.jpg
61,hwDVghTGl8,Por el mundo. La China Suarez blanqueó su romance con su novio español  Armando Mena Navareño,https://www.clarin.com/fama/china-suarez-blanqueo-romance-novio-espanol-armando-mena-navareno_0_hwDVghTGl8.html,https://images.clarin.com/2022/01/25/eteDyEndT_720x0__1.jpg
62,nOiqzsjEjD,Es el sábado. Las complicaciones familiares de Susana Giménez para celebrar su cumpleaños,https://www.clarin.com/fama/susana-gimenez-complicando-celebracion-cumpleanos_0_nOiqzsjEjD.html,https://images.clarin.com/2021/06/21/Lxlpaxy96_720x0__1.jpg
63,RDxlccuYsS,Los mejores salarios. Cuáles son los 10 empleos que ofrecen sueldos por encima de 150 mil pesos,https://www.clarin.com/economia/-10-empleos-ofrecen-sueldos-encima-150-mil-pesos-_0_RDxlccuYsS.html,https://images.clarin.com/2021/09/09/Kb-LTMcKu_720x0__1.jpg
64,ksvrMStPUc,El heredero de Los Monos. A los 19 años está preso y es uno de los dueños de la violencia narco,https://www.clarin.com/policiales/19-anos-preso-ven-nuevo-dueno-violencia-narco-lucho-cantero-heredero-monos_0_ksvrMStPUc.html,https://images.clarin.com/2021/02/11/ndto2wOOq_1256x620__4.jpg#1643054293620
65,gKYbwO0NzV,Oportunidad laboral. Un gigante de Wall Street busca 1.000 empleados en Argentina: los requisitos,https://www.clarin.com/servicios/gigante-wall-street-busca-1-000-empleados-argentina-posiciones-necesita-cubrir-postularse_0_gKYbwO0NzV.html,https://images.clarin.com/2022/01/24/azvGLkZu6_720x0__1.jpg
66,6869wNVOSt,Nueva encuesta. Miden los duelos políticos del momento: Alberto vs. Cristina y Macri vs. Larreta,https://www.clarin.com/politica/nueva-encuesta-midio-duelos-politicos-momento-alberto-vs-cristina-macri-vs-larreta_0_6869wNVOSt.html,https://images.clarin.com/2022/01/15/ZRpVABYou_720x0__1.jpg
67,PHQppaHldm,"Agenda impositiva. Uno por uno, cuáles son los impuestos que hay que pagar durante 2022",https://www.clarin.com/servicios/agenda-impositiva-impuestos-pagar-2022_0_PHQppaHldm.html,https://images.clarin.com/2017/12/07/B1KuFaI-G_720x0.jpg
68,6E9DkhsM2t,Sociedad. A 20 años del boom: en qué quedó la promesa de las células madre,https://www.clarin.com/sociedad/20-anos-boom-quedo-promesa-celulas-madre_0_6E9DkhsM2t.html,https://images.clarin.com/2022/01/21/ysSy5U8W-_720x0__1.jpg
69,LIci3lVcJ,Política. Enigma Nisman: siete años; siete misterios sin resolver,https://www.clarin.com/politica/enigma-nisman-anos-misterios-resolver_0_LIci3lVcJ.html,https://images.clarin.com/2022/01/13/mfXLvGAxI_720x0__1.jpg
70,m1EdK_wpV,Sociedad. Mundo verdulería: 10 secretos del negocio que explotó en pandemia,https://www.clarin.com/sociedad/mundo-verduleria-10-secretos-negocio-exploto-pandemia_0_m1EdK_wpV.html,https://images.clarin.com/2021/12/20/MSbLfu4yR_720x0__1.jpg
71,fJM8dsWAP,Viajes. De Salta a Tierra del Fuego: postales de siete rutas escénicas de la Argentina,https://www.clarin.com/viajes/salta-tierra-fuego-postales-imperdibles-rutas-escenicas-argentina_0_fJM8dsWAP.html,https://images.clarin.com/2021/12/23/_rnz40zJS_720x0__1.jpg
72,OvrpkOi6BJ,"Confesiones del mejor. Usain Bolt, exclusivo para Clarín: ""No extraño correr y menos entrenarme""",https://www.clarin.com/deportes/usain-bolt-exclusivo-clarin-extrano-correr-entrenarme-_0_OvrpkOi6BJ.html,https://images.clarin.com/2022/01/19/cPhdT3V6D_720x0__1.jpg
73,cUFY4OFeMo,"Este jueves por la tarde. A los 46, Maravilla Martínez vuelve a pelear y avisa: ""Estoy a una derrota del retiro""",https://www.clarin.com/deportes/maravilla-martinez-vuelve-pelear-46-anos-suena-titulo-avisa-derrota-retiro-_0_cUFY4OFeMo.html,https://images.clarin.com/2021/09/23/zbH211hTo_1256x620__3.jpg#1643134185486
74,kZ6WmW5IeW,"Por dos temporadas. La apuesta de River por Esequiel Barco: 4,4 millones de dólares por un préstamo",https://www.clarin.com/deportes/apuesta-river-esequiel-barco-4-4-millones-dolares-prestamo-temporadas_0_kZ6WmW5IeW.html,https://images.clarin.com/2022/01/21/3M2eddpOL_720x0__1.jpg
75,nNVvdCbSiR,Un clásico nada amistoso. Boca sufrió hasta el final pero le ganó a San Lorenzo y se llevó el Torneo de Verano,https://www.clarin.com/deportes/boca-vs-san-lorenzo-torneo-verano-horario-tv-formaciones-directo_0_nNVvdCbSiR.html,https://images.clarin.com/2022/01/25/0yWf3x6AI_1256x620__2.jpg#1643164427499
76,QV67xPI5qO,"Australia. Medvédev ganó una batalla de más de 4 horas, está en semis y amenaza a Djokovic",https://www.clarin.com/deportes/abierto-australia-daniil-medvedev-gano-batalla-4-horas-semis_0_QV67xPI5qO.html,https://images.clarin.com/2022/01/26/BI8tg4fUQ_720x0__1.jpg
77,oNMnBvjeJs,NBA. Campazzo volvió a dejar poco en un Denver que sigue en alza y venció a Detroit,https://www.clarin.com/deportes/nba-facundo-campazzo-volvio-dejar-denver-sigue-alza-vencio-detroit_0_oNMnBvjeJs.html,https://images.clarin.com/2022/01/24/KtLj-Edsdq_720x0__1.jpg
