n,id,title,url,image
1,DVdjMkFWK,El manejo de la pandemia. Covid-19: cuántas vacunas del componente 2 de Sputnik V faltan y cuándo podrían llegar,https://www.clarin.com/sociedad/carrera-covid-cuantas-vacunas-componente-2-sputnik-faltan-podrian-llegar_0_DVdjMkFWK.html,https://images.clarin.com/2021/05/18/BqGcP2HAgX_720x0__1.jpg
2,8SbOsUAFm,"Horas decisivas. Boca, aislado: qué jugadores estarán disponibles ante Banfield y San Lorenzo",https://www.clarin.com/deportes/horas-decisivas-boca-escandalo-belo-horizonte-futbolistas-disponibles-jugar-banfield-san-lorenzo_0_8SbOsUAFm.html,https://images.clarin.com/2021/07/22/uwptc3mh8_1200x0__2.jpg#1626968935812
3,J9aK6sEG4,Fútbol masculino. La Selección de Batista decepcionó y cayó ante Australia en su debut,https://www.clarin.com/deportes/argentina-vs-australia-grupo-c-juegos-olimpicos-tokio-previa-alineaciones-directo_0_J9aK6sEG4.html,https://images.clarin.com/2021/07/22/WnjOjJvN__1256x620__2.jpg#1626957658384
4,fbj0o1z8y,Puro optimismo. Julián Weich dejó terapia intensiva: el mensaje que le dio a su médico,https://www.clarin.com/fama/julian-weich-dejo-terapia-intensiva-pelear-salgo-adelante-_0_fbj0o1z8y.html,https://images.clarin.com/2021/07/22/SoySeyUxk_720x0__1.jpg
5,LW6xPeIyv,"Crimen del contador. Investigan si un detenido era el ""contacto"" para la compra y venta de dólares",https://www.clarin.com/policiales/investigan-detenidos-contacto-compra-venta-dolares-contador-asesinado-parana_0_LW6xPeIyv.html,https://images.clarin.com/2021/07/18/_rS_TfgiE_1256x620__4.jpg#1626972791544
6,bdlSk1GTx,Pertrechos a Bolivia. La Fuerza Aérea informó que los 70 mil cartuchos enviados no habían sido declarados,https://www.clarin.com/politica/fuerza-aerea-informo-70-mil-cartuchos-antidisturbios-enviados-bolivia-declarados_0_bdlSk1GTx.html,https://images.clarin.com/2019/11/13/a-12UC72_720x0__1.jpg
7,cPZwT-OIV,Tiene 20 años. El drama de Alan: tuvo Covid y ahora sufre de tics que no le permiten controlar su cuerpo,https://www.clarin.com/sociedad/drama-alan-covid-ahora-sufre-tics-permiten-controlar-cuerpo_0_cPZwT-OIV.html,https://images.clarin.com/2021/07/22/63hVwWcNA_720x0__1.jpg
8,HpWtoQBEj,Corazón de la Ciudad. Parque Lezama: la mágica historia del lugar donde nació Buenos Aires,https://www.clarin.com/viva/parque-lezama-magica-historia-lugar-nacio-buenos-aires_0_HpWtoQBEj.html,https://images.clarin.com/2021/07/19/pRiQ_e1i7_720x0__1.jpg
9,eQQxuwG19,Nutrición. Los alimentos no saludables ocupan 4 veces más lugar en los supermercados,https://www.clarin.com/buena-vida/alimentos-saludables-ocupan-4-veces-lugar-supermercados_0_eQQxuwG19.html,https://images.clarin.com/2021/07/21/H8b4OHZmZ_720x0__1.jpg
10,2uhlev2PR,"Sin maquillaje. Gene Simmons: rock sin drogas, el #MeToo y el último adiós de Kiss",https://www.clarin.com/espectaculos/musica/gene-simmons-kiss-rock-drogas-politicos-idiotas-metoo-ultimo-adios-banda_0_2uhlev2PR.html,https://images.clarin.com/2019/12/31/0b_pt7zZ_1256x620__2.jpg#1626932459024
11,DVdjMkFWK,El manejo de la pandemia. Covid-19: cuántas vacunas del componente 2 de Sputnik V faltan y cuándo podrían llegar,https://www.clarin.com/sociedad/carrera-covid-cuantas-vacunas-componente-2-sputnik-faltan-podrian-llegar_0_DVdjMkFWK.html,https://images.clarin.com/2021/05/18/BqGcP2HAgX_720x0__1.jpg
12,8SbOsUAFm,"Horas decisivas. Boca, aislado: qué jugadores estarán disponibles ante Banfield y San Lorenzo",https://www.clarin.com/deportes/horas-decisivas-boca-escandalo-belo-horizonte-futbolistas-disponibles-jugar-banfield-san-lorenzo_0_8SbOsUAFm.html,https://images.clarin.com/2021/07/22/uwptc3mh8_1200x0__2.jpg#1626968935812
13,J9aK6sEG4,Fútbol masculino. La Selección de Batista decepcionó y cayó ante Australia en su debut,https://www.clarin.com/deportes/argentina-vs-australia-grupo-c-juegos-olimpicos-tokio-previa-alineaciones-directo_0_J9aK6sEG4.html,https://images.clarin.com/2021/07/22/WnjOjJvN__1256x620__2.jpg#1626957658384
14,oHQ_J7YHA,"""Le tengo mucho miedo"". Fernando Burlando reconoció que combinó vacunas para estar más protegido contra el coronavirus",https://www.clarin.com/fama/fernando-burlando-reconocio-combino-vacunas-protegido-coronavirus_0_oHQ_J7YHA.html,https://images.clarin.com/2021/07/22/10vcbjEi3_720x0__1.jpg
15,N2WZMC55D,Preocupación. Fuertes imágenes de Cabito Massa Alcantara luchando por su vida,https://www.clarin.com/fama/fuertes-imagenes-cabito-massa-alcantara-luchando-vida_0_N2WZMC55D.html,https://images.clarin.com/2018/11/28/t03yQXZzd_720x0__1.jpg
16,j7G6Eub-p,Rompió el silencio. Guillermo Francella confirmó que tiene coronavirus y brindó detalles de su contagio,https://www.clarin.com/fama/guillermo-francella-confirmo-coronavirus-brindo-detalles-contagio_0_j7G6Eub-p.html,https://images.clarin.com/2020/01/13/MXyY-ULm_720x0__1.jpg
17,qft10U3nH,¡Qué felicidad!. Pampita dio a luz a su primera hija con Roberto García Moritán,https://www.clarin.com/fama/pampita-dio-luz-primera-hija-roberto-garcia-moritan_0_qft10U3nH.html,https://images.clarin.com/2021/07/22/wmoQSND6U_720x0__1.jpg
18,OvdV2Yg4R,"Reino Unido. Coronavirus: ""¡Ping!"", el ruido de pesadilla que tiene a los británicos encerrados",https://www.clarin.com/mundo/coronavirus-reino-unido-ping-ruido-pesadilla-britanicos-encerrados_0_OvdV2Yg4R.html,https://images.clarin.com/2021/07/22/5oV23gEUQ_1256x620__2.jpg#1626971980300
19,4gC_EpQq7,Crisis sanitaria. 100.000 muertes: así es el semáforo del Covid en la Argentina,https://www.clarin.com/sociedad/100-000-muertos-covid-argentina-semaforo-primeros-500-dias-pandemia_0_4gC_EpQq7.html,https://images.clarin.com/2021/07/12/tjHQTSy1Z_720x0__1.jpg
20,wXrCrtaXH,"Especial Clarín. Psoriasis, la enfermedad que explotó en la pandemia",https://www.clarin.com/buena-vida/psoriasis-enfermedad-exploto-pandemia_0_wXrCrtaXH.html,https://images.clarin.com/2021/05/31/saNJQi-UR_720x0__1.jpg
21,O-m1BwnMT,Un nuevo ídolo. Fenómeno L-Gante: 48 horas con el pibe del Conurbano que provoca y hace bailar a millones,https://www.clarin.com/especiales/48-horas-l-gante-rapero-revoluciona-villas-hace-bailar-ricos-famosos-anima-fiestas-clandestinas_0_O-m1BwnMT.html,https://images.clarin.com/2021/07/02/NdREIuV9g_720x0__1.jpg
22,IZnJZ6DC6,Especial Clarín. ¿Cuál es la Gioconda argentina? Diez obras de arte que hay que ver y cómo entenderlas mejor,https://www.clarin.com/cultura/-gioconda-argentina-obras-arte-ver-entenderlas-mejor_0_IZnJZ6DC6.html,https://images.clarin.com/2021/03/15/0yjYB6S5M_720x0__1.jpg
23,APP4ns6OV,"Habló con Clarín. La intimidad de Peque Pareto en la previa de los Juegos Olímpicos: la gloria, el retiro y la medicina",https://www.clarin.com/deportes/paula-peque-pareto-juegos-olimpicos-judo-aud1enc14-j0v3n_0_APP4ns6OV.html,https://images.clarin.com/2019/10/09/SMN9FJzX_1256x620__2.jpg#1626915164017
24,1YYZ6Znus,"Juegos Olímpicos 2021. Uno por uno, todos los atletas argentinos que estarán en Tokio 2020",https://www.clarin.com/deportes/atletas-argentinos-tokio-2020_0_1YYZ6Znus.html,https://images.clarin.com/2021/07/19/WxVMXZvWG_720x0__1.jpg
25,Nrf7za6kd,Interna en llamas. Bochornosa asamblea en Independiente: problemas para leer e insultos de Moyano,https://www.clarin.com/deportes/bochornosa-asamblea-independiente-problemas-leer-insultos-hugo-moyano_0_Nrf7za6kd.html,https://images.clarin.com/2021/07/21/QYZAgvTRG_720x0__1.jpg
26,cMoogKiq7,"""Hicimos el click"". Gallardo desempolvó una vieja receta que le sirvió para ganar su primera Libertadores",https://www.clarin.com/deportes/marcelo-gallardo-desempolvo-vieja-receta-sirvio-ganar-primera-libertadores-river_0_cMoogKiq7.html,https://images.clarin.com/2021/07/22/4N9S4s4ID_720x0__1.jpg
27,XxupnEH8J,Por paritarias. Las expensas llegan con ajustes por el aumento a los encargados de edificios,https://www.clarin.com/economia/expensas-empezaron-llegar-ajustes-aumento-encargados-edificios_0_XxupnEH8J.html,https://images.clarin.com/2016/04/02/H1eTt_oFVx_720x0.jpg
28,KcKiScaEY,Privacidad. Por qué deberías desactivar la función de Google Maps que registra todos tus movimientos,https://www.clarin.com/tecnologia/deberias-desactivar-funcion-google-maps-registra-movimientos_0_KcKiScaEY.html,https://images.clarin.com/2021/02/17/pgHGt09h2_720x0__1.jpg
