n,id,title,url,image
1,5cuLmfaT9,"El avance de la segunda ola. Los casos de Covid cayeron un 30% en junio, la positividad bajó al 23% y qué puede pasar este invierno",https://www.clarin.com/sociedad/covid-casos-cayeron-30-junio-positividad-23-puede-pasar-invierno-argentina_0_5cuLmfaT9.html,https://images.clarin.com/2021/06/19/F67EnPEuK_720x0__1.jpg
2,hD1gu0hxX,La pandemia. Coronavirus en Argentina: informan otras 495 muertes y 15.631 nuevos casos,https://www.clarin.com/sociedad/coronavirus-argentina-informan-495-muertes-15-631-nuevos-casos_0_hD1gu0hxX.html,https://images.clarin.com/2021/06/09/lDu70_chq_720x0__1.jpg
3,rZvIUro-l,Variante Delta. Expertos explican hasta cuándo seguirá mutando el coronavirus,https://www.clarin.com/sociedad/peligrosa-variante-delta-expertos-explican-seguira-mutando-covid_0_rZvIUro-l.html,https://images.clarin.com/2021/06/14/r5j0RKa55_720x0__1.jpg
4,a6v_cvUxl,Aplicación de dosis. No hace falta esperar 15 días entre las vacunas contra el Covid y la gripe,https://www.clarin.com/sociedad/estudio-afirma-hace-falta-esperar-15-dias-aplicacion-vacunas-coronavirus-gripe_0_a6v_cvUxl.html,https://images.clarin.com/2021/06/15/y66ke1zCt_720x0__1.jpg
5,CrTxQdISv,Jorge Lanata. Les chiques usan maquillaje,https://www.clarin.com/opinion/chiques-usan-maquillaje_0_CrTxQdISv.html,https://images.clarin.com/2020/10/24/UfSH0CTmj_720x0__1.jpg
6,HscF3eJNc,Foco económico. Inflación en las nubes o la prueba de que no hay plan,https://www.clarin.com/economia/inflacion-nubes-prueba-plan_0_HscF3eJNc.html,https://images.clarin.com/2021/05/26/qbQT--DSg_720x0__1.jpg
7,YDuCbPNwE,Análisis. El plan económico del Gobierno tiene tres patas y fecha de vencimiento,https://www.clarin.com/economia/plan-economico-gobierno-patas-fecha-vencimiento_0_YDuCbPNwE.html,https://images.clarin.com/2021/04/12/OaoxULc9x_720x0__1.jpg
8,TtGFdpg_Y,"Contámelo. Volvió el ""Tinder"" del fútbol y gambetea la pandemia",https://www.clarin.com/sociedad/-jugamos-volvio-tinder-futbol-gambetea-pandemia_0_TtGFdpg_Y.html,https://images.clarin.com/2021/06/19/ghSpkyfFW_1256x620__2.jpg#1624125523515
9,INDzSlr2T,Misterio en San Luis. El papá de Guadalupe pidió volver a declarar para aportar una nueva pista,https://www.clarin.com/sociedad/busqueda-guadalupe-papa-nena-pidio-volver-declarar-aportar-nueva-pista_0_INDzSlr2T.html,https://images.clarin.com/2021/06/15/xyeUIYWT3_720x0__1.jpg
10,d-j3OzyhK,"Perfil de un asesino. Ratko Mladic, el ""carnicero de Bosnia"" que desencadenó un infierno sobre la tierra",https://www.clarin.com/mundo/brutal-historia-ratko-mladic--carnicero-bosnia-desencadeno-infierno-tierra_0_d-j3OzyhK.html,https://images.clarin.com/2021/06/15/mLQbDqsib_1256x620__2.jpg#1623781759442
11,MMd5ulAYq,A sangre y fuego. Ezeiza 1973: el día en que mataron y murieron en nombre de Perón,https://www.clarin.com/politica/ezeiza-1973-dia-mataron-murieron-nombre-peron_0_MMd5ulAYq.html,https://images.clarin.com/2021/06/19/BguDcISRs_720x0__1.jpg
12,19-eX440K,Especial Clarín. Guía de ahorro: diez claves para bajar gastos de la casa y el auto,https://www.clarin.com/servicios/guia-ahorro-claves-bajar-gastos-casa-auto-pelearle-inflacion_0_19-eX440K.html,https://images.clarin.com/2021/05/31/7WP8wMbXk_720x0__1.jpg
13,SFuIhiZRm,Escenario. El problema no es China. Son las grandes tecnológicas,https://www.clarin.com/new-york-times-international-weekly/problema-china-grandes-tecnologicas_0_SFuIhiZRm.html,https://images.clarin.com/2021/06/18/MSpUG3Dqb_1256x620__2.jpg#1624031074336
14,bWD3Zcwrq,Amenaza climática. ¿Qué es una megasequía?,https://www.clarin.com/new-york-times-international-weekly/-megasequia-_0_bWD3Zcwrq.html,https://images.clarin.com/2021/06/18/f3qGoHGnj_1256x620__2.jpg#1624023988083
15,5p2TC6dqd,Testimonio. La fuerza silenciosa de un bosque antiguo,https://www.clarin.com/new-york-times-international-weekly/fuerza-silenciosa-bosque-antiguo_0_5p2TC6dqd.html,https://images.clarin.com/2021/06/16/2e56qbwT6_1256x620__2.jpg#1623852807979
16,L6zDym779,"Kim Jong Un. Está listo para el ""diálogo y la confrontación"" con Biden",https://www.clarin.com/new-york-times-international-weekly/kim-jong-dice-listo-dialogo-confrontacion-biden_0_L6zDym779.html,https://images.clarin.com/2021/06/18/dALrEeSM6_1256x620__2.jpg#1624027764852
17,5cuLmfaT9,"El avance de la segunda ola. Los casos de Covid cayeron un 30% en junio, la positividad bajó al 23% y qué puede pasar este invierno",https://www.clarin.com/sociedad/covid-casos-cayeron-30-junio-positividad-23-puede-pasar-invierno-argentina_0_5cuLmfaT9.html,https://images.clarin.com/2021/06/19/F67EnPEuK_720x0__1.jpg
18,hD1gu0hxX,La pandemia. Coronavirus en Argentina: informan otras 495 muertes y 15.631 nuevos casos,https://www.clarin.com/sociedad/coronavirus-argentina-informan-495-muertes-15-631-nuevos-casos_0_hD1gu0hxX.html,https://images.clarin.com/2021/06/09/lDu70_chq_720x0__1.jpg
19,rZvIUro-l,Variante Delta. Expertos explican hasta cuándo seguirá mutando el coronavirus,https://www.clarin.com/sociedad/peligrosa-variante-delta-expertos-explican-seguira-mutando-covid_0_rZvIUro-l.html,https://images.clarin.com/2021/06/14/r5j0RKa55_720x0__1.jpg
20,a6v_cvUxl,Aplicación de dosis. No hace falta esperar 15 días entre las vacunas contra el Covid y la gripe,https://www.clarin.com/sociedad/estudio-afirma-hace-falta-esperar-15-dias-aplicacion-vacunas-coronavirus-gripe_0_a6v_cvUxl.html,https://images.clarin.com/2021/06/15/y66ke1zCt_720x0__1.jpg
21,CrTxQdISv,Jorge Lanata. Les chiques usan maquillaje,https://www.clarin.com/opinion/chiques-usan-maquillaje_0_CrTxQdISv.html,https://images.clarin.com/2020/10/24/UfSH0CTmj_720x0__1.jpg
22,HscF3eJNc,Foco económico. Inflación en las nubes o la prueba de que no hay plan,https://www.clarin.com/economia/inflacion-nubes-prueba-plan_0_HscF3eJNc.html,https://images.clarin.com/2021/05/26/qbQT--DSg_720x0__1.jpg
23,YDuCbPNwE,Análisis. El plan económico del Gobierno tiene tres patas y fecha de vencimiento,https://www.clarin.com/economia/plan-economico-gobierno-patas-fecha-vencimiento_0_YDuCbPNwE.html,https://images.clarin.com/2021/04/12/OaoxULc9x_720x0__1.jpg
24,TtGFdpg_Y,"Contámelo. Volvió el ""Tinder"" del fútbol y gambetea la pandemia",https://www.clarin.com/sociedad/-jugamos-volvio-tinder-futbol-gambetea-pandemia_0_TtGFdpg_Y.html,https://images.clarin.com/2021/06/19/ghSpkyfFW_1256x620__2.jpg#1624125523515
25,CjC1IkCWe,"Entrevista exclusiva. Emmanuel Carrère, en los límites del poder de la palabra",https://www.clarin.com/revista-n/emmanuel-carrere-esfuerzo-decir-verdad-_0_CjC1IkCWe.html,https://images.clarin.com/2021/06/10/MbdJxlkj9_1256x620__2.jpg#1623328796651
26,cXMfnuwYb,"Vuelve un clásico. Asterix, el galo más amado",https://www.clarin.com/revista-n/literatura/asterix-galo-amado_0_cXMfnuwYb.html,https://images.clarin.com/2021/05/07/zZDEUmJpy_1256x620__2.jpg#1624037427407
27,ilJ1sUy1O,Diálogo con Pablo Larraín. Réquiem para los que siguen vivos,https://www.clarin.com/revista-n/escenarios/requiem-siguen-vivos_0_ilJ1sUy1O.html,https://images.clarin.com/2021/06/18/Up2rfAMLP_720x0__1.jpg
28,OmQks_iC2,"Opinión. ¿Los argentinos somos europeos, indígenas, mixtos o qué?",https://www.clarin.com/revista-n/-argentinos-europeos-indigenas-mixtos-_0_OmQks_iC2.html,https://images.clarin.com/2021/06/18/2SvD4AvsK_1256x620__2.jpg#1624047586937
29,8JR3M0rNX,"Pandemia y ciudades. AMBA, un nudo de emergencias",https://www.clarin.com/revista-n/ideas/amba-nudo-emergencias_0_8JR3M0rNX.html,https://images.clarin.com/2020/05/16/8ObfAI-4c_720x0__1.jpg
30,rHOYEjj5e,"Encuesta. La calle, futura sala del museo",https://www.clarin.com/revista-n/arte/calle-futura-sala-museo_0_rHOYEjj5e.html,https://images.clarin.com/2021/06/18/vGcCfC99g_930x525__2.jpg#1624048394164
31,oLXnVlQRB,Para riego y abastecimiento. Agua: soluciones solares para una provisión sustentable,https://www.clarin.com/brandstudio/agua-soluciones-solares-provision-sustentable_0_oLXnVlQRB.html,https://images.clarin.com/2020/05/22/TMSM6OtOf_720x0__1.jpg
32,vgYDtmW_-,Porcinos. Se asoma un futuro promisorio,https://www.clarin.com/rural/futuro-promisorio-produccion-porcina-espera-financiamiento-estabilidad-mantener-crecimiento_0_vgYDtmW_-.html,https://images.clarin.com/2019/09/12/6ivqWbHg8_720x0__1.jpg
33,9LLi9siY3,La columna de la semana. Es aquí y es ahora: el potencial de las nuevas industrias verdes,https://www.clarin.com/rural/ahora-potencial-nuevas-industrias-verdes_0_9LLi9siY3.html,https://images.clarin.com/2016/10/11/HybA3o2FEx_720x0.jpg
34,1fqqZ8d36,Política y producción. Cepo a la carne: señales confusas que alejan las soluciones,https://www.clarin.com/rural/cepo-carne-senales-confusas-alejan-soluciones_0_1fqqZ8d36.html,https://images.clarin.com/2021/06/19/IVyFxP9e2_720x0__1.jpg
35,ddrDKOi_z,"Agricultura. Una ""soja de tercera"" les salvó la campaña tras una tormenta de granizo",https://www.clarin.com/rural/soja-tercera-salvo-campana-tormenta-destruyo-cultivos-gruesa_0_ddrDKOi_z.html,https://images.clarin.com/2021/06/19/RSDDwFL1L_720x0__1.jpg
36,ee2Hw54_y,Agroindustria. Japón se vuelca a la producción vertical de alimentos,https://www.clarin.com/rural/japon-vuelca-produccion-vertical-alimentos_0_ee2Hw54_y.html,https://images.clarin.com/2021/06/17/dUH-4Tihc_720x0__1.jpg
37,G6d2Nqmul,"Pide ayuda para viajar. Tiene 4 años, le falta el radio en ambos brazos y su familia lucha por tratarla en EE.UU.",https://www.clarin.com/zonales/video-4-anos-falta-radio-ambos-brazos-familia-lucha-pueda-tratarse-unidos_0_G6d2Nqmul.html,https://images.clarin.com/2021/06/14/FGdEB5b-e_950x468__3.jpg#1623698081178
38,owEDEvcYF,Reclamos por 300 despidos. Aseguran que cierra la planta de Bimbo tras un incendio que la destruyó,https://www.clarin.com/zonales/aseguran-cierra-planta-bimbo-incendio-destruyo-reclamos-300-despidos_0_owEDEvcYF.html,https://images.clarin.com/2021/06/16/pcjIStn2f_720x0__1.jpg
39,AcO7w3WTp,"""Hermanos Zapatilla"". Calzan 51 y son famosos por sus acciones solidarias",https://www.clarin.com/zonales/hermanos-zapatilla-calzan-51-comparten-famosos-acciones-solidarias_0_AcO7w3WTp.html,https://images.clarin.com/2021/05/24/cxBLeN6ik_720x0__1.jpg
40,y3RmaRve8,"Crisis. Para sostener el comercio, Vicente López habilita locales en 24 horas",https://www.clarin.com/zonales/sostener-comercio-vicente-lopez-ahora-habilitan-locales-24-horas-internet_0_y3RmaRve8.html,https://images.clarin.com/2021/01/13/S7pm954m6_720x0__1.jpg
41,U6d-E3AJg,Glew. Una ONG mascotera denuncia discriminación a perros negros,https://www.clarin.com/zonales/ong-mascotera-denuncia-discriminacion-perros-negros_0_U6d-E3AJg.html,https://images.clarin.com/2021/06/10/1bQn1qqbv_720x0__1.jpg
42,tXp0Hm67K,Grupo E. España lo busca sin ideas y Polonia se aferra al empate,https://www.clarin.com/deportes/espana-vs-polonia-eurocopa-previa-alineaciones-directo_0_tXp0Hm67K.html,https://images.clarin.com/2021/06/19/n8ak3K_tW_1256x620__2.jpg#1624134238349
43,N8mKTLvV5,Eurocopa. Francia no pudo quebrar a Hungría en Budapest y no aseguró su clasificación,https://www.clarin.com/deportes/hungria-vs-francia-eurocopa-2020-minuto-minuto-directo_0_N8mKTLvV5.html,https://images.clarin.com/2021/06/19/uUBK6rF23_720x0__1.jpg
44,5Fkatkdu8,Revuelo en España. Un goleador argentino posó con una remera de la ultra-derecha: luego pidió perdón,https://www.clarin.com/deportes/revuelo-espana-goleador-argentino-chimy-avila-poso-remera-ultraderecha-pedir-perdon_0_5Fkatkdu8.html,https://images.clarin.com/2021/06/19/9wmC_unk2_720x0__1.jpg
45,sP0EmPfzz,"Foto en Instagram. ""¡Vamos, carajo!"": el festejo de Messi en el vestuario tras la victoria ante Uruguay",https://www.clarin.com/deportes/messi-seleccion-argentina-vestuario_0_sP0EmPfzz.html,https://images.clarin.com/2021/06/19/D23hkSBi3_1256x620__2.jpg#1624104373009
46,5-t5SWAfH,"Tiene 20 años. ""Kubo"", el Messi japonés que metió un gol con 4 caños y hoy no tiene club",https://www.clarin.com/deportes/kubo--messi-japones-metio-gol-canos--paso-barcelona-real-madrid--hoy-club_0_5-t5SWAfH.html,https://images.clarin.com/2021/06/16/Mz45zmV2D_720x0__1.jpg
47,Igvayor4w,Ya tienen a Agüero. Otro socio para Messi: Barcelona confirmó el fichaje de Memphis Depay,https://www.clarin.com/deportes/socio-lionel-messi-barcelona-confirmo-fichaje-memphis-depay_0_Igvayor4w.html,https://images.clarin.com/2021/06/19/OemikwmgU_720x0__1.jpg
48,3lkio7vHS,"¿Llegará a la F1?. Arthur Leclerc, el hermano menor de Charles, ganó en la Fórmula 3",https://www.clarin.com/deportes/arthur-leclerc-hermano-menor-charles-gano-primera-vez-formula-3_0_3lkio7vHS.html,https://images.clarin.com/2021/06/19/1RwF5DJXG_720x0__1.jpg
49,IYzL2TmRC,Érica Farías. Inédito: es argentina y peleará en Las Vegas por el título mundial,https://www.clarin.com/deportes/primera-vez-boxeadora-argentina-peleara-vegas-titulo-mundial-erica-farias-gloria-mikaela-mayer_0_IYzL2TmRC.html,https://images.clarin.com/2021/06/18/7BsDQgtjO_1256x620__2.jpg#1624037146887
50,2Utx4a7MB,"Encuesta y grieta. Preguntaron por figuras internacionales ""más odiadas"" y los macristas eligieron al Papa",https://www.clarin.com/politica/encuesta-grieta-preguntaron-figuras-internacionales-odiadas-macristas-eligieron-papa_0_2Utx4a7MB.html,https://images.clarin.com/2016/10/29/rkD61UAXe_720x0.jpg
51,9nYSUWihX,Propiedad privada. En la Iglesia piden no relacionar todo lo que dice el Papa con Argentina,https://www.clarin.com/politica/propiedad-privada-iglesia-culpan-grieta-criticas-papa-declaraciones_0_9nYSUWihX.html,https://images.clarin.com/2020/02/13/q5xUGNJs_720x0__1.jpg
52,bUgaQSxdF,Precios-salarios. Moyano logró un aumento salarial de 45% y le pone presión a las paritarias,https://www.clarin.com/politica/paritaria-moyano-cerro-45-mete-presion-precios-negociaciones_0_bUgaQSxdF.html,https://images.clarin.com/2021/06/15/0fj9sa9vu_1256x620__2.jpg#1624069555189
53,O_QOL8eoR,"Acusaciones. ""Envenenamiento"": el abogado de Alberto Fernández dijo que denunciarán a Carrió",https://www.clarin.com/politica/abogado-alberto-fernandez-anuncio-demandara-elisa-carrio-acusar-presidente-envenenamiento_0_O_QOL8eoR.html,https://images.clarin.com/2020/12/08/RHeT_poie_720x0__1.jpg
54,muLvfTsdR,Año electoral. Quiénes son los legisladores que terminan su mandato en el Congreso,https://www.clarin.com/politica/ano-electoral-principales-espadas-oficialismo-oposicion-terminan-mandato-congreso_0_muLvfTsdR.html,https://images.clarin.com/2021/06/18/23PF3r6pu_720x0__1.jpg
55,puumbJlAZ,Estudio de la UBA. Resultados alentadores en un ensayo para tratar el Covid,https://www.clarin.com/sociedad/investigadores-uba-probaron-antihipertensivo-tratar-covid-19-obtuvieron-buenos-resultados_0_puumbJlAZ.html,https://images.clarin.com/2020/09/04/U1O0CVZAK_720x0__1.jpg
56,XnkFFq0ir, ¿Fin de una grieta?. Los taxistas que manejan para aplicaciones de movilidad,https://www.clarin.com/ciudades/taxistas-manejan-aplicaciones-movilidad-fin-grieta-_0_XnkFFq0ir.html,https://images.clarin.com/2021/06/17/gniVn1YPc_720x0__1.jpg
57,FrvRCUL9W,"Elecciones 2021. Elogios de Sanz para Facundo Manes: es ""la frutilla del postre"" del radicalismo",https://www.clarin.com/politica/ernesto-sanz-califico-facundo-manes-frutilla-postre-radicalismo_0_FrvRCUL9W.html,https://images.clarin.com/2021/06/19/841pN4gv-_720x0__1.jpg
58,sB70TqvacF,En pandemia. Emigrar a España: cuáles son las 5 profesiones que más piden y cuánto pagan,https://www.clarin.com/servicios/emigrar-espana-5-profesiones-piden-pagan_0_sB70TqvacF.html,https://images.clarin.com/2021/06/17/LOwQUaie4_720x0__1.jpg
59,VgS-q_VVJ,"Sexo y parejas. Cuando la diferencia de edad no importa: qué es el ""cubbing""",https://www.clarin.com/buena-vida/diferencia-edad-importa-cubbing-_0_VgS-q_VVJ.html,https://images.clarin.com/2021/06/17/Ogw7c9mZ7_720x0__1.jpg
60,kpdi_AqWf,Oportunidad. Liquidan Smart TV con rebajas de hasta 40% y 18 cuotas sin interés,https://www.clarin.com/servicios/oportunidad-liquidan-smart-tv-rebajas-40-18-cuotas-interes_0_kpdi_AqWf.html,https://images.clarin.com/2021/03/09/VhK7BtYEJ_720x0__1.jpg
61,6MRExDXla,"Dejó de producir en 2019. Bieckert, la fábrica pionera de cerveza que vendió hasta malta para embarazadas",https://www.clarin.com/gourmet/historia-bieckert-primera-fabrica-cerveza-argentina-vendio-malta-embarazadas_0_6MRExDXla.html,https://images.clarin.com/2021/06/18/aTz3I7cw2_720x0__1.jpg
62,g9T4_4hdg,"Patrocinado. ATRIUM, una innovadora experiencia que te da la bienvenida a tu nueva vida",https://www.clarin.com/mercado-inmobiliario/atrium-innovadora-experiencia-da-bienvenida-nueva-vida_0_g9T4_4hdg.html,https://images.clarin.com/2021/06/15/IY-bQLxr6_720x0__1.jpg
63,t0IQWonnZ,Poo powered. El novedoso auto que se mueve en base a excrementos,https://www.clarin.com/autos/poo-powered-auto-electrico-mueve-base-excrementos-australia_0_t0IQWonnZ.html,https://images.clarin.com/2021/06/18/SHlAwC_kT_720x0__1.jpg
64,r5kPqV8_4,"KWS, 15 años brindando soluciones. Genética de elite adaptada localmente",https://www.clarin.com/rural/genetica-elite-adaptada-localmente_0_r5kPqV8_4.html,https://images.clarin.com/2021/06/18/NyZgSbfpv_720x0__1.jpg
65,rk0rpxYVI,Obsequio todoterreno. Día del Padre: el regalo perfecto para un papá todo terreno,https://www.clarin.com/brandstudio/dia-padre-regalo-perfecto-papa-terreno_0_rk0rpxYVI.html,https://images.clarin.com/2021/06/08/cNrNw3xtp_720x0__1.jpg
66,mD89dgB_4,"""La Catedral"". El día en que Escobar se entregó para ir a la cárcel que mandó a construir",https://www.clarin.com/internacional/historia-dia-pablo-escobar-entrego-justicia-ir-carcel-mismo-construyo_0_mD89dgB_4.html,https://images.clarin.com/2014/02/25/rk-pCN_iXx_720x0.jpg
67,zarfPIKxG,"""The Wall"". El muro gigante que protege a una ciudad del frío extremo",https://www.clarin.com/viste/muro-proteger-ciudad-entera-viento-helado_0_zarfPIKxG.html,https://images.clarin.com/2021/06/18/f2NsqStFr_720x0__1.jpg
68,kt2W9ZKAi,Alerta roja. Reaparecieron los avispones asesinos en otra zona de Estados Unidos ,https://www.clarin.com/internacional/estados-unidos/reaparecieron-avispones-asesinos-zona-unidos-vuelve-alerta-roja_0_kt2W9ZKAi.html,https://images.clarin.com/2021/06/19/9b4jzlzOM_720x0__1.jpg
69,Iq2wnMYga,"Historia. La venganza de dos mujeres por una infidelidad: ""Se quedó sin palabras""",https://www.clarin.com/viste/elaborada-venganza-mujeres-infidelidad-quedo-palabras-primera-vez-_0_Iq2wnMYga.html,https://images.clarin.com/2021/06/17/09LjeuvXl_720x0__1.jpg
70,D6tBS1PIX,Video viral. Aterrizó su avión en pleno bosque con una araña gigante en el techo de la cabina,https://www.clarin.com/internacional/video-aterrizo-avion-pleno-bosque-arana-gigante-acechandolo-techo-cabina_0_D6tBS1PIX.html,https://images.clarin.com/2021/06/18/RbnvTwDiQ_720x0__1.jpg
71,j5wcjB0bO,¿Qué pasó?. Lloraron la muerte de su gato y lo cremaron: tras un mes apareció vivo en su casa,https://www.clarin.com/viste/lloraron-muerte-gato-cremaron-mes-siguiente-aparecio-vivo-casa_0_j5wcjB0bO.html,https://images.clarin.com/2021/06/18/RJZeFmh0f_720x0__1.jpg
72,GpK1H3ovA,Nuevo desarrollo. Comodidad y personalidad en Belgrano,https://www.clarin.com/mercado-inmobiliario/comodidad--mucha-personalidad-nuevo-desarrollo-belgrano_0_GpK1H3ovA.html,https://images.clarin.com/2021/05/05/aJ-JXIyXs_720x0__1.jpg
73,3Eb4Y1C56,En el corazón del barrio. Alma Palermo: una oportunidad ideal de inversión,https://www.clarin.com/mercado-inmobiliario/alma-palermo-oportunidad-ideal-inversion_0_3Eb4Y1C56.html,https://images.clarin.com/2021/04/19/bxKckY2pj_720x0__1.jpg
74,rZFjRfSv1,Semipisos a estrenar. Gran oportunidad de inversión y vivienda en Villa Crespo,https://www.clarin.com/mercado-inmobiliario/gran-oportunidad-inversion-vivienda-corazon-villa-crespo_0_rZFjRfSv1.html,https://images.clarin.com/2021/05/05/MBENUc8tQ_720x0__1.jpg
75,ZFeUYcNSG,Klover Plaza. Amenities de hotelería con calidez de hogar,https://www.clarin.com/mercado-inmobiliario/klover-plaza-amenities-hoteleria-calidez-hogar_0_ZFeUYcNSG.html,https://images.clarin.com/2021/05/11/G9pKhqgks_720x0__1.jpg
76,ggbQsuiZE,"Edificio Cuvee. Buscá lo que necesitás y encontrá lo que soñás, con gran financiación",https://www.clarin.com/mercado-inmobiliario/edificio-cuvee-busca-necesitas-encontra-sonas--amplia-financiacion-pesos_0_ggbQsuiZE.html,https://images.clarin.com/2021/05/27/9ria-qepd_720x0__1.jpg
77,OcSI55viW,"Eduardo Duhalde. ""Alberto no está bien, duerme poco; le mandé un WhatsApp a las 2am y me contestó""",https://www.clarin.com/politica/eduardo-duhalde-alberto-bien-duerme-mande-whatsapp-2am-contesto-_0_OcSI55viW.html,https://images.clarin.com/2021/04/15/VeGGHTTMB_720x0__1.jpg
78,ZGNRoZRgG,Eurocopa. Alemania aplastó al Portugal de Cristiano Ronaldo en un partidazo,https://www.clarin.com/deportes/portugal-vs-alemania-eurocopa-2020-minuto-minuto-directo_0_ZGNRoZRgG.html,https://images.clarin.com/2021/06/19/szZe_V_hb_720x0__1.jpg
79,5gzPZauFz,Condenado a muerte. Víctor Saldaño cumple 25 años en el corredor de la muerte pero mantiene la esperanza ,https://www.clarin.com/sociedad/victor-saldano-cumple-25-anos-corredor-muerte-mantiene-esperanza-ee-uu-acate-fallo-cidh_0_5gzPZauFz.html,https://images.clarin.com/2019/05/30/2CIiyCg1f_1256x620__5.jpg#1624130945355
80,J4vkpyTJb,Femicidio en Quilmes. Hallan muerta de una puñalada en un hotel alojamiento a una mujer de 27 años,https://www.clarin.com/policiales/femicidio-hotel-quilmes-encuentran-asesinada-punalada-joven-19-anos_0_J4vkpyTJb.html,https://images.clarin.com/2021/06/19/GeG12Bz2r_720x0__1.jpg
81,Z5il9CaAW,Coronavirus. Brasil superó los 500 mil muertos y se repiten las marchas contra Jair Bolsonaro,https://www.clarin.com/mundo/brasil-supero-500-mil-muertos-coronavirus-repiten-marchas-jair-bolsonaro_0_Z5il9CaAW.html,https://images.clarin.com/2021/06/19/jsWQjM6GQ_720x0__1.jpg
82,uQs-jtC3n,"""Hija no humana"". Para un juez, una pareja y su perra eran una ""familia multiespecie""",https://www.clarin.com/sociedad/padres-hija-humana-juez-pareja-perra-formaban-familia-multiespecie-_0_uQs-jtC3n.html,https://images.clarin.com/2021/06/12/oQuoOREq9_1256x620__2.jpg#1624133493761
83,EGJ_Yv5Qu,Denuncia de expertos. La cara oculta de Wikipedia: pide donaciones aunque no las necesita,https://www.clarin.com/tecnologia/cara-oculta-wikipedia-denuncian-sigue-pidiendo-donaciones-necesita_0_EGJ_Yv5Qu.html,https://images.clarin.com/2021/06/18/BBmSEZ9-P_720x0__1.jpg
84,TzrFE6umQ,Mundos íntimos. Soy hijo de una militante de los 70: viví parte de la infancia en la semiclandestinidad,https://www.clarin.com/sociedad/mundos-intimos-hijo-militante-70-dejar-barrio-vivir-parte-infancia-semiclandestinidad_0_TzrFE6umQ.html,https://images.clarin.com/2021/06/17/Wdk7yxMCk_1256x620__2.jpg#1623954856336
85,qYlboAYE2,"Ansiedad y estrés. Los beneficios del yoga en la pandemia, que celebra su día de manera online",https://www.clarin.com/sociedad/beneficios-yoga-pandemia-ano-celebra-dia-manera-online_0_qYlboAYE2.html,https://images.clarin.com/2021/06/19/GT75rJWt4_1256x620__2.jpg#1624129444200
86,ezv8J9oHB,"Entrevista sin maquillaje. Abel Pintos, en un presente distinto: ""Todo lo que quiero hoy es construir""",https://www.clarin.com/espectaculos/musica/abel-pintos--presente-perfecto-mentiras-miedos-quiero-hoy-construir_0_ezv8J9oHB.html,https://images.clarin.com/2021/06/19/xHkWABUUP_720x0__1.jpg
87,S3WrsyLfN,"Historia y homenaje. Güemes a contraluz, retrato y preguntas sobre los gauchos",https://www.clarin.com/revista-n/escenarios/television/guemes-contraluz-retrato-preguntas-gauchos_0_S3WrsyLfN.html,https://images.clarin.com/2019/05/08/s0WixOLFg_1200x0__2.jpg#1624058713529
88,WWaAFDIA7,"Estados Unidos. La Casa Blanca anunció la muerte de 'Champ', uno de los perros de Joe Biden",https://www.clarin.com/mundo/casa-blanca-anuncio-muerte-champ-perros-presidente-joe-biden_0_WWaAFDIA7.html,https://images.clarin.com/2021/06/19/L27-ZkXo8_720x0__1.jpg
89,CDEbeHtsJ,Debate en Países Bajos. La carroza de los reyes Guillermo y Máxima: ¿un símbolo del racismo?,https://www.clarin.com/mundo/carroza-dorada-reyes-guillermo-maxima-simbolo-racismo-paises-bajos-_0_CDEbeHtsJ.html,https://images.clarin.com/2021/06/19/R5-OtxvYx_720x0__1.jpg
90,zrKuvUaTs,"Esteban De Jesús. Cárcel, drogas y muerte prematura: la vida del boxeador que noqueó a Mano de Piedra Durán",https://www.clarin.com/deportes/carcel-drogas-muerte-prematura-vih-caida-esteban-jesus-boxeador-sorprendio-mundo-noquear-mano-piedra-duran_0_zrKuvUaTs.html,https://images.clarin.com/2021/06/17/0G5NA2qfG_1256x620__2.jpg#1623967655820
91,Ae59xO2IW,Día del Padre. Qué regalarle a los papás según su signo del zodíaco,https://www.clarin.com/astrologia/regalarle-papa-signo_0_Ae59xO2IW.html,https://images.clarin.com/2021/06/18/ap50rBcOL_720x0__1.jpg
