n,id,title,url,image
1,euJOtlS3h,Clases presenciales. La Procuración dictaminó que la Corte puede tratar el amparo de la Ciudad por el cierre de escuelas,https://www.clarin.com/politica/procuracion-dictamino-corte-suprema-puede-tratar-amparo-ciudad-cierre-escuelas_0_euJOtlS3h.html,https://images.clarin.com/2021/04/16/KF4kI6-0P_720x0__1.jpg
2,gFG3mwwUq,"Del editor. Alberto Fernández, solo y a la intemperie",https://www.clarin.com/opinion/alberto-fernandez-solo-intemperie_0_gFG3mwwUq.html,https://images.clarin.com/2021/04/16/O8RHtxPgh_720x0__1.jpg
3,eeQHkSFSa,Ya rigen las medidas. Caos en el regreso a casa en el primer día de las restricciones para circular,https://www.clarin.com/politica/caos-regreso-casa-primer-dia-nuevas-restricciones-circulacion_0_eeQHkSFSa.html,https://images.clarin.com/2021/04/16/vIrIFfGPe_720x0__1.jpg
4,ClabvFePd,Puente Pueyrredón. Bajaron a una familia del colectivo e intervino Frederic para que pueda viajar,https://www.clarin.com/sociedad/puente-pueyrredon-bajaron-familia-colectivo-frederic-ordeno-permitieran-continuar-viaje_0_ClabvFePd.html,https://images.clarin.com/2021/04/16/tifrQjVKg_720x0__1.jpg
5,WgNkv6AP3,"Entre policías y agentes. El bar ""rebelde"" de Palermo que se resistió a cerrar pese a las nuevas medidas",https://www.clarin.com/ciudades/bar-rebelde-resistio-cerrar-pese-restricciones-impuso-gobierno_0_WgNkv6AP3.html,https://images.clarin.com/2021/04/16/NvTcZHtkB_720x0__1.jpg
6,oQlikoA-W,"La segunda ola. Coronavirus: reportaron 29.472 casos positivos, nuevo récord para un día",https://www.clarin.com/sociedad/coronavirus-argentina-reportan-29-472-casos-nuevos-nuevo-record-contagios-dia_0_oQlikoA-W.html,https://images.clarin.com/2021/04/16/Fv-TlIuCv_1256x620__2.jpg#1618611292583
7,Lj3lZ25Qk,“Echar al diablo”: la Iglesia da cursos de exorcismo por Zoom,https://www.clarin.com/mundo/crecen-exorcismos-ahora-iglesia-da-cursos-zoom-sacar-diablo-cuerpo_0_Lj3lZ25Qk.html,https://images.clarin.com/2021/04/12/5fIF9cGKy_720x0__1.jpg
8,INTNs_Ok8,En Santiago del Estero. Borré termina con su sequía y River amplía la ventaja en Santiago del Estero,https://www.clarin.com/deportes/central-cordoba-vs-river-copa-liga-profesional-minuto-minuto-directo_0_INTNs_Ok8.html,https://images.clarin.com/2021/04/16/3NxNywFFh_720x0__1.jpg
9,mwMxcy2WU,Ahorro. Así es el plan para comprar computadoras de alta gama en cuotas,https://www.clarin.com/economia/plan-comprar-computadoras-alta-gama-cuotas_0_mwMxcy2WU.html,https://images.clarin.com/2020/11/11/6C0ynCzuZ_720x0__1.jpg
10,uzLyhTbQD,Cómo inscribirse. Los cinco mejores cursos gratuitos online para estudiar en Harvard,https://www.clarin.com/servicios/mejores-cursos-gratuitos-online-estudiar-harvard-inscribirse_0_uzLyhTbQD.html,https://images.clarin.com/2018/11/19/1RZfXReV__720x0__1.jpg
11,EpSy7gnEQ,En el Palacio Pizzurno. Masiva protesta de padres por la suspensión de clases presenciales,https://www.clarin.com/sociedad/coronavirus-padres-alumnos-protestan-gobierno-suspension-clases-presenciales-amba_0_EpSy7gnEQ.html,https://images.clarin.com/2021/04/16/LEUTromRY_720x0__1.jpg
12,rMjxzK4sX,Alais y los tanques que avanzaban para no llegar. Secretos a 34 años del alzamiento de Semana Santa,https://www.clarin.com/historias/general-alais-tanques-leales-avanzaban-llegar-secretos-34-anos-alzamiento-carapintada-semana-santa_0_rMjxzK4sX.html,https://images.clarin.com/2021/04/15/QgHWCZXfE_720x0__1.jpg
13,euJOtlS3h,Clases presenciales. La Procuración dictaminó que la Corte puede tratar el amparo de la Ciudad por el cierre de escuelas,https://www.clarin.com/politica/procuracion-dictamino-corte-suprema-puede-tratar-amparo-ciudad-cierre-escuelas_0_euJOtlS3h.html,https://images.clarin.com/2021/04/16/KF4kI6-0P_720x0__1.jpg
14,gFG3mwwUq,"Del editor. Alberto Fernández, solo y a la intemperie",https://www.clarin.com/opinion/alberto-fernandez-solo-intemperie_0_gFG3mwwUq.html,https://images.clarin.com/2021/04/16/O8RHtxPgh_720x0__1.jpg
15,eeQHkSFSa,Ya rigen las medidas. Caos en el regreso a casa en el primer día de las restricciones para circular,https://www.clarin.com/politica/caos-regreso-casa-primer-dia-nuevas-restricciones-circulacion_0_eeQHkSFSa.html,https://images.clarin.com/2021/04/16/vIrIFfGPe_720x0__1.jpg
16,ClabvFePd,Puente Pueyrredón. Bajaron a una familia del colectivo e intervino Frederic para que pueda viajar,https://www.clarin.com/sociedad/puente-pueyrredon-bajaron-familia-colectivo-frederic-ordeno-permitieran-continuar-viaje_0_ClabvFePd.html,https://images.clarin.com/2021/04/16/tifrQjVKg_720x0__1.jpg
17,WgNkv6AP3,"Entre policías y agentes. El bar ""rebelde"" de Palermo que se resistió a cerrar pese a las nuevas medidas",https://www.clarin.com/ciudades/bar-rebelde-resistio-cerrar-pese-restricciones-impuso-gobierno_0_WgNkv6AP3.html,https://images.clarin.com/2021/04/16/NvTcZHtkB_720x0__1.jpg
18,oQlikoA-W,"La segunda ola. Coronavirus: reportaron 29.472 casos positivos, nuevo récord para un día",https://www.clarin.com/sociedad/coronavirus-argentina-reportan-29-472-casos-nuevos-nuevo-record-contagios-dia_0_oQlikoA-W.html,https://images.clarin.com/2021/04/16/Fv-TlIuCv_1256x620__2.jpg#1618611292583
19,Lj3lZ25Qk,“Echar al diablo”: la Iglesia da cursos de exorcismo por Zoom,https://www.clarin.com/mundo/crecen-exorcismos-ahora-iglesia-da-cursos-zoom-sacar-diablo-cuerpo_0_Lj3lZ25Qk.html,https://images.clarin.com/2021/04/12/5fIF9cGKy_720x0__1.jpg
20,6r-QivM3W,Entrevista a Chloé Zhao. La directora de Nomadland que se emocionó con Campanella y va por el Oscar,https://www.clarin.com/espectaculos/cine/premios-oscar-2021-directora-nomadland-emociono-campanella_0_6r-QivM3W.html,https://images.clarin.com/2021/04/15/W5Ldkf2RH_720x0__1.jpg
21,QLyPx9fF6,Qué cambiará. Concluye la era Castro en Cuba: renuncia Raúl y llama al diálogo con EE.UU.,https://www.clarin.com/mundo/concluye-castro-cuba-renuncia-raul-llama-dialogo-unidos_0_QLyPx9fF6.html,https://images.clarin.com/2021/04/16/fQkFS6iDy_720x0__1.jpg
22,jfNAAZQWW,Estaba en Sierra Chica. Liberan a un preso que llevaba más de 20 años con la pena cumplida y no quería dejar la cárcel,https://www.clarin.com/policiales/liberan-preso-llevaba-20-anos-pena-cumplida-queria-irse-carcel_0_jfNAAZQWW.html,https://images.clarin.com/2021/04/16/HPgOI2iq4_720x0__1.jpg
23,FFWdNIzzj,Estados Unidos. El último consejo de Jeff Bezos como CEO de Amazon en su carta despedida,https://www.clarin.com/tecnologia/ultimo-consejo-jeff-bezos-ceo-amazon-carta-despedida_0_FFWdNIzzj.html,https://images.clarin.com/2021/02/18/5lf6LC7IG_720x0__1.jpg
24,nr5Goniwl,Patologías asociadas. Coronavirus: cuando la señal de alerta la dan los ojos,https://www.clarin.com/buena-vida/coronavirus-senal-alerta-dan-ojos_0_nr5Goniwl.html,https://images.clarin.com/2021/04/16/ypY0neo-h_720x0__1.jpg
25,uCxmonyy5,Casos asintomáticos. Los 8 signos que alertan que pudiste tener coronavirus sin saberlo,https://www.clarin.com/internacional/covid-19-8-signos-alertan-pudiste-tener-coronavirus-saberlo_0_uCxmonyy5.html,https://images.clarin.com/2021/04/15/pXYF_bXXS_720x0__1.jpg
26,09gjx-4Q-,"Tenía 52 años. Murió Helen McCrory, actriz de Peaky Blinders y Harry Potter",https://www.clarin.com/espectaculos/cine/murio-helen-mccrory-actriz-peaky-blinders-harry-potter_0_09gjx-4Q-.html,https://images.clarin.com/2021/04/16/dMQZFMUsu_720x0__1.jpg
27,nv--p6vJT,Cuentas claras. Los 5 métodos más eficientes para salir de las deudas y no volver a caer,https://www.clarin.com/servicios/5-metodos-eficientes-salir-deudas-volver-caer_0_nv--p6vJT.html,https://images.clarin.com/2021/04/15/aDhZJ-mVJ_720x0__1.jpg
28,8K8d_TCOt,Restricciones en el AMBA. Cambian los horarios de los partidos por las medidas: cómo se juega la fecha 10,https://www.clarin.com/deportes/nuevas-restricciones-coronavirus-gobierno-exigio-afa-jueguen-partidos-futbol-despues-20_0_8K8d_TCOt.html,https://images.clarin.com/2021/04/16/I93u7MJmu_720x0__1.jpg
29,-wl8IfzT5,"En una entrevista. Cascini habló de todo: Wanchope, Pergolini, Cavani y su pedido de disculpas a Tevez",https://www.clarin.com/deportes/cascini-hablo-wanchope-pergolini-cavani-pedido-disculpas-tevez_0_-wl8IfzT5.html,https://images.clarin.com/2021/04/16/q_UiH7yMH_720x0__1.jpg
30,iAtmoA34q,"2-0 en Liniers. Vélez superó a Huracán, se afirma en la cima y está a un paso de la clasificación",https://www.clarin.com/deportes/velez-vs-huracan-copa-liga-profesional-minuto-minuto-directo_0_iAtmoA34q.html,https://images.clarin.com/2021/04/16/OyCh9fIct_720x0__1.jpg
31,dTrOIQLQj,1-0 en Mar del Plata. Rosario Central le ganó a Aldosivi con un gol de Zabala sobre el final y sueña,https://www.clarin.com/deportes/aldosivi-vs-rosario-central-copa-liga-profesional-minuto-minuto-directo_0_dTrOIQLQj.html,https://images.clarin.com/2021/04/16/vLkSKD7js_720x0__1.jpg
32,LCCJ83TPQ,3-0 en Córdoba. Talleres goleó a Unión y desplazó a Boca de los primeros cuatro puestos,https://www.clarin.com/deportes/talleres-vs-union-copa-liga-profesional-minuto-minuto-directo_0_LCCJ83TPQ.html,https://images.clarin.com/2021/04/16/uNSwgNEuL_720x0__1.jpg
33,9LMxmAHOf,Billie Jean King Cup. Un triunfo histórico de Lourdes Carlé salvó la caída de Nadia Podoroska,https://www.clarin.com/deportes/triunfo-historico-lourdes-carle-salvo-increible-caida-podoroska_0_9LMxmAHOf.html,https://images.clarin.com/2021/04/16/GlcXxbDi3_1256x620__2.jpg#1618611264102
34,IrEVe6NQF,"Otra enorme sorpresa . Al igual que Djokovic, Rafa Nadal se despidió del Masters 1000 de Montecarlo",https://www.clarin.com/deportes/-sorpresa-eliminacion-novak-djokovic-rafael-nadal-pasa-mal-andrey-rublev-montecarlo_0_IrEVe6NQF.html,https://images.clarin.com/2021/04/16/DMtJASDZf_720x0__1.jpg
35,S89pcQv3i,"Equipo por equipo. De torneo ""para el retiro"" a mercado top: comienza la MLS con 46 argentinos",https://www.clarin.com/deportes/torneo-retiro-mercado-top-comienza-mls--nueva-liga-elegida-jugadores-argentinos_0_S89pcQv3i.html,https://images.clarin.com/2020/10/16/bWo49tln0_720x0__1.jpg
36,w1679ZZgS,"En medio de la tensión. Alberto F. habló con Trotta, que tiene la esperanza de volver a las aulas en 15 días",https://www.clarin.com/politica/medio-tension-alberto-fernandez-llamo-nicolas-trotta-ministro-mantiene-esperanza-volver-15-dias-aulas_0_w1679ZZgS.html,https://images.clarin.com/2021/04/16/AapwwJzx7_720x0__1.jpg
37,X8UYVYfFz,Escuelas sin clases. Expertos cuestionan la variable que se usó para justificar el cierre,https://www.clarin.com/sociedad/clases-presenciales-expertos-cuestionan-variable-uso-alberto-f-justificar-cierre-escuelas_0_X8UYVYfFz.html,https://images.clarin.com/2021/04/16/aU_SH3ThW_1256x620__2.jpg#1618596592150
38,fX4wibA5k,Manejo sanitario. El cierre de escuelas y el riesgo de que la política se quede sin datos inobjetables,https://www.clarin.com/sociedad/coronavirus-cierre-escuelas-riesgo-politica-sanitaria-novela-kafka_0_fX4wibA5k.html,https://images.clarin.com/2021/04/16/wgajp-FjF_720x0__1.jpg
39,PIXsWJ3Ub,"Reacción de Larreta. ""Vamos a hacer todo para que los chicos estén en las aulas el próximo lunes""",https://www.clarin.com/politica/horacio-rodriguez-larreta-dara-conferencia-prensa-reunion-alberto-fernandez_0_PIXsWJ3Ub.html,https://images.clarin.com/2021/04/16/r8ZwWcCZQ_720x0__1.jpg
40,13wzEbbic,Roces en el Gobierno. Una encuesta le puso números al avance de Cristina sobre el poder de Alberto F.,https://www.clarin.com/politica/encuesta-puso-numeros-avance-cristina-kirchner-poder-alberto-fernandez_0_13wzEbbic.html,https://images.clarin.com/2021/03/06/SwyqWXuhY_720x0__1.jpg
41,A5lSubicS,"Golpe al bolsillo. Tras la inflación récord, YPF incrementa un 6% el precio de la nafta",https://www.clarin.com/economia/inflacion-record-ypf-aumenta-manana-6-nafta_0_A5lSubicS.html,https://images.clarin.com/2021/04/16/ZA7SZ0rfH_1256x620__2.jpg#1618594417766
42,nLmGn1t1K,Posible mala praxis. Imputan a Aníbal Lotocki por la muerte de un paciente tras una cirugía,https://www.clarin.com/policiales/imputan-anibal-lotocki-muerte-paciente_0_nLmGn1t1K.html,https://images.clarin.com/2016/10/20/ry-FVW8RQx_720x0.jpg
43,xY4WMRjRv,Más eficientes. Se lanzó una nueva generación de cosechadoras con la más alta tecnología,https://www.clarin.com/brandstudio/lanzo-nueva-generacion-cosechadoras-alta-tecnologia_0_xY4WMRjRv.html,https://images.clarin.com/2021/04/15/h9sXbRo2S_720x0__1.jpg
44,xgHBN__P1,"""Inconstitucional"". El Gobierno porteño presentó el amparo contra el cierre de las escuelas",https://www.clarin.com/politica/ciudad-presento-amparo-cierre-escuelas-hablo-normativa-irrazonable-_0_xgHBN__P1.html,https://images.clarin.com/2021/04/15/L5uoc30Kw_720x0__1.jpg
45,u0kvcpeDn,Nuevas medidas. En los bares y restaurantes del AMBA la gente siguió adentro y nadie controló,https://www.clarin.com/sociedad/bares-restaurantes-amba-gente-siguio-adentro-nadie-controlo_0_u0kvcpeDn.html,https://images.clarin.com/2021/04/16/cV7ZB1Wji_1256x620__2.jpg#1618598163444
46,nFmY9rN_D,Vicente López. Jorge Macri presentó un amparo para que sigan las clases presenciales,https://www.clarin.com/politica/segunda-ola-coronavirus-jorge-macri-presento-amparo-sigan-clases-presenciales-vicente-lopez_0_nFmY9rN_D.html,https://images.clarin.com/2021/04/16/izCEAPcyX_720x0__1.jpg
47,ETVR-kurb,Van a la Justicia. Dos colegios convocan a sus alumnos para ir a clases el lunes,https://www.clarin.com/sociedad/escuela-plata-va-justicia-convoca-alumnos-ir-clases-lunes_0_ETVR-kurb.html,https://images.clarin.com/2021/04/16/1uBNrFKci_1256x620__2.jpg#1618583574242
48,bxEIhXllp,"Olivos. Alberto F. apuntó a Bullrich por el cacerolazo: ""La he visto en el ocaso""",https://www.clarin.com/politica/alberto-fernandez-apunto-patricia-bullrich-cacerolazo-olivos-visto-terminar-ocaso-_0_bxEIhXllp.html,https://images.clarin.com/2021/02/09/B7_Ra08xq_720x0__1.jpg
49,uqBjINWc7,Colegios privados. Padres convocan a manifestaciones contra el cierre ,https://www.clarin.com/sociedad/colegios-privados-padres-convocan-manifestaciones-cierre-escuelas_0_uqBjINWc7.html,https://images.clarin.com/2021/04/15/RQK6AGFF9_1256x620__3.jpg#1618599177207
50,_9K_4ci-0,"Turismo rural. Maridaje de quesos y vinos, una tendencia en suelo bonaerense",https://www.clarin.com/viajes/escapadas-maridaje-quesos-vinos-tendencia-suelo-bonaerense_0__9K_4ci-0.html,https://images.clarin.com/2021/04/16/6syRfobcA_720x0__1.jpg
51,fFS8w2HVY,Vida en pandemia. La familia que fotografió el paso a paso de su cuarentena,https://www.clarin.com/viva/coronavirus-argentina-familia-fotografio-paso-paso-cuarentena_0_fFS8w2HVY.html,https://images.clarin.com/2021/04/13/fxguNmnzZ_720x0__1.jpg
52,B40q5unNo,"Ecoturismo. Escapadas de otoño: 8 reservas naturales, un respiro al aire libre",https://www.clarin.com/viajes/escapadas-otono-8-reservas-naturales-respiro-aire-libre_0_B40q5unNo.html,https://images.clarin.com/2021/04/13/fZIErdGbs_720x0__1.jpg
53,5Uk-qPE8H,"Mercedes-Benz EQS. El ""anti-Tesla"" con cine incorporado y puertas que se abren y se cierran solas",https://www.clarin.com/autos/mercedes-benz-eqs-anti-tesla-cine-incorporado-puertas-abren-cierran-solas_0_5Uk-qPE8H.html,https://images.clarin.com/2021/04/16/FTOdryFm5_720x0__1.jpg
54,zd5vbiKZw,Llega desde China. Jetour X70: espacio y confort para siete pasajeros,https://www.clarin.com/autos/jetour-x70-espacio-confort-pasajeros_0_zd5vbiKZw.html,https://images.clarin.com/2021/04/16/xAvcVF33Q_720x0__1.jpg
55,cWXuXaWyp,"Ciclos planetarios. El ""reloj"" astrológico de la vida: cuáles son las edades claves",https://www.clarin.com/astrologia/reloj-astrologico-vida-edades-claves_0_cWXuXaWyp.html,https://images.clarin.com/2021/04/15/Bf8egC3Yb_720x0__1.jpg
56,gkv5VdfKJ,Opinión. Cómo evitar transmitir nuestros miedos a los niños,https://www.clarin.com/familias/evitar-transmitir-miedos-ninos_0_gkv5VdfKJ.html,https://images.clarin.com/2021/04/15/_J2D6QYZt_720x0__1.jpg
57,gkM0rSImu,Patrocinado. Cómo aprovechar las ventajas del blanqueo impositivo e invertir en San Telmo,https://www.clarin.com/mercado-inmobiliario/aprovechar-ventajas-blanqueo-impositivo-invertir-san-telmo_0_gkM0rSImu.html,https://images.clarin.com/2021/04/13/YWlnM3T-S_720x0__1.jpg
58,L_Cfcyihq,En San Telmo. Invertí y comenzá a cobrar alquiler hasta la posesión,https://www.clarin.com/mercado-inmobiliario/inverti-san-telmo-comenza-cobrar-alquiler-posesion_0_L_Cfcyihq.html,https://images.clarin.com/2021/03/17/P3bQz9HnN_720x0__1.jpg
59,RnDCXdAqB,Solar Bustamante. Para mudarse con categoría y estilo en una esquina única,https://www.clarin.com/mercado-inmobiliario/solar-bustamante-identidad-palermo-categoria-estilo_0_RnDCXdAqB.html,https://images.clarin.com/2020/09/01/9s-MMDBF9_720x0__1.jpg
60,d7GR8WGdY,Mine Newbery. La nueva estrella de La Imprenta,https://www.clarin.com/mercado-inmobiliario/mine-newbery-proyecto-imperdible-pleno-barrio-imprenta_0_d7GR8WGdY.html,https://images.clarin.com/2020/11/09/61Go-_7CD_720x0__1.jpg
61,m50YRWT_x,Charcas Live. Invertí en pesos y en un producto premium,https://www.clarin.com/mercado-inmobiliario/inverti-pesos-producto-premium_0_m50YRWT_x.html,https://images.clarin.com/2021/03/05/YlVCe0xV2_720x0__1.jpg
62,hRAaQxf6y,Dos ambientes. El mejor momento para comprar en Palermo Soho,https://www.clarin.com/brandstudio/mejor-momento-comprar-palermo-soho_0_hRAaQxf6y.html,https://images.clarin.com/2021/03/18/2Kszwqqc9_720x0__1.jpg
63,60Eslgunc,Video. Una oveja derriba a un dron con un cabezazo para defender a sus crías,https://www.clarin.com/viste/oveja-derriba-dron-cabezazo-defender-crias_0_60Eslgunc.html,https://images.clarin.com/2021/04/15/FXxRysUON_720x0__1.jpg
64,1hArzoLpa,"Viral. ""Fueron 100 días horribles"": pasó tres meses buscando a su perro y así fue su emotivo reencuentro",https://www.clarin.com/viste/-100-dias-horribles-paso-meses-buscando-perro-emotivo-reencuentro_0_1hArzoLpa.html,https://images.clarin.com/2021/04/16/bSINBF90G_720x0__1.jpg
65,0O4JZL_Pe,"En Polonia. La historia detrás de la ""bestia del árbol"" que aterrorizó a un barrio",https://www.clarin.com/viste/historia-detras-bestia-arbol-aterrorizo-barrio_0_0O4JZL_Pe.html,https://images.clarin.com/2021/04/15/EUPL5mhX0_720x0__1.jpg
66,SetG9UlHH,En Texas. Una espeluznante criatura marina atacó y picó a un niño de 8 años,https://www.clarin.com/internacional/estados-unidos/espeluznante-criatura-marina-ataco-pico-nino-8-anos_0_SetG9UlHH.html,https://images.clarin.com/2021/04/16/u4KxxskTB_720x0__1.jpg
67,nAwGOiIBJ,Hecha la ley.... Un hombre se casa cuatro veces para tener las vacaciones pagas,https://www.clarin.com/internacional/insolito-hombre-casa-veces-mes-poder-tener-vacaciones-pagas_0_nAwGOiIBJ.html,https://images.clarin.com/1969/12/31/HJ0PI93Ql_1256x620__1.jpg#1618586006528
68,rGq3cGt79,17 de abril. Se viene el primer festival virtual de América,https://www.clarin.com/brandstudio/viene-primer-festival-virtual-america_0_rGq3cGt79.html,https://images.clarin.com/2021/04/13/bCVMQM41E_1256x620__2.jpg#1618342226195
69,2mRqBisUb,En apenas 48 horas. Conmoción en Santa Fe por la muerte de toda una familia por coronavirus,https://www.clarin.com/sociedad/conmocion-santa-fe-muerte-toda-familia-causa-coronavirus_0_2mRqBisUb.html,https://images.clarin.com/2021/04/16/Z9LbFmmNp_720x0__1.jpg
70,SWpGJKJ0Q,Por las nuevas medidas. Falabella adelanta su cierre: qué productos quedaron en stock online y a qué precios,https://www.clarin.com/zonales/falabella-adelanta-cierre-productos-quedaron-stock-online-precios_0_SWpGJKJ0Q.html,https://images.clarin.com/2021/04/15/HkPepwCnE_1256x620__2.jpg#1618595756993
71,V7FQIroXJ,"De ""amigo"" a ""ingrato"". Fernández-Larreta: la relación se rompió y ahora la apuesta es ""salvar"" el diálogo ",https://www.clarin.com/politica/amigo-ingrato-relacion-alberto-fernandez-horacio-rodriguez-larreta-rompio-ahora-apuesta-salvar-dialogo-institucional_0_V7FQIroXJ.html,https://images.clarin.com/2021/04/16/_BMHeErPf_720x0__1.jpg
72,fv7Zokzvt,Cierre de escuelas. Duros mensajes de Lavagna contra el Gobierno por las restricciones,https://www.clarin.com/politica/duros-mensajes-roberto-lavagna-gobierno-cierre-escuelas-manejo-pandemia_0_fv7Zokzvt.html,https://images.clarin.com/2019/10/20/_D90bhm9_720x0__1.jpg
73,sPsSaTboB,Fue denunciada. El descargo de la modelo de 24 años que se vacunó contra el Covid en Merlo,https://www.clarin.com/sociedad/descargo-antonella-delmonte-modelo-24-anos-vacuno-coronavirus-merlo_0_sPsSaTboB.html,https://images.clarin.com/2021/04/15/aHFTXhRc0_720x0__1.jpg
74,-gDlG2Z1w,"No se guardó nada. Érica Rivas hizo una grave denuncia contra Francella: ""Me dijo feminazi""",https://www.clarin.com/fama/erica-rivas-hizo-grave-denuncia-guillermo-francella-dijo-feminazi-_0_-gDlG2Z1w.html,https://images.clarin.com/2020/04/17/7HxqdKw7J_720x0__1.jpg
75,2qHDz22JO,En La Plata. Pablo Lunati dio más detalles del día de su pelea a las piñas con Juan Sebastián Verón,https://www.clarin.com/deportes/pablo-lunati-dio-detalles-dia-pelea-pinas-juan-sebastian-veron_0_2qHDz22JO.html,https://images.clarin.com/2021/04/16/8pwII8cW9_720x0__1.jpg
76,4HK9Q2bsc,Nueva Marca País. Cómo ganar pasajes y estadías en diversos destinos argentinos,https://www.clarin.com/brandstudio/ganar-pasajes-estadias-diversos-destinos-argentinos_0_4HK9Q2bsc.html,https://images.clarin.com/2020/04/05/xgJYmTvmP_720x0__1.jpg
