n,id,title,url,image
1,4rIoeSIH1s,El mundo en vilo. Declaración de guerra: Putin lanzó una ofensiva total contra Ucrania,https://www.clarin.com/mundo/vladimir-putin-anuncio-operacion-militar-ucrania-unidos-pide-tropas-regresen-cuartel_0_4rIoeSIH1s.html,https://images.clarin.com/2022/02/24/XTepeQiOp_720x0__1.jpg
2,kqzpNOmFEK,"La guerra, minuto a minuto. En vivo: Moscú dice que “Ucrania necesita ser liberada y limpiada de nazis”",https://www.clarin.com/mundo/guerra-rusia-ucrania-vivo-ucrania-afirma-asesinado-50-soldados-rusos-reportan-civiles-muertos-bombardeos_0_kqzpNOmFEK.html,https://images.clarin.com/2022/02/24/ElXMZq60P_720x0__1.jpg
3,lrICkxiTSB,"Posición oficial. El Gobierno expresó su ""firme rechazo al uso de la fuerza armada"" y llamó a Rusia a cesar las acciones",https://www.clarin.com/politica/guerra-rusia-ucrania-gobierno-expreso-firme-rechazo-uso-fuerza-armada-llamo-rusia-cesar-acciones-militares_0_lrICkxiTSB.html,https://images.clarin.com/2022/02/24/6vIoFIBhs_720x0__1.jpg
4,0XMkHbeWZF,"En foco. La guerra de Putin no es contra Ucrania, es contra todo el mundo",https://www.clarin.com/mundo/guerra-vladimir-putin-ucrania-mundo_0_0XMkHbeWZF.html,https://images.clarin.com/2022/02/24/aKc-DIICo_720x0__1.jpg
5,K38fLfPbPW,"Ataque militar. Desolación, bombas y cadáveres calcinados en el este de Ucrania",https://www.clarin.com/mundo/desolacion-bombas-cadaveres-calcinados-ucrania_0_K38fLfPbPW.html,https://images.clarin.com/2022/02/24/51XbWWHbN_720x0__1.jpg
6,IjojgL4Gis,Del editor. La neutralidad del Gobierno argentino y su peligroso rebote en Malvinas,https://www.clarin.com/opinion/neutralidad-ucrania-peligroso-rebote-malvinas_0_IjojgL4Gis.html,https://images.clarin.com/2022/02/03/ut8sPbE5a_720x0__1.jpg
7,gBDYQc7HOE,"Preparan la contraofensiva. Biden: ""Putin eligió una guerra premeditada que traerá pérdida catastrófica de vidas""",https://www.clarin.com/mundo/unidos-anuncio-vladimir-putin-injustificado-provocado-ataque-ucrania-_0_gBDYQc7HOE.html,https://images.clarin.com/2022/02/24/EgL5bODaP_720x0__1.jpg
8,F9EKWYvw90,Avanzada del Kremlin. Los impactantes videos de los primeros ataques de Rusia a Ucrania,https://www.clarin.com/mundo/impactantes-videos-primeros-ataques-rusia-ucrania_0_F9EKWYvw90.html,https://images.clarin.com/2022/02/24/wvbxLHCEG_720x0__1.jpg
9,FEEzQNshyF,En plena cobertura. Un corresponsal de CNN fue sorprendido en vivo por las explosiones en Kiev,https://www.clarin.com/mundo/conflicto-rusia-ucrania-corresponsal-cnn-sorprendido-vivo-explosiones-kiev_0_FEEzQNshyF.html,https://images.clarin.com/2022/02/24/CfFGAx7PX_720x0__1.jpg
10,rIaXSqQNT8,Fotogalería. El miedo se apodera de Kiev: así se vive en Ucrania el inicio de la guerra,https://www.clarin.com/fotogalerias/miedo-apodera-kiev-vive-ucrania-medio-tensiones-actuales-rusia_5_rIaXSqQNT8.html,
11,1yytR2FnGH,"Mercados. El conflicto Rusia-Ucrania impacta en la Argentina: sube 3,4% el riesgo país y las acciones caen hasta 8%",https://www.clarin.com/economia/conflicto-rusia-ucrania-impacta-argentina-sube-3-4-riesgo-pais-acciones-caen-8-_0_1yytR2FnGH.html,https://images.clarin.com/2022/02/24/3gDo-jqsQ_720x0__1.jpg
12,SX53cL5akC,Movimientos en el Congreso. Cristina reaparece en el Senado en medio de la tensión por el acuerdo con el Fondo,https://www.clarin.com/politica/cristina-kirchner-reaparece-senado-medio-tensiones-acuerdo-fondo_0_SX53cL5akC.html,https://images.clarin.com/2021/12/31/pFAEaXoD8_720x0__1.jpg
13,XKg1WSqXur,La deuda. Diferencias sobre la suba de tarifas de luz y gas demoran el acuerdo con el FMI,https://www.clarin.com/politica/casa-rosada-admiten-ahora-acuerdo-fmi-podria-presentarse-despues-1-marzo_0_XKg1WSqXur.html,https://images.clarin.com/2022/02/22/u85fd_1HW_720x0__1.jpg
14,V7rvFP0cR2,Mayor flexibilidad. Mejoran las condiciones para tener la jubilación anticipada por desempleo,https://www.clarin.com/economia/mejoran-condiciones-acceder-jubilacion-anticipada-desempleo_0_V7rvFP0cR2.html,https://images.clarin.com/2022/02/24/_FC52KYMv_720x0__1.jpg
15,cbDer2x1kK,Por avenida Mitre. Piquete en Puente Pueyrredón: cortan el paso de Avellaneda a la Ciudad,https://www.clarin.com/ciudades/piquete-puente-pueyrredon-cortan-paso-avellaneda-ciudad_0_cbDer2x1kK.html,https://images.clarin.com/2022/02/24/VTPJGCu9H_720x0__1.jpg
16,TtifpzQv9P,Pelea presidencial. Nueva encuesta para 2023: Cristina fue la más votada y sorprenden Milei y Bullrich,https://www.clarin.com/politica/nueva-encuesta-2023-cristina-kirchner-votada-sorprenden-javier-milei-patricia-bullrich_0_TtifpzQv9P.html,https://images.clarin.com/2022/01/27/BzQZ3qfrJ_720x0__1.jpg
17,ejdPPuNRbr,"Juicio a Cristina Kirchner. Cómo simularon gastos para lavar dinero en hoteles, según el peor testigo para la vice",https://www.clarin.com/politica/juicio-cristina-kirchner-paso-paso-simularon-gastos-hoteles-lavar-dinero-peor-testigo-vice_0_ejdPPuNRbr.html,https://images.clarin.com/2021/03/08/m030nqLI2_720x0__1.jpg
18,jHpWSeYSZU,"Misterio en Caballito. ""Sabía sobre el caso Nisman"": habla la mamá del policía desaparecido hace 3 años",https://www.clarin.com/policiales/-hijo-sabia-caso-nisman-habla-madre-policia-desaparecido-hace-3-anos-caballito_0_jHpWSeYSZU.html,https://images.clarin.com/2022/02/23/44PZs1YrT_720x0__1.jpg
19,7BZUm4gxf8,"Gran Bretaña. Enferma de Covid, la reina Isabel volvió a cancelar sus compromisos virtuales",https://www.clarin.com/mundo/gran-bretana-enferma-coronavirus-reina-isabel-volvio-cancelar-compromisos-virtuales_0_7BZUm4gxf8.html,https://images.clarin.com/2021/11/16/VFVgv9Rje_720x0__1.jpg
20,WfU9LGqon1,Qué perfiles laborales busca. Tesla ofrece a argentinos 8.500 dólares mensuales y la visa para EE.UU.,https://www.clarin.com/servicios/tesla-ofrece-8-500-dolares-mensuales-visa-unidos-empleados-argentinos-perfiles-busca_0_WfU9LGqon1.html,https://images.clarin.com/2022/01/27/Rxh8nKytD_720x0__1.jpg
21,DBz3X3vdlS,"""No pienso ir atrás"". Nuevo revés para Domenech en la lucha por ver a sus hijos: ahora lo investigarán a él",https://www.clarin.com/fama/sebastian-domenech-sigue-ver-hijos-investigado-delito-desobediencia-_0_DBz3X3vdlS.html,https://images.clarin.com/2021/12/22/1JSJrACbC_720x0__1.jpg
22,supgAPmJaL,Inseguridad. Entró a robar en una maderera y el sereno le mató de un tiro en la cabeza,https://www.clarin.com/policiales/entro-robar-maderera-sereno-mato-tiro-cabeza_0_supgAPmJaL.html,https://images.clarin.com/2022/02/24/gOjTy0inB_1256x620__2.jpg#1645706243549
23,E7ffIRZZxM,Una zona histórica . El ex edificio de una tienda lujosa en Recoleta que gambeteó la demolición ,https://www.clarin.com/ciudades/ex-edificio-lujosa-tienda-moda-gambeteo-demolicion-zona-historica-recoleta_0_E7ffIRZZxM.html,https://images.clarin.com/2022/02/23/kWHUczYo4_1256x620__2.jpg#1645644816114
24,SvanQl3qTk,Finanzas. Invertir en ladrillos: qué es el crowdfunding y cómo ganar hasta un 30% en dólares,https://www.clarin.com/servicios/invertir-ladrillos-crowdfunding-ganar-30-dolares_0_SvanQl3qTk.html,https://images.clarin.com/2021/05/21/CalVlUC-p_720x0__1.jpg
25,9Nr1A0ccs4,Increible situación en Córdoba. Fue a trabajar al cementerio y encontró el féretro de su hijo tirado en una calle,https://www.clarin.com/sociedad/cordoba-trabajar-cementerio-encontro-feretro-hijo-tirado-calle_0_9Nr1A0ccs4.html,https://images.clarin.com/2022/02/24/W_kgZAavv_1256x620__2.jpg#1645709310400
26,wOxmlsLFCd,Imágenes sensibles. Video: así fue el doble femicidio en Misiones,https://www.clarin.com/policiales/video-doble-femicidio-misiones_0_wOxmlsLFCd.html,https://images.clarin.com/2022/02/23/tH9ru2aCi_1256x620__2.jpg#1645631805679
27,EnOjHQI4HJ,"Así se hacía. Yo me quiero casar...: perlitas, estafas y flechazos del ciclo que anticipó Tinder",https://www.clarin.com/espectaculos/tv/quiero-casar-usted-perlitas-estafas-flechazos-ciclo-roberto-galan-anticipo-tinder_0_EnOjHQI4HJ.html,https://images.clarin.com/2022/02/23/EhJt3rpTI_720x0__1.jpg
28,DfNrHIvAMd,Historias visuales. Las mejores 93 imágenes de hoy en la Argentina y el mundo,https://www.clarin.com/fotogalerias/fotogalerias-historias-visuales-dia-fotos-imagenes-destacadas-argentina-mundo_5_DfNrHIvAMd.html,
29,4rIoeSIH1s,El mundo en vilo. Declaración de guerra: Putin lanzó una ofensiva total contra Ucrania,https://www.clarin.com/mundo/vladimir-putin-anuncio-operacion-militar-ucrania-unidos-pide-tropas-regresen-cuartel_0_4rIoeSIH1s.html,https://images.clarin.com/2022/02/24/XTepeQiOp_720x0__1.jpg
30,kqzpNOmFEK,"La guerra, minuto a minuto. En vivo: Moscú dice que “Ucrania necesita ser liberada y limpiada de nazis”",https://www.clarin.com/mundo/guerra-rusia-ucrania-vivo-ucrania-afirma-asesinado-50-soldados-rusos-reportan-civiles-muertos-bombardeos_0_kqzpNOmFEK.html,https://images.clarin.com/2022/02/24/ElXMZq60P_720x0__1.jpg
31,lrICkxiTSB,"Posición oficial. El Gobierno expresó su ""firme rechazo al uso de la fuerza armada"" y llamó a Rusia a cesar las acciones",https://www.clarin.com/politica/guerra-rusia-ucrania-gobierno-expreso-firme-rechazo-uso-fuerza-armada-llamo-rusia-cesar-acciones-militares_0_lrICkxiTSB.html,https://images.clarin.com/2022/02/24/6vIoFIBhs_720x0__1.jpg
32,0XMkHbeWZF,"En foco. La guerra de Putin no es contra Ucrania, es contra todo el mundo",https://www.clarin.com/mundo/guerra-vladimir-putin-ucrania-mundo_0_0XMkHbeWZF.html,https://images.clarin.com/2022/02/24/aKc-DIICo_720x0__1.jpg
33,K38fLfPbPW,"Ataque militar. Desolación, bombas y cadáveres calcinados en el este de Ucrania",https://www.clarin.com/mundo/desolacion-bombas-cadaveres-calcinados-ucrania_0_K38fLfPbPW.html,https://images.clarin.com/2022/02/24/51XbWWHbN_720x0__1.jpg
34,IjojgL4Gis,Del editor. La neutralidad del Gobierno argentino y su peligroso rebote en Malvinas,https://www.clarin.com/opinion/neutralidad-ucrania-peligroso-rebote-malvinas_0_IjojgL4Gis.html,https://images.clarin.com/2022/02/03/ut8sPbE5a_720x0__1.jpg
35,gBDYQc7HOE,"Preparan la contraofensiva. Biden: ""Putin eligió una guerra premeditada que traerá pérdida catastrófica de vidas""",https://www.clarin.com/mundo/unidos-anuncio-vladimir-putin-injustificado-provocado-ataque-ucrania-_0_gBDYQc7HOE.html,https://images.clarin.com/2022/02/24/EgL5bODaP_720x0__1.jpg
36,F9EKWYvw90,Avanzada del Kremlin. Los impactantes videos de los primeros ataques de Rusia a Ucrania,https://www.clarin.com/mundo/impactantes-videos-primeros-ataques-rusia-ucrania_0_F9EKWYvw90.html,https://images.clarin.com/2022/02/24/wvbxLHCEG_720x0__1.jpg
37,FEEzQNshyF,En plena cobertura. Un corresponsal de CNN fue sorprendido en vivo por las explosiones en Kiev,https://www.clarin.com/mundo/conflicto-rusia-ucrania-corresponsal-cnn-sorprendido-vivo-explosiones-kiev_0_FEEzQNshyF.html,https://images.clarin.com/2022/02/24/CfFGAx7PX_720x0__1.jpg
38,UiKcuEySgm,"Secretario de Energía. Darío Martínez: ""No queremos repetir el tarifazo ni tener las tarifas congeladas""",https://www.clarin.com/economia/dario-martinez-secretario-energia-queremos-repetir-tarifazo-tener-tarifas-congeladas-_0_UiKcuEySgm.html,https://images.clarin.com/2021/11/26/l2KB7BpLj_720x0__1.jpg
39,OHRB3XsuvU,Ingresos Brutos. Quienes se inscriban en el régimen simplificado no pagarán por un año,https://www.clarin.com/economia/ingresos-brutos-inscriban-regimen-simplificado-pagaran-ano_0_OHRB3XsuvU.html,https://images.clarin.com/2021/07/11/akK2rRrFL_720x0__1.jpg
40,ls67lX9xtP,Debate en el FMI. Países clave dudan de que Argentina pueda cumplir con las pautas del préstamo,https://www.clarin.com/economia/paises-clave-dudan-argentina-pueda-cumplir-pautas-prestamo_0_ls67lX9xtP.html,https://images.clarin.com/2021/10/13/0AxjftXEv_720x0__1.jpg
41,AII52pQTOV,"Reunión en Energía. Con el crudo por las nubes, el Gobierno convocó a las petroleras para asegurar el abastecimiento",https://www.clarin.com/economia/gobierno-convoco-petroleras-asegurar-abastecimiento_0_AII52pQTOV.html,https://images.clarin.com/2022/01/25/Y3CNfjKb0_720x0__1.jpg
42,0l6hKMuCHh,Entre 14 y 20%. Suba del gas: será desde marzo para usuarios residenciales y pymes,https://www.clarin.com/economia/suba-gas-amba-autorizan-incremento-36-distribuidoras_0_0l6hKMuCHh.html,https://images.clarin.com/2021/10/16/f5fy_OkYF_720x0__1.jpg
43,ITLFRrcAXy,Inflación. Crean un fondo para controlar saltos en precios de verduras,https://www.clarin.com/economia/crean-fondo-controlar-saltos-estacionales-precios-verduras_0_ITLFRrcAXy.html,https://images.clarin.com/2022/02/22/L4XmY_5-7_720x0__1.jpg
44,oPusOfUAW0,De Ramos Mejía a Hong Kong. La historia del primer chef argentino con estrella Michelin en Asia,https://www.clarin.com/gourmet/ramos-mejia-hong-kong-historia-primer-chef-argentino-estrella-michelin-asia_0_oPusOfUAW0.html,https://images.clarin.com/2022/02/23/ayVB_l16p_1256x620__2.jpg#1645641382119
45,HhJHbCSQZO,"Gadgets. Spotify presentó Car Thing, un dispositivo para el tablero del auto: para qué sirve",https://www.clarin.com/tecnologia/spotify-presento-car-thing-dispositivo-tablero-auto-sirve_0_HhJHbCSQZO.html,https://images.clarin.com/2022/02/23/Lnmkq3RTb_720x0__1.jpg
46,DAJmL81yu4,Pausas activas. 5 ejercicios fáciles para evitar lesiones por pasar mucho tiempo sentado,https://www.clarin.com/buena-vida/5-ejercicios-faciles-evitar-lesiones-pasar-tiempo-sentado_0_DAJmL81yu4.html,https://images.clarin.com/2022/02/23/Z7BaNJ1uh_720x0__1.jpg
47,CGgX4NF9fG,Modelo 2014. Vuelven a subastar el Audi R8 de los trompos: piden un tercio de lo que vale,https://www.clarin.com/autos/vuelven-subastar-audi-r8-trompos-piden-tercio-vale_0_CGgX4NF9fG.html,https://images.clarin.com/2021/09/20/QPdPX4MP4_720x0__1.jpg
48,kMmbYsH4pR,Nutrición. Dieta Keto: ¿qué evidencia científica tiene?,https://www.clarin.com/buena-vida/dieta-keto-evidencia-cientifica-_0_kMmbYsH4pR.html,https://images.clarin.com/2021/10/15/50FMMm_oT_720x0__1.jpg
49,UHyyRDr7z0,"""Dirty talk"" y más. El sexo empieza antes de desnudarse: la comunicación es clave",https://www.clarin.com/relaciones/sexo-empieza-desnudarse-comunicacion-clave_0_UHyyRDr7z0.html,https://images.clarin.com/2022/02/23/7vaEkETtJ_720x0__1.jpg
50,dGFbQqHt3k,"Edificio vanguardista. Las mejores 45 fotos del impactante ""Museo del Futuro"" en Dubai",https://www.clarin.com/fotogalerias/fotos-impactante-museo-futuro-dubai-emiratos-arabes-unidos_5_dGFbQqHt3k.html,
51,gEq7imvgEU,Crítica. Belfast: No hay nada más lindo que la familia unida,https://www.clarin.com/espectaculos/cine/oscar-2022-belfast-lindo-familia-unida_0_gEq7imvgEU.html,https://images.clarin.com/2022/02/18/9U1dWlC5d_720x0__1.jpg
52,yRJLQ18UlK,Asombro mundial. Descubrieron el plano arquitectónico de trampas más antiguo de la historia,https://www.clarin.com/internacional/asombro-mundial-hallaron-plano-arquitectonico-trampas-antiguo-historia_0_yRJLQ18UlK.html,https://images.clarin.com/2022/02/22/YxldN_Fpa_720x0__1.jpg
53,RvXP1dVLU1,Mirá el video. Resuelven el misterio del centenar de pájaros muerto en pleno vuelo,https://www.clarin.com/viste/resuelven-misterio-tordos-amarillos-muertos-pleno-vuelo_0_RvXP1dVLU1.html,https://images.clarin.com/2022/02/23/m9qgPJzcF_720x0__1.jpg
54,dS8QHuc8gt,Modelo israelí. El estafador de Tinder: quién es la supuesta última novia de Simon Leviev,https://www.clarin.com/internacional/espectaculos/estafador-tinder-supuesta-ultima-novia-simon-leviev_0_dS8QHuc8gt.html,https://images.clarin.com/2022/02/22/upxHVJKcC_720x0__1.jpg
55,FxDfDjXbP4,"Ideal de belleza. Gastó casi 35.000 dólares en cirugías para tener el ""aspecto perfecto"" de las redes",https://www.clarin.com/internacional/gasto-35-000-dolares-cirugias-esteticas-tener-aspecto-perfecto-redes-sociales_0_FxDfDjXbP4.html,https://images.clarin.com/2022/02/23/PmmN_hKKu_720x0__1.jpg
56,PlciJ5toOy,Nueva fórmula. Cómo cuidar tu pelo largo,https://www.clarin.com/brandstudio/franquicias-exitosas-invertir-2022_0_PlciJ5toOy.html,https://images.clarin.com/2022/02/18/rmNdxH4OZ_720x0__1.jpg
57,UArRdBjpDx,Viaje seguro. Claves para un buen mantenimiento vehicular,https://www.clarin.com/brandstudio/claves-buen-mantenimiento-vehicular_0_UArRdBjpDx.html,https://images.clarin.com/2022/02/10/D7A90l23C_720x0__1.jpg
58,XkFLne0BvL,¡Alerta verano!. Siete días de vacaciones pueden arruinar 365 días de cabello sano,https://www.clarin.com/brandstudio/dias-vacaciones-pueden-arruinar-365-dias-cabello-sano_0_XkFLne0BvL.html,https://images.clarin.com/2022/02/15/J2tI3ijcQ_720x0__1.jpg
59,NrWvZrt7sD,Auténticos. 4 peinados para el fin de semana de Carnaval,https://www.clarin.com/brandstudio/4-peinados-fin-semana-carnaval_0_NrWvZrt7sD.html,https://images.clarin.com/2022/02/21/KQNHFhbfj_720x0__1.jpg
60,nwZLGVgog6,Nuevas tecnologías. Alternativas revolucionarias para bajar de peso y definir el cuerpo,https://www.clarin.com/brandstudio/alternativas-revolucionarias-bajar-peso-definir-cuerpo_0_nwZLGVgog6.html,https://images.clarin.com/2022/02/18/5HrF1gUbv_720x0__1.jpg
61,2T1fHOhKf4,Escenario. ¿Por qué la invasión a Ucrania es diferente a la mayoría de las guerras de los ú´ltimos 80 años?,https://www.clarin.com/new-york-times-international-weekly/-ucrania-diferente-_0_2T1fHOhKf4.html,https://images.clarin.com/2022/02/21/YvrdK1c1T_1256x620__2.jpg#1645462764444
62,4zbyNLawFl,"Clima. Los meteorólogos advierten sobre una ""crisis mundial de incendios forestales""",https://www.clarin.com/new-york-times-international-weekly/meteorologos-advierten-crisis-mundial-incendios-forestales-_0_4zbyNLawFl.html,https://images.clarin.com/2022/02/23/0_TDoEM4U_1256x620__2.jpg#1645647134659
63,YjfmKWGTGj,Tendencia. Cómo China bajo Xi Jinping se está alejando del mundo,https://www.clarin.com/new-york-times-international-weekly/china-xi-jinping-alejando-mundo_0_YjfmKWGTGj.html,https://images.clarin.com/2022/02/23/IWrEkCb1I_1256x620__2.jpg#1645647878752
64,ZYapSNWDdf,Opinión. Los límites de una Europa entera y libre,https://www.clarin.com/new-york-times-international-weekly/limites-europa-entera-libre_0_ZYapSNWDdf.html,https://images.clarin.com/2022/02/23/yUB0aKJuz_1256x620__2.jpg#1645644563676
65,3pEhhjapwH,"Vuelve a la TV. El paso de Luis Otero por la UCR: ""Gente de La Cámpora se sacaba fotos conmigo""",https://www.clarin.com/zonales/luis-otero-paso-radicalismo-militantes-campora-evita-sacaban-fotos-conmigo-_0_3pEhhjapwH.html,https://images.clarin.com/2019/03/19/mHckWbH82_720x0__1.jpg
66,pLyXoq8GFj,También cirrosis y otras fibrosis. Una medicamento creado por científicos argentinos podría sanar algunos tipos de cáncer,https://www.clarin.com/zonales/investigadores-quilmes-participan-creacion-biofarmaco-podria-tratar-fibrosis-cancer_0_pLyXoq8GFj.html,https://images.clarin.com/2022/02/08/k4-jVQelW_950x468__2.jpg#1644344631053
67,x1z9dbdG5A,Tercera Sección. Se tomaron licencia pero no dejan el poder: los intendentes que presidirán el PJ,https://www.clarin.com/zonales/tomaron-licencia-conservan-poder-intendentes-gba-presidiran-pj-municipios_0_x1z9dbdG5A.html,https://images.clarin.com/2022/02/18/roAe3H1eP_720x0__1.jpg
68,IpQCPVLOUa,Automovilismo. Quién es el pibe de Pilar que es la máxima apuesta argentina para llegar a la F1,https://www.clarin.com/zonales/pilar-maxima-apuesta-argentina-llegar-formula-1_0_IpQCPVLOUa.html,https://images.clarin.com/2022/02/03/8of6xKzeC_1256x620__2.jpg#1644866974049
69,a2omJJExfS,Gran celebración. Mirtha Legrand festejó su cumpleaños de 95: las fotos y quiénes fueron los invitados,https://www.clarin.com/fama/fotos-cumpleanos-mirtha-legrand-junto-familiares-amigos-intimos_0_a2omJJExfS.html,https://images.clarin.com/2022/02/23/Z5AUk4c8X_720x0__1.jpg
70,AcgojtGjgn,Todo mal. El Dipy tuvo un durísimo cruce con Alberto Samid y lo desafió a pelear,https://www.clarin.com/fama/dipy-durisimo-cruce-alberto-samid-desafio-pelear-guantes-tiros-_0_AcgojtGjgn.html,https://images.clarin.com/2021/01/21/drpCL0JK3_720x0__1.jpg
71,Zq30FRclyZ,Habló con Clarín. ¡Sin vueltas! Viviana Canosa enfrentó los rumores de romance con Mariano Martínez,https://www.clarin.com/fama/-vueltas-viviana-canosa-enfrento-rumores-romance-mariano-martinez_0_Zq30FRclyZ.html,https://images.clarin.com/2022/02/23/KiYwAFie__720x0__1.jpg
72,jitmyELigS,Lo que no se vio al aire. Qué pasó en el corte y cómo hizo para ingresar al estudio la mujer que irrumpió en América Noticias,https://www.clarin.com/fama/hizo-ingresar-estudio-mujer-irrumpio-america-noticias-video-paso-corte_0_jitmyELigS.html,https://images.clarin.com/2022/02/23/CTgey0GEP_720x0__1.jpg
73,oyQkq6n9PA,"""Doctor algoritmo"". Cómo funcionan los servicios de salud asistidos por inteligencia artificial",https://www.clarin.com/sociedad/-doctor-algoritmo-funcionan-servicios-salud-asistidos-inteligencia-artificial_0_oyQkq6n9PA.html,https://images.clarin.com/2022/02/20/n7-pox_YD_1256x620__2.jpg#1645388849572
74,FOXUhGAhFO,Promociones y descuentos. Vuelta al cole: cómo ahorrar plata en las compras de último momento,https://www.clarin.com/economia/promociones-descuentos-vuelta-cole-ahorrar-plata-compras-ultimo-momento_0_FOXUhGAhFO.html,https://images.clarin.com/2022/02/23/4s4H-pe8O_720x0__1.jpg
75,Cz99PvRWL,"A tres años. La muerte de Natacha Jaitt: un video inquietante, cocaína en el baño y una clave que resiste",https://www.clarin.com/policiales/muerte-natacha-jaitt-video-inquietante-cocaina-bano-clave-resiste_0_Cz99PvRWL.html,https://images.clarin.com/2019/02/23/8GKY4lkg__720x0__1.jpg
76,h50hSOxaEb,Suba de tasas. Plazos fijos: en qué casos convienen hoy y 10 claves para tener en cuenta,https://www.clarin.com/servicios/plazos-fijos-casos-convienen-hoy-10-claves-tener-cuenta-solicitarlos_0_h50hSOxaEb.html,https://images.clarin.com/2021/10/12/NpOw-mnh7_720x0__1.jpg
77,VnZMiPPDId,Duda frecuente. Adelgazar a medida que pasan los años: ¿se puede pesar lo mismo a los 50 que a los 20?,https://www.clarin.com/buena-vida/adelgazar-medida-pasan-anos-puede-pesar-mismo-50-anos-20-_0_VnZMiPPDId.html,https://images.clarin.com/2022/02/22/s4fgRG-4N_720x0__1.jpg
78,SoZr8JwDdO,Sociedad. Mundo carnicería: el corte premium y los 10 secretos de un negocio que se reinventa,https://www.clarin.com/sociedad/mundo-carniceria-corte-premium-10-secretos-negocio-reinventa_0_SoZr8JwDdO.html,https://images.clarin.com/2022/01/28/u2yb-Md7V_720x0__1.jpg
79,T1mHmV8zH,Ciudades. Buenos Aires secreta: cómo son los edificios que cuentan la historia porteña,https://www.clarin.com/ciudades/edificios-buenos-aires-10-ciudad_0_T1mHmV8zH.html,https://images.clarin.com/2022/01/05/w1gm-ejpv_720x0__1.jpg
80,xVDwNStxia,Policiales. A tres años de la muerte de Natacha Jaitt: habla el último amigo que la vio con vida,https://www.clarin.com/policiales/anos-muerte-natacha-jaitt-habla-ultimo-amigo-vio-vida_0_xVDwNStxia.html,https://images.clarin.com/2022/02/11/EgPOXPI-T_720x0__1.jpg
81,uEFL9rA0bj,Aniversario. Enigmas de la Reina eterna: Isabel cumple 70 años en el trono británico y estalla la sucesión,https://www.clarin.com/mundo/enigmas-reina-eterna-isabel-cumple-70-anos-trono-britanico-estalla-sucesion_0_uEFL9rA0bj.html,https://images.clarin.com/2022/01/31/fQCwJghce_720x0__1.jpg
82,gVAELufSwl,Programada en San Petersburgo. La UEFA convocó una reunión para mudar la final de la Champions,https://www.clarin.com/deportes/guerra-rusia-ucrania-conflicto-afecta-deporte-europa-pone-jaque-champions-league_0_gVAELufSwl.html,https://images.clarin.com/2022/02/24/21S8WxXS7_1256x620__2.jpg#1645700963270
83,ligd54046H,Las otras historias. Corea del Sur: de los karatecas que querían partir a Maradona a este equipo que asombra,https://www.clarin.com/deportes/corea-sur-karatecas-querian-partir-maradona-seleccionado-asombra_0_ligd54046H.html,https://images.clarin.com/2022/02/03/Tr970eGoK_720x0__1.jpg
84,HfZ86vnzQ8,Opinión. Expectativa por un récord de Cristiano Ronaldo que en realidad ya tiene,https://www.clarin.com/deportes/expectativa-record-cristiano-ronaldo-realidad_0_HfZ86vnzQ8.html,https://images.clarin.com/2022/02/23/hZbysliEx_720x0__1.jpg
85,Wfym0uTUsx,"Yaroslav Rakitskyy. El ucraniano del Zenit que juega con 25 compañeros rusos: ""¡Detengan la guerra!""",https://www.clarin.com/deportes/rakitskyy-ucraniano-zenit-juega-25-companeros-rusos-detengan-guerra-_0_Wfym0uTUsx.html,https://images.clarin.com/2022/02/24/zUsY2oW2U_1256x620__2.jpg#1645708052400
86,IVfCNibrUL,"Primer triunfo. Racing, Milito, Alcaraz y el loco partido del número 22 en Avellaneda",https://www.clarin.com/deportes/racing-milito-alcaraz-loco-partido-numero-22-avellaneda_0_IVfCNibrUL.html,https://images.clarin.com/2022/02/22/m84Ey56bx_720x0__1.jpg
87,,Vuelve un clásico. Gran DT arranca este jueves: ¡armá YA tu equipo!,,
