n,id,title,url,image
1,-DkernBnM,Decisión del Presidente. El Gobierno sube levemente el cupo para que más varados en el exterior puedan regresar al país,https://www.clarin.com/politica/gobierno-sube-levemente-cupo-ingresos-pais-forma-progresiva-fin-mes-podran-volver-1-000-argentinos-dia_0_-DkernBnM.html,https://images.clarin.com/2021/07/05/sQ-uN8vLm_720x0__1.jpg
2,lJpDUvn4Z,Masiva movilización. En la protesta del campo también reclamaron por las vacunas y las restricciones,https://www.clarin.com/rural/comenzo-protesta-campo-gobierno-pais_0_lJpDUvn4Z.html,https://images.clarin.com/2021/07/09/AiLaJqh84_720x0__1.jpg
3,PrQhlRoKd,"Acto por el 9 de Julio. Alberto Fernández: ""Si alguien espera que claudique ante un laboratorio se equivoca""",https://www.clarin.com/politica/vivo-alberto-fernandez-encabeza-acto-dia-independencia-tucuman-medio-protestas_0_PrQhlRoKd.html,https://images.clarin.com/2021/07/09/AFHngk3mA_720x0__1.jpg
4,JRClc_0-3,En Tucumán. El error histórico del Presidente al mencionar a Macacha Güemes,https://www.clarin.com/politica/error-historico-alberto-fernandez-acto-dia-independencia-mencionar-macacha-guemes_0_JRClc_0-3.html,https://images.clarin.com/2021/07/09/S_rDGgKsi_720x0__1.jpg
5,2EHK3Px74,"En Bahía Blanca. Original protesta de ganaderos: ofrecieron ""vaca china"" al asador",https://www.clarin.com/economia/original-protesta-ganaderos-ofrecieron-vaca-china-asador_0_2EHK3Px74.html,https://images.clarin.com/2021/07/09/3yx3WjQJx_720x0__1.jpg
6,Lz_4qGbhA,Avance de la pandemia. Sputnik V y la escasez de segundas dosis: cuántas faltan y cómo harán para conseguirlas,https://www.clarin.com/ciudades/sputnik-v-escasez-componente-2-cuantas-vacunas-faltan-haran-conseguirlas_0_Lz_4qGbhA.html,https://images.clarin.com/2021/06/07/VCtpZptv__1256x620__3.jpg#1625845391466
7,PcmDCLJ-e,Coronavirus:. Reportan otras 244 muertes y Argentina superó los 98 mil fallecidos,https://www.clarin.com/sociedad/coronavirus-reportan-244-muertes-argentina-supero-98-mil-fallecidos_0_PcmDCLJ-e.html,https://images.clarin.com/2021/07/07/4vwHwKqv7_720x0__1.jpg
8,h0sN2zjTl,"Covid y neumonía. ""El 70% de los pacientes graves sufren secuelas no menos de 6 meses""",https://www.clarin.com/sociedad/neumonia-covid-70-pacientes-graves-sufren-secuelas-6-meses-_0_h0sN2zjTl.html,https://images.clarin.com/2021/07/09/QQfSCq2rp_720x0__1.jpg
9,mTDNygnqn,"Comida, juegos y salubridad. 9 de julio: diez cosas que (casi) no sabías sobre la vida cotidiana en 1816",https://www.clarin.com/cultura/9-julio-cosas-sabias-vida-cotidiana-1816_0_mTDNygnqn.html,https://images.clarin.com/2021/07/06/c_koODPiH_720x0__1.jpg
10,wXrCrtaXH,Cuál es la enfermedad de la piel que explotó durante la pandemia,https://www.clarin.com/buena-vida/psoriasis-enfermedad-exploto-pandemia_0_wXrCrtaXH.html,https://images.clarin.com/2021/05/31/saNJQi-UR_720x0__1.jpg
11,JCGyuqgZy,#9J. Banderazo contra el Gobierno en el Obelisco y llamativos afiches para Vidal,https://www.clarin.com/politica/banderazo-gobierno-obelisco-quinta-olivos_0_JCGyuqgZy.html,https://images.clarin.com/2021/07/09/LXUR2lW_i_720x0__1.jpg
12,-DkernBnM,Decisión del Presidente. El Gobierno sube levemente el cupo para que más varados en el exterior puedan regresar al país,https://www.clarin.com/politica/gobierno-sube-levemente-cupo-ingresos-pais-forma-progresiva-fin-mes-podran-volver-1-000-argentinos-dia_0_-DkernBnM.html,https://images.clarin.com/2021/07/05/sQ-uN8vLm_720x0__1.jpg
13,lJpDUvn4Z,Masiva movilización. En la protesta del campo también reclamaron por las vacunas y las restricciones,https://www.clarin.com/rural/comenzo-protesta-campo-gobierno-pais_0_lJpDUvn4Z.html,https://images.clarin.com/2021/07/09/AiLaJqh84_720x0__1.jpg
14,PrQhlRoKd,"Acto por el 9 de Julio. Alberto Fernández: ""Si alguien espera que claudique ante un laboratorio se equivoca""",https://www.clarin.com/politica/vivo-alberto-fernandez-encabeza-acto-dia-independencia-tucuman-medio-protestas_0_PrQhlRoKd.html,https://images.clarin.com/2021/07/09/AFHngk3mA_720x0__1.jpg
15,JRClc_0-3,En Tucumán. El error histórico del Presidente al mencionar a Macacha Güemes,https://www.clarin.com/politica/error-historico-alberto-fernandez-acto-dia-independencia-mencionar-macacha-guemes_0_JRClc_0-3.html,https://images.clarin.com/2021/07/09/S_rDGgKsi_720x0__1.jpg
16,2EHK3Px74,"En Bahía Blanca. Original protesta de ganaderos: ofrecieron ""vaca china"" al asador",https://www.clarin.com/economia/original-protesta-ganaderos-ofrecieron-vaca-china-asador_0_2EHK3Px74.html,https://images.clarin.com/2021/07/09/3yx3WjQJx_720x0__1.jpg
17,Lz_4qGbhA,Avance de la pandemia. Sputnik V y la escasez de segundas dosis: cuántas faltan y cómo harán para conseguirlas,https://www.clarin.com/ciudades/sputnik-v-escasez-componente-2-cuantas-vacunas-faltan-haran-conseguirlas_0_Lz_4qGbhA.html,https://images.clarin.com/2021/06/07/VCtpZptv__1256x620__3.jpg#1625845391466
18,PcmDCLJ-e,Coronavirus:. Reportan otras 244 muertes y Argentina superó los 98 mil fallecidos,https://www.clarin.com/sociedad/coronavirus-reportan-244-muertes-argentina-supero-98-mil-fallecidos_0_PcmDCLJ-e.html,https://images.clarin.com/2021/07/07/4vwHwKqv7_720x0__1.jpg
19,h0sN2zjTl,"Covid y neumonía. ""El 70% de los pacientes graves sufren secuelas no menos de 6 meses""",https://www.clarin.com/sociedad/neumonia-covid-70-pacientes-graves-sufren-secuelas-6-meses-_0_h0sN2zjTl.html,https://images.clarin.com/2021/07/09/QQfSCq2rp_720x0__1.jpg
20,-fBYuEtg1,Juegos Olímpicos de Tokio. Horarios y día a día con la actividad de los atletas y equipos argentinos,https://www.clarin.com/deportes/juegos-olimpicos-tokio-horarios-dia-dia-actividad-atletas-equipos-argentinos_0_-fBYuEtg1.html,https://images.clarin.com/2021/07/09/KbLzpx18-_720x0__1.jpg
21,XrALb2Lh0,Tenis . Djokovic se metió en otra final de Wimbledon e irá por el récord de Nadal y Federer,https://www.clarin.com/deportes/wimbledon-2021-novak-djokovic-va-victoria-acerque-record_0_XrALb2Lh0.html,https://images.clarin.com/2021/07/09/b_CEV-X4Nr_1256x620__2.jpg#1625855311790
22,Drkz20AH6,Copa América. Habrá 2.200 hinchas argentinos en el Maracaná: quiénes podrán ir a la cancha,https://www.clarin.com/deportes/final-publico-copa-america-argentina_0_Drkz20AH6.html,https://images.clarin.com/2021/07/08/D78B-HclWF_720x0__1.jpg
23,uZBWxRXOT,Secretos técnicos. Tite dice tener la receta para marcar a Messi y le mandó una chicana a Scaloni,https://www.clarin.com/deportes/oferta-tite-argentina-dice-va-marcar-neymar-abrimos-juego-decimos-vamos-marcar-messi-_0_uZBWxRXOT.html,https://images.clarin.com/2021/07/06/k1u1uU0Cl_720x0__1.jpg
24,78acik6Zd,Messi vs. Neymar. La rivalidad de dos amigos que tienen clavada la misma espina,https://www.clarin.com/deportes/final-copa-america-messi-vs-neymar-rivalidad-amigos-clavada-misma-espina_0_78acik6Zd.html,https://images.clarin.com/2021/06/08/wcze6ElHG_1256x620__2.jpg#1625856091955
25,VR9AhMnPO,"""Bailá ahora"". De dónde viene y cómo siguió la pelea Messi-Mina",https://www.clarin.com/deportes/futbol-internacional/-baila-ahora-viene-bronca-messi-yerry-mina-siguio-despues-partido-afuera-cancha_0_VR9AhMnPO.html,https://images.clarin.com/2021/07/07/0P4CRNNp1_720x0__1.jpg
26,jq_6PPDoM,Copa América. Cuáles son las dudas en la formación de la Selección para la final ante Brasil,https://www.clarin.com/deportes/copa-america-dudas-formacion-seleccion-gran-final-brasil_0_jq_6PPDoM.html,https://images.clarin.com/2021/07/06/a2SFKeo4X_720x0__1.jpg
27,Ygc9Z1owv,"Hay 3 argentinos. Se filtró cuánto cobran los futbolistas del PSG, el nuevo galáctico del fútbol",https://www.clarin.com/deportes/filtro-cobran-futbolistas-psg-nuevo-galactico-futbol_0_Ygc9Z1owv.html,https://images.clarin.com/2021/05/17/xMJk7vG0lC_1256x620__2.jpg#1625845417164
28,sePjdd9gk,Minuto a minuto. Mercado de pases: todas las altas y bajas de los equipos de la Liga de Fútbol Profesional,https://www.clarin.com/deportes/mercado-pases-71-refuerzos-futbol-argentino_0_sePjdd9gk.html,https://images.clarin.com/2021/07/09/cHYOolsFW_720x0__1.jpg
29,Qe-Y42yeG,"El crimen de un policía. Un imprevisto lo hizo volver a su casa, defendió a su mujer de un robo y lo mataron",https://www.clarin.com/policiales/asesinan-tiro-pecho-policia-ciudad-delante-familia-avellaneda_0_Qe-Y42yeG.html,https://images.clarin.com/2021/07/09/WXmu5ZYTM_720x0__1.jpg
30,M24zrG-2V,"Nueva proclama ultra K. Le piden al Presidente más intervención estatal y ""valentía"" para salir de la crisis",https://www.clarin.com/politica/nueva-proclama-ultra-k-piden-alberto-fernandez-intervencion-estatal-valentia-salir-crisis_0_M24zrG-2V.html,https://images.clarin.com/2021/07/09/xl6oN6_Q9_720x0__1.jpg
31,fDKnXuLeK,"San Nicolás. A caballo y con poncho, así llegó Patricia Bullrich a la protesta del campo",https://www.clarin.com/rural/caballo-poncho-llego-patricia-bullrich-protesta-campo-gobierno_0_fDKnXuLeK.html,https://images.clarin.com/2021/07/09/3lzOptUu0_720x0__1.jpg
32,CdNJup7xV,Costanera Sur. Así será el nuevo barrio que harán en la ex Ciudad Deportiva de Boca,https://www.clarin.com/ciudades/nuevo-barrio-haran-ex-ciudad-deportiva-boca-juniors_0_CdNJup7xV.html,https://images.clarin.com/2021/07/08/8e_-HdQ1d_720x0__1.jpg
33,kED3kflsd,"Forcejeos y golpes. Incidentes entre manifestantes y la Policía, antes del acto en Tucumán",https://www.clarin.com/politica/incidentes-manifestantes-policia-tucuman-acto-alberto-fernandez_0_kED3kflsd.html,https://images.clarin.com/2021/07/09/je7Qd0NQC_720x0__1.jpg
34,b96-Oy6G0,Dieron su pronóstico. Cuál será el valor del dólar y la inflación a fin de año según los economistas,https://www.clarin.com/economia/encuesta-banco-central-inflacion-junio-quedaria-3-2-_0_b96-Oy6G0.html,https://images.clarin.com/2020/07/28/iYSWSPInX_720x0__1.jpg
35,wflfINi9Y,Cacería en Haití. Quiénes son los detenidos por el asesinato del presidente Moise,https://www.clarin.com/mundo/caceria-haiti-detenidos-ahora-asesinato-presidente-jovenel-moise_0_wflfINi9Y.html,https://images.clarin.com/2021/07/09/kgZWl_2WT_1256x620__2.jpg#1625832605298
36,JtzN5gjm6,"La vida de un narco. ""Sigo siendo Pablo Escobar"": diálogos entre ""Rengo"" Pacheco y su ex",https://www.clarin.com/policiales/-sigo-pablo-escobar-violentos-dialogos-rengo-pacheco-ex_0_JtzN5gjm6.html,https://images.clarin.com/2021/05/31/voEQ6IDxw_1256x620__2.jpg#1625782939745
37,ZHDCh3tkR,"Características y precios. Audio HiFi: comparativa de Spotify, Apple, Amazon, YouTube y Deezer",https://www.clarin.com/tecnologia/audio-hifi-llega-plataformas-musica-comparativa-spotify-apple-amazon-youtube-deezer_0_ZHDCh3tkR.html,https://images.clarin.com/2019/11/13/h88HrFUW_720x0__1.jpg
38,dURNrkweQ,"Día de la Independencia. Locro, pastelitos de membrillo y otras recetas para festejar el 9 de Julio",https://www.clarin.com/gourmet/9-de-julio-locro-pastelitos-de-membrillo-y-otras-recetas-para-festejar-el-dia-de-la-independencia_0_dURNrkweQ.html,https://images.clarin.com/2019/06/29/PLK-geHyl_720x0__1.jpg
39,YnKh4wsem,Claves para el éxito. Inteligencia emocional financiera: cómo tener una mejor relación con el dinero,https://www.clarin.com/servicios/inteligencia-emocional-financiera-optimizarla-tener-mejor-relacion-dinero_0_YnKh4wsem.html,https://images.clarin.com/2020/08/28/pPhNjParW_720x0__1.jpg
40,TX0FXfxgG,"Hoteles. El ""campamento 5 estrellas"" en uno de los paisajes más espectaculares del país",https://www.clarin.com/viajes/sorprendente-campamento-estrellas-paisajes-espectaculares-argentina_0_TX0FXfxgG.html,https://images.clarin.com/2021/07/06/FSNUiAq2B_720x0__1.jpg
41,QIQD3LfVI,Criptomonedas. El fundador de Twitter fabricará una billetera física para guardar bitcoins,https://www.clarin.com/tecnologia/fundador-twitter-fabricara-billetera-fisica-guardar-bitcoins_0_QIQD3LfVI.html,https://images.clarin.com/2021/06/05/YKNDt6622_720x0__1.jpg
42,wEEOa41Xk,El otro Tinder. Juego de seducción: así se forman las parejas gamers,https://www.clarin.com/buena-vida/juego-seduccion-forman-parejas-gamers_0_wEEOa41Xk.html,https://images.clarin.com/2021/07/08/-TeqEpc-L_720x0__1.jpg
43,TKpNOJFW2,Fin de semana largo. Doce salidas para disfrutar con los chicos,https://www.clarin.com/viajes/12-escapadas-disfrutar-chicos_0_TKpNOJFW2.html,https://images.clarin.com/2021/05/18/mS_TqkGVv_720x0__1.jpg
44,wX1aR6LVJ,"Gourmet. Pizzas tradicionales, vegetarianas y veganas en Villa Crespo",https://www.clarin.com/gourmet/nuevas-pizzas-tradicionales-vegetarianas-veganas-villa-crespo_0_wX1aR6LVJ.html,https://images.clarin.com/2021/07/08/0Qim3ug_T_1256x620__3.jpg#1625765082374
45,9loa_zK_q,El Mundo de Mateo.  ¿Quién mató a Luciano Ávalos?,https://www.clarin.com/brandstudio/mundo-mateo-mato-luciano-avalos-_0_9loa_zK_q.html,https://images.clarin.com/2021/06/24/ZlXeeJ4qM_720x0__1.jpg
46,4Rg7Up-BH,The Night Shift. El drama médico que transcurre en el turno noche de un hospital,https://www.clarin.com/brandstudio/the-night-shift-drama-medico-transcurre-turno-noche-hospital_0_4Rg7Up-BH.html,https://images.clarin.com/2021/07/08/Dwp9KV29z_720x0__1.jpg
47,qhBuq0DYE,The Other Guy. La celebrada comedia australiana llega a Flow,https://www.clarin.com/brandstudio/the-guy-celebrada-comedia-australiana-llega-flow_0_qhBuq0DYE.html,https://images.clarin.com/2021/07/08/ROMHAQy9w_1256x620__2.jpg#1625750493502
48,5-zqA7EtG,Cine en casa. Judas y el mesías negro se suma al catálogo de Flow,https://www.clarin.com/brandstudio/judas-mesias-negro-suma-catalogo-flow_0_5-zqA7EtG.html,https://images.clarin.com/2021/07/08/dbEbkmg0Z_720x0__1.jpg
49,Ix2DJnY4l,El Desertor. Una miniserie alemana sobre el sentido de la lealtad,https://www.clarin.com/brandstudio/desertor-miniserie-alemana-sentido-lealtad_0_Ix2DJnY4l.html,https://images.clarin.com/2021/07/08/3o0icdt05_720x0__1.jpg
50,4jISRf2E3,LUCHA DE UN GRANJERO. No vendió su campo y ahora trabaja la tierra en medio de la ciudad,https://www.clarin.com/viste/nego-vender-campo-ahora-trabaja-tierra-medio-ciudad_0_4jISRf2E3.html,https://images.clarin.com/2021/07/08/yuOrnYLib_720x0__1.jpg
51,OBr-WWIw-,MIRÁ EL VIDEO. Cuál es el lugar más seguro del mundo para vivir durante la pandemia,https://www.clarin.com/viste/lugar-seguro-mundo-vivir-pandemia_0_OBr-WWIw-.html,https://images.clarin.com/2021/07/09/C0vKs5txd_720x0__1.jpg
52,l3ymY1jvB,"Brasil. Video: tomó a una rehén, la policía lo mató a balazos y la gente aplaudió",https://www.clarin.com/internacional/video-tomo-rehen-policia-mato-balazos-gente-aplaudio_0_l3ymY1jvB.html,https://images.clarin.com/2021/07/09/_hNgsaB7G_720x0__1.jpg
53,bR-Xl9Jmd,Estados Unidos. El joven que mató a una mujer y su bebé y es amado por millones de chicas,https://www.clarin.com/viste/joven-mato-mujer-bebe-amado-millones-chicas_0_bR-Xl9Jmd.html,https://images.clarin.com/2021/07/09/hztdKBoqI_720x0__1.jpg
54,INM6ldrbZ,"Bangladesh. Miles de personas acuden a ver una vaca enana, única en el mundo",https://www.clarin.com/viste/miles-personas-acuden-ver-vaca-enana-unica-mundo_0_INM6ldrbZ.html,https://images.clarin.com/2021/07/09/UpVinPKOs_720x0__1.jpg
55,h7yavCnNH,Más de 90 platos . Para todos los gustos: abrió el Museo de la peor comida del mundo y es un éxito total,https://www.clarin.com/viste/abrio-museo-peor-comida-mundo-exito-total_0_h7yavCnNH.html,https://images.clarin.com/2021/07/09/JtBmD7YDo_720x0__1.jpg
56,Yry3j9PRw,"La caída de Evo Morales en 2919. Más contradicciones en la acusación K a Macri de enviar ""material bélico"" a Bolivia",https://www.clarin.com/politica/contradicciones-acusacion-k-mauricio-macri-enviar-material-belico-bolivia_0_Yry3j9PRw.html,https://images.clarin.com/2021/07/09/aD1qC0UTX_720x0__1.jpg
57,Ih9xeTj_u,"CFK prometió exportarlas. Procesan a empresarios y exfuncionarios por las cosechadoras ""truchas"" ",https://www.clarin.com/politica/procesan-empresarios-exfuncionarios-cosechadoras-truchas-cristina-kirchner-prometio-exportar-angola_0_Ih9xeTj_u.html,https://images.clarin.com/2012/06/30/B1eUt-CXl_720x0.jpg
58,Dvbw64XMp,"Críticas a Kicillof. Convocaron a población de riesgo para recibir la segunda Sputnik V, pero se quedaron sin dosis",https://www.clarin.com/sociedad/bronca-plata-convocan-poblacion-riesgo-recibir-segundo-componente-sputnik-v-terminaron-dosis_0_Dvbw64XMp.html,https://images.clarin.com/2021/07/09/iUwFeCP1q_720x0__1.jpg
59,ce806VOZp,Tragedia. Mar del Plata: una joven de 23 años murió tras caer por el hueco de un ascensor,https://www.clarin.com/sociedad/mar-plata-joven-23-anos-murio-caer-hueco-ascensor_0_ce806VOZp.html,https://images.clarin.com/2021/07/09/tinCiUv_B_1256x620__2.jpg#1625865943061
60,LtUEwKdB9,Intimidad . Nadal compartió una foto de su living y fue motivo de burlas por un detalle ,https://www.clarin.com/deportes/rafael-nadal-compartio-foto-living-motivo-burlas-detalle-decoracion_0_LtUEwKdB9.html,https://images.clarin.com/2021/07/09/KNWSu3UDD_720x0__1.jpg
61,jhD1GudPD,"Elecciones 2021. En una encuesta sobre aliados ganaron Manes, Stolbizer y Espert",https://www.clarin.com/politica/hicieron-encuesta-aliados-ganaron-facundo-manes-margarita-stolbizer-jose-luis-espert_0_jhD1GudPD.html,https://images.clarin.com/2021/07/03/LcIq8ro82_720x0__1.jpg
62,9rdMGTNec,"Tragedia en Llavallol. Se ahorcó frente a la casa de su novio: ""Mi vida está en ruinas por culpa del Gordo""",https://www.clarin.com/policiales/ahorco-frente-casa-novio-vida-ruinas-culpa-gordo-_0_9rdMGTNec.html,https://images.clarin.com/2021/07/08/03_WEqzRk_1256x620__2.jpg#1625778061836
63,46pP_omfk,Adiós a la estrella italiana. El día que Raffaella Carrà rechazó casarse con Frank Sinatra y abandonó Hollywood,https://www.clarin.com/internacional/espectaculos/dia-raffaella-carra-rechazo-propuesta-casamiento-frank-sinatra-abandono-hollywood_0_46pP_omfk.html,https://images.clarin.com/2021/07/08/fX1JVry2u_720x0__1.jpg
64,zDgvFwCc7,"Revista Ñ. Bienalsur inauguró su tercera edición, con el arte de pueblos originarios",https://www.clarin.com/cultura/bienalsur-inauguro-tercera-edicion-foco-arte-pueblos-originarios_0_zDgvFwCc7.html,https://images.clarin.com/2021/07/09/_1VSKarJ-_720x0__1.jpg
65,3g2Arz6PH,"Claudia Piñeiro. ""Somos una mezcla: momentos de tragedia, drama y otros de humor""",https://www.clarin.com/cultura/claudia-pineiro-pais-mezcla-momentos-tragedia-drama-momentos-humor-_0_3g2Arz6PH.html,https://images.clarin.com/2020/05/06/blDX3hrFh_1256x620__2.jpg#1625841245610
66,FEdFxU27d,"Entrevista exclusiva. Florence Pugh, de youtuber a ser la próxima Black Widow",https://www.clarin.com/espectaculos/cine/entrevista-florence-pugh-youtuber-proxima-black-widow_0_FEdFxU27d.html,https://images.clarin.com/2021/07/08/3FYwE7vqT_720x0__1.jpg
67,-7yENBfo8,"Ahorran hasta 60%. Precios Cuidados: cuáles son las 15 ""gangas"" de la nueva lista",https://www.clarin.com/servicios/precios-cuidados-15-gangas-nueva-lista_0_-7yENBfo8.html,https://images.clarin.com/2021/05/26/pl7KnWW8E_720x0__1.jpg
68,Ejfvkputn,"Caracas bajo fuego. La banda de ""El Koki"", el azote que tiene de rehén a la capital en Venezuela",https://www.clarin.com/mundo/caracas-fuego-banda-koki-azote-rehen-capital-venezuela_0_Ejfvkputn.html,https://images.clarin.com/2021/07/09/hRVn3iQuK_1256x620__2.jpg#1625846721584
69,mgFpzM-pr,"Crimen en Beverly Hills. Eran jóvenes, tenían una vida ostentosa y mataron a sus padres por la herencia",https://www.clarin.com/internacional/jovenes-vida-ostentosa-mataron-padres-herencia-crimen-asombro-beverly-hills_0_mgFpzM-pr.html,https://images.clarin.com/2021/07/09/rCr1gii0w_720x0__1.jpg
70,98j3fJNoC,"A 10 años de su asesinato. Facundo Cabral: el cantor y ""filósofo"" popular que murió acribillado",https://www.clarin.com/espectaculos/musica/facundo-cabral-cantor-filosofo-popular-murio-acribillado-sicarios-calle-guatemala_0_98j3fJNoC.html,https://images.clarin.com/1969/12/31/HJqkiuxNx_1256x620__1.jpg#1625833122627
