n,id,title,url,image
1,07vPd6ddi,Segunda ola de coronavirus. La Provincia suspende actividades entre las 2 y las 6 de la mañana y limita las reuniones a 10 personas,https://www.clarin.com/politica/segunda-ola-coronavirus-provincia-suspende-actividades-2-6-manana-limita-reuniones_0_07vPd6ddi.html,https://images.clarin.com/2021/03/30/ntq8R6Q99_720x0__1.jpg
2,RMmKXSyjj,"Avanza la pandemia. Uno por uno, los 110 partidos bonaerenses que suman restricciones",https://www.clarin.com/politica/segunda-ola-coronavirus-110-partidos-provincia-buenos-aires-suman-restricciones_0_RMmKXSyjj.html,https://images.clarin.com/2021/03/30/LIblcxc8V_720x0__1.jpg
3,9d3yHT9NH,Del editor. El riesgo de que la segunda ola sea un tsunami,https://www.clarin.com/opinion/riesgo-segunda-ola-tsunami_0_9d3yHT9NH.html,https://images.clarin.com/2021/01/12/2MHa_e6Lo_720x0__1.jpg
4,Sm-HYoKdL,Proyecto K. Proponen multas y penas de prisión más duras para el que propague el Covid,https://www.clarin.com/politica/polemica-proyecto-k-propone-multas-millonarias-endurecer-penas-prision-propague-covid_0_Sm-HYoKdL.html,https://images.clarin.com/2020/02/02/7tuwNLfP_720x0__1.jpg
5,84BVIXlf_,Este lunes. La Ciudad tuvo el día de más casos registrados en la pandemia,https://www.clarin.com/ciudades/coronavirus-ciudad-lunes-dia-casos-registrados-inicio-pandemia_0_84BVIXlf_.html,https://images.clarin.com/2021/03/30/I9whfX1tt_1256x620__2.jpg#1617108470599
6,EOqoCy03a,"Carta abierta. Dramático llamado de líderes mundiales por las futuras pandemias: ""Es cuestión de tiempo""",https://www.clarin.com/mundo/principales-lideres-mundiales-piden-tratado-pandemias-vendran-solo-cuestion-tiempo-_0_EOqoCy03a.html,https://images.clarin.com/2020/12/24/LbyB3ma2f_1256x620__2.jpg#1617110437257
7,7Kg7Atm78,"""Vicios procesales"". Boudou gana tiempo y por ahora no regresa a la cárcel",https://www.clarin.com/politica/vicios-procesales-amado-boudou-gana-tiempo-ahora-regresara-carcel_0_7Kg7Atm78.html,https://images.clarin.com/2021/03/20/sbIrF5p_W_720x0__1.jpg
8,97C3GGHOC,Decisión polémica. El fiscal de la tragedia de Once pidió que De Vido no vuelva a prisión,https://www.clarin.com/politica/fiscal-tragedia-once-pidio-julio-vido-vuelva-carcel_0_97C3GGHOC.html,https://images.clarin.com/2021/03/29/Cav_mttuB_720x0__1.jpg
9,x-zHdSAQD,Las sorprendentes islas trillizas que aparecieron frente a San Isidro,https://www.clarin.com/zonales/sorprendentes-islas-trillizas-san-isidro-formo-nuevo-delta-rio-plata_0_x-zHdSAQD.html,https://images.clarin.com/2021/03/23/4B_OFn6QH_1256x620__2.jpg#1616519108321
10,m-Air23Zu,Ahora 12. Últimas horas para comprar en cuotas con 3 meses de gracia y pagar en julio,https://www.clarin.com/servicios/ahora-12-ultimas-horas-comprar-cuotas-3-meses-gracia-empezar-pagar-julio_0_m-Air23Zu.html,https://images.clarin.com/2021/03/29/S9vrG8LyK_720x0__1.jpg
11,_tyWno-_s,Detectaron 30 focos. Alerta en Provincia por el brote de una bacteria en aves que ya provocó neumonía en personas,https://www.clarin.com/sociedad/alerta-provincia-brote-bacteria-aves-provoco-neumonia-personas_0__tyWno-_s.html,https://images.clarin.com/2021/03/20/f6YIewRGq_720x0__1.jpg
12,v7ep9yRza,Tenía 50 años. Murió el escritor Carlos Busqued tras sufrir un accidente doméstico,https://www.clarin.com/cultura/murio-escritor-carlos-busqued_0_v7ep9yRza.html,https://images.clarin.com/2021/03/29/fDyAC4qmV_1256x620__2.jpg#1617057736667
13,BgVfAkb5E,"Fiat 128. Secretos de un auto amado por los argentinos, a 50 años de su aparición ",https://www.clarin.com/autos/fiat-128-50-anos-aparicion-auto-amado-argentinos_0_BgVfAkb5E.html,https://images.clarin.com/2021/03/30/xpyazVarB_720x0__1.jpg
14,07vPd6ddi,Segunda ola de coronavirus. La Provincia suspende actividades entre las 2 y las 6 de la mañana y limita las reuniones a 10 personas,https://www.clarin.com/politica/segunda-ola-coronavirus-provincia-suspende-actividades-2-6-manana-limita-reuniones_0_07vPd6ddi.html,https://images.clarin.com/2021/03/30/ntq8R6Q99_720x0__1.jpg
15,RMmKXSyjj,"Avanza la pandemia. Uno por uno, los 110 partidos bonaerenses que suman restricciones",https://www.clarin.com/politica/segunda-ola-coronavirus-110-partidos-provincia-buenos-aires-suman-restricciones_0_RMmKXSyjj.html,https://images.clarin.com/2021/03/30/LIblcxc8V_720x0__1.jpg
16,9d3yHT9NH,Del editor. El riesgo de que la segunda ola sea un tsunami,https://www.clarin.com/opinion/riesgo-segunda-ola-tsunami_0_9d3yHT9NH.html,https://images.clarin.com/2021/01/12/2MHa_e6Lo_720x0__1.jpg
17,Sm-HYoKdL,Proyecto K. Proponen multas y penas de prisión más duras para el que propague el Covid,https://www.clarin.com/politica/polemica-proyecto-k-propone-multas-millonarias-endurecer-penas-prision-propague-covid_0_Sm-HYoKdL.html,https://images.clarin.com/2020/02/02/7tuwNLfP_720x0__1.jpg
18,84BVIXlf_,Este lunes. La Ciudad tuvo el día de más casos registrados en la pandemia,https://www.clarin.com/ciudades/coronavirus-ciudad-lunes-dia-casos-registrados-inicio-pandemia_0_84BVIXlf_.html,https://images.clarin.com/2021/03/30/I9whfX1tt_1256x620__2.jpg#1617108470599
19,EOqoCy03a,"Carta abierta. Dramático llamado de líderes mundiales por las futuras pandemias: ""Es cuestión de tiempo""",https://www.clarin.com/mundo/principales-lideres-mundiales-piden-tratado-pandemias-vendran-solo-cuestion-tiempo-_0_EOqoCy03a.html,https://images.clarin.com/2020/12/24/LbyB3ma2f_1256x620__2.jpg#1617110437257
20,7Kg7Atm78,"""Vicios procesales"". Boudou gana tiempo y por ahora no regresa a la cárcel",https://www.clarin.com/politica/vicios-procesales-amado-boudou-gana-tiempo-ahora-regresara-carcel_0_7Kg7Atm78.html,https://images.clarin.com/2021/03/20/sbIrF5p_W_720x0__1.jpg
21,97C3GGHOC,Decisión polémica. El fiscal de la tragedia de Once pidió que De Vido no vuelva a prisión,https://www.clarin.com/politica/fiscal-tragedia-once-pidio-julio-vido-vuelva-carcel_0_97C3GGHOC.html,https://images.clarin.com/2021/03/29/Cav_mttuB_720x0__1.jpg
22,-kFLOqCnZ,"Loco y polémico. Hernán Montenegro: ""Doblé todas las curvas a 260 y voy a seguir haciéndolo""",https://www.clarin.com/viva/hernan-montenegro-cocaina-mala--problema_0_-kFLOqCnZ.html,https://images.clarin.com/2021/03/29/lNvjsdgYK_720x0__1.jpg
23,OUu5MVzuy,"Permítame contarle. León Tolstoi, en el nostálgico recuerdo de su nieto Serge",https://www.clarin.com/viva/leon-tolstoi--nostalgico-recuerdo-nieto-serge_0_OUu5MVzuy.html,https://images.clarin.com/2021/03/25/RyKZq2gi0_720x0__1.jpg
24,wE3LTCQcp,"Museo de la Lengua. Perón, Frida Kahlo, Pizarnik: cartas de amor de la historia leídas por actores",https://www.clarin.com/cultura/-tesoro-adorado-sale-retiro-casamos-escribe-peron-evita-serie-cartas-ahora-da-conocer-museo-lengua_0_wE3LTCQcp.html,https://images.clarin.com/2020/05/19/zl8YR7kIn_1256x620__2.jpg#1617025989902
25,ECGDFN6-U,Turismo y religión. Semana Santa 2021: la agenda de actividades en los destinos turísticos,https://www.clarin.com/viajes/semana-santa-2021-agenda-actividades-destinos-turisticos_0_ECGDFN6-U.html,https://images.clarin.com/2019/04/07/B8vzH-LXw_720x0__1.jpg
26,JCkkOuovx,Emprendedores. Hicieron del aburrimiento una plataforma para ahorrar tiempo y dinero,https://www.clarin.com/economia/amigos-hicieron-aburrimiento-plataforma-ahorrar-tiempo-dinero_0_JCkkOuovx.html,https://images.clarin.com/2021/03/27/U7LB1K_W2_720x0__1.jpg
27,CXFEyh797,"""Maté a mi madre"". Xuxa y un mensaje sobre el Covid que generó confusión y repudio",https://www.clarin.com/espectaculos/tv/xuxa-mensaje-concientizar-covid-mate-madre-_0_CXFEyh797.html,https://images.clarin.com/2021/01/20/eRDTZjvHC_720x0__1.jpg
28,j0RXESa8l,Premios Oscar. Carey Mulligan se venga y va a ganar el premio,https://www.clarin.com/espectaculos/cine/premios-oscar-2021-carey-mulligan-venga-va-ganar-premio_0_j0RXESa8l.html,https://images.clarin.com/2021/03/15/5Ecgapef5_720x0__1.jpg
29,uKXSlLDEF,Cambio cultural. El rol de la Universidad en la agenda por la igualdad de género,https://www.clarin.com/brandstudio/rol-universidad-agenda-igualdad-genero_0_uKXSlLDEF.html,https://images.clarin.com/2021/03/26/CaWMubbmX_720x0__1.jpg
30,XbBmaeBjI,Espacios multitarea. Home Office: los cinco consejos para ser más productivos,https://www.clarin.com/brandstudio/home-office-consejos-productivos_0_XbBmaeBjI.html,https://images.clarin.com/2020/11/13/AMyiFBwt4_720x0__1.jpg
31,-kFLOqCnZ,"Loco y polémico. Hernán Montenegro: ""Doblé todas las curvas a 260 y voy a seguir haciéndolo""",https://www.clarin.com/viva/hernan-montenegro-cocaina-mala--problema_0_-kFLOqCnZ.html,https://images.clarin.com/2021/03/29/lNvjsdgYK_720x0__1.jpg
32,OUu5MVzuy,"Permítame contarle. León Tolstoi, en el nostálgico recuerdo de su nieto Serge",https://www.clarin.com/viva/leon-tolstoi--nostalgico-recuerdo-nieto-serge_0_OUu5MVzuy.html,https://images.clarin.com/2021/03/25/RyKZq2gi0_720x0__1.jpg
33,wE3LTCQcp,"Museo de la Lengua. Perón, Frida Kahlo, Pizarnik: cartas de amor de la historia leídas por actores",https://www.clarin.com/cultura/-tesoro-adorado-sale-retiro-casamos-escribe-peron-evita-serie-cartas-ahora-da-conocer-museo-lengua_0_wE3LTCQcp.html,https://images.clarin.com/2020/05/19/zl8YR7kIn_1256x620__2.jpg#1617025989902
34,ECGDFN6-U,Turismo y religión. Semana Santa 2021: la agenda de actividades en los destinos turísticos,https://www.clarin.com/viajes/semana-santa-2021-agenda-actividades-destinos-turisticos_0_ECGDFN6-U.html,https://images.clarin.com/2019/04/07/B8vzH-LXw_720x0__1.jpg
35,JCkkOuovx,Emprendedores. Hicieron del aburrimiento una plataforma para ahorrar tiempo y dinero,https://www.clarin.com/economia/amigos-hicieron-aburrimiento-plataforma-ahorrar-tiempo-dinero_0_JCkkOuovx.html,https://images.clarin.com/2021/03/27/U7LB1K_W2_720x0__1.jpg
36,CXFEyh797,"""Maté a mi madre"". Xuxa y un mensaje sobre el Covid que generó confusión y repudio",https://www.clarin.com/espectaculos/tv/xuxa-mensaje-concientizar-covid-mate-madre-_0_CXFEyh797.html,https://images.clarin.com/2021/01/20/eRDTZjvHC_720x0__1.jpg
37,j0RXESa8l,Premios Oscar. Carey Mulligan se venga y va a ganar el premio,https://www.clarin.com/espectaculos/cine/premios-oscar-2021-carey-mulligan-venga-va-ganar-premio_0_j0RXESa8l.html,https://images.clarin.com/2021/03/15/5Ecgapef5_720x0__1.jpg
38,uKXSlLDEF,Cambio cultural. El rol de la Universidad en la agenda por la igualdad de género,https://www.clarin.com/brandstudio/rol-universidad-agenda-igualdad-genero_0_uKXSlLDEF.html,https://images.clarin.com/2021/03/26/CaWMubbmX_720x0__1.jpg
39,XbBmaeBjI,Espacios multitarea. Home Office: los cinco consejos para ser más productivos,https://www.clarin.com/brandstudio/home-office-consejos-productivos_0_XbBmaeBjI.html,https://images.clarin.com/2020/11/13/AMyiFBwt4_720x0__1.jpg
40,sKQ4ZanDD,Festejo argentino. Adolfo Cambiaso hizo historia en la Triple Corona de EE.UU. junto a su hijo Poroto,https://www.clarin.com/deportes/adolfo-cambiaso-hizo-historia-triple-corona-unidos-junto-hijo-poroto_0_sKQ4ZanDD.html,https://images.clarin.com/2021/03/29/1U8PFON1e_1256x620__2.jpg#1617058498704
41,39TL4nfaA,"Se va del City. El futuro de Agüero, entre Messi, PSG y el deseo del Rojo",https://www.clarin.com/deportes/kun-aguero-ilusion-hinchas-rojo-inminente-arribo-grande-europeo_0_39TL4nfaA.html,https://images.clarin.com/2019/02/03/5VhCyX3wF_1256x620__2.jpg#1617060974477
42,-J0ag_fjl,"España. Ronaldo se arrepintió de su corte de pelo en 2002: ""Fue horrible, pido perdón a las madres""",https://www.clarin.com/deportes/ronaldo-look-2002-horrible_0_-J0ag_fjl.html,https://images.clarin.com/2021/03/29/zRscQqohA_720x0__1.jpg
43,j4OyxPocU,Estadísticas. Los 10 resultados más locos de la Copa de la Liga Profesional,https://www.clarin.com/deportes/10-resultados-locos-copa-liga-profesional_0_j4OyxPocU.html,https://images.clarin.com/2021/03/15/mDQVXzBLA_720x0__1.jpg
44,9ycWFS0qa,"Preocupa a Falcioni. Independiente sufre el mal de altura: los cuatro goles que recibió, de cabeza",https://www.clarin.com/deportes/independiente-sufre-mal-altura-goles-recibio-cabeza_0_9ycWFS0qa.html,https://images.clarin.com/2021/03/29/RGU9c0dqY_1256x620__3.jpg#1617059328447
45,kgkJCD_cj,"River. Driussi ""no aguanta más"" sus ganas de volver: cuándo puede regresar",https://www.clarin.com/deportes/sebastian-driussi-aguanta-ganas-volver-river-puede-regresar_0_kgkJCD_cj.html,https://images.clarin.com/2017/04/23/SkjyOepV-_720x0.jpg
46,oU3u3LhDN,Con Noruega. Video: el brutal bombazo de Haaland que casi rompe la red,https://www.clarin.com/deportes/brutal-bombazo-haaland-rompe-red_0_oU3u3LhDN.html,https://images.clarin.com/2021/03/30/6q5VO1GfD_720x0__1.jpg
47,TrA2T6VQc,NBA. Brooklyn Nets se armó para arrasar: éxitos y fracasos de los súper equipos,https://www.clarin.com/deportes/brooklyn-nets-armo-arrasar-historias-grandes-exitos-enormes-fracasos-super-equipos-nba_0_TrA2T6VQc.html,https://images.clarin.com/2021/03/29/nMcYzSLfH_1256x620__2.jpg#1617044103167
48,8mKpxL1qR,El Gobierno apelará. Manipulación K de los datos del PBI: otro juicio que el país puede perder,https://www.clarin.com/economia/justicia-nueva-york-fallo-argentina-cupon-pbi-gobierno-cristina-kirchner_0_8mKpxL1qR.html,https://images.clarin.com/2020/06/05/gDYgVZUEn_720x0__1.jpg
49,L4qMVQO6H,"Crisis sanitaria. ""El coronavirus será endémico y tendremos que aprender a convivir con él""",https://www.clarin.com/mundo/syra-madad-coronavirus-endemico-aprender-convivir-_0_L4qMVQO6H.html,https://images.clarin.com/2020/03/17/WZChdLtv_1256x620__2.jpg#1616978092722
50,5qCOQyLXX,"Autos. Pese a la paralización en Brasil, terminales argentinas no frenan la producción",https://www.clarin.com/economia/autos-terminales-argentinas-suspenden-produccion-pese-paralizacion-brasil-covid_0_5qCOQyLXX.html,https://images.clarin.com/2019/05/08/vH9hN9VAv_720x0__1.jpg
51,-Liii1Mt6,Impuestos. Dólar ahorro: quedan dos días para pedir el reintegro del 35%,https://www.clarin.com/economia/dolar-ahorro-quedan-dias-pedir-reintegro-35-_0_-Liii1Mt6.html,https://images.clarin.com/2021/03/30/8l3WkYoLN_720x0__1.jpg
52,tXXRk_R0R,Cuentas públicas. Martín Guzmán viaja a Europa a negociar la deuda del Club de París,https://www.clarin.com/economia/martin-guzman-viaja-europa-negociar-deuda-club-paris_0_tXXRk_R0R.html,https://images.clarin.com/2021/03/24/NFLlzpBJA_720x0__1.jpg
53,2wyFhA7VD,Sin redes sociales. Trump lanzó un sitio web donde busca reescribir la historia de su presidencia,https://www.clarin.com/mundo/donald-trump-lanzo-pagina-internet-busca-reescribir-historia-presidencia_0_2wyFhA7VD.html,https://images.clarin.com/2021/03/30/1pOWXFDX3_720x0__1.jpg
54,ZcZrS9pXk,Semana Santa. Vuelven los testeos a viajeros en Costa Salguero: cómo sacar turno,https://www.clarin.com/ciudades/vuelven-testeos-viajeros-costa-salguero-semana-santa-sacar-turno-hacerlos_0_ZcZrS9pXk.html,https://images.clarin.com/2021/01/15/Gj1jhRH8H_1256x620__2.jpg#1617061620691
55,a8TjP7ePc,En Constitución. Cambian paradas de colectivos para permitir el distanciamiento,https://www.clarin.com/ciudades/cambian-paradas-colectivos-constitucion-permitir-distanciamiento_0_a8TjP7ePc.html,https://images.clarin.com/2021/03/30/B-OekUkR6_720x0__1.jpg
56,v7ky16QDm,"Psico. Qué es el ""Complejo de Penélope"" y cómo salir del ovillo",https://www.clarin.com/buena-vida/complejo-penelope-salir-ovillo_0_v7ky16QDm.html,https://images.clarin.com/2021/03/29/OT1a5ra9o_720x0__1.jpg
57,S1zGtftrS,Cuál es la explicación. El gran espectáculo de los cerezos en flor de Japón se adelantó,https://www.clarin.com/viajes/gran-espectaculo-cerezos-flor-japon-adelanto-explicacion_0_S1zGtftrS.html,https://images.clarin.com/2021/03/30/kQqnFngQC_720x0__1.jpg
58,5HXM5quN3,"Mercat Villa Crespo. Qué comer, beber y comprar en el nuevo mercado gourmet de la Ciudad",https://www.clarin.com/gourmet/mercat-villa-crespo-comer-beber-comprar-nuevo-mercado-gourmet-ciudad_0_5HXM5quN3.html,https://images.clarin.com/2021/02/10/VN7WW5e3z_720x0__1.jpg
59,N_KjzMYBX,Mercedes vs Aston Martin. ¿Cuál es el auto de seguridad más rápido en la Fórmula 1?,https://www.clarin.com/autos/mercedes-benz-vs-aston-martin-auto-seguridad-rapido-formula-1-_0_N_KjzMYBX.html,https://images.clarin.com/2021/03/29/yJ64q7FVh_720x0__1.jpg
60,GQmypRoeZ,Nutrición. Microbiota intestinal: estos son los alimentos con más probióticos,https://www.clarin.com/buena-vida/microbiota-intestinal-alimentos-probioticos_0_GQmypRoeZ.html,https://images.clarin.com/2021/03/30/4wjmzRsne_720x0__1.jpg
61,85-2eG5HW,"Alimentación. Los beneficios de una dieta para bajar de peso se ""contagian""",https://www.clarin.com/buena-vida/beneficios-dieta-bajar-peso-contagian-_0_85-2eG5HW.html,https://images.clarin.com/2021/03/29/yoNTmGjmr_720x0__1.jpg
62,7wgwsBqxa,"Mi 11 Pro. Xiaomi presentó el autoproclamado ""rey"" de los celulares con Android",https://www.clarin.com/tecnologia/xiaomi-presento-11-pro-autoproclamado-rey-celulares-android_0_7wgwsBqxa.html,https://images.clarin.com/2021/03/29/7CkOqPqnY_720x0__1.jpg
63,_mqV4EYCP,Educación alternativa. Jardines rodantes: tribus de crianza y aprendizaje en casa,https://www.clarin.com/familias/jardines-rodantes-tribus-crianza-aprendizaje-casa_0__mqV4EYCP.html,https://images.clarin.com/2021/03/29/MvMJR2-FW_720x0__1.jpg
64,1esVPOmyS,Confesión. William Shatner dijo que nunca vio Viaje a las estrellas,https://www.clarin.com/espectaculos/tv/insolita-confesion-william-shatner-dijo-vio-viaje-estrellas_0_1esVPOmyS.html,https://images.clarin.com/2020/04/03/DL9YwNAL0_720x0__1.jpg
65,ULqUUEQGt,"El más visitado. Cómo estar a solas con la Gioconda y recorrer el Louvre, con guía en español",https://www.clarin.com/cultura/solas-gioconda-recorrer-museo-louvre_0_ULqUUEQGt.html,https://images.clarin.com/2021/03/29/YIkAS-MrQ_1256x620__2.jpg#1617033950509
66,DkTTTUmqR,Historia. El Castillo de Coral: un misterio inexplicable que lleva 100 años,https://www.clarin.com/viste/castillo-coral-misterio-inexplicable-lleva-100-anos_0_DkTTTUmqR.html,https://images.clarin.com/2021/03/28/RCtKXBxvs_720x0__1.jpg
67,uh5VzuzGj,El Chavo del 8. El conmovedor y último chiste que le hizo Don Ramón a Quico en su agonía,https://www.clarin.com/internacional/espectaculos/chavo-8-ultimo-conmovedor-chiste-hizo-don-ramon-quico-agonia_0_uh5VzuzGj.html,https://images.clarin.com/2021/03/26/eJ0dSULg0_720x0__1.jpg
68,n5S95AJb6,Tailandia. Compró el IPhone de sus sueños en la Web y recibió una insólita sorpresa,https://www.clarin.com/viste/compro-iphone-suenos-web-recibio-escritorio-forma-telefono_0_n5S95AJb6.html,https://images.clarin.com/2021/03/25/YdiJLYtV4_1256x620__2.jpg#1616707488807
69,GJxiz-TfM,"En Brasil. El drama de Rodrigo, el joven de 22 años que mide 2,23 metros y no para de crecer",https://www.clarin.com/viste/drama-rodrigo-joven-22-anos-mide-2-23-metros-puede-parar-crecer_0_GJxiz-TfM.html,https://images.clarin.com/2021/03/26/VxqDxv9Kr_720x0__1.jpg
70,2wrwOqyZI,Tiene media sanción. Tensión en el bloque K del Senado por un proyecto que se trabó inesperadamente,https://www.clarin.com/politica/senado-crece-tension-puertas-adentro-bloque-k-proyecto-inesperadamente-trabo-diputados_0_2wrwOqyZI.html,https://images.clarin.com/2020/12/10/ozeG0CJrF_720x0__1.jpg
71,_RPuDgd5l,El manejo de la pandemia. Llegan otras 300 mil vacunas Sputnik V y sale el segundo vuelo a China,https://www.clarin.com/sociedad/coronavirus-llegan-300-mil-vacunas-sputnik-v-decimo-vuelo-aerolineas-argentinas-rusia_0__RPuDgd5l.html,https://images.clarin.com/2021/03/30/DkXtSYIS3_1256x620__2.jpg#1617108438919
72,AJ0TSXPRf,Dosis de Sputnik V. Denuncian que se echaron a perder 300 vacunas en una delegación del PAMI,https://www.clarin.com/sociedad/coronavirus-denuncian-echaron-perder-300-vacunas-delegacion-pami-azul_0_AJ0TSXPRf.html,https://images.clarin.com/2021/03/30/dPDTJqFOc_720x0__1.jpg
73,yqVNC7hJy,En Longchamps. Escándalo por una enfermera esposada por una policía en una guardia,https://www.clarin.com/sociedad/video-escandalo-enfermera-esposada-policia-longchamps_0_yqVNC7hJy.html,https://images.clarin.com/2021/03/30/jMFF2vZ9E_720x0__1.jpg
74,RF5INFoMV,"Presupuesto Covid. Las provincias que más gastaron en barbijos, alcohol y ambulancias",https://www.clarin.com/sociedad/presupuesto-covid-provincias-gastaron-barbijos-ambulancias-alcohol_0_RF5INFoMV.html,https://images.clarin.com/2020/03/24/P5wr89r65_720x0__1.jpg
75,9FGj9bof7,"Día clave. ""Fui imprudente, lo lamento"": las disculpas de Veppo antes de la sentencia",https://www.clarin.com/ciudades/dictan-sentencia-eugenio-veppo-periodista-preso-atropellar-matar-agente-transito_0_9FGj9bof7.html,https://images.clarin.com/2021/03/30/I9i5o0nOg_1256x620__2.jpg#1617111078267
76,VWzLKrOzp,"Tiene 22 años. La versión ""poco creíble"" del detenido por el crimen del abogado camporista",https://www.clarin.com/policiales/-moto-prestado-version-creible-detenido-crimen-pulpo-chantada_0_VWzLKrOzp.html,https://images.clarin.com/2021/02/08/8OgrwxzEJ_1256x620__2.jpg#1617109522453
77,Y3NhT25kI,Barcelona. Koeman le baja el pulgar al arribo del Kun Agüero al Barcelona,https://www.clarin.com/deportes/ronald-koeman-baja-pulgar-arribo-kun-aguero-barcelona_0_Y3NhT25kI.html,https://images.clarin.com/1969/12/31/HyghhSqRXe_1256x620__1.jpg#1617111791225
