n,id,title,url,image
1,dKO1FkVez,"Testimonio en España. Afirman que el ex jefe de inteligencia de Chávez declaró que mandaban dinero ""a Néstor Kirchner""",https://www.clarin.com/politica/ex-jefe-inteligencia-chavez-aseguro-mandaban-dinero-nestor-kirchner-argentina-_0_dKO1FkVez.html,https://images.clarin.com/1969/12/31/rkeUd9hhXx_1256x620__1.jpg#1634647539436
2,jlvWrswHW,Internas en el Gobierno. Oficialismo a la deriva: chicanas y trompadas en el día de la grieta peronista,https://www.clarin.com/opinion/miserias-chicanas-trompadas-dia-grieta-peronista_0_jlvWrswHW.html,https://images.clarin.com/2021/10/18/Aj1lsS4C3_720x0__1.jpg
3,cs-PZpA2q,Precios congelados. Las empresas trabajan contra reloj para validar los listados que envió el Gobierno,https://www.clarin.com/economia/precios-congelados-feletti-listado_0_cs-PZpA2q.html,https://images.clarin.com/2021/10/19/faSRbFs1T_720x0__1.jpg
4,pb_LIK2Dn,Más vuelos. Tres aerolíneas volverán a Argentina desde diciembre,https://www.clarin.com/viajes/apertura-fronteras-gol-air-canada-anuncian-vuelos-argentina-partir-diciembre_0_pb_LIK2Dn.html,https://images.clarin.com/2020/06/12/U-5uoEyEt_720x0__1.jpg
5,_eq1FO9Zd,Más de 100 artistas en el CCK. Cómo será y cómo conseguir las entradas gratuitas para festejar los 70 de Charly García,https://www.clarin.com/espectaculos/musica/conseguir-entradas-gratuitas-festejar-70-anos-charly-garcia-cck_0__eq1FO9Zd.html,https://images.clarin.com/2021/10/16/YY53SNU2I_720x0__1.jpg
6,CVoMMjyVo,Especial Clarín. La verdadera historia del incendio en la Rosada antes de la muerte de Nisman,https://www.clarin.com/politica/verdadera-historia-incendio-casa-rosada-horas-hallar-muerto-nisman_0_CVoMMjyVo.html,https://images.clarin.com/2021/10/14/EXosCOcyf_720x0__1.jpg
7,T2HeqAFwU,Elecciones 2021. Guerra electoral en Provincia: operaciones cruzadas y las encuestas que no se ven,https://www.clarin.com/politica/guerra-electoral-provincia-operaciones-cruzadas-encuestas-ven_0_T2HeqAFwU.html,https://images.clarin.com/2021/10/15/eTfX2p38g_720x0__1.jpg
8,hEsSQeYpq,"Agustina Propato. La esposa de Berni, señalada por irrumpir en helicóptero en una canchita de fútbol",https://www.clarin.com/politica/denuncian-agustina-propato-esposa-sergio-berni-irrumpir-helicoptero-cancha-futbol-infantil_0_hEsSQeYpq.html,https://images.clarin.com/2021/08/12/odT2FDt0r_720x0__1.jpg
9,G1jpHyG4D,"Tenía 16 años. ""El papá del grupo de amigos"": quién era Maxi, el chico asesinado por motochorros",https://www.clarin.com/policiales/-papa-grupo-amigos-evitaba-problemas-maxi-chico-16-anos-asesinado-motochorros_0_G1jpHyG4D.html,https://images.clarin.com/2021/10/19/U1hu-ffXM_720x0__1.jpg
10,S2SRkIqgb,Violencia en Mendoza. Denuncian a dos rugbiers por una golpiza a un chico: tiene 8 fracturas y casi pierde un ojo,https://www.clarin.com/policiales/denuncian-rugbiers-brutal-golpiza-chico-16-anos-8-fracturas-pierde-ojo_0_S2SRkIqgb.html,https://images.clarin.com/2021/10/19/SjmRI6uI8_1256x620__2.jpg#1634654096366
11,BSK1Syg_o,"Hablan expertos. Wanda-Icardi: la infidelidad, consulta infaltable en las terapias de parejas",https://www.clarin.com/sociedad/caso-wanda-nara-mauro-icardi-infidelidad-consulta-infaltable-terapias-parejas_0_BSK1Syg_o.html,https://images.clarin.com/2019/12/26/jcnyl7JX_720x0__1.jpg
12,s9p-VQLls,Sin vueltas. Rodrigo De Paul enfrentó los rumores de romance con la China Suárez,https://www.clarin.com/fama/rodrigo-paul-enfrento-rumores-romance-china-suarez_0_s9p-VQLls.html,https://images.clarin.com/2021/10/19/zTJo74lCl_720x0__1.jpg
13,NNxpJYzbv,Podría presentar un escrito. Macri volvió al país y define si mañana se presenta a declarar por presunto espionaje,https://www.clarin.com/politica/mauricio-macri-volvio-pais-define-manana-presenta-declarar-presunto-espionaje_0_NNxpJYzbv.html,https://images.clarin.com/2021/09/28/EmTFFQUdq_720x0__1.jpg
14,lNyV6D6l3,Visita presidencial. Los petroleros de Chubut paralizan la producción para ir al acto de Alberto Fernández,https://www.clarin.com/politica/petroleros-chubut-paralizan-produccion-ir-acto-alberto-fernandez_0_lNyV6D6l3.html,https://images.clarin.com/2021/10/16/BZbVm4TxJ_720x0__1.jpg
15,hHLjWV3ys,"La campaña, minuto a minuto. Milei le respondió a Caló y Vidal arriesgó cuánto tiempo llevará bajar la inflación",https://www.clarin.com/politica/elecciones-2021-minuto-minuto-campana-26-dias-comicios_0_hHLjWV3ys.html,https://images.clarin.com/2021/10/18/CxV6S9Qak_720x0__1.jpg
16,uVaGdiEWj,Cumple 138 años. Desde cañonazos ingleses hasta fuego del 55: secretos del convento de Santo Domingo,https://www.clarin.com/ciudades/canonazos-invasiones-inglesas-fuego-55-secretos-iglesia-convento-santo-domingo_0_uVaGdiEWj.html,https://images.clarin.com/2021/10/16/ozzISG-ju_720x0__1.jpg
17,67yOSTaZr,Evento Unleashed. Apple lanzó un trapo para el polvo a un precio ridículamente alto,https://www.clarin.com/tecnologia/apple-lanzo-trapo-polvo-precio-ridiculamente-alto_0_67yOSTaZr.html,https://images.clarin.com/2021/10/19/Zy-PRUhfO_720x0__1.jpg
18,xiRqtCtrV,Desobediencia judicial. La ex Miss Argentina que atropelló y mató sumó una nueva condena,https://www.clarin.com/sociedad/ex-miss-argentina-atropello-mato-misiones-sumo-nueva-condena_0_xiRqtCtrV.html,https://images.clarin.com/2019/01/31/aw96YoXlE_1256x620__6.jpg#1634578873841
19,J8gdjZliF,"""Retrógrado y sexista"". Trabajo encubierto y discriminación: el certamen ""Miss Francia"", al banquillo",https://www.clarin.com/mundo/trabajo-encubierto-discriminacion-certamen-belleza-miss-francia-banquillo_0_J8gdjZliF.html,https://images.clarin.com/2021/10/19/SG9mZmUDg_930x525__2.jpg#1634650941558
20,xQEeVGBXQ,"Para todos los gustos. La agenda del súper martes: Messi, la Liga Profesional y el arranque de la NBA",https://www.clarin.com/deportes/agenda-super-martes-deportivo-ver-messi-liga-profesional-futbol-arranque-nba_0_xQEeVGBXQ.html,https://images.clarin.com/2021/10/19/3TdtheJVW_1256x620__2.jpg#1634651991824
21,0Pb9pSB1E,Francia. Icardi se bajó del partido entre PSG y Leipzig en medio del escándalo con Wanda Nara,https://www.clarin.com/deportes/mauro-icardi-partido-psg-leipzig-medio-escandalo-wanda-nara_0_0Pb9pSB1E.html,https://images.clarin.com/2021/10/19/xfCava-5V_720x0__1.jpg
22,13zhBRlNA,Moneda de 50 centavos. Por qué los comercios no las aceptan y cuál es el rebusque para que valgan más,https://www.clarin.com/sociedad/moneda-50-centavos-comercios-aceptan-rebusque-valgan_0_13zhBRlNA.html,https://images.clarin.com/2021/10/18/ZtJG8D0JN_1256x620__2.jpg#1634593458649
23,0IgmZ5Xxf,Investigación. Aparecen misteriosas cajas de un barco nazi en las playas de Brasil,https://www.clarin.com/internacional/aparecen-misteriosas-cajas-barco-nazi-playas-brasil_0_0IgmZ5Xxf.html,https://images.clarin.com/2021/10/19/ZCHEXbPiM_720x0__1.jpg
24,EgkvOuEFe,"Estados Unidos. Liberan al ""asesino pelirrojo"" que a los 13 años mató y abusó de un niño de 4",https://www.clarin.com/internacional/estados-unidos/liberan-asesino-pelirrojo-13-anos-mato-abuso-nino-4_0_EgkvOuEFe.html,https://images.clarin.com/2021/10/19/obxsDKe5ZQ_720x0__1.jpg
25,pl1yTZbcje,Royal Meteorological Society. las mejores fotografías de los fenómenos naturales de 2021,https://www.clarin.com/fotogalerias/mejores-fotografias-meteorologicas-2020-royal-meteorological-society_5_pl1yTZbcje.html,
26,zi7XyAZhRX,Historias visuales. Las mejores 96 imágenes de hoy en Argentina y el mundo,https://www.clarin.com/fotogalerias/dia-fotos-mejores-imagenes-argentina-mundo_5_zi7XyAZhRX.html,
27,GfYTyGY-n,Nuevo estudio. Virus recién descubiertos de murciélagos revelan pistas sobre el origen del COVID,https://www.clarin.com/new-york-times-international-weekly/virus-recien-descubiertos-murcielagos-revelan-pistas-origen-covid_0_GfYTyGY-n.html,https://images.clarin.com/2021/10/18/i_gVRb_Y3_720x0__1.jpg
28,zIcB1a4AGp,Modern Love. Una relación prohibida desde el otro lado del mundo,https://www.clarin.com/new-york-times-international-weekly/modern-love-relacion-prohibida-lado-mundo_0_zIcB1a4AGp.html,https://images.clarin.com/2021/10/18/ZoMMtuIu7_1256x620__2.jpg#1634567358066
29,k5eaDvux2,Astronomía. Una bomba nuclear podría salvar a la Tierra de un asteroide furtivo,https://www.clarin.com/new-york-times-international-weekly/bomba-nuclear-podria-salvar-tierra-asteroide-furtivo_0_k5eaDvux2.html,https://images.clarin.com/2021/10/18/Ta1AGZbsH_1256x620__2.jpg#1634580930534
30,dKO1FkVez,"Testimonio en España. Afirman que el ex jefe de inteligencia de Chávez declaró que mandaban dinero ""a Néstor Kirchner""",https://www.clarin.com/politica/ex-jefe-inteligencia-chavez-aseguro-mandaban-dinero-nestor-kirchner-argentina-_0_dKO1FkVez.html,https://images.clarin.com/1969/12/31/rkeUd9hhXx_1256x620__1.jpg#1634647539436
31,jlvWrswHW,Internas en el Gobierno. Oficialismo a la deriva: chicanas y trompadas en el día de la grieta peronista,https://www.clarin.com/opinion/miserias-chicanas-trompadas-dia-grieta-peronista_0_jlvWrswHW.html,https://images.clarin.com/2021/10/18/Aj1lsS4C3_720x0__1.jpg
32,cs-PZpA2q,Precios congelados. Las empresas trabajan contra reloj para validar los listados que envió el Gobierno,https://www.clarin.com/economia/precios-congelados-feletti-listado_0_cs-PZpA2q.html,https://images.clarin.com/2021/10/19/faSRbFs1T_720x0__1.jpg
33,pb_LIK2Dn,Más vuelos. Tres aerolíneas volverán a Argentina desde diciembre,https://www.clarin.com/viajes/apertura-fronteras-gol-air-canada-anuncian-vuelos-argentina-partir-diciembre_0_pb_LIK2Dn.html,https://images.clarin.com/2020/06/12/U-5uoEyEt_720x0__1.jpg
34,_eq1FO9Zd,Más de 100 artistas en el CCK. Cómo será y cómo conseguir las entradas gratuitas para festejar los 70 de Charly García,https://www.clarin.com/espectaculos/musica/conseguir-entradas-gratuitas-festejar-70-anos-charly-garcia-cck_0__eq1FO9Zd.html,https://images.clarin.com/2021/10/16/YY53SNU2I_720x0__1.jpg
35,CVoMMjyVo,Especial Clarín. La verdadera historia del incendio en la Rosada antes de la muerte de Nisman,https://www.clarin.com/politica/verdadera-historia-incendio-casa-rosada-horas-hallar-muerto-nisman_0_CVoMMjyVo.html,https://images.clarin.com/2021/10/14/EXosCOcyf_720x0__1.jpg
36,T2HeqAFwU,Elecciones 2021. Guerra electoral en Provincia: operaciones cruzadas y las encuestas que no se ven,https://www.clarin.com/politica/guerra-electoral-provincia-operaciones-cruzadas-encuestas-ven_0_T2HeqAFwU.html,https://images.clarin.com/2021/10/15/eTfX2p38g_720x0__1.jpg
37,zk_8S6Kli,"Wanda-Icardi-Suárez. ""Me gustaría encontrarte"": si es virtual, ¿cuenta como infidelidad?",https://www.clarin.com/relaciones/-gustaria-encontrarte-virtual-cuenta-infidelidad-_0_zk_8S6Kli.html,https://images.clarin.com/2021/10/18/TjjXnSBlu_720x0__1.jpg
38,2RYtSMte1,Nutrición. ¿Puede una dieta baja en carbohidratos ayudar a la salud del corazón?,https://www.clarin.com/buena-vida/-puede-dieta-baja-carbohidratos-ayudar-salud-corazon-_0_2RYtSMte1.html,https://images.clarin.com/2021/10/15/50FMMm_oT_720x0__1.jpg
39,KJODYH3ug,Paso a paso. Día del Gin Tonic: cómo preparar la receta original y otras 6 versiones,https://www.clarin.com/gourmet/dia-internacional-gin-tonic-preparar-receta-original-6-versiones_0_KJODYH3ug.html,https://images.clarin.com/2021/10/18/O9CO_7YfS_1256x620__2.jpg#1634636447751
40,OvCrzaDbK,"Pospandemia. Fiestas, viajes de egresados y alcohol: el peligro del “efecto rebote” en los adolescentes",https://www.clarin.com/buena-vida/fiestas-viajes-egresados-evitar-efecto-rebote-aislamiento-adolescentes_0_OvCrzaDbK.html,https://images.clarin.com/2021/10/18/bpkc4fulv_720x0__1.jpg
41,gWLCFDa3E,"Libros. ""La casa de los conejos"": la dictadura vista desde los ojos de una nena",https://www.clarin.com/cultura/-casa-conejos-dictadura-vista-ojos-nena_0_gWLCFDa3E.html,https://images.clarin.com/2021/10/18/k6mIFAo3Z_1256x620__2.jpg#1634580471654
42,ggMLOkEUy,"Entrevista. Magdalena Fleitas: ""La música es un aliado de la familia""",https://www.clarin.com/familias/magdalena-fleitas-musica-aliado-familia-_0_ggMLOkEUy.html,https://images.clarin.com/2021/10/16/_9vSpoGnB_1256x620__2.jpg#1634607578017
43,of2sR4w-R,"Epopeya visual. ""Dune"", la película sagrada que reunía a Dalí, Mick Jagger y Pink Floyd",https://www.clarin.com/internacional/espectaculos/-dune-pelicula-sagrada-buscaba-expandir-conciencia-reunia-salvador-dali-mick-jagger-pink-floyd_0_of2sR4w-R.html,https://images.clarin.com/2021/10/18/cPJevmsqM_720x0__1.jpg
44,4nRgQJdQW,Historias. La artista que reconstruyó las caras desfiguradas de los soldados de la Primera Guerra,https://www.clarin.com/internacional/artista-reconstruyo-caras-desfiguradas-soldados-primera-guerra-mundial_0_4nRgQJdQW.html,https://images.clarin.com/2021/10/15/Y14Z8O8LU_1256x620__3.jpg#1634384212156
45,uEW4zE_dv,Peligro infantil. Alerta por pilas botón: un grave accidente casero que se incrementó en pandemia,https://www.clarin.com/buena-vida/alerta-pilas-boton-grave-accidente-casero-incremento-pandemia_0_uEW4zE_dv.html,https://images.clarin.com/2021/10/13/_qP8UGmFy_720x0__1.jpg
46,9Ss6__Y4-,Por Amazon Prime Video. La rueda del tiempo buscará ocupar el vacío que dejó Game of Thrones,https://www.clarin.com/espectaculos/tv/rueda-tiempo-buscara-ocupar-vacio-dejo-game-of-thrones_0_9Ss6__Y4-.html,https://images.clarin.com/2021/10/10/1seM_IRH2_720x0__1.jpg
47,G8grfPIbU,Fabuloso. El excéntrico barón que deja sus dominios en manos de la naturaleza,https://www.clarin.com/viste/excentrico-baron-deja-dominios-manos-naturaleza_0_G8grfPIbU.html,https://images.clarin.com/2021/10/17/rISTrdCgZ_720x0__1.jpg
48,JLUawK067,"Pareja. Cómo pelearse correctamente, durante la pandemia o después",https://www.clarin.com/relaciones/pelearse-correctamente-pandemia-despues_0_JLUawK067.html,https://images.clarin.com/2021/10/14/9GAlvjEk7_720x0__1.jpg
49,,Cuotas y promociones. ¿Por qué es mejor comprar celulares en Argentina que en Estados Unidos?,,
50,3PaiSxs_m,Octubre rosa. La detección temprana del cáncer de mama con tecnología de punta,https://www.clarin.com/brandstudio/deteccion-temprana-cancer-mama-tecnologia-punta_0_3PaiSxs_m.html,https://images.clarin.com/2021/10/18/YItnTbnqP_720x0__1.jpg
51,ts35AkTvi,Servicios para cada necesidad. Innovación y experiencia: Cooperación Seguros celebra 95 años,https://www.clarin.com/brandstudio/innovacion-experiencia-cooperacion-seguros-celebra-95-anos_0_ts35AkTvi.html,https://images.clarin.com/2021/10/15/HpcHAcqji_720x0__1.jpg
52,Y7BlZUlug,"En pareja. María Becerra y Rusherking: unidos por la música, el amor y la atracción",https://www.clarin.com/brandstudio/maria-becerra-rusherking-unidos-musica-amor-atraccion_0_Y7BlZUlug.html,https://images.clarin.com/2021/10/12/E7Ryzlh0M_1256x620__2.jpg#1634065250011
53,Co_KJ3cwz,Gastronomía. Un nuevo brasero japonés desembarca en Buenos Aires,https://www.clarin.com/brandstudio/nuevo-brasero-japones-desembarca-buenos-aires_0_Co_KJ3cwz.html,https://images.clarin.com/2021/10/13/P_9fmpHv7_720x0__1.jpg
54,acvZ8wveH,Contundente. La reacción de Gonzalo Heredia ante los rumores de un romance con la China Suárez,https://www.clarin.com/fama/reaccion-gonzalo-heredia-rumores-romance-china-suarez_0_acvZ8wveH.html,https://images.clarin.com/2021/10/19/MO6mz45nZ_720x0__1.jpg
55,Dp4a15vEn,"Fuerte frase. Rial contó qué le habría dicho Vicuña a Wanda sobre la China Suárez: ""Usó una palabra dura""",https://www.clarin.com/fama/jorge-rial-conto-benjamin-vicuna-wanda-nara-china-suarez-uso-palabra-bastante-dura-_0_Dp4a15vEn.html,https://images.clarin.com/2021/10/19/gfxEaB7yi_720x0__1.jpg
56,8t1dIjI8p,Sin anestesia. Durísima respuesta de Alejandra Maglietti al tuit en el que Wanda Nara la agredió y luego borró,https://www.clarin.com/fama/durisima-respuesta-alejandra-maglietti-tuit-wanda-nara-agredio-luego-borro_0_8t1dIjI8p.html,https://images.clarin.com/2021/10/18/deVZaXA6g_720x0__1.jpg
57,ayspscpJ9,"""Sos un sorete"". El tremendo mensaje que Paula Chaves le habría enviado a la China Suárez tras el escándalo",https://www.clarin.com/fama/tremendo-mensaje-paula-chaves-enviado-china-suarez-escandalo-sos-sorete-_0_ayspscpJ9.html,https://images.clarin.com/2021/10/18/18kJD7UE2_720x0__1.jpg
58,jdDB4Kn5t,"Finanzas personales. ""El juego del calamar"": los 5 errores que sólo agravan tus deudas y cómo evitarlos",https://www.clarin.com/servicios/-juego-calamar-5-errores-solo-agravan-deudas-evitarlos_0_jdDB4Kn5t.html,https://images.clarin.com/2021/09/29/Hd04p1e1L_720x0__1.jpg
59,kreN9ng4t,"Agarrar la ""platita"". 5 fuertes subsidios al consumo para aprovechar hasta las elecciones",https://www.clarin.com/servicios/agarrar-platita-5-fuertes-subsidios-consumo-aprovechar-elecciones_0_kreN9ng4t.html,https://images.clarin.com/2021/04/12/SbwIVq8Rt_720x0__1.jpg
60,T_KP8fzZc,Encuesta clave. Dónde irán los votos de Manes y cómo está la pelea por la punta en Provincia,https://www.clarin.com/politica/encuesta-clave-iran-votos-facundo-manes-pelea-punta-provincia_0_T_KP8fzZc.html,https://images.clarin.com/2021/09/13/P-gqe18FF_720x0__1.jpg
61,MP3Uxp_Y-,ARN mensajero. La revolución que puede generar en la vacuna contra la gripe,https://www.clarin.com/sociedad/arn-mensajero-revolucion-puede-generar-vacuna-gripe_0_MP3Uxp_Y-.html,https://images.clarin.com/2021/10/18/p3x2r44oN_720x0__1.jpg
62,zQz8RjazX,"El régimen chavista. Venezuela: quién es la modelo italiana y esposa de Alex Saab, preso en Miami",https://www.clarin.com/mundo/venezuela-camila-fabri-modelo-italiana-esposa-alex-saab-preso-miami_0_zQz8RjazX.html,https://images.clarin.com/2021/10/19/pk3j-1yrL_1256x620__2.jpg#1634656589251
63,uoLFCUu_3,Datos oficiales. Volver a empezar: al menos 100 argentinos por día se van del país,https://www.clarin.com/sociedad/volver-empezar-100-argentinos-dia-van-pais_0_uoLFCUu_3.html,https://images.clarin.com/2021/10/01/B5BQs1azI_720x0__1.jpg
64,GcFG_FemJ,Escena del Crimen. El cuerpo quemado de Puerto Madero que no le importa a nadie,https://www.clarin.com/policiales/cuerpo-quemado-puerto-madero-importa-nadie_0_GcFG_FemJ.html,https://images.clarin.com/2021/10/01/6sBt8-wQ4_720x0__1.jpg
65,YrCdvF1-t,Calles bajo fuego. Mundo narco: los sicarios de Rosario salen a matar por $15.000,https://www.clarin.com/policiales/mundo-narco-sicarios-rosario-salen-matar-15-000_0_YrCdvF1-t.html,https://images.clarin.com/2021/09/20/noXbd76DV_720x0__1.jpg
66,j5owUSw_W,En alza. Criptomonedas: ¿cuánta plata se puede ganar con una PC desde el living de casa?,https://www.clarin.com/especiales/criptomonedas-plata-puede-ganar-pc-living-casa-_0_j5owUSw_W.html,https://images.clarin.com/2021/08/16/SZDgaDM6F_720x0__1.jpg
67,NvzkKJmL9,Busca renovarle. River quiere blindar a Julián Álvarez antes de que se lo lleven a Europa,https://www.clarin.com/deportes/river-quiere-blindar-julian-alvarez-lleven-europa_0_NvzkKJmL9.html,https://images.clarin.com/2021/10/05/rJHmYYGHu_720x0__1.jpg
68,Olzgz93oj,Comprometido. Comenzó el juicio que podría enviar a prisión a Benzema por un chantaje sexual,https://www.clarin.com/deportes/benzema-juicio-valbuena-preso_0_Olzgz93oj.html,https://images.clarin.com/2021/10/19/wtQz8lCR8_720x0__1.jpg
69,RGpwP7C2x,Quiere cambiar los Mundiales. Los entretelones de la visita de Gianni Infantino a la Argentina,https://www.clarin.com/deportes/entretelones-visita-gianni-infantino-argentina_0_RGpwP7C2x.html,https://images.clarin.com/2021/10/19/n61Sd6WB__720x0__1.jpg
70,V6OmbHJNL,La NBA arranca con todo. Curry frente a LeBron y revancha de la épica final del Este,https://www.clarin.com/deportes/nueva-temporada-nba-arranca-curry-frente-lebron-revancha-epica-final-nets-bucks_0_V6OmbHJNL.html,https://images.clarin.com/2021/10/18/RGqTnp7Ef_1256x620__2.jpg#1634578095158
71,P4jwer-vS,Australia. Djokovic puso en duda su presencia si le exigen declarar la vacuna contra el Covid,https://www.clarin.com/deportes/djokovic-puso-duda-participacion-australia-exigen-declarar-vacuna-covid-asunto-privado-_0_P4jwer-vS.html,https://images.clarin.com/2020/10/30/kmJtWTVlF_1256x620__2.jpg#1634590054051
72,exonpE8Zg,Horarios y TV. Se vienen 61 partidos en 72 horas: toda la agenda del fútbol,https://www.clarin.com/deportes/vienen-61-partidos-72-horas-toda-agenda-choque-talleres-river-plato-fuerte-liga-mejor-champions-league_0_exonpE8Zg.html,https://images.clarin.com/2021/10/03/DaAGMBWqk1_720x0__1.jpg
73,zw9owPCN9,"Oportunidad. Whisky, electrónica y joyas: cómo participar del remate online de la Aduana",https://www.clarin.com/economia/whisky-electronica-joyas-participar-remate-online-aduana_0_zw9owPCN9.html,https://images.clarin.com/2021/09/10/AQcQqPqvS_720x0__1.jpg
74,-CQsvxwq8,"Proyecciones, en la mira. La meta de inflación de Guzmán tambalea y podrían reabrir paritarias",https://www.clarin.com/economia/meta-inflacion-guzman-tambalea-podrian-reabrir-paritarias_0_-CQsvxwq8.html,https://images.clarin.com/2021/10/13/7QhzB91L6_720x0__1.jpg
75,DS1Wfx5Ot,Mercado digital. Bitcoin: se mantiene en US$ 62.000 y crece la expectativa ante el debut del primer ETF de futuros de la cripto,https://www.clarin.com/economia/bitcoin-mantiene-us-62-000-crece-expectativa-debut-primer-etf-futuros-cripto_0_DS1Wfx5Ot.html,https://images.clarin.com/2021/09/16/x_2rig3sa_720x0__1.jpg
76,7yobCN1Hw,Cepo cambiario. Los fabricantes de motos le piden dólares al BCRA: dicen que el mes que viene se quedarán sin piezas,https://www.clarin.com/economia/fabricantes-motos-piden-dolares-bcra-dicen-mes-viene-quedaran-piezas_0_7yobCN1Hw.html,https://images.clarin.com/2018/10/24/yIra-om1o_720x0__1.jpg
77,5TgThSRuF,"Cuentas. Por los fondos del FMI, en septiembre se achicó la deuda pública",https://www.clarin.com/economia/fondos-recibidos-fmi-septiembre-achico-deuda-publica-nacional_0_5TgThSRuF.html,https://images.clarin.com/2021/10/13/0AxjftXEv_1256x620__2.jpg#1634648025932
78,hnCFqejhi,"IDEA. Globant tomará 15.000 ingenieros, programadores y diseñadores en cinco años",https://www.clarin.com/economia/globant-anuncio-tomara-15-000-personas-anos_0_hnCFqejhi.html,https://images.clarin.com/2021/10/14/k-lbeu4go_720x0__1.jpg
