n,id,title,url,image
1,wBd24PNN3,Rumbo a las PASO. El consultor español y chavista al que escuchan Alberto Fernández y Cristina,https://www.clarin.com/politica/consultor-espanol-chavista-escuchan-alberto-fernandez-cristina-kirchner_0_wBd24PNN3.html,https://images.clarin.com/2021/07/15/ykGuVheh3_720x0__1.jpg
2,fY4Wn2Vf8,"Polémica en Texas. Castaño fue mejor, pero las tarjetas dieron un empate ante Charlo",https://www.clarin.com/deportes/brian-castano-vs-jermell-charlo-unificacion-absoluta-superwelter-minuto-minuto-directo_0_fY4Wn2Vf8.html,https://images.clarin.com/2021/07/18/eTg374eTv_720x0__1.jpg
3,VYuYB8RNb,Del editor. Cristina Kirchner se distingue de Alberto Fernández pero sus destinos está unidos,https://www.clarin.com/opinion/cristina-distingue-alberto-destinos-unidos_0_VYuYB8RNb.html,https://images.clarin.com/2021/05/27/AstdTXHzj_720x0__1.jpg
4,SyC_tRAKz,"Nardini, ¿su 2?. Crecen las chances de Tolosa Paz para encabezar la boleta oficial en Provincia",https://www.clarin.com/politica/crecen-chances-victoria-tolosa-paz-encabezar-boleta-frente-provincia_0_SyC_tRAKz.html,https://images.clarin.com/2021/05/28/vOJYRbSTc_720x0__1.jpg
5,X0zVE-6hI,Humor político. Arranca la temporada alta de indignados,https://www.clarin.com/opinion/arranca-temporada-alta-indignados_0_X0zVE-6hI.html,https://images.clarin.com/2021/07/15/Z415RAgAZ_720x0__1.jpg
6,_U9ALMd-S,Trama política. La tragedia de los 100 mil muertos por Covid: ¿Macri lo hubiera hecho peor?,https://www.clarin.com/opinion/tragedia-100-mil-muertos-macri-hecho-peor-_0__U9ALMd-S.html,https://images.clarin.com/2020/10/13/40559zmVM_720x0__1.jpg
7,xfSOE9OOa,"Millones, afuera. La vacuna, pasaporte para entrar o no a Europa: ¿otra forma de discriminación?",https://www.clarin.com/sociedad/marca-vacuna-pasaporte-entrar-europa-nueva-forma-discriminacion-_0_xfSOE9OOa.html,https://images.clarin.com/2021/07/09/-We1gwotv__1256x620__2.jpg#1626551342574
8,JIq9CkdDV,Miami. La imponente casa en la que Leo Messi pasa sus vacaciones,https://www.clarin.com/deportes/imponente-casa-miami-lionel-messi-pasa-vacaciones-familia_0_JIq9CkdDV.html,https://images.clarin.com/2021/07/17/Oc-y4DXWL_720x0__1.jpg
9,JRU8GbhOt,"Vivanco, director de HRW. ""Es demasiado grotesca la ignorancia de Alberto F. respecto de Cuba""",https://www.clarin.com/politica/jose-miguel-vivanco-demasiado-grotesca-ignorancia-alberto-fernandez-respecto-cuba-_0_JRU8GbhOt.html,https://images.clarin.com/2021/07/17/YJRAVnTdQ_720x0__1.jpg
10,iBzlwaE2c,"Crisis económica. Por la inflación y la caída del salario, hay menos porteños de clase media",https://www.clarin.com/economia/recesion-inflacion-caida-ingresos-vez-portenos-pertenecen-clase-media_0_iBzlwaE2c.html,https://images.clarin.com/2021/07/03/QNjuAbzs6_720x0__1.jpg
11,_C-HhGX_A,"Especial. A dos meses de las PASO, 28 encuestas bajo la lupa: cómo miden los candidatos ",https://www.clarin.com/politica/meses-paso-28-encuestas-lupa-miden-candidatos-suenan_0__C-HhGX_A.html,https://images.clarin.com/2021/07/15/mMb1Yvwxi_720x0__1.jpg
12,QeRTRjuDR,"Guía interactiva. Uno por uno, todos los datos de los 1.080 jugadores de la Liga Profesional de Fútbol",https://www.clarin.com/deportes/guia-interactiva-datos-1-080-jugadores-26-equipos-juegan-liga-profesional-futbol_0_QeRTRjuDR.html,https://images.clarin.com/2021/07/16/9bUAMd3Ga_720x0__1.jpg
13,o4XOKmkHz,COVID-19 y VIH. Cuánto crece el riesgo de morir ,https://www.clarin.com/new-york-times-international-weekly/crece-riesgo-morir-covid-19-pacientes-vih_0_o4XOKmkHz.html,https://images.clarin.com/2021/07/16/zDyTXXTTP_1256x620__2.jpg#1626440927370
14,vEpZyFUgy," Arte robado. El Louvre tiene a su propia  ""Indiana Jones"" ",https://www.clarin.com/new-york-times-international-weekly/louvre-propia-indiana-jones-cuadros-saqueados-nazis_0_vEpZyFUgy.html,https://images.clarin.com/2021/07/16/TamIOZM0W_1256x620__2.jpg#1626442750680
15,l-aDY1xrzu,Sorprendente. Esta perra puede seleccionar entre 92 palabras para hablar,https://www.clarin.com/new-york-times-international-weekly/perra-aprendio-hablar-duena_0_l-aDY1xrzu.html,https://images.clarin.com/2021/07/13/KWz43Dihnf_1256x620__2.jpg#1626277078943
16,vk40-lzfB,Geopolítica. China critica la retirada de EE.UU. de Afganistán,https://www.clarin.com/new-york-times-international-weekly/china-critico-guerra-afganistan-ahora-preocupa-retirada-_0_vk40-lzfB.html,https://images.clarin.com/2021/07/16/1yrpygp0i_1256x620__2.jpg#1626461484668
17,wBd24PNN3,Rumbo a las PASO. El consultor español y chavista al que escuchan Alberto Fernández y Cristina,https://www.clarin.com/politica/consultor-espanol-chavista-escuchan-alberto-fernandez-cristina-kirchner_0_wBd24PNN3.html,https://images.clarin.com/2021/07/15/ykGuVheh3_720x0__1.jpg
18,fY4Wn2Vf8,"Polémica en Texas. Castaño fue mejor, pero las tarjetas dieron un empate ante Charlo",https://www.clarin.com/deportes/brian-castano-vs-jermell-charlo-unificacion-absoluta-superwelter-minuto-minuto-directo_0_fY4Wn2Vf8.html,https://images.clarin.com/2021/07/18/eTg374eTv_720x0__1.jpg
19,VYuYB8RNb,Del editor. Cristina Kirchner se distingue de Alberto Fernández pero sus destinos está unidos,https://www.clarin.com/opinion/cristina-distingue-alberto-destinos-unidos_0_VYuYB8RNb.html,https://images.clarin.com/2021/05/27/AstdTXHzj_720x0__1.jpg
20,SyC_tRAKz,"Nardini, ¿su 2?. Crecen las chances de Tolosa Paz para encabezar la boleta oficial en Provincia",https://www.clarin.com/politica/crecen-chances-victoria-tolosa-paz-encabezar-boleta-frente-provincia_0_SyC_tRAKz.html,https://images.clarin.com/2021/05/28/vOJYRbSTc_720x0__1.jpg
21,X0zVE-6hI,Humor político. Arranca la temporada alta de indignados,https://www.clarin.com/opinion/arranca-temporada-alta-indignados_0_X0zVE-6hI.html,https://images.clarin.com/2021/07/15/Z415RAgAZ_720x0__1.jpg
22,_U9ALMd-S,Trama política. La tragedia de los 100 mil muertos por Covid: ¿Macri lo hubiera hecho peor?,https://www.clarin.com/opinion/tragedia-100-mil-muertos-macri-hecho-peor-_0__U9ALMd-S.html,https://images.clarin.com/2020/10/13/40559zmVM_720x0__1.jpg
23,xfSOE9OOa,"Millones, afuera. La vacuna, pasaporte para entrar o no a Europa: ¿otra forma de discriminación?",https://www.clarin.com/sociedad/marca-vacuna-pasaporte-entrar-europa-nueva-forma-discriminacion-_0_xfSOE9OOa.html,https://images.clarin.com/2021/07/09/-We1gwotv__1256x620__2.jpg#1626551342574
24,JIq9CkdDV,Miami. La imponente casa en la que Leo Messi pasa sus vacaciones,https://www.clarin.com/deportes/imponente-casa-miami-lionel-messi-pasa-vacaciones-familia_0_JIq9CkdDV.html,https://images.clarin.com/2021/07/17/Oc-y4DXWL_720x0__1.jpg
25,BnER3Kju4,Réquiem. A 500 años de la caída de Tenochtitlan,https://www.clarin.com/revista-n/requiem-capital-mexicana_0_BnER3Kju4.html,https://images.clarin.com/2021/07/16/9oAbNSjC0_1256x620__2.jpg#1626471282293
26,Ofo9n1S36,"""Cantora"". La voz irrompible de la Negra Sosa",https://www.clarin.com/revista-n/escenarios/voz-irrompible-negra-sosa_0_Ofo9n1S36.html,https://images.clarin.com/2019/10/03/ObwJhj6j_1256x620__2.jpg#1626477451609
27,iQBwICGcd,En La Boca. Proa: bajo el aura de los sentidos,https://www.clarin.com/revista-n/arte/suite-proa_0_iQBwICGcd.html,https://images.clarin.com/2021/07/15/QBQ_tA4OY_720x0__1.jpg
28,968OPi8c-,Ginevra Bompiani. “La mujer es la mayor mistificación de la historia”,https://www.clarin.com/revista-n/literatura/ginevra-bompiani-mujer-mayor-mistificacion-historia_0_968OPi8c-.html,https://images.clarin.com/2021/07/16/hR76bwuqE_1256x620__2.jpg#1626456566865
29,R3yIlS4W7,Tiempos modernos. ¿De qué hablamos cuando hablamos de amor?,https://www.clarin.com/revista-n/ideas/-hablamos-hablamos-amor-_0_R3yIlS4W7.html,https://images.clarin.com/2021/07/01/uqh_BvUIK_720x0__1.jpg
30,s5-zI3hBQ,Grieta profunda. En la guerra de canciones cubanas no falta el degüello,https://www.clarin.com/revista-n/guerra-canciones-cubanas-falta-deguello_0_s5-zI3hBQ.html,https://images.clarin.com/2021/07/13/NGDCYxPLT_720x0__1.jpg
31,VN3MUQvJi,Sub 40. A los 22 se tuvo que hacer cargo de la empresa familiar y la cambió por completo,https://www.clarin.com/rural/22-hacer-cargo-empresa-familiar-transformo-completo_0_VN3MUQvJi.html,https://images.clarin.com/2021/07/16/DOP7I65wq_720x0__1.jpg
32,3PXwODN4c,La columna de la semana. Biocombustibles: una decisión a contramano de la tendencia mundial,https://www.clarin.com/rural/biocombustibles-decision-contramano-tendencia-mundial_0_3PXwODN4c.html,https://images.clarin.com/2021/03/26/iW7jeyCzG_720x0__1.jpg
33,_rassvpoh,Ganadería. Es tiempo de empezar a capitalizar la captura de carbono,https://www.clarin.com/rural/buscan-generar-beneficios-financieros-promover-captura-carbono_0__rassvpoh.html,https://images.clarin.com/2021/07/16/0LEy-gUdb_720x0__1.jpg
34,yWR1Jz1gO,Análisis. La coalición popular exportadora es la salida de la crisis argentina,https://www.clarin.com/rural/coalicion-popular-exportadora-salida-crisis-argentina_0_yWR1Jz1gO.html,https://images.clarin.com/2021/07/02/YOVsG4RZU_720x0__1.jpg
35,I2ueKe4sw,Tecnología agrícola. Una plataforma digital que se expande en América,https://www.clarin.com/rural/plataforma-digital-afianza-pais-expande-nivel-mundial_0_I2ueKe4sw.html,https://images.clarin.com/2021/07/16/dIjyN0vqP_720x0__1.jpg
36,z_VB_hHJI,Inesperado encuentro. De Angeli se reunió con Grabois por el acceso a tierras,https://www.clarin.com/rural/-compartimos-preocupaciones-alfredo-angeli-reunio-juan-grabois-acceso-tierras_0_z_VB_hHJI.html,https://images.clarin.com/2021/07/15/HqMxpppWu_720x0__1.jpg
37,Ll1DKh5ZO,Historias del GBA. El abuelo de 100 años que conmovió a Messi: cómo el nieto consiguió un video del ídolo,https://www.clarin.com/zonales/abuelo-100-anos-conmovio-messi-nieto-consiguio-video-idolo_0_Ll1DKh5ZO.html,https://images.clarin.com/2021/07/14/SxgcH4rDb_720x0__1.jpg
38,qXQ-rUzez,Indignación. Fiesta clandestina en un hospital de San Martín: suspendieron a 15 médicos,https://www.clarin.com/zonales/fiesta-clandestina-hospital-san-martin-suspendieron-15-medicos_0_qXQ-rUzez.html,https://images.clarin.com/2016/03/08/BJdHcoF4e_720x0.jpg
39,cXHrtB_S1,La Matanza. Ricoteros donaron chatarra y el Indio tiene su primera estatua,https://www.clarin.com/zonales/matanza-pusieron-estatua-rendirle-tributo-indio-solari_0_cXHrtB_S1.html,https://images.clarin.com/2021/07/13/plBH70JGR_720x0__1.jpg
40,5z4AJwVEO,Pedido por $ 4.000. No le pagó la comida al delivery y le armaron un escrache,https://www.clarin.com/zonales/pago-comida-delivery-encerro-casa-repartidores-escracharon-salio_0_5z4AJwVEO.html,https://images.clarin.com/2021/07/14/7c3UD97RI_720x0__1.jpg
41,uSVEbkEMe,Tres de Febrero. Quiénes son los dos campeones que la rompían en un club barrial,https://www.clarin.com/zonales/copa-america-campeones-maracana-rompian-juntos-club-barrio-gba_0_uSVEbkEMe.html,https://images.clarin.com/2021/07/11/GaAm-t-kb_720x0__1.jpg
42,q8IT4qssv,Ganaron 33-11 . Los Pumas cerraron su gira europea con un gran triunfo ante Gales,https://www.clarin.com/deportes/los-pumas-cierran-su-gira-europea-ante-gales-campeon-del-seis-naciones-previa-y-minuto-a-minuto-en-directo_0_q8IT4qssv.html,https://images.clarin.com/2021/07/17/FpZROOQdm_1256x620__2.jpg#1626532627193
43,jQafwTeia,Pobre empate sin goles. Vélez y Racing no se sacaron ventaja en la fría noche de Liniers,https://www.clarin.com/deportes/velez-vs-racing-liga-profesional-futbol-cero-cero-frio-liniers_0_jQafwTeia.html,https://images.clarin.com/2021/07/17/t4JghjKOR_720x0__1.jpg
44,OFIzJ7mDz,Copa Libertadores.  Vargas tiene Covid y en Mineiro temen más casos antes de jugar contra Boca,https://www.clarin.com/deportes/chileno-vargas-dio-positivo-coronavirus-baja-boca-mineiro_0_OFIzJ7mDz.html,https://images.clarin.com/2021/07/17/aIvyUDqIQ_1256x620__2.jpg#1626557756443
45,4qNqv5rsa,Open británico de golf. Oosthuizen se mantiene líder pero la presión se empieza a hacer sentir,https://www.clarin.com/deportes/open-britanico-golf-oosthuizen-mantiene-lider-presion-empieza-hacer-sentir_0_4qNqv5rsa.html,https://images.clarin.com/2021/07/17/3o1gaWxy9_720x0__1.jpg
46,py7y8-eBy,Fórmula 1 . Espectacular largada de Verstappen en el primer sprint de la historia ,https://www.clarin.com/deportes/verstappen-quedo-primer-sprint-historia-formula-1-partira-adelante-silverstone_0_py7y8-eBy.html,https://images.clarin.com/2021/07/17/XrQiwHNPP_1256x620__2.jpg#1626542755256
47,rGHKkdXR4,2-2 en La Plata. Gimnasia rescató un empate agónico ante Platense,https://www.clarin.com/deportes/gimnasia-plata-vs-platense-liga-profesional-futbol-previa-alineaciones-minuto-minuto_0_rGHKkdXR4.html,https://images.clarin.com/2021/07/17/6KHyoNmti_1256x620__2.jpg#1626563132165
48,oPvFj0PyK,4-2 en el Sur. El inoxidable Sand festejó sus 41 con un doblete y Lanús ganó un partidazo,https://www.clarin.com/deportes/lanus-vs-atletico-tucuman-liga-profesional-futbol-previa-alineaciones-minuto-minuto_0_oPvFj0PyK.html,https://images.clarin.com/2021/07/17/WcDqbiAje_720x0__1.jpg
49,EPsets6DN,En Maldivas. La romántica propuesta de matrimonio de Tagliafico a su novia,https://www.clarin.com/deportes/romantica-propuesta-matrimonio-nicolas-tagliafico-novia-islas-maldivas_0_EPsets6DN.html,https://images.clarin.com/2021/07/17/QNZDmj0jF_720x0__1.jpg
50,oYnvgH2OH,Crisis y protestas. Acto al amanecer y con Raúl Castro presente: el régimen cubano hizo su propia marcha de apoyo,https://www.clarin.com/mundo/regimen-cuba-muestra-musculo-marcha-encabezada-raul-castro_0_oYnvgH2OH.html,https://images.clarin.com/2021/07/17/m9k32QOuc_720x0__1.jpg
51,9J4dwGK2F,"""Patria o muerte"". Diputados del Frente de Todos salieron a respaldar el régimen cubano",https://www.clarin.com/politica/-patria-muerte-diputados-frente-salieron-respaldar-regimen-cubano_0_9J4dwGK2F.html,https://images.clarin.com/2021/03/18/CCL3ykAFB_720x0__1.jpg
52,Ot9l7idQ-,La segunda ola. Coronavirus en Argentina: informan otras 276 muertes y 12.230 casos positivos,https://www.clarin.com/sociedad/coronavirus-argentina-informan-276-muertes-12-230-casos-positivos_0_Ot9l7idQ-.html,https://images.clarin.com/2021/07/15/89ukI9grj_720x0__1.jpg
53,D0rdbUm3D,En Plaza de Mayo. Desesperado reclamo de padres para que vacunen a sus hijos con discapacidades,https://www.clarin.com/sociedad/desesperado-reclamo-padres-chicos-discapacidad-llegada-vacunas-pfizer-grandes-olvidados-_0_D0rdbUm3D.html,https://images.clarin.com/2021/07/17/zpAfV3ulr_720x0__1.jpg
54,HDLi7L94N,Brasil. El curioso video que publicó Bolsonaro desde el hospital donde está internado,https://www.clarin.com/mundo/curioso-video-publico-jair-bolsonaro-hospital-internado_0_HDLi7L94N.html,https://images.clarin.com/2021/07/17/PzEVBYYFw_720x0__1.jpg
55,PHBLsut40,Análisis. El plan económico del Gobierno: siguen los éxitos y la sarasa de Martín Guzmán,https://www.clarin.com/economia/plan-economico-gobierno-siguen-exitos-sarasa-martin-guzman_0_PHBLsut40.html,https://images.clarin.com/2021/06/22/zeBvoBI2h_720x0__1.jpg
56,1Bl78ZkZq,En Chubut. Un mozo gastó $ 80 mil de la tarjeta de un cliente y podría ir 6 años preso,https://www.clarin.com/policiales/mozo-quedo-tarjeta-cliente-gasto-80-mil-pesos-podria-ir-6-anos-preso_0_1Bl78ZkZq.html,https://images.clarin.com/2021/07/17/8FW1oZJZg_720x0__1.jpg
57,cIWuqHLRr,A un año del caso. El jubilado que mató a un ladrón en Quilmes volvió a su casa: qué dice hoy,https://www.clarin.com/policiales/jubilado-mato-ladron-quilmes-volvio-casa-quiero-agarrar-arma-_0_cIWuqHLRr.html,https://images.clarin.com/2021/07/15/h8SP-qM30_1256x620__2.jpg#1626375852945
58,4UsOnsRSz,Conexión regulada. Biden quiere darle más Internet a Cuba: evalúa quebrar las restricciones,https://www.clarin.com/tecnologia/joe-biden-quiere-darle-internet-cuba-evalua-quebrar-restricciones_0_4UsOnsRSz.html,https://images.clarin.com/2021/07/17/2-WUNLpLf_720x0__1.jpg
59,eAIjr8dq2,Mundos íntimos. A mi profesora de francés la mató el marido: la asfixió con una almohada,https://www.clarin.com/sociedad/mundos-intimos-profesora-frances-vivia-oprimida-sentia-raro-entendia-luego-supe-marido-mato-_0_eAIjr8dq2.html,https://images.clarin.com/2021/07/14/clzWFa8gW_1256x620__2.jpg#1626282910193
60,2jVGYRkG4,Imperdibles. Nueve bares porteños “instagrameables”: los más buscados para la selfie,https://www.clarin.com/gourmet/9-bares-instagrameables-buenos-aires-buscados-selfie_0_2jVGYRkG4.html,https://images.clarin.com/2020/04/19/701rWUE6W_1256x620__2.jpg#1626484002889
61,3c0mmnLBA,Gratis en la Ciudad. Vacaciones de invierno: la agenda para disfrutar con los chicos,https://www.clarin.com/ciudades/vacaciones-invierno-ciudad-agenda-actividades-disfrutar-chicos_0_3c0mmnLBA.html,https://images.clarin.com/2021/07/15/Xeb0Tdb9T_720x0__1.jpg
62,8gpW_aK25,Estancias y hoteles. Días de campo: ocho escapadas para las vacaciones de invierno,https://www.clarin.com/viajes/dias-campo-estancias-hoteles-rurales-8-escapadas-vacaciones-invierno_0_8gpW_aK25.html,https://images.clarin.com/2021/02/05/z5Dj_ToZ-_720x0__1.jpg
63,OVmdoLNu7,"Nuevo libro. Jimena La Torre y ""los tarots que toda bruja debe saber""",https://www.clarin.com/astrologia/jimena-torre-tarots-toda-bruja-debe-saber-_0_OVmdoLNu7.html,https://images.clarin.com/2020/01/20/DsUtrTAl_1256x620__2.jpg#1626462285142
64,yHdNMNFx-,"Sexo. Role-playing, una práctica que permite hacer realidad las fantasías sexuales",https://www.clarin.com/buena-vida/role-playing-practica-permite-hacer-realidad-fantasias-sexuales_0_yHdNMNFx-.html,https://images.clarin.com/2021/07/15/GCqmj_bRo_720x0__1.jpg
65,u44ORlX_T,Diez claves. Emigrar a España para emprender: cuánto cuesta y qué se pide,https://www.clarin.com/servicios/emigrar-espana-emprender-cuesta-empezar-negocio-documentacion-necesita_0_u44ORlX_T.html,https://images.clarin.com/2021/07/15/l-V7FkUMV_720x0__1.jpg
66,_zWUgUGWc,a 3.500 Kms de su casa. Desapareció hace un año y lo hallaron deambulando en el Ártico,https://www.clarin.com/internacional/desaparecio-hace-ano-hallaron-deambulando-artico-barbudo-3-500-kilometros-casa_0__zWUgUGWc.html,https://images.clarin.com/2021/07/15/ThFgYQZIT_720x0__1.jpg
67,0gaK3czOn,"California. Pena de muerte al ""Destripador de Hollywood"", asesino de una ex novia de Ashton Kutcher",https://www.clarin.com/internacional/espectaculos/pena-muerte-destripador-hollywood-mato-mujeres-ex-novia-ashton-kutcher_0_0gaK3czOn.html,https://images.clarin.com/2021/07/17/G_6GX1VU-_720x0__1.jpg
68,Th2CetFgo,"Historia de lucha. Aprendió a vivir sin colon, recto y estómago: ""Estoy vacío por dentro""",https://www.clarin.com/viste/hombre-aprendio-vivir-colon-recto-estomago-vacio-dentro-_0_Th2CetFgo.html,https://images.clarin.com/2021/07/15/MzHKe9Ivj_720x0__1.jpg
69,EUi2bBIpJ,Impresionantes. Las fotos de galaxias cercanas captadas por los telescopios más potentes,https://www.clarin.com/internacional/fuegos-artificiales-impresionantes-imagenes-galaxias-cercanas-captadas-telescopios-potentes-mundo_0_EUi2bBIpJ.html,https://images.clarin.com/2021/07/17/OukuStGdf_720x0__1.jpg
70,rV9NFyxt5,"En México. Robaron 100 mil dólares en zapatillas, pero casi todas del pie izquierdo",https://www.clarin.com/internacional/mexico/robaron-100-mil-dolares-zapatillas-todas-pie-izquierdo_0_rV9NFyxt5.html,https://images.clarin.com/2021/03/29/Mw4w5iPiH_720x0__1.jpg
71,wEAR05BHI,Space Jam. Qué es de la vida de Wayne Knight y los otros actores del clásico de los noventa,https://www.clarin.com/internacional/espectaculos/space-jam-vida-wayne-knight-personajes-clasico-noventa_0_wEAR05BHI.html,https://images.clarin.com/2021/07/15/YgvubsALL_720x0__1.jpg
72,Psfu-sRG5,Llamativo hashtag. Carla Vizzotti habló de la licitación para comprar 10 mil penes de madera,https://www.clarin.com/politica/carla-vizzotti-hablo-polemica-licitacion-comprar-10-mil-penes-madera_0_Psfu-sRG5.html,https://images.clarin.com/2021/07/02/HBxclTOKc_720x0__1.jpg
73,Abfuep4AE,Contámelo otra vez. Sobrevivió a un accidente aéreo en 2014 y revela cómo salió adelante,https://www.clarin.com/sociedad/sobrevivio-accidente-aereo-salio-adelante-respeto-paso-dedico-vida-_0_Abfuep4AE.html,https://images.clarin.com/2021/07/17/PH98cqELp_1256x620__2.jpg#1626552532154
74,jLP1gBqOu,Femicidio en Quilmes. El curioso hallazgo en el celular del acusado de matar a su sobrina en un hotel,https://www.clarin.com/policiales/detienen-tio-joven-asesinada-punaladas-hotel-alojamiento-quilmes_0_jLP1gBqOu.html,https://images.clarin.com/2021/07/17/5dHezEqOC_720x0__1.jpg
75,MbbAhvPyX,"No hay detenidos. El misterioso crimen del contador: quién era el ""pibe intachable"" asesinado ",https://www.clarin.com/policiales/misterioso-crimen-contador-gonzalo-calleja-pibe-intachable-asesinado-parana_0_MbbAhvPyX.html,https://images.clarin.com/2021/07/17/XV2ADTnjS_1256x620__2.jpg#1626544000704
76,-bWcutemH,Ciclo lectivo. Proponen que los chicos deban aprobar el 70% del contenido para pasar de grado,https://www.clarin.com/sociedad/polemica-gobierno-propone-alumnos-aprobar-70-contenidos-parar-pasar-grado_0_-bWcutemH.html,https://images.clarin.com/2020/01/24/_jvqL0tB_720x0__1.jpg
77,nDfCZrhvZ,La interna de JxC. Radicales vs. radicales: una diáspora  que le suma pimienta a las PASO,https://www.clarin.com/politica/radicales-vs-radicales-diaspora-suma-pimienta-paso-2021_0_nDfCZrhvZ.html,https://images.clarin.com/2021/06/27/ZghPHOwqK_720x0__1.jpg
78,a8S-zPIpD,"Relax del campeón. El descanso de Messi: caminata, fotos y un clip musical junto al mar",https://www.clarin.com/deportes/messi-antonela-video-musical_0_a8S-zPIpD.html,https://images.clarin.com/2021/07/17/jXwH59IP2_720x0__1.jpg
79,V_-E07koA,Más show. Prueban en juveniles 4 modificaciones que podrían revolucionar al fútbol,https://www.clarin.com/deportes/torneo-juvenil-puso-prueba-cambios-reglamentarios-podrian-revolucionar-futbol_0_V_-E07koA.html,https://images.clarin.com/2021/07/17/TIUKeS5q8_720x0__1.jpg
80,SjsIp6rNp6,"Reseña de una nueva biografía. Genialidad, miserias y la creación de un imperio global: los secretos de Jeff Bezos",https://www.clarin.com/tecnologia/genialidad-miserias-creacion-imperio-global-secretos-jeff-bezos-descubierto-nueva-biografia_0_SjsIp6rNp6.html,https://images.clarin.com/2021/07/08/UuUBLBuCu_720x0__1.jpg
81,TqF4rB2Xm,"Especial para Clarín. Cuba, '89: memorias paranoicas de San Antonio de Los Baños",https://www.clarin.com/revista-n/cuba-89-memorias-paranoicas-san-antonio-banos_0_TqF4rB2Xm.html,https://images.clarin.com/2021/07/17/MUlsgj9VR_720x0__1.jpg
82,srrlPoMPx,"Costa Morúa.  ""El pueblo de Cuba le ha puesto el sello de fin al discurso de la revolución""",https://www.clarin.com/mundo/manuel-costa-morua-pueblo-cuba-puesto-sello-fin-discurso-revolucion-_0_srrlPoMPx.html,https://images.clarin.com/2019/08/24/MlRV1wePJ_720x0__1.jpg
83,uQ9R4zW-c,"Profeta en muchas tierras. Ricardo Montaner: familia, haters, La Voz Argentina y el Fideo Di María como hijo",https://www.clarin.com/espectaculos/musica/ricardo-montaner-familia-haters-voz-argentina-fideo-di-maria-hijo_0_uQ9R4zW-c.html,https://images.clarin.com/2021/07/14/BxZgISldi_720x0__1.jpg
84,wzNsiP7Xm,"La historia de Erik Finman. Su abuela le dio US$ 1.000 a los 12, los invirtió en bitcoin y hoy es millonario",https://www.clarin.com/tecnologia/abuela-regalo-mil-dolares-cumplio-12-anos-invirtio-bitcoin-hoy-millonario_0_wzNsiP7Xm.html,https://images.clarin.com/2021/07/17/kzwgeJsfW_720x0__1.jpg
85,sZz9U8Vnd,Sexualidad. Tres juguetes eróticos innovadores para probar en pareja,https://www.clarin.com/relaciones/3-juguetes-eroticos-innovadores-para-probar-en-pareja_0_sZz9U8Vnd.html,https://images.clarin.com/2021/07/15/ayRD91tha_1256x620__2.jpg#1626393257968
86,5FMmNjRjl,"Medida del COI. Camas ""anti sexo"" en los Juegos Olímpicos: cómo impacta esta prohibición",https://www.clarin.com/relaciones/camas-anti-sexo-juegos-olimpicos-impacta-prohibicion_0_5FMmNjRjl.html,https://images.clarin.com/2021/06/20/TvP-hxtYi_720x0__1.jpg
87,s-pd52PDT,Modelos y precios. Todo lo que hay que saber para instalar cámaras de seguridad en casa,https://www.clarin.com/tecnologia/camaras-vigilancia-ultima-generacion-5-mejores-modelos-reforzar-seguridad-casa_0_s-pd52PDT.html,https://images.clarin.com/2021/07/14/kfQ6ZzR_d_720x0__1.jpg
88,WIdGW_irp,"Donald Sutherland. Fue Homero Simpson, Cristo y casi muere filmando con Clint Eastwood",https://www.clarin.com/espectaculos/cine/donald-sutherland-homer-simpson-pelicula-cristo-muere-filmando-clint-eastwood_0_WIdGW_irp.html,https://images.clarin.com/2021/07/16/5UFuF0gQw_720x0__1.jpg
89,nVoxNaxKm,Festival de Cannes. Histórico: una película dirigida por una mujer gana la Palma de Oro,https://www.clarin.com/espectaculos/cine/segunda-vez-historia-filme-dirigido-mujer-gana-palma-oro_0_nVoxNaxKm.html,https://images.clarin.com/2021/07/17/l7hZfN3j8_720x0__1.jpg
90,SjsIp6rNp6,"Reseña de una nueva biografía. Genialidad, miserias y la creación de un imperio global: los secretos de Jeff Bezos",https://www.clarin.com/tecnologia/genialidad-miserias-creacion-imperio-global-secretos-jeff-bezos-descubierto-nueva-biografia_0_SjsIp6rNp6.html,https://images.clarin.com/2021/07/08/UuUBLBuCu_720x0__1.jpg
91,TqF4rB2Xm,"Especial para Clarín. Cuba, '89: memorias paranoicas de San Antonio de Los Baños",https://www.clarin.com/revista-n/cuba-89-memorias-paranoicas-san-antonio-banos_0_TqF4rB2Xm.html,https://images.clarin.com/2021/07/17/MUlsgj9VR_720x0__1.jpg
92,srrlPoMPx,"Costa Morúa.  ""El pueblo de Cuba le ha puesto el sello de fin al discurso de la revolución""",https://www.clarin.com/mundo/manuel-costa-morua-pueblo-cuba-puesto-sello-fin-discurso-revolucion-_0_srrlPoMPx.html,https://images.clarin.com/2019/08/24/MlRV1wePJ_720x0__1.jpg
93,uQ9R4zW-c,"Profeta en muchas tierras. Ricardo Montaner: familia, haters, La Voz Argentina y el Fideo Di María como hijo",https://www.clarin.com/espectaculos/musica/ricardo-montaner-familia-haters-voz-argentina-fideo-di-maria-hijo_0_uQ9R4zW-c.html,https://images.clarin.com/2021/07/14/BxZgISldi_720x0__1.jpg
