n,id,title,url,image
1,smEu4z28G,"Tras su polémica frase. En Brasil acusan de ""racista"" a Alberto Fernández y también hay indignación en México",https://www.clarin.com/mundo/polemica-frase-alberto-fernandez-brasilenos-mexicanos-genera-repercusiones-medios-internacionales_0_smEu4z28G.html,https://images.clarin.com/2021/06/09/diJhNAfXD_1256x620__2.jpg#1623272103731
2,ctbRt_9Ce,"""Selva"". El irónico tuit de Bolsonaro luego de los dichos de Alberto Fernández",https://www.clarin.com/politica/ironica-respuesta-jair-bolsonaro-alberto-fernandez-foto-selva-_0_ctbRt_9Ce.html,https://images.clarin.com/2021/06/09/pfu3aAt5L_720x0__1.jpg
3,FSgG54L_P,Mirada. Bloopers y tropezones de un ocurrente serial,https://www.clarin.com/cultura/bloopers-tropezones-ocurrente-serial_0_FSgG54L_P.html,https://images.clarin.com/2021/06/09/y2FuGOAVV_720x0__1.jpg
4,lTrEpbEDc,"Del editor. Las extrañas muertes que ""ahorra"" Vizzotti",https://www.clarin.com/opinion/extranas-muertes-ahorradas-ministra-vizzotti_0_lTrEpbEDc.html,https://images.clarin.com/2021/04/08/0K7o6Dhre_720x0__1.jpg
5,ZRrkFBbl-,Tras los cuestionamientos. Monotributo: eliminan el ajuste retroactivo de las cuotas y amplían las escalas,https://www.clarin.com/economia/anticipo-gobierno-dara-marcha-polemico-ajuste-retroactivo-cuotas-monotributo_0_ZRrkFBbl-.html,https://images.clarin.com/2021/06/09/q3ME-i8p8_720x0__1.jpg
6,0Z_aUUXyU,Impacto positivo. Covid: los datos que confirman que las vacunas funcionan,https://www.clarin.com/buena-vida/covid-datos-confirman-vacunas-funcionan_0_0Z_aUUXyU.html,https://images.clarin.com/2021/06/01/mHaIWvA_-_720x0__1.jpg
7,K6i70BgBp,"Está en Uruguay. Tras dar positivo de coronavirus, Susana Giménez contó como se siente",https://www.clarin.com/fama/susana-gimenez-enferma-covid-declaro-dolor-cuerpo-horrible-_0_K6i70BgBp.html,https://images.clarin.com/2021/04/24/2Cm6tdEZe_720x0__1.jpg
8,rnsOFkifw,"NBA. Con un flojo Campazzo, Denver cayó aplastado por Phoenix",https://www.clarin.com/deportes/facundo-campazzo-denver-nuggets-vs-phoenix-suns-playoffs-nba-minuto-minuto_0_rnsOFkifw.html,https://images.clarin.com/2021/06/09/BNt1ZLC9Z_1256x620__2.jpg#1623290248271
9,DxKFJdF5Q,Coronavirus. Ibuprofeno: cómo se gestó su mala fama y qué dicen ahora los médicos,https://www.clarin.com/sociedad/ibuprofeno-covid-gesto-mala-fama-dicen-ahora-medicos-uso_0_DxKFJdF5Q.html,https://images.clarin.com/2020/06/09/ftOWletwT_720x0__1.jpg
10,vwTLyZ501,Oferta creciente. Tres accesorios simples y baratos para soportar mejor el barbijo,https://www.clarin.com/servicios/accesorios-simples-baratos-soportar-mejor-barbijo_0_vwTLyZ501.html,https://images.clarin.com/2021/06/09/RdY0vs4Gi_720x0__1.jpg
11,AAkGAgOgY,"Coronavirus. Cómo la variante ""Alfa"" se hizo tan poderosa",https://www.clarin.com/new-york-times-international-weekly/variante-alfa-coronavirus-hizo-poderosa_0_AAkGAgOgY.html,https://images.clarin.com/2021/06/08/O-18MfRV6_1256x620__2.jpg#1623162844202
12,smEu4z28G,"Tras su polémica frase. En Brasil acusan de ""racista"" a Alberto Fernández y también hay indignación en México",https://www.clarin.com/mundo/polemica-frase-alberto-fernandez-brasilenos-mexicanos-genera-repercusiones-medios-internacionales_0_smEu4z28G.html,https://images.clarin.com/2021/06/09/diJhNAfXD_1256x620__2.jpg#1623272103731
13,ctbRt_9Ce,"""Selva"". El irónico tuit de Bolsonaro luego de los dichos de Alberto Fernández",https://www.clarin.com/politica/ironica-respuesta-jair-bolsonaro-alberto-fernandez-foto-selva-_0_ctbRt_9Ce.html,https://images.clarin.com/2021/06/09/pfu3aAt5L_720x0__1.jpg
14,FSgG54L_P,Mirada. Bloopers y tropezones de un ocurrente serial,https://www.clarin.com/cultura/bloopers-tropezones-ocurrente-serial_0_FSgG54L_P.html,https://images.clarin.com/2021/06/09/y2FuGOAVV_720x0__1.jpg
15,lTrEpbEDc,"Del editor. Las extrañas muertes que ""ahorra"" Vizzotti",https://www.clarin.com/opinion/extranas-muertes-ahorradas-ministra-vizzotti_0_lTrEpbEDc.html,https://images.clarin.com/2021/04/08/0K7o6Dhre_720x0__1.jpg
16,ZRrkFBbl-,Tras los cuestionamientos. Monotributo: eliminan el ajuste retroactivo de las cuotas y amplían las escalas,https://www.clarin.com/economia/anticipo-gobierno-dara-marcha-polemico-ajuste-retroactivo-cuotas-monotributo_0_ZRrkFBbl-.html,https://images.clarin.com/2021/06/09/q3ME-i8p8_720x0__1.jpg
17,0Z_aUUXyU,Impacto positivo. Covid: los datos que confirman que las vacunas funcionan,https://www.clarin.com/buena-vida/covid-datos-confirman-vacunas-funcionan_0_0Z_aUUXyU.html,https://images.clarin.com/2021/06/01/mHaIWvA_-_720x0__1.jpg
18,K6i70BgBp,"Está en Uruguay. Tras dar positivo de coronavirus, Susana Giménez contó como se siente",https://www.clarin.com/fama/susana-gimenez-enferma-covid-declaro-dolor-cuerpo-horrible-_0_K6i70BgBp.html,https://images.clarin.com/2021/04/24/2Cm6tdEZe_720x0__1.jpg
19,rnsOFkifw,"NBA. Con un flojo Campazzo, Denver cayó aplastado por Phoenix",https://www.clarin.com/deportes/facundo-campazzo-denver-nuggets-vs-phoenix-suns-playoffs-nba-minuto-minuto_0_rnsOFkifw.html,https://images.clarin.com/2021/06/09/BNt1ZLC9Z_1256x620__2.jpg#1623290248271
20,xsLF9gFj-,"Eurocopa 2020. Con público y en 11 sedes, la elite del Viejo Continente arranca su gran fiesta",https://www.clarin.com/deportes/euro-2020-publico-tribunas-11-sedes-distintas--elite-futbol-viejo-continente-arranca-gran-fiesta_0_xsLF9gFj-.html,https://images.clarin.com/1969/12/31/r1ZDsmhK4x_1256x620__1.jpg#1622916747252
21,qT3xE1GLc,Alivio en la Selección. La lesión del Cuti Romero no es grave y estará en la Copa América,https://www.clarin.com/deportes/cristian-romero-lesion-copa-america_0_qT3xE1GLc.html,https://images.clarin.com/2021/06/09/kzCCaap1ym_1256x620__2.jpg#1623283312214
22,M4Zc48qRb,"A 35 años de México 86. Canadá, la selección que tenía medio plantel que jugaba otro deporte ",https://www.clarin.com/deportes/35-anos-mexico-86-canada-peculiar-seleccion-medio-plantel-jugaba-deporte-pleno-mundial_0_M4Zc48qRb.html,https://images.clarin.com/2021/06/09/umRRIH-RH_720x0__1.jpg
23,dtz07LO7q,Pese a la caída. La increíble racha que Schwartzman le cortó a Nadal,https://www.clarin.com/deportes/increible-racha-schwartzman-corto-nadal-roland-garros_0_dtz07LO7q.html,https://images.clarin.com/2021/06/09/7FSK_TDgr_720x0__1.jpg
24,ZvuvCQwwy,"En París. Una derrota que enaltece al ""Peque"" Schwartzman ante un Nadal insoportable",https://www.clarin.com/deportes/derrota-enaltece-peque-schwartzman-rafa-nadal-insoportable_0_ZvuvCQwwy.html,https://images.clarin.com/2021/06/09/2AB44AU5z_720x0__1.jpg
25,ZiV2b4M8a,Roland Garros. Djokovic y un triunfo que lo mete en las semis y lo llena de confianza,https://www.clarin.com/deportes/novak-djokovic-triunfo-mete-semis-roland-garros-llena-confianza-disputarle-trono-nadal_0_ZiV2b4M8a.html,https://images.clarin.com/2021/06/09/I0ebSaH5Y_1256x620__2.jpg#1623282076445
26,fQtdDS5u5,"Indignado. Ruggeri explotó porque aún no lo vacunaron: ""Con mi salud no van a joder""",https://www.clarin.com/deportes/oscar-ruggeri-exploto-vivo-aviso-llaman-vacunarse-hara-exterior_0_fQtdDS5u5.html,https://images.clarin.com/2021/06/09/gHi8KTbzA_1256x620__2.jpg#1623266966689
27,k2rfCO5HE,"Automovilismo. Damián Fineschi, el ingeniero que regresó al país y gana en Súper TC 2000",https://www.clarin.com/deportes/damian-fineschi-ingeniero-regreso-pais-gana-super-tc-2000_0_k2rfCO5HE.html,https://images.clarin.com/2021/06/09/Hl_eRYEDY_720x0__1.jpg
28,3Qerf3LXC,Medidas por la pandemia. Superpoderes: sin certezas de que Diputados logre los votos para la ley,https://www.clarin.com/politica/oficialismo-apura-proyecto-alberto-fernandez-poderes-manejar-pandemia_0_3Qerf3LXC.html,https://images.clarin.com/2021/03/07/mw1eXVEO__720x0__1.jpg
29,qRhSG3t_7,Encuesta y sorpresa. Rodríguez Larreta ya no es el opositor más querido entre los votantes K,https://www.clarin.com/politica/sorpresa-encuesta-horacio-rodriguez-larreta-opositor-querido-votantes-k_0_qRhSG3t_7.html,https://images.clarin.com/2021/06/09/PW8P0mLSb_720x0__1.jpg
30,I80R6Zbqn,"Nuevo parte. Reutemann presentó una ""buena evolución"" de su cuadro infeccioso",https://www.clarin.com/politica/nuevo-parte-medico-carlos-reutemann-presento-buena-evolucion-cuadro-infeccioso_0_I80R6Zbqn.html,https://images.clarin.com/2017/03/29/BkeSY3yTg_720x0.jpg
31,YlcmgIRz6,"Criticó al Gobierno. Darín: ""Estamos haciendo todo al revés para atraer inversión extranjera""",https://www.clarin.com/politica/ricardo-darin-duro-gobierno-haciendo-reves-hora-atraer-inversion-extranjera-_0_YlcmgIRz6.html,https://images.clarin.com/2021/02/25/CsnY3uOPE_720x0__1.jpg
32,Hqje9F1VJ,Tragedia en Bariloche. Una joven murió al caer de un puente: investigan si quiso sacarse una selfie,https://www.clarin.com/sociedad/joven-murio-caer-puente-bariloche-investigan-intentaba-sacarse-selfie_0_Hqje9F1VJ.html,https://images.clarin.com/2021/06/09/5hcJQwQXm_720x0__1.jpg
33,-e0EwjBJA,Tiene 55 años. El músico Willy Crook sufrió un ACV y está internado en coma farmacológico,https://www.clarin.com/espectaculos/musica/musico-willy-crook-sufrio-acv-internado-coma-farmacologico_0_-e0EwjBJA.html,https://images.clarin.com/2021/06/09/5Vt5FFoU0_720x0__1.jpg
34,o6vNNMomU,Día Nacional. Seguridad Vial: 10 personas mueren por día por accidentes de tránsito,https://www.clarin.com/autos/dia-nacional-seguridad-vial-10-personas-mueren-dia-accidentes-transito_0_o6vNNMomU.html,https://images.clarin.com/2021/03/09/bBSK9UJ2s_720x0__1.jpg
35,3YZCGOjjM,Para toda la semana. 24 recetas saludables para que los chicos coman mejor,https://www.clarin.com/gourmet/24-recetas-saludables-chicos-coman-mejor_0_3YZCGOjjM.html,https://images.clarin.com/2021/05/31/VRuJNTdp3_720x0__1.jpg
36,wz2B5jcoK,Vinos bajo el mar. La bodega argentina que sumergió sus botellas en cavas submarinas,https://www.clarin.com/viajes/vinos-mar-bodega-argentina-sumergio-botellas-cavas-submarinas_0_wz2B5jcoK.html,https://images.clarin.com/2021/06/08/r56-Bskk0_720x0__1.jpg
37,FOjGOBrVU,"Entrevista. El argentino que diseñó el Audi de tres motores para el Dakar: ""Es un OVNI""",https://www.clarin.com/autos/juan-manuel-diaz-argentino-diseno-audi-motores-dakar-ovni-_0_FOjGOBrVU.html,https://images.clarin.com/2021/06/08/iJgt33MdS_720x0__1.jpg
38,2JyrhFyfx,Salud. Los peligros de fluctuar mucho de peso en poco tiempo,https://www.clarin.com/buena-vida/peligros-fluctuar-peso-tiempo_0_2JyrhFyfx.html,https://images.clarin.com/2021/06/09/ZWIJAGAif_720x0__1.jpg
39,JRvxHJqwR,Informe. Día Nacional de la Seguridad Vial: el 85% de las sillas infantiles están mal colocadas,https://www.clarin.com/autos/dia-nacional-seguridad-vial-85-sillas-infantiles-mal-colocadas_0_JRvxHJqwR.html,https://images.clarin.com/2018/06/08/SyIkavOlQ_720x0__2.jpg#1623301372806
40,AO3uvQaL6O,Espiritualidad. Meditación para recibir la energía del eclipse solar en Géminis,https://www.clarin.com/astrologia/meditacion-recibir-energia-eclipse-solar-geminis_0_AO3uvQaL6O.html,https://images.clarin.com/2021/06/09/AZcPyo0St_720x0__1.jpg
41,HmL3TKTIn,Clima energético. Eclipse solar de junio 2021: influencias y qué podemos esperar en estos días,https://www.clarin.com/astrologia/eclipse-solar-junio-2021-influencias-podemos-esperar-dias_0_HmL3TKTIn.html,https://images.clarin.com/2021/06/03/lvPxwVqif_720x0__1.jpg
42,ogwcDRnIE,Rumbo a Tokio. Los Murciélagos se consagraron campeones del Grand Prix de Japón,https://www.clarin.com/brandstudio/murcielagos-consagraron-campeones-grand-prix-japon_0_ogwcDRnIE.html,https://images.clarin.com/2021/06/08/e1FyvtR40_720x0__1.jpg
43,Ly7KG970d,"Máxima crueldad. Vampirismo, orgías y muerte: la historia de la condesa sangrienta",https://www.clarin.com/internacional/vampirismo-orgias-muerte-aberrante-historia-condesa-sangrienta-mayor-asesina-serial-historia_0_Ly7KG970d.html,https://images.clarin.com/2021/06/09/GqR0EAK3w_720x0__1.jpg
44,2hAskUkjk,Decisiones inteligentes. Ecosistema Conectado John Deere: información que revoluciona la forma de trabajar,https://www.clarin.com/rural/ecosistema-conectado-john-deere-informacion-revoluciona-forma-trabajar_0_2hAskUkjk.html,https://images.clarin.com/2021/06/08/YVLrwFX7F_720x0__1.jpg
45,pVxhhNkfU,"""Asqueroso"". Pidió pollo y recibió una toalla frita: la respuesta del restaurante",https://www.clarin.com/viste/pidio-pollo-recibio-toalla-frita-lanzo-feroz-critica-respuesta-restaurante_0_pVxhhNkfU.html,https://images.clarin.com/2021/06/08/Fusj0Nw8d_720x0__1.jpg
46,CMbDipbuI,"Estreno. El conjuro 3: Es verdad, aunque usted no lo crea",https://www.clarin.com/espectaculos/cine/conjuro-3-verdad--usted-crea_0_CMbDipbuI.html,https://images.clarin.com/2021/06/08/p46vjD12J_720x0__1.jpg
47,hkSm-GneK,Vale US$ 15 mil. Lo atropellaron y le robaron su pierna ortopédica que es única en el mundo,https://www.clarin.com/viste/atropellaron-hombre-robaron-pierna-ortopedica-unica-mundo_0_hkSm-GneK.html,https://images.clarin.com/2021/06/09/vDDdxq1dz_720x0__1.jpg
48,foytCxLyo,Mirá el video. Un joven amenazó al dueño de un negocio y terminó noqueado,https://www.clarin.com/viste/joven-amenazo-dueno-negocio-termino-noqueado_0_foytCxLyo.html,https://images.clarin.com/2021/06/09/IiTzJGGJi_720x0__1.jpg
49,CgT_Nf0GU,Escenario. Las contradicciones del Estado débil: ¿hay zonas del GBA donde sobran dosis?,https://www.clarin.com/politica/contradicciones-debil-zonas-conurbano-vacunas-sobran-_0_CgT_Nf0GU.html,https://images.clarin.com/2021/05/05/oJeg5NEej_720x0__1.jpg
50,XhSGdqe6K,El rol opositor. Juntos por el Cambio discute un nuevo nombre para poder ampliarse,https://www.clarin.com/politica/busqueda-ampliar-bajar-imagen-negativa-motivos-juntos-cambio-discutir-nuevo-nombre_0_XhSGdqe6K.html,https://images.clarin.com/2021/06/08/4kaKvmDWv_720x0__1.jpg
51,7xIqKxZvN,Nación no quiere. Desde el lunes habrá más clases presenciales en las secundarias porteñas,https://www.clarin.com/sociedad/ciudad-analiza-vuelvan-alumnos-secundarios-aula-chicos-presencialidad-completa_0_7xIqKxZvN.html,https://images.clarin.com/2021/06/09/Bxy2HmtYS_720x0__1.jpg
52,rnsOFkifw,"NBA. Con un flojo Campazzo, Denver cayó aplastado por Phoenix",https://www.clarin.com/deportes/facundo-campazzo-denver-nuggets-vs-phoenix-suns-playoffs-nba-minuto-minuto_0_rnsOFkifw.html,https://images.clarin.com/2021/06/09/BNt1ZLC9Z_1256x620__2.jpg#1623290248271
53,49lXa-SnN,"Finanzas personales. Paso a paso, cómo vender dólares  de manera legal y al mejor precio",https://www.clarin.com/servicios/paso-paso--vender-dolares--manera-legal-mejor-precio_0_49lXa-SnN.html,https://images.clarin.com/2021/03/22/VosNxnRmN_720x0__1.jpg
54,eLi7mHgA1,Desde el martes. Florencia Kirchner está internada en el Otamendi: qué dice el parte médico,https://www.clarin.com/politica/florencia-kirchner-internada-sanatorio-otamendi_0_eLi7mHgA1.html,https://images.clarin.com/2020/02/11/48K2OSIQ_720x0__1.jpg
55,1A0ikcIbW,Motochorros. Asesinan de un balazo en la cabeza a un empresario para robarle la camioneta,https://www.clarin.com/policiales/buscar-esposa-asesinaron-balazo-cabeza-robarle-camioneta_0_1A0ikcIbW.html,https://images.clarin.com/2021/06/09/TovzpTgVd_720x0__1.jpg
56,gCWlF6Tmo,"Traición intramuros. La verdad sobre el Pastor Alejandro, según el youtuber tumbero",https://www.clarin.com/policiales/verdad-pastor-alejandro--youtuber-tumbero_0_gCWlF6Tmo.html,https://images.clarin.com/2021/04/30/EK3yCi8O6_1256x620__2.jpg#1623271685141
57,UWXsNamux,Tendencia global. ¿Un mundo sin chicos? Interrogantes y desafíos que plantea la caída de la natalidad,https://www.clarin.com/mundo/mundo-chicos-interrogantes-desafios-plantea-caida-natalidad_0_UWXsNamux.html,https://images.clarin.com/2021/06/09/WtWInk8fX_720x0__1.jpg
58,WpVwUcHrt,"Entrevista exclusiva. Pechito López, de la tarjeta de crédito que no funcionaba a vivir en Mónaco",https://www.clarin.com/deportes/pechito-lopez-argentino-campeon-mundial-fangio-tarjeta-credito-funcionaba-vivir-monaco_0_WpVwUcHrt.html,https://images.clarin.com/2020/09/14/U_vh0IGbD_1256x620__2.jpg#1623287455220
59,iM9kQ-iCYw,"Marty Baron. El periodista de las historias únicas, entre Spotlight y The Washington Post",https://www.clarin.com/internacional/marty-baron-periodista-historias-unicas-spotlight-the-washington-post-retiro-pulitzers_0_iM9kQ-iCYw.html,https://images.clarin.com/2021/06/06/WyzjJtQ1T_720x0__1.jpg
60,DAvihYpXa,Tragedia en el Delta. Manejaba borracho una lancha y mató a una chica: $ 10 millones para no ir a juicio,https://www.clarin.com/sociedad/manejaba-borracho-lancha-mato-joven-paga-10-millones-zafar-juicio_0_DAvihYpXa.html,https://images.clarin.com/2021/06/09/yGWLREP5o_1256x620__2.jpg#1623275654282
61,i0MiyuwvJ,"Retrato. Clotilde Hesme, la francesa que le hace la segunda a Omar Sy en Lupin",https://www.clarin.com/espectaculos/tv/clotilde-hesme-francesa-hace-segunda-omar-sy-lupin_0_i0MiyuwvJ.html,https://images.clarin.com/2021/06/09/7TCsqqYXG_720x0__1.jpg
62,SqqUHvZrj,Despegó con demora. Las cigarras invadieron el avión de los periodistas que viajan con Biden,https://www.clarin.com/mundo/cigarras-invaden-avion-periodistas-viajan-joe-biden-demora-horas_0_SqqUHvZrj.html,https://images.clarin.com/2021/06/09/eAPHDef8B_1256x620__2.jpg#1623258543993
63,qDAv8G55r,Residuos patogénicos. Qué se debe hacer si se encuentra un animal muerto en la calle en la Ciudad,https://www.clarin.com/ciudades/debe-hacer-encuentra-animal-muerto-calle-ciudad_0_qDAv8G55r.html,https://images.clarin.com/2021/06/05/o4T5RBlgC_720x0__1.jpg
64,gvlQ8iZzZ,Oficinas Virtuales. El sueño de un espacio de trabajo remoto e integrado para PyMEs,https://www.clarin.com/brandstudio/sueno-espacio-trabajo-remoto-integrado-pymes_0_gvlQ8iZzZ.html,https://images.clarin.com/2021/06/02/ameEHXxax_1256x620__2.jpg#1622643955031
