n,id,title,url,image
1,Jpw11dKwV,Copa Libertadores. La batalla de Boca en el Mineirao: paso a paso de un escándalo que había sido anunciado,https://www.clarin.com/deportes/batalla-belo-horizonte-cronica-paso-paso-escandalo-anunciado_0_Jpw11dKwV.html,https://images.clarin.com/2021/07/21/ILS1h_zGX_720x0__1.jpg
2,Nw61_tjfl,"Opinión. La rodilla, el glúteo y el VAR de los tontos",https://www.clarin.com/opinion/rodilla-gluteo-var-tontos_0_Nw61_tjfl.html,https://images.clarin.com/2021/07/21/jv5YZ2ERJ_720x0__1.jpg
3,tUUxGZTUR,Escándalo en Brasil. Audios y videos: así actuó el VAR en el gol que le anularon a Boca,https://www.clarin.com/deportes/jugada-polemica-actuo-var-gol-anularon-boca_0_tUUxGZTUR.html,https://images.clarin.com/2021/07/21/FKVM8S-VO_720x0__1.jpg
4,L5N1kesIN,Figuran en el acta. Quiénes son y de qué están acusados seis jugadores de Boca,https://www.clarin.com/deportes/acusados-6-futbolistas-boca-figuran-acta-policia-escandalo-brasil_0_L5N1kesIN.html,https://images.clarin.com/2021/07/21/DObQlSeGz_720x0__1.jpg
5,xl-WGmHFd,Análisis. La culpa no es del chancho ni de los que inventaron el VAR,https://www.clarin.com/deportes/escandalo-atletico-mineiro-boca-libertadores-culpa-chancho-inventaron-var_0_xl-WGmHFd.html,https://images.clarin.com/2021/07/21/-mG7MVCul_720x0__1.jpg
6,nYicQvF5a,Juntos por el Cambio. La extraña foto del pelo que eligieron para confirmar a un candidato en Provincia,https://www.clarin.com/politica/curiosa-foto-juntos-cambio-confirmo-candidatura-diego-santilli-provincia_0_nYicQvF5a.html,https://images.clarin.com/2021/07/21/DgAiMfT8V_720x0__1.jpg
7,saZ5EuAtc,Momento incómodo. El reclamo a los gritos en el acto de Alberto F. donde presentó el DNI no binario,https://www.clarin.com/sociedad/-x-reclamo-gritos-acto-alberto-fernandez-presentar-dni-binario_0_saZ5EuAtc.html,https://images.clarin.com/2021/07/21/dmWdLNlhz_720x0__1.jpg
8,muydpdjzY,En la Ciudad. Cómo es el edificio de viviendas más exclusivo,https://www.clarin.com/economia/inversion-us-130-millones-avanza-construccion-departamentos-exclusivos-ciudad_0_muydpdjzY.html,https://images.clarin.com/2021/07/20/6J6NGv3eK_720x0__1.jpg
9,B5R3qcQwa,Estudio en Sri Lanka. Evaluaron por primera vez la respuesta de Sinopharm frente a la variante Delta,https://www.clarin.com/sociedad/evaluan-primera-vez-respuesta-vacuna-sinopharm-frente-variante-delta_0_B5R3qcQwa.html,https://images.clarin.com/2021/07/21/v3qRs388t_1256x620__2.jpg#1626883044271
10,BbfX3pPo0,Desde el celular. Coronavirus: cómo tramitar el certificado digital de vacunación,https://www.clarin.com/servicios/coronavirus-tramitar-certificado-digital-vacunacion_0_BbfX3pPo0.html,https://images.clarin.com/2021/07/21/huKoLhoix_720x0__1.jpg
11,5uL-aeyI7,Ahorros en dólares. Los 5 errores comunes que arruinan los billetes y los dejan sin valor,https://www.clarin.com/servicios/ahorros-dolares-5-errores-comunes-arruinan-billetes-dejan-valor_0_5uL-aeyI7.html,https://images.clarin.com/2021/07/20/hbCyUfN2Z_720x0__1.jpg
12,zS8Bwnhru,Especial Clarín. Tesoros escondidos: 10 pueblos con historias secretas para ver en vacaciones,https://www.clarin.com/viajes/secretos-fantasmas-pasado-10-pueblos-historia-sorprendernos-vacaciones_0_zS8Bwnhru.html,https://images.clarin.com/2021/07/19/ZvpNNGtYC_720x0__1.jpg
13,g6Xn0kv3D,"Proyecto internacional. Cómo se construyó Little Island, el nuevo parque público de Nueva York",https://www.clarin.com/arq/arquitectura/construyo-little-island-nuevo-parque-publico-nueva-york_0_g6Xn0kv3D.html,https://images.clarin.com/2021/07/13/vmmCfxtgU_720x0__1.jpg
14,QeRTRjuDR,"Guía interactiva. Uno por uno, todos los datos de los 1.080 jugadores de la Liga Profesional",https://www.clarin.com/deportes/guia-interactiva-datos-1-080-jugadores-26-equipos-juegan-liga-profesional-futbol_0_QeRTRjuDR.html,https://images.clarin.com/2021/07/16/9bUAMd3Ga_720x0__1.jpg
15,Jpw11dKwV,Copa Libertadores. La batalla de Boca en el Mineirao: paso a paso de un escándalo que había sido anunciado,https://www.clarin.com/deportes/batalla-belo-horizonte-cronica-paso-paso-escandalo-anunciado_0_Jpw11dKwV.html,https://images.clarin.com/2021/07/21/ILS1h_zGX_720x0__1.jpg
16,Nw61_tjfl,"Opinión. La rodilla, el glúteo y el VAR de los tontos",https://www.clarin.com/opinion/rodilla-gluteo-var-tontos_0_Nw61_tjfl.html,https://images.clarin.com/2021/07/21/jv5YZ2ERJ_720x0__1.jpg
17,tUUxGZTUR,Escándalo en Brasil. Audios y videos: así actuó el VAR en el gol que le anularon a Boca,https://www.clarin.com/deportes/jugada-polemica-actuo-var-gol-anularon-boca_0_tUUxGZTUR.html,https://images.clarin.com/2021/07/21/FKVM8S-VO_720x0__1.jpg
18,L5N1kesIN,Figuran en el acta. Quiénes son y de qué están acusados seis jugadores de Boca,https://www.clarin.com/deportes/acusados-6-futbolistas-boca-figuran-acta-policia-escandalo-brasil_0_L5N1kesIN.html,https://images.clarin.com/2021/07/21/DObQlSeGz_720x0__1.jpg
19,xl-WGmHFd,Análisis. La culpa no es del chancho ni de los que inventaron el VAR,https://www.clarin.com/deportes/escandalo-atletico-mineiro-boca-libertadores-culpa-chancho-inventaron-var_0_xl-WGmHFd.html,https://images.clarin.com/2021/07/21/-mG7MVCul_720x0__1.jpg
20,nYicQvF5a,Juntos por el Cambio. La extraña foto del pelo que eligieron para confirmar a un candidato en Provincia,https://www.clarin.com/politica/curiosa-foto-juntos-cambio-confirmo-candidatura-diego-santilli-provincia_0_nYicQvF5a.html,https://images.clarin.com/2021/07/21/DgAiMfT8V_720x0__1.jpg
21,saZ5EuAtc,Momento incómodo. El reclamo a los gritos en el acto de Alberto F. donde presentó el DNI no binario,https://www.clarin.com/sociedad/-x-reclamo-gritos-acto-alberto-fernandez-presentar-dni-binario_0_saZ5EuAtc.html,https://images.clarin.com/2021/07/21/dmWdLNlhz_720x0__1.jpg
22,muydpdjzY,En la Ciudad. Cómo es el edificio de viviendas más exclusivo,https://www.clarin.com/economia/inversion-us-130-millones-avanza-construccion-departamentos-exclusivos-ciudad_0_muydpdjzY.html,https://images.clarin.com/2021/07/20/6J6NGv3eK_720x0__1.jpg
23,2x7qyI2s-,"Sospechas con el VAR. ""Están pasando cosas muy raras"": la bronca y las suspicacias de Riquelme",https://www.clarin.com/deportes/juan-roman-riquelme-opino-escandalosa-eliminacion-boca-ganamos-partidos-cobran-goles-_0_2x7qyI2s-.html,https://images.clarin.com/2021/04/04/ykshMFWdF_720x0__1.jpg
24,HX9wE7L7B,Bronca contenida. Pergolini explotó contra la dirigencia de Boca tras el gol anulado,https://www.clarin.com/deportes/mario-pergolini-exploto-dirigencia-boca-gol-anulado-var-mineiro_0_HX9wE7L7B.html,https://images.clarin.com/2021/07/20/a8U0XzHim_720x0__1.jpg
25,vzoGopiOh,Incidentes. Salud evalúa si Boca rompió la burbuja sanitaria: qué puede pasar,https://www.clarin.com/deportes/ministerio-salud-va-evaluar-boca-rompio-burbuja-incidentes-belo-horizonte_0_vzoGopiOh.html,https://images.clarin.com/2021/07/21/oWYA4fYzw_720x0__1.jpg
26,5inFQyvgx,"Tokio 2020. Día por día, el calendario de todas disciplinas",https://www.clarin.com/deportes/agenda-completa-juegos-olimpicos-tokio-2020-dia-dia-calendario-todas-disciplinas_0_5inFQyvgx.html,https://images.clarin.com/2021/07/19/1ULuMAezG_720x0__1.jpg
27,-PJDho3YG,"España, el candidato. Juegos de Tokio: ¿Quiénes son las figuras en el torneo de fútbol?",https://www.clarin.com/deportes/juegos-olimpicos-tokio-2020-figuras-torneo-futbol-_0_-PJDho3YG.html,https://images.clarin.com/2021/07/20/-kAh1RKbe_720x0__1.jpg
28,mDvMdiUBp,Única candidata. La ciudad australiana de Brisbane será la sede de los Juegos Olímpicos de 2032,https://www.clarin.com/deportes/ciudad-australiana-brisbane-sede-juegos-olimpicos-2032_0_mDvMdiUBp.html,https://images.clarin.com/2021/07/21/4FpSIHz3A_720x0__1.jpg
29,TsEVB773P,Copa Libertadores. Cómo le fue al River de Gallardo cuando llegó con desventaja a una revancha copera,https://www.clarin.com/deportes/river-gallardo-llego-desventaja-revancha-copera_0_TsEVB773P.html,https://images.clarin.com/2021/07/20/yV3DpQ4Sl_720x0__1.jpg
30,wtsX_U4oX,En modo MVP. Antetokounmpo llevó a Milwaukee Bucks al título de la NBA tras 50 años,https://www.clarin.com/deportes/giannis-antetokounmpo-modo-mvp-llevo-milwaukee-bucks-titulo-nba-50-anos_0_wtsX_U4oX.html,https://images.clarin.com/2021/07/21/PRWA6JY6S_720x0__1.jpg
31,C9acAmJvY,Justicia y política. La trama K para designar una jueza afín en el tribunal que define la causa Correo,https://www.clarin.com/politica/trama-k-designar-jueza-afin-tribunal-define-causa-correo-argentino_0_C9acAmJvY.html,https://images.clarin.com/2021/02/17/ZbSbcK0Ss_720x0__1.jpg
32,v07S6YXRM,Dos ejemplares. Hallaron en Misiones una especie de hurón que no se registraba desde 1989,https://www.clarin.com/sociedad/hallaron-misiones-especie-huron-registraba-1989_0_v07S6YXRM.html,https://images.clarin.com/2021/07/21/Y2CDRsmM5_720x0__1.jpg
33,zR9DMeYmh,Crecieron 21%. Exportaciones de carne: Uruguay aprovecha la plaza que dejó Argentina,https://www.clarin.com/rural/uruguay-aprovecha-plaza-deja-vacante-argentina_0_zR9DMeYmh.html,https://images.clarin.com/2021/03/31/j-ukdDTLp_720x0__1.jpg
34,xMWRxRlbG,"Consumo y ahorro. Vacaciones: banco por banco, qué descuentos y promos ofrecen",https://www.clarin.com/economia/vacaciones-invierno-2021-banco-banco-promociones-ofrecen_0_xMWRxRlbG.html,https://images.clarin.com/2021/07/02/S6b2l945X_720x0__1.jpg
35,WxLlN5pUs,"Coronavirus. Francia: cuarta ola, medidas más duras y denuncias de ""dictadura sanitaria""",https://www.clarin.com/mundo/francia-entra-cuarta-ola-coronavirus-estrena-pasaporte-sanitario-endurece-medidas_0_WxLlN5pUs.html,https://images.clarin.com/2021/07/21/_LSunfKEQ_720x0__1.jpg
36,bHTGUKPkl,"Movilidad. La bici está de moda y hay ""congestiones"": las ciclovías que más se usan",https://www.clarin.com/ciudades/bici-moda-congestion-hora-pico-ciclovias-usan_0_bHTGUKPkl.html,https://images.clarin.com/2021/07/17/ZEaMoJThy_720x0__1.jpg
37,8coSxuOQp,Testimonio. La médica que tuiteó el lado más terrible de la guerra contra la pandemia,https://www.clarin.com/viva/medica-tuiteo-lado-terrible-guerra-pandemia_0_8coSxuOQp.html,https://images.clarin.com/2021/07/20/AhepXTZj7_720x0__1.jpg
38,WNMGsKhEe,Jubilados. La exención y devolución de Ganancias arranca recién en agosto,https://www.clarin.com/economia/jubilados-exencion-devolucion-ganancias-arranca-recien-agosto_0_WNMGsKhEe.html,https://images.clarin.com/2021/05/18/UG3aScAm__720x0__1.jpg
39,cWxZKUv4T,En Provincia. Tras las huellas de Francisco Salamone: guía para conocer sus mejores obras,https://www.clarin.com/viajes/recorrido-provincia-buenos-aires-traves-obra-arquitecto-francisco-salamone_0_cWxZKUv4T.html,https://images.clarin.com/2021/07/09/vbz4BnkGd_720x0__1.jpg
40,alaSPpRRJ,"Bodegones porteños. Dónde pedir Revuelto Gramajo, Suprema Maryland y otros clásicos",https://www.clarin.com/gourmet/mejores-platos-bodegones-portenos-pedir-revuelto-gramajo-suprema-maryland-clasicos_0_alaSPpRRJ.html,https://images.clarin.com/2021/07/09/AiHZftlsr_720x0__1.jpg
41,7Y3Yuo8bI,En Dubái. Baños de hielo y control de la respiración para combatir el calor y el estrés,https://www.clarin.com/viajes/banos-hielo-control-respiracion-experiencias-combatir-calor-estres-dubai_0_7Y3Yuo8bI.html,https://images.clarin.com/2021/07/21/0I6jiOL8G_720x0__1.jpg
42,2KJgOhN7w,Crononutrición. Cuál es el mejor momento del día para consumir proteínas,https://www.clarin.com/buena-vida/crononutricion-mejor-momento-dia-consumir-proteinas_0_2KJgOhN7w.html,https://images.clarin.com/2020/11/11/sw9xuETE4_720x0__1.jpg
43,CaCG8LjJn,Alimentación. De los copos al cous cous: cómo sumar cereales más allá del desayuno,https://www.clarin.com/buena-vida/copos-cous-cous-incorporar-cereales-alla-desayuno_0_CaCG8LjJn.html,https://images.clarin.com/2021/07/20/BM6OtDzjm_720x0__1.jpg
44,GW8GjiVxu,Mascotas. Día Mundial del Perro: qué hay que saber antes de llevar un cachorro a casa,https://www.clarin.com/familias/dia-mundial-perro-saber-llevar-cachorro-casa_0_GW8GjiVxu.html,https://images.clarin.com/2021/07/20/u0o_FEiJQ_720x0__1.jpg
45,2zs5qnG1n,"Internet. La berenjena y el durazno, los emojis más incomprendidos en todo el mundo",https://www.clarin.com/tecnologia/berenjena-durazno-emojis-incomprendidos-mundo_0_2zs5qnG1n.html,https://images.clarin.com/2019/11/02/SdWeXGA8_720x0__1.jpg
46,pogug9iLq,Astrología. De Cáncer a Leo: claves para lo que queda del invierno,https://www.clarin.com/astrologia/cancer-leo-claves-astrologicas-queda-invierno_0_pogug9iLq.html,https://images.clarin.com/2021/07/20/BwxXDZ4pY_720x0__1.jpg
47,aE6xJESYD,Nuevos estudios. Lo que no sabés sobre las alergias a los alimentos,https://www.clarin.com/new-york-times-international-weekly/sabes-alergias-alimentos_0_aE6xJESYD.html,https://images.clarin.com/2021/07/21/H1UgIgS-1_1256x620__2.jpg#1626875009470
48,ZD5VrwTqr,"Crímenes. La casa del horror de Gloucester: incesto y muerte, la siniestra historia de Fred y Rose West",https://www.clarin.com/internacional/casa-horror-gloucester-incesto-sexo-muerte-siniestra-historia-fred-rose-west_0_ZD5VrwTqr.html,https://images.clarin.com/2021/05/18/2TNLfHnAW_720x0__1.jpg
49,Cuo51OYwG,China. Arranca el primer tren del mundo que corre a 600 kilómetros por hora,https://www.clarin.com/viste/empieza-funcionar-primer-tren-mundo-corre-600-kilometros-hora_0_Cuo51OYwG.html,https://images.clarin.com/2021/07/20/rG2b4snl6_720x0__1.jpg
50,seCItbeUz,"Insólito. Lo liberan después de estar 21 años preso por asesinato: su ""víctima"" está viva",https://www.clarin.com/viste/liberan-despues-21-anos-preso-asesinato-victima-viva_0_seCItbeUz.html,https://images.clarin.com/2019/02/24/gDwFx4_Xs_720x0__1.jpg
51,1k5fH8dRN,"Alemania. Varios salmones se ""volvieron locos"" tras intoxicarse con cocaína",https://www.clarin.com/viste/varios-salmones-volvieron-locos-intoxicarse-cocaina_0_1k5fH8dRN.html,https://images.clarin.com/2021/07/19/WkJZ-v5HQ_720x0__1.jpg
52,L7qSGzuZv,Furor en TikTok. De cantar en la calle a ganar 1.400 dólares por hora y un contrato discográfico,https://www.clarin.com/internacional/cantar-calle-ganar-1-400-dolares-hora-contrato-discografico_0_L7qSGzuZv.html,https://images.clarin.com/2021/07/18/p-8EFfoy0_720x0__1.jpg
53,XGVAmzsy_,"Presentó el DNI no binario. Alberto Fernández: ""El ideal va a ser cuando todos y todas seamos todes""",https://www.clarin.com/politica/alberto-fernandez-presentacion-dni-binario-ideal-va-todas-todes-_0_XGVAmzsy_.html,https://images.clarin.com/2021/07/21/FGGw3xLIL_720x0__1.jpg
54,xTZlsGC8E,La pelea en CABA. Nueva encuesta electoral de una de las consultoras que mide para el Gobierno,https://www.clarin.com/politica/nueva-encuesta-electoral-consultoras-mide-gobierno_0_xTZlsGC8E.html,https://images.clarin.com/2021/05/01/gBleWwOX8_720x0__1.jpg
55,lMMc0iNMW,Frente de Todos. Victoria Tolosa Paz encabezaría la lista oficial en Provincia y la secundaría Gollan,https://www.clarin.com/politica/victoria-tolosa-paz-encabezaria-lista-diputados-nacionales-secundaria-daniel-gollan_0_lMMc0iNMW.html,https://images.clarin.com/2019/12/21/FVg5uIX-_1256x620__2.jpg#1626881340738
56,DuvUs4gCZ,Videojuegos. El histórico PES cambia de nombre y será gratuito en todas las plataformas,https://www.clarin.com/tecnologia/historico-pes-pasa-llamarse-efootball-convierte-videojuego-digital-gratuito_0_DuvUs4gCZ.html,https://images.clarin.com/2021/07/21/NbtJ_XkRX_720x0__1.jpg
57,wmAswZ7Du,"Pandemia y crisis económica. Cerca de 1,7 millones de argentinos se cayeron de la clase media en 2020",https://www.clarin.com/economia/pandemia-crisis-economica-banco-mundial-1-7-millones-argentinos-cayeron-clase-media-2020_0_wmAswZ7Du.html,https://images.clarin.com/2021/07/20/MMi1uh4Vl_720x0__1.jpg
58,G1LoH9dAK,A la vista de turistas. Sorpresa en el Sur: un puma apareció en la cima de un glaciar del Lago Argentino,https://www.clarin.com/sociedad/sorpresa-sur-puma-aparecio-cima-glaciar-lago-argentino_0_G1LoH9dAK.html,https://images.clarin.com/2021/07/21/R0xd_gl-v_720x0__1.jpg
59,5aJQGf1nR,En plena audiencia. Crimen del contador: un detenido dijo que tenía Covid y provocó una situación insólita,https://www.clarin.com/policiales/crimen-contador-parana-sospechosos-misma-familia-fiscal-va-pedir-prisiones-preventivas_0_5aJQGf1nR.html,https://images.clarin.com/2021/07/19/jhNyj3DLC_1256x620__3.jpg#1626870352501
60,WlpB2HC3p,Insólita situación. Video: encontró a su mujer y su mejor amigo entrando a un hotel,https://www.clarin.com/sociedad/video-encontro-mujer-mejor-amigo-entrando-hotel_0_WlpB2HC3p.html,https://images.clarin.com/2021/07/20/Qx-KODnJt_720x0__1.jpg
61,ibvJXCKe_,"Veinte preguntas a José Luis Clerc. La política, su rivalidad con Vilas y el mundo de la raqueta: ""En el tenis hay mucha envidia""",https://www.clarin.com/viva/jose-luis-clerc-tenis-mucha-envidia-_0_ibvJXCKe_.html,https://images.clarin.com/2018/05/01/Hyl8nuwTf_1256x620__3.jpg#1626865222109
62,3DeHC8Jp8,Debate. Penes de madera: ¿qué pasó con la ESI en pandemia?,https://www.clarin.com/sociedad/debate-penes-madera-pandemia-profundizo-fallas-educacion-sexual-integral-_0_3DeHC8Jp8.html,https://images.clarin.com/2021/07/18/iGN9QA312_720x0__1.jpg
63,G_MhTZEah,Diversidad. Qué significa ser graysexual,https://www.clarin.com/relaciones/-que-significa-ser-graysexual-_0_G_MhTZEah.html,https://images.clarin.com/2021/07/15/DbhCKihm4_720x0__1.jpg
64,XhDAZgt77,"España. El pueblo donde ""todos"" se llaman Japón por la aventura de un samurái",https://www.clarin.com/mundo/coria-rio-pueblo-espana-llaman-japon-aventura-samurai_0_XhDAZgt77.html,https://images.clarin.com/2021/07/20/-vl0klWbT_720x0__1.jpg
65,J45mjhAuI,Burocracia judicial. El insólito pedido a la madre de un joven atropellado por un médico borracho,https://www.clarin.com/sociedad/insolito-pedido-madre-joven-murio-atropellado-medico-borracho_0_J45mjhAuI.html,https://images.clarin.com/2021/07/20/BUE0Cpecr_1256x620__2.jpg#1626813843223
66,-7yYCdtur,"Destrucción. Este es el primer insecto extinguido por la mano del hombre, hace 93 años",https://www.clarin.com/viste/primer-insecto-extinguido-mano-hombre-hace-93-anos-ee-uu-_0_-7yYCdtur.html,https://images.clarin.com/2021/07/21/QLNuVtxER_720x0__1.jpg
67,wdKtxyggk,Puro descuido. De millonarias a abandonadas: las sedes fantasma de los Juegos Olímpicos del pasado,https://www.clarin.com/internacional/deportes/costaron-millones-terminaron-abandonadas-sedes-fantasma-juegos-olimpicos-pasado_0_wdKtxyggk.html,https://images.clarin.com/2021/07/20/dlK9ggaJ1_720x0__1.jpg
68,P-fS-jNWC,"""Post it"" online. A qué se dedica Mural, la startup que es el nuevo unicornio argentino",https://www.clarin.com/tecnologia/dedica-mural-startup-convirtio-nuevo-unicornio-argentino_0_P-fS-jNWC.html,https://images.clarin.com/2021/07/21/tLkKPL2fU_720x0__1.jpg
69,g6Ip1rOt4,Finanzas. Manual de supervivencia para pymes: 5 claves para sobrevivir a la crisis,https://www.clarin.com/servicios/manual-supervivencia-pymes-5-claves-sobrevivir-crisis-reinventarse_0_g6Ip1rOt4.html,https://images.clarin.com/2021/06/11/RK31pBSM2_720x0__1.jpg
70,ibvJXCKe_,"Veinte preguntas a José Luis Clerc. La política, su rivalidad con Vilas y el mundo de la raqueta: ""En el tenis hay mucha envidia""",https://www.clarin.com/viva/jose-luis-clerc-tenis-mucha-envidia-_0_ibvJXCKe_.html,https://images.clarin.com/2018/05/01/Hyl8nuwTf_1256x620__3.jpg#1626865222109
71,3DeHC8Jp8,Debate. Penes de madera: ¿qué pasó con la ESI en pandemia?,https://www.clarin.com/sociedad/debate-penes-madera-pandemia-profundizo-fallas-educacion-sexual-integral-_0_3DeHC8Jp8.html,https://images.clarin.com/2021/07/18/iGN9QA312_720x0__1.jpg
72,G_MhTZEah,Diversidad. Qué significa ser graysexual,https://www.clarin.com/relaciones/-que-significa-ser-graysexual-_0_G_MhTZEah.html,https://images.clarin.com/2021/07/15/DbhCKihm4_720x0__1.jpg
73,XhDAZgt77,"España. El pueblo donde ""todos"" se llaman Japón por la aventura de un samurái",https://www.clarin.com/mundo/coria-rio-pueblo-espana-llaman-japon-aventura-samurai_0_XhDAZgt77.html,https://images.clarin.com/2021/07/20/-vl0klWbT_720x0__1.jpg
74,J45mjhAuI,Burocracia judicial. El insólito pedido a la madre de un joven atropellado por un médico borracho,https://www.clarin.com/sociedad/insolito-pedido-madre-joven-murio-atropellado-medico-borracho_0_J45mjhAuI.html,https://images.clarin.com/2021/07/20/BUE0Cpecr_1256x620__2.jpg#1626813843223
75,-7yYCdtur,"Destrucción. Este es el primer insecto extinguido por la mano del hombre, hace 93 años",https://www.clarin.com/viste/primer-insecto-extinguido-mano-hombre-hace-93-anos-ee-uu-_0_-7yYCdtur.html,https://images.clarin.com/2021/07/21/QLNuVtxER_720x0__1.jpg
76,wdKtxyggk,Puro descuido. De millonarias a abandonadas: las sedes fantasma de los Juegos Olímpicos del pasado,https://www.clarin.com/internacional/deportes/costaron-millones-terminaron-abandonadas-sedes-fantasma-juegos-olimpicos-pasado_0_wdKtxyggk.html,https://images.clarin.com/2021/07/20/dlK9ggaJ1_720x0__1.jpg
77,P-fS-jNWC,"""Post it"" online. A qué se dedica Mural, la startup que es el nuevo unicornio argentino",https://www.clarin.com/tecnologia/dedica-mural-startup-convirtio-nuevo-unicornio-argentino_0_P-fS-jNWC.html,https://images.clarin.com/2021/07/21/tLkKPL2fU_720x0__1.jpg
78,g6Ip1rOt4,Finanzas. Manual de supervivencia para pymes: 5 claves para sobrevivir a la crisis,https://www.clarin.com/servicios/manual-supervivencia-pymes-5-claves-sobrevivir-crisis-reinventarse_0_g6Ip1rOt4.html,https://images.clarin.com/2021/06/11/RK31pBSM2_720x0__1.jpg
