n,id,title,url,image
1,xNwrVlS6L,Visitas a Olivos en cuarentena. Una nueva foto dentro de la Quinta suma más polémica y la orden oficial es esquivar el tema,https://www.clarin.com/politica/visitas-olivos-foto-dentro-quinta-reavivo-polemica-orden-oficial-esquivar-tema_0_xNwrVlS6L.html,https://images.clarin.com/2021/08/12/SEIwwNc9u_720x0__1.jpg
2,J1ceCJxY3,En plena etapa de aislamiento. Quién es quién en la polémica foto del cumpleaños de la Primera Dama en Olivos,https://www.clarin.com/politica/foto-olivos-imagen-viral-fiesta-cumpleanos-primera-dama-cuarentena_0_J1ceCJxY3.html,https://images.clarin.com/2021/08/12/ZCO42FJSU_720x0__1.jpg
3,2gQlO3in-,14 de julio de 2020. Cuáles eran las restricciones estrictas que regían el día de la foto en la Quinta,https://www.clarin.com/politica/aislamiento-obligatorio-comercios-cerrados-permiso-circular-pasaba-pais-14-julio-2020_0_2gQlO3in-.html,https://images.clarin.com/2021/02/28/QdRhWsRuA_1256x620__2.jpg#1628807103898
4,J3J4ZXL9r,"En la oposición. Evalúan si Alberto Fernández es ""pasible de juicio político"" por violar la cuarentena",https://www.clarin.com/politica/oposicion-evalua-alberto-fernandez-pasible-juicio-politico-violar-cuarentena_0_J3J4ZXL9r.html,https://images.clarin.com/2021/08/12/UWD3LBumb_720x0__1.jpg
5,P3pzx0X7t,Sarcopenia. Otro efecto secundario que puede aparecer a seis meses del contagio de Covid,https://www.clarin.com/sociedad/covid-sarcopenia-efecto-secundario-puede-aparecer-meses-despues-contagio_0_P3pzx0X7t.html,https://images.clarin.com/2021/04/24/DjL7XL8xG_720x0__1.jpg
6,1aSgYO9lG,"Desde Lomas de Zamora. Cristina se sumó a las críticas de La Cámpora al PJ y dijo que hubo ""ingenuidad política"" de Alberto Fernández",https://www.clarin.com/politica/campana-cristina-kirchner-lanza-nueva-version-polemico-plan-qunita_0_1aSgYO9lG.html,https://images.clarin.com/2021/08/12/1a6-OS0yC_1256x620__2.jpg#1628799022103
7,Q_FeljsLx,Tenía mandato hasta 2023. Sorpresiva renuncia de Facundo Moyano a su banca en la Cámara de Diputados,https://www.clarin.com/politica/sorpresiva-renuncia-facundo-moyano-banca-diputado_0_Q_FeljsLx.html,https://images.clarin.com/2019/12/14/NneNGKtD_720x0__1.jpg
8,HxTxSe5eB,Datos oficiales. La inflación de julio fue de 3% y en siete meses se superó la meta oficial para todo el año,https://www.clarin.com/economia/inflacion-julio-3-acumula-29-1-va-ano_0_HxTxSe5eB.html,https://images.clarin.com/2021/08/12/KEEDVQNyB_720x0__1.jpg
9,iZB1UHEOY,Los Messi en París. El exclusivo ambiente de glamour y amistad al que llegan Leo y Antonela,https://www.clarin.com/deportes/messi-paris-exclusivo-ambiente-glamour-amistad-rodea-psg-llegan-leo-antonela_0_iZB1UHEOY.html,https://images.clarin.com/2021/08/10/JoEZruuJi_1256x620__2.jpg#1628729527069
10,GVrdPVBku,"Nueva figura en el PSG. Abrazos con Icardi y Ramos, y trabajos con pelota: así fue la primera práctica de Messi",https://www.clarin.com/deportes/primer-entrenamiento-messi-psg-abrazos-reencuentros-gym-trabajos-pelota_0_GVrdPVBku.html,https://images.clarin.com/2021/08/12/j3BHtHiTx_720x0__1.jpg
11,xjP7LiM8A,"Dejó Barcelona. Dónde está Hulk, el enorme y exclusivo perro de Lionel Messi",https://www.clarin.com/familias/hulk-perro-messi-raza-precio-dogo-burdeos_0_xjP7LiM8A.html,https://images.clarin.com/2021/08/12/gZ7YA_ZE1_720x0__1.jpg
12,reHbDwrxy,Bienvenida. El tímido y generoso ofrecimiento de un juvenil de 17 años del PSG para Messi,https://www.clarin.com/deportes/timido-generoso-ofrecimiento-juvenil-17-anos-psg-messi_0_reHbDwrxy.html,https://images.clarin.com/2021/08/12/FPGs3jVTn_720x0__1.jpg
13,KaBNRaB4w,"Triple crimen narco en Varela. Milagros, la víctima inocente de un infierno de 130 disparos que conmovió a todo un barrio",https://www.clarin.com/policiales/triple-crimen-narco-varela-milagros-victima-inocente-infierno-130-disparos-conmovio-barrio_0_KaBNRaB4w.html,https://images.clarin.com/2021/08/12/YtZr_0FoO_1256x620__2.jpg#1628792733977
14,HXBu4K0VJ,Sorpresivamente. El padre de Britney Spears aceptó renunciar a la tutela de su hija después de 13 años,https://www.clarin.com/espectaculos/musica/padre-britney-spears-jamie-spears-acepto-renunciar-tutela-hija_0_HXBu4K0VJ.html,https://images.clarin.com/2021/07/15/A-pHS5FUI_720x0__1.jpg
15,w3OzcLhdL,Tras la salida de la OTAN. Afganistán: las capitales provinciales caen una tras otra por el avance talibán,https://www.clarin.com/mundo/caos-afganistan-capitales-provinciales-caen-avance-taliban_0_w3OzcLhdL.html,https://images.clarin.com/2021/08/12/sHWssXBhf_1200x0__2.jpg#1628789717780
16,KzpaB1lw3,Adelanto de Clarín. A un mes de las PASO: qué dicen las últimas encuestas en los cinco distritos clave,https://www.clarin.com/politica/mes-paso-2021-dicen-ultimas-encuestas-distritos-clave_0_KzpaB1lw3.html,https://images.clarin.com/2018/04/02/r1AWG4liM_720x0__1.jpg
17,B0R_VFQuB,Sospechas de corrupción. Procesan por lavado a un cómplice clave de Lázaro Báez en la Ruta del Dinero K,https://www.clarin.com/politica/procesaron-lavado-complice-clave-lazaro-baez-ruta-dinero-k_0_B0R_VFQuB.html,https://images.clarin.com/2016/04/23/SysDMgJNg_720x0.jpg
18,3bqZpY-6k,Salvar los billetes. Dólares y pesos deteriorados: en qué casos se pueden cambiar y cómo hacerlo gratis,https://www.clarin.com/servicios/dolares-pesos-deteriorados-casos-pueden-cambiar-hacerlo-gratis_0_3bqZpY-6k.html,https://images.clarin.com/2021/08/11/Ij9Ow0TbB_720x0__1.jpg
19,0Ai7lnbWR,El crac de 2019. El día que ocurrió la mayor pérdida de valor en la economía argentina,https://www.clarin.com/economia/dia-ocurrio-mayor-perdida-valor-economia-argentina_0_0Ai7lnbWR.html,https://images.clarin.com/2021/08/12/JrXh6znhU_720x0__1.jpg
20,VhECYCdjg,En Chubut. Apareció una ballena muerta y los vecinos se metieron en su interior para hacer selfies,https://www.clarin.com/sociedad/chubut-aparecio-ballena-muerta-playa-vecinos-metieron-interior-hacer-selfies_0_VhECYCdjg.html,https://images.clarin.com/2021/08/12/dyi1HV6Fb_1256x620__2.jpg#1628793142356
21,PDm-q6oXE,Piquete. Una protesta de vecinos sin luz provoca un caos de tránsito en la Panamericana,https://www.clarin.com/sociedad/protesta-vecinos-luz-provoca-caos-transito-panamericana_0_PDm-q6oXE.html,https://images.clarin.com/2021/08/12/yTAVyg9Dn_1256x620__2.jpg#1628804909169
22,3Jn7UhAFi,Elecciones 2021. Tolosa Paz y López Murphy se cruzaron en radio por la propuesta de subir impuestos,https://www.clarin.com/politica/tolosa-paz-lopez-murphy-cruzaron-radio-propuesta-subir-impuestos_0_3Jn7UhAFi.html,https://images.clarin.com/2021/08/11/HZ1iJpPqV_720x0__1.jpg
23,nQCmuq33p,"Santa Fe. Tragedia en la ruta: iban a un velorio, chocaron de frente contra un camión y murieron",https://www.clarin.com/sociedad/tragedia-ruta-iban-velorio-chocaron-frente-camion-murieron_0_nQCmuq33p.html,https://images.clarin.com/2021/08/12/eJQGRiA2L_720x0__1.jpg
24,SvPgcy4ti,Viajó a Colombia . Cómo es el compromiso que firmó Sebastián Villa y que en Boca creen que no cumplirá,https://www.clarin.com/deportes/futbol/boca-juniors/compromiso-firmo-sebastian-villa-boca-creen-cumplira_0_SvPgcy4ti.html,https://images.clarin.com/2021/08/12/rRmGwsQxO_720x0__1.jpg
25,eqRYKbY4J,"Clásico del cine. La tenebrosa historia real que inspiró a la película ""Sexto sentido""",https://www.clarin.com/internacional/tenebrosa-historia-real-inspiro-sexto-sentido-pelicula-night-shyamalan_0_eqRYKbY4J.html,https://images.clarin.com/2019/08/09/MretULqX-_1256x620__2.jpg#1628714489112
26,,Historias visuales. Fotogalería con las 100 grandes imágenes del día,,
27,6I_6dPI7S,"Goleada pincha. Estudiantes abrió el partido con un ""favor"" del arquero y liquidó a Arsenal en 14 minutos",https://www.clarin.com/deportes/estudiantes-vs-arsenal-liga-profesional-futbol-minuto-minuto-directo_0_6I_6dPI7S.html,https://images.clarin.com/2021/08/02/5qiUepmC2_720x0__1.jpg
28,-nRfoHRoF,En deuda con el gol. A Boca le cuesta convertir y la pregunta es cómo hará para lastimar a River en el Súper,https://www.clarin.com/deportes/boca-cuesta-enormidad-convertir-pregunta-hara-lastimar-river-superclasico_0_-nRfoHRoF.html,https://images.clarin.com/2021/07/09/VSLRr4BGz_720x0__1.jpg
29,GTzxj6nrZ,"De climas astrológicos. Cómo se hace un horóscopo semanal: desafíos para ""leer"" el cielo",https://www.clarin.com/astrologia/hace-horoscopo-semanal-desafios-leer-cielo_0_GTzxj6nrZ.html,https://images.clarin.com/2021/08/02/6HL17cR6C_720x0__1.jpg
30,Y_02kn9ZM,Movilidad. Jubilados: de cuánto sería el aumento que se dará en septiembre,https://www.clarin.com/economia/jubilados-aumento-dara-septiembre_0_Y_02kn9ZM.html,https://images.clarin.com/2021/05/14/xjJFCv9Ai_720x0__1.jpg
31,NoaXlhzXT,Debacle económica. Venezuela eliminará seis ceros de su moneda e implementa el bolívar digital,https://www.clarin.com/mundo/venezuela-eliminara-ceros-moneda-anuncio-implementacion-bolivar-digital_0_NoaXlhzXT.html,https://images.clarin.com/2021/08/04/s5XQzr_OS_1256x620__3.jpg#1628170987756
32,isiPRB0Hv,Se va a España. Julio Buffarini ya tiene club: jugará en el Huesca,https://www.clarin.com/deportes/julio-buffarini-club-jugara-huesca-espana_0_isiPRB0Hv.html,https://images.clarin.com/2021/08/05/33LnbSATY_720x0__1.jpg
33,ABrK78Gqe,"Igualdad de género. ""No me callo más"": mujeres que rompen mandatos e inspiran",https://www.clarin.com/brandstudio/-callo-mujeres-rompen-mandatos-inspiran_0_ABrK78Gqe.html,https://images.clarin.com/2021/05/03/squ5fgS4L_1256x620__2.jpg#1620066080799
34,nkt__X8Cv,"Cepo a los vuelos. Varados: evalúan un ""aumento progresivo y escalonado"" del cupo de ingreso al país",https://www.clarin.com/politica/varados-gobierno-evalua-aumento-progresivo-escalonado-cupo_0_nkt__X8Cv.html,https://images.clarin.com/2021/06/28/9hLDfDCVw_720x0__1.jpg
35,5_nxsK8Cs,"Luz verde. Tras 14 años de lucha en la Legislatura, San Lorenzo podrá volver a Boedo",https://www.clarin.com/deportes/san-lorenzo-logro-vencer-obstaculos-14-anos-lucha-legislatura-podra-tener-vez-estadio-boedo_0_5_nxsK8Cs.html,https://images.clarin.com/2021/08/05/iim7LjkSQ_720x0__1.jpg
36,XSyCYu3_N,"Fútbol y streetstyle, unidos. Neymar y Wild Rider, las zapatillas de PUMA que elige para la ciudad",https://www.clarin.com/brandstudio/neymar-wild-rider-zapatillas-puma-elige-ciudad_0_XSyCYu3_N.html,https://images.clarin.com/2021/08/04/ShaKRhLgQ_1256x620__2.jpg#1628084625745
37,xVUGYj6En,Sin mandatos. Madres y padres: cuando lo ideal choca con lo real,https://www.clarin.com/brandstudio/madres-padres-ideal-choca-real_0_xVUGYj6En.html,https://images.clarin.com/2021/08/01/CR7XYAmDm_720x0__1.jpg
38,aZVtm3frI,De la Patagonia al Norte. Conocé las maravillas de Argentina desde el living de tu casa,https://www.clarin.com/brandstudio/conoce-maravillas-argentina-living-casa_0_aZVtm3frI.html,https://images.clarin.com/2021/08/05/s6In6Azcl_720x0__1.jpg
39,f3sy6ToG4,Gran DT. Ya podés armar tu equipo: hay $150.000 para el ganador de cada fecha,https://www.clarin.com/sociedad/tragedia-rugby-adolescente-15-anos-murio-primera-practica_0_f3sy6ToG4.html,https://images.clarin.com/2021/08/05/S2sk1TP1mI_720x0__1.jpg
40,r5tSn2nyl,Amor superclásico. La tierna carta de Marcos Rojo a su mamá cuando era chico,https://www.clarin.com/deportes/tierna-carta-marcos-rojo-mama-chico-quiero-gallina-amarga-_0_r5tSn2nyl.html,https://images.clarin.com/2021/08/06/3AoNcovoF_720x0__1.jpg
41,4PqsMdEyY,"Inversiones rentables . Green Life Realty, una inmobiliaria para invertir en Miami",https://www.clarin.com/mercado-inmobiliario/green-life-realty-inmobiliaria-invertir-miami_0_4PqsMdEyY.html,https://images.clarin.com/2021/06/08/9Vn3oz_3D_720x0__1.jpg
42,g9T4_4hdg,"Diseño contemporáneo. ATRIUM, una innovadora experiencia que te da la bienvenida a tu nueva vida",https://www.clarin.com/mercado-inmobiliario/atrium-innovadora-experiencia-da-bienvenida-nueva-vida_0_g9T4_4hdg.html,https://images.clarin.com/2021/06/15/IY-bQLxr6_720x0__1.jpg
43,s33Tg7-oq,En el corazón de Barracas. Excelente inversión con la mejor calidad e increíbles precios,https://www.clarin.com/mercado-inmobiliario/excelente-inversion-mejor-calidad-increibles-precios_0_s33Tg7-oq.html,https://images.clarin.com/2021/06/17/Pj1czJo9a_720x0__1.jpg
44,3Eb4Y1C56,Un proyecto moderno. Alma Palermo: una oportunidad ideal de inversión,https://www.clarin.com/mercado-inmobiliario/alma-palermo-oportunidad-ideal-inversion_0_3Eb4Y1C56.html,https://images.clarin.com/2021/04/19/bxKckY2pj_720x0__1.jpg
45,jNBOtzrp7,Trama política. Políticos con lengua de madera: Alberto Fernández supera los límites,https://www.clarin.com/opinion/politicos-lengua-madera-alberto-fernandez-supera-limites_0_jNBOtzrp7.html,https://images.clarin.com/2021/07/17/fynre6r3x_720x0__1.jpg
46,s8YhnENf7,"Mal comportamiento. Alcohol, destrozos, burbuja rota y vómitos en un avión, los escándalos de los australianos",https://www.clarin.com/deportes/tokio-2020-alcohol-destrozos-ruptura-burbuja-vomitos-avion-escandalos-australianos_0_s8YhnENf7.html,https://images.clarin.com/2021/08/07/MA1Jp0NFT_720x0__1.jpg
47,n9HwNA0xv,Juan José Cáceres. El pibe de la Isla Maciel que jugó en todos los puestos y se ganó su lugar en Racing,https://www.clarin.com/deportes/juan-jose-caceres-pibe-isla-maciel-jugo-puestos-gano-lugar-racing_0_n9HwNA0xv.html,https://images.clarin.com/2021/07/27/ImbdVxuku_720x0__1.jpg
48,RQWgA6jIx,"En Wembley. Sin Agüero y lejos de Messi, el City de Guardiola perdió la Community Shield",https://www.clarin.com/deportes/aguero-lejos-messi-manchester-city-guardiola-perdio-community-shield_0_RQWgA6jIx.html,https://images.clarin.com/2021/08/07/7rkbQpxwM_720x0__1.jpg
49,eW8JAcXot,En conflicto con Boca. Sebastián Villa dejó el país y nadie sabe qué será de su futuro,https://www.clarin.com/deportes/villa-colombia-conflicto-boca_0_eW8JAcXot.html,https://images.clarin.com/2021/08/07/3qNuUU1WA_720x0__1.jpg
50,y40Ceg6UX,Liga de Francia. Pochettino volvió a hablar sobre Messi tras el triunfo de PSG ante Troyes,https://www.clarin.com/deportes/pochettino-psg-messi-troyes_0_y40Ceg6UX.html,https://images.clarin.com/2021/08/07/Q8hY8Me-Ew_720x0__1.jpg
51,hPwKYhR1s,2-1 en Mendoza. Godoy Cruz dio la sorpresa y le ganó bien a un River con suplentes pero desconocido,https://www.clarin.com/deportes/godoy-cruz-vs-river-liga-profesional-futbol-previa-alineaciones-minuto-minuto_0_hPwKYhR1s.html,https://images.clarin.com/2021/08/07/1OBF8vJSc_1256x620__3.jpg#1628385363645
52,X_V52ZVmQ,Más allá del diagnóstico. Cáncer y sexualidad femenina: 10 claves para recuperar la intimidad,https://www.clarin.com/relaciones/cancer-sexualidad-femenina-10-claves-recuperar-intimidad_0_X_V52ZVmQ.html,https://images.clarin.com/2021/07/28/fs214s1D4_720x0__1.jpg
53,a2kzSkHmf,Fertilización granos gruesos. Una estrategia de fertilización poco común pero muy efectiva,https://www.clarin.com/rural/estrategia-fertilizacion-comun-efectiva_0_a2kzSkHmf.html,https://images.clarin.com/2021/08/06/Kl5G0L1wQ_720x0__1.jpg
54,H2og8fB56,"La columna de la semana. La fertilización, una tarea pendiente en la Segunda Revolución de las Pampas",https://www.clarin.com/rural/fertilizacion-tarea-pendiente-segunda-revolucion-pampas_0_H2og8fB56.html,https://images.clarin.com/2021/01/28/tzOvwLnlS_720x0__1.jpg
55,FUh8YQAa0,Especial fertilización. Paso a paso para que a la soja no le falte ningún nutriente,https://www.clarin.com/rural/paso-paso-soja-falte-nutriente_0_FUh8YQAa0.html,https://images.clarin.com/2014/11/19/SybFKeRXx_720x0.jpg
56,XNBfvI_Fq,Análisis. Récord de las exportaciones agroalimentarias brasileñas en 2021,https://www.clarin.com/rural/nuevo-record-exportaciones-agroalimentarias-brasilenas-2021_0_XNBfvI_Fq.html,https://images.clarin.com/2020/11/18/nAbzHagzj_720x0__1.jpg
57,6x0Eb2R19,Alta expectativa. PSG se prepara para recibir a Messi y París por fin será una fiesta,https://www.clarin.com/deportes/paris-saint-germain-prepara-recibir-messi-fin-fiesta_0_6x0Eb2R19.html,https://images.clarin.com/2021/08/08/NDY5_j3BL_720x0__1.jpg
58,_hIcWlvZa,Historias visuales. El calendario Pirelli 2022 con la música como protagonista,https://www.clarin.com/cultura/primer-exportador-libros-castellano-industria-editorial-caida-libre-paso-50-anos_0__hIcWlvZa.html,https://images.clarin.com/2021/08/06/lpVc92-1D_1256x620__2.jpg#1628275450766
59,yAZM1sXZQ,El medallero de Tokio 2020. Estados Unidos le ganó a China y Brasil cerró una actuación histórica,https://www.clarin.com/deportes/tokio-2020-unidos-gano-medallero-china-brasil-cerro-actuacion-historica_0_yAZM1sXZQ.html,https://images.clarin.com/2021/08/08/p48u4KEo9_720x0__1.jpg
60,xfEsYtZV8,"Balance. Chau Tokio, hola París 2024: se terminaron los Juegos más desafiantes de la historia",https://www.clarin.com/deportes/chau-tokio-2020-hola-paris-2024-terminaron-juegos-olimpicos-desafiantes-historia_0_xfEsYtZV8.html,https://images.clarin.com/2021/08/08/-5mdf7HwA_720x0__1.jpg
61,zFPxECzD4,Invencible. Kipchoge ganó el maratón y Eulalio Muñoz hizo historia para la Argentina,https://www.clarin.com/deportes/keniata-eliud-kipchoge-gano-maraton-juegos-olimpicos-tokio-2020_0_zFPxECzD4.html,https://images.clarin.com/2021/08/07/G44h0lIpC_720x0__1.jpg
62,2khkoAVvh,"Estilo. La historia de Louis Vuitton, el hombre que se convirtió en marca de lujo",https://www.clarin.com/viva/verdadera-historia-louis-vuitton-hombre-convirtio-marca-lujo_0_2khkoAVvh.html,https://images.clarin.com/2021/08/03/BCaHAW2Gy_720x0__1.jpg
63,vhCmX-YIl,"Personaje. Diego Peretti: ""La grieta es un negocio que le da plata y poder a mucha gente""",https://www.clarin.com/viva/diego-peretti-grieta-negocio-da-plata-poder-mucha-gente-_0_vhCmX-YIl.html,https://images.clarin.com/2021/08/03/_LjtB0eqs_720x0__1.jpg
64,63YHJJmcV,Personaje. El vegano que abrió un santuario para salvar a los animales del matadero,https://www.clarin.com/viva/vegano-abrio-santuario-salvar-animales-matadero_0_63YHJJmcV.html,https://images.clarin.com/2021/08/04/vFu7AATtW_720x0__1.jpg
65,u1T-fJ12F,Consultorio. Por qué la serotonina es una sustancia clave para el bienestar,https://www.clarin.com/viva/serotonina-sustancia-clave-bienestar_0_u1T-fJ12F.html,https://images.clarin.com/2021/03/02/CCLloZBiv_720x0__1.jpg
66,x2YiiBTFz,Ciudad revolucionada. Cómo es el lujoso hotel de París en el que Messi se hospedará junto a su familia,https://www.clarin.com/deportes/messi-llego-paris-firmar-psg-lujoso-hotel-hospedara-junto-familia_0_x2YiiBTFz.html,https://images.clarin.com/2021/08/10/kkUjZP9MI_720x0__1.jpg
67,xNwrVlS6L,Visitas a Olivos en cuarentena. Una nueva foto dentro de la Quinta suma más polémica y la orden oficial es esquivar el tema,https://www.clarin.com/politica/visitas-olivos-foto-dentro-quinta-reavivo-polemica-orden-oficial-esquivar-tema_0_xNwrVlS6L.html,https://images.clarin.com/2021/08/12/SEIwwNc9u_720x0__1.jpg
68,J1ceCJxY3,En plena etapa de aislamiento. Quién es quién en la polémica foto del cumpleaños de la Primera Dama en Olivos,https://www.clarin.com/politica/foto-olivos-imagen-viral-fiesta-cumpleanos-primera-dama-cuarentena_0_J1ceCJxY3.html,https://images.clarin.com/2021/08/12/ZCO42FJSU_720x0__1.jpg
69,2gQlO3in-,14 de julio de 2020. Cuáles eran las restricciones estrictas que regían el día de la foto en la Quinta,https://www.clarin.com/politica/aislamiento-obligatorio-comercios-cerrados-permiso-circular-pasaba-pais-14-julio-2020_0_2gQlO3in-.html,https://images.clarin.com/2021/02/28/QdRhWsRuA_1256x620__2.jpg#1628807103898
70,J3J4ZXL9r,"En la oposición. Evalúan si Alberto Fernández es ""pasible de juicio político"" por violar la cuarentena",https://www.clarin.com/politica/oposicion-evalua-alberto-fernandez-pasible-juicio-politico-violar-cuarentena_0_J3J4ZXL9r.html,https://images.clarin.com/2021/08/12/UWD3LBumb_720x0__1.jpg
71,P3pzx0X7t,Sarcopenia. Otro efecto secundario que puede aparecer a seis meses del contagio de Covid,https://www.clarin.com/sociedad/covid-sarcopenia-efecto-secundario-puede-aparecer-meses-despues-contagio_0_P3pzx0X7t.html,https://images.clarin.com/2021/04/24/DjL7XL8xG_720x0__1.jpg
72,1aSgYO9lG,"Desde Lomas de Zamora. Cristina se sumó a las críticas de La Cámpora al PJ y dijo que hubo ""ingenuidad política"" de Alberto Fernández",https://www.clarin.com/politica/campana-cristina-kirchner-lanza-nueva-version-polemico-plan-qunita_0_1aSgYO9lG.html,https://images.clarin.com/2021/08/12/1a6-OS0yC_1256x620__2.jpg#1628799022103
73,Od6anw6le,Sin acuerdo con el FMI. Empezó la sangría: las reservas del Central cayeron más de US$ 1.000 millones en tres semanas,https://www.clarin.com/economia/empezo-sangria-reservas-central-cayeron-us-1-000-millones-semanas_0_Od6anw6le.html,https://images.clarin.com/2021/03/18/pWzCvP93r_720x0__1.jpg
74,A9FYbl9at,Seis meses de gracia y tasa 0. Créditos a monotributistas: cuáles son los requisitos y cómo acceder,https://www.clarin.com/economia/monotributistas-requisitos-condiciones-acceder-creditos-tasa-cero_0_A9FYbl9at.html,https://images.clarin.com/2021/08/12/iU_pdE0bP_720x0__1.jpg
75,FJKLIxQjK,Pronósticos privados. El Gobierno destinará el 1% del PBI a impulsar el consumo por las elecciones,https://www.clarin.com/economia/gobierno-destinara-1-pbi-impulsar-consumo-cara-elecciones_0_FJKLIxQjK.html,https://images.clarin.com/2021/04/21/SbGQrvjxf_720x0__1.jpg
76,WFZLLdYu6,Pase de manos. Adidas vende Reebok a la empresa que maneja Forever 21,https://www.clarin.com/economia/adidas-vende-reebok-empresa-maneja-forever-21_0_WFZLLdYu6.html,https://images.clarin.com/2021/08/12/gSn0ipoxa_720x0__1.jpg
77,H0D5jLLGH,Consumo. Día el niño: cuánto se gasta en cada regalo y qué se compra online,https://www.clarin.com/economia/dia-nino-2021-gasta-regalo-compra-online_0_H0D5jLLGH.html,https://images.clarin.com/2020/11/24/8rfjRuDIU_720x0__1.jpg
78,AyWMzWRZu,Marketing. Una empresa japonesa busca inversores para hacer negocios en la Luna,https://www.clarin.com/economia/marketing-espacial-empresa-japonesa-busca-inversores-hacer-negocios-luna_0_AyWMzWRZu.html,https://images.clarin.com/2021/08/10/evxRcA3q7_720x0__1.jpg
79,NS_W_lqTT,"Contenido Patrocinado. De la Patagonia al mundo: PCR, empresa líder en energía",https://www.clarin.com/brandstudio/patagonia-mundo-pcr-empresa-lider-energia_0_NS_W_lqTT.html,https://images.clarin.com/2021/07/27/8V673OzmU_720x0__1.jpg
80,JKberHjco,Fútbol para ciegos. El plan de los Murciélagos de cara a los Juegos Paralímpicos,https://www.clarin.com/brandstudio/plan-murcielagos-cara-juegos-paralimpicos_0_JKberHjco.html,https://images.clarin.com/2021/08/11/LNRdF0RId_720x0__1.jpg
81,F3JJjEw8r,Garantías de fianza. Una solución inteligente y realista para concretar alquileres,https://www.clarin.com/brandstudio/garantias-fianza-solucion-inteligente-realista-concretar-alquileres_0_F3JJjEw8r.html,https://images.clarin.com/2021/08/06/Dlm-TYUOb_1256x620__2.jpg#1628273919443
82,tym06X7Os,Profesionales. Desarrollo de Videojuegos: nueva carrera universitaria,https://www.clarin.com/brandstudio/desarrollo-videojuegos-nueva-carrera-universitaria_0_tym06X7Os.html,https://images.clarin.com/2021/06/08/Z5_BcDUI7_720x0__1.jpg
83,TPokrJofA,Fin de semana. 8 escapadas al campo para disfrutar el Día del Niño,https://www.clarin.com/viajes/8-escapadas-campo-disfrutar-dia-nino_0_TPokrJofA.html,https://images.clarin.com/2021/07/07/GzxpTy0-i_720x0__1.jpg
84,p3iwAippZ,Audi R8. Subastarán el patrullero más caro y lujoso que tuvo la Policía de la Ciudad,https://www.clarin.com/autos/audi-r8-subastaran-patrullero-caro-lujoso-policia-ciudad_0_p3iwAippZ.html,https://images.clarin.com/2021/08/12/xGrhilvxH_720x0__1.jpg
85,M2L29EEnS,Censura en internet. Cuáles son los países que más prohibiciones imponen y qué lugar ocupa Argentina,https://www.clarin.com/tecnologia/censura-internet-paises-prohibiciones-imponen-lugar-ocupa-argentina_0_M2L29EEnS.html,https://images.clarin.com/2021/04/29/awUR4Iblt_720x0__1.jpg
86,Qo8a9c3qM,Aplicaciones online. Cómo calcular tu riesgo de sufrir un infarto o ACV (y si tu corazón es más viejo que vos),https://www.clarin.com/buena-vida/calcular-riesgo-cardiovascular-edad-corazon-prevenir-problemas_0_Qo8a9c3qM.html,https://images.clarin.com/2021/05/20/IU-aBeVV5_720x0__1.jpg
87,iT7dAMWS9,En 2022. Elon Musk quiere llenar el cielo de satélites con avisos publicitarios,https://www.clarin.com/tecnologia/elon-musk-quiere-llenar-cielo-satelites-avisos-publicitarios_0_iT7dAMWS9.html,https://images.clarin.com/2021/08/05/7v5F8dvTo_720x0__1.jpg
88,LD3dUSWRz,"Cristales y color. Gemoterapia: qué propiedades tienen los cristales, según su color",https://www.clarin.com/astrologia/propiedades-cristales-colores_0_LD3dUSWRz.html,https://images.clarin.com/2021/04/13/itn4XNpj3_720x0__1.jpg
89,xtjWTC-xB,Imágenes únicas. Venden la mansión más cara de EE.UU.: tiene 21 habitaciones y 42 baños,https://www.clarin.com/internacional/venden-the-one-mansion-cara-ee-uu-21-habitaciones-42-banos_0_xtjWTC-xB.html,https://images.clarin.com/2021/02/23/fqj1tZhKU_720x0__1.jpg
90,JxPW0oeSw,La historia de Bill Hwang. Perdió 20.000 millones en dos días y hoy vive con poco: la caída del mago de Wall Street,https://www.clarin.com/internacional/perdio-20-000-millones-dolares-dias-hoy-vive-caida-bill-hwang-mago-wall-street_0_JxPW0oeSw.html,https://images.clarin.com/2021/08/12/h1FZTffXn_720x0__1.jpg
91,vfStB_vbE,No hubo víctimas. Increíble imagen: un buque carguero se partió al medio frente a las costas de Japón,https://www.clarin.com/internacional/increible-imagen-buque-carguero-partio-medio-frente-costas-japon_0_vfStB_vbE.html,https://images.clarin.com/2021/08/12/kex_t7oc__720x0__1.jpg
92,OpYB8HXi9,"Historia. Pidió una hamburguesa triple y se dislocó la mandíbula: ""Mi vida se arruinó""",https://www.clarin.com/viste/pidio-hamburguesa-triple-disloco-mandibula-vida-arruino-_0_OpYB8HXi9.html,https://images.clarin.com/2021/08/11/MN3AvikTN_720x0__1.jpg
