n,id,title,url,image
1,NYuTcbWX3,Cruce con la oposición. La directora de Migraciones dijo que entraron al país delincuentes venezolanos por culpa de Macri,https://www.clarin.com/politica/directora-migraciones-dijo-entraron-pais-delincuentes-venezolanos-culpa-mauricio-macri-salieron-cruzarla_0_NYuTcbWX3.html,https://images.clarin.com/2020/12/12/RfRHcHqpq_720x0__1.jpg
2,-Cc278zGk,"Alberto Fernández. ""Los violentos tiran piedras, nosotros llevamos obras y vacunas""",https://www.clarin.com/politica/alberto-fernandez-violentos-tiran-piedras-llevamos-obras-vacunas-_0_-Cc278zGk.html,https://images.clarin.com/2021/03/15/4EN63oAys_720x0__1.jpg
3,RierD-p5k,Agresión en Chubut. El video casero que muestra cómo dañan la camioneta del Presidente,https://www.clarin.com/politica/video-casero-muestra-instante-arrojan-piedrazo-rompe-vidrio-camioneta-presidente_0_RierD-p5k.html,https://images.clarin.com/2021/03/13/vbAZ_hbeJ_720x0__1.jpg
4,UZEmpYyoE,Obra pública. Nueva etapa clave en el juicio: cómo se armó la estructura para beneficiar a Báez,https://www.clarin.com/politica/nueva-etapa-clave-juicio-cristina-armo-estructura-administrativa-beneficiar-lazaro-baez_0_UZEmpYyoE.html,https://images.clarin.com/2019/05/08/9QcQTpOzz_720x0__1.jpg
5,dPdAtxgfI,Entre Ríos. Mató a su ex tras recibir una orden judicial por violencia de género,https://www.clarin.com/policiales/femicidio-rios-mato-punaladas-expareja-recibir-orden-judicial-violencia-genero_0_dPdAtxgfI.html,https://images.clarin.com/2021/03/15/wKHTZUao0_720x0__1.jpg
6,NrUGLrn87,"Un año de dolor. Murió al caer de un cuarto piso, pero su familia denuncia un femicidio",https://www.clarin.com/policiales/murio-caer-cuarto-piso-familia-denuncia-femicidio_0_NrUGLrn87.html,https://images.clarin.com/2021/03/15/fHS0bdLpE_1256x620__2.jpg#1615808907784
7,VdcjTGiMF,Coronavirus. Detectan otros 55 casos en dos grupos de egresados que volvieron de Cancún,https://www.clarin.com/sociedad/detectan-55-casos-coronavirus-contingentes-egresados-volvieron-cancun_0_VdcjTGiMF.html,https://images.clarin.com/2020/02/01/GNCoQHhk_720x0__1.jpg
8,lXa4G1V_F,"Miami Beach. Los jóvenes ""invaden"" la playa con incidentes y detenidos",https://www.clarin.com/mundo/jovenes-invaden-miami-beach-receso-primavera-respetan-protocolos-desatan-incidentes-100-detenidos_0_lXa4G1V_F.html,https://images.clarin.com/2021/03/07/_v73tBOEc_1256x620__2.jpg#1615819939617
9,gG7Xn_XEX,Los detalles. Gran susto en París: cómo fue el robo y qué se llevaron de la casa de Di María,https://www.clarin.com/deportes/gran-susto-paris-robo-llevaron-casa-angel-di-maria_0_gG7Xn_XEX.html,https://images.clarin.com/2017/06/30/S1QWy7HV-_1256x620__2.jpg#1615808142883
10,iqSyN3B9Y,González Catán. El cruce entre la madre del chico que conducía y la familia de la víctima,https://www.clarin.com/sociedad/-hijo-salio-matar-fuerte-cruce-madre-chico-manejaba-auto-hermano-victima-gonzalez-catan_0_iqSyN3B9Y.html,https://images.clarin.com/2021/03/15/e6J5vjlsV_720x0__1.jpg
11,kYiEES80s,"Tragedia. ""Se cayó la luz"", el susto del nene de 5 años que perdió a su papá atropellado",https://www.clarin.com/sociedad/-cayo-luz-susto-nene-perdio-papa-atropellado-chico-14-anos_0_kYiEES80s.html,https://images.clarin.com/2021/03/14/fdiFL4WCB_720x0__1.jpg
12,G44rOYquF,"Beijing, apocalíptico. El extraño paisaje con el que amaneció la capital de China",https://www.clarin.com/mundo/beijing-apocaliptico-extrano-paisaje-amanecio-capital-china_0_G44rOYquF.html,https://images.clarin.com/2021/03/15/f9l2f8Yll_720x0__1.jpg
13,gmztaut3D,Salud. La verdadera razón de la euforia de los corredores,https://www.clarin.com/new-york-times-international-weekly/verdadera-razon-euforia-corredores_0_gmztaut3D.html,https://images.clarin.com/2021/03/11/Z4ANJRc4t_1256x620__2.jpg#1615469324744
14,NYuTcbWX3,Cruce con la oposición. La directora de Migraciones dijo que entraron al país delincuentes venezolanos por culpa de Macri,https://www.clarin.com/politica/directora-migraciones-dijo-entraron-pais-delincuentes-venezolanos-culpa-mauricio-macri-salieron-cruzarla_0_NYuTcbWX3.html,https://images.clarin.com/2020/12/12/RfRHcHqpq_720x0__1.jpg
15,-Cc278zGk,"Alberto Fernández. ""Los violentos tiran piedras, nosotros llevamos obras y vacunas""",https://www.clarin.com/politica/alberto-fernandez-violentos-tiran-piedras-llevamos-obras-vacunas-_0_-Cc278zGk.html,https://images.clarin.com/2021/03/15/4EN63oAys_720x0__1.jpg
16,RierD-p5k,Agresión en Chubut. El video casero que muestra cómo dañan la camioneta del Presidente,https://www.clarin.com/politica/video-casero-muestra-instante-arrojan-piedrazo-rompe-vidrio-camioneta-presidente_0_RierD-p5k.html,https://images.clarin.com/2021/03/13/vbAZ_hbeJ_720x0__1.jpg
17,UZEmpYyoE,Obra pública. Nueva etapa clave en el juicio: cómo se armó la estructura para beneficiar a Báez,https://www.clarin.com/politica/nueva-etapa-clave-juicio-cristina-armo-estructura-administrativa-beneficiar-lazaro-baez_0_UZEmpYyoE.html,https://images.clarin.com/2019/05/08/9QcQTpOzz_720x0__1.jpg
18,dPdAtxgfI,Entre Ríos. Mató a su ex tras recibir una orden judicial por violencia de género,https://www.clarin.com/policiales/femicidio-rios-mato-punaladas-expareja-recibir-orden-judicial-violencia-genero_0_dPdAtxgfI.html,https://images.clarin.com/2021/03/15/wKHTZUao0_720x0__1.jpg
19,NrUGLrn87,"Un año de dolor. Murió al caer de un cuarto piso, pero su familia denuncia un femicidio",https://www.clarin.com/policiales/murio-caer-cuarto-piso-familia-denuncia-femicidio_0_NrUGLrn87.html,https://images.clarin.com/2021/03/15/fHS0bdLpE_1256x620__2.jpg#1615808907784
20,VdcjTGiMF,Coronavirus. Detectan otros 55 casos en dos grupos de egresados que volvieron de Cancún,https://www.clarin.com/sociedad/detectan-55-casos-coronavirus-contingentes-egresados-volvieron-cancun_0_VdcjTGiMF.html,https://images.clarin.com/2020/02/01/GNCoQHhk_720x0__1.jpg
21,lXa4G1V_F,"Miami Beach. Los jóvenes ""invaden"" la playa con incidentes y detenidos",https://www.clarin.com/mundo/jovenes-invaden-miami-beach-receso-primavera-respetan-protocolos-desatan-incidentes-100-detenidos_0_lXa4G1V_F.html,https://images.clarin.com/2021/03/07/_v73tBOEc_1256x620__2.jpg#1615819939617
22,gG7Xn_XEX,Los detalles. Gran susto en París: cómo fue el robo y qué se llevaron de la casa de Di María,https://www.clarin.com/deportes/gran-susto-paris-robo-llevaron-casa-angel-di-maria_0_gG7Xn_XEX.html,https://images.clarin.com/2017/06/30/S1QWy7HV-_1256x620__2.jpg#1615808142883
23,jcup4CXCN,Conmoción en el sur. El triste destino de los Barría: tres hermanos muertos en dos tragedias,https://www.clarin.com/sociedad/triste-destino-barria-hermanos-muertos-tragedias_0_jcup4CXCN.html,https://images.clarin.com/2021/03/15/7i_JJT7mt_1256x620__2.jpg#1615815114218
24,vq7KgaHmx,"Hasta el miércoles. Arranca el Electrofest: cómo, cuánto y qué comprar con descuentos",https://www.clarin.com/economia/arranca-electrofest-comprar-descuentos_0_vq7KgaHmx.html,https://images.clarin.com/2019/03/13/DguzUFUUl_720x0__1.jpg
25,rm7Ql0D81,Razones para la angustia. El papa Francisco contó por qué fue a una psiquiatra,https://www.clarin.com/cultura/papa-francisco-conto-psiquiatra_0_rm7Ql0D81.html,https://images.clarin.com/2021/03/15/degYrrOIU_1256x620__2.jpg#1615821787898
26,pDwgKuHpz,"Consultorio. Ser autoexigente: los peligros del ""querer es poder""",https://www.clarin.com/viva/autoexigente-peligros-querer-poder-_0_pDwgKuHpz.html,https://images.clarin.com/2016/08/11/r1lRCi1AQe_720x0.jpg
27,dXIR-PZQ8,Servicio. Trenes: a dónde se puede viajar en la Argentina y cuánto cuestan los pasajes,https://www.clarin.com/viajes/trenes-puede-viajar-argentina-cuestan-pasajes_0_dXIR-PZQ8.html,https://images.clarin.com/2021/03/12/hpao3vpmF_720x0__1.jpg
28,8B2krjNWI,Cumple 50 años. La Biblia de Vox Dei: el día que el rock argentino hizo contacto con Dios,https://www.clarin.com/espectaculos/musica/biblia-vox-dei-cumple-50-anos-dia-rock-argentino-hizo-contacto-dios_0_8B2krjNWI.html,https://images.clarin.com/2019/09/12/t7LmfcqNH_720x0__1.jpg
29,2bxrgT_z6,"Oscar 2021. Dónde, cómo y cuándo ver las películas candidatas",https://www.clarin.com/espectaculos/cine/nominaciones-oscar-2021-ver-peliculas-candidatas_0_2bxrgT_z6.html,https://images.clarin.com/2021/03/15/5Ecgapef5_720x0__1.jpg
30,iK_GG2SGa,"¿""Mank"" favorita?. 5 curiosidades de la película con más nominaciones al Oscar",https://www.clarin.com/espectaculos/cine/mank-5-curiosidades-pelicula-netflix-nominaciones-oscar-2021_0_iK_GG2SGa.html,https://images.clarin.com/2021/03/15/cRj14l4cE_720x0__1.jpg
31,xZumyG65u,Descuentos especiales. YPF acompaña  en la vuelta a clases a trabajadores de la educación,https://www.clarin.com/brandstudio/ypf-acompana-trabajadores-educacion-vuelta-clases_0_xZumyG65u.html,https://images.clarin.com/2021/03/12/GhFpNsYbQ_720x0__1.jpg
32,jcup4CXCN,Conmoción en el sur. El triste destino de los Barría: tres hermanos muertos en dos tragedias,https://www.clarin.com/sociedad/triste-destino-barria-hermanos-muertos-tragedias_0_jcup4CXCN.html,https://images.clarin.com/2021/03/15/7i_JJT7mt_1256x620__2.jpg#1615815114218
33,vq7KgaHmx,"Hasta el miércoles. Arranca el Electrofest: cómo, cuánto y qué comprar con descuentos",https://www.clarin.com/economia/arranca-electrofest-comprar-descuentos_0_vq7KgaHmx.html,https://images.clarin.com/2019/03/13/DguzUFUUl_720x0__1.jpg
34,rm7Ql0D81,Razones para la angustia. El papa Francisco contó por qué fue a una psiquiatra,https://www.clarin.com/cultura/papa-francisco-conto-psiquiatra_0_rm7Ql0D81.html,https://images.clarin.com/2021/03/15/degYrrOIU_1256x620__2.jpg#1615821787898
35,pDwgKuHpz,"Consultorio. Ser autoexigente: los peligros del ""querer es poder""",https://www.clarin.com/viva/autoexigente-peligros-querer-poder-_0_pDwgKuHpz.html,https://images.clarin.com/2016/08/11/r1lRCi1AQe_720x0.jpg
36,dXIR-PZQ8,Servicio. Trenes: a dónde se puede viajar en la Argentina y cuánto cuestan los pasajes,https://www.clarin.com/viajes/trenes-puede-viajar-argentina-cuestan-pasajes_0_dXIR-PZQ8.html,https://images.clarin.com/2021/03/12/hpao3vpmF_720x0__1.jpg
37,8B2krjNWI,Cumple 50 años. La Biblia de Vox Dei: el día que el rock argentino hizo contacto con Dios,https://www.clarin.com/espectaculos/musica/biblia-vox-dei-cumple-50-anos-dia-rock-argentino-hizo-contacto-dios_0_8B2krjNWI.html,https://images.clarin.com/2019/09/12/t7LmfcqNH_720x0__1.jpg
38,2bxrgT_z6,"Oscar 2021. Dónde, cómo y cuándo ver las películas candidatas",https://www.clarin.com/espectaculos/cine/nominaciones-oscar-2021-ver-peliculas-candidatas_0_2bxrgT_z6.html,https://images.clarin.com/2021/03/15/5Ecgapef5_720x0__1.jpg
39,iK_GG2SGa,"¿""Mank"" favorita?. 5 curiosidades de la película con más nominaciones al Oscar",https://www.clarin.com/espectaculos/cine/mank-5-curiosidades-pelicula-netflix-nominaciones-oscar-2021_0_iK_GG2SGa.html,https://images.clarin.com/2021/03/15/cRj14l4cE_720x0__1.jpg
40,xZumyG65u,Descuentos especiales. YPF acompaña  en la vuelta a clases a trabajadores de la educación,https://www.clarin.com/brandstudio/ypf-acompana-trabajadores-educacion-vuelta-clases_0_xZumyG65u.html,https://images.clarin.com/2021/03/12/GhFpNsYbQ_720x0__1.jpg
41,-3i2b967j,Igualdad . Nos lavaron la cabeza con los mandatos de feminidad,https://www.clarin.com/brand-studio/lavaron-cabeza-mandatos-feminidad_0_-3i2b967j.html,https://images.clarin.com/2021/03/04/pL8RTKU9c_720x0__1.jpg
42,Qn8USrVoa,En primera persona. Historias de mujeres que rompieron con los prejuicios de la sociedad,https://www.clarin.com/brandstudio/historias-mujeres-rompieron-prejuicios-sociedad_0_Qn8USrVoa.html,https://images.clarin.com/2019/12/11/N-U6a-lX_720x0__1.jpg
43,179ExUtXY,Dejar a un lado los prejucios. Mitos derribados sobre el pelo,https://www.clarin.com/brandstudio/mitos-derribados-pelo_0_179ExUtXY.html,https://images.clarin.com/2021/03/14/rj1K7JthD_720x0__1.jpg
44,mLI21CcRQ,Volver a aprender. Una campaña que celebra la diversidad de las mujeres,https://www.clarin.com/brandstudio/campana-celebra-diversidad-mujeres_0_mLI21CcRQ.html,https://images.clarin.com/2021/02/17/qdc_015op_1256x620__2.jpg#1615758869301
45,OY62eNFKa,"Tu pelo, tu elección. Los chistes que no van",https://www.clarin.com/brandstudio/chistes-van_0_OY62eNFKa.html,https://images.clarin.com/2021/03/14/tCYn4hD1A_720x0__1.jpg
46,sQ_oZneQo,"Se acabó el amor. Casillas, Sara Carbonero y el patrimonio millonario tras la inesperada separación",https://www.clarin.com/deportes/iker-casillas-sara-carbonero-patrimonio-millonario-queda-inesperada-separacion_0_sQ_oZneQo.html,https://images.clarin.com/2021/03/15/5OxsQCFUG_1256x620__2.jpg#1615818287713
47,96Srxh1_7,Colombia. La furia de Teo Gutiérrez: gol anulado y roja por un cabezazo a un rival,https://www.clarin.com/deportes/teofilo-gutierrez-junior-roja-expulsion_0_96Srxh1_7.html,https://images.clarin.com/2020/07/03/_VpHyWivX_1256x620__2.jpg#1615816466886
48,CVC2JfZY3,Tras el 1-1 con River. Boca y la línea de tres centrales: aprobada y con chances de quedar como sistema,https://www.clarin.com/deportes/boca-linea-centrales-aprobada-superclasico-chances-quedar-sistema_0_CVC2JfZY3.html,https://images.clarin.com/2021/03/15/7tErY6L-4_1256x620__2.jpg#1615825001338
49,Qs0IdRvHr,Análisis I. ¿Por qué no ganó Boca?,https://www.clarin.com/deportes/dejo-superclasico-gano-boca-_0_Qs0IdRvHr.html,https://images.clarin.com/2021/03/14/4Hy2zuFLJ_1256x620__2.jpg#1615775619611
50,f1pXcL9Re,Análisis II. ¿Por qué no ganó River?,https://www.clarin.com/deportes/dejo-superclasico-gano-river-_0_f1pXcL9Re.html,https://images.clarin.com/2021/03/14/OpKEQdmg1_1256x620__2.jpg#1615774196913
51,OcJwcbUlD,España. La nueva y original forma de Luis Enrique para anunciar convocados ,https://www.clarin.com/deportes/seleccion-espana-lista-convocados-luis-enrique_0_OcJwcbUlD.html,https://images.clarin.com/2021/03/15/4K7m-hH0c_1256x620__2.jpg#1615812182795
52,sAoEhbQk1,Fuerte cambio. Medvedev dio un gran zarpazo en el ranking ATP,https://www.clarin.com/deportes/fuerte-cambio-ranking-atp-daniil-medvedev-desplazo-rafael-nadal-nuevo-numero-2-mundo_0_sAoEhbQk1.html,https://images.clarin.com/2021/02/19/y4GizbKSe_1256x620__2.jpg#1615810242000
53,TJh0L1QU4,Exclusivo para Clarín. Thomas está de vuelta y va por el Nº 1 del ranking mundial,https://www.clarin.com/deportes/thomas-vuelta-va-n-1-ranking-mundial_0_TJh0L1QU4.html,https://images.clarin.com/2021/03/09/xNcm_cIr6_720x0__1.jpg
54,mtjcqYsgB,Maniobras secretas. Pablo Iglesias deja el gobierno de Sánchez en España y busca la presidencia de Madrid,https://www.clarin.com/mundo/espana-pablo-iglesias-deja-gobierno-sanchez_0_mtjcqYsgB.html,https://images.clarin.com/2021/03/15/LKcYbfAFW_1256x620__2.jpg#1615807275927
55,MRu2e8jEG,"Anuncio oficial. El Vaticano aclaró que no aprobará uniones homosexuales para no ""bendecir el pecado""",https://www.clarin.com/mundo/iglesia-catolica-afirmo-aprobara-uniones-homosexuales-puede-bendecir-pecado-_0_MRu2e8jEG.html,https://images.clarin.com/2019/05/08/QHC6Obcw5_1256x620__2.jpg#1615814831687
56,oKT62OylZ,Coronavirus. Desesperado pedido a Bolsonaro: San Pablo en toque de queda y con escuelas cerradas,https://www.clarin.com/mundo/san-pablo-vive-toque-queda-cierra-escuelas-llamado-desesperado-gobernadores-bolsonaro_0_oKT62OylZ.html,https://images.clarin.com/2021/03/15/iEaKFB6pF_1256x620__2.jpg#1615815908316
57,KRBZdFWty,Zonas rojas. Italia se llena de ciudades fantasma por la tercera ola de Covid,https://www.clarin.com/mundo/italia-llena-ciudades-fantasma-tercera-ola-coronavirus-encierra-casas-millones-personas_0_KRBZdFWty.html,https://images.clarin.com/2021/03/15/xGJV5Dker_1256x620__2.jpg#1615822377012
58,SJnQwBhDB,Análisis. ¿Qué efecto causa subir o bajar impuestos?,https://www.clarin.com/economia/-efecto-causa-subir-bajar-impuestos-_0_SJnQwBhDB.html,https://images.clarin.com/2021/03/15/Jhi6d1F8y_720x0__1.jpg
59,iZs0aQKp5,Una larga lista. El Gobierno cambió y creó 16 impuestos que aumentan la presión fiscal,https://www.clarin.com/economia/impuestos-larga-lista-cambios-elevan-presion-fiscal-mandato-alberto-fernandez_0_iZs0aQKp5.html,https://images.clarin.com/2020/12/17/18y68--_F_720x0__1.jpg
60,41QNwnoN6,"Interna radical. Elección en Córdoba: Negri y Mestre festejaron en una ""elección pareja""",https://www.clarin.com/politica/eleccion-ucr-cordoba-mario-negri-ramon-mestre-festejaron-triunfo-eleccion-pareja-_0_41QNwnoN6.html,https://images.clarin.com/2021/03/15/YXQgE7QdF_720x0__1.jpg
61,_1HB1uoWJ,En la Ciudad. Remates de inmuebles sin herederos: a un click de la primera casa,https://www.clarin.com/economia/remates-online-inmuebles-pesos-saber-participar_0__1HB1uoWJ.html,https://images.clarin.com/2021/03/11/SZChpGsnU_720x0__1.jpg
62,oMUWmq26X,Audi e-tron. Cómo anda el auto eléctrico de lujo que tiene dos motores,https://www.clarin.com/autos/audi-tron-anda-auto-electrico-lujo-motores_0_oMUWmq26X.html,https://images.clarin.com/2021/03/15/2xFH_6mq2_720x0__1.jpg
63,pswvgcRVP,Tabaquismo. Este es el beneficio menos conocido de dejar de fumar,https://www.clarin.com/buena-vida/beneficio-conocido-dejar-fumar_0_pswvgcRVP.html,https://images.clarin.com/2021/03/10/2mNhBznlz_720x0__1.jpg
64,BP7gtM8XH,Heredero del ghosting. Paperclipping: reaparecer de la nada para alimentar falsas expectativas,https://www.clarin.com/relaciones/paperclipping-gosthing-relaciones_0_BP7gtM8XH.html,https://images.clarin.com/2021/03/12/U1T0yzuUP_720x0__1.jpg
65,JrgZZXKvT,"¿""Paciente acordeón""?. 20 claves para identificar una dieta destinada al fracaso",https://www.clarin.com/buena-vida/-sos-paciente-acordeon-20-claves-identificar-dieta-destinada-fracaso_0_JrgZZXKvT.html,https://images.clarin.com/2021/03/01/Xpjb0XP5v_720x0__1.jpg
66,5sYEvRZS6,TLON SPACE. La startup argentina que es capaz de reutilizar sus cohetes como SpaceX,https://www.clarin.com/tecnologia/startup-argentina-capaz-reutilizar-cohetes-spacex_0_5sYEvRZS6.html,https://images.clarin.com/2021/03/14/Suu3vwQzI_720x0__1.jpg
67,MGa3HvLg0,Redes sociales. Telegram prepara las salas de voz  al estilo de Clubhouse,https://www.clarin.com/tecnologia/telegram-prepara-salas-voz-estilo-clubhouse_0_MGa3HvLg0.html,https://images.clarin.com/2021/01/28/WRpx3Fohk_720x0__1.jpg
68,j3urJjHPO,Recetas. Qué cocinar esta semana: menú día por día del 15 al 21 de marzo,https://www.clarin.com/gourmet/cocinar-semana-menu-dia-dia-15-21-marzo_0_j3urJjHPO.html,https://images.clarin.com/2021/02/23/AGaPQMUu6_720x0__1.jpg
69,8L51D2T2D,Horóscopo semanal. Predicciones del 15 al 21 de marzo para todos los signos,https://www.clarin.com/astrologia/horoscopo-semanal-predicciones-15-21-marzo-signos_0_8L51D2T2D.html,https://images.clarin.com/2021/03/15/k-TM3aKep_720x0__1.jpg
70,uERLWgMyq,Serán 6 capítulos. Falcon y el Soldado del Invierno tiene nuevo trailer,https://www.clarin.com/espectaculos/tv/falcon-soldado-invierno-marvel-nuevo-trailer_0_uERLWgMyq.html,https://images.clarin.com/2020/11/12/90aocbnXV_720x0__1.jpg
71,wAWx7gHww,Amor. La colombiana que se enamoró y se casó con un guerrero masái en Kenia,https://www.clarin.com/viste/colombiana-enamoro-caso-guerrero-masai-kenia_0_wAWx7gHww.html,https://images.clarin.com/2021/03/15/3xBx1AkMh_720x0__1.jpg
72,Tmp7fka4n,"Mirá el video. Apareció una morsa ártica, totalmente agotada, en la costa irlandesa",https://www.clarin.com/viste/crisis-climatica-aparecio-morsa-artica-totalmente-agotada-costa-irlandesa_0_Tmp7fka4n.html,https://images.clarin.com/2021/03/15/blpeq2oBV_720x0__1.jpg
73,rPUjOJJ0-,En la cordillera. Hallan restos fósiles de un Ictiosaurio en un campo en Mendoza,https://www.clarin.com/viste/encontraron-restos-fosiles-ictiosaurio-campo-mendoza-plena-cordillera_0_rPUjOJJ0-.html,https://images.clarin.com/2015/01/12/HyXbYvnh7g_720x0.jpg
74,3cp4ATZpT,Foto y dudas. La Fuerza Aérea de Uruguay investiga la aparición de un OVNI,https://www.clarin.com/viste/fuerza-aerea-uruguay-investiga-aparicion-ovni_0_3cp4ATZpT.html,https://images.clarin.com/2021/03/12/Z6GxwIpbU_720x0__1.jpg
75,5UgZWRY-_,"Video. El lago que puede cambiar de color entre el rosa, el blanco o el azul",https://www.clarin.com/viste/misterio-lago-puede-cambiar-color-rosa-blanco-azul_0_5UgZWRY-_.html,https://images.clarin.com/2021/03/15/SVwsV0hS4_720x0__1.jpg
76,1OsNbwscG,"Nueva encuesta nacional. ""Lo creía distinto y lo veo parecido"": los votos que perdería Fernández por acercarse a CFK",https://www.clarin.com/politica/-creia-distinto-veo-parecido-votos-perderia-alberto-fernandez-acercarse-cristina-kirchner_0_1OsNbwscG.html,https://images.clarin.com/2021/03/01/kGaj6WRZz_720x0__1.jpg
77,52Ip4OFcu,Coronavirus. Argentina vacuna sólo a tres adultos mayores por cada diez dosis y la brecha crece,https://www.clarin.com/sociedad/coronavirus-argentina-vacuna-solo-adultos-mayores-menores-60-dosis-chinas-agrandan-brecha_0_52Ip4OFcu.html,https://images.clarin.com/2021/03/02/tBXUqWJHI_720x0__1.jpg
78,DAZsdNRXl,"Coronavirus. Alemania, Italia y Francia también suspenden la vacuna de AstraZeneca",https://www.clarin.com/mundo/alemania-suspende-uso-vacuna-astrazeneca-coronavirus_0_DAZsdNRXl.html,https://images.clarin.com/2021/03/15/8H69DKrS8_720x0__1.jpg
79,ftfK8by0E,"Burbujas escolares. Ver y escuchar, los nuevos problemas de la distancia entre alumnos y maestros",https://www.clarin.com/sociedad/burbujas-escolares-ver-escuchar-nuevos-problemas-distancia-alumnos-maestros-dentro-aulas_0_ftfK8by0E.html,https://images.clarin.com/2020/10/06/hr6u7il9J_720x0__1.jpg
80,hawR9zslC,"Últimos días. Buscan a jóvenes argentinos para una ""pasantía virtual"" en Google",https://www.clarin.com/servicios/convocan-jovenes-argentinos-pasantia-virtual-google-ultimos-dias-postularse_0_hawR9zslC.html,https://images.clarin.com/2019/06/29/xUPLI2CB2_720x0__1.jpg
81,7Z-gf21uQ,"Tuvo coronavirus. Lapegüe, antes de su regreso a la TV: ""Sufro estrés, me asusto fácil y siento ira""",https://www.clarin.com/zonales/lapegue-vuelve-tele-sigue-rehabilitacion-banfield_0_7Z-gf21uQ.html,https://images.clarin.com/2021/03/13/2tIat9Phh_720x0__1.jpg
82,dqihJ-0lx,Preocupación. Internaron a Guillermo Coppola por complicaciones respiratorias,https://www.clarin.com/deportes/internaron-guillermo-coppola-complicaciones-respiratorias_0_dqihJ-0lx.html,https://images.clarin.com/2020/11/30/xFQo5iIgw_720x0__1.jpg
83,wMG3vvJIE,En el Sub 21. Un cordobés en la Selección de Alemania: convocan a Mateo Klimowicz,https://www.clarin.com/deportes/cordobes-seleccion-alemania-mateo-klimowicz-convocado-jugar-sub-21_0_wMG3vvJIE.html,https://images.clarin.com/2021/03/15/P977hJwuh_1256x620__2.jpg#1615823528015
