n,id,title,url,image
1,1aID_oLxm,Comicios presidenciales. Elecciones en Chile: José Kast se impone en las urnas e irá al balotaje con Gabriel Boric ,https://www.clarin.com/mundo/elecciones-chile-resultados-empiezan-cerrar-mesas-votacion_0_1aID_oLxm.html,https://images.clarin.com/2021/11/21/3rGUnxUvM_720x0__1.jpg
2,lPgaudU8C,"Avant Premiere. Los mapuches en agenda, el Congreso de Cristina y la tensión opositora",https://www.clarin.com/politica/mapuches-agenda-congreso-cristina-tension-opositora_0_lPgaudU8C.html,https://images.clarin.com/2021/11/21/sKo9884vU_720x0__1.jpg
3,U6OLTBd1R,De la Editora. El Perico de Alberto Fernández,https://www.clarin.com/opinion/perico-alberto-fernandez_0_U6OLTBd1R.html,https://images.clarin.com/2021/11/19/C88ExmJpj_720x0__1.jpg
4,TTRFs_LtV,Humor político. Equipo chico LPQTP,https://www.clarin.com/opinion/equipo-chico-lpqtp_0_TTRFs_LtV.html,https://images.clarin.com/2021/11/20/q7YivgiUR_720x0__1.jpg
5,E6qcITbvC,"NBA. LeBron James le dio un brutal golpe a Isaiah Stewart, lo dejó sangrando y se fue expulsado",https://www.clarin.com/deportes/nba-lebron-james-dio-brutal-codazo-isaiah-stewart-dejo-sangrando-expulsado-segunda-vez-carrera_0_E6qcITbvC.html,https://images.clarin.com/2021/11/21/16qfA7rW6_720x0__1.jpg
6,duah-jfF_,Río Negro. Investigan incidente en una toma mapuche: denuncian un muerto y un herido de bala,https://www.clarin.com/politica/investigan-incidente-toma-mapuche-rio-negro-denuncian-herido-bala_0_duah-jfF_.html,https://images.clarin.com/2021/10/23/4hV1ruXu4_720x0__1.jpg
7,N2p9AczF7,Al menos 20 heridos. Una camioneta atropelló a decenas de personas durante un desfile navideño en EE.UU.,https://www.clarin.com/mundo/video-camioneta-atropello-decenas-personas-desfile-navideno-unidos_0_N2p9AczF7.html,https://images.clarin.com/2021/11/21/lfshMvJnK_720x0__1.jpg
8,93SLEWGog,En la Bombonera. Un barra de Boca golpeó salvajemente a la ex pareja de Fernando Di Zeo,https://www.clarin.com/deportes/boca-juniors-golpiza-barra-esposa-di-zeo_0_93SLEWGog.html,https://images.clarin.com/2021/11/21/6XE-SEdTB6_1256x620__2.jpg#1637529053738
9,nIfV5kq35,Liga Profesional. River golpea de arranque y le gana a Platense con un gol de Julián Álvarez,https://www.clarin.com/deportes/platense-vs-river-liga-profesional-futbol-minuto-minuto-directo_0_nIfV5kq35.html,https://images.clarin.com/2021/11/21/Nw9IROEJO_720x0__1.jpg
10,q_3rAiuC4,"Tenía 34 años. ""Camila"", el misterioso nombre detrás del crimen de un financista en Almagro",https://www.clarin.com/policiales/citaron-prestamista-departamento-almagro-vacio-apunalaron_0_q_3rAiuC4.html,https://images.clarin.com/2021/11/21/iNLxfxc2V_1256x620__2.jpg#1637526321254
11,eTf-tbKqH,"Adelanto de Clarín. Tras su buena elección, una encuesta midió por primera vez a Milei para presidente",https://www.clarin.com/politica/buena-eleccion-ciudad-encuesta-midio-primera-vez-javier-milei-presidente-2023_0_eTf-tbKqH.html,https://images.clarin.com/2021/11/15/p0SqTncHS_720x0__1.jpg
12,7yiNZ6-HT,Un cambio polémico. El Gobierno acelera el plan para que los intendentes tengan re-reelección y ya hay charlas con la oposición,https://www.clarin.com/politica/gobierno-acelera-plan-re-reeleccion-intendentes-charlas-oposicion_0_7yiNZ6-HT.html,https://images.clarin.com/2021/09/14/qgHidlsE3_720x0__1.jpg
13,19V11qCa0,Tragedia de Once. De Vido pidió hacer una campaña contra el maquinista en los chats con Baratta,https://www.clarin.com/politica/tragedia-once-vido-pidio-hacer-campana-maquinista-chats-baratta_0_19V11qCa0.html,https://images.clarin.com/2020/08/07/WN22H3a3Q_720x0__1.jpg
14,bDE37RlYh,Estaba internado. A los 75 años murió el periodista de espectáculos Guillermo Blanc,https://www.clarin.com/fama/75-anos-murio-periodista-espectaculos-guillermo-blanc_0_bDE37RlYh.html,https://images.clarin.com/2021/11/21/xjwBfNNct_720x0__1.jpg
15,UOMfMk0o0," ""Encubren a los policías"". Muerte en una comisaría de San Clemente: la ex esposa del detenido desmintió a Berni",https://www.clarin.com/policiales/muerte-comisaria-ex-esposa-detenido-desmintio-sergio-berni-aseguro-encubriendo-policias-_0_UOMfMk0o0.html,https://images.clarin.com/2021/11/21/r1Yp-M1HS_720x0__1.jpg
16,DXx_MdCfk,Piden preservar el patrimonio. Interna en el club más exclusivo: revuelo en el Jockey por una deuda millonaria,https://www.clarin.com/economia/interna-club-exclusivo-revuelo-jockey-deuda-millonaria_0_DXx_MdCfk.html,https://images.clarin.com/2020/11/03/6iuUJcHiw_720x0__1.jpg
17,RWpjqK-KN,Alireza Firouzja. El genio del ajedrez que a los 18 años superó récords de Carlsen y Kasparov,https://www.clarin.com/deportes/alireza-firouzja-genio-ajedrez-18-anos-supero-records-magnus-carlsen-garry-kasparov_0_RWpjqK-KN.html,https://images.clarin.com/2021/11/21/HFamDi-yZ_720x0__1.jpg
18,gyeo9hDtD,Un Miura de 1969. El Elvis griego y un Lamborghini 32 años abandonado en un estacionamiento,https://www.clarin.com/autos/la-increible-historia-del-elvis-griego-y-un-lamborghini-que-estuvo-32-anos-abandonado-en-un-estacionamiento_0_gyeo9hDtD.html,https://images.clarin.com/2021/11/20/q--bqeybD_720x0__1.jpg
19,2QKyQaZs7,Internas en Juntos. Facundo Manes desafía la centralidad de Larreta y sale a recorrer el país,https://www.clarin.com/politica/internas-juntos-ahora-facundo-manes-desafia-centralidad-rodriguez-larreta-sale-recorrer-pais_0_2QKyQaZs7.html,https://images.clarin.com/2021/11/21/-BrlIzFjI_720x0__1.jpg
20,A36Fibpz5,Comicios regionales. Venezuela: cierran las mesas de votación en una jornada con incidentes menores,https://www.clarin.com/mundo/venezuela-cierran-mesas-votacion-jornada-incidentes-menores_0_A36Fibpz5.html,https://images.clarin.com/2021/11/21/-tS0VWidM_1200x0__2.jpg#1637528384509
21,7nNRVIs9F,"Cara a cara con Natalio Botana. ""Como en Argentina, el populismo cuando es derrotado no lo admite""",https://www.clarin.com/politica/natalio-botana-argentina-populismo-derrotado-admite-_0_7nNRVIs9F.html,https://images.clarin.com/2019/09/20/7DiQxYjhA_720x0__1.jpg
22,T3A9JLdmL,Cantó con 60 chicos. Abel Pintos sorprendió a una orquesta infanto juvenil de Mar del Plata en pleno ensayo,https://www.clarin.com/espectaculos/musica/abel-pintos-sorprendio-orquesta-infanto-juvenil-mar-plata-medio-ensayo_0_T3A9JLdmL.html,https://images.clarin.com/2021/11/21/IXirj7cH0_720x0__1.jpg
23,zbg5yXRSa,Premio Docentes que Inspiran. Es maestra rural e impulsa proyectos de lectura radial y obras de teatro para incluir,https://www.clarin.com/sociedad/innovacion-educativa-maestra-rural-impulsa-proyectos-lectura-radial-obras-teatro-promover-inclusion_0_zbg5yXRSa.html,https://images.clarin.com/2021/11/21/UDDdGhjfW_1256x620__2.jpg#1637525550603
24,O5PcE6QA2,"Criptoarte. Se ""robó"" todos los NFT del mundo y los dejó para descargar gratis",https://www.clarin.com/tecnologia/robo-nft-mundo-subio-descargar-gratis-mucha-gente-estafada-_0_O5PcE6QA2.html,https://images.clarin.com/2021/11/20/FtdY-II9o_720x0__1.jpg
25,1aID_oLxm,Comicios presidenciales. Elecciones en Chile: José Kast se impone en las urnas e irá al balotaje con Gabriel Boric ,https://www.clarin.com/mundo/elecciones-chile-resultados-empiezan-cerrar-mesas-votacion_0_1aID_oLxm.html,https://images.clarin.com/2021/11/21/3rGUnxUvM_720x0__1.jpg
26,lPgaudU8C,"Avant Premiere. Los mapuches en agenda, el Congreso de Cristina y la tensión opositora",https://www.clarin.com/politica/mapuches-agenda-congreso-cristina-tension-opositora_0_lPgaudU8C.html,https://images.clarin.com/2021/11/21/sKo9884vU_720x0__1.jpg
27,U6OLTBd1R,De la Editora. El Perico de Alberto Fernández,https://www.clarin.com/opinion/perico-alberto-fernandez_0_U6OLTBd1R.html,https://images.clarin.com/2021/11/19/C88ExmJpj_720x0__1.jpg
28,TTRFs_LtV,Humor político. Equipo chico LPQTP,https://www.clarin.com/opinion/equipo-chico-lpqtp_0_TTRFs_LtV.html,https://images.clarin.com/2021/11/20/q7YivgiUR_720x0__1.jpg
29,E6qcITbvC,"NBA. LeBron James le dio un brutal golpe a Isaiah Stewart, lo dejó sangrando y se fue expulsado",https://www.clarin.com/deportes/nba-lebron-james-dio-brutal-codazo-isaiah-stewart-dejo-sangrando-expulsado-segunda-vez-carrera_0_E6qcITbvC.html,https://images.clarin.com/2021/11/21/16qfA7rW6_720x0__1.jpg
30,duah-jfF_,Río Negro. Investigan incidente en una toma mapuche: denuncian un muerto y un herido de bala,https://www.clarin.com/politica/investigan-incidente-toma-mapuche-rio-negro-denuncian-herido-bala_0_duah-jfF_.html,https://images.clarin.com/2021/10/23/4hV1ruXu4_720x0__1.jpg
31,N2p9AczF7,Al menos 20 heridos. Una camioneta atropelló a decenas de personas durante un desfile navideño en EE.UU.,https://www.clarin.com/mundo/video-camioneta-atropello-decenas-personas-desfile-navideno-unidos_0_N2p9AczF7.html,https://images.clarin.com/2021/11/21/lfshMvJnK_720x0__1.jpg
32,cOHWx5yrR,Él le lleva 19 años. Flor Vigna reveló si le afecta la diferencia de edad con Luciano Castro,https://www.clarin.com/fama/flor-vigna-revelo-afecta-diferencia-edad-luciano-castro_0_cOHWx5yrR.html,https://images.clarin.com/2021/10/07/9pl4If8WM_720x0__1.jpg
33,Hx8iKxhfa,¿Aceptará?. Marcelo Tinelli sorprendió con la propuesta que le hizo a L-Gante,https://www.clarin.com/fama/marcelo-tinelli-sorprendio-propuesta-hizo-l-gante_0_Hx8iKxhfa.html,https://images.clarin.com/2021/11/21/4kqQNAVcU_720x0__1.jpg
34,E0TPXY6iL,"El peor momento. La fuerte confesión de Adabel Guerrero: ""Quería que me pise un auto y desaparecer""",https://www.clarin.com/fama/fuerte-confesion-adabel-guerrero-queria-pise-auto-desaparecer-_0_E0TPXY6iL.html,https://images.clarin.com/2021/11/21/XfmW9Nk-2_720x0__1.jpg
35,4507BGkyR,Puro amor. Julieta Prandi se confesó y expresó todo su amor por Emanuel Ortega,https://www.clarin.com/fama/julieta-prandi-confeso-expreso-amor-emanuel-ortega_0_4507BGkyR.html,https://images.clarin.com/2021/11/21/q57q_bMub_720x0__1.jpg
36,Mx9vFnOV9,Dispositivos. Todo sobre drones en Argentina: los mejores 5 modelos para principiantes,https://www.clarin.com/tecnologia/drones-argentina-mejores-5-modelos-principiantes_0_Mx9vFnOV9.html,https://images.clarin.com/2020/11/13/wqdtsh8-Q_720x0__1.jpg
37,WPyeUsDIe,"La intimidad del poder. Pizzas, asados y discusiones en la Quinta de Olivos, con Cristina al teléfono",https://www.clarin.com/politica/pizzas-asados-discusiones-quinta-olivos-cristina-kirchner-telefono_0_WPyeUsDIe.html,https://images.clarin.com/2021/11/15/D1CWSrOhc_720x0__1.jpg
38,Sv-dWAmyF,Especial Clarín. Qatar 2022: la odisea de los hinchas argentinos para llegar al Mundial imposible,https://www.clarin.com/servicios/qatar-2022-odisea-hinchas-argentinos-llegar-mundial-imposible_0_Sv-dWAmyF.html,https://images.clarin.com/2021/11/18/uoaxFiLhP_720x0__1.jpg
39,murejnPAb,Salud pública. Un cambio en las prestaciones del PAMI afecta a miles de jubilados,https://www.clarin.com/sociedad/cambio-prestaciones-pami-afecta-miles-jubilados_0_murejnPAb.html,https://images.clarin.com/2020/09/07/_IUuAIxSB_720x0__1.jpg
40,4gTT8aN11,Cuadernos de las Coimas. Viaje al iPhone de Baratta y cómo CFK pedía datos para denunciar a Macri,https://www.clarin.com/politica/iphone-baratta-cristina-pidio-vido-datos-denunciar-macri_0_4gTT8aN11.html,https://images.clarin.com/2019/12/15/W0vdn7sC_720x0__1.jpg
41,cIBZoWA73,Informe especial. El lado oscuro del tenis: cuando jugar a perder hace ganar millones de dólares,https://www.clarin.com/deportes/lado-oscuro-tenis-jugar-perder-hace-ganar-millones-dolares_0_cIBZoWA73.html,https://images.clarin.com/2021/11/15/Qp8noW2AE_720x0__1.jpg
42,QYZ1y_wYH,Literatura y plástica. Misteriosa Buenos Aires: 11 rincones del arte porteño con secretos para explorar,https://www.clarin.com/ciudades/misteriosa-buenos-aires-11-rincones-arte-porteno-secretos-explorar_0_QYZ1y_wYH.html,https://images.clarin.com/2021/11/11/BD1JOPOew_720x0__1.jpg
43,4ymJ2uqkt,Victoria Alonso.  La historia de la argentina que se convirtió en la mujer más poderosa de Hollywood,https://www.clarin.com/espectaculos/cine/victoria-alonso-historia-argentina-mujer-poderosa-hollywood_0_4ymJ2uqkt.html,https://images.clarin.com/2021/11/09/2vfL1S0eT_720x0__1.jpg
44,qzHnl8JmC,La caída de Alperovich. El legislador más rico del país se queda sin fueros y lo acorrala la Justicia,https://www.clarin.com/especiales/caida-alperovich-queda-fueros-acorrala-justicia-denuncias-abuso_0_qzHnl8JmC.html,https://images.clarin.com/2021/10/29/wHW65Lf-7_720x0__1.jpg
45,WZbuqmI90,Liga Profesional. Racing no hizo pie con Colón y volvió a perder en el Cilindro de Avellaneda,https://www.clarin.com/deportes/racing-vs-colon-por-la-liga-profesional-de-futbol-volvio-perder-no-hace-pie_0_WZbuqmI90.html,https://images.clarin.com/2021/11/21/b_kKDILnW_720x0__1.jpg
46,Xz_mIUm1m,"Premier League. El Leeds de Bielsa no aguantó, perdió con Tottenham y sigue en el fondo",https://www.clarin.com/deportes/leeds-united-marcelo-bielsa-aguanto-perdio-tottenham-sigue-fondo-tabla-premier-league_0_Xz_mIUm1m.html,https://images.clarin.com/2021/11/21/_8AiCBvKj_720x0__1.jpg
47,-C1r-eXKP,El misterio de Peng Shuai. Apareció la tenista china que denunció abusos de un ex viceministro: qué dijo,https://www.clarin.com/deportes/aparecio-peng-shuai-comunico-traves-videollamada-thomas-bach-presidente-coi-dijo-bien-_0_-C1r-eXKP.html,https://images.clarin.com/2021/11/21/U1kRG3cSs_720x0__1.jpg
48,GVcK_Oavb,Los Pumas. Tomás Lavanini vio la tarjeta roja contra Irlanda y alcanzó un récord que nadie quiere tener,https://www.clarin.com/deportes/lavanini-jugador-expulsado-pumas_0_GVcK_Oavb.html,https://images.clarin.com/2021/11/21/JApIPpPUpg_720x0__1.jpg
49,S9w0zmkck,Francia. Un jugador de Sampaoli recibió un botellazo en la cabeza: partido suspendido,https://www.clarin.com/deportes/francia-jugador-jorge-sampaoli-recibio-botellazo-cabeza-suspendieron-partido-lyon-marsella_0_S9w0zmkck.html,https://images.clarin.com/2021/11/21/2xA-qvXIt_720x0__1.jpg
50,jDC57n2aK,Fórmula 1 en Qatar. Hamilton ganó de punta a punta y acortó distancias con Verstappen,https://www.clarin.com/deportes/formula-1-gran-premio-qatar-hamilton-gano-verstappen-recupero-sancion-alonso-brillo-tercero-red-bull-mercedes-alpine_0_jDC57n2aK.html,https://images.clarin.com/2021/11/21/ppuqWVGfK_720x0__1.jpg
51,M3SgqMfyq,Medida en evaluación. Feletti no descartó más retenciones a las exportaciones de carne y otros alimentos para frenar la inflación,https://www.clarin.com/economia/roberto-feletti-descarto-subir-retenciones-exportaciones-carne-alimentos-frenar-aumentos-precios_0_M3SgqMfyq.html,https://images.clarin.com/2021/10/29/GcatnnRwX_720x0__1.jpg
52,oehMEW6U1,Foco económico. Dólar y devaluación: la estrategia del aguante entra en zona de definición,https://www.clarin.com/economia/dolar-devaluacion-estrategia-aguante-entra-zona-definicion_0_oehMEW6U1.html,https://images.clarin.com/2021/11/20/j2njpH_gN_720x0__1.jpg
53,bULDEGqdn,Negociación de la deuda. ¿Gana la Argentina si firma con el FMI un año más tarde?,https://www.clarin.com/economia/-gana-argentina-firma-fmi-ano-tarde-_0_bULDEGqdn.html,https://images.clarin.com/2020/09/25/jBbGb_0rv_1256x620__2.jpg#1637453197647
54,QpgMU6H0p,Economía de No Ficción. Macri y su recuerdo de Menem en plena corrida: el dólar fijo para jugar al golf,https://www.clarin.com/economia/economia-de-no-ficcion/macri-recuerdo-menem-plena-corrida-tener-dolar-fijo-ir-jugar-golf_0_QpgMU6H0p.html,https://images.clarin.com/2021/11/20/CEiFcSvsz_1256x620__2.jpg#1637437494244
55,7tLmo2dAL,Postpandemia. Mercado laboral: hay récord de monotributistas y de empleados públicos,https://www.clarin.com/economia/mercado-laboral-post-pandemia-record-monotributistas-empleados-publicos_0_7tLmo2dAL.html,https://images.clarin.com/2018/11/07/ECsJAMQ4k_720x0__1.jpg
56,jfFAlVqBt,Energía. El Gobierno interviene en las exportaciones de gas para hacer un canje con Chile,https://www.clarin.com/economia/gobierno-interviene-exportaciones-gas-hacer-canje-chile_0_jfFAlVqBt.html,https://images.clarin.com/2021/11/19/XIbNGYYtO_720x0__1.jpg
