n,id,title,url,image
1,2B6F8T5nf,Falta de segundas dosis. Componente 2 de la Sputnik V: crónica de una muerte anunciada hace 164 días en Rusia,https://www.clarin.com/sociedad/componente-2-sputnik-v-cronica-muerte-anunciada-hace-164-dias-rusia_0_2B6F8T5nf.html,https://images.clarin.com/2021/06/24/TUmUNS6ZI_720x0__1.jpg
2,PBL3OnQsr,Coronavirus. Delta y Delta Plus: qué sabe realmente la ciencia sobre las nuevas variantes,https://www.clarin.com/sociedad/delta-delta-plus-sabe-realmente-ciencia-nuevas-variantes-covid_0_PBL3OnQsr.html,https://images.clarin.com/2020/05/05/9ypg4Ge4f_720x0__1.jpg
3,4rp3rzUHE,Con Macri y Larreta. Juntos por el Cambio se mostró unido pero igual tendría internas,https://www.clarin.com/politica/mauricio-macri-horacio-rodriguez-larreta-buscaron-bajar-tension-listas_0_4rp3rzUHE.html,https://images.clarin.com/2021/06/23/JEfdarjMm_720x0__1.jpg
4,VADxcQ3My,"Escenario. ""Que parezca un accidente"", la tarea más difícil para el frente opositor",https://www.clarin.com/politica/-parezca-accidente-tarea-dificil-cumplir-juntos-cambio_0_VADxcQ3My.html,https://images.clarin.com/2021/06/23/a-katAdMM_720x0__1.jpg
5,QTssUIA1w,Miami. Se derrumbó un edificio: hay tres argentinos desaparecidos,https://www.clarin.com/mundo/derrumbo-parte-edificio-miami_0_QTssUIA1w.html,https://images.clarin.com/2021/06/24/Maql3ZOzj_720x0__1.jpg
6,Crwe1oc8C,Construido en 1981. Cómo era el lujoso edificio de 12 pisos que colapsó en Miami,https://www.clarin.com/mundo/lujoso-edificio-12-pisos-derrumbo-miami_0_Crwe1oc8C.html,https://images.clarin.com/2021/06/24/l1hxneuJv_720x0__1.jpg
7,0QpLJmbIN,Sigue el rescate. Así fue el momento del derrumbe en el complejo de torres,https://www.clarin.com/mundo/momento-derrumbe-edificio-miami_0_0QpLJmbIN.html,https://images.clarin.com/2021/06/24/43taiWJb9_720x0__1.jpg
8,0R-ujE3t1,Del editor. Cristina pidió un fallo a medida y se lo dieron,https://www.clarin.com/opinion/justicia-delivery-cristina-pidio-fallo-medida-dieron_0_0R-ujE3t1.html,https://images.clarin.com/2021/06/14/L5lzTB_Wp_720x0__1.jpg
9,ZgGkZoagh,Mercado de trabajo. Qué piden y cuánto pagan las 10 grandes empresas que están buscando personal,https://www.clarin.com/economia/10-grandes-empresas-buscando-personal-argentina-piden-pagan_0_ZgGkZoagh.html,https://images.clarin.com/2021/04/23/2hDNHGgJf_720x0__1.jpg
10,bkV3cz2EZ,"McAfee fue hallado muerto. La alocada vida del rey del antivirus: armas, drogas, prostitutas y un crimen",https://www.clarin.com/tecnologia/alocada-vida-john-mcafee-armas-drogas-prostitutas-evasion-fiscal-crimen-resolver_0_bkV3cz2EZ.html,https://images.clarin.com/2021/06/23/kEYl2Bmtd_720x0__1.jpg
11,RHTCkH946,A 21 años de su muerte. Las últimas horas de Rodrigo y la foto que no se pudo conseguir,https://www.clarin.com/especiales/21-anos-muerte-rodrigo-ultimas-horas-potro-foto-pudo-conseguir_0_RHTCkH946.html,https://images.clarin.com/2019/06/27/cFerHu_k9_720x0__1.jpg
12,RUR-8QT5A,"Alerta. Confiaron en las vacunas chinas, pero ahora sufren rebrotes",https://www.clarin.com/new-york-times-international-weekly/confiaron-vacunas-chinas-ahora-sufren-rebrotes_0_RUR-8QT5A.html,https://images.clarin.com/2021/06/23/3QWcWOL-T_1256x620__2.jpg#1624452508674
13,2B6F8T5nf,Falta de segundas dosis. Componente 2 de la Sputnik V: crónica de una muerte anunciada hace 164 días en Rusia,https://www.clarin.com/sociedad/componente-2-sputnik-v-cronica-muerte-anunciada-hace-164-dias-rusia_0_2B6F8T5nf.html,https://images.clarin.com/2021/06/24/TUmUNS6ZI_720x0__1.jpg
14,PBL3OnQsr,Coronavirus. Delta y Delta Plus: qué sabe realmente la ciencia sobre las nuevas variantes,https://www.clarin.com/sociedad/delta-delta-plus-sabe-realmente-ciencia-nuevas-variantes-covid_0_PBL3OnQsr.html,https://images.clarin.com/2020/05/05/9ypg4Ge4f_720x0__1.jpg
15,4rp3rzUHE,Con Macri y Larreta. Juntos por el Cambio se mostró unido pero igual tendría internas,https://www.clarin.com/politica/mauricio-macri-horacio-rodriguez-larreta-buscaron-bajar-tension-listas_0_4rp3rzUHE.html,https://images.clarin.com/2021/06/23/JEfdarjMm_720x0__1.jpg
16,VADxcQ3My,"Escenario. ""Que parezca un accidente"", la tarea más difícil para el frente opositor",https://www.clarin.com/politica/-parezca-accidente-tarea-dificil-cumplir-juntos-cambio_0_VADxcQ3My.html,https://images.clarin.com/2021/06/23/a-katAdMM_720x0__1.jpg
17,QTssUIA1w,Miami. Se derrumbó un edificio: hay tres argentinos desaparecidos,https://www.clarin.com/mundo/derrumbo-parte-edificio-miami_0_QTssUIA1w.html,https://images.clarin.com/2021/06/24/Maql3ZOzj_720x0__1.jpg
18,Crwe1oc8C,Construido en 1981. Cómo era el lujoso edificio de 12 pisos que colapsó en Miami,https://www.clarin.com/mundo/lujoso-edificio-12-pisos-derrumbo-miami_0_Crwe1oc8C.html,https://images.clarin.com/2021/06/24/l1hxneuJv_720x0__1.jpg
19,0QpLJmbIN,Sigue el rescate. Así fue el momento del derrumbe en el complejo de torres,https://www.clarin.com/mundo/momento-derrumbe-edificio-miami_0_0QpLJmbIN.html,https://images.clarin.com/2021/06/24/43taiWJb9_720x0__1.jpg
20,0R-ujE3t1,Del editor. Cristina pidió un fallo a medida y se lo dieron,https://www.clarin.com/opinion/justicia-delivery-cristina-pidio-fallo-medida-dieron_0_0R-ujE3t1.html,https://images.clarin.com/2021/06/14/L5lzTB_Wp_720x0__1.jpg
21,k8jceaISt,"Los 34 de Messi. Otra vez vestido de Selección, otra vez los mismos sueños",https://www.clarin.com/deportes/messi-cumpleanos_0_k8jceaISt.html,https://images.clarin.com/2021/06/23/50AoQEJUM_720x0__1.jpg
22,-IfTHT5AB,Copa América. La Conmebol explicó el polémico fallo de Pitana en la victoria de Brasil,https://www.clarin.com/deportes/conmebol-explico-video-polemico-fallo-nestor-pitana-victoria-brasil_0_-IfTHT5AB.html,https://images.clarin.com/2021/06/24/atZzxh3PN_720x0__1.jpg
23,NEbz0VkBI,Juegos Olímpicos. Santiago Lange y Cecilia Carranza serán los abanderados argentinos,https://www.clarin.com/deportes/santiago-lange-cecilia-carranza-abanderados-argentinos-juegos-olimpicos-tokio_0_NEbz0VkBI.html,https://images.clarin.com/2021/06/23/47nmGLFFf_1256x620__2.jpg#1624490426768
24,TTJPjUd0r,A 35 años. El gol de Maradona a Inglaterra: qué se habló la noche previa y dónde está la camiseta del 10,https://www.clarin.com/deportes/35-anos-gol-maradona-inglaterra-hablo-noche-previa-camiseta-10_0_TTJPjUd0r.html,https://images.clarin.com/2020/04/17/bHBrJn4Wc_1256x620__2.jpg#1624479091269
25,jueUyc4F9,"2-2 ante Francia. Cristiano Ronaldo, doblete y otro récord para hacer historia",https://www.clarin.com/deportes/cristiano-ronaldo-record-maximo-goleador-selecciones_0_jueUyc4F9.html,https://images.clarin.com/2021/06/23/mBe50O7QR_720x0__1.jpg
26,uWLrvRFAV,"Eurocopa. Así quedaron los cruces de octavos de final, con un duelo histórico",https://www.clarin.com/deportes/eurocopa-2020-quedaron-cruces-octavos-final-duelo-historico_0_uWLrvRFAV.html,https://images.clarin.com/2021/06/23/Y3gRnXn7V_720x0__1.jpg
27,0h0NOvaYV,Fórmula 1. Qué le pasó a Ferrari en su peor fin de semana de la temporada,https://www.clarin.com/deportes/formula-1-paso-ferrari-peor-fin-semana-temporada_0_0h0NOvaYV.html,https://images.clarin.com/2021/06/20/8O2RW-QhWh_720x0__1.jpg
28,YJs_x1TOK,Tras bajarse de Tokio. Cómo sigue el futuro de Del Potro y cuál es su verdadero sueño,https://www.clarin.com/deportes/bajarse-tokio-2020-sigue-futuro-potro-verdadero-sueno_0_YJs_x1TOK.html,https://images.clarin.com/2020/07/20/TnjHXL6X6_1256x620__2.jpg#1624472781416
29,RHE2Nu70u,"Por los pasillos. La decisión de CFK, consejos para Alberto F. y el publicista de Manes",https://www.clarin.com/politica/l_0_RHE2Nu70u.html,https://images.clarin.com/2021/06/15/rg5CXFh-o_1256x620__3.jpg#1624459249421
30,CS082bjw5,"En vivo, desde las 11. Billeteras virtuales, QR, procesamiento de pagos: lo que viene en dinero digital",https://www.clarin.com/economia/billeteras-virtuales-qr-procesamiento-pagos-mundo-viene-dinero-digital_0_CS082bjw5.html,https://images.clarin.com/2021/06/23/HI128SLH9_720x0__1.jpg
31,L-7ENE-We,Nueva encuesta. Ranking incómodo: quiénes son los 8 gobernadores con peor imagen del país,https://www.clarin.com/politica/ranking-incomodo-8-gobernadores-peor-imagen-pais_0_L-7ENE-We.html,https://images.clarin.com/2020/01/25/EoOXomO7_720x0__1.jpg
32,aIlS0Fa8m,Habló del dólar. Qué dijo Guzmán sobre la chance de una devaluación tras las elecciones,https://www.clarin.com/economia/martin-guzman-expectativa-devaluacion-luego-elecciones-_0_aIlS0Fa8m.html,https://images.clarin.com/2021/06/23/K_YV0oqvW_720x0__1.jpg
33,VLY8yO-19,"""Tiros al aire"". La Cámpora sale a bajarle el pulgar a la estatización de la Hidrovía",https://www.clarin.com/politica/-balas-perdidas-tiros-aire-cristinismo-toma-distancia-reclamos-estatizar-hidrovia_0_VLY8yO-19.html,https://images.clarin.com/2020/08/28/I-EJV_9b0_720x0__1.jpg
34,_lE0q3MFt,Impuestos. Monotributo: la AFIP prorrogó el pago de junio y dio nueva fecha,https://www.clarin.com/economia/monotributo-afip-prorrogo-pago-junio-dio-nueva-fecha_0__lE0q3MFt.html,https://images.clarin.com/2021/04/26/ZGV-9LFhL_720x0__1.jpg
35,eDEJVcz1R,"Boletín Oficial. Recompensa de $5 millones por “Dumbo”, el narco más buscado del país",https://www.clarin.com/policiales/gobierno-ofrecio-recompensa-5-millones-dumbo-narco-buscado-pais_0_eDEJVcz1R.html,https://images.clarin.com/2021/05/21/TUAaSy7EQ_720x0__1.jpg
36,c2wSi3Ltk,Medida judicial. Suspenden el DNU de telecomunicaciones para DirecTV y Telecentro,https://www.clarin.com/politica/justicia-suspende-dnu-telecomunicaciones-telecentro-directv_0_c2wSi3Ltk.html,https://images.clarin.com/2021/06/07/XJg8CuoWe_720x0__1.jpg
37,4zkcLUuo1,Patagonia. Todo listo en La Trochita para la temporada de invierno,https://www.clarin.com/viajes/listo-trochita-temporada-invierno_0_4zkcLUuo1.html,https://images.clarin.com/2021/06/21/QNkG7nTiM_720x0__1.jpg
38,WJKnEorJ8,"Meriendas clásicas. Tortas fritas, churros, rosquitas y más: 17 recetas fáciles para el mate",https://www.clarin.com/gourmet/tortas-fritas--churros--rosquitas-17-recetas-faciles-mate_0_WJKnEorJ8.html,https://images.clarin.com/2021/06/23/fxOGMbF8U_720x0__1.jpg
39,X8xYEtXxB,"En julio y agosto. Guía para hacer cumbre en el omnipresente monte Fuji, alma de Japón",https://www.clarin.com/viajes/guia-hacer-cumbre-omnipresente-monte-fuji-alma-japon_0_X8xYEtXxB.html,https://images.clarin.com/2020/10/23/yws8R1XAm_720x0__1.jpg
40,OmD0TbSpJ,Corazón. Hallan beneficios en comer un puñado de ciruelas pasas por día,https://www.clarin.com/buena-vida/hallan-beneficios-comer-punado-ciruelas-pasas-dia_0_OmD0TbSpJ.html,https://images.clarin.com/2021/06/23/3Xzm5xS8v_720x0__1.jpg
41,1VqhcnqYo,Riesgos. ¿Se puede volver a congelar un alimento sacado del freezer?,https://www.clarin.com/buena-vida/-puede-volver-congelar-alimento-sacado-freezer-_0_1VqhcnqYo.html,https://images.clarin.com/2021/06/23/3ZsrnPHvR_720x0__1.jpg
42,2y1r2AnMw,¿Todo por un like?. Qué hacen los adolescentes en su búsqueda por ser populares en la web,https://www.clarin.com/familias/-like-hacen-adolescentes-busqueda-populares-web_0_2y1r2AnMw.html,https://images.clarin.com/2021/06/21/AIhSOb-qW_720x0__1.jpg
43,MEQsfZmms,"Lenguaje compartido. ""Familecto"": la complicidad del idioma del hogar",https://www.clarin.com/familias/-familecto-complicidad-idioma-hogar_0_MEQsfZmms.html,https://images.clarin.com/2021/06/16/Q9Rv2PUOg_720x0__1.jpg
44,9uQ8sbCsC,Astro Guía. Luna llena en Capricornio de junio 2021: los efectos sobre cada signo,https://www.clarin.com/internacional/luna-llena-capricornio-junio-2021-efectos-signo-zodiaco_0_9uQ8sbCsC.html,https://images.clarin.com/2021/06/23/zY5GARhkz_720x0__1.jpg
45,_vBthvWG7,En Polonia. Una red de túneles en un volcán ocultaría secretos nazis,https://www.clarin.com/viste/red-tuneles-volcan-polonia-ocultaria-secretos-alemania-nazi_0__vBthvWG7.html,https://images.clarin.com/2016/08/12/B1l3UakR7l_720x0.jpg
46,92JKj5Tuj,Japón. Venden casas de 7 habitaciones con jardín a 500 dólares: ¿cómo funciona esta nueva tendencia?,https://www.clarin.com/internacional/japon-venden-casas-7-habitaciones-jardin-500-dolares-funciona-nueva-tendencia-_0_92JKj5Tuj.html,https://images.clarin.com/2021/06/23/0K49ow_Vj_720x0__1.jpg
47,f8AZoVf_u,"Vivía en EE.UU.. Fingió ser una ama de casa aburrida, pero en realidad era una espía rusa de la KGB",https://www.clarin.com/viste/fingio-aburrida-ama-casa-clase-media-realidad-espia-rusa-kgb_0_f8AZoVf_u.html,https://images.clarin.com/2021/06/22/GhFKXKgAH_720x0__1.jpg
48,WSip-xtZh,"Simo Hayha. ""La muerte blanca"", el francotirador más letal de la Segunda Guerra Mundial",https://www.clarin.com/internacional/llamaban-muerte-blanca-simo-hayha-francotirador-letal-segunda-guerra-mundial_0_WSip-xtZh.html,https://images.clarin.com/2021/06/18/t21ZzTA32_1256x620__2.jpg#1624005482119
49,4E9cKg2zn,A 35 años. Tragedia del Challenger: se supo cómo murieron los tripulantes,https://www.clarin.com/viste/supo-verdad-tripulantes-challenger-murieron-explosion-estrellarse-oceano_0_4E9cKg2zn.html,https://images.clarin.com/2021/06/21/4z6LkRZvY_720x0__1.jpg
50,IbzteJOO1,"Educación sexual. ""El koala exprimidor"": la guía de sexo explícito que generó debate en Noruega",https://www.clarin.com/internacional/-koala-exprimidor-guia-sexo-explicito-genero-debate-noruega_0_IbzteJOO1.html,https://images.clarin.com/2021/06/17/cICfDLOpr_720x0__1.jpg
51,7Qsf6cyU7,El canciller se defiende. Solá dijo que desde afuera no se pueden objetar las leyes electorales de los países,https://www.clarin.com/politica/felipe-sola-defiende-criticas-dice-advirtio-nicaragua-violaciones-derechos-humanos_0_7Qsf6cyU7.html,https://images.clarin.com/2021/06/16/NkSCoKEe8_720x0__1.jpg
52,bLlxaCXuo,Puerto Deseado. Una joven se quitó la vida y su familia denuncia que fue por un abuso hace dos años,https://www.clarin.com/sociedad/puerto-deseado-adolescente-quito-vida-familia-denuncia-abuso-sufrio-hace-anos_0_bLlxaCXuo.html,https://images.clarin.com/2021/06/23/t2n7eZVvT_720x0__1.jpg
53,tTEGhOKaI,Copa América. Brasil gritó al final con un polémico arbitraje de Pitana,https://www.clarin.com/deportes/brasil-vs-colombia-copa-america-minuto-minuto-directo_0_tTEGhOKaI.html,https://images.clarin.com/2021/06/23/Zr3nme7AN_720x0__1.jpg
54,NgvZI5hFt,Paso a paso. Dónde vender la ropa que ya no usás y cómo ganar un dinero extra,https://www.clarin.com/servicios/vender-ropa-usas-ganar-dinero-extra_0_NgvZI5hFt.html,https://images.clarin.com/2021/06/23/iQXMltAEH_720x0__1.jpg
55,dPtt5zlRp,Polémica. Empieza a regir hoy la expropiación de terrenos en Avellaneda,https://www.clarin.com/ciudades/expropiacion-terrenos-avellaneda-empieza-regir-jueves-oposicion-denuncia-inconstitucional_0_dPtt5zlRp.html,https://images.clarin.com/2021/06/23/MP3LPIbiO_720x0__1.jpg
56,eLff37pzM,En Caballito. Ataque de furia en una concesionaria: un hombre se enojó y destrozó un 0 km,https://www.clarin.com/sociedad/ataque-furia-concesionaria-caballito-hombre-enojo-destrozo-auto-0-km_0_eLff37pzM.html,https://images.clarin.com/2021/06/24/_TKWJW4PY_720x0__1.jpg
57,p97noF2Rq5,Viajar en pandemia. Otra aerolínea suspende sus vuelos a Buenos Aires por falta de reglas claras,https://www.clarin.com/viajes/falta-prevision-reglas-claras-aerolinea-suspende-vuelos-buenos-aires_0_p97noF2Rq5.html,https://images.clarin.com/2021/03/02/RuvGAuZpg_720x0__1.jpg
58,cevnNRPT_,Por el cobre. Hay monedas que valen 3 veces más por su peso que por su valor nominal,https://www.clarin.com/economia/monedas-valen-3-veces-peso-valor-nominal_0_cevnNRPT_.html,https://images.clarin.com/2021/06/24/yyw35kB7G_720x0__1.jpg
59,E5EzxpsYl,"Una carrera de triatlón. Estaba por ganar, festejó antes y se hizo viral: ""Fue el mejor segundo puesto de la historia""",https://www.clarin.com/viste/estaba-por-ganar-una-carrera-festejo-antes-y-se-hizo-viral-fue-el-mejor-segundo-puesto-de-la-historia-aud1enc14-j0v3n_0_E5EzxpsYl.html,https://images.clarin.com/2021/06/23/kjpvdSxP9_720x0__1.jpg
60,JxXcf7hj0,Copa América vs Eurocopa. El juego de las diferencias entre los dos torneos continentales,https://www.clarin.com/deportes/copa-america-vs-eurocopa-juego-diferencias-torneos-continentales-importantes-mundo_0_JxXcf7hj0.html,https://images.clarin.com/2021/06/23/MM97S1XnN_720x0__1.jpg
61,S_BntFobw,"Sueño de muchos. Trabajar probando videojuegos: cómo ser ""tester"" y cuánto se gana",https://www.clarin.com/servicios/trabajar-probando-videojuegos-estudiar-tester-oficio-gana_0_S_BntFobw.html,https://images.clarin.com/2021/06/23/dyw4zjew4_720x0__1.jpg
62,ffoIWvLK0,"""A tomar la leeeche"". Cómo nació y creció El Capitán Piluso, la versión más tierna de Olmedo",https://www.clarin.com/espectaculos/tv/nacio-crecio-capitan-piluso--version-tierna-alberto-olmedo_0_ffoIWvLK0.html,https://images.clarin.com/2021/06/23/sSsMPa7Rw_720x0__1.jpg
63,hlFYWeOvO,Efecto cuarentena. Ya son más de la mitad los chicos a quienes no les leen cuentos en sus casas,https://www.clarin.com/sociedad/efecto-pandemia-mitad-chicos-leen-cuentos-impacta-educacion_0_hlFYWeOvO.html,https://images.clarin.com/2021/06/24/9QhrKK-40_720x0__1.jpg
64,9boSN4Cxg,"Psicología. Segunda ola de Covid: cómo evitar la ""depresión reactiva""",https://www.clarin.com/buena-vida/segunda-ola-coronavirus-evitar-depresion-reactiva-_0_9boSN4Cxg.html,https://images.clarin.com/2021/06/21/ganXyc7pg_720x0__1.jpg
65,T0-ugZjG7,Furor. Efecto pandemia: kilos de más y atracón de dietas por las redes,https://www.clarin.com/viva/efecto-pandemia-kilos-atracon-dietas-redes_0_T0-ugZjG7.html,https://images.clarin.com/2021/06/23/pIBn8fgGB_720x0__1.jpg
66,mtTZddPNg,Temporada de nieve. Vacaciones de invierno: la Patagonia busca recibir turistas extranjeros,https://www.clarin.com/viajes/vacaciones-invierno-patagonia-busca-recibir-turistas-extranjeros_0_mtTZddPNg.html,https://images.clarin.com/2015/03/15/rkeX1EQA7e_720x0.jpg
67,tGIbEhOBG,Citroën Méhari. A 50 años del lanzamiento del gran aventurero argentino,https://www.clarin.com/autos/citroen-mehari-50-anos-lanzamiento-gran-aventurero-argentino_0_tGIbEhOBG.html,https://images.clarin.com/2021/06/23/lJalNI9SM_720x0__1.jpg
