n,id,title,url,image
1,kmeT6sGUx,Copa América. Argentina le ganó a Colombia en los penales y jugará una final soñada contra Brasil,https://www.clarin.com/deportes/futbol-internacional/argentina-vs-colombia-lugar-final-copa-america-frente-brasil-formaciones-tv-minuto-minuto_0_kmeT6sGUx.html,https://images.clarin.com/2021/07/07/kgfIQMsBe_720x0__1.jpg
2,l55Unjyj-,"A lo Goyco. Dibu Martínez, el héroe: tapó tres penales y puso a Argentina en la final",https://www.clarin.com/deportes/dibu-martinez-heroe-seleccion-tapo-penales-puso-argentina-final_0_l55Unjyj-.html,https://images.clarin.com/2021/07/07/kgfIQMsBe_720x0__1.jpg
3,fFalNnA_a,Para agendar. Qué día y dónde se jugará la final de la Copa América ante Brasil,https://www.clarin.com/deportes/futbol/dia-juega-final-copa-america_0_fFalNnA_a.html,https://images.clarin.com/2021/07/07/q0jPi2KHV_720x0__1.jpg
4,XFMoev7Di,"La emoción de Messi. ""Todos saben que lo que quiero es ganar algo con la Selección""",https://www.clarin.com/deportes/emocion-lionel-messi-ganarle-colombia-penales-saben-quiero-ganar-seleccion-_0_XFMoev7Di.html,https://images.clarin.com/2021/07/07/1VUXLoV18_720x0__1.jpg
5,09_TXEd1Q,Dura patada. La plancha de Fabra que dejó a Messi sangrando,https://www.clarin.com/deportes/plancha-frank-fabra-lionel-messi-paralizo-corazones-argentinos_0_09_TXEd1Q.html,https://images.clarin.com/2021/07/06/bU1syPDME_720x0__1.jpg
6,5E0WzyXl3,Restricción de vuelos. Quedan 14 mil varados en el exterior y el Gobierno no define cuándo volverán,https://www.clarin.com/sociedad/gobierno-convoco-representantes-aerolineas-extranjeras-restriccion-vuelos_0_5E0WzyXl3.html,https://images.clarin.com/2021/07/06/krq76o7Ow_720x0__1.jpg
7,5raF4SyMQ,Del editor. Migraciones aprieta a los que vuelven,https://www.clarin.com/opinion/migraciones-aprieta-vuelven_0_5raF4SyMQ.html,https://images.clarin.com/2021/07/06/_3uq7oqY1_720x0__1.jpg
8,sPb8HgG3s,Informe judicial. Vacunatorio VIP: el Posadas aplicó 385 dosis de manera irregular,https://www.clarin.com/politica/informe-judicial-certifica-hospital-posadas-aplico-385-vacunas-personas-registradas-personal-salud_0_sPb8HgG3s.html,https://images.clarin.com/2021/06/04/Hh2dqTWwS_720x0__1.jpg
9,T-XS7n5Br,Sputnik V. Guía contra la angustia para adultos mayores que esperan la segunda dosis,https://www.clarin.com/sociedad/guia-angustia-adultos-mayores-esperan-segunda-dosis-sputnik-v_0_T-XS7n5Br.html,https://images.clarin.com/2021/04/20/9sU5ljQuT_720x0__1.jpg
10,uPod_Vk-w,En foco. La urgencia del kirchnerismo para subir a Macri al ring de la campaña,https://www.clarin.com/opinion/kirchnerismo-busca-subir-mauricio-macri-ring-campana_0_uPod_Vk-w.html,https://images.clarin.com/2021/07/06/znNqtuOqw_720x0__1.jpg
11,O-m1BwnMT,Especial. L-Gante: qué tiene en la cabeza el pibe del Conurbano que provoca y suena en el mundo,https://www.clarin.com/especiales/48-horas-l-gante-rapero-revoluciona-villas-hace-bailar-ricos-famosos-anima-fiestas-clandestinas_0_O-m1BwnMT.html,https://images.clarin.com/2021/07/02/NdREIuV9g_720x0__1.jpg
12,kmeT6sGUx,Copa América. Argentina le ganó a Colombia en los penales y jugará una final soñada contra Brasil,https://www.clarin.com/deportes/futbol-internacional/argentina-vs-colombia-lugar-final-copa-america-frente-brasil-formaciones-tv-minuto-minuto_0_kmeT6sGUx.html,https://images.clarin.com/2021/07/07/kgfIQMsBe_720x0__1.jpg
13,l55Unjyj-,"A lo Goyco. Dibu Martínez, el héroe: tapó tres penales y puso a Argentina en la final",https://www.clarin.com/deportes/dibu-martinez-heroe-seleccion-tapo-penales-puso-argentina-final_0_l55Unjyj-.html,https://images.clarin.com/2021/07/07/kgfIQMsBe_720x0__1.jpg
14,fFalNnA_a,Para agendar. Qué día y dónde se jugará la final de la Copa América ante Brasil,https://www.clarin.com/deportes/futbol/dia-juega-final-copa-america_0_fFalNnA_a.html,https://images.clarin.com/2021/07/07/q0jPi2KHV_720x0__1.jpg
15,XFMoev7Di,"La emoción de Messi. ""Todos saben que lo que quiero es ganar algo con la Selección""",https://www.clarin.com/deportes/emocion-lionel-messi-ganarle-colombia-penales-saben-quiero-ganar-seleccion-_0_XFMoev7Di.html,https://images.clarin.com/2021/07/07/1VUXLoV18_720x0__1.jpg
16,09_TXEd1Q,Dura patada. La plancha de Fabra que dejó a Messi sangrando,https://www.clarin.com/deportes/plancha-frank-fabra-lionel-messi-paralizo-corazones-argentinos_0_09_TXEd1Q.html,https://images.clarin.com/2021/07/06/bU1syPDME_720x0__1.jpg
17,5E0WzyXl3,Restricción de vuelos. Quedan 14 mil varados en el exterior y el Gobierno no define cuándo volverán,https://www.clarin.com/sociedad/gobierno-convoco-representantes-aerolineas-extranjeras-restriccion-vuelos_0_5E0WzyXl3.html,https://images.clarin.com/2021/07/06/krq76o7Ow_720x0__1.jpg
18,5raF4SyMQ,Del editor. Migraciones aprieta a los que vuelven,https://www.clarin.com/opinion/migraciones-aprieta-vuelven_0_5raF4SyMQ.html,https://images.clarin.com/2021/07/06/_3uq7oqY1_720x0__1.jpg
19,sPb8HgG3s,Informe judicial. Vacunatorio VIP: el Posadas aplicó 385 dosis de manera irregular,https://www.clarin.com/politica/informe-judicial-certifica-hospital-posadas-aplico-385-vacunas-personas-registradas-personal-salud_0_sPb8HgG3s.html,https://images.clarin.com/2021/06/04/Hh2dqTWwS_720x0__1.jpg
20,b9lNsXQdx,De su representante. Un goleador del ascenso reveló un estremecedor intento de abuso sexual,https://www.clarin.com/deportes/estremecedor-relato-facundo-diz-intento-abuso-sexual-sufrio-parte-representante_0_b9lNsXQdx.html,https://images.clarin.com/2020/11/17/_BhYv3Zhr_720x0__1.jpg
21,7HE-G-ZOs,Eurocopa. Italia venció en los penales a España y es finalista,https://www.clarin.com/deportes/italia-espana-semifinales-eurocopa-horario-tv-formaciones_0_7HE-G-ZOs.html,https://images.clarin.com/2021/07/06/yXrT28h_c_720x0__1.jpg
22,9Wbvt8CPA,Qué jugador. Las lujosas vacaciones de Cristiano Ronaldo en su yate de 6 millones de euros,https://www.clarin.com/deportes/lujosas-vacaciones-cristiano-ronaldo-yate-6-millones-euros_0_9Wbvt8CPA.html,https://images.clarin.com/2021/07/06/nFdiqDhKs_720x0__1.jpg
23,gOpLPvfIJ,"Crisis del referato. Mientras crece la polémica en el Ascenso, la AFA pierde la batalla judicial con los árbitros",https://www.clarin.com/deportes/crece-polemica-ascenso-afa-pierde-batalla-judicial-arbitros_0_gOpLPvfIJ.html,https://images.clarin.com/2021/07/06/LLWLgRQkw_720x0__1.jpg
24,pN9CjX7qW,"Internada en Santa Fe. La hermana del fallecido futbolista Emiliano Sala, en estado crítico",https://www.clarin.com/deportes/conmocion-santa-fe-hermana-emiliano-sala-encuentra-internada-grave_0_pN9CjX7qW.html,https://images.clarin.com/2021/07/06/rXEzdnVO__1256x620__2.jpg#1625588262254
25,m1mwmyxjM,Extensa entrevista. Gallardo se quejó por el aislamiento y aclaró su deseo de Selección,https://www.clarin.com/deportes/marcelo-gallardo-aislamiento-obligatorio-plantel-river-aclaracion-seleccion-continuidad_0_m1mwmyxjM.html,https://images.clarin.com/2021/05/25/gFMSQ8tlJ_720x0__1.jpg
26,oYO83gOb_,A Inglaterra. Un compañero de Messi se va al Leeds de Bielsa,https://www.clarin.com/deportes/futbol-internacional/junior-firpo-leeds-barcelona-bielsa_0_oYO83gOb_.html,https://images.clarin.com/2021/07/06/WDYqoKAM6_720x0__1.jpg
27,sePjdd9gk,Minuto a minuto. Mercado de pases: todas las altas y bajas de los equipos de la Liga de Fútbol Profesional,https://www.clarin.com/deportes/mercado-pases-71-refuerzos-futbol-argentino_0_sePjdd9gk.html,https://images.clarin.com/2021/06/13/q7d2ydV9u_720x0__1.jpg
28,qbjnBai2s,Adelanto de Clarín. Encuesta en Provincia: empate casi exacto entre el Frente de Todos y Juntos por el Cambio,https://www.clarin.com/politica/nueva-encuesta-provincia-empate-exacto-frente-juntos-cambio_0_qbjnBai2s.html,https://images.clarin.com/2017/10/22/BkhBnm9ab_720x0.jpg
29,IhyotswVI,En Rosario. Descubrió que su marido era gay y pidió anular el matrimonio: la Justicia se lo negó,https://www.clarin.com/sociedad/pidio-anular-matrimonio-descubrio-marido-gay-justicia-dijo_0_IhyotswVI.html,https://images.clarin.com/2021/06/30/pUnhgr3eu_720x0__1.jpg
30,pWhoIHzbz,"La interna opositora. Larreta y Santilli, en el GBA: se mostraron en un acto con peronistas no K",https://www.clarin.com/politica/horacio-rodriguez-larreta-mostro-candidato-diego-santilli-conurbano_0_pWhoIHzbz.html,https://images.clarin.com/2021/07/06/CiTdlc89l_720x0__1.jpg
31,PD1HG1--B,Lo reveló Zannini. El Gobierno sube la apuesta y pedirá la extensión a Socma de la quiebra del Correo,https://www.clarin.com/politica/carlos-zannini-adelanto-gobierno-pedira-extension-quiebra-correo-argentino-socma_0_PD1HG1--B.html,https://images.clarin.com/2021/03/11/b7ZTfxfRQ_720x0__1.jpg
32,vSX2-0pXb,Interna en JxC. El llamativo ofrecimiento de Larreta a Lousteau y los enojos de Bullrich,https://www.clarin.com/politica/interna-juntos-cambio-llamativo-ofrecimiento-rodriguez-larreta-martin-lousteau-enojos-patricia-bullrich_0_vSX2-0pXb.html,https://images.clarin.com/2021/07/04/BhptPNFQn_720x0__1.jpg
33,uN-Z8DoBa,"En Israel. Polémico video de Urribarri en una fiesta: ""Mañana, todos con Covid""",https://www.clarin.com/politica/polemica-redes-video-sergio-urribarri-fiesta-israel-manana-covid-_0_uN-Z8DoBa.html,https://images.clarin.com/2021/07/06/OHXFAK1DR_720x0__1.jpg
34,CFERmx7GV,En Provincia. Convocarán a 1.200 voluntarios: probarán seis combinaciones de vacunas,https://www.clarin.com/sociedad/provincia-convocara-1200-voluntarios-probar-combinaciones-vacunas-covid_0_CFERmx7GV.html,https://images.clarin.com/2021/06/11/X5_ZPsYnP_720x0__1.jpg
35,n0K3G5Pf7,En Plaza de Mayo. Militantes K acampan frente a Casa Rosada para pedir que liberen a Milagro Sala,https://www.clarin.com/politica/arranco-acampe-plaza-mayo-reclamar-liberacion-milagro-sala_0_n0K3G5Pf7.html,https://images.clarin.com/2021/07/06/hOjZ2P3E3_0x750__2.jpg#1625610832303
36,GzJfwjBdU,Guerra de consolas. Nintendo anunció su nueva Switch con pantalla OLED y más almacenamiento,https://www.clarin.com/tecnologia/nintendo-anuncio-nueva-switch-pantalla-oled-capacidad-almacenamiento_0_GzJfwjBdU.html,https://images.clarin.com/2021/07/06/ys-DS-8v2_720x0__1.jpg
37,isvLdO3ob,¿Paciencia o permisividad?. Cinco estrategias para poner límites sin perder la calma,https://www.clarin.com/familias/5-estrategias-poner-limites-perder-calma_0_isvLdO3ob.html,https://images.clarin.com/2021/07/05/MwW9-2gRt_720x0__1.jpg
38,rMgXltEXp,Tesla Cybertruck. Elon Musk confirmó que su pickup eléctrica tendrá dirección en las 4 ruedas,https://www.clarin.com/autos/tesla-cybertruck-elon-musk-confirmo-pickup-electrica-direccion-4-ruedas_0_rMgXltEXp.html,https://images.clarin.com/2021/07/05/lZgzbZ0Of_720x0__1.jpg
39,ltiMZRfqR,Salud cardiovascular. Advierten sobre los efectos de la apnea del sueño en pacientes cardíacos,https://www.clarin.com/buena-vida/advierten-efectos-apnea-sueno-pacientes-cardiacos_0_ltiMZRfqR.html,https://images.clarin.com/2021/06/25/84FKZ4TN5_720x0__1.jpg
40,A_7arU5f5,"Cambio de roles. Cuando nos convertimos en ""padres de nuestros padres""",https://www.clarin.com/familias/cambio-roles-convertimos-padres-padres-_0_A_7arU5f5.html,https://images.clarin.com/2021/07/05/5ljyXN4L6_720x0__1.jpg
41,Dig3QaDq7,"Blockchain. Así es MALa, el primer museo de criptoarte del mundo",https://www.clarin.com/tecnologia/mala-primer-museo-criptoarte-mundo_0_Dig3QaDq7.html,https://images.clarin.com/2021/06/05/cPCIIZ1MD_720x0__1.jpg
42,O1cn-tQre,Tierra del Fuego. El centro de esquí más austral del mundo abrió la temporada 2021,https://www.clarin.com/viajes/centro-esqui-austral-mundo-abrio-temporada-2021_0_O1cn-tQre.html,https://images.clarin.com/2021/07/06/o3dNA03Bl_720x0__1.jpg
43,QEOZ1a7y_,Psico. Conductas adictivas en casa: cómo detectarlas y enfrentarlas,https://www.clarin.com/buena-vida/conductas-adictivas-casa-detectarlas-enfrentarlas_0_QEOZ1a7y_.html,https://images.clarin.com/2021/07/05/N9tFzH_99_720x0__1.jpg
44,qCpyTm07w,Tránsitos claves. Cómo prepararnos para la conjunción de Marte y Venus en Leo,https://www.clarin.com/astrologia/prepararnos-conjuncion-marte-venus-leo_0_qCpyTm07w.html,https://images.clarin.com/2021/07/05/DrOfn1Gkj_720x0__1.jpg
45,6Bl_gyyju,Escándalo. La mansión de 300 habitaciones del presidente de Turquía,https://www.clarin.com/viste/escandalo-nueva-mansion-300-habitaciones-presidente-turquia_0_6Bl_gyyju.html,https://images.clarin.com/2021/07/06/nkOJsHMA1_720x0__1.jpg
46,4EUNbnvzU,Pasión nacional. ¿Cuáles son los quesos más elegidos por los argentinos?,https://www.clarin.com/brandstudio/-quesos-elegidos-argentinos-_0_4EUNbnvzU.html,https://images.clarin.com/2021/03/24/6su1XbrJZ_720x0__1.jpg
47,OcLKRqjJo,Vive en Bélgica. Niño superdotado: tiene 11 años y ya terminó la carrera de Física en 9 meses,https://www.clarin.com/internacional/impactante-historia-nino-superdotado-11-anos-termino-carrera-fisica-9-meses_0_OcLKRqjJo.html,https://images.clarin.com/2019/12/11/4Pggfu6__720x0__1.jpg
48,f-KTo-fxM,Lo reveló el ADN. El crimen de una nena que tardó 35 años en resolverse: fueron sus padres,https://www.clarin.com/viste/crimen-nena-tardo-35-anos-resolverse-adn-revelo-padres_0_f-KTo-fxM.html,https://images.clarin.com/2018/06/12/SyEZs-eWQ_720x0__1.jpg
49,37R5--FDq,"Marca histórica. Tiempo ""loco"": ola de calor en el Ártico con picos de 34 grados",https://www.clarin.com/viste/tiempo-loco-ola-calor-artico-picos-34-_0_37R5--FDq.html,https://images.clarin.com/2021/07/06/0BZh1rHMv_720x0__1.jpg
50,2bVNQ2L5O,"Lo lanzó la NASA. Sojourner, el vehículo que está abandonado en Marte desde hace 24 años",https://www.clarin.com/viste/sojourner-vehiculo-abandonado-marte-hace-24-anos_0_2bVNQ2L5O.html,https://images.clarin.com/2021/07/05/JjHE81Lz-_720x0__1.jpg
51,v2kbhZQsp,Internado en Santa Fe. Crece la preocupación por la salud de Carlos Reutemann,https://www.clarin.com/politica/crece-preocupacion-salud-carlos-reutemann_0_v2kbhZQsp.html,https://images.clarin.com/2021/05/06/trEkjE9b7_720x0__1.jpg
52,v-d_PmBG3,Foco Económico. Se renueva la presión sobre el dólar con la mira en las elecciones,https://www.clarin.com/economia/renueva-presion-dolar-mira-puesta-elecciones_0_v-d_PmBG3.html,https://images.clarin.com/2021/06/23/0eTYm38OE_720x0__1.jpg
53,7hOwJh7qw,"""Sos la más hermosa"". Nahir Galarza y el hijo de un narco ya no ocultan su romance",https://www.clarin.com/policiales/nahir-galarza-hijo-narco-ocultan-romance-amo-amor-sos-hermosa-_0_7hOwJh7qw.html,https://images.clarin.com/2021/07/06/kod6GqhdT_1256x620__2.jpg#1625612160449
54,DNqB8vKW_,Buscan a los autores. Violento robo en un country de Canning: un propietario herido y gran operativo,https://www.clarin.com/policiales/violento-robo-country-canning-propietario-herido-importante-operativo-policial_0_DNqB8vKW_.html,https://images.clarin.com/2021/07/06/ZoRpyE3iV_720x0__1.jpg
55,n6YkGPy61,San Juan. Identifican al hombre que filmó el video de la portera que abusaba de un menor,https://www.clarin.com/sociedad/escandalo-san-juan-justicia-identifico-hombre-filmo-video-portera-abusaba-menor_0_n6YkGPy61.html,https://images.clarin.com/2021/07/06/uRgzuree9_1256x620__2.jpg#1625621765937
56,yrezcPP-G,"Lo contó en TV. Patricia Bullrich: ""Alguna vez armé una molotov, pero ya me olvidé""",https://www.clarin.com/politica/patricia-bullrich-explosiva-alguna-vez-arme-molotov-olvide-_0_yrezcPP-G.html,https://images.clarin.com/2020/07/12/eoQGUDrj6_720x0__1.jpg
57,Rfiw6WZHQ,"Puja por los salarios. Por la inflación, adelantan la revisión de la paritaria de los estatales ",https://www.clarin.com/politica/inflacion-gobierno-adelanto-revision-paritaria-estatales_0_Rfiw6WZHQ.html,https://images.clarin.com/2021/07/06/zkTuDZS0U_720x0__1.jpg
58,BWk6grImC,Cambio de tribunal. Pacto con Irán: la causa pasó a la sala que sobreseyó a CFK por el dólar futuro,https://www.clarin.com/politica/pacto-iran-causa-paso-sala-casacion-sobreseyo-cristina-kirchner-dolar-futuro_0_BWk6grImC.html,https://images.clarin.com/2020/09/07/6uEJnb-BI_720x0__1.jpg
59,D17ptSpzv,"El adiós a la artista italiana. Raffaella Carrà: cómo será su funeral, las indicaciones que dejó y el curioso epitafio",https://www.clarin.com/internacional/espectaculos/funeral-raffaella-carra-ultimos-deseos-cantante-actriz_0_D17ptSpzv.html,https://images.clarin.com/2021/07/06/iDP3bbcwy_720x0__1.jpg
60,G1RKeA4VT,Nuevos tratamientos. La OMS recomienda utilizar dos drogas reumatológicas en casos graves de Covid,https://www.clarin.com/sociedad/tocilizumab-sarilumab-oms-recomienda-utilizar-drogas-reumatologicas-cuadros-graves-covid_0_G1RKeA4VT.html,https://images.clarin.com/2021/02/11/FYdgnY7g-_720x0__1.jpg
61,8ftWAG_Kb,"Horror en avenida Cabildo. “¡Corran, nos disparan!”: a 15 años del brutal ataque del tirador de Belgrano",https://www.clarin.com/policiales/-corran-disparan-15-anos-brutal-ataque-tirador-belgrano_0_8ftWAG_Kb.html,https://images.clarin.com/2021/07/05/2odW0aRhi_1256x620__2.jpg#1625514068598
62,VIs8c-Org,Startup de nanosatélites. El próximo “unicornio”: la empresa argentina que ya vale US$ 850 millones,https://www.clarin.com/economia/satellogic-asocia-fondo-inversion-salir-cotizar-nasdaq_0_VIs8c-Org.html,https://images.clarin.com/2020/08/29/0_-pRWKo7_720x0__1.jpg
63,FOF4uIHmB,"Imposible de soltar. Pop it, el juego de moda: qué es, para qué sirve y cuánto cuesta",https://www.clarin.com/servicios/pop-it-juego-moda-sirve-cuesta_0_FOF4uIHmB.html,https://images.clarin.com/2021/05/17/wLJXfOxZJ_720x0__1.jpg
64,sTNRhRZBF,Inscripción. Abren los créditos Procrear II y Casa Propia: requisitos y cómo anotarse,https://www.clarin.com/servicios/creditos-casa-propia-procrear-ii-abren-inscripcion-requisitos-anotarse_0_sTNRhRZBF.html,https://images.clarin.com/2020/09/09/3abIicCrp_720x0__1.jpg
65,3XRRpKLKd,"Salud masculina. Con 4 hábitos, los hombres pueden vivir más años sin enfermedades",https://www.clarin.com/buena-vida/4-habitos-saludables-hombres-pueden-vivir-tiempo-enfermedades_0_3XRRpKLKd.html,https://images.clarin.com/2021/06/30/n4_dHgr5z_1256x620__2.jpg#1625490388152
66,-tEEQcb9l,A 25 años del estreno. Día de la Independencia: ¿A qué actor querían en lugar de Will Smith?,https://www.clarin.com/espectaculos/cine/dia-independencia-actor-querian-lugar-will-smith-_0_-tEEQcb9l.html,https://images.clarin.com/2021/07/06/1ErOWY7lZ_720x0__1.jpg
67,PwqMQ9Wx8,Apps. Cuál es el emoji secreto que esconde WhatsApp y cómo activarlo,https://www.clarin.com/tecnologia/emoji-secreto-esconde-whatsapp-activarlo_0_PwqMQ9Wx8.html,https://images.clarin.com/2017/12/19/SJkPcRUzz_720x0.jpg
68,D17ptSpzv,"El adiós a la artista italiana. Raffaella Carrà: cómo será su funeral, las indicaciones que dejó y el curioso epitafio",https://www.clarin.com/internacional/espectaculos/funeral-raffaella-carra-ultimos-deseos-cantante-actriz_0_D17ptSpzv.html,https://images.clarin.com/2021/07/06/iDP3bbcwy_720x0__1.jpg
69,G1RKeA4VT,Nuevos tratamientos. La OMS recomienda utilizar dos drogas reumatológicas en casos graves de Covid,https://www.clarin.com/sociedad/tocilizumab-sarilumab-oms-recomienda-utilizar-drogas-reumatologicas-cuadros-graves-covid_0_G1RKeA4VT.html,https://images.clarin.com/2021/02/11/FYdgnY7g-_720x0__1.jpg
70,8ftWAG_Kb,"Horror en avenida Cabildo. “¡Corran, nos disparan!”: a 15 años del brutal ataque del tirador de Belgrano",https://www.clarin.com/policiales/-corran-disparan-15-anos-brutal-ataque-tirador-belgrano_0_8ftWAG_Kb.html,https://images.clarin.com/2021/07/05/2odW0aRhi_1256x620__2.jpg#1625514068598
71,VIs8c-Org,Startup de nanosatélites. El próximo “unicornio”: la empresa argentina que ya vale US$ 850 millones,https://www.clarin.com/economia/satellogic-asocia-fondo-inversion-salir-cotizar-nasdaq_0_VIs8c-Org.html,https://images.clarin.com/2020/08/29/0_-pRWKo7_720x0__1.jpg
72,FOF4uIHmB,"Imposible de soltar. Pop it, el juego de moda: qué es, para qué sirve y cuánto cuesta",https://www.clarin.com/servicios/pop-it-juego-moda-sirve-cuesta_0_FOF4uIHmB.html,https://images.clarin.com/2021/05/17/wLJXfOxZJ_720x0__1.jpg
73,sTNRhRZBF,Inscripción. Abren los créditos Procrear II y Casa Propia: requisitos y cómo anotarse,https://www.clarin.com/servicios/creditos-casa-propia-procrear-ii-abren-inscripcion-requisitos-anotarse_0_sTNRhRZBF.html,https://images.clarin.com/2020/09/09/3abIicCrp_720x0__1.jpg
74,3XRRpKLKd,"Salud masculina. Con 4 hábitos, los hombres pueden vivir más años sin enfermedades",https://www.clarin.com/buena-vida/4-habitos-saludables-hombres-pueden-vivir-tiempo-enfermedades_0_3XRRpKLKd.html,https://images.clarin.com/2021/06/30/n4_dHgr5z_1256x620__2.jpg#1625490388152
75,-tEEQcb9l,A 25 años del estreno. Día de la Independencia: ¿A qué actor querían en lugar de Will Smith?,https://www.clarin.com/espectaculos/cine/dia-independencia-actor-querian-lugar-will-smith-_0_-tEEQcb9l.html,https://images.clarin.com/2021/07/06/1ErOWY7lZ_720x0__1.jpg
76,PwqMQ9Wx8,Apps. Cuál es el emoji secreto que esconde WhatsApp y cómo activarlo,https://www.clarin.com/tecnologia/emoji-secreto-esconde-whatsapp-activarlo_0_PwqMQ9Wx8.html,https://images.clarin.com/2017/12/19/SJkPcRUzz_720x0.jpg
