n,id,title,url,image
1,Sydkfcukb,"Nuevas restricciones. Más cepo al dólar: para los especialistas, las medidas incentivan la especulación y la inflación",https://www.clarin.com/economia/cepo-dolar-especialistas-medidas-incentivan-especulacion-inflacion_0_Sydkfcukb.html,https://images.clarin.com/2021/08/26/SPaBEFkHp_720x0__1.jpg
2,Wq7oI6tD2,"Justicia y política. Con la sorpresiva renuncia de Highton a la Corte Suprema, el Gobierno perdió su único voto",https://www.clarin.com/politica/sorpresiva-renuncia-elena-highton-corte-gobierno-perdio-unico-voto_0_Wq7oI6tD2.html,https://images.clarin.com/2021/10/05/EsM-IAp4-_720x0__1.jpg
3,CxGmOswps,Del editor. Llegó Rosatti y salió Highton: una renuncia por edad y por incomodidad,https://www.clarin.com/opinion/llego-rosatti-salio-highton-renuncia-llega-edad-incomodidad_0_CxGmOswps.html,https://images.clarin.com/2020/08/01/GD548WIwi_720x0__1.jpg
4,UNjcLB0o5,"Salud. Etiquetado: debate por los nutrientes, el azúcar y el huevo Kinder sin sorpresa",https://www.clarin.com/sociedad/etiquetado-frontal-alimentos-debate-nutrientes-azucar-huevo-kinder-sorpresa_0_UNjcLB0o5.html,https://images.clarin.com/2019/05/08/05L2ttXJ3_720x0__1.jpg
5,k_kfjn-Br,"Nueva encuesta porteña. Hasta cuánto podrían crecer  Vidal, Santoro y Milei",https://www.clarin.com/politica/nueva-encuesta-portena-podrian-crecer-maria-eugenia-vidal-leandro-santoro-javier-milei_0_k_kfjn-Br.html,https://images.clarin.com/2021/10/05/zzFIL8_Nz_720x0__1.jpg
6,NTpKJ0zyI,Sin cupo. El Gobierno levanta a partir del 19 de octubre el cepo a los vuelos internacionales,https://www.clarin.com/sociedad/levantan-partir-19-octubre-cepo-vuelos_0_NTpKJ0zyI.html,https://images.clarin.com/2021/09/26/2nwIGWQgF_720x0__1.jpg
7,lmzJLX4e6,Coronavirus. La variante Delta ya está en casi 1 de cada 10 nuevos casos de circulación comunitaria analizados,https://www.clarin.com/sociedad/variante-delta-circulacion-comunitaria-quintuplico-ultimas-semanas_0_lmzJLX4e6.html,https://images.clarin.com/2021/10/03/n5-aj3cHY_720x0__1.jpg
8,EcOjLURJf,Estrategia electoral. Ganar en la derrota: el plan consuelo del oficialismo para la campaña,https://www.clarin.com/politica/-ganar-derrota-discurso-zen-plan-consuelo-oficialismo-campana_0_EcOjLURJf.html,https://images.clarin.com/2021/10/05/PGwHkbcMo_720x0__1.jpg
9,0eIq8V0UH,Tras el apagón. Más revelaciones de la informante que destapó el escándalo de Facebook,https://www.clarin.com/tecnologia/revelaciones-informante-destapo-escandalo-facebook-nadie-sabe-pasa-adentro-_0_0eIq8V0UH.html,https://images.clarin.com/2021/10/05/IuvuhQnQ-_720x0__1.jpg
10,TkM-coj9Z,Alquileres en la Costa. Cuánto piden por casas y departamentos para el verano 2022,https://www.clarin.com/servicios/alquileres-costa-piden-casas-departamentos-verano-2022_0_TkM-coj9Z.html,https://images.clarin.com/2020/02/06/OMWt_J0o_720x0__1.jpg
11,g9r7ZDhWf,"Foco en la Bombonera. Después de los desbordes, cómo serán los controles que se vienen en los estadios",https://www.clarin.com/deportes/desbordes-fecha-pasada-controles-vienen-estadios_0_g9r7ZDhWf.html,https://images.clarin.com/2021/10/03/0i0FpEyMA_1256x620__2.jpg#1633486248451
12,R3bMSHAj5,"¿Qué pasó con el quórum?. La teoría ""conspiranoica"" que corrió en Diputados y a la que el oficialismo tilda de ""pavada""",https://www.clarin.com/politica/teoria-conspiranoica-corrio-diputados-oficialismo-califica-pavada-_0_R3bMSHAj5.html,https://images.clarin.com/2021/10/05/7YBIgzhpX_720x0__1.jpg
13,7RCb_6Uhu,"""Murió por salvarte a vos"". El mensaje de la esposa del rehén asesinado en Caseros a su hijo",https://www.clarin.com/policiales/-murio-salvarte-vos-mensaje-esposa-rehen-asesinado-caseros-hijo_0_7RCb_6Uhu.html,https://images.clarin.com/2021/10/05/0mAsLDUGk_720x0__1.jpg
14,WG6djUVfs,"Absurda muerte y desidia. Sin vereda ni parada, quiso subirse al colectivo y fue atropellada",https://www.clarin.com/zonales/video-absurda-muerte-debido-desidia-gba-vereda-parada-quiso-subirse-colectivo-chofer-atropello_0_WG6djUVfs.html,https://images.clarin.com/2021/10/05/5BNRHLouF_720x0__1.jpg
15,LnOttqs4i,Finanzas personales. Criptomonedas: los 5 errores más comunes que cometen los principiantes y cómo evitarlos,https://www.clarin.com/servicios/criptomonedas-5-errores-comunes-cometen-principiantes-invertir-evitarlos_0_LnOttqs4i.html,https://images.clarin.com/2021/08/14/AIZanGe92_720x0__1.jpg
16,YMQYg2YAw,Bajo la lupa. Batacazos y gigantes a los tropiezos: la Champions ahora permite asombros,https://www.clarin.com/deportes/batacazos-historicos-gigantes-tropiezos-champions-league-ahora-permite-asombros-_0_YMQYg2YAw.html,https://images.clarin.com/2021/09/29/xBzsBQgJF_1256x620__2.jpg#1633482859362
17,zlnNvyCqX,Patrimonio porteño. Polémica y denuncia por obras en la calle Defensa,https://www.clarin.com/ciudades/polemica-obras-calle-defensa-denuncian-cumplen-fallo-preserva-adoquines_0_zlnNvyCqX.html,https://images.clarin.com/2021/10/05/XTX9FHACb_1256x620__2.jpg#1633472867371
18,uoLFCUu_3,Especial Clarín. Volver a empezar: al menos 100 argentinos por día se van del país,https://www.clarin.com/sociedad/volver-empezar-100-argentinos-dia-van-pais_0_uoLFCUu_3.html,https://images.clarin.com/2021/10/01/B5BQs1azI_720x0__1.jpg
19,zCBE5Ga5u,Antes del cierre. Cómo son las exclusivas cenas de despedida del restaurante de Germán Martitegui,https://www.clarin.com/gourmet/cierre-exclusivas-cenas-despedida-restaurante-german-martitegui_0_zCBE5Ga5u.html,https://images.clarin.com/2021/10/05/4LFrMfpeU_720x0__1.jpg
20,OoakPApBV,"Sexo seguro. Adolescentes y sexo en la casa de mamá y papá: ¿""Dejá la puerta abierta""?",https://www.clarin.com/familias/adolescentes-sexo-casa-mama-papa-deja-puerta-abierta-_0_OoakPApBV.html,https://images.clarin.com/2021/09/27/yBt8PcYog_720x0__1.jpg
21,xaU42Cssz,"“Dije buen día y no contestó"". El dramático relato del amigo que encontró muerto a Acero Cali en La Pampa",https://www.clarin.com/deportes/-dije-buen-dia-contesto-dramatico-relato-amigo-encontro-muerto-acero-cali_0_xaU42Cssz.html,https://images.clarin.com/2021/10/05/lHzEeEnK8_1256x620__2.jpg#1633471128538
22,ahfbkQOAP,"Su historia se viralizó. Habla la joven a la que no le dieron trabajo por ""sonreír demasiado"" en la entrevista",https://www.clarin.com/sociedad/-sonreiste-demasiado-entrevista-profesional-motivos-dieron-trabajo_0_ahfbkQOAP.html,https://images.clarin.com/2021/10/02/cxwQLyrHj_720x0__1.jpg
23,G6fV_mlTu,Alimentación. Seis malos hábitos del almuerzo que deberías modificar,https://www.clarin.com/buena-vida/malos-habitos-almuerzo-hacen-mal-salud_0_G6fV_mlTu.html,https://images.clarin.com/2021/10/05/LhEa3N7sv_720x0__1.jpg
24,jJTWCsHOX,"""El club me salvó la vida"". Elton John y el fútbol: revolución en el Watford, salida del clóset y chau drogas",https://www.clarin.com/deportes/revolucion-elton-john-watford-logro-ascenso-meteorico-cambio-vida_0_jJTWCsHOX.html,https://images.clarin.com/2021/08/19/XNsInqm5t_720x0__1.jpg
25,,"Historias visuales. El mundo hoy, en 90 fotos",,
26,iF0Nhmvbk,Estudio sobre las vacunas. Pfizer brinda una protección del 90% contra hospitalizaciones durante 6 meses,https://www.clarin.com/new-york-times-international-weekly/vacuna-pfizer-brinda-proteccion-90-hospitalizaciones-meses_0_iF0Nhmvbk.html,https://images.clarin.com/2021/10/05/IzXMvwuF2_1200x0__2.jpg#1633454578380
27,Ptx6U0u_G,En Internet . Lugares extraños para visitar: un catálogo reescribe historias curiosas,https://www.clarin.com/new-york-times-international-weekly/new-york/lugares-extranos-visitar-catalogo-internet-reescribe-historias-curiosas_0_Ptx6U0u_G.html,https://images.clarin.com/2021/09/30/6YMNG4FQA_720x0__1.jpg
28,8NBAd9Ye3,Contra el covid. Todo lo que hay que saber sobre la nueva píldora para tratar el coronavirus,https://www.clarin.com/new-york-times-international-weekly/saber-nueva-pildora-tratar-coronavirus_0_8NBAd9Ye3.html,https://images.clarin.com/2021/10/02/Sr5-b2Jgw_720x0__1.jpg
29,hXf9Ti3eK,Investigación. Concluyen que personal de la OMS cometió abusos sexuales en el Congo,https://www.clarin.com/new-york-times-international-weekly/new-york/investigacion-concluyo-personal-oms-cometio-abusos-sexuales-congo_0_hXf9Ti3eK.html,https://images.clarin.com/2021/05/28/tmSkFthkh_720x0__1.jpg
30,Sydkfcukb,"Nuevas restricciones. Más cepo al dólar: para los especialistas, las medidas incentivan la especulación y la inflación",https://www.clarin.com/economia/cepo-dolar-especialistas-medidas-incentivan-especulacion-inflacion_0_Sydkfcukb.html,https://images.clarin.com/2021/08/26/SPaBEFkHp_720x0__1.jpg
31,Wq7oI6tD2,"Justicia y política. Con la sorpresiva renuncia de Highton a la Corte Suprema, el Gobierno perdió su único voto",https://www.clarin.com/politica/sorpresiva-renuncia-elena-highton-corte-gobierno-perdio-unico-voto_0_Wq7oI6tD2.html,https://images.clarin.com/2021/10/05/EsM-IAp4-_720x0__1.jpg
32,CxGmOswps,Del editor. Llegó Rosatti y salió Highton: una renuncia por edad y por incomodidad,https://www.clarin.com/opinion/llego-rosatti-salio-highton-renuncia-llega-edad-incomodidad_0_CxGmOswps.html,https://images.clarin.com/2020/08/01/GD548WIwi_720x0__1.jpg
33,UNjcLB0o5,"Salud. Etiquetado: debate por los nutrientes, el azúcar y el huevo Kinder sin sorpresa",https://www.clarin.com/sociedad/etiquetado-frontal-alimentos-debate-nutrientes-azucar-huevo-kinder-sorpresa_0_UNjcLB0o5.html,https://images.clarin.com/2019/05/08/05L2ttXJ3_720x0__1.jpg
34,k_kfjn-Br,"Nueva encuesta porteña. Hasta cuánto podrían crecer  Vidal, Santoro y Milei",https://www.clarin.com/politica/nueva-encuesta-portena-podrian-crecer-maria-eugenia-vidal-leandro-santoro-javier-milei_0_k_kfjn-Br.html,https://images.clarin.com/2021/10/05/zzFIL8_Nz_720x0__1.jpg
35,NTpKJ0zyI,Sin cupo. El Gobierno levanta a partir del 19 de octubre el cepo a los vuelos internacionales,https://www.clarin.com/sociedad/levantan-partir-19-octubre-cepo-vuelos_0_NTpKJ0zyI.html,https://images.clarin.com/2021/09/26/2nwIGWQgF_720x0__1.jpg
36,lmzJLX4e6,Coronavirus. La variante Delta ya está en casi 1 de cada 10 nuevos casos de circulación comunitaria analizados,https://www.clarin.com/sociedad/variante-delta-circulacion-comunitaria-quintuplico-ultimas-semanas_0_lmzJLX4e6.html,https://images.clarin.com/2021/10/03/n5-aj3cHY_720x0__1.jpg
37,xuUJAyOIQ,La historia de Ann Hodges. La única persona en el mundo a la que le cayó encima un meteorito,https://www.clarin.com/internacional/ann-hodges-unica-persona-mundo-cayo-encima-meteorito_0_xuUJAyOIQ.html,https://images.clarin.com/2021/10/02/X_mDmk7AU_1256x620__3.jpg#1633172463047
38,da948z4bv,Joven mendocino. Cosechaba uvas para poder pagar sus estudios y se acaba de recibir de ingeniero,https://www.clarin.com/viste/mendocino-cosechaba-uvas-poder-pagar-estudios-acaba-recibir-ingeniero_0_da948z4bv.html,https://images.clarin.com/2021/10/05/VyyvBWP_q_720x0__1.jpg
39,v_cBDTr8Z,La nueva de James Bond. Sin tiempo para morir no recupera la inversión pese a su éxito internacional,https://www.clarin.com/espectaculos/cine/tiempo-morir-nueva-james-bond-recupera-inversion-pese-exito-internacional_0_v_cBDTr8Z.html,https://images.clarin.com/2021/09/29/Ymit2fpKf_720x0__1.jpg
40,I1dvOhFn0,"Final pautado. Martha, la mujer que festeja que el próximo domingo morirá por eutanasia",https://www.clarin.com/viste/martha-mujer-festeja-proximo-domingo-morira-eutanasia_0_I1dvOhFn0.html,https://images.clarin.com/2021/10/05/Kf5slRHRd_720x0__1.jpg
41,AjN59Fc2-,Infancias y zodíaco. Cómo son los niños y niñas de Libra,https://www.clarin.com/familias/ninos-ninas-libra_0_AjN59Fc2-.html,https://images.clarin.com/2021/10/05/-k_GJoH3j_720x0__1.jpg
42,uspXQAtC_,"Los astros y vos. Horóscopo Libra de hoy: las predicciones para la salud, el amor y el dinero",https://www.clarin.com/astrologia/horoscopo-libra-hoy-06-octubre-2021-predicciones-salud-amor-dinero_0_uspXQAtC_.html,https://images.clarin.com/2020/07/07/Bp8SjAzWu_720x0__1.jpg
43,HJihJhKdb,Cómo acceder. Talleres gratuitos sobre educación financiera,https://www.clarin.com/brandstudio/talleres-gratuitos-educacion-financiera_0_HJihJhKdb.html,https://images.clarin.com/2021/10/04/M3mdWIDnm_720x0__1.jpg
44,CmFnRXFYm,En la Ciudad. Recolección de residuos: incorporan un innovador camión Scania a GNC,https://www.clarin.com/brandstudio/recoleccion-residuos-urbanos-ciudad-incorporan-innovador-camion-scania-gnc_0_CmFnRXFYm.html,https://images.clarin.com/2021/10/01/uNZUJmjDP_720x0__1.jpg
45,mxquPM1ck,Para aprovechar. Grandes beneficios para pymes y emprendedores,https://www.clarin.com/brandstudio/grandes-beneficios-pymes-emprendedores_0_mxquPM1ck.html,https://images.clarin.com/2021/10/05/7mOlSs2LW_720x0__1.jpg
46,wA_1yfZjp,"Contenido patrocinado. Mine Newbery, un proyecto imperdible en pleno barrio de La Imprenta",https://www.clarin.com/mercado-inmobiliario/proyecto-imperdible-barrio-imprenta-baigun_0_wA_1yfZjp.html,https://images.clarin.com/2021/09/22/eaXkrTShO_720x0__1.jpg
47,,"Biodiversidad. Jaaukanigás, el paraíso natural para descubrir en el norte de Santa Fe",,
48,IM3Urz6ab,En 2001. Se conocieron más detalles de la llegada y estadía de Mavys en Argentina junto a Maradona,https://www.clarin.com/fama/conocieron-detalles-llegada-estadia-mavys-alvarez-argentina-junto-diego-maradona_0_IM3Urz6ab.html,https://images.clarin.com/2021/09/29/Db9ki2TCd_720x0__1.jpg
49,uB-5RPMXF,Fuerte momento. Trascendió cómo Fernando Gago le habría blanqueado su infidelidad a Gisela Dulko,https://www.clarin.com/fama/trascendio-momento-fernando-gago-blanqueado-infidelidad-gisela-dulko_0_uB-5RPMXF.html,https://images.clarin.com/2021/10/05/9WGy2yGyb_720x0__1.jpg
50,4S5TDcMtX,Nueva pareja. Inesperado romance entre Luciano Castro y Flor Vigna: la foto que confirma la relación,https://www.clarin.com/fama/inesperado-romance-luciano-castro-flor-vigna-foto-confirma-relacion_0_4S5TDcMtX.html,https://images.clarin.com/2021/10/05/POI5Ka8BL_720x0__1.jpg
51,O_DGqK2Z-,"""Los extrañé mucho"". Tras su larga ausencia en televisión, Viviana Canosa volvió a las redes sociales",https://www.clarin.com/fama/larga-ausencia-television-viviana-canosa-volvio-redes-sociales-extrane-_0_O_DGqK2Z-.html,https://images.clarin.com/2021/06/03/fRZsoH2kQ_720x0__1.jpg
52,fcnc1XtQ5,"Mercado laboral. Empresas unicornio: qué son, qué perfiles buscan y cómo aplicar",https://www.clarin.com/servicios/empresas-unicornio-perfiles-buscan-aplicar-puesto_0_fcnc1XtQ5.html,https://images.clarin.com/2020/10/29/lLCHwpG6J_720x0__1.jpg
53,VMC1_ZgU_,Sinopharm. Cuándo vencen las dosis y el riesgo de que ANMAT sea un nuevo INDEC,https://www.clarin.com/sociedad/vencen-dosis-sinopharm-riesgo-anmat-nuevo-indec_0_VMC1_ZgU_.html,https://images.clarin.com/2021/08/25/oL2M8nrMP_720x0__1.jpg
54,PlBS6PpU5,"Nuevo escenario político. Una encuesta preguntó ""a quién votaría mañana como presidente"": el Gobierno baja",https://www.clarin.com/politica/encuesta-pregunto-votaria-manana-presidente-gobierno-ahi_0_PlBS6PpU5.html,https://images.clarin.com/2021/10/04/gZW_X031r_720x0__1.jpg
55,oqU9HY_9y,"Nelson Castro, a fondo. El día que le dieron la extremaunción y qué lo alejó de la medicina",https://www.clarin.com/historias/nelson-castro-dia-dieron-extremauncion-menem-alejo-medicina_0_oqU9HY_9y.html,https://images.clarin.com/2021/07/28/Qf-_CAjgd_720x0__1.jpg
56,_adcmXyIE,Tips útiles. Puerta a puerta: 5 claves para tener en cuenta antes de comprar afuera,https://www.clarin.com/servicios/puerta-puerta-5-claves-tener-cuenta-comprar-exterior_0__adcmXyIE.html,https://images.clarin.com/2020/11/24/knC59Dd9M_720x0__1.jpg
57,EfrpJtQSb,Proteger ahorros. Dólares: cuál es la vida útil de los billetes y cómo cuidarlos para que duren más,https://www.clarin.com/servicios/dolares-vida-util-billetes-cuidarlos-duren_0_EfrpJtQSb.html,https://images.clarin.com/2020/07/23/bMdb9DlKC_720x0__1.jpg
58,GcFG_FemJ,Escena del Crimen. El cuerpo quemado de Puerto Madero que no le importa a nadie,https://www.clarin.com/policiales/cuerpo-quemado-puerto-madero-importa-nadie_0_GcFG_FemJ.html,https://images.clarin.com/2021/10/01/6sBt8-wQ4_720x0__1.jpg
59,6fkpujJeR,Vacunación de perros y gatos. Morir de rabia: una amenaza del pasado que vuelve por culpa de la pandemia,https://www.clarin.com/buena-vida/morir-rabia-amenaza-pasado-vuelve_0_6fkpujJeR.html,https://images.clarin.com/2021/09/27/NTP7Ovmhq_720x0__1.jpg
60,YrCdvF1-t,Calles bajo fuego. Mundo narco: los sicarios de Rosario salen a matar por $15.000,https://www.clarin.com/policiales/mundo-narco-sicarios-rosario-salen-matar-15-000_0_YrCdvF1-t.html,https://images.clarin.com/2021/09/20/noXbd76DV_720x0__1.jpg
61,j5owUSw_W,En alza. Criptomonedas: ¿cuánta plata se puede ganar con una PC desde el living de casa?,https://www.clarin.com/especiales/criptomonedas-plata-puede-ganar-pc-living-casa-_0_j5owUSw_W.html,https://images.clarin.com/2021/08/16/SZDgaDM6F_720x0__1.jpg
62,aJCBFfrH9,Nuevo capitán de la Davis. Coria: el desafío de suceder a Gaudio y qué pasará con Del Potro,https://www.clarin.com/deportes/guillermo-coria-nuevo-capitan-davis-emocion-desafio-suceder-gaudio-pasara-potro_0_aJCBFfrH9.html,https://images.clarin.com/2021/10/05/h8YNSZUp1_1256x620__2.jpg#1633469907059
63,Nje4HcdQj,Dolor infinito. La emotiva despedida a Lucas Pierazzoli en Hurling y el llanto de todo el rugby,https://www.clarin.com/deportes/emotiva-despedida-lucas-pierazzoli-hurling-ronda-amigos-gaita-llanto-rugby_0_Nje4HcdQj.html,https://images.clarin.com/2021/10/05/XlAODdpew_720x0__1.jpg
64,bf18vE1Jy,"La nueva joya. Julián Álvarez, cada día más cerca del fútbol europeo: qué clubes lo quieren",https://www.clarin.com/deportes/julian-alvarez-dia-cerca-futbol-europeo-clubes-quieren-pagarian-pase_0_bf18vE1Jy.html,https://images.clarin.com/2021/10/04/ifLCMCixJ_1256x620__3.jpg#1633482046937
65,Okopq4p9n,"Scaloni tiene todo claro. Una Selección sin misterios, con nombres que se repiten y una base consolidada",https://www.clarin.com/deportes/scaloni-claro-seleccion-misterios-nombres-repiten-base-consolidada_0_Okopq4p9n.html,https://images.clarin.com/2021/10/05/NM83bSlwG_1256x620__2.jpg#1633487117704
66,6BOWOWRrJ,Leyenda. El español Pau Gasol anunció su retiro del básquet profesional,https://www.clarin.com/deportes/espanol-pau-gasol-anuncio-retiro-basquet-profesional_0_6BOWOWRrJ.html,https://images.clarin.com/2021/10/05/vmk_eN2aP_720x0__1.jpg
67,HluOvrCFA,"""Candidatos"". River y los motivos como para pensar que ahora sí se le puede dar en el torneo local",https://www.clarin.com/deportes/river-motivos-pensar-ahora-puede-dar-torneo-local_0_HluOvrCFA.html,https://images.clarin.com/2021/10/04/jmu0bU-uT_720x0__1.jpg
68,XkgsvlmRF,"Evento del Banco Nación. Manzur también se muestra ante empresarios pymes: ""Vamos a salir de todas con las botas puestas""",https://www.clarin.com/economia/manzur-muestra-empresarios-pymes-vamos-salir-todas-botas-puestas-_0_XkgsvlmRF.html,https://images.clarin.com/2021/10/05/N8kP0TK3d_720x0__1.jpg
69,alSTfHYTK,"Inflación. En octubre, los alimentos dan un nuevo envión al índice de precios",https://www.clarin.com/economia/octubre-alimentos-dan-nuevo-envion-indice-precios_0_alSTfHYTK.html,https://images.clarin.com/2020/07/28/iYSWSPInX_720x0__1.jpg
70,EaSXr5m2y,"Política comercial. Pese a los reclamos de las empresas, el Gobierno se prepara para renovar Precios Cuidados casi sin cambios",https://www.clarin.com/economia/pese-reclamos-empresas-gobierno-prepara-renovar-precios-cuidados-cambios_0_EaSXr5m2y.html,https://images.clarin.com/2021/10/04/PcygMT89o_720x0__1.jpg
71,Yr5sxzrof,El mundo que viene. Claves para el futuro: el mundo de los millennials,https://www.clarin.com/economia/claves-futuro-mundo-millennials_0_Yr5sxzrof.html,https://images.clarin.com/2021/10/05/tUhf_-jlj_720x0__1.jpg
72,qwgwU4kzb,"Para Stiglitz. La recuperación ""no será posible si hay países que no pueden afrontar deudas""",https://www.clarin.com/economia/stiglitz-recuperacion-global-posible-paises-pueden-afrontar-deudas-_0_qwgwU4kzb.html,https://images.clarin.com/2021/10/05/YNjVM57K1_720x0__1.jpg
73,HqYnkBehv,Salario-inflación. Argentina Gastronómica: cara para locales y regalada para extranjeros,https://www.clarin.com/economia/argentina-gastronomica-cara-argentinos-regalada-extranjeros_0_HqYnkBehv.html,https://images.clarin.com/2021/10/05/3IxQ6jmC6_720x0__1.jpg
74,0ISvRT96r,Ya está disponible. Windows 11: cómo instalarlo si todavía no aparece la actualización,https://www.clarin.com/tecnologia/windows-11-disponible-instalarlo-todavia-aparece-actualizacion_0_0ISvRT96r.html,https://images.clarin.com/2021/10/05/HJSqcHcmj_720x0__1.jpg
75,prx9-01bz,Tendencias. Verano 2022: cuánto cuestan las vacaciones en las playas de Villa Gesell,https://www.clarin.com/viajes/verano-2022-cuestan-vacaciones-playas-villa-gesell_0_prx9-01bz.html,https://images.clarin.com/2021/02/24/3S3NapID7_720x0__1.jpg
76,I8Qc9A-PP,Cómo superarlo. Los 6 pasos para olvidar a tu ex de forma definitiva,https://www.clarin.com/relaciones/6-pasos-olvidar-ex-forma-definitiva_0_I8Qc9A-PP.html,https://images.clarin.com/2021/10/04/UeqiRuTkv_720x0__1.jpg
77,VcbB-gzrY,"Sexo seguro. DIU, vasectomía, pastillas, preservativo: mitos y verdades de métodos anticonceptivos",https://www.clarin.com/buena-vida/diu-vasectomia-pastillas-preservativo-mitos-verdades-metodos-anticonceptivos_0_VcbB-gzrY.html,https://images.clarin.com/2021/10/05/g53ImlU7K_720x0__1.jpg
78,3WGf0upvu,Pese a la pandemia. Cerro Castor cerró una de las mejores temporadas de invierno de su historia,https://www.clarin.com/viajes/pese-pandemia-cerro-castor-cerro-mejores-temporadas-invierno-historia_0_3WGf0upvu.html,https://images.clarin.com/2021/10/05/Qi1SJpZXH_720x0__1.jpg
79,QwW_ILOkn,Neurociencias. Lo que pensás mientras no hacés nada puede dar pistas sobre tu salud mental,https://www.clarin.com/buena-vida/pensas-haces-puede-dar-pistas-salud-mental_0_QwW_ILOkn.html,https://images.clarin.com/2021/10/04/oKoCFBb1V_720x0__1.jpg
