n,id,title,url,image
1,N21edbV03,Tensión Nación-Ciudad. Lo que la pelea con el gobierno porteño oculta: la crisis sanitaria y una posible jugada por las PASO,https://www.clarin.com/opinion/paso_0_N21edbV03.html,https://images.clarin.com/2021/04/16/aU_SH3ThW_720x0__1.jpg
2,gqw-ZuzhJ,"Escuelas abiertas. Pese al fallo judicial, confirman las clases presenciales para hoy en la Ciudad",https://www.clarin.com/ciudades/gobierno-ciudad-confirmo-pese-nuevo-fallo-manana-clases-presenciales-ciudad_0_gqw-ZuzhJ.html,https://images.clarin.com/2021/04/20/7BySM11cr_720x0__1.jpg
3,4zinog38s,"Pelea por las aulas. ""Delito de desobediencia"": la respuesta de la Rosada a Larreta",https://www.clarin.com/politica/gobierno-nacional-respondio-horacio-rodriguez-larreta-continuidad-clases-delito-desobediencia-civil-_0_4zinog38s.html,https://images.clarin.com/2021/04/17/VdsDBeAKC_720x0__1.jpg
4,TIgWCCWXM,Lo designó Kirchner. Quién es el juez que ordenó a la Ciudad cerrar las escuelas,https://www.clarin.com/politica/esteban-furnari-juez-volvio-cerrar-escuelas-designado-nestor-kirchner-carlos-zannini_0_TIgWCCWXM.html,https://images.clarin.com/2021/04/20/DzvvD9ogw_1256x620__2.jpg#1618966828602
5,XPQULwQV3,Del editor. Alberto Fernández y el riesgo de quedar tercero en la línea de mando,https://www.clarin.com/opinion/alberto-fernandez-riesgo-quedar-tercero-linea-mando_0_XPQULwQV3.html,https://images.clarin.com/2020/12/03/gZSybhzTu_720x0__1.jpg
6,sZ4ocfc1D,Emergencia sanitaria. Definen cuándo los sanatorios en Provincia atenderán solo casos de Covid,https://www.clarin.com/sociedad/sanatorios-bonaerenses-deberan-atender-solo-casos-covid-ocupan-70-terapia-intensiva_0_sZ4ocfc1D.html,https://images.clarin.com/2021/04/21/_rHeTyEan_720x0__1.jpg
7,AcONuuOmh,"Avanza la pandemia. Alarma en clínicas por las terapias intensivas: ""La situación es crítica""",https://www.clarin.com/sociedad/-situacion-critica-ritmo-crecimiento-casos-amenaza-desbordarla-alarma-clinicas-sanatorios_0_AcONuuOmh.html,https://images.clarin.com/2021/04/20/rBX8kPACR_1256x620__2.jpg#1618965221521
8,_rlo26H9H,"Cambio climático: el ""virus"" que avanza y espera tras la pandemia",https://www.clarin.com/sociedad/cambio-climatico-virus-avanza-espera-detras-pandemia_0__rlo26H9H.html,https://images.clarin.com/2021/04/19/0pONQxseU_720x0__1.jpg
9,VjmaFUyNI,Tiene 130 empleados. Dánica cierra su fábrica de aderezos de San Luis y culpa al gremio de Aceiteros,https://www.clarin.com/economia/danica-cierra-fabrica-aderezos-san-luis-culpa-gremio-aceiteros_0_VjmaFUyNI.html,https://images.clarin.com/2020/04/11/3O_5AU2ij_720x0__1.jpg
10,HdIEZFlma,Foco económico. Vacuna y comicios: el mercado ya apuesta al dólar del día después,https://www.clarin.com/economia/vacunacion-covid-elecciones-mercado-apuesta-dolar-dia-despues_0_HdIEZFlma.html,https://images.clarin.com/2021/03/16/7RB8w0dTH_720x0__1.jpg
11,L49zZvYfO,"Billetes antiguos. Dólares ""cara chica"": las claves para hacerlos valer al 100%",https://www.clarin.com/servicios/dolares-cara-chica-causan-discusiones-bancos-claves-hacerlos-valer-100-_0_L49zZvYfO.html,https://images.clarin.com/2020/08/17/U9cIo3ojS_720x0__1.jpg
12,ohL9rlnnB,Sectarismo.  La grieta política es una amenaza para la democracia,https://www.clarin.com/new-york-times-international-weekly/sectarismo-grieta-politica-amenaza-democracia_0_ohL9rlnnB.html,https://images.clarin.com/2021/04/20/ql2vvjzLL_1256x620__2.jpg#1618939725603
13,dYIibtnDS,Opinión. Abandonar Afganistán es un error histórico,https://www.clarin.com/new-york-times-international-weekly/abandonar-afganistan-error-historico_0_dYIibtnDS.html,https://images.clarin.com/2021/04/14/uIKZhwbDx_1256x620__2.jpg#1618942290745
14,N21edbV03,Tensión Nación-Ciudad. Lo que la pelea con el gobierno porteño oculta: la crisis sanitaria y una posible jugada por las PASO,https://www.clarin.com/opinion/paso_0_N21edbV03.html,https://images.clarin.com/2021/04/16/aU_SH3ThW_720x0__1.jpg
15,gqw-ZuzhJ,"Escuelas abiertas. Pese al fallo judicial, confirman las clases presenciales para hoy en la Ciudad",https://www.clarin.com/ciudades/gobierno-ciudad-confirmo-pese-nuevo-fallo-manana-clases-presenciales-ciudad_0_gqw-ZuzhJ.html,https://images.clarin.com/2021/04/20/7BySM11cr_720x0__1.jpg
16,4zinog38s,"Pelea por las aulas. ""Delito de desobediencia"": la respuesta de la Rosada a Larreta",https://www.clarin.com/politica/gobierno-nacional-respondio-horacio-rodriguez-larreta-continuidad-clases-delito-desobediencia-civil-_0_4zinog38s.html,https://images.clarin.com/2021/04/17/VdsDBeAKC_720x0__1.jpg
17,TIgWCCWXM,Lo designó Kirchner. Quién es el juez que ordenó a la Ciudad cerrar las escuelas,https://www.clarin.com/politica/esteban-furnari-juez-volvio-cerrar-escuelas-designado-nestor-kirchner-carlos-zannini_0_TIgWCCWXM.html,https://images.clarin.com/2021/04/20/DzvvD9ogw_1256x620__2.jpg#1618966828602
18,XPQULwQV3,Del editor. Alberto Fernández y el riesgo de quedar tercero en la línea de mando,https://www.clarin.com/opinion/alberto-fernandez-riesgo-quedar-tercero-linea-mando_0_XPQULwQV3.html,https://images.clarin.com/2020/12/03/gZSybhzTu_720x0__1.jpg
19,sZ4ocfc1D,Emergencia sanitaria. Definen cuándo los sanatorios en Provincia atenderán solo casos de Covid,https://www.clarin.com/sociedad/sanatorios-bonaerenses-deberan-atender-solo-casos-covid-ocupan-70-terapia-intensiva_0_sZ4ocfc1D.html,https://images.clarin.com/2021/04/21/_rHeTyEan_720x0__1.jpg
20,AcONuuOmh,"Avanza la pandemia. Alarma en clínicas por las terapias intensivas: ""La situación es crítica""",https://www.clarin.com/sociedad/-situacion-critica-ritmo-crecimiento-casos-amenaza-desbordarla-alarma-clinicas-sanatorios_0_AcONuuOmh.html,https://images.clarin.com/2021/04/20/rBX8kPACR_1256x620__2.jpg#1618965221521
21,_rlo26H9H,"Cambio climático: el ""virus"" que avanza y espera tras la pandemia",https://www.clarin.com/sociedad/cambio-climatico-virus-avanza-espera-detras-pandemia_0__rlo26H9H.html,https://images.clarin.com/2021/04/19/0pONQxseU_720x0__1.jpg
22,RWNx3cbR0,"Daniel Passarella. El otoño del gran capitán: recluido, quiere ser manager y espera un juicio clave",https://www.clarin.com/historias/daniel-passarella-otono-gran-capitan-recluido-ganas-manager-espera-juicio-podria-llevarlo-prision_0_RWNx3cbR0.html,https://images.clarin.com/2021/04/14/n9sH5QSi0_720x0__1.jpg
23,z3KXcb0Qn,"90 años de profesionalismo. Huelga y 200 jugadores desafiliados, así fue el inicio de la era rentada en el fútbol argentino",https://www.clarin.com/deportes/huelga-200-jugadores-desafiliados--inicio-rentada-futbol-argentino_0_z3KXcb0Qn.html,https://images.clarin.com/2021/04/19/a5ye9U7_A_720x0__1.jpg
24,9YdpwT6NB,Físico argentino en EE.UU.. Escribe Juan Maldacena: ¿es posible viajar en el tiempo?,https://www.clarin.com/viva/escribe-juan-maldacena-posible-viajar-tiempo-_0_9YdpwT6NB.html,https://images.clarin.com/2021/04/20/94XXFZ1Sz_720x0__1.jpg
25,LCIPQhYx1,Coronavirus. El punto ciego de la positividad: cuántos casos reales hay por día,https://www.clarin.com/sociedad/punto-ciego-positividad-casos-reales-covid-dia_0_LCIPQhYx1.html,https://images.clarin.com/2021/04/09/9TEVIk_PP_1256x620__2.jpg#1618934985419
26,2PTqv3w1I,"Números preocupantes. Los cementerios y crematorios de la India, desbordados por el Covid",https://www.clarin.com/mundo/cementerios-crematorios-india--desbordados-nueva-ola-coronavirus_0_2PTqv3w1I.html,https://images.clarin.com/2021/04/20/BPxvZZmUv_1200x0__2.jpg#1618943587504
27,rR-fkhxRe,Perfil de un genio. Federico Fellini: cómo fue el origen de su imaginación ilimitada,https://www.clarin.com/viva/federico-fellini-origen-imaginacion-ilimitada_0_rR-fkhxRe.html,https://images.clarin.com/2014/09/19/rJZyQxShXx_720x0.jpg
28,i2LNjpUwD,Soluciones prácticas. Claves y consejos para ahorrar a la hora de lavar la ropa,https://www.clarin.com/brandstudio/claves-consejos-ahorrar-hora-lavar-ropa_0_i2LNjpUwD.html,https://images.clarin.com/2021/04/15/-4so25uA4_720x0__1.jpg
29,BduIyjwjX,Gratuita y 100% digital. Ganá dinero con tu caja de ahorro: cómo conseguir la mejor tasa del mercado,https://www.clarin.com/brandstudio/gana-dinero-caja-ahorro-conseguir-mejor-tasa-mercado_0_BduIyjwjX.html,https://images.clarin.com/2021/04/14/TvsJRuLIx_720x0__1.jpg
30,d8XCaPG3T,"Entrevista con Clarín. Cómo está el hijo del Ruso Heguy: ""Por suerte cada mañana puedo agradecer un nuevo día""",https://www.clarin.com/deportes/hijo-ruso-heguy-podriamos-perdido-suerte-manana-puedo-agradecer-nuevo-dia-pedrito_0_d8XCaPG3T.html,https://images.clarin.com/2021/04/20/MIpU1N9_U_720x0__1.jpg
31,qcBNh_tDU,"Copa Libertadores. Vélez estuvo dos veces arriba, pero Flamengo se lo dio vuelta",https://www.clarin.com/deportes/velez-sarsfield-vs-flamengo-copa-libertadores-previa-alineaciones-directo_0_qcBNh_tDU.html,https://images.clarin.com/2021/04/20/6BC429vsO_720x0__1.jpg
32,JYxO-mNoq,Por la Libertadores. Argentinos venció a Nacional y encendió su ilusión en la Copa,https://www.clarin.com/deportes/argentinos-juniors-vs-nacional-copa-libertadores-previa-alineaciones-directo_0_JYxO-mNoq.html,https://images.clarin.com/2021/04/20/JCfgqHZTQ_720x0__1.jpg
33,myzZz_ARX,Copa Sudamericana. Newell's se defendió bien y se llevó un punto de Brasil,https://www.clarin.com/deportes/atletico-goianiense-vs-newell-s-copa-sudamericana-previa-alineaciones-directo_0_myzZz_ARX.html,https://images.clarin.com/2021/04/20/n6QBD6wgf_720x0__1.jpg
34,1b3E6afgr,Santiago del Estero. Video: le dieron una piña y el árbitro siguió el juego,https://www.clarin.com/deportes/primera-nacional-ceballos-mitre_0_1b3E6afgr.html,https://images.clarin.com/2021/04/20/TBDmsrklh_720x0__1.jpg
35,oXiS1J16z,"Un nuevo libro. La humillación secreta de Nadia Comaneci: violencia, abusos y espionaje",https://www.clarin.com/deportes/libro-cuenta-padecer-nadia-comaneci-formacion-atleta-violencia-abusos-espionaje_0_oXiS1J16z.html,https://images.clarin.com/2019/02/18/3KnPVliAti_720x0__1.jpg
36,PJXdYRl9C,"Será rival del Rojo. Torque, el club que nació hace 13 años en un baño y es socio del Manchester City",https://www.clarin.com/deportes/torque--club-nacio-hace-13-anos-bano-mercado-ahora-socio-manchester-city_0_PJXdYRl9C.html,https://images.clarin.com/2017/03/22/B1VNVWx2l_720x0.jpg
37,STs_9kuZq,"Superliga vs. FIFA. Traiciones, millones y ¿Messi sin Mundial?",https://www.clarin.com/deportes/superliga-europea-vs-uefa-fifa-historia-traiciones-millones-puede-dejar-lionel-messi-mundial_0_STs_9kuZq.html,https://images.clarin.com/2021/04/11/olTulyrFN_720x0__1.jpg
38,ZY8C_QY85,"Realeza británica. Viuda y con su familia en crisis, la reina Isabel II cumple 95 años en soledad",https://www.clarin.com/mundo/reino-unido-viuda-familia-crisis-reina-isabel-ii-cumple-95-anos-soledad_0_ZY8C_QY85.html,https://images.clarin.com/2021/04/20/-Va_EYtp5_1256x620__2.jpg#1618933666314
39,nghGcLvjA,Ataque a la prensa. Repudio de la Academia Nacional de Periodismo al fallo contra Daniel Santoro,https://www.clarin.com/politica/academia-nacional-periodismo-repudio-fallo-daniel-santoro-precedente-enorme-gravedad-_0_nghGcLvjA.html,https://images.clarin.com/2019/07/19/KbGiKXpQJ_720x0__1.jpg
40,dn7pfWEz6,"Tenía 81 años. Murió el periodista, escritor y docente Daniel Muchnik",https://www.clarin.com/sociedad/murio-periodista-escritor-docente-daniel-muchnik_0_dn7pfWEz6.html,https://images.clarin.com/2021/04/20/FW4ptkK5r_720x0__1.jpg
41,X0ObN4fZq,Boletín Oficial. Entró en vigencia la reforma al Impuesto a las Ganancias,https://www.clarin.com/economia/publico-boletin-oficial-decreto-promulga-reforma-impuesto-ganancias_0_X0ObN4fZq.html,https://images.clarin.com/2021/04/16/BjzRXkYqq_720x0__1.jpg
42,BXHQaLMeg,Tenía siete denuncias . Detuvieron al acusado por el femicidio de Analía en Los Toldos,https://www.clarin.com/policiales/detuvieron-acusado-femicidio-analia-maldonado_0_BXHQaLMeg.html,https://images.clarin.com/2021/04/20/PQja6vwre_1256x620__2.jpg#1618950748929
43,GMeWwXh_P,Inseguridad vial. Murió atropellado por un motociclista y su familia busca testigos,https://www.clarin.com/ciudades/murio-atropellado-motociclista-familia-busca-testigos-parecia-pasado-tren-encima_0_GMeWwXh_P.html,https://images.clarin.com/2021/04/20/qY0SbohTz_720x0__1.jpg
44,yss8NvcrO,Capacitación. Cursos online y gratuitos para aprender a programar desde cero,https://www.clarin.com/servicios/cursos-online-gratuitos-aprender-programar-cero_0_yss8NvcrO.html,https://images.clarin.com/2020/04/04/FVygAHJuQ_720x0__1.jpg
45,Ex3G3Yoml,Nuevos rubros. Hot Sale 2021: habrá récord de marcas y robots contra ofertas engañosas,https://www.clarin.com/sociedad/hot-sale-2021-record-marcas-robots-ofertas-enganosas_0_Ex3G3Yoml.html,https://images.clarin.com/2021/04/20/5znA70V1g_1256x620__2.jpg#1618932194227
46,LSp96mQqG,Gym vs. Home. Cómo adaptar en casa 12 ejercicios que hacés en las máquinas del gimnasio,https://www.clarin.com/buena-vida/adaptar-casa-12-ejercicios-haces-maquinas-gimnasio_0_LSp96mQqG.html,https://images.clarin.com/2021/04/20/IheQMIvUE_720x0__1.jpg
47,-PNiCRHs0,"Nuevo ranking. Para un crítico chileno, los mejores vinos argentinos del año son dos tintos mendocinos",https://www.clarin.com/gourmet/critico-chileno--mejores-vinos-argentinos-ano-tintos-mendocinos_0_-PNiCRHs0.html,https://images.clarin.com/2018/03/14/HkdzHuKFf_720x0__1.jpg
48,dRQj4cdtd,Derechos reproductivos. Qué es el Foro IDEA 2021: ¿soluciones creativas a problemas complejos?,https://www.clarin.com/familias/foro-idea-2021-soluciones-creativas-problemas-complejos-_0_dRQj4cdtd.html,https://images.clarin.com/2021/04/20/PA6UJOKWf_720x0__1.jpg
49,qPUXwYEr3,"Patrocinado. La recuperación de un edificio histórico: lofts y ""tiny apartments"" en el centro",https://www.clarin.com/mercado-inmobiliario/recuperacion-edificio-historico-exclusivos-lofts-tiny-apartments-centro-ciudad_0_qPUXwYEr3.html,https://images.clarin.com/2021/04/15/wqKqWzgvu_720x0__1.jpg
50,Y2k6vddW_,"Decentraland,. La ciudad virtual con casas de millones de dólares en las que no se puede vivir",https://www.clarin.com/tecnologia/decentraland-ciudad-virtual-casas-millones-dolares-puede-vivir_0_Y2k6vddW_.html,https://images.clarin.com/2021/04/20/n97XZyfxR_720x0__1.jpg
51,yrO4_f5rF,"Tendencias. Con un freno al turismo, ahora Amsterdam quiere ser un destino menos masivo",https://www.clarin.com/viajes/freno-turismo-coronavirus-ahora-amsterdam-quiere-destino-masivo_0_yrO4_f5rF.html,https://images.clarin.com/2021/04/20/B6VHq_S5E_720x0__1.jpg
52,d7C-NPQsC,Turismo. Un mapa mundial para buscar las mejores playas nudistas,https://www.clarin.com/viajes/mapa-mundial-buscar-mejores-playas-nudistas_0_d7C-NPQsC.html,https://images.clarin.com/2018/01/28/SkuI_dsBz_1256x620__2.jpg#1618949774272
53,csSjzecqi,Energía positiva. Hogares prósperos: cómo atraer abundancia a tu casa,https://www.clarin.com/astrologia/hogares-prosperos-atraer-abundancia-casa_0_csSjzecqi.html,https://images.clarin.com/2021/04/20/hjUJXiS7X_720x0__1.jpg
54,PwKYdbiXM,Barcelona. Si no se puede viajar... Isabel Allende firma libros a través de un robot,https://www.clarin.com/cultura/puede-viajar-isabel-allende-firma-libros-traves-robot_0_PwKYdbiXM.html,https://images.clarin.com/2021/04/20/OR983CScD_1256x620__2.jpg#1618929805817
55,pEvJgavNo,DRAMATICO. Un hombre salva a un nene cuando un tren lo iba a arrollar,https://www.clarin.com/viste/heroe-hombre-salva-nene-tren-iba-arrollar_0_pEvJgavNo.html,https://images.clarin.com/2021/04/20/9S32_Wq1i_720x0__1.jpg
56,6UggGTRkf,Otras audiencias. Las diez series más comentadas en las redes sociales de la Argentina,https://www.clarin.com/espectaculos/tv/series-interacciones-redes-sociales-argentina_0_6UggGTRkf.html,https://images.clarin.com/2021/02/03/f0LLp0Lyj_720x0__1.jpg
57,HgKJZZBPf,Avicii. A tres años de la muerte del DJ: los 5 momentos que marcaron su vida,https://www.clarin.com/internacional/espectaculos/anos-muerte-avicii-5-momentos-marcaron-vida-dj-sueco_0_HgKJZZBPf.html,https://images.clarin.com/2021/04/19/kjm87ByjE_720x0__1.jpg
58,60Eslgunc,Video. Una oveja derriba a un dron con un cabezazo para defender a sus crías,https://www.clarin.com/viste/oveja-derriba-dron-cabezazo-defender-crias_0_60Eslgunc.html,https://images.clarin.com/2021/04/15/FXxRysUON_720x0__1.jpg
59,k5tSAys7M,Pandemia. Descubren un nuevo talón de Aquiles del coronavirus,https://www.clarin.com/internacional/covid-19-descubren-nuevo-talon-aquiles-coronavirus_0_k5tSAys7M.html,https://images.clarin.com/2021/02/26/kb04Vc4jx_720x0__1.jpg
60,Vo3ARyUPI,¿Cae el proyecto?. Los seis clubes ingleses involucrados se bajan de la Superliga europea,https://www.clarin.com/deportes/clubes-ingleses-involucrados-anunciaron-abandonan-proyecto-superliga_0_Vo3ARyUPI.html,https://images.clarin.com/2021/04/20/Awi1M1iyN_720x0__1.jpg
61,LxLN9mmla,Ataque a la Justicia. El kirchnerismo quiere armar una comisión en el Congreso para investigar a los jueces,https://www.clarin.com/politica/vez-kirchnerismo-jueces-ahora-quieren-armar-comision-congreso-investigarlos_0_LxLN9mmla.html,https://images.clarin.com/2021/04/20/AyJE2adhL_720x0__1.jpg
62,LYHSrr256,Estados Unidos. Declaran culpable al policía que mató a George Floyd,https://www.clarin.com/mundo/unidos-jurado-declaro-culpable-policia-derek-chauvin-muerte-george-floyd_0_LYHSrr256.html,https://images.clarin.com/2020/06/01/4CFJY_jNt_1200x0__2.jpg#1618948648669
63,qBeBsdKgF,Los detalles. Cómo es el acuerdo para terminar de fabricar la Sputnik V en el país,https://www.clarin.com/sociedad/coronavirus-acuerdo-terminar-fabricar-sputnik-v-pais-vacunas_0_qBeBsdKgF.html,https://images.clarin.com/2021/04/20/zX4YZJ8xW_720x0__1.jpg
64,oe6qAp7yu,En plena pandemia. Alberto Fernández prepara una gira por Europa para mayo y podría ir a Moscú,https://www.clarin.com/politica/alberto-fernandez-prepara-gira-europa-mayo-descartan-llegue-moscu_0_oe6qAp7yu.html,https://images.clarin.com/2020/02/04/_7-3Ec8B_720x0__1.jpg
65,fTsXD85FL,"Qué dijo la pericia. Revelan que una falla mecánica provocó el accidente en el que murió ""Wey"" Zapata",https://www.clarin.com/sociedad/revelan-falla-mecanica-provoco-accidente-murio-wey-zapata-piloto-corria-brazo_0_fTsXD85FL.html,https://images.clarin.com/2021/04/06/x_z930F5Q_720x0__1.jpg
66,lpJX42ped,Destinos en el país. Coronavirus: qué provincias piden test para ingresar,https://www.clarin.com/viajes/coronavirus-provincias-piden-test-ingresar_0_lpJX42ped.html,https://images.clarin.com/2015/11/25/ryiHLZ1Nx_720x0.jpg
67,zsrlcgnoB,Actividades. Ushuaia: una escapada al fin del mundo,https://www.clarin.com/brandstudio/ushuaia-escapada-fin-mundo_0_zsrlcgnoB.html,https://images.clarin.com/2021/04/16/U1tcfhIdH_720x0__1.jpg
