n,id,title,url,image
1,vq0t4aaBo,"A ocho meses de su asunción. Secretos de la primera reunión entre Soria y la Corte: tensión, reclamos mutuos y dos ""olvidos"" del ministro",https://www.clarin.com/politica/secretos-reunion-martin-soria-corte-suprema-media-hora-tension-reclamos-mutuos-olvidos-ministro_0_vq0t4aaBo.html,https://images.clarin.com/2021/12/07/2xlkyCUCC_720x0__1.jpg
2,H4FzY1jEP,Del editor. El Gobierno tiene un motivo para festejar: la ruptura radical,https://www.clarin.com/opinion/gobierno-motivo-festejar-ruptura-radical_0_H4FzY1jEP.html,https://images.clarin.com/2021/06/10/yuKUCJ8Ln_720x0__1.jpg
3,5lqdNQbrY,La pandemia. La OMS afirmó que no hay pruebas de que Ómicron cause cuadros más graves de Covid,https://www.clarin.com/sociedad/oms-afirmo-pruebas-omicron-cause-cuadros-graves-covid_0_5lqdNQbrY.html,https://images.clarin.com/2021/12/07/ZOTE81BMn_720x0__1.jpg
4,HzPbF2KXR,"Nueva cepa. Ómicron ""sigilosa"": la variante ya mutó y puede ser más difícil de detectar",https://www.clarin.com/sociedad/omicron-sigilosa-variante-muto-ahora-volvio-dificil-detectar_0_HzPbF2KXR.html,https://images.clarin.com/2021/12/07/y3IRKL5-n_720x0__1.jpg
5,9OWWRYDz-,Denunció agresiones. Ofelia Fernández apuntó contra un diputado de Milei por un fuerte insulto,https://www.clarin.com/politica/ofelia-fernandez-denuncio-libertarios-agredieron-apunto-diputado-javier-milei-fuerte-insulto_0_9OWWRYDz-.html,https://images.clarin.com/2020/05/05/jBNX4M0Lp_720x0__1.jpg
6,ZBvddNMF7,Foco Económico. Por qué ahora baja el dólar y suben los bonos argentinos,https://www.clarin.com/opinion/-ahora-baja-dolar-suben-bonos-argentinos-_0_ZBvddNMF7.html,https://images.clarin.com/2021/10/22/pN5hRqgGb_720x0__1.jpg
7,sbWHn-lAK,Decisión del Presidente. Desplazan al director de Ceremonial de Casa Rosada por denuncias de maltratos,https://www.clarin.com/politica/desplazan-director-ceremonial-casa-rosada-denuncias-maltratos_0_sbWHn-lAK.html,https://images.clarin.com/2021/12/07/UaAyKRE1t_1256x620__2.jpg#1638916879934
8,NSophRf6r,"Informe de la UCA. Bajaron la pobreza y el desempleo, pero la situación social sigue siendo más crítica que en la prepandemia",https://www.clarin.com/economia/bajaron-pobreza-desempleo-situacion-social-sigue-critica-prepandemia_0_NSophRf6r.html,https://images.clarin.com/2021/09/30/OPK2cFrmI_720x0__1.jpg
9,al4Rgl9CSR,El nuevo Congreso. Diputados: la llamativa jura de Del Caño y el particular lugar donde se sentó Milei ,https://www.clarin.com/politica/jura-diputados-vivo-segui-minuto-minuto-ceremonia-asuncion_0_al4Rgl9CSR.html,https://images.clarin.com/2021/12/07/_oIDlm-u8_1256x620__2.jpg#1638897637318
10,jjTIlJb8K,"Barras premiadas. Tres bares de Buenos Aires, entre los 50 mejores del mundo",https://www.clarin.com/gourmet/bares-buenos-aires-50-mejores-mundo_0_jjTIlJb8K.html,https://images.clarin.com/2018/10/04/OCPK3QU9z_1256x620__2.jpg#1638915274062
11,BTB4gdilU,"Champions League. Messi, más grande que Pelé: superó un récord del brasileño en la goleada del PSG",https://www.clarin.com/deportes/messi-paso-record-pele_0_BTB4gdilU.html,https://images.clarin.com/2021/12/07/s4cgKEWOh_720x0__1.jpg
12,3d6DI98tD,"Ganó en Portugal. Con aporte argentino, Atlético Madrid logró una milagrosa clasificación",https://www.clarin.com/deportes/porto-vs-atletico-madrid-champions-league-minuto-minuto-directo_0_3d6DI98tD.html,https://images.clarin.com/2021/12/07/14uqV6t2X_720x0__1.jpg
13,vB6hNhtvv,"La pandemia en el país. Coronavirus: confirman 3.089 nuevos casos, la cifra más alta para un día en casi tres meses",https://www.clarin.com/sociedad/coronavirus-argentina-confirman-3-089-nuevos-casos-23-muertes-ultimas-24-horas_0_vB6hNhtvv.html,https://images.clarin.com/2021/12/07/dLcaHx43w_1256x620__2.jpg#1638901924647
14,IwC6NWWxM,"Afectado por ELA. Con una carta, Esteban Bullrich anunció que renuncia a su banca en el Senado",https://www.clarin.com/politica/esteban-bullrich-renuncia-banca-senado_0_IwC6NWWxM.html,https://images.clarin.com/2021/12/06/rXFZT7GpX_720x0__1.jpg
15,FOBXTCbyE,Video. Roban dos camisetas firmadas por Maradona de la Casa de las Madres de Plaza de Mayo,https://www.clarin.com/sociedad/video-roban-camisetas-firmadas-diego-maradona-casa-madres-plaza-mayo_0_FOBXTCbyE.html,https://images.clarin.com/2021/12/07/AHkW_tA3S_720x0__1.jpg
16,UyYjpAzpq,Se renueva la Cámara. Ratifican a Massa como presidente de Diputados y sólo cambió un vice,https://www.clarin.com/politica/camara-diputados-ratifican-sergio-massa-presidente-solo-cambiaria-vice_0_UyYjpAzpq.html,https://images.clarin.com/2021/12/07/GxOEQfLmt_720x0__1.jpg
17,GkC-554jr,Mirá las fotos. El penthouse que Hamilton vendió en Manhattan por casi 50 millones de dólares,https://www.clarin.com/deportes/fotos-exclusivo-penthouse-lewis-hamilton-manhattan-vendio-50-millones-dolares_0_GkC-554jr.html,https://images.clarin.com/2021/12/07/ChZFAvIVO_720x0__1.jpg
18,CpUhuSgLk,Especial Clarín. Autitos de colección: un juego que no es de niños y mueve millones,https://www.clarin.com/autos/autitos-coleccion-juego-ninos-mueve-millones_0_CpUhuSgLk.html,https://images.clarin.com/2021/12/03/clFAGxjmh_720x0__1.jpg
19,cmA9rsYBP,"Escapadas. 6 rutas temáticas imperdibles entre quesos, termas y pulperías",https://www.clarin.com/viajes/escapadas-6-rutas-tematicas-imperdibles-quesos-termas-pulperias_0_cmA9rsYBP.html,https://images.clarin.com/2021/11/16/-MkgFxhBV_720x0__1.jpg
20,5A9TKTfIG,En redes. Antonela Roccuzzo mostró su rutina de yoga y se filtró un detalle navideño,https://www.clarin.com/deportes/antonela-roccuzzo-mostro-espectacular-rutina-ejercicios-yoga-filtro-detalle-navideno-hogar_0_5A9TKTfIG.html,https://images.clarin.com/2021/12/07/Bi4T_5LJz_720x0__1.jpg
21,o3ZxAo0tZ,Restringió su cuenta. La Policía Federal investigará quienes acosaron al chico de las tortas en Twitter,https://www.clarin.com/sociedad/anibal-fernandez-ordeno-policia-federal-investigue-acosaron-chico-tortas-twitter_0_o3ZxAo0tZ.html,https://images.clarin.com/2021/11/25/IZ2L_aLrw_720x0__1.jpg
22,OiDJQJsxD,Tradición. Furor por los arbolitos de Navidad: cuánto cuestan y cuál es la tendencia de este año,https://www.clarin.com/sociedad/furor-arbolitos-navidad-cuestan-tendencia-ano_0_OiDJQJsxD.html,https://images.clarin.com/2021/12/07/Iga3BFpFt_720x0__1.jpg
23,IB5qp2e5_,"El hecho quedó filmado. Perpetua para el asesino de Abril Bogado, baleada delante de sus padres en un robo",https://www.clarin.com/policiales/prision-perpetua-asesino-abril-bogado-nena-12-anos-baleada-robo-adelante-padres_0_IB5qp2e5_.html,https://images.clarin.com/2018/11/18/VHHy71YMA_720x0__1.jpg
24,NYnSW23i8,"Análisis. Biden-Putin: una cumbre tensa por Ucrania, pero con pocos avances concretos",https://www.clarin.com/mundo/joe-biden-vladimir-putin-cumbre-tensa-ucrania-pocos-avances-concretos_0_NYnSW23i8.html,https://images.clarin.com/2021/12/07/STSvbPkuf_720x0__1.jpg
25,s7hFhIBaN,"Mata en un minuto. Sarco, la máquina para el suicidio asistido, ya es legal en Suiza",https://www.clarin.com/internacional/sarco-maquina-suicidio-asistido-legal-suiza_0_s7hFhIBaN.html,https://images.clarin.com/2021/12/07/1liHEPAvK_720x0__1.jpg
26,1AperrGpiG,Historias visuales. Las 102 mejores imágenes de hoy en la Argentina y el mundo,https://www.clarin.com/fotogalerias/mundo-fotos-imagenes-destacadas-actualidad_5_1AperrGpiG.html,
27,vq0t4aaBo,"A ocho meses de su asunción. Secretos de la primera reunión entre Soria y la Corte: tensión, reclamos mutuos y dos ""olvidos"" del ministro",https://www.clarin.com/politica/secretos-reunion-martin-soria-corte-suprema-media-hora-tension-reclamos-mutuos-olvidos-ministro_0_vq0t4aaBo.html,https://images.clarin.com/2021/12/07/2xlkyCUCC_720x0__1.jpg
28,H4FzY1jEP,Del editor. El Gobierno tiene un motivo para festejar: la ruptura radical,https://www.clarin.com/opinion/gobierno-motivo-festejar-ruptura-radical_0_H4FzY1jEP.html,https://images.clarin.com/2021/06/10/yuKUCJ8Ln_720x0__1.jpg
29,5lqdNQbrY,La pandemia. La OMS afirmó que no hay pruebas de que Ómicron cause cuadros más graves de Covid,https://www.clarin.com/sociedad/oms-afirmo-pruebas-omicron-cause-cuadros-graves-covid_0_5lqdNQbrY.html,https://images.clarin.com/2021/12/07/ZOTE81BMn_720x0__1.jpg
30,HzPbF2KXR,"Nueva cepa. Ómicron ""sigilosa"": la variante ya mutó y puede ser más difícil de detectar",https://www.clarin.com/sociedad/omicron-sigilosa-variante-muto-ahora-volvio-dificil-detectar_0_HzPbF2KXR.html,https://images.clarin.com/2021/12/07/y3IRKL5-n_720x0__1.jpg
31,9OWWRYDz-,Denunció agresiones. Ofelia Fernández apuntó contra un diputado de Milei por un fuerte insulto,https://www.clarin.com/politica/ofelia-fernandez-denuncio-libertarios-agredieron-apunto-diputado-javier-milei-fuerte-insulto_0_9OWWRYDz-.html,https://images.clarin.com/2020/05/05/jBNX4M0Lp_720x0__1.jpg
32,ZBvddNMF7,Foco Económico. Por qué ahora baja el dólar y suben los bonos argentinos,https://www.clarin.com/opinion/-ahora-baja-dolar-suben-bonos-argentinos-_0_ZBvddNMF7.html,https://images.clarin.com/2021/10/22/pN5hRqgGb_720x0__1.jpg
33,sbWHn-lAK,Decisión del Presidente. Desplazan al director de Ceremonial de Casa Rosada por denuncias de maltratos,https://www.clarin.com/politica/desplazan-director-ceremonial-casa-rosada-denuncias-maltratos_0_sbWHn-lAK.html,https://images.clarin.com/2021/12/07/UaAyKRE1t_1256x620__2.jpg#1638916879934
34,REQD_E286,Las más destacadas. El ranking de las 100 empresas con mejor reputación de la Argentina,https://www.clarin.com/economia/ranking-100-empresas-mejor-reputacion-argentina_0_REQD_E286.html,https://images.clarin.com/2021/12/03/_sp0jqkGZ_720x0__1.jpg
35,GrKsPt82P,"Entrevista con Clarín. Luis Pagani, CEO de Arcor: inflación, congelamiento de precios y qué espera para 2022",https://www.clarin.com/economia/luis-pagani-existen-planes-milagrosos-inflacion-_0_GrKsPt82P.html,https://images.clarin.com/2019/03/11/EuFjAsR3j_720x0__1.jpg
36,a4IkTnvAD,"Repiten podio. Galperin, Pagani y Migoya, los líderes más valorados",https://www.clarin.com/economia/galperin-pagani-migoya-lideres-valorados_0_a4IkTnvAD.html,https://images.clarin.com/2021/12/03/-lTTHsufv_720x0__1.jpg
37,xj3MGqjOJ,"Merco 2021. La reputación, un eje central en la gestión empresarial",https://www.clarin.com/economia/reputacion-eje-central-gestion-empresarial_0_xj3MGqjOJ.html,https://images.clarin.com/2021/12/03/W_ZrUT0gF_720x0__1.jpg
38,XuLdjgSE2,Sueldo complementario. Aguinaldo 2021: cuánto tiempo hay que trabajar para cobrarlo y qué pasa con Ganancias,https://www.clarin.com/economia/aguinaldo-2021-tiempo-trabajar-cobrarlo-pasa-impuesto-ganancias_0_XuLdjgSE2.html,https://images.clarin.com/2021/10/28/upFHhVHJT_720x0__1.jpg
39,4VGemYtef,De diversos sectores. Empresarios reclaman consenso político para el acuerdo con el FMI,https://www.clarin.com/economia/empresarios-reclaman-consenso-politico-acelerar-acuerdo-fmi_0_4VGemYtef.html,https://images.clarin.com/2021/12/03/ycEFeQ1hW_720x0__1.jpg
40,0O_-tuQBP,"Negociación por la deuda. Estados Unidos pide que Argentina y el Fondo firmen un acuerdo ""sólido""",https://www.clarin.com/economia/unidos-pide-argentina-fondo-monetario-internacional-firmen-acuerdo-solido-_0_0O_-tuQBP.html,https://images.clarin.com/2021/04/15/VEDWhVR_U_720x0__1.jpg
41,pEniqSnJK,"Precios congelados. Uno por uno, qué productos componen la canasta navideña y a qué precios",https://www.clarin.com/economia/productos-componen-canasta-navidena-precios_0_pEniqSnJK.html,https://images.clarin.com/2019/12/17/Pd0yS2pT_720x0__1.jpg
42,qMC-Pw0jF,Misiones. Combustibles: quieren limitar el horario de carga a los extranjeros en Iguazú,https://www.clarin.com/economia/combustibles-quieren-limitar-horario-carga-extranjeros-iguazu_0_qMC-Pw0jF.html,https://images.clarin.com/2021/11/02/AVx1rCK-j_720x0__1.jpg
43,ej8T7u06b,Análisis. Cuál es el pronóstico de inflación de Cavallo para 2023,https://www.clarin.com/economia/pronostico-inflacion-domingo-cavallo-2023_0_ej8T7u06b.html,https://images.clarin.com/2021/12/07/GdpIClllP_720x0__1.jpg
44,6ZriTipg5,Alimentos. 10 mitos y dudas sobre los parásitos en los pescados,https://www.clarin.com/buena-vida/10-mitos-dudas-parasitos-pescados_0_6ZriTipg5.html,https://images.clarin.com/2021/06/18/5g8IQDzrT_1256x620__2.jpg#1638550536120
45,FpMExobUs,Todoterreno. Cómo es la tablet nacional que usan las Fuerzas Armadas,https://www.clarin.com/tecnologia/todoterreno-tablet-nacional-usan-fuerzas-armadas_0_FpMExobUs.html,https://images.clarin.com/2021/12/01/tPAxviBL9_720x0__1.jpg
46,atQ-7-Kjj,"¿Amor condicionado?. ""Si no te portás bien, Papá Noel no te va a traer regalo"": por qué evitar ""amenazas navideñas""",https://www.clarin.com/familias/-portas-bien-papa-noel-va-traer-regalo-evitar-amenazas-navidenas-_0_atQ-7-Kjj.html,https://images.clarin.com/2021/12/06/PbCuyCNJf_720x0__1.jpg
47,9iOufU0bR,Comodín de la cocina. 30 recetas de tartas saladas fáciles y rápidas,https://www.clarin.com/gourmet/30-recetas-tartas-saladas-faciles-rapidas_0_9iOufU0bR.html,https://images.clarin.com/2020/09/30/QRSNdmKed_1256x620__2.jpg#1602594145102
48,rn5wRP5zc,Debate. Filosofía on demand: ¿qué tiene de malo ser millonario?,https://www.clarin.com/viva/filosofia-on-demand-malo-millonario-_0_rn5wRP5zc.html,https://images.clarin.com/2021/12/06/a09ZLMZ9f_720x0__1.jpg
49,vRjZ9PmbM,Nuevo estudio. Descubren que un tipo de herpes es capaz de deteriorar el sistema inmunológico,https://www.clarin.com/buena-vida/descubren-tipo-herpes-capaz-deteriorar-sistema-inmunologico_0_vRjZ9PmbM.html,https://images.clarin.com/2021/12/03/luNfs2tQm_720x0__1.jpg
50,,Retrospectiva. Un año en fotos: las imágenes del 2021 según la agencia AFP,,
51,anWSo-43_,Contrabando de décadas. Un multimillonario tenía 180 obras de arte robadas que valen millones de dólares,https://www.clarin.com/viste/multimillonario-180-obras-arte-robadas-valen-millones-dolares_0_anWSo-43_.html,https://images.clarin.com/2021/12/07/s_jiFp2Hh_720x0__1.jpg
52,gUPtaaSnW,Secretos de expertos. Por qué deberíamos cambiar el papel higiénico cuando llegamos a un hotel,https://www.clarin.com/internacional/deberiamos-cambiar-rollo-papel-higienico-llegamos-habitacion-hotel_0_gUPtaaSnW.html,https://images.clarin.com/2020/04/15/BeJE5MJUp_720x0__1.jpg
53,iqSYjStMz,Horóscopo semanal. Predicciones del 6 al 12 de diciembre de 2021 para todos los signos,https://www.clarin.com/astrologia/horoscopo-semanal-predicciones-6-12-diciembre-2021-signos_0_iqSYjStMz.html,https://images.clarin.com/2021/08/08/vI0BfCwiF_720x0__1.jpg
54,CoqqufG5u,"De vuelta a casa. Recuperan la tabla de Gilgamesh, una pieza de 3.500 años robada en 1991",https://www.clarin.com/viste/recuperan-tabla-gilgamesh-pieza-3-500-anos-robada-1991_0_CoqqufG5u.html,https://images.clarin.com/2021/12/07/gx9aaLxRj_720x0__1.jpg
55,bpBznSjuU,Un enigma. Encontraron restos humanos con lenguas de oro en Egipto,https://www.clarin.com/viste/encontraron-restos-humanos-lenguas-oro-egipto_0_bpBznSjuU.html,https://images.clarin.com/2021/12/07/8CdY9pRPR_720x0__1.jpg
56,,De Caracas al mundo. 40 años de Carolina Herrera: un ícono del diseño y el estilo,,
57,nsJI_l6Bu,Soluciones. Tecnología aplicada al agro: el rescate para el maíz,https://www.clarin.com/rural/tecnologia-aplicada-agro-rescate-maiz_0_nsJI_l6Bu.html,https://images.clarin.com/2021/11/30/TVchjNl4m_720x0__1.jpg
58,nYAS6RK00j,Turismo. Todo lo que tenés que saber a la hora de programar un viaje,https://www.clarin.com/brandstudio/tenes-saber-hora-programar-viaje_0_nYAS6RK00j.html,https://images.clarin.com/2021/12/03/20DkEbfSF_720x0__1.jpg
59,BDMdVG2Iq,Una empresa argentina. El nuevo barbijo ecológico que promete reducir el riesgo contagio de Ómicron y Delta,https://www.clarin.com/brandstudio/nuevo-barbijo-ecologico-promete-reducir-riesgo-contagio-variante-omicron-delta_0_BDMdVG2Iq.html,https://images.clarin.com/2021/12/03/7AnbqfljO_1256x620__2.jpg#1638548056874
60,,DS7. Un nuevo híbrido desembarca en Argentina,,
61,H5auN4NsN,"Reconocida. Helios Salud, paradigma en la atención del VIH",https://www.clarin.com/brandstudio/helios-salud-paradigma-atencion-vih_0_H5auN4NsN.html,https://images.clarin.com/2021/12/02/DG-7VYE29_720x0__1.jpg
62,_nf-PHfzO,Impacto pandémico. Cuando los que más gastan no vuelven pronto,https://www.clarin.com/new-york-times-international-weekly/ciencia/gastan-vuelven-pronto_0__nf-PHfzO.html,https://images.clarin.com/2021/12/06/1dUX6KQH8_1256x620__2.jpg#1638811716051
63,m0UGrdaJQ,Opinión. Se viene el metaverso y el mundo no está preparado,https://www.clarin.com/new-york-times-international-weekly/metaverso-viene-camino-mundo-preparado_0_m0UGrdaJQ.html,https://images.clarin.com/2021/12/06/6vAyXHrKj_1256x620__2.jpg#1638812435824
64,_bBjohMGe,Estudio. ¿Por qué el café tiene un efecto tan inmediato en el intestino?,https://www.clarin.com/new-york-times-international-weekly/-cafe-efecto-inmediato-intestino-_0__bBjohMGe.html,https://images.clarin.com/2021/12/06/GnGAckIm-_1256x620__2.jpg#1638801372816
65,huAnCwEeW,Modern Love. ¿Sería ella otra fuente de dolor con un lindo envoltorio?,https://www.clarin.com/new-york-times-international-weekly/modern-love-fuente-dolor-lindo-envoltorio-_0_huAnCwEeW.html,https://images.clarin.com/2021/12/06/-Y_Vrumn7_1256x620__2.jpg#1638789790323
66,S_2uJLZhP,"Un año de romance. Moria y el Pato Galmarini, enamorados y de festejo: se vacunaron contra el Covid",https://www.clarin.com/zonales/moria-casan-pato-galmarini-celebraron-primer-ano-amor-vacunandose-covid_0_S_2uJLZhP.html,https://images.clarin.com/2021/12/06/PvtPF93zy_1256x620__2.jpg#1638823673706
67,yG732rtTj,"En las maquinitas. La historia del ganador de 2,7 millones en el bingo de Pilar: qué hará con el premio",https://www.clarin.com/zonales/historia-ganador-2-7-millones-bingo-pilar-hara-premio_0_yG732rtTj.html,https://images.clarin.com/2021/02/06/9CkSB5Ye-_720x0__1.jpg
68,zc8Kdsqkr,Ciberdelito. Atraparon a estafadores virtuales con identidades falsas que vaciaban cuentas bancarias,https://www.clarin.com/zonales/atraparon-banda-estafadores-virtuales-identidades-falsas-vaciaban-cuentas-bancarias_0_zc8Kdsqkr.html,https://images.clarin.com/2021/12/03/D6Wr4ZZXo_1256x620__2.jpg#1638543998234
69,UjXq3A-O7,Tragedia en Lavallol. La novia de su hijo se ahorcó frente a su casa: escucharon todo pero les dio miedo salir,https://www.clarin.com/zonales/novia-hijo-ahorco-frente-casa-dicen-escucharon-dio-miedo-salir_0_UjXq3A-O7.html,https://images.clarin.com/2021/12/01/IR9TgX4Zc_720x0__1.jpg
70,iSuCPmfYo,"Escándalo en ""ShowMatch"". Habrían encontrado a dos participantes teniendo sexo en los camarines",https://www.clarin.com/fama/escandalo-camarines-showmatch-encontrado-participantes-sexo_0_iSuCPmfYo.html,https://images.clarin.com/2021/12/07/Jx7SnCes7_720x0__1.jpg
71,jfAAmampY,"""Nunca bajes los brazos"". Wanda Nara apoyó a Joaquín Nahuel, el nene pastelero, y le hizo un pedido especial",https://www.clarin.com/fama/wanda-nara-apoyo-joaquin-nahuel-nene-pastelero-encargo-pedido-especial_0_jfAAmampY.html,https://images.clarin.com/2021/12/07/a8STGmqy__720x0__1.jpg
72,txSEBVVxw,"¡Noche de gala! . Flavio Mendoza celebró los 10 años de ""Stravaganza"" con una increíble fiesta en un hotel de lujo",https://www.clarin.com/fama/-noche-gala-flavio-mendoza-celebro-10-anos-stravaganza-increible-fiesta-hotel-lujo_0_txSEBVVxw.html,https://images.clarin.com/2021/12/07/pWC1ltYNT_720x0__1.jpg
73,rZ_R1b_dQ,"Insólita encuesta. Flor Vigna encontró un personaje de Los Simpson ""igual"" a Luciano Castro y abrió una votación",https://www.clarin.com/fama/flor-vigna-comparo-luciano-castro-personaje-simpson-igual-lucho-_0_rZ_R1b_dQ.html,https://images.clarin.com/2021/12/07/qcx1fnrW__720x0__1.jpg
74,5KzkmRd6m,Finanzas personales. Ahorro: las 7 apps para invertir pequeños montos de dinero y pelearle a la inflación,https://www.clarin.com/servicios/ahorro-7-apps-invertir-pequenos-montos-dinero-pelearle-inflacion_0_5KzkmRd6m.html,https://images.clarin.com/2019/06/11/ZMaJBKQZs_720x0__1.jpg
75,Toz3Xg0nq,El ranking de la grieta. Por qué Corrientes y Entre Ríos se convirtieron en las nuevas capitales anti K,https://www.clarin.com/politica/corrientes-rios-nuevas-capitales-anti-k-bien-juntos-cambio-ahi_0_Toz3Xg0nq.html,https://images.clarin.com/2021/11/06/4mlb045Mg_720x0__1.jpg
76,uCg_B0PYl,Para el verano. Liquidan aires acondicionados: 25 modelos con descuentos,https://www.clarin.com/servicios/liquidan-aires-acondicionados-25-modelos-fuertes-descuentos-ahora-30-18-cuotas-interes_0_uCg_B0PYl.html,https://images.clarin.com/2021/04/12/SbwIVq8Rt_720x0__1.jpg
77,IcOikj0oR,Cambio de tendencia. El dólar blue cayó a $ 199: cuáles son las razones que lo empujan a la baja,https://www.clarin.com/economia/dolar-blue-cede-199-5-ubica-debajo-200-primera-vez-20-dias_0_IcOikj0oR.html,https://images.clarin.com/2021/12/01/cqQ07puag_720x0__1.jpg
78,tzxf_rj8h,"Coronavirus en Argentina. ""¿Cuándo me toca?"": la llegada de Ómicron potencia la ansiedad por la tercera dosis",https://www.clarin.com/sociedad/-toca-llegada-omicron-potencia-ansiedad-tercera-dosis_0_tzxf_rj8h.html,https://images.clarin.com/2021/12/06/XLxZnEK7J_1256x620__2.jpg#1638768293825
79,YvuxFVzwz,Ruta internacional. Dónde van los relojes de alta gama robados en Argentina,https://www.clarin.com/policiales/van-relojes-alta-gama-robados-argentina_0_YvuxFVzwz.html,https://images.clarin.com/2021/12/02/orU-T-sim_720x0__1.jpg
80,udh99kElk,Rutas naturales. El boom del trekking: 10 circuitos imperdibles para el verano,https://www.clarin.com/viajes/boom-trekking-10-circuitos-imperdibles-verano_0_udh99kElk.html,https://images.clarin.com/2021/11/19/OqcgqdVXl_720x0__1.jpg
81,HtRSbjnD6,Lo hallaron en 2016. Tatuajes raros y piedras en los bolsillos: el cadáver fantasma en Costanera Sur,https://www.clarin.com/policiales/cadaver-fantasma-reserva-ecologica_0_HtRSbjnD6.html,https://images.clarin.com/2021/11/19/t2XMqMtNK_720x0__1.jpg
82,Sv-dWAmyF,Qatar 2022. La odisea de los hinchas argentinos para llegar al Mundial imposible,https://www.clarin.com/servicios/qatar-2022-odisea-hinchas-argentinos-llegar-mundial-imposible_0_Sv-dWAmyF.html,https://images.clarin.com/2021/11/18/uoaxFiLhP_720x0__1.jpg
83,ysha7MyIu,Cuántos se van y cuántos se quedan. Los cinco grandes de la Argentina tienen problemas técnicos,https://www.clarin.com/deportes/van-quedan-grandes-argentina-problemas-tecnicos_0_ysha7MyIu.html,https://images.clarin.com/2021/12/06/hRucOXV4t_720x0__1.jpg
84,aN_fhY76W,"Opinión. Gallardo, el más tranquilo de todos, decide qué lado de la balanza pesa más",https://www.clarin.com/deportes/gallardo-tranquilo-decide-lado-balanza-pesa_0_aN_fhY76W.html,https://images.clarin.com/2021/12/06/Mp5uBMhrf_720x0__1.jpg
85,Tq4FUNmDl,"El que sabe, sabe. Elogios a Maradona y Messi: el video de Xavi Hernández, más argentino que nunca",https://www.clarin.com/deportes/xavi-messi-maradona-mundiales-argentina_0_Tq4FUNmDl.html,https://images.clarin.com/2021/11/20/fsyL5exyv_1256x620__2.jpg#1638917652625
86,rCgXhMbBP,Antes de la final con Talleres. Battaglia decidió concentrar dos días tras el escándalo de los colombianos,https://www.clarin.com/deportes/boca-battaglia-decidio-concentrar-dias-final-despues-escandalo-colombianos_0_rCgXhMbBP.html,https://images.clarin.com/2021/11/02/ZomjhxdT8_720x0__1.jpg
87,BZCQVqDS2,Fórmula 1. La guerra entre Verstappen y Hamilton le puso punto final a la era de la diplomacia,https://www.clarin.com/deportes/formula-1-guerra-max-verstappen-lewis-hamilton-puso-punto-final-diplomacia_0_BZCQVqDS2.html,https://images.clarin.com/2021/12/03/RusSyGvwGM_720x0__1.jpg
88,Jwn28ST8c,Golf. Jorge Fernández Valdés se consagró en el Open de Argentina,https://www.clarin.com/deportes/jorge-fernandez-valdes-consagro-open-argentina_0_Jwn28ST8c.html,https://images.clarin.com/2021/12/06/vMdlOfKtI_720x0__1.jpg
