n,id,title,url,image
1,PfhXKvlcE,Quedaron filmados. Encapuchados atacaron con bombas molotov el edificio de Clarín,https://www.clarin.com/policiales/encapuchados-atacan-bombas-molotov-edificio-clarin_0_PfhXKvlcE.html,https://images.clarin.com/2021/11/23/MxwMUPMoP_720x0__1.jpg
2,4-r2jjAra,"Agresión de encapuchados. Comunicado del Grupo Clarín: ""Es una expresión violenta de intolerancia contra un medio""",https://www.clarin.com/sociedad/comunicado-grupo-clarin-ataque-expresion-violenta-intolerancia-medio-_0_4-r2jjAra.html,https://images.clarin.com/2021/11/23/NQy8Z64RG_720x0__1.jpg
3,Pvexx-hOY,Otra vez tensión bilateral. Cruce diplomático con Chile por las críticas del embajador Bielsa a Kast,https://www.clarin.com/politica/final-santiago-cafiero-debio-llamar-chile-descomprimir-conflicto-dichos-rafael-bielsa_0_Pvexx-hOY.html,https://images.clarin.com/2021/11/22/FoA1Wf7dx_1256x620__2.jpg#1637627005017
4,o0YBzKQbp,"Tensión cambiaria. El blue se mantiene estable, mientras el dólar MEP se despega",https://www.clarin.com/economia/dolar-blue-mantiene-201-5-dolar-mep-despega-avanza-208_0_o0YBzKQbp.html,https://images.clarin.com/2020/02/13/MA7_WOHR_720x0__1.jpg
5,dKi8_bvRV,A 30 años de un hito. Ocho días para fabricarlo y una rifa: la historia del último Falcon producido en el país,https://www.clarin.com/autos/ocho-dias-para-fabricarlo-y-una-rifa-asi-se-despidio-el-ultimo-falcon-producido-en-argentina_0_dKi8_bvRV.html,https://images.clarin.com/2021/11/19/LEDVwga9k_720x0__1.jpg
6,v7XpAY6K5,Nueva encuesta para 2023. Midieron a 5 presidenciables de Juntos por el Cambio: ganó Larreta y Manes quedó tercero,https://www.clarin.com/politica/midieron-5-presidenciables-juntos-cambio-gano-horacio-rodriguez-larreta-facundo-manes-quedo-tercero_0_v7XpAY6K5.html,https://images.clarin.com/2021/07/28/QuFXIalTK_720x0__1.jpg
7,SOw46_nmk,"""Lo que dice no es verdad"". Aníbal Fernández cruzó al intendente de El Bolsón por la violencia de grupos mapuches",https://www.clarin.com/politica/anibal-fernandez-cruzo-intendente-bolson-violencia-grupos-mapuches-dice-verdad-_0_SOw46_nmk.html,https://images.clarin.com/2021/09/28/gGK_Gap2Z_720x0__1.jpg
8,B6rMbOlGD,"Vacunación. ""¿Pega más?"": qué se sabe de los efectos de la tercera dosis contra el Covid",https://www.clarin.com/sociedad/-pega-sabe-efectos-tercera-dosis-covid_0_B6rMbOlGD.html,https://images.clarin.com/2021/11/17/bBH8k-6tO_1256x620__2.jpg#1637167959081
9,D9nmrchwJ,"Fechas confirmadas. Cómo viajar a precio ""regalado"" en los 7 fines de semana largos del 2022",https://www.clarin.com/servicios/oportunidad-viajar-precio-regalado-7-fines-semana-largos-2022_0_D9nmrchwJ.html,https://images.clarin.com/2021/11/22/zDhAQeU22_720x0__1.jpg
10,HtRSbjnD6,Especial Clarín. Tatuajes raros y piedras en los bolsillos: el misterio del cadáver en la Costanera,https://www.clarin.com/policiales/cadaver-fantasma-reserva-ecologica_0_HtRSbjnD6.html,https://images.clarin.com/2021/11/19/t2XMqMtNK_720x0__1.jpg
11,ZGHL_7idF,Es oficial. Uruguay quiere a Marcelo Gallardo y tiene un plan para intentar seducirlo,https://www.clarin.com/deportes/uruguay-quiere-marcelo-gallardo-plan-intentar-seducirlo_0_ZGHL_7idF.html,https://images.clarin.com/2020/12/24/zlbZ9n3j1_720x0__1.jpg
12,OWQsjagHn,Interna en La Doce. Qué se esconde detrás de la paliza a la ex cuñada de Rafa Di Zeo en la Bombonera,https://www.clarin.com/deportes/esconde-detras-brutal-paliza-ex-cunada-rafa-di-zeo-bombonera_0_OWQsjagHn.html,https://images.clarin.com/2021/11/23/qoOZxRzBN_720x0__1.jpg
13,hBBO4no23,"Un caso testigo. Cómo funcionó el plan ""heladera para todos"": el Gobierno, a punto de revertir la elección en un municipio",https://www.clarin.com/politica/funciono-plan-heladera-gobierno-punto-revertir-eleccion-general-rodriguez_0_hBBO4no23.html,https://images.clarin.com/2021/09/22/c1hcbhEgq_720x0__1.jpg
14,jsP56UfIM,Fiesta de consumo. Black Friday 2021: cuándo es y qué descuentos y cuotas ofrece cada banco,https://www.clarin.com/economia/black-friday-2021-descuentos-cuotas-ofrece-banco_0_jsP56UfIM.html,https://images.clarin.com/2020/04/15/4ULBpu2nv_720x0__1.jpg
15,jOs17_n81,"Gatillo fácil en Barracas. ""Julián manejó a los gritos cuatro cuadras, con Lucas en su falda, ensangrentado""",https://www.clarin.com/policiales/crimen-lucas-gonzalez-julian-manejo-gritos-cuadras-lucas-falda-ensangrentado-_0_jOs17_n81.html,https://images.clarin.com/2021/11/18/8XQg9z8zn_1256x620__4.jpg#1637670458471
16,qwBgL8UM3,"WhatsApp Delta. Por qué muchos se animan a instalar la versión ""más peligrosa"" de la app",https://www.clarin.com/tecnologia/whatsapp-delta-animan-instalar-version-peligrosa-app_0_qwBgL8UM3.html,https://images.clarin.com/2021/11/22/C0DgPFBZs_720x0__1.jpg
17,w6devBYUo,"Mano a mano con Clarín. Broun, el último arquero de Maradona: bizcochitos y el llanto sin explicación",https://www.clarin.com/deportes/fatura-broun-ultimo-arquero-maradona-bizcochitos-regalo-llanto-hijo-pudo-explicar_0_w6devBYUo.html,https://images.clarin.com/2021/11/05/7E5UM_9vh_720x0__1.jpg
18,p94APbX-u,Misión sin precedentes. La NASA lanza la nave DART para chocar contra un asteroide,https://www.clarin.com/sociedad/nasa-lanza-mision-precedentes-nave-dart-chocara-asteroide_0_p94APbX-u.html,https://images.clarin.com/2021/11/05/60UI_SUXx_720x0__1.jpg
19,JMf8NRKFC,"Fiesta en Mendoza. 20 restaurantes argentinos, entre los 100 mejores de Latinoamérica",https://www.clarin.com/gourmet/20-restaurantes-argentinos-100-mejores-latinoamerica_0_JMf8NRKFC.html,https://images.clarin.com/2021/11/22/Y5wGkKcbe_720x0__1.jpg
20,IyJFm1iSM,Inflación. EE.UU. libera sus reservas estratégicas de crudo para bajar el precio del petróleo,https://www.clarin.com/mundo/unidos-libera-reservas-estrategicas-crudo-bajar-precio-petroleo_0_IyJFm1iSM.html,https://images.clarin.com/2021/11/23/BL_w75nVs_1256x620__2.jpg#1637673375662
21,rjyYKpqRV,Histórico. Autorizan por primera vez en Italia el suicidio asistido a un hombre tetrapléjico,https://www.clarin.com/mundo/historico-autorizan-primera-vez-italia-suicidio-asistido-hombre-tetraplejico_0_rjyYKpqRV.html,https://images.clarin.com/2021/05/15/apMuP3H_u_1256x620__2.jpg#1637672149439
22,UaJrJsLwF,Haciendo historia. El origen del tango y su olvidada raíz afroamericana,https://www.clarin.com/viva/origen-tango-olvidada-raiz-afroamericana_0_UaJrJsLwF.html,https://images.clarin.com/2021/11/18/9ZQ-c1XKK_720x0__1.jpg
23,1GJ-lMQfs,Entrevista. Exclusiva con Halle Berry: dos costillas quebradas en su debut como realizadora,https://www.clarin.com/espectaculos/cine/exclusiva-halle-berry-costillas-quebradas-debut-realizadora_0_1GJ-lMQfs.html,https://images.clarin.com/2021/11/21/Zgy_g9QMr_720x0__1.jpg
24,tdGdthomZ,"Tigre campeón. Pablo Magnín, el filósofo del gol que siente un vacío existencial",https://www.clarin.com/deportes/tigre-campeon-pablo-magnin-filosofo-gol-siente-vacio-existencial_0_tdGdthomZ.html,https://images.clarin.com/2021/11/23/lW7lA6uOm_720x0__1.jpg
25,sPgjb-DFC,Investigadora urbana. La joven fotógrafa rusa Lana Sator revela sitios abandonados de la antigua URSS,https://www.clarin.com/fotogalerias/fotografa-rusa-lana-sator-recorrida-fotografica-sitios-abandonados-antigua-urss_5_sPgjb-DFC.html,
26,PfhXKvlcE,Quedaron filmados. Encapuchados atacaron con bombas molotov el edificio de Clarín,https://www.clarin.com/policiales/encapuchados-atacan-bombas-molotov-edificio-clarin_0_PfhXKvlcE.html,https://images.clarin.com/2021/11/23/MxwMUPMoP_720x0__1.jpg
27,4-r2jjAra,"Agresión de encapuchados. Comunicado del Grupo Clarín: ""Es una expresión violenta de intolerancia contra un medio""",https://www.clarin.com/sociedad/comunicado-grupo-clarin-ataque-expresion-violenta-intolerancia-medio-_0_4-r2jjAra.html,https://images.clarin.com/2021/11/23/NQy8Z64RG_720x0__1.jpg
28,Pvexx-hOY,Otra vez tensión bilateral. Cruce diplomático con Chile por las críticas del embajador Bielsa a Kast,https://www.clarin.com/politica/final-santiago-cafiero-debio-llamar-chile-descomprimir-conflicto-dichos-rafael-bielsa_0_Pvexx-hOY.html,https://images.clarin.com/2021/11/22/FoA1Wf7dx_1256x620__2.jpg#1637627005017
29,o0YBzKQbp,"Tensión cambiaria. El blue se mantiene estable, mientras el dólar MEP se despega",https://www.clarin.com/economia/dolar-blue-mantiene-201-5-dolar-mep-despega-avanza-208_0_o0YBzKQbp.html,https://images.clarin.com/2020/02/13/MA7_WOHR_720x0__1.jpg
30,dKi8_bvRV,A 30 años de un hito. Ocho días para fabricarlo y una rifa: la historia del último Falcon producido en el país,https://www.clarin.com/autos/ocho-dias-para-fabricarlo-y-una-rifa-asi-se-despidio-el-ultimo-falcon-producido-en-argentina_0_dKi8_bvRV.html,https://images.clarin.com/2021/11/19/LEDVwga9k_720x0__1.jpg
31,v7XpAY6K5,Nueva encuesta para 2023. Midieron a 5 presidenciables de Juntos por el Cambio: ganó Larreta y Manes quedó tercero,https://www.clarin.com/politica/midieron-5-presidenciables-juntos-cambio-gano-horacio-rodriguez-larreta-facundo-manes-quedo-tercero_0_v7XpAY6K5.html,https://images.clarin.com/2021/07/28/QuFXIalTK_720x0__1.jpg
32,SOw46_nmk,"""Lo que dice no es verdad"". Aníbal Fernández cruzó al intendente de El Bolsón por la violencia de grupos mapuches",https://www.clarin.com/politica/anibal-fernandez-cruzo-intendente-bolson-violencia-grupos-mapuches-dice-verdad-_0_SOw46_nmk.html,https://images.clarin.com/2021/09/28/gGK_Gap2Z_720x0__1.jpg
33,EuOXHVNk9,Tras el escándalo. El ex de la amante de Gago comenzó una relación con la periodista Marcela Pagano,https://www.clarin.com/fama/escandalo-ex-amante-fernando-gago-comenzo-relacion-periodista-marcela-pagano_0_EuOXHVNk9.html,https://images.clarin.com/2021/11/23/nGSXhvQDO_720x0__1.jpg
34,t7hBkrlQI,"En Instagram. Tamara Báez, la novia de L-Gante,  revolucionó las redes con sus fotos: ""A dos meses de ser mami""",https://www.clarin.com/fama/tamara-baez-novia-l-gante-revoluciono-redes-fotos-meses-mami-_0_t7hBkrlQI.html,https://images.clarin.com/2021/11/22/WDEj9FsCp_720x0__1.jpg
35,YhBHNBOd1,"Fuerte versión. Nelson Castro aseguró que Diego Maradona ""fue enterrado sin el corazón"" y explicó el motivo",https://www.clarin.com/fama/nelson-castro-aseguro-diego-maradona-enterrado-corazon-explico-motivo_0_YhBHNBOd1.html,https://images.clarin.com/2021/11/22/cKNyRl-Qw_720x0__1.jpg
36,_F5D1egEc,"A qué se dedica. Era figura de ShowMatch, pero dejó todo: cómo es la nueva vida de Belén Pouchan en Dubai",https://www.clarin.com/fama/figura-showmatch-dejo-pais-nueva-vida-dedica-belen-pouchan-dubai_0__F5D1egEc.html,https://images.clarin.com/2021/11/22/ObUAYXLjo_720x0__1.jpg
37,QXtzBBquK,Finanzas personales. Los 5 errores más comunes que afectan el bolsillo: cuáles son y cómo evitarlos,https://www.clarin.com/servicios/5-errores-comunes-afectan-bolsillo-evitarlos_0_QXtzBBquK.html,https://images.clarin.com/2020/11/13/SQWM8kJZi_720x0__1.jpg
38,iIWUt08tL,Precios comparados. ¿Micro o avión? Cuál es más barato ahora para viajar a cada destino del país,https://www.clarin.com/servicios/-micro-avion-barato-ahora-viajar-destino-turistico-pais_0_iIWUt08tL.html,https://images.clarin.com/2021/11/01/leSrmAoyX_720x0__1.jpg
39,wSnyyEgPp,"""Bitcoin blue"". Cómo funciona el sistema persona a persona que no paga el impuesto al cheque",https://www.clarin.com/servicios/bitcoin-blue-funciona-sistema-persona-persona-paga-impuesto-cheque_0_wSnyyEgPp.html,https://images.clarin.com/2021/09/22/MCM6I4paq_720x0__1.jpg
40,TTRFs_LtV,Humor político. Equipo chico LPQTP,https://www.clarin.com/opinion/equipo-chico-lpqtp_0_TTRFs_LtV.html,https://images.clarin.com/2021/11/20/q7YivgiUR_720x0__1.jpg
41,D-sHNVvu4,"Entrevista con Clarín. ""La relación con el médico cambiará"", el pronóstico de un científico sobre la salud post pandemia",https://www.clarin.com/sociedad/-relacion-medico-cambiara-pronostico-cientifico-salud-post-pandemia_0_D-sHNVvu4.html,https://images.clarin.com/2021/11/21/yzKITDvtB_1256x620__2.jpg#1637540552972
42,Sv-dWAmyF,Qatar 2022. La odisea de los hinchas argentinos para llegar al Mundial imposible,https://www.clarin.com/servicios/qatar-2022-odisea-hinchas-argentinos-llegar-mundial-imposible_0_Sv-dWAmyF.html,https://images.clarin.com/2021/11/18/uoaxFiLhP_720x0__1.jpg
43,qzHnl8JmC,La caída de Alperovich. El legislador más rico del país se queda sin fueros y lo acorrala la Justicia,https://www.clarin.com/especiales/caida-alperovich-queda-fueros-acorrala-justicia-denuncias-abuso_0_qzHnl8JmC.html,https://images.clarin.com/2021/10/29/wHW65Lf-7_720x0__1.jpg
44,lyv8I6NIN,El segundo a los inlgeses. Anatomía del gol más grande del mundo: la obra maestra del Diez cómo nunca la viste,https://www.clarin.com/deportes/anatomia-gol-grande-mundo-obra-maestra-diego-maradona_0_lyv8I6NIN.html,https://images.clarin.com/2021/06/17/-ieSnq3Y6_720x0__1.jpg
45,QYZ1y_wYH,Literatura y plástica. Misteriosa Buenos Aires: 11 rincones del arte porteño con secretos para explorar,https://www.clarin.com/ciudades/misteriosa-buenos-aires-11-rincones-arte-porteno-secretos-explorar_0_QYZ1y_wYH.html,https://images.clarin.com/2021/11/11/BD1JOPOew_720x0__1.jpg
46,e-dBBJd-t,Vuelve El Matador. Tigre le ganó al Barracas Central de Chiqui Tapia y volvió a Primera,https://www.clarin.com/deportes/tigre-gano-barracas-central-chiqui-tapia-volvio-primera_0_e-dBBJd-t.html,https://images.clarin.com/2021/11/22/19wXKxH2I_720x0__1.jpg
47,0RMBV-Plg,"Vuelve a Primera. El DT y el plantel de Tigre: ""Esto fue un equipo de hombres, fue justo el fútbol""",https://www.clarin.com/deportes/desahogo-dt-jugadores-tigre-equipo-hombres-justo-futbol-_0_0RMBV-Plg.html,https://images.clarin.com/2021/11/23/5TjvZ9939_720x0__1.jpg
48,VBBxolqqQ,"""Adaptado al PSG"". Messi ya palpita Qatar 2022:  ""La ilusión y el sueño siempre están""",https://www.clarin.com/deportes/messi-qatar-2022-ilusion-sueno-final_0_VBBxolqqQ.html,https://images.clarin.com/2021/11/23/__9Wj2OoI_720x0__1.jpg
49,8qsQ0j7pA,"Opinión. Con River al borde del título, por qué Gallardo debería bajarse de su propio éxito",https://www.clarin.com/deportes/river-borde-titulo-gallardo-deberia-bajarse-propio-exito_0_8qsQ0j7pA.html,https://images.clarin.com/2021/11/21/2PF2V8ZwY_720x0__1.jpg
50,3zEcPJNC2,"Mensaje del DT. Boca se enfoca en entrar a la Libertadores, pero no se olvida de 2022",https://www.clarin.com/deportes/boca-enfoca-entrar-libertadores-deja-pensar-2022-claro-mensaje-battaglia-renovaciones-cardona-pavon-salvio_0_3zEcPJNC2.html,https://images.clarin.com/2021/11/22/f5eqFbYTb_720x0__1.jpg
51,TS69gyuDC,Faltan 4 fechas. Qué necesita River para ser campeón este jueves ante Racing,https://www.clarin.com/deportes/necesita-river-campeon-jueves-racing_0_TS69gyuDC.html,https://images.clarin.com/2021/11/22/U0ZnvSrWH_720x0__1.jpg
52,qhs212h_r,Indicadores en rojo. Tensión cambiaria: los economistas dicen que no aflojará en diciembre pese al ingreso de dólares,https://www.clarin.com/economia/tension-cambiaria-economistas-dicen-aflojara-diciembre-pese-ingreso-dolares_0_qhs212h_r.html,https://images.clarin.com/2021/08/19/FB1ICEn6i_720x0__1.jpg
53,wIbL1G7ki,Lo sugirió Feletti. El campo rechaza la posible suba de retenciones y analiza medidas de fuerza,https://www.clarin.com/rural/campo-rechaza-analiza-medidas-fuerza-posible-suba-retenciones_0_wIbL1G7ki.html,https://images.clarin.com/2018/09/12/OCdStEPwZ_720x0__1.jpg
54,KSsN7VWyM,"Opinión. Para el CEO de AA2000, un acuerdo con el FMI ayudaría a mejorar los planes de inversión de las empresas",https://www.clarin.com/economia/ceo-aa2000-acuerdo-fmi-ayudaria-mejorar-planes-inversion-empresas_0_KSsN7VWyM.html,https://images.clarin.com/2021/11/22/wQdm4g491_720x0__1.jpg
55,S0ZxY5QYY,Finanzas digitales. Mercado Libre permitirá a sus usuarios en Brasil operar con criptomonedas,https://www.clarin.com/economia/mercado-libre-permitira-usuarios-brasil-operar-criptomonedas_0_S0ZxY5QYY.html,https://images.clarin.com/2021/11/16/kiFPAT4S0_720x0__1.jpg
56,gdAnm8CfD,Autos. Concesionarias: la escasez de 0km es más por falta de dólares que de chips,https://www.clarin.com/economia/autos-escasez-0km-falta-dolares-chips-dicen-concesionarias_0_gdAnm8CfD.html,https://images.clarin.com/2021/03/30/392MXONRZ_720x0__1.jpg
57,WiSqKYYv_,"Anticipada. Jubilados docentes universitarios: en diciembre la suba será del 8,77%",https://www.clarin.com/economia/jubilados-docentes-universitarios-aumento-diciembre-8-77-_0_WiSqKYYv_.html,https://images.clarin.com/2019/08/15/3X6hLLArz_720x0__1.jpg
