n,id,title,url,image
1,I8BzLfXw_,La negociación con el FMI. Larreta ratificó que no irá a la reunión convocada por Guzmán: “Es mucho más política que en serio”,https://www.clarin.com/politica/rodriguez-larreta-ratifico-ira-reunion-convocada-martin-guzman-politica-trabajo-_0_I8BzLfXw_.html,https://images.clarin.com/2022/01/04/6RuDsrjyF_720x0__1.jpg
2,gX2qWH8rA,Tercera ola de Covid. Quirós pidió que la ANMAT autorice los autotest ante la fuerte demanda de hisopados,https://www.clarin.com/politica/fernan-quiros-pidio-anmat-libere-autotest-covid-19-fuerte-demanda-hisopados-importante-_0_gX2qWH8rA.html,https://images.clarin.com/2021/12/17/RPVsh_Ql3_720x0__1.jpg
3,r0rdQOEqq,Positivos en alza. Explosión de casos: por qué es más fácil contagiarse con Delta y Ómicron,https://www.clarin.com/sociedad/explosion-casos-facil-contagiarse-delta-omicron-ocurre_0_r0rdQOEqq.html,https://images.clarin.com/2022/01/03/XOMBT53_w_720x0__1.jpg
4,RqzomUSJ7,Récord mundial. Estados Unidos registró más de un millón de casos de Covid en un solo día,https://www.clarin.com/mundo/record-mundial-unidos-registra-millon-casos-covid-19-ultimas-24-horas_0_RqzomUSJ7.html,https://images.clarin.com/2022/01/04/DtNDlW_oa_720x0__1.jpg
5,99RZvnb_g,Tarifas impactantes. Ya venden pasajes a Qatar 2022: cuánto cuesta un vuelo al Mundial desde Buenos Aires,https://www.clarin.com/servicios/venden-pasajes-qatar-2022-cuesta-vuelo-mundial-buenos-aires_0_99RZvnb_g.html,https://images.clarin.com/2017/03/22/ry4hwJx2g_720x0.jpg
6,F0xT28w2D,Del editor. El cuatriciclo nuestro de cada verano,https://www.clarin.com/opinion/cuatriciclo-verano_0_F0xT28w2D.html,https://images.clarin.com/2022/01/02/nSIrsXWCh_720x0__1.jpg
7,S9mQi-U-f,"Hoy lo indagan. Robo y uso de armas de guerra, detrás del asesino al volante en Palermo",https://www.clarin.com/ciudades/conductor-atropello-mato-palermo-antecedentes-familia-victima-pide-liberen_0_S9mQi-U-f.html,https://images.clarin.com/2022/01/02/WPz84txM3_1256x620__3.jpg#1641248137037
8,gN9eW_RsT,Para mayores de 18. Aprender a programar gratis: cómo anotarse al curso con el que se puede ganar $ 300.000 al mes,https://www.clarin.com/servicios/aprender-programar-gratis-anotarse-curso-puede-ganar-300-000-mes_0_gN9eW_RsT.html,https://images.clarin.com/2021/04/04/cxeF72zG3_720x0__1.jpg
9,w9PhSWVUG,"Video y polémica en Chubut. Una jueza, ""a los besos"" con un preso al que había condenado por matar a un policía",https://www.clarin.com/policiales/polemica-chubut-video-jueza-besos-preso-condenado-matar-policia_0_w9PhSWVUG.html,https://images.clarin.com/2022/01/03/hBwqI_YJI_720x0__1.jpg
10,m1EdK_wpV,Especial Clarín. Mundo verdulería: 10 secretos del negocio que explotó en pandemia,https://www.clarin.com/sociedad/mundo-verduleria-10-secretos-negocio-exploto-pandemia_0_m1EdK_wpV.html,https://images.clarin.com/2021/12/20/MSbLfu4yR_720x0__1.jpg
11,HUM-tOE3p,Brasil. Bolsonaro superó la obstrucción intestinal y descartan una nueva cirugía,https://www.clarin.com/mundo/jair-bolsonaro-supero-obstruccion-intestinal-medicos-descartaron-nueva-cirugia_0_HUM-tOE3p.html,https://images.clarin.com/2022/01/04/cuQYjgpUA_1256x620__2.jpg#1641301087735
12,Rqp-5PUvh,Polémica decisión. Djokovic recibió un permiso especial y podrá jugar en Australia sin vacunarse,https://www.clarin.com/deportes/novak-djokovic-recibio-exencion-vacuna-coronavirus-jugara-australian-open_0_Rqp-5PUvh.html,https://images.clarin.com/2022/01/04/73uqy6c9E_720x0__1.jpg
13,ttnNlcO_r,Tenía 14 años. Un adolescente murió mientras jugaba con una lona enjabonada en su cumpleaños,https://www.clarin.com/sociedad/adolescente-murio-jugaba-lona-enjabonada-fiesta-cumpleanos-rios_0_ttnNlcO_r.html,https://images.clarin.com/2022/01/04/3YChPHvQr_720x0__1.jpg
14,NFONrWeqy,Inédita decisión en Corrientes. Vio morir ahogado a su padre y fue demandado por su madre y una hermana,https://www.clarin.com/policiales/vio-morir-ahogado-padre-inedita-decision-demandado-madre-hermana_0_NFONrWeqy.html,https://images.clarin.com/2021/09/10/TEo21r9hi_720x0__1.jpg
15,u5LwAANEJ,Brutal accidente en Neuquén. Una familia destruida por un choque: murieron dos mujeres y dos chicos,https://www.clarin.com/sociedad/familia-destruida-choque-neuquen-murieron-mujeres-chicos-8-14-anos_0_u5LwAANEJ.html,https://images.clarin.com/2022/01/03/8Sm32Y6h5_720x0__1.jpg
16,CAIikvgIs,Reclamos y sanciones. Siguen los cortes de luz en el AMBA: son más de 32.000 los usuarios sin servicio,https://www.clarin.com/sociedad/siguen-cortes-luz-ciudad-conurbano-32-000-usuarios-servicio_0_CAIikvgIs.html,https://images.clarin.com/2022/01/01/q7dp-FtVA_720x0__1.jpg
17,daBIqi-4o,Coronavirus en Argentina. Tercera ola y refuerzo: qué pasa si me vacuno sin saber que tengo Covid,https://www.clarin.com/sociedad/tercera-ola-refuerzo-pasa-vacuno-saber-covid_0_daBIqi-4o.html,https://images.clarin.com/2021/12/31/jJFyp8A7O_720x0__1.jpg
18,sdoM-e4RV,"Sus otras ""profesiones"". Sandro: a 12 años de su muerte, los lados desconocidos del ídolo",https://www.clarin.com/espectaculos/musica/sandro-12-anos-muerte-lados-desconocidos-idolo_0_sdoM-e4RV.html,https://images.clarin.com/2019/12/26/1NnGDtio_720x0__1.jpg
19,gWU93nT1Ts,"Temporada 2022. Las fotos del verano en Mar del Plata, Pinamar y Punta del Este",https://www.clarin.com/fotogalerias/todas-fotos-verano-mar-plata-pinamar-punta-clarin_5_gWU93nT1Ts.html,
20,QDemYIogN,Quieren a Suárez y a Cavani. Gastan millones en figuras: ¿de dónde sacan la plata los equipos brasileños?,https://www.clarin.com/deportes/sacan-plata-equipos-brasilenos_0_QDemYIogN.html,https://images.clarin.com/2021/11/27/rcpXcpAlW_720x0__1.jpg
21,HJrMotSwR,"La fundadora de Theranos. Declararon culpable de estafa a Elizabeth Holmes, la multimillonaria más joven",https://www.clarin.com/mundo/declararon-culpable-estafa-elizabeth-holmes-multimillonaria-joven-mundo_0_HJrMotSwR.html,https://images.clarin.com/2022/01/03/x3t8BVAts_720x0__1.jpg
22,lEDGzY9Av,Verano 2022. Clásicos y nuevos: 7 restaurantes imperdibles en Mar del Plata,https://www.clarin.com/gourmet/clasicos-nuevos-7-restaurantes-imperdibles-mar-plata_0_lEDGzY9Av.html,https://images.clarin.com/2022/01/04/oc9jwbsDv_1256x620__2.jpg#1641266431839
23,GWtShBG2z,"Detrás de la viralización. Abraham Gómez, el ilustrador que se gana la vida dibujando mapas de ciudades a mano alzada",https://www.clarin.com/ciudades/abraham-gomez-ilustrador-gana-vida-dibujando-mapas-ciudades-mano-alzada_0_GWtShBG2z.html,https://images.clarin.com/2021/12/24/ehyuKHf2a_720x0__1.jpg
24,3TM3OrAyD,Operación Auca. Quisieron evangelizar una tribu amazónica y todo terminó muy mal: su historia,https://www.clarin.com/internacional/historia-misioneros-quisieron-evangelizar-tribu-termino-mal_0_3TM3OrAyD.html,https://images.clarin.com/2022/01/03/Wf3FYi3Nt_720x0__1.jpg
25,SVuUdmiNG,Fantasía de a tres. Tríos sexuales y pareja: cómo elegir a la tercera persona,https://www.clarin.com/relaciones/trios-sexuales-pareja-elegir-tercera-persona_0_SVuUdmiNG.html,https://images.clarin.com/2021/12/31/qCEG-z3nY_720x0__1.jpg
26,I8BzLfXw_,La negociación con el FMI. Larreta ratificó que no irá a la reunión convocada por Guzmán: “Es mucho más política que en serio”,https://www.clarin.com/politica/rodriguez-larreta-ratifico-ira-reunion-convocada-martin-guzman-politica-trabajo-_0_I8BzLfXw_.html,https://images.clarin.com/2022/01/04/6RuDsrjyF_720x0__1.jpg
27,gX2qWH8rA,Tercera ola de Covid. Quirós pidió que la ANMAT autorice los autotest ante la fuerte demanda de hisopados,https://www.clarin.com/politica/fernan-quiros-pidio-anmat-libere-autotest-covid-19-fuerte-demanda-hisopados-importante-_0_gX2qWH8rA.html,https://images.clarin.com/2021/12/17/RPVsh_Ql3_720x0__1.jpg
28,r0rdQOEqq,Positivos en alza. Explosión de casos: por qué es más fácil contagiarse con Delta y Ómicron,https://www.clarin.com/sociedad/explosion-casos-facil-contagiarse-delta-omicron-ocurre_0_r0rdQOEqq.html,https://images.clarin.com/2022/01/03/XOMBT53_w_720x0__1.jpg
29,RqzomUSJ7,Récord mundial. Estados Unidos registró más de un millón de casos de Covid en un solo día,https://www.clarin.com/mundo/record-mundial-unidos-registra-millon-casos-covid-19-ultimas-24-horas_0_RqzomUSJ7.html,https://images.clarin.com/2022/01/04/DtNDlW_oa_720x0__1.jpg
30,99RZvnb_g,Tarifas impactantes. Ya venden pasajes a Qatar 2022: cuánto cuesta un vuelo al Mundial desde Buenos Aires,https://www.clarin.com/servicios/venden-pasajes-qatar-2022-cuesta-vuelo-mundial-buenos-aires_0_99RZvnb_g.html,https://images.clarin.com/2017/03/22/ry4hwJx2g_720x0.jpg
31,F0xT28w2D,Del editor. El cuatriciclo nuestro de cada verano,https://www.clarin.com/opinion/cuatriciclo-verano_0_F0xT28w2D.html,https://images.clarin.com/2022/01/02/nSIrsXWCh_720x0__1.jpg
32,S9mQi-U-f,"Hoy lo indagan. Robo y uso de armas de guerra, detrás del asesino al volante en Palermo",https://www.clarin.com/ciudades/conductor-atropello-mato-palermo-antecedentes-familia-victima-pide-liberen_0_S9mQi-U-f.html,https://images.clarin.com/2022/01/02/WPz84txM3_1256x620__3.jpg#1641248137037
33,iFnpFBvct,"Engaños, insultos y amenazas. Matías Defederico publicó un fuerte audio de Cinthia Fernández amenazándolo de muerte ",https://www.clarin.com/fama/matias-defederico-publico-fuerte-audio-cinthia-fernandez-amenazandolo-muerte-clavo-cuchillo-_0_iFnpFBvct.html,https://images.clarin.com/2022/01/04/VzFXJc25u_720x0__1.jpg
34,QrBAauhJL,"¡Mirá el video!. El drama de Diego Pérez : ""Mis vacaciones empezaron con el pie izquierdo""",https://www.clarin.com/fama/drama-diego-perez-vacaciones-empezaron-pie-izquierdo-_0_QrBAauhJL.html,https://images.clarin.com/2022/01/03/soa0m0f8q_720x0__1.jpg
35,dcMalIZnw,Escándalo. Daniel Osvaldo se peleó con Gianinna Maradona y se lo vio a los besos con otra chica,https://www.clarin.com/fama/daniel-osvaldo-peleo-gianinna-maradona-vio-besos-chica_0_dcMalIZnw.html,https://images.clarin.com/2022/01/03/FZXK4Gy4c_720x0__1.jpg
36,cG8yswvgB,Segundo round. Fernando Burlando pidió la detención de L-Gante en la causa por tentativa de homicidio,https://www.clarin.com/fama/fernando-burlando-pidio-detencion-l-gante-causa-tentativa-homicidio_0_cG8yswvgB.html,https://images.clarin.com/2022/01/03/qSfCEcc0a_720x0__1.jpg
37,DARLe9vRZ,Especial Clarín. Anuario 2021: 12 meses en 12 fotos que marcaron el año,https://www.clarin.com/sociedad/12-meses-12-fotos-marcaron-ano_0_DARLe9vRZ.html,https://images.clarin.com/2021/12/21/7cai5MZiW_720x0__1.jpg
38,z5tXbKtWj,Borrón y cuenta nueva. Las 5 claves para poner en orden las finanzas y tener un 2022 exitoso,https://www.clarin.com/servicios/5-claves-poner-orden-finanzas-personales-tener-2022-exitoso_0_z5tXbKtWj.html,https://images.clarin.com/2021/04/30/45b6-rIu0_720x0__1.jpg
39,o1VbT49CP,Encuesta nacional. Midieron a los personajes más influyentes y Alberto F. quedó abajo de Milei,https://www.clarin.com/politica/midieron-personajes-influyentes-ano-alberto-fernandez-quedo-abajo-javier-milei_0_o1VbT49CP.html,https://images.clarin.com/2021/12/29/mo9Bwzdha_720x0__1.jpg
40,IQblRJpNK,"Tendencias. Metaverso, mini PCs y más: las 7 novedades tech que marcarán agenda en 2022",https://www.clarin.com/tecnologia/acontecimientos-marcaran-agenda-tecnologica-2022_0_IQblRJpNK.html,https://images.clarin.com/2021/12/27/COd0lHbob_720x0__1.jpg
41,772fmAfVl,Modelos hogareños. Cortes de luz: cuánto cuesta un grupo electrógeno y cómo elegirlo,https://www.clarin.com/servicios/cortes-luz-cuesta-ahora-grupo-electrogeno-elegirlo_0_772fmAfVl.html,https://images.clarin.com/2020/12/10/FagyYTh5i_720x0__1.jpg
42,2q9ie4r2d,Mundo. El último sobreviviente de las Torres Gemelas,https://www.clarin.com/mundo/ultimo-sobreviviente_0_2q9ie4r2d.html,https://images.clarin.com/2021/09/07/PWjdezPAa_720x0__1.jpg
43,lyv8I6NIN,Deportes. Diego Maradona: anatomía del gol más grande del mundo,https://www.clarin.com/deportes/anatomia-gol-grande-mundo-obra-maestra-diego-maradona_0_lyv8I6NIN.html,https://images.clarin.com/2021/06/17/-ieSnq3Y6_720x0__1.jpg
44,FbGcuI55-,Cultura. Viaje a la cabeza del muralista Martín Ron: así se hace una obra de arte,https://www.clarin.com/cultura/martin-ron-muralismo-muralista-arte_0_FbGcuI55-.html,https://images.clarin.com/2021/04/07/arhw6r0s4_720x0__1.jpg
45,4gC_EpQq7,Sociedad. 100.000 muertes: el semáforo del Covid en la Argentina,https://www.clarin.com/sociedad/100-000-muertos-covid-argentina-semaforo-primeros-500-dias-pandemia_0_4gC_EpQq7.html,https://images.clarin.com/2021/07/12/tjHQTSy1Z_720x0__1.jpg
46,qll_2nEGM,La vuelta del fútbol argentino. Más de 60 contagios de coronavirus en el regreso a los entrenamientos,https://www.clarin.com/deportes/coronavirus-golpea-equipos-comenzaron-pretemporada-velez-aldosivi-lanus-positivos-planteles_0_qll_2nEGM.html,https://images.clarin.com/2022/01/03/J6NqUt9Sa_720x0__1.jpg
47,c4mzv1toc,"Empezó la pretemporada. Fabra y Battaglia, aislados por síntomas: se sumaron a las ocho bajas por Covid",https://www.clarin.com/deportes/boca-endurece-controles-covid-pretemporada-futbolistas-dieron-positivo-aislados_0_c4mzv1toc.html,https://images.clarin.com/2021/12/14/5Pk7MysSC_720x0__1.jpg
48,ErfoUt-Ll,Está cerrado. Independiente tiene nuevo DT: Domínguez llegó a un acuerdo y firmará por un año,https://www.clarin.com/deportes/independiente-nuevo-dt-eduardo-dominguez-llego-acuerdo-firmara-ano_0_ErfoUt-Ll.html,https://images.clarin.com/2021/06/04/oyknRE90n_720x0__1.jpg
49,GlVZxpnHO,"La furia de la Bruja. Cansado de las críticas, Verón explotó en las redes con un fuerte mensaje",https://www.clarin.com/deportes/veron-estudiantes-exploto-redes-histeria_0_GlVZxpnHO.html,https://images.clarin.com/2022/01/04/qIcibYzLOa_720x0__1.jpg
50,bUYElSO7h,Frente a Doncic. NBA: a Denver no le alcanzó la intensidad de Campazzo y cayó ante Dallas,https://www.clarin.com/deportes/nba-denver-alcanzo-intensidad-facundo-campazzo-cayo-dallas_0_bUYElSO7h.html,https://images.clarin.com/2022/01/04/1342718oO_720x0__1.jpg
51,RF2gwWjLQ,San Lorenzo. Troglio ya piensa en los refuerzos pero deben levantar una inhibición del TAS,https://www.clarin.com/deportes/pedro-troglio-pone-primera-san-lorenzo-puestos-reforzar-levantar-inhibicion-palestino-chile_0_RF2gwWjLQ.html,https://images.clarin.com/2020/01/09/hSaCUgn0y_720x0__1.jpg
52,EN-losOhf,"La salida del congelamiento. Tensiones y dura pulseada por la canasta de ""precios regulados""",https://www.clarin.com/economia/tensiones-duras-pulseadas-canasta-precios-regulados-_0_EN-losOhf.html,https://images.clarin.com/2021/10/26/fJ5YR-4d__720x0__1.jpg
53,6ss7CXqeA,"Repercusiones. Cepo a 7 cortes de carne: el campo, entre las críticas y la aceptación",https://www.clarin.com/rural/cepo-7-cortes-carne-opiniones-campo-van-criticas-aceptacion_0_6ss7CXqeA.html,https://images.clarin.com/2021/11/25/mMuoR5qeD_720x0__1.jpg
54,QxM6SVzTq,Banco por banco. Qué promos y descuentos ofrecen para comprar los regalos de Reyes Magos,https://www.clarin.com/economia/banco-banco-promos-descuentos-ofrecen-comprar-regalos-reyes-magos_0_QxM6SVzTq.html,https://images.clarin.com/2022/01/03/-zFYmllf5_720x0__1.jpg
55,1nvYkbS4M,Propuesta ante el Fondo. En Economía dicen que buscan un acuerdo de precios y salarios,https://www.clarin.com/economia/gobierno-negocia-acuerdo-precios-salarios-fmi_0_1nvYkbS4M.html,https://images.clarin.com/2021/12/22/iV5epPV06_720x0__1.jpg
56,ju72_u1_5,"Datos de 2021. Con el empuje de las retenciones, la recaudación creció más que la inflación",https://www.clarin.com/economia/recaudacion-crecio-65-8-2021-encima-inflacion_0_ju72_u1_5.html,https://images.clarin.com/2021/11/17/0T0_qdwPh_720x0__1.jpg
57,2APWJq41E,"Fiscalización. Por los cortes de luz, el Gobierno pone una veedora en Edesur",https://www.clarin.com/economia/cortes-luz-gobierno-pone-veedora-edesur_0_2APWJq41E.html,https://images.clarin.com/2022/01/01/q7dp-FtVA_720x0__1.jpg
