n,id,title,url,image
1,NPlhdHpwzS,Nueva flexibilización. Dejan de exigir PCR negativo para entrar al país a los argentinos y residentes con vacunación completa,https://www.clarin.com/sociedad/gobierno-dejara-exigir-pcr-negativo-ingreso-pais-argentinos-residentes_0_NPlhdHpwzS.html,https://images.clarin.com/2021/11/08/bgHO5hjuE_720x0__1.jpg
2,1KV794Dgxx,"Del editor al lector. Ricardo Alfonsín y Polak, cara y ceca de la política argentina en la embajada de Madrid",https://www.clarin.com/opinion/ricardo-alfonsin-polak-cara-ceca-politica-argentina-embajada-madrid_0_1KV794Dgxx.html,https://images.clarin.com/2022/01/26/Ae1bZH5AD_720x0__1.jpg
3,yOAS62PZMY,"En foco. Las repetidas alucinaciones kirchneristas, ahora con el FMI",https://www.clarin.com/opinion/ahora-fmi-repetidas-alucionaciones-kirchneristas_0_yOAS62PZMY.html,https://images.clarin.com/2022/01/24/17h9Blc6__720x0__1.jpg
4,ILIT9Nc5Mh,"Escenario. Aunque parezca mentira, el Gobierno aún no definió si le pagará al FMI",https://www.clarin.com/opinion/parezca-mentira-definieron-pagaran-fmi_0_ILIT9Nc5Mh.html,https://images.clarin.com/2022/01/25/B27rgEh36_720x0__1.jpg
5,GJDYnkMSQt,Crédito ultra subsidiado. Aires y heladeras en 30 cuotas: qué se consigue a días de que venza el plan oficial,https://www.clarin.com/servicios/aires-heladeras-30-cuotas-consigue-dias-venza-plan-oficial_0_GJDYnkMSQt.html,https://images.clarin.com/2022/01/25/kNWOi3ikA_720x0__1.jpg
6,32VBhGItUA,La pandemia. Aislados en la misma casa: 8 claves para convivir con un caso positivo y no contagiarse,https://www.clarin.com/sociedad/aislados-misma-casa-8-claves-convivir-caso-covid-positivo-evitar-contagiarse_0_32VBhGItUA.html,https://images.clarin.com/2022/01/25/RZgg16u3Y_1256x620__2.jpg#1643157060925
7,IZ1llJz2cQ,No hay detenidos. México: asesinaron a un argentino de dos disparos en la cabeza en Playa del Carmen,https://www.clarin.com/mundo/mexico-argentino-asesinado-disparos-cabeza-playa-carmen_0_IZ1llJz2cQ.html,https://images.clarin.com/2022/01/26/6ac1X5V3w_720x0__1.jpg
8,8su6VnFfTf,Tenía 6 años. Qué reveló la autopsia a la nena que fue al hospital por un raspón y murió,https://www.clarin.com/sociedad/revelo-autopsia-nena-6-anos-hospital-raspon-murio_0_8su6VnFfTf.html,https://images.clarin.com/2022/01/20/TQIP-fhN6_720x0__1.jpg
9,AEZicEljM8,Guía paso a paso. Cortes de luz: cómo pedir el resarcimiento económico a Edenor y Edesur,https://www.clarin.com/servicios/cortes-luz-pedir-resarcimiento-economico-edenor-edesur_0_AEZicEljM8.html,https://images.clarin.com/2016/02/18/Hkgc-PyJ4e_720x0.jpg
10,mn7mWvCNPU,Especial Clarín. Tensión en Ucrania: ¿es posible una guerra entre Rusia y Estados Unidos?,https://www.clarin.com/mundo/tension-baltico-posible-desate-guerra-rusia-ucrania-_0_mn7mWvCNPU.html,https://images.clarin.com/2022/01/21/OFwRbM7SD_720x0__1.jpg
11,Nf1TH6prJI,Murió en 2020. Kobe Bryant: la herencia y el conflicto que separó a su viuda de su propia madre,https://www.clarin.com/deportes/anos-muerte-kobe-bryant-millonaria-herencia-conflicto-separo-viuda-propia-madre_0_Nf1TH6prJI.html,https://images.clarin.com/2022/01/25/fMfLlyNE8_720x0__1.jpg
12,nNVvdCbSiR,En La Plata. Boca sufrió hasta el final pero le ganó a San Lorenzo y se llevó el Torneo de Verano,https://www.clarin.com/deportes/boca-vs-san-lorenzo-torneo-verano-horario-tv-formaciones-directo_0_nNVvdCbSiR.html,https://images.clarin.com/2022/01/25/0yWf3x6AI_1256x620__2.jpg#1643164427499
13,XcusrInTip,Escala imprevista. Alberto Fernández irá a Barbados en su regreso de la gira por Rusia y China,https://www.clarin.com/politica/alberto-fernandez-ira-barbados-regreso-gira-rusia-china_0_XcusrInTip.html,https://images.clarin.com/2020/11/19/NeNnu8M4V_720x0__1.jpg
14,fnvHqQEvo2,Tragedia en Córdoba. Un adolescente de 14 años murió electrocutado al tocar un poste de luz en una plaza,https://www.clarin.com/sociedad/cordoba-adolescente-14-anos-murio-electrocutado-tocar-poste-luz_0_fnvHqQEvo2.html,https://images.clarin.com/2022/01/26/fZcwGSxvB_720x0__1.jpg
15,OvrpkOi6BJ,"Confesiones del mejor. Usain Bolt, exclusivo para Clarín: ""No extraño correr y mucho menos entrenarme""",https://www.clarin.com/deportes/usain-bolt-exclusivo-clarin-extrano-correr-entrenarme-_0_OvrpkOi6BJ.html,https://images.clarin.com/2022/01/19/cPhdT3V6D_720x0__1.jpg
16,prxwZnv-l,Vacaciones. 10 parques temáticos para divertirse en verano en el Partido de la Costa,https://www.clarin.com/viajes/10-parques-tematicos-divertirse-verano-partido-costa_0_prxwZnv-l.html,https://images.clarin.com/2022/01/12/QynM2eU1q_720x0__1.jpg
17,EBcjHnngHT,Semblanzas. Ucranianos en Argentina: una larga historia con grandes huellas,https://www.clarin.com/mundo/ucranianos-argentina-larga-historia-grandes-huellas_0_EBcjHnngHT.html,https://images.clarin.com/2022/01/25/tUyn2FiKn_1256x620__2.jpg#1643134006840
18,1trwOw5rCA,Estudio. ¿Te preocupás demasiado? Así aumenta tu riesgo de enfermarte,https://www.clarin.com/buena-vida/-preocupas-demasiado-aumenta-riesgo-enfermarte_0_1trwOw5rCA.html,https://images.clarin.com/2022/01/25/3MFAJTM2E_720x0__1.jpg
19,J7Vj6guBKa,"Se estrena su reality. Georgina Rodríguez y la intimidad de su vida junto a Cristiano: ""Tardé medio año para ubicarme en su casa""",https://www.clarin.com/deportes/georgina-rodriguez-intimidad-vida-junto-cristiano-ronaldo-tarde-medio-ano-ubicarme-casa-_0_J7Vj6guBKa.html,https://images.clarin.com/2021/07/06/nFdiqDhKs_720x0__1.jpg
20,3n25f92NWR,"Ideales para el verano. Licuados, jugos y smoothies saludables: recetas y consejos para prepararlos",https://www.clarin.com/gourmet/licuados-jugos-smoothies-saludables-recetas-consejos-prepararlos_0_3n25f92NWR.html,https://images.clarin.com/2017/12/28/ByrSwTGmf_1256x620__2.jpg#1643136963955
21,OaH6zogZPZ,"Lanzan 1.010 ""obras"". Hay un trabajo nunca visto de Picasso, pero se vende como NFT",https://www.clarin.com/cultura/trabajo-visto-picasso-vende-nft_0_OaH6zogZPZ.html,https://images.clarin.com/2022/01/26/uGVp-2uVL_1256x620__2.jpg#1643194069533
22,4QRcIdxAdl,Estados Unidos. Murió el gorila macho más viejo del mundo: investigan la causa de su muerte,https://www.clarin.com/mundo/unidos-murio-gorila-macho-viejo-mundo-zoo-atlanta_0_4QRcIdxAdl.html,https://images.clarin.com/2022/01/26/mvrFp2sKx_720x0__1.jpg
23,NPFVsMsdjs,Operará en Eslovaquia. El auto volador fue habilitado y dicen que puede viajar por toda Europa,https://www.clarin.com/autos/aircar-habilitado-auto-volador-dicen-puede-viajar-toda-europa_0_NPFVsMsdjs.html,https://images.clarin.com/2021/06/30/HXL2AG6PJ_720x0__1.jpg
24,ksvrMStPUc,El heredero de Los Monos. A los 19 años está preso y lo ven como el dueño de la violencia narco: quién es Lucho Cantero,https://www.clarin.com/policiales/19-anos-preso-ven-nuevo-dueno-violencia-narco-lucho-cantero-heredero-monos_0_ksvrMStPUc.html,https://images.clarin.com/2021/02/11/ndto2wOOq_1256x620__4.jpg#1643054293620
25,gWU93nT1Ts,"Temporada 2022. Todas las fotos del verano en Mar del Plata, Pinamar y Punta del Este",https://www.clarin.com/fotogalerias/todas-fotos-verano-mar-plata-pinamar-punta-clarin_5_gWU93nT1Ts.html,
26,f2mpj0ZPKE,Historias visuales. Las imágenes más destacadas del día en Argentina y el mundo,https://www.clarin.com/fotogalerias/historias-visuales-dia-fotos-imagenes-destacadas-argentina-mundo_5_f2mpj0ZPKE.html,
27,HLytYCRdyp,"La deuda. El FMI dice que sigue negociando pero insiste en un plan ""sólido y creíble""",https://www.clarin.com/economia/fmi-mejora-pronostico-crecimiento-argentina-ano_0_HLytYCRdyp.html,https://images.clarin.com/2022/01/25/iNsoNu1vw_720x0__1.jpg
28,dIICePd4d2,Salarios 2022. Las empresas le ponen piso a la inflación y planean incrementos de hasta 51%,https://www.clarin.com/economia/salarios-2022-empresas-ponen-piso-inflacion-planean-incrementos-51-_0_dIICePd4d2.html,https://images.clarin.com/2021/11/24/JLxccO2Ok_720x0__1.jpg
29,6oU0eTaHIU,Dudas sobre Argentina. Mercado Libre lanzará desde Brasil su propia criptomoneda para América latina,https://www.clarin.com/economia/mercado-libre-lanzara-brasil-propia-criptomoneda-america-latina_0_6oU0eTaHIU.html,https://images.clarin.com/2019/10/17/TTA4XSC4_720x0__1.jpg
30,blkf79KECs,"Tecnológicas. Satellogic debuta en el Nasdaq: podría ser el nuevo ""unicornio"" argentino",https://www.clarin.com/economia/satellogic-debuta-nasdaq-podria-convertirse-nuevo-unicornio-argentino_0_blkf79KECs.html,https://images.clarin.com/2020/08/29/0_-pRWKo7_720x0__1.jpg
31,2zsp8O6yDi,"Guerra y lluvias. Sube el trigo, baja la soja: por qué hay tanta diferencia en el precio",https://www.clarin.com/rural/fuertes-contrastes-precios-trigo-soja_0_2zsp8O6yDi.html,https://images.clarin.com/2021/12/24/x27qlepng_720x0__1.jpg
32,W4PR0KuKg8,Qué modelos. Celulares en 18 cuotas y hasta con 30% de descuento,https://www.clarin.com/economia/celulares-18-cuotas-30-descuento-modelos-pueden-comprarse_0_W4PR0KuKg8.html,https://images.clarin.com/2022/01/24/33AmgH6cT_720x0__1.jpg
33,ss0iDOr2iX,De Volver al Futuro. El increíble DeLorean que se detuvo en el tiempo: tiene 40 años y es casi 0 km,https://www.clarin.com/autos/increible-delorean-detuvo-tiempo-40-anos-0-kilometro_0_ss0iDOr2iX.html,https://images.clarin.com/2022/01/24/GKNSD6yc0_720x0__1.jpg
34,DfG0G7ANPw,Veterinaria y pediatría. Mascotas y bebés: qué hacer con nuestros animales ante la llegada de un hijo,https://www.clarin.com/familias/mascotas-bebes-hacer-animales-llegada-hijo_0_DfG0G7ANPw.html,https://images.clarin.com/2022/01/24/dHIkZJTsL_720x0__1.jpg
35,RwR3RzXDfQ,Experiencias. Para vivir la gravedad cero ya no es necesario ser astronauta o millonario,https://www.clarin.com/viajes/vivir-gravedad-cero-necesario-astronauta-millonario_0_RwR3RzXDfQ.html,https://images.clarin.com/2022/01/25/oxUJ4klIH_720x0__1.jpg
36,l0ybP9I4c7,"Cuerpo en ""modo ahorro"". La razón por la que te puede estar costando bajar de peso",https://www.clarin.com/buena-vida/cuerpo-modo-ahorro-razon-puede-costando-bajar-peso_0_l0ybP9I4c7.html,https://images.clarin.com/2021/10/22/HTeiqzdpA_720x0__1.jpg
37,1BNtYU1LDS,Adultos mayores. El consejo de los expertos para fatigarse menos y vivir más,https://www.clarin.com/buena-vida/consejo-expertos-fatigarse-vivir_0_1BNtYU1LDS.html,https://images.clarin.com/2022/01/24/OZV54RlUa_720x0__1.jpg
38,mQbi-VFQ0,Diversión. Vacaciones: nueve propuestas de turismo aventura en la Argentina,https://www.clarin.com/viajes/propuestas-turismo-aventura-argentina_0_mQbi-VFQ0.html,https://images.clarin.com/2022/01/03/Im_EiW8tq_720x0__1.jpg
39,uOI08OypyV,"El ""Monje Loco"". Del culto sexual y las profecías al poder sanador: la inquietante vida de Rasputín",https://www.clarin.com/internacional/culto-sexual-profecias-poder-sanador-inquietante-historia-rasputin-monje-loco-_0_uOI08OypyV.html,https://images.clarin.com/2022/01/24/Gzj3LXTb3_1256x620__2.jpg#1643018092355
40,JtTaKaEGva,"Ver para creer. Video: un ""muerto"" vuelve a la vida y sale caminando de la morgue",https://www.clarin.com/internacional/video-muerto-vuelve-vida-sale-caminando-morgue_0_JtTaKaEGva.html,https://images.clarin.com/2022/01/25/EmURAiLbi_720x0__1.jpg
41,mfqmTvpKzt,Nueva herramienta. Descubrí qué fotografía sacó la NASA el día de tu cumpleaños,https://www.clarin.com/viste/descubri-fotografia-saco-nasa-dia-cumpleanos_0_mfqmTvpKzt.html,https://images.clarin.com/2020/04/24/3Hqn-OYGj_720x0__1.jpg
42,QSAxhz0tMH,Proyecto colosal. Más de 5 mil científicos se unen para secuenciar todo el genoma de la Tierra,https://www.clarin.com/internacional/proyecto-colosal-5-mil-cientificos-unen-secuenciar-genoma-tierra_0_QSAxhz0tMH.html,https://images.clarin.com/2020/07/22/UhWAPyuA-_720x0__1.jpg
43,FNLyiOy2ps,Reino Unido. Se hizo una cirugía estética y lleva tres años sin poder cerrar los ojos,https://www.clarin.com/internacional/hizo-cirugia-estetica-lleva-anos-poder-cerrar-ojos_0_FNLyiOy2ps.html,https://images.clarin.com/2022/01/25/rj3rNx-Ak_720x0__1.jpg
44,RUBJx90dFC,Historia santa. La escalera de mármol que subió Jesús para su juicio con Poncio Pilato,https://www.clarin.com/viste/escalera-marmol-subio-jesus-juicio-poncio-pilato_0_RUBJx90dFC.html,https://images.clarin.com/2019/04/11/KLSRAqd45_720x0__1.jpg
45,qOweMMKRd9,Tecnología de vanguardia. La fórmula que asegura la calidad y el desarrollo inteligente de los combustibles,https://www.clarin.com/brandstudio/formula-asegura-calidad-desarrollo-inteligente-combustibles_0_qOweMMKRd9.html,https://images.clarin.com/2022/01/25/PUOAPNIBX_720x0__1.jpg
46,WhOmyN5V4,"Verano 2022. Ford Go, lo último entre las plataformas de carsharing, llegó a Pinamar y Cariló",https://www.clarin.com/autos/ford-go-ultimo-plataformas-carsharing-desembarco-pinamar-carilo_0_WhOmyN5V4.html,https://images.clarin.com/2022/01/21/tCMDU5RPO_720x0__1.jpg
47,qedV4ey0o,Conexión total para el verano. Los beneficios en Internet fija y móvil a los que podés acceder,https://www.clarin.com/brandstudio/beneficios-internet-fija-movil-podes-acceder_0_qedV4ey0o.html,https://images.clarin.com/2022/01/17/t1z5URbaE_720x0__1.jpg
48,f0ZqWxsfCE,La pick-up RAM. Una de las grandes atracciones para poner a prueba junto a los especialistas,https://www.clarin.com/autos/pick-up-ram-grandes-atracciones-poner-prueba-junto-especialistas_0_f0ZqWxsfCE.html,https://images.clarin.com/2022/01/21/bXAaTuWTx_720x0__1.jpg
49,NzFwlcStEy,Volver a viajar. Nueva alianza estratégica entre Universal Assistance y Flybondi,https://www.clarin.com/brandstudio/nueva-alianza-estrategica-universal-assistance-flybondi_0_NzFwlcStEy.html,https://images.clarin.com/2022/01/18/rHMkMTdNx_720x0__1.jpg
50,Xqdj0CHHTu,Billetera virtual. BIMO y VISA extienden su promo hasta fin de mes,https://www.clarin.com/brandstudio/bimo-visa-extienden-promo-fin-mes_0_Xqdj0CHHTu.html,https://images.clarin.com/2021/06/02/xLj5ue_qY_720x0__1.jpg
51,2RaPx7CJud,Estudio. La evolución radical de la variante ómicron,https://www.clarin.com/new-york-times-international-weekly/evolucion-radical-variante-omicron_0_2RaPx7CJud.html,https://images.clarin.com/2022/01/25/AuLh8tLN3_1256x620__2.jpg#1643151564238
52,SbgcooQd4w,Estudio. ¿Por qué el alcohol interfiere con mi sueño?,https://www.clarin.com/new-york-times-international-weekly/-alcohol-interfiere-sueno-_0_SbgcooQd4w.html,https://images.clarin.com/2022/01/25/zK4UgmTox_1256x620__2.jpg#1643150558865
53,PvB5IFt8Lu,Avance crucial. Un nuevo mapa de la burbuja local del Sol,https://www.clarin.com/new-york-times-international-weekly/nuevo-mapa-burbuja-local-sol_0_PvB5IFt8Lu.html,https://images.clarin.com/2022/01/25/VIjjclrdm_1256x620__2.jpg#1643154659713
54,xFxKEWwUDt,Análisis. Un tesoro de fotos antiguas podría revelar el futuro de estos glaciares árticos,https://www.clarin.com/new-york-times-international-weekly/tesoro-fotos-antiguas-podria-revelar-futuro-glaciares-articos_0_xFxKEWwUDt.html,https://images.clarin.com/2022/01/25/6eUA-la0J_720x0__1.jpg
55,NgxFYEHt5c,Hurlingham. A un mes de la desaparición de una mujer se desvanece la única pista que había,https://www.clarin.com/zonales/cumplio-mes-desaparicion-mujer-retraso-desvanece-unica-pista_0_NgxFYEHt5c.html,https://images.clarin.com/2022/01/06/bKdli1_O2_720x0__1.jpg
56,2ymnZjJpGd,Talentos del Conurbano. La fileteadora que causó sensación en China y sueña con ver su arte en todo Castelar,https://www.clarin.com/zonales/fileteadora-castelar-llego-arte-china-suena-verla-barrio_0_2ymnZjJpGd.html,https://images.clarin.com/2022/01/17/P1oY17Tsf_720x0__1.jpg
57,Ltd-aq7jR,Trujui Rugby. El proyecto de un jugador veterano del GBA y su hijo para no dejar a nadie afuera,https://www.clarin.com/zonales/trujui-rugby-club-nace-mano-apellido-hizo-historia-mariano-moreno_0_Ltd-aq7jR.html,https://images.clarin.com/2022/01/04/DZNHRPOKP_720x0__1.jpg
58,6t8VXrx5M,Vecina del GBA. A los 10 años ya toca varios instrumentos y una sinfónica interpretó una obra suya,https://www.clarin.com/zonales/vida-nina-parte-orquesta-juvenil-nacional-san-martin_0_6t8VXrx5M.html,https://images.clarin.com/2022/01/14/20yR8SoEa_720x0__2.jpg#1642198191249
59,idjv45Okcy,"""Me siento raro"". Cómo fue el regreso de Luis Ventura al panel de ""Intrusos"" después de ocho años",https://www.clarin.com/fama/luis-ventura-regreso-intrusos-confeso-siento-raro-_0_idjv45Okcy.html,https://images.clarin.com/2022/01/25/yHOG0O-Hu_720x0__1.jpg
60,X8c9P5g48G,"Picante cruce. El malestar de Antonio Gasalla en su entrevista con Moria Casán: ""No me querés entender""",https://www.clarin.com/fama/malestar-antonio-gasalla-entrevista-moria-casan-queres-entender-_0_X8c9P5g48G.html,https://images.clarin.com/2022/01/25/hozpC52Wn_720x0__1.jpg
61,TkQNfSV3oP,"Tras las denuncias en su contra. El duro presente de Fabián Gianola: ""Está quebrado, su hijo le paga el alquiler""",https://www.clarin.com/fama/duro-presente-fabian-gianola-quebrado-hijo-paga-alquiler-_0_TkQNfSV3oP.html,https://images.clarin.com/2021/12/16/HJGOZey9c_720x0__1.jpg
62,G47lJJL6BU,Impactante. El drástico cambio de look de Luisana Lopilato para un nuevo proyecto junto a Michael Bublé,https://www.clarin.com/fama/drastico-cambio-look-luisana-lopilato-nuevo-proyecto-junto-michael-buble_0_G47lJJL6BU.html,https://images.clarin.com/2021/11/10/dylvKLKCy_720x0__1.jpg
63,RDxlccuYsS,Los mejores salarios. Cuáles son los 10 empleos que ofrecen sueldos por encima de 150 mil pesos,https://www.clarin.com/economia/-10-empleos-ofrecen-sueldos-encima-150-mil-pesos-_0_RDxlccuYsS.html,https://images.clarin.com/2021/09/09/Kb-LTMcKu_720x0__1.jpg
64,gKYbwO0NzV,Oportunidad laboral. Un gigante de Wall Street busca 1.000 empleados en Argentina: los requisitos,https://www.clarin.com/servicios/gigante-wall-street-busca-1-000-empleados-argentina-posiciones-necesita-cubrir-postularse_0_gKYbwO0NzV.html,https://images.clarin.com/2022/01/24/azvGLkZu6_720x0__1.jpg
65,6869wNVOSt,Nueva encuesta. Miden los duelos políticos del momento: Alberto vs. Cristina y Macri vs. Larreta,https://www.clarin.com/politica/nueva-encuesta-midio-duelos-politicos-momento-alberto-vs-cristina-macri-vs-larreta_0_6869wNVOSt.html,https://images.clarin.com/2022/01/15/ZRpVABYou_720x0__1.jpg
66,PHQppaHldm,"Agenda impositiva. Uno por uno, cuáles son los impuestos que hay que pagar durante 2022",https://www.clarin.com/servicios/agenda-impositiva-impuestos-pagar-2022_0_PHQppaHldm.html,https://images.clarin.com/2017/12/07/B1KuFaI-G_720x0.jpg
67,Iyn3ZWly2D,Inseguridad en trenes. Cómo hay que usar la nueva app oficial para pedir auxilio al instante,https://www.clarin.com/servicios/inseguridad-trenes-usar-nueva-app-oficial-pedir-auxilio-instante_0_Iyn3ZWly2D.html,https://images.clarin.com/2021/04/26/szXX6vEF4_720x0__1.jpg
68,6E9DkhsM2t,Sociedad. A 20 años del boom: en qué quedó la promesa de las células madre,https://www.clarin.com/sociedad/20-anos-boom-quedo-promesa-celulas-madre_0_6E9DkhsM2t.html,https://images.clarin.com/2022/01/21/ysSy5U8W-_720x0__1.jpg
69,LIci3lVcJ,Política. Enigma Nisman: siete años; siete misterios sin resolver,https://www.clarin.com/politica/enigma-nisman-anos-misterios-resolver_0_LIci3lVcJ.html,https://images.clarin.com/2022/01/13/mfXLvGAxI_720x0__1.jpg
70,m1EdK_wpV,Sociedad. Mundo verdulería: 10 secretos del negocio que explotó en pandemia,https://www.clarin.com/sociedad/mundo-verduleria-10-secretos-negocio-exploto-pandemia_0_m1EdK_wpV.html,https://images.clarin.com/2021/12/20/MSbLfu4yR_720x0__1.jpg
71,fJM8dsWAP,Viajes. De Salta a Tierra del Fuego: postales de siete rutas escénicas de la Argentina,https://www.clarin.com/viajes/salta-tierra-fuego-postales-imperdibles-rutas-escenicas-argentina_0_fJM8dsWAP.html,https://images.clarin.com/2021/12/23/_rnz40zJS_720x0__1.jpg
72,iVKbyl0aKF,Selección Nacional. Alerta en el mediocampo: futbolistas al límite y la baja de Guido Rodríguez,https://www.clarin.com/deportes/alerta-mediocampo-seleccion-futbolistas-limite-baja-guido-rodriguez_0_iVKbyl0aKF.html,https://images.clarin.com/2022/01/25/rTKPIvISM_720x0__1.jpg
73,XL9DmIhzoy,Se mueve el mercado. River ya tiene a Elías Gómez y ahora va por una figura de otro equipo grande,https://www.clarin.com/deportes/river-elias-gomez-ahora-va-figura-equipo-grande_0_XL9DmIhzoy.html,https://images.clarin.com/2021/12/18/ZRWLrZQ4-_720x0__1.jpg
74,so0FkJHOvO,"Cargadas al Rojo. Los memes por el pase de Elías Gómez, el refuerzo que River le sopló a Independiente",https://www.clarin.com/deportes/elias-gomez-river-independiente-memes_0_so0FkJHOvO.html,https://images.clarin.com/2022/01/25/4FWKjTq3b_720x0__1.jpg
75,75U0CMXiQQ,"Volvió a convertir. Luis Vázquez, el chico que responde con goles ante la llegada de Benedetto a Boca",https://www.clarin.com/deportes/luis-vazquez-chico-responde-goles-llegada-benedetto-boca_0_75U0CMXiQQ.html,https://images.clarin.com/2022/01/25/T3v5nglSi_720x0__1.jpg
76,KBauU6F2IG,Tras las críticas. El Abierto de Australia ahora permitirá remeras de apoyo a Peng Shuai,https://www.clarin.com/deportes/abierto-australia-dio-marcha-ahora-permitira-remeras-apoyo-peng-shuai_0_KBauU6F2IG.html,https://images.clarin.com/2022/01/25/iZjVG3_Dk_1256x620__3.jpg#1643142288253
77,oNMnBvjeJs,NBA. Campazzo volvió a dejar poco en un Denver que sigue en alza y venció a Detroit,https://www.clarin.com/deportes/nba-facundo-campazzo-volvio-dejar-denver-sigue-alza-vencio-detroit_0_oNMnBvjeJs.html,https://images.clarin.com/2022/01/24/KtLj-Edsdq_720x0__1.jpg
