n,id,title,url,image
1,8uDsmkKsf,El frente económico. Temor a la escalada del dólar: la trastienda del pago al Club de París,https://www.clarin.com/opinion/temor-escalada-dolar-trastienda-pago-club-paris_0_8uDsmkKsf.html,https://images.clarin.com/2021/06/24/NiLf5rWhX_720x0__1.jpg
2,1cSDTNkZk,"Quiere más del 40%. Mayor presión gremial: por la inflación, la CGT pide reabrir todas las paritarias",https://www.clarin.com/economia/hector-daer-cgt-ministerio-trabajo-debe-convocar-paritarias-superadas-inflacion-_0_1cSDTNkZk.html,https://images.clarin.com/2019/07/14/0tX3ASt34_720x0__1.jpg
3,RegN3TL4y,"Clarín en Miami. Desolación, muerte y esperanza en plena búsqueda de sobrevivientes",https://www.clarin.com/mundo/tragedia-miami-imagenes-desolacion-muerte-esperanza-pie-ruinas-edificio_0_RegN3TL4y.html,https://images.clarin.com/2021/06/24/1wGxk-q0c_1200x0__2.jpg#1624583624103
4,lqcatvBEW,Horas de angustia. Los rostros detrás del derrumbe en Miami,https://www.clarin.com/mundo/rostros-detras-derrumbe-miami-personas-desaparecidas_0_lqcatvBEW.html,https://images.clarin.com/2021/06/24/7J01jX5vO_1256x620__2.jpg#1624576412672
5,0QpLJmbIN,Cámara de seguridad. El impactante video que muestra en detalle el colapso del edificio,https://www.clarin.com/mundo/momento-derrumbe-edificio-miami_0_0QpLJmbIN.html,https://images.clarin.com/2021/06/24/43taiWJb9_720x0__1.jpg
6,9_MTDJXJ7,Del editor. Tragedia en la ciudad donde sobran vacunas,https://www.clarin.com/opinion/tragedia-miami-ciudad-sobran-vacunas_0_9_MTDJXJ7.html,https://images.clarin.com/2021/06/24/HPFPs6N4F_720x0__1.jpg
7,yEGlFK834,Ser militante o pagar US$: cómo se vacuna en la Venezuela chavista,https://www.clarin.com/mundo/sistema-patria-venezuela-chavista-vacunas-gratis-militantes-us-300_0_yEGlFK834.html,https://images.clarin.com/2021/06/02/PSEmhQiwR_720x0__1.jpg
8,01vGveUpD,Rubro por rubro. Nuevas aperturas en la Ciudad: qué cambia y desde cuando rigen las medidas,https://www.clarin.com/ciudades/nueva-etapa-restricciones-ciudad-cambia-rigen-medidas_0_01vGveUpD.html,https://images.clarin.com/2020/10/26/K_xW4oV5c_1256x620__4.jpg#1624580945954
9,tGFqbEwj-,"Una jugada polémica. A 10 años del descenso de River: ""No entendí por qué Pezzotta no cobró el penal a Caruso""",https://www.clarin.com/deportes/river-10-anos-descenso-entendi-pezzotta-cobro-penal-chiqui-perez-caruso-_0_tGFqbEwj-.html,https://images.clarin.com/2016/10/19/HJQ0kRhtVe_720x0.jpg
10,ZaSDdgfJe,¿Vacunación mixta?. Por qué cada vez más países la adoptan,https://www.clarin.com/new-york-times-international-weekly/vez-paises-adoptan-vacunacion-mixta-coronavirus_0_ZaSDdgfJe.html,https://images.clarin.com/2021/06/24/3xGBzkaCK_1256x620__2.jpg#1624561898413
11,qjLCy7tpV,Jasídica pero poco ortodoxa. Se recibió de médica con 10 hijos,https://www.clarin.com/new-york-times-international-weekly/madre-jasidica-10-hijos-recibio-medica_0_qjLCy7tpV.html,https://images.clarin.com/2021/06/24/fhJyjUA-X_1256x620__2.jpg#1624540757357
12,8uDsmkKsf,El frente económico. Temor a la escalada del dólar: la trastienda del pago al Club de París,https://www.clarin.com/opinion/temor-escalada-dolar-trastienda-pago-club-paris_0_8uDsmkKsf.html,https://images.clarin.com/2021/06/24/NiLf5rWhX_720x0__1.jpg
13,1cSDTNkZk,"Quiere más del 40%. Mayor presión gremial: por la inflación, la CGT pide reabrir todas las paritarias",https://www.clarin.com/economia/hector-daer-cgt-ministerio-trabajo-debe-convocar-paritarias-superadas-inflacion-_0_1cSDTNkZk.html,https://images.clarin.com/2019/07/14/0tX3ASt34_720x0__1.jpg
14,RegN3TL4y,"Clarín en Miami. Desolación, muerte y esperanza en plena búsqueda de sobrevivientes",https://www.clarin.com/mundo/tragedia-miami-imagenes-desolacion-muerte-esperanza-pie-ruinas-edificio_0_RegN3TL4y.html,https://images.clarin.com/2021/06/24/1wGxk-q0c_1200x0__2.jpg#1624583624103
15,lqcatvBEW,Horas de angustia. Los rostros detrás del derrumbe en Miami,https://www.clarin.com/mundo/rostros-detras-derrumbe-miami-personas-desaparecidas_0_lqcatvBEW.html,https://images.clarin.com/2021/06/24/7J01jX5vO_1256x620__2.jpg#1624576412672
16,0QpLJmbIN,Cámara de seguridad. El impactante video que muestra en detalle el colapso del edificio,https://www.clarin.com/mundo/momento-derrumbe-edificio-miami_0_0QpLJmbIN.html,https://images.clarin.com/2021/06/24/43taiWJb9_720x0__1.jpg
17,9_MTDJXJ7,Del editor. Tragedia en la ciudad donde sobran vacunas,https://www.clarin.com/opinion/tragedia-miami-ciudad-sobran-vacunas_0_9_MTDJXJ7.html,https://images.clarin.com/2021/06/24/HPFPs6N4F_720x0__1.jpg
18,yEGlFK834,Ser militante o pagar US$: cómo se vacuna en la Venezuela chavista,https://www.clarin.com/mundo/sistema-patria-venezuela-chavista-vacunas-gratis-militantes-us-300_0_yEGlFK834.html,https://images.clarin.com/2021/06/02/PSEmhQiwR_720x0__1.jpg
19,01vGveUpD,Rubro por rubro. Nuevas aperturas en la Ciudad: qué cambia y desde cuando rigen las medidas,https://www.clarin.com/ciudades/nueva-etapa-restricciones-ciudad-cambia-rigen-medidas_0_01vGveUpD.html,https://images.clarin.com/2020/10/26/K_xW4oV5c_1256x620__4.jpg#1624580945954
20,zRgz3lCjs,Copa América. Paraguay le ganó a Chile y Argentina evitará a Brasil hasta una eventual final,https://www.clarin.com/deportes/chile-vs-paraguay-copa-america-minuto-minuto-directo_0_zRgz3lCjs.html,https://images.clarin.com/2021/06/24/L9gOh2fhT_1256x620__2.jpg#1624583958055
21,hHkHc8Ekp,Polémica en la Copa América. Amenazaron a Néstor Pitana por el gol de Brasil a Colombia,https://www.clarin.com/deportes/amenazaron-nestor-pitana-gol-brasil-colombia-pusieron-seguridad-casa-misiones_0_hHkHc8Ekp.html,https://images.clarin.com/2021/06/24/yawSb4qkK_720x0__1.jpg
22,0QUGOhk62,El cumple del Chueco. El contrato en blanco que firmó Fangio para llegar a la Fórmula 1,https://www.clarin.com/deportes/dia-piloto-contrato-blanco-firmo-fangio-llegar-formula-1_0_0QUGOhk62.html,https://images.clarin.com/2020/05/20/kt6Z40pl8_720x0__1.jpg
23,Z7Nn2GSTQ,"Después de 56 años. Cambio histórico: la UEFA eliminó la regla del ""gol de visitante""",https://www.clarin.com/deportes/oficial-despues-56-anos-uefa-elimino-regla-gol-visitante-_0_Z7Nn2GSTQ.html,https://images.clarin.com/2021/04/13/Gi2S5wCrD_720x0__1.jpg
24,a5d_lyNE6,Mercado de pases. Por qué a Boca podrían entrarle 15 millones de dólares por Bentancur ,https://www.clarin.com/deportes/triangulo-boca-juventus-bentancur-podria-dejar-15-millones-dolares-xeneize_0_a5d_lyNE6.html,https://images.clarin.com/2021/06/22/86Xq08Ggu_720x0__1.jpg
25,ChQqZlng7,Llegaron los 34. El cumpleaños de Messi: el video con la sorpresa y los regalos de la Selección,https://www.clarin.com/deportes/cumpleanos-lionel-messi-sorpresa-regalos-plantel-seleccion-argentina_0_ChQqZlng7.html,https://images.clarin.com/2021/06/24/NbkUEzFl8_720x0__1.jpg
26,hfcxWmNy1,Un video especial. El original homenaje de Los Palmeras para Messi por sus 34 años,https://www.clarin.com/deportes/original-homenaje-palmeras-cumpleanos-messi_0_hfcxWmNy1.html,https://images.clarin.com/2021/06/24/XRx8pMSUP_720x0__1.jpg
27,hHDov_BZU,"Faltan 29 días. Uno por uno, los 167 atletas argentinos clasificados para los Juegos Olímpicos",https://www.clarin.com/deportes/143-atletas-argentinos-clasificados-juegos-olimpicos-tokio-2020_0_hHDov_BZU.html,https://images.clarin.com/1969/12/31/rJ-6NTgAme_1256x620__1.jpg#1595357047729
28,nZgctR29V,Finanzas y mercados. Argentina dejó de ser mercado emergente y pasó a una categoría peor que de frontera,https://www.clarin.com/economia/final-argentina-cayo-mercado-emergente-categoria-peor-frontera_0_nZgctR29V.html,https://images.clarin.com/2017/06/21/BJgruuiD-_720x0.jpg
29,oiJnlLGqD,"""Negro"" Rojas. El narco que va camino a otra condena por planificar el asesinato de un juez",https://www.clarin.com/sociedad/narco-negro-rojas-camino-condena-planificar-asesinato-juez_0_oiJnlLGqD.html,https://images.clarin.com/2020/06/24/BmDZFjY5Q_1256x620__2.jpg#1624569926401
30,sE6qWZrYl,Supermercados. Las cadenas regionales quieren vender los cortes de carne populares,https://www.clarin.com/economia/cadenas-regionales-supermercados-quieren-vender-cortes-carne-populares_0_sE6qWZrYl.html,https://images.clarin.com/2021/06/24/Sme4xfdfg_720x0__1.jpg
31,RP_TEShgU,Derechos humanos. La CIDH exigió la liberación de los opositores presos en Nicaragua,https://www.clarin.com/mundo/corte-interamericana-derechos-humamos-pidio-liberacion-inmediata-opositores-presos-nicaragua_0_RP_TEShgU.html,https://images.clarin.com/2021/06/24/KcDqKkbed_720x0__1.jpg
32,enk2M2XnA,Plan de vacunación. Rusia anunció que enviará más dosis del componente 2 de la Sputnik V ,https://www.clarin.com/sociedad/rusia-anuncio-enviara-argentina-vacunas-componente-2-sputnik-v-dijo-cuantas-dosis_0_enk2M2XnA.html,https://images.clarin.com/2021/06/17/sn9peN0DO_1256x620__3.jpg#1624558792075
33,c0Lo_zPM-,En el caso Traficante. La Cámara Federal porteña anuló el procesamiento de Daniel Santoro,https://www.clarin.com/politica/forma-unanime-camara-federal-portena-anulo-procesamiento-periodista-daniel-santoro-caso-traficante_0_c0Lo_zPM-.html,https://images.clarin.com/2019/07/19/KbGiKXpQJ_720x0__1.jpg
34,KAel4Vd7B,10 días sin rastros. Caso Guadalupe: las llamadas que recibió la mamá se hicieron desde Río Negro,https://www.clarin.com/sociedad/desesperada-busqueda-guadalupe-llamadas-recibio-mama-hicieron-rio-negro_0_KAel4Vd7B.html,https://images.clarin.com/2021/06/15/GCrI7L5gb_1256x620__2.jpg#1624575059281
35,fChFVwLli,18 convocados. La selección de futsal se entrena con el Mundial en la mira,https://www.clarin.com/brandstudio/seleccion-futsal-entrena-mundial-mira_0_fChFVwLli.html,https://images.clarin.com/2021/06/22/h2An14XVt_720x0__1.jpg
36,S0i9I0IiU,Software. Microsoft presentó Windows 11: todas las novedades del nuevo sistema operativo,https://www.clarin.com/tecnologia/microsoft-presento-windows-11-todas-novedades-nuevo-sistema-operativo-pc_0_S0i9I0IiU.html,https://images.clarin.com/2021/06/24/2qHjSN7cC_720x0__1.jpg
37,bkV3cz2EZ,"McAfee fue hallado muerto. La alocada vida del rey del antivirus: armas, drogas, prostitutas y un crimen",https://www.clarin.com/tecnologia/alocada-vida-john-mcafee-armas-drogas-prostitutas-evasion-fiscal-crimen-resolver_0_bkV3cz2EZ.html,https://images.clarin.com/2021/06/23/kEYl2Bmtd_720x0__1.jpg
38,0JUNBoasG,"Turismo en pandemia. Paquetes, estancias y hoteles: propuestas y precios para las vacaciones de invierno",https://www.clarin.com/viajes/paquetes-estancias-hoteles-all-inclusive-propuestas-precios-vacaciones-invierno-2021_0_0JUNBoasG.html,https://images.clarin.com/2021/05/27/tsPgcl8iQ_720x0__1.jpg
39,ujKI8XKWo,Salud. La postura correcta para ir al baño y otros consejos,https://www.clarin.com/buena-vida/postura-correcta-ir-bano-consejos_0_ujKI8XKWo.html,https://images.clarin.com/2021/06/24/rDvDolBE5_720x0__1.jpg
40,WJKnEorJ8,"Meriendas clásicas. Tortas fritas, churros, rosquitas y más: 17 recetas fáciles para el mate",https://www.clarin.com/gourmet/tortas-fritas--churros--rosquitas-17-recetas-faciles-mate_0_WJKnEorJ8.html,https://images.clarin.com/2021/06/23/fxOGMbF8U_720x0__1.jpg
41,tGIbEhOBG,Citroën Méhari. A 50 años del lanzamiento del gran aventurero argentino,https://www.clarin.com/autos/citroen-mehari-50-anos-lanzamiento-gran-aventurero-argentino_0_tGIbEhOBG.html,https://images.clarin.com/2021/06/23/lJalNI9SM_720x0__1.jpg
42,4zkcLUuo1,Patagonia. Todo listo en La Trochita para la temporada de invierno,https://www.clarin.com/viajes/listo-trochita-temporada-invierno_0_4zkcLUuo1.html,https://images.clarin.com/2021/06/21/QNkG7nTiM_720x0__1.jpg
43,9boSN4Cxg,"Psicología. Segunda ola de Covid: cómo evitar la ""depresión reactiva""",https://www.clarin.com/buena-vida/segunda-ola-coronavirus-evitar-depresion-reactiva-_0_9boSN4Cxg.html,https://images.clarin.com/2021/06/21/ganXyc7pg_720x0__1.jpg
44,OmD0TbSpJ,Corazón. Hallan beneficios en comer un puñado de ciruelas pasas por día,https://www.clarin.com/buena-vida/hallan-beneficios-comer-punado-ciruelas-pasas-dia_0_OmD0TbSpJ.html,https://images.clarin.com/2021/06/23/3Xzm5xS8v_720x0__1.jpg
45,XIg3W7RMR,En Italia. Un hermoso pueblo paga hasta 50 mil dólares por mudarse allí,https://www.clarin.com/internacional/hermoso-pueblo-italiano-paga-mudarse_0_XIg3W7RMR.html,https://images.clarin.com/2021/06/24/Td5_mj-53g_720x0__1.jpg
46,0ZDKE2taT,Avance médico. Descubren una proteína antienvejecimiento que ayuda a evitar el deterioro cognitivo,https://www.clarin.com/internacional/descubren-proteina-antienvejecimiento-sangre-ayuda-evitar-deterioro-cognitivo_0_0ZDKE2taT.html,https://images.clarin.com/2021/03/28/CeGqgFZaS_720x0__1.jpg
47,nCvdy4w_H,Mirá el video. La increíble reacción de niños de Uganda al ver un hombre blanco por primera vez,https://www.clarin.com/viste/ve-primera-vez-hombre-blanco-cree-fantasma-va-comer_0_nCvdy4w_H.html,https://images.clarin.com/2021/06/24/Tbe9NVo2T_720x0__1.jpg
48,g0nxP7BYe,"Escándalo. El récord que no fue: dijo que dio a luz a 10 bebés, pero era mentira: ",https://www.clarin.com/viste/aseguro-dado-luz-bebes-gran-mentira_0_g0nxP7BYe.html,https://images.clarin.com/2021/06/23/Ss10DiNJz_720x0__1.jpg
49,sMX_NwiqH,En el mar. Hallan euna botella con un mensaje de 1926 y hallan a la hija de quien lo escribió,https://www.clarin.com/internacional/estados-unidos/encuentran-mar-botella-mensaje-1926-hallan-hija-escribio_0_sMX_NwiqH.html,https://images.clarin.com/2021/06/24/aKgoxfyBa_720x0__1.jpg
50,Xo22m_jLg,Gran concurso. Disney regala viajes a sus parques para las 50 personas más solidarias,https://www.clarin.com/viste/disney-regala-viajes-gratuitos-parques-50-personas-solidarias_0_Xo22m_jLg.html,https://images.clarin.com/2021/06/23/LGpxVuH5r_720x0__1.jpg
51,eBLmj8wiQ,Estudio en Argentina. Qué cepas del coronavirus contagian más a los que están vacunados,https://www.clarin.com/sociedad/sputnik--astrazeneca-sinopharm-variantes-covid-afectaron-vacunados_0_eBLmj8wiQ.html,https://images.clarin.com/2020/03/18/HztDaeRy_1256x620__3.jpg#1624564242488
52,5sDt0HNjw,Servicios bancarios. Los 10 derechos menos conocidos de los clientes y cómo defenderlos,https://www.clarin.com/servicios/10-derechos-conocidos-clientes-bancos-defenderlos_0_5sDt0HNjw.html,https://images.clarin.com/2020/04/04/KASyjwKAd_720x0__1.jpg
53,NuMSwIYBS,"Por la suba de casos. Tras 10 días sin tapabocas, Israel da marcha atrás y vuelve al uso obligatorio",https://www.clarin.com/mundo/israel-vuelve-uso-obligatorio-mascarilla-lugares-cerrados-aumento-casos-coronavirus_0_NuMSwIYBS.html,https://images.clarin.com/2021/06/25/RUUo2YBhQ_720x0__1.jpg
54,d-zKcQLv9,En cuatro tramos. Oficializaron el aumento para el personal doméstico: así serán los salarios,https://www.clarin.com/economia/oficializan-aumento-personal-domestico-quedan-salarios-partir-junio_0_d-zKcQLv9.html,https://images.clarin.com/2021/05/27/0r9IwJ7Nr_720x0__1.jpg
55,2B6F8T5nf,Falta de dosis. Componente 2: crónica de una muerte anunciada en Rusia hace 164 días,https://www.clarin.com/sociedad/componente-2-sputnik-v-cronica-muerte-anunciada-hace-164-dias-rusia_0_2B6F8T5nf.html,https://images.clarin.com/2021/06/24/TUmUNS6ZI_720x0__1.jpg
56,vARvwzI-I,"El armado opositor. Macri habló de la interna en el PRO y de ""miserias humanas"" en el cierre de listas",https://www.clarin.com/politica/mauricio-macri-senora-kirchner-manejaba-disc-jockey-catering-_0_vARvwzI-I.html,https://images.clarin.com/2021/06/25/aCkRCFk3K_720x0__1.jpg
57,1IbnA-paI,"No fue a una reunión. Patricia Bullrich, molesta con las idas y vueltas por las candidaturas",https://www.clarin.com/politica/elecciones-2021-patricia-bullrich-molesta-internas-pro_0_1IbnA-paI.html,https://images.clarin.com/2019/04/03/J8KB0Y05u_720x0__1.jpg
58,lqm1kVa0H,Fina y crocante. La pizza a la parrilla porteña cumple 27 años y cada vez gusta más,https://www.clarin.com/gourmet/pizza-parrilla-portena-cumple-27-anos-vez-gusta_0_lqm1kVa0H.html,https://images.clarin.com/2021/06/24/7FKaeDvpn_1256x620__2.jpg#1624582912773
59,gQogixSAm,"Hay 99 desaparecidos. La dramática búsqueda: ""Escuchamos sonidos bajo los escombros""",https://www.clarin.com/mundo/dramatica-busqueda-sobrevivientes-derrumbe-miami-escuchamos-sonidos-escombros-gente-golpeando-_0_gQogixSAm.html,https://images.clarin.com/2021/06/24/49gQqIg8M_720x0__1.jpg
60,EhonIPC47,Hipótesis de expertos. ¿Una falla estructural causada por la niebla salina provocó el derrumbe?,https://www.clarin.com/arq/conjeturas-derrumbe-parcial-edificio-miami_0_EhonIPC47.html,https://images.clarin.com/2021/06/24/fxHTxw-h__720x0__1.jpg
61,F6qiMT2kt,"Al borde del llanto. Impactante relato de Nico Vázquez: ""No entendíamos qué pasaba""",https://www.clarin.com/fama/impactante-relato-nico-vazquez-derrumbe-miami-estruendo-fuerte-entendiamos-pasaba-_0_F6qiMT2kt.html,https://images.clarin.com/2021/06/24/4_H5_muPZ_720x0__1.jpg
62,Iq7s6_c3z,Andrés Galfrascoli. Quién es el cirujano de famosos que está desaparecido,https://www.clarin.com/fama/derrumbe-miami-andres-galfrascoli-cirujano-famosos-desaparecido_0_Iq7s6_c3z.html,https://images.clarin.com/2021/06/24/DyCKj-ThL_720x0__1.jpg
63,wQ0LsrWVA,"Habló su ex esposa. La confusión con el ""argentino"" que aún no apareció",https://www.clarin.com/sociedad/derrumbe-miami-confusion-argentino-aparecio_0_wQ0LsrWVA.html,https://images.clarin.com/2021/06/24/5B-Gg913B_1256x620__2.jpg#1624574538877
64,q-LXkdAM6,Minuto a minuto. Las cifras de la tragedia y las novedades del operativo de rescate,https://www.clarin.com/mundo/derrumbe-miami-vivo-rescate-escombros-minuto-minuto_0_q-LXkdAM6.html,https://images.clarin.com/2021/06/24/-8qddmRF9_720x0__1.jpg
65,zHx6QeKEK,A 35 años de México 86. Barrabravas vs. hooligans: mitos y verdades de la batalla en el estadio Azteca,https://www.clarin.com/deportes/35-anos-mexico-86-barrabravas-vs-hooligans-mitos-verdades-batalla-hinchas-azteca_0_zHx6QeKEK.html,https://images.clarin.com/2021/06/24/xtoObcxfN_720x0__1.jpg
66,Aj9ipx7Bo,Consejos de expertos. Entrevistas de trabajo: las 6 preguntas más difíciles y cómo responder sin fallar,https://www.clarin.com/servicios/entrevistas-trabajo-6-preguntas-dificiles-responderlas-fallar_0_Aj9ipx7Bo.html,https://images.clarin.com/2015/03/20/ry-HnI7R7l_720x0.jpg
67,v6STePPQ5,Otra cara justiciera del actor. Ben Affleck trabaja contra el hambre y explica por qué la ayuda humanitaria no sirve,https://www.clarin.com/cultura/faceta-justiciera-ben-affleck-vida-real_0_v6STePPQ5.html,https://images.clarin.com/2021/06/14/JkYDMMkn-_1256x620__3.jpg#1624544157075
68,E5EzxpsYl,"Una carrera de triatlón. Estaba por ganar, festejó antes y se hizo viral: ""Fue el mejor segundo puesto de la historia""",https://www.clarin.com/viste/estaba-por-ganar-una-carrera-festejo-antes-y-se-hizo-viral-fue-el-mejor-segundo-puesto-de-la-historia-aud1enc14-j0v3n_0_E5EzxpsYl.html,https://images.clarin.com/2021/06/23/kjpvdSxP9_720x0__1.jpg
69,KiG5fA7MS,"Instagram. Tiene vitiligo, escondió su cuerpo por el bullying y ahora lo convierte en arte",https://www.clarin.com/viste/vitiligo-escondio-cuerpo-bullying-convierte-arte-aud1enc14-j0v3n_0_KiG5fA7MS.html,https://images.clarin.com/2021/06/25/8hGKCyPHw_720x0__1.jpg
70,hEwDN-RgZ,Nuevo grupo. Un homínido hallado en Israel cambia la historia de la evolución humana,https://www.clarin.com/internacional/hominido-hallado-israel-cambia-historia-evolucion-humana_0_hEwDN-RgZ.html,https://images.clarin.com/2021/06/24/VXtaJopDf_720x0__1.jpg
71,glyAcgp25,Nuevo estudio. Descubren que las canas que produce el estrés pueden revertirse,https://www.clarin.com/buena-vida/descubren-canas-produce-estres-pueden-revertirse_0_glyAcgp25.html,https://images.clarin.com/2021/06/24/n3_N_O9dW_720x0__1.jpg
72,a2kmj-rCg,"Redes sociales. Twitch suspende a dos de sus máximas estrellas por ser ""demasiado sexy""",https://www.clarin.com/tecnologia/twitch-suspende-temporalmente-maximas-estrellas-demasiado-sexy-_0_a2kmj-rCg.html,https://images.clarin.com/2021/06/23/on59H8xcH_720x0__1.jpg
73,eJqbgAp-R,Empresas. Cómo adaptarse y crecer en tiempos de pandemia,https://www.clarin.com/brandstudio/adaptarse-crecer-tiempos-pandemia_0_eJqbgAp-R.html,https://images.clarin.com/2021/06/22/gClqmdtye_720x0__1.jpg
74,zHx6QeKEK,A 35 años de México 86. Barrabravas vs. hooligans: mitos y verdades de la batalla en el estadio Azteca,https://www.clarin.com/deportes/35-anos-mexico-86-barrabravas-vs-hooligans-mitos-verdades-batalla-hinchas-azteca_0_zHx6QeKEK.html,https://images.clarin.com/2021/06/24/xtoObcxfN_720x0__1.jpg
75,Aj9ipx7Bo,Consejos de expertos. Entrevistas de trabajo: las 6 preguntas más difíciles y cómo responder sin fallar,https://www.clarin.com/servicios/entrevistas-trabajo-6-preguntas-dificiles-responderlas-fallar_0_Aj9ipx7Bo.html,https://images.clarin.com/2015/03/20/ry-HnI7R7l_720x0.jpg
76,v6STePPQ5,Otra cara justiciera del actor. Ben Affleck trabaja contra el hambre y explica por qué la ayuda humanitaria no sirve,https://www.clarin.com/cultura/faceta-justiciera-ben-affleck-vida-real_0_v6STePPQ5.html,https://images.clarin.com/2021/06/14/JkYDMMkn-_1256x620__3.jpg#1624544157075
77,E5EzxpsYl,"Una carrera de triatlón. Estaba por ganar, festejó antes y se hizo viral: ""Fue el mejor segundo puesto de la historia""",https://www.clarin.com/viste/estaba-por-ganar-una-carrera-festejo-antes-y-se-hizo-viral-fue-el-mejor-segundo-puesto-de-la-historia-aud1enc14-j0v3n_0_E5EzxpsYl.html,https://images.clarin.com/2021/06/23/kjpvdSxP9_720x0__1.jpg
78,KiG5fA7MS,"Instagram. Tiene vitiligo, escondió su cuerpo por el bullying y ahora lo convierte en arte",https://www.clarin.com/viste/vitiligo-escondio-cuerpo-bullying-convierte-arte-aud1enc14-j0v3n_0_KiG5fA7MS.html,https://images.clarin.com/2021/06/25/8hGKCyPHw_720x0__1.jpg
79,hEwDN-RgZ,Nuevo grupo. Un homínido hallado en Israel cambia la historia de la evolución humana,https://www.clarin.com/internacional/hominido-hallado-israel-cambia-historia-evolucion-humana_0_hEwDN-RgZ.html,https://images.clarin.com/2021/06/24/VXtaJopDf_720x0__1.jpg
80,glyAcgp25,Nuevo estudio. Descubren que las canas que produce el estrés pueden revertirse,https://www.clarin.com/buena-vida/descubren-canas-produce-estres-pueden-revertirse_0_glyAcgp25.html,https://images.clarin.com/2021/06/24/n3_N_O9dW_720x0__1.jpg
81,a2kmj-rCg,"Redes sociales. Twitch suspende a dos de sus máximas estrellas por ser ""demasiado sexy""",https://www.clarin.com/tecnologia/twitch-suspende-temporalmente-maximas-estrellas-demasiado-sexy-_0_a2kmj-rCg.html,https://images.clarin.com/2021/06/23/on59H8xcH_720x0__1.jpg
82,eJqbgAp-R,Empresas. Cómo adaptarse y crecer en tiempos de pandemia,https://www.clarin.com/brandstudio/adaptarse-crecer-tiempos-pandemia_0_eJqbgAp-R.html,https://images.clarin.com/2021/06/22/gClqmdtye_720x0__1.jpg
