n,id,title,url,image
1,ucsDwOKif,"Más cruces por las clases. Cafiero criticó fuerte a Larreta y Santilli le respondió: ""Parece que Horacio es el responsable de todo""",https://www.clarin.com/politica/santiago-cafiero-critico-fuerte-rodriguez-larreta-respondio-santilli-parece-horacio-responsable-_0_ucsDwOKif.html,https://images.clarin.com/2021/05/21/N95GTNmaH_1256x620__2.jpg#1623506755819
2,c1jXwJLgt,El manejo de la pandemia. AstraZeneca: ¿los jóvenes tienen reacciones más fuertes tras vacunarse?,https://www.clarin.com/sociedad/astrazeneca-personas-jovenes-reacciones-fuertes-despues-vacunarse-_0_c1jXwJLgt.html,https://images.clarin.com/2021/06/03/JUaFHdgzj_1256x620__2.jpg#1623525020712
3,PRV9ukP2C,"Conmoción en la Eurocopa. Un futbolista se desplomó en pleno partido, pero lo reanimaron y está “estable”",https://www.clarin.com/deportes/conmocion-eurocopa-salud-christian-eriksen-desplomo-pleno-partido_0_PRV9ukP2C.html,https://images.clarin.com/2021/06/12/i-kAYEQVw_720x0__1.jpg
4,onJdmgPc6,En Dinamarca . El shock y las lágrimas de la esposa de Eriksen en pleno partido,https://www.clarin.com/deportes/shock-lagrimas-esposa-christian-eriksen-luego-esposo-desplomara-pleno-partido_0_onJdmgPc6.html,https://images.clarin.com/2021/06/12/QK4SUUQIy_720x0__1.jpg
5,N0RUkTBgh,Preocupación. El minuto a minuto en imágenes del dramático momento en la Eurocopa,https://www.clarin.com/deportes/minuto-minuto-imagenes-dramatico-momento-vivio-eurocopa-desplomarse-futbolista-danes_0_N0RUkTBgh.html,https://images.clarin.com/2021/06/12/F8QZ79axi_720x0__1.jpg
6,ZI4MVpSFQ,"Tiene coronavirus. El nuevo parte médico sobre la salud de Susana Giménez, internada en Uruguay",https://www.clarin.com/fama/coronavirus-nuevo-parte-medico-salud-susana-gimenez_0_ZI4MVpSFQ.html,https://images.clarin.com/2021/04/25/qkkc8Z4Oo_720x0__1.jpg
7,VveaddKoH,Brasil. Bolsonaro encabeza una masiva caravana de motos,https://www.clarin.com/mundo/jair-bolsonaro-vuelve-desafiar-pandemia-encabeza-masiva-caravana-motos_0_VveaddKoH.html,https://images.clarin.com/2021/06/12/br9LGsphe_720x0__1.jpg
8,P-hhzZAOG,Análisis. ¿Será cierto que el que apuesta a la inflación gana?,https://www.clarin.com/economia/-cierto-apuesta-inflacion-gana-_0_P-hhzZAOG.html,https://images.clarin.com/2021/04/18/hupzQp_Ep_720x0__1.jpg
9,NNuG8jP1K,Foco Económico. Kicillof recibe del Gobierno 20 veces más plata que Larreta,https://www.clarin.com/economia/axel-kicillof-recibe-gobierno-20-veces-plata-horacio-larreta_0_NNuG8jP1K.html,https://images.clarin.com/2021/05/21/sXEAkLR3__720x0__1.jpg
10,L37QPMfsz,"Escándalo en Italia. El joven asistente de Gianni Vattimo, acusado de manipular al filósofo",https://www.clarin.com/mundo/escandalo-mundo-intelectual-italia-pasa-gianni-vattimo-asistente-brasileno-_0_L37QPMfsz.html,https://images.clarin.com/2021/06/11/nXhNmDtRv_720x0__1.jpg
11,7HDeYszvA,Argentinos que no vinieron en los barcos. Cuáles son los pueblos originarios que habitan el país,https://www.clarin.com/politica/argentinos-vinieron-barcos-pueblos-originarios-habitan-pais_0_7HDeYszvA.html,https://images.clarin.com/2021/06/11/OeJ_edbv6_720x0__1.jpg
12,MAGWsul87,Biodiversidad. Hay un punto ciego frente al cambio climático,https://www.clarin.com/new-york-times-international-weekly/punto-ciego-respuesta-cambio-climatico_0_MAGWsul87.html,https://images.clarin.com/2021/06/11/Vz_cVwu8Q_1256x620__2.jpg#1623422680068
13,_kC9sq_CJu,Alarma. ¿ Se está desmoronando Amsterdam?,https://www.clarin.com/new-york-times-international-weekly/-desmoronando-amsterdam-_0__kC9sq_CJu.html,https://images.clarin.com/2021/06/11/qD3SqIwsE_1256x620__2.jpg#1623425341836
14,E2vsJJxNp,"Insólito. Gran Bretaña clausuró el ""Arca de Noé"" ",https://www.clarin.com/new-york-times-international-weekly/gran-bretana-clausuro-arca-noe-cuestiona-pueda-salir-mar_0_E2vsJJxNp.html,https://images.clarin.com/2021/06/11/B3fGPQy3n_1256x620__2.jpg#1623424413752
15,pGKqAIgiL,Nuevo anticonceptivo.  ¿Será tan revolucionario como la píldora?,https://www.clarin.com/new-york-times-international-weekly/nuevo-metodo-anticonceptivo-mujeres-revolucionario-pildora-_0_pGKqAIgiL.html,https://images.clarin.com/2021/06/11/Lgwo25vLz_1256x620__2.jpg#1623419141571
16,ucsDwOKif,"Más cruces por las clases. Cafiero criticó fuerte a Larreta y Santilli le respondió: ""Parece que Horacio es el responsable de todo""",https://www.clarin.com/politica/santiago-cafiero-critico-fuerte-rodriguez-larreta-respondio-santilli-parece-horacio-responsable-_0_ucsDwOKif.html,https://images.clarin.com/2021/05/21/N95GTNmaH_1256x620__2.jpg#1623506755819
17,c1jXwJLgt,El manejo de la pandemia. AstraZeneca: ¿los jóvenes tienen reacciones más fuertes tras vacunarse?,https://www.clarin.com/sociedad/astrazeneca-personas-jovenes-reacciones-fuertes-despues-vacunarse-_0_c1jXwJLgt.html,https://images.clarin.com/2021/06/03/JUaFHdgzj_1256x620__2.jpg#1623525020712
18,PRV9ukP2C,"Conmoción en la Eurocopa. Un futbolista se desplomó en pleno partido, pero lo reanimaron y está “estable”",https://www.clarin.com/deportes/conmocion-eurocopa-salud-christian-eriksen-desplomo-pleno-partido_0_PRV9ukP2C.html,https://images.clarin.com/2021/06/12/i-kAYEQVw_720x0__1.jpg
19,onJdmgPc6,En Dinamarca . El shock y las lágrimas de la esposa de Eriksen en pleno partido,https://www.clarin.com/deportes/shock-lagrimas-esposa-christian-eriksen-luego-esposo-desplomara-pleno-partido_0_onJdmgPc6.html,https://images.clarin.com/2021/06/12/QK4SUUQIy_720x0__1.jpg
20,N0RUkTBgh,Preocupación. El minuto a minuto en imágenes del dramático momento en la Eurocopa,https://www.clarin.com/deportes/minuto-minuto-imagenes-dramatico-momento-vivio-eurocopa-desplomarse-futbolista-danes_0_N0RUkTBgh.html,https://images.clarin.com/2021/06/12/F8QZ79axi_720x0__1.jpg
21,ZI4MVpSFQ,"Tiene coronavirus. El nuevo parte médico sobre la salud de Susana Giménez, internada en Uruguay",https://www.clarin.com/fama/coronavirus-nuevo-parte-medico-salud-susana-gimenez_0_ZI4MVpSFQ.html,https://images.clarin.com/2021/04/25/qkkc8Z4Oo_720x0__1.jpg
22,VveaddKoH,Brasil. Bolsonaro encabeza una masiva caravana de motos,https://www.clarin.com/mundo/jair-bolsonaro-vuelve-desafiar-pandemia-encabeza-masiva-caravana-motos_0_VveaddKoH.html,https://images.clarin.com/2021/06/12/br9LGsphe_720x0__1.jpg
23,YvgWav0Z5,"Entrevista en París. Coco, sobreviviente de Chalie Hebdo, cuenta su nuevo comic",https://www.clarin.com/revista-n/coco-sobreviviente-charlie-hebdo-cuenta-nuevo-comic_0_YvgWav0Z5.html,https://images.clarin.com/2021/06/11/Rs9xUV0uB_930x525__3.jpg#1623497156963
24,fSiAPic95,"Libro testimonial. Martha Argerich por ella misma: ""Nunca tuve confianza en mí""",https://www.clarin.com/revista-n/escenarios/martha-argerich-misma-confianza-_0_fSiAPic95.html,https://images.clarin.com/2020/06/13/QCscEel5p_1256x620__2.jpg#1623332607375
25,L3zd8Jw9x,Landet en La Boca. Portales hacia el uso incesante,https://www.clarin.com/revista-n/arte/marco-la-boca-jose-luis-landet-reciclado_0_L3zd8Jw9x.html,https://images.clarin.com/2021/06/11/YLlvL1RtI_930x525__2.jpg#1623440238675
26,izI5x5C6z,Libros flamantes. Nuevas voces para recordar la Guerra de Malvinas,https://www.clarin.com/revista-n/ideas/nuevas-voces-recordar-guerra-malvinas_0_izI5x5C6z.html,https://images.clarin.com/2019/03/30/OUMcBhF7a_1256x620__2.jpg#1623330193301
27,rtDaE8euk,"Martín Kohan. ""No siempre la vanguardia motoriza una revolución política""",https://www.clarin.com/revista-n/literatura/martin-kohan-siempre-vanguardia-motoriza-revolucion-politica-_0_rtDaE8euk.html,https://images.clarin.com/2021/06/10/Di6BarxEJ_720x0__1.jpg
28,up8-srJPm,Modos de ver. Las fotos de Walker Evans se ven cada día más cerca,https://www.clarin.com/revista-n/literatura/fotos-walker-evans-ven-dia-cerca_0_up8-srJPm.html,https://images.clarin.com/2021/06/11/XcTUgqnFQ_1256x620__2.jpg#1623436861979
29,fKZXzMzRG,Ganadería del NEA y el NOA. Una familia que apuesta a seguir creciendo pese a las medidas del Gobierno,https://www.clarin.com/rural/familia-integro-agricultura-ganaderia-apuesta-seguir-creciendo-pese-obstaculos-politicos_0_fKZXzMzRG.html,https://images.clarin.com/2021/06/10/hOhY4QMP8_720x0__1.jpg
30,aaGNY93sZ,La columna de la semana. Cepo a la carne: un tiro en el pie,https://www.clarin.com/rural/cierre-exportaciones-tiro-pie_0_aaGNY93sZ.html,https://images.clarin.com/2021/06/11/8SihWuYll_720x0__1.jpg
31,27mHF16qN,"Tensión Campo-Gobierno. La sensación de ser acusados, otra vez, como los malos de la película",https://www.clarin.com/rural/sensacion-acusados-vez-malos-pelicula_0_27mHF16qN.html,https://images.clarin.com/2021/06/07/zgWz9WJAU_720x0__1.jpg
32,1rtjTQ_DV,Ganadería del NEA y el NOA. Cómo atravesar un invierno con escasez forrajera,https://www.clarin.com/rural/atravesar-invierno-escasez-forrajera_0_1rtjTQ_DV.html,https://images.clarin.com/2021/06/11/2epz3jwRD_720x0__1.jpg
33,UNAxARWaB,"Ganadería del NEA y el NOA. La sanidad, esa herramienta invisible que no puede faltar",https://www.clarin.com/rural/sanidad-herramienta-invisible-puede-faltar_0_UNAxARWaB.html,https://images.clarin.com/2021/06/11/VS7fhLLYO_720x0__1.jpg
34,vEA95U1cu,Análisis. La producción agroalimentaria arrastra a Brasil a crecer 5% en 2021,https://www.clarin.com/rural/produccion-agroalimentaria-arrastra-brasil-crecer-5-ciento-2021_0_vEA95U1cu.html,https://images.clarin.com/2017/12/25/Sko1xG0MG_720x0.jpg
35,PQ1iFBKtV,"Provincia daría el OK. Para acelerar los tiempos, un intendente del GBA quiere vacunar de noche",https://www.clarin.com/zonales/hurlingham-quieren-empezar-vacunar-noche_0_PQ1iFBKtV.html,https://images.clarin.com/2021/06/10/Wpvche8mb_720x0__1.jpg
36,lUnZdT3Hk,"Delivery y take away. Una pizzería histórica reabrió con apoyo de vecinos, a dos meses de un terrible accidente",https://www.clarin.com/zonales/colectivo-incrusto-pizzeria-historica-meses-despues-reabrio-apoyo-barrio_0_lUnZdT3Hk.html,https://images.clarin.com/2021/04/03/UcJuVu4_E_720x0__1.jpg
37,CE61WB-_h,"Inseguridad. Le falta una pierna, anda en muletas y asaltaba colectivos",https://www.clarin.com/zonales/falta-pierna-anda-muletas-asaltaba-colectivos_0_CE61WB-_h.html,https://images.clarin.com/2021/06/11/9MKcqBu9n_720x0__1.jpg
38,NWudYcyvy,Fanático. La emoción de un abuelo al recibir el saludo de cumpleaños de Francescoli,https://www.clarin.com/zonales/video-emocion-abuelo-fanatico-river-recibir-saludo-cumpleanos-enzo-francescoli_0_NWudYcyvy.html,https://images.clarin.com/2021/06/10/mwv2U7Cgu_1256x620__4.jpg#1623353076446
39,qkA22uy5X,Mujeres en acción. La feria emprendedoras para salvar las ventas del Día del Padre,https://www.clarin.com/zonales/-mujeres-accion-feria-cien-emprendedoras-unieron-salvar-ventas-dia-padre_0_qkA22uy5X.html,https://images.clarin.com/2021/06/11/MAWlqA7sJ_720x0__1.jpg
40,SxWOs4I0K,"Reflotó el interés. Lautaro Martínez, otra vez tapa: ¿se viene el tridente con Messi y Agüero?",https://www.clarin.com/deportes/lautaro-martinez-barcelona-inter_0_SxWOs4I0K.html,https://images.clarin.com/2021/06/12/E3AbAyz4C_720x0__1.jpg
41,7JaMFBnmi,Debuta este domingo. Copa América: 12 contagios y brote de Covid en la selección de Venezuela,https://www.clarin.com/deportes/copa-america-12-contagios-brote-coronavirus-seleccion-venezuela_0_7JaMFBnmi.html,https://images.clarin.com/2021/06/12/dDYhFHm-t_720x0__1.jpg
42,YoThqHLhS,Copa América. Habrá reemplazos ilimitados en los planteles por contagios de Covid,https://www.clarin.com/deportes/copa-america-reemplazos-ilimitados-planteles-caso-contagios-covid-19_0_YoThqHLhS.html,https://images.clarin.com/2021/06/12/Cy6_UjwJz_1256x620__2.jpg#1623499657876
43,eJ8fdiKI8,"Corrales vs. Castillo. Uno de los combates más vibrantes del Siglo XXI, que nunca tuvo revancha digna",https://www.clarin.com/deportes/diego-corrales-vs-jose-luis-castillo-combates-vibrantes-siglo-xxi-revancha-digna_0_eJ8fdiKI8.html,https://images.clarin.com/2021/06/09/c7lhKw52B_1256x620__2.jpg#1623293935049
44,JiJAawLSe,Primer título de GS. Barbora Krejcikova dio la sorpresa y se consagró campeona en Roland Garros,https://www.clarin.com/deportes/tenis-barbora-krejcikova-consagro-campeona-roland-garros_0_JiJAawLSe.html,https://images.clarin.com/2021/06/12/_4PwE4xFj_1256x620__2.jpg#1623515160722
45,fpHAJ7APH,"A 35 años del Mundial 86. Pat Jennings, el arquero de las manos gigantes y los mil partidos",https://www.clarin.com/deportes/35-anos-mundial-86-pat-jennings-arquero-manos-gigantes-mil-partidos-hizo-historia-mexico_0_fpHAJ7APH.html,https://images.clarin.com/2021/06/11/dnYoGzfWG_720x0__1.jpg
46,HRf8w7MAB,Está 3-0 abajo. Campazzo aportó poco y Denver ahora perdió de local ante Phoenix,https://www.clarin.com/deportes/facundo-campazzo-denver-nuggets-vs-phoenix-suns-playoffs-nba-minuto-minuto-directo_0_HRf8w7MAB.html,https://images.clarin.com/2021/06/09/LAalB5bv2_720x0__1.jpg
47,Z1zXJSYQ5,"Especial para Clarín. Tsitsipas todavía no es Zeus, pero en Grecia lo miran como a un dios",https://www.clarin.com/deportes/stefanos-tsitsipas-todavia-zeus-grecia-miran-dios_0_Z1zXJSYQ5.html,https://images.clarin.com/2021/06/11/CwS5spcy__720x0__1.jpg
48,1tXcR-yNd,Imágenes sensibles. Video: denuncian que un policía mató de cuatro tiros a un joven qom en Chaco,https://www.clarin.com/sociedad/denuncian-policia-mato-tiros-joven-comunidad-qom-chaco_0_1tXcR-yNd.html,https://images.clarin.com/2021/06/12/TkY1DT4vv_720x0__1.jpg
49,0yhyNgf2s,Boletín Oficial. Reducen vuelos a Europa y suspenden nuevos destinos por las nuevas cepas,https://www.clarin.com/sociedad/coronavirus-reducen-vuelos-europa-suspenden-nuevos-destinos-evitar-ingreso-nuevas-cepas_0_0yhyNgf2s.html,https://images.clarin.com/2021/04/11/C2WX0mXCs_720x0__1.jpg
50,PhFcYtyE6,"Método dudoso. Kicillof y la ""trampa"" estadística para volver a las clases presenciales",https://www.clarin.com/sociedad/coronavirus-trampita-estadistica-axel-kicillof-puedan-volver-clases-presenciales_0_PhFcYtyE6.html,https://images.clarin.com/2021/06/11/JgcS0i-PR_720x0__1.jpg
51,Chs2RIo-_,En mayo . Aumentó el pago de intereses de la deuda: cobraron el FMI y los bonistas del canje,https://www.clarin.com/economia/mayo-aumento-pago-intereses-deuda_0_Chs2RIo-_.html,https://images.clarin.com/2021/06/04/Piy0zAO7P_720x0__1.jpg
52,2rr2MLZtM,Giro de Kicillof. Vuelta a las aulas en Provincia: una decisión que dejó expuesta a la Rosada,https://www.clarin.com/politica/regreso-aulas-bonaerenses-decision-dejo-expuesta-casa-rosada_0_2rr2MLZtM.html,https://images.clarin.com/2021/06/11/RKuBeICt3d_720x0__1.jpg
53,Foj4M4T81,Rubro por rubro. Desde restaurantes hasta cines: las nuevas aperturas en la Ciudad,https://www.clarin.com/ciudades/aperturas-anuncio-rodriguez-larreta-ciudad_0_Foj4M4T81.html,https://images.clarin.com/2021/06/03/-W8lZ3yYA_720x0__1.jpg
54,7htUbO0EQ,Clásicos y originales. Día Mundial del Gin: 10 recetas de tragos para preparar en casa,https://www.clarin.com/gourmet/dia-mundial-gin-10-recetas-tragos-clasicos-originales-preparar-casa_0_7htUbO0EQ.html,https://images.clarin.com/2021/06/10/XgedIj4j7_1256x620__2.jpg#1623376887717
55,GswTVoIYN,Paso a paso. Las mejores recetas de MasterChef de la semana,https://www.clarin.com/gourmet/mejores-recetas-masterchef-semana_0_GswTVoIYN.html,https://images.clarin.com/1969/12/31/ByY0MbqEl_1256x620__2.jpg#1623458718196
56,PKcx25_mR,Móviles. Cómo saber si hackearon tu teléfono celular y te están espiando,https://www.clarin.com/tecnologia/saber-hackearon-telefono-celular-espiando_0_PKcx25_mR.html,https://images.clarin.com/2021/04/26/_EjGoYWVe_720x0__1.jpg
57,kO3nLBYPT,"Preocupación y alerta. Cáncer de próstata: con antecedentes, hay que empezar antes los controles",https://www.clarin.com/buena-vida/cancer-prostata-preocupan-bajos-controles-advierten-antecedentes-empezar_0_kO3nLBYPT.html,https://images.clarin.com/2021/06/10/6RfEbyk5w_720x0__1.jpg
58,vNq4rOO96,Estudio. ¿Es bueno que los chicos duerman con sus mascotas?,https://www.clarin.com/buena-vida/-bueno-chicos-duerman-mascotas-_0_vNq4rOO96.html,https://images.clarin.com/2021/06/09/utYjlcVLE_720x0__1.jpg
59,BA2tbqmXH,Consejos. La ley de atracción: ¿mito o realidad?,https://www.clarin.com/relaciones/ley-atraccion-mito-realidad-_0_BA2tbqmXH.html,https://images.clarin.com/2021/06/08/Yetw7j0BR_720x0__1.jpg
60,GB0ZeOI-O,Clima energético. Solsticio de invierno 2021: cuándo es y qué propone el cambio estacional,https://www.clarin.com/astrologia/solsticio-invierno-2021-propone-cambio-estacional_0_GB0ZeOI-O.html,https://images.clarin.com/2021/06/11/-49Xo1G0t_720x0__1.jpg
61,4PqsMdEyY,"Patrocinado. Green Life Realty, una inmobiliaria para invertir en Miami",https://www.clarin.com/mercado-inmobiliario/green-life-realty--inmobiliaria-invertir-miami_0_4PqsMdEyY.html,https://images.clarin.com/2021/06/08/9Vn3oz_3D_720x0__1.jpg
62,pGvZsYNff,"Mundo insólito. Las ""micronaciones"" más excéntricas para solicitar la ciudadanía",https://www.clarin.com/internacional/micronaciones-excentricas-puede-solicitar-ciudadania_0_pGvZsYNff.html,https://images.clarin.com/2021/06/10/1sRQdqngR_720x0__1.jpg
63,9kxuVC__m,"Béisbol. Se sacaron de encima a su ídolo y fracasaron durante 86 años: la ""maldición del Bambino""",https://www.clarin.com/internacional/deportes/sacaron-encima-idolo-fracasaron-86-anos-inexplicable-maldicion-bambino-_0_9kxuVC__m.html,https://images.clarin.com/2021/06/10/s8snPviNJ_720x0__1.jpg
64,i_kZaKoE2,violenta venganza. Un albañil destruyó una casa porque no le pagaron por los arreglos,https://www.clarin.com/viste/violenta-venganza-albanil-pagaron-arreglos-hizo-casa_0_i_kZaKoE2.html,https://images.clarin.com/2021/06/11/B2fjQ6ITf_720x0__1.jpg
65,D5jRZEhRM,Misterio. Apareció muerta una actriz porno que había causado un escándalo en EE.UU.,https://www.clarin.com/viste/aparecio-muerta-actriz-porno-dakota-skye-causo-escandalo-redes-tomarse-fotos-hot-mural-george-floyd_0_D5jRZEhRM.html,https://images.clarin.com/2021/06/11/u5Jbj_q1y_720x0__1.jpg
66,tKImHpgkv,Sigue el misterio. Revelan que una momia egipcia no es humana y la vinculan con un dios,https://www.clarin.com/internacional/sigue-misterio-revelan-momia-egipcia-humana-vinculan-dios-muerte_0_tKImHpgkv.html,https://images.clarin.com/2020/07/18/Jo8Zx5kQ2_720x0__1.jpg
67,XlEKDFLGy,Mirá el video. Captan por primera vez a ballenas cazando mediante un increíble sistema,https://www.clarin.com/viste/video-muestra-primera-vez-ballenas-cazando-mediante-increible-sistema_0_XlEKDFLGy.html,https://images.clarin.com/2021/06/10/1jihB0y3q_720x0__1.jpg
68,H2wDEkurn,"Seis episodios. Ordena tu vida, con Eugenia Tobal, disponible en Flow",https://www.clarin.com/brandstudio/ordena-vida-eugenia-tobal-disponible-flow_0_H2wDEkurn.html,https://images.clarin.com/2021/06/10/MI9Mj6cRK_720x0__1.jpg
69,L5jZp97Zf,"Ideal para maratonear. Mary Kills People, una comedia negra sobre la vida y la muerte",https://www.clarin.com/brandstudio/mary-kills-people-comedia-negra-vida-muerte_0_L5jZp97Zf.html,https://images.clarin.com/2021/06/10/EDd8WdptlQ_720x0__1.jpg
70,BERKr87qI,Especial Warner Mood. ¿El mejor programa? Cine en casa,https://www.clarin.com/brandstudio/-mejor-programa-cine-casa_0_BERKr87qI.html,https://images.clarin.com/2021/06/10/CkEpC5nHO_720x0__1.jpg
71,tjcnvfn8Y,"En Flow. Pavarotti, un documental único sobre el famoso Tenor del pueblo",https://www.clarin.com/brandstudio/pavarotti-documental-unico-famoso-tenor-pueblo_0_tjcnvfn8Y.html,https://images.clarin.com/2021/06/11/XL51-Tv7l_720x0__1.jpg
72,5xQCotTu9,"El Encanto. La eterna búsqueda del momento ideal para ser padres, en Flow",https://www.clarin.com/brandstudio/encanto-eterna-busqueda-momento-ideal-padres_0_5xQCotTu9.html,https://images.clarin.com/2021/06/10/o5MlxAv0h_720x0__1.jpg
73,PQ0eSvb7I,En Uruguay. Una argentina desapareció cuando iba al juzgado por una denuncia contra su ex,https://www.clarin.com/policiales/argentina-desaparecio-uruguay-iba-juzgado-denuncia-ex_0_PQ0eSvb7I.html,https://images.clarin.com/2021/06/12/QAUjfMEyx_720x0__1.jpg
74,Ya0mXLXdn,"Horror en España. Qué dice la autopsia de Olivia, una de las hijas que Gimeno arrojó al mar",https://www.clarin.com/internacional/horror-tenerife-dice-autopsia-olivia-hijas-tomas-gimeno-arrojo-mar_0_Ya0mXLXdn.html,https://images.clarin.com/2021/06/10/oFElfENKI_720x0__1.jpg
75,GSuy0mlFE,En la Provincia. La lista de actividades que están permitidas según cada fase de restricciones,https://www.clarin.com/sociedad/lista-completa-actividades-permitidas-provincia-fase-restricciones_0_GSuy0mlFE.html,https://images.clarin.com/2021/06/12/tAss0bASh_1256x620__2.jpg#1623516927468
76,DhfMyk_Eh,Escribe Lanata. Qué pasa por la cabeza de los protagonistas de la interna macrista,https://www.clarin.com/opinion/matar-padre-pasa-cabeza-protagonistas-interna-macrista_0_DhfMyk_Eh.html,https://images.clarin.com/2021/06/07/5kJoMGuP7_720x0__1.jpg
77,6B53iTCEN,"En Provincia . Por primera vez, Juntos por el Cambio aparece arriba del Frente de Todos ",https://www.clarin.com/politica/encuesta-electoral-primera-vez-juntos-cambio-aparece-arriba-frente-provincia_0_6B53iTCEN.html,https://images.clarin.com/2019/10/28/SSyblKSP_720x0__1.jpg
78,EqViRdeh2,Tenía 55 años. Le avisó a su hijo que se iba a encontrar con una mujer y apareció asesinado en su auto,https://www.clarin.com/policiales/aviso-hijo-iba-encontrar-mujer-aparecio-asesinado-auto_0_EqViRdeh2.html,https://images.clarin.com/2021/06/12/JZ89Y5x3B_720x0__1.jpg
79,vr_B6NoQC,Video. Un jugador japonés hizo un gol increíble con cuatro caños consecutivos,https://www.clarin.com/deportes/gol-canos-kubo-japon-jamaica_0_vr_B6NoQC.html,https://images.clarin.com/2021/06/12/EuPpdCZp2_720x0__1.jpg
80,YVisJujxx,Monotributo 2021. Qué pasa con las deudas y cuándo rigen las nuevas categorías,https://www.clarin.com/economia/monotributo-2021-pasa-deudas-rigen-nuevas-categorias_0_YVisJujxx.html,https://images.clarin.com/2021/06/01/0jZCB_MaB_1256x620__3.jpg#1623519046294
81,PNxcy3vVs,"Tiene 29 años. Quién es Christian Eriksen, el talentoso volante creativo que brilla en el Inter",https://www.clarin.com/deportes/christian-eriksen-futbolista-danes-desplomo-eurocopa-2020_0_PNxcy3vVs.html,https://images.clarin.com/2021/06/12/ODzDdLP3R_1256x620__2.jpg#1623519730214
82,mMcneMQio,"La palabra de un cardiólogo. ""Los médicos le salvaron la vida; no los jugadores""",https://www.clarin.com/deportes/roberto-peidro-medicos-salvaron-vida-hicieron-jugadores-arbitro-_0_mMcneMQio.html,https://images.clarin.com/2021/06/12/XTVCHSVeN_720x0__1.jpg
83,ExAczQxPG,Antecedentes. De la muerte de Foé al susto con Graieb: otros casos similares,https://www.clarin.com/deportes/muerte-foe-susto-graieb-casos-conmocionaron-futbol_0_ExAczQxPG.html,https://images.clarin.com/2018/02/15/SyBYDvNwG_720x0__1.jpg
84,naXgsw0TF,En las redes. Las plegarias de los futbolistas por la salud del danés Eriksen,https://www.clarin.com/deportes/eurocopa-preocupacion-rezos-futbolistas-salud-christian-eriksen_0_naXgsw0TF.html,https://images.clarin.com/2021/06/12/WOV-FRE3i_720x0__1.jpg
85,Vn70wzGP8,Bill Gates. El día que descubrió Internet: cómo aplastó a todos y por qué ya nadie usa Explorer,https://www.clarin.com/tecnologia/dia-bill-gates-descubrio-web-aplasto-competencia-25-anos-despues-nadie-usa-internet-explorer_0_Vn70wzGP8.html,https://images.clarin.com/2021/05/19/GdXVOwlZf_1256x620__2.jpg#1623436403803
86,n5T65dkTl,Entrevista. Los onas que viajaron enjaulados a París y la extraordinaria vuelta de uno de ellos,https://www.clarin.com/cultura/hombre-llego-paris-jaula-hizo-volver_0_n5T65dkTl.html,https://images.clarin.com/2021/06/11/hlf4V3wqa_720x0__1.jpg
87,qpvrHWuqI,Grúas en la Ciudad. Siguen las quejas por el maltrato a los autos y la velocidad en los acarreos,https://www.clarin.com/ciudades/gruas-polemicas-siguen-quejas-maltrato-autos-excesos-velocidad-acarreos_0_qpvrHWuqI.html,https://images.clarin.com/2021/06/11/v5k0koDxB_720x0__1.jpg
88,LGnGaDCEf,Mundos íntimos. Mi amiga necesitó un trasplante de corazón: su cuerpo lo rechazó y murió,https://www.clarin.com/sociedad/mundos-intimos-amiga-necesito-trasplante-corazon-cuerpo-rechazo-murio-hoy-recuerdo-ganas-vivir-_0_LGnGaDCEf.html,https://images.clarin.com/2021/06/11/J8ib0MvW9_1256x620__2.jpg#1623434490110
89,lpdKIxklV,Ladrón internacional. Viajó al Mundial de Rusia para robar joyas: cayó asaltando en Caballito,https://www.clarin.com/policiales/viajo-ultimo-mundial-robo-valija-joyas-enterro-campo-ruso-cayo-asaltando-departamento-caballito_0_lpdKIxklV.html,https://images.clarin.com/2021/06/11/CALGIJlth_720x0__1.jpg
90,NsnXc4PCc,"Serie de los 80. Willis, la vida al límite del único sobreviviente de ""Blanco y negro""",https://www.clarin.com/internacional/espectaculos/willis-blanco-negro-vida-limite-unico-sobreviviente-serie-80_0_NsnXc4PCc.html,https://images.clarin.com/2020/05/19/HKPYqL22Y_720x0__1.jpg
91,XeA0W7C2-,"Fue publicada. Diario de Ana Frank: la versión completa, que reescribió antes de caer en manos de los nazis",https://www.clarin.com/cultura/diario-ana-frank-publican-version-completa--misma-reescribio-caer-manos-nazis_0_XeA0W7C2-.html,https://images.clarin.com/2021/06/11/GYzrC43RF_1256x620__2.jpg#1623451303258
92,ZNakYZnEo,"Gigantes tecnológicos. EE.UU. contra Google, Amazon, Facebook y Apple: promueven 5 leyes anti monopolio",https://www.clarin.com/tecnologia/unidos-apunta-fuerte-google-amazon-facebook-apple-promueven-5-leyes-anti-monopolio_0_ZNakYZnEo.html,https://images.clarin.com/2021/04/13/pUzDHKxpS_720x0__1.jpg
