n,id,title,url,image
1,T0_TG8XoR,Disputa por las aulas. Balance de las medidas: dos curvas revelan la verdad sobre las clases presenciales y el Covid,https://www.clarin.com/sociedad/balance-medidas-curvas-revelan-verdad-clases-presenciales-covid_0_T0_TG8XoR.html,https://images.clarin.com/2021/06/07/twpd1Fc1W_720x0__1.jpg
2,IVJkZ6gjp,Restricciones por el Covid. Cómo prevé el Gobierno que siga la cuarentena a partir del sábado,https://www.clarin.com/politica/nueva-cuarentena-fines-semana-duros-dias-habiles-limitaciones-clases-presenciales_0_IVJkZ6gjp.html,https://images.clarin.com/2021/06/07/VzaV8taE6_720x0__1.jpg
3,uXzfVaEVx,Cambios impositivos. Los monotributistas y 800 mensajes por hora con quejas por los retroactivos,https://www.clarin.com/economia/monotributistas-800-mensajes-hora-quejas-retroactivos_0_uXzfVaEVx.html,https://images.clarin.com/2021/04/29/awUR4Iblt_1256x620__2.jpg#1623146796615
4,_WX52x7Bd,"Interna en el PRO. Sin acuerdo con Macri, Rodríguez Larreta va por listas propias en la Ciudad y la Provincia",https://www.clarin.com/politica/horacio-rodriguez-larreta-patricia-bullrich-reunieron-bajar-tension-candidaturas-desacuerdos-siguen_0__WX52x7Bd.html,https://images.clarin.com/2021/06/07/5kJoMGuP7_720x0__1.jpg
5,Gu1J_v69H,"País adolescente. Que mande Cristina, pero que no se note",https://www.clarin.com/opinion/mande-cristina-note_0_Gu1J_v69H.html,https://images.clarin.com/2019/11/29/0vYyN4qP_720x0__1.jpg
6,p10lRZOk7,"Con Miami caro, los otros destinos elegidos para vacunarse en EE.UU.",https://www.clarin.com/mundo/miami-carisimo-destinos-eligen-argentinos-vacunarse-ee-uu-_0_p10lRZOk7.html,https://images.clarin.com/2021/05/03/ZcwCl7rao_1256x620__2.jpg#1622929441915
7,i_D-IB-Df,Del editor. El hombre que jaqueó al poder y se niega a ser estrella,https://www.clarin.com/opinion/hombre-jaqueo-poder-niega-estrella_0_i_D-IB-Df.html,https://images.clarin.com/2021/01/26/041TPKdBU_720x0__1.jpg
8,_D0r-i7yz,"Movilidad en dos ruedas. Motos, bicis y monopatines baratos: modelos por menos de $ 90.000 y en cuotas",https://www.clarin.com/servicios/motos-bicis-monopatines-baratos-modelos-90-000-cuotas_0__D0r-i7yz.html,https://images.clarin.com/2021/03/12/NdextrRQb_720x0__1.jpg
9,QU7iD1E6C,Turismo. Con qué vacunas ya se puede ingresar a España,https://www.clarin.com/mundo/espana-abre-fronteras-turistas-vacunados-dosis-aprobadas-poder-ingresar_0_QU7iD1E6C.html,https://images.clarin.com/2021/06/07/KvTSuKAoQ_720x0__1.jpg
10,56M3hMOau,Personaje. Martina Navratilova tiene mucho que decir,https://www.clarin.com/new-york-times-international-weekly/martina-navratilova-decir_0_56M3hMOau.html,https://images.clarin.com/2021/06/07/_w1r96yvt_1256x620__3.jpg#1623076781161
11,L--Uz9I0v,"Modern Love. Ay, Dewey, ¿dónde me pondrías?",https://www.clarin.com/new-york-times-international-weekly/modern-love-ay-dewey-pondrias-_0_L--Uz9I0v.html,https://images.clarin.com/2021/06/07/4TCdX2Tlr_1256x620__2.jpg#1623074768189
12,_whSNgp2m,Coronavirus. ¿Necesitaremos refuerzos de la vacuna? ¿Cuándo? ¿Y cuáles?,https://www.clarin.com/new-york-times-international-weekly/probablemente-necesitaremos-refuerzos-vacuna-_0__whSNgp2m.html,https://images.clarin.com/2021/06/07/9KqatN2ao_1256x620__2.jpg#1623079268054
13,T0_TG8XoR,Disputa por las aulas. Balance de las medidas: dos curvas revelan la verdad sobre las clases presenciales y el Covid,https://www.clarin.com/sociedad/balance-medidas-curvas-revelan-verdad-clases-presenciales-covid_0_T0_TG8XoR.html,https://images.clarin.com/2021/06/07/twpd1Fc1W_720x0__1.jpg
14,IVJkZ6gjp,Restricciones por el Covid. Cómo prevé el Gobierno que siga la cuarentena a partir del sábado,https://www.clarin.com/politica/nueva-cuarentena-fines-semana-duros-dias-habiles-limitaciones-clases-presenciales_0_IVJkZ6gjp.html,https://images.clarin.com/2021/06/07/VzaV8taE6_720x0__1.jpg
15,uXzfVaEVx,Cambios impositivos. Los monotributistas y 800 mensajes por hora con quejas por los retroactivos,https://www.clarin.com/economia/monotributistas-800-mensajes-hora-quejas-retroactivos_0_uXzfVaEVx.html,https://images.clarin.com/2021/04/29/awUR4Iblt_1256x620__2.jpg#1623146796615
16,_WX52x7Bd,"Interna en el PRO. Sin acuerdo con Macri, Rodríguez Larreta va por listas propias en la Ciudad y la Provincia",https://www.clarin.com/politica/horacio-rodriguez-larreta-patricia-bullrich-reunieron-bajar-tension-candidaturas-desacuerdos-siguen_0__WX52x7Bd.html,https://images.clarin.com/2021/06/07/5kJoMGuP7_720x0__1.jpg
17,Gu1J_v69H,"País adolescente. Que mande Cristina, pero que no se note",https://www.clarin.com/opinion/mande-cristina-note_0_Gu1J_v69H.html,https://images.clarin.com/2019/11/29/0vYyN4qP_720x0__1.jpg
18,p10lRZOk7,"Con Miami caro, los otros destinos elegidos para vacunarse en EE.UU.",https://www.clarin.com/mundo/miami-carisimo-destinos-eligen-argentinos-vacunarse-ee-uu-_0_p10lRZOk7.html,https://images.clarin.com/2021/05/03/ZcwCl7rao_1256x620__2.jpg#1622929441915
19,i_D-IB-Df,Del editor. El hombre que jaqueó al poder y se niega a ser estrella,https://www.clarin.com/opinion/hombre-jaqueo-poder-niega-estrella_0_i_D-IB-Df.html,https://images.clarin.com/2021/01/26/041TPKdBU_720x0__1.jpg
20,KZM6UQAKV,Eliminatorias. Argentina juega ante Colombia en un clima tenso en Barranquilla,https://www.clarin.com/deportes/argentina-juega-colombia-clima-tenso-barranquilla_0_KZM6UQAKV.html,https://images.clarin.com/2021/06/08/A1G1DL5Pt_720x0__1.jpg
21,RsSn7LhNU,Negociaciones difíciles. Gallardo y la búsqueda de un salto de calidad con futbolistas que ya jugaron en River,https://www.clarin.com/deportes/marcelo-gallardo-buscar-darle-salto-calidad-river-nombre-suena-lucas-alario_0_RsSn7LhNU.html,https://images.clarin.com/2021/05/25/gFMSQ8tlJ_720x0__1.jpg
22,2GeUBsXDX,"A 35 años de México 86. Scifo, el ""Pelé belga"" que inspiró a la generación de Lukaku y De Bruyne",https://www.clarin.com/deportes/futbol/35-anos-mexico-86-vicenzo-scifo--pele-belga-inspiro-generacion-hazard--lukaku-bruyne_0_2GeUBsXDX.html,https://images.clarin.com/2021/06/07/ljThTmam3_720x0__1.jpg
23,xL8T-v2E4,"Roland Garros. Schwartzman ganó otra batalla, pasó a cuartos y enfrentará a Nadal",https://www.clarin.com/deportes/roland-garros-2021-schwartzman-nadal-djokovic-van-busca-cuartos-final_0_xL8T-v2E4.html,https://images.clarin.com/2021/06/07/_sbs7a7Ex_720x0__1.jpg
24,fCNzDHb6s,"Especial para Clarín. La jerarquía, esa plusvalía que tienen pocos y que siempre marca la diferencia",https://www.clarin.com/deportes/jerarquia-plusvalia-pocos-siempre-marca-diferencia-grand-slam_0_fCNzDHb6s.html,https://images.clarin.com/2021/06/07/2aIogqNN-_720x0__1.jpg
25,PLU3GycAh,La chica maravilla. El video en slow motion de la prueba con la que Biles rompió otro récord,https://www.clarin.com/deportes/impresionante-video-slow-motion-prueba-simone-biles-rompio-record-titulos-nacionales_0_PLU3GycAh.html,https://images.clarin.com/2021/06/07/FELSLOtSF_720x0__1.jpg
26,QbndPkewN,Emotiva. La publicidad que evoca a Maradona con una mano de Dios desde el cielo,https://www.clarin.com/deportes/futbol/emotiva-publicidad-quilmes-evoca-maradona-mano-dios-ahora-llega-cielo_0_QbndPkewN.html,https://images.clarin.com/2021/06/07/NQu9X-M-T_720x0__1.jpg
27,BDQf0DlGo,"En Denver. Tata Martino y un minuto de furia con México: reclamo, expulsión y roja",https://www.clarin.com/deportes/tata-martino-minuto-furia-mexico-reclamo-airado-expulsion-derrota-unidos-final-liga-naciones-concacaf_0_BDQf0DlGo.html,https://images.clarin.com/2019/12/03/AI2Yw-S0_720x0__1.jpg
28,AkqrQz8qo,Mar del Plata. Un juez ordenó suspender la ley del aborto legal y el Gobierno apelará,https://www.clarin.com/sociedad/aborto-legal-juez-mar-plata-ordeno-suspender-aplicacion-ley-ive-gobierno-anuncio-apelara_0_AkqrQz8qo.html,https://images.clarin.com/2020/12/30/Pdwwtu2fQ_720x0__1.jpg
29,wtTHEzukY,Formosa. Un ministro arrastró con su auto a una persona en una protesta,https://www.clarin.com/sociedad/formosa-ministro-arrastro-auto-comerciante-reclamaba-restricciones_0_wtTHEzukY.html,https://images.clarin.com/2021/06/07/v-XwFZfiC_720x0__1.jpg
30,Vtl6mQMrC,Coronavirus. Llega de Rusia el avión con el principio activo para producir la vacuna Sputnik V,https://www.clarin.com/sociedad/coronavirus-partio-rusia-avion-trae-principio-activo-empezar-producir-vacuna-sputnik-v-argentina_0_Vtl6mQMrC.html,https://images.clarin.com/2021/05/27/teYHkvJ8o_720x0__1.jpg
31,3Gfi7DM1G,Plan Qunita. Confirman las irregularidades por las que está procesado Gollán,https://www.clarin.com/politica/plan-qunita-pericia-confirmo-irregularidades-procesado-ministro-daniel-gollan_0_3Gfi7DM1G.html,https://images.clarin.com/2021/06/07/mA9PaV5zY_720x0__1.jpg
32,r58wcEGnr,Antes de irse. Falabella remata más de 10.000 productos: cuándo son las subastas,https://www.clarin.com/economia/falabella-remata-10-000-productos-irse-subastas-participar_0_r58wcEGnr.html,https://images.clarin.com/2021/06/01/5U5Ue3HoN_720x0__1.jpg
33,71gKr-l94,Conmoción. Santa Cruz: dos chicos murieron tras partirse el hielo de un lago congelado,https://www.clarin.com/sociedad/tragedia-rio-turbio-chicos-murieron-ahogados-partirse-hielo-lago-congelado_0_71gKr-l94.html,https://images.clarin.com/2021/06/07/8vTZ8a3lR_1256x620__2.jpg#1623109977825
34,sTIIGPuLI,Polo científico. Un laboratorio argentino para diseñar ciudades inteligentes,https://www.clarin.com/brandstudio/laboratorio-argentino-disenar-ciudades-inteligentes_0_sTIIGPuLI.html,https://images.clarin.com/2021/06/04/w2P86GYPe_720x0__1.jpg
35,4WOf_CuyG,Grupos de riesgo. Covid y corazón: cuáles son los riesgos y qué chequeos hay que hacerse,https://www.clarin.com/buena-vida/covid-corazon-riesgos-chequeos-hacerse_0_4WOf_CuyG.html,https://images.clarin.com/2021/05/27/_YyqxHKbC_720x0__1.jpg
36,2w1tQxz-F,WWDC 21. Apple presentó el sistema operativo iOS 15 que llegará con el próximo iPhone,https://www.clarin.com/tecnologia/wwdc-21-apple-presento-sistema-operativo-ios-15-llegara-proximo-iphone_0_2w1tQxz-F.html,https://images.clarin.com/2021/06/07/I0Wo8B4v__720x0__1.jpg
37,aztC7wR-d,"Cuando el sol se esconde. Conjuros, mitos y creencias populares sobre los eclipses",https://www.clarin.com/astrologia/conjuros--mitos-creencias-populares-eclipses_0_aztC7wR-d.html,https://images.clarin.com/2021/06/07/woiCch0pM_720x0__1.jpg
38,oI8K7dTk9,Accidente frecuente. Por qué se puede romper un corcho de vino y cómo solucionarlo,https://www.clarin.com/gourmet/por-que-se-puede-romper-un-corcho-de-vino-y-como-solucionarlo_0_oI8K7dTk9.html,https://images.clarin.com/2021/05/28/1ooo9fyO6_1256x620__2.jpg#1622246153431
39,mDrT4g2wE,Niños y autonomía. De atarse cordones a ordenar su cuarto: cuándo es esperable de los chicos,https://www.clarin.com/familias/atarse-cordones-ordenar-cuarto-esperable-chicos-comiencen-hacerlo_0_mDrT4g2wE.html,https://images.clarin.com/2021/05/31/VvqKdF4TW_720x0__1.jpg
40,lWgFipYiP,Innovador. American Airlines ofrece clases de idioma a sus pasajeros,https://www.clarin.com/viajes/american-airlines-ofrece-clases-idioma-pasajeros_0_lWgFipYiP.html,https://images.clarin.com/2018/10/20/KjrV8UMcG_720x0__1.jpg
41,pSm7100W4,Nuevo estudio. ¿Protege la vitamina D contra casos graves de Covid?,https://www.clarin.com/buena-vida/-protege-vitamina-d-casos-graves-covid-_0_pSm7100W4.html,https://images.clarin.com/2021/06/04/uihw6TrB8_720x0__1.jpg
42,wCmduM45j,Recetas. Qué cocinar esta semana: menú día por día del 7 al 13 de junio,https://www.clarin.com/gourmet/que-cocinar-esta-semana-recetas_0_wCmduM45j.html,https://images.clarin.com/2021/05/10/afFixoKzm_720x0__1.jpg
43,SFqF6k83J,Online. Maradona eterno: fotos suyas cierran una muestra de arte en Serbia,https://www.clarin.com/cultura/maradona-eterno-fotos-cierran-muestra-arte-serbia_0_SFqF6k83J.html,https://images.clarin.com/2021/06/07/aNzxO_Su__1256x620__2.jpg#1623076154670
44,zsiv788dE,Scotty Bowers. El proxeneta que les organizaba encuentros sexuales secretos a las estrellas de Hollywood,https://www.clarin.com/internacional/espectaculos/historia-scotty-bowers-proxeneta-organizaba-encuentros-sexuales-secretos-estrellas-hollywood_0_zsiv788dE.html,https://images.clarin.com/2021/06/07/yHg3P4qj9_720x0__1.jpg
45,XQz4yR7OD,En Siberia. Animal microscópico volvió a la vida tras pasar 24.000 años bajo el hielo,https://www.clarin.com/viste/animal-microscopico-volvio-vida-pasar-24-000-anos-hielo-siberia_0_XQz4yR7OD.html,https://images.clarin.com/2021/06/07/xfJDqIN-B_720x0__1.jpg
46,T-SNaNPmE,En España e Italia. Conmoción: la estrella de TV y su marido ¿suicidado o asesinado?,https://www.clarin.com/viste/caso-conmueve-espana-italia-estrella-teve-famosa-marido-suicidado-asesinado-_0_T-SNaNPmE.html,https://images.clarin.com/2021/06/06/53Ybh5a-v_720x0__1.jpg
47,YsciVkQ3dr,Innovación. Inventan un baño para mujeres seis veces más rápido de usar que el inodoro,https://www.clarin.com/internacional/inventan-bano-mujeres-veces-rapido-usar-inodoro-tradicional_0_YsciVkQ3dr.html,https://images.clarin.com/2021/06/05/NfASxY5ab_720x0__1.jpg
48,1mJDB_u7D,Cambio rotundo. Cómo es la dieta que hizo Ed Sheeran para bajar de peso y adelgazar 20 kilos,https://www.clarin.com/internacional/espectaculos/dieta-hizo-ed-sheeran-bajar-peso-adelgazar-20-kilos_0_1mJDB_u7D.html,https://images.clarin.com/2021/06/04/nZK4YOnIn_720x0__1.jpg
49,aCNhGmssn3,"Vacunas. Citados bajo amenaza de apercibimiento, los laboratorios darán en Diputados respuestas",https://www.clarin.com/politica/laboratorios-van-congreso-explicar-demoras-vacunas_0_aCNhGmssn3.html,https://images.clarin.com/2021/05/07/QPxAVpntX_720x0__1.jpg
50,2QmBUMdOL,Elecciones en Perú. Castillo se aproxima a la victoria sobre Keiko Fujimori en un reñido final voto a voto,https://www.clarin.com/mundo/elecciones-peru-keiko-fujimori-supera-pedro-castillo-faltan-votos-interior_0_2QmBUMdOL.html,https://images.clarin.com/2021/06/07/NNMnl8rB2_1256x620__2.jpg#1623084585099
51,8p6979AWp,NBA. El aporte de Campazzo no alcanzó y Denver comienza abajo en semifinales,https://www.clarin.com/deportes/nba-aporte-facundo-campazzo-alcanzo-denver-comienza-abajo-semifinal-suns_0_8p6979AWp.html,https://images.clarin.com/2021/06/08/QCIhwPmYB_720x0__1.jpg
52,XbzGF_fBD,Demoras. Ganancias: la AFIP no reglamentó la ley y se sigue reteniendo el impuesto,https://www.clarin.com/economia/ganancias-afip-reglamento-ley-empresas-siguen-reteniendo-impuesto-empleados_0_XbzGF_fBD.html,https://images.clarin.com/2021/03/31/DUtPl8AE3A_720x0__1.jpg
53,kq651ziGj,Coronavirus. La Ciudad habilita hoy la vacunación a los mayores de 50: cómo inscribirse,https://www.clarin.com/ciudades/ciudad-habilita-hoy-vacunacion-mayores-50-inscribirse_0_kq651ziGj.html,https://images.clarin.com/2021/06/07/HiZyejsn9_1256x620__2.jpg#1623112299304
54,iziMuRFMt,Tenía 34 años. Murió por Covid una enfermera que había recibido las dos dosis de la vacuna,https://www.clarin.com/sociedad/coronavirus-murio-enfermera-34-anos-recibido-dosis-vacuna_0_iziMuRFMt.html,https://images.clarin.com/2021/06/07/42bS8Imf__1256x620__2.jpg#1623091616267
55,27XgnR7bF,"Tiene 15 años. Su papá abusaba de ella, le pidió ayuda a un policía y también la violó",https://www.clarin.com/sociedad/drama-cordobesa-15-anos-papa-abusaba-pidio-ayuda-policia-violo_0_27XgnR7bF.html,https://images.clarin.com/2021/06/07/Q8Ce2dgBn_720x0__1.jpg
56,f8XeRk42t,"Sacó un libro. El Indio Solari: ""No vi a nadie del régimen de Macri complicado con la cana""",https://www.clarin.com/politica/indio-solari-despotrico-mauricio-macri-vi-nadie-regimen-complicado-cana-_0_f8XeRk42t.html,https://images.clarin.com/2020/01/15/PWSp9-RR_1256x620__3.jpg#1623129540690
57,B1YPfTQ9G,"En China. Cómo es el Foso Celestial, el pozo natural más grande del mundo",https://www.clarin.com/viajes/foso-celestial-pozo-natural-grande-mundo_0_B1YPfTQ9G.html,https://images.clarin.com/2021/06/07/gIp-eA3-G_720x0__1.jpg
58,mnaOq_tw-,"La mítica Comandante 2. Dora María Téllez: ""Lo único que quiere Ortega es permanecer en el poder en Nicaragua""",https://www.clarin.com/mundo/dora-maria-tellez--ex-comandante-sandinista-unico-quiere-daniel-ortega-permanecer-poder-nicaragua_0_mnaOq_tw-.html,https://images.clarin.com/2021/06/07/EmVnim2AX_1200x0__2.jpg#1623097308798
59,trpOul17R,"Testimonio. Conmovedora entrevista de Quique Pesoa a Tanu, su hijo trans",https://www.clarin.com/sociedad/conmovedora-entrevista-quique-pesoa-tanu-hijo-trans-cambie-genero-mismo-_0_trpOul17R.html,https://images.clarin.com/2021/06/08/dWbcxGqO4_720x0__1.jpg
60,bFVZ6h7bN,Autos 0 km. Las marcas apuestan a sus planes de financiación para incentivar las ventas,https://www.clarin.com/autos/autos-0-km-marcas-apuestan-planes-financiacion-incentivar-ventas_0_bFVZ6h7bN.html,https://images.clarin.com/2021/03/30/392MXONRZ_720x0__1.jpg
61,cHpR1EP_W,Capacitación. Las 7 mejores apps para estudiar inglés gratis,https://www.clarin.com/servicios/7-mejores-apps-estudiar-ingles-gratis-distancia_0_cHpR1EP_W.html,https://images.clarin.com/2021/03/11/QKI9kPnVP_720x0__1.jpg
62,tYJnMQc1o,Difícil de cocinar. Mollejas: 5 errores que cometieron en MasterChef y cómo evitarlos,https://www.clarin.com/gourmet/mollejas-5-errores-cometieron-masterchef-evitarlos_0_tYJnMQc1o.html,https://images.clarin.com/2021/06/07/W65AYgB7I_720x0__1.jpg
63,2xP-qXkMr,Recuperación. Mientras hacía el desayuno se prendió fuego y los tatuajes la ayudaron a aceptarse,https://www.clarin.com/viste/el-fuego-quemo-un-tercio-del-cuerpo-y-los-tatuajes-la-ayudaron-a-aceptar-sus-cicatrices-aud1enc14-j0v3n_0_2xP-qXkMr.html,https://images.clarin.com/2021/06/05/0q4XSSay7_720x0__1.jpg
64,GvEDgpxxJ,Fórmula. Un nuevo aliado para combatir las arrugas,https://www.clarin.com/brandstudio/nuevo-aliado-combatir-arrugas_0_GvEDgpxxJ.html,https://images.clarin.com/2021/05/07/uDHfDfHjQ_720x0__1.jpg
65,gvlQ8iZzZ,Oficinas virtuales. El sueño de un espacio de trabajo remoto e integrado para PyMEs,https://www.clarin.com/brandstudio/sueno-espacio-trabajo-remoto-integrado-pymes_0_gvlQ8iZzZ.html,https://images.clarin.com/2021/06/02/ameEHXxax_1256x620__2.jpg#1622643955031
