n,id,title,url,image
1,Kr09OMuKL,"Crisis económica y pandemia. Otro día de protestas: el Gobierno aumenta la ayuda social, pero no logra contener la protesta",https://www.clarin.com/politica/movilizacion-piqueteros-regreso-ife-alimentos-gobierno-aumenta-ayuda-social-logra-contener-protesta_0_Kr09OMuKL.html,https://images.clarin.com/2021/06/18/EonWLt1fL_720x0__1.jpg
2,bth92bHF6,"Cobertura, minuto a minuto. Argentina se quedó sin piernas, pero maneja la pelota ante Uruguay",https://www.clarin.com/deportes/argentina-vs-uruguay-copa-america-2021-minuto-minuto-directo_0_bth92bHF6.html,https://images.clarin.com/2021/06/18/GrGRn4cdS_720x0__1.jpg
3,aayhZWBYK,Del editor. El dictador que el Gobierno se niega a ver,https://www.clarin.com/opinion/dictador-gobierno-niega-ver_0_aayhZWBYK.html,https://images.clarin.com/2021/06/18/VdbAy_4sn_720x0__1.jpg
4,WRcdWbyjo,"Tras las críticas. Macri pidió ""perdón"" tras referirse al Covid como una gripe ""un poco más grave""",https://www.clarin.com/politica/mauricio-macri-pidio-perdon-referirse-coronavirus-gripe-grave-_0_WRcdWbyjo.html,https://images.clarin.com/2021/06/18/wYJAUR4ZQi_720x0__1.jpg
5,m2gxHBXwf,En Santiago. Encontraron a una joven asesinada en un hotel alojamiento: un menor detenido,https://www.clarin.com/sociedad/femicidio-santiago-estero-encontraron-adolescente-ensangrentada-hotel-alojamiento_0_m2gxHBXwf.html,https://images.clarin.com/2021/06/18/gkXJUJIQ-_720x0__1.jpg
6,g8Q4nVBam,En Uruguay. Hallan a la argentina que desapareció cuando iba a denunciar a su ex,https://www.clarin.com/sociedad/hallaron-argentina-desaparecido-uruguay-iba-denunciar-ex-pareja_0_g8Q4nVBam.html,https://images.clarin.com/2021/06/12/QAUjfMEyx_720x0__1.jpg
7,19-eX440K,Guía de ahorro: diez claves para bajar gastos de la casa y el auto,https://www.clarin.com/servicios/guia-ahorro-claves-bajar-gastos-casa-auto-pelearle-inflacion_0_19-eX440K.html,https://images.clarin.com/2021/05/31/7WP8wMbXk_720x0__1.jpg
8,1SvkTxMt4,"Desgarrador testimonio. ""Laburé toda mi vida y mirá lo que tengo"": duro relato de un hombre que pedía comida",https://www.clarin.com/sociedad/-labure-toda-vida-mira-desgarrador-testimonio-hombre-pedia-comida-plaza-moron_0_1SvkTxMt4.html,https://images.clarin.com/2021/06/18/nR6zaH3IN_720x0__1.jpg
9,sB70TqvacF,En pandemia. Emigrar a España: cuáles son las 5 profesiones que más piden y cuánto pagan,https://www.clarin.com/servicios/emigrar-espana-5-profesiones-piden-pagan_0_sB70TqvacF.html,https://images.clarin.com/2021/06/17/LOwQUaie4_720x0__1.jpg
10,IYzL2TmRC,"Érica Farías, por la gloria. Inédito: es argentina y peleará en Las Vegas por el título mundial",https://www.clarin.com/deportes/primera-vez-boxeadora-argentina-peleara-vegas-titulo-mundial-erica-farias-gloria-mikaela-mayer_0_IYzL2TmRC.html,https://images.clarin.com/2021/06/18/7BsDQgtjO_1256x620__2.jpg#1624037146887
11,kpdi_AqWf,Oportunidad. Liquidan Smart TV con rebajas de hasta 40% y 18 cuotas sin interés,https://www.clarin.com/servicios/oportunidad-liquidan-smart-tv-rebajas-40-18-cuotas-interes_0_kpdi_AqWf.html,https://images.clarin.com/2021/03/09/VhK7BtYEJ_720x0__1.jpg
12,HLq8z5RaI,Perfil. Este es el primer ministro de Israel que no conocés,https://www.clarin.com/new-york-times-international-weekly/primer-ministro-israel-conoces_0_HLq8z5RaI.html,https://images.clarin.com/2021/06/17/TmNciCSfs_1256x620__2.jpg#1623940189201
13,Kr09OMuKL,"Crisis económica y pandemia. Otro día de protestas: el Gobierno aumenta la ayuda social, pero no logra contener la protesta",https://www.clarin.com/politica/movilizacion-piqueteros-regreso-ife-alimentos-gobierno-aumenta-ayuda-social-logra-contener-protesta_0_Kr09OMuKL.html,https://images.clarin.com/2021/06/18/EonWLt1fL_720x0__1.jpg
14,bth92bHF6,"Cobertura, minuto a minuto. Argentina se quedó sin piernas, pero maneja la pelota ante Uruguay",https://www.clarin.com/deportes/argentina-vs-uruguay-copa-america-2021-minuto-minuto-directo_0_bth92bHF6.html,https://images.clarin.com/2021/06/18/GrGRn4cdS_720x0__1.jpg
15,aayhZWBYK,Del editor. El dictador que el Gobierno se niega a ver,https://www.clarin.com/opinion/dictador-gobierno-niega-ver_0_aayhZWBYK.html,https://images.clarin.com/2021/06/18/VdbAy_4sn_720x0__1.jpg
16,WRcdWbyjo,"Tras las críticas. Macri pidió ""perdón"" tras referirse al Covid como una gripe ""un poco más grave""",https://www.clarin.com/politica/mauricio-macri-pidio-perdon-referirse-coronavirus-gripe-grave-_0_WRcdWbyjo.html,https://images.clarin.com/2021/06/18/wYJAUR4ZQi_720x0__1.jpg
17,m2gxHBXwf,En Santiago. Encontraron a una joven asesinada en un hotel alojamiento: un menor detenido,https://www.clarin.com/sociedad/femicidio-santiago-estero-encontraron-adolescente-ensangrentada-hotel-alojamiento_0_m2gxHBXwf.html,https://images.clarin.com/2021/06/18/gkXJUJIQ-_720x0__1.jpg
18,g8Q4nVBam,En Uruguay. Hallan a la argentina que desapareció cuando iba a denunciar a su ex,https://www.clarin.com/sociedad/hallaron-argentina-desaparecido-uruguay-iba-denunciar-ex-pareja_0_g8Q4nVBam.html,https://images.clarin.com/2021/06/12/QAUjfMEyx_720x0__1.jpg
19,19-eX440K,Guía de ahorro: diez claves para bajar gastos de la casa y el auto,https://www.clarin.com/servicios/guia-ahorro-claves-bajar-gastos-casa-auto-pelearle-inflacion_0_19-eX440K.html,https://images.clarin.com/2021/05/31/7WP8wMbXk_720x0__1.jpg
20,1SvkTxMt4,"Desgarrador testimonio. ""Laburé toda mi vida y mirá lo que tengo"": duro relato de un hombre que pedía comida",https://www.clarin.com/sociedad/-labure-toda-vida-mira-desgarrador-testimonio-hombre-pedia-comida-plaza-moron_0_1SvkTxMt4.html,https://images.clarin.com/2021/06/18/nR6zaH3IN_720x0__1.jpg
21,3NCh-ZWhx,Copa América. Chile venció a Bolivia con un gol del inglés Brereton y es líder del Grupo A,https://www.clarin.com/deportes/chile-vs-bolivia-copa-america-2021-minuto-minuto-directo_0_3NCh-ZWhx.html,https://images.clarin.com/2021/06/18/pxCaDu2Y3_720x0__1.jpg
22,F8v38oeD4,Eurocopa. Inglaterra no pudo con Escocia y se fue silbada de Wembley,https://www.clarin.com/deportes/inglaterra-vs-escocia-eurocopa-previa-alineaciones-directo_0_F8v38oeD4.html,https://images.clarin.com/2021/06/18/JE-eC6NTW_720x0__1.jpg
23,F1tC3DYj1,"Se sigue armando. Boca volvió al trabajo, busca más refuerzos y sueña con el regreso de Nico Gaitán",https://www.clarin.com/deportes/boca-volvio-trabajo-busca-refuerzos-suena-regreso-nico-gaitan_0_F1tC3DYj1.html,https://images.clarin.com/2021/06/18/O4FfNdXfI_1256x620__2.jpg#1624036863279
24,1GGlPN9s1,"Cláusula multimillonaria. Leo Díaz, el arquero que debutó en el Superclásico, firmó su primer contrato",https://www.clarin.com/deportes/leo-diaz-arquero-debuto-superclasico-coronavirus-firmo-primer-contrato-river-puso-clausula-rescision-multimillonaria_0_1GGlPN9s1.html,https://images.clarin.com/2021/05/16/L5B4j63xU_720x0__1.jpg
25,-s82MSL4N," DT de San Lorenzo. Montero y su carta de presentación: ""El fútbol es más simple de lo que se piensa""",https://www.clarin.com/deportes/paolo-montero-carta-presentacion-dt-san-lorenzo-futbol-simple-piensa-_0_-s82MSL4N.html,https://images.clarin.com/2021/06/18/X8Mq_z85h_720x0__1.jpg
26,L5aQZc0A2,"¿Se detendrán?. Por cantos homofóbicos, México podría ser expulsado de Qatar 2022",https://www.clarin.com/deportes/cantos-homofobicos-hinchas-mexico-podria-expulsado-qatar-2022-perder-sede-mundial-2026_0_L5aQZc0A2.html,https://images.clarin.com/2021/06/18/kMA3VV9sX_720x0__1.jpg
27,Xg5hiM7CE,"Dinamarca . Eriksen fue operado del corazón, recibió el alta y pasó por la concentración ",https://www.clarin.com/deportes/christian-eriksen-operado-corazon-recibio-alta-paso-concentracion-dinamarca_0_Xg5hiM7CE.html,https://images.clarin.com/2021/06/18/O6oLSvx-w_1256x620__2.jpg#1624035089020
28,l050dKLw5,Voleibol. Axel Jacobsen: el vikingo argentino que a los 36 triunfa en Dinamarca,https://www.clarin.com/deportes/polideportivo/axel-jacobsen-vikingo-argentino-triunfa-dinamarca_0_l050dKLw5.html,https://images.clarin.com/2021/06/17/YUNDTuTdu_1256x620__2.jpg#1623972089555
29,Kjh4moxHP,"Puja por las candidaturas. Carrió reaviva la interna: ""El radicalismo y mi partido se cansaron del destrato""",https://www.clarin.com/politica/elisa-carrio-reaviva-interna-juntos-cambio-radicalismo-partido-cansados-destrato-_0_Kjh4moxHP.html,https://images.clarin.com/2020/11/14/tI3pBSzQRE_720x0__1.jpg
30,F18hN-yld,"Nueva encuesta. Macri y Scioli últimos, y llamativo empate entre Carrió y Máximo Kirchner",https://www.clarin.com/politica/encuesta-incomoda-estrellas-presidencial-hoy-peor-imagen_0_F18hN-yld.html,https://images.clarin.com/2015/10/25/SylXdekyVl_720x0.jpg
31,CguAyYQNf,"La muerte del Diez. El coordinador de enfermeros dijo que la premisa era ""no invadir"" a Maradona",https://www.clarin.com/policiales/muerte-diego-maradona-coordinador-enfermeros-aseguro-premisa-molestar-invadir-ex-futbolista_0_CguAyYQNf.html,https://images.clarin.com/2021/06/18/cNd4tn_xY_720x0__1.jpg
32,38TtuGCLc,Lanzó su partido. Pichetto quiere ser candidato en Provincia y que Macri compita en Ciudad,https://www.clarin.com/politica/miguel-pichetto-presento-partido-quiere-candidato-provincia-mauricio-macri-compita-ciudad_0_38TtuGCLc.html,https://images.clarin.com/2021/06/18/6dfX7H79K_720x0__1.jpg
33,jpGVtCsXP,"Al igual que Cristina. El Presidente puso la mira en el sistema de salud: ""Hay que optimizarlo""",https://www.clarin.com/politica/reclamo-cristina-kirchner-alberto-fernandez-dijo-optimizar-funcionamiento-sistema-salud_0_jpGVtCsXP.html,https://images.clarin.com/2021/06/18/77t4hWKYA_720x0__1.jpg
34,gVNxMM6IE,Mediación trunca. Alberto Fernández demandará a Patricia Bullrich por difamaciones,https://www.clarin.com/politica/acuerdo-mediacion-alberto-fernandez-demandara-patricia-bullrich-difamaciones_0_gVNxMM6IE.html,https://images.clarin.com/2021/03/03/mTXp81F7__720x0__1.jpg
35,IrzdWVbf5,Buscan a Guadalupe. Operativos en tres sitios y la apuesta a un dato a cambio de recompensa,https://www.clarin.com/sociedad/guadalupe-aparece-nuevos-operativos-sitios-diferentes-apuesta-dato-mano-recompensa_0_IrzdWVbf5.html,https://images.clarin.com/2021/06/18/qzTQqeQxQ_720x0__1.jpg
36,qprEZD0BY,Gestión de residuos. El acuerdo que busca convertir a Iguazú en una ciudad más sustentable,https://www.clarin.com/brandstudio/puerto-iguazu-renovada-planta-reciclaje-funcionamiento_0_qprEZD0BY.html,https://images.clarin.com/2021/06/06/-nqc4B8po_720x0__1.jpg
37,mG1_hSzOR,Día del Padre. En el nombre del padre: esa tradición que se mantiene a través de las generaciones,https://www.clarin.com/familias/nombre-padre-tradicion-mantiene-traves-generaciones_0_mG1_hSzOR.html,https://images.clarin.com/2021/06/04/fBqrhXb4V_720x0__1.jpg
38,T0cCsNB18,"Precio y detalles. Apple lanza los Beats Studio Buds, la alternativa barata a los AirPods",https://www.clarin.com/tecnologia/apple-lanza-beats-studio-buds-alternativa-barata-airpods_0_T0cCsNB18.html,https://images.clarin.com/2021/06/17/kzA9hMo1A_720x0__1.jpg
39,cLvNwBkSW,Arte visual. ¿Qué hace una vela consumiéndose en 9 de Julio?,https://www.clarin.com/cultura/arte-visual-hace-vela-consumiendose-9-julio-_0_cLvNwBkSW.html,https://images.clarin.com/2021/06/17/We4jNKbPy_720x0__1.jpg
40,g9T4_4hdg,"Patrocinado. ATRIUM, una innovadora experiencia que te da la bienvenida a tu nueva vida",https://www.clarin.com/mercado-inmobiliario/atrium-innovadora-experiencia-da-bienvenida-nueva-vida_0_g9T4_4hdg.html,https://images.clarin.com/2021/06/15/IY-bQLxr6_720x0__1.jpg
41,zoCUsCwE6,Turismo. Seis de cada diez argentinos quieren viajar en 2021: cuáles son las tendencias,https://www.clarin.com/viajes/argentinos-quieren-viajar-2021-tendencias_0_zoCUsCwE6.html,https://images.clarin.com/2019/02/08/EbB0HP8SC_720x0__1.jpg
42,fx6wSy4QT,En la Ciudad. Con un solo síntoma de Covid los chicos deben testearse: cuándo hacerlo,https://www.clarin.com/buena-vida/solo-sintoma-covid-chicos-deben-testearse-hacerlo_0_fx6wSy4QT.html,https://images.clarin.com/2021/06/17/GD0YtXXdt_720x0__1.jpg
43,r5kPqV8_4,"KWS, 15 años brindando soluciones. Genética de elite adaptada localmente",https://www.clarin.com/rural/genetica-elite-adaptada-localmente_0_r5kPqV8_4.html,https://images.clarin.com/2021/06/18/NyZgSbfpv_720x0__1.jpg
44,rk0rpxYVI,Obsequio todoterreno. Día del Padre: el regalo perfecto para un papá todo terreno,https://www.clarin.com/brandstudio/dia-padre-regalo-perfecto-papa-terreno_0_rk0rpxYVI.html,https://images.clarin.com/2021/06/08/cNrNw3xtp_720x0__1.jpg
45,zarfPIKxG,"""The Wall"". El muro gigante que protege a una ciudad del frío extremo",https://www.clarin.com/viste/muro-proteger-ciudad-entera-viento-helado_0_zarfPIKxG.html,https://images.clarin.com/2021/06/18/f2NsqStFr_720x0__1.jpg
46,Iq2wnMYga,"Historia. La venganza de dos mujeres por una infidelidad: ""Se quedó sin palabras por primera vez""",https://www.clarin.com/viste/elaborada-venganza-mujeres-infidelidad-quedo-palabras-primera-vez-_0_Iq2wnMYga.html,https://images.clarin.com/2021/06/17/09LjeuvXl_720x0__1.jpg
47,D6tBS1PIX,Video viral. Aterrizó su avión en pleno bosque con una araña gigante en el techo de la cabina,https://www.clarin.com/internacional/video-aterrizo-avion-pleno-bosque-arana-gigante-acechandolo-techo-cabina_0_D6tBS1PIX.html,https://images.clarin.com/2021/06/18/RbnvTwDiQ_720x0__1.jpg
48,j5wcjB0bO,¿Qué pasó?. Lloraron la muerte de su gato y lo cremaron: tras un mes apareció vivo en su casa,https://www.clarin.com/viste/lloraron-muerte-gato-cremaron-mes-siguiente-aparecio-vivo-casa_0_j5wcjB0bO.html,https://images.clarin.com/2021/06/18/RJZeFmh0f_720x0__1.jpg
49,XBTrE4e3c,Zonas azules. Los 5 lugares del mundo donde se vive más de 100 años,https://www.clarin.com/internacional/5-lugares-mundo-vive-100-anos_0_XBTrE4e3c.html,https://images.clarin.com/2021/06/17/uk8UNUaM7_720x0__1.jpg
50,h-jUp3_Mk,Con un dron. Video: un fotógrafo filmó dos OVNIS cruzando a gran velocidad por el cielo,https://www.clarin.com/viste/fotografo-filmo-ovnis-cruzando-gran-velocidad-cielo_0_h-jUp3_Mk.html,https://images.clarin.com/2021/06/17/lNHm4p38J_720x0__1.jpg
51,GpK1H3ovA,Nuevo desarrollo. Comodidad y personalidad en Belgrano,https://www.clarin.com/mercado-inmobiliario/comodidad--mucha-personalidad-nuevo-desarrollo-belgrano_0_GpK1H3ovA.html,https://images.clarin.com/2021/05/05/aJ-JXIyXs_720x0__1.jpg
52,3Eb4Y1C56,En el corazón del barrio. Alma Palermo: una oportunidad ideal de inversión,https://www.clarin.com/mercado-inmobiliario/alma-palermo-oportunidad-ideal-inversion_0_3Eb4Y1C56.html,https://images.clarin.com/2021/04/19/bxKckY2pj_720x0__1.jpg
53,rZFjRfSv1,Semipisos a estrenar. Gran oportunidad de inversión y vivienda en Villa Crespo,https://www.clarin.com/mercado-inmobiliario/gran-oportunidad-inversion-vivienda-corazon-villa-crespo_0_rZFjRfSv1.html,https://images.clarin.com/2021/05/05/MBENUc8tQ_720x0__1.jpg
54,ZFeUYcNSG,Klover Plaza. Amenities de hotelería con calidez de hogar,https://www.clarin.com/mercado-inmobiliario/klover-plaza-amenities-hoteleria-calidez-hogar_0_ZFeUYcNSG.html,https://images.clarin.com/2021/05/11/G9pKhqgks_720x0__1.jpg
55,ggbQsuiZE,"Edificio Cuvee. Buscá lo que necesitás y encontrá lo que soñás, con gran financiación",https://www.clarin.com/mercado-inmobiliario/edificio-cuvee-busca-necesitas-encontra-sonas--amplia-financiacion-pesos_0_ggbQsuiZE.html,https://images.clarin.com/2021/05/27/9ria-qepd_720x0__1.jpg
56,d9Bq93x1K,Pasó por Chacarita. Murió el ex jugador Robert Lima y horas después falleció la madre de sus hijos,https://www.clarin.com/deportes/dolor-dolor-uruguay-murio-ex-penarol-robert-lima-horas-despues-fallecio-madre-hijos_0_d9Bq93x1K.html,https://images.clarin.com/2021/06/18/usY1C-4Dg_720x0__1.jpg
57,7XvNuL8da,La vacuna rusa. ¿Conflicto político o científico? Por qué Europa no aprueba la Sputnik,https://www.clarin.com/mundo/europa-aprueba-vacuna-sputnik-coronavirus-conflicto-politico-cientifico-_0_7XvNuL8da.html,https://images.clarin.com/2021/06/18/9U5U-82bS_720x0__1.jpg
58,tXSYBTNgn,En el país. Richmond terminó de producir las primeras 400 mil dosis de Sputnik V,https://www.clarin.com/sociedad/laboratorio-richmond-anuncio-termino-producir-primeras-400-mil-dosis-sputnik-v_0_tXSYBTNgn.html,https://images.clarin.com/2021/06/18/oalBldxuo_720x0__1.jpg
59,qK__DAfOW,Coronavirus. Informan otras 465 muertes y Argentina ya superó los 88 mil fallecidos,https://www.clarin.com/sociedad/coronavirus-informan-465-muertes-argentina-supero-88-mil-fallecidos_0_qK__DAfOW.html,https://images.clarin.com/2021/05/30/0c01pFMqJ_720x0__1.jpg
60,bUgaQSxdF,Camioneros. Paritarias: Moyano cerró en 45% y mete más presión sobre otras negociaciones,https://www.clarin.com/politica/paritaria-moyano-cerro-45-mete-presion-precios-negociaciones_0_bUgaQSxdF.html,https://images.clarin.com/2021/06/15/0fj9sa9vu_720x0__1.jpg
61,2zab6VRTu,Rumbo a las PASO. El Gobierno arrancó la campaña y hubo un ultimátum de Alberto F. a los ministros,https://www.clarin.com/politica/gobierno-arranco-campana-alberto-dio-ultimatum-ministros-salgan-defender-gestion_0_2zab6VRTu.html,https://images.clarin.com/2020/07/24/-Ko-_L-h-_720x0__1.jpg
62,i6YvKlIRg," Copa América. La guerra de Chile y Nike: denuncias cruzadas, millones y la pipa que ya no se ve",https://www.clarin.com/deportes/chile-declaro-guerra-nike-copa-america-denuncias-cruzadas-millones-juego-famosa-pipa-ve_0_i6YvKlIRg.html,https://images.clarin.com/2021/06/18/wO3PokjWo_1256x620__2.jpg#1624051555965
63,xYukQpKOP,WhatsApp. Trucos para leer mensajes sin que tus contactos vean que estás en línea,https://www.clarin.com/tecnologia/trucos-leer-mensajes-whatsapp-contactos-vean-linea_0_xYukQpKOP.html,https://images.clarin.com/2017/04/07/BkRctUBpx_720x0.jpg
64,pkINhxTev,La historia del PCCh. Cien años del poderoso partido comunista chino que nació en un barquito de turistas,https://www.clarin.com/mundo/cien-anos-poderoso-pcch-partido-comunista-china-nacio-barquito-turistas_0_pkINhxTev.html,https://images.clarin.com/2021/06/18/v_5WACmLX_1256x620__2.jpg#1624030119170
65,WFObNIUzZ,Alekhine. El genio del ajedrez que destronó a Capablanca y su misteriosa muerte,https://www.clarin.com/deportes/alekhine--genio-ajedrez-destrono-capablanca-buenos-aires-misteriosa-muerte-coquetear-nazis_0_WFObNIUzZ.html,https://images.clarin.com/2021/06/17/muQRB7jGZ_720x0__1.jpg
66,7Y33M6ppi,Cumple 79 años. Paul McCartney: cuál es su fórmula para no dejarse atrapar por el paso del tiempo,https://www.clarin.com/espectaculos/musica/paul-mccartney-cumple-79-anos-formula-dejarse-atrapar-paso-tiempo_0_7Y33M6ppi.html,https://images.clarin.com/2021/06/17/YYPi8tKCv_720x0__1.jpg
67,VgS-q_VVJ,"Sexo y parejas. Cuando la diferencia de edad no importa: qué es el ""cubbing""",https://www.clarin.com/buena-vida/diferencia-edad-importa-cubbing-_0_VgS-q_VVJ.html,https://images.clarin.com/2021/06/17/Ogw7c9mZ7_720x0__1.jpg
68,1Rz5WQsxv,"Salud. Una entidad médica y la cosmética vaginal: ""No hay una vulva perfecta""",https://www.clarin.com/sociedad/-vulva-perfecta-entidad-medica-cuestiona-cosmetica-vaginal_0_1Rz5WQsxv.html,https://images.clarin.com/2021/03/20/d5HFdtxKq_720x0__1.jpg
69,0ZyBL3IYe,Entrevista. Danilo Gerlo: el día que se fue a vivir con el aguatero para volver al llano,https://www.clarin.com/deportes/danilo-gerlo-dia-vivir-aguatero-volver-llano-rol-river-estrellas-juega-futbol-amigos_0_0ZyBL3IYe.html,https://images.clarin.com/2021/06/18/WcbkA6dWx_1256x620__2.jpg#1624020120637
70,URICIGGjw,Françoise Hardy. La mítica cantante que ayudó a morir a su madre ahora reclama su propia eutanasia,https://www.clarin.com/internacional/espectaculos/fran-oise-hardy-mitica-cantante-ayudo-morir-madre-ahora-reclama-propia-eutanasia_0_URICIGGjw.html,https://images.clarin.com/2021/06/18/n2D-uvcM-_720x0__1.jpg
71,alij3SKvu,Día internacional . Ingredientes y calorías: ¿el sushi es realmente saludable? ,https://www.clarin.com/buena-vida/-sushi-realmente-saludable-_0_alij3SKvu.html,https://images.clarin.com/2021/06/18/Qh0Lx03d1_720x0__1.jpg
72,-gRluyGIh,Patrocinado. Lali Espósito reveló sus tips inéditos de belleza: ¿De qué se tratan?,https://www.clarin.com/brandstudio/lali-esposito-revelo-tips-ineditos-belleza-tratan-_0_-gRluyGIh.html,https://images.clarin.com/2021/06/16/I-aWVSHwi_720x0__1.jpg
73,pkINhxTev,La historia del PCCh. Cien años del poderoso partido comunista chino que nació en un barquito de turistas,https://www.clarin.com/mundo/cien-anos-poderoso-pcch-partido-comunista-china-nacio-barquito-turistas_0_pkINhxTev.html,https://images.clarin.com/2021/06/18/v_5WACmLX_1256x620__2.jpg#1624030119170
74,WFObNIUzZ,Alekhine. El genio del ajedrez que destronó a Capablanca y su misteriosa muerte,https://www.clarin.com/deportes/alekhine--genio-ajedrez-destrono-capablanca-buenos-aires-misteriosa-muerte-coquetear-nazis_0_WFObNIUzZ.html,https://images.clarin.com/2021/06/17/muQRB7jGZ_720x0__1.jpg
75,7Y33M6ppi,Cumple 79 años. Paul McCartney: cuál es su fórmula para no dejarse atrapar por el paso del tiempo,https://www.clarin.com/espectaculos/musica/paul-mccartney-cumple-79-anos-formula-dejarse-atrapar-paso-tiempo_0_7Y33M6ppi.html,https://images.clarin.com/2021/06/17/YYPi8tKCv_720x0__1.jpg
76,VgS-q_VVJ,"Sexo y parejas. Cuando la diferencia de edad no importa: qué es el ""cubbing""",https://www.clarin.com/buena-vida/diferencia-edad-importa-cubbing-_0_VgS-q_VVJ.html,https://images.clarin.com/2021/06/17/Ogw7c9mZ7_720x0__1.jpg
77,1Rz5WQsxv,"Salud. Una entidad médica y la cosmética vaginal: ""No hay una vulva perfecta""",https://www.clarin.com/sociedad/-vulva-perfecta-entidad-medica-cuestiona-cosmetica-vaginal_0_1Rz5WQsxv.html,https://images.clarin.com/2021/03/20/d5HFdtxKq_720x0__1.jpg
78,0ZyBL3IYe,Entrevista. Danilo Gerlo: el día que se fue a vivir con el aguatero para volver al llano,https://www.clarin.com/deportes/danilo-gerlo-dia-vivir-aguatero-volver-llano-rol-river-estrellas-juega-futbol-amigos_0_0ZyBL3IYe.html,https://images.clarin.com/2021/06/18/WcbkA6dWx_1256x620__2.jpg#1624020120637
79,URICIGGjw,Françoise Hardy. La mítica cantante que ayudó a morir a su madre ahora reclama su propia eutanasia,https://www.clarin.com/internacional/espectaculos/fran-oise-hardy-mitica-cantante-ayudo-morir-madre-ahora-reclama-propia-eutanasia_0_URICIGGjw.html,https://images.clarin.com/2021/06/18/n2D-uvcM-_720x0__1.jpg
80,alij3SKvu,Día internacional . Ingredientes y calorías: ¿el sushi es realmente saludable? ,https://www.clarin.com/buena-vida/-sushi-realmente-saludable-_0_alij3SKvu.html,https://images.clarin.com/2021/06/18/Qh0Lx03d1_720x0__1.jpg
81,-gRluyGIh,Patrocinado. Lali Espósito reveló sus tips inéditos de belleza: ¿De qué se tratan?,https://www.clarin.com/brandstudio/lali-esposito-revelo-tips-ineditos-belleza-tratan-_0_-gRluyGIh.html,https://images.clarin.com/2021/06/16/I-aWVSHwi_720x0__1.jpg
