n,id,title,url,image
1,PBWDQBKVM,"La derrota electoral del Gobierno. Juntos por el Cambio dice que no lo convocaron al diálogo y criticó el mensaje de Alberto F.: “Están sordos""",https://www.clarin.com/politica/elecciones-2021-minuto-minuto-reacciones-dia-despues-derrota-gobierno-pais_0_PBWDQBKVM.html,https://images.clarin.com/2021/11/15/xTZLcMtx9_720x0__1.jpg
2,hbd6avEjr,"Tras las elecciones. El Gobierno, sindicalistas y La Cámpora se reúnen para definir el acto del miércoles",https://www.clarin.com/politica/reunion-cumbre-gobierno-sindicalistas-campora-definir-marcha-miercoles_0_hbd6avEjr.html,https://images.clarin.com/2021/11/15/q_CKuE8mx_720x0__1.jpg
3,mlrSzTNe-,Legislativas 2021. La encuesta que le advirtió a Santilli que podía perder la elección en Provincia,https://www.clarin.com/politica/encuesta-advirtio-diego-santilli-sabado-podia-perder-eleccion-provincia_0_mlrSzTNe-.html,https://images.clarin.com/2021/11/15/oTyILJbva_720x0__1.jpg
4,nFCSjcOAt,Del editor. Alguien debe avisarle a Alberto Fernández que perdió,https://www.clarin.com/opinion/alguien-debe-avisarle-alberto-fernandez-perdio_0_nFCSjcOAt.html,https://images.clarin.com/2021/11/15/kDJ7uQ2Cg_720x0__1.jpg
5,QyhMqxnsK,Femicidio en el sur del GBA. Video: la última imagen de Brisa y su asesino en un baile en Berazategui,https://www.clarin.com/policiales/video-ultima-imagen-brisa-asesino-baile-berazategui_0_QyhMqxnsK.html,https://images.clarin.com/2021/11/15/EXOkoWvlw_720x0__1.jpg
6,RmWXB9XUO,Elecciones 2021. Mirá el mapa con todos los resultados distrito por distrito,https://www.clarin.com/politica/resultados-elecciones-2021-mapa-vivo-ganaron-distrito-distrito_0_RmWXB9XUO.html,https://images.clarin.com/2021/11/05/JweW7P6k2_720x0__1.jpg
7,JIG2F-meB,Las claves en Provincia. El oficialismo se quedó con los votos nuevos y Espert y Hotton frenaron a Santilli,https://www.clarin.com/politica/victoria-tolosa-paz-quedo-votos-nuevos-jose-luis-espert-cynthia-hotton-frenaron-diego-santilli_0_JIG2F-meB.html,https://images.clarin.com/2021/11/15/521Le7UpE_720x0__1.jpg
8,o_BxoHYtP,"Nace ""Soberanxs"". Tras la derrota, Boudou lanza su espacio político junto a otros dirigentes ultra K",https://www.clarin.com/politica/dia-despues-derrota-electoral-amado-boudou-alicia-castro-gabriel-mariotto-lanzan-espacio-politico_0_o_BxoHYtP.html,https://images.clarin.com/2021/10/17/uX2FbTvUw_720x0__1.jpg
9,2mnaBaGPF,"Tras las elecciones. El análisis de Durán Barba sobre la derrota del Gobierno y lo que vio ""por primera vez""",https://www.clarin.com/politica/analisis-jaime-duran-barba-derrota-gobierno-primera-vez-alguien-celebra-triunfo-perdio-_0_2mnaBaGPF.html,https://images.clarin.com/2016/05/26/SJgENDzJ4x_720x0.jpg
10,UsIl8Ytk6,Eliminatorias. Neymar se lesionó y no viaja con Brasil para jugar contra la Selección en San Juan,https://www.clarin.com/deportes/neymar-lesiono-viaja-brasil-jugar-argentina-san-juan_0_UsIl8Ytk6.html,https://images.clarin.com/2021/11/15/bBZ6MtGs1_720x0__1.jpg
11,NA8zCFZCE,"Tras la elección en Provincia. La pelea por el diputado 35: era de Juntos, es de Espert pero podría ser de Randazzo",https://www.clarin.com/politica/pelea-diputado-35-provincia-juntos-ahora-espert-podria-quedarselo-randazzo_0_NA8zCFZCE.html,https://images.clarin.com/2021/11/15/X8I3KSgDk_720x0__1.jpg
12,EmN8PDgzx,"Conmoción en el Luna Park. Tras el incidente con el custodio, Milei defendió la tenencia de armas",https://www.clarin.com/politica/elecciones-2021-incidente-custodio-javier-milei-defendio-tenencia-armas-manos-ciudadanos_0_EmN8PDgzx.html,https://images.clarin.com/2021/11/15/p0SqTncHS_1256x620__2.jpg#1636974741065
13,C7Lc-tcD4,"Mercados. El dólar blue cede a $199,5 tras la derrota del Gobierno en las elecciones",https://www.clarin.com/economia/dolar-blue-mantiene-200-derrota-gobierno-elecciones_0_C7Lc-tcD4.html,https://images.clarin.com/2021/10/22/pN5hRqgGb_720x0__1.jpg
14,MBLMiB1De,Conmoción en Pinamar. Tragedia en un ascensor: confirman que la víctima bajó sola a abrirle a unos amigos,https://www.clarin.com/policiales/tragedia-sola-muerte-alicia-sanchez-caer-hueco-ascensor-pinamar_0_MBLMiB1De.html,https://images.clarin.com/2021/11/15/ds-bArJMx_1256x620__2.jpg#1636988071371
15,rBAZ5Or6l,Desde el 1° de diciembre. Chile reabre sus fronteras terrestres: qué pasos se habilitan y qué requisitos hay,https://www.clarin.com/mundo/chile-reabre-fronteras-terrestres-1-diciembre-pasos-habilitan-requisitos-ingresar_0_rBAZ5Or6l.html,https://images.clarin.com/2021/09/21/DrCEYVPgp_720x0__1.jpg
16,I-I8z1deW,Décadas sin castigo. Buscó durante 26 años al asesino de su hija y lo encontró en otro país,https://www.clarin.com/internacional/busco-26-anos-asesino-hija-encontro_0_I-I8z1deW.html,https://images.clarin.com/2021/11/15/_kBN24uOd_720x0__1.jpg
17,P1W5_I0J1,"Entrevista. Tom Hanks y Finch, su nueva y solitaria película: ""No tenía con quién hablar""",https://www.clarin.com/espectaculos/cine/tom-hanks-finch-nueva-solitaria-pelicula-hablar-_0_P1W5_I0J1.html,https://images.clarin.com/2021/11/15/5xutfYQwo_720x0__1.jpg
18,MX4sV0nUN,Furor y locura en San Juan. Conseguir entradas para el Argentina-Brasil con Messi y compañía fue una odisea,https://www.clarin.com/deportes/furor-locura-san-juan-scaloneta-conseguir-entradas-argentina-brasil-messi-compania-odisea_0_MX4sV0nUN.html,https://images.clarin.com/2021/11/15/tijs8q8pc_720x0__1.jpg
19,-D2rAS9wu,"""Bien de familia"". Qué día se podrá hacer gratis el trámite para proteger la vivienda",https://www.clarin.com/servicios/-bien-familia-consultar-gratis-escribano-proteger-vivienda_0_-D2rAS9wu.html,https://images.clarin.com/2021/11/12/mMTXp6kvD_720x0__1.jpg
20,bbmt4Khg9,"Cable y TV abierta. TN y El Trece, ganadores en el rating por la cobertura de las elecciones",https://www.clarin.com/espectaculos/tv/tn-trece-ganadores-rating-cobertura-elecciones_0_bbmt4Khg9.html,https://images.clarin.com/2021/11/07/4J6nziRzR_720x0__1.jpg
21,e8XxSfsQu,"Uno de los ""curas sanadores"". La Iglesia iniciará el proceso para declarar santo al padre Mario",https://www.clarin.com/sociedad/iglesia-iniciara-proceso-declarar-santo-padre-mario_0_e8XxSfsQu.html,https://images.clarin.com/2018/10/08/wFOTQUXeg_1256x620__2.jpg#1637004479171
22,Xl3UzE_zT,"Pandemia. El Covid vuelve a crecer con un nuevo tipo de paciente: buscan ""salvar la Navidad""",https://www.clarin.com/mundo/covid-vuelve-crecer-italia-nuevo-tipo-paciente-pais-moviliza-salvar-navidad-_0_Xl3UzE_zT.html,https://images.clarin.com/2021/10/11/oSqUrHswt_1256x620__2.jpg#1636993796539
23,tjy3jz0TC,Cómo será. Empieza la obra del nuevo centro comercial donde estaba el BA Design,https://www.clarin.com/ciudades/empieza-obra-nuevo-centro-comercial-buenos-aires-design_0_tjy3jz0TC.html,https://images.clarin.com/2021/11/15/RZx60WZKC_1256x620__2.jpg#1637007654671
24,PBWDQBKVM,"La derrota electoral del Gobierno. Juntos por el Cambio dice que no lo convocaron al diálogo y criticó el mensaje de Alberto F.: “Están sordos""",https://www.clarin.com/politica/elecciones-2021-minuto-minuto-reacciones-dia-despues-derrota-gobierno-pais_0_PBWDQBKVM.html,https://images.clarin.com/2021/11/15/xTZLcMtx9_720x0__1.jpg
25,hbd6avEjr,"Tras las elecciones. El Gobierno, sindicalistas y La Cámpora se reúnen para definir el acto del miércoles",https://www.clarin.com/politica/reunion-cumbre-gobierno-sindicalistas-campora-definir-marcha-miercoles_0_hbd6avEjr.html,https://images.clarin.com/2021/11/15/q_CKuE8mx_720x0__1.jpg
26,mlrSzTNe-,Legislativas 2021. La encuesta que le advirtió a Santilli que podía perder la elección en Provincia,https://www.clarin.com/politica/encuesta-advirtio-diego-santilli-sabado-podia-perder-eleccion-provincia_0_mlrSzTNe-.html,https://images.clarin.com/2021/11/15/oTyILJbva_720x0__1.jpg
27,nFCSjcOAt,Del editor. Alguien debe avisarle a Alberto Fernández que perdió,https://www.clarin.com/opinion/alguien-debe-avisarle-alberto-fernandez-perdio_0_nFCSjcOAt.html,https://images.clarin.com/2021/11/15/kDJ7uQ2Cg_720x0__1.jpg
28,QyhMqxnsK,Femicidio en el sur del GBA. Video: la última imagen de Brisa y su asesino en un baile en Berazategui,https://www.clarin.com/policiales/video-ultima-imagen-brisa-asesino-baile-berazategui_0_QyhMqxnsK.html,https://images.clarin.com/2021/11/15/EXOkoWvlw_720x0__1.jpg
29,RmWXB9XUO,Elecciones 2021. Mirá el mapa con todos los resultados distrito por distrito,https://www.clarin.com/politica/resultados-elecciones-2021-mapa-vivo-ganaron-distrito-distrito_0_RmWXB9XUO.html,https://images.clarin.com/2021/11/05/JweW7P6k2_720x0__1.jpg
30,JIG2F-meB,Las claves en Provincia. El oficialismo se quedó con los votos nuevos y Espert y Hotton frenaron a Santilli,https://www.clarin.com/politica/victoria-tolosa-paz-quedo-votos-nuevos-jose-luis-espert-cynthia-hotton-frenaron-diego-santilli_0_JIG2F-meB.html,https://images.clarin.com/2021/11/15/521Le7UpE_720x0__1.jpg
31,fPcbHbR08,Escandalosa versión. Qué le habría contestado la China Suárez a Wanda Nara cuando le preguntó para qué fue a París,https://www.clarin.com/fama/contestado-china-suarez-wanda-nara-pregunto-paris_0_fPcbHbR08.html,https://images.clarin.com/2021/11/05/HbC8bigeG_720x0__1.jpg
32,t2oTcrDW6,"""Ella está destruida"". Se conocieron nuevos y polémicos detalles de la separación de Dulko y Gago",https://www.clarin.com/fama/conocieron-nuevos-polemicos-detalles-escandalosa-separacion-gisela-dulko-fernando-gago_0_t2oTcrDW6.html,https://images.clarin.com/2021/11/10/wCGivWu_k_720x0__1.jpg
33,6UPNy0f0m,Nuevamente enamorado. Andrés Nara presentó a su nueva novia: se llama Debby Giménez y tiene 28 años menos que él,https://www.clarin.com/fama/andres-nara-presento-nueva-novia-llama-debby-gimenez-28-anos_0_6UPNy0f0m.html,https://images.clarin.com/2021/11/15/zwgg09e7Z_720x0__1.jpg
34,lorSQIDQ4,Polémico tuit. Jorge Rial reavivó una histórica pelea y publicó un picante mensaje contra Mónica Gutiérrez,https://www.clarin.com/fama/jorge-rial-reavivo-historica-pelea-publico-picante-mensaje-monica-gutierrez_0_lorSQIDQ4.html,https://images.clarin.com/2021/11/15/b71zsws1m_720x0__1.jpg
35,EiCe2Ai3I,Escenario. Por qué los crímenes de la inseguridad no movieron la aguja en las urnas,https://www.clarin.com/opinion/crimenes-inseguridad-movieron-aguja-urnas_0_EiCe2Ai3I.html,https://images.clarin.com/2021/11/12/qu2ibP7DL_720x0__1.jpg
36,9JQheSI_l,Para evitar cortes. Cambio de titularidad del servicio de luz: 5 preguntas que nos hacemos todos,https://www.clarin.com/servicios/cambio-titularidad-edesur-edenor-5-preguntas-hacemos_0_9JQheSI_l.html,https://images.clarin.com/2016/02/18/Hkgc-PyJ4e_720x0.jpg
37,jtYE4TDwV,Diabetes. El oscuro pronóstico sobre una enfermedad que afecta a gente cada vez más joven,https://www.clarin.com/sociedad/oscuro-pronostico-enfermedad-afecta-gente-vez-joven_0_jtYE4TDwV.html,https://images.clarin.com/2021/11/11/PYFmYducb_720x0__1.jpg
38,R-hM_zHc2,Finanzas personales. Cómo ahorrar: los 5 métodos que se ajustan a los distintos bolsillos,https://www.clarin.com/servicios/ahorrar-5-metodos-ajustan-distintos-bolsillos_0_R-hM_zHc2.html,https://images.clarin.com/2021/02/10/BHMff5txk_720x0__1.jpg
39,v0v0De_LX,"Dispositivos. El audio del cine, en casa: las mejores barras de sonido para TV",https://www.clarin.com/tecnologia/audio-cine-casa-mejores-barras-sonido-tv_0_v0v0De_LX.html,https://images.clarin.com/2021/11/10/-bnyWvznN_720x0__1.jpg
40,QYZ1y_wYH,Literatura y plástica. Misteriosa Buenos Aires: 11 rincones del arte porteño con secretos para explorar,https://www.clarin.com/ciudades/misteriosa-buenos-aires-11-rincones-arte-porteno-secretos-explorar_0_QYZ1y_wYH.html,https://images.clarin.com/2021/11/11/BD1JOPOew_720x0__1.jpg
41,4ymJ2uqkt,Victoria Alonso.  La historia de la argentina que se convirtió en la mujer más poderosa de Hollywood,https://www.clarin.com/espectaculos/cine/victoria-alonso-historia-argentina-mujer-poderosa-hollywood_0_4ymJ2uqkt.html,https://images.clarin.com/2021/11/09/2vfL1S0eT_720x0__1.jpg
42,qzHnl8JmC,La caída de Alperovich. El legislador más rico del país se queda sin fueros y lo acorrala la Justicia,https://www.clarin.com/especiales/caida-alperovich-queda-fueros-acorrala-justicia-denuncias-abuso_0_qzHnl8JmC.html,https://images.clarin.com/2021/10/29/wHW65Lf-7_720x0__1.jpg
43,CVoMMjyVo,¿Qué se perdió?. La historia secreta del incendio en la Rosada antes de hallar muerto a Nisman,https://www.clarin.com/politica/verdadera-historia-incendio-casa-rosada-horas-hallar-muerto-nisman_0_CVoMMjyVo.html,https://images.clarin.com/2021/10/14/EXosCOcyf_720x0__1.jpg
44,MX4sV0nUN,"Furor y locura en San Juan . Conseguir entradas para el Argentina-Brasil con Messi y compañía, una odisea",https://www.clarin.com/deportes/furor-locura-san-juan-scaloneta-conseguir-entradas-argentina-brasil-messi-compania-odisea_0_MX4sV0nUN.html,https://images.clarin.com/2021/11/15/tijs8q8pc_720x0__1.jpg
45,n4kJ-1mSB,Por el acceso a la Copa. Battaglia tiene todo el equipo a disposición y el desafío de armar el mejor once,https://www.clarin.com/deportes/futbol/boca-juniors/battaglia-equipo-disposicion-desafio-armar-mejor-once-cierre-ano_0_n4kJ-1mSB.html,https://images.clarin.com/2021/11/06/zXD52QxvV2_720x0__1.jpg
46,L5JDHmJxH,El sprint final. River se enfoca en la definición y Gallardo espera por el regreso de jugadores importantes,https://www.clarin.com/deportes/river-enfoca-definicion-torneo-marcelo-gallardo-espera-regreso-jugadores-importantes_0_L5JDHmJxH.html,https://images.clarin.com/2021/10/04/jmu0bU-uT_720x0__1.jpg
47,By_afQE-1,Reclamo de su rival. Cúper se equivocó al hacer los cambios y Congo podría quedar fuera del Mundial,https://www.clarin.com/deportes/insolito-hector-cuper-utilizo-ventanas-hacer-cambios-congo-podria-quedar-mundial_0_By_afQE-1.html,https://images.clarin.com/2021/05/13/6B0n7SCjR_720x0__1.jpg
48,vOGIPRTy_,¿Cuándo vuelve?. El futuro de Federer: la frase de su entrenador que siembra dudas,https://www.clarin.com/deportes/ivan-ljubicic-siembra-dudas-futuro-roger-federer-probablemente-perdera-australia-_0_vOGIPRTy_.html,https://images.clarin.com/2018/01/29/BylXjfarf_1256x620__2.jpg#1636975626468
49,GLxrlA1B-,ATP Finals. Djokovic debutó con una cómoda victoria sobre Casper Ruud,https://www.clarin.com/deportes/atp-finals-2021-novak-djokovic-fisuras-debuto-comoda-victoria-casper-ruud_0_GLxrlA1B-.html,https://images.clarin.com/2021/11/15/Wbx7fgWfC_720x0__1.jpg
50,pDGTKESt3,Reclamo colectivo. Jubilados: nuevos fallos declaran la inconstitucionalidad de los aumentos por decreto de 2020,https://www.clarin.com/economia/jubilados-nuevos-fallos-declaran-inconstitucionalidad-aumentos-decreto-2020_0_pDGTKESt3.html,https://images.clarin.com/2021/05/18/a2cTZwCtK_720x0__1.jpg
51,n4dCMK7zD,Elecciones 2021. El voto del campo fue un claro rechazo a las políticas agropecuarias,https://www.clarin.com/rural/voto-campo-claro-rechazo-politicas-agropecuarias_0_n4dCMK7zD.html,https://images.clarin.com/2021/11/15/a_Siq01bV_720x0__1.jpg
52,rVKDqRFba,"Economía de No Ficción. Sarasear al borde del abismo, algo que pasó en el crac del 30",https://www.clarin.com/economia/economia-de-no-ficcion/sarasear-borde-abismo-paso-crac-30_0_rVKDqRFba.html,https://images.clarin.com/2013/10/11/r14hsjdn7e_720x0.jpg
53,WgZFUnCdl,La economía que viene. Los empresarios piden acuerdos para una economía muy débil,https://www.clarin.com/economia/empresarios-piden-acuerdos-economia-debil-mundo-crisis_0_WgZFUnCdl.html,https://images.clarin.com/2021/10/12/BocmPUHT4_720x0__1.jpg
54,-YY8d8O2j,Empresas. Fravega abrió su primera sucursal en Tierra del Fuego,https://www.clarin.com/economia/empresas-y-negocios/fravega-abrio-primera-sucursal-tierra-fuego_0_-YY8d8O2j.html,https://images.clarin.com/2021/11/14/zUmx0lv0X_720x0__1.jpg
55,EtRALpAGr,Verano 2022. Cuánto cuestan las vacaciones en Brasil y cuáles son los destinos favoritos,https://www.clarin.com/viajes/verano-2022-cuestan-vacaciones-brasil-destinos-favoritos-argentinos_0_EtRALpAGr.html,https://images.clarin.com/2021/11/12/0A3otY2B8_720x0__1.jpg
56,2OtWBmXyZ,"HIIT. ¿Afecta el entrenamiento de intervalos intenso al corazón, la mente y la longevidad?",https://www.clarin.com/buena-vida/-afecta-entrenamiento-intervalos-alta-intensidad-corazon-mente-longevidad-_0_2OtWBmXyZ.html,https://images.clarin.com/2017/11/07/HJ1WVDkyz_720x0.jpg
57,_zHhDfNlF,Amor libre. Cómo es la separación en una relación poliamorosa: ¿no hay reglas?,https://www.clarin.com/relaciones/separacion-relacion-poliamorosa-reglas-_0__zHhDfNlF.html,https://images.clarin.com/2021/11/12/NLPqSdMDp_720x0__1.jpg
58,mi05cGjxT,"Enfermedad prevalente. Obesidad: un estudio identificó 4 tipos, que podrían tratarse de manera diferente",https://www.clarin.com/buena-vida/obesidad-estudio-identifico-4-tipos-podrian-tratarse-manera-diferente_0_mi05cGjxT.html,https://images.clarin.com/2021/11/12/JTUIOFGtX_720x0__1.jpg
59,Ki-a51DQC,Predicciones 2022. Qué tránsitos planetarios marcarán el clima astrológico del año,https://www.clarin.com/astrologia/predicciones-2022-transitos-planetarios-marcaran-clima-astrologico-ano_0_Ki-a51DQC.html,https://images.clarin.com/2021/11/12/zMNelYYQ7_720x0__1.jpg
60,idveFgOCe,Recetas. Qué cocinar esta semana: menú día por día del 15 al 21 de noviembre,https://www.clarin.com/gourmet/cocinar-semana-menu-dia-dia-15-21-noviembre_0_idveFgOCe.html,https://images.clarin.com/2020/11/25/rGzF72E8w_720x0__1.jpg
