n,id,title,url,image
1,hAPlcekqp,Es una mujer de 57 años. Confirman el primer caso de la variante Delta del coronavirus en Mendoza,https://www.clarin.com/sociedad/confirman-primer-caso-variante-delta-coronavirus-mendoza_0_hAPlcekqp.html,https://images.clarin.com/2021/06/29/E1fJBOiET_1256x620__2.jpg#1629748295140
2,N21HZmWZF,Asesor del Gobierno. Eduardo López: “Tener 5 millones de vacunas en heladeras es un fracaso”,https://www.clarin.com/politica/fuerte-queja-infectologo-eduardo-lopez-tener-5-millones-vacunas-heladeras-barbaridad-fracaso-sistema-_0_N21HZmWZF.html,https://images.clarin.com/2020/05/19/SuPTftjVi_720x0__1.jpg
3,Wgvo381oQ,Vacunación. AstraZeneca y Sputnik V: crece una mala señal en plena carrera por las segundas dosis,https://www.clarin.com/sociedad/astrazeneca-sputnik-v-crece-mal-sintoma-plena-carrera-segundas-dosis_0_Wgvo381oQ.html,https://images.clarin.com/2021/05/17/kbmZmDxvM_720x0__1.jpg
4,YR_POuRPO,Fiesta en Olivos. Reunión secreta entre el Presidente y el abogado que coordina la defensa de los invitados,https://www.clarin.com/politica/fiesta-olivos-reunion-secreta-presidente-abogado-juan-pablo-fioribello_0_YR_POuRPO.html,https://images.clarin.com/2021/08/23/C7Xeh4ODC_720x0__1.jpg
5,mJbo4OWsd,"Hábito poco rentable. Ahorros: por qué no recomiendan tener todo en dólares y ""bajo el colchón""",https://www.clarin.com/servicios/ahorros-recomiendan-tener-dolares-colchon-_0_mJbo4OWsd.html,https://images.clarin.com/2021/05/18/F4IeReufg_720x0__1.jpg
6,vGEz4JQ40,"Adelanto de Clarín. Encuesta: cuántos puntos bajó Tolosa Paz por el ""Olivosgate"" y quiénes se los repartieron",https://www.clarin.com/politica/nueva-encuesta-puntos-victoria-tolosa-paz-olivosgate-repartieron_0_vGEz4JQ40.html,https://images.clarin.com/2021/08/16/BXrZhEhar_720x0__1.jpg
7,OOOC1DuZy,Flexibilizaciones. Los restaurantes y bares de la Ciudad ya abren hasta la 1 y aceptan hasta el 70% de aforo,https://www.clarin.com/ciudades/restaurantes-bares-ciudad-abren-1-aceptan-70-aforo_0_OOOC1DuZy.html,https://images.clarin.com/2021/01/10/5GkSX6eEY_1256x620__2.jpg#1629743442670
8,CueYz03V3,"Quiénes pueden entrar. Tras un mes, España levanta la cuarentena obligatoria para los argentinos que viajen",https://www.clarin.com/mundo/espana-levanta-cuarentena-dias-argentinos-puedan-viajar_0_CueYz03V3.html,https://images.clarin.com/2021/06/18/hMvnegUPa_1256x620__3.jpg#1629723248871
9,HyaFFMbmo,"En campaña. Alberto Fernández, contra Macri: ""Alguien tomó un crédito por 57 mil millones de dólares y todavía habla""",https://www.clarin.com/politica/alberto-fernandez-mauricio-macri-alguien-argentina-tomo-credito-57-mil-millones-dolares-todavia-habla-_0_HyaFFMbmo.html,https://images.clarin.com/2021/08/23/QA8jHql2N_720x0__1.jpg
10,toWj6Xq9a,Para las Eliminatorias. Scaloni dio la lista: cuatro regresos con historias diferentes,https://www.clarin.com/deportes/regreso-paulo-dybala-caras-nuevas-lionel-scaloni-dio-lista-seleccion-jugara-eliminatorias_0_toWj6Xq9a.html,https://images.clarin.com/2021/08/23/8MLOFoby2g_720x0__1.jpg
11,m8w50htXJ,El futuro de CR7. La decisión de Cristiano Ronaldo que podría romper el mercado de pases en Europa,https://www.clarin.com/deportes/decision-cristiano-ronaldo-podria-romper-mercado-pases_0_m8w50htXJ.html,https://images.clarin.com/2021/08/23/DdU0_k-OJ_1256x620__2.jpg#1629738928201
12,Y4B7RFUct,"Tenía 84 años. Murió José Yudica, uno de los grandes entrenadores de la historia del fútbol argentino",https://www.clarin.com/deportes/murio-jose-yudica-grandes-entrenadores-historia-futbol-argentino_0_Y4B7RFUct.html,https://images.clarin.com/2021/08/23/3BB0z4iK2_720x0__1.jpg
13,Y5BD1DhCk,"Ayuda mundial. Con advertencias, llegan a la Argentina los US$ 4.350 millones del FMI",https://www.clarin.com/economia/llegan-argentina-us-4-350-millones-fmi-reclama-uso-responsable-fondos_0_Y5BD1DhCk.html,https://images.clarin.com/2021/07/12/utE9vcPbY_720x0__1.jpg
14,s2jchryqj,A veinte días de las PASO. Problemas para conformar autoridades de mesas en la provincia de Buenos Aires,https://www.clarin.com/politica/problemas-conformar-autoridades-mesas-provincia-buenos-aires_0_s2jchryqj.html,https://images.clarin.com/2017/10/18/SkL6hgHaW_1256x620__2.jpg#1629733731563
15,wc8leFGZ_,"Violencia en Rosario. ""Suelten a Los Monos porque los matamos a todos"", el escalofriante llamado al 911",https://www.clarin.com/policiales/-suelten-monos-matamos-escalofriante-llamado-911-rosario_0_wc8leFGZ_.html,https://images.clarin.com/2021/08/23/jGD8v3APa_1256x620__2.jpg#1629728999267
16,jBza8GaEl,La grieta en Nordelta. Carpinchos: la mitad de los vecinos no quiere saber nada con que se queden,https://www.clarin.com/zonales/grieta-nordelta-carpinchos-mitad-vecinos-quiere-saber-queden_0_jBza8GaEl.html,https://images.clarin.com/2021/08/23/ZNmQLHYZM_720x0__1.jpg
17,yVWX9L3Yz,Salieron de Bariloche. Buscan a cuatro personas que desaparecieron cuando iban a repartir juguetes,https://www.clarin.com/sociedad/desesperada-busqueda-4-vecinos-bariloche-desaparecieron-iban-repartir-juguetes-dia-ninez_0_yVWX9L3Yz.html,https://images.clarin.com/2021/08/23/SxHkoAvbU_720x0__1.jpg
18,3iLYBEFMf,Qué significa. EE.UU. le otorgó la aprobación total a la vacuna de Pfizer contra el coronavirus,https://www.clarin.com/mundo/unidos-otorgo-aprobacion-total-vacuna-pfizer-coronavirus_0_3iLYBEFMf.html,https://images.clarin.com/2021/08/23/KRVdn8XwN_1256x620__2.jpg#1629727287382
19,MJOehilLx,Especial Clarín. Diez años sin Candela: la venganza narco que conmovió al país,https://www.clarin.com/policiales/anos-candela-venganza-narco-conmovio-pais-final_0_MJOehilLx.html,https://images.clarin.com/2021/08/19/WMNo6rFVs_720x0__1.jpg
20,kpk9ILyab,"Emotivo adiós en Mendoza. Días antes de morir de Covid, pidió ver por última vez a su compañera de toda la vida",https://www.clarin.com/sociedad/emotiva-despedida-mendoza-dias-morir-covid-pidio-ver-ultima-vez-companera-toda-vida_0_kpk9ILyab.html,https://images.clarin.com/2021/08/23/HUTImyiw2_720x0__1.jpg
21,7VFHD0Gc0,Caos en Afganistán. Aún hay 100 mil personas para evacuar: piden a EE.UU. que aplace su retirada,https://www.clarin.com/mundo/100-mil-personas-evacuar-afganistan-piden-unidos-aplace-retirada_0_7VFHD0Gc0.html,https://images.clarin.com/2021/08/23/28DBMrwLP_1256x620__2.jpg#1629737303477
22,Zb_TGbc7n,"En Villa Devoto. La pesadilla de 20 familias que compraron en pozo: por una disputa judicial, podrían quedar en la calle",https://www.clarin.com/ciudades/pesadilla-20-familias-compraron-pozo-villa-devoto-disputa-judicial-podrian-quedar-calle_0_Zb_TGbc7n.html,https://images.clarin.com/2021/08/14/C4kGTDV-M_720x0__1.jpg
23,84WpnOL2s,Hollywood. Las estrellas que dejan de actuar y eligen otras actividades,https://www.clarin.com/espectaculos/cameron-diaz-kiefer-sutherland-estrellas-hollywood-dejan-actuar-eligen-actividades_0_84WpnOL2s.html,https://images.clarin.com/2016/03/11/H1nx2Se4x_720x0.jpg
24,crRTsWJ4s,Redes sociales. Cómo ganar dinero en TikTok: los requisitos que les piden a los influencers,https://www.clarin.com/tecnologia/ganar-dinero-tiktok-requisitos-piden-influencers_0_crRTsWJ4s.html,https://images.clarin.com/2021/08/18/-WeAtCf4R_720x0__1.jpg
25,CWQycj7el,Fotogalería. Inundaciones y vuelos cancelados en EE.UU. por la tormenta tropical Henri,https://www.clarin.com/tecnologia/ingeniero-creo-lanza-telaranas-funciona-spider-man_0_CWQycj7el.html,https://images.clarin.com/2021/08/22/lyE42dtIs_720x0__1.jpg
26,,Historias visuales. El Día en Fotos con las 100 mejores imágenes de Argentina y el mundo,,
27,9-SxibHYv,Finanzas y mercados. Inversiones en modo electoral: plazo corto y títulos ajustados a inflación o a tasa fija,https://www.clarin.com/economia/inflacion-tasa-fija-duda-inversores-mes-paso_0_9-SxibHYv.html,https://images.clarin.com/2021/08/03/9cU78nS60_720x0__1.jpg
28,tWduMDcgf,Impuesto a las Ganancias. La Justicia dictó un fallo que evitará que una empresa pague una tasa del 80%,https://www.clarin.com/economia/impuesto-ganancias-justicia-dicto-fallo-evitara-empresa-pague-tasa-80-_0_tWduMDcgf.html,https://images.clarin.com/2021/04/26/ZGV-9LFhL_720x0__1.jpg
29,ZfSMYIcwE,"Mercado cambiario. Con el dólar blue en $ 182, el Banco Central refuerza las reservas con la llegada de los US$ 4.350 millones del FMI",https://www.clarin.com/economia/dolar-blue-182-banco-central-refuerza-reservas-llegada-deg-fmi_0_ZfSMYIcwE.html,https://images.clarin.com/2020/02/13/MA7_WOHR_720x0__1.jpg
30,WoygovnVy,Opinión. Dueños o inquilinos: por qué es importante una buena política de viviendas,https://www.clarin.com/economia/duenos-inquilinos-importante-buena-politica-viviendas_0_WoygovnVy.html,https://images.clarin.com/2021/06/01/GAfN3vZWW_720x0__1.jpg
31,D6VYrk__9,Turismo. PreViaje: se triplicaron reservas y analizan ampliar el plan,https://www.clarin.com/economia/previaje-triplicaron-reservas-analizan-ampliar-plan-turistas-extranjeros_0_D6VYrk__9.html,https://images.clarin.com/2021/08/02/0BIGTBQ7U_720x0__1.jpg
32,JoujK8gi9,Alivio fiscal. Jubilados: arranca la exención y devolución de Ganancias,https://www.clarin.com/economia/jubilados-arranca-manana-exencion-devolucion-ganancias_0_JoujK8gi9.html,https://images.clarin.com/2021/06/21/VB8HjHKq1_720x0__1.jpg
33,BMdoQg3LW,Redes. Crianza en tribu: grupos de mamás para criar como nuestros abuelos,https://www.clarin.com/familias/crianza-tribu-grupos-mamas-criar-abuelos_0_BMdoQg3LW.html,https://images.clarin.com/2021/08/16/kINh7Qrj6_720x0__1.jpg
34,dbENItBdg,"Concientización. Muerte súbita: 5 preguntas frecuentes (y cómo convertirte en un ""rescatador"")",https://www.clarin.com/buena-vida/muerte-subita-5-preguntas-frecuentes-convertirte-rescatador-_0_dbENItBdg.html,https://images.clarin.com/2021/08/23/2VygSkZQj_720x0__1.jpg
35,mckM-g-aq,Ciberseguridad. Por qué es riesgoso entrar a una videollamada de WhatsApp ya iniciada,https://www.clarin.com/tecnologia/riesgoso-entrar-videollamada-whatsapp-iniciada_0_mckM-g-aq.html,https://images.clarin.com/2020/04/28/D-HZrf-8C_720x0__1.jpg
36,Z_aODH31G,"Todo empieza en casa. Cómo enseñar ""buenos modales"" a los niños",https://www.clarin.com/familias/como-ensenar-buenos-modales-a-los-ninos_0_Z_aODH31G.html,https://images.clarin.com/2021/08/20/dtr6SPpIr_1256x620__2.jpg#1629487924815
37,P8Ko7-M4b,"Contenido patrocinado. El momento para invertir, precios bajos vislumbran una muy buena rentabilidad",https://www.clarin.com/mercado-inmobiliario/hoy-momento-invertir-precios-bajos-vislumbran-buena-rentabilidad_0_P8Ko7-M4b.html,https://images.clarin.com/2021/08/18/u7Zf8f--5_720x0__1.jpg
38,MBIRedhZl,Recetas. Qué cocinar esta semana: menú día por día del 23 al 29 de agosto,https://www.clarin.com/gourmet/cocinar-semana-menu-dia-dia-23-29-agosto_0_MBIRedhZl.html,https://images.clarin.com/2021/06/23/WQ1uJdj7C_1256x620__3.jpg#1629481152072
39,L9uAWcGZ6,"Aniversario. Dodge 1500, un clásico de la clase media argentina cumple 50 años",https://www.clarin.com/autos/dodge-1500-clasico-clase-media-argentina-cumple-50-anos_0_L9uAWcGZ6.html,https://images.clarin.com/2021/08/21/960sw6p1Z_720x0__1.jpg
40,vm5Jy4wCI,"Historias. Videntes, sicarios y un imperio teñido de sangre: así fue el asesinato de Maurizio Gucci",https://www.clarin.com/internacional/videntes-sicarios-imperio-sangre-asesinato-maurizio-gucci-penso-viuda-negra-_0_vm5Jy4wCI.html,https://images.clarin.com/2021/08/22/JKPc-69IT_720x0__1.jpg
41,eNJSaBOVk,Los Sex Pistols en guerra. Johnny Rotten perdió una demanda contra sus ex compañeros,https://www.clarin.com/espectaculos/musica/sex-pistols-guerra-johnny-rotten-perdio-demanda-ex-companeros_0_eNJSaBOVk.html,https://images.clarin.com/2021/08/23/7CsZVzW3-_1256x620__2.jpg#1629744773749
42,xpQV09I-f,Astrología. Horóscopo semanal: predicciones del 22 al 29 de agosto para cada signo,https://www.clarin.com/astrologia/horoscopo-semanal-predicciones-22-29-agosto-signos_0_xpQV09I-f.html,https://images.clarin.com/2021/01/25/o3ZvCDEkR_720x0__1.jpg
43,1HVSivaGp,Día Internacional. Cuáles son los hashtag más usados en redes sociales,https://www.clarin.com/tecnologia/dia-internacional-hashtag-usados-redes-sociales_0_1HVSivaGp.html,https://images.clarin.com/2021/08/23/bc-XZY94O_720x0__1.jpg
44,orpmERoGa,"Semana del Descanso. La innovación, un aspecto vital del ""entrenamiento invisible""",https://www.clarin.com/brandstudio/innovacion-aspecto-vital-entrenamiento-invisible-_0_orpmERoGa.html,https://images.clarin.com/2021/08/19/NoQLsOsmq_720x0__1.jpg
45,MaqcClGNx,La importancia del descanso. Claves para dormir bien y lograr un sueño reparador,https://www.clarin.com/brandstudio/claves-dormir-bien-lograr-sueno-reparador_0_MaqcClGNx.html,https://images.clarin.com/2021/08/21/Dvv4yGl01_720x0__1.jpg
46,Dk8sBTBr6,Para los turistas. San Juan: una promoción para ahorrar en alojamiento y excursiones,https://www.clarin.com/brandstudio/san-juan-promocion-ahorrar-alojamiento-excursiones_0_Dk8sBTBr6.html,https://images.clarin.com/2021/08/19/l6nHLX0-J_720x0__1.jpg
47,4hu0TcUAT,Sueño reparador. Semana del descanso: ¿Por qué dormir es bueno para la salud?,https://www.clarin.com/brandstudio/semana-descanso-dormir-bueno-salud-_0_4hu0TcUAT.html,https://images.clarin.com/2021/08/21/7bU8jDjZi_720x0__1.jpg
48,4zQbjXWXO,Atracción fatal. Si te ataca una serpiente marina  no trates de huir,https://www.clarin.com/new-york-times-international-weekly/ataca-serpiente-marina-trates-huir_0_4zQbjXWXO.html,https://images.clarin.com/2021/08/20/d7OzbO2Py_1256x620__2.jpg#1629481177676
49,JgAMh2dIL,Hallazgo de paleontólogos. Este cerebro permaneció intacto en un fósil de 310 millones de años,https://www.clarin.com/new-york-times-international-weekly/cerebro-permanecio-intacto-fosil-310-millones-anos_0_JgAMh2dIL.html,https://images.clarin.com/2021/08/18/YurSNSKaF_1256x620__2.jpg#1629298794059
50,pJ4WDGUSJ,Sorprendente. Algunas crías de murciélago balbucean igual que los bebés humanos,https://www.clarin.com/new-york-times-international-weekly/crias-murcielago-balbucean-igual-bebes-humanos_0_pJ4WDGUSJ.html,https://images.clarin.com/2021/08/20/LKzkaolEW_1256x620__2.jpg#1629482830157
51,6YXBMVsTo,Víctima. Un futbolista afgano de 17 años cayó de un avión de evacuación de EE.UU.,https://www.clarin.com/new-york-times-international-weekly/futbolista-afgano-17-anos-murio-caer-avion-evacuacion-ee-uu-_0_6YXBMVsTo.html,https://images.clarin.com/2021/08/20/s4-5GNPzS_1256x620__2.jpg#1629482184841
52,G_70KKTSk,Gesto solidario. Dejó la enfermería pero no su vocación: hoy les hace las cejas gratis a pacientes oncológicos,https://www.clarin.com/zonales/dejo-enfermeria-vocacion-hoy-hace-cejas-gratis-pacientes-oncologicos_0_G_70KKTSk.html,https://images.clarin.com/2021/06/22/NXzpFroM0_720x0__1.jpg
53,AZEx8CVjW,"Orgullo de La Matanza. Un regalo de despedida ""para toda la vida"" al campeón de América Gonzalo Montiel ",https://www.clarin.com/zonales/montiel-sevilla-barrio-siempre-despidieron-grande-mural_0_AZEx8CVjW.html,https://images.clarin.com/2021/08/13/Spt3OAO7y_720x0__1.jpg
54,DY8TO3xpY,"Una obra de $25 millones. Tras varios años, reabrieron el puente Maipú y ya funciona como trasbordo ",https://www.clarin.com/zonales/reabrieron-puente-maipu-funciona-trasbordo-tren-costa-mitre_0_DY8TO3xpY.html,https://images.clarin.com/2021/08/16/Zrhtu5lfL_720x0__1.jpg
55,Plr8KU51b,"Historias del GBA. ""Las gorditas no pueden usar bikinis"", le dijeron: ahora es modelo y diseña ropa XL ",https://www.clarin.com/zonales/talles-cuerpos-edades-frase-vos-va-camino-caducar-_0_Plr8KU51b.html,https://images.clarin.com/2021/05/07/8siNSm11U_720x0__1.jpg
56,wj4lvNrTP,"Reclamo y polémica. Tras su separación de Vicuña, la China Suárez enfrenta un escandaloso conflicto judicial",https://www.clarin.com/fama/separacion-benjamin-vicuna-china-suarez-enfrenta-escandaloso-conflicto-judicial_0_wj4lvNrTP.html,https://images.clarin.com/2020/03/25/hk5uPjq02_720x0__1.jpg
57,osOoqhBq-,"Viven en Alemania. Un túnel de arcoíris, arte y naturaleza: cómo es el colegio al que van los hijos de Eva Anderson",https://www.clarin.com/fama/tunel-arcoiris-arte-naturaleza-colegio-van-hijos-eva-anderson-alemania_0_osOoqhBq-.html,https://images.clarin.com/2020/03/21/VTca1zzIX_720x0__1.jpg
58,epvISF1G9,"Escándalo interminable. La Justicia falló a favor de Fabián Cubero y Nicole Neumann estalló de bronca al enterarse: ""Rata""",https://www.clarin.com/fama/justicia-fallo-favor-fabian-cubero-nicole-neumann-estallo-bronca-enterarse-rata-_0_epvISF1G9.html,https://images.clarin.com/2020/02/03/ZcV-2uqZ_720x0__1.jpg
59,fwxwVikdQ,En medio del escándalo. Aseguran que Vicky Xipolitakis tiene un nuevo novio: quién es y a qué se dedica,https://www.clarin.com/fama/medio-escandalo-aseguran-vicky-xipolitakis-nuevo-novio-dedica_0_fwxwVikdQ.html,https://images.clarin.com/2021/08/23/w4rtbYwKv_720x0__1.jpg
60,yKDDCTSxw,"La intimidad del poder. Olivos: presión de Cristina, los nervios de Alberto y los chats de Fabiola ",https://www.clarin.com/politica/arde-olivos-presion-cristina-kirchner-nervios-alberto-fernandez-chats-fabiola-yanez_0_yKDDCTSxw.html,https://images.clarin.com/2021/01/17/T60N_5i6c_1256x620__2.jpg#1629638041955
61,icTAj2pu8,"500 días sin actuar. La silenciosa vida de Antonio Gasalla, hoy: ""No me van a ver más""",https://www.clarin.com/historias/500-dias-actuar-silenciosa-vida-antonio-gasalla-hoy-van-ver-_0_icTAj2pu8.html,https://images.clarin.com/2021/08/20/JmKXLLBr7_720x0__1.jpg
62,btMTg9BAV,"Humor político. No sabés el día que tuve hoy, Dylan",https://www.clarin.com/opinion/sabes-dia-hoy-dylan_0_btMTg9BAV.html,https://images.clarin.com/2021/08/21/HlSsNSTtF_720x0__2.jpg#1629590666451
63,LyA2Idxkn,"Finanzas en rojo. ¿Estoy en el Veraz? Paso a paso, cómo tengo que hacer para salir",https://www.clarin.com/servicios/-veraz-paso-paso-hacer-salir_0_LyA2Idxkn.html,https://images.clarin.com/2018/08/03/rywiGQfHX_720x0__1.jpg
64,NIm7w-Esj,Covid. Los problemas neurológicos son más frecuentes en los chicos,https://www.clarin.com/sociedad/problemas-neurologicos-veces-frecuentes-chicos-covid-adultos_0_NIm7w-Esj.html,https://images.clarin.com/2020/09/22/gwuzKCyYt_1256x620__3.jpg#1629479159661
65,a_fFOCBbW,En detalle. Cómo armar una PC gamer con todo por menos de 130 mil pesos,https://www.clarin.com/tecnologia/armar-computadora-gamer-barata-necesita-130-mil-pesos_0_a_fFOCBbW.html,https://images.clarin.com/2019/02/28/e8qPpgyHF_720x0__1.jpg
66,j5owUSw_W,En alza. Criptomonedas: ¿cuánto plata se puede ganar con una PC desde el living de casa?,https://www.clarin.com/especiales/criptomonedas-plata-puede-ganar-pc-living-casa-_0_j5owUSw_W.html,https://images.clarin.com/2021/08/16/SZDgaDM6F_720x0__1.jpg
67,cLMOjbE0e,Razones de un boom. Ser vegano: el negocio millonario detrás de un fenómeno imparable,https://www.clarin.com/sociedad/vegano-negocio-millonario-detras-fenomeno-imparable_0_cLMOjbE0e.html,https://images.clarin.com/2021/08/10/qvvDoNwrX_720x0__1.jpg
68,BnHii2BYB,"Historia conmovedora. Olga, la pianista que perdió la memoria pero nunca olvidó una nota",https://www.clarin.com/sociedad/conmovedora-historia-olga-pianista-perdio-memoria-sigue-tocando-sinfonias_0_BnHii2BYB.html,https://images.clarin.com/2021/07/29/msCNVBg57_720x0__1.jpg
69,WV8NLblKxr,"Una ""caja"" política. Peajes, narcotráfico y secretos de estado: por qué la Hidrovía desvela al Gobierno",https://www.clarin.com/politica/peajes-narcotrafico-secretos-hidrovia-desvela-gobierno_0_WV8NLblKxr.html,https://images.clarin.com/2021/08/04/BZBPAPEqR_720x0__1.jpg
70,e9Tw5FxYI,Ansiedad por la Pulga. Messi volvió a Francia y se acerca su esperado debut en Paris Saint-Germain,https://www.clarin.com/deportes/lionel-messi-volvio-francia-iniciar-semana-previa-esperado-debut-paris-saint-germain_0_e9Tw5FxYI.html,https://images.clarin.com/2021/08/19/L63bZF9Hv_720x0__1.jpg
71,M7LZRaoWZ,"El 9 que esperaba Boca. Luis Vázquez: ""Ojalá de ahora en más vengan más triunfos""",https://www.clarin.com/deportes/luis-vazquez-9-esperaba-boca-trajo-grito-desahogo-ojala-ahora-vengan-triunfos-_0_M7LZRaoWZ.html,https://images.clarin.com/2021/08/21/Fm2wZF4x0_720x0__1.jpg
72,5ODT-pp3I,Desacostumbrado. La cara nunca antes vista del River de Gallardo. atrapado en la irregularidad,https://www.clarin.com/deportes/cara-vista-river-gallardo-atrapado-irregularidad-solo-gano-7-ultimos-22-partidos_0_5ODT-pp3I.html,https://images.clarin.com/2021/08/22/czCYbeRGW_720x0__1.jpg
73,szF2AiyIH,"Habla por primera vez. Chiaraviglio y su calvario en Tokio: ""Me sentí en una prisión y sufrí un ataque de pánico""",https://www.clarin.com/deportes/tokio-2020-chiaraviglio-covid-relato-salvaje-prision_0_szF2AiyIH.html,https://images.clarin.com/2021/08/22/4tV71Fn8b_720x0__1.jpg
74,cUGAkDOOK,Ranking ATP. Zverev sube y corre a Rafael Nadal del top 4,https://www.clarin.com/deportes/ranking-atp-alexander-zverev-sube-corre-rafael-nadal-top-4_0_cUGAkDOOK.html,https://images.clarin.com/2021/08/23/7al4SvZwP_720x0__1.jpg
75,Pxgdk3NHT,Duras sanciones. Habrá severas multas y hasta prisión para los participantes del escándalo en Niza,https://www.clarin.com/deportes/severas-multas-anos-prision-participaron-escandalo-niza-marsella_0_Pxgdk3NHT.html,https://images.clarin.com/2021/08/22/o6A6Cygcl_720x0__1.jpg
