n,id,title,url,image
1,SFKq4AsAi,"Ofensiva contra la Justicia. Otro ataque de Alberto Fernández a la Corte Suprema: ""Tiene un problema de funcionamiento muy serio""",https://www.clarin.com/politica/ataque-alberto-fernandez-justicia-corte-suprema-problema-funcionamiento-serio-_0_SFKq4AsAi.html,https://images.clarin.com/2022/01/10/LRm49eXCU_1256x620__2.jpg#1641843704370
2,ntpR1U9VX,La tercera ola en el país. Coronavirus: confirman 88.352 casos y 51 muertos en las últimas 24 horas,https://www.clarin.com/sociedad/coronavirus-argentina-confirman-88-352-nuevos-casos-ultimas-24-horas_0_ntpR1U9VX.html,https://images.clarin.com/2022/01/08/ZpQSwarf5_1256x620__2.jpg#1641837313170
3,bLcljZ1Gd,"Coronavirus. El Gobierno avisa que seguirá la suba de casos, pero le pone fecha a la caída de contagios",https://www.clarin.com/sociedad/ministerio-salud-advierte-semana-seguiran-subiendo-contagios-pone-fecha-caida-casos_0_bLcljZ1Gd.html,https://images.clarin.com/2021/12/28/eNWaki2du_720x0__1.jpg
4,VDxeT3WZT,"Interna oficialista. La ultra K que llamó ""okupa"" al Presidente ahora pega duro por la deuda y la inflación",https://www.clarin.com/politica/ultra-k-llamo-okupa-mequetrefe-presidente-ahora-pega-duro-deuda-inflacion_0_VDxeT3WZT.html,https://images.clarin.com/2020/02/02/7tuwNLfP_720x0__1.jpg
5,6Mhbf5WZ2,"Un clásico de los 90. El adiós a Rodizio Costanera: el restaurante será demolido y sus empleados, indemnizados",https://www.clarin.com/ciudades/adios-definitivo-rodizio-costanera-empleados-indemnizados-restaurante-demolido_0_6Mhbf5WZ2.html,https://images.clarin.com/2022/01/07/fHK4voTvl_1256x620__2.jpg#1641588492617
6,X4pP14maa,Vacunas contra el Covid. La paradoja de la tercera dosis: las dos causas que le están poniendo el pie en el freno,https://www.clarin.com/sociedad/paradoja-tercera-dosis-vacuna-covid-causas-poniendo-pie-freno_0_X4pP14maa.html,https://images.clarin.com/2022/01/03/-RPJS0HLU_1256x620__2.jpg#1641668126579
7,Y9y-g3u-D,Podrían ser más. Aerolíneas Argentinas canceló siete vuelos por contagios de Covid,https://www.clarin.com/economia/aerolineas-cancelo-vuelos-contagios-covid_0_Y9y-g3u-D.html,https://images.clarin.com/2021/03/15/JutoN7wPm_720x0__1.jpg
8,cguyT-Oky,"Su mayor cliente era YPF. Tras el robo de $ 1.000 millones, echan a 300 empleados de la empresa de caudales del ex financista de Radio del Plata",https://www.clarin.com/politica/robo-1-000-millones-despiden-300-trabajadores-transportadora-caudales-ex-financista-radio-plata_0_cguyT-Oky.html,https://images.clarin.com/2022/01/07/6RPjFnzsO_720x0__1.jpg
9,sv5a4uabV,El Merval también cede. Los bonos soberanos extienden su caída y el riesgo país trepa a 1.833 puntos,https://www.clarin.com/economia/bonos-dolares-extienden-caida-riesgo-pais-trepa-1-833-puntos_0_sv5a4uabV.html,https://images.clarin.com/2022/01/10/bbSQNIRlq_720x0__1.jpg
10,VBn7uqGsA,Peso mega devaluado. Las estrategias de las familias que no se resignan a bajarse de Punta del Este,https://www.clarin.com/sociedad/peso-mega-devaluado-estrategias-familias-clase-media-resignan-bajarse-punta_0_VBn7uqGsA.html,https://images.clarin.com/2022/01/06/1QiQlwPZb_1256x620__2.jpg#1641671338484
11,5hdjH99Gl,"Debe ser tratado. El intendente de Rosario anunció que le detectaron una ""patología prostática""",https://www.clarin.com/politica/intendente-rosario-pablo-javkin-detectaron-patologia-prostatica-empezara-tratamiento_0_5hdjH99Gl.html,https://images.clarin.com/2020/01/03/WUj9hVt9_720x0__1.jpg
12,wu7cWYnRh,Liberan a Nole. Djokovic ganó la batalla judicial con Australia y logró la devolución de su visado,https://www.clarin.com/deportes/arranca-audiencia-novak-djokovic-tribunal-australia-quedara-irse-jugar-primer-grand-slam-ano-_0_wu7cWYnRh.html,https://images.clarin.com/2022/01/10/y8CBeeRiB_720x0__1.jpg
13,ekQ-L9mev,Creen que se intoxicaron. Encontraron muertos a dos turistas extranjeros en un hotel de Mendoza,https://www.clarin.com/policiales/encontraron-turistas-extranjeros-muertos-hotel-mendoza-creen-intoxicaron-alimentos_0_ekQ-L9mev.html,https://images.clarin.com/2022/01/10/TlovHIdQ1_720x0__1.jpg
14,U8DizIWQl,Desarrollo. Pfizer podría tener lista en dos meses la nueva vacuna contra la variante Ómicron,https://www.clarin.com/sociedad/pfizer-podria-tener-lista-meses-nueva-vacuna-variante-omicron-covid-19_0_U8DizIWQl.html,https://images.clarin.com/2021/10/27/g48gpgw9m_720x0__1.jpg
15,Bgc_16lzU,"Mar del Plata. El turista apuñalado a la salida de un boliche: ""No fue una riña, le quisieron robar""",https://www.clarin.com/sociedad/turista-apunalado-salida-boliche-mar-plata-rina-quisieron-robar-_0_Bgc_16lzU.html,https://images.clarin.com/2022/01/10/yhu5ayUE0_720x0__1.jpg
16,LTz2JIw8y,"La clave, un hecho climático. Un pueblo del oeste de La Pampa, invadido por millones de cascarudos",https://www.clarin.com/sociedad/pleno-desierto-humedad-provoco-invasion-cascarudos-pueblo-pampa_0_LTz2JIw8y.html,https://images.clarin.com/2022/01/10/HQ9kq_5e9_1256x620__2.jpg#1641841222675
17,WN3KLEi9j,"¿Quién es Elena Ferrante?. Nadie la vio ni saben cómo se llama: la misteriosa historia de la autora de ""La hija oscura""",https://www.clarin.com/internacional/espectaculos/nadie-vio-saben-llama-misteriosa-historia-autora-hija-oscura-_0_WN3KLEi9j.html,https://images.clarin.com/2022/01/09/rlXXwIabt_720x0__1.jpg
18,NAVP54rrZ,Entrevista. Natalie Pérez: por qué prioriza su carrera musical y el vínculo con Chano,https://www.clarin.com/fama/natalie-perez-intima-prioriza-carrera-musical-peso-fama-relacion-une-chano_0_NAVP54rrZ.html,https://images.clarin.com/2022/01/10/Rz61XzrIh_720x0__1.jpg
19,fCQieK1hy,"Integra dos tríadas. Tiene 4 novios: ""El poliamor es la única forma de relación en la que me siento bien""",https://www.clarin.com/relaciones/4-novios-poliamor-unica-forma-relacion-siento-bien-_0_fCQieK1hy.html,https://images.clarin.com/2022/01/07/yg-7XDirs_720x0__1.jpg
20,4-72mSg37,El crimen de Fernando. La Justicia desestimó la acusación de Nahir Galarza contra su padre,https://www.clarin.com/policiales/justicia-desestimo-acusacion-nahir-galarza-padre-crimen-fernando-pastorizo_0_4-72mSg37.html,https://images.clarin.com/2018/12/27/fNKetxY1J_720x0__1.jpg
21,LJTBrHqsI,"Tenía 65 años. Encuentran muerto en un hotel a Bob Saget, el actor de ""Full House""",https://www.clarin.com/espectaculos/encuentran-muerto-bob-saget-actor-full-house-how-i-met-your-mother-_0_LJTBrHqsI.html,https://images.clarin.com/2022/01/10/CXOEQamxE_720x0__1.jpg
22,Ch-m3xi_B,La rompe en Italia. Giovanni Simeone hizo fuerza con sus goles en el Calcio y vuelve a la Selección Argentina,https://www.clarin.com/deportes/giovanni-simeone-hizo-fuerza-goles-calcio-vuelve-seleccion-argentina_0_Ch-m3xi_B.html,https://images.clarin.com/2022/01/10/vTVerMq24_1256x620__2.jpg#1641827365037
23,kPwz3R9Cg,Al cierre de 2021. Ranking de usados: cuáles son los modelos más vendidos en la Argentina,https://www.clarin.com/autos/ranking-usados-modelos-vendidos-argentina_0_kPwz3R9Cg.html,https://images.clarin.com/2019/03/09/PJ6NAKdMW_720x0__1.jpg
24,okmqSntk1,El estreno del MACA. Punta de Este abrió un museo modernísimo: su arquitecto cuenta los secretos del edificio,https://www.clarin.com/cultura/punta-abrio-museo-modernisimo-carlos-ott-arquitecto-revela-claves_0_okmqSntk1.html,https://images.clarin.com/2022/01/10/Rk5pkt91X_720x0__1.jpg
25,SFKq4AsAi,"Ofensiva contra la Justicia. Otro ataque de Alberto Fernández a la Corte Suprema: ""Tiene un problema de funcionamiento muy serio""",https://www.clarin.com/politica/ataque-alberto-fernandez-justicia-corte-suprema-problema-funcionamiento-serio-_0_SFKq4AsAi.html,https://images.clarin.com/2022/01/10/LRm49eXCU_1256x620__2.jpg#1641843704370
26,ntpR1U9VX,La tercera ola en el país. Coronavirus: confirman 88.352 casos y 51 muertos en las últimas 24 horas,https://www.clarin.com/sociedad/coronavirus-argentina-confirman-88-352-nuevos-casos-ultimas-24-horas_0_ntpR1U9VX.html,https://images.clarin.com/2022/01/08/ZpQSwarf5_1256x620__2.jpg#1641837313170
27,bLcljZ1Gd,"Coronavirus. El Gobierno avisa que seguirá la suba de casos, pero le pone fecha a la caída de contagios",https://www.clarin.com/sociedad/ministerio-salud-advierte-semana-seguiran-subiendo-contagios-pone-fecha-caida-casos_0_bLcljZ1Gd.html,https://images.clarin.com/2021/12/28/eNWaki2du_720x0__1.jpg
28,VDxeT3WZT,"Interna oficialista. La ultra K que llamó ""okupa"" al Presidente ahora pega duro por la deuda y la inflación",https://www.clarin.com/politica/ultra-k-llamo-okupa-mequetrefe-presidente-ahora-pega-duro-deuda-inflacion_0_VDxeT3WZT.html,https://images.clarin.com/2020/02/02/7tuwNLfP_720x0__1.jpg
29,6Mhbf5WZ2,"Un clásico de los 90. El adiós a Rodizio Costanera: el restaurante será demolido y sus empleados, indemnizados",https://www.clarin.com/ciudades/adios-definitivo-rodizio-costanera-empleados-indemnizados-restaurante-demolido_0_6Mhbf5WZ2.html,https://images.clarin.com/2022/01/07/fHK4voTvl_1256x620__2.jpg#1641588492617
30,X4pP14maa,Vacunas contra el Covid. La paradoja de la tercera dosis: las dos causas que le están poniendo el pie en el freno,https://www.clarin.com/sociedad/paradoja-tercera-dosis-vacuna-covid-causas-poniendo-pie-freno_0_X4pP14maa.html,https://images.clarin.com/2022/01/03/-RPJS0HLU_1256x620__2.jpg#1641668126579
31,Y9y-g3u-D,Podrían ser más. Aerolíneas Argentinas canceló siete vuelos por contagios de Covid,https://www.clarin.com/economia/aerolineas-cancelo-vuelos-contagios-covid_0_Y9y-g3u-D.html,https://images.clarin.com/2021/03/15/JutoN7wPm_720x0__1.jpg
32,vUWU0j20x,"Toda la intimidad. Casamiento de Stefi Roitman y Ricky Montaner: llantos, reality, shows, boda mixta y romances",https://www.clarin.com/fama/casamiento-stefi-roitman-ricky-montaner-llantos-reality-shows-boda-mixta-romances_0_vUWU0j20x.html,https://images.clarin.com/2022/01/09/t5Sl6tXYZ_720x0__1.jpg
33,StLH4bntT,"Se salvó de milagro. Flor Jazmín Peña, la campeona del ""Bailando 2019"", sufrió un tremendo accidente en la ruta",https://www.clarin.com/fama/flor-jazmin-pena-campeona-bailando-2019-sufrio-tremendo-accidente-ruta_0_StLH4bntT.html,https://images.clarin.com/2022/01/10/ecHFEuxS0_720x0__1.jpg
34,UIlmI5GC5,Se investiga el hecho. Entraron a robar a la casa de Nico Repetto en Uruguay: arrancaron la caja fuerte de la habitación,https://www.clarin.com/fama/entraron-robar-casa-nicolas-repetto-uruguay-arrancaron-caja-fuerte-habitacion_0_UIlmI5GC5.html,https://images.clarin.com/2020/09/09/UbHWnZab4_720x0__1.jpg
35,oRz7-T5gN,"Exclusivo. La ex de Manu Urcera, el novio de Nicole, recordó la advertencia que le hizo a la modelo",https://www.clarin.com/fama/ex-manu-urcera-novio-nicole-neumann-recordo-advertencia-hizo-modelo-lugar-mina-distinta-meses-_0_oRz7-T5gN.html,https://images.clarin.com/2022/01/07/tH-2DsyG-_720x0__1.jpg
36,6Wp3w8uBf,"Especial Clarín. Una noche en la ópera: viaje al interior de Aída, la obra cumbre de Verdi",https://www.clarin.com/espectaculos/musica/aida-princesa-cautiva-soldado-debate-amor-lealtad_0_6Wp3w8uBf.html,https://images.clarin.com/2022/01/05/uDG_HUrKJ_720x0__1.jpg
37,BGDTkApp6,Garantías para alquilar. Cómo acceder a un seguro de caución subsidiado y 70% más barato,https://www.clarin.com/servicios/garantias-alquilar-acceder-seguro-caucion-subsidiado-70-barato_0_BGDTkApp6.html,https://images.clarin.com/2021/02/19/cKI-VYNrU_720x0__1.jpg
38,PKU9Ton6a,De la gloria a la cárcel. Jorge Comas: los días del ex ídolo de Boca en un penal de Veracruz,https://www.clarin.com/historias/gloria-carcel-jorge-comas-dias-ex-idolo-boca-penal-veracruz_0_PKU9Ton6a.html,https://images.clarin.com/2022/01/05/GwsseWqtd_720x0__1.jpg
39,_UY9O4NAz,"La pandemia. Guía completa de los autotest de Covid: cuándo llegan, cómo son y el precio",https://www.clarin.com/sociedad/autotest-covid-hacen-podrian-costar_0__UY9O4NAz.html,https://images.clarin.com/2022/01/07/PZEPJApFV_1256x620__2.jpg#1641581597130
40,jqHZVVlHp,Manejar para ahorrar. Los costos de mantener un auto: cuánto suman y cómo se pueden solventar,https://www.clarin.com/servicios/costos-mantener-auto-suman-ahora-rebusque-pueden-solventar_0_jqHZVVlHp.html,https://images.clarin.com/2021/05/08/DT6KyD2Wi_720x0__1.jpg
41,m1EdK_wpV,Sociedad. Mundo verdulería: 10 secretos del negocio que explotó en pandemia,https://www.clarin.com/sociedad/mundo-verduleria-10-secretos-negocio-exploto-pandemia_0_m1EdK_wpV.html,https://images.clarin.com/2021/12/20/MSbLfu4yR_720x0__1.jpg
42,fJM8dsWAP,Viajes. De Salta a Tierra del Fuego: postales imperdibles de siete rutas escénicas de la Argentina,https://www.clarin.com/viajes/salta-tierra-fuego-postales-imperdibles-rutas-escenicas-argentina_0_fJM8dsWAP.html,https://images.clarin.com/2021/12/23/_rnz40zJS_720x0__1.jpg
43,CpUhuSgLk,Sociedad. Autitos de colección: un juego que no es de niños y mueve millones,https://www.clarin.com/autos/autitos-coleccion-juego-ninos-mueve-millones_0_CpUhuSgLk.html,https://images.clarin.com/2021/12/03/clFAGxjmh_720x0__1.jpg
44,9KZn_RIDy,Sociedad. El último lugar de la Argentina que se salva del cambio climático,https://www.clarin.com/especiales/ultimo-lugar-argentina-salva-cambio-climatico_0_9KZn_RIDy.html,https://images.clarin.com/2021/12/09/MXDJDgPHP_720x0__1.jpg
45,4o89XPZ8g,"Clarín en Arabia Saudita. Kees Koolen, el magnate que se rompió 22 huesos, pero no puede dejar el Dakar",https://www.clarin.com/deportes/kees-koolen-millonario-creador-booking-rompio-22-huesos-mata-puede-dejar-dakar_0_4o89XPZ8g.html,https://images.clarin.com/2022/01/09/Uf4Q6-Gf2_720x0__1.jpg
46,B8UMWjLoO,"Retirado desde 2013. A los 44 años, Pepe Sánchez volvió a jugar y terminó con una planilla increíble",https://www.clarin.com/deportes/44-anos-generacion-dorada-juan-ignacio-pepe-sanchez-volvio-jugar-basquet-domingo_0_B8UMWjLoO.html,https://images.clarin.com/2022/01/09/cN7xmVk0W_720x0__1.jpg
47,kqH1J7SVR,¿Cuál es la verdad?. Un rumor en Twitter sacudió a San Lorenzo: ¿los Romero llamaron a Tinelli para volver?,https://www.clarin.com/deportes/rumor-twitter-sacudio-san-lorenzo-hermanos-romero-llamaron-tinelli-volver-_0_kqH1J7SVR.html,https://images.clarin.com/2021/08/25/butxG0-FE_720x0__1.jpg
48,O3c50BPGA,En ronda con Clarín. Rafael Santos Borré: la vuelta de Juanfer a River y cómo ve a Gallardo para dirigir en Europa,https://www.clarin.com/deportes/rafael-santos-borre-vuelta-juanfer-river-ilusion-jugar-primer-mundial-ve-gallardo-dirigir-europa-muchas-cosas-hace-ven-aca-_0_O3c50BPGA.html,https://images.clarin.com/2022/01/05/zj4gWmiHX_720x0__1.jpg
49,9SVjKHZCH,Clarín en Arabia. Odisea para el Pato Silva en el Dakar: su camión se paró y pasó la noche en el desierto,https://www.clarin.com/deportes/dakar-2022-camion-pudo-pato-silva-paso-noche-medio-desierto_0_9SVjKHZCH.html,https://images.clarin.com/2022/01/10/_mV_6oh9d_1256x620__2.jpg#1641829210295
50,4Rx0LHiba,Minuto a minuto. Mercado de pases al día: todas las altas y bajas de los equipos de la Liga Profesional,https://www.clarin.com/deportes/mercado-pases-dia-todas-altas-bajas-equipos-liga-futbol-profesional_0_4Rx0LHiba.html,https://images.clarin.com/2021/09/15/5FU9sy6IB4_720x0__1.jpg
51,xMn7UrBZm,"Deuda reestructurada. En medio de presiones para acordar con el FMI, el Gobierno paga US$ 700 millones a los bonistas",https://www.clarin.com/economia/medio-presiones-acordar-fmi-gobierno-paga-us-700-millones-bonistas_0_xMn7UrBZm.html,https://images.clarin.com/2022/01/07/Ras4M764A_720x0__1.jpg
52,ruP2xuLbC,"Negociación con el FMI. El mercado desconfía del ""gradualismo"" de Guzmán y anticipa presiones",https://www.clarin.com/economia/negociacion-fmi-mercado-desconfia-gradualismo-guzman-anticipa-presiones_0_ruP2xuLbC.html,https://images.clarin.com/2022/01/09/ny_lOToQq_720x0__1.jpg
53,HlG9DaS4_,"Guía paso a paso. Monotributo 2022: recategorización, cómo pagarlo y más preguntas",https://www.clarin.com/economia/monotributo-recategorizacion-2022-beneficios-pagar-cuota-9-preguntas-frecuentes_0_HlG9DaS4_.html,https://images.clarin.com/2021/11/17/0T0_qdwPh_720x0__1.jpg
54,mJeM7v8VH,"Negociación . Acuerdo de precios: ""Somos cautelosos"", dice el presidente de la UIA",https://www.clarin.com/economia/acuerdo-precios-cautelosos-dice-presidente-uia_0_mJeM7v8VH.html,https://images.clarin.com/2021/10/18/JPBXY7ZcD_720x0__1.jpg
55,3uVaClAue,Finanzas. Comprar en pesos acciones que cotizan en el mundo: una opción ganadora,https://www.clarin.com/economia/comprar-pesos-acciones-cotizan-mundo-opcion-ganadora_0_3uVaClAue.html,https://images.clarin.com/2022/01/07/vAFo33sD0_720x0__1.jpg
