n,id,title,url,image
1,KE5OSSyhvj,Negociación de la deuda. Interna en el Gobierno por el FMI: la respuesta de Economía ante las presiones y filtraciones K,https://www.clarin.com/politica/interna-fmi-respuesta-economia-presiones-filtraciones-kirchnerismo_0_KE5OSSyhvj.html,https://images.clarin.com/2022/02/13/JwBMh-fMG_720x0__1.jpg
2,rmtMjJmlV6,"Escala el conflicto. Biden condenó la ""invasión"" a Ucrania y anunció sanciones contra Rusia junto a Europa",https://www.clarin.com/mundo/sanciones-ee-uu-rusia-bancos-empresas-puerta-abierta-dialogo_0_rmtMjJmlV6.html,https://images.clarin.com/2022/02/22/t5Dov5bXc_720x0__1.jpg
3,SCQg02el4G,Minuto a minuto. El Consejo de Seguridad ucraniano pide instaurar el estado de emergencia,https://www.clarin.com/mundo/conflicto-rusia-ucrania-vivo-consejo-seguridad-ucraniano-pide-instaure-emergencia_0_SCQg02el4G.html,https://images.clarin.com/2022/02/23/_3nC4jS63_720x0__1.jpg
4,CUuwWCuVFQ,Irá hoy. Incendios en Corrientes: Cabandié deberá dar explicaciones en el Senado,https://www.clarin.com/politica/incendios-corrientes-medio-cruces-ministro-juan-cabandie-debera-dar-explicaciones-senado_0_CUuwWCuVFQ.html,https://images.clarin.com/2022/02/19/7dwuA3iob_720x0__1.jpg
5,VnZMiPPDId,Duda frecuente. Adelgazar a medida que pasan los años: ¿se puede pesar lo mismo a los 50 que a los 20?,https://www.clarin.com/buena-vida/adelgazar-medida-pasan-anos-puede-pesar-mismo-50-anos-20-_0_VnZMiPPDId.html,https://images.clarin.com/2022/02/22/s4fgRG-4N_720x0__1.jpg
6,NphEF3RnDe,Del editor. El enigma interminable de la droga envenenada,https://www.clarin.com/opinion/enigma-interminable-droga-envenenada_0_NphEF3RnDe.html,https://images.clarin.com/2022/02/11/jweU7pJ1l_720x0__1.jpg
7,2y6gHubb18,Interna opositora para 2023. Larreta sumó otro gesto de Miguel Pichetto y le quitó una aliada a Patricia Bullrich,https://www.clarin.com/politica/cara-2023-rodriguez-larreta-sumo-gesto-miguel-pichetto-quito-aliada-patricia-bullrich_0_2y6gHubb18.html,https://images.clarin.com/2022/02/22/5b728jDDf_720x0__1.jpg
8,uOTn26NP0W,Crisis sanitaria. Covid silencioso: qué controles clave hay que hacerse hasta un año después de la infección,https://www.clarin.com/sociedad/covid-silencioso-controles-clave-hacerse-ano-despues-infeccion_0_uOTn26NP0W.html,https://images.clarin.com/2020/05/18/hNXcJrsfm_1256x620__2.jpg#1645538086727
9,ysOI0rjGQX,Choque fatal en Florianópolis. Las vacaciones de una familia argentina en Brasil que terminaron en tragedia,https://www.clarin.com/sociedad/vacaciones-familia-argentina-brasil-terminaron-tragedia_0_ysOI0rjGQX.html,https://images.clarin.com/2022/02/22/jU91yMkst_1256x620__2.jpg#1645552116403
10,Cz99PvRWL,"La muerte de Natacha Jaitt. Un video inquietante, cocaína en el baño y una clave que resiste",https://www.clarin.com/policiales/muerte-natacha-jaitt-video-inquietante-cocaina-bano-clave-resiste_0_Cz99PvRWL.html,https://images.clarin.com/2019/02/23/8GKY4lkg__720x0__1.jpg
11,9hRs7ob9FY,Evacuaron a vecinos. Video: alarma por un impresionante incendio en un edificio de Colegiales,https://www.clarin.com/sociedad/impresionante-incendio-edificio-barrio-porteno-colegiales_0_9hRs7ob9FY.html,https://images.clarin.com/2022/02/22/Op0o96wlw_720x0__1.jpg
12,9SRDinhF0s,Entre Kicillof y los gremios. Principio de acuerdo en la paritaria docente en Provincia: cuánto subirían los sueldos,https://www.clarin.com/sociedad/principio-acuerdo-gobierno-bonaerense-gremios-paritaria-docente-aumentarian-sueldos_0_9SRDinhF0s.html,https://images.clarin.com/2022/02/22/v1LOuZCc__720x0__1.jpg
13,h50hSOxaEb,Suba de tasas. Plazos fijos: en qué casos convienen hoy y 10 claves para tener en cuenta,https://www.clarin.com/servicios/plazos-fijos-casos-convienen-hoy-10-claves-tener-cuenta-solicitarlos_0_h50hSOxaEb.html,https://images.clarin.com/2021/10/12/NpOw-mnh7_720x0__1.jpg
14,xXd4Hexf7F,La pandemia. El laboratorio argentino Raffo comercializará la vacuna de Moderna en el país,https://www.clarin.com/sociedad/covid-19-laboratorio-argentino-raffo-comercializara-vacuna-moderna-pais_0_xXd4Hexf7F.html,https://images.clarin.com/2022/01/31/Avmwz37TI_720x0__1.jpg
15,M9DKGUHuER,"Imperdible. Subastan autos, camionetas y motos a precios de remate",https://www.clarin.com/servicios/subastan-autos-camionetas-motos-precios-remate-consigue_0_M9DKGUHuER.html,https://images.clarin.com/2022/02/22/iYHgwDkoq_720x0__1.jpg
16,wCh5HO8noG,Desde Brasil. Explosiva reaparición de Zárate: disculpas de Barros Schelotto y críticas de Vélez,https://www.clarin.com/deportes/mauro-zarate-boca-juventude-brasil-regreso-hijo-peticion_0_wCh5HO8noG.html,https://images.clarin.com/2022/02/22/Z1gVTtXxV_720x0__1.jpg
17,lZDTPYWWBh,Mirá el video. El gesto de un oso melero al recibir agua de un ambientalista en Corrientes,https://www.clarin.com/sociedad/video-gesto-oso-melero-recibir-agua-ambientalista-corrientes_0_lZDTPYWWBh.html,https://images.clarin.com/2022/02/23/YyCml6Y-v_720x0__1.jpg
18,80JYmtQARq,Especial Clarín. 10 años de la tragedia de Once: la vida después del horror y los culpables fuera de la cárcel,https://www.clarin.com/ciudades/10-anos-tragedia-once-vida-despues-horror-culpables-libres_0_80JYmtQARq.html,https://images.clarin.com/2022/02/21/xafz_m1GM_720x0__1.jpg
19,vwIsKsVs3,"Entrevista con Clarín. Tagliabúe, el goleador que es una celebridad en Medio Oriente y quiere jugar el Mundial",https://www.clarin.com/deportes/sebastian-tagliabue-goleador-celebridad-medio-oriente-quiere-jugar-mundial_0_vwIsKsVs3.html,https://images.clarin.com/2018/09/26/zgvO5n7JV_720x0__1.jpg
20,J6AX7bxXYV,"En el mundo UFC. Cobró fama con el Pollo Vignolo, dejó todo y ahora brilla en Miami ",https://www.clarin.com/deportes/polideportivo/cobro-fama-pollo-vignolo-relato-copa-libertadores-dejo-miami-ahora-brilla-mundo-ufc_0_J6AX7bxXYV.html,https://images.clarin.com/2022/02/21/6Bo1FXNrP_720x0__1.jpg
21,3JxqGAogr4,Contundente. Santiago Maratea le respondió con todo al cantante de La Mancha de Rolando,https://www.clarin.com/fama/santiago-maratea-respondio-cantante-mancha-rolando-bobo-_0_3JxqGAogr4.html,https://images.clarin.com/2022/02/22/F9AqGymkQ_720x0__1.jpg
22,yjurU8EkdP,"Seguridad vial. ""Pisacolas"" en autopistas: una mala costumbre que crece y causa 9 de cada 10 choques",https://www.clarin.com/ciudades/-pisacolas-autopistas-mala-costumbre-crece-causa-9-10-choques_0_yjurU8EkdP.html,https://images.clarin.com/2022/02/22/rRIsZvH8m_1256x620__2.jpg#1645552492564
23,nzGwEIN27e,"Logro inédito. Un nadador cruzó el lago Nahuel Huapi, ida y vuelta, sin protección térmica",https://www.clarin.com/sociedad/nadador-cruzo-lago-nahuel-huapi-ida-vuelta-proteccion-termica_0_nzGwEIN27e.html,https://images.clarin.com/2022/02/23/GqoUiCUmL_720x0__1.jpg
24,ZhkTSpDmVP,"Detrás del mito. Julia Pastrana: la breve y triste historia de ""la mujer más fea del mundo""",https://www.clarin.com/internacional/julia-pastrana-breve-triste-historia-mujer-fea-mundo-_0_ZhkTSpDmVP.html,https://images.clarin.com/2022/02/22/og8WCfnxU_720x0__1.jpg
25,KE5OSSyhvj,Negociación de la deuda. Interna en el Gobierno por el FMI: la respuesta de Economía ante las presiones y filtraciones K,https://www.clarin.com/politica/interna-fmi-respuesta-economia-presiones-filtraciones-kirchnerismo_0_KE5OSSyhvj.html,https://images.clarin.com/2022/02/13/JwBMh-fMG_720x0__1.jpg
26,rmtMjJmlV6,"Escala el conflicto. Biden condenó la ""invasión"" a Ucrania y anunció sanciones contra Rusia junto a Europa",https://www.clarin.com/mundo/sanciones-ee-uu-rusia-bancos-empresas-puerta-abierta-dialogo_0_rmtMjJmlV6.html,https://images.clarin.com/2022/02/22/t5Dov5bXc_720x0__1.jpg
27,SCQg02el4G,Minuto a minuto. El Consejo de Seguridad ucraniano pide instaurar el estado de emergencia,https://www.clarin.com/mundo/conflicto-rusia-ucrania-vivo-consejo-seguridad-ucraniano-pide-instaure-emergencia_0_SCQg02el4G.html,https://images.clarin.com/2022/02/23/_3nC4jS63_720x0__1.jpg
28,CUuwWCuVFQ,Irá hoy. Incendios en Corrientes: Cabandié deberá dar explicaciones en el Senado,https://www.clarin.com/politica/incendios-corrientes-medio-cruces-ministro-juan-cabandie-debera-dar-explicaciones-senado_0_CUuwWCuVFQ.html,https://images.clarin.com/2022/02/19/7dwuA3iob_720x0__1.jpg
29,VnZMiPPDId,Duda frecuente. Adelgazar a medida que pasan los años: ¿se puede pesar lo mismo a los 50 que a los 20?,https://www.clarin.com/buena-vida/adelgazar-medida-pasan-anos-puede-pesar-mismo-50-anos-20-_0_VnZMiPPDId.html,https://images.clarin.com/2022/02/22/s4fgRG-4N_720x0__1.jpg
30,NphEF3RnDe,Del editor. El enigma interminable de la droga envenenada,https://www.clarin.com/opinion/enigma-interminable-droga-envenenada_0_NphEF3RnDe.html,https://images.clarin.com/2022/02/11/jweU7pJ1l_720x0__1.jpg
31,2y6gHubb18,Interna opositora para 2023. Larreta sumó otro gesto de Miguel Pichetto y le quitó una aliada a Patricia Bullrich,https://www.clarin.com/politica/cara-2023-rodriguez-larreta-sumo-gesto-miguel-pichetto-quito-aliada-patricia-bullrich_0_2y6gHubb18.html,https://images.clarin.com/2022/02/22/5b728jDDf_720x0__1.jpg
32,t1GruFafJD,Desde Miami. Rocío Marengo rompió el silencio y explicó por qué no estuvo en el entierro de Gustavo Martínez,https://www.clarin.com/fama/rocio-marengo-rompio-silencio-explico-entierro-gustavo-martinez_0_t1GruFafJD.html,https://images.clarin.com/2021/10/07/rbTauK1BX_720x0__1.jpg
33,ORoVaayawV,"Tensión al aire. Una mujer irrumpió en el estudio de ""América Noticias"" y debieron cortar la transmisión",https://www.clarin.com/fama/mujer-irrumpio-estudio-america-noticias-cortaron-transmision_0_ORoVaayawV.html,https://images.clarin.com/2022/02/22/QVDtpXt7a_720x0__1.jpg
34,uPn4iXIHoh,Caso cerrado. Axel reveló el tormento que vivió tras la denuncia por abuso sexual,https://www.clarin.com/fama/axel-revelo-tormento-vivio-denuncia-abuso-sexual_0_uPn4iXIHoh.html,https://images.clarin.com/2022/02/22/8n-dVjRRa_720x0__1.jpg
35,jb3XxGm23c,"Pura felicidad. Tras la ola de rumores, Luisana Lopilato confirmó que está embarazada de su cuarto hijo",https://www.clarin.com/fama/luisana-lopilato-confirmo-embarazada-cuarto-hijo_0_jb3XxGm23c.html,https://images.clarin.com/2022/02/22/8-BRS0ocB_720x0__1.jpg
36,98KGVF83SI,Tips útiles. Códigos QR: 7 consejos para utilizarlos de forma segura y no ser estafado,https://www.clarin.com/servicios/codigos-qr-7-consejos-utilizarlos-manera-segura-estafado_0_98KGVF83SI.html,https://images.clarin.com/2021/11/30/zskuo2zlj_720x0__1.jpg
37,A8wNfLd9aJ,Dónde comprarlos. La nueva obsesión del mundo cripto: qué son los cubos de tungsteno,https://www.clarin.com/tecnologia/nueva-obsesion-mundo-cripto-cubos-tungsteno-comprarlos-argentina_0_A8wNfLd9aJ.html,https://images.clarin.com/2022/02/21/Pt72LW4pr_720x0__1.jpg
38,5VpEK8edyo,Adelanto de Clarín. La pelea por el 2023: qué dice la última encuesta que encargó Larreta,https://www.clarin.com/politica/pelea-2023-dice-ultima-encuesta-encargo-horacio-rodriguez-larreta_0_5VpEK8edyo.html,https://images.clarin.com/2022/02/21/FDd7uTu-K_720x0__1.jpg
39,vjUNYFdNZo,"Historias. Caso Epstein: suicidios, dolor y vergüenza, puntos en común del escándalo de pedofilia",https://www.clarin.com/mundo/caso-epstein-suicidios-verguenza-dolor-denominadores-comunes-escandalo-pedofilia_0_vjUNYFdNZo.html,https://images.clarin.com/2021/12/09/zZqHe8BMA_720x0__1.jpg
40,xTsxkqCMmb,Aprender a financiarse. Tarjeta de crédito: los 5 errores que hay que evitar y que pueden arruinar el bolsillo,https://www.clarin.com/servicios/tarjeta-credito-5-errores-evitar-usarla-pueden-arruinarte-bolsillo_0_xTsxkqCMmb.html,https://images.clarin.com/2020/11/24/8rfjRuDIU_720x0__1.jpg
41,xVDwNStxia,Policiales. A tres años de la muerte de Natacha Jaitt: habla el último amigo que la vio con vida,https://www.clarin.com/policiales/anos-muerte-natacha-jaitt-habla-ultimo-amigo-vio-vida_0_xVDwNStxia.html,https://images.clarin.com/2022/02/11/EgPOXPI-T_720x0__1.jpg
42,SoZr8JwDdO,Sociedad. Mundo carnicería: el corte premium y los 10 secretos de un negocio que se reinventa,https://www.clarin.com/sociedad/mundo-carniceria-corte-premium-10-secretos-negocio-reinventa_0_SoZr8JwDdO.html,https://images.clarin.com/2022/01/28/u2yb-Md7V_720x0__1.jpg
43,39kfvq4CeI,"Mundo. El infierno de los abusos sexuales en la Iglesia, en primera persona",https://www.clarin.com/mundo/infierno-abusos-sexuales-iglesia-espana-primera-persona_0_39kfvq4CeI.html,https://images.clarin.com/2022/02/08/tDCNKeXAH_720x0__1.jpg
44,Ye7hLgfiBO,Policiales. Bodas de sangre: la historia secreta detrás del triple crimen narco de Rosario,https://www.clarin.com/policiales/bodas-sangre-historia-secreta-detras-triple-crimen-narco-rosario_0_Ye7hLgfiBO.html,https://images.clarin.com/2022/02/04/jgZ1OPKRT_720x0__1.jpg
45,C8AVcMFlqP,Copa de la Liga Profesional. Racing se desbloqueó a puro golazo ante Argentinos y consiguió su primer triunfo,https://www.clarin.com/deportes/racing-vs-argentinos-juniors-copa-liga-se-desbloqueo-a-puro-gol_0_C8AVcMFlqP.html,https://images.clarin.com/2022/02/22/fXDb3reuH_720x0__1.jpg
46,lnFo35JNzB,"Países Bajos. El doble gesto del Ajax con Nouri, la joven promesa que sufrió daños cerebrales",https://www.clarin.com/deportes/doble-gesto-ajax-nouri-joven-promesa-sufrio-danos-graves-descompensarse-pretemporada_0_lnFo35JNzB.html,https://images.clarin.com/2022/02/22/V7b8utzbO_720x0__1.jpg
47,TQrHN2sVbk,El 29 de marzo. Argentina evitará la altura de Quito para visitar a Ecuador por Eliminatorias,https://www.clarin.com/deportes/argentina-evitara-altura-quito-visitar-ecuador-eliminatorias_0_TQrHN2sVbk.html,https://images.clarin.com/2021/10/08/cdos7TA3y_720x0__1.jpg
48,dIpzMATWry,"Champions League. Simeone enfrenta a Cristiano Ronaldo, la peor pesadilla de su Atlético de Madrid",https://www.clarin.com/deportes/champions-league-cholo-simeone-enfrenta-cristiano-ronaldo-peor-pesadilla-atletico-madrid_0_dIpzMATWry.html,https://images.clarin.com/2022/02/22/x55-opS3Q_720x0__1.jpg
49,sIMKnxSfvP,"Champions League. Villarreal y la Juve, serie abierta: del récord de Vlahovic a la conducción de Lo Celso",https://www.clarin.com/deportes/villarreal-vs-juventus-champions-league-previa-alineaciones-directo_0_sIMKnxSfvP.html,https://images.clarin.com/2022/02/22/1XkdrATPk_720x0__1.jpg
50,,Vuelve un clásico. Ya podés armar tu equipo de Gran DT: arranca a partir de la fecha 4,,
51,IbMsY2P7Z0,La deuda. El acuerdo con el FMI incluye más ajustes que los que anunció el Gobierno,https://www.clarin.com/economia/fmi-kirchnerismo-filtra-borrador-acuerdo-recta-final-negociacion_0_IbMsY2P7Z0.html,https://images.clarin.com/2021/12/04/VoAwyZj6l_720x0__1.jpg
52,ITLFRrcAXy,Inflación. Crean un fondo para controlar saltos estacionales en precios de verduras,https://www.clarin.com/economia/crean-fondo-controlar-saltos-estacionales-precios-verduras_0_ITLFRrcAXy.html,https://images.clarin.com/2022/02/22/L4XmY_5-7_720x0__1.jpg
53,Hrvb7WYCC3,Incendios en Corrientes. El fuego destruyó el sueño de una familia y organizaron una rifa que tuvo gran repercusión,https://www.clarin.com/rural/incendios-corrientes-fuego-destruyo-sueno-familia-organizaron-rifa-gran-repercusion_0_Hrvb7WYCC3.html,https://images.clarin.com/2022/02/23/PuS0rmqfN_720x0__1.jpg
54,25phRvXvst,Finanzas y mercados. Mercado Libre mejoró sus ingresos y su acción rebotó 10% después del cierre,https://www.clarin.com/economia/mercado-libre-mejoro-ingresos-accion-reboto-10-despues-cierre_0_25phRvXvst.html,https://images.clarin.com/2021/12/14/8TbXp1h_D_720x0__1.jpg
55,eq0f5NBJlR,Lo que se viene. 10 tendencias del comercio electrónico para 2022,https://www.clarin.com/economia/viene-10-tendencias-comercio-electronico-2022_0_eq0f5NBJlR.html,https://images.clarin.com/2020/11/24/8rfjRuDIU_720x0__1.jpg
56,V0yIhA6hde,"Reclamos. Las garrafas de gas argentinas, entre las más baratas de la región",https://www.clarin.com/economia/garrafas-gas-argentinas-baratas-region_0_V0yIhA6hde.html,https://images.clarin.com/2019/10/20/L56CkndY_720x0__1.jpg
57,o7FWlrPeLz,Cuenta regresiva. Los mapas y 10 preguntas para entender por qué puede estallar la guerra,https://www.clarin.com/mundo/conflicto-rusia-ucrania-mapas-10-preguntas-entender-puede-estallar-guerra_0_o7FWlrPeLz.html,https://images.clarin.com/2022/01/21/OFwRbM7SD_720x0__1.jpg
58,sNETCJ4Z6P,"En foco. En formato perder-perder, Vladimir Putin repite los errores con Ucrania",https://www.clarin.com/mundo/vladimir-putin-formato-perder-perder-repite-errores-ucrania_0_sNETCJ4Z6P.html,https://images.clarin.com/2022/02/21/PmLEZZk0h_720x0__1.jpg
59,BfLWCYxX96,"Sensación en las redes. Philip Crowther, el cronista que se hizo viral por cubrir el conflicto en seis idiomas",https://www.clarin.com/mundo/philip-crowther-cronista-luxemburgo-cubre-idiomas-conflicto-ucrania_0_BfLWCYxX96.html,https://images.clarin.com/2022/02/22/URGhTGaBx_720x0__1.jpg
60,efWWt73I3k,Crisis ucraniana. Esta es la guerra de Putin. Pero EE.UU. y la OTAN no son espectadores inocentes,https://www.clarin.com/mundo/guerra-putin-unidos-otan-espectadores-inocentes_0_efWWt73I3k.html,https://images.clarin.com/2021/12/23/TRIJd1xOx_720x0__1.jpg
