n,id,title,url,image
94,wzNsiP7Xm,"La historia de Erik Finman. Su abuela le dio US$ 1.000 a los 12, los invirtió en bitcoin y hoy es millonario",https://www.clarin.com/tecnologia/abuela-regalo-mil-dolares-cumplio-12-anos-invirtio-bitcoin-hoy-millonario_0_wzNsiP7Xm.html,https://images.clarin.com/2021/07/17/kzwgeJsfW_720x0__1.jpg
95,sZz9U8Vnd,Sexualidad. Tres juguetes eróticos innovadores para probar en pareja,https://www.clarin.com/relaciones/3-juguetes-eroticos-innovadores-para-probar-en-pareja_0_sZz9U8Vnd.html,https://images.clarin.com/2021/07/15/ayRD91tha_1256x620__2.jpg#1626393257968
96,5FMmNjRjl,"Medida del COI. Camas ""anti sexo"" en los Juegos Olímpicos: cómo impacta esta prohibición",https://www.clarin.com/relaciones/camas-anti-sexo-juegos-olimpicos-impacta-prohibicion_0_5FMmNjRjl.html,https://images.clarin.com/2021/06/20/TvP-hxtYi_720x0__1.jpg
97,s-pd52PDT,Modelos y precios. Todo lo que hay que saber para instalar cámaras de seguridad en casa,https://www.clarin.com/tecnologia/camaras-vigilancia-ultima-generacion-5-mejores-modelos-reforzar-seguridad-casa_0_s-pd52PDT.html,https://images.clarin.com/2021/07/14/kfQ6ZzR_d_720x0__1.jpg
98,WIdGW_irp,"Donald Sutherland. Fue Homero Simpson, Cristo y casi muere filmando con Clint Eastwood",https://www.clarin.com/espectaculos/cine/donald-sutherland-homer-simpson-pelicula-cristo-muere-filmando-clint-eastwood_0_WIdGW_irp.html,https://images.clarin.com/2021/07/16/5UFuF0gQw_720x0__1.jpg
99,nVoxNaxKm,Festival de Cannes. Histórico: una película dirigida por una mujer gana la Palma de Oro,https://www.clarin.com/espectaculos/cine/segunda-vez-historia-filme-dirigido-mujer-gana-palma-oro_0_nVoxNaxKm.html,https://images.clarin.com/2021/07/17/l7hZfN3j8_720x0__1.jpg
