n,id,title,url,image
1,xt-yObnF1,"La interna opositora. Tras lanzar su candidatura en Provincia, Manes busca sumar a Stolbizer, Monzó y Jorge Macri",https://www.clarin.com/politica/lanzar-candidatura-facundo-manes-busca-sumar-stolbizer-monzo-jorge-macri_0_xt-yObnF1.html,https://images.clarin.com/2021/07/03/K2XjEd2ac_720x0__1.jpg
2,B1XQv2FLE,Humor político. Todos los zombies del Presidente,https://www.clarin.com/opinion/zombies-presidente_0_B1XQv2FLE.html,https://images.clarin.com/2019/09/18/UazSmQ4Gy_720x0__1.jpg
3,asr1O2j1E,Trama política. Alberto entrega una caja a Cristina,https://www.clarin.com/opinion/alberto-entrega-caja-cristina_0_asr1O2j1E.html,https://images.clarin.com/2021/07/01/mq2-hUhuG_1256x620__4.jpg#1625358800950
4,h4-ygxJY7,"Del editor. Contradicciones de Cristina, con Macri en el Mediterráneo",https://www.clarin.com/opinion/contradicciones-cristina-macri-mediterraneo_0_h4-ygxJY7.html,https://images.clarin.com/2019/12/11/o7N0SU6J_720x0__1.jpg
5,g-ibcYANt,3-0 a Ecuador. Argentina goleó en otra noche mágica de Leo Messi ,https://www.clarin.com/deportes/contundencia-plan-juego-messi-enorme-vez-argentina-goleo-ecuador-semifinales-copa-america_0_g-ibcYANt.html,https://images.clarin.com/2021/07/04/nuLslOHJW_1256x620__2.jpg#1625368269092
6,5w-CfqIQz,Copa América. Así quedaron las semis: el rival argentino y el camino a la gran final,https://www.clarin.com/deportes/quedaron-semifinales-copa-america-rival-argentina-camino-definicion-maracana_0_5w-CfqIQz.html,https://images.clarin.com/2021/07/03/RfGwxCgmr_1256x620__2.jpg#1625365229043
7,8QS2OzI00,"Análisis. El 1x1: Messi, otra vez figura, buenos ingresos y una floja defensa",https://www.clarin.com/deportes/1x1-seleccion-argentina-ecuador-messi-vez-figura-buenos-ingresos-floja-defensa_0_8QS2OzI00.html,https://images.clarin.com/2021/07/04/9vhCWcGVy_720x0__1.jpg
8,oluCFm_tX,"Opinión. Por cómo veo al grupo, me juego con que la Selección está para campeón",https://www.clarin.com/deportes/veo-grupo-juego-seleccion-campeon-copa-america_0_oluCFm_tX.html,https://images.clarin.com/2018/11/14/v1UQKzE9g_720x0__1.jpg
9,lwV939Rd7,Derrumbe en Miami. Hallan el cuerpo de la fotógrafa argentina entre los escombros del edificio,https://www.clarin.com/mundo/hallan-cuerpo-fotografa-argentina-escombros-miami_0_lwV939Rd7.html,https://images.clarin.com/2021/07/03/N8DNMhcgm_720x0__1.jpg
10,TAWlK6AIM,"Apuesta al 2023. Patricia Bullrich no se postulará: ""Para esta elección no soy imprescindible""",https://www.clarin.com/politica/patricia-bullrich-confirmo-candidata-diputada-ciudad-buenos-aires_0_TAWlK6AIM.html,https://images.clarin.com/2021/07/02/D7zfeAR4p_720x0__1.jpg
11,7i8KSfB6t,Pujas en JxC. Los mensajes de Larreta y Vidal a Bullrich tras bajarse de la interna porteña,https://www.clarin.com/politica/mensajes-maria-eugenia-vidal-horacio-rodriguez-larreta-renuncia-patricia-bullrich-competir-interna_0_7i8KSfB6t.html,https://images.clarin.com/2021/06/08/DAcqUbXb2_720x0__1.jpg
12,vUSYL7IZS,"Contámelo otra vez. Fue 30 años al mismo boliche, lo van a tirar abajo y se quedó sin baile",https://www.clarin.com/sociedad/st-thomas-kravi-30-anos-mismo-boliche-van-tirar-abajo-quedo-baile_0_vUSYL7IZS.html,https://images.clarin.com/2021/07/03/tDStMJpmC_1256x620__2.jpg#1625336727425
13,ZW5Qz7MWZ,Rinden como una notebook. Cuáles son las mejores tablets del mercado,https://www.clarin.com/tecnologia/cuestan-mitad-notebook-dan-mismo-rendimiento-mejores-tablets-mercado_0_ZW5Qz7MWZ.html,https://images.clarin.com/2021/07/01/GTSNKgiTI_720x0__1.jpg
14,s7Z62T6iD,Última zona de hielo. El Ártico resiste menos el calentamiento global,https://www.clarin.com/new-york-times-international-weekly/ultima-zona-hielo-artico-resiste-calentamiento-global_0_s7Z62T6iD.html,https://images.clarin.com/2021/07/02/vAiKjWsKP_1256x620__2.jpg#1625243366879
15,ZF1zpJrZa,Evolución. Sicilia tuvo alguna vez elefantes enanos,https://www.clarin.com/new-york-times-international-weekly/sicilia-alguna-vez-elefantes-enanos_0_ZF1zpJrZa.html,https://images.clarin.com/2021/07/02/oQ2PAv_vI_1256x620__2.jpg#1625237354936
16,eIZoSRn8m,Informe internacional. Los bloqueos de la pandemia ayudaron a los depredadores,https://www.clarin.com/new-york-times-international-weekly/bloqueos-pandemia-ayudaron-depredadores-mundo_0_eIZoSRn8m.html,https://images.clarin.com/2021/07/02/e2tW1NGO2_1256x620__2.jpg#1625235273622
17,sIm92uySZ,Hace 20.000 años. Cómo nos marcó una epidemia de coronavirus,https://www.clarin.com/new-york-times-international-weekly/marco-epidemia-coronavirus-hace-20-000-anos_0_sIm92uySZ.html,https://images.clarin.com/2021/06/29/SedmF_H8R_1256x620__2.jpg#1624972752774
18,xt-yObnF1,"La interna opositora. Tras lanzar su candidatura en Provincia, Manes busca sumar a Stolbizer, Monzó y Jorge Macri",https://www.clarin.com/politica/lanzar-candidatura-facundo-manes-busca-sumar-stolbizer-monzo-jorge-macri_0_xt-yObnF1.html,https://images.clarin.com/2021/07/03/K2XjEd2ac_720x0__1.jpg
19,B1XQv2FLE,Humor político. Todos los zombies del Presidente,https://www.clarin.com/opinion/zombies-presidente_0_B1XQv2FLE.html,https://images.clarin.com/2019/09/18/UazSmQ4Gy_720x0__1.jpg
20,asr1O2j1E,Trama política. Alberto entrega una caja a Cristina,https://www.clarin.com/opinion/alberto-entrega-caja-cristina_0_asr1O2j1E.html,https://images.clarin.com/2021/07/01/mq2-hUhuG_1256x620__4.jpg#1625358800950
21,h4-ygxJY7,"Del editor. Contradicciones de Cristina, con Macri en el Mediterráneo",https://www.clarin.com/opinion/contradicciones-cristina-macri-mediterraneo_0_h4-ygxJY7.html,https://images.clarin.com/2019/12/11/o7N0SU6J_720x0__1.jpg
22,g-ibcYANt,3-0 a Ecuador. Argentina goleó en otra noche mágica de Leo Messi ,https://www.clarin.com/deportes/contundencia-plan-juego-messi-enorme-vez-argentina-goleo-ecuador-semifinales-copa-america_0_g-ibcYANt.html,https://images.clarin.com/2021/07/04/nuLslOHJW_1256x620__2.jpg#1625368269092
23,5w-CfqIQz,Copa América. Así quedaron las semis: el rival argentino y el camino a la gran final,https://www.clarin.com/deportes/quedaron-semifinales-copa-america-rival-argentina-camino-definicion-maracana_0_5w-CfqIQz.html,https://images.clarin.com/2021/07/03/RfGwxCgmr_1256x620__2.jpg#1625365229043
24,8QS2OzI00,"Análisis. El 1x1: Messi, otra vez figura, buenos ingresos y una floja defensa",https://www.clarin.com/deportes/1x1-seleccion-argentina-ecuador-messi-vez-figura-buenos-ingresos-floja-defensa_0_8QS2OzI00.html,https://images.clarin.com/2021/07/04/9vhCWcGVy_720x0__1.jpg
25,oluCFm_tX,"Opinión. Por cómo veo al grupo, me juego con que la Selección está para campeón",https://www.clarin.com/deportes/veo-grupo-juego-seleccion-campeon-copa-america_0_oluCFm_tX.html,https://images.clarin.com/2018/11/14/v1UQKzE9g_720x0__1.jpg
26,Yo0zFybFJ,20 AÑOS DE DIFERENCIA. La maldición de Bruce Lee y su hijo:  muertos mientras filmaban películas,https://www.clarin.com/famosos/maldicion-bruce-lee-hijo-brandon-muertos-filmaban-peliculas-20-anos-diferencia_0_Yo0zFybFJ.html,https://images.clarin.com/2021/07/03/vbSV1UGeZ_720x0__1.jpg
27,T-z_f-LXI,Ambiente. Se inauguró un centro de almacenamiento de envases vacíos de fitosanitarios,https://www.clarin.com/rural/inauguro-nuevo-centro-almacenamiento-envases-vacios-fitosanitarios_0_T-z_f-LXI.html,https://images.clarin.com/2021/07/02/U23xzztP__720x0__1.jpg
28,Nph3vUtze,"Boda trágica. Murió minutos antes de casarse, mientras la novia caminaba hacia el altar",https://www.clarin.com/viste/boda-tragica-murio-minutos-casarse-novia-caminaba-altar_0_Nph3vUtze.html,https://images.clarin.com/2021/07/03/qYTTLONk3_720x0__1.jpg
29,VmYlRUJwe,"""Ya era hora"". Se divorció y lo festejó con una banda de música a la salida del registro civil",https://www.clarin.com/viste/-hora-divorcio-festejo-banda-musica-salida-registro-civil_0_VmYlRUJwe.html,https://images.clarin.com/2021/07/02/8Oh4fA6gw_720x0__1.jpg
30,0wNpAHcLn,Maltrato animal. La macabra verdad de uno de los videos más vistos en TikTok,https://www.clarin.com/internacional/macabra-verdad-videos-vistos-tiktok_0_0wNpAHcLn.html,https://images.clarin.com/2021/06/17/kliNJtSo__720x0__1.jpg
31,reW6R0c5z,Inglaterra. Ganaron 200 millones de dólares en la lotería y ahora están en la ruina,https://www.clarin.com/internacional/millonarios-mendigos-ganaron-200-millones-dolares-loteria-ruina_0_reW6R0c5z.html,https://images.clarin.com/2012/08/14/BkXmk12nXl_720x0.jpg
32,bRuFQuWBh,Entrevista con Pablo Semán. Una radiografía sobre el amor sagrado,https://www.clarin.com/revista-n/ideas/radiografia-amor-sagrado_0_bRuFQuWBh.html,https://images.clarin.com/2020/05/22/EiGYYGf4c_1256x620__2.jpg#1625083577261
33,sLZ3YMEqK,Panorama. El teatro se despierta de nuevo,https://www.clarin.com/revista-n/escenarios/teatro-despierta-nuevo_0_sLZ3YMEqK.html,https://images.clarin.com/2021/07/02/MfnprdhBf_720x0__1.jpg
34,ZdJ4bZ9Km,Opinión. Otra medalla oficial espinosa para el escritor Antón Arrufat,https://www.clarin.com/revista-n/ideas/historia/medalla-oficial-espinosa-escritor-anton-arrufat_0_ZdJ4bZ9Km.html,https://images.clarin.com/1969/12/31/SJf2fOT3Qx_1256x620__1.jpg#1625262328260
35,cM52EvPej,"Otro artista arrestado. Hamlet Lavastida, del encierro sanitario a la celda",https://www.clarin.com/revista-n/ideas/historia/artista-cubano-hamlet-lavastida-encierro-sanitario-celda_0_cM52EvPej.html,https://images.clarin.com/2021/06/30/H4FX6Llqp_1256x620__2.jpg#1625261787401
36,6wbOiW4al,Artist Films International. Nuevo auge del cine expandido,https://www.clarin.com/revista-n/arte/videoarte-cine-expandido-proa_0_6wbOiW4al.html,https://images.clarin.com/2021/07/02/8u5iets3h_930x525__2.jpg#1625235934894
37,HSbVKDT2K,García Márquez y el cine. Gabo se sienta en la oscuridad,https://www.clarin.com/revista-n/literatura/gabo-sienta-oscuridad_0_HSbVKDT2K.html,https://images.clarin.com/2019/05/31/R8ICePQ6C_1256x620__2.jpg#1625249455977
38,RDjtnfxH2,Especial forrajes. Dos hermanas que pasaron de la educación a ser contratistas,https://www.clarin.com/rural/educacion-campo-hermanas-revolucionaron-familia-convirtieron-contratistas_0_RDjtnfxH2.html,https://images.clarin.com/2021/07/01/XkZJF6bCY_720x0__1.jpg
39,3R3kCrM9c,"La columna de la semana. Los contratistas forrajeros argentinos, en la vanguardia mundial",https://www.clarin.com/rural/contratistas-forrajeros-argentinos-vanguardia-mundial_0_3R3kCrM9c.html,https://images.clarin.com/2021/04/20/_VUtMQzEA_720x0__1.jpg
40,gYCY4nnoz,Política agroindustrial. La segunda ola estatizadora recalienta la grieta entre el campo y el Gobierno,https://www.clarin.com/rural/segunda-ola-estatizadora-recalienta-grieta-campo-gobierno_0_gYCY4nnoz.html,https://images.clarin.com/2020/05/07/oTUBYMuxL_720x0__1.jpg
41,fjKxjGylj,Especial forrajes. Con la lupa en los costos y apuntando a producir menos kilos,https://www.clarin.com/rural/lupa-costos-apuntando-producir-kilos_0_fjKxjGylj.html,https://images.clarin.com/2020/06/25/sj22vcaFc_720x0__1.jpg
42,TRhUz-7rt,"Santiago Negri. ""Me entusiasma cómo nos vamos acercando al consumidor""",https://www.clarin.com/rural/santiago-negri-entusiasma-hoy-cerca-quieren-consumidores-_0_TRhUz-7rt.html,https://images.clarin.com/2021/07/02/owco3trae_720x0__1.jpg
43,oT3tzXnyT,Análisis. Producción récord de granos y cerdos en la República Popular China,https://www.clarin.com/rural/produccion-record-granos-cerdos-republica-popular-china_0_oT3tzXnyT.html,https://images.clarin.com/2017/03/17/r1YFfTtsl_720x0.jpg
44,CVEstkOSa,Fitito made in Caseros. Un símbolo del progreso social: los 300.000 autos se fabricaron en el Oeste del GBA,https://www.clarin.com/zonales/fitito-simbolo-febrero-empieza-recuperar-presencia_0_CVEstkOSa.html,https://images.clarin.com/2021/06/09/WKFZ6CmEw_720x0__1.jpg
45,txo_cpEPN,Amor al barrio. El mejor hincha: lleva más de la mitad de su vida trabajando gratis en una cancha de la C,https://www.clarin.com/zonales/hincha-lleva-mitad-75-anos-trabajando-gratis-cancha-ituzaingo_0_txo_cpEPN.html,https://images.clarin.com/2021/06/22/Z5qJa3UX4_720x0__1.jpg
46,k7gLFREz0,En el Oeste. Robaron en un colectivo y un delincuente le mordió la mano al chofer,https://www.clarin.com/zonales/robaron-colectivo-obligaron-chofer-detenerse-logro-subir-policia-ladron-mordio-mano_0_k7gLFREz0.html,https://images.clarin.com/2021/06/28/uyUx_iIyS_720x0__1.jpg
47,joOJPZDSO,Percusionista del GBA. El músico del grupo Sombra que lucha en la primera línea,https://www.clarin.com/zonales/tumbadoras-grupo-sombras-frente-batalla-pandemia-matanza_0_joOJPZDSO.html,https://images.clarin.com/2021/06/25/EalyJo2i0_720x0__1.jpg
48,Y_wa7lMBd,En Ramos Mejía. Insólita ola de robos: sacan canillas de los frentes e inundan veredas,https://www.clarin.com/zonales/insolita-ola-robos-ramos-mejia-sacan-canillas-frentes-casas-inundan-veredas_0_Y_wa7lMBd.html,https://images.clarin.com/2021/06/25/8Onr4k2nv_720x0__1.jpg
49,ZYOOZtIsM,Volvió el tranvía de Caballito. Un viaje a mediados del siglo XX desde un presente de pandemia,https://www.clarin.com/ciudades/volvio-tranvia-caballito-viaje-mediados-siglo-xx-presente-pandemia_0_ZYOOZtIsM.html,https://images.clarin.com/2021/07/03/B14zDVjAlf_720x0__1.jpg
50,iIk0kKkI4,Mano a mano con Clarín. Scarlett Johansson cuenta la increíble conexión argentina,https://www.clarin.com/espectaculos/cine/black-widow-scarlett-johansson-increible-conexion-argentina_0_iIk0kKkI4.html,https://images.clarin.com/2021/07/03/DXM5IVp3__720x0__1.jpg
51,C_qldeTIB,"""Infelicidad Covid"". La gente está menos feliz que en 2020 y casi la mitad no se siente satisfecha",https://www.clarin.com/sociedad/gente-feliz-2020-mitad-siente-satisfecha-vida_0_C_qldeTIB.html,https://images.clarin.com/2021/07/02/maqRQrtij_1256x620__2.jpg#1625342441957
52,cg4mBRzi6,Balas por rating. El periodista que asesinaba para dar la primicia en su programa,https://www.clarin.com/internacional/balas-rating-historia-periodista-asesinaba-dar-primicia-programa_0_cg4mBRzi6.html,https://images.clarin.com/2021/06/30/DCxkIbaKy_1256x620__2.jpg#1625055134225
53,I1uWQbTQh,A 455 años de su muerte. Nostradamus: sus grandes profecías y qué predijo para el 2021,https://www.clarin.com/internacional/nostradamus-455-anos-muerte-predijo-2021-grandes-profecias_0_I1uWQbTQh.html,https://images.clarin.com/2021/07/02/HBgVNHDDO_720x0__1.jpg
54,5g5EKSgJT,Dame fuego. Sexo y zodiaco: los 6 signos más fogosos,https://www.clarin.com/astrologia/sexo-zodiaco-6-signos-fogosos_0_5g5EKSgJT.html,https://images.clarin.com/2021/07/02/Evect1AYA_720x0__1.jpg
55,zi7eCKAbC,"Tiene 22 años. Le donaron US$ 170 mil para una nueva casa, pero se compró un Mercedes Benz ",https://www.clarin.com/internacional/donaron-170-mil-dolares-nueva-vivienda-compro-mercedes-benz-clase_0_zi7eCKAbC.html,https://images.clarin.com/2021/07/03/PVgKou3ez_720x0__1.jpg
56,9ThaTL2qb,"Un género recargado. ""True crime"": el boom de los documentales policiales sobre casos reales",https://www.clarin.com/revista-n/sabuesos-asesinos-seriales-true-crime-podcast_0_9ThaTL2qb.html,https://images.clarin.com/2021/07/02/psN1Y7Mbk_1256x620__2.jpg#1625258704067
57,XNuEnnURE,Mundos íntimos.  Cómo la renovación de una mesa unió a mi familia,https://www.clarin.com/sociedad/mundos-intimos-renovar-propias-manos-mesa-casa-unio-familia-dio-esperanzas-construimos-futuro_0_XNuEnnURE.html,https://images.clarin.com/2021/07/01/MS1LvpdJG_1256x620__2.jpg#1625168799964
58,jZKYnXUDw,"Asistidor y goleador. Habló Messi: ""Necesitamos un paso más para estar en esa deseada final""",https://www.clarin.com/deportes/messi-necesitamos-paso-deseada-final-_0_jZKYnXUDw.html,https://images.clarin.com/2021/07/04/ipl03vzpP_720x0__1.jpg
59,eVC5EtYQS,"Ecos de la victoria. Lautaro y Nico González: ""Todos seguimos a Messi y queremos darle una alegría""",https://www.clarin.com/deportes/lautaro-martinez-nicolas-gonzalez-vencer-ecuador-pasar-semi-copa-america-seguimos-messi-queremos-darle-alegria-_0_eVC5EtYQS.html,https://images.clarin.com/2021/07/04/eX1gax40T_720x0__1.jpg
60,Squ9MpJr6,"Una de las claves. De Paul, símbolo de la renovación y primer grito de Selección",https://www.clarin.com/deportes/rodrigo-paul-simbolo-renovacion-primer-grito-seleccion_0_Squ9MpJr6.html,https://images.clarin.com/2021/07/04/EDU0MFXQC_720x0__1.jpg
61,OIOliww0S,Copa América.  Colombia fue más en los penales y eliminó al Uruguay de Suárez y Cavani,https://www.clarin.com/deportes/uruguay-vs-colombia-copa-america-previa-alineaciones-directo_0_OIOliww0S.html,https://images.clarin.com/2021/07/03/Xw1CaFpO3_720x0__1.jpg
62,LNV0gJpmB,"La recta final. Con tres poderosos y un cuento de hadas, así serán las semis de la Eurocopa",https://www.clarin.com/deportes/sigue-eurocopa-2020-italia-espana-dinamarca-inglaterra-poderosos-cuento-hadas-semifinales_0_LNV0gJpmB.html,https://images.clarin.com/2021/07/03/7YDLJ3NqE_1256x620__2.jpg#1625345666124
63,Ve4ZxoDu6,Debut en el año. Los Pumas sumaron un triunfo ante Rumania y algunas preocupaciones ,https://www.clarin.com/deportes/rugby-pumas-miden-rumania-primer-partido-ano_0_Ve4ZxoDu6.html,https://images.clarin.com/2021/07/03/RRhy-RJ_6_720x0__1.jpg
64,tKBgpW4dG,Fue en 1993. La pelea que tuvo que pararse por un paracaidista que cayó en el ring,https://www.clarin.com/deportes/riddick-bowe-vs-evander-holyfield-ii-pelea-21-minutos-detenida-culpa-paracaidista-hizo-temblar-vegas_0_tKBgpW4dG.html,https://images.clarin.com/2021/06/30/J7Prs2dcm_1256x620__2.jpg#1625095067838
65,CtFG2JXVR,NBA. Milwaukee Bucks eliminó a Atlanta Hawks y jugará la final ante Phoenix Suns,https://www.clarin.com/deportes/bucks-eliminan-hawks-definiran-final-suns_0_CtFG2JXVR.html,https://images.clarin.com/2021/07/04/dBaFo71o0_720x0__1.jpg
66,BTKJDTGnX,El escenario político. Nueva encuesta en el GBA de una consultora que mide para el Gobierno,https://www.clarin.com/politica/nueva-encuesta-gba-consultoras-mide-gobierno_0_BTKJDTGnX.html,https://images.clarin.com/2021/05/04/JMILqEJJ0_720x0__1.jpg
67,PpzSIkA-w,Foco Económico. Un sondeo preocupa al Gobierno: el humor social no le alcanza con la vacuna ,https://www.clarin.com/economia/encuesta-oficialista-revela-humor-social-alcanza-vacuna_0_PpzSIkA-w.html,https://images.clarin.com/2021/07/01/mq2-hUhuG_720x0__1.jpg
68,30Tc9EQHz,"Por WhatsApp. Una ""amiga"" les ofreció comprar dólares, pero las estafaron en $ 300 mil",https://www.clarin.com/policiales/amiga-mando-whatsapp-ofrecio-comprar-dolares-estafa-robaron-300-000_0_30Tc9EQHz.html,https://images.clarin.com/2021/01/19/dDlfREGS8_720x0__1.jpg
69,Tqto537pL,Berazategui. Hallan muerto en un auto incendiado al presidente del Consejo Escolar,https://www.clarin.com/policiales/misterio-berazategui-encuentran-muerto-dentro-auto-incendiado-presidente-consejo-escolar_0_Tqto537pL.html,https://images.clarin.com/2021/07/03/SqQ6tstPE_720x0__1.jpg
70,vAKMoye31,"Venezuela. Juan Guaidó cruzó a Alberto F.: ""Están desapareciendo los seres humanos""",https://www.clarin.com/politica/juan-guaido-cruzo-alberto-fernandez-desapareciendo-seres-humanos-_0_vAKMoye31.html,https://images.clarin.com/2021/05/27/i9qFJADgE_720x0__1.jpg
71,FNrtYk7ty,"Fuego amigo. Sergio Berni: ""El Presidente pide mi renuncia todos los días""",https://www.clarin.com/politica/sergio-berni-presidente-pide-renuncia-dias-_0_FNrtYk7ty.html,https://images.clarin.com/2021/06/05/2bw5p5mvy_1256x620__2.jpg#1625326311439
72,BBFRc49_F,"Gran Bretaña. ""Horrenda"": los críticos destrozan la nueva estatua en homenaje a Lady Di",https://www.clarin.com/mundo/-horrenda-kitsch-pasada-moda-criticos-destrozan-nueva-estatua-homenaje-lady-di_0_BBFRc49_F.html,https://images.clarin.com/2021/07/02/R2wFMBiRF_720x0__1.jpg
73,FvO5z21cN,Patrocinado. Por qué las teorías políticas occidentales no pueden explicar el éxito del PCCh,https://www.clarin.com/brandstudio/teorias-politicas-occidentales-pueden-explicar-exito-pcch_0_FvO5z21cN.html,https://images.clarin.com/2021/06/30/pAn7hun42_720x0__1.jpg
74,3tO1KuZxz,Ciberdelincuentes. Atacaron 200 proveedores de internet en EE.UU.: más de mil empresas afectadas,https://www.clarin.com/tecnologia/ciberdelincuentes-atacaron-200-proveedores-internet-unidos_0_3tO1KuZxz.html,https://images.clarin.com/2021/07/03/taOxuNz5G_720x0__1.jpg
75,4WTpESt7-,Gourmet. Milanesas gigantes: nueve lugares para los que aman las porciones XL,https://www.clarin.com/gourmet/milanesas-gigantes-recargadas-9-lugares-fanaticos-porciones-xl_0_4WTpESt7-.html,https://images.clarin.com/2021/07/01/A_zFCNRa1_720x0__1.jpg
76,wF3J4g3FO,Tenía 41 años . Se ahogó y nadie puede acceder a sus US$ 2 mil millones en criptomonedas,https://www.clarin.com/tecnologia/ahogo-multimillonario-nadie-puede-acceder-2-mil-millones-dolares-criptomonedas_0_wF3J4g3FO.html,https://images.clarin.com/2021/07/02/yv-YXNTuH_720x0__1.jpg
77,sDPxshjPQ,"El sabor de lo prohibido. ""Empezamos como amantes y hoy somos pareja"": la vida después del triángulo amoroso",https://www.clarin.com/relaciones/-empezamos-amantes-hoy-pareja-vida-despues-triangulo-amoroso_0_sDPxshjPQ.html,https://images.clarin.com/2021/07/01/uqh_BvUIK_720x0__1.jpg
78,gII5uCN4M,"Coronavirus. Respuestas a sus preguntas: dudan en vacunarse, pero no son antivacunas",https://www.clarin.com/buena-vida/antivacunas-dudan-vacunarse-covid-respuestas-temores_0_gII5uCN4M.html,https://images.clarin.com/2021/07/02/raief-DJT_720x0__1.jpg
79,lpYFrlZqg,Tendencia. Estatuas que bailan y miles de seguidores: los museos se subieron a TikTok,https://www.clarin.com/cultura/estatuas-bailan-miles-seguidores-museos-subieron-tiktok_0_lpYFrlZqg.html,https://images.clarin.com/2021/07/03/C3XxVM9rE_720x0__1.jpg
80,u_ZiWqTvC,Problema histórico. Adiós a la pantalla azul de la muerte: cambiará de color en Windows 11,https://www.clarin.com/tecnologia/adios-historica-pantalla-azul-muerte-cambiara-color-windows-11_0_u_ZiWqTvC.html,https://images.clarin.com/2021/07/02/1KUNaHYjz_720x0__1.jpg
81,wa00J_mOd,En la Ciudad. Nombres de nene: los más populares de 2021,https://www.clarin.com/familias/nombres-nene-populares-2021_0_wa00J_mOd.html,https://images.clarin.com/2021/06/17/WXhAPHH-J_720x0__1.jpg
82,qums4iRHZ,"Estuvo en Santa Fe. Carrió confirmó que no será candidata en PBA: ""Mi sacrificio resultaría inútil""",https://www.clarin.com/politica/elisa-carrio-anuncio-candidata-carece-sentido-historico-sacrificio-resultaria-inutil-_0_qums4iRHZ.html,https://images.clarin.com/2020/11/14/3OUMxYlvw7_720x0__1.jpg
83,DTAHuq-Oh,En campaña. La curiosa foto de Facundo Manes que compartió Gerardo Morales,https://www.clarin.com/politica/curiosa-foto-facundo-manes-compartio-gerardo-morales-lanzamiento-candidatura-neurocientifico_0_DTAHuq-Oh.html,https://images.clarin.com/2021/07/03/Dsgr4OeuO_1256x620__2.jpg#1625344475154
84,TPcrYMBBB,Coronavirus. Hallan la variable que permite saber cuándo el cuerpo está protegido,https://www.clarin.com/sociedad/identifican-variable-faltaba-determinar-cuerpo-protegido-covid_0_TPcrYMBBB.html,https://images.clarin.com/2021/07/02/kil0JWowC_720x0__1.jpg
85,hYGt0yNxA,Por las restricciones. La odisea de una familia para salir del país e irse a vivir al exterior,https://www.clarin.com/sociedad/odisea-familia-poder-salir-pais-minuto-minuto-travesia-impensada_0_hYGt0yNxA.html,https://images.clarin.com/2021/07/03/YfLIFbJSx_720x0__1.jpg
86,gMv3-E2_V,Por Instagram. El picante mensaje de Neymar para Arturo Vidal tras el tenso Brasil-Chile,https://www.clarin.com/deportes/picante-mensaje-neymar-arturo-vidal-debiles-intentan-mantenerse-pie-fuertes-mantienen-fe-_0_gMv3-E2_V.html,https://images.clarin.com/2021/07/03/YZOcbxPGw_1256x620__2.jpg#1625357742351
87,B8GVaxCgK,San Luis. Guadalupe: el relato de los chicos que vieron cuando se llevaban a la nena,https://www.clarin.com/sociedad/busqueda-guadalupe-relato-chicos-vieron-llevaban-nena_0_B8GVaxCgK.html,https://images.clarin.com/2021/06/29/_uLglDTNP_720x0__1.jpg
88,C-rClDPhN,En Tucumán. La terrible hipótesis que maneja la Justicia sobre la nena desaparecida,https://www.clarin.com/policiales/terrible-hipotesis-maneja-justicia-desaparicion-nena-4-anos-tucuman_0_C-rClDPhN.html,https://images.clarin.com/2021/07/02/vRoWqAN4E_1256x620__3.jpg#1625324285676
89,THWd0iaUi,"""La Pochola"". Amante de su cuerpo y solidaria: quién es la mujer que cayó por extorsionar hombres",https://www.clarin.com/sociedad/amante-cuerpo-solidaria-pochola-mujer-extorsionaba-hombres-publicar-fotos-intimas_0_THWd0iaUi.html,https://images.clarin.com/2021/07/02/PzwtBbKFx_1256x620__2.jpg#1625321718206
