n,id,title,url,image
1,BnjmnzEzU,"Vuelta a la normalidad. La Ciudad anunció el plan para las escuelas: ""Después de vacaciones, la asistencia será obligatoria""",https://www.clarin.com/ciudades/clases-presenciales-ciudad-anuncia-plan-gradual-volver-normalidad_0_BnjmnzEzU.html,https://images.clarin.com/2021/07/19/cCCkQVIk6_1256x620__2.jpg#1626720402654
2,pCCMQiogM,"Clases presenciales. Fecha por fecha, cómo es el programa porteño en colegios y universidades",https://www.clarin.com/ciudades/clases-presenciales-plan-gradual-ciudad-regreso-normalidad-escuelas-universidades_0_pCCMQiogM.html,https://images.clarin.com/2021/07/19/3rsSgM7vU_720x0__1.jpg
3,xD-CHhTubE,"El plan del oficialismo. Mientras sigue la danza de nombres, el Gobierno lanza una campaña de ""rendición de cuentas""",https://www.clarin.com/politica/sigue-danza-nombres-gobierno-lanza-campana-rendicion-cuentas-paso_0_xD-CHhTubE.html,https://images.clarin.com/2021/07/15/ykGuVheh3_720x0__1.jpg
4,OBI201ElL,"Juntos por el Cambio. Santilli-Manes: interna, pedidos de renuncia y la fórmula ""imposible""",https://www.clarin.com/politica/interna-santilli-manes-provincia-pedidos-renuncia-formula-imposible-repartira-lugares-lista-final_0_OBI201ElL.html,https://images.clarin.com/2021/07/18/KIo84Xztl_1256x620__2.jpg#1626620942439
5,k5i3C_CgN,"Pedido de Larreta. Para evitar las rupturas, la oposición arma un código de ""convivencia""",https://www.clarin.com/politica/evitar-rupturas-juntos-cambio-arma-codigo-convivencia-paso_0_k5i3C_CgN.html,https://images.clarin.com/2021/06/08/R1r651qbt_720x0__1.jpg
6,C3mVGA2OP,"Variante Delta en Italia. Verano, vacunas y contagios: ¿un espejo para lo que viene en Argentina?",https://www.clarin.com/mundo/verano-vacunas-contagios-variante-delta-italia-espejo-viene-argentina-_0_C3mVGA2OP.html,https://images.clarin.com/2021/05/21/fjznM5mEZ_1256x620__3.jpg#1626712089930
7,jLVP3fwJN,Covid. Se agravó la salud de Julián Weich y pasó a terapia intensiva,https://www.clarin.com/fama/complico-salud-julian-weich-derivado-terapia-intensiva_0_jLVP3fwJN.html,https://images.clarin.com/2018/11/01/9IlgvANub_720x0__1.jpg
8,cj4GTg6Ld,Llamado a licitación. Polémica por la compra de 10 mil penes de madera: las críticas de los expertos,https://www.clarin.com/sociedad/polemica-compra-10-mil-penes-madera-tamano-material-criticas-expertos_0_cj4GTg6Ld.html,https://images.clarin.com/2021/07/18/GgRM8A_AI_1256x620__2.jpg#1626703611533
9,l_5zQa8KV,"Historia de vida. Es abogado y hace changas en Europa: ""No soy el típico argentino que se fue podrido""",https://www.clarin.com/sociedad/abogado-trabaja-haciendo-changas-europa-tipico-argentino-podrido-pais-_0_l_5zQa8KV.html,https://images.clarin.com/2021/06/26/mQxVOZsFx_720x0__1.jpg
10,LInZlz7Id,"Sin restricciones por Covid. Descontrol en boliches de Inglaterra al llegar el ""Freedom day""",https://www.clarin.com/mundo/fin-restricciones-covid-inglaterra-descontrol-boliches-boris-johnson-aislado_0_LInZlz7Id.html,https://images.clarin.com/2021/07/19/hr8dOlCMC_1256x620__2.jpg#1626702408770
11,6Fr8P3Kyi,Maduro o Guaidó. ¿De quién es el oro venezolano en Londres? La Corte británica decide,https://www.clarin.com/mundo/-oro-venezuela-guarda-londres-corte-britanica-decide-maduro-guaido_0_6Fr8P3Kyi.html,https://images.clarin.com/2020/08/07/o6GrLY4pu_720x0__1.jpg
12,QeRTRjuDR,"Guía interactiva. Uno por uno, todos los datos de los 1.080 jugadores de la Liga Profesional de Fútbol",https://www.clarin.com/deportes/guia-interactiva-datos-1-080-jugadores-26-equipos-juegan-liga-profesional-futbol_0_QeRTRjuDR.html,https://images.clarin.com/2021/07/16/9bUAMd3Ga_720x0__1.jpg
13,isvbvmDlg,No al consumismo. Michael Landy: el hombre que lo destruyó todo,https://www.clarin.com/new-york-times-international-weekly/michael-landy-hombre-destruyo_0_isvbvmDlg.html,https://images.clarin.com/2021/07/16/BLubcnH7K_1256x620__2.jpg#1626462089697
14,BnjmnzEzU,"Vuelta a la normalidad. La Ciudad anunció el plan para las escuelas: ""Después de vacaciones, la asistencia será obligatoria""",https://www.clarin.com/ciudades/clases-presenciales-ciudad-anuncia-plan-gradual-volver-normalidad_0_BnjmnzEzU.html,https://images.clarin.com/2021/07/19/cCCkQVIk6_1256x620__2.jpg#1626720402654
15,pCCMQiogM,"Clases presenciales. Fecha por fecha, cómo es el programa porteño en colegios y universidades",https://www.clarin.com/ciudades/clases-presenciales-plan-gradual-ciudad-regreso-normalidad-escuelas-universidades_0_pCCMQiogM.html,https://images.clarin.com/2021/07/19/3rsSgM7vU_720x0__1.jpg
16,xD-CHhTubE,"El plan del oficialismo. Mientras sigue la danza de nombres, el Gobierno lanza una campaña de ""rendición de cuentas""",https://www.clarin.com/politica/sigue-danza-nombres-gobierno-lanza-campana-rendicion-cuentas-paso_0_xD-CHhTubE.html,https://images.clarin.com/2021/07/15/ykGuVheh3_720x0__1.jpg
17,OBI201ElL,"Juntos por el Cambio. Santilli-Manes: interna, pedidos de renuncia y la fórmula ""imposible""",https://www.clarin.com/politica/interna-santilli-manes-provincia-pedidos-renuncia-formula-imposible-repartira-lugares-lista-final_0_OBI201ElL.html,https://images.clarin.com/2021/07/18/KIo84Xztl_1256x620__2.jpg#1626620942439
18,k5i3C_CgN,"Pedido de Larreta. Para evitar las rupturas, la oposición arma un código de ""convivencia""",https://www.clarin.com/politica/evitar-rupturas-juntos-cambio-arma-codigo-convivencia-paso_0_k5i3C_CgN.html,https://images.clarin.com/2021/06/08/R1r651qbt_720x0__1.jpg
19,C3mVGA2OP,"Variante Delta en Italia. Verano, vacunas y contagios: ¿un espejo para lo que viene en Argentina?",https://www.clarin.com/mundo/verano-vacunas-contagios-variante-delta-italia-espejo-viene-argentina-_0_C3mVGA2OP.html,https://images.clarin.com/2021/05/21/fjznM5mEZ_1256x620__3.jpg#1626712089930
20,jLVP3fwJN,Covid. Se agravó la salud de Julián Weich y pasó a terapia intensiva,https://www.clarin.com/fama/complico-salud-julian-weich-derivado-terapia-intensiva_0_jLVP3fwJN.html,https://images.clarin.com/2018/11/01/9IlgvANub_720x0__1.jpg
21,cj4GTg6Ld,Llamado a licitación. Polémica por la compra de 10 mil penes de madera: las críticas de los expertos,https://www.clarin.com/sociedad/polemica-compra-10-mil-penes-madera-tamano-material-criticas-expertos_0_cj4GTg6Ld.html,https://images.clarin.com/2021/07/18/GgRM8A_AI_1256x620__2.jpg#1626703611533
22,gMZDUMA_P,"Copa Libertadores. ""Estar 7 puntos para hacer daño"": la ambición de Gallardo para que River crezca",https://www.clarin.com/deportes/-7-puntos-hacer-dano-ambicion-gallardo-river-crezca-logre-pase-cuartos-final-copa-libertadores_0_gMZDUMA_P.html,https://images.clarin.com/2021/07/19/hd6mgJSc7_720x0__1.jpg
23,dkcDgDOUQ,Juan Nimo. Un accidente lo dejó en silla de ruedas a los 18 y maneja un auto de TC sólo con sus manos,https://www.clarin.com/deportes/accidente-dejo-silla-ruedas-18-maneja-auto-tc-pista-solo-manos-quiere-volver-caminar-quiero-demostrar-puede-_0_dkcDgDOUQ.html,https://images.clarin.com/2021/06/24/m01qHDPbM_720x0__1.jpg
24,GvtnGlMip,Entrevista a Pedro Ibarra. El histórico oro con Los Leones en Río cuenta cómo llegan a los Juegos,https://www.clarin.com/deportes/pedro-ibarra-historico-oro-leones-rio-llegan-juegos-pandemia-dia-llevo-botines-semifinal-mundial_0_GvtnGlMip.html,https://images.clarin.com/2021/07/18/jJWE_LPzz_720x0__1.jpg
25,ih2z5Vn3_,"No quiso jugar. Ramírez, el jugador por el que se pelean Boca y River, fue apartado en San Lorenzo",https://www.clarin.com/deportes/juan-ramirez-apartado-plantel-san-lorenzo-entrenarse-solo-resuelva-situacion_0_ih2z5Vn3_.html,https://images.clarin.com/2021/07/17/h3rArTIpj_720x0__1.jpg
26,s5lqrAAY8,Paso importante. La joven promesa Luka Romero se va del Mallorca para jugar en la Lazio,https://www.clarin.com/deportes/luca-romero-lazio-roma-mallorca-libre_0_s5lqrAAY8.html,https://images.clarin.com/2020/12/25/zlOB9m_RC_720x0__1.jpg
27,9x-bg7KMs,Trágico accidente. Conmoción en Paraguay por la muerte del hijo del DT de Cerro Porteño,https://www.clarin.com/deportes/conmocion-paraguay-muerte-hijo-francisco-chiqui-arce-dt-cerro-porteno_0_9x-bg7KMs.html,https://images.clarin.com/2021/07/19/1jASTpPKX_720x0__1.jpg
28,hQFIuUfjs,Opinión. Las razones por las que Castaño debió llevarse las cuatro coronas ante Charlo,https://www.clarin.com/deportes/castano-merecio-razones-argentino-debio-llevarse-coronas-charlo_0_hQFIuUfjs.html,https://images.clarin.com/2021/07/18/DATE3nlz1_720x0__1.jpg
29,V4JtRcylu,Juegos Olímpicos. Dos argentinas compartieron avión con un positivo: tres días aisladas,https://www.clarin.com/deportes/juegos-olimpicos-argentinas-travascio-branz-compartieron-avion-positivo-coronavirus-pasaron-dias-aisladas-tokio_0_V4JtRcylu.html,https://images.clarin.com/2021/07/19/Waz4NHaMC_720x0__1.jpg
30,8HXW4rEWR,Corrupción K. Se define la condicional de Boudou y la principal testigo denunció que el Gobierno no la cuida,https://www.clarin.com/politica/define-libertad-condicional-amado-boudou-principal-testigo-ciccone-denuncio-gobierno-cuida_0_8HXW4rEWR.html,https://images.clarin.com/2020/12/31/ucK8KhfWN_720x0__1.jpg
31,DFh_RhWj0,A través de un DNU. El Gobierno condena los bloqueos a Venezuela mientras el régimen detiene a opositores,https://www.clarin.com/politica/gobierno-volvio-condenar-bloqueos-venezuela-medio-detencion-opositores-parte-regimen-nicolas-maduro_0_DFh_RhWj0.html,https://images.clarin.com/2021/01/24/P9UIT-3CY_720x0__1.jpg
32,gA5r1OI5y,"Bares y restaurantes. Kicillof estudia el ""pase sanitario"" para vacunados como en Francia",https://www.clarin.com/politica/gobierno-axel-kicillof-adelanto-estudia-aplicar-pase-sanitario-vacunados-hizo-francia-_0_gA5r1OI5y.html,https://images.clarin.com/2021/07/19/-N_fF4p7B_720x0__1.jpg
33,j6f0gb1iH,Increíble huida. Mendoza: estaban en una clandestina y escaparon de la policía por los techos,https://www.clarin.com/sociedad/increible-huida-mendoza-encontraron-fiesta-clandestina-escaparon-policia-techos_0_j6f0gb1iH.html,https://images.clarin.com/2021/07/18/RdOy4qAUT_720x0__1.jpg
34,jSh7p-hOA,"Protestas en Cuba. Para bajar la tensión, más importaciones de alimentos y medicinas",https://www.clarin.com/mundo/protestas-cuba-bajar-tension-gobierno-permite-importaciones-alimentos-medicinas_0_jSh7p-hOA.html,https://images.clarin.com/2021/07/16/OrEOzW_UY_1200x0__2.jpg#1626716714365
35,b8RUTKKud,Servidores de Email. EE.UU. acusó a China de estar detrás de un ataque cibernético a Microsoft,https://www.clarin.com/mundo/ee-uu-acuso-china-detras-ataque-cibernetico-servidores-email-microsoft_0_b8RUTKKud.html,https://images.clarin.com/2021/07/19/re_U4-S39_1256x620__2.jpg#1626695037570
36,x-d02V7yc,Monotributo. Es oficial la recategorización y amplían fecha de pago,https://www.clarin.com/economia/monotributo-oficial-recategorizacion-amplian-fecha-pago_0_x-d02V7yc.html,https://images.clarin.com/2021/04/26/ZGV-9LFhL_720x0__1.jpg
37,VgafioLjw,"Así actúa. Pegasus, el software espía que infectó 50 mil celulares de periodistas y activistas del mundo",https://www.clarin.com/tecnologia/actua-pegasus-software-espia-infecto-50-mil-celulares-periodistas-activistas-mundo_0_VgafioLjw.html,https://images.clarin.com/2021/07/19/xH6eaC1Hl_720x0__1.jpg
38,Dkyl_x2SW,Paso a paso. Cómo mejorar la señal de WiFi en casa con 5 trucos sencillos,https://www.clarin.com/tecnologia/mejorar-senal-wifi-casa-5-trucos-sencillos_0_Dkyl_x2SW.html,https://images.clarin.com/2020/05/15/6ex1lc45W_720x0__1.jpg
39,Boib5PIY7,"Una temporada distinta. Vacaciones de invierno: 10 propuestas para chicos en casa, teatros y aire libre",https://www.clarin.com/familias/vacaciones-invierno-10-propuestas-chicos-casa-teatros-aire-libre_0_Boib5PIY7.html,https://images.clarin.com/2021/05/28/YOy0lJlWW_1256x620__2.jpg#1626438482742
40,1ew2dDdzS,Fitness. Entrenamiento virtual versus presencial: ¿cuál es más efectivo?,https://www.clarin.com/buena-vida/entrenamiento-virtual-versus-presencial-efectivo-_0_1ew2dDdzS.html,https://images.clarin.com/2021/07/15/mlgmpbbJd_720x0__1.jpg
41,dYq690Twr,Psicología. ¿Se puede aprender a ser feliz?,https://www.clarin.com/buena-vida/-puede-aprender-feliz-_0_dYq690Twr.html,https://images.clarin.com/2021/07/09/zvkzOOZem_720x0__1.jpg
42,2asBF4AQt,Advertencia. Estas conductas machistas afectan la salud de los hombres,https://www.clarin.com/buena-vida/conductas-machistas-afectan-salud-hombres_0_2asBF4AQt.html,https://images.clarin.com/2021/07/19/gupxbBi93_720x0__1.jpg
43,EWVA-tKfO,"Zoo milenario. Cómo sos como amigo, según el horóscopo chino",https://www.clarin.com/astrologia/sos-amigo-horoscopo-chino_0_EWVA-tKfO.html,https://images.clarin.com/2021/07/16/HIM7MM4ay_720x0__1.jpg
44,VEGDBv8jC,Recetas. Qué cocinar esta semana: menú día por día del 19 al 25 de julio,https://www.clarin.com/gourmet/cocinar-semana-menu-dia-dia-19-25-julio_0_VEGDBv8jC.html,https://images.clarin.com/2021/05/19/S1UYGFh6-_720x0__1.jpg
45,08CFh1WrT,Panorama astrológico. Horóscopo semanal: predicciones del 19 al 25 de julio para todos los signos,https://www.clarin.com/astrologia/horoscopo-semanal-predicciones-19-25-julio-signos_0_08CFh1WrT.html,https://images.clarin.com/2021/07/18/g0pdQn33F_720x0__1.jpg
46,N9TmxD9WY,"Faye Dunaway. Por qué la consideran ""la peor persona de Hollywood""",https://www.clarin.com/espectaculos/cine/faye-dunaway-consideran-peor-persona-hollywood-_0_N9TmxD9WY.html,https://images.clarin.com/2021/07/08/i33sbJU4i_720x0__1.jpg
47,2XvkB8gDu,"""Tsirkon"". El misil hipersónico de Rusia que puede volar nueve veces más rápido que el sonido",https://www.clarin.com/mundo/-tsirkon-misil-hipersonico-rusia-puede-volar-veces-rapido-sonido_0_2XvkB8gDu.html,https://images.clarin.com/2021/07/19/6oLShI-Br_1256x620__2.jpg#1626694612380
48,QFI_DiDVc,"2a temporada. Sky rojo llega con más acción, pero muchas menos sorpresas",https://www.clarin.com/espectaculos/tv/segunda-temporada-sky-rojo-llega-accion-muchas-sorpresas_0_QFI_DiDVc.html,https://images.clarin.com/2021/03/22/U1sMkM5JI_1256x620__2.jpg#1626640086404
49,BrqHvvEAz,"""Belito"". El abuelo que es furor en TikTok por reírse al pedir pizza",https://www.clarin.com/internacional/belito-abuelo-furor-tiktok-reirse-pedir-pizza-aman-millones-usuarios_0_BrqHvvEAz.html,https://images.clarin.com/2021/07/17/fckBLlLKh_720x0__1.jpg
50,Th2CetFgo,"Historia de lucha. Aprendió a vivir sin colon, recto y estómago: ""Estoy vacío por dentro""",https://www.clarin.com/viste/hombre-aprendio-vivir-colon-recto-estomago-vacio-dentro-_0_Th2CetFgo.html,https://images.clarin.com/2021/07/15/MzHKe9Ivj_720x0__1.jpg
51,EUi2bBIpJ,Impresionantes. Las fotos de galaxias cercanas captadas por los telescopios más potentes,https://www.clarin.com/internacional/fuegos-artificiales-impresionantes-imagenes-galaxias-cercanas-captadas-telescopios-potentes-mundo_0_EUi2bBIpJ.html,https://images.clarin.com/2021/07/17/OukuStGdf_720x0__1.jpg
52,PdXj8gNFs,Mercados. El dólar blue arranca la semana en $ 180 y caen las acciones argentinas,https://www.clarin.com/economia/dolar-blue-arranca-semana-180-hunden-acciones-argentinas_0_PdXj8gNFs.html,https://images.clarin.com/2011/06/07/rylFURO0Qe_720x0.jpg
53,DdjY72N5r,La trastienda del poder. Cecilia Todesca Bocco: su historia de dos padres y su rol con Fernández y Cafiero,https://www.clarin.com/politica/cecilia-todesca-bocco-historia-padres-rol-clave-alberto-fernandez-santiago-cafiero_0_DdjY72N5r.html,https://images.clarin.com/2020/10/25/sbNw20Ee__1256x620__3.jpg#1626374786977
54,o5dIInFij,Cuándo inscribirse. Jubilación para mujeres sin aportes: qué hay que hacer antes de pedir turno,https://www.clarin.com/servicios/jubilacion-mujeres-aportes-empieza-inscripcion-hacer-solicitar-turno_0_o5dIInFij.html,https://images.clarin.com/2021/03/29/cA4hfYtXI_720x0__1.jpg
55,qPACaAfRr,En Entre Ríos. Detuvieron a cuatro personas por el crimen del contador: buscan a un prófugo,https://www.clarin.com/policiales/detuvieron-personas-crimen-contador-parana-buscan-profugo_0_qPACaAfRr.html,https://images.clarin.com/2021/07/19/jhNyj3DLC_1256x620__2.jpg#1626719504161
56,UilTdD09q,Polémica en la F1. Por qué fue tan leve el castigo a Hamilton tras el toque que sacó a Verstappen,https://www.clarin.com/deportes/formula-1-leve-castigo-hamilton-toque-saco-verstappen-silverstone_0_UilTdD09q.html,https://images.clarin.com/2021/07/19/nQcTkYcsQ_720x0__1.jpg
57,ScOuOZ9L7,"Plan canje. Cristiano Ronaldo por Icardi, la bomba del mercado de la que hablan en Europa",https://www.clarin.com/deportes/bomba-mercado-hablan-europa-viene-trueque-cristiano-ronaldo-mauro-icardi-_0_ScOuOZ9L7.html,https://images.clarin.com/2021/07/19/GwZcbVJhY_720x0__1.jpg
58,VeOzVMdja,De vacaciones. Messi en Miami y una cena romántica con Antonela,https://www.clarin.com/deportes/messi-antonela-roccuzzo-vacaciones-miami_0_VeOzVMdja.html,https://images.clarin.com/2021/07/19/wU8Ezv2_nm_720x0__1.jpg
59,ORR5dYtEV,Tenían 67 años. Hallan muerta a una pareja en un piletón: creen que intentaban rescatar a un perro,https://www.clarin.com/sociedad/encuentran-muerta-pareja-dentro-pileton-riego-creen-intentaban-rescatar-perro_0_ORR5dYtEV.html,https://images.clarin.com/2019/11/19/f0v5duTA_720x0__1.jpg
60,2BtVuRPnC,"Escenas de la crisis. Mar del Plata: el paso del shopping al trueque en la ""feria de la subsistencia""",https://www.clarin.com/economia/mar-plata-shopping-trueque_0_2BtVuRPnC.html,https://images.clarin.com/2021/07/06/WISsthv9S_720x0__1.jpg
61,gN2xWit_M,Prendas de Maradona. Histórica subasta: de la camiseta ante Brasil en Italia 90 a la medalla que nunca ganó,https://www.clarin.com/deportes/de-la-camiseta-que-uso-ante-brasil-en-italia-90-a-la-medalla-que-nunca-gano-una-historica-subasta-de-prendas-de-diego-maradona_0_gN2xWit_M.html,https://images.clarin.com/2018/05/15/SyDjZrsAz_1256x620__2.jpg#1626651954362
62,6HlLWfprm,"Historias de los JJ.OO.. Moratorio, el jinete que fuera de todo cálculo se subió el podio en Tokio 64",https://www.clarin.com/deportes/historias-juegos-olimpicos-carlos-moratorio-jinete-calculos-subio-podio-tokio-1964_0_6HlLWfprm.html,https://images.clarin.com/2021/07/19/5-TDZEcrf_1256x620__2.jpg#1626708069643
63,FR7yIG5TO,Despertó la ira musulmana. Murió el dibujante que hizo a Mahoma con una bomba y lo quisieron asesinar,https://www.clarin.com/cultura/murio-westergaard-dibujante-hizo-mahoma-bomba-turbante_0_FR7yIG5TO.html,https://images.clarin.com/2021/07/19/3JJY7JeJp_1256x620__2.jpg#1626701593770
64,V1Sbwkw-u,Finanzas personales. Cómo invertir en ladrillos en EE.UU. con poco dinero y ganancia en dólares,https://www.clarin.com/servicios/invertir-ladrillos-ee-uu-entrar-dinero-obtener-ganancias-dolares_0_V1Sbwkw-u.html,https://images.clarin.com/2020/12/16/6jWQ3UUvh_720x0__1.jpg
65,Z31avQA6B,Relevamiento. Ir al cine en vacaciones: cuánto valen las entradas y cómo pagar la mitad,https://www.clarin.com/servicios/ir-cine-vacaciones-invierno-cadena-cadena-valen-entradas-pagar-mitad_0_Z31avQA6B.html,https://images.clarin.com/2021/02/27/mEEz41SkF_720x0__1.jpg
66,4gJhsDvxi,Aliados del placer. 3 ejercicios que te ayudarán a tener una mejor vida sexual,https://www.clarin.com/relaciones/3-ejercicios-que-te-ayudaran-a-tener-una-mejor-vida-sexual_0_4gJhsDvxi.html,https://images.clarin.com/2021/07/15/tUGCRHDw0_720x0__1.jpg
67,zeZ-CNbAh,"Mil caras. Campi, o cómo ser el doble de los famosos y no reírse de ellos",https://www.clarin.com/espectaculos/tv/campi-doble-famosos-reirse_0_zeZ-CNbAh.html,https://images.clarin.com/2021/07/03/u55zdiV9V_720x0__1.jpg
68,F2fXEp7lW,"Revelación. Mj Rodriguez, la primera actriz trans en ser nominada al Emmy",https://www.clarin.com/espectaculos/tv/mj-rodriguez-primera-actriz-trans-nominada-emmy_0_F2fXEp7lW.html,https://images.clarin.com/2019/09/22/xT7LiQ2O-_720x0__1.jpg
