n,id,title,url,image
1,Popj7Bao-,"La zona norte, la más complicada. En plena ola de calor, reportan un fuerte apagón en la Ciudad y parte del Conurbano: afecta a 600 mil usuarios",https://www.clarin.com/sociedad/ola-calor-extremo-fuerte-apagon-ciudad-buenos-aires-parte-conurbano_0_Popj7Bao-.html,https://images.clarin.com/2020/02/08/abGO5Pt9_720x0__1.jpg
2,7ZwlcH9Fl,En qué casos aplica. Covid: los contactos estrechos asintomáticos y vacunados no tendrán que hacer aislamiento,https://www.clarin.com/sociedad/coronavirus-contactos-estrechos-asintomaticos-dosis-hacer-aislamiento_0_7ZwlcH9Fl.html,https://images.clarin.com/2021/12/22/5AXHPavpI_720x0__1.jpg
3,1u4DY4-iR,"Ataque a la AMIA.  Tras las críticas, el Gobierno repudia la presencia del acusado iraní en el acto de Ortega",https://www.clarin.com/politica/duras-criticas-oposicion-pide-cafiero-vaya-congreso-presencia-irani-acusado-atentado-amia-nicaragua_0_1u4DY4-iR.html,https://images.clarin.com/2022/01/10/ZgA-xnGHP_720x0__1.jpg
4,Rbyrygl_H,"El perfil del iraní. Quién es Mohsen Rezai, el acusado del atentado a la AMIA que estuvo en Nicaragua",https://www.clarin.com/politica/mohsen-rezai-acusado-atentado-amia-re-asuncion-daniel-ortega-nicaragua_0_Rbyrygl_H.html,https://images.clarin.com/2022/01/11/QfxxFkSqW_720x0__1.jpg
5,CcirjqfOA,Ola de calor en el país. Aire acondicionado: cómo usarlo para que rinda al máximo y no derroche energía,https://www.clarin.com/servicios/ola-calor-usar-aire-acondicionado-rinda-maximo-derroche-energia_0_CcirjqfOA.html,https://images.clarin.com/2015/03/19/Hk-y5pXRQg_720x0.jpg
6,LF7HoQfhF,Adelanto de Clarín. Sorpresas en el ranking de gobernadores: cambios en la cima y en el fondo de la tabla,https://www.clarin.com/politica/sorpresa-ranking-gobernadores-lidera-radical-apuntado-momento_0_LF7HoQfhF.html,https://images.clarin.com/2022/01/10/AhkBOk4lq_720x0__1.jpg
7,xhk5CiZJo,Nueva ola de la pandemia. ¿Ya se puede tratar al Covid como si fuera una gripe? El debate se enciende en España,https://www.clarin.com/mundo/-puede-tratar-covid-gripe-debate-enciende-espana_0_xhk5CiZJo.html,https://images.clarin.com/2021/12/21/Dzz39E43c_720x0__1.jpg
8,mAHYRL5T9,Especial Clarín. A 20 años de 20 discos indispensables y por qué hay que volver a escucharlos,https://www.clarin.com/espectaculos/musica/20-anos-20-discos-veinte-anos-20-discos-hicieron-historia_0_mAHYRL5T9.html,https://images.clarin.com/2022/01/10/EjHIxZzOW_720x0__1.jpg
9,UF1_ZmxRb,Abrirá más sucursales. De Caballito a Punta del Este: la pizzería que le ganó a la pandemia y no para de crecer,https://www.clarin.com/gourmet/caballito-punta-pizzeria-gano-pandemia-crecer_0_UF1_ZmxRb.html,https://images.clarin.com/2022/01/10/NLHAcY5P9_1256x620__2.jpg#1641822500819
10,mwB1ffjT4,"Lo contó la conductora. Murió el músico Martín Carrizo, hermano de Caramelito, que padecía ELA",https://www.clarin.com/espectaculos/murio-musico-martin-carrizo-hermano-caramelito-padecia-ela_0_mwB1ffjT4.html,https://images.clarin.com/2022/01/11/bcnxNBxvO_720x0__1.jpg
11,kRR6Tudff,En Instagram. El conmovedor mensaje de Caramelito tras la muerte de su hermano,https://www.clarin.com/sociedad/murio-martin-carrizo-conmovedor-mensaje-caramelito-muerte-hermano_0_kRR6Tudff.html,https://images.clarin.com/2022/01/11/f5_Rvq3Eh_720x0__1.jpg
12,AVkbC1Ew8,Femicidio. Estaba por empezar a jugar un partido de fútbol con amigas y fue degollada por su ex,https://www.clarin.com/policiales/femicidio-empezar-jugar-partido-futbol-amigas-degollada-ex-pareja_0_AVkbC1Ew8.html,https://images.clarin.com/2022/01/11/RMUUsPtAK_720x0__1.jpg
13,BB3PYOmcT,"Proyecciones sobre Argentina. El Banco Mundial advierte sobre la inflación, el control de precios y el cepo cambiario",https://www.clarin.com/economia/banco-mundial-advierte-inflacion-control-precios-cepo-cambiario_0_BB3PYOmcT.html,https://images.clarin.com/2021/06/08/eFL2kIzTw_720x0__1.jpg
14,a4lFP0wPd,"Duro análisis. ""Paria financiero"": la frase del Financial Times frente a un posible default de Argentina",https://www.clarin.com/economia/ft-default-fmi-dejaria-argentina-paria-financiero-_0_a4lFP0wPd.html,https://images.clarin.com/2022/01/11/0CgVc5QgN_1256x620__2.jpg#1641904623776
15,bEWkO0bMv,Grieta en las redes. Fuerte mensaje de Novaresio por el caso Djokovic: ¿le apuntó a Viviana Canosa?,https://www.clarin.com/fama/luis-novaresio-cruzo-viviana-canosa-caso-novak-djokovic_0_bEWkO0bMv.html,https://images.clarin.com/2021/07/20/dCqPTF8T-_720x0__1.jpg
16,kdFE0dWkC,Copa Liga Profesional. Se sortean los grupos del próximo campeonato: cómo se jugará,https://www.clarin.com/deportes/copa-liga-profesional-argentina-sorteo_0_kdFE0dWkC.html,https://images.clarin.com/2022/01/10/M4PwC_31R_720x0__1.jpg
17,MoLYDzbiz,Reino Unido. Un nuevo escándalo por una fiesta en plena cuarentena golpea a Boris Johnson,https://www.clarin.com/mundo/nuevo-escandalo-fiesta-plena-cuarentena-golpea-boris-johnson_0_MoLYDzbiz.html,https://images.clarin.com/2022/01/11/lSLNN2iHz_720x0__1.jpg
18,EYJ9onsPJ,Hito de la medicina. Qué puertas abre el primer trasplante de un corazón de un cerdo a un humano,https://www.clarin.com/sociedad/hito-medicina-puertas-abre-primer-trasplante-corazon-cerdo-humano_0_EYJ9onsPJ.html,https://images.clarin.com/2022/01/11/vPjGbGQ8L_1256x620__2.jpg#1641909177689
19,Bnf3XabnQ,"De qué se trata. Solos entre la multitud: turismo burbuja, la tendencia que crece en Mar del Plata",https://www.clarin.com/sociedad/solos-multitud-turismo-burbuja-tendencia-impone-verano-mar-plata_0_Bnf3XabnQ.html,https://images.clarin.com/2022/01/11/fl3j2uVqF_720x0__1.jpg
20,KTIv4_uix,Adiós al coitocentrismo. ¿El clítoris salió del clóset? El órgano indispensable para hablar del goce femenino,https://www.clarin.com/relaciones/-clitoris-salio-closet-organo-indispensable-hablar-goce-femenino_0_KTIv4_uix.html,https://images.clarin.com/2022/01/03/pISrmvNbB_720x0__1.jpg
21,LRBuynODh,Para adoptar. Bill Gates reveló su clave para evitar el agotamiento mental,https://www.clarin.com/internacional/bill-gates-revelo-claves-evitar-agotamiento-mental_0_LRBuynODh.html,https://images.clarin.com/2021/10/18/-ZiS8yK0P_720x0__1.jpg
22,hrOCPO9W4,Sanciones por no votar. Vence el plazo para justificar la ausencia en la última elección: qué pasa si no se hace,https://www.clarin.com/servicios/vence-plazo-justificar-ausencia-ultima-eleccion-pasa-hace_0_hrOCPO9W4.html,https://images.clarin.com/2021/11/14/Xtgw4R94z_720x0__1.jpg
23,WeLoA4AAJ,Sin esfuerzo. Ejercicio: qué es el wu-wei y cómo ayuda a mejorar el rendimiento,https://www.clarin.com/buena-vida/ejercicio-wu-wei-ayuda-mejorar-rendimiento_0_WeLoA4AAJ.html,https://images.clarin.com/2022/01/10/6AhwiBErS_720x0__1.jpg
24,eDZ5iYJaa,Destinos de un nuevo mundo. Qué lugar de Argentina recomendó el New York Times para visitar en su TOP 52,https://www.clarin.com/viajes/destino-argentina-recomendo-new-york-times-visitar-top-52_0_eDZ5iYJaa.html,https://images.clarin.com/2021/08/24/RIAZfsLFx_720x0__1.jpg
25,x6P3twBkH,Comer bien. ¿Galletitas? ¿Papas fritas? ¿Pizza? Así es como podés dominar tus antojos.,https://www.clarin.com/new-york-times-international-weekly/-galletitas-papas-fritas-pizza-podes-dominar-antojos-_0_x6P3twBkH.html,https://images.clarin.com/2022/01/10/52Rm_jXH5_720x0__1.jpg
26,nPSB9Sc6T,Opinión. ¿Cuándo será el pico de la variante ómicron?,https://www.clarin.com/new-york-times-international-weekly/-pico-variante-omicron-_0_nPSB9Sc6T.html,https://images.clarin.com/2022/01/10/x20TnYuQo_1256x620__2.jpg#1641856201170
27,srKrX3vOX,Avance crucial. Cómo se hizo el trasplante de un corazón de cerdo genéticamente modificado,https://www.clarin.com/new-york-times-international-weekly/primera-vez-hombre-recibe-corazon-cerdo-geneticamente-modificado_0_srKrX3vOX.html,https://images.clarin.com/2022/01/10/RRVbHrWxX_1256x620__2.jpg#1641866661899
28,zxSDBeD09,Análisis. ¿Es posible hacer demasiado ejercicio?,https://www.clarin.com/new-york-times-international-weekly/-posible-hacer-demasiado-ejercicio-_0_zxSDBeD09.html,https://images.clarin.com/2022/01/10/M8Wg1yn6d_1256x620__2.jpg#1641861695943
29,Popj7Bao-,"La zona norte, la más complicada. En plena ola de calor, reportan un fuerte apagón en la Ciudad y parte del Conurbano: afecta a 600 mil usuarios",https://www.clarin.com/sociedad/ola-calor-extremo-fuerte-apagon-ciudad-buenos-aires-parte-conurbano_0_Popj7Bao-.html,https://images.clarin.com/2020/02/08/abGO5Pt9_720x0__1.jpg
30,7ZwlcH9Fl,En qué casos aplica. Covid: los contactos estrechos asintomáticos y vacunados no tendrán que hacer aislamiento,https://www.clarin.com/sociedad/coronavirus-contactos-estrechos-asintomaticos-dosis-hacer-aislamiento_0_7ZwlcH9Fl.html,https://images.clarin.com/2021/12/22/5AXHPavpI_720x0__1.jpg
31,1u4DY4-iR,"Ataque a la AMIA.  Tras las críticas, el Gobierno repudia la presencia del acusado iraní en el acto de Ortega",https://www.clarin.com/politica/duras-criticas-oposicion-pide-cafiero-vaya-congreso-presencia-irani-acusado-atentado-amia-nicaragua_0_1u4DY4-iR.html,https://images.clarin.com/2022/01/10/ZgA-xnGHP_720x0__1.jpg
32,Rbyrygl_H,"El perfil del iraní. Quién es Mohsen Rezai, el acusado del atentado a la AMIA que estuvo en Nicaragua",https://www.clarin.com/politica/mohsen-rezai-acusado-atentado-amia-re-asuncion-daniel-ortega-nicaragua_0_Rbyrygl_H.html,https://images.clarin.com/2022/01/11/QfxxFkSqW_720x0__1.jpg
33,CcirjqfOA,Ola de calor en el país. Aire acondicionado: cómo usarlo para que rinda al máximo y no derroche energía,https://www.clarin.com/servicios/ola-calor-usar-aire-acondicionado-rinda-maximo-derroche-energia_0_CcirjqfOA.html,https://images.clarin.com/2015/03/19/Hk-y5pXRQg_720x0.jpg
34,LF7HoQfhF,Adelanto de Clarín. Sorpresas en el ranking de gobernadores: cambios en la cima y en el fondo de la tabla,https://www.clarin.com/politica/sorpresa-ranking-gobernadores-lidera-radical-apuntado-momento_0_LF7HoQfhF.html,https://images.clarin.com/2022/01/10/AhkBOk4lq_720x0__1.jpg
35,xhk5CiZJo,Nueva ola de la pandemia. ¿Ya se puede tratar al Covid como si fuera una gripe? El debate se enciende en España,https://www.clarin.com/mundo/-puede-tratar-covid-gripe-debate-enciende-espana_0_xhk5CiZJo.html,https://images.clarin.com/2021/12/21/Dzz39E43c_720x0__1.jpg
36,flbqsYm-j,El consultorio. Cuatro consejos para lograr este año los objetivos que querés alcanzar,https://www.clarin.com/buena-vida/consejos-lograr-ano-objetivos-queres-alcanzar_0_flbqsYm-j.html,https://images.clarin.com/2022/01/10/Zly9RatWn_720x0__1.jpg
37,BtVACG04u,Modelos Classic y Celta. Chevrolet busca autos con airbags defectuosos: premiará a los clientes que se presenten,https://www.clarin.com/autos/chevrolet-busca-autos-airbags-defectuosos-premiara-dinero-clientes-presenten_0_BtVACG04u.html,https://images.clarin.com/2016/08/25/r1ZDkEzRml_720x0.jpg
38,-i3_dJIXG,De Dante a Capote. Una lista inspirada en Borges: los 100 libros que convirtieron a David Bowie en ícono,https://www.clarin.com/cultura/lista-inspirada-borges-100-libros-convirtieron-david-bowie-icono_0_-i3_dJIXG.html,https://images.clarin.com/2012/09/05/ByxKCXoame_720x0.jpg
39,G_5uwAK4t,Entrevista a Mabel Katz. Ho'oponopono: cómo se usa la técnica hawaiana que elimina pensamientos tóxicos,https://www.clarin.com/astrologia/usan-4-frases-gatillo-ho-oponopono-tecnica-hawaiana-busca-eliminar-pensamientos-toxicos_0_G_5uwAK4t.html,https://images.clarin.com/2022/01/05/lLuB1h3xO_720x0__1.jpg
40,r_MdAzIfe,Videollamadas. El algoritmo que cambió al mundo: la vida en Argentina de Nasir Ahmed,https://www.clarin.com/tecnologia/algoritmo-cambio-mundo-vida-argentina-nasir-ahmed-padre-videollamadas_0_r_MdAzIfe.html,https://images.clarin.com/2022/01/09/Mfae6h17M_720x0__1.jpg
41,DZTXqoc2f,Máximas extremas. Ola de calor: signos de deshidratación y cuidados especiales para personas mayores,https://www.clarin.com/buena-vida/ola-calor-signos-deshidratacion-cuidados-especiales-adultos-mayores_0_DZTXqoc2f.html,https://images.clarin.com/2022/01/11/gY5af5w-N_720x0__1.jpg
42,yiy5aucvN,Tiene 10 años. La historia del niño que quiere ser Bruce Lee y es furor en las redes sociales,https://www.clarin.com/internacional/historia-nino-quiere-bruce-lee-furor-redes-sociales_0_yiy5aucvN.html,https://images.clarin.com/2022/01/09/ZdR2N6ht-_720x0__1.jpg
43,CFFdY-l3c,Se salvó de milagro. Video: el momento en que una madre de 18 años tira a su hija recién nacida a la basura,https://www.clarin.com/internacional/video-momento-madre-18-anos-tira-hija-recien-nacida-basura_0_CFFdY-l3c.html,https://images.clarin.com/2022/01/10/xvZQrCZnp_720x0__1.jpg
44,rkWwuHWIU,"Decisión tomada. Intentarán cerrar la  ""Puerta del Infierno"", que arde noche y día desde 1971",https://www.clarin.com/internacional/decision-tomada-intentaran-cerrar-puerta-infierno-arde-noche-dia-1971_0_rkWwuHWIU.html,https://images.clarin.com/2022/01/08/1wArMlZjW_720x0__1.jpg
45,FyltrhlbE,"Fin del misterio. Revelan qué es la ""cabaña misteriosa"" detectada en el lado oscuro de la Luna",https://www.clarin.com/internacional/revelan-cabana-misteriosa-detectada-lado-oscuro-luna_0_FyltrhlbE.html,https://images.clarin.com/2021/12/06/OPWvPjrVw_720x0__1.jpg
46,9VMEsNlJX,"Sospechas. Un youtuber piloteaba una avioneta y por un ""desperfecto"" se tiró en paracaídas",https://www.clarin.com/viste/piloteaba-avioneta-desperfecto-tiro-paracaidas-sospechoso-caso-trevor-jacob_0_9VMEsNlJX.html,https://images.clarin.com/2022/01/08/Mxvbb-sMo_720x0__1.jpg
47,rbDBFBCBp,"En Estados Unidos. Envió un mensaje al número de su hermana fallecida, le contestaron y quedó helada",https://www.clarin.com/viste/envio-mensaje-numero-hermana-fallecida-contestaron-quedo-helada_0_rbDBFBCBp.html,https://images.clarin.com/2022/01/07/qi472yqJq_720x0__1.jpg
48,f2mpj0ZPKE,Historias visuales. Las 84 mejores imágenes de hoy en la Argentina y el mundo,https://www.clarin.com/fotogalerias/historias-visuales-dia-fotos-imagenes-destacadas-argentina-mundo_5_f2mpj0ZPKE.html,
49,zHQ6pbg9o,DS Automobiles. Sofisticación y tecnología de vanguardia,https://www.clarin.com/brandstudio/buque-insignia-ds-automobiles-exquisita-combinacion-sofisticacion-tecnologia-vanguardia_0_zHQ6pbg9o.html,https://images.clarin.com/2021/11/30/1AMq1S3Ty_720x0__1.jpg
50,Vx1Egfv-X,¿A dónde ir?. Las maravillas turísticas de cada provincia giran por el país,https://www.clarin.com/brandstudio/maravillas-turisticas-provincia-giran-pais_0_Vx1Egfv-X.html,https://images.clarin.com/2022/01/05/rc3cOXONN_720x0__1.jpg
51,23tPAM1eR,Ellas al volante. Un estudio asegura que las mujeres están más expuestas a la violencia en el tránsito,https://www.clarin.com/brandstudio/estudio-asegura-mujeres-expuestas-situaciones-violencia-transito_0_23tPAM1eR.html,https://images.clarin.com/2022/01/04/4BAIF9rmp_720x0__1.jpg
52,4HUWfsVX-,Soluciones digitales. Así es la nueva plataforma de cobros de Banco Macro,https://www.clarin.com/brandstudio/nueva-plataforma-cobros-banco-macro_0_4HUWfsVX-.html,https://images.clarin.com/2021/12/29/CZ0LSHpJJ_720x0__1.jpg
53,bUe5K8zWQ,Proyección. Un año de consolidación para las selecciones juveniles femeninas,https://www.clarin.com/brandstudio/ano-consolidacion-selecciones-juveniles-femeninas_0_bUe5K8zWQ.html,https://images.clarin.com/2022/01/10/RmSsBV5fI_720x0__1.jpg
54,-2PUomFuE,Nuevos hábitos. Novedoso tratamiento para el sobrepeso y la obesidad,https://www.clarin.com/brandstudio/novedoso-tratamiento-sobrepeso-obesidad_0_-2PUomFuE.html,https://images.clarin.com/2021/12/27/SuNixpkYX_720x0__1.jpg
55,Id-WjCQjW,"Contó su verdad. Claudio Contardi, el ex de Julieta Prandi, rompió el silencio: ""Tomó a mis hijos como rehenes""",https://www.clarin.com/fama/claudio-contardi-ex-julieta-prandi-rompio-silencio-tomo-hijos-rehenes-_0_Id-WjCQjW.html,https://images.clarin.com/2022/01/11/ZE_A4u1j1_720x0__1.jpg
56,hpaTGFt1d,"Contundente descargo. Alejandro Fantino respondió las críticas a su video viral y desafió ""a los piolas del medio""",https://www.clarin.com/fama/alejandro-fantino-respondio-criticas-video-viral-desafio-piolas-medio-_0_hpaTGFt1d.html,https://images.clarin.com/2022/01/11/-ATv0Bd5K_720x0__1.jpg
57,22Rs6qMKT,Relato salvaje. Campi describió el paso a paso de su odisea varado con sus hijos en la ruta,https://www.clarin.com/fama/campi-relato-paso-paso-odisea-varado-hijos-ruta_0_22Rs6qMKT.html,https://images.clarin.com/2022/01/10/pJLHtDOYw_720x0__1.jpg
58,bjquccci9,"Dolor de padre. Antonio Ríos habló tras la detención de su hijo: ""Afecta directamente a mi familia""",https://www.clarin.com/fama/antonio-rios-hablo-despues-detencion-hijo-daniel-afecta-directamente-familia-_0_bjquccci9.html,https://images.clarin.com/2022/01/10/KIV9o-rM1_720x0__1.jpg
59,X4pP14maa,La pandemia. La paradoja de la tercera dosis: las dos causas que le ponen el pie en el freno,https://www.clarin.com/sociedad/paradoja-tercera-dosis-vacuna-covid-causas-poniendo-pie-freno_0_X4pP14maa.html,https://images.clarin.com/2022/01/03/-RPJS0HLU_1256x620__2.jpg#1641668126579
60,wjR4uteiS,Más contagiosa. Ómicron dominante: las respuestas a las dudas clave de la variante de Covid,https://www.clarin.com/sociedad/omicron-dominante-respuestas-dudas-clave-variante-impulsa-tercera-ola-covid_0_wjR4uteiS.html,https://images.clarin.com/2021/12/23/L949x9rk7_1256x620__2.jpg#1641858186837
61,NiOtAd08H,Alquileres para el verano. Tres plataformas que permiten pagar en pesos y sin recargos,https://www.clarin.com/servicios/alquileres-verano-3-plataformas-locales-permiten-pagar-pesos-recargos_0_NiOtAd08H.html,https://images.clarin.com/2018/12/18/Hupnmauc3_720x0__1.jpg
62,XC5XUWOJ0,El armado opositor. Bullrich & Milei: el contacto estrecho que más inquieta a Juntos por el Cambio,https://www.clarin.com/politica/patricia-bullrich-javier-milei-contacto-estrecho-inquieta-juntos-cambio_0_XC5XUWOJ0.html,https://images.clarin.com/2022/01/04/jPgM0Ln1m_720x0__1.jpg
63,VDxeT3WZT,"Interna oficialista. La ultra K que llamó ""okupa"" al Presidente ahora pega duro por la deuda",https://www.clarin.com/politica/ultra-k-llamo-okupa-mequetrefe-presidente-ahora-pega-duro-deuda-inflacion_0_VDxeT3WZT.html,https://images.clarin.com/2020/02/02/7tuwNLfP_720x0__1.jpg
64,m1EdK_wpV,Sociedad. Mundo verdulería: 10 secretos del negocio que explotó en pandemia,https://www.clarin.com/sociedad/mundo-verduleria-10-secretos-negocio-exploto-pandemia_0_m1EdK_wpV.html,https://images.clarin.com/2021/12/20/MSbLfu4yR_720x0__1.jpg
65,fJM8dsWAP,Viajes. De Salta a Tierra del Fuego: postales imperdibles de siete rutas escénicas de la Argentina,https://www.clarin.com/viajes/salta-tierra-fuego-postales-imperdibles-rutas-escenicas-argentina_0_fJM8dsWAP.html,https://images.clarin.com/2021/12/23/_rnz40zJS_720x0__1.jpg
66,CpUhuSgLk,Sociedad. Autitos de colección: un juego que no es de niños y mueve millones,https://www.clarin.com/autos/autitos-coleccion-juego-ninos-mueve-millones_0_CpUhuSgLk.html,https://images.clarin.com/2021/12/03/clFAGxjmh_720x0__1.jpg
67,9KZn_RIDy,Sociedad. El último lugar de la Argentina que se salva del cambio climático,https://www.clarin.com/especiales/ultimo-lugar-argentina-salva-cambio-climatico_0_9KZn_RIDy.html,https://images.clarin.com/2021/12/09/MXDJDgPHP_720x0__1.jpg
68,sqHQJ4lIP,"Sigue la investigación. Nuevas contradicciones complican a Djokovic, que se sigue entrenando",https://www.clarin.com/deportes/djokovic-entrena-nuec_0_sqHQJ4lIP.html,https://images.clarin.com/2022/01/11/Er7w87Y5HM_720x0__1.jpg
69,oYKHEUJHN,"Once partidos en una semana. Uno por uno, todos los amistosos de verano de los próximos días",https://www.clarin.com/deportes/amistosos-verano-futbol-argentino_0_oYKHEUJHN.html,https://images.clarin.com/2022/01/10/YwlbuQOu9_720x0__1.jpg
70,cck5nItlj,Clarín en el Dakar. El argentino Pablo Copetti ganó la novena etapa y acorta distancia con el primero,https://www.clarin.com/deportes/argentino-pablo-copetti-gano-novena-etapa-acorta-distancia-primero_0_cck5nItlj.html,https://images.clarin.com/2021/01/14/h1SpZl3pY_720x0__1.jpg
71,fWDqFW5Kq,"De pretemporada. ""Vamos todos unidos"": la foto del plantel de River que ilusiona a los hinchas",https://www.clarin.com/deportes/foto-plantel-river-pretemporada_0_fWDqFW5Kq.html,https://images.clarin.com/2022/01/11/H8NF3SkH__720x0__1.jpg
72,4Rx0LHiba,Minuto a minuto. Mercado de pases al día: todas las altas y bajas de los equipos de la Liga Profesional,https://www.clarin.com/deportes/mercado-pases-dia-todas-altas-bajas-equipos-liga-futbol-profesional_0_4Rx0LHiba.html,https://images.clarin.com/2021/09/15/5FU9sy6IB4_720x0__1.jpg
73,S74s_3GzX,"""Estás muerto"". Kylian Mbappé recibió amenazas mientras define su continuidad en el PSG",https://www.clarin.com/deportes/mbappe-amenazas-muerte-mural_0_S74s_3GzX.html,https://images.clarin.com/2022/01/11/4DlkRdOM4i_720x0__1.jpg
74,q-OTO27at,Equinor junto a YPF y Shell. El Gobierno abraza la explotación de petróleo off shore y enfrenta a  ambientalistas,https://www.clarin.com/economia/gobierno-abraza-explotacion-petroleo-off-shore-enfrenta-ambientalistas_0_q-OTO27at.html,https://images.clarin.com/2016/04/29/BybL6EntNe_720x0.jpg
75,67zvbOVwc,Finanzas personales. Una nueva forma de ahorro en pesos y atados al exterior: qué son los ETF,https://www.clarin.com/economia/nueva-forma-ahorro-pesos-atados-fondos-exterior-etf-invierte_0_67zvbOVwc.html,https://images.clarin.com/2021/10/22/Kr4aw3Dm9_720x0__1.jpg
76,rKcowkuQB,Especial para jubilados. Ola de calor: desde ANSeS aconsejan no ir al banco y usar más la tarjeta de débito,https://www.clarin.com/economia/ola-calor-anses-aconsejan-ir-banco-usar-tarjeta-debito_0_rKcowkuQB.html,https://images.clarin.com/2022/01/11/jDtrb7hng_720x0__1.jpg
77,M_uOcIaEm,Un departamento en CABA. Con la demora en la derogación de la ley: cuánto sale hoy alquilar ,https://www.clarin.com/economia/demora-derogacion-ley-sale-alquilar-hoy-departamento-caba_0_M_uOcIaEm.html,https://images.clarin.com/2021/12/24/7ZAkns9GQ_720x0__1.jpg
78,bED8Zr7WW,Educación financiera. Los 9 consejos de un economista de Harvard para una sana y larga vida financiera,https://www.clarin.com/economia/9-consejos-economista-harvard-vida-financiera-larga-sana_0_bED8Zr7WW.html,https://images.clarin.com/2018/06/10/H1fWRy3xX_720x0__1.jpg
79,AZc_8PVsK,Ben Kelmenson. Llega el economista inglés que será los ojos del FMI en Buenos Aires,https://www.clarin.com/economia/-economista-ingles-hara-cargo-oficina-fmi-buenos-aires-_0_AZc_8PVsK.html,https://images.clarin.com/2021/06/18/BoW7ph9ab_720x0__1.jpg
