n,id,title,url,image
1,nwukVpCiI,Coronavirus. Llegan más vacunas: las dudas de los voluntarios de ensayos clínicos y qué deben hacer,https://www.clarin.com/sociedad/llegan-vacunas-covid-dudas-voluntarios-ensayos-clinicos-deben-hacer_0_nwukVpCiI.html,https://images.clarin.com/2021/05/18/9SZGXk1Mn_1256x620__2.jpg#1623179239518
2,ItQZ2HPiB,El Covid en la Argentina. Diez conclusiones que dejan los primeros 4 millones de casos en el país,https://www.clarin.com/sociedad/coronavirus-conclusiones-dejan-primeros-4-millones-casos-argentina_0_ItQZ2HPiB.html,https://images.clarin.com/2021/06/08/xhwNm5JyU_720x0__1.jpg
3,WlUCtj5s4,No estuvo Macri. Juntos por el Cambio acordó fijar reglas para ampliar la coalición,https://www.clarin.com/politica/mauricio-macri-bajar-tensiones-juntos-cambio-acordo-fijar-reglas-ampliar-coalicion_0_WlUCtj5s4.html,https://images.clarin.com/2021/06/08/R1r651qbt_720x0__1.jpg
4,le0V2WQ5_,Del editor al lector. Sacudiendo la ropa sucia del PRO,https://www.clarin.com/opinion/sacudiendo-ropa-sucia-pro_0_le0V2WQ5_.html,https://images.clarin.com/2021/06/08/-IuePCIg4_720x0__1.jpg
5,wFvifW3VY,"Balotaje en Perú. Antes de que termine el recuento, Castillo se declaró ganador frente a Fujimori",https://www.clarin.com/mundo/balotaje-peru-pedro-castillo-declaro-ganador-frente-keiko-fujimori-termine-recuento_0_wFvifW3VY.html,https://images.clarin.com/2021/06/09/5DEVYKPzY_720x0__1.jpg
6,bEi0p6A-q,Reactivación del turismo. Aprobaron el Certificado Covid para viajar dentro de la Unión Europea,https://www.clarin.com/mundo/eurocamara-aprobo-certificado-covid-viajar-dentro-union-europea_0_bEi0p6A-q.html,https://images.clarin.com/2021/06/09/JHKgCTYbO_720x0__1.jpg
7,iQH8gHmxN,En París. Schwartzman va por un batacazo histórico ante Nadal,https://www.clarin.com/deportes/roland-garros-diego-schwartzman-va-batacazo-historico-rafael-nadal_0_iQH8gHmxN.html,https://images.clarin.com/2020/10/09/khcX6LcxSN_1256x620__5.jpg#1623163236300
8,9Va2soqWk,Modo electoral. Tres razones por las que el dólar puede seguir planchado hasta noviembre,https://www.clarin.com/economia/dolar-electoral-razones-explican-puede-seguir-planchado-noviembre_0_9Va2soqWk.html,https://images.clarin.com/2021/04/22/w2IQovzeJ_720x0__1.jpg
9,q9OMGhid9,Para la memoria. Cómo usar contraseñas seguras y jamás olvidarlas: 3 técnicas efectivas,https://www.clarin.com/servicios/tecnicas-efectivas-usar-contrasenas-seguras-jamas-olvidarlas_0_q9OMGhid9.html,https://images.clarin.com/2019/02/05/3QXqYNhNX_720x0__1.jpg
10,wz2B5jcoK,Vinos bajo el mar. La bodega argentina que sumergió sus botellas en cavas submarinas,https://www.clarin.com/viajes/vinos-mar-bodega-argentina-sumergio-botellas-cavas-submarinas_0_wz2B5jcoK.html,https://images.clarin.com/2021/06/08/r56-Bskk0_720x0__1.jpg
11,p10lRZOk7,"Especial Clarín. Con Miami carísimo, los otros destinos para vacunarse en EE.UU.",https://www.clarin.com/mundo/miami-carisimo-destinos-eligen-argentinos-vacunarse-ee-uu-_0_p10lRZOk7.html,https://images.clarin.com/2021/05/03/ZcwCl7rao_1256x620__2.jpg#1622929441915
12,JEgbuq2Dp,"Hay miles en la Ciudad. Plátanos, la pesadilla de los alérgicos que da síntomas similares al Covid",https://www.clarin.com/ciudades/podan-platanos--pesadilla-alergicos-da-sintomas-parecidos-coronavirus_0_JEgbuq2Dp.html,https://images.clarin.com/2021/06/08/koH-P0E65_720x0__1.jpg
13,nwukVpCiI,Coronavirus. Llegan más vacunas: las dudas de los voluntarios de ensayos clínicos y qué deben hacer,https://www.clarin.com/sociedad/llegan-vacunas-covid-dudas-voluntarios-ensayos-clinicos-deben-hacer_0_nwukVpCiI.html,https://images.clarin.com/2021/05/18/9SZGXk1Mn_1256x620__2.jpg#1623179239518
14,ItQZ2HPiB,El Covid en la Argentina. Diez conclusiones que dejan los primeros 4 millones de casos en el país,https://www.clarin.com/sociedad/coronavirus-conclusiones-dejan-primeros-4-millones-casos-argentina_0_ItQZ2HPiB.html,https://images.clarin.com/2021/06/08/xhwNm5JyU_720x0__1.jpg
15,WlUCtj5s4,No estuvo Macri. Juntos por el Cambio acordó fijar reglas para ampliar la coalición,https://www.clarin.com/politica/mauricio-macri-bajar-tensiones-juntos-cambio-acordo-fijar-reglas-ampliar-coalicion_0_WlUCtj5s4.html,https://images.clarin.com/2021/06/08/R1r651qbt_720x0__1.jpg
16,le0V2WQ5_,Del editor al lector. Sacudiendo la ropa sucia del PRO,https://www.clarin.com/opinion/sacudiendo-ropa-sucia-pro_0_le0V2WQ5_.html,https://images.clarin.com/2021/06/08/-IuePCIg4_720x0__1.jpg
17,wFvifW3VY,"Balotaje en Perú. Antes de que termine el recuento, Castillo se declaró ganador frente a Fujimori",https://www.clarin.com/mundo/balotaje-peru-pedro-castillo-declaro-ganador-frente-keiko-fujimori-termine-recuento_0_wFvifW3VY.html,https://images.clarin.com/2021/06/09/5DEVYKPzY_720x0__1.jpg
18,bEi0p6A-q,Reactivación del turismo. Aprobaron el Certificado Covid para viajar dentro de la Unión Europea,https://www.clarin.com/mundo/eurocamara-aprobo-certificado-covid-viajar-dentro-union-europea_0_bEi0p6A-q.html,https://images.clarin.com/2021/06/09/JHKgCTYbO_720x0__1.jpg
19,iQH8gHmxN,En París. Schwartzman va por un batacazo histórico ante Nadal,https://www.clarin.com/deportes/roland-garros-diego-schwartzman-va-batacazo-historico-rafael-nadal_0_iQH8gHmxN.html,https://images.clarin.com/2020/10/09/khcX6LcxSN_1256x620__5.jpg#1623163236300
20,9Va2soqWk,Modo electoral. Tres razones por las que el dólar puede seguir planchado hasta noviembre,https://www.clarin.com/economia/dolar-electoral-razones-explican-puede-seguir-planchado-noviembre_0_9Va2soqWk.html,https://images.clarin.com/2021/04/22/w2IQovzeJ_720x0__1.jpg
21,LXHmi6jna,Nuevas investigaciones en Canadá. Tumbas sin nombre y más misterio: ¿cómo desaparecieron miles de chicos indígenas?,https://www.clarin.com/mundo/tumbas-nombre-misterio-crece-desaparecieron-miles-chicos-indigenas-canada_0_LXHmi6jna.html,https://images.clarin.com/2021/06/08/kB3zIz2sm_720x0__1.jpg
22,FOjGOBrVU,"Entrevista. El argentino que diseñó el Audi de tres motores para el Dakar: ""Es un OVNI""",https://www.clarin.com/autos/juan-manuel-diaz-argentino-diseno-audi-motores-dakar-ovni-_0_FOjGOBrVU.html,https://images.clarin.com/2021/06/08/iJgt33MdS_720x0__1.jpg
23,7fSSefrcT,Coronavirus. ¿El tipo de dieta puede ayudar a disminuir la gravedad?,https://www.clarin.com/buena-vida/covid-tipo-dieta-puede-ayudar-disminuir-gravedad-_0_7fSSefrcT.html,https://images.clarin.com/2021/06/08/gjw9m9KP3_720x0__1.jpg
24,BUTLZEE1O,Consumo. Préstamos o tarjetas de crédito: cuál conviene más para financiar los gastos,https://www.clarin.com/servicios/prestamos-personales-tarjetas-credito-conviene-financiar-gastos_0_BUTLZEE1O.html,https://images.clarin.com/2017/12/07/B1KuFaI-G_720x0.jpg
25,eADO-n0KO,Turismo. Temporada de esquí 2021: promociones de preventa y cuotas para disfrutar de la nieve,https://www.clarin.com/viajes/temporada-esqui-2021-promociones-preventa-cuotas-disfrutar-nieve_0_eADO-n0KO.html,https://images.clarin.com/2015/09/07/BylRNxfy4e_720x0.jpg
26,nUp6aFhUd,"Personaje. Soy Rada: ""Si no nos reímos, nos volvemos locos""",https://www.clarin.com/viva/rada-reimos--volvemos-locos_0_nUp6aFhUd.html,https://images.clarin.com/2021/06/08/6bUvRN73I_720x0__1.jpg
27,y1T9GTZnB,"Entrevista. Sacheri: ""El primer lugar donde vi desafiar al régimen militar fue en las canchas""",https://www.clarin.com/cultura/eduardo-sacheri-primer-lugar-vi-desafiar-regimen-militar-canchas-futbol_0_y1T9GTZnB.html,https://images.clarin.com/2021/06/08/qI5VY_YUy_720x0__1.jpg
28,WJh6ANF6W,Valores Religiosos. El cura argentino que tiende puentes en Medio Oriente,https://www.clarin.com/sociedad/cura-argentino-tiende-puentes-medio-oriente_0_WJh6ANF6W.html,https://images.clarin.com/2021/06/08/sXODazoQU_720x0__1.jpg
29,Xl9vyDWzU,Compras digitales. Todos los beneficios y descuentos de Clarín 365 en un solo lugar,https://www.clarin.com/brandstudio/beneficios-descuentos-clarin-365-solo-lugar_0_Xl9vyDWzU.html,https://images.clarin.com/2021/06/02/xLj5ue_qY_720x0__1.jpg
30,-Qll9r0qH,"Historias sobre ruedas. Frank Williams, un pionero en llevar petrodólares a la élite del deporte",https://www.clarin.com/deportes/increible-historia-frank-williams-medio-oriente-pionero-llevar-petrodolares-elite-deporte_0_-Qll9r0qH.html,https://images.clarin.com/2021/06/08/mp7DXZcNl_1256x620__2.jpg#1623204484924
31,TwqGaHeVc,"Triunfo de visitante. Brasil, imparable: venció a Paraguay, Neymar brilló y lleva seis triunfos al hilo",https://www.clarin.com/deportes/paraguay-vs-brasil-eliminatorias-sudamericanas-formaciones-horario-minuto-minuto_0_TwqGaHeVc.html,https://images.clarin.com/2021/06/08/ob4WRgGLj_720x0__1.jpg
32,VXYlt8LjL,Preocupó a todos. Emiliano Martínez habló tras su dura lesión y explicó por qué lo cambiaron,https://www.clarin.com/deportes/dura-lesion-dibu-martinez-obligo-dejar-cancha-ingreso-marchesin_0_VXYlt8LjL.html,https://images.clarin.com/2021/06/08/goPpJ9D4N_1256x620__2.jpg#1623203886606
33,M1PAPVfqz,Elegido MVP. El compañero estelar de Campazzo se llevó uno de los premios top de la NBA,https://www.clarin.com/deportes/basquet/companero-estelar-facundo-campazzo-nikola-dokic-elegido-jugador-valioso-temporada-nba_0_M1PAPVfqz.html,https://images.clarin.com/2021/06/08/xJTW5pPWG_1256x620__2.jpg#1623202390779
34,qwJsrchV8,Quién es Buendía. Se fue a los 11 y jugó para España: el argentino que sacudió la Premier,https://www.clarin.com/deportes/11-anos-real-madrid-jugo-sub-19-espana-eligio-argentina-emiliano-buendia-argentino-comprado-46-millones-dolares_0_qwJsrchV8.html,https://images.clarin.com/2021/06/08/GfyblXoA2_720x0__1.jpg
35,0g4U7RHb7,"Yao Cabrera, su rival. El Chino Maidana aceptó el desafío de pelear con un youtuber",https://www.clarin.com/deportes/chino-maidana-acepto-desafio-pelear-hizo-youtuber-yao-cabrera-voy-fajar-_0_0g4U7RHb7.html,https://images.clarin.com/2021/06/08/hzBTULr2l_720x0__1.jpg
36,UeAvCntSZ,Volvió a entrenar. El conmovedor esfuerzo de Del Potro para llegar a los Juegos de Tokio,https://www.clarin.com/deportes/conmovedor-esfuerzo-potro-llegar-juegos-olimpicos-tokio_0_UeAvCntSZ.html,https://images.clarin.com/2021/06/08/_snKkEtjt_720x0__1.jpg
37,fCNzDHb6s,"Especial para Clarín. La jerarquía, esa plusvalía que tienen pocos y que siempre marca la diferencia",https://www.clarin.com/deportes/jerarquia-plusvalia-pocos-siempre-marca-diferencia-grand-slam_0_fCNzDHb6s.html,https://images.clarin.com/2021/06/07/2aIogqNN-_720x0__1.jpg
38,mYJPEt-LW,"Tenía 34 años. ""Tanto ayudó a otros y ya no está"": dolor por la enfermera que murió pese a estar vacunada",https://www.clarin.com/ciudades/-equipo-mary-ayudo-dolor-companeras-enfermera-murio-pese-vacunada_0_mYJPEt-LW.html,https://images.clarin.com/2021/06/08/qP6W3ZBZm_1256x620__2.jpg#1623200763360
39,EofRLqMpS,"Hay 82.667 fallecidos. Un curioso cálculo de Vizzotti: dice que por la vacunación ""se evitaron 5.500 muertes""",https://www.clarin.com/sociedad/gobierno-asegura-avance-campana-vacunacion-evitaron-5-500-muertes-_0_EofRLqMpS.html,https://images.clarin.com/2021/06/02/5DgB6YJFD_720x0__1.jpg
40,EuOWiASPM,"En Casa Rosada. Con una agenda económica, Alberto F. recibe al español Pedro Sánchez",https://www.clarin.com/politica/agenda-economica-conferencia-aire-libre-alberto-fernandez-recibe-espanol-pedro-sanchez_0_EuOWiASPM.html,https://images.clarin.com/2021/05/22/Crwz61no0_720x0__1.jpg
41,Rx-UBTv5F,En redes sociales. Duro cruce entre Wado de Pedro y Patricia Bullrich por la falta de vacunas,https://www.clarin.com/politica/cruce-acusaciones-wado-pedro-patricia-bullrich-falta-vacunas_0_Rx-UBTv5F.html,https://images.clarin.com/2020/10/25/ynbWIQq78_720x0__1.jpg
42,aCNhGmssn3,Ante el Congreso. Pfizer negó un pedido de coimas y habló de la ley que impide un acuerdo,https://www.clarin.com/politica/laboratorios-van-congreso-explicar-demoras-vacunas_0_aCNhGmssn3.html,https://images.clarin.com/2021/06/08/goDaPJPCa_720x0__1.jpg
43,iZh9xkHbcC,"Educación. La UBA, otra vez la mejor universidad de Iberoamérica en un ránking mundial",https://www.clarin.com/sociedad/ranking-qs-quedo-ubicada-uba-resto-universidades-argentinas_0_iZh9xkHbcC.html,https://images.clarin.com/2021/06/08/Pzpe5vfKH_720x0__1.jpg
44,lgL15C56p,"Un clásico porteño. El nuevo ""Fechoría"", el restaurante favorito de los famosos que reabrió en Recoleta",https://www.clarin.com/gourmet/nuevo-fechoria-restaurante-favorito-famosos-reabrio-recoleta_0_lgL15C56p.html,https://images.clarin.com/2021/06/03/JZej3iC3v_1256x620__2.jpg#1622757559587
45,VEBJLxWwP,Niños en la web. Desafíos virales de TikTok: cómo proteger a los chicos,https://www.clarin.com/familias/desafios-virales-tiktok-proteger-chicos_0_VEBJLxWwP.html,https://images.clarin.com/2021/06/07/50etJ7_L6_720x0__1.jpg
46,NAIYlFb61,Dormir como un rey. Cuánto cuesta pasar la noche en el nuevo hotel del Palacio de Versalles,https://www.clarin.com/viajes/dormir-rey-cuesta-pasar-noche-nuevo-hotel-palacio-versalles_0_NAIYlFb61.html,https://images.clarin.com/2021/06/08/7O4L89dNg_720x0__1.jpg
47,3Ma_ngTwS,Llegará en 2022. Ford Maverick: se presentó la pickup que competirá con Fiat Toro,https://www.clarin.com/autos/ford-maverick-presento-pickup-competira-fiat-toro_0_3Ma_ngTwS.html,https://images.clarin.com/2021/06/08/ofVAP7-HT_720x0__1.jpg
48,_ld5DRHNM,Estudio. Autismo: descubren que el bilingüismo traería beneficios,https://www.clarin.com/buena-vida/autismo-descubren-bilinguismo-traeria-beneficios_0__ld5DRHNM.html,https://images.clarin.com/2021/06/07/KbkqNx3Wv_720x0__1.jpg
49,pSm7100W4,Nuevo estudio. ¿Protege la vitamina D contra casos graves de Covid?,https://www.clarin.com/buena-vida/-protege-vitamina-d-casos-graves-covid-_0_pSm7100W4.html,https://images.clarin.com/2021/06/04/uihw6TrB8_720x0__1.jpg
50,wCmduM45j,Recetas. Qué cocinar esta semana: menú día por día del 7 al 13 de junio,https://www.clarin.com/gourmet/que-cocinar-esta-semana-recetas_0_wCmduM45j.html,https://images.clarin.com/2021/05/10/afFixoKzm_720x0__1.jpg
51,khBVwqfXV,Clima energético. Eclipse solar y Luna nueva en Géminis 2021: significados astrológicos,https://www.clarin.com/astrologia/eclipse-solar-luna-nueva-geminis-2021-significados-astrologicos_0_khBVwqfXV.html,https://images.clarin.com/2021/06/08/dUx3vx_W__720x0__1.jpg
52,CMbDipbuI,"Estreno. El conjuro 3: Es verdad, aunque usted no lo crea",https://www.clarin.com/espectaculos/cine/conjuro-3-verdad--usted-crea_0_CMbDipbuI.html,https://images.clarin.com/2021/06/08/p46vjD12J_720x0__1.jpg
53,Ly7KG970d,"Máxima crueldad. Vampirismo, orgías y muerte: la aberrante historia de la condesa sangrienta",https://www.clarin.com/internacional/vampirismo-orgias-muerte-aberrante-historia-condesa-sangrienta-mayor-asesina-serial-historia_0_Ly7KG970d.html,https://images.clarin.com/2021/06/09/GqR0EAK3w_720x0__1.jpg
54,k-dIt93oM,Familia numerosa. Parto récord: una mujer sudafricana dio a luz a diez bebés,https://www.clarin.com/viste/parto-record-mujer-sudafricana-dio-luz-bebes_0_k-dIt93oM.html,https://images.clarin.com/2021/06/08/nIyZSYSpx_720x0__1.jpg
55,swhFDmWbv,"Robo virtual. Lo estafaron y luego se burlaron: ""Estoy disfrutando de tu platita""",https://www.clarin.com/viste/estafaron-transferencia-falsa-luego-burlaron-whatsapp-disfrutando-platita-_0_swhFDmWbv.html,https://images.clarin.com/2021/06/08/qRBa6JjJ1_720x0__1.jpg
56,PTWu0Tcst,Coronavirus. La estrella de un reality rechaza la vacuna y recomienda la meditación,https://www.clarin.com/internacional/estrella-reality-show-rechaza-vacuna-covid-recomienda-meditacion_0_PTWu0Tcst.html,https://images.clarin.com/2021/06/07/Pru0k8yFj_720x0__1.jpg
57,xpTZrdAiT,"Su historia. La Tierra de Mary Bird, el gigantesco desierto de hielo que ningún país reclama",https://www.clarin.com/internacional/tierra-mary-bird-gigantesco-desierto-hielo-pais-reclama_0_xpTZrdAiT.html,https://images.clarin.com/2021/03/19/WVdOJoGeo_720x0__1.jpg
58,108wbyoWX,"Colombia 2 - Argentina 2. Pese al empate del final, Scaloni se fue con más certezas que dudas",https://www.clarin.com/deportes/seleccion-arranque-voraz-escurrio-triunfo-scaloni-certezas-dudas_0_108wbyoWX.html,https://images.clarin.com/2021/06/08/CO2PuufRX_720x0__1.jpg
59,tzDAvGIBH,Foco económico. El dilema de saber cuánto cuesta una botella de aceite en Argentina,https://www.clarin.com/economia/dilema-saber-cuesta-botella-aceite-argentina_0_tzDAvGIBH.html,https://images.clarin.com/2021/06/08/eLEXpz8xL_720x0__1.jpg
60,Rvv0fWW5e,Mudanza a Italia. Se cansó de lucharla: convirtió su viñedo en leña y vendió el tractor para irse,https://www.clarin.com/economia/canso-lucharla-convirtio-vinedo-lena-vendio-tractor-irse-vivir-italia_0_Rvv0fWW5e.html,https://images.clarin.com/2021/06/08/huB1QHCUt_1256x620__2.jpg#1623198306957
61,R7s4p2BQn,"""No me ayuda nadie"". Los dramáticos mensajes de una mujer internada que murió por Covid",https://www.clarin.com/sociedad/-dejando-morir-desesperado-pedido-joven-32-anos-fallecio-coronavirus_0_R7s4p2BQn.html,https://images.clarin.com/2021/06/08/-qmlF9hFV_720x0__1.jpg
62,ypQGH4Hnx,"Defendió aumento. Una diputada K dijo que los sueldos de los legisladores ""daban vergüenza""",https://www.clarin.com/politica/polemica-defensa-fernanda-vallejos-aumento-40-sueldos-congreso-daban-verguenza-_0_ypQGH4Hnx.html,https://images.clarin.com/2020/02/02/7tuwNLfP_720x0__1.jpg
63,uE7adjrBF,Deuda. Guzmán sale a buscar $ 19.000 millones al mercado para financiar el déficit,https://www.clarin.com/economia/deuda-martin-guzman-sale-buscar-19-000-millones-mercado-financiar-deficit_0_uE7adjrBF.html,https://images.clarin.com/2021/03/04/788_kK-hV_720x0__1.jpg
64,dX0ixXB9y,Boletín Oficial. Era columnista de C5N y fue designada como directora del Banco Nación,https://www.clarin.com/politica/columnista-c5n-designada-directora-banco-nacion_0_dX0ixXB9y.html,https://images.clarin.com/2021/06/09/G8kfTBUD6_720x0__1.jpg
