n,id,title,url,image
1,hihyC82KO,Buscan consenso. La Casa Rosada acelera y le pone fecha a la reunión con la oposición para postergar las elecciones,https://www.clarin.com/politica/gobierno-acelera-puso-fecha-reunion-oposicion-postergar-paso_0_hihyC82KO.html,https://images.clarin.com/2021/03/30/fOhTOeBDS_720x0__1.jpg
2,tUukV6Yz-,Son 3 millones de dosis. El Gobierno ya le pagó a China US$ 60 millones por vacunas que aún no llegan,https://www.clarin.com/politica/gobierno-pago-china-60-millones-dolares-adelantado-3-millones-dosis-sinopharm-llegaron_0_tUukV6Yz-.html,https://images.clarin.com/2021/03/31/MpQEEX4n0_720x0__1.jpg
3,DOsgh0pI6,En foco. En Casa Rosada no salen de la trampa del Vacunatorio Vip,https://www.clarin.com/opinion/gobierno-sale-trampa-vacunatorio-vip_0_DOsgh0pI6.html,https://images.clarin.com/2021/01/22/OV5LSWmR5_720x0__1.jpg
4,6nTjiIN0M,"Del editor. Mucho virus, poca vacuna y encima un conflicto gremial",https://www.clarin.com/opinion/virus-poca-vacuna-encima-paro_0_6nTjiIN0M.html,https://images.clarin.com/2020/10/18/HQFmYt5QK_720x0__1.jpg
5,z8RGG_pM_,"Avanzada judicial. Un diputado K acusó a Majul de ""filtrar"" datos sobre fiscales y el periodista lo cruzó",https://www.clarin.com/politica/diputado-k-acuso-luis-majul-filtrar-informacion-fiscales-periodista-trato-energumeno-machista-_0_z8RGG_pM_.html,https://images.clarin.com/2020/03/04/vNvDFPyv_720x0__1.jpg
6,YJHvxdyX6,En la Ciudad. Docentes en espera y prioridad a los mayores de 60: el plan para vacunar,https://www.clarin.com/ciudades/docentes-espera-prioridad-mayores-60-plan-ciudad-vacunar-segunda-ola_0_YJHvxdyX6.html,https://images.clarin.com/2021/03/10/DcUvih7I93_1256x620__2.jpg#1617142147491
7,KjIx_uFwk,Tras las demoras. Comenzaron a vacunar a mayores de 75 y el jueves inscriben a los +70,https://www.clarin.com/ciudades/empezo-vacunacion-mayores-75-dieron-10-mil-turnos-jueves-inscriben-70_0_KjIx_uFwk.html,https://images.clarin.com/2021/03/31/sr8WVp_S3_1256x620__2.jpg#1617202760860
8,cjuPx7Viq,"Stablecoins. ""Dólares digitales"" sin cepo ni límites: cómo se compran",https://www.clarin.com/servicios/stablecoins-dolares-digitales-cepo-limites-compran-argentina_0_cjuPx7Viq.html,https://images.clarin.com/2019/11/21/qrXWapBB_720x0__1.jpg
9,J0JnNvxtB5,"La mano de Moscú. Desarman una trama de espías en Italia: euros, secretos y ""topos"" en un estacionamiento",https://www.clarin.com/mundo/desarman-trama-espias-italia-secretos-euros-topos-estacionamiento-roma_0_J0JnNvxtB5.html,https://images.clarin.com/2021/03/31/DK3ZFz0w5_1256x620__2.jpg#1617199164650
10,CqePc4xys,Quiénes deben hacérselos. Preocupa la baja en los controles para detectar cáncer de colon,https://www.clarin.com/buena-vida/preocupa-baja-controles-detectar-cancer-colon-deben-hacerselos_0_CqePc4xys.html,https://images.clarin.com/2021/03/30/_y9qYRiS1_720x0__1.jpg
11,x-zHdSAQD,Especial Clarín. Las sorprendentes islas trillizas que aparecieron frente a San Isidro,https://www.clarin.com/zonales/sorprendentes-islas-trillizas-san-isidro-formo-nuevo-delta-rio-plata_0_x-zHdSAQD.html,https://images.clarin.com/2021/03/23/4B_OFn6QH_1256x620__2.jpg#1616519108321
12,H5I4Tv79Y,Wall Street. Los bancos enfrentan pérdidas multimillonarias,https://www.clarin.com/new-york-times-international-weekly/bancos-enfrentan-perdidas-multimillonarias-apuesta-viacomcbs_0_H5I4Tv79Y.html,https://images.clarin.com/2021/03/30/V8z34yLyn_720x0__1.jpg
13,hihyC82KO,Buscan consenso. La Casa Rosada acelera y le pone fecha a la reunión con la oposición para postergar las elecciones,https://www.clarin.com/politica/gobierno-acelera-puso-fecha-reunion-oposicion-postergar-paso_0_hihyC82KO.html,https://images.clarin.com/2021/03/30/fOhTOeBDS_720x0__1.jpg
14,tUukV6Yz-,Son 3 millones de dosis. El Gobierno ya le pagó a China US$ 60 millones por vacunas que aún no llegan,https://www.clarin.com/politica/gobierno-pago-china-60-millones-dolares-adelantado-3-millones-dosis-sinopharm-llegaron_0_tUukV6Yz-.html,https://images.clarin.com/2021/03/31/MpQEEX4n0_720x0__1.jpg
15,DOsgh0pI6,En foco. En Casa Rosada no salen de la trampa del Vacunatorio Vip,https://www.clarin.com/opinion/gobierno-sale-trampa-vacunatorio-vip_0_DOsgh0pI6.html,https://images.clarin.com/2021/01/22/OV5LSWmR5_720x0__1.jpg
16,6nTjiIN0M,"Del editor. Mucho virus, poca vacuna y encima un conflicto gremial",https://www.clarin.com/opinion/virus-poca-vacuna-encima-paro_0_6nTjiIN0M.html,https://images.clarin.com/2020/10/18/HQFmYt5QK_720x0__1.jpg
17,z8RGG_pM_,"Avanzada judicial. Un diputado K acusó a Majul de ""filtrar"" datos sobre fiscales y el periodista lo cruzó",https://www.clarin.com/politica/diputado-k-acuso-luis-majul-filtrar-informacion-fiscales-periodista-trato-energumeno-machista-_0_z8RGG_pM_.html,https://images.clarin.com/2020/03/04/vNvDFPyv_720x0__1.jpg
18,YJHvxdyX6,En la Ciudad. Docentes en espera y prioridad a los mayores de 60: el plan para vacunar,https://www.clarin.com/ciudades/docentes-espera-prioridad-mayores-60-plan-ciudad-vacunar-segunda-ola_0_YJHvxdyX6.html,https://images.clarin.com/2021/03/10/DcUvih7I93_1256x620__2.jpg#1617142147491
19,KjIx_uFwk,Tras las demoras. Comenzaron a vacunar a mayores de 75 y el jueves inscriben a los +70,https://www.clarin.com/ciudades/empezo-vacunacion-mayores-75-dieron-10-mil-turnos-jueves-inscriben-70_0_KjIx_uFwk.html,https://images.clarin.com/2021/03/31/sr8WVp_S3_1256x620__2.jpg#1617202760860
20,cjuPx7Viq,"Stablecoins. ""Dólares digitales"" sin cepo ni límites: cómo se compran",https://www.clarin.com/servicios/stablecoins-dolares-digitales-cepo-limites-compran-argentina_0_cjuPx7Viq.html,https://images.clarin.com/2019/11/21/qrXWapBB_720x0__1.jpg
21,9CsI538Ep,"Entrevista exclusiva. Japón va a fondo con Tokio 2020: ""Cancelar los Juegos Olímpicos sería muy cruel""",https://www.clarin.com/deportes/embajador-tokio-2020-cancelar-juegos-olimpicos-cruel-atletas-miercoles-_0_9CsI538Ep.html,https://images.clarin.com/2021/03/29/bkh01H7CI_720x0__1.jpg
22,PHljo4GLw,Dos décadas. Por qué Boca supera a River en el ránking del siglo XXI de la IFFHS,https://www.clarin.com/deportes/boca-supera-river-ranking-siglo-xxi-iffhs_0_PHljo4GLw.html,https://images.clarin.com/2021/03/30/6osu3axHB_720x0__1.jpg
23,6c9VjWSrp,Cambio de época. La era de los entrenadores: ¿son más protagonistas que los jugadores?,https://www.clarin.com/deportes/entrenadores-protagonistas-jugadores-_0_6c9VjWSrp.html,https://images.clarin.com/2021/03/28/5LRl5Z7Tl_1256x620__3.jpg#1617152355400
24,lIRFOasIF,¿Llegará la oferta?. Santos Borré saltó del pase caído a Gremio al nuevo interés de Lazio,https://www.clarin.com/deportes/borre-caido-gremio-volvio-lazio-river_0_lIRFOasIF.html,https://images.clarin.com/2021/03/04/nRiIzy_Am_720x0__1.jpg
25,-ddBjk52S,Un sueño. Independiente se juega una patriada y hará un intento por la vuelta de Agüero,https://www.clarin.com/deportes/independiente-juega-patriada-hara-intento-vuelta-kun-aguero_0_-ddBjk52S.html,https://images.clarin.com/2021/03/30/8PNasw2CP_1256x620__2.jpg#1617132990504
26,Tq1pYokDs,"Victoria de Denver. Campazzo y el topetazo que hizo ""volar"" a un rival de 2,11",https://www.clarin.com/deportes/facundo-campazzo-erratico-aporto-defensa-victoria-denver-nuggets-philadelphia-76ers_0_Tq1pYokDs.html,https://images.clarin.com/2021/03/31/MwX7MU8MA_720x0__1.jpg
27,JgZvWmdvw,Eliminado. Schwartzman fue sorprendido por Korda y quedó afuera en Miami,https://www.clarin.com/deportes/tenis/diego-schwartzman-sorprendido-joven-korda-quedo-afuera-masters-miami_0_JgZvWmdvw.html,https://images.clarin.com/2021/03/30/r2INj2p0R_1256x620__2.jpg#1617153454117
28,kgkJCD_cj,"River. Driussi ""no aguanta más"" sus ganas de volver: cuándo puede regresar",https://www.clarin.com/deportes/sebastian-driussi-aguanta-ganas-volver-river-puede-regresar_0_kgkJCD_cj.html,https://images.clarin.com/2017/04/23/SkjyOepV-_720x0.jpg
29,my1XhR-ap,Hasta el 15 de mayo. Extienden Precios Máximos sin cambios pese a la oposición de las empresas,https://www.clarin.com/economia/gobierno-extiende-programa-precios-maximos-cambios-pese-oposicion-empresas_0_my1XhR-ap.html,https://images.clarin.com/2021/02/14/QfYSBPgTu_720x0__1.jpg
30,vpF33xfdE,Inflación. La canasta de los jubilados ya triplica el haber mínimo y llega a $ 64.039,https://www.clarin.com/economia/canasta-jubilados-triplica-minimo-llega-64-039_0_vpF33xfdE.html,https://images.clarin.com/2021/03/17/zsF0fYNWF_720x0__1.jpg
31,JT9wA-RGY,Becas. Bono de $ 8.500: los requisitos y cuándo abre la inscripción para cobrarlo,https://www.clarin.com/economia/bono-8-500-requisitos-abre-inscripcion-cobrar-beneficio_0_JT9wA-RGY.html,https://images.clarin.com/2021/03/05/-Yrnbd3dJ_720x0__1.jpg
32,G7ByFTQ_H,"Caso Ciccone. Tras el fallo a su favor, Boudou festejó la asunción de Soria en Justicia",https://www.clarin.com/politica/fallo-favor-amado-boudou-celebro-asuncion-martin-soria-justicia_0_G7ByFTQ_H.html,https://images.clarin.com/2019/03/26/nhpsJMaMW_720x0__1.jpg
33,5vji_ec90,"Gordon Liddy. El cerebro del Watergate y asesor de Richard Nixon, murió a los 90 años",https://www.clarin.com/mundo/gordon-liddy-cerebro-watergate-asesor-richard-nixon-murio-90-anos_0_5vji_ec90.html,https://images.clarin.com/2021/03/31/MMjTqNuwN_720x0__1.jpg
34,qITctEs9E,"Walter Braga Netto. El ministro de Defensa de Brasil pide ""celebrar"" el golpe del 64",https://www.clarin.com/mundo/ministro-defensa-brasil-walter-braga-netto-pide-celebrar-golpe-64_0_qITctEs9E.html,https://images.clarin.com/2021/03/31/1dmBDkX_-_1256x620__2.jpg#1617198365094
35,Cpndb5rm4,Luego de tres días. Autorizaron el ingreso al país de 86 varados en la frontera con Paso de los Libres,https://www.clarin.com/sociedad/autorizaron-ingreso-pais-86-varados-frontera-paso-libres_0_Cpndb5rm4.html,https://images.clarin.com/2021/03/29/9Onz0t1Ha_720x0__1.jpg
36,m-Air23Zu,Ahora 12. Últimas horas para comprar en cuotas con 3 meses de gracia,https://www.clarin.com/servicios/ahora-12-ultimas-horas-comprar-cuotas-3-meses-gracia-empezar-pagar-julio_0_m-Air23Zu.html,https://images.clarin.com/2021/03/29/S9vrG8LyK_720x0__1.jpg
37,SSuK4RA2Q,Pistantrofobia. La traición que enferma,https://www.clarin.com/relaciones/pistantrofobia-traicion-enferma_0_SSuK4RA2Q.html,https://images.clarin.com/2021/03/30/O_2UuX53w_720x0__1.jpg
38,zLgUWZqKK,Todo casero. Menú para Semana Santa: 35 recetas saladas y dulces para estas Pascuas,https://www.clarin.com/gourmet/menu-para-semana-santa-35-recetas-para-estas-pascuas_0_zLgUWZqKK.html,https://images.clarin.com/2020/04/06/Hqo2lN-ZX_720x0__1.jpg
39,a-hdOr_hI,¿Se te mueren las plantas?. Estos son los errores más frecuentes en toda huerta urbana,https://www.clarin.com/familias/errores-frecuentes-toda-huerta-urbana_0_a-hdOr_hI.html,https://images.clarin.com/2021/03/30/GatiKKf0s_720x0__1.jpg
40,BlNNiYOc4,"""Voltswagen"". La broma de Volkswagen con una audaz estrategia de marketing",https://www.clarin.com/autos/broma-volkswagen-causo-enojo-prensa-audaz-estrategia-marketing_0_BlNNiYOc4.html,https://images.clarin.com/2021/03/30/vx59ShnOi_720x0__1.jpg
41,ECGDFN6-U,Turismo y religión. Semana Santa 2021: la agenda de actividades en los destinos turísticos,https://www.clarin.com/viajes/semana-santa-2021-agenda-actividades-destinos-turisticos_0_ECGDFN6-U.html,https://images.clarin.com/2019/04/07/B8vzH-LXw_720x0__1.jpg
42,TsiWYq377,"Streaming. Los argentinos, adictos a Netflix: es el segundo país donde más se usa",https://www.clarin.com/tecnologia/argentinos-adictos-netflix-segundo-pais-usa-plataforma_0_TsiWYq377.html,https://images.clarin.com/2021/03/04/f7Ogfa62s_720x0__1.jpg
43,8QFV8x1N7,Vuelos cancelados. Qué hacer con las reservas de pasajes aéreos y paquetes turísticos,https://www.clarin.com/viajes/suspension-vuelos-hacer-reservas-pasajes-aereos-paquetes-turisticos_0_8QFV8x1N7.html,https://images.clarin.com/2021/03/30/vxS-J7KUI_720x0__1.jpg
44,tZh2AIvN8,Tecno. Inventan el casco más seguro para ciclistas,https://www.clarin.com/viva/inventan-casco-seguro-ciclistas_0_tZh2AIvN8.html,https://images.clarin.com/2021/03/29/lA19vmV_6_720x0__1.jpg
45,xAlSb-FpC,"Experiencia. ""Pude ver la galaxia"": así explica una joven lo que sintió al ""morir"" durante 7 minutos",https://www.clarin.com/internacional/-pude-ver-galaxia-explica-joven-sintio-morir-7-minutos_0_xAlSb-FpC.html,https://images.clarin.com/2021/03/30/a9D9b_pfH_720x0__1.jpg
46,tp1HjSC0w,"Furor en China. El joven que trabaja como ""hombre alarma"" y gana miles de dólares por mes",https://www.clarin.com/viste/joven-trabaja-hombre-alarma-gana-miles-dolares-mes_0_tp1HjSC0w.html,https://images.clarin.com/2021/03/30/Puwn3gfo9_720x0__1.jpg
47,CBuKt33Mc,Inexplicable. Los conejos mutantes que caminan con sus patas delanteras,https://www.clarin.com/viste/conejos-mutantes-caminan-patas-delanteras_0_CBuKt33Mc.html,https://images.clarin.com/2021/03/30/JatGdrfdi_720x0__1.jpg
48,QjPX_Gydk,Fabuloso. Crearon ruedas para bicicleta que no necesitan inflarse y no se pinchan,https://www.clarin.com/viste/crearon-ruedas-bicicleta-necesitan-inflarse-pinchan_0_QjPX_Gydk.html,https://images.clarin.com/2021/03/30/7-ZDb8_0q_720x0__1.jpg
49,A_FU0gqUg,"Solo hay 666 pares. Escándalo por unas zapatillas ""satánicas"" hechas con sangre",https://www.clarin.com/viste/escandalo-zapatillas-satanicas-nike-autorizadas_0_A_FU0gqUg.html,https://images.clarin.com/2021/03/30/93Zzh5fh2_720x0__1.jpg
50,M_WIR1LZb,TAG. Diseño top en la zona más trendy de La Imprenta,https://www.clarin.com/mercado-inmobiliario/tag-diseno-top-zona-trendy-imprenta_0_M_WIR1LZb.html,https://images.clarin.com/2021/02/04/Uyvu9O4eA_720x0__1.jpg
51,PM-FaXR4l,"Comodidad. La libertad de elegir un plan ""a tu medida"" en Palermo Hollywood",https://www.clarin.com/mercado-inmobiliario/libertad-elegir-plan-medida-palermo-hollywood_0_PM-FaXR4l.html,https://images.clarin.com/2021/01/29/WCmrb3LzL_720x0__1.jpg
52,vLyfzHpi7,Distrito Colegiales. Invertí en el proyecto más emblemático de la Ciudad de Buenos Aires,https://www.clarin.com/mercado-inmobiliario/distrito-colegiales-inverti-proyecto-emblematico-ciudad-buenos-aires_0_vLyfzHpi7.html,https://images.clarin.com/2021/02/01/ZjrIqHX_0_720x0__1.jpg
53,d7GR8WGdY,Proyecto de Branson. Mine Newbery: la nueva estrella de La Imprenta,https://www.clarin.com/mercado-inmobiliario/mine-newbery-proyecto-imperdible-pleno-barrio-imprenta_0_d7GR8WGdY.html,https://images.clarin.com/2020/11/09/61Go-_7CD_720x0__1.jpg
54,sm95sswMb,"Contactos. Cómo invertir en Arévalo Estudios, producto premium en Palermo",https://www.clarin.com/mercado-inmobiliario/invertir-arevalo-estudios-producto-premium-palermo_0_sm95sswMb.html,https://images.clarin.com/2021/02/18/vo2mh-Sgc_720x0__1.jpg
55,gTh2bCqVC,"Difunden datos oficiales. En los últimos tres años, la cantidad de pobres subió de 11 a 19 millones de personas",https://www.clarin.com/economia/solo-anos-pobreza-subio-11-millones-19-millones-personas_0_gTh2bCqVC.html,https://images.clarin.com/2021/03/24/9dZVcH9Y1_1256x620__2.jpg#1617195581016
56,0FuSiixrl,"La interna opositora. Midieron por primera vez a dos ""presidenciables"" de la UCR: cómo les fue",https://www.clarin.com/politica/midieron-primera-vez-presidenciables-ucr-provincia-provincia_0_0FuSiixrl.html,https://images.clarin.com/2021/03/31/D5h_NK9e5_720x0__1.jpg
57,rQlORpTki,"La segunda ola. Provincia y una cuarentena estricta: ""Si hay que hacerlo, hay que hacerlo""",https://www.clarin.com/politica/provincia-posible-vuelta-cuarentena-estricta-hacerlo-hacerlo-_0_rQlORpTki.html,https://images.clarin.com/2020/12/30/Q7il3BBwR_1256x620__2.jpg#1617194693301
58,CTDfWkKOS,Coronavirus. Qué variantes se detectaron en el país y cuánto más contagian,https://www.clarin.com/sociedad/coronavirus-variantes-detectaron-ahora-argentina-contagian_0_CTDfWkKOS.html,https://images.clarin.com/2020/04/02/S4WpOnmwM_1256x620__3.jpg#1617142609082
59,DRMI9HOjs,"""Ahora te toca a vos"". El pedido a políticos de un empresario que pagó el impuesto a la riqueza",https://www.clarin.com/economia/ahora-toca-vos-pedido-empresario-pagar-impuesto-riqueza_0_DRMI9HOjs.html,https://images.clarin.com/2021/03/30/PjuplIZfl_720x0__1.jpg
60,pP0jxv72R,Violencia de género. La fiscalía pide que detengan al ex de la joven que murió al caer de un cuarto piso,https://www.clarin.com/policiales/murio-caer-cuarto-piso-fiscalia-pide-vuelvan-detener-ex_0_pP0jxv72R.html,https://images.clarin.com/2020/03/17/krLcmDgm_1256x620__2.jpg#1617199174166
61,p_LxAKDVA,En Tandil. Un incendio arrasó una planta de una tradicional empresa de chacinados,https://www.clarin.com/sociedad/video-incendio-arraso-planta-tradicional-empresa-chacinados-cagnoli-tandil_0_p_LxAKDVA.html,https://images.clarin.com/2021/03/31/wO2M0xCxL_1256x620__2.jpg#1617191327287
62,rxH0HjPze,Agua segura. Un proyecto que hace foco en las comunidades más vulnerables,https://www.clarin.com/brandstudio/-ampliar-acceso-agua-segura-proyecto-hace-foco-comunidades-vulnerables_0_rxH0HjPze.html,https://images.clarin.com/2021/03/19/bPZ9t_adI_720x0__1.jpg
63,Qhr07M4lm,"Mechi Margalot. ""Quería ser la Miguel Simón de las mujeres, nunca imaginé que en el relato""",https://www.clarin.com/deportes/mechi-margalot-queria-miguel-simon-mujeres-imagine-relato-_0_Qhr07M4lm.html,https://images.clarin.com/2021/03/30/_tx_xyyXa_1256x620__2.jpg#1617157871513
64,HhW213bjp,VSS Imagine. Así es la nueva nave espacial retro-futurista que llevará turistas espaciales,https://www.clarin.com/tecnologia/vss-imagine-nueva-nave-espacial-retro-futurista-virgin-galactic_0_HhW213bjp.html,https://images.clarin.com/2021/03/31/flvxOGLIc_720x0__1.jpg
65,Dw1tRGhrx,"Murió en 1984. Acusaron a Foucault de abusar de menores en África: ""Era un tipo horrible""",https://www.clarin.com/cultura/37-anos-muerte-acusaron-michel-foucault-abusar-menores-africa-tipo-horrible-_0_Dw1tRGhrx.html,https://images.clarin.com/2018/02/23/ryazEZRwf_720x0__1.jpg
66,UTMSrVvYe,"Con Clarín. Raff Law, el hijo de Jude Law: dos gotas de agua",https://www.clarin.com/espectaculos/cine/raff-law-hijo-jude-law-gotas-agua_0_UTMSrVvYe.html,https://images.clarin.com/2021/03/31/ZY6xYW4WS_720x0__1.jpg
67,C-R8E003W,"Estreno. Cómo es ""Caos: El inicio"", con Spiderman y Rey Skywalker",https://www.clarin.com/espectaculos/cine/caos-inicio-spiderman-rey-skywalker_0_C-R8E003W.html,https://images.clarin.com/2021/03/31/65c663mB__720x0__1.jpg
68,QJBQ69l0_,"EE.UU.. Marte, el pueblito de otro planeta en donde Trump es el más popular de todos",https://www.clarin.com/mundo/marte-pueblito-planeta-donald-trump-popular_0_QJBQ69l0_.html,https://images.clarin.com/2021/03/31/SmPSONMVZ_1256x620__2.jpg#1617196453402
69,R0fnsjAi2,Debate. ¿El siglo XXI matará a la monogamia?,https://www.clarin.com/viva/debate-siglo-xxi-matara-monogamia-_0_R0fnsjAi2.html,https://images.clarin.com/2021/03/29/ZokerzI6m_720x0__1.jpg
70,XTuDJ8Wcy,Claves para ahorrar. Cuáles son las mejores opciones para calefaccionar el hogar,https://www.clarin.com/brandstudio/mejores-opciones-calefaccionar-hogar_0_XTuDJ8Wcy.html,https://images.clarin.com/2021/03/26/PAeUxtwqx_720x0__1.jpg
71,ZUV4Pwlt-,En primera persona. Cuando la publicidad ayuda a derribar mandatos y estereotipos,https://www.clarin.com/brandstudio/publicidad-ayuda-derribar-mandatos-estereotipos_0_ZUV4Pwlt-.html,https://images.clarin.com/2021/02/17/qdc_015op_1256x620__3.jpg#1617041077301
72,Qhr07M4lm,"Mechi Margalot. ""Quería ser la Miguel Simón de las mujeres, nunca imaginé que en el relato""",https://www.clarin.com/deportes/mechi-margalot-queria-miguel-simon-mujeres-imagine-relato-_0_Qhr07M4lm.html,https://images.clarin.com/2021/03/30/_tx_xyyXa_1256x620__2.jpg#1617157871513
73,HhW213bjp,VSS Imagine. Así es la nueva nave espacial retro-futurista que llevará turistas espaciales,https://www.clarin.com/tecnologia/vss-imagine-nueva-nave-espacial-retro-futurista-virgin-galactic_0_HhW213bjp.html,https://images.clarin.com/2021/03/31/flvxOGLIc_720x0__1.jpg
74,Dw1tRGhrx,"Murió en 1984. Acusaron a Foucault de abusar de menores en África: ""Era un tipo horrible""",https://www.clarin.com/cultura/37-anos-muerte-acusaron-michel-foucault-abusar-menores-africa-tipo-horrible-_0_Dw1tRGhrx.html,https://images.clarin.com/2018/02/23/ryazEZRwf_720x0__1.jpg
75,UTMSrVvYe,"Con Clarín. Raff Law, el hijo de Jude Law: dos gotas de agua",https://www.clarin.com/espectaculos/cine/raff-law-hijo-jude-law-gotas-agua_0_UTMSrVvYe.html,https://images.clarin.com/2021/03/31/ZY6xYW4WS_720x0__1.jpg
76,C-R8E003W,"Estreno. Cómo es ""Caos: El inicio"", con Spiderman y Rey Skywalker",https://www.clarin.com/espectaculos/cine/caos-inicio-spiderman-rey-skywalker_0_C-R8E003W.html,https://images.clarin.com/2021/03/31/65c663mB__720x0__1.jpg
77,QJBQ69l0_,"EE.UU.. Marte, el pueblito de otro planeta en donde Trump es el más popular de todos",https://www.clarin.com/mundo/marte-pueblito-planeta-donald-trump-popular_0_QJBQ69l0_.html,https://images.clarin.com/2021/03/31/SmPSONMVZ_1256x620__2.jpg#1617196453402
78,R0fnsjAi2,Debate. ¿El siglo XXI matará a la monogamia?,https://www.clarin.com/viva/debate-siglo-xxi-matara-monogamia-_0_R0fnsjAi2.html,https://images.clarin.com/2021/03/29/ZokerzI6m_720x0__1.jpg
79,XTuDJ8Wcy,Claves para ahorrar. Cuáles son las mejores opciones para calefaccionar el hogar,https://www.clarin.com/brandstudio/mejores-opciones-calefaccionar-hogar_0_XTuDJ8Wcy.html,https://images.clarin.com/2021/03/26/PAeUxtwqx_720x0__1.jpg
80,ZUV4Pwlt-,En primera persona. Cuando la publicidad ayuda a derribar mandatos y estereotipos,https://www.clarin.com/brandstudio/publicidad-ayuda-derribar-mandatos-estereotipos_0_ZUV4Pwlt-.html,https://images.clarin.com/2021/02/17/qdc_015op_1256x620__3.jpg#1617041077301
