n,id,title,url,image
1,EryXqkccR,Inseguridad en el GBA. El motochorro que mató a la psicóloga había sido liberado en la pandemia: volvieron a detenerlo,https://www.clarin.com/sociedad/detuvieron-motochorro-asesino-psicologa-ramos-mejia-liberado-pandemia_0_EryXqkccR.html,https://images.clarin.com/2021/03/22/Z9f5evm6Y_720x0__1.jpg
2,RNJpImx4w,Del editor. Radicales en su salsa: las internas,https://www.clarin.com/opinion/radicales-salsa-internas_0_RNJpImx4w.html,https://images.clarin.com/2021/03/22/u9CPsqvOA_720x0__1.jpg
3,zG7wW6avA,"País adolescente. La economía no explota, pero la Argentina languidece",https://www.clarin.com/opinion/economia-explota-argentina-languidece_0_zG7wW6avA.html,https://images.clarin.com/2020/09/25/jBbGb_0rv_720x0__1.jpg
4,rSEDKjKQT,Coronavirus. El mito de que los vacunados no se infectan y qué cambia al estar inmunizado,https://www.clarin.com/sociedad/coronavirus-mito-vacunados-infectan-contagian-cambia-inmunizado_0_rSEDKjKQT.html,https://images.clarin.com/2021/03/17/9I4RSuVmk_720x0__1.jpg
5,Tqcv1FLZo,Más irregularidades. En Avellaneda vacunaron a una joven de 18 años que milita con Ferraresi,https://www.clarin.com/politica/avellaneda-vacunaron-joven-18-anos-milita-jorge-ferraresi_0_Tqcv1FLZo.html,https://images.clarin.com/2021/03/22/JGmezxLvN_1256x620__2.jpg#1616456763283
6,joS2Rrt_r,Buscan justificarla. Qué dijeron en el entorno del ministro sobre la militante vacunada,https://www.clarin.com/zonales/explicacion-entorno-jorge-ferraresi-militante-18-anos-vacunada-avellaneda-turno-app-pudo-dicho-_0_joS2Rrt_r.html,https://images.clarin.com/2021/03/22/KM5zoMsr0_720x0__1.jpg
7,mvK_A0kpC,15 encuestas bajo la lupa: políticos top y los temas más calientes,https://www.clarin.com/politica/15-encuestas-lupa-ranking-politicos-top-temas-calientes-ano-electoral_0_mvK_A0kpC.html,https://images.clarin.com/2021/03/22/N4YXAnxMc_720x0__1.jpg
8,P8pQk4sDZ,Desde el 1 de abril. Cuánto habrá que pagar para sacar plata de los cajeros y en qué casos seguirá siendo gratis,https://www.clarin.com/servicios/pagar-sacar-plata-cajeros-automaticos-casos-seguira-gratis_0_P8pQk4sDZ.html,https://images.clarin.com/2020/04/04/KASyjwKAd_720x0__1.jpg
9,AzFvts3s1,Subdiagnóstico. Advierten por un trastorno gastrointestinal que se confunde con la acidez,https://www.clarin.com/buena-vida/advierten-trastorno-gastrointestinal-confunde-acidez_0_AzFvts3s1.html,https://images.clarin.com/2021/03/22/my3wdt2Fs_720x0__1.jpg
10,pP8MwrRPe,"Por la pandemia. Cerró La Puerto Rico, un bar notable con más de 100 años de historia",https://www.clarin.com/ciudades/cerro-puerto-rico-bar-notable-100-anos-historia_0_pP8MwrRPe.html,https://images.clarin.com/2021/03/22/R0Q8g4gPW_1256x620__2.jpg#1616453897274
11,nzb4AjGW0,Coronavirus. La vacunación en Europa falló. Estas son las razones,https://www.clarin.com/new-york-times-international-weekly/vacunacion-europa-fallo-razones_0_nzb4AjGW0.html,https://images.clarin.com/2021/03/22/BdEWiI7LE_720x0__1.jpg
12,zL4jCEneQ,Modern Love. Por qué hice un voto de celibato,https://www.clarin.com/new-york-times-international-weekly/hice-voto-celibato_0_zL4jCEneQ.html,https://images.clarin.com/2021/03/22/8n3ZLdlYz_720x0__1.jpg
13,MC07HuGsg,Opinión. ¡Cristianos progresistas levántense! ¡Aleluya!,https://www.clarin.com/new-york-times-international-weekly/-cristianos-progresistas-levantense-aleluya-_0_MC07HuGsg.html,https://images.clarin.com/2021/03/22/tF_Piv5v3_720x0__1.jpg
14,EScaQDtGf,AstraZeneca. Un ensayo clínico en EE.UU. demostró una eficacia del 79%,https://www.clarin.com/new-york-times-international-weekly/vacuna-astrazeneca-ensayo-clinico-ee-uu-demostro-eficacia-79-_0_EScaQDtGf.html,https://images.clarin.com/2021/03/22/I_ttEoNil_720x0__1.jpg
15,EryXqkccR,Inseguridad en el GBA. El motochorro que mató a la psicóloga había sido liberado en la pandemia: volvieron a detenerlo,https://www.clarin.com/sociedad/detuvieron-motochorro-asesino-psicologa-ramos-mejia-liberado-pandemia_0_EryXqkccR.html,https://images.clarin.com/2021/03/22/Z9f5evm6Y_720x0__1.jpg
16,RNJpImx4w,Del editor. Radicales en su salsa: las internas,https://www.clarin.com/opinion/radicales-salsa-internas_0_RNJpImx4w.html,https://images.clarin.com/2021/03/22/u9CPsqvOA_720x0__1.jpg
17,zG7wW6avA,"País adolescente. La economía no explota, pero la Argentina languidece",https://www.clarin.com/opinion/economia-explota-argentina-languidece_0_zG7wW6avA.html,https://images.clarin.com/2020/09/25/jBbGb_0rv_720x0__1.jpg
18,rSEDKjKQT,Coronavirus. El mito de que los vacunados no se infectan y qué cambia al estar inmunizado,https://www.clarin.com/sociedad/coronavirus-mito-vacunados-infectan-contagian-cambia-inmunizado_0_rSEDKjKQT.html,https://images.clarin.com/2021/03/17/9I4RSuVmk_720x0__1.jpg
19,Tqcv1FLZo,Más irregularidades. En Avellaneda vacunaron a una joven de 18 años que milita con Ferraresi,https://www.clarin.com/politica/avellaneda-vacunaron-joven-18-anos-milita-jorge-ferraresi_0_Tqcv1FLZo.html,https://images.clarin.com/2021/03/22/JGmezxLvN_1256x620__2.jpg#1616456763283
20,joS2Rrt_r,Buscan justificarla. Qué dijeron en el entorno del ministro sobre la militante vacunada,https://www.clarin.com/zonales/explicacion-entorno-jorge-ferraresi-militante-18-anos-vacunada-avellaneda-turno-app-pudo-dicho-_0_joS2Rrt_r.html,https://images.clarin.com/2021/03/22/KM5zoMsr0_720x0__1.jpg
21,mvK_A0kpC,15 encuestas bajo la lupa: políticos top y los temas más calientes,https://www.clarin.com/politica/15-encuestas-lupa-ranking-politicos-top-temas-calientes-ano-electoral_0_mvK_A0kpC.html,https://images.clarin.com/2021/03/22/N4YXAnxMc_720x0__1.jpg
22,P8pQk4sDZ,Desde el 1 de abril. Cuánto habrá que pagar para sacar plata de los cajeros y en qué casos seguirá siendo gratis,https://www.clarin.com/servicios/pagar-sacar-plata-cajeros-automaticos-casos-seguira-gratis_0_P8pQk4sDZ.html,https://images.clarin.com/2020/04/04/KASyjwKAd_720x0__1.jpg
23,IjPE2jxOt,"Tiene 33 años. Flores de Bach, el secreto que le permitió a Messi estar mejor físicamente que a los 20",https://www.clarin.com/deportes/flores-bach-secreto-permitio-messi-mejor-fisicamente-20_0_IjPE2jxOt.html,https://images.clarin.com/2021/02/21/48CYz6Afy_1256x620__2.jpg#1616465621779
24,PPxKCkjjVX,Ante Argentinos. Racing mejoró con los cambios y metió su cuarta victoria al hilo,https://www.clarin.com/deportes/racing-vs-argentinos-juniors-copa-liga-profesional-futbol-victoria-miranda-pizzi_0_PPxKCkjjVX.html,https://images.clarin.com/2021/03/22/EjTQkFg37_1256x620__2.jpg#1616464609937
25,n3y8JlL70,Juegos Olímpicos. Del Potro vuelve a operarse de la rodilla con la ilusión de poder estar en Tokio,https://www.clarin.com/deportes/potro-vuelve-operarse-rodilla-ilusion-poder-juegos-olimpicos-tokio_0_n3y8JlL70.html,https://images.clarin.com/2021/03/10/4ruf40_gi_1256x620__3.jpg#1616446542445
26,iBlZL32qk,"Miami Open. Sin Djokovic, Nadal ni Federer, arranca un torneo marcado por las ausencias",https://www.clarin.com/deportes/djokovic-nadal-federer-arranca-miami-open-marcado-grandes-ausencias_0_iBlZL32qk.html,https://images.clarin.com/2019/03/29/wWGmWIFxq_1256x620__2.jpg#1616449244515
27,maQXZdEOy,"Tendencia. Desde la pandemia, Boca gana cada vez menos en la Bombonera",https://www.clarin.com/deportes/pandemia-boca-gana-vez-bombonera-contundente-estadistica_0_maQXZdEOy.html,https://images.clarin.com/2021/03/21/kMduW-deG_720x0__1.jpg
28,GwmCYcEUG,Fútbol y política. Denuncian contratos polémicos firmados durante la gestión de Chiqui Tapia,https://www.clarin.com/deportes/golpe-claudio-chiqui-tapia-denuncian-contratos-polemicos-firmados-gestion_0_GwmCYcEUG.html,https://images.clarin.com/2020/10/17/fAkSG2LcM_720x0__1.jpg
29,XaelUpTfd,"Cacho Laudonio. Murió el ""Loco Banderita"" que anunciaba la salida de Boca a la cancha",https://www.clarin.com/deportes/murio-cacho-laudonio-loco-banderita-anunciaba-daba-color-salida-boca_0_XaelUpTfd.html,https://images.clarin.com/2021/01/10/HiViNif6V_720x0__1.jpg
30,tKGKEv6ye,"Polémica en puerta. Con Messi, De Paul y Dybala como modelos, la Selección tiene nueva camiseta",https://www.clarin.com/deportes/messi-paul-dybala-modelos-seleccion-argentina-nueva-camiseta_0_tKGKEv6ye.html,https://images.clarin.com/2021/03/22/W1F64VqbF_1256x620__2.jpg#1616419313242
31,AB0g3ag7O,"Alberto Fernández. “Estamos vacunando a los argentinos, mientras otros se levantan de la cama y hacen Zoom”",https://www.clarin.com/politica/criticas-mauricio-macri-medio-tensiones-internas-alberto-fernandez-pidio-debate-unidad-_0_AB0g3ag7O.html,https://images.clarin.com/2021/03/22/tvYZSleTM_720x0__1.jpg
32,m4Ht-umuv,"Sanciones a jefes y oficiales. Fallo por el ARA San Juan, destitución y polémica: ¿Quién manda en el mar?",https://www.clarin.com/politica/ara-san-juan-fallo-destitucion-polemica-manda-mar-_0_m4Ht-umuv.html,https://images.clarin.com/2019/07/18/sa1iyL6Di_720x0__1.jpg
33,qM_NFzRhG,"El armado opositor. Quién es Maxi Abad, el nuevo presidente del radicalismo en la Provincia",https://www.clarin.com/politica/-maxi-abad-nuevo-presidente-radicalismo-provincia-_0_qM_NFzRhG.html,https://images.clarin.com/2021/03/22/0fzO5k2Oo_720x0__1.jpg
34,o-_UKSbEn,"Con la mirada en 2023. Abad: ""El radicalismo tiene que ocupar el ala progresista de la oposición""",https://www.clarin.com/politica/maximiliano-abad-vamos-trabajar-tener-candidatos-presidente-gobernador-radicalismo-_0_o-_UKSbEn.html,https://images.clarin.com/2021/02/12/PFx0JjbFY_720x0__1.jpg
35,Upb1Ct3ht,En Washington. Cita clave en el FMI: Guzmán se reúne hoy con Georgieva,https://www.clarin.com/economia/reunion-clave-fondo-monetario-internacional-martin-guzman-reune-martes-kristalina-georgieva_0_Upb1Ct3ht.html,https://images.clarin.com/2021/03/22/QnXOQwjGn_720x0__1.jpg
36,E6mLMh6RF,Justifica Federal. Le ordenan a la AFIP no cobrarle el impuesto a la riqueza a un empresario,https://www.clarin.com/politica/justicia-federal-ordeno-afip-cobrarle-impuesto-riqueza-empresario_0_E6mLMh6RF.html,https://images.clarin.com/2019/03/07/UzEJ-JuHM_720x0__1.jpg
37,yd4q-xuYg,Motochorros. Intentan robarle el auto y le gatillan en la cabeza cuando estaba en el piso,https://www.clarin.com/policiales/video-motochorros-intentaron-robarle-auto-gatillaron-cabeza-piso_0_yd4q-xuYg.html,https://images.clarin.com/2021/03/22/mZE6O66Nc_720x0__1.jpg
38,Ywct0xLc-,ESEADE. El desafío de educar a los líderes emprendedores del mañana,https://www.clarin.com/brandstudio/desafio-educar-lideres-emprendedores-manana_0_Ywct0xLc-.html,https://images.clarin.com/2021/03/18/KQzhVgVMi_1256x620__3.jpg#1616431910606
39,r820zclEv,Presentación. Aston Martin festeja su vuelta a la F1 con un superdeportivo adaptado para la calle,https://www.clarin.com/autos/aston-martin-festeja-vuelta-formula-1-superdeportivo-adaptado-calle_0_r820zclEv.html,https://images.clarin.com/2021/03/22/Owsx0Yobg_720x0__1.jpg
40,yWFQfOLY3,Nueva disposición. La cédula verde del auto tendrá menos vigencia: vencerá en solo un año,https://www.clarin.com/autos/cedula-verde-auto-vigencia-vencera-solo-ano_0_yWFQfOLY3.html,https://images.clarin.com/2021/03/22/Zszbg_cJM_720x0__1.jpg
41,YsudBDsqOj,"Locaciones de la serie. En Nueva Jersey, en busca de los escenarios de Los Soprano",https://www.clarin.com/viajes/nueva-jersey-busca-escenarios-soprano_0_YsudBDsqOj.html,https://images.clarin.com/2021/03/19/6hLpDA6PH_720x0__1.jpg
42,Z31zeNGbL,Precio insólito. El auto familiar Volvo de los 20 millones de dólares y un detalle único,https://www.clarin.com/autos/auto-familiar-volvo-20-millones-dolares_0_Z31zeNGbL.html,https://images.clarin.com/2021/03/22/7AhERn8P6_720x0__1.jpg
43,LnQKjKaKC,Según un estudio. Comer antes de las 8.30 podría reducir los factores de riesgo de diabetes,https://www.clarin.com/buena-vida/comer-8-30-podria-reducir-factores-riesgo-diabetes-estudio_0_LnQKjKaKC.html,https://images.clarin.com/2021/03/22/ja1dW8TUC_720x0__1.jpg
44,V4gAa4UpZ,Preocupación. Advierten sobre el uso de ansiolíticos en personas con hipertensión,https://www.clarin.com/buena-vida/advierten-uso-ansioliticos-personas-hipertension_0_V4gAa4UpZ.html,https://images.clarin.com/2021/03/22/rL2K2vXLG_720x0__1.jpg
45,JZY4lRjt5,Recetas. Qué cocinar esta semana: menú día por día del 22 al 28 de marzo,https://www.clarin.com/gourmet/cocinar-semana-menu-dia-dia-22-28-marzo_0_JZY4lRjt5.html,https://images.clarin.com/2021/03/11/But3p5Lnx_1256x620__2.jpg#1616199132765
46,XkVjMTkFP,Astros y relaciones. Venus Star Point 2021: cuándo es y qué significa,https://www.clarin.com/astrologia/venus-star-point-2021-significa_0_XkVjMTkFP.html,https://images.clarin.com/2021/03/22/0NYU6b4-h_720x0__1.jpg
47,GFnJi5fyA,"Dante Alighieri . Homenajean al poeta italiano en Instagram, Facebook y Tik Tok",https://www.clarin.com/cultura/dante-alighieri-quiere-amigo-homenajean-poeta-italiano-instagram-facebook-tik-tok_0_GFnJi5fyA.html,https://images.clarin.com/2021/03/19/Ww2r9bikz_720x0__1.jpg
48,gVlLYsmF1,Fenómeno. Volcán en erupción en Islandia: cientos de visitantes se acercan a disfrutar del espectáculo,https://www.clarin.com/viajes/volcan-erupcion-islandia-cientos-visitantes-acercan-disfrutar-espectaculo_0_gVlLYsmF1.html,https://images.clarin.com/2021/03/22/NFi8VBZ0n_720x0__1.jpg
49,LyY5-hfLK,Vale millones. Venden el cuadro en que Banksy se rió de Demi Moore,https://www.clarin.com/cultura/venden-cuadro-banksy-rio-demi-moore_0_LyY5-hfLK.html,https://images.clarin.com/2021/03/22/ZN03J7gQV_1256x620__2.jpg#1616418718919
50,56AfJewwO,Historias. Los increíbles objetos que el hombre dejó en la Luna,https://www.clarin.com/viste/increibles-objetos-hombre-dejo-luna_0_56AfJewwO.html,https://images.clarin.com/2021/03/21/PufuZkUFW_720x0__1.jpg
51,o3AiMvvVW,Astronomía. NASA: calculan por primera vez el tamaño del núcleo de Marte,https://www.clarin.com/internacional/nasa-calculan-primera-vez-tamano-nucleo-marte_0_o3AiMvvVW.html,https://images.clarin.com/2021/03/21/KpnWUyAx8_720x0__1.jpg
52,FjvzIIwpe,En España. El mejor árbol europeo tiene mil años y fue un nido de brujas,https://www.clarin.com/viste/mejor-arbol-europeo-espana-mil-anos-nido-brujas_0_FjvzIIwpe.html,https://images.clarin.com/2021/03/21/5xA2TPZ2Y_720x0__1.jpg
53,LnlyGgbqD,"Sin IFE ni ATP. El Gobierno afirma que si hay rebrote de Covid ""se tomarán medidas excepcionales""",https://www.clarin.com/economia/ife-atp-gobierno-afirma-rebrote-coronavirus-tomaran-medidas-excepcionales-_0_LnlyGgbqD.html,https://images.clarin.com/2020/03/17/w_y_Y8Ho_720x0__1.jpg
54,s1fATTjIm,"Narcotráfico. Doble crimen en Belgrano: chats hots con ""La Tía"" y trampa desde el Caribe",https://www.clarin.com/policiales/secretos-doble-crimen-belgrano-chats-hots-tia-trampa-caribe_0_s1fATTjIm.html,https://images.clarin.com/2020/03/15/CmpJqQPQ_1256x620__3.jpg#1616431292616
55,L0ADp5tUm,"Reclamo por salarios. Lanzan un paro para el viernes en sanatorios, clínicas y hospitales",https://www.clarin.com/sociedad/trabajadores-sanidad-haran-paro-viernes-pais-trabajado-cobrado-_0_L0ADp5tUm.html,https://images.clarin.com/2020/12/13/r6XYNrUBv_720x0__1.jpg
56,dg0nODcp6,"Tenía 44 años. Murió el editor Hugo Montero, fundador y director de editorial Sudestada",https://www.clarin.com/cultura/murio-editor-hugo-montero-fundador-director-editorial-sudestada_0_dg0nODcp6.html,https://images.clarin.com/2021/03/22/cKsIkC5-m_1256x620__2.jpg#1616446101295
57,0woyv46W4,Estados Unidos. Tiroteo en Colorado: diez muertos en un supermercado,https://www.clarin.com/mundo/tiroteo-supermercado-colorado-policia-muerto-informa-multiples-victimas-_0_0woyv46W4.html,https://images.clarin.com/2021/03/22/quzpsblLE_720x0__1.jpg
58,Soj62XVZF,Votan hoy. Polarización en Israel en unas elecciones marcadas por la exitosa vacunación,https://www.clarin.com/mundo/cuarta-votacion-anos-polarizacion-israel-elecciones-marcadas-exitosa-campana-vacunacion_0_Soj62XVZF.html,https://images.clarin.com/2021/03/22/9imU9yLpw_1200x0__2.jpg#1616435142209
59,tpcqWxdkt,Había 500 personas. Expulsan de Uruguay al hijo de Mónica Gonzaga por armar una fiesta ilegal,https://www.clarin.com/sociedad/expulsan-uruguay-hijo-monica-gonzaga-organizar-fiesta-clandestina_0_tpcqWxdkt.html,https://images.clarin.com/2021/03/22/A9AaHw2TZ_720x0__1.jpg
60,VL4FtiKZm,Revés judicial. Multa millonaria a Apple por no incluir el cargador en la caja del iPhone 12,https://www.clarin.com/tecnologia/apple-recibio-multa-millonaria-incluir-cargador-caja-iphone-12_0_VL4FtiKZm.html,https://images.clarin.com/2021/03/22/OpnT4fsQE_720x0__1.jpg
61,C6RGrteht,Travesía extrema. La camarera de la hazaña: cruzó el Atlántico remando sola,https://www.clarin.com/viva/camarera-hazana-cruzo-atlantico-remando-sola_0_C6RGrteht.html,https://images.clarin.com/2021/03/22/ixEPFt9JG_720x0__1.jpg
62,Qhyr2JqLZ,Inseguridad vial. Las historias detrás de las bicicletas blancas colgadas en la Ciudad,https://www.clarin.com/ciudades/historias-detras-bicicletas-blancas-colgadas-ciudad-simbolo-recuerda-victimas-transito_0_Qhyr2JqLZ.html,https://images.clarin.com/2021/03/22/xetQHFE8v_1256x620__2.jpg#1616458002982
63,s4vQ1BfDI,Búsqueda laboral. Cómo hacer un currículum vitae: los 6 errores que jamás se deben cometer,https://www.clarin.com/servicios/hacer-curriculum-vitae-6-errores-jamas-deben-cometer_0_s4vQ1BfDI.html,https://images.clarin.com/2021/02/01/zzHOwG8ek_720x0__1.jpg
64,GloXzdqF1,"Consecuencias. En pandemia, creció la cantidad de argentinos judíos que emigran a Israel",https://www.clarin.com/politica/pandemia-crecio-cantidad-argentinos-judios-emigran-israel_0_GloXzdqF1.html,https://images.clarin.com/2021/03/19/lQfDbRMB1_720x0__1.jpg
65,gk4Dj2Wx8,"El retorno del rey. Fernando Alonso, el bicampeón de Fórmula 1 que no puede vivir sin competir",https://www.clarin.com/deportes/retorno-rey-fernando-alonso--bicampeon-formula-1-puede-vivir-competir_0_gk4Dj2Wx8.html,https://images.clarin.com/2020/07/07/Cex4i6Gr4_1256x620__2.jpg#1616442603005
66,YhSWy0J77,Anécdotas de su libro. El día que Tyson hizo estallar su habitación y su reacción al encontrar a su novia con Brad Pitt,https://www.clarin.com/deportes/dia-mike-tyson-hizo-explotar-habitacion-reaccion-encontro-novia-brad-pitt_0_YhSWy0J77.html,https://images.clarin.com/2020/08/11/WsAPPRItm_720x0__1.jpg
67,a2cUJNzrO,Chubut. Varamiento intencional: así cazan las orcas en Península Valdés,https://www.clarin.com/viajes/varamiento-intencional-cazan-orcas-peninsula-valdes_0_a2cUJNzrO.html,https://images.clarin.com/2021/03/22/ZbrHb-U6__720x0__1.jpg
68,XMZ0OcrLI,Después de las vacaciones. Los beneficios adquiridos con PreViaje se podrán seguir usando en el año,https://www.clarin.com/brandstudio/beneficios-adquiridos-previaje-podran-seguir-usando-ano_0_XMZ0OcrLI.html,https://images.clarin.com/2021/02/03/-Yb1SfU2y_720x0__1.jpg
