n,id,title,url,image
1,4NLrXATeY,"""Es terrorismo"", dijo. Berni volvió a contradecir al Gobierno y afirmó que debe mandar tropas a la Patagonia por los ataques mapuches",https://www.clarin.com/politica/sergio-berni-volvio-contradecir-gobierno-afirmo-debe-mandar-tropas-sur-conflicto-mapuche-terrorismo-_0_4NLrXATeY.html,https://images.clarin.com/2021/10/22/wiRcA2fTW_1256x620__2.jpg#1634911958739
2,ohnyWqfnt,"Mercado financiero. El dólar blue sube a $ 192,50: ¿cuál podría ser el techo?",https://www.clarin.com/economia/dolar-blue-sube-192-50-podria-techo-_0_ohnyWqfnt.html,https://images.clarin.com/2021/10/04/sLkfwJt2C_720x0__1.jpg
3,eMRzi_R3y,Tragedia en el cine. Alec Baldwin disparó un arma de utilería durante un rodaje y mató a una asistente,https://www.clarin.com/mundo/alec-baldwin-disparo-mato-persona-hirio-rodaje-pelicula_0_eMRzi_R3y.html,https://images.clarin.com/2021/10/22/PieDJzaUb_720x0__1.jpg
4,sWK-hAse7,Habló de los K. España suspendió a último momento la extradición a EE.UU. del ex jefe de espías chavista,https://www.clarin.com/politica/justicia-espanola-suspendio-entrega-unidos-ex-jefe-espionaje-chavez-hugo-pollo-carvajal_0_sWK-hAse7.html,https://images.clarin.com/2021/10/19/C_isYfxMW_720x0__1.jpg
5,whYBnxwnB,Susto en Turín. Entraron a robar la casa que comparten Paulo Dybala y Oriana Sabatini,https://www.clarin.com/deportes/susto-turin-entraron-fuerza-robar-casa-comparten-paulo-dybala-oriana-sabatini_0_whYBnxwnB.html,https://images.clarin.com/2020/03/24/0QaFW43v6_720x0__1.jpg
6,Jf6oz7KuS,"Tensión por controles. Secretos, mentiras y falacias del congelamiento de precios que impuso el Gobierno",https://www.clarin.com/opinion/secretos-mentiras-falacias-congelamiento-precios_0_Jf6oz7KuS.html,https://images.clarin.com/2021/10/09/837qtXW1w_720x0__1.jpg
7,YCHOoUamk,"Elección en Provincia. Guerra de encuestas: Tolosa Paz había alcanzado a Santilli, pero volvió a quedar abajo",https://www.clarin.com/politica/guerra-encuestas-victoria-tolosa-paz-alcanzado-diego-santilli-ahora-volvio-quedar-abajo_0_YCHOoUamk.html,https://images.clarin.com/2021/10/22/yhSz2nATt_720x0__1.jpg
8,Pc5Q2jwtR,Especial Clarín. Charly García cumple 70: las increíbles historias de un indispensable,https://www.clarin.com/espectaculos/musica/charly-garcia-cumple-70-anos-vidas-caidas-resurrecciones-icono-cultura-argentina_0_Pc5Q2jwtR.html,https://images.clarin.com/2021/10/19/Ui8iVf_v__720x0__1.jpg
9,cdObEvovf,Nacida en Ucrania. Quién era la directora de fotografía que murió baleada por Alec Baldwin,https://www.clarin.com/espectaculos/halyna-hutchins-directora-fotografia-mato-alec-baldwin_0_cdObEvovf.html,https://images.clarin.com/2021/10/22/MnyfUWlwa_720x0__1.jpg
10,LOKQFGgF8,En Nuevo México. Las primeras imágenes de Alec Baldwin luego de la tragedia en el set de filmación,https://www.clarin.com/espectaculos/primeras-imagenes-alec-baldwin-tragedia_0_LOKQFGgF8.html,https://images.clarin.com/2021/10/22/BOXf_1kqC_720x0__1.jpg
11,WU--YY53e,"Coronavirus. Argentina sufrió 300% más muertes que la media y busca revancha, pero hay una duda",https://www.clarin.com/sociedad/covid-300-muertes-media-mundial-argentina-busca-revancha-tercera-ola_0_WU--YY53e.html,https://images.clarin.com/2021/02/28/YR69JkxFj_720x0__1.jpg
12,HOG6XaBcr,¿Efecto Wanda Nara?. Revelan por qué Real Madrid desistió de la idea de comprar a Icardi,https://www.clarin.com/deportes/madrid-compro-icardi-wanda_0_HOG6XaBcr.html,https://images.clarin.com/2021/10/21/dO-De4oPF_720x0__1.jpg
13,X23r_a0Fe,Baldwin y un rodaje trágico. Siete actores que murieron mientras estaban filmando una película,https://www.clarin.com/internacional/espectaculos/alec-baldwin-rodaje-tragico-7-actores-murieron-filmando-pelicula_0_X23r_a0Fe.html,https://images.clarin.com/2021/08/04/0hgrd783s_720x0__1.jpg
14,-mzz9zrIs,Contra la inflación. Ir al mayorista y ahorrar doble: qué tarjetas te devuelven hasta un 35% de lo gastado,https://www.clarin.com/servicios/ir-mayorista-doble-ahorro-tarjetas-devuelven-35-gastado_0_-mzz9zrIs.html,https://images.clarin.com/2021/05/14/IWIZohvNK_720x0__1.jpg
15,8JeFaE6YM,La víctima tiene 8 fracturas. Quiénes son los cuatro acusados de desfigurar a un adolescente en una fiesta,https://www.clarin.com/policiales/rugbiers-acusados-darle-paliza-desfigurar-adolescente-fiesta_0_8JeFaE6YM.html,https://images.clarin.com/2021/10/19/xGQsJyeyz_720x0__1.jpg
16,WRf-_RHni,"Otro día de cortes. Choferes protestan en Puente Pueyrredón,  Acceso Oeste y Campana",https://www.clarin.com/sociedad/jornada-cortes-choferes-protestan-puente-pueyrredon-acceso-oeste-campana_0_WRf-_RHni.html,https://images.clarin.com/2021/05/11/6PB1l5twu_720x0__1.jpg
17,GKY7whjiJ,"La campaña, minuto a minuto. Una visita especial a la Rosada y el viaje de Larreta a Córdoba para apoyar a un candidato",https://www.clarin.com/politica/elecciones-2021-minuto-minuto-visita-especial-casa-rosada-viaje-larreta-cordoba-apoyar-candidato_0_GKY7whjiJ.html,https://images.clarin.com/2021/10/22/QjUqcORMy_720x0__1.jpg
18,4wZ2oIW33,Según un ranking. Por qué Argentina es uno de los países más fáciles para aprender a manejar,https://www.clarin.com/sociedad/licencias-conducir-argentina-paises-faciles-mundo-aprender-manejar_0_4wZ2oIW33.html,https://images.clarin.com/2021/06/16/nzoduM4ZY_1256x620__2.jpg#1634907887650
19,rfq3ya4DN,En la Ciudad. Al aire libre y más baratas que un restorán: vuelven las ferias gastronómicas,https://www.clarin.com/ciudades/aire-libre-baratas-restaurante-vuelven-ferias-gastronomicas-ciudad_0_rfq3ya4DN.html,https://images.clarin.com/2021/10/19/C4TLydIhZ_1256x620__2.jpg#1634678755578
20,7FFW-QPJX,Liga Profesional. Más ventaja para River: así quedó la tabla de posiciones luego del triunfo en Córdoba,https://www.clarin.com/deportes/quedo-tabla-posiciones-liga-profesional-river-alto-lejos-resto_0_7FFW-QPJX.html,https://images.clarin.com/2021/10/21/Gcn5g4fix_720x0__1.jpg
21,zrJnA43ab,La Justicia lo citó a declarar. Ginecólogo denunciado por abuso sexual: ya son 15 las mujeres que lo acusan,https://www.clarin.com/sociedad/ginecologo-denunciado-abuso-sexual-15-mujeres-acusan-justicia-cito-declarar_0_zrJnA43ab.html,https://images.clarin.com/2021/10/22/JsVlw9oIE_720x0__1.jpg
22,p393u6fvH,"Un dato bancario, clave. Creen que sacó un crédito en una financiera para pagar a los sicarios que mataron a su ex",https://www.clarin.com/policiales/creen-saco-credito-financiera-pagar-sicarios-mataron-ex_0_p393u6fvH.html,https://images.clarin.com/2021/10/04/QWOKShHWa_720x0__1.jpg
23,p9jASKtLk,Entrevista a corazón abierto. Vencer a la mente y al físico: Londero y el desafío de recuperar nivel en la élite,https://www.clarin.com/deportes/juan-ignacio-londero-quiero-probarme-gente-puedo-volver-_0_p9jASKtLk.html,https://images.clarin.com/2021/10/21/iDx0swWnO_1256x620__2.jpg#1634847605358
24,xW4DaJFJB,Nuevo libro. Los muertos de la Recoleta cuentan sus historias,https://www.clarin.com/viva/muertos-recoleta-cuentan-historias_0_xW4DaJFJB.html,https://images.clarin.com/2021/10/18/hNiK9lWHE_720x0__1.jpg
25,Bp4hIbgps,Steve McQueen. El sex symbol de Hollywood que  escondía una oscura personalidad,https://www.clarin.com/internacional/espectaculos/sex-symbol-hollywood-escondia-oscura-personalidad-verdad-steve-mcqueen_0_Bp4hIbgps.html,https://images.clarin.com/2021/10/21/_jMxz9GTY_720x0__1.jpg
26,zi7XyAZhRX,Historias visuales. Las mejores 98 imágenes de hoy en Argentina y el mundo,https://www.clarin.com/fotogalerias/dia-fotos-mejores-imagenes-argentina-mundo_5_zi7XyAZhRX.html,
27,Lf88S5vmH,Inteligencia. Para qué sirven las películas de terror,https://www.clarin.com/new-york-times-international-weekly/sirven-peliculas-terror_0_Lf88S5vmH.html,https://images.clarin.com/2021/10/21/bD3s54OQx_1256x620__2.jpg#1634841208383
28,FZuWnzOs-,Vikingos . Ya estaban en América hace exactamente 1.000 años,https://www.clarin.com/new-york-times-international-weekly/vikingos-america-hace-exactamente-1-000-anos_0_FZuWnzOs-.html,https://images.clarin.com/2021/10/21/y_EGyGSTI_1256x620__2.jpg#1634832925664
29,iINejVaX5,"Martin Margiela. Un diseñador de moda consagrado, dejó todo por el arte",https://www.clarin.com/new-york-times-international-weekly/disenador-moda-consagrado-dejo-arte_0_iINejVaX5.html,https://images.clarin.com/2021/10/21/Bj3iPTW0O_1256x620__2.jpg#1634833865453
30,4NLrXATeY,"""Es terrorismo"", dijo. Berni volvió a contradecir al Gobierno y afirmó que debe mandar tropas a la Patagonia por los ataques mapuches",https://www.clarin.com/politica/sergio-berni-volvio-contradecir-gobierno-afirmo-debe-mandar-tropas-sur-conflicto-mapuche-terrorismo-_0_4NLrXATeY.html,https://images.clarin.com/2021/10/22/wiRcA2fTW_1256x620__2.jpg#1634911958739
31,ohnyWqfnt,"Mercado financiero. El dólar blue sube a $ 192,50: ¿cuál podría ser el techo?",https://www.clarin.com/economia/dolar-blue-sube-192-50-podria-techo-_0_ohnyWqfnt.html,https://images.clarin.com/2021/10/04/sLkfwJt2C_720x0__1.jpg
32,eMRzi_R3y,Tragedia en el cine. Alec Baldwin disparó un arma de utilería durante un rodaje y mató a una asistente,https://www.clarin.com/mundo/alec-baldwin-disparo-mato-persona-hirio-rodaje-pelicula_0_eMRzi_R3y.html,https://images.clarin.com/2021/10/22/PieDJzaUb_720x0__1.jpg
33,sWK-hAse7,Habló de los K. España suspendió a último momento la extradición a EE.UU. del ex jefe de espías chavista,https://www.clarin.com/politica/justicia-espanola-suspendio-entrega-unidos-ex-jefe-espionaje-chavez-hugo-pollo-carvajal_0_sWK-hAse7.html,https://images.clarin.com/2021/10/19/C_isYfxMW_720x0__1.jpg
34,whYBnxwnB,Susto en Turín. Entraron a robar la casa que comparten Paulo Dybala y Oriana Sabatini,https://www.clarin.com/deportes/susto-turin-entraron-fuerza-robar-casa-comparten-paulo-dybala-oriana-sabatini_0_whYBnxwnB.html,https://images.clarin.com/2020/03/24/0QaFW43v6_720x0__1.jpg
35,Jf6oz7KuS,"Tensión por controles. Secretos, mentiras y falacias del congelamiento de precios que impuso el Gobierno",https://www.clarin.com/opinion/secretos-mentiras-falacias-congelamiento-precios_0_Jf6oz7KuS.html,https://images.clarin.com/2021/10/09/837qtXW1w_720x0__1.jpg
36,YCHOoUamk,"Elección en Provincia. Guerra de encuestas: Tolosa Paz había alcanzado a Santilli, pero volvió a quedar abajo",https://www.clarin.com/politica/guerra-encuestas-victoria-tolosa-paz-alcanzado-diego-santilli-ahora-volvio-quedar-abajo_0_YCHOoUamk.html,https://images.clarin.com/2021/10/22/yhSz2nATt_720x0__1.jpg
37,Wtm04rQMr,En WhatsApp. El truco secreto para silenciar a alguien en un grupo sin expulsarlo,https://www.clarin.com/tecnologia/truco-secreto-whatsapp-silenciar-alguien-grupo-tener-expulsarlo_0_Wtm04rQMr.html,https://images.clarin.com/2021/08/05/sYBXnEUjk_720x0__1.jpg
38,y9WfVuPBv,Tomar conciencia. Tartamudez: señales de alerta que no hay que dejar pasar y cuándo consultar,https://www.clarin.com/buena-vida/dia-internacional-de-la-tartamudez-por-que-se-conmemora-hoy-22-de-octubre-_0_y9WfVuPBv.html,https://images.clarin.com/2021/04/19/5Vfcf4K1r_720x0__1.jpg
39,8CHd0DKyR,Salud. Tiroides: los sí y los no para el cuidado de la glándula que regula el metabolismo,https://www.clarin.com/buena-vida/tiroides-cuidado-glandula-regula-metabolismo_0_8CHd0DKyR.html,https://images.clarin.com/2021/10/21/CaUMzuUfK_720x0__1.jpg
40,Op576jVfp,Ranking. Cuáles son las 15 marcas de autos más valiosas del mundo en 2021,https://www.clarin.com/autos/15-marcas-autos-valiosas-mundo-2021_0_Op576jVfp.html,https://images.clarin.com/2021/10/21/sFN16-v4b_720x0__1.jpg
41,-XQrhSo46,En Roma. Adiós a Alitalia: auxiliares de vuelo protestaron en ropa interior,https://www.clarin.com/viajes/adios-alitalia-auxiliares-vuelo-protestaron-ropa-interior_0_-XQrhSo46.html,https://images.clarin.com/2021/10/21/LgLMGSib3_720x0__1.jpg
42,1oAgcjbAN,Ciberseguridad. Hackearon miles de cuentas de youtubers para estafar con criptomonedas,https://www.clarin.com/tecnologia/hackearon-miles-cuentas-youtubers-estafar-criptomonedas_0_1oAgcjbAN.html,https://images.clarin.com/2021/09/29/H-VVE2uqL_720x0__1.jpg
43,AWQkRLjcx,"Rara moda. En España la gente compra los ataúdes de ""El juego del calamar""",https://www.clarin.com/viste/espana-gente-compra-ataudes-juego-calamar-_0_AWQkRLjcx.html,https://images.clarin.com/2021/10/21/1SFx1YYMO_720x0__1.jpg
44,P6cevWQ2g,Tiene 100 millones de años. Hallan preservado en ámbar un cangrejo de la era de los dinosaurios,https://www.clarin.com/internacional/hallan-preservado-ambar-cangrejo-100-millones-anos-dinosaurios_0_P6cevWQ2g.html,https://images.clarin.com/2021/10/21/NofQ_ber2_720x0__1.jpg
45,z8SOOeQ36,Sorpresa. Se descubrió que en Argentina los dinosaurios vivían en manadas,https://www.clarin.com/viste/descubrio-argentina-dinosaurios-vivian-manadas_0_z8SOOeQ36.html,https://images.clarin.com/2021/10/21/CP2ht-ACH_720x0__1.jpg
46,XJ2USGUCn,"Arte ""site specific"". ¡Sshh silencio! Una imponente escultura de 22 metros de altura en Nueva York",https://www.clarin.com/cultura/-ssshhh-silencio-imponente-escultura-22-metros-altura-sorprende-nueva-york_0_XJ2USGUCn.html,https://images.clarin.com/2021/10/19/REviXQ_-1_720x0__1.jpg
47,qUFvFcnxx,"Crítica I. Ron da error, el filme de Disney con gente de Pixar",https://www.clarin.com/espectaculos/cine/ron-da-error_0_qUFvFcnxx.html,https://images.clarin.com/2021/10/14/-bnTMcNhP_720x0__1.jpg
48,0LjX6wsen,"Crítica II. Duna, una experiencia única para ser disfrutada en pantalla grande",https://www.clarin.com/espectaculos/cine/duna-experiencia-unica-disfrutada-pantalla-grande_0_0LjX6wsen.html,https://images.clarin.com/2021/08/31/i6F116NrQ_720x0__1.jpg
49,,Residuos orgánicos. La Ciudad instala composteras en puntos verdes de las 15 comunas,,
50,hM56KNTpW,"Único. Un Cabernet Sauvignon diferente, tributo a la experiencia",https://www.clarin.com/brandstudio/cabernet-sauvignon-diferente-tributo-experiencia_0_hM56KNTpW.html,https://images.clarin.com/2021/10/12/gUuhvIh-V_720x0__1.jpg
51,PAfJ-VSFW,"En Palermo. Tenis: las nuevas promesas, juntas en el Dove Men+Care Challenger de Buenos Aires",https://www.clarin.com/brandstudio/tenis-nuevas-promesas-juntas-dove-men-care-challenger-buenos-aires_0_PAfJ-VSFW.html,https://images.clarin.com/2021/10/15/_LzB1MYH-_720x0__1.jpg
52,Ot_6cI1X2,Experiencias transformadoras. Innovación en educación: las claves para estar a la vanguardia,https://www.clarin.com/brandstudio/innovacion-educacion-claves-vanguardia_0_Ot_6cI1X2.html,https://images.clarin.com/2021/10/15/WMxJf4GMH_720x0__1.jpg
53,Y7BlZUlug,"En pareja. María Becerra y Rusherking: unidos por la música, el amor y la atracción",https://www.clarin.com/brandstudio/maria-becerra-rusherking-unidos-musica-amor-atraccion_0_Y7BlZUlug.html,https://images.clarin.com/2021/10/12/E7Ryzlh0M_1256x620__2.jpg#1634065250011
54,,Promociones. ¿Por qué es mejor comprar celulares en Argentina que en Estados Unidos?,,
55,br_UxL9gc,"En campaña. El marido de Pampita propuso debatir ""lo que sea con quien sea"" y recibió insólitas respuestas",https://www.clarin.com/fama/roberto-garcia-moritan-marido-pampita-propuso-debatir-recibio-insolitas-respuestas_0_br_UxL9gc.html,https://images.clarin.com/2021/10/22/aU3x2ByJJ_720x0__1.jpg
56,Hl83CjbbF,¡Tremendo!. Revelaron la frase con la que Mauro Icardi se acercó a la China Suárez y comenzó a seducirla,https://www.clarin.com/fama/marcelo-polino-revelo-frase-mauro-icardi-intento-conquistar-china-suarez_0_Hl83CjbbF.html,https://images.clarin.com/2021/10/20/DdVDcWyZk_720x0__1.jpg
57,kv488iffK,Va a la Justicia. Los fuertes motivos por los que la hija de Andrea del Boca inició los trámites para cambiar su nombre,https://www.clarin.com/fama/fuertes-motivos-hija-andrea-boca-inicio-tramites-cambiar-nombre_0_kv488iffK.html,https://images.clarin.com/2019/12/11/1Z77O6iK_720x0__1.jpg
58,AISvH7DCB,Sin vueltas. Polémica teoría del psicólogo Gabriel Cartañá sobre el descargo de la China Suárez,https://www.clarin.com/fama/polemica-teoria-gabriel-cartana-descargo-china-suarez_0_AISvH7DCB.html,https://images.clarin.com/2021/10/21/g8l4YUkTG_720x0__1.jpg
59,CVoMMjyVo,Especial Clarín. La historia del incendio en la Rosada que Aníbal F. quiso esconder,https://www.clarin.com/politica/verdadera-historia-incendio-casa-rosada-horas-hallar-muerto-nisman_0_CVoMMjyVo.html,https://images.clarin.com/2021/10/14/EXosCOcyf_720x0__1.jpg
60,v_kQlS4pc,Nueva encuesta en CABA. Milei capta votos de López Murphy y queda cerca del Frente de Todos,https://www.clarin.com/politica/nueva-encuesta-caba-javier-milei-capta-votos-ricardo-lopez-murphy-queda-cerca-frente_0_v_kQlS4pc.html,https://images.clarin.com/2021/08/23/Zuj1aofO0_720x0__1.jpg
61,1MwSCyoUU,Qué mirar al reservar. Alquileres de verano: las 7 claves para evitar estafas y sobreprecios,https://www.clarin.com/servicios/alquileres-verano-7-claves-evitar-estafas-sobreprecios_0_1MwSCyoUU.html,https://images.clarin.com/2018/01/04/r16D7Hh7G_720x0.jpg
62,LR3WL1-Dg,"Entrevista con Clarín. A diez años del fin de la lucha armada, el hijo de un ex miembro de ETA cuenta su drama familiar en un documental",https://www.clarin.com/mundo/jon-viar-terrorismo-eta-consecuencia-discurso-politico-basado-mentira-_0_LR3WL1-Dg.html,https://images.clarin.com/2021/10/21/job4xwPAC_720x0__1.jpg
63,RILHTMnj5,"Las cinco más baratas. Franquicias ""low cost"": cómo iniciar un negocio rentable con sólo $ 20.000",https://www.clarin.com/servicios/franquicias-low-cost-iniciar-negocio-rentable-solo-20-000-100-000-150-000_0_RILHTMnj5.html,https://images.clarin.com/2017/12/07/B1KuFaI-G_720x0.jpg
64,uoLFCUu_3,Datos oficiales. Volver a empezar: al menos 100 argentinos por día se van del país,https://www.clarin.com/sociedad/volver-empezar-100-argentinos-dia-van-pais_0_uoLFCUu_3.html,https://images.clarin.com/2021/10/01/B5BQs1azI_720x0__1.jpg
65,uw0bgL8rw,"Escapadas. Viajar por Argentina: imperdibles, requisitos y precios de 10 clásicos",https://www.clarin.com/viajes/volver-viajar-argentina-imperdibles-requisitos-precios-10-destinos-clasicos_0_uw0bgL8rw.html,https://images.clarin.com/2021/10/06/H7yN0b_4A_720x0__1.jpg
66,GcFG_FemJ,Escena del Crimen. El cuerpo quemado de  Puerto Madero que no le importa a nadie,https://www.clarin.com/policiales/cuerpo-quemado-puerto-madero-importa-nadie_0_GcFG_FemJ.html,https://images.clarin.com/2021/10/01/6sBt8-wQ4_720x0__1.jpg
67,Q2C6_fQ1u,Millones de cheques por mes. Planes sociales: cómo salir del laberinto en la Argentina sin trabajo,https://www.clarin.com/economia/planes-sociales-salir-laberinto-argentina-trabajo_0_Q2C6_fQ1u.html,https://images.clarin.com/2021/10/13/dIZupPki4_720x0__1.jpg
68,rxhnxr4-a,Opinión. Por qué Ginóbili no fue elegido entre los 75 mejores de la historia de la NBA,https://www.clarin.com/deportes/manu-ginobili-elegido-75-mejores-jugadores-historia-nba_0_rxhnxr4-a.html,https://images.clarin.com/2018/09/14/kfzvU3JBX_720x0__1.jpg
69,yxVHrxeyl,"Un fútbol de locos. Peleas entre jugadores, broncas con los dirigentes y proyectos que duran poco",https://www.clarin.com/deportes/vuelta-publico-futbol-argentino-vuelve-vivir-borde-ataque-nervios_0_yxVHrxeyl.html,https://images.clarin.com/2021/10/21/vdgby7DWm_720x0__1.jpg
70,Kv7NvFASe,Hamilton vs Verstappen. Preguntas y respuestas de cara a un final de campeonato atrapante,https://www.clarin.com/deportes/formula-1-hamilton-vs-verstappen-preguntas-respuestas-final-campeonato-atrapante-ultimos-tiempos_0_Kv7NvFASe.html,https://images.clarin.com/2021/10/21/ZKh9ifD1x_720x0__1.jpg
71,xUO4PeRzD,Independiente. Un grupo de barras se metió al vestuario a increpar a los jugadores tras el empate,https://www.clarin.com/deportes/grupo-barras-independiente-metio-vestuario-recriminarle-nivel-jugadores_0_xUO4PeRzD.html,https://images.clarin.com/2021/10/21/jdtcy5kKn_720x0__1.jpg
72,d3Wrg8Yd2,"Habló con Clarín. Sebastián Báez, la estrella de la NextGen  que sueña en grande",https://www.clarin.com/deportes/sebastian-baez-estrella-nextgen-tenis-argentino-suena-grande-va-paso-paso_0_d3Wrg8Yd2.html,https://images.clarin.com/2021/10/20/Z9ocfJM_8_1256x620__2.jpg#1634768784870
73,Vu4JHm4JA,Tope de gama. La NBA y la Fórmula 1 unidos en una sociedad de gigantes,https://www.clarin.com/deportes/unidos-nba-formula-1-unidos-sociedad-gigantes_0_Vu4JHm4JA.html,https://images.clarin.com/2021/10/20/X-_vrsOgS_720x0__1.jpg
74,P81a2vt7V,Tensión en las empresas. Arranca la pulseada entre fabricantes y supermercados por el costo de congelar,https://www.clarin.com/economia/arranca-pulseada-fabricantes-supermercados-congelamiento_0_P81a2vt7V.html,https://images.clarin.com/2021/10/21/T5-3arYQB_720x0__1.jpg
75,SsH9R4LmS,"Inflación y controles. Paso por paso, cómo se forma el precio de los alimentos",https://www.clarin.com/economia/medio-congelamiento-componen-precios-alimentos-_0_SsH9R4LmS.html,https://images.clarin.com/2021/04/24/mEKs3q2NS_1256x620__2.jpg#1634821733136
76,Cff28K0gf,"Mercado aerocomercial. Vuelven los vuelos regionales, con Brasil como eje de la temporada alta",https://www.clarin.com/economia/vuelven-vuelos-regionales-brasil-eje-temporada-alta_0_Cff28K0gf.html,https://images.clarin.com/2021/06/20/wkK3e7O86_720x0__1.jpg
77,0qLEzQtXT,"Con cinco ejes. Cómo es el plan económico que Redrado propone ""para después de las elecciones""",https://www.clarin.com/economia/plan-economico-martin-redrado-propone-aplicar-despues-elecciones-_0_0qLEzQtXT.html,https://images.clarin.com/2021/10/21/SYKdsQWi-_720x0__1.jpg
78,yM40xFy7e,Cuentas públicas. Martín Guzmán no llegará al déficit que quería Cristina,https://www.clarin.com/economia/martin-guzman-llegara-deficit-queria-cristina_0_yM40xFy7e.html,https://images.clarin.com/2021/10/12/YN5KuUmQY_1256x620__2.jpg#1634903424658
79,MkbrG8iSm,Tras 8 años. Ciudad: aumentan las asignaciones familiares para el personal porteño,https://www.clarin.com/economia/ciudad-aumentan-asignaciones-familiares-personal-porteno_0_MkbrG8iSm.html,https://images.clarin.com/2021/10/22/gRa-lG106_720x0__1.jpg
