n,id,title,url,image
1,BJeyBw46V,El impacto de la segunda ola. Confirman 23.718 nuevos casos de coronavirus y crece el número de pacientes en terapia intensiva,https://www.clarin.com/sociedad/coronavirus-argentina-confirman-23-718-nuevos-casos-ultimas-24-horas_0_BJeyBw46V.html,https://images.clarin.com/2021/04/28/EwfC1YLpc_1256x620__2.jpg#1619634497604
2,srjEinqoI,"Manejo de la pandemia. Con Larreta y Kicillof, Alberto F. termina la ronda de diálogo antes de definir restricciones",https://www.clarin.com/politica/larreta-kicillof-alberto-fernandez-termina-ronda-dialogo-gobernadores-definir-restricciones_0_srjEinqoI.html,https://images.clarin.com/2021/04/03/TYcZbaR_C_720x0__1.jpg
3,BAOQZ0itl,Reunión clave. Habrá más controles a la circulación y no descartan cerrar accesos a la Ciudad,https://www.clarin.com/politica/controles-circulacion-descartan-cerrar-accesos-ciudad-coronavirus_0_BAOQZ0itl.html,https://images.clarin.com/2019/12/16/l2qFh11d_720x0__1.jpg
4,HeoXcUmWW,"Ranking global. Argentina, el tercer país que peor actuó en el manejo de la pandemia",https://www.clarin.com/economia/argentina-paises-peor-actuaron-frente-pandemia-coronavirus_0_HeoXcUmWW.html,https://images.clarin.com/2021/04/28/HfP0kjJX0_720x0__1.jpg
5,r50v270Ch,A través de un comunicado. El senador Esteban Bullrich confirmó que sufre ELA,https://www.clarin.com/politica/esteban-bullrich-confirmo-sufre-ela-dios-pone-pruebas-podamos-superar-_0_r50v270Ch.html,https://images.clarin.com/2019/09/01/wmLVqt2Rs_720x0__1.jpg
6,_SYqO9II1,ELA. Cómo es la enfermedad que padece el senador,https://www.clarin.com/buena-vida/ela-enfermedad-padece-esteban-bullrich_0__SYqO9II1.html,https://images.clarin.com/2018/07/17/rkmR8ghmX_720x0__1.jpg
7,cYwhX1ewB,En redes sociales. El mensaje de Cristina Kirchner a Esteban Bullrich,https://www.clarin.com/politica/mensaje-cristina-kirchner-esteban-bullrich-revelo-sufre-ela_0_cYwhX1ewB.html,https://images.clarin.com/2020/12/08/GXufIYelP_720x0__1.jpg
8,waPpK2PJq,2-1 al PSG. El City dio el golpe en París y quedó cerca de la final,https://www.clarin.com/deportes/paris-saint-germain-vs-manchester-city-champions-league-previa-alineaciones-directo_0_waPpK2PJq.html,https://images.clarin.com/2021/04/28/s0rdIELoI_720x0__1.jpg
9,h24q0BQNH,Plan por 72 horas. Los TV y equipos de audio que se pueden comprar en 24 cuotas sin interés,https://www.clarin.com/servicios/televisores-equipos-audio-pueden-comprar-24-cuotas-interes_0_h24q0BQNH.html,https://images.clarin.com/2021/03/09/lPXiHHED5_720x0__1.jpg
10,U-73vb1cs,Los Toldos. El fisicoculturista detenido por femicidio sufrió una paliza en prisión,https://www.clarin.com/policiales/fisicoculturista-detenido-femicidio-toldos-recibio-golpiza-prision_0_U-73vb1cs.html,https://images.clarin.com/2021/04/28/g8XdXovgh_1256x620__2.jpg#1619629944291
11,rm0CbPvmH,"""Kenai"". El ""chico bien"" que robó medio millón de dólares para mantener su estatus",https://www.clarin.com/policiales/-kenai-chico-bien-cayo-robar-medio-millon-dolares-mantener-estatus_0_rm0CbPvmH.html,https://images.clarin.com/2021/04/27/YIlr1THD__720x0__1.jpg
12,45G5zMFIE,Especial Clarín. Acuerdo secreto: los criaderos de cerdos que China quiere poner en Argentina,https://www.clarin.com/especiales/luces-sombras-acuerdo-secreto-megacriaderos-cerdos-china-quiere-instalar-argentina_0_45G5zMFIE.html,https://images.clarin.com/2020/12/14/ckZztnqMd_720x0__1.jpg
13,TdbU1S75I,Otra variante. La crisis en la India preocupa al planeta,https://www.clarin.com/mundo/coronavirus-crisis-india-preocupa-planeta-_0_TdbU1S75I.html,https://images.clarin.com/2021/04/28/NkuP1WGgp_1256x620__2.jpg#1619613481813
14,QDL82E6E4,Enemigos. ¿Qué pasó entre Mark Zuckerberg y Tim Cook?,https://www.clarin.com/new-york-times-international-weekly/mark-zuckerberg-tim-cook-convirtieron-enemigos_0_QDL82E6E4.html,https://images.clarin.com/2021/04/26/D4sxSYkGp_1256x620__2.jpg#1619464338412
15,BJeyBw46V,El impacto de la segunda ola. Confirman 23.718 nuevos casos de coronavirus y crece el número de pacientes en terapia intensiva,https://www.clarin.com/sociedad/coronavirus-argentina-confirman-23-718-nuevos-casos-ultimas-24-horas_0_BJeyBw46V.html,https://images.clarin.com/2021/04/28/EwfC1YLpc_1256x620__2.jpg#1619634497604
16,srjEinqoI,"Manejo de la pandemia. Con Larreta y Kicillof, Alberto F. termina la ronda de diálogo antes de definir restricciones",https://www.clarin.com/politica/larreta-kicillof-alberto-fernandez-termina-ronda-dialogo-gobernadores-definir-restricciones_0_srjEinqoI.html,https://images.clarin.com/2021/04/03/TYcZbaR_C_720x0__1.jpg
17,BAOQZ0itl,Reunión clave. Habrá más controles a la circulación y no descartan cerrar accesos a la Ciudad,https://www.clarin.com/politica/controles-circulacion-descartan-cerrar-accesos-ciudad-coronavirus_0_BAOQZ0itl.html,https://images.clarin.com/2019/12/16/l2qFh11d_720x0__1.jpg
18,HeoXcUmWW,"Ranking global. Argentina, el tercer país que peor actuó en el manejo de la pandemia",https://www.clarin.com/economia/argentina-paises-peor-actuaron-frente-pandemia-coronavirus_0_HeoXcUmWW.html,https://images.clarin.com/2021/04/28/HfP0kjJX0_720x0__1.jpg
19,r50v270Ch,A través de un comunicado. El senador Esteban Bullrich confirmó que sufre ELA,https://www.clarin.com/politica/esteban-bullrich-confirmo-sufre-ela-dios-pone-pruebas-podamos-superar-_0_r50v270Ch.html,https://images.clarin.com/2019/09/01/wmLVqt2Rs_720x0__1.jpg
20,_SYqO9II1,ELA. Cómo es la enfermedad que padece el senador,https://www.clarin.com/buena-vida/ela-enfermedad-padece-esteban-bullrich_0__SYqO9II1.html,https://images.clarin.com/2018/07/17/rkmR8ghmX_720x0__1.jpg
21,cYwhX1ewB,En redes sociales. El mensaje de Cristina Kirchner a Esteban Bullrich,https://www.clarin.com/politica/mensaje-cristina-kirchner-esteban-bullrich-revelo-sufre-ela_0_cYwhX1ewB.html,https://images.clarin.com/2020/12/08/GXufIYelP_720x0__1.jpg
22,waPpK2PJq,2-1 al PSG. El City dio el golpe en París y quedó cerca de la final,https://www.clarin.com/deportes/paris-saint-germain-vs-manchester-city-champions-league-previa-alineaciones-directo_0_waPpK2PJq.html,https://images.clarin.com/2021/04/28/s0rdIELoI_720x0__1.jpg
23,CmglS0fs_,"Una vida de película. Kim Basinger, del éxito en el cine y comprar un pueblo entero a la bancarrota y el encierro",https://www.clarin.com/espectaculos/cine/vida-kim-basinger-exito-bancarrota-encierro_0_CmglS0fs_.html,https://images.clarin.com/2020/12/02/YKqcJEYZT_720x0__1.jpg
24,XwmnLZGgl,"Orbitó la nave en 1969. Murió Michael Collins, el único astronauta del Apolo 11 que no pisó la Luna",https://www.clarin.com/mundo/murio-michael-collins-unico-astronauta-primera-mision-luna-llego-pisarla_0_XwmnLZGgl.html,https://images.clarin.com/2021/04/28/06jTssZui_1256x620__2.jpg#1619628113413
25,Wmd3wP5J-,Historias de encierros. Los que llevan un año sin salir por la pandemia: cuando la vida se achica,https://www.clarin.com/ciudades/llevan-ano-salir-coronavirus-pasa-vida-achica_0_Wmd3wP5J-.html,https://images.clarin.com/2021/04/27/6YKbdqCeJ_1256x620__2.jpg#1619572052211
26,xq3a73sER,Finanzas personales. Cómo poner los pesos a trabajar: la estrategia que plantean bancos y billeteras virtuales,https://www.clarin.com/economia/poner-pesos-trabajar-estrategia-riesgo-plantean-bancos-billeteras-virtuales_0_xq3a73sER.html,https://images.clarin.com/2020/09/03/1yx_cauTZ_720x0__1.jpg
27,ws_EqxA1b,Estafas bancarias. Los fraudes más comunes y 10 estrategias para evitarlos,https://www.clarin.com/servicios/estafas-bancarias-enganos-comunes-10-estrategias-evitarlos_0_ws_EqxA1b.html,https://images.clarin.com/2020/08/19/GRU_umLoo_720x0__1.jpg
28,K45bhcMkk,Primer uso del año. Estufas: qué revisar al encenderlas y cuánto cobran los gasistas,https://www.clarin.com/servicios/estufas-revisar-volver-encenderlas-cobran-ahora-gasistas_0_K45bhcMkk.html,https://images.clarin.com/2021/04/27/az7TvemXV_720x0__1.jpg
29,6CcP2MndP,Tras reabrir en febrero. Apuntan al Parque de la Costa como foco de contagio: sólo recibe el 15% de su capacidad,https://www.clarin.com/zonales/apuntan-parque-costa-foco-contagio-obligan-recibir-solo-15-visitantes_0_6CcP2MndP.html,https://images.clarin.com/2021/03/24/UqbN-bezK_720x0__1.jpg
30,xplcETZkc,Clásico de los 70. La serie La isla de la fantasía vuelve con nuevo elenco,https://www.clarin.com/espectaculos/tv/serie-isla-fantasia-vuelve-nuevo-elenco_0_xplcETZkc.html,https://images.clarin.com/2021/04/28/juKbDctEI_720x0__1.jpg
31,nd6vzB4vm,Proyecto criticado. Burlas contra Leo DiCaprio porque hará la remake de Otra ronda,https://www.clarin.com/espectaculos/cine/oscar-2021-burlan-leo-dicaprio-hara-remake-ronda_0_nd6vzB4vm.html,https://images.clarin.com/2021/04/28/Uh1JW-9B4_720x0__1.jpg
32,CmglS0fs_,"Una vida de película. Kim Basinger, del éxito en el cine y comprar un pueblo entero a la bancarrota y el encierro",https://www.clarin.com/espectaculos/cine/vida-kim-basinger-exito-bancarrota-encierro_0_CmglS0fs_.html,https://images.clarin.com/2020/12/02/YKqcJEYZT_720x0__1.jpg
33,XwmnLZGgl,"Orbitó la nave en 1969. Murió Michael Collins, el único astronauta del Apolo 11 que no pisó la Luna",https://www.clarin.com/mundo/murio-michael-collins-unico-astronauta-primera-mision-luna-llego-pisarla_0_XwmnLZGgl.html,https://images.clarin.com/2021/04/28/06jTssZui_1256x620__2.jpg#1619628113413
34,Wmd3wP5J-,Historias de encierros. Los que llevan un año sin salir por la pandemia: cuando la vida se achica,https://www.clarin.com/ciudades/llevan-ano-salir-coronavirus-pasa-vida-achica_0_Wmd3wP5J-.html,https://images.clarin.com/2021/04/27/6YKbdqCeJ_1256x620__2.jpg#1619572052211
35,xq3a73sER,Finanzas personales. Cómo poner los pesos a trabajar: la estrategia que plantean bancos y billeteras virtuales,https://www.clarin.com/economia/poner-pesos-trabajar-estrategia-riesgo-plantean-bancos-billeteras-virtuales_0_xq3a73sER.html,https://images.clarin.com/2020/09/03/1yx_cauTZ_720x0__1.jpg
36,ws_EqxA1b,Estafas bancarias. Los fraudes más comunes y 10 estrategias para evitarlos,https://www.clarin.com/servicios/estafas-bancarias-enganos-comunes-10-estrategias-evitarlos_0_ws_EqxA1b.html,https://images.clarin.com/2020/08/19/GRU_umLoo_720x0__1.jpg
37,K45bhcMkk,Primer uso del año. Estufas: qué revisar al encenderlas y cuánto cobran los gasistas,https://www.clarin.com/servicios/estufas-revisar-volver-encenderlas-cobran-ahora-gasistas_0_K45bhcMkk.html,https://images.clarin.com/2021/04/27/az7TvemXV_720x0__1.jpg
38,6CcP2MndP,Tras reabrir en febrero. Apuntan al Parque de la Costa como foco de contagio: sólo recibe el 15% de su capacidad,https://www.clarin.com/zonales/apuntan-parque-costa-foco-contagio-obligan-recibir-solo-15-visitantes_0_6CcP2MndP.html,https://images.clarin.com/2021/03/24/UqbN-bezK_720x0__1.jpg
39,xplcETZkc,Clásico de los 70. La serie La isla de la fantasía vuelve con nuevo elenco,https://www.clarin.com/espectaculos/tv/serie-isla-fantasia-vuelve-nuevo-elenco_0_xplcETZkc.html,https://images.clarin.com/2021/04/28/juKbDctEI_720x0__1.jpg
40,nd6vzB4vm,Proyecto criticado. Burlas contra Leo DiCaprio porque hará la remake de Otra ronda,https://www.clarin.com/espectaculos/cine/oscar-2021-burlan-leo-dicaprio-hara-remake-ronda_0_nd6vzB4vm.html,https://images.clarin.com/2021/04/28/Uh1JW-9B4_720x0__1.jpg
41,uCA9vi8Va,Segunda fecha. Defensa y Justicia recibe a Universitario en busca de su primera victoria,https://www.clarin.com/deportes/defensa-justicia-vs-universitario-copa-libertadores-previa-alineaciones-directo_0_uCA9vi8Va.html,https://images.clarin.com/2021/04/25/FMtZOW9DL_1256x620__3.jpg#1619640884493
42,MAIe9j1QD,Iría a los Knicks.  En Europa afirman que otro argentino está muy cerca de llegar a la NBA,https://www.clarin.com/deportes/basquet/luca-vildoza-europa-aseguran-argentino-cierra-llegada-nba_0_MAIe9j1QD.html,https://images.clarin.com/2020/06/30/ff1SFJhCS_1256x620__2.jpg#1619630266089
43,S5kKpOazA,"Tragedia en el rally. Un testamento, una bola de fuego y una investigación inconclusa",https://www.clarin.com/deportes/tragedia-cambio-rally-testamento-bola-fuego-investigacion-inconclusa_0_S5kKpOazA.html,https://images.clarin.com/2021/04/27/-QUruL0Si_720x0__1.jpg
44,IpmrGdiIs,Dio de baja un GP. La Fórmula 1 confirmó dónde será su primera carrera sprint,https://www.clarin.com/deportes/formula-1-confirmo-primera-carrera-sprint-dio-baja-gp-coronavirus_0_IpmrGdiIs.html,https://images.clarin.com/2020/08/09/EWbXJ5N74_720x0__1.jpg
45,jxV65EG2o,"""Soy hincha"". El fundador de Spotify insiste en comprar al Arsenal de Inglaterra",https://www.clarin.com/deportes/fundador-spotify-insiste-oferta-comprar-arsenal-inglaterra-va-serio-_0_jxV65EG2o.html,https://images.clarin.com/2021/04/26/c7wjpzOIN_720x0__1.jpg
46,Gny8giad7,"El futuro de la Pulga. El PSG ya tiene una oferta para Messi que es ""inalcanzable"" para Barcelona",https://www.clarin.com/deportes/barcelona-mostro-cartas-psg-oferta-inalcanzable-fichar-messi_0_Gny8giad7.html,https://images.clarin.com/2021/04/28/2ItJSuimd_720x0__1.jpg
47,DGzc-RBNj,Ya tiene fecha. Mayweather vuelve al ring en una pelea con el youtuber Logan Paul ,https://www.clarin.com/deportes/mayweather-logan-paul-pelea-fecha-confir_0_DGzc-RBNj.html,https://images.clarin.com/2021/04/28/wUmTjqgX0_720x0__1.jpg
48,aFSX7cg-O,Sorpresa. Alejandro Fantino anunció el final de su programa en ESPN y explicó los motivos,https://www.clarin.com/deportes/alejandro-fantino-anuncio-final-programa-espn-explico-motivos_0_aFSX7cg-O.html,https://images.clarin.com/2021/04/01/cJ875X0i5_720x0__1.jpg
49,J-NzsbkHY,Crisis en Brasil. Piden aplazar embarazos y la vacunación será prioridad en embarazadas,https://www.clarin.com/mundo/coronavirus-brasil-pide-aplazar-embarazos-pone-todas-embarazadas-primer-lugar-vacunar_0_J-NzsbkHY.html,https://images.clarin.com/2021/03/26/EqrTFMpHS_1256x620__2.jpg#1619629922308
50,m7fDyDglN,"Negoció el préstamo en 2018. El FMI jubila a Werner, funcionario clave en las relaciones con la Argentina ",https://www.clarin.com/economia/fondo-monetario-internacional-jubila-alejandro-werner-funcionario-clave-relaciones-argentina-ultimos-anos_0_m7fDyDglN.html,https://images.clarin.com/2021/04/28/Dt46n74tc_720x0__1.jpg
51,9yV9zS3Br,Encuesta incómoda. Cuánto le cree la gente a los 11 principales políticos argentinos,https://www.clarin.com/politica/encuesta-incomoda-preguntaron-credibilidad-11-politicos-argentinos-reprobaron_0_9yV9zS3Br.html,https://images.clarin.com/2021/04/25/BHeGiSOrQ_720x0__1.jpg
52,2BJ3HNEdC,Locura al volante. El joven que se metió en contramano por la 9 de Julio tenía pedido de captura,https://www.clarin.com/policiales/video-hombre-evadio-control-metio-contramano-9-julio-pedido-captura-robo_0_2BJ3HNEdC.html,https://images.clarin.com/2021/04/27/2JQwMWwTa_720x0__1.jpg
53,b-JStjVGc,En plena pandemia. Perdió un trasplante por la cumbre del G20 y ahora lo logró por un gesto de amor,https://www.clarin.com/sociedad/perdio-trasplante-rinon-cumbre-g20-ahora-logro-gesto-amor_0_b-JStjVGc.html,https://images.clarin.com/2021/04/28/pJlF1igg6_1256x620__2.jpg#1619638702494
54,qivLM7KnD,"Justicia y género. La insólita respuesta de un aspirante a juez sobre el concepto ""techo de cristal""",https://www.clarin.com/politica/insolita-respuesta-aspirante-juez-preguntaron-concepto-techo-cristal-_0_qivLM7KnD.html,https://images.clarin.com/2021/04/28/MarstoC42_720x0__1.jpg
55,aIRCy7Zzl,Crecimiento agrícola. Un aliado completo en cada momento del ciclo productivo,https://www.clarin.com/brandstudio/aliado-completo-momento-ciclo-productivo_0_aIRCy7Zzl.html,https://images.clarin.com/2019/03/12/TJzi2Dq-D_720x0__1.jpg
56,iGa7G4fWs,Salidas cercanas. Restaurantes de campo para disfrutar de una escapada en familia,https://www.clarin.com/viajes/8-restaurantes-campo-disfrutar-escapada-familia_0_iGa7G4fWs.html,https://images.clarin.com/2021/04/27/c4GDAJ-qY_720x0__1.jpg
57,zniVCs9yE,Discriminación. Albinos: contra el estigma y por una ley nacional que los proteja,https://www.clarin.com/buena-vida/albinos-estigma-ley-nacional-proteja_0_zniVCs9yE.html,https://images.clarin.com/2021/04/27/XFfCrK1K1_720x0__1.jpg
58,Qef9N7Th8,"Turismo. 6 puentes imperdibles: vértigo, arquitectura impactante y grandes vistas",https://www.clarin.com/viajes/6-puentes-imperdibles-mundo-vertigo-arquitectura-impactante-grandes-vistas_0_Qef9N7Th8.html,https://images.clarin.com/2021/04/26/p_B2Y-iZz_720x0__1.jpg
59,Vu_En31h_,Lanzamiento. Samsung presenta sus nuevas notebooks Galaxy Book Pro y Galaxy Pro 360,https://www.clarin.com/tecnologia/samsung-presenta-nuevas-notebooks-galaxy-book-pro-galaxy-pro-360_0_Vu_En31h_.html,https://images.clarin.com/2021/04/28/WHpNWWsC0_720x0__1.jpg
60,7LmotJsBD,De película. La casa rodante con fuselaje de avión hecha por un convicto,https://www.clarin.com/autos/andromeda-casa-rodante-fuselaje-avion-hecha-convicto-california_0_7LmotJsBD.html,https://images.clarin.com/2021/04/28/EjxVvfx-w_720x0__1.jpg
61,zN28IgbfZ,Sexo y relaciones. ¿Qué significa ser pansexual?,https://www.clarin.com/relaciones/que-significa-ser-pansexual_0_zN28IgbfZ.html,https://images.clarin.com/2021/04/06/DnfEC7u9e_720x0__1.jpg
62,leMoc0gaD,"Horóscopo. Lilith, la luna negra del zodíaco: la energía más oscura de tu carta natal",https://www.clarin.com/astrologia/lilith-luna-negra-zodiaco-energia-oscura-carta-natal_0_leMoc0gaD.html,https://images.clarin.com/2021/04/27/o0us34uKJ_720x0__1.jpg
63,s-KQRZcsV,En Copenhague. FIFA 21: Argentina se clasificó a la eNations Cup,https://www.clarin.com/brandstudio/fifa-21-argentina-clasifico-enations-cup_0_s-KQRZcsV.html,https://images.clarin.com/2021/04/26/sVLQIK8el_720x0__1.jpg
64,PNoNido7H,Junto a Undead. Una importante empresa dice presente en el mundo de los esports,https://www.clarin.com/tecnologia/esports/burger-king-dice-presente-mundo-esports_0_PNoNido7H.html,https://images.clarin.com/2021/04/15/IVFs_QWS8_720x0__1.jpg
65,Ru03vCC5m,Hollywood. Las infidelidades y separaciones más escandalosas de las celebridades,https://www.clarin.com/internacional/espectaculos/infidelidades-separaciones-escandalosas-celebridades_0_Ru03vCC5m.html,https://images.clarin.com/2015/03/24/HyxRWk14x_720x0.jpg
66,yjtli2S1v,Japón. Salió con 4.000 mujeres y a los 77 años lo asesinó su esposa de 25,https://www.clarin.com/viste/salio-4-000-mujeres-77-anos-asesino-esposa-25_0_yjtli2S1v.html,https://images.clarin.com/2021/04/28/5rqZHaBzN_720x0__1.jpg
67,bY3kD0TQs,A 76 años. La muerte de Mussolini: cómo está ahora el lugar donde lo colgaron de los pies,https://www.clarin.com/internacional/video-muerte-mussolini-italia_0_bY3kD0TQs.html,https://images.clarin.com/2020/04/28/nj_UDqwN1_720x0__1.jpg
68,R4ko_cm4S,"EE.UU.. Murió un bebé al que su madre alimentó con una dieta vegana ""basada"" en la Biblia",https://www.clarin.com/internacional/murio-bebe-madre-alimento-dieta-vegana-basada-biblia-_0_R4ko_cm4S.html,https://images.clarin.com/2021/04/28/vf9ZG1sle_720x0__1.jpg
69,KZyEAi-Tu,Fabulosa. La casa que se construye con un contenedor y tiene agua y luz gratis,https://www.clarin.com/viste/casa-construye-contenedor-reciclado-agua-luz-gratis_0_KZyEAi-Tu.html,https://images.clarin.com/2021/04/28/0JrjX-jM8_720x0__1.jpg
70,cIpU7Cfey,Votar en pandemia. Distancia social y protocolos: las medidas que analizan para las elecciones,https://www.clarin.com/politica/distancia-social-protocolos-medidas-analiza-gobierno-votar-elecciones-2021_0_cIpU7Cfey.html,https://images.clarin.com/2021/04/28/IrBtxwCwx_720x0__1.jpg
71,R1ADr07dm,Pandemia en EE.UU.. Primavera de optimismo en Nueva York: la segunda ola de coronavirus se debilita,https://www.clarin.com/mundo/primavera-optimismo-nueva-york-segunda-ola-coronavirus-debilita_0_R1ADr07dm.html,https://images.clarin.com/2021/04/28/QmzjG71po_720x0__1.jpg
72,NE2K-fXP9,Demora y misterio. Por qué AstraZeneca todavía no trajo ninguna vacuna al país,https://www.clarin.com/sociedad/hugo-sigman-fabrico-60-millones-vacunas-covid-astrazeneca-todavia-trajo-pais_0_NE2K-fXP9.html,https://images.clarin.com/2021/03/16/k8qcTpYXW_720x0__1.jpg
73,lP17Jiqxj,Cumbre en la Rosada. Carla Vizzotti le pidió a AstraZeneca información por la demora con las dosis,https://www.clarin.com/sociedad/coronavirus-carla-vizzotti-pidio-astrazeneca-informacion-demora-entrega-vacunas_0_lP17Jiqxj.html,https://images.clarin.com/2021/04/28/hvZEd7A-N_720x0__1.jpg
74,xZGeQMt7F,Copa América. Scaloni entregó una lista preliminar con los de siempre más algunas sorpresas,https://www.clarin.com/deportes/copa-america-scaloni-entrego-lista-preliminar-siempre-sorpresas_0_xZGeQMt7F.html,https://images.clarin.com/2020/10/09/OuHGZRT7H_720x0__1.jpg
75,ZhHi5kzBN,"""Hoy somos familia"". Ricardo Gareca contó por primera vez que reconoció a una hija extramatrimonial",https://www.clarin.com/deportes/ricardo-gareca-conto-primera-vez-reconocio-hija-extramatrimonial-fuerte-hoy-familia-_0_ZhHi5kzBN.html,https://images.clarin.com/2021/04/28/hwNgUgWWK_720x0__1.jpg
76,EwV8zfoKe,"Violencia de género. Prendió fuego a su esposa con nafta, le dieron 12 años y no irá a la cárcel",https://www.clarin.com/policiales/prendio-fuego-esposa-bidon-nafta-dieron-12-anos-ira-carcel_0_EwV8zfoKe.html,https://images.clarin.com/2021/04/28/ACDuf1k9__720x0__1.jpg
77,XSxuL3YC8,En la Ciudad. La Justicia ordenó suspender el cobro del impuesto a las tarjetas de crédito,https://www.clarin.com/politica/justicia-portena-ordeno-gobierno-ciudad-suspenda-cobro-impuesto-tarjetas-credito_0_XSxuL3YC8.html,https://images.clarin.com/2021/04/26/2LV461SOi_720x0__1.jpg
