n,id,title,url,image
1,1XPvnSsUC,Tensión Nación-Ciudad. La contraofensiva del Gobierno: dos presentaciones judiciales para frenar la apertura de escuelas,https://www.clarin.com/politica/contraofensiva-gobierno-horacio-rodriguez-larreta-presentaciones-judiciales-frenar-apertura-escuelas_0_1XPvnSsUC.html,https://images.clarin.com/2021/03/01/dhAux6Of0_720x0__1.jpg
2,TbAiILyNG,Aulas cerradas. Kicillof  volvió a defender la medida con un mensaje político a la Ciudad,https://www.clarin.com/politica/axel-kicillof-defendio-cierre-escuelas-dejo-mensaje-politico-ciudad_0_TbAiILyNG.html,https://images.clarin.com/2021/04/08/O6ycWvyNc_720x0__1.jpg
3,Xdm4hVg7x,Protestas. Padres y alumnos realizan abrazos en varias escuelas de Provincia,https://www.clarin.com/sociedad/suspension-clases-presenciales-padres-alumnos-realizan-abrazos-escuelas-provincia_0_Xdm4hVg7x.html,https://images.clarin.com/2021/04/19/eMFv3VMNr_720x0__1.jpg
4,URgir9-dE,Tras el fallo judicial. Abrieron los colegios en la Ciudad: estiman un 60% de presencialidad,https://www.clarin.com/ciudades/abren-escuelas-ciudad-fallo-justicia-nuevos-medidas-paro-gremios_0_URgir9-dE.html,https://images.clarin.com/2021/04/19/Lcdj2dIGY_720x0__1.jpg
5,rjd0LpiDa,"Escenario. Futuro educativo definido en los tribunales, ¿qué puede salir mal?",https://www.clarin.com/sociedad/futuro-educacion-definido-tribunales-puede-salir-mal-_0_rjd0LpiDa.html,https://images.clarin.com/2021/04/19/7W9JaX-nw_720x0__1.jpg
6,TW8uyTdPg,Quinta presidencial. Masiva manifestación en Olivos por las clases presenciales,https://www.clarin.com/zonales/video-masivas-protestas-escuelas-conurbano-quinta-olivos-clases_0_TW8uyTdPg.html,https://images.clarin.com/2021/04/19/rBDqn7yml_720x0__1.jpg
7,KYBDxFZJe,Polémico. El Ministerio de Seguridad borró un tuit contra el gobierno porteño,https://www.clarin.com/politica/ministerio-seguridad-nacion-borrar-polemico-tuit-gobierno-porteno_0_KYBDxFZJe.html,https://images.clarin.com/2020/10/01/w8k7P2-Td_720x0__1.jpg
8,esbLHlJ2i,Coronavirus. Por qué la Argentina le pidió al Fondo Covax la menor cantidad de vacunas posible,https://www.clarin.com/sociedad/coronavirus-pese-falta-vacunas-argentina-pidio-fondo-covax-menor-cantidad-dosis-posible_0_esbLHlJ2i.html,https://images.clarin.com/2021/04/18/YEi14uxZR_720x0__1.jpg
9,QusXjw7wq,Histórico. El helicóptero Ingenuity vuela en Marte por primera vez,https://www.clarin.com/mundo/historico-helicoptero-ingenuity-vuela-marte-primera-vez_0_QusXjw7wq.html,https://images.clarin.com/2021/04/19/FRRmy4e9W_1256x620__2.jpg#1618832582593
10,46_0d341f,"Humor político. La Patria es el otro + 4,8% mensual",https://www.clarin.com/opinion/patria-4-8-mensual_0_46_0d341f.html,https://images.clarin.com/2021/04/16/SRQSQdBUA_720x0__1.jpg
11,uqxCX2xCJ,"Maniobra en alza. Trabajar desde casa para el exterior: el truco ""cripto"" para traer dólares a valor blue",https://www.clarin.com/servicios/trabajar-casa-exterior-truco-cripto-traer-dolares-valor-blue_0_uqxCX2xCJ.html,https://images.clarin.com/2018/10/16/yAFCOaW81_720x0__1.jpg
12,71BdwgA3q,Turismo. Escapadas: un viaje en el tiempo por castillos y mansiones bonaerenses,https://www.clarin.com/viajes/escapadas-viaje-tiempo-castillos-mansiones-bonaerenses_0_71BdwgA3q.html,https://images.clarin.com/2021/04/16/QmwIR9uWe_720x0__1.jpg
13,zmB0kkgH-,Análisis. Qué condenó a la misión de Estados Unidos en Afganistán,https://www.clarin.com/new-york-times-international-weekly/contradiccion-condeno-mision-unidos-afganistan_0_zmB0kkgH-.html,https://images.clarin.com/2021/04/16/NN7iCkNSz_720x0__1.jpg
14,kwzMHJosG,"Informática. ""Amo"", ""esclavo"" y otros términos racistas",https://www.clarin.com/new-york-times-international-weekly/-amo-esclavo-lucha-terminos-ofensivos-informatica_0_kwzMHJosG.html,https://images.clarin.com/2021/04/16/kIweQfttm_1256x620__2.jpg#1618625475543
15,1XPvnSsUC,Tensión Nación-Ciudad. La contraofensiva del Gobierno: dos presentaciones judiciales para frenar la apertura de escuelas,https://www.clarin.com/politica/contraofensiva-gobierno-horacio-rodriguez-larreta-presentaciones-judiciales-frenar-apertura-escuelas_0_1XPvnSsUC.html,https://images.clarin.com/2021/03/01/dhAux6Of0_720x0__1.jpg
16,TbAiILyNG,Aulas cerradas. Kicillof  volvió a defender la medida con un mensaje político a la Ciudad,https://www.clarin.com/politica/axel-kicillof-defendio-cierre-escuelas-dejo-mensaje-politico-ciudad_0_TbAiILyNG.html,https://images.clarin.com/2021/04/08/O6ycWvyNc_720x0__1.jpg
17,Xdm4hVg7x,Protestas. Padres y alumnos realizan abrazos en varias escuelas de Provincia,https://www.clarin.com/sociedad/suspension-clases-presenciales-padres-alumnos-realizan-abrazos-escuelas-provincia_0_Xdm4hVg7x.html,https://images.clarin.com/2021/04/19/eMFv3VMNr_720x0__1.jpg
18,URgir9-dE,Tras el fallo judicial. Abrieron los colegios en la Ciudad: estiman un 60% de presencialidad,https://www.clarin.com/ciudades/abren-escuelas-ciudad-fallo-justicia-nuevos-medidas-paro-gremios_0_URgir9-dE.html,https://images.clarin.com/2021/04/19/Lcdj2dIGY_720x0__1.jpg
19,rjd0LpiDa,"Escenario. Futuro educativo definido en los tribunales, ¿qué puede salir mal?",https://www.clarin.com/sociedad/futuro-educacion-definido-tribunales-puede-salir-mal-_0_rjd0LpiDa.html,https://images.clarin.com/2021/04/19/7W9JaX-nw_720x0__1.jpg
20,TW8uyTdPg,Quinta presidencial. Masiva manifestación en Olivos por las clases presenciales,https://www.clarin.com/zonales/video-masivas-protestas-escuelas-conurbano-quinta-olivos-clases_0_TW8uyTdPg.html,https://images.clarin.com/2021/04/19/rBDqn7yml_720x0__1.jpg
21,KYBDxFZJe,Polémico. El Ministerio de Seguridad borró un tuit contra el gobierno porteño,https://www.clarin.com/politica/ministerio-seguridad-nacion-borrar-polemico-tuit-gobierno-porteno_0_KYBDxFZJe.html,https://images.clarin.com/2020/10/01/w8k7P2-Td_720x0__1.jpg
22,esbLHlJ2i,Coronavirus. Por qué la Argentina le pidió al Fondo Covax la menor cantidad de vacunas posible,https://www.clarin.com/sociedad/coronavirus-pese-falta-vacunas-argentina-pidio-fondo-covax-menor-cantidad-dosis-posible_0_esbLHlJ2i.html,https://images.clarin.com/2021/04/18/YEi14uxZR_720x0__1.jpg
23,Rdq6tFuCe,No pasa inadvertido. El éxito de Bielsa en Leeds y la grieta que no descansa ni un sábado a la mañana,https://www.clarin.com/deportes/exito-bielsa-leeds-grieta-descansa-sabado-8-manana_0_Rdq6tFuCe.html,https://images.clarin.com/2021/04/10/-F2rLI6aG_1256x620__2.jpg#1618792586107
24,JkTkNveRI,"Fin de una era. El último día de Raúl Castro, el pragmático que salió de la sombra de Fidel en Cuba",https://www.clarin.com/mundo/ultimo-dia-raul-castro-lider-pragmatico-salio-sombra-fidel-cuba_0_JkTkNveRI.html,https://images.clarin.com/2018/12/29/Avbh9dB4y_1256x620__2.jpg#1618836964188
25,OPd__jIR8,"Criptomonedas. Pi, la moneda virtual de los científicos que tiene 15 millones de fanáticos",https://www.clarin.com/economia/pi-moneda-virtual-cientificos-15-millones-fanaticos_0_OPd__jIR8.html,https://images.clarin.com/2020/10/29/lLCHwpG6J_720x0__1.jpg
26,6Cc_Vug2s,Finanzas. Ahorrar en pareja: cómo evitar los errores más comunes y crear hábitos,https://www.clarin.com/servicios/ahorrar-pareja-evitar-errores-comunes-crear-nuevos-habitos_0_6Cc_Vug2s.html,https://images.clarin.com/2018/01/04/H1Yb4psXG_720x0.jpg
27,MfTM61Pq_,Tiempo de incertidumbre. Carta de un psicólogo a adolescentes y niños de la pandemia,https://www.clarin.com/buena-vida/carta-psicologo-adolescentes-ninos-pandemia_0_MfTM61Pq_.html,https://images.clarin.com/2021/04/19/_wkb84XNa_720x0__1.jpg
28,JhrYMWZj4,Consultorio. Debate en la ciencia: ¿qué relación hay entre cáncer y estrés?,https://www.clarin.com/viva/debate-ciencia-relacion-cancer-estres-_0_JhrYMWZj4.html,https://images.clarin.com/2021/03/18/E0qzbD0Lv_720x0__1.jpg
29,XeGRY7H_A,Haciendo historia. El mandatario que ofreció el país para que fuera colonia inglesa,https://www.clarin.com/viva/mandatario-ofrecio-pais-colonia-inglesa_0_XeGRY7H_A.html,https://images.clarin.com/2020/01/09/R_saiAj2_720x0__1.jpg
30,ITsPFsaNA,"Turismo. De Mendoza a Tierra del Fuego, un viaje por los colores del otoño",https://www.clarin.com/viajes/mendoza-tierra-fuego-viaje-colores-otono_0_ITsPFsaNA.html,https://images.clarin.com/2021/04/18/0fUCENie8_720x0__1.jpg
31,PNoNido7H,Junto a Undead. Burger King® dice presente en el mundo de los esports,https://www.clarin.com/tecnologia/esports/burger-king-dice-presente-mundo-esports_0_PNoNido7H.html,https://images.clarin.com/2021/04/15/IVFs_QWS8_720x0__1.jpg
32,ZGhY9XIdF,Inglaterra. Echaron a José Mourinho como entrenador del Tottenham,https://www.clarin.com/deportes/echaron-jose-mourinho-entrenador-tottenham_0_ZGhY9XIdF.html,https://images.clarin.com/2021/04/19/1LRIvBS7d_720x0__1.jpg
33,djFMYhmMy,Se rompe el fútbol. Las acciones de la Juventus se dispararon un 13% tras el anuncio de la Superliga Europea,https://www.clarin.com/deportes/acciones-juventus-dispararon-13-anuncio-creacion-superliga-europea_0_djFMYhmMy.html,https://images.clarin.com/2021/04/11/PjP0mx03__1256x620__2.jpg#1618830272314
34,zso3X246C,Segunda ola de Covid. Independiente: Insaurralde dio positivo y ya son tres casos en 36 horas,https://www.clarin.com/deportes/brote-coronavirus-detiene-independiente-juan-manuel-insaurralde-dio-positivo-casos-36-horas_0_zso3X246C.html,https://images.clarin.com/2021/03/28/0D1TOaQQQ_720x0__1.jpg
35,zFQXnlcjP,Relato íntimo. Cuando correr en la montaña es la sanación para un maldito ataque de pánico,https://www.clarin.com/deportes/correr-montana-sanacion-escapar-maldito-ataque-panico_0_zFQXnlcjP.html,https://images.clarin.com/2021/04/18/s4pEGJTQl_720x0__1.jpg
36,AA04OFZ-Y,"River. Marcelo Gallardo y el sueño de La Masía propia, cada vez más cerca",https://www.clarin.com/deportes/river-marcelo-gallardo-sueno-masia-propia-vez-cerca_0_AA04OFZ-Y.html,https://images.clarin.com/2021/03/14/BD5rQ6gLp_720x0__1.jpg
37,709fr4pUE,"Opinión. El Boca de Russo, un cambio radical y el desafío de sostenerlo en el tiempo",https://www.clarin.com/deportes/boca-russo-cambio-radical-desafio-sostenerlo-tiempo_0_709fr4pUE.html,https://images.clarin.com/2021/04/17/ExouZXz-K_720x0__1.jpg
38,1lNI2nOOa,"Tenis. Diego Schwartzman: ""Vengo un poquito irregular, me tengo que encontrar""",https://www.clarin.com/deportes/diego-schwartzman-vengo-poquito-irregular-encontrar-_0_1lNI2nOOa.html,https://images.clarin.com/2021/04/18/voIM2wveO_1256x620__2.jpg#1618781393630
39,7AyEYGnKu,"Circo en Atlanta. El brutal nocaut de Jake Paul, el youtuber que quiere hacer su propia historia",https://www.clarin.com/deportes/jake-paul-ben-askren-nocaut_0_7AyEYGnKu.html,https://images.clarin.com/2021/04/18/zHP6I_c-Hp_1256x620__2.jpg#1618766759484
40,lNFMxmbpP,Escándalo en el Norte. Robo de vacunas en Santiago del Estero: caen otros dos enfermeros,https://www.clarin.com/sociedad/robo-vacunas-covid-19-santiago-estero-caen-enfermeros_0_lNFMxmbpP.html,https://images.clarin.com/2021/04/18/C4eQHGM5m_720x0__1.jpg
41,khxfGkTtT,Coronavirus. Pfizer anunció la entrega de  100 millones de dosis más a la Unión Europea,https://www.clarin.com/mundo/pfizer-anuncio-entrega-100-millones-dosis-vacunas-covid-union-europea_0_khxfGkTtT.html,https://images.clarin.com/2021/04/19/5htDo4g3M_1256x620__2.jpg#1618834979363
42,ee4AM2rua,Normativa. Reglamentan el blanqueo para la construcción: 8 claves,https://www.clarin.com/economia/gobierno-reglamento-blanqueo-construccion-8-claves_0_ee4AM2rua.html,https://images.clarin.com/2021/04/01/eGxuFq1ov_720x0__1.jpg
43,Ua7I6I9Te,Segunda ola de Covid. La Justicia ordenó al Ejecutivo vacunar a una mujer con Síndrome de Down,https://www.clarin.com/sociedad/justicia-ordeno-poder-ejecutivo-vacunar-coronavirus-mujer-sindrome-down_0_Ua7I6I9Te.html,https://images.clarin.com/2021/04/19/dosKp-9TN_720x0__1.jpg
44,RqnyyEtbH,Restricciones. Hay que pasar el invierno: cómo se preparan los bares y restaurantes,https://www.clarin.com/ciudades/pasar-invierno-preparan-bares-restaurantes-frio_0_RqnyyEtbH.html,https://images.clarin.com/2020/08/31/q3YYKaqrQX_720x0__1.jpg
45,BARPiP246,La Plata. La asaltaron en su relojería y murió luego de tres días en coma,https://www.clarin.com/policiales/plata-asaltaron-relojeria-murio-luego-dias-coma_0_BARPiP246.html,https://images.clarin.com/2021/04/18/dXuRhT992_1256x620__2.jpg#1618797445764
46,2QL9QNObv,"Medio siglo de cárcel. La joven condenada por el ataque a una comisaría: ""Me mataron en vida""",https://www.clarin.com/policiales/-mataron-vida-cuenta-prision-joven-condenada-ataque-comisaria-liberar-pareja_0_2QL9QNObv.html,https://images.clarin.com/2018/04/28/HJdnOhv6M_1256x620__2.jpg#1618673136562
47,szadhcn5E,"Madre del Dolor. Le mataron a dos hijos en hechos de inseguridad: ""Sigo porque quiero justicia""",https://www.clarin.com/policiales/mataron-hijos-hechos-inseguridad-sigo-adelante-quiero-justicia-_0_szadhcn5E.html,https://images.clarin.com/2021/04/18/9kBf2i4nB_720x0__1.jpg
48,Kg-CJB7dp,"Postales. Cómo es Civita di Bagnoregio, el pueblo que muere lentamente",https://www.clarin.com/viajes/civita-di-bagnoregio-pueblo-muere-lentamente_0_Kg-CJB7dp.html,https://images.clarin.com/2021/04/16/e0hy-aBom_720x0__1.jpg
49,zSyQlVEU2,"Gestión de emociones. Cómo aprovechar la ""envidia"" de Instagram para alcanzar metas personales",https://www.clarin.com/relaciones/vinculos-aprovechar-envidia-instagram-alcanzar-metas-personales_0_zSyQlVEU2.html,https://images.clarin.com/2021/04/17/E32RNWRrz_720x0__1.jpg
50,a0YNRGvzi,"Videojuegos. Del Antiguo Egipto al Holocausto, ya hay problemas para representar la Historia",https://www.clarin.com/tecnologia/antiguo-egipto-holocausto-videojuegos-problemas-representar-historia_0_a0YNRGvzi.html,https://images.clarin.com/2021/04/16/jtpi7l5rl_720x0__1.jpg
51,KIVZcBStB,Salud y nutrición. Qué alimentos deberías incluir en la dieta si tenés anemia,https://www.clarin.com/buena-vida/alimentos-deberias-incluir-dieta-tenes-anemia_0_KIVZcBStB.html,https://images.clarin.com/2021/04/18/OpSjfrQ5q_720x0__1.jpg
52,q4FwtXWsP,Malware. La falsa app que roba criptomonedas a través de un canal de Telegram,https://www.clarin.com/tecnologia/falsa-app-roba-criptomonedas-traves-canal-telegram_0_q4FwtXWsP.html,https://images.clarin.com/2021/04/18/K81tCQTsJ_720x0__1.jpg
53,B40q5unNo,"Ecoturismo. Escapadas de otoño: 8 reservas naturales, un respiro al aire libre",https://www.clarin.com/viajes/escapadas-otono-8-reservas-naturales-respiro-aire-libre_0_B40q5unNo.html,https://images.clarin.com/2021/04/13/fZIErdGbs_720x0__1.jpg
54,DvQ5HCncc,Recetas. Qué cocinar esta semana: menú día por día del 19 al 25 de abril,https://www.clarin.com/gourmet/cocinar-semana-menu-dia-dia-19-25-abril_0_DvQ5HCncc.html,https://images.clarin.com/2021/04/02/n8Z7N9ZLz_1256x620__4.jpg#1618672870288
55,Gqt--Mkkx,Horóscopo semanal. Predicciones del 19 al 25 de abril para todos los signos,https://www.clarin.com/astrologia/horoscopo-semanal-predicciones-19-25-abril-signos_0_Gqt--Mkkx.html,https://images.clarin.com/2021/04/16/bY04iLq6j_720x0__1.jpg
56,nZ9Fif5Hq,Belleza. La ciencia eligió cuál es el coche más lindo de la historia,https://www.clarin.com/viste/ciencia-eligio-coche-lindo-historia_0_nZ9Fif5Hq.html,https://images.clarin.com/2021/04/19/rp5vlnbw8_720x0__1.jpg
57,wUBOGAm48,"Genio excéntrico. Albert Einstein: 7 datos curiosos y desconocidos de su vida personal, a 66 años de su muerte",https://www.clarin.com/internacional/albert-einstein-7-datos-curiosos-desconocidos-vida-personal--66-anos-muerte_0_wUBOGAm48.html,https://images.clarin.com/2021/04/17/GRzzW64Ad_720x0__1.jpg
58,7Oc769Qxi,Charla Nash. La mujer a la que un chimpancé le arrancó cara y manos,https://www.clarin.com/viste/historia-charla-nash-mujer-chimpance-arranco-cara-manos-frenetico-ataque_0_7Oc769Qxi.html,https://images.clarin.com/2021/04/17/jjXrbcTjl_720x0__1.jpg
59,60Eslgunc,Video. Una oveja derriba a un dron con un cabezazo para defender a sus crías,https://www.clarin.com/viste/oveja-derriba-dron-cabezazo-defender-crias_0_60Eslgunc.html,https://images.clarin.com/2021/04/15/FXxRysUON_720x0__1.jpg
60,k5tSAys7M,Pandemia. Descubren un nuevo talón de Aquiles del coronavirus,https://www.clarin.com/internacional/covid-19-descubren-nuevo-talon-aquiles-coronavirus_0_k5tSAys7M.html,https://images.clarin.com/2021/02/26/kb04Vc4jx_720x0__1.jpg
61,D9UwdjZKd,"""Me mordió"". El video del hombre que defiende a su esposa del ataque de un lince rabioso",https://www.clarin.com/viste/-mordio-video-hombre-defiende-esposa-ataque-lince-rabioso_0_D9UwdjZKd.html,https://images.clarin.com/2021/04/16/uqcfJrf4__720x0__1.jpg
62,5J8vLLVra,La pelea del momento. Una encuesta midió a Rodríguez Larreta contra Axel Kicillof en todo el país,https://www.clarin.com/politica/pelea-momento-encuesta-midio-horacio-rodriguez-larreta-axel-kicillof-pais_0_5J8vLLVra.html,https://images.clarin.com/2020/10/11/Lrz-a7CNQ_720x0__1.jpg
63,PvryjZ3eb,Una triste historia. El capitán que murió por Covid en alta mar y el drama de su familia argentina,https://www.clarin.com/mundo/italia-triste-historia-capitan-muerto-covid-alta-mar-drama-familia-argentina_0_PvryjZ3eb.html,https://images.clarin.com/2021/04/19/zWCQrEjEB_1256x620__2.jpg#1618839597194
64,Plw_tTXIJ,"Guerra por la pelota. Cómo se jugará la Superliga Europea, el torneo millonario con 12 gigantes",https://www.clarin.com/deportes/jugara-superliga-torneo-millonario-reunira-12-gigantes-busca-romper-hegemonia-champions-league_0_Plw_tTXIJ.html,https://images.clarin.com/2020/12/08/-RqEtxmbJ_720x0__1.jpg
65,hHBu-enBv,Contraataque. La UEFA juegas sus cartas y anuncia el nuevo formato de la Champions League,https://www.clarin.com/deportes/uefa-contraataca-anuncia-nuevo-formato-champions-league-contrarrestar-creacion-superliga_0_hHBu-enBv.html,https://images.clarin.com/2021/04/19/-kF26rAP8_720x0__1.jpg
66,O89qPzCfV,Resolución oficial. La UBA anunció que mantendrá sus colegios sin presencialidad,https://www.clarin.com/sociedad/uba-acatara-fallo-justicia-portena-mantendra-colegios-cerrados_0_O89qPzCfV.html,https://images.clarin.com/2021/04/19/ayOmsy9DE_720x0__1.jpg
67,7Vop4DGul,Un caso brutal. Violó y mató a machetazos a una joven: definen si es imputable o no,https://www.clarin.com/policiales/violo-mato-machetazos-joven-definen-imputable_0_7Vop4DGul.html,https://images.clarin.com/2021/04/19/QFsa87a0p_1256x620__2.jpg#1618838083111
68,A4K-RPV9H,"Tucumán. Motochorros balearon a un chico: ""Mamá, quedate tranquila, yo te salvé""",https://www.clarin.com/policiales/motochorros-balearon-chico-mama-quedate-tranquila-salve-_0_A4K-RPV9H.html,https://images.clarin.com/2021/04/19/D8kusQ53l_1256x620__2.jpg#1618834193070
69,_WeHXzACb,Campaña. Una empresa que lucha contra la violencia de género,https://www.clarin.com/brandstudio/dato-alarmante-90-argentinas-sufrido-acoso-callejero_0__WeHXzACb.html,https://images.clarin.com/2020/12/21/CF9hrosSD_720x0__1.jpg
