n,id,title,url,image
1,0oYkeMSaN,"Curiosa interpretación. La inflación anual fue de 50,9% y el Presidente dijo: ""Esperemos que esta senda descendente se sostenga""",https://www.clarin.com/politica/inflacion-anual-50-9-alberto-fernandez-dijo-esperemos-senda-descendente-sostenga-_0_0oYkeMSaN.html,https://images.clarin.com/2022/01/13/9tCkWwH9K_720x0__1.jpg
2,16PlkVL9el,Infierno porteño. Emiten una nueva alerta por calor extremo y pronostican 42° para hoy en la Ciudad,https://www.clarin.com/sociedad/servicio-meteorologico-emitio-nueva-alerta-calor-extremo-pronostica-42-ciudad_0_16PlkVL9el.html,https://images.clarin.com/2022/01/13/Ij44C4GCJ_720x0__1.jpg
3,Z7apC6U7UC,"Del editor. El sorteo de Milei, el viaje de Volnovich y la frivolidad insoportable",https://www.clarin.com/opinion/sorteo-milei-viaje-volnovich-frivolidad-insoportable_0_Z7apC6U7UC.html,https://images.clarin.com/2022/01/13/5EzjxgULl_720x0__1.jpg
4,hkjcxkty46,Fue estrangulado. Quién era el ex rugbier hallado muerto en una camioneta con $180 mil,https://www.clarin.com/zonales/deporte-motos-river-pasiones-marcelo-longhi-ex-rugbier-asesinado_0_hkjcxkty46.html,https://images.clarin.com/2022/01/13/x8W3QzQd9_720x0__1.jpg
5,jX74wdZvPA,"Panorama económico. Las negociaciones con el ""alter ego"" de Joe Biden que siguen los empresarios",https://www.clarin.com/opinion/negociaciones-alter-ego-joe-biden-siguen-empresarios_0_jX74wdZvPA.html,https://images.clarin.com/2022/01/13/9hZU_Ti_9_720x0__1.jpg
6,8z07FLdw3T,Hallazgo médico. Revelan que el virus de la mononucleosis es la causa de la esclerosis múltiple,https://www.clarin.com/sociedad/identifican-estudio-virus-mononucleosis-causa-principal-esclerosis-multiple_0_8z07FLdw3T.html,https://images.clarin.com/2015/03/25/B1lzIegy4e_720x0.jpg
7,yXGOKmoTl,En base a ensayos clínicos. La OMS recomienda dos nuevos tratamientos contra el Covid-19: en qué casos se usan,https://www.clarin.com/sociedad/oms-recomienda-nuevos-tratamientos-covid-19-casos-utilizan_0_yXGOKmoTl.html,https://images.clarin.com/2021/02/25/jwzl71LXf_720x0__1.jpg
8,7osS7ia1lt,"Crisis energética. Por temor a un colapso energético, el Gobierno aplicó restricciones y dio asueto a los empleados públicos",https://www.clarin.com/politica/temor-colapso-energetico-gobierno-aplico-restricciones-dio-asueto-empleados-publicos_0_7osS7ia1lt.html,https://images.clarin.com/2022/01/13/KYkUKl86V_720x0__1.jpg
9,uJUyGhuQG,"Horas decisivas para el serbio. Mientras Australia no definió que hará, borraron a Djokovic de una lista de entrenamiento",https://www.clarin.com/deportes/australia-define-situacion-novak-djokovic-nombre-desaparece-lista-entrenamiento_0_uJUyGhuQG.html,https://images.clarin.com/2022/01/13/ymrsXbzfv_720x0__1.jpg
10,ljIUGuvCi,Nasir Ahmed habló con Clarín. El genio indio que creó la videollamada y vive con una argentina en Tucumán,https://www.clarin.com/historias/nasir-ahmed-genio-indio-hizo-posible-videollamada-retratan-this-is-us-vive-mujer-tucumana-yerba-buena_0_ljIUGuvCi.html,https://images.clarin.com/2022/01/10/IvFPSwtfv_720x0__1.jpg
11,Qn7H2P1npW,En la playa. Quisieron incautarle los churros a un vendedor y los turistas lo evitaron,https://www.clarin.com/sociedad/pinamar-quisieron-incautar-churros-vendedor-ambulante-turistas-impidieron_0_Qn7H2P1npW.html,https://images.clarin.com/2022/01/13/F85Y_tgn5_720x0__1.jpg
12,ClPVJwIW59,"Peligro en Pinamar. Dos heridos en accidentes con cuatriciclos: ""No murieron de milagro""",https://www.clarin.com/sociedad/heridos-nuevos-accidentes-cuatriciclos-pinamar-murieron-milagro-_0_ClPVJwIW59.html,https://images.clarin.com/2022/01/13/8Qjd1oNLn_720x0__1.jpg
13,RrdTLtL8j8,"Una situación repetida. Cortes de luz: 33 años después, el Gobierno reaccionó con una medida igual a la de Alfonsín",https://www.clarin.com/politica/gobierno-tomo-medida-igual-raul-alfonsin-1989-daban-asueto-empleados-publicos-ahorrar-luz_0_RrdTLtL8j8.html,https://images.clarin.com/2022/01/13/sKqFdTfUN_720x0__1.jpg
14,hcifT5wYU,"La vida de Adrián Sack. Es periodista, se metió en un chat en Floresta y el amor lo llevó hasta Londres y Atlanta",https://www.clarin.com/historias/metio-chat-floresta-historia-amor-llevo-londres-atlanta-vida-periodista-adrian-sack_0_hcifT5wYU.html,https://images.clarin.com/2022/01/10/a33OtSms1_720x0__1.jpg
15,2DX66xuWe,Susto en vivo. Un periodista se desmayó durante un móvil y debieron cortar la transmisión,https://www.clarin.com/fama/periodista-desmayo-vivo-debieron-cortar-transmision_0_2DX66xuWe.html,https://images.clarin.com/2022/01/13/dPXehWqjG_720x0__1.jpg
16,RlkK7KZUC,Asalto a McDonald's y Galicia. La transportadora de caudales del robo millonario también se quedó con $160 millones de una empresa del juego,https://www.clarin.com/politica/transportadora-caudales-robo-millonario-quedo-160-millones-empresa-juego_0_RlkK7KZUC.html,https://images.clarin.com/2016/05/05/Hkev9olJVe_720x0.jpg
17,HIxlltZ5O,"Duro testimonio. ""Aún le temo a mi papá"": un tenista reveló el calvario que vivió en su infancia",https://www.clarin.com/deportes/-todavia-miedo-papa-criaria-hijos-tenista-australiano-bernard-tomic-conto-calvario-vivio-infancia_0_HIxlltZ5O.html,https://images.clarin.com/2022/01/13/h9oTdH9tI_720x0__1.jpg
18,Rb18irVMo,Dónde está y qué vende. La cadena de café más famosa de Colombia llegó a la Argentina,https://www.clarin.com/gourmet/juan-valdez-cadena-cafe-famosa-colombia-abrio-primera-sucursal-argentina_0_Rb18irVMo.html,https://images.clarin.com/2022/01/13/zi22sZdn__1256x620__3.jpg#1642090743636
19,9IB06CZv_,Tendencias. Sex trends 2022: de la masturbación analgésica al fin de la monogamia,https://www.clarin.com/relaciones/sex-trends-2022-masturbacion-analgesica-fin-monogamia_0_9IB06CZv_.html,https://images.clarin.com/2022/01/12/-B-Of6yjc_720x0__1.jpg
20,vhco3CFaUE,"Sobrino del ex Presidente. Adiós a Mario Cámpora: diplomacia, política y sensibilidad",https://www.clarin.com/politica/murio-mario-campora-sobrino-ex-presidente-dejo-huella-diplomatico_0_vhco3CFaUE.html,https://images.clarin.com/2022/01/13/v39L0zax-_720x0__1.jpg
21,p5KpThZEF,Según un estudio. En cuántos días aparecen los síntomas de Ómicron,https://www.clarin.com/internacional/dias-aparecen-sintomas-omicron_0_p5KpThZEF.html,https://images.clarin.com/2022/01/05/_KBSO-FYb_720x0__1.jpg
22,-9iieqDiL,Mucho más que carpas. Tres propuestas innovadoras en los paradores de Pinamar y cuánto cuestan,https://www.clarin.com/sociedad/carpas-propuestas-innovadoras-paradores-pinamar-cuestan_0_-9iieqDiL.html,https://images.clarin.com/2022/01/12/Ky__pIj_l_720x0__1.jpg
23,fw8AvQiIE,Reino Unido. La Corona británica le quitó todos los honores militares al príncipe Andrés,https://www.clarin.com/mundo/corona-britanica-quito-honores-militares-principe-andres_0_fw8AvQiIE.html,https://images.clarin.com/2022/01/13/IIcXfZ33H_1256x620__2.jpg#1642095055350
24,BCLinJ_rM,Idas y vueltas. En la Rosada vuelven a poner en duda la reunión con la oposición por el FMI,https://www.clarin.com/politica/gobierno-vuelve-poner-duda-reunion-oposicion-acuerdo-fmi_0_BCLinJ_rM.html,https://images.clarin.com/2022/01/13/xC6tOrX41_720x0__1.jpg
25,gadZh3XF4,Astronomía. Revelan que la Tierra está rodeada por una misteriosa burbuja,https://www.clarin.com/internacional/revelan-tierra-rodeada-misteriosa-burbuja-1-000-anos-luz_0_gadZh3XF4.html,https://images.clarin.com/2022/01/13/DEsEY0W8t_720x0__1.jpg
26,nTdVbbj97,Análisis. El próximo movimiento de Putin en Ucrania es un misterio. Tal y como le gusta.,https://www.clarin.com/new-york-times-international-weekly/proximo-movimiento-putin-ucrania-misterio-gusta-_0_nTdVbbj97.html,https://images.clarin.com/2022/01/12/BfSAdZuBU_720x0__1.jpg
27,XvSyX5Qav,Consejos para un trance crítico. Cómo las familias pueden navegar la terapia intensiva,https://www.clarin.com/new-york-times-international-weekly/familias-pueden-navegar-terapia-intensiva_0_XvSyX5Qav.html,https://images.clarin.com/2022/01/12/A8m0Q7Pj4_1256x620__2.jpg#1642035521876
28,0V5_UW349,Estudio. El ejercicio puede domar nuestra ansiedad,https://www.clarin.com/new-york-times-international-weekly/ejercicio-puede-domar-ansiedad_0_0V5_UW349.html,https://images.clarin.com/2022/01/12/ghYdx1cc5_1256x620__2.jpg#1642031581873
29,0oYkeMSaN,"Curiosa interpretación. La inflación anual fue de 50,9% y el Presidente dijo: ""Esperemos que esta senda descendente se sostenga""",https://www.clarin.com/politica/inflacion-anual-50-9-alberto-fernandez-dijo-esperemos-senda-descendente-sostenga-_0_0oYkeMSaN.html,https://images.clarin.com/2022/01/13/9tCkWwH9K_720x0__1.jpg
30,16PlkVL9el,Infierno porteño. Emiten una nueva alerta por calor extremo y pronostican 42° para hoy en la Ciudad,https://www.clarin.com/sociedad/servicio-meteorologico-emitio-nueva-alerta-calor-extremo-pronostica-42-ciudad_0_16PlkVL9el.html,https://images.clarin.com/2022/01/13/Ij44C4GCJ_720x0__1.jpg
31,Z7apC6U7UC,"Del editor. El sorteo de Milei, el viaje de Volnovich y la frivolidad insoportable",https://www.clarin.com/opinion/sorteo-milei-viaje-volnovich-frivolidad-insoportable_0_Z7apC6U7UC.html,https://images.clarin.com/2022/01/13/5EzjxgULl_720x0__1.jpg
32,hkjcxkty46,Fue estrangulado. Quién era el ex rugbier hallado muerto en una camioneta con $180 mil,https://www.clarin.com/zonales/deporte-motos-river-pasiones-marcelo-longhi-ex-rugbier-asesinado_0_hkjcxkty46.html,https://images.clarin.com/2022/01/13/x8W3QzQd9_720x0__1.jpg
33,jX74wdZvPA,"Panorama económico. Las negociaciones con el ""alter ego"" de Joe Biden que siguen los empresarios",https://www.clarin.com/opinion/negociaciones-alter-ego-joe-biden-siguen-empresarios_0_jX74wdZvPA.html,https://images.clarin.com/2022/01/13/9hZU_Ti_9_720x0__1.jpg
34,8z07FLdw3T,Hallazgo médico. Revelan que el virus de la mononucleosis es la causa de la esclerosis múltiple,https://www.clarin.com/sociedad/identifican-estudio-virus-mononucleosis-causa-principal-esclerosis-multiple_0_8z07FLdw3T.html,https://images.clarin.com/2015/03/25/B1lzIegy4e_720x0.jpg
35,ONicEnozC6,"Relanzamiento de la nueva lista. Para el Presidente, Precios Cuidados es un arma clave para bajar la inflación",https://www.clarin.com/economia/presidente-precios-cuidados-arma-clave-bajar-inflacion_0_ONicEnozC6.html,https://images.clarin.com/2022/01/13/9tCkWwH9K_720x0__1.jpg
36,-afjNBHy4,En sintonía con el Central. Guzmán prendió la aspiradora de pesos en la primera licitación del año,https://www.clarin.com/economia/martin-guzman-prendio-aspiradora-pesos-coloco-114-000-millones-primera-licitacion-ano_0_-afjNBHy4.html,https://images.clarin.com/2022/01/05/RDhaTjEms_720x0__1.jpg
37,u8-eC43xs,Panorama para el 2022. Pasajes aéreos: advierten que la suba de precios se extenderá tras el verano,https://www.clarin.com/economia/pasajes-aereos-advierten-disparada-precio-extendera-alla-verano_0_u8-eC43xs.html,https://images.clarin.com/2020/10/24/1DBXTtPch_720x0__1.jpg
38,Z2MKSnclu,"Mercado financiero. Sin avances con el FMI, el riesgo país sube a 1.863 y el dólar blue se va a $ 209,5",https://www.clarin.com/economia/avances-fmi-riesgo-pais-sube-1848-puntos-basicos_0_Z2MKSnclu.html,https://images.clarin.com/2021/12/10/PjaAFPLoO_720x0__1.jpg
39,0RuuDRThp,Generación ZOE. Denuncian por estafa a una empresa vinculada con las criptomonedas,https://www.clarin.com/economia/ong-bitcoin-argentina-denuncio-estafa-generacion-zoe_0_0RuuDRThp.html,https://images.clarin.com/2021/12/23/75TADbve7_720x0__1.jpg
40,k42Fyu686,Sistema bancario. Tarjetas de crédito: la tasa de financiamiento pasa de 43% a 49%,https://www.clarin.com/economia/tarjetas-credito-tasa-financiamiento-pasa-43-49-_0_k42Fyu686.html,https://images.clarin.com/2020/11/24/8rfjRuDIU_720x0__1.jpg
41,9MQlYEXP2,"Desde Estados Unidos. ""San Martín"" viajó al espacio: el satélite de Mar del Plata despegó con éxito",https://www.clarin.com/tecnologia/san-martin-espacio-vivo-satelite-mar-plata-viaja-bordo-cohete-spacex_0_9MQlYEXP2.html,https://images.clarin.com/2022/01/13/5M7_59fXX_720x0__1.jpg
42,oWoGO75Lc,Movilidad sustentable. Crece el mercado de híbridos y eléctricos: los modelos en el país y cuánto cuestan,https://www.clarin.com/autos/crece-mercado-hibridos-electricos-modelos-pais-cuestan_0_oWoGO75Lc.html,https://images.clarin.com/2019/11/26/eNaw6t2Y_720x0__1.jpg
43,GpCJmTmeD,Máximas extremas. Ola de calor: cómo evitar problemas respiratorios por el uso de aire acondicionado,https://www.clarin.com/buena-vida/ola-calor-evitar-problemas-respiratorios-uso-aire-acondicionado_0_GpCJmTmeD.html,https://images.clarin.com/2022/01/12/TigUkypOR_720x0__1.jpg
44,akz22o_VY,"Nutrición. Omnívoros, veganos y vegetarianos: ¿quién tiene la dieta más saludable?",https://www.clarin.com/buena-vida/omnivoros-veganos-vegetarianos-dieta-saludable-_0_akz22o_VY.html,https://images.clarin.com/2021/06/08/gjw9m9KP3_720x0__1.jpg
45,DlcZrbwRTE,"Altas temperaturas. La ola de calor también afecta a tu teléfono, PC y laptop: cómo protegerlos",https://www.clarin.com/tecnologia/ola-calor-afecta-telefono-pc-laptop-protegerlos_0_DlcZrbwRTE.html,https://images.clarin.com/2021/03/19/UWR8w1TUN_720x0__1.jpg
46,u9fntuyqz,"¿Todo te sale mal?. Mercurio retrógrado 2022: fechas claves, signos y cómo prepararte",https://www.clarin.com/astrologia/mercurio-retrogrado-2022-fechas-claves-significa-hacer_0_u9fntuyqz.html,https://images.clarin.com/2022/01/12/SgXcEZndq_720x0__1.jpg
47,lxjm79m6I,La pagó US$ 12 millones. Robbie Williams vende a precio regalado su mansión porque está embrujada,https://www.clarin.com/viste/robbie-williams-vende-precio-regalado-mansion-dice-embrujada_0_lxjm79m6I.html,https://images.clarin.com/2021/09/23/b5DSKDnTU_720x0__1.jpg
48,x5eYMC7Lsj,"Gran enigma marino. Apareció el pulpo manta, con hembras de 2 metros y machos de 2 centímetros",https://www.clarin.com/internacional/aparecio-pulpo-manta-grandes-enigmas-marinos-hembras-2-metros-machos-2-centimetros_0_x5eYMC7Lsj.html,https://images.clarin.com/2022/01/13/8lDp-OVYU_720x0__1.jpg
49,2dNLjbQPa,Está en México. El restaurante más rápido del mundo: sirven la comida en 18 segundos,https://www.clarin.com/viste/restaurante-rapido-mundo-sirven-comida-18-segundos_0_2dNLjbQPa.html,https://images.clarin.com/2022/01/13/oITYpFm2a_720x0__1.jpg
50,5kPl00eNk,Cabo Verde. El extraño mensaje en la arena que puede verse en Google Maps,https://www.clarin.com/internacional/extrano-mensaje-arena-puede-verse-google-maps_0_5kPl00eNk.html,https://images.clarin.com/2021/11/15/iIv_LxRf2_720x0__1.jpg
51,3KQjQcupP,Preocupación. En México aseguran que Luis Miguel estuvo a punto de perder un brazo,https://www.clarin.com/espectaculos/musica/-luis-miguel-punto-perder-brazo-_0_3KQjQcupP.html,https://images.clarin.com/2021/05/27/-JgshnORG_720x0__1.jpg
52,LyS9CFugA,"Personaje. La historia de Lee Morgan, el trompetista de jazz asesinado por una infidelidad",https://www.clarin.com/espectaculos/musica/historia-lee-morgan-trompetista-jazz-asesinado-infidelidad_0_LyS9CFugA.html,https://images.clarin.com/2022/01/13/nC3Q1kWDY_720x0__1.jpg
53,f2mpj0ZPKE,Historias visuales. Las 86 mejores imágenes de hoy en la Argentina y el mundo,https://www.clarin.com/fotogalerias/historias-visuales-dia-fotos-imagenes-destacadas-argentina-mundo_5_f2mpj0ZPKE.html,
54,8K_aR5ZNf,Simple y eficaz. Operar con tarjetas crypto: alternativa para ahorrar y optimizar tu dinero,https://www.clarin.com/brandstudio/operar-tarjetas-crypto-alternativa-ahorrar-optimizar-dinero_0_8K_aR5ZNf.html,https://images.clarin.com/2022/01/06/EhOxB5uJq_720x0__1.jpg
55,dAQl0Rpe-,Bombay Bramble. Llega un gin infusionado con moras y frambuesas para dar un toque único a tus cocteles,https://www.clarin.com/brandstudio/llega-gin-infusionado-moras-frambuesas-dar-toque-color-sabor-unico-cocteles_0_dAQl0Rpe-.html,https://images.clarin.com/2022/01/07/l17Fh2sg3_720x0__1.jpg
56,23tPAM1eR,Ellas al volante. Un estudio asegura que las mujeres están más expuestas a la violencia en el tránsito,https://www.clarin.com/brandstudio/estudio-asegura-mujeres-expuestas-situaciones-violencia-transito_0_23tPAM1eR.html,https://images.clarin.com/2022/01/04/4BAIF9rmp_720x0__1.jpg
57,4HUWfsVX-,Soluciones digitales. Así es la nueva plataforma de cobros de Banco Macro,https://www.clarin.com/brandstudio/nueva-plataforma-cobros-banco-macro_0_4HUWfsVX-.html,https://images.clarin.com/2021/12/29/CZ0LSHpJJ_720x0__1.jpg
58,88CIzGJvL,Infraestructura marítima. Jan de Nul gana el proyecto de electrificación de cable submarino en Abu Dhabi,https://www.clarin.com/brandstudio/jan-nul-gana-historico-proyecto-electrificacion-cable-submarino-abu-dhabi_0_88CIzGJvL.html,https://images.clarin.com/2022/01/12/Pm3MwFqZQ_720x0__1.jpg
59,zHQ6pbg9o,DS Automobiles. Sofisticación y tecnología de vanguardia,https://www.clarin.com/brandstudio/buque-insignia-ds-automobiles-exquisita-combinacion-sofisticacion-tecnologia-vanguardia_0_zHQ6pbg9o.html,https://images.clarin.com/2021/11/30/1AMq1S3Ty_720x0__1.jpg
60,mKyp6H7D5u,Perfil alto. Viviana Canosa compartió imágenes de su cuerpo y de su rostro y revolucionó las redes,https://www.clarin.com/fama/viviana-canosa-compartio-imagenes-cuerpo-rostro-revoluciono-redes_0_mKyp6H7D5u.html,https://images.clarin.com/2022/01/13/34Shmwj0n_720x0__1.jpg
61,602VBsvi0,¡Sin el pan y sin la...!. Polémica tras la boda de Stefi Roitman y Ricky Montaner: la denuncia de una emprendedora,https://www.clarin.com/fama/polemica-boda-stefi-roitman-ricky-montaner-emprendedora-denuncio-pareja-redes_0_602VBsvi0.html,https://images.clarin.com/2022/01/13/i8KkeQ0li_720x0__1.jpg
62,xRVk7dXqd7,"No le gustó. ""Jujuy"" Jiménez fue al frente y habló de los ""likes"" que Wanda Nara le dio a su novio",https://www.clarin.com/fama/sofia-jujuy-jimenez-frente-hablo-likes-wanda-nara-dio-novio_0_xRVk7dXqd7.html,https://images.clarin.com/2022/01/13/zH2qY-DZu_720x0__1.jpg
63,DgB2-naoT,Indignación 2.0. Alex Caniggia criticó a los que veranean en la Costa y fue repudiado en las redes,https://www.clarin.com/fama/alex-caniggia-critico-veranean-costa-repudiado-redes_0_DgB2-naoT.html,https://images.clarin.com/2022/01/13/9wLLi3Jqj_720x0__1.jpg
64,mAHYRL5T9,Especial Clarín. A 20 años de 20 discos indispensables y por qué hay que volver a escucharlos,https://www.clarin.com/espectaculos/musica/20-anos-20-discos-veinte-anos-20-discos-hicieron-historia_0_mAHYRL5T9.html,https://images.clarin.com/2022/01/10/EjHIxZzOW_720x0__1.jpg
65,txjg0gErX,Desinfección nasal. Cómo es el tratamiento que estudian en España para frenar el contagio del Covid,https://www.clarin.com/mundo/desinfeccion-nasal-tratamiento-estudian-espana-frenar-contagio-covid_0_txjg0gErX.html,https://images.clarin.com/2022/01/13/Z3_CJFqZ5_720x0__1.jpg
66,hf1sMfBXJ,"La pelea por el 2023. Una encuesta midió internas para presidente: ganaron CFK, Macri y Milei",https://www.clarin.com/politica/nueva-encuesta-midio-internas-presidente-ganaron-cristina-kirchner-mauricio-macri-javier-milei_0_hf1sMfBXJ.html,https://images.clarin.com/2020/12/07/QpAboYnUs_720x0__1.jpg
67,SplnRIWj0,Ahorrar pidiendo rebajas. El arte del regateo: consejos de un experto para pelear precios en vacaciones,https://www.clarin.com/servicios/arte-regateo-10-consejos-experto-pelear-precios-vacaciones-ganar_0_SplnRIWj0.html,https://images.clarin.com/2022/01/12/Lus2a0B-1_720x0__1.jpg
68,fyNPWSlhV,Suministro en riesgo. Cuidar el agua: claves para reducir el consumo y evitar cortes en medio del calor,https://www.clarin.com/servicios/cuidar-agua-10-claves-reducir-consumo-evitar-cortes-medio-calor_0_fyNPWSlhV.html,https://images.clarin.com/2021/06/22/Atar7vRR__720x0__1.jpg
69,m1EdK_wpV,Sociedad. Mundo verdulería: 10 secretos del negocio que explotó en pandemia,https://www.clarin.com/sociedad/mundo-verduleria-10-secretos-negocio-exploto-pandemia_0_m1EdK_wpV.html,https://images.clarin.com/2021/12/20/MSbLfu4yR_720x0__1.jpg
70,fJM8dsWAP,Viajes. De Salta a Tierra del Fuego: postales imperdibles de siete rutas escénicas de la Argentina,https://www.clarin.com/viajes/salta-tierra-fuego-postales-imperdibles-rutas-escenicas-argentina_0_fJM8dsWAP.html,https://images.clarin.com/2021/12/23/_rnz40zJS_720x0__1.jpg
71,CpUhuSgLk,Sociedad. Autitos de colección: un juego que no es de niños y mueve millones,https://www.clarin.com/autos/autitos-coleccion-juego-ninos-mueve-millones_0_CpUhuSgLk.html,https://images.clarin.com/2021/12/03/clFAGxjmh_720x0__1.jpg
72,9KZn_RIDy,Sociedad. El último lugar de la Argentina que se salva del cambio climático,https://www.clarin.com/especiales/ultimo-lugar-argentina-salva-cambio-climatico_0_9KZn_RIDy.html,https://images.clarin.com/2021/12/09/MXDJDgPHP_720x0__1.jpg
73,xXKUIStXwI,Golpe al Rojo. Independiente pierde a su goleador y capitán: Silvio Romero se va a Brasil,https://www.clarin.com/deportes/independiente-pierde-goleador-capitan-silvio-romero-va-fortaleza-brasil_0_xXKUIStXwI.html,https://images.clarin.com/2022/01/13/x9lRQqlew_1256x620__2.jpg#1642118378416
74,RA8Rp0UPVF,Opinión. El escándalo Djokovic dañará al deporte australiano: ¿puede perder su Grand Slam?,https://www.clarin.com/deportes/escandalo-novak-djokovic-danara-politica-deportiva-australiana-puede-perder-sede-grand-slam-_0_RA8Rp0UPVF.html,https://images.clarin.com/2022/01/13/zrdEzukZX_720x0__1.jpg
75,qSqjCIHsq,En Riad. Atlético de Madrid se durmió y quedó eliminado de la Supercopa de España,https://www.clarin.com/deportes/atletico-madrid-vs-athletic-bilbao-supercopa-espana-previa-alineaciones-directo_0_qSqjCIHsq.html,https://images.clarin.com/2022/01/13/1uK_Bq29S_1256x620__2.jpg#1642106725168
76,5tI4UYWZ2,"Rompió el silencio.  Messi aclaró versiones sobre su salud: ""Me llevó más tiempo del que esperaba estar bien""",https://www.clarin.com/deportes/mensaje-lionel-messi-aclarar-versiones-fisico-salud_0_5tI4UYWZ2.html,https://images.clarin.com/2022/01/13/k1M52QdPd_720x0__1.jpg
77,PwjG2TGF3M,Foto impactante. El uruguayo Ronald Araújo jugó el clásico ante Real Madrid con dos clavos en la mano,https://www.clarin.com/deportes/uruguayo-ronald-araujo-jugo-clasico-real-madrid-clavos-mano_0_PwjG2TGF3M.html,https://images.clarin.com/2022/01/13/uKefhfqROq_720x0__1.jpg
78,ynXIOMvFN,Minuto a minuto. Mercado de pases al día: las altas y las bajas de todos los equipos de la Liga Profesional,https://www.clarin.com/deportes/mercado-pases-dia-altas-bajas-equipos-liga-futbol-profesional_0_ynXIOMvFN.html,https://images.clarin.com/2017/07/20/H1wt-QASW_720x0.jpg
