n,id,title,url,image
1,14GB2DuqLk,"La columna de Lanata. La cultura narco instalada en el país: sicariato, muerte de niños y droga adulterada en el Conurbano",https://www.clarin.com/opinion/cultura-narco-instalada-pais-sicariato-muerte-ninos-droga-adulterada_0_14GB2DuqLk.html,https://images.clarin.com/2022/02/02/_oVLeqXeK_720x0__1.jpg
2,5REIQ6s1mM,Con Xi Jinping de anfitrión. Alberto Fernández almorzó con otros jefes de Estado que asisten a los Juegos de Invierno,https://www.clarin.com/politica/alberto-fernandez-almorzo-jefes-asisten-juegos-olimpicos-invierno_0_5REIQ6s1mM.html,https://images.clarin.com/2022/02/05/mV66p8D4P_1256x620__2.jpg#1644064912663
3,fKmTc2zYbd,"Del editor. Sergio y Aníbal contra los narcos, una película trágica",https://www.clarin.com/opinion/sergio-anibal-narcos-pelicula-tragica_0_fKmTc2zYbd.html,https://images.clarin.com/2021/10/27/BA5yYBKT9_720x0__1.jpg
4,1cHaLV1W9A,Ideas al paso. El narco avanza descontrolado y la muerte sale a la superficie,https://www.clarin.com/opinion/narco-avanza-descontrolado-muerte-sale-superficie_0_1cHaLV1W9A.html,https://images.clarin.com/2022/02/04/2oYYNTYR4_720x0__1.jpg
5,fcqZMqYRTW,Adelanto de Clarín. Una encuesta midió internas en el PRO y la UCR para 2023: sorpresas con los resultados,https://www.clarin.com/politica/encuesta-midio-internas-pro-ucr-2023-sorpresas-resultados_0_fcqZMqYRTW.html,https://images.clarin.com/2019/10/05/QCvIxR50_720x0__1.jpg
6,1KSbdUFhbb,Subas en la electricidad. Tarifas: el Gobierno definió 13 barrios y casi 500 countries en los que aplicará aumentos,https://www.clarin.com/economia/tarifas-gobierno-definio-13-barrios-aplicara-aumentos-segmentados_0_1KSbdUFhbb.html,https://images.clarin.com/2022/01/11/leWdaXqH9_720x0__1.jpg
7,MlqrudkEVG,"Home office. Dólares y billeteras virtuales: la ""odisea"" para cobrar un trabajo desde el exterior",https://www.clarin.com/sociedad/dolares-criptomonedas-billeteras-virtuales-odisea-cobrar-trabajo-exterior_0_MlqrudkEVG.html,https://images.clarin.com/2020/05/15/6ex1lc45W_720x0__1.jpg
8,wpVbsfeG25,"""Genera confianza"". Para el CEO de JP Morgan, ""el preacuerdo con el FMI es muy positivo para el país""",https://www.clarin.com/economia/-preacuerdo-fmi-positivo-pais-_0_wpVbsfeG25.html,https://images.clarin.com/2022/02/04/3FpE9eJ_x_1256x620__2.jpg#1644066307950
9,svB762BTWp,"El nene atrapado en un pozo. Marruecos: con riesgo de derrumbes, cavan los últimos metros para llegar a Rayan",https://www.clarin.com/mundo/marruecos-lento-riesgo-derrumbes-cavan-ultimos-metros-llegar-rayan_0_svB762BTWp.html,https://images.clarin.com/2022/02/05/2wWuePWjX_1256x620__2.jpg#1644063443957
10,tTpg8OXd13,"Mundos íntimos. “Quería ser una madre canchera, que no dejaba el disfrute por la maternidad”",https://www.clarin.com/sociedad/mundos-intimos-negaba-madre-obvia-decir-frase-bebe-mejor-paso-vida-_0_tTpg8OXd13.html,https://images.clarin.com/2022/02/04/2puXv1UYT_1256x620__2.jpg#1644002553725
11,IypjrIZL7E,"Tras su día de furia. Boca: Wanchope Ábila reapareció en el cumpleaños de Tevez y habló de ""lealtad""",https://www.clarin.com/deportes/dia-furia-boca-wanchope-abila-reaparecio-cumpleanos-tevez-hablo-lealtad-_0_IypjrIZL7E.html,https://images.clarin.com/2022/02/05/ws1aEUVJjv_1256x620__2.jpg#1644063931279
12,zU5tfpfZ7B,"Amor eterno. ""Mi papá falleció ya hace seis meses y mi abuela le sigue escribiendo a su WhatsApp""",https://www.clarin.com/sociedad/hijo-murio-hace-meses-todavia-escribe-whatsapp-hace-sentir-cerca-_0_zU5tfpfZ7B.html,https://images.clarin.com/2022/02/04/82JlF2rMg_720x0__1.jpg
13,TDfE3A0X76,Entrevista. La nueva vida de Deborah de Corral en Miami como chef y dueña de un restaurante,https://www.clarin.com/gourmet/nueva-vida-deborah-corral-chef-duena-restaurante-premiado-miami_0_TDfE3A0X76.html,https://images.clarin.com/2022/02/04/vbhCu9SlQ_1256x620__2.jpg#1643972992848
14,l9IGPXqTCD,Crisis con Rusia. Chernobyl: la ciudad fantasma que volvió a rugir con un ejercicio militar de Ucrania,https://www.clarin.com/mundo/ucrania-soldados-entrenaron-pueblo-fantasma-radioactivo-chernobyl-posible-invasion-rusa_0_l9IGPXqTCD.html,https://images.clarin.com/2022/02/05/60DuCBN9N_720x0__1.jpg
15,4jNxyPLwm3,Hay un prófugo. Impactante giro en el caso del ex rugbier asesinado en Luján: detienen a su socio,https://www.clarin.com/policiales/impactante-giro-caso-ex-rugbier-marcelo-longhi-asesinado-lujan-detuvieron-socio_0_4jNxyPLwm3.html,https://images.clarin.com/2022/02/04/GDcRY3-Rf_720x0__1.jpg
16,fpWJwa7Vev,Relegado por el técnico. Campazzo estuvo todo el partido en el banco y Denver sufrió otra derrota,https://www.clarin.com/deportes/nba-facundo-campazzo-minutos-nueva-derrota-denver-nuggets_0_fpWJwa7Vev.html,https://images.clarin.com/2022/02/03/9bXto5cy4_720x0__1.jpg
17,TTM4rcd4hC,"Se hizo viral en Twitter. Un ""trapito"" de Palermo le robó los limpiaparabrisas y le dejó una increíble nota",https://www.clarin.com/viste/carta-dejo-cuidacoches-robarle-limpiaparabrisas-dije-5-iba-_0_TTM4rcd4hC.html,https://images.clarin.com/2022/02/04/tTe-AaxEU_720x0__1.jpg
18,6uWKyvUfGp,Beneficio extendido. Reintegro del 15% a compras con débito: cómo chequear si podés acceder,https://www.clarin.com/servicios/reintegro-15-compras-tarjeta-debito-chequear-online-podes-acceder_0_6uWKyvUfGp.html,https://images.clarin.com/2022/01/18/Wioc1PeXl_720x0__1.jpg
19,uEFL9rA0bj,Especial Clarín. Los enigmas de la reina eterna: Isabel cumple 70 años en el trono,https://www.clarin.com/mundo/enigmas-reina-eterna-isabel-cumple-70-anos-trono-britanico-estalla-sucesion_0_uEFL9rA0bj.html,https://images.clarin.com/2022/01/31/fQCwJghce_720x0__1.jpg
20,YpQpS6bgs5,"El espectáculo del año. Mundial de Qatar: guía de alojamientos, precios y las reglas que habrá que seguir",https://www.clarin.com/deportes/mundial-qatar-2022-guia-completa-alojamientos-precios-reglas-deberan-seguir-hinchas_0_YpQpS6bgs5.html,https://images.clarin.com/2022/02/02/Bwv6VaQeG_720x0__1.jpg
21,B7fSrMPoq,¿Cuántas hay?. La fotógrafa que construye un mapa con todas las cúpúlas porteñas,https://www.clarin.com/ciudades/reina-cupulas-fotografa-quiere-hacer-mapa-todas-ciudad_0_B7fSrMPoq.html,https://images.clarin.com/2022/01/12/d92C9AzSy_720x0__1.jpg
22,mC9PZ483mZ,"Está por cumplir 60 años. Gastó 250 mil dólares para parecerse a un reptil: Erik Sprague, ""El hombre lagarto""",https://www.clarin.com/internacional/gasto-250-mil-dolares-parecerse-reptil-erik-sprague-hombre-lagarto-_0_mC9PZ483mZ.html,https://images.clarin.com/2022/02/04/WR4Zz-oT6_1256x620__2.jpg#1643969185547
23,SLAHjQIF85,Dermatología. Rosácea: qué es y qué rol puede jugar la alimentación,https://www.clarin.com/buena-vida/rosacea-rol-puede-jugar-alimentacion_0_SLAHjQIF85.html,https://images.clarin.com/2022/02/04/yySqB50TK_720x0__1.jpg
24,qcg1KzGp8b,Monetización de redes. Ganar dinero en YouTube: ¿cuántos suscriptores se necesitan?,https://www.clarin.com/tecnologia/ganar-dinero-youtube-suscriptores-necesitan-_0_qcg1KzGp8b.html,https://images.clarin.com/2021/09/29/uRjHloPM6_720x0__1.jpg
25,RiKH4YGgpI,Turismo en verano. En busca de las playas más tranquilas para disfrutar en febrero,https://www.clarin.com/viajes/playas-conocidas-solitarias-costa-atlantica_0_RiKH4YGgpI.html,https://images.clarin.com/2022/02/02/RputDdzju_720x0__1.jpg
26,DfNrHIvAMd,Historias visuales. Las imágenes más destacadas del día en Argentina y el mundo,https://www.clarin.com/fotogalerias/historias-visuales-dia-fotos-imagenes-destacadas-argentina-mundo_5_DfNrHIvAMd.html,
27,Zexv2yW6iY,Tironeos por la Ley. Alquileres: el Gobierno evalúa medidas para ampliar la oferta y contener la suba de precios,https://www.clarin.com/economia/alquileres-gobierno-evalua-medidas-ampliar-oferta-contener-suba-precios_0_Zexv2yW6iY.html,https://images.clarin.com/2021/12/16/bgD7Pzj5p2_720x0__1.jpg
28,2h5wIEXJ0P,Letra chica del acuerdo. Los números de Guzmán para cumplir con el déficit fiscal que pedirá el FMI,https://www.clarin.com/economia/numeros-martin-guzman-cumplir-deficit-fiscal-pedira-fmi_0_2h5wIEXJ0P.html,https://images.clarin.com/2020/04/14/SkjKxvW_e_720x0__1.jpg
29,Q6cBNwCGmd,Litio. La segunda minera más grande del mundo invertirá  US$ 100 millones en Salta,https://www.clarin.com/economia/litio-segunda-minera-grande-mundo-invertira-us-100-millones-salta_0_Q6cBNwCGmd.html,https://images.clarin.com/2018/07/19/By6wlwyV7_720x0__1.jpg
30,1ihZkItnft,"Datos de enero. Por las vacaciones y el Covid, se desplomó la producción de autos",https://www.clarin.com/economia/vacaciones-ausentismo-covid-desplomo-produccion-autos-enero_0_1ihZkItnft.html,https://images.clarin.com/2021/05/05/urtcY41R8_720x0__1.jpg
31,PactAnKUz2,Las causas. Cada vez son más los jubilados de haberes más bajos,https://www.clarin.com/economia/vez-jubilados-haberes-bajos_0_PactAnKUz2.html,https://images.clarin.com/2022/01/11/jDtrb7hng_720x0__1.jpg
32,ahtk0vgg72,"En el Norte. Incendios y sequía jaquean la producción de arroz, tabaco, yerba y ganado",https://www.clarin.com/economia/sequia-incendios-jaquean-produccion-arroz-tabaco-yerba-ganado-norte_0_ahtk0vgg72.html,https://images.clarin.com/2022/02/04/Tca3R7oDo_720x0__1.jpg
33,JMOPZE5Bos,Piden US$ 7 millones. Venden una Maserati que Fangio llevó a grandes victorias en el final de su carrera,https://www.clarin.com/autos/venden-emblematica-maserati-fangio-llevo-grandes-victorias-final-carrera_0_JMOPZE5Bos.html,https://images.clarin.com/2022/02/03/E9nOQWEuk_720x0__1.jpg
34,d0dkFS7guc,Apps. WhatsApp planea ampliar el tiempo límite para eliminar un mensaje para todos,https://www.clarin.com/tecnologia/whatsapp-planea-ampliar-tiempo-limite-eliminar-mensaje_0_d0dkFS7guc.html,https://images.clarin.com/2020/09/02/wL7DcCaEk_720x0__1.jpg
35,sVZmHsTKaO,Cómo hacerlo en casa. Día del Pisco Sour: su historia y la receta ideal para prepararlo,https://www.clarin.com/gourmet/dia-pisco-sour-historia-receta-preparar-trago-popular-peru_0_sVZmHsTKaO.html,https://images.clarin.com/2019/01/31/48oidqhwW_1256x620__2.jpg#1612463479631
36,NO48VRG1oi,Regreso a las aulas. Vuelta a clases: recomendaciones para toda la familia,https://www.clarin.com/familias/vuelta-clases-recomendaciones-toda-familia_0_NO48VRG1oi.html,https://images.clarin.com/2022/02/04/NBedEAhvL_720x0__1.jpg
37,npQgD9id7d,"Habló con Clarín. Quién es Kelly Link, la ""mejor"" escritora de cuentos fantásticos de la actualidad",https://www.clarin.com/cultura/comparan-borges-lee-mariana-enriquez-kelly-link-mejor-escritora-cuentos-fantasticos-actualidad_0_npQgD9id7d.html,https://images.clarin.com/2022/01/26/wV5mwR2UD_720x0__1.jpg
38,SQ1yiKaO1G,En movimiento. Más beneficios del ejercicio: activar el cuerpo mejora el rendimiento cognitivo,https://www.clarin.com/buena-vida/beneficios-hacer-ejercicio-activar-cuerpo-mejora-rendimiento-cognitivo_0_SQ1yiKaO1G.html,https://images.clarin.com/2021/08/16/GTZt6NtHY_720x0__1.jpg
39,i6WFBdjQeO,"La palabra de expertos. La verdad sobre la teoría de la película ""Moonfall"": ¿puede la Luna chocar contra la Tierra?",https://www.clarin.com/internacional/espectaculos/verdad-teoria-moonfall-posible-luna-choque-tierra-_0_i6WFBdjQeO.html,https://images.clarin.com/2022/02/03/yRm7JggCn_720x0__1.jpg
40,8fu65wyhwr,"Vive en Australia. Tiene 106 años, vive solo y dice que el secreto de una vida feliz es evitar dos cosas",https://www.clarin.com/internacional/106-anos-vive-solo-dice-secreto-vida-feliz-evitar-cosas_0_8fu65wyhwr.html,https://images.clarin.com/2022/02/04/ttIqyYqyo_720x0__1.jpg
41,hvHYgvRTnu,Conmoción en Bolivia. Abandonan a un bebé en una caja: su madre es una joven de 14 abusada por su padre,https://www.clarin.com/internacional/abandonan-bebe-caja-madre-joven-14-anos-abusada-padre_0_hvHYgvRTnu.html,https://images.clarin.com/2022/02/04/Nt-gbTcUK_720x0__1.jpg
42,scXq5Play0,Ojos bien abiertos. ¿Por qué los candidatos al Oscar no son los que tienen más votos?,https://www.clarin.com/espectaculos/cine/ojos_0_scXq5Play0.html,https://images.clarin.com/2022/01/05/L4IbK2hu6_720x0__1.jpg
43,HF8lZfXH2d,Estados Unidos. Video: batalla campal en un tenedor libre luego que se acabara la carne,https://www.clarin.com/internacional/estados-unidos/video-batalla-campal-tenedor-libre-luego-acabara-carne_0_HF8lZfXH2d.html,https://images.clarin.com/2022/02/04/Xoxlz6H7x_720x0__1.jpg
44,kkpovqxL5v,"Bielorrusia. En una entrevista de trabajo, se le enredó el pelo en una máquina y murió",https://www.clarin.com/internacional/entrevista-trabajo-enredo-pelo-maquina-murio_0_kkpovqxL5v.html,https://images.clarin.com/2022/02/03/WmD9xflL2_720x0__1.jpg
45,TGjgH38kU1,"Anticipo en la Costa. Peugeot Landtrek, la nueva pickup de la marca francesa que llega este año",https://www.clarin.com/autos/peugeot-landtrek-nueva-pickup-marca-francesa-llega-ano_0_TGjgH38kU1.html,https://images.clarin.com/2022/01/24/Y4MxZCiNB_720x0__1.jpg
46,v2cuem61Mz,"Presentación en la Costa. Nuevo Citroën C3, el hatch que llega para continuar con el gran éxito de la marca",https://www.clarin.com/autos/nuevo-citroen-c3-hatch-llega-continuar-gran-exito-marca_0_v2cuem61Mz.html,https://images.clarin.com/2022/01/19/EnjbaLe6W_720x0__1.jpg
47,5xRu-d_MU,"Presentación en la Costa. Nuevo Jeep Commander, máxima categoría y confort en un SUV para 7 ocupantes",https://www.clarin.com/autos/nuevo-jeep-commander-maxima-categoria-confort-suv-7-ocupantes_0_5xRu-d_MU.html,https://images.clarin.com/2022/01/25/Kq9Vdwlm5_720x0__1.jpg
48,nRk2xh46e,"Adelanto en la Costa. El Fiat que faltaba: cómo es el Pulse, el nuevo SUV de la marca italiana",https://www.clarin.com/autos/fiat-faltaba-pulse-nuevo-suv-marca-italiana_0_nRk2xh46e.html,https://images.clarin.com/2022/01/17/iBAj5ZorO_720x0__1.jpg
49,b8JmSpP9L,En Cariló. Volkswagen exhibe los nuevos modelos 100% eléctricos en un espacio interactivo,https://www.clarin.com/brandstudio/volkswagen-exhibe-nuevos-modelos-100-electricos-espacio-interactivo-carilo_0_b8JmSpP9L.html,https://images.clarin.com/2022/01/14/FWgnkAcca_720x0__1.jpg
50,xh92ydkh5F,Pura potencia. Se viene un duelo de titanes entre Ford y Volkswagen con dos pick ups bestiales,https://www.clarin.com/autos/anticipo-viene-duelo-titanes-ford-volkswagen-pick-ups-bestiales_0_xh92ydkh5F.html,https://images.clarin.com/2022/02/03/GiKsExy2r_720x0__1.jpg
51,p64wtHpyPX,Escaladores. El montañista más solitario del Everest,https://www.clarin.com/new-york-times-international-weekly/montanista-solitario-everest_0_p64wtHpyPX.html,https://images.clarin.com/2022/02/03/xhRbq1lPv_720x0__1.jpg
52,ZGGEtbydK7,Escenarios de la pandemia. Un día en el 'universo paralelo' de una UCI de Londres,https://www.clarin.com/new-york-times-international-weekly/dia-universo-paralelo-uci-londres_0_ZGGEtbydK7.html,https://images.clarin.com/2022/02/02/hJRF-Plha_1256x620__2.jpg#1643842633180
53,SxnLwYh5qH,Investigación. La vacuna COVID que necesitamos ahora puede no ser una inyección,https://www.clarin.com/new-york-times-international-weekly/vacuna-covid-necesitamos-ahora-puede-inyeccion_0_SxnLwYh5qH.html,https://images.clarin.com/2022/02/02/rMQPapPp6_720x0__1.jpg
54,xS96BeE1AM,Salud. ¿De verdad funciona el rinocornio?,https://www.clarin.com/new-york-times-international-weekly/-verdad-funciona-rinocornio-_0_xS96BeE1AM.html,https://images.clarin.com/2022/02/02/QlEVPeGtJ_720x0__1.jpg
55,eGw5XVZsii,Hurlingham. Encontraron a la mujer con retraso que buscaban hacía más de un mes,https://www.clarin.com/zonales/encontraron-veronica-garcia-mujer-retraso-desaparecida-mes_0_eGw5XVZsii.html,https://images.clarin.com/2022/01/28/GBNzKFSTK_720x0__1.jpg
56,Yl0q7wD5t,Integró la Selección. La defensora que pregunta por qué Gallardo no deja jugar a las mujeres en el Monumental,https://www.clarin.com/zonales/padre-dejaba-jugar-futbol-ahora-figura-river-seleccion_0_Yl0q7wD5t.html,https://images.clarin.com/2022/01/12/Lgj4SdYNv_720x0__1.jpg
57,2ymnZjJpGd,Talentos del Conurbano. La fileteadora que causó sensación en China y sueña con ver su arte en todo Castelar,https://www.clarin.com/zonales/fileteadora-castelar-llego-arte-china-suena-verla-barrio_0_2ymnZjJpGd.html,https://images.clarin.com/2022/01/17/P1oY17Tsf_720x0__1.jpg
58,Ltd-aq7jR,Trujui Rugby. El proyecto de un jugador veterano del GBA y su hijo para no dejar a nadie afuera,https://www.clarin.com/zonales/trujui-rugby-club-nace-mano-apellido-hizo-historia-mariano-moreno_0_Ltd-aq7jR.html,https://images.clarin.com/2022/01/04/DZNHRPOKP_720x0__1.jpg
59,4GLOqQLyCk,"¡Nada que ver!. Dijo ser parecido a un famoso, pero nadie lo descubría y generó decepción al revelar a quién",https://www.clarin.com/fama/aseguro-parecido-famoso-nadie-descubria-genero-decepcion-revelar_0_4GLOqQLyCk.html,https://images.clarin.com/2022/02/04/HIbMWGhV8_720x0__1.jpg
60,6XQerMCP0c,Mal momento. Marian Farjat se hizo una cirugía estética y hoy vive una pesadilla,https://www.clarin.com/fama/marian-farjat-hizo-cirugia-estetica-hoy-vive-pesadilla-nadie-puede-arreglar-hicieron-_0_6XQerMCP0c.html,https://images.clarin.com/2021/09/21/e6VINkF3p_720x0__1.jpg
61,CfbPJ0PcC6,Sincero y movilizado. Sergio Lapegüe se despidió del noticiero de El Trece y explicó los motivos de su renuncia,https://www.clarin.com/fama/sergio-lapegue-despidio-noticiero-trece-explico-motivos-renuncia_0_CfbPJ0PcC6.html,https://images.clarin.com/2022/02/03/LRLb-ygZG_720x0__1.jpg
62,tNn9xJvLoL,"Indignado. Gastón Pauls habló de la cocaína adulterada y apuntó contra Sergio Berni: ""No sean caretas""",https://www.clarin.com/fama/gaston-pauls-hablo-cocaina-adulterada-apunto-sergio-berni-caretas-_0_tNn9xJvLoL.html,https://images.clarin.com/2022/02/03/Md3ZkOU-L_720x0__1.jpg
63,U7cCA27BTk,"Aumento de la nafta. Marca por marca, cómo cargar siempre con descuentos de hasta el 30%",https://www.clarin.com/servicios/aumento-nafta-marca-marca-cargar-siempre-descuentos-30-_0_U7cCA27BTk.html,https://images.clarin.com/2022/02/02/czpMoWxSm_720x0__1.jpg
64,ME0Db4gWHf,Finanzas personales. Los ahorristas apuestan por la inflación: crecen los plazos fijos UVA,https://www.clarin.com/economia/ahorristas-apuestan-inflacion-crecen-plazos-fijos-uva_0_ME0Db4gWHf.html,https://images.clarin.com/2021/10/12/NpOw-mnh7_720x0__1.jpg
65,WhBYpDzfWL,Contra el coronavirus. Viejos y nuevos tratamientos: qué fracasó y qué se usa en la tercera ola,https://www.clarin.com/sociedad/viejos-nuevos-tratamientos-covid-fracaso-usa-tercera-ola_0_WhBYpDzfWL.html,https://images.clarin.com/2021/11/18/WFwD9VMFG_720x0__1.jpg
66,vpoHCXndPT,Llegar antes. Cáncer: siete hábitos ayudan a prevenir hasta la mitad de los casos,https://www.clarin.com/buena-vida/dia-mundial-cancer-7-habitos-ayudan-prevenir-mitad-casos_0_vpoHCXndPT.html,https://images.clarin.com/2021/03/01/Sc58rpi8l_720x0__1.jpg
67,CTqJcTtu05,Adelanto. Una encuesta midió a Máximo para una interna presidencial: le fue mal,https://www.clarin.com/politica/encuesta-midio-maximo-kirchner-interna-presidencial-quedo-anteultimo_0_CTqJcTtu05.html,https://images.clarin.com/2021/12/17/Exx-TV1NJ_720x0__1.jpg
68,3FVyBQy1ak,"Sociedad. El ""nuevo"" Aconcagua: escaladas en burbujas y rescates dramáticos",https://www.clarin.com/especiales/nuevo-aconcagua-retiros-espirituales-escalada-burbuja-verano-omicron_0_3FVyBQy1ak.html,https://images.clarin.com/2022/01/18/cgf90Nj_g_720x0__1.jpg
69,m1EdK_wpV,Sociedad. Mundo verdulería: 10 secretos del negocio que explotó en pandemia,https://www.clarin.com/sociedad/mundo-verduleria-10-secretos-negocio-exploto-pandemia_0_m1EdK_wpV.html,https://images.clarin.com/2021/12/20/MSbLfu4yR_720x0__1.jpg
70,fJM8dsWAP,Viajes. De Salta a Tierra del Fuego: postales de siete rutas escénicas de la Argentina,https://www.clarin.com/viajes/salta-tierra-fuego-postales-imperdibles-rutas-escenicas-argentina_0_fJM8dsWAP.html,https://images.clarin.com/2021/12/23/_rnz40zJS_720x0__1.jpg
71,RuiIn5s5cJ,A 77 años de su liberación. Holocausto: así era el campo de concentración nazi de Auschwitz,https://www.clarin.com/mundo/holocausto-campo-concentracion-nazi-auschwitz-nuevo-aniversario-liberacion_0_RuiIn5s5cJ.html,https://images.clarin.com/2021/01/27/js5e-EO_z_720x0__1.jpg
72,KAS3BRq7sf,"Mano a mano con Clarin. El plan de Maravilla Martínez para ser campeón a los 47: ""Necesito dos peleas""",https://www.clarin.com/deportes/sergio-maravilla-martinez-necesito-peleas-recien-ahi-apuntare-campeones-mundo-_0_KAS3BRq7sf.html,https://images.clarin.com/2022/02/03/SN6NTSEP-_720x0__1.jpg
73,RBkEEHFCy3,¿Vuelve al fútbol?. Tevez festejó su cumpleaños con cuarteto y ajeno al escándalo en Boca,https://www.clarin.com/deportes/carlos-tevez-festejo-cumpleanos-38-cuarteto-ajeno-escandalo-boca-saludo-club_0_RBkEEHFCy3.html,https://images.clarin.com/2022/02/05/atwJNXOq5_720x0__1.jpg
74,y9KT6jByVK,"Golpe en la FA Cup. Manchester United, eliminado por un equipo de la Segunda con un argentino de verdugo",https://www.clarin.com/deportes/manchester-united-eliminado-equipo-segunda-penal-errado-cristiano-argentino-verdugo_0_y9KT6jByVK.html,https://images.clarin.com/2022/02/04/7xxeHOrIW_720x0__1.jpg
75,eRvWbl0nJI,"Una vida juntos.  ""Ni nos saludábamos"": el Cholo Simeone recordó cómo era su particular relación con Verón",https://www.clarin.com/deportes/cholo-simeone-recordo-particular-relacion-juan-sebastian-veron-saludabamos-_0_eRvWbl0nJI.html,https://images.clarin.com/2022/02/04/OGdfiKoQl_1256x620__2.jpg#1643982519518
76,xEjCM08Wxr,Viajó a México. Ángel Romero explicó por qué no arregló con Boca y dejó un mensaje para sus hinchas,https://www.clarin.com/deportes/angel-romero-explico-arreglo-boca-dejo-mensaje-hinchas_0_xEjCM08Wxr.html,https://images.clarin.com/2022/02/04/epOBnaclQ_720x0__1.jpg
77,tGb32PL33L,Se juega en marzo. Coria anunció el equipo de Copa Davis con la vuelta de un histórico y un debut,https://www.clarin.com/deportes/copa-davis-guillermo-coria-anuncio-equipo-argentino-regreso-historico-debut-baez_0_tGb32PL33L.html,https://images.clarin.com/2019/02/04/IvtIL-3eu_1256x620__3.jpg#1643995741154
