n,id,title,url,image
1,rOmpidXaOj,Restricciones. Tensión e incidentes frente a Casa Rosada en medio de protestas contra las medidas,https://www.clarin.com/sociedad/video-tension-frente-casa-rosada-medio-protestas-gobierno-restricciones_0_rOmpidXaOj.html,https://images.clarin.com/2021/04/17/vWHhp_3ta_720x0__1.jpg
2,BgfYfFlt1,Clases presenciales. Primer rechazo de la Justicia a un amparo para que el lunes las escuelas sigan abiertas,https://www.clarin.com/politica/justicia-rechazo-amparo-pedia-dejar-efecto-dnu-alberto-fernandez_0_BgfYfFlt1.html,https://images.clarin.com/2021/04/17/0BMEJExj0_720x0__1.jpg
3,iJU7yawMF,"Recorrida de Clarín. Un centro comercial de La Matanza, un ""hormiguero"" de gente este sábado",https://www.clarin.com/sociedad/centro-comercial-matanza-hormiguero-gente-sabado_0_iJU7yawMF.html,https://images.clarin.com/2021/04/17/XxlqdYPG6_1256x620__2.jpg#1618690252033
4,wXfBPSaOU,Segunda ola. Reportan otros 19.119 casos: bajaron fuerte los testeos y creció la positividad,https://www.clarin.com/sociedad/coronavirus-argentina-reportan-19-119-nuevos-casos-positivos-80-muertes_0_wXfBPSaOU.html,https://images.clarin.com/2021/04/17/cU2NS-0UT_720x0__1.jpg
5,cH-dvGKkd,Viral en redes. Irónico video de un grupo de médicos a Alberto F. por sus polémicos dichos,https://www.clarin.com/sociedad/ironico-mensaje-grupo-medicos-rechazar-criticas-alberto-fernandez_0_cH-dvGKkd.html,https://images.clarin.com/2021/04/17/X1YCO23Vn_720x0__1.jpg
6,DQqlR3Hcq,Campeón con el Barcelona. Messi: golazo y dos récords en la que pudo ser su última Copa del Rey,https://www.clarin.com/deportes/lionel-messi-golazo-enmarcar-records-pudo-ultima-copa-rey_0_DQqlR3Hcq.html,https://images.clarin.com/2021/04/17/QycyWnlxe_1256x620__2.jpg#1618694504695
7,vCQD3eivs,"3-1. Boca ganó, se acomodó arriba y ya piensa en la Copa Libertadores",https://www.clarin.com/deportes/boca-vs-atletico-tucuman-copa-liga-profesional-futbol-previa-alineaciones-directo_0_vCQD3eivs.html,https://images.clarin.com/2021/04/17/4j-j_iJ1n_720x0__1.jpg
8,hY45QHVRX,"Rompió el silencio. El dolor de Jonatan Viale tras la muerte de su padre: ""Te extrañamos tanto""",https://www.clarin.com/fama/dolor-jonatan-viale-muerte-padre-extranamos-_0_hY45QHVRX.html,https://images.clarin.com/2021/04/12/D1k0AX12u_720x0__1.jpg
9,_72Mahl6P,Transición . La familia real despidió a Felipe en un ceremonia íntima que abre otra etapa,https://www.clarin.com/mundo/familia-real-britanica-despidio-principe-felipe-ceremonia-intima-abre-etapa_0__72Mahl6P.html,https://images.clarin.com/2021/04/17/dUvHejpZ3_720x0__1.jpg
10,,Fotogalería. El adiós de la familia real británica al príncipe Felipe,,
11,9_LHva6mn,Funeral de Felipe. Una mujer corrió semidesnuda en las afueras del castillo de Windsor,https://www.clarin.com/mundo/funeral-principe-felipe-mujer-corrio-semidesnuda-afueras-castillo-windsor_0_9_LHva6mn.html,https://images.clarin.com/2021/04/17/YNtXp21PP_1256x620__2.jpg#1618675542016
12,Lj3lZ25Qk,Especial Clarín. “Echar al diablo”: la Iglesia da cursos de exorcismo por Zoom,https://www.clarin.com/mundo/crecen-exorcismos-ahora-iglesia-da-cursos-zoom-sacar-diablo-cuerpo_0_Lj3lZ25Qk.html,https://images.clarin.com/2021/04/12/5fIF9cGKy_720x0__1.jpg
13,rMjxzK4sX,Alais y los tanques que avanzaban para no llegar. Secretos a 34 años del alzamiento de Semana Santa,https://www.clarin.com/historias/general-alais-tanques-leales-avanzaban-llegar-secretos-34-anos-alzamiento-carapintada-semana-santa_0_rMjxzK4sX.html,https://images.clarin.com/2021/04/15/QgHWCZXfE_720x0__1.jpg
14,kzH_sJbpQ,"Opinión. A pesar de la pandemia, deberías tener hijos (si querés)",https://www.clarin.com/new-york-times-international-weekly/pesar-pandemia-deberias-tener-hijos-queres-_0_kzH_sJbpQ.html,https://images.clarin.com/2021/04/16/lwnHXBw_K_720x0__1.jpg
15,BtIZD09_D,Sorpresa. Gustavo Dudamel dirigirá la Ópera de París,https://www.clarin.com/new-york-times-international-weekly/venezolano-gustavo-dudamel-director-orquesta-superestrella-dirigira-opera-paris_0_BtIZD09_D.html,https://images.clarin.com/2021/04/16/yKrPwpBKt_720x0__1.jpg
16,ZrACV7a3Z, Yoshihide Suga en Washington. ¿Japón enfrentará a China?,https://www.clarin.com/new-york-times-international-weekly/-japon-enfrentara-china-visita-primer-ministro-yoshihide-suga-washington-puede-dar-respuesta_0_ZrACV7a3Z.html,https://images.clarin.com/2021/04/15/eszwsfVfZ_720x0__1.jpg
17,WRXP-4UVP,Hallazgo. Descubren rocas que viajaron 1.600 km a bordo de dinosaurios,https://www.clarin.com/new-york-times-international-weekly/descubren-rocas-prehistoricas-viajaron-1-600-km-transportadas-dinosaurios_0_WRXP-4UVP.html,https://images.clarin.com/2021/04/15/LVe99w4qQ_720x0__1.jpg
18,H9Pcf_6w3,Especial feedlot. Los corrales siguen buscando el equilibrio que les permita resistir,https://www.clarin.com/rural/corrales-siguen-buscando-equilibrio-permita-resistir_0_H9Pcf_6w3.html,https://images.clarin.com/2020/04/17/gW3GYcSsw_720x0__1.jpg
19,GFVdgFLQB,La columna de la semana. Biocombustibles: ante el peligro de una marcha atrás en el camino emprendido,https://www.clarin.com/rural/biocombustibles-peligro-marcha-camino-emprendido_0_GFVdgFLQB.html,https://images.clarin.com/2020/04/29/fCsU15huy_720x0__1.jpg
20,LeoCJDK7f,"Ganadería. La carne, en el ojo de la tormenta: ¿otra vez sopa?",https://www.clarin.com/rural/carne-ojo-tormenta-vez-sopa-_0_LeoCJDK7f.html,https://images.clarin.com/2020/02/17/ljqfhFKe_720x0__1.jpg
21,Y0qwB7asB,Engorde a corral. Buenas prácticas que marcan la diferencia,https://www.clarin.com/rural/buenas-practicas-marcan-diferencia-engorde-corral_0_Y0qwB7asB.html,https://images.clarin.com/2019/05/08/6L1NhVBab_720x0__1.jpg
22,4JNwr4pHG,Sanidad. Las claves para controlar las enfermedades en los corrales,https://www.clarin.com/rural/abc-enfermedades-corrales_0_4JNwr4pHG.html,https://images.clarin.com/2018/11/08/BJx1rqOcA_720x0__1.jpg
23,xVnvKetyc,En foco. La pandemia agudizó la crisis del agro en India,https://www.clarin.com/rural/pandemia-coronavirus-transformado-crisis-cronica-agro-indio-aguda-irreversible_0_xVnvKetyc.html,https://images.clarin.com/2021/04/16/XRHVw0MdN_720x0__1.jpg
24,SWpGJKJ0Q,Por las restricciones. Falabella adelanta su cierre: qué productos quedaron en stock online y a qué precios,https://www.clarin.com/zonales/falabella-adelanta-cierre-productos-quedaron-stock-online-precios_0_SWpGJKJ0Q.html,https://images.clarin.com/2021/04/15/HkPepwCnE_1256x620__2.jpg#1618595756993
25,vbpBqBq1l,Video. Manejaba el colectivo sin barbijo y se peleó con una mujer que lo empezó a filmar,https://www.clarin.com/zonales/video-manejaba-colectivo-barbijo-peleo-mujer-empezo-filmar_0_vbpBqBq1l.html,https://images.clarin.com/2021/04/13/e4Pmzug6e_720x0__1.jpg
26,RQ-KCUP0U,Del GBA. En un municipio el 90% de los tests dio positivo y apareció la cepa Manaos,https://www.clarin.com/zonales/municipios-habitados-90-tests-dieron-positivo-aparecio-temida-cepa-manaos_0_RQ-KCUP0U.html,https://images.clarin.com/2021/04/14/BP9oXoDl0_950x468__2.jpg#1618435344996
27,3Pa76H9da,Los Polvorines. Estranguló al perro de su vecina y mató a un joven: sigue libre,https://www.clarin.com/zonales/estrangulo-perro-vecina-colgo-alambrado-despues-atropello-mato-joven-19-anos_0_3Pa76H9da.html,https://images.clarin.com/2021/04/08/7fxUiQJwr_1256x620__2.jpg#1617998037856
28,evAMKp1oc,Enzo Taborda. El elegido entre 11 países para mandar una carta de amor al Espacio,https://www.clarin.com/zonales/estudiante-fisica-argentino-mandara-carta-amor-espacio-exterior_0_evAMKp1oc.html,https://images.clarin.com/2021/04/05/8kso0oGKB_720x0__1.jpg
29,3T7hjsHm0,Tres argentinos en la misma velada. El día en que el Madison Square Garden tuvo su cartelera más argentina,https://www.clarin.com/deportes/dia-monzon-galindez-ahumada-pelearon-madison-square-garden-titulo-mundo_0_3T7hjsHm0.html,https://images.clarin.com/2021/04/14/7I5pNRGd6_1256x620__2.jpg#1618442033511
30,7Oc769Qxi,"""Se la está comiendo"". La historia de la mujer a la que un chimpancé le arrancó la cara y manos en un frenético ataque",https://www.clarin.com/viste/historia-charla-nash-mujer-chimpance-arranco-cara-manos-frenetico-ataque_0_7Oc769Qxi.html,https://images.clarin.com/2021/04/17/jjXrbcTjl_720x0__1.jpg
31,3Lrlk-3iR,Placer. Juguetes sexuales: ranking erótico y cuerpos conectados por apps,https://www.clarin.com/relaciones/juguetes-sexuales-ranking-erotico-cuerpos-conectados_0_3Lrlk-3iR.html,https://images.clarin.com/2021/02/26/ikU5AB76C_720x0__1.jpg
32,E2hFPfHGI,"Veinte preguntas. Anita Martínez: ""Estoy sola, pero administro el Tinder de mis amigas""",https://www.clarin.com/viva/anita-martinez-sola-administro-tinder-amigas-_0_E2hFPfHGI.html,https://images.clarin.com/2019/09/12/WZWhRgJZi_720x0__1.jpg
33,JC_ua7QJ1,"Con ""Fearless"". Taylor Swift rompió un récord de Los Beatles que tenía 55 años",https://www.clarin.com/espectaculos/musica/taylor-swift-tifon-pensilvania-paso-arriba-record-beatles_0_JC_ua7QJ1.html,https://images.clarin.com/2021/04/17/WX9Z6MvCM_720x0__1.jpg
34,ZV-bu_QXC,Entrevista. Diego Boneta cuenta cómo fue hacer a los dos Luis Miguel de la segunda temporada,https://www.clarin.com/espectaculos/tv/diego-boneta-cuenta-hacer-luis-miguel-segunda-temporada-serie_0_ZV-bu_QXC.html,https://images.clarin.com/2021/04/12/3qAHeVyD1_720x0__1.jpg
35,uHnQWwSTW,"Desembarco de Normandía. A los 106 años, murió el anteúltimo sobreviviente del comando francés",https://www.clarin.com/mundo/murio-anteultimo-sobreviviente-comando-frances-participo-desembarco-normandia_0_uHnQWwSTW.html,https://images.clarin.com/2021/04/17/SZECqePtU_720x0__1.jpg
36,_rxWaYXLZ,Día del Malbec. Por qué el de Argentina es el mejor del mundo,https://www.clarin.com/gourmet/dia-del-malbec-vino-argentino-mejor-del-mundo_0__rxWaYXLZ.html,https://images.clarin.com/2020/11/23/mtJ0OG8E6_720x0__1.jpg
37,Yxm0YmEI2,"Mundos íntimos. La noche que mi abuelo murió, di mi primer beso",https://www.clarin.com/sociedad/mundos-intimos-noche-abuelo-murio-di-primer-beso-triste-alegre-juntaron-hacerme-adulto_0_Yxm0YmEI2.html,https://images.clarin.com/2021/04/16/f0X8tYzKZ_1256x620__2.jpg#1618584685264
38,-iaaHnW1s,Inigualable. Las tapas con la consagración de Messi en la Copa del Rey 2021,https://www.clarin.com/deportes/barcelona-campeon-tapas-consagracion-messi-copa-rey-2021_0_-iaaHnW1s.html,https://images.clarin.com/2021/04/17/ulqX9Rpio_720x0__1.jpg
39,V2hgH3fOK,"Sufrió una molestia. El karma de Mauro Zárate en Boca: por fin fue titular, pero se volvió a lesionar",https://www.clarin.com/deportes/zarate-nueva-lesion-boca-tucuman_0_V2hgH3fOK.html,https://images.clarin.com/2021/04/17/8hH7G4owT_720x0__1.jpg
40,mAknKvw6A,1-1 en el Bajo Flores. San Lorenzo no lo supo definir y Argentinos se lo terminó empatando,https://www.clarin.com/deportes/san-lorenzo-vs-argentinos-juniors-copa-liga-profesional-futbol-previa-alineaciones-directo_0_mAknKvw6A.html,https://images.clarin.com/2021/04/17/QR-Vy9_kL_720x0__1.jpg
41,VzlLKIwRk,"Marcha atrás. San Lorenzo, al final, jugará contra Huachipato en el Nuevo Gasómetro",https://www.clarin.com/deportes/nuevas-restricciones-amba-san-lorenzo-jugara-huachipato-mundialista-mar-plata_0_VzlLKIwRk.html,https://images.clarin.com/2021/04/17/oF0-GSmjo_1256x620__2.jpg#1618670784752
42,hPAUYy1bE,"En Córdoba. Pese al triunfo heroico de Carlé, Argentina perdió con Kazajistán",https://www.clarin.com/deportes/lourdes-carle-logro-triunfo-heroico-rival-desgarrada-mantener-vida-argentina_0_hPAUYy1bE.html,https://images.clarin.com/2021/04/17/JDrWOTq82_720x0__1.jpg
43,TCgFb0ZoW,"¿Se cierra un ciclo?. Sin Nadal, Djokovic ni Federer, la Next Gen define el título en Montecarlo",https://www.clarin.com/deportes/nueva-normalidad-tenis-nadal-djokovic-eliminados-federer-afuera-next-gen-define-titulo-montecarlo_0_TCgFb0ZoW.html,https://images.clarin.com/2021/04/17/UrYJc6SpI_1256x620__2.jpg#1618679877619
44,MCscieRoH,"Vuelve a la Argentina. El Oveja Hernández sorprendió y se fue de Zaragoza: ""Necesito estar con mis hijos""",https://www.clarin.com/deportes/oveja-hernandez-sorprendio-marcho-zaragoza-necesito-hijos-_0_MCscieRoH.html,https://images.clarin.com/2021/04/17/_z-zKKblp_1256x620__2.jpg#1618664705330
45,XzuV9S55E,"Denver sigue firme. La defensa de Campazzo, otra vez clave en un nuevo triunfo de los Nuggets",https://www.clarin.com/deportes/denver-campazzo-houston-nba-triunfo_0_XzuV9S55E.html,https://images.clarin.com/2021/03/29/KyodrDqgb_1256x620__2.jpg#1618631415323
46,lO4GEcpx0,"Soledad Acuña. ""Cuando los chicos no están en la escuela, están en otro lado, y se contagian""",https://www.clarin.com/sociedad/soledad-acuna-chicos-escuela-lado-contagian-_0_lO4GEcpx0.html,https://images.clarin.com/2020/10/12/ULFgwDzXI_720x0__1.jpg
47,oeEXISnnv,Radiografía mundial. Coronavirus: los efectos de la vacunación en 10 países y cómo se ubica la Argentina,https://www.clarin.com/sociedad/coronavirus-efectos-vacunacion-10-paises-ubica-argentina_0_oeEXISnnv.html,https://images.clarin.com/2021/04/09/B18qhyByV_1256x620__2.jpg#1617977684488
48,93zatGKsI,"Economía. El plan ""Vamos viendo"", una de las pocas certidumbres del Gobierno",https://www.clarin.com/economia/plan-vamos-viendo-pocas-certidumbres-ofrece-gobierno_0_93zatGKsI.html,https://images.clarin.com/2021/04/12/Q4N04g4LF_1256x620__2.jpg#1618673498147
49,B1uIilN8Y,En foco. La batalla económica sin resultados: 70 mil precios máximos y la inflación vuela,https://www.clarin.com/opinion/fracaso-70-000-precios-maximos-inflacion-vuela_0_B1uIilN8Y.html,https://images.clarin.com/2021/04/17/-WWKGDvD3_720x0__1.jpg
50,oyQdxa6h-,Gremialista detenido. Murió el uruguayo que intentó comprar los lujosos autos de Marcelo Balcedo,https://www.clarin.com/mundo/murio-uruguayo-intento-comprar-lujosos-autos-gremialista-marcelo-balcedo_0_oyQdxa6h-.html,https://images.clarin.com/2021/03/27/9J8ed5Wya_720x0__1.jpg
51,obXpHuD9B,"A perpetua. Unos anteojos debajo de un sillón, la clave para condenar al hijo de una ex jueza",https://www.clarin.com/policiales/anteojos-debajo-sillon-clave-condenar-perpetua-hijo-ex-jueza_0_obXpHuD9B.html,https://images.clarin.com/2021/04/16/QRxwW2aAH_720x0__1.jpg
52,2mRqBisUb,En apenas 48 horas. Conmoción en Santa Fe por la muerte de toda una familia por coronavirus,https://www.clarin.com/sociedad/conmocion-santa-fe-muerte-toda-familia-causa-coronavirus_0_2mRqBisUb.html,https://images.clarin.com/2021/04/16/Z9LbFmmNp_720x0__1.jpg
53,i3gEX-lz6,"Gerónimo. El ""narcoconcejal"" que traficó cocaína y ahora recibió una dura condena",https://www.clarin.com/policiales/geronimo-narcoconcejal-trafico-cocaina-huyo-cayo-ahora-dieron-dura-condena_0_i3gEX-lz6.html,https://images.clarin.com/2021/03/31/F0ODLlVbs_720x0__1.jpg
54,b1KO4_StJ,Conquista espacial. Elon Musk le ganó a Bezos un contrato de US$ 2.9 mil millones de la NASA ,https://www.clarin.com/tecnologia/elon-musk-gano-jeff-bezos-contrato-2-9-mil-millones-dolares-nasa-ir-luna_0_b1KO4_StJ.html,https://images.clarin.com/2021/02/24/S3fMGBX6I_720x0__1.jpg
55,P1_N4R3oc,Día Mundial del Malbec. Los mejores de Argentina según la app de vinos más famosa,https://www.clarin.com/gourmet/dia-mundial-malbec-mejores-argentina-app-vinos-famosa_0_P1_N4R3oc.html,https://images.clarin.com/2021/04/11/8OVoC4K2W_720x0__1.jpg
56,_9K_4ci-0,"Turismo rural. Maridaje de quesos y vinos, una tendencia en suelo bonaerense",https://www.clarin.com/viajes/escapadas-maridaje-quesos-vinos-tendencia-suelo-bonaerense_0__9K_4ci-0.html,https://images.clarin.com/2021/04/16/6syRfobcA_720x0__1.jpg
57,mIqYtturc,"Criptoarte. Pelé se sube al NFT: ""1.282 goles, 1.363 partidos, la más valiosa figurita""",https://www.clarin.com/tecnologia/pele-sube-fiebre-nft-1-282-goles-1-363-partidos-valiosa-figurita-_0_mIqYtturc.html,https://images.clarin.com/2020/10/22/xt2TGxiUF_720x0__1.jpg
58,voHXlNZTK,Polémica. Facebook todavía no decidió si levantará el veto a Donald Trump,https://www.clarin.com/tecnologia/facebook-todavia-decidio-levantara-veto-donald-trump_0_voHXlNZTK.html,https://images.clarin.com/2021/04/17/AQqyAxSuO_720x0__1.jpg
59,mwMxcy2WU,Ahorro. Así es el plan para comprar computadoras de alta gama en cuotas,https://www.clarin.com/economia/plan-comprar-computadoras-alta-gama-cuotas_0_mwMxcy2WU.html,https://images.clarin.com/2020/11/11/6C0ynCzuZ_720x0__1.jpg
60,B40q5unNo,"Ecoturismo. Escapadas de otoño: 8 reservas naturales, un respiro al aire libre",https://www.clarin.com/viajes/escapadas-otono-8-reservas-naturales-respiro-aire-libre_0_B40q5unNo.html,https://images.clarin.com/2021/04/13/fZIErdGbs_720x0__1.jpg
61,gkM0rSImu,Patrocinado. Cómo aprovechar las ventajas del blanqueo impositivo e invertir en San Telmo,https://www.clarin.com/mercado-inmobiliario/aprovechar-ventajas-blanqueo-impositivo-invertir-san-telmo_0_gkM0rSImu.html,https://images.clarin.com/2021/04/13/YWlnM3T-S_720x0__1.jpg
62,L_Cfcyihq,En San Telmo. Invertí y comenzá a cobrar alquiler hasta la posesión,https://www.clarin.com/mercado-inmobiliario/inverti-san-telmo-comenza-cobrar-alquiler-posesion_0_L_Cfcyihq.html,https://images.clarin.com/2021/03/17/P3bQz9HnN_720x0__1.jpg
63,RnDCXdAqB,Solar Bustamante. Para mudarse con categoría y estilo en una esquina única,https://www.clarin.com/mercado-inmobiliario/solar-bustamante-identidad-palermo-categoria-estilo_0_RnDCXdAqB.html,https://images.clarin.com/2020/09/01/9s-MMDBF9_720x0__1.jpg
64,d7GR8WGdY,Mine Newbery. La nueva estrella de La Imprenta,https://www.clarin.com/mercado-inmobiliario/mine-newbery-proyecto-imperdible-pleno-barrio-imprenta_0_d7GR8WGdY.html,https://images.clarin.com/2020/11/09/61Go-_7CD_720x0__1.jpg
65,m50YRWT_x,Charcas Live. Invertí en pesos y en un producto premium,https://www.clarin.com/mercado-inmobiliario/inverti-pesos-producto-premium_0_m50YRWT_x.html,https://images.clarin.com/2021/03/05/YlVCe0xV2_720x0__1.jpg
66,hRAaQxf6y,Dos ambientes. El mejor momento para comprar en Palermo Soho,https://www.clarin.com/brandstudio/mejor-momento-comprar-palermo-soho_0_hRAaQxf6y.html,https://images.clarin.com/2021/03/18/2Kszwqqc9_720x0__1.jpg
67,60Eslgunc,Video. Una oveja derriba a un dron con un cabezazo para defender a sus crías,https://www.clarin.com/viste/oveja-derriba-dron-cabezazo-defender-crias_0_60Eslgunc.html,https://images.clarin.com/2021/04/15/FXxRysUON_720x0__1.jpg
68,1hArzoLpa,"Viral. ""Fueron 100 días horribles"": pasó tres meses buscando a su perro y así fue su emotivo reencuentro",https://www.clarin.com/viste/-100-dias-horribles-paso-meses-buscando-perro-emotivo-reencuentro_0_1hArzoLpa.html,https://images.clarin.com/2021/04/16/bSINBF90G_720x0__1.jpg
69,k5tSAys7M,Pandemia. Descubren un nuevo talón de Aquiles del coronavirus,https://www.clarin.com/internacional/covid-19-descubren-nuevo-talon-aquiles-coronavirus_0_k5tSAys7M.html,https://images.clarin.com/2021/02/26/kb04Vc4jx_720x0__1.jpg
70,D9UwdjZKd,"""Me mordió"". El video del hombre que defiende a su esposa del ataque de un lince rabioso",https://www.clarin.com/viste/-mordio-video-hombre-defiende-esposa-ataque-lince-rabioso_0_D9UwdjZKd.html,https://images.clarin.com/2021/04/16/uqcfJrf4__720x0__1.jpg
71,SetG9UlHH,En Texas. Una espeluznante criatura marina atacó y picó a un niño de 8 años,https://www.clarin.com/internacional/estados-unidos/espeluznante-criatura-marina-ataco-pico-nino-8-anos_0_SetG9UlHH.html,https://images.clarin.com/2021/04/16/u4KxxskTB_720x0__1.jpg
72,nAwGOiIBJ,Hecha la ley.... Un hombre se casa cuatro veces para tener las vacaciones pagas,https://www.clarin.com/internacional/insolito-hombre-casa-veces-mes-poder-tener-vacaciones-pagas_0_nAwGOiIBJ.html,https://images.clarin.com/1969/12/31/HJ0PI93Ql_1256x620__1.jpg#1618586006528
73,nXLaPXeRf,Alberto Greco. El gurú de su propio culto,https://www.clarin.com/revista-n/arte/alberto-greco-guru-propio-culto_0_nXLaPXeRf.html,https://images.clarin.com/2021/04/16/8Mr8NcKJx_1256x620__2.jpg#1618615008415
74,i5d5MO1pr,Libros políticos. Para elegir con los ojos abiertos,https://www.clarin.com/revista-n/ideas/leer-libros-politicos-votar-ojos-abiertos_0_i5d5MO1pr.html,https://images.clarin.com/2021/04/16/u8-Xbow2__1256x620__2.jpg#1618611624426
75,oe37DS8EZ,"Entrevista. Alan Pauls, a favor de una navegación lenta",https://www.clarin.com/revista-n/literatura/alan-pauls-favor-navegacion-lenta_0_oe37DS8EZ.html,https://images.clarin.com/2021/04/16/aZwqSF6CG_1256x620__2.jpg#1618594309557
76,K_nVUoKI1,Fotografía. Bajo otro meridiano,https://www.clarin.com/revista-n/arte/fotografia-meridiano_0_K_nVUoKI1.html,https://images.clarin.com/2021/04/16/HVGc_4cdP_1256x620__2.jpg#1618606728573
77,PsDvGX5ty,"Pompeyo Audivert. “Habitación Macbeth”: un rey desaforado, entre fantasmas",https://www.clarin.com/revista-n/escenarios/-habitacion-macbeth-rey-desaforado-fantasmas_0_PsDvGX5ty.html,https://images.clarin.com/2021/04/16/7FVOgQd_-_720x0__1.jpg
78,DbmE-7lrf,Cañete pide perdón (apenas). “Voy a demandar al Museo de Houston”,https://www.clarin.com/revista-n/arte/canete-pide-perdon-apenas-anuncia-voy-demandar-museo-houston-_0_DbmE-7lrf.html,https://images.clarin.com/2021/04/05/i5SNrcpsw_1200x0__2.jpg#1618323235899
79,oqwVCyvFX,"En Córdoba. La historia del policía que rechazó una coima de $ 11 millones: ""Hice lo que tenía que hacer""",https://www.clarin.com/policiales/historia-policia-rechazo-bolso-coima-11-millones-hice-hacer-_0_oqwVCyvFX.html,https://images.clarin.com/2021/04/17/0OyoGevnT_720x0__1.jpg
80,GGotMs4ju,"Contámelo otra vez. La titiritera que pasó 16 días en coma tras un robo: ""Tuve tres plenos en la ruleta""",https://www.clarin.com/sociedad/titiritera-atacada-motochorro-paso-16-dias-coma-recupero-plenos-ruleta-_0_GGotMs4ju.html,https://images.clarin.com/2021/04/01/po4J_-j0B_720x0__1.jpg
81,kVikFw_DP,Adelanto de Clarín. Nueva encuesta en un bastión anti K: imagen de dirigentes e intención de voto,https://www.clarin.com/politica/nueva-encuesta-capital-anti-k-argentina-imagen-dirigentes-intencion-voto-2021_0_kVikFw_DP.html,https://images.clarin.com/2019/05/08/w5MDooybH_720x0__1.jpg
82,MExA6vNLH,La carrera electoral. A quiénes ve Máximo como candidatos presidenciales en 2023,https://www.clarin.com/politica/ve-maximo-kirchner-candidatos-presidenciales-2023_0_MExA6vNLH.html,https://images.clarin.com/2020/12/27/mxVsgXOh-_720x0__1.jpg
83,6rkYEv0Q7,Por 45 días. El segundo de Alicia Kirchner en Santa Cruz fue denunciado y pidió licencia,https://www.clarin.com/politica/vicegobernador-santa-cruz-pidio-licencia-denuncia_0_6rkYEv0Q7.html,https://images.clarin.com/2021/04/17/VjeUzT_kG_720x0__1.jpg
84,EZopvfTqn,Crece la indignación. Un grupo de padres hará el lunes un abrazo en cada una de las escuelas,https://www.clarin.com/sociedad/defensa-presencialidad-padres-autoconvocados-haran-proximo-lunes-abrazo-escuelas_0_EZopvfTqn.html,https://images.clarin.com/2021/04/16/UIySXc9C8_720x0__1.jpg
85,GPRwsdOZ1,Polémica en gráfica. El INADI se pronunció sobre la tapa de Noticias contra Canosa,https://www.clarin.com/sociedad/inadi-pronuncio-tapa-revista-noticias-viviana-canosa-discriminatoria-_0_GPRwsdOZ1.html,https://images.clarin.com/2021/04/17/-jlQ5IlPw_1256x620__2.jpg#1618680421400
86,4MnFTyQCR,"DAIA lo denunciaría. Polémicos tuits de Alberto Samid contra  Sigman, Galperin y Grobocopatel",https://www.clarin.com/sociedad/polemicos-tuits-alberto-samid-galperin-grobocopatel-sigman-daia-podria-denunciarlo_0_4MnFTyQCR.html,https://images.clarin.com/2021/04/17/B-O2L27K7_720x0__1.jpg
