n,id,title,url,image
1,o7ZRvooO7,Un tribunal clave. Eligen al nuevo presidente de Casación  y un juez vinculado al kirchnerismo podría tomar el control,https://www.clarin.com/politica/define-presidencia-camara-casacion-juez-vinculado-k-podria-tomar-control_0_o7ZRvooO7.html,https://images.clarin.com/2020/11/06/Zx3VuNPLy_720x0__1.jpg
2,rn2bbpdOg,"País adolescente. Alberto, Cristina, Lula y una foto que huele a decadencia",https://www.clarin.com/opinion/alberto-fernandez-cristina-kirchner-lula-silva-foto-huele-decadencia_0_rn2bbpdOg.html,https://images.clarin.com/2021/12/14/RvAI4PHea_720x0__1.jpg
3,QdCF6xpjK,"Inflación. Por el fracaso, el Gobierno da marcha atrás con el congelamiento de precios",https://www.clarin.com/economia/gobierno-pone-fin-congelamiento-relanzan-precios-cuidados-2022_0_QdCF6xpjK.html,https://images.clarin.com/2021/12/13/gPgOhp63O_720x0__1.jpg
4,Min6oU7jG,Del editor. El Presidente se desmarca de la tragedia educativa,https://www.clarin.com/opinion/presidente-desmarca-tragedia-educativa_0_Min6oU7jG.html,https://images.clarin.com/2021/12/13/RYbePUMHo_720x0__1.jpg
5,L_N2Ux-Ju,"Eitan Shaked. Habla el joven que pasó 24 horas en un glaciar: ""No entiendo cómo no morí""",https://www.clarin.com/sociedad/habla-eitan-shaked-joven-sobrevivio-24-horas-glaciar-entiendo-mori-acto-_0_L_N2Ux-Ju.html,https://images.clarin.com/2021/12/12/05nL6NXG5_720x0__1.jpg
6,yBkgHFCPn,Especial Clarín. El año del dólar: dónde fueron a parar las reservas del Banco Central,https://www.clarin.com/economia/ano-dolar-parar-reservas-banco-central_0_yBkgHFCPn.html,https://images.clarin.com/2021/12/13/SUktNy4Ij_720x0__1.jpg
7,o5tlcVSTn,La asesinó a puñaladas. Cadena perpetua a un ex policía por el femicidio de Úrsula Bahillo en Rojas,https://www.clarin.com/sociedad/condenaron-cadena-perpetua-ex-policia-femicidio-ursula-bahillo-rojas_0_o5tlcVSTn.html,https://images.clarin.com/2021/02/09/9zFp8HCnx_720x0__1.jpg
8,LanisqHiY,"Coronavirus. Advertencia de la OMS: ""Nos enfrentamos a un tsunami de infecciones en el mundo, tanto de Delta como de Ómicron""",https://www.clarin.com/mundo/advertencia-oms-enfrentamos-tsunami-infecciones-covid-mundo-delta-omicron-_0_LanisqHiY.html,https://images.clarin.com/2021/12/14/ayqqKeWlu_720x0__1.jpg
9,cwT8GOtqW,Coronavirus. Cuántos casos de reinfección hubo hasta ahora en el país y cómo influirá Ómicron,https://www.clarin.com/sociedad/casos-reinfeccion-covid-ahora-argentina-influira-omicron_0_cwT8GOtqW.html,https://images.clarin.com/2021/12/14/1hX8WD-LE_1256x620__2.jpg#1639458069866
10,SFj_MBc2T,Qué implica cada opción. Donación de propiedades: ¿conviene planificarla en vida o hacer la sucesión después?,https://www.clarin.com/servicios/donacion-propiedades-conviene-planificarla-vida-hacer-sucesion-despues-_0_SFj_MBc2T.html,https://images.clarin.com/2021/05/04/Iq185gi4q_720x0__1.jpg
11,-sYvvCjkh,Escándalo en el Ascenso. Qué le dijo Lamolina al DT de Ferro por el penal inexistente que cobró,https://www.clarin.com/deportes/orsi-tecnico-ferro-destruidos-injusto_0_-sYvvCjkh.html,https://images.clarin.com/2021/12/14/Dj1QcuEEJ3_720x0__1.jpg
12,ToEbiWXTs,"El acuerdo con el FMI. Rodríguez Larreta: ""Que el Gobierno diga cómo vamos a crecer y a generar trabajo""",https://www.clarin.com/politica/rodriguez-larreta-dijo-acuerdo-fmi-parte-plan-integral-gobierno-diga-vamos-crecer-generar-trabajo-_0_ToEbiWXTs.html,https://images.clarin.com/2021/12/14/tL7Li34_T_720x0__1.jpg
13,3hS5nRxET,"La pelea por los precios. Roberto Feletti: ""Un éxito en el número de inflación es que en noviembre no superara el 3%""",https://www.clarin.com/economia/roberto-feletti-exito-numero-inflacion-noviembre-superara-3-_0_3hS5nRxET.html,https://images.clarin.com/2021/12/14/NI6NqGYZ8_720x0__1.jpg
14,sNQ7lHkXU7,Sigue la investigación. Ordenan la captura nacional e internacional  de dos prófugos por el ataque a Clarín,https://www.clarin.com/sociedad/ordenan-captura-nacional-internacional-profugos-ataque-clarin_0_sNQ7lHkXU7.html,https://images.clarin.com/2021/12/13/cMt3gs1UQ_720x0__1.jpg
15,XX3RyeF35,Vínculo estrecho. Pep Guardiola estará presente en el anuncio de Agüero de mañana,https://www.clarin.com/deportes/guardiola-aguero-conferencia-retiro_0_XX3RyeF35.html,https://images.clarin.com/2021/03/19/GmhcCOh3e_720x0__1.jpg
16,aWcx_VNlg,"Para ver. La historia de Sara Ramírez, el personaje latino no binario de ""Sex And The City""",https://www.clarin.com/espectaculos/cine/historia-sara-ramirez-personaje-latino-binario-sex-and-the-city-_0_aWcx_VNlg.html,https://images.clarin.com/2021/12/01/yGt1jkJT0_720x0__1.jpg
17,KubrdVdas3,Fotogalería. Todos los looks de la alfombra roja en la premiere de la nueva Spider-Man,https://www.clarin.com/fotogalerias/imponente-vestido-zendaya-llevo-todas-mirada-premier-spiderman_5_KubrdVdas3.html,
18,2SQdJB5nV,Impacto de la cuarentena. La revancha de La Boca: el paseo que quedó desierto por el Covid y empieza a recuperarse,https://www.clarin.com/ciudades/revancha-boca-paseo-clasico-quedo-desierto-covid-empieza-recuperarse_0_2SQdJB5nV.html,https://images.clarin.com/2021/12/13/4CsYxX-s8_1256x620__2.jpg#1639434200012
19,DkWS3EjPQ,Prevén 11 meses de trabajos. Arrancan obras para cambiar Libertador con ciclovías y nuevas paradas,https://www.clarin.com/ciudades/ciclovia-retiro-general-paz-libertador-primera-calle-compartida-ciudad_0_DkWS3EjPQ.html,https://images.clarin.com/2021/12/13/bB-pwWvuS_720x0__1.jpg
20,o5UgwjHWp,"Tierra del Fuego. La historia del Desdémona, un náufrago bajo las estrellas",https://www.clarin.com/viajes/desdemona-naufrago-estrellas_0_o5UgwjHWp.html,https://images.clarin.com/2016/09/16/HJ-SH0uCmg_720x0.jpg
21,YWvLLZW0t,"Sorprendente. La increíble historia de Martin Laurello, el hombre que podía girar la cabeza 180 grados",https://www.clarin.com/internacional/increible-historia-martin-laurello-hombre-podia-girar-cabeza-180-grados_0_YWvLLZW0t.html,https://images.clarin.com/2021/12/13/44a3fxRk5_1256x620__2.jpg#1639401608680
22,tLkx6wd8M,Turki Al-Sheikh. Quién es el excéntrico árabe que organizó la Maradona Cup entre Boca y Barcelona,https://www.clarin.com/deportes/turki-sheikh-excentrico-magnate-arabe-organizo-maradona-cup-boca-barcelona_0_tLkx6wd8M.html,https://images.clarin.com/2019/11/15/nPLNQ1mf_720x0__1.jpg
23,6cvzYlP8N,Para regalar. Tres policiales recomendados para el arbolito,https://www.clarin.com/cultura/navidad-policiales-negros-recomendados-arbolito_0_6cvzYlP8N.html,https://images.clarin.com/2021/02/07/cljkuure8_1256x620__2.jpg#1639486353123
24,VXbkWXFgo,"Revelaciones. Borges, según su madre: el genio precoz y la ardua lucha contra la ceguera",https://www.clarin.com/viva/borges-madre-genio-precoz-ardua-lucha-ceguera_0_VXbkWXFgo.html,https://images.clarin.com/2021/12/13/aGsJAkGrz_720x0__1.jpg
25,o7ZRvooO7,Un tribunal clave. Eligen al nuevo presidente de Casación  y un juez vinculado al kirchnerismo podría tomar el control,https://www.clarin.com/politica/define-presidencia-camara-casacion-juez-vinculado-k-podria-tomar-control_0_o7ZRvooO7.html,https://images.clarin.com/2020/11/06/Zx3VuNPLy_720x0__1.jpg
26,rn2bbpdOg,"País adolescente. Alberto, Cristina, Lula y una foto que huele a decadencia",https://www.clarin.com/opinion/alberto-fernandez-cristina-kirchner-lula-silva-foto-huele-decadencia_0_rn2bbpdOg.html,https://images.clarin.com/2021/12/14/RvAI4PHea_720x0__1.jpg
27,QdCF6xpjK,"Inflación. Por el fracaso, el Gobierno da marcha atrás con el congelamiento de precios",https://www.clarin.com/economia/gobierno-pone-fin-congelamiento-relanzan-precios-cuidados-2022_0_QdCF6xpjK.html,https://images.clarin.com/2021/12/13/gPgOhp63O_720x0__1.jpg
28,Min6oU7jG,Del editor. El Presidente se desmarca de la tragedia educativa,https://www.clarin.com/opinion/presidente-desmarca-tragedia-educativa_0_Min6oU7jG.html,https://images.clarin.com/2021/12/13/RYbePUMHo_720x0__1.jpg
29,L_N2Ux-Ju,"Eitan Shaked. Habla el joven que pasó 24 horas en un glaciar: ""No entiendo cómo no morí""",https://www.clarin.com/sociedad/habla-eitan-shaked-joven-sobrevivio-24-horas-glaciar-entiendo-mori-acto-_0_L_N2Ux-Ju.html,https://images.clarin.com/2021/12/12/05nL6NXG5_720x0__1.jpg
30,yBkgHFCPn,Especial Clarín. El año del dólar: dónde fueron a parar las reservas del Banco Central,https://www.clarin.com/economia/ano-dolar-parar-reservas-banco-central_0_yBkgHFCPn.html,https://images.clarin.com/2021/12/13/SUktNy4Ij_720x0__1.jpg
31,o5tlcVSTn,La asesinó a puñaladas. Cadena perpetua a un ex policía por el femicidio de Úrsula Bahillo en Rojas,https://www.clarin.com/sociedad/condenaron-cadena-perpetua-ex-policia-femicidio-ursula-bahillo-rojas_0_o5tlcVSTn.html,https://images.clarin.com/2021/02/09/9zFp8HCnx_720x0__1.jpg
32,GcWnscAZv,"Tragos, música y puro festejo. La intimidad del cumpleaños sorpresa que le organizaron a Wanda Nara en la Argentina",https://www.clarin.com/fama/cumpleanos-sorpresa-wanda-nara-argentina-intimidad-festejo-torta-particular_0_GcWnscAZv.html,https://images.clarin.com/2021/12/14/XlyDdOdW0_720x0__1.jpg
33,lZKpRZ3_R,"Fuerte insulto. ""¿No te parece que es momento de retirarte?"": Chiche Gelblung se cruzó con un entrevistado al aire",https://www.clarin.com/fama/-parece-momento-retirarte-chiche-gelblung-cruzo-entrevistado-aire_0_lZKpRZ3_R.html,https://images.clarin.com/2021/07/26/0qVZoZovy_720x0__1.jpg
34,r2rCB2Wr2,Tras el escándalo en América. Lussich y Pallares se refirieron a las denuncias por maltrato contra Antonio Laje,https://www.clarin.com/fama/rodrigo-lussich-adrian-pallares-refirieron-denuncias-maltrato-antonio-laje_0_r2rCB2Wr2.html,https://images.clarin.com/2021/12/13/61AGD-YzI_720x0__1.jpg
35,hnx5GXjAI,"Tenía 33 años. Murió Daniela Chili Fernández, ex participante de ""El gran premio de la cocina""",https://www.clarin.com/fama/murio-daniela-chili-fernandez-ex-participante-gran-premio-cocina-_0_hnx5GXjAI.html,https://images.clarin.com/2021/12/13/c_zISTHXN_720x0__1.jpg
36,SsvsImfVY,Robos callejeros. Cuánto cuesta al mes asegurar la cartera o el bolso y lo que se lleva adentro,https://www.clarin.com/servicios/robos-callejeros-cuesta-mes-asegurar-cartera-bolso-lleva-adentro_0_SsvsImfVY.html,https://images.clarin.com/2021/12/13/S0uBzDV-F_720x0__1.jpg
37,FEcxng-RH,Home office en Balcarce. Rolo Villar: cómo resistió con humor a un año lleno de golpes,https://www.clarin.com/historias/rolo-villar-lucha-sostener-humor-ano-lleno-golpes_0_FEcxng-RH.html,https://images.clarin.com/2021/12/07/klqN-vkyx_720x0__1.jpg
38,yiloOoXXD,"Casos sin resolver. Qué pasó con Emanuela Orlandi: dos extrañas visitas y un audio, nuevos detalles",https://www.clarin.com/mundo/extranos-visitantes-audio-nuevos-detalles-paso-emanuela-orlandi_0_yiloOoXXD.html,https://images.clarin.com/2019/08/12/kKmnXVnRE_720x0__1.jpg
39,Jn8hD-WHB,A dónde va el Covid. La supremacía de Ómicron y cuánto hay que preocuparse,https://www.clarin.com/sociedad/va-covid-supremacia-omicron-preocuparse_0_Jn8hD-WHB.html,https://images.clarin.com/2021/04/12/mu8KdqkCd_720x0__1.jpg
40,FblFa42vW,Clave en vacaciones. Uso de tarjetas en el exterior: cuántos dólares se puede gastar y retirar en cajeros,https://www.clarin.com/servicios/uso-tarjetas-exterior-dolares-puede-gastar-retirar-cajeros-automaticos_0_FblFa42vW.html,https://images.clarin.com/2018/12/24/ZCTfXDBzz_720x0__1.jpg
41,CpUhuSgLk,Pasión en miniatura. Autitos de colección: un juego que no es de niños y mueve millones,https://www.clarin.com/autos/autitos-coleccion-juego-ninos-mueve-millones_0_CpUhuSgLk.html,https://images.clarin.com/2021/12/03/clFAGxjmh_720x0__1.jpg
42,YvuxFVzwz,Ruta internacional. Dónde van los relojes de alta gama robados en Argentina,https://www.clarin.com/policiales/van-relojes-alta-gama-robados-argentina_0_YvuxFVzwz.html,https://images.clarin.com/2021/12/02/orU-T-sim_720x0__1.jpg
43,10RDfpYkp,"Especial Clarín. Viaje a la ""fábrica"" del cannabis: cómo se produce el aceite en el primer laboratorio industrial del país",https://www.clarin.com/sociedad/viaje-fabrica-cannabis-produce-aceite-primer-laboratorio-industrial-pais_0_10RDfpYkp.html,https://images.clarin.com/2021/11/23/_jEGmHUd-_720x0__1.jpg
44,QYZ1y_wYH,Misteriosa Buenos Aires . Once rincones del arte porteño con secretos para explorar,https://www.clarin.com/ciudades/misteriosa-buenos-aires-11-rincones-arte-porteno-secretos-explorar_0_QYZ1y_wYH.html,https://images.clarin.com/2021/11/11/BD1JOPOew_720x0__1.jpg
45,qHrQzo04R,"Champions League. Tras el insólito error en el sorteo, al PSG de Messi le tocó Real Madrid en octavos",https://www.clarin.com/deportes/champions-league-sorteo-octavos-final-minuto-minuto-directo-psg-messi-campeon-chelsea-grandes-cucos_0_qHrQzo04R.html,https://images.clarin.com/2021/12/13/vful-q5Oj_720x0__1.jpg
46,NPkLaDpXf,Histórica indemnización. Las gimnastas víctimas de abuso de Larry Nassar llegaron a un acuerdo multimillonario,https://www.clarin.com/deportes/gimnastas-victimas-abuso-sexual-sistematico-medico-larry-nassar-alcanzaron-acuerdo-multimillonario_0_NPkLaDpXf.html,https://images.clarin.com/2021/09/16/o9GC1jNhxg_720x0__1.jpg
47,_SqN9uMz8,"Verstappen, campeón de la F1. El show de Toto Wolff: ¿tuvo responsabilidad en la derrota de Hamilton?",https://www.clarin.com/deportes/show-toto-wolff-ultima-vuelta-definio-campeonato-formula-1-responsabilidad-derrota-hamilton-_0__SqN9uMz8.html,https://images.clarin.com/2021/12/12/oBFlGSQDe_1256x620__4.jpg#1639405759704
48,V-zVSraS-,"Fórmula 1. La bronca de Hamilton antes de perder con Verstappen: ""Esto está siendo manipulado""",https://www.clarin.com/deportes/lewis-hamilton-mensaje-indignacion-perder-mundial-formula-1-max-verstappen-manipulado-_0_V-zVSraS-.html,https://images.clarin.com/2021/12/14/TIxGwxNmm_720x0__1.jpg
49,rjSrHceqA,"Cholito, en llamas. ¿Puede ser Gio Simeone el 9 que le falta a la Selección de Scaloni?",https://www.clarin.com/deportes/-puede-gio-simeone-9-falta-seleccion-scaloni-_0_rjSrHceqA.html,https://images.clarin.com/2021/12/09/fcNuDoltj_1256x620__2.jpg#1639436951302
50,sHDMkONzs,"Camilo Castagnola. Tras salir campeón, es el 10 de handicap más joven de la historia del polo",https://www.clarin.com/deportes/despues-salir-campeon-palermo-camilo-castagnola-10-handicap-joven-historia-polo_0_sHDMkONzs.html,https://images.clarin.com/2021/12/13/hzI5TrZc5_720x0__1.jpg
51,KpbP_IZUO,"Negociaciones. En tiempo de descuento para el acuerdo, el FMI  sigue sin definir que pasará con la sobre tasa",https://www.clarin.com/economia/tiempo-descuento-acuerdo-fmi-sigue-definir-pasara-tasa_0_KpbP_IZUO.html,https://images.clarin.com/2021/11/15/KowauKFo1_720x0__1.jpg
52,50pKGx0uY,En 12 y 18 cuotas sin interés. El Banco Nación lanza una promo  para comprar notebooks y celulares ,https://www.clarin.com/economia/banco-nacion-lanza-promo-comprar-notebooks-celulares-12-18-cuotas-interes_0_50pKGx0uY.html,https://images.clarin.com/2021/12/02/PeNaL-Mz5_720x0__1.jpg
53,kB7u4BiUD,"Para comprar con tiempo. Una por una, todas las promociones de los bancos para Navidad y fin de año",https://www.clarin.com/economia/comprar-tiempo-todas-promociones-bancos-navidad-fin-ano_0_kB7u4BiUD.html,https://images.clarin.com/2021/12/09/mqZlrilGI_720x0__1.jpg
54,ITkCcnlRV,Qué dijo. Dogecoin se dispara más de 24% tras un tuit de Elon Musk sobre la cripto y Tesla,https://www.clarin.com/economia/dogecoin-disparo-24-tuit-elon-musk-cripto-tesla_0_ITkCcnlRV.html,https://images.clarin.com/2021/12/14/Jnvnofjh0_720x0__1.jpg
55,49wWKCxpS,Leve suba. Cuáles fueron los 10 autos usados más vendidos de noviembre,https://www.clarin.com/autos/10-autos-usados-vendidos-noviembre_0_49wWKCxpS.html,https://images.clarin.com/2021/09/10/k4EgVGttm_720x0__1.jpg
