n,id,title,url,image
1,gft4M6hym,"Acto en La Plata. Al grito de ""vamos a volver"", Diego Santilli cerró su campaña: ""Hay que terminar con la improvisación""",https://www.clarin.com/politica/grito-vamos-volver-diego-santilli-cerro-campana-plata-terminar-relato-_0_gft4M6hym.html,https://images.clarin.com/2021/09/09/HlkJQVfPB_720x0__1.jpg
2,j2fq23ldQ,"Cierre de campaña. Alberto Fernández, contra JxC: ""Si van a hacer lo mismo que Macri, por favor no vuelvan""",https://www.clarin.com/politica/alberto-fernandez-apunto-juntos-cambio-dias-paso-van-hacer-mismo-mauricio-macri-favor-vuelvan-_0_j2fq23ldQ.html,https://images.clarin.com/2021/09/07/wQbDT9F2X_720x0__1.jpg
3,yTR_VfSM4,"Detrás de cámaras. ""¿Me estás cargando?"": el tenso cruce entre Santilli y Tolosa Paz en TV",https://www.clarin.com/politica/tenso-cruce-diego-santilli-victoria-tolosa-paz-aire_0_yTR_VfSM4.html,https://images.clarin.com/2021/09/09/cgNWQdPto_720x0__1.jpg
4,omDQLt0qb,"Recta final. La estimación del Frente de Todos en Provincia: caída del 20%, pero triunfo en las PASO",https://www.clarin.com/politica/ultimos-numeros-maneja-frente-provincia-caida-20-triunfo-paso_0_omDQLt0qb.html,https://images.clarin.com/2021/08/18/MoWw6lR2D_720x0__1.jpg
5,YDMQWfyl3,Nuevo ítem. Servicio doméstico: cómo calcular el pago adicional por antigüedad,https://www.clarin.com/servicios/servicio-domestico-calcular-pago-adicional-antiguedad_0_YDMQWfyl3.html,https://images.clarin.com/2021/09/08/glw6QNryk_720x0__1.jpg
6,M7wAOyXJU,Mercado cambiario. El dólar blue abre en $ 188 y marca un nuevo récord para el año,https://www.clarin.com/economia/dolar-blue-abre-188-marca-nuevo-record-ano_0_M7wAOyXJU.html,https://images.clarin.com/2021/03/22/VosNxnRmN_720x0__1.jpg
7,dw5jWtgLF,"Plan de vacunación. Sputnik: liberan otras 760 mil segundas dosis de Richmond y hay 2,9 millones pendientes",https://www.clarin.com/sociedad/sputnik-v-liberan-760-mil-segundas-dosis-richmond-2-9-millones-pendientes_0_dw5jWtgLF.html,https://images.clarin.com/2021/08/10/mBEYD0cbS_720x0__1.jpg
8,wYm2aQMi6,Ola de violencia. Sergio Berni desafió a Frederic y encabezó un operativo anti narco en Rosario,https://www.clarin.com/policiales/sergio-berni-desafio-sabina-frederic-encabezo-operativo-anti-narco-rosario_0_wYm2aQMi6.html,https://images.clarin.com/2021/09/09/SNWQFiqfa_720x0__1.jpg
9,fmdnVDZR9,"El partido de la Selección. Iorio, de ser el elegido para cantar el Himno a quedarse afuera de la fiesta ",https://www.clarin.com/deportes/ricardo-iorio-elegido-cantar-himno-quedarse-afuera-fiesta-seleccion_0_fmdnVDZR9.html,https://images.clarin.com/2021/09/08/1hspqRECd_1256x620__2.jpg#1631197676075
10,9PlwIzh3S,A los 77 años. Persiguiendo a Gatti: la misteriosa vida del último gran showman del fútbol,https://www.clarin.com/historias/persiguiendo-hugo-orlando-gatti-misteriosa-vida-77-ultimo-gran-showman-futbol_0_9PlwIzh3S.html,https://images.clarin.com/2021/09/08/D2th5gCee_720x0__1.jpg
11,Qw-zkTGOY,Posible mala praxis. Vendió su camioneta para hacerse una cirugía estética y vive un infierno,https://www.clarin.com/policiales/vendio-camioneta-hacerse-cirugia-estetica-ahora-vida-infierno_0_Qw-zkTGOY.html,https://images.clarin.com/2021/09/08/pat5To1Ek_1256x620__2.jpg#1631133154851
12,Z4zramAMR,Insólito. Ocho escalones y ninguna rampa para entrar a una Secretaría de Discapacidad,https://www.clarin.com/sociedad/insolito-escalones-rampa-entrar-secretaria-discapacidad-ushuaia_0_Z4zramAMR.html,https://images.clarin.com/2021/09/09/XMBA5z5ux_930x525__4.jpg#1631193302771
13,wVcqs_z8f,"De portaligas en el Congreso. Tras las críticas, Cinthia Fernández redobló la apuesta y mostró el video completo",https://www.clarin.com/fama/portaligas-congreso-criticas-cinthia-fernandez-redoblo-apuesta-mostro-video-completo_0_wVcqs_z8f.html,https://images.clarin.com/2021/09/09/_mCQdUCo-_720x0__1.jpg
14,5Xxguf_Tj,Contra el coronavirus. Cómo funciona y a quiénes se aplica el medicamento con el que trataron a Susana,https://www.clarin.com/buena-vida/tocilizumab-funciona-aplica-medicamento-trataron-susana_0_5Xxguf_Tj.html,https://images.clarin.com/2021/08/25/pHv15epCf_720x0__1.jpg
15,e0LDuvnMN,Previa caliente. El cruce entre Gustavo López y un streamer por las entradas VIP para ver a la Selección,https://www.clarin.com/deportes/entradas-vip-ver-seleccion-reclamo-gustavo-lopez-polemica-respuesta-streamer-coscu_0_e0LDuvnMN.html,https://images.clarin.com/2021/09/09/j0lNDUXBC_720x0__1.jpg
16,NF2dxHOMI,"Fer Palacio, con Clarín. El DJ que le pondrá música a la Selección: de ser maquinista de tren a remixear el fútbol",https://www.clarin.com/deportes/fer-palacio-dj-pondra-musica-seleccion-messi-maquinista-tren-sarmiento-remixear-futbol-argentino_0_NF2dxHOMI.html,https://images.clarin.com/2021/08/19/35ZpMNIEu_720x0__1.jpg
17,jImLxUG3n,"A tres días de las PASO. La justificación de AFIP para no querellar a Cristóbal López: ""La finalidad era persecución y hostigamientos""",https://www.clarin.com/politica/justificacion-afip-querellar-cristobal-lopez-finalidad-persecucion-hostigamientos-_0_jImLxUG3n.html,https://images.clarin.com/2019/07/03/VXwtc7l9v_720x0__1.jpg
18,fxFCspG6u,"""La casita en el cielo de Buenos Aires"". El chalet que mira al Obelisco y es uno de los misterios de la Ciudad",https://www.clarin.com/ciudades/-casita-cielo-buenos-aires-historia-chalet-mira-obelisco-misterios-ciudad_0_fxFCspG6u.html,https://images.clarin.com/2021/09/08/dxJ4dYtw2_720x0__1.jpg
19,OG-4a6f78,A 40 años de su muerte. Balbín: perfil definitivo del radical que inmortalizó una frase frente al ataúd de Perón,https://www.clarin.com/politica/40-anos-muerte-ricardo-balbin-perfil-definitivo-radical-inmortalizo-frase-frente-ataud-peron_0_OG-4a6f78.html,https://images.clarin.com/2017/10/25/rkEtaDCaZ_720x0.jpg
20,DaUbTO7to,Nueva normativa. Reforma laboral en Brasil: impulsan modalidades sin vacaciones ni aguinaldo,https://www.clarin.com/economia/reforma-laboral-brasil-impulsan-modalidades-empleo-vacaciones-aguinaldo_0_DaUbTO7to.html,https://images.clarin.com/2021/09/02/CGzMA8GQM_720x0__1.jpg
21,H5iWWegxr,"Piden precaución. Temporal en la Costa: clases suspendidas, voladuras de techo y caída de árboles",https://www.clarin.com/sociedad/temporal-costa-clases-suspendidas-voladuras-techo-caida-arboles_0_H5iWWegxr.html,https://images.clarin.com/2021/09/09/96qfOpjZc_720x0__1.jpg
22,i8o3f9uEq,"Por los pasillos. Alberto Fernández sin corbata, Pichichi ministeriable y el rush final de María Eugenia Vidal",https://www.clarin.com/politica/l_0_i8o3f9uEq.html,https://images.clarin.com/2021/09/08/MDDf6y5e1_1256x620__2.jpg#1631116038599
23,OvLXaHTqQ,Padrón electoral. Consultá en qué lugar votás en las PASO del domingo,https://www.clarin.com/politica/elecciones-2021-voto-consulto-padron-electoral-paso-_0_OvLXaHTqQ.html,https://images.clarin.com/2021/08/13/TItADFCK1_720x0__1.jpg
24,ZBinkt-e1,"Choque con Francia. Reino Unido quiere cambiar la ""ley del mar"" en las aguas más peligrosas del planeta",https://www.clarin.com/mundo/reino-unido-quiere-cambiar-ley-mar-aguas-peligrosas-planeta_0_ZBinkt-e1.html,https://images.clarin.com/2020/09/17/Zv1PufaP4_1256x620__2.jpg#1631198004841
25,bvKBMaDDe,"Placer y trabajo. Workation, una tendencia que crece a pasos agigantados en Argentina",https://www.clarin.com/viajes/workation-tendencia-crece-pasos-agigantados-argentina_0_bvKBMaDDe.html,https://images.clarin.com/2021/09/07/h3dAGJfXl_720x0__1.jpg
26,,Historias visuales. El Mundo en Fotos con las mejores imágenes de la actualidad,,
27,gft4M6hym,"Acto en La Plata. Al grito de ""vamos a volver"", Diego Santilli cerró su campaña: ""Hay que terminar con la improvisación""",https://www.clarin.com/politica/grito-vamos-volver-diego-santilli-cerro-campana-plata-terminar-relato-_0_gft4M6hym.html,https://images.clarin.com/2021/09/09/HlkJQVfPB_720x0__1.jpg
28,j2fq23ldQ,"Cierre de campaña. Alberto Fernández, contra JxC: ""Si van a hacer lo mismo que Macri, por favor no vuelvan""",https://www.clarin.com/politica/alberto-fernandez-apunto-juntos-cambio-dias-paso-van-hacer-mismo-mauricio-macri-favor-vuelvan-_0_j2fq23ldQ.html,https://images.clarin.com/2021/09/07/wQbDT9F2X_720x0__1.jpg
29,yTR_VfSM4,"Detrás de cámaras. ""¿Me estás cargando?"": el tenso cruce entre Santilli y Tolosa Paz en TV",https://www.clarin.com/politica/tenso-cruce-diego-santilli-victoria-tolosa-paz-aire_0_yTR_VfSM4.html,https://images.clarin.com/2021/09/09/cgNWQdPto_720x0__1.jpg
30,omDQLt0qb,"Recta final. La estimación del Frente de Todos en Provincia: caída del 20%, pero triunfo en las PASO",https://www.clarin.com/politica/ultimos-numeros-maneja-frente-provincia-caida-20-triunfo-paso_0_omDQLt0qb.html,https://images.clarin.com/2021/08/18/MoWw6lR2D_720x0__1.jpg
31,YDMQWfyl3,Nuevo ítem. Servicio doméstico: cómo calcular el pago adicional por antigüedad,https://www.clarin.com/servicios/servicio-domestico-calcular-pago-adicional-antiguedad_0_YDMQWfyl3.html,https://images.clarin.com/2021/09/08/glw6QNryk_720x0__1.jpg
32,M7wAOyXJU,Mercado cambiario. El dólar blue abre en $ 188 y marca un nuevo récord para el año,https://www.clarin.com/economia/dolar-blue-abre-188-marca-nuevo-record-ano_0_M7wAOyXJU.html,https://images.clarin.com/2021/03/22/VosNxnRmN_720x0__1.jpg
33,VtAWn4zBo,"Primera quincena de agosto. Venta de heladeras, lavarropas y aires: con el Ahora 12 ampliado aumentaron 16% las operaciones",https://www.clarin.com/economia/heladeras-lavarropas-aires-ahora-12-ampliado-genero-aumento-16-operaciones_0_VtAWn4zBo.html,https://images.clarin.com/2021/08/03/Vq2Mftj6w_720x0__1.jpg
34,JKb0I_ILT,Sueldos vs. inflación. Aumentos salariales 2022: cuáles son las subas que estiman dar las empresas,https://www.clarin.com/economia/aumentos-salariales-2022-empresas-preven-dar-42-promedio-apenas-debajo-ano_0_JKb0I_ILT.html,https://images.clarin.com/2021/03/26/Zxgj5V2Hv_720x0__1.jpg
35,cOZimaRE7,"Desconfianza. Por la inflación y el dólar, hace 20 años que caen los depósitos de largo plazo",https://www.clarin.com/economia/inflacion-suba-dolar-hace-20-anos-caen-depositos-largo-plazo_0_cOZimaRE7.html,https://images.clarin.com/2021/02/10/BHMff5txk_720x0__3.jpg#1631202043149
36,2mk9wutgH,Mercado de deuda. Guzmán le pidió ayuda al Banco Nación para evitar otro traspié con los bonos,https://www.clarin.com/economia/guzman-pidio-ayuda-banco-nacion-evitar-traspie-bonos_0_2mk9wutgH.html,https://images.clarin.com/2021/09/06/vy2-AGq5X_720x0__1.jpg
37,XwE_1e74I,"Comercio exterior. Exportaciones estancadas, la advertencia de un documento oficial",https://www.clarin.com/economia/dura-advertencia-documento-oficial-exportaciones-estancadas-basadas-productos-campo_0_XwE_1e74I.html,https://images.clarin.com/2021/04/09/GkmWqSJJI_720x0__1.jpg
38,iOj-aDs3I,En julio. Trabajadores formales volvieron a ganarle a la inflación,https://www.clarin.com/economia/julio-salarios-trabajadores-formales-volvieron-ganarle-inflacion_0_iOj-aDs3I.html,https://images.clarin.com/2021/03/30/km7rgS_KY_720x0__1.jpg
39,TBUgA4mIr,"Meditación. ¿De qué están hechas las emociones? claves para comprenderlas y ""catarlas""",https://www.clarin.com/buena-vida/-hechas-emociones-claves-comprenderlas-catarlas-_0_TBUgA4mIr.html,https://images.clarin.com/2021/09/08/vtksfTDZQ_720x0__1.jpg
40,7e9X04lGs,Consolas. PlayStation Showcase: qué juegos se esperan en el nuevo evento virtual,https://www.clarin.com/tecnologia/playstation-showcase-juegos-esperan-nuevo-evento-virtual_0_7e9X04lGs.html,https://images.clarin.com/2021/09/08/YPuwTcyI2_1256x620__2.jpg#1631189553699
41,XwWes0nGJ,Anticipo. Se filtraron los anteojos de Ray-Ban que hizo Facebook: así funcionarán,https://www.clarin.com/tecnologia/filtraron-anteojos-ray-ban-hizo-facebook-funcionaran_0_XwWes0nGJ.html,https://images.clarin.com/2021/09/09/QzjjPYvvu_720x0__1.jpg
42,VJlxxSaG0,"Egipto. Cómo es el Templo de Karnak, el complejo faraónico más grande de Egipto",https://www.clarin.com/viajes/templo-karnak-complejo-faraonico-grande-egipto_0_VJlxxSaG0.html,https://images.clarin.com/2021/09/08/WvUkEOPKm_720x0__1.jpg
43,kUdIzAzcD,Test drive. Mustang Mach 1: cómo anda el Ford más potente de la Argentina,https://www.clarin.com/autos/analisis-mustang-mach-1-anda-ford-potente-argentina_0_kUdIzAzcD.html,https://images.clarin.com/2021/09/09/_Ai0RU2Pq_720x0__1.jpg
44,D-S1hSkCZ,Siembra. Huerta urbana: cuáles son los errores más frecuentes,https://www.clarin.com/familias/huerta-urbana-errores-frecuentes_0_D-S1hSkCZ.html,https://images.clarin.com/2021/09/08/tQFfv874M_720x0__1.jpg
45,lJ6DYahjK,"""Flashdance"". La historia de las dobles de Jennifer Beals, actriz que triunfó sin bailar",https://www.clarin.com/internacional/espectaculos/-flashdance-historia-dobles-jennifer-beals-actriz-triunfo-bailar_0_lJ6DYahjK.html,https://images.clarin.com/2021/09/08/B0bMK8UNU_720x0__1.jpg
46,swghgP5M3,"Imagine. el himno pacifista de Lennon cumple 50 años: poesía, utopía, un gesto machista y... ¿plagio?",https://www.clarin.com/espectaculos/musica/imagine-himno-pacifista-cumple-50-anos-poesia-utopia-acto-machismo-plagio-_0_swghgP5M3.html,https://images.clarin.com/2021/09/08/gRDbUmm-__1256x620__2.jpg#1631144434834
47,_jsAk_Hyy,"Crítica. Maligno, entre la fascinación y el Naaahh, ¿en serio?",https://www.clarin.com/espectaculos/cine/maligno-fascinacion-naaahh-serio-_0__jsAk_Hyy.html,https://images.clarin.com/2021/09/08/6HkHHOXal_720x0__1.jpg
48,eNrm0KO9-,Llega el 23 de diciembre. The Matrix Resurrections: todo lo que cuenta el trailer,https://www.clarin.com/espectaculos/cine/the-matrix-resurrections-cuenta-trailer_0_eNrm0KO9-.html,https://images.clarin.com/2021/09/09/qss3KtioA_720x0__1.jpg
49,CC4zGiNvs,Qué dicen. Numerología: qué significa cada número según las fuerzas espirituales,https://www.clarin.com/astrologia/numerologia-que-significa-cada-numero-segun-las-fuerzas-espirituales_0_CC4zGiNvs.html,https://images.clarin.com/2021/09/09/HiIKFXwPm_720x0__1.jpg
50,pPwSscu91,Tailandia. Fue a tomar una cerveza a un bar y terminó perdido en la jungla por cuatro días,https://www.clarin.com/viste/jubilado-tomar-cerveza-bar-termino-perdido-jungla-tailandesa-dias_0_pPwSscu91.html,https://images.clarin.com/2021/09/08/PzryXUon__720x0__1.jpg
51,REgAuiIQu,"Fórmula premium. Diesel Premium del futuro, para motores cada vez más evolucionados",https://www.clarin.com/brand-studio/diesel-premium-futuro-motores-vez-evolucionados_0_REgAuiIQu.html,https://images.clarin.com/2021/09/01/aW9e2wYZW_720x0__1.jpg
52,UGPxmUaq7,"Comercio exterior. A China, sin escalas: todo sobre el pabellón argentino del ICBC Mall China",https://www.clarin.com/brandstudio/china-escalas-pabellon-argentino-icbc-mall-china_0_UGPxmUaq7.html,https://images.clarin.com/2021/09/06/iAuRpY2NE_720x0__1.jpg
53,jnOuEb5Uc,Fragancia única. Phantom aterrizó en Buenos Aires con un impactante show en el Planetario,https://www.clarin.com/brandstudio/phantom-aterrizo-buenos-aires-impactante-show-planetario_0_jnOuEb5Uc.html,https://images.clarin.com/2021/09/08/1zCIi_C5Z_1256x620__2.jpg#1631123040488
54,CweZBUEiw,Secretos útiles. Cómo cocinar una verdadera pizza a la piedra en solo 3 minutos,https://www.clarin.com/brandstudio/cocinar-verdadera-pizza-piedra-solo-3-minutos_0_CweZBUEiw.html,https://images.clarin.com/2021/09/07/1A26NQQ7B_1256x620__2.jpg#1631025013306
55,nAjesb0zK,Opinión. ¿Qué viene después de la guerra contra el terrorismo? ¿La guerra contra China?,https://www.clarin.com/new-york-times-international-weekly/-viene-despues-guerra-terrorismo-guerra-china-_0_nAjesb0zK.html,https://images.clarin.com/2021/09/08/4yBKqCOgr_1256x620__2.jpg#1631109162650
56,ecJmrgsmM,Hallazgo. La pérdida de la visión puede afectar al cerebro,https://www.clarin.com/new-york-times-international-weekly/perdida-vision-puede-afectar-cerebro_0_ecJmrgsmM.html,https://images.clarin.com/2021/09/08/eSTFSgODm_1256x620__2.jpg#1631127089736
57,QRDBCXGVo,Conservación. Con ADN y algo de suerte buscan reunir a una elefanta huérfana con su madre,https://www.clarin.com/new-york-times-international-weekly/adn-suerte-buscan-reunir-elefanta-huerfana-madre_0_QRDBCXGVo.html,https://images.clarin.com/2021/09/08/zK-uD6F49_1256x620__2.jpg#1631126017375
58,vfn53BUl-,Legado del 11-S. La policía de Nueva York usa recursos antiterroristas contra la delincuencia,https://www.clarin.com/new-york-times-international-weekly/policia-nueva-york-usa-recursos-antiterroristas-delincuencia_0_vfn53BUl-.html,https://images.clarin.com/2021/01/25/iBRjRAzSW_720x0__1.jpg
59,Qksjszgnhw,Inseguridad. Video: así se roban los autos de las calles del Conurbano con una grúa trucha,https://www.clarin.com/zonales/video-mira-roban-autos-calles-conurbano-grua-trucha_0_Qksjszgnhw.html,https://images.clarin.com/2021/09/06/yOYxQ3vqo_720x0__1.jpg
60,CpafXNMwT,"Porteño y conurbano. Fileteador de colectivos, un arte simétrico y de colores fuertes que de a poco resurge del olvido",https://www.clarin.com/zonales/fileteador-colectivos-arte-punto-extinguirse-empieza-resurgir_0_CpafXNMwT.html,https://images.clarin.com/2021/08/11/90t7OJbk3_720x0__1.jpg
61,r_E6iEMBE,Un año sin funcionar. Reabrirán un paseo de compras del GBA que no había resistido la cuarentena,https://www.clarin.com/zonales/vuelve-tradicional-feria-ituzaingo-resistio-cuarentena-2020_0_r_E6iEMBE.html,https://images.clarin.com/2021/08/31/LcsHUKuoS_720x0__1.jpg
62,VDmocd7nQ,"Arrabalera del GBA. El tango también se baila sola, sobre todo en pandemia: ""A veces pongo música y arranco""",https://www.clarin.com/zonales/milena-plebs-poder-volver-bailar-gloria-cosas-valoran-pierden-_0_VDmocd7nQ.html,https://images.clarin.com/2021/08/27/1ZrxMwgSH_1256x620__2.jpg#1630102530361
63,FX8vnzQiW,¡Parece otra! . Martita Fort se hizo un impactante cambio de look para grabar la serie sobre su padre,https://www.clarin.com/fama/-parece-martita-fort-hizo-impactante-cambio-look-grabar-serie-papa_0_FX8vnzQiW.html,https://images.clarin.com/2021/09/09/yZg1FAvwn_720x0__1.jpg
64,PLAVYpd4C,Escándalo inesperado. Denuncian a Cinthia Fernández por la canción que bailó en portaligas frente al Congreso,https://www.clarin.com/fama/denuncian-cinthia-fernandez-cancion-bailo-portaligas-frente-congreso_0_PLAVYpd4C.html,https://images.clarin.com/2021/09/09/0wtfKzpfr_720x0__1.jpg
65,RU8GIxLaj,Está en estado crítico. Crece el drama de Ana Rosenfeld: confirman que su marido tuvo la variante Delta,https://www.clarin.com/fama/crece-drama-ana-rosenfeld-confirman-marido-variante-delta-critico_0_RU8GIxLaj.html,https://images.clarin.com/2020/04/30/RhzE9xLq2_720x0__1.jpg
66,zOB8eS-65,La mandó al frente. Marley mostró la insólita foto que Lali Espósito tiene en WhatsApp,https://www.clarin.com/fama/marley-mostro-foto-sexy-lali-esposito-whatsapp_0_zOB8eS-65.html,https://images.clarin.com/2021/09/08/3HBMjGF7U_720x0__1.jpg
67,sz0VadlW8,"Covid y relaciones. Abrazar o no abrazar: con vacuna, el saludo se relaja y aparecen burbujas flexibles",https://www.clarin.com/sociedad/abrazar-abrazar-vacuna-saludo-relaja-habla-burbujas-flexibles_0_sz0VadlW8.html,https://images.clarin.com/2020/11/14/wAiXzf5S8_1256x620__2.jpg#1631128052171
68,SCJUP911l,"Grave denuncia. La hija de la mujer desaparecida en Río Gallegos: ""El tema de los dólares me da miedo""",https://www.clarin.com/politica/hablo-hija-mujer-desaparecida-rio-gallegos-tema-dolares-da-miedo-_0_SCJUP911l.html,https://images.clarin.com/2021/09/03/2QyGMd6t8_720x0__1.jpg
69,0-W36BtrX,Precios en dólares. Punta del Este: cuánto costará alquilar departamentos y casas para el verano 2022,https://www.clarin.com/servicios/punta-costara-alquilar-departamentos-casas-verano-2022_0_0-W36BtrX.html,https://images.clarin.com/2020/09/14/P3Tm_Ib28_720x0__1.jpg
70,S6Q_w0aqS,"Señales preelectorales. Empleo, consumo, inflación y salarios: cómo están los cuatro datos claves antes de las PASO",https://www.clarin.com/economia/empleo-consumo-inflacion-salarios-datos-claves-paso_0_S6Q_w0aqS.html,https://images.clarin.com/2021/09/09/Kb-LTMcKu_720x0__1.jpg
71,sR_xbLpUK,Especial Clarín. La inquietante trama de las 12 narcovalijas en la embajada rusa,https://www.clarin.com/policiales/espias-diplomaticos-policias-inquietante-trama-12-narcovalijas-embajada-rusa_0_sR_xbLpUK.html,https://images.clarin.com/2021/09/02/Wt5VOz0v2_720x0__1.jpg
72,R8yXCE_RH,"Delitos en alza. Cómo  son las ciberestafas que llegan por Whatsapp, Facebook o Instagram",https://www.clarin.com/tecnologia/puede-pasar-estafas-whatsapp-facebook-instagram_0_R8yXCE_RH.html,https://images.clarin.com/2021/09/02/ncCHIb4BU_720x0__1.jpg
73,ROYjGBIxk,Tesoro oculto en el Delta. Mil millones de abejas que subieron a la Argentina al podio mundial de la miel,https://www.clarin.com/zonales/mil-millones-abejas-subieron-argentina-podio-mundial-miel_0_ROYjGBIxk.html,https://images.clarin.com/2021/08/27/QGv5mjUft_720x0__1.jpg
74,j5owUSw_W,En alza. Criptomonedas: ¿cuánta plata se puede ganar con una PC desde el living de casa?,https://www.clarin.com/especiales/criptomonedas-plata-puede-ganar-pc-living-casa-_0_j5owUSw_W.html,https://images.clarin.com/2021/08/16/SZDgaDM6F_720x0__1.jpg
75,nLkI_EbdH,Jagger vs. McCartney. Cuál es la verdad sobre la grieta entre los Beatles y los Rolling Stones,https://www.clarin.com/espectaculos/beatles-vs-rolling-stones-grieta-existio-sigue-abierta_0_nLkI_EbdH.html,https://images.clarin.com/2021/08/30/PyFd0KEYI_720x0__1.jpg
76,2REfCx6lT,Otra vez colapsó el sistema. Furor de madrugada por la Selección: se agotó un remanente de entradas,https://www.clarin.com/deportes/furor-madrugada-seleccion-agoto-remanente-entradas-vez-colapso-sistema_0_2REfCx6lT.html,https://images.clarin.com/2021/09/09/xyj8f06kr_720x0__1.jpg
77,jrun7ztJV,Cambio de mando. El trotamundos que será el sucesor de Oveja Hernández en la Selección de básquet,https://www.clarin.com/deportes/seleccion-basquet-sucesor-oveja-hernandez-banco-nestor-che-garcia_0_jrun7ztJV.html,https://images.clarin.com/2018/11/09/xpXJrOQoM_720x0__1.jpg
78,WpAAyGqxx,"Exclusivo para Clarín. A Fernández y Raducanu, las jóvenes maravilla del US Open, les toca ahora lo más difícil",https://www.clarin.com/deportes/leylah-fernandez-emma-raducanu-jovenes-maravilla-us-open-toca-ahora-dificil_0_WpAAyGqxx.html,https://images.clarin.com/2021/09/09/_W5vSVo2O_720x0__1.jpg
79,aSCTB-kQc,"Promesa del tenis argentino. Solana Sierra, la chica de 17 años que avanza entre las juniors en el US Open",https://www.clarin.com/deportes/solana-sierra-chica-17-anos-avanza-us-open-grandes-promesas-tenis-argentino_0_aSCTB-kQc.html,https://images.clarin.com/2021/09/08/Md80Z_uO0_1256x620__2.jpg#1631136531771
80,63D8wXLPB,"NFL. Comienza la temporada, con polémica por las vacunas y Tom Brady en el inicio",https://www.clarin.com/deportes/comienza-temporada-2021-nfl-polemica-vacunas-tom-brady-partido-inaugural_0_63D8wXLPB.html,https://images.clarin.com/2021/02/08/SUbjDe8Uh_1256x620__3.jpg#1631144251649
81,w93fq5ZBA,Carlo Ancelotti. El experto en administrar estrellas va por un ciclo glorioso con el Real Madrid,https://www.clarin.com/deportes/futbol/carlo-ancelotti-experto-administrar-estrellas-va-nuevo_0_w93fq5ZBA.html,https://images.clarin.com/2021/09/04/D2IEaJpJj_1256x620__2.jpg#1631147755807
