n,id,title,url,image
1,hDqa4oxqj,"El mismo día que el kiosquero. Otro asesinato en La Matanza: hizo una reunión contra la inseguridad y los narcos, y lo acribillaron a balazos",https://www.clarin.com/policiales/hizo-reunion-inseguridad-narco-barrio-matanza-horas-acribillaron-balazos_0_hDqa4oxqj.html,https://images.clarin.com/2021/11/10/aUv8EHDjX_1256x620__2.jpg#1636560925941
2,fZpE6aHfw,En Bariloche. La Justicia anuló una decisión del Gobierno que le reconocía varias hectáreas a mapuches,https://www.clarin.com/sociedad/justicia-anulo-resolucion-gobierno-reconocia-propiedad-varias-hectareas-mapuches-bariloche_0_fZpE6aHfw.html,https://images.clarin.com/2021/11/10/zP5QICdPw_720x0__1.jpg
3,QT2TSdZKI,Tensión cambiaria. El dólar blue ya pasó los $ 200 y marca un nuevo récord,https://www.clarin.com/economia/dolar-blue-sube-201-marca-nuevo-record_0_QT2TSdZKI.html,https://images.clarin.com/2021/04/22/w2IQovzeJ_720x0__1.jpg
4,NNKkvgjSy,Cifras de delitos. Vidal cruzó a Kicillof por los datos de inseguridad,https://www.clarin.com/politica/vidal-cruzo-kicillof-datos-inseguridad-mismo-gobierno-intervino-indec-gustaba-cifras-_0_NNKkvgjSy.html,https://images.clarin.com/2021/10/14/QQVb4PszE_720x0__1.jpg
5,PNYpqfmRf,Finanzas personales. Cómo invertir pesos en Mercado Libre y ganar en dólares,https://www.clarin.com/servicios/invertir-pesos-mercado-libre-ganar-dolares_0_PNYpqfmRf.html,https://images.clarin.com/2020/08/17/U9cIo3ojS_720x0__1.jpg
6,8nDs8lJOZ,El asesinato del kiosquero.  Historias de vecinos de Ramos Mejía con miedo a morir en un robo,https://www.clarin.com/policiales/historias-vecinos-ramos-mejia-miedo-diario-morir-robo_0_8nDs8lJOZ.html,https://images.clarin.com/2021/11/10/B_wrQ4MfH_1256x620__2.jpg#1636567590204
7,VNTP4zb0S,Crimen en Ramos Mejía. Los gestos de Ponzio y Juanfer Quintero con la familia del kiosquero asesinado,https://www.clarin.com/policiales/gesto-idolo-river-familia-kiosquero-asesinado-ramos-mejia_0_VNTP4zb0S.html,https://images.clarin.com/2021/11/10/NLxyZdj-a_720x0__1.jpg
8,2I3KxRjVc,En todo el país. El Gobierno acordó aplicar la tercera dosis a personal de salud y mayores de 70 años,https://www.clarin.com/sociedad/gobierno-acordo-aplicar-tercera-dosis-personal-salud-mayores-70-anos-pais_0_2I3KxRjVc.html,https://images.clarin.com/2021/11/10/ZHJMftIkj_720x0__1.jpg
9,mVYipWIr2,"Se dijeron de todo. Terrible cruce entre Lavolpe y Ruggeri al aire de ESPN: ""¡No tenés códigos, vos!""",https://www.clarin.com/deportes/terrible-cruce-ricardo-lavolpe-oscar-ruggeri-aire-espn-tenes-codigos-vos-_0_mVYipWIr2.html,https://images.clarin.com/2021/11/10/BjeK_0B_2_720x0__1.jpg
10,Rl3ycRL2d,"Codecop. Se paralizó la transportadora de caudales del financista de Radio Del Plata, tras el robo de más de $1.000 millones",https://www.clarin.com/politica/quedo-paralizada-transportadora-caudales-financista-radio-plata-robo-1-000-millones_0_Rl3ycRL2d.html,https://images.clarin.com/2021/11/02/xA0vot_uc_720x0__1.jpg
11,ccpCmYJQJ,Duro desde redes. Feinmann cruzó a Karina luego de la polémica por un recital en La Matanza,https://www.clarin.com/fama/eduardo-feinmann-cruzo-karina-princesita-polemica-recital-matanza_0_ccpCmYJQJ.html,https://images.clarin.com/2021/11/10/7fLi2rnrV_720x0__1.jpg
12,BVqv3rN_F,En Instragram. El reflexivo mensaje de Dulko tras la escandalosa separación de Fernando Gago,https://www.clarin.com/fama/gisela-dulko-anuncio-dejo-fernando-gago-contundente-mensaje_0_BVqv3rN_F.html,https://images.clarin.com/2021/11/10/wCGivWu_k_720x0__1.jpg
13,G8Vj0GihT,Post elecciones. Se termina el congelamiento en las naftas: habrá subas el próximo mes,https://www.clarin.com/economia/termina-congelamiento-naftas-subas-proximos-meses_0_G8Vj0GihT.html,https://images.clarin.com/2021/05/17/zd3N8mPW3_720x0__1.jpg
14,_i1m8qu2H,Tributo. Cómo fue el recorrido del cortejo que homenajeó a Fangio en Balcarce,https://www.clarin.com/deportes/tributo-fangio-recorrido-cortejo-calles-balcarce-lugares-detendra_0__i1m8qu2H.html,https://images.clarin.com/2015/12/09/Hkb2UdxEl_720x0.jpg
15,iJbL2xdAZ,Corrientes. Hallan muerto al adolescente de 18 años que se tiró al río Paraná escapando de policías,https://www.clarin.com/policiales/encuentran-muerto-adolescente-18-anos-tiro-rio-escapando-policias-corrientes_0_iJbL2xdAZ.html,https://images.clarin.com/2021/11/10/sgSgl8-YL_720x0__1.jpg
16,_x4jLqg6u,"La campaña, minuto a minuto. El inesperado cruce entre Tetaz y Milei por la mesa de Mirtha Legrand",https://www.clarin.com/politica/elecciones-2021-minuto-minuto-respuesta-bullrich-anibal-fernandez-karaoke-alfredo-cornejo_0__x4jLqg6u.html,https://images.clarin.com/2021/11/10/oRi173klW_720x0__1.jpg
17,uda5x8lGh,Detección precoz. Síntomas del cáncer de páncreas: conocerlos para llegar antes al diagnóstico,https://www.clarin.com/buena-vida/sintomas-cancer-pancreas-estimulan-conocerlos-llegar-diagnostico_0_uda5x8lGh.html,https://images.clarin.com/2021/11/09/UR4WRAv20_720x0__1.jpg
18,9kBrtLdFl,La verdad de su pelea. Maradona y Jorge Cyterszpiler: los chispazos con Claudia y su pacto secreto,https://www.clarin.com/deportes/historia-ruptura-maradona-jorge-cyterszpiler-chispazos-claudia-pacto-secreto_0_9kBrtLdFl.html,https://images.clarin.com/2017/05/07/HyPK6xpy-_1256x620__2.jpg#1636480411761
19,4ymJ2uqkt,Especial Clarín. Se fue de La Plata para ser actriz y ahora es la mujer más poderosa de Hollywood,https://www.clarin.com/espectaculos/cine/victoria-alonso-historia-argentina-mujer-poderosa-hollywood_0_4ymJ2uqkt.html,https://images.clarin.com/2021/11/09/2vfL1S0eT_720x0__1.jpg
20,NGGJITrwT,"Crece la polémica. Escándalo en Grey’s Anatomy: tras los abusos, ahora revelan violencia física y racismo",https://www.clarin.com/internacional/espectaculos/anatomia-grey-isaiah-washington-revelo-patrick-dempsey-golpeo-veces-racista_0_NGGJITrwT.html,https://images.clarin.com/2021/11/09/ZIIIaQcWL_720x0__1.jpg
21,yprbAeji7,Rumbo a Qatar. Qué necesita la Selección para clasificar al Mundial en esta doble fecha de Eliminatorias,https://www.clarin.com/deportes/necesita-seleccion-argentina-clasificar-mundial-doble-fecha-eliminatorias_0_yprbAeji7.html,https://images.clarin.com/2021/11/10/xqMkSCtn6_720x0__1.jpg
22,oce0vGS6x,La pandemia. Pfizer y Sinopharm para chicos: 10 claves sobre las diferencias y un dato decisivo,https://www.clarin.com/sociedad/pfizer-sinopharm-chicos-10-claves-diferencias-vacunas-dato-decisivo_0_oce0vGS6x.html,https://images.clarin.com/2021/11/09/1GFJqRTj5_720x0__1.jpg
23,frPPoFB_P,"Cuánto pagaron. Subastaron a Wilson, la pelota de vóley que acompañó a Tom Hanks en Náufrago",https://www.clarin.com/espectaculos/cine/subastaron-wilson-pelota-voley-acompano-tom-hanks-naufrago-pagaron_0_frPPoFB_P.html,https://images.clarin.com/2020/03/21/pw_UHspsa_720x0__1.jpg
24,cTzHqTZ8N,"Ceremonia en el Luna Park. Todos los ganadores de los Martín Fierro de Cable, con dos estatuillas de oro",https://www.clarin.com/espectaculos/tv/martin-fierro-cable-ganadores-mejor-2019-2020_0_cTzHqTZ8N.html,https://images.clarin.com/2021/11/09/B8rocBAjV_720x0__1.jpg
25,cP8oTqku9,"""La princesa de las noticias"". Mafias y pedofilia VIP: el crimen de la periodista estrella de la BBC",https://www.clarin.com/internacional/-princesa-noticias-misterioso-asesinato-periodista-estrella-bbc_0_cP8oTqku9.html,https://images.clarin.com/2021/11/09/THFNTaDRk_720x0__1.jpg
26,5vzo02-KV,Mercado cambiario. Dólar: las distintas cotizaciones subieron entre 18% y 45% en lo que va del año,https://www.clarin.com/economia/dolar-hoy-distintas-cotizaciones-subieron-18-45-va-ano_0_5vzo02-KV.html,https://images.clarin.com/2021/10/31/ywFagLM21_720x0__1.jpg
27,muKcwtmTb,Renovación a medias. Aerolíneas reemplaza dos Airbus de más de 20 años por otros de 13 y 14 años,https://www.clarin.com/economia/renovacion-medias-aerolineas-reemplaza-airbus-20-anos-13-14-anos_0_muKcwtmTb.html,https://images.clarin.com/2021/11/03/omfbaKMlW_720x0__1.jpg
28,d377Hxlkc,Sistema mixto. Bancos: qué tener en cuenta a la hora de ir a una sucursal sin turno previo,https://www.clarin.com/economia/bancos-tener-cuenta-hora-ir-sucursal-turno-previo_0_d377Hxlkc.html,https://images.clarin.com/2020/12/10/KNGEdO7VU_720x0__1.jpg
29,fnHQR-Etu,Pelea contra la inflación. Feletti presiona para que precios congelados llegue a almacenes y quioscos,https://www.clarin.com/economia/feletti-presiona-precios-congelados-llegue-almacenes-quioscos_0_fnHQR-Etu.html,https://images.clarin.com/2021/11/09/rUO3LpXmF_720x0__1.jpg
30,SZPltVcIh,Rivian. La automotriz respaldada por Amazon que quiere desbancar a Tesla,https://www.clarin.com/economia/rivian-automotriz-respaldada-amazon-quiere-desbancar-tesla_0_SZPltVcIh.html,https://images.clarin.com/2021/06/28/tjMxS1WWE_720x0__1.jpg
31,EXEN4lv86,Construcción. Saint Gobain invierte US$ 214 millones para sustituir importaciones,https://www.clarin.com/economia/saint-gobain-invierte-us-214-millones-fabricacion-vidrio-plano_0_EXEN4lv86.html,https://images.clarin.com/2017/10/11/H12wxCi3b_720x0.jpg
32,smomJXI_b,Windows 11 SE. Microsoft presentó el sistema operativo para la escuela,https://www.clarin.com/tecnologia/windows-11-microsoft-presento-sistema-operativo-escuela-competir-chromebooks_0_smomJXI_b.html,https://images.clarin.com/2021/11/10/MDUPal62H_720x0__1.jpg
33,XBB2KiR0g,Platos para ahorrar. 30 recetas fáciles y económicas para comer rico y cuidar el bolsillo,https://www.clarin.com/gourmet/30-recetas-faciles-economicas_0_XBB2KiR0g.html,https://images.clarin.com/2020/02/25/sl7YH0U1_720x0__1.jpg
34,WV5Zddvvli,"Contra el maltrato. YouTube elimina el recuento de los ""No me gusta"": cómo será el nuevo sistema",https://www.clarin.com/tecnologia/youtube-decide-eliminar-recuento-gusta-vera-dislike-videos_0_WV5Zddvvli.html,https://images.clarin.com/2021/09/30/SkQ0pBFG5_720x0__1.jpg
35,r7UQLB3Ix,Plan de Turismo Social. Cómo inscribirse y disfrutar del verano en Chapadmalal y Embalse,https://www.clarin.com/viajes/inscribirse-plan-turismo-social-disfrutar-verano-chapadmalal-embalse_0_r7UQLB3Ix.html,https://images.clarin.com/2021/11/09/oNvl-Zt8w_720x0__1.jpg
36,b5bAwll5U,Precios y horarios. Salen a la venta los pasajes de tren a Córdoba y Rosario para el verano,https://www.clarin.com/viajes/salen-venta-pasajes-tren-cordoba-rosario-verano-precios-horarios_0_b5bAwll5U.html,https://images.clarin.com/2021/11/09/e4mpEQHb4_720x0__1.jpg
37,m0Xad2KUO,Mensajería. WhatsApp: cómo activar los nuevos emojis gratuitos,https://www.clarin.com/tecnologia/whatsapp-activar-nuevos-emojis-gratuitos_0_m0Xad2KUO.html,https://images.clarin.com/2017/12/19/SJkPcRUzz_720x0.jpg
38,,A cielo abierto. Trepar rascacielos es la nueva atracción de Nueva York para amantes de las alturas,,
39,htZ3BA6cP,Reino Unido. Profesora sedujo a su alumno de 15 años por Snapchat y abusó sexualmente de él,https://www.clarin.com/viste/profesora-sedujo-alumno-15-anos-snapchat-abuso-sexualmente_0_htZ3BA6cP.html,https://images.clarin.com/2021/11/10/LWV9Bt-1a_720x0__1.jpg
40,tKUIyXJ5h,Ya afectó al 85%. Los koalas van rumbo a la muerte por una enfermedad de transmisión sexual,https://www.clarin.com/viste/koalas-van-rumbo-muerte-enfermedad-transmision-sexual_0_tKUIyXJ5h.html,https://images.clarin.com/2021/02/12/15EweBNZt_720x0__1.jpg
41,iNSEo0BFt,Anuncio inesperado. Foo Fighters va en camino a convertirse en una banda de terror,https://www.clarin.com/espectaculos/musica/foo-fighters-va-camino-convertirse-banda-terror_0_iNSEo0BFt.html,https://images.clarin.com/2021/11/09/QlxcOLJEG_1256x620__2.jpg#1636549773941
42,HACK2BmE2,Tendencias. De vacaciones en Tiny Houses: cómo son y cuánto cuesta pasar la noche,https://www.clarin.com/viajes/vacaciones-tiny-houses-cuesta-pasar-noche_0_HACK2BmE2.html,https://images.clarin.com/2021/11/08/GSDSsPpy__720x0__1.jpg
43,T_Tewax4_,Lunar y solar. Eclipses de fin de año: cuándo serán y cuáles serán sus influencias,https://www.clarin.com/astrologia/eclipses-fin-ano-influencias_0_T_Tewax4_.html,https://images.clarin.com/2021/11/09/nG3i6_LVM_720x0__1.jpg
44,hz7h2oyzsM,Historias visuales. Las mejores 102 imágenes de hoy en la Argentina y el mundo,https://www.clarin.com/fotogalerias/dia-fotos-mejores-imagenes-argentina-mundo_5_hz7h2oyzsM.html,
45,,Deportivo amplio y versátil. Llegó a nuestro país un nuevo modelo de MINI,,
46,-GQlzsAor,"Tecnología y deporte. Ultralivianas y flexibles, así son las primeras zapatillas de FILA con placa de carbono",https://www.clarin.com/brandstudio/ultralivianas-flexibles-primeras-zapatillas-fila-placa-carbono_0_-GQlzsAor.html,https://images.clarin.com/2021/11/05/ZvBB4eHDZ_720x0__1.jpg
47,rOjIr7nIX,Enfoque. El mundo entero aborda el tren rápido del desarrollo de China,https://www.clarin.com/brandstudio/mundo-entero-aborda-tren-rapido-desarrollo-china_0_rOjIr7nIX.html,https://images.clarin.com/2021/11/09/fwX9Iizfq_720x0__1.jpg
48,Kg6LLQAhh,"Estrategias comerciales. Educación virtual y digitalización, claves para la recuperación de los comercios de barrio",https://www.clarin.com/brandstudio/educacion-virtual-digitalizacion-claves-recuperacion-comercios-barrio_0_Kg6LLQAhh.html,https://images.clarin.com/2021/11/04/fVLPG71LB_720x0__1.jpg
49,9XHpcaD0l,"La Ruta Natural. Una invitación a conocer la Argentina más increíble, de punta a punta",https://www.clarin.com/brandstudio/ruta-natural-invitacion-conocer-argentina-increible-punta-punta_0_9XHpcaD0l.html,https://images.clarin.com/2021/11/05/EbuOlNCp-_720x0__1.jpg
50,5jIcAvDUk,Historias reales. Conocé el curso digital y gratuito que ayuda a pequeños comercios a salir adelante,https://www.clarin.com/brandstudio/conoce-curso-digital-gratuito-ayuda-pequenos-comercios-salir-adelante_0_5jIcAvDUk.html,https://images.clarin.com/2021/11/03/S0M5iLQf8_720x0__1.jpg
51,bVibPBSaL,Nuevo estudio. La Antártida fue una vez una tierra de fuego y no de hielo,https://www.clarin.com/new-york-times-international-weekly/antartida-vez-tierra-fuego-hielo_0_bVibPBSaL.html,https://images.clarin.com/2021/11/08/SpOP5LWls_1256x620__3.jpg#1636394794866
52,CqkKU6m5G,"Psicología. ¿Sos ansioso, evitativo o seguro?",https://www.clarin.com/new-york-times-international-weekly/-sos-ansioso-evitativo-seguro-_0_CqkKU6m5G.html,https://images.clarin.com/2021/11/08/2uZMNvefw_720x0__1.jpg
53,EjYrvbkjw,Pilotos afganos. En la clandestinidad y abandonados por EE.UU.,https://www.clarin.com/new-york-times-international-weekly/pilotos-militares-afganos-fuga-sienten-abandonados-ee-uu-_0_EjYrvbkjw.html,https://images.clarin.com/2021/11/08/fAyuXLD3__1256x620__2.jpg#1636397068141
54,kzQJ16Zfj,Terapia. Cuando los alimentos indígenas forman parte del plan de curación,https://www.clarin.com/new-york-times-international-weekly/alimentos-indigenas-forman-parte-plan-curacion_0_kzQJ16Zfj.html,https://images.clarin.com/2021/11/09/MDabIUsLF_720x0__1.jpg
55,Fcd81Z1fF,Crimen del kiosquero. Qué pidieron los comerciantes de Ramos Mejía en su acalorada reunión con Berni,https://www.clarin.com/zonales/crimen-kiosquero-pidieron-comerciantes-ramos-mejia-acalorada-reunion-sergio-berni_0_Fcd81Z1fF.html,https://images.clarin.com/2021/11/07/0Lo7n3dAt_720x0__1.jpg
56,necEb9Lx8,Operada sólo por mujeres. Ya reciben basura en la primera planta de reciclaje de San Fernando,https://www.clarin.com/zonales/reciben-basura-primera-planta-reciclaje-san-fernando-operada-solo-mujeres_0_necEb9Lx8.html,https://images.clarin.com/2021/11/02/nbu_dcNMH_720x0__1.jpg
57,6EBj_11Rq,La idea ganó un concurso. Su compañera de 15 quedó embarazada y crearon una App de educación sexual ,https://www.clarin.com/zonales/companera-15-quedo-embarazada-crearon-app-educacion-sexual-gano-concurso_0_6EBj_11Rq.html,https://images.clarin.com/2021/11/02/9mSH2bZYC_1256x620__2.jpg#1636056820571
58,c73hO_T86,"Lo organiza una ONG. Tras conocer la fecha del juicio, harán un torneo de fútbol en homenaje a Báez Sosa",https://www.clarin.com/zonales/conocerse-fecha-juicio-rugbiers-haran-torneo-futbol-homenaje-fernando-baez-sosa_0_c73hO_T86.html,https://images.clarin.com/2021/11/05/pYvihM7oH_1256x620__2.jpg#1636137306653
59,GIkERp3DK,"""Tengo que ser muy sincera"". Contundente pedido de Dalma Maradona por el aniversario de la muerte de su padre",https://www.clarin.com/fama/-sincera-contundente-pedido-dalma-maradona-aniversario-muerte-padre_0_GIkERp3DK.html,https://images.clarin.com/2021/11/10/BdTBGTFib_720x0__1.jpg
60,fc5p13i8M,Emotivo momento. El desconsolado llanto de Jonatan Viale durante un homenaje a su padre en los Martín Fierro,https://www.clarin.com/fama/desconsolado-llanto-jonatan-viale-homenaje-padre-martin-fierro-cable_0_fc5p13i8M.html,https://images.clarin.com/2021/11/10/QBhZegpH2_720x0__1.jpg
61,0o7vJIV41,"A través de un mensaje de voz. Magnolia, la hija de la China Suárez, le hizo un insólito reclamo a Lali Espósito",https://www.clarin.com/fama/-reclamo-virtual-magnolia-hija-china-suarez-grabo-mensaje-lali-esposito_0_0o7vJIV41.html,https://images.clarin.com/2021/11/10/2KC7C5a1o_720x0__1.jpg
62,nT0MiR6x_,"Diferentes versiones. Zaira Nara, en crisis con su pareja por el escándalo Wanda-Icardi: la imagen que lo confirmaría",https://www.clarin.com/fama/zaira-nara-crisis-jakob-von-plessen-imagen-confirmaria_0_nT0MiR6x_.html,https://images.clarin.com/2021/11/09/2K8sbkfF7_720x0__1.jpg
63,FO-MllMtd,Tras el pacto de precios. Ahorrar en la farmacia: qué tarjetas y apps te devuelven hasta un 30% del gasto,https://www.clarin.com/servicios/ahorrar-farmacia-tarjetas-apps-devuelven-30-gasto-remedios_0_FO-MllMtd.html,https://images.clarin.com/2021/11/09/Gf3Vlw3y2_720x0__1.jpg
64,xUVueG3hT,A 4 días de los comicios. Presentismo y voto útil: dos claves que pueden definir la elección del domingo,https://www.clarin.com/politica/presentismo-voto-util-claves-pueden-definir-eleccion-domingo_0_xUVueG3hT.html,https://images.clarin.com/2021/09/30/nK5uMkqjn_720x0__1.jpg
65,8wmlDaMoe,La economía que viene. Consultoras corrigen al alza el crecimiento para 2021 pero bajan sus pronósticos de 2022,https://www.clarin.com/economia/consultoras-ven-salto-9-pbi-ano-anticipan-debil-crecimiento-2022_0_8wmlDaMoe.html,https://images.clarin.com/2021/11/01/Dv8MxdoHH_720x0__1.jpg
66,3wwV_RmSL,Oportunidad. Liquidan Smart TV en 24 cuotas sin interés con todas las tarjetas: qué se consigue,https://www.clarin.com/servicios/liquidan-smart-tv-24-cuotas-interes-todas-tarjetas-consigue_0_3wwV_RmSL.html,https://images.clarin.com/2021/11/07/-guceIUU0_720x0__1.jpg
67,VjSEmv_fY,Alerta de la OMS. La cuarta ola de Covid amenaza a Europa: ¿cómo harán para frenarla?,https://www.clarin.com/mundo/cuarta-ola-coronavirus-amenaza-europa-haran-frenarla-_0_VjSEmv_fY.html,https://images.clarin.com/2021/08/07/QeUl6FkJ3_720x0__1.jpg
68,qzHnl8JmC,La caída de Alperovich. El legislador más rico del país se queda sin fueros y lo acorrala la Justicia,https://www.clarin.com/especiales/caida-alperovich-queda-fueros-acorrala-justicia-denuncias-abuso_0_qzHnl8JmC.html,https://images.clarin.com/2021/10/29/wHW65Lf-7_720x0__1.jpg
69,CVoMMjyVo,¿Qué se perdió?. La historia secreta del incendio en la Rosada antes de hallar muerto a Nisman,https://www.clarin.com/politica/verdadera-historia-incendio-casa-rosada-horas-hallar-muerto-nisman_0_CVoMMjyVo.html,https://images.clarin.com/2021/10/14/EXosCOcyf_720x0__1.jpg
70,3r94MILrv,Crimen en un petrolero. Terror a bordo: el asesino del barco tenía todo planeado y se vistió para matar,https://www.clarin.com/policiales/terror-bordo-asesino-barco-planeado-vistio-matar_0_3r94MILrv.html,https://images.clarin.com/2021/11/01/b7Srso2T4_720x0__1.jpg
71,uw0bgL8rw,"Escapadas. Viajar por Argentina: imperdibles, requisitos y precios de 10 clásicos",https://www.clarin.com/viajes/volver-viajar-argentina-imperdibles-requisitos-precios-10-destinos-clasicos_0_uw0bgL8rw.html,https://images.clarin.com/2021/10/06/H7yN0b_4A_720x0__1.jpg
72,NYZENxLGq,"Quiere hacer historia. Julián Alvarez en la vía de Maradona, Di Stéfano, Kempes y otras glorias",https://www.clarin.com/deportes/julian-alvarez-camino-maradona-di-stefano-kempes-glorias-futbol-argentino_0_NYZENxLGq.html,https://images.clarin.com/2021/11/09/FnIPewHYt_720x0__1.jpg
73,F4GWAhsl5,Con barras de hierro. Detienen a una jugadora del PSG por una feroz golpiza a una compañera ,https://www.clarin.com/deportes/detuvieron-jugadora-psg-feroz-golpiza-companera-barras-hierro_0_F4GWAhsl5.html,https://images.clarin.com/2021/11/10/3XG17N6up_720x0__1.jpg
74,4hCSADOmS,La polémica que se viene. La vuelta del público visitante divide a la política pero también a los clubes,https://www.clarin.com/deportes/vuelta-publico-visitante-divide-politica-clubes-hecha-ley-hecha-trampa-_0_4hCSADOmS.html,https://images.clarin.com/2021/11/09/lAcdWBZge_720x0__1.jpg
75,b7BJSNKu_,"Tributo al Quíntuple. Jackie Stewart: ""Tienen mucha suerte de haber tenido a un hombre como Fangio""",https://www.clarin.com/deportes/jackie-stewart-presente-tributo-fangio-mucha-suerte-hombre-_0_b7BJSNKu_.html,https://images.clarin.com/2021/11/09/zLIsx36MJ_1256x620__2.jpg#1636508659462
76,1TFnBAsG3,"Uruguay. El Albion Football Club, uno de los pioneros del fútbol mundial, ascendió a Primera",https://www.clarin.com/deportes/uruguay-albion-football-club-pioneros-futbol-mundial-ascendio-primera-division_0_1TFnBAsG3.html,https://images.clarin.com/2021/11/09/WGUWFoUba_720x0__1.jpg
77,vqIoS6CKd,"Boca espera rival. La Copa Argentina de la ""rosca"": la semi entre Godoy Cruz y Talleres ya tendría fecha",https://www.clarin.com/deportes/copa-argentina-rosca-postergada-semifinal-godoy-cruz-talleres-fecha_0_vqIoS6CKd.html,https://images.clarin.com/2021/10/30/BVNSibDcF_720x0__1.jpg
