n,id,title,url,image
1,r6myZzBpt,"La pandemia. El Covid en el país, hoy: contagios más rápidos, pero 93% menos de muertes que en la segunda ola",https://www.clarin.com/sociedad/covid-hoy-contagios-rapidos-93-muertes-segunda-ola_0_r6myZzBpt.html,https://images.clarin.com/2021/12/22/Lfr12UW7m_720x0__1.jpg
2,3fNiCB1lr,Crimen en Palermo. Detuvieron al portero del edificio donde hallaron asesinado a un jubilado,https://www.clarin.com/policiales/detuvieron-principal-sospechoso-crimen-jubilado-asesinado-departamento-palermo_0_3fNiCB1lr.html,https://images.clarin.com/2021/12/17/CHfF3wjtn_720x0__1.jpg
3,Rr5PDFy0z,"Bienes Personales. Desde Berlín, uno de los diputados de Juntos por el Cambio que faltó dio sus motivos",https://www.clarin.com/politica/bienes-personales-diputados-juntos-cambio-falto-sesion-conto-ausento-dijo-piensa-renunciar_0_Rr5PDFy0z.html,https://images.clarin.com/2021/12/22/nCni9hxlX_720x0__1.jpg
4,4xhQ36yrA,Senado. Los cambios en Bienes Personales ya tienen dictamen y se votarían la semana que viene,https://www.clarin.com/politica/bienes-personales-senado-dictamino-cambios-suba-piso-imponible-buscara-votarlos-semana-viene_0_4xhQ36yrA.html,https://images.clarin.com/2021/12/22/a8uopSLX7_720x0__1.jpg
5,tVcELaZJl,Odisea. Sin pasaporte: por qué 100 mil argentinos tienen el trámite demorado,https://www.clarin.com/sociedad/pasaporte-razon-100-mil-argentinos-tramite-demorado_0_tVcELaZJl.html,https://images.clarin.com/2021/12/21/qEIuwLtwg_720x0__1.jpg
6,tY8ABzxrx,Ayuda extraordinaria. Bono de fin de año: qué gremios y sectores consiguieron un plus salarial,https://www.clarin.com/economia/bono-fin-ano-gremios-sectores-consiguieron-plus-salarial-fiestas_0_tY8ABzxrx.html,https://images.clarin.com/2019/04/04/63AWmNkmH_720x0__1.jpg
7,eHA98cEDi,"La negociación por la deuda. El Gobierno habla de una ""crítica contundente"" del Fondo a la gestión Macri",https://www.clarin.com/politica/gobierno-habla-critica-contundente-fondo-aa-gestion-macri-lanza-ofensiva-juntos-cambio_0_eHA98cEDi.html,https://images.clarin.com/2021/12/17/bUaCPpb0n_720x0__1.jpg
8,zO1ZAVGTB,"Investigan si está en Perú. ""Si me muero, fueron Kathy y el chabón"": lo mataron por la espalda y buscan a su ex novia",https://www.clarin.com/policiales/-mamita-muero-kathy-chabon-balearon-espalda-novia-buscada-interpol_0_zO1ZAVGTB.html,https://images.clarin.com/2021/12/22/bpYJqgk-K_1256x620__2.jpg#1640193549944
9,LgF7HovK8,Sistema Riachuelo. Viaje a las entrañas de la Ciudad: abren por primera vez una cloaca centenaria,https://www.clarin.com/ciudades/primera-vez-abren-cloaca-maxima-centenaria-ciudad-conectarla-sistema-riachuelo_0_LgF7HovK8.html,https://images.clarin.com/2021/12/21/G9cgPAJ4K_720x0__1.jpg
10,hWbMU9TFV,"Inauguraron dos tramos. Tras años de demoras, este verano se podrá viajar a la Costa todo por autovía",https://www.clarin.com/sociedad/anos-demoras-verano-podra-viajar-pinamar-gesell-resto-costa-autovia_0_hWbMU9TFV.html,https://images.clarin.com/2021/12/22/dgRRaVDPK_1256x620__2.jpg#1640183031689
11,9eL3m9c9R,Barracas Central. La dura respuesta de Caruso Lombardi al hijo de Chiqui Tapia tras el ascenso,https://www.clarin.com/deportes/caruso-lombardi-respuesta-ivan-tapia-barracas_0_9eL3m9c9R.html,https://images.clarin.com/2021/12/21/n4gVVQmoS_720x0__1.jpg
12,wzTMj5VEB,"El DT, confirmado. Roger Martínez, Angel Romero y Farías: ¿es posible el Boca 2022 que sueña Riquelme?",https://www.clarin.com/deportes/roger-martinez-angel-romero-farias-posible-boca-2022-suenan-riquelme-battaglia-pelear-libertadores-_0_wzTMj5VEB.html,https://images.clarin.com/2021/12/22/RhYmuhWNj_720x0__1.jpg
13,Z8juAILMW,Festejo en Pilar. El discurso de Cristina con artistas K: elogios a invitados y emoción al hablar de Flor,https://www.clarin.com/politica/discurso-cristina-kirchner-cena-artistas-periodistas-k-elogios-invitados-emocion-hablar-florencia_0_Z8juAILMW.html,https://images.clarin.com/2021/12/20/i-oeXZG2b_720x0__1.jpg
14,EjjLO5Csd,Lo contó en Twitter. Jorge Rial se contagió de Covid: cuál fue su principal síntoma y cómo está de salud,https://www.clarin.com/fama/jorge-rial-contagio-coronavirus-principal-sintoma-salud_0_EjjLO5Csd.html,https://images.clarin.com/2021/10/13/EC1D5JEVe_720x0__1.jpg
15,vV5xhzHeT,"""No se impuso la racionalidad"". Morales y una crítica hacia adentro: ""No se puede dejar a un Gobierno sin Presupuesto""",https://www.clarin.com/politica/gerardo-morales-critico-posicion-juntos-cambio-puede-dejar-gobierno-presupuesto-impuso-racionalidad-_0_vV5xhzHeT.html,https://images.clarin.com/2021/12/18/qqAqMP5po_720x0__1.jpg
16,zRNbr_Xva,Perfectamente conservado. Hallan en China un embrión de dinosaurio de 66 millones de años,https://www.clarin.com/internacional/hallan-embrion-dinosaurio-66-millones-anos_0_zRNbr_Xva.html,https://images.clarin.com/2021/12/22/WX10oM0tf_720x0__1.jpg
17,ou5xUVQJL,Sorpresa y dudas. Ganancias: qué cambia a partir del agregado de último momento que votó Diputados,https://www.clarin.com/economia/ganancias-cambia-partir-agregado-ultimo-momento-voto-diputados_0_ou5xUVQJL.html,https://images.clarin.com/2021/12/19/MDMOBmeTG_1256x620__2.jpg#1640176371244
18,wwV3ZK5-w,En el Hotel Hilton. Escándalo: L-Gante casi a las trompadas con el representante de Yao Cabrera,https://www.clarin.com/fama/escandalo-amenazas-hotel-hilton-l-gante-agarra-trompadas-representante-yao-cabrera_0_wwV3ZK5-w.html,https://images.clarin.com/2021/12/22/ROrXsbxid_720x0__1.jpg
19,Cg0uouyyL,Cuenta regresiva. Última chance de usar el crédito del Previaje 2020: en qué se puede gastar,https://www.clarin.com/servicios/ultima-chance-usar-credito-previaje-2020-vence-puede-gastar_0_Cg0uouyyL.html,https://images.clarin.com/2021/12/21/gpmSY2DVn_720x0__1.jpg
20,7-e_-D1_8,"En Avellaneda. La tumba de Luca Prodan: misterio, mitos y dudas sobre los restos del líder de Sumo",https://www.clarin.com/zonales/misterio-tumba-luca-prodan-dicen-roca-deberian-restos_0_7-e_-D1_8.html,https://images.clarin.com/2020/04/01/orQ13gP0r_950x468__2.jpg#1640108229990
21,P7Nrpg_VJ,"No fue a declarar. Gianola presentó un nuevo escrito ante la Justicia: ""Jamás abusé sexualmente de nadie""",https://www.clarin.com/sociedad/-jamas-abuse-sexualmente-nadie-asegura-fabian-gianola-nuevo-escrito-presento-justicia_0_P7Nrpg_VJ.html,https://images.clarin.com/2019/05/08/rPLsZZrUL_1256x620__2.jpg#1640184941828
22,8H_mr7yDv,"Su particular historia. Brownie, la mascota de Boric, asumió como ""el Primer Perro de la República de Chile""",https://www.clarin.com/mundo/particular-historia-brownie-perro-gabriel-boric-debuto-redes-asumio-primer-perro-republica-chile-_0_8H_mr7yDv.html,https://images.clarin.com/2021/12/22/pBu8veDkf_720x0__1.jpg
23,heqm-Stqp,Sobras de comida. Cuándo deben refrigerarse y cuánto tiempo pueden estar en la heladera,https://www.clarin.com/buena-vida/deben-refrigerarse-tiempo-pueden-permanecer-heladera-sobras-comida_0_heqm-Stqp.html,https://images.clarin.com/2021/12/22/vrmFc98oP_720x0__1.jpg
24,sHRLaTL-4,"Vivió 8 años en un sótano. Secuestrada, esclavizada y abusada: la aberrante historia de Natascha Kampusch",https://www.clarin.com/internacional/secuestrada-abusada-esclavizada-aberrante-historia-nina-vivio-8-anos-sotano_0_sHRLaTL-4.html,https://images.clarin.com/2016/08/22/BkNTF-AQl_720x0.jpg
25,g61D_CIFA,"Entrevista exclusiva. Hailee Steinfeld, la chica candidata al Oscar que toma la posta de Hawkeye",https://www.clarin.com/espectaculos/cine/entrevista-hailee-steinfeld-chica-candidata-oscar-toma-posta-hawkeye_0_g61D_CIFA.html,https://images.clarin.com/2021/11/24/DYhJ7LI_6_720x0__1.jpg
26,r6myZzBpt,"La pandemia. El Covid en el país, hoy: contagios más rápidos, pero 93% menos de muertes que en la segunda ola",https://www.clarin.com/sociedad/covid-hoy-contagios-rapidos-93-muertes-segunda-ola_0_r6myZzBpt.html,https://images.clarin.com/2021/12/22/Lfr12UW7m_720x0__1.jpg
27,3fNiCB1lr,Crimen en Palermo. Detuvieron al portero del edificio donde hallaron asesinado a un jubilado,https://www.clarin.com/policiales/detuvieron-principal-sospechoso-crimen-jubilado-asesinado-departamento-palermo_0_3fNiCB1lr.html,https://images.clarin.com/2021/12/17/CHfF3wjtn_720x0__1.jpg
28,Rr5PDFy0z,"Bienes Personales. Desde Berlín, uno de los diputados de Juntos por el Cambio que faltó dio sus motivos",https://www.clarin.com/politica/bienes-personales-diputados-juntos-cambio-falto-sesion-conto-ausento-dijo-piensa-renunciar_0_Rr5PDFy0z.html,https://images.clarin.com/2021/12/22/nCni9hxlX_720x0__1.jpg
29,4xhQ36yrA,Senado. Los cambios en Bienes Personales ya tienen dictamen y se votarían la semana que viene,https://www.clarin.com/politica/bienes-personales-senado-dictamino-cambios-suba-piso-imponible-buscara-votarlos-semana-viene_0_4xhQ36yrA.html,https://images.clarin.com/2021/12/22/a8uopSLX7_720x0__1.jpg
30,tVcELaZJl,Odisea. Sin pasaporte: por qué 100 mil argentinos tienen el trámite demorado,https://www.clarin.com/sociedad/pasaporte-razon-100-mil-argentinos-tramite-demorado_0_tVcELaZJl.html,https://images.clarin.com/2021/12/21/qEIuwLtwg_720x0__1.jpg
31,tY8ABzxrx,Ayuda extraordinaria. Bono de fin de año: qué gremios y sectores consiguieron un plus salarial,https://www.clarin.com/economia/bono-fin-ano-gremios-sectores-consiguieron-plus-salarial-fiestas_0_tY8ABzxrx.html,https://images.clarin.com/2019/04/04/63AWmNkmH_720x0__1.jpg
32,eHA98cEDi,"La negociación por la deuda. El Gobierno habla de una ""crítica contundente"" del Fondo a la gestión Macri",https://www.clarin.com/politica/gobierno-habla-critica-contundente-fondo-aa-gestion-macri-lanza-ofensiva-juntos-cambio_0_eHA98cEDi.html,https://images.clarin.com/2021/12/17/bUaCPpb0n_720x0__1.jpg
33,zV_zDtmZ2,Cincuenta años después. María Leal blanqueó un romance secreto con Sandra Mihanovich y contó detalles de la relación,https://www.clarin.com/fama/maria-leal-blanqueo-romance-secreto-sandra-mihanovich-conto-detalles-comenzo-relacion_0_zV_zDtmZ2.html,https://images.clarin.com/2021/12/22/zekjkTCzV_720x0__1.jpg
34,MuO8wFUuX,Video viral. Preocupación por los extraños movimientos de mandíbula de Marc Anthony en un show,https://www.clarin.com/fama/preocupacion-extranos-movimientos-mandibula-marc-anthony-shows_0_MuO8wFUuX.html,https://images.clarin.com/2021/12/22/TCx8adKW0_720x0__1.jpg
35,w0YMEnLJo,Descargo público. Habló la influencer con la que Rusher King habría engañado a María Becerra y contó su verdad,https://www.clarin.com/fama/hablo-influencer-rusher-king-enganado-maria-becerra-conto-verdad_0_w0YMEnLJo.html,https://images.clarin.com/2021/12/22/tL8tHtV3C_720x0__1.jpg
36,yOBs9ofr2,Postal familiar. Gustavo Yankelevich publicó una foto de los hijos de Romina Yan y revolucionó las redes,https://www.clarin.com/fama/gustavo-yankelevich-publico-foto-hijos-romina-yan-revoluciono-redes_0_yOBs9ofr2.html,https://images.clarin.com/2016/09/05/B1flm37AXl_720x0.jpg
37,D8hRFkw0n,Especial Clarín. Las sillas vacías en las Fiestas por los ladrones que salen a matar,https://www.clarin.com/policiales/sillas-vacias-inseguridad_0_D8hRFkw0n.html,https://images.clarin.com/2021/12/20/WnPAKZwCY_720x0__1.jpg
38,gntzdVI0V,Tips útiles. Propiedades: las 10 claves para vender tu casa en poco tiempo,https://www.clarin.com/servicios/propiedades-10-claves-vender-casa-tiempo_0_gntzdVI0V.html,https://images.clarin.com/2020/02/19/tkgkUQS8_720x0__1.jpg
39,_DrzljJ2F,Desde el celular. Cómo conseguir taxi o Uber en las Fiestas: las 5 claves para no caer en esperas eternas,https://www.clarin.com/servicios/conseguir-taxi-uber-fiestas-5-claves-caer-esperas-eternas_0__DrzljJ2F.html,https://images.clarin.com/2020/10/08/HLVEOou5y_720x0__1.jpg
40,enVeBaeCV,Ciberdelitos. Estafas virtuales en Navidad: cuáles son las tres modalidades del momento y cómo cuidarse,https://www.clarin.com/sociedad/estafas-virtuales-navidad-modalidades-momento-cuidarse_0_enVeBaeCV.html,https://images.clarin.com/2020/11/24/8rfjRuDIU_1256x620__2.jpg#1639794160505
41,W70YGoINv,Compras online. Cómo traer productos del exterior a bajo costo y al tipo de cambio más barato,https://www.clarin.com/servicios/traer-productos-exterior-costo-tipo-cambio-barato_0_W70YGoINv.html,https://images.clarin.com/2020/11/24/knC59Dd9M_720x0__1.jpg
42,9KZn_RIDy,Península Mitre. El último lugar de la Argentina que se salva del cambio climático,https://www.clarin.com/especiales/ultimo-lugar-argentina-salva-cambio-climatico_0_9KZn_RIDy.html,https://images.clarin.com/2021/12/09/MXDJDgPHP_720x0__1.jpg
43,CpUhuSgLk,Pasión en miniatura. Autitos de colección: un juego que no es de niños y mueve millones,https://www.clarin.com/autos/autitos-coleccion-juego-ninos-mueve-millones_0_CpUhuSgLk.html,https://images.clarin.com/2021/12/03/clFAGxjmh_720x0__1.jpg
44,YvuxFVzwz,Ruta internacional. Dónde van los relojes de alta gama robados en Argentina,https://www.clarin.com/policiales/van-relojes-alta-gama-robados-argentina_0_YvuxFVzwz.html,https://images.clarin.com/2021/12/02/orU-T-sim_720x0__1.jpg
45,10RDfpYkp,"Especial Clarín. Viaje a la ""fábrica"" del cannabis: cómo se produce el aceite en el primer laboratorio industrial del país",https://www.clarin.com/sociedad/viaje-fabrica-cannabis-produce-aceite-primer-laboratorio-industrial-pais_0_10RDfpYkp.html,https://images.clarin.com/2021/11/23/_jEGmHUd-_720x0__1.jpg
46,KtL37Rt1x,Qué acordaron para 2022. Battaglia se reunió con Riquelme y se confirmó su continuidad en Boca,https://www.clarin.com/deportes/battaglia-reunio-riquelme-confirmo-continuidad-dt-boca-acordaron-2022_0_KtL37Rt1x.html,https://images.clarin.com/2021/12/21/J6ZI5hHpX_1256x620__2.jpg#1640141966664
47,T_5sXQHfL,"Quién es más grande. Bianchi o Gallardo, el debate de moda que divide al fútbol argentino",https://www.clarin.com/deportes/carlos-bianchi-marcelo-gallardo-debate-moda-divide-futbol-argentino_0_T_5sXQHfL.html,https://images.clarin.com/2021/12/22/GZaSfnO6i_720x0__1.jpg
48,Ych77yfxr,Descanso de campeón. Las vacaciones de Julián Alvarez en México mientras lo miran con ganas de Europa,https://www.clarin.com/deportes/vacaciones-plantel-river_0_Ych77yfxr.html,https://images.clarin.com/2021/12/22/Uib8OTArj_720x0__1.jpg
49,zXK7WnU86,"Carlos Sainz. ""El hijo de"" que se hizo un lugar en la F1 y fue el mejor detrás de Red Bull y Mercedes",https://www.clarin.com/deportes/carlos-sainz-hijo-hizo-lugar-formula-1-mejor-detras-red-bull-mercedes_0_zXK7WnU86.html,https://images.clarin.com/2021/12/21/0PBPh5_kA_1256x620__2.jpg#1640140797869
50,ZzW1ktg0D,Suben los casos. Gustavo Barros Schelotto tiene coronavirus y aislaron a Guillermo,https://www.clarin.com/deportes/gustavo-barros-schelotto-coronavirus-aislaron-guillermo_0_ZzW1ktg0D.html,https://images.clarin.com/2021/11/17/1YyLLPLTn7_1256x620__2.jpg#1640183685789
51,60PkEQ4dd,Bronca en España. El lapidario comentario de Fillol en medio de la polémica entre Simeone y Suárez,https://www.clarin.com/deportes/lapidario-comentario-pato-fillol-medio-polemica-simeone-suarez-desagradecido-_0_60PkEQ4dd.html,https://images.clarin.com/2021/12/22/McWjU0ze9_720x0__1.jpg
52,U8Oj6Ogv7,Mercado digital. Criptomonedas: 5 tips para tener en cuenta antes de invertir,https://www.clarin.com/economia/criptomonedas-5-tips-tener-cuenta-invertir_0_U8Oj6Ogv7.html,https://images.clarin.com/2021/09/16/x_2rig3sa_720x0__1.jpg
53,i2bZdymvh,Consumo. La chilena Cencosud lanza su cuarta cadena de supermercados en el país,https://www.clarin.com/economia/chilena-cencosud-lanza-cuarta-cadena-supermercados-pais_0_i2bZdymvh.html,https://images.clarin.com/2021/12/22/oFN0OwSXv_720x0__1.jpg
54,_FLeYJbRU,Perspectivas. Tipo de cambio y financiamiento: las dos preocupaciones de la Construcción,https://www.clarin.com/economia/tipo-cambio-acceso-financiamiento-preocupaciones-construccion_0__FLeYJbRU.html,https://images.clarin.com/2021/03/12/ccCt3ywy__720x0__1.jpg
55,gLD0IfWWh,"Relevaron 24 productos. La canasta navideña subió más de 60%, por encima de la inflación",https://www.clarin.com/economia/ano-canasta-navidena-subio-60-encima-inflacion_0_gLD0IfWWh.html,https://images.clarin.com/2021/12/21/aUm7cNvAZ_720x0__1.jpg
56,SkmqkzN21,Comercio exterior. El vino argentino cierra el 2021 con récord de exportaciones,https://www.clarin.com/economia/vino-argentino-cierra-2021-record-exportaciones_0_SkmqkzN21.html,https://images.clarin.com/2021/04/01/rowoIkUpB_720x0__1.jpg
57,Slh-0BcWI,Trampas. Cómo funcionan las billeteras cripto que están en la mira del BCRA,https://www.clarin.com/economia/trampa-dinero-facil-funcionan-billeteras-cripto-mira-bcra_0_Slh-0BcWI.html,https://images.clarin.com/2021/10/01/t2rfPxeY4_720x0__1.jpg
