n,id,title,url,image
1,CiV0Awhmw,Cambio de tendencia. Ahora el 70% de las remesas es plata que argentinos en el exterior mandan a sus familias en el país,https://www.clarin.com/economia/cambio-tendencia-argentina-peru-recibe-vez-remesas-exterior_0_CiV0Awhmw.html,https://images.clarin.com/2016/09/19/H1f6ImS07l_720x0.jpg
2,ubOFf15W0,"De la Editora al lector. Soria, el mejor alumno de Cristina",https://www.clarin.com/opinion/soria-mejor-alumno-cristina_0_ubOFf15W0.html,https://images.clarin.com/2021/03/06/q7Qm8iZLg_720x0__1.jpg
3,EMFyR1XCP,Pingüinos 2021. Los funcionarios leales a Cristina que llegaron al poder desde tres provincias patagónicas,https://www.clarin.com/politica/pinguinos-2021-funcionarios-leales-cristina-llegaron-poder-provincias-patagonicas_0_EMFyR1XCP.html,https://images.clarin.com/2021/01/22/c55jTAzS1_720x0__1.jpg
4,xmUXuUylz,Humor político. Al servicio secreto de su Majestad,https://www.clarin.com/opinion/martin-soria-alberto-fernandez-cristina-kirchner-servicio-secreto-majestad-_0_xmUXuUylz.html,https://images.clarin.com/2021/03/06/q7Qm8iZLg_1256x620__2.jpg#1616277693194
5,Fr1nUbcFF,"Avant Premiere. Massa arrinconado, Gollán levanta perfil y el paso a paso de las PASO",https://www.clarin.com/politica/sergio-massa-arrinconado-daniel-gollan-levanta-perfil-paso-paso-paso_0_Fr1nUbcFF.html,https://images.clarin.com/2020/12/21/SVvRqpmmw_720x0__1.jpg
6,k0POSmHof,Segunda ola. El Gobierno prepara un DNU con nuevas restricciones por el coronavirus,https://www.clarin.com/politica/gobierno-prepara-dnu-nuevas-restricciones-temor-segunda-ola-medio-falta-vacunas_0_k0POSmHof.html,https://images.clarin.com/2020/03/12/wiT2xSPb_720x0__1.jpg
7,yN51eZ8Ij,"España. Con un doblete de Messi, Barcelona goleó y sueña",https://www.clarin.com/deportes/real-sociedad-vs-barcelona-liga-espana-minuto-minuto-directo_0_yN51eZ8Ij.html,https://images.clarin.com/2021/03/21/ExXiurVlL_720x0__1.jpg
8,bV8N6deXv,"Formosa dramática. ""No me deje morir"": la carta que le escribió un chico con fibrosis quística al presidente",https://www.clarin.com/sociedad/-deje-morir-pido-oportunidad-vivir-sonar-carta-escribio-chico-fibrosis-quistica-presidente_0_bV8N6deXv.html,https://images.clarin.com/2021/03/09/VZqF5FBi9_720x0__1.jpg
9,bWs93sFzz,"Modalidad que crece. Estafa virtual: el audio de una sextorsión y el anzuelo con la falsa ""Sofía""",https://www.clarin.com/policiales/audio-sextorsion-anzuelo-falsa-sofia-_0_bWs93sFzz.html,https://images.clarin.com/2019/08/10/1qjE4q5AX_720x0__1.jpg
10,A9NC9icw9Z,En pandemia. Por qué dejé de correr (y cómo volví a empezar),https://www.clarin.com/new-york-times-international-weekly/deje-correr-pandemia-volvi-empezar-_0_A9NC9icw9Z.html,https://images.clarin.com/2021/03/18/anhCgVHEL_720x0__1.jpg
11,m6cqxXXvj,Ciberseguridad. Los autos también se pueden hackear,https://www.clarin.com/new-york-times-international-weekly/automotrices-esfuerzan-mantenerse-paso-adelante-hackers_0_m6cqxXXvj.html,https://images.clarin.com/2021/03/19/zbuv0nD5l_720x0__1.jpg
12,CiV0Awhmw,Cambio de tendencia. Ahora el 70% de las remesas es plata que argentinos en el exterior mandan a sus familias en el país,https://www.clarin.com/economia/cambio-tendencia-argentina-peru-recibe-vez-remesas-exterior_0_CiV0Awhmw.html,https://images.clarin.com/2016/09/19/H1f6ImS07l_720x0.jpg
13,ubOFf15W0,"De la Editora al lector. Soria, el mejor alumno de Cristina",https://www.clarin.com/opinion/soria-mejor-alumno-cristina_0_ubOFf15W0.html,https://images.clarin.com/2021/03/06/q7Qm8iZLg_720x0__1.jpg
14,EMFyR1XCP,Pingüinos 2021. Los funcionarios leales a Cristina que llegaron al poder desde tres provincias patagónicas,https://www.clarin.com/politica/pinguinos-2021-funcionarios-leales-cristina-llegaron-poder-provincias-patagonicas_0_EMFyR1XCP.html,https://images.clarin.com/2021/01/22/c55jTAzS1_720x0__1.jpg
15,xmUXuUylz,Humor político. Al servicio secreto de su Majestad,https://www.clarin.com/opinion/martin-soria-alberto-fernandez-cristina-kirchner-servicio-secreto-majestad-_0_xmUXuUylz.html,https://images.clarin.com/2021/03/06/q7Qm8iZLg_1256x620__2.jpg#1616277693194
16,Fr1nUbcFF,"Avant Premiere. Massa arrinconado, Gollán levanta perfil y el paso a paso de las PASO",https://www.clarin.com/politica/sergio-massa-arrinconado-daniel-gollan-levanta-perfil-paso-paso-paso_0_Fr1nUbcFF.html,https://images.clarin.com/2020/12/21/SVvRqpmmw_720x0__1.jpg
17,k0POSmHof,Segunda ola. El Gobierno prepara un DNU con nuevas restricciones por el coronavirus,https://www.clarin.com/politica/gobierno-prepara-dnu-nuevas-restricciones-temor-segunda-ola-medio-falta-vacunas_0_k0POSmHof.html,https://images.clarin.com/2020/03/12/wiT2xSPb_720x0__1.jpg
18,yN51eZ8Ij,"España. Con un doblete de Messi, Barcelona goleó y sueña",https://www.clarin.com/deportes/real-sociedad-vs-barcelona-liga-espana-minuto-minuto-directo_0_yN51eZ8Ij.html,https://images.clarin.com/2021/03/21/ExXiurVlL_720x0__1.jpg
19,bV8N6deXv,"Formosa dramática. ""No me deje morir"": la carta que le escribió un chico con fibrosis quística al presidente",https://www.clarin.com/sociedad/-deje-morir-pido-oportunidad-vivir-sonar-carta-escribio-chico-fibrosis-quistica-presidente_0_bV8N6deXv.html,https://images.clarin.com/2021/03/09/VZqF5FBi9_720x0__1.jpg
20,11vdzmBQN,Discusión interna. Juntos por el Cambio y la reaparición de Macri: ¿conviene que haga campaña?,https://www.clarin.com/politica/reaparicion-mauricio-macri-abre-discusion-juntos-cambio-conviene-haga-campana-_0_11vdzmBQN.html,https://images.clarin.com/2021/02/07/EL90sdmwY_720x0__1.jpg
21,KJwIRUdhA,Adelanto de Clarín. Nueva encuesta: Larreta también quedó en rojo y reprueban a todo el Gabinete nacional,https://www.clarin.com/politica/marzo-negro-encuesta-midio-37-politicos-funcionarios-reprobaron_0_KJwIRUdhA.html,https://images.clarin.com/2021/03/12/xlPSbEwEL_720x0__1.jpg
22,YstHgYuHP,Nuevas medidas. La Ciudad analiza relajar protocolos por coronavirus en las escuelas,https://www.clarin.com/sociedad/ciudad-analiza-cambios-protocolos-coronavirus-escuelas-distanciamiento-necesario-_0_YstHgYuHP.html,https://images.clarin.com/2021/03/21/qtk-uoVbk_720x0__1.jpg
23,Sje-aYxrV,"Interna en Seguridad. El segundo de Frederic habló de la agresión de Berni: ""Fue un empujón""",https://www.clarin.com/politica/segundo-sabina-frederic-hablo-agresion-sergio-berni-empujon-_0_Sje-aYxrV.html,https://images.clarin.com/2021/03/21/zZMKrBDiN_720x0__1.jpg
24,0yBX78DdJ,Rebrote de Covid. Aerolíneas canceló 68 vuelos y no habrá viajes de repatriación,https://www.clarin.com/sociedad/aerolineas-argentinas-cancelo-68-vuelos-confirman-viajes-repatriacion_0_0yBX78DdJ.html,https://images.clarin.com/2021/03/20/CfRRE-BlW_1256x620__2.jpg#1616283786807
25,PUnCnVBWM,Cifras oficiales. Confirmaron 4.032 nuevos casos y otras 28 muertes en las últimas 24 horas,https://www.clarin.com/sociedad/coronavirus-argentina-confirmaron-4-032-nuevos-casos-28-muertes-ultimas-24-horas_0_PUnCnVBWM.html,https://images.clarin.com/2021/03/21/-bXtRs4mr_1256x620__2.jpg#1616357300060
26,8D0mYPbKH,Pandemia y crisis. Venezuela: Guaidó acusó a Maduro de politizar el acceso a las vacunas,https://www.clarin.com/mundo/coronavirus-venezuela-juan-guaido-acuso-nicolas-maduro-politizar-acceso-vacunas-forma-controlar-poblacion_0_8D0mYPbKH.html,https://images.clarin.com/2021/03/21/3wxBgwrXq_1200x0__2.jpg#1616348357909
27,A36pa8Mdv,Día del Sueño. Una reflexión sobre el descanso: ¿dormimos bien?,https://www.clarin.com/brandstudio/reflexion-horas-descanso-durmiendo-bien-_0_A36pa8Mdv.html,https://images.clarin.com/2018/06/22/r1eBeqcbX_720x0__1.jpg
28,epiGCO4qg,En colchones . Una trayectoria llena de innovación en busca del descanso profundo,https://www.clarin.com/brandstudio/trayectoria-llena-innovacion-busca-descanso-profundo_0_epiGCO4qg.html,https://images.clarin.com/2021/03/18/TS_fCbdBn_1256x620__2.jpg#1616094083906
29,eFqowheBj,"Beneficios. A la hora de dormir bien, la respuesta es el colchón",https://www.clarin.com/brandstudio/hora-dormir-bien-respuesta-colchon_0_eFqowheBj.html,https://images.clarin.com/2021/03/18/-5y2JFhEG_720x0__1.jpg
30,5uuu0Y8Qp,Consejos para dormir bien. Los beneficios de un descanso reparador,https://www.clarin.com/brandstudio/beneficios-descanso-reparador_0_5uuu0Y8Qp.html,https://images.clarin.com/2021/03/18/qGpTbLJy9_720x0__1.jpg
31,nsTxlNoKu,"Opciones disponibles. Dormir bien, un sueño que todos deberían poder lograr",https://www.clarin.com/brandstudio/dormir-bien-sueno-deberian-poder-lograr_0_nsTxlNoKu.html,https://images.clarin.com/2021/03/18/70QVq05KS_720x0__1.jpg
32,VMoI7oB4c,Estados Unidos. Toque de queda en Miami Beach por el descontrol de los turistas y el Covid,https://www.clarin.com/viajes/toque-queda-miami-beach-descontrol-turistas-coronavirus_0_VMoI7oB4c.html,https://images.clarin.com/2021/03/20/hdgWOLSAY_720x0__1.jpg
33,Y3iCgxYnh,En primera persona. Probar no es comer: cómo ser jurado gastronómico y seguir con la dieta,https://www.clarin.com/gourmet/probar-comer-jurado-gastronomico-seguir-dieta_0_Y3iCgxYnh.html,https://images.clarin.com/2021/03/20/h0CN1VuvU_720x0__1.jpg
34,ze0UUNq-e,Su fuerte influencia. Twitter cumple 15 años: evolución de la red social valorada en 40 mil millones de dólares,https://www.clarin.com/tecnologia/twitter-cumple-15-anos-evolucion-de-la-red-social-valorada-en-40-mil-millones-de-dolares_0_ze0UUNq-e.html,https://images.clarin.com/2021/03/10/HU3Y4fMhb_720x0__1.jpg
35,K4Imfyptk,Día y noche. Delta del Tigre: 8 restaurantes y bares para comer y beber cerca del río,https://www.clarin.com/gourmet/delta-tigre-8-restaurantes-bares-comer-beber-cerca-rio_0_K4Imfyptk.html,https://images.clarin.com/2021/03/20/eBeuF_9rL_1256x620__2.jpg#1616309818180
36,wfoPGXm7j,Mirá los precios. Cuáles son y cuánto cuestan los autos y pickups fabricados en la Argentina,https://www.clarin.com/autos/cuestan-autos-pickups-fabricados-argentina_0_wfoPGXm7j.html,https://images.clarin.com/2021/03/18/MN56uJc9-_720x0__1.jpg
37,SrYmM_gCv,Tap to Phone. La tecnología que permite a celulares recibir pagos de tarjetas de crédito,https://www.clarin.com/tecnologia/tap-to-phone-nueva-tecnologia-permite-celulares-recibir-pagos-tarjetas-credito_0_SrYmM_gCv.html,https://images.clarin.com/2021/03/17/-et0ZnUJL_720x0__1.jpg
38,19TxHVf83,Feng Shui. Limpieza otoñal: cómo equilibrar las energías Yin-Yang  en esta temporada,https://www.clarin.com/familias/limpieza-otonal-equilibrar-energias-yin-yang-temporada_0_19TxHVf83.html,https://images.clarin.com/2021/03/19/qziPChS7E_720x0__1.jpg
39,LS_MSL9A7,Electrodomésticos. Cómo conseguir descuentos en COTO,https://www.clarin.com/brandstudio/conseguir-descuentos-coto_0_LS_MSL9A7.html,https://images.clarin.com/2021/03/20/1P1jBEjh3_1256x620__2.jpg#1616214754026
40,lFYw2Qtm6,"¿Quién fue ""Hamnet""?. Shakespeare y la peor de sus tragedias: la muerte de su hijo",https://www.clarin.com/cultura/shakespeare-protagonista-drama-alejado-escenario-muerte-hijo_0_lFYw2Qtm6.html,https://images.clarin.com/2009/03/09/ry1RTnkFe_720x0.jpg
41,56AfJewwO,Pequeñas historias. Los increíbles objetos que el hombre dejó en la Luna,https://www.clarin.com/viste/increibles-objetos-hombre-dejo-luna_0_56AfJewwO.html,https://images.clarin.com/2021/03/21/PufuZkUFW_720x0__1.jpg
42,o3AiMvvVW,Astronomía. NASA: calculan por primera vez el tamaño del núcleo de Marte,https://www.clarin.com/internacional/nasa-calculan-primera-vez-tamano-nucleo-marte_0_o3AiMvvVW.html,https://images.clarin.com/2021/03/21/KpnWUyAx8_720x0__1.jpg
43,iIym8Lb4v,"Un grande. Retrato de Anthony Hopkins, el actor más longevo nominado al Oscar",https://www.clarin.com/espectaculos/cine/retrato-anthony-hopkins-actor-longevo-nominado-oscar_0_iIym8Lb4v.html,https://images.clarin.com/2016/06/03/SJGucQ3K4g_720x0.jpg
44,FjvzIIwpe,En España. El mejor árbol europeo tiene mil años y fue un nido de brujas,https://www.clarin.com/viste/mejor-arbol-europeo-espana-mil-anos-nido-brujas_0_FjvzIIwpe.html,https://images.clarin.com/2021/03/21/5xA2TPZ2Y_720x0__1.jpg
45,6ZHTgEcsy,Viral. El hilo de Twitter con los peores baños de los departamentos en alquiler ,https://www.clarin.com/viste/hilo-twitter-peores-banos-departamentos-alquiler-volvio-viral_0_6ZHTgEcsy.html,https://images.clarin.com/2021/03/20/u4YsOj2Xa_720x0__1.jpg
46,xSpY_dqrC,Entrevista. El loco mundo de Verónica de la Canal: ¿es o se hace?,https://www.clarin.com/viva/loco-mundo-veronica-canal-hace_0_xSpY_dqrC.html,https://images.clarin.com/2021/03/16/Ml4NWCq13_720x0__1.jpg
47,roQf1B3Yg,Alta pasión. Montañistas: ¿por qué se juegan la vida para conquistar una cumbre?,https://www.clarin.com/viva/montanistas-juegan-vida-conquistar-cumbre-_0_roQf1B3Yg.html,https://images.clarin.com/2021/03/15/l-kz9xA-I_720x0__1.jpg
48,P4OUPgtvK,"Veinte preguntas. Gabriel Goity: ""Muchos se jactan de ser artistas, pero no mueven el culito""",https://www.clarin.com/viva/gabriel-goity-jactan-artistas--mueven-culito_0_P4OUPgtvK.html,https://images.clarin.com/2021/03/15/NNxshMwhH_720x0__1.jpg
49,n0NHzLIQB,Vidas para leer. El radiólogo que vivió siete años con el cadáver de una paciente,https://www.clarin.com/viva/radiologo-vivio-anos-cadaver-paciente_0_n0NHzLIQB.html,https://images.clarin.com/2021/03/15/XAVf81zaq_720x0__1.jpg
50,Pkr71FPtA,Personaje. Dejó Medicina para escribir y se consagró con Bridgerton,https://www.clarin.com/viva/dejo-medicina-escribir-historias-amor-consagro-bridgerton_0_Pkr71FPtA.html,https://images.clarin.com/2021/03/15/0hZzH_7O2_720x0__1.jpg
51,pDwgKuHpz,"Consultorio. Ser autoexigente: los peligros del ""querer es poder""",https://www.clarin.com/viva/autoexigente-peligros-querer-poder-_0_pDwgKuHpz.html,https://images.clarin.com/2016/08/11/r1lRCi1AQe_720x0.jpg
52,hoXNJMFev,Boom de demanda. Suba de precios y dólar planchado: ¿es negocio construir?,https://www.clarin.com/economia/suba-precios-dolar-planchado-negocio-construir-_0_hoXNJMFev.html,https://images.clarin.com/2021/02/10/gQoz2auqB_720x0__1.jpg
53,wC0Lsxap7,"Entretelas de la política. Soria, ministro de escenario para un ministerio loteado",https://www.clarin.com/economia/soria-ministro-escenario-ministerio-loteado_0_wC0Lsxap7.html,https://images.clarin.com/2021/03/15/plpNkDiVM_720x0__1.jpg
54,4WZJjYklO,Política económica. Radiografía del impacto sectorial de las crisis,https://www.clarin.com/economia/radiografia-impacto-sectorial-crisis_0_4WZJjYklO.html,https://images.clarin.com/2021/03/11/9z6ogEGqc_720x0__1.jpg
55,P3CZ3o1CW,Mirada Global. China: más superávit gracias a la competitividad,https://www.clarin.com/economia/china-superavit-gracias-competitividad_0_P3CZ3o1CW.html,https://images.clarin.com/2020/01/27/6BIBG7-9_720x0__1.jpg
56,JPy67Nib7,Mundo laboral. Claves para no fracasar en una entrevista de trabajo virtual,https://www.clarin.com/economia/atravesar-exito-entrevista-trabajo-virtual_0_JPy67Nib7.html,https://images.clarin.com/2020/11/02/6nKO5CHUA_1256x620__2.jpg#1616242643010
57,G8nNiPOhn,Avanzada contra Tapia. El Gobierno impulsa a un viejo conocido del kirchnerismo en la interna de la AFA,https://www.clarin.com/deportes/alberto-fernandez-impulsa-viejo-conocido-kirchnerismo-interna-poder-afa_0_G8nNiPOhn.html,https://images.clarin.com/2019/12/16/2IMRjy_P_720x0__1.jpg
58,zJIefT-JX,"En el Bajo Flores. Con un golazo de Grahl, Alsosivi sorprende a San Lorenzo",https://www.clarin.com/deportes/san-lorenzo-vs-aldosivi-copa-liga-profesional-minuto-minuto-directo_0_zJIefT-JX.html,https://images.clarin.com/2021/03/21/YvuNIrHy5_1256x620__2.jpg#1616364208794
59,M0AoKHdGf,"Violencia en el GBA. Discusión y muerte frente a un hospital de San Martín: ""No era un delincuente""",https://www.clarin.com/policiales/discusion-muerte-frente-hospital-san-martin-delincuente-_0_M0AoKHdGf.html,https://images.clarin.com/2021/03/21/I-0QQh_xn_1256x620__2.jpg#1616364120130
60,mt2DPWS_l,Ataque e infarto. Murió una mujer en Ramos Mejía tras ser asaltada por un motochorro,https://www.clarin.com/policiales/video-murio-mujer-ramos-mejia-asaltada-motochorro_0_mt2DPWS_l.html,https://images.clarin.com/2021/03/21/ZFvjMXCie_1256x620__2.jpg#1616358491796
61,JO8e4Vh-C,"Apuesta electoral. Aunque falten dosis, el Gobierno mira encuestas y se aferra a la vacunación",https://www.clarin.com/politica/falten-dosis-gobierno-mira-encuestas-aferra-campana-vacunacion_0_JO8e4Vh-C.html,https://images.clarin.com/2021/03/05/B-horuDdp_720x0__1.jpg
62,FRzrNVoOH,Intimidad del poder. Se sublevan las mujeres del Gabinete y las llamas llegan a Cristina y a Kicillof,https://www.clarin.com/politica/sublevan-mujeres-gabinete-llamas-llegan-cristina-kirchner-axel-kicillof_0_FRzrNVoOH.html,https://images.clarin.com/2021/01/02/dBV2BVJUj_720x0__1.jpg
63,crpiuJy8t,En Provincia. Qué se juega en la interna radical: alianzas y el futuro de dos presidenciables,https://www.clarin.com/politica/ucr-votan-bonaerenses-ponen-juego-liderazgos-nacionales_0_crpiuJy8t.html,https://images.clarin.com/2021/03/21/nskpb8cCd_720x0__1.jpg
64,dc0dZE1TJ,A los 88 años. Murió el reconocido cirujano plástico José Juri,https://www.clarin.com/sociedad/murio-reconocido-cirujano-plastico-jose-juri_0_dc0dZE1TJ.html,https://images.clarin.com/2021/03/21/ysAg5JQYe_1256x620__2.jpg#1616350702905
65,cLcVnqfam,"Volver al futuro y un caso increíble. El conflicto con George McFly, el personaje al que reemplazaron con una máscara",https://www.clarin.com/historias/volver-futuro-escandaloso-conflicto-george-mcfly-personaje-reemplazaron-mascara_0_cLcVnqfam.html,https://images.clarin.com/2021/03/20/Mui6s3ktt_720x0__1.jpg
66,7S-PydbjM,"300 horas apagada. La experiencia de ""vacío"" de una chica de 26 años que pasó 12 días en coma por Covid",https://www.clarin.com/sociedad/300-horas-apagada-experiencia-vacio-chica-26-anos-paso-12-dias-coma-inducido-covid_0_7S-PydbjM.html,https://images.clarin.com/2021/03/18/7iND04Nbv_720x0__1.jpg
67,OLeFYxnXe,"""Queen in 3-D"". Brian May reeditó su libro y compartió imágenes inéditas de Freddie Mercury",https://www.clarin.com/espectaculos/musica/brian-may-compartio-imagenes-ineditas-freddie-mercury_0_OLeFYxnXe.html,https://images.clarin.com/2021/03/21/KqXfHNOro_720x0__1.jpg
68,lZO_qt8CX,Finanzas digitales. Diez claves para evitar caer en estafas virtuales,https://www.clarin.com/economia/claves-evitar-caer-estafas-virtuales_0_lZO_qt8CX.html,https://images.clarin.com/2019/11/20/_90icxDG_720x0__1.jpg
69,_Oll3l0Af,Revelación. La actriz rosarina que triunfa interpretando a una estrella porno en una serie de HBO,https://www.clarin.com/espectaculos/tv/actriz-rosarina-triunfa-interpretando-estrella-porno-serie-brasilena-hard_0__Oll3l0Af.html,https://images.clarin.com/2021/03/21/KqLOSdleJ_720x0__1.jpg
70,XVtO_KzS3,"Abuso doméstico. Angelina Jolie va con todo contra Brad Pitt, en su última batalla judicial",https://www.clarin.com/espectaculos/cine/angelina-jolie-va-brad-pitt-ultima-batalla-judicial_0_XVtO_KzS3.html,https://images.clarin.com/2020/08/10/Gcn47j2qN_720x0__1.jpg
71,dCJziX_PF,El Mensajero Sideral. Robo de una obra de Galileo Galilei: la pista del ladrón que fue absuelto en Argentina,https://www.clarin.com/cultura/robo-obra-galileo-galilei-espana-pista-ladron-uruguayo-absuelto-argentina_0_dCJziX_PF.html,https://images.clarin.com/2019/05/30/aoa4_rUTX_720x0__1.jpg
72,PXhjHLRbC,"Amor por las mascotas. Nora Portela, la modelo que brilló en los '70 y hoy convive con perros ciegos y maltratados",https://www.clarin.com/zonales/reconocida-modelo-hoy-cuida-perros-ciegos-maltratados-abandonados-casa-san-isidro_0_PXhjHLRbC.html,https://images.clarin.com/2021/03/01/7ghlYLxXw_1256x620__2.jpg#1615815890249
73,KIBIY7qV1,C Tangana. El trapero al que Calamaro le regaló un verso,https://www.clarin.com/espectaculos/musica/c-tangana-trapero-licenciado-filosofia-andres-calamaro-regalo-verso-mil-horas_0_KIBIY7qV1.html,https://images.clarin.com/2021/03/20/h8comqYus_720x0__1.jpg
74,cLcVnqfam,"Volver al futuro y un caso increíble. El conflicto con George McFly, el personaje al que reemplazaron con una máscara",https://www.clarin.com/historias/volver-futuro-escandaloso-conflicto-george-mcfly-personaje-reemplazaron-mascara_0_cLcVnqfam.html,https://images.clarin.com/2021/03/20/Mui6s3ktt_720x0__1.jpg
75,7S-PydbjM,"300 horas apagada. La experiencia de ""vacío"" de una chica de 26 años que pasó 12 días en coma por Covid",https://www.clarin.com/sociedad/300-horas-apagada-experiencia-vacio-chica-26-anos-paso-12-dias-coma-inducido-covid_0_7S-PydbjM.html,https://images.clarin.com/2021/03/18/7iND04Nbv_720x0__1.jpg
76,OLeFYxnXe,"""Queen in 3-D"". Brian May reeditó su libro y compartió imágenes inéditas de Freddie Mercury",https://www.clarin.com/espectaculos/musica/brian-may-compartio-imagenes-ineditas-freddie-mercury_0_OLeFYxnXe.html,https://images.clarin.com/2021/03/21/KqXfHNOro_720x0__1.jpg
77,lZO_qt8CX,Finanzas digitales. Diez claves para evitar caer en estafas virtuales,https://www.clarin.com/economia/claves-evitar-caer-estafas-virtuales_0_lZO_qt8CX.html,https://images.clarin.com/2019/11/20/_90icxDG_720x0__1.jpg
78,_Oll3l0Af,Revelación. La actriz rosarina que triunfa interpretando a una estrella porno en una serie de HBO,https://www.clarin.com/espectaculos/tv/actriz-rosarina-triunfa-interpretando-estrella-porno-serie-brasilena-hard_0__Oll3l0Af.html,https://images.clarin.com/2021/03/21/KqLOSdleJ_720x0__1.jpg
79,XVtO_KzS3,"Abuso doméstico. Angelina Jolie va con todo contra Brad Pitt, en su última batalla judicial",https://www.clarin.com/espectaculos/cine/angelina-jolie-va-brad-pitt-ultima-batalla-judicial_0_XVtO_KzS3.html,https://images.clarin.com/2020/08/10/Gcn47j2qN_720x0__1.jpg
80,dCJziX_PF,El Mensajero Sideral. Robo de una obra de Galileo Galilei: la pista del ladrón que fue absuelto en Argentina,https://www.clarin.com/cultura/robo-obra-galileo-galilei-espana-pista-ladron-uruguayo-absuelto-argentina_0_dCJziX_PF.html,https://images.clarin.com/2019/05/30/aoa4_rUTX_720x0__1.jpg
81,PXhjHLRbC,"Amor por las mascotas. Nora Portela, la modelo que brilló en los '70 y hoy convive con perros ciegos y maltratados",https://www.clarin.com/zonales/reconocida-modelo-hoy-cuida-perros-ciegos-maltratados-abandonados-casa-san-isidro_0_PXhjHLRbC.html,https://images.clarin.com/2021/03/01/7ghlYLxXw_1256x620__2.jpg#1615815890249
82,KIBIY7qV1,C Tangana. El trapero al que Calamaro le regaló un verso,https://www.clarin.com/espectaculos/musica/c-tangana-trapero-licenciado-filosofia-andres-calamaro-regalo-verso-mil-horas_0_KIBIY7qV1.html,https://images.clarin.com/2021/03/20/h8comqYus_720x0__1.jpg
83,wCEyiTKeH,Jorge Barrio . Tiene 16 años y ganó en dos categorías en el mismo día,https://www.clarin.com/deportes/jorgito-barrio-chico-16-anos-asombrar-corrio-carreras-categorias-diferentes-gano_0_wCEyiTKeH.html,https://images.clarin.com/2021/03/15/rcy0SN87S_720x0__1.jpg
84,9TRKXVS7F,El caso Tanco. Sigue la guerra entre Banfield y Lanús: ¿quién tiene la razón?,https://www.clarin.com/deportes/sigue-guerra-banfield-lanus-razon-caso-tanco-_0_9TRKXVS7F.html,https://images.clarin.com/2021/03/21/_BrzMV7kC_720x0__1.jpg
85,hosbojcRK,Súper TC2000 en el Gálvez. En el nombre del padre: Agustín Canapino y una victoria a pura emoción,https://www.clarin.com/deportes/nombre-padre-agustin-canapino-victoria-pura-emocion-super-tc2000_0_hosbojcRK.html,https://images.clarin.com/2021/03/21/GbNwnj-KX_720x0__1.jpg
86,AEwRmuaLj,En el Sudamericano. El logro de la natación argentina también desnudó un falso análisis de la realidad,https://www.clarin.com/deportes/gran-logro-natacion-argentina-sudamericano-desnudo-falso-analisis-realidad_0_AEwRmuaLj.html,https://images.clarin.com/2021/03/20/bRgl2QFVe_720x0__1.jpg
87,qntAXJ_Vk,Italia. Gaich aprovechó un regalo y Benevento amargó a Juventus,https://www.clarin.com/deportes/gol-adolfo-gaich-benevento-da-batacazo-gana-juventus-erratico-cristiano-ronaldo_0_qntAXJ_Vk.html,https://images.clarin.com/2021/03/21/9M2sUmZhY_720x0__1.jpg
88,jPT-D3rcs,Chantaje. Una modelo reveló que le ofrecieron miles de euros para seducir a Djokovic,https://www.clarin.com/deportes/modelo-revelo-ofrecieron-miles-euros-seducir-novak-djokovic-destruir-carrera_0_jPT-D3rcs.html,https://images.clarin.com/2021/02/21/ZDYH1EXql_720x0__1.jpg
89,Htdwhr29Y,A 20 años. La Tigresa Acuña y un hito: el nacimiento del boxeo femenino en Argentina,https://www.clarin.com/deportes/pelea-invisible-tigresa-acuna-empujar-nacimiento-boxeo-femenino-argentina_0_Htdwhr29Y.html,https://images.clarin.com/2021/03/18/IchUWXk0y_1256x620__2.jpg#1616107707398
