n,id,title,url,image
1,bIVR5SZiO,"Polémica medida. Nuevo avance sobre empresas: deberán decirle al Gobierno sus costos, ventas y stocks",https://www.clarin.com/economia/gobierno-pedira-grandes-empresas-informen-meses-ventas-costos-productos-stock_0_bIVR5SZiO.html,https://images.clarin.com/2020/01/10/K_i_6LQ8_720x0__1.jpg
2,xt2AzH9V8,"Información sensible. El Gobierno persigue el sueño del ""excel total""",https://www.clarin.com/economia/gobierno-cumple-sueno-excel-total-conocer-detalle-informacion-empresas_0_xt2AzH9V8.html,https://images.clarin.com/2021/03/16/dobjGgsRb_720x0__1.jpg
3,4xn8KusEi,"Reacción en Diputados. ""Paradoja Soria"": su llegada a Justicia traba dos leyes clave para el kirchnerismo",https://www.clarin.com/politica/paradoja-soria-designacion-ministro-justicia-traba-leyes-clave-kirchnerismo_0_4xn8KusEi.html,https://images.clarin.com/2021/03/17/oKk8tk88Z_1256x620__2.jpg#1615950077587
4,oyrdGJhPa,Análisis. Ministerio de Justicia: se va la dama y llega Rambo,https://www.clarin.com/opinion/justicia-dama-rambo-martin-soria-marcela-losardo_0_oyrdGJhPa.html,https://images.clarin.com/2021/03/15/HKmDPjesf_720x0__1.jpg
5,Onziah9yi,Del editor. El espectáculo de la política irresponsable,https://www.clarin.com/opinion/espectaculo-politica-irresponsable_0_Onziah9yi.html,https://images.clarin.com/2021/03/13/--j59YzUr_720x0__1.jpg
6,PeFsAa-z7,"Amplían el rastrillaje. Video: la última imagen de Maia, la nena desaparecida en Parque Avellaneda",https://www.clarin.com/sociedad/video-ultima-imagen-maia-nena-7-anos-desaparecida-parque-avellaneda_0_PeFsAa-z7.html,https://images.clarin.com/2021/03/17/UCqhie2To_720x0__1.jpg
7,3ebh79vY0,Bahía Blanca. Los chicos africanos abandonados y una espera larga,https://www.clarin.com/sociedad/luego-4-meses-mellizos-africanos-siguen-alojados-hogar-bahia-blanca-espera-nueva-familia_0_3ebh79vY0.html,https://images.clarin.com/2020/11/25/tmt802HXg_720x0__1.jpg
8,R7zVe9v-j,Tragedia en Bernal. Un chofer de Uber dio marcha atrás para evitar que lo asalten y mató a su pasajera,https://www.clarin.com/policiales/chofer-uber-creyo-iban-asaltar-dio-marcha-mato-pasajera-bernal_0_R7zVe9v-j.html,https://images.clarin.com/2021/03/17/bpLIW4Le5_1256x620__2.jpg#1615977744088
9,IkThK3UT1,Prácticos y efectivos. Suba de la nafta: consejos para ahorrar combustible y gastar menos al cargar,https://www.clarin.com/servicios/aumento-nafta-consejos-ahorrar-combustible-gastar-hora-cargar_0_IkThK3UT1.html,https://images.clarin.com/2021/03/16/MGs6asUyM_720x0__1.jpg
10,IZnJZ6DC6,Especial Clarín. ¿Cuál es la Gioconda argentina? Diez obras de arte que hay que ver,https://www.clarin.com/cultura/-gioconda-argentina-obras-arte-ver-entenderlas-mejor_0_IZnJZ6DC6.html,https://images.clarin.com/2021/03/15/0yjYB6S5M_720x0__1.jpg
11,J5-bjNqKT,"San Patricio limitado. Por la crisis de los pubs del Bajo, el festejo se muda a los barrios",https://www.clarin.com/ciudades/san-patricio-limitado-crisis-pubs-vez-festejo-muda-barrios_0_J5-bjNqKT.html,https://images.clarin.com/2021/03/16/1biapL7GF_1256x620__2.jpg#1615912954095
12,XWo1meAdT,Sin lugar. Los migrantes se agolpan en la frontera de México y EE.UU.,https://www.clarin.com/new-york-times-international-weekly/angustia-frontera-mexico-unidos-migrantes-acumulan_0_XWo1meAdT.html,https://images.clarin.com/2021/03/16/SZR00ZgL2_720x0__1.jpg
13,QDJBwenw8,Coronavirus. Qué distancia recomiendan en el aula,https://www.clarin.com/new-york-times-international-weekly/coronavirus-estudio-sugiere-barbijo-metro-suficiente-distancia-aulas_0_QDJBwenw8.html,https://images.clarin.com/2021/03/16/eRCtp9HiB_720x0__1.jpg
14,u5qXj-7CW,En Yale. Tres millones de personas se inscribieron en un curso sobre la felicidad,https://www.clarin.com/new-york-times-international-weekly/millones-personas-inscribieron-curso-felicidad-aprendieron_0_u5qXj-7CW.html,https://images.clarin.com/2021/03/16/5pS6H0zSK_720x0__1.jpg
15,bIVR5SZiO,"Polémica medida. Nuevo avance sobre empresas: deberán decirle al Gobierno sus costos, ventas y stocks",https://www.clarin.com/economia/gobierno-pedira-grandes-empresas-informen-meses-ventas-costos-productos-stock_0_bIVR5SZiO.html,https://images.clarin.com/2020/01/10/K_i_6LQ8_720x0__1.jpg
16,xt2AzH9V8,"Información sensible. El Gobierno persigue el sueño del ""excel total""",https://www.clarin.com/economia/gobierno-cumple-sueno-excel-total-conocer-detalle-informacion-empresas_0_xt2AzH9V8.html,https://images.clarin.com/2021/03/16/dobjGgsRb_720x0__1.jpg
17,4xn8KusEi,"Reacción en Diputados. ""Paradoja Soria"": su llegada a Justicia traba dos leyes clave para el kirchnerismo",https://www.clarin.com/politica/paradoja-soria-designacion-ministro-justicia-traba-leyes-clave-kirchnerismo_0_4xn8KusEi.html,https://images.clarin.com/2021/03/17/oKk8tk88Z_1256x620__2.jpg#1615950077587
18,oyrdGJhPa,Análisis. Ministerio de Justicia: se va la dama y llega Rambo,https://www.clarin.com/opinion/justicia-dama-rambo-martin-soria-marcela-losardo_0_oyrdGJhPa.html,https://images.clarin.com/2021/03/15/HKmDPjesf_720x0__1.jpg
19,Onziah9yi,Del editor. El espectáculo de la política irresponsable,https://www.clarin.com/opinion/espectaculo-politica-irresponsable_0_Onziah9yi.html,https://images.clarin.com/2021/03/13/--j59YzUr_720x0__1.jpg
20,PeFsAa-z7,"Amplían el rastrillaje. Video: la última imagen de Maia, la nena desaparecida en Parque Avellaneda",https://www.clarin.com/sociedad/video-ultima-imagen-maia-nena-7-anos-desaparecida-parque-avellaneda_0_PeFsAa-z7.html,https://images.clarin.com/2021/03/17/UCqhie2To_720x0__1.jpg
21,3ebh79vY0,Bahía Blanca. Los chicos africanos abandonados y una espera larga,https://www.clarin.com/sociedad/luego-4-meses-mellizos-africanos-siguen-alojados-hogar-bahia-blanca-espera-nueva-familia_0_3ebh79vY0.html,https://images.clarin.com/2020/11/25/tmt802HXg_720x0__1.jpg
22,R7zVe9v-j,Tragedia en Bernal. Un chofer de Uber dio marcha atrás para evitar que lo asalten y mató a su pasajera,https://www.clarin.com/policiales/chofer-uber-creyo-iban-asaltar-dio-marcha-mato-pasajera-bernal_0_R7zVe9v-j.html,https://images.clarin.com/2021/03/17/bpLIW4Le5_1256x620__2.jpg#1615977744088
23,159ODAWSz,Expectativa. Habrá cuatro nuevos cupos en Primera D: los clubes que buscan entrar a la AFA,https://www.clarin.com/deportes/nuevos-cupos-primera-d-clubes-quieren-afiliarse-afa_0_159ODAWSz.html,https://images.clarin.com/2021/03/16/7i7pjhmdV_720x0__1.jpg
24,nytBclzlH,Dura caída. Schwartzman pasó del título en Buenos Aires a la eliminación en Acapulco,https://www.clarin.com/deportes/diego-schwartzman-paso-titulo-buenos-aires-eliminacion-acapulco_0_nytBclzlH.html,https://images.clarin.com/2021/03/17/PPyL1EpNC_1256x620__2.jpg#1615980181817
25,Rn6SJf7C3,Puntero de la Zona 2. Las 5 claves de Julio Falcioni para devolverle la ilusión a Independiente,https://www.clarin.com/deportes/5-claves-julio-falcioni-devolverle-ilusion-independiente_0_Rn6SJf7C3.html,https://images.clarin.com/2021/01/28/j2NOq5zOU_720x0__1.jpg
26,kkYXynMZJ,"Primera Nacional. Tres expulsados, polémicas y pierna fuerte en el triunfo de Atlanta ante Chacarita",https://www.clarin.com/deportes/expulsados-polemicas-pierna-fuerte-triunfo-atlanta-chacarita-superclasico-ascenso_0_kkYXynMZJ.html,https://images.clarin.com/2021/03/16/3I7sX0SEU_720x0__1.jpg
27,pdmpZHGuq,En Neuquén. Brutal: le pateó la cabeza a un rival caído y lo mandó al hospital,https://www.clarin.com/deportes/brutal-pateo-cabeza-rival-caido-mando-hospital-partido-futbol-villa-angostura_0_pdmpZHGuq.html,https://images.clarin.com/2021/03/16/H_emE4hnd_720x0__1.jpg
28,lOA_iUmC7,"Impactante foto. Tevez jugó ante River con el tobillo ""a lo Maradona"" en Italia 90",https://www.clarin.com/deportes/tevez-jugo-superclasico-tobillo-maradona-italia-90_0_lOA_iUmC7.html,https://images.clarin.com/2021/03/16/FhuSYooL6_720x0__1.jpg
29,AVljMHkXi,Su plan para Newell's. Llegó el Mono Burgos al país: ayudantes europeos y dirigir primera y reserva,https://www.clarin.com/deportes/llego-mono-burgos-ayudantes-europeos-quiere-dirigir-primera-reserva-presencia-viernes-duda_0_AVljMHkXi.html,https://images.clarin.com/2021/03/16/b6JkQOo4h_720x0__1.jpg
30,7mdxlOq0C,"Tensión en el Gabinete. Los desafíos de Martín Soria en Justicia y los ""jefes"" internos con los que deberá lidiar",https://www.clarin.com/politica/desafios-martin-soria-justicia-jefes-internos-debera-lidiar_0_7mdxlOq0C.html,https://images.clarin.com/2021/03/16/CEPPn6old_720x0__1.jpg
31,OCt436W-L,Tras la reapertura. El negocio de los cines en pandemia: poca gente y salas al borde de la quiebra,https://www.clarin.com/economia/negocio-cines-pandemia-pelicula-mete-miedo_0_OCt436W-L.html,https://images.clarin.com/2021/03/16/5PAmjmf9y_720x0__1.jpg
32,dnrIemjQ4,Actividad industrial. Por qué sube fuerte la producción de las automotrices,https://www.clarin.com/economia/automotrices-ponen-primera-incremento-produccion-nuevos-turnos_0_dnrIemjQ4.html,https://images.clarin.com/2020/10/22/ckBgNQlBs_720x0__1.jpg
33,jz0DyG2qf,Dinero digital. Bitcoin es la moneda que más ganó en la última década: las claves,https://www.clarin.com/economia/bitcoin-opera-moneda-gano-ultima-decada_0_jz0DyG2qf.html,https://images.clarin.com/2021/03/13/SWsvVIdbd_720x0__1.jpg
34,Kafdg-FKP,"TV Pública. Desplazan a directivos por el retiro de $11,4 millones en efectivo",https://www.clarin.com/politica/desplazan-directivos-tv-publica-retiro-dinero-efectivo-bolsos-11-4-millones_0_Kafdg-FKP.html,https://images.clarin.com/2021/03/16/WOcr3_a1u_720x0__1.jpg
35,LBEeGCwoh,Hospital Español.  Hubo avances para levantar la clausura y no trasladarán a los pacientes internados,https://www.clarin.com/ciudades/clausura-hospital-espanol-reasignan-turnos-pacientes-internados-trasladados_0_LBEeGCwoh.html,https://images.clarin.com/2021/03/16/NdLzpx4cu_1256x620__2.jpg#1615925667761
36,MS6fEsaMM,"PJ bonaerense. La lista de Máximo, con ministros, intendentes y camporistas",https://www.clarin.com/politica/ministros-intendentes-conurbano-camporistas-lista-armo-maximo-kirchner-llegar-poder-pj-bonaerense_0_MS6fEsaMM.html,https://images.clarin.com/2020/05/21/NfZ_FAKC1_720x0__1.jpg
37,1v7wjdlOP,Calendario. La Cámara Electoral fijó la fecha para las PASO y las elecciones generales,https://www.clarin.com/politica/oficializaron-cronograma-electoral-paso-generales_0_1v7wjdlOP.html,https://images.clarin.com/2017/10/22/HkOsjXca-_720x0.jpg
38,JP-EgX0uG,Guía para elegirlas. San Patricio: las mejores cervezas para probar y festejar,https://www.clarin.com/gourmet/san-patricio-mejores-cervezas-probar-festejar_0_JP-EgX0uG.html,https://images.clarin.com/2021/03/16/_MgaADFmv_720x0__1.jpg
39,WTIIJ4dmS,17 de marzo. Las promociones para comprar cerveza con descuento y 2 x 1,https://www.clarin.com/gourmet/san-patricio-promociones-comprar-cerveza-descuento-2-x-1_0_WTIIJ4dmS.html,https://images.clarin.com/2019/03/10/WG11hbrt2_720x0__1.jpg
40,3NMgD1HtH,Semana Santa 2021. Los destinos más buscados y las oportunidades para el fin de semana largo,https://www.clarin.com/viajes/semana-santa-2021-destinos-buscados-oportunidades-fin-semana-largo_0_3NMgD1HtH.html,https://images.clarin.com/2020/11/21/sRq3-ZGa8_720x0__1.jpg
41,WyWtZ4HCS,Adelantarse a la crisis. 10 estrategias para conectarte mejor con tu pareja,https://www.clarin.com/relaciones/10-estrategias-conectarte-mejor-pareja_0_WyWtZ4HCS.html,https://images.clarin.com/2021/03/16/EQFJIW2Fs_720x0__1.jpg
42,fLinu0BGO,"Y no era una Ferrari. Cumple 60 años el ""auto más hermoso del mundo"", según Enzo Ferrari",https://www.clarin.com/autos/cumple-60-anos-auto-hermoso-mundo-enzo-ferrari-hablaba-ferrari_0_fLinu0BGO.html,https://images.clarin.com/2021/03/15/b-Ot2Mayi_720x0__1.jpg
43,m-aCTHHVz,Fertilidad. Endometriosis: ¿cuál es su relación con la microbiota?,https://www.clarin.com/buena-vida/endometriosis-relacion-microbiota_0_m-aCTHHVz.html,https://images.clarin.com/2021/03/16/USWMsLF2g_720x0__1.jpg
44,P6El2DRQD,Astrología oriental. Horóscopo hindú 2021: cuál es tu rashi y qué dice de tu personalidad,https://www.clarin.com/astrologia/horoscopo-hindu-2021-cual-es-tu-rashi-y-que-dice-de-tu-personalidad_0_P6El2DRQD.html,https://images.clarin.com/2021/03/10/IlFYUhh69_1200x0__2.jpg#1615414833802
45,6Ja1gmxyy,El Sistema Enlist. Corteva presenta una nueva agricultura,https://www.clarin.com/rural/corteva-presenta-nueva-agricultura-sistema-enlist-_0_6Ja1gmxyy.html,https://images.clarin.com/2021/03/15/b4yiNlbS0_720x0__1.jpg
46,L2BhUQI5U,Podrían ser clave. Hallan tres bacterias desconocidas en la Estación Espacial Internacional,https://www.clarin.com/internacional/descubren-bacterias-desconocidas-bordo-estacion-espacial-internacional_0_L2BhUQI5U.html,https://images.clarin.com/2020/11/03/UDspSKTKf_720x0__1.jpg
47,QuS8JGPHv,"Macabra historia. Ronald DeFeo, el asesino ""poseído"" cuya masacre inspiró ""Terror en Amityville""",https://www.clarin.com/internacional/murio-ronald-defeo-asesino-poseido-inspiro-terror-amityville-_0_QuS8JGPHv.html,https://images.clarin.com/2021/03/16/YorE-n1Fl_720x0__1.jpg
48,KpIOitJLv,Estados Unidos. Una abuela dijo que fotografió al demonio en la cama de su nieta y se volvió viral,https://www.clarin.com/viste/abuela-dijo-fotografio-demonio-cama-nieta-volvio-viral_0_KpIOitJLv.html,https://images.clarin.com/2021/03/16/aJOV7IRUM_1256x620__2.jpg#1615918944486
49,HJuiPE42b,En París. Un niño pidió disculpas por acosar a un compañero de clase y se tiró al vacío,https://www.clarin.com/viste/murio-nino-saltar-vacio-pedir-disculpas-acosar-companero-clase_0_HJuiPE42b.html,https://images.clarin.com/2021/03/16/9fVcefWYg_720x0__1.jpg
50,VooMasvnP,"Desastre aéreo. En Miami, una avioneta chocó contra un auto y hubo tres muertos",https://www.clarin.com/internacional/video-tragico-miami-avioneta-choco-auto-muertos_0_VooMasvnP.html,https://images.clarin.com/2021/03/16/NVVTB7NpY_720x0__1.jpg
51,5UgZWRY-_,"Video. El lago que puede cambiar de color entre el rosa, el blanco o el azul",https://www.clarin.com/viste/misterio-lago-puede-cambiar-color-rosa-blanco-azul_0_5UgZWRY-_.html,https://images.clarin.com/2021/03/15/SVwsV0hS4_720x0__1.jpg
52,qbgGF6ZT3,Iban a una protesta. Escándalo en Formosa: retienen a opositores en un destacamento,https://www.clarin.com/politica/retuvieron-dirigentes-radicales-formosa-impedian-circular-denunciaran-gildo-insfran_0_qbgGF6ZT3.html,https://images.clarin.com/2021/03/16/QEEZLQ1bN_720x0__1.jpg
53,RFMWQkMQA,"Rescate y polémica. Plus Ultra, la compañía aérea vinculada a Maduro que complica al gobierno de España",https://www.clarin.com/mundo/rescate-plus-ultra-compania-aerea-vinculada-circulo-intimo-nicolas-maduro-complica-gobierno-espana_0_RFMWQkMQA.html,https://images.clarin.com/2017/06/14/Sy94OylQ-_1200x0__2.jpg#1615932753402
54,dNYvT-QXw,Demoras en México. Envasarán dosis de AstraZeneca en EE.UU. para cumplir con la Argentina,https://www.clarin.com/sociedad/coronavirus-demoran-dosis-astrazeneca-mexico-ahora-envasan-ee-uu-cumplir-argentina_0_dNYvT-QXw.html,https://images.clarin.com/2021/03/16/k8qcTpYXW_720x0__1.jpg
55,xbnBR1yWJ,"Nueva etapa. A un mes de la vuelta a clases, cuál es el balance con los contagios de Covid",https://www.clarin.com/ciudades/mes-vuelta-clases-ir-escuela-hizo-subir-contagios-ciudad_0_xbnBR1yWJ.html,https://images.clarin.com/2021/02/19/1TxKgW_Bz_720x0__1.jpg
56,VNG0q6-TC,"Polémica decisión. Los socios pagan la cuota, siguen afuera y en las tribunas hay acomodados ""VIP""",https://www.clarin.com/deportes/socios-pagan-cuota-siguen-afuera-cancha-tribunas-acomodados-vip_0_VNG0q6-TC.html,https://images.clarin.com/2021/03/16/5egfTIqWn_720x0__1.jpg
57,56j2N3KBl,"¿Se va?. La bronca del Kun Agüero en el Manchester City: ""No me pasan la pelota""",https://www.clarin.com/deportes/bronca-kun-aguero-manchester-city-pasan-pelota-_0_56j2N3KBl.html,https://images.clarin.com/2021/03/17/sJyzlyY5a_720x0__1.jpg
58,7f8Kg9FxG,"Cumplió 83 años. ""Veo banderas de Diego, ¿qué pasa?"", la frase conmovedora de Carlos Bilardo",https://www.clarin.com/deportes/carlos-bilardo-cumpleanos-jorge_0_7f8Kg9FxG.html,https://images.clarin.com/2018/09/01/rk9sCtuv7_720x0__1.jpg
59,PkBQF4FZ9,Apps. WhatsApp deja de funcionar en los iPhones: qué modelos quedan afuera,https://www.clarin.com/tecnologia/whatsapp-deja-funcionar-iphones-modelos-quedaron-ultima-version_0_PkBQF4FZ9.html,https://images.clarin.com/2021/03/16/D7wwugH2z_720x0__1.jpg
60,dWJuNkMtJ,"Laura Grassi y una carrera accidental. La Tana, sonrisa de la pandemia: la azafata que copó la televisión argentina",https://www.clarin.com/historias/tana--sonrisa-pandemia-azafata-copo-television-argentina_0_dWJuNkMtJ.html,https://images.clarin.com/2021/03/16/AcHhKymWq_1256x620__2.jpg#1615898583382
61,gDV5qK6F3,"Entrevista. Maia Reficco, la argentina que fue la Evita más joven de Broadway",https://www.clarin.com/espectaculos/musica/maia-reficco-argentina-evita-joven-broadway_0_gDV5qK6F3.html,https://images.clarin.com/2021/03/16/VJmdy35Uh_720x0__1.jpg
62,P4OUPgtvK,"Veinte preguntas. Gabriel Goity: ""Muchos se jactan de ser artistas, pero no mueven el culito""",https://www.clarin.com/viva/gabriel-goity-jactan-artistas--mueven-culito_0_P4OUPgtvK.html,https://images.clarin.com/2021/03/15/NNxshMwhH_720x0__1.jpg
63,roQf1B3Yg,Alta pasión. Montañistas: ¿por qué se juegan la vida para conquistar una cumbre?,https://www.clarin.com/viva/montanistas-juegan-vida-conquistar-cumbre-_0_roQf1B3Yg.html,https://images.clarin.com/2021/03/15/l-kz9xA-I_720x0__1.jpg
64,03RnKDXne,Historias sobre ruedas. El jefe de equipo de la F1 que tuvo a Niki Lauda de mentor y se hizo famoso en Netflix,https://www.clarin.com/deportes/jefe-equipo-formula-1-niki-lauda-mentor-hizo-famoso-serie-netflix_0_03RnKDXne.html,https://images.clarin.com/2021/03/16/rT5Rq6OEw_720x0__1.jpg
65,MyJi7TwlX,Biomarcador. Qué dice la velocidad a la que caminás sobre tu riesgo frente al coronavirus,https://www.clarin.com/buena-vida/dice-velocidad-caminas-riesgo-frente-coronavirus_0_MyJi7TwlX.html,https://images.clarin.com/2020/01/24/ebzCvfqV_720x0__1.jpg
66,LLbDonIGH,Mariana Eva Pérez. La Princesa Montonera está de vuelta,https://www.clarin.com/cultura/princesa-montonera-vuelta-cosa-reconocer-figuras-resistieron-hace-40-anos-ponerlas-autoridad-indiscutida-_0_LLbDonIGH.html,https://images.clarin.com/2021/03/17/VuTr57Y4e_720x0__1.jpg
67,ulmmsRowb,Hamburguesas. Alimentación saludable: ya es tendencia y cada vez es más fácil sumarse,https://www.clarin.com/brandstudio/alimentacion-saludable-tendencia-vez-facil-sumarse_0_ulmmsRowb.html,https://images.clarin.com/2021/03/12/xpTuwlI-n_720x0__1.jpg
68,bSveKLfcH,En crecimiento. AFA: así es el Plan Estratégico de futsal 2021-2025,https://www.clarin.com/brandstudio/afa-plan-estrategico-futsal-2021-2025_0_bSveKLfcH.html,https://images.clarin.com/2021/02/03/UCQBxaMEr_720x0__1.jpg
69,-3i2b967j,Igualdad . Nos lavaron la cabeza con los mandatos de feminidad,https://www.clarin.com/brand-studio/lavaron-cabeza-mandatos-feminidad_0_-3i2b967j.html,https://images.clarin.com/2021/03/04/pL8RTKU9c_720x0__1.jpg
70,Qn8USrVoa,En primera persona. Historias de mujeres que rompieron con los prejuicios de la sociedad,https://www.clarin.com/brandstudio/historias-mujeres-rompieron-prejuicios-sociedad_0_Qn8USrVoa.html,https://images.clarin.com/2019/12/11/N-U6a-lX_720x0__1.jpg
71,179ExUtXY,Dejar a un lado los prejucios. Mitos derribados sobre el pelo,https://www.clarin.com/brandstudio/mitos-derribados-pelo_0_179ExUtXY.html,https://images.clarin.com/2021/03/14/rj1K7JthD_720x0__1.jpg
72,mLI21CcRQ,Volver a aprender. Una campaña que celebra la diversidad de las mujeres,https://www.clarin.com/brandstudio/campana-celebra-diversidad-mujeres_0_mLI21CcRQ.html,https://images.clarin.com/2021/02/17/qdc_015op_1256x620__2.jpg#1615758869301
73,OY62eNFKa,"Tu pelo, tu elección. Los chistes que no van",https://www.clarin.com/brandstudio/chistes-van_0_OY62eNFKa.html,https://images.clarin.com/2021/03/14/tCYn4hD1A_720x0__1.jpg
