n,id,title,url,image
1,GEuxsIxqS,Minuto a minuto. En vivo: el Gobierno promete que los primeros resultados oficiales se conocerán a las 21,https://www.clarin.com/politica/elecciones-paso-2021-vivo-segui-minuto-minuto-votacion-legislativas_0_GEuxsIxqS.html,https://images.clarin.com/2021/09/12/0kQm-M7egB_720x0__1.jpg
2,SPCohV5Uo,"Cerró la votación. PASO 2021: el Frente de Todos saca ventaja en la Provincia, en una elección con pocos votantes",https://www.clarin.com/politica/paso-2021-frente-saca-ventaja-provincia-eleccion-pocos-votantes_0_SPCohV5Uo.html,https://images.clarin.com/2021/09/12/O6wM-BPTQ_720x0__1.jpg
3,fuJhCTxUK,Elecciones 2021. La fiebre de encuestas traspasó la veda y se desató la guerra de bocas de urna de las PASO,https://www.clarin.com/politica/elecciones-2021-fiebre-encuestas-traspaso-veda-empezo-guerra-bocas-urna-paso_0_fuJhCTxUK.html,https://images.clarin.com/2021/09/12/Xb58wXxRs_720x0__1.jpg
4,zo9-KIJ_O,Sólo votó el 67%. Histórico: las PASO 2021 tuvieron el nivel más bajo de participación desde 1983,https://www.clarin.com/politica/historico-67-ciento-paso-2021-nivel-participacion-1983_0_zo9-KIJ_O.html,https://images.clarin.com/2021/09/12/l8GSO134p_720x0__1.jpg
5,kvJYTHL3I,"Humor político. El que no vota, no mama",https://www.clarin.com/opinion/vota-mama_0_kvJYTHL3I.html,https://images.clarin.com/2021/09/11/cq1JX93NS_720x0__1.jpg
6,fOAdmq-dr,En Capital y GBA. Largas filas y poca distancia afuera de los colegios: cómo fue votar en pandemia,https://www.clarin.com/sociedad/votar-pandemia-paso-2021-largas-filas-poca-distancia-afuera-colegios_0_fOAdmq-dr.html,https://images.clarin.com/2021/09/12/xnk8XHIf2_1256x620__2.jpg#1631483787969
7,dlnfEIvb8,"Curiosidades de las PASO. Un ""carpincho"" a las urnas y un votante disfrazado de coronavirus",https://www.clarin.com/politica/elecciones-paso-2021-curiosa-foto-alberto-fernandez-cabalas-candidatos-humor-redes_0_dlnfEIvb8.html,https://images.clarin.com/2021/09/12/N6v7r1nGp_1256x620__2.jpg#1631462910939
8,i5h38txGc,Glamour en las urnas. Desde Mirtha Legrand a Candelaria Tinelli: así votaron los famosos,https://www.clarin.com/fama/mirtha-legrand-candelaria-tinelli-votaron-famosos_0_i5h38txGc.html,https://images.clarin.com/2021/09/12/EbEyGNg_M_720x0__1.jpg
9,T0-RuzS0K,"La intimidad del poder. Cristina Kirchner, su alarma por el dólar y por qué está ansioso todo el Gabinete",https://www.clarin.com/politica/cristina-kirchner-alarma-dolar-ansiedad-gabinete-cambios-vienen_0_T0-RuzS0K.html,https://images.clarin.com/2021/08/17/vwB4of7uh_720x0__1.jpg
10,FsVxOr9h3,Ausencias no justificadas. ¿Qué pasa si no voté en las PASO 2021?,https://www.clarin.com/politica/elecciones-paso-2021-argentina-pasa-voto_0_FsVxOr9h3.html,https://images.clarin.com/2019/11/01/a4jd3SgB_720x0__1.jpg
11,e3yNFLy6z,Lo barrió en tres set. Un Medvedev implacable frustró el sueño de Djokovic y se quedó con el US Open,https://www.clarin.com/deportes/final-us-open-2021-novak-djokovic-daniil-medvedev-previa-minuto-minuto-directo_0_e3yNFLy6z.html,https://images.clarin.com/2021/09/12/Yw2BxBBU6_1256x620__2.jpg#1631483412686
12,LXYebzhEs,Pura bronca. Djokovic estalló de impotencia ante Medvedev y destrozó su raqueta,https://www.clarin.com/deportes/us-open-djokovic-estallo-impotencia-destrozo-raqueta_0_LXYebzhEs.html,https://images.clarin.com/2021/09/12/5zYoeXu3q_720x0__1.jpg
13,d5mopBx6b,GP de Italia. Así fue el choque para la historia: la FIA responsabilizó y sancionó a Verstappen,https://www.clarin.com/deportes/formula-1-sancion-choque-verstappen-hamilton-culpa-gp-italia-monza_0_d5mopBx6b.html,https://images.clarin.com/2021/09/12/KZnKcT_I__720x0__1.jpg
14,,Fotos. Las 100 mejores imágenes de las PASO,,
15,77Vl1v2zR,Micaela Acevedo. Se fue a Italia tras la huella de Maradona y hoy trabaja en el Inter,https://www.clarin.com/espectaculos/tv/italia-huella-maradona-hoy-trabaja-inter-argentina-micaela-acevedo_0_77Vl1v2zR.html,https://images.clarin.com/2021/09/08/ZLV6pJVsm_720x0__1.jpg
16,kdL6rDJPd,Mal momento. Escrachan al procesado juez Walter Bento en una parrilla en Mendoza,https://www.clarin.com/politica/elecciones-paso-2021-escrachan-juez-walter-bento-parrilla-palmares_0_kdL6rDJPd.html,https://images.clarin.com/2021/08/10/djcRcE-TP_720x0__1.jpg
17,tcDKMkXOH,Irregularidades. Julián Weich fue a votar y se llevó una fuerte sorpresa al ver el padrón electoral,https://www.clarin.com/fama/julian-weich-votar-llevo-fuerte-sorpresa-ver-padron-electoral_0_tcDKMkXOH.html,https://images.clarin.com/2021/03/07/9ekFi1nk4_720x0__1.jpg
18,Z8LLpCM9M,Historias. La emoción de un inmigrante que votó por primera vez tras vivir medio siglo en Argentina,https://www.clarin.com/sociedad/elecciones-paso-2021-emocion-inmigrante-voto-primera-vez-vivir-medio-siglo-argentina_0_Z8LLpCM9M.html,https://images.clarin.com/2021/09/12/trWGEUq9N_720x0__1.jpg
19,mOCAxNiKp,"F1 en Monza. Tras el escándalo entre Verstappen y Hamilton, McLaren hizo un 1-2 histórico",https://www.clarin.com/deportes/formula-1-gran-premio-italia-monza-resultados-ricciardo-choque-verstappen-hamilton_0_mOCAxNiKp.html,https://images.clarin.com/2021/09/12/kk67YTFG3_720x0__1.jpg
20,8h4KozQPB,"Coronavirus en Argentina. Después de 461 días, se reportaron menos de mil casos diarios",https://www.clarin.com/sociedad/coronavirus-argentina-confirman-930-nuevos-casos-46-muertes-ultimas-24-horas_0_8h4KozQPB.html,https://images.clarin.com/2021/08/30/dPLmHTkec_720x0__1.jpg
21,muLzcL4ie,Contámelo otra vez. La ballena que sólo quería jugar: cómo se hizo el video que emocionó al mundo,https://www.clarin.com/sociedad/ballena-solo-queria-jugar-hizo-video-minuto-emociono-mundo_0_muLzcL4ie.html,https://images.clarin.com/2021/09/10/i_NVLXref_1256x620__2.jpg#1631384036607
22,fZZQOpiyC,Hay casos de Delta. Brote de Covid en la escuela ORT: investigan si hay nexo de contagio con algún viajero,https://www.clarin.com/ciudades/brote-covid-escuela-ort-belgrano-investigan-nexo-contagio-algun-viajero_0_fZZQOpiyC.html,https://images.clarin.com/2021/05/03/vA-nbSba4_720x0__1.jpg
23,bFHYaDZne,Minuto a minuto. Regresó Andy Kusnetzoff y se reeditó el duelo con Juana Viale: ¿quién se impuso?,https://www.clarin.com/espectaculos/tv/regreso-andy-kusnetzoff-reedito-duelo-juana-viale-impuso-rating-_0_bFHYaDZne.html,https://images.clarin.com/2021/04/04/NtYbjGLSw_720x0__1.jpg
24,mXOtnvr6r,"Violencia de género. Paola Tacacho, la mujer que ""hizo todo y más"" para detener a su acosador: igual la mataron",https://www.clarin.com/policiales/paola-tacacho-mujer-hizo-detener-acosador-igual-mataron_0_mXOtnvr6r.html,https://images.clarin.com/2021/05/31/Iq3OOcJNI_720x0__1.jpg
25,L9HsB59s3,"Afganistán. Entre lujos y armas, los talibanes acampan en el palacio de su peor enemigo",https://www.clarin.com/mundo/afganistan-lujos-armas-talibanes-acampan-kabul-palacio-peor-enemigo_0_L9HsB59s3.html,https://images.clarin.com/2021/09/12/v4LYHgIi6_1200x0__2.jpg#1631463431283
26,Q9hkCAXnT,Dictadura en Nicaragua. Carta pública de apoyo al escritor Sergio Ramírez,https://www.clarin.com/cultura/carta-publica-apoyo-escritor-sergio-ramirez_0_Q9hkCAXnT.html,https://images.clarin.com/2021/09/08/Shfbfu2ec_720x0__1.jpg
27,6Nn0t9URB,Tendencias. Motorhomes: qué modelos se pueden alquilar en Argentina y cuánto cuestan,https://www.clarin.com/viajes/motorhomes-modelos-pueden-alquilar-argentina-cuestan_0_6Nn0t9URB.html,https://images.clarin.com/2021/09/10/xv5RV6YsT_720x0__1.jpg
28,q3KZuK_cz,Historias visuales. Las mejores fotos de la semana,https://www.clarin.com/fotogalerias/dia-fotos-mejores-imagenes-argentina-mundo_5_q3KZuK_cz.html,
29,Yz_nTZgyD,El Leeds sigue sin ganar. Liverpool le dio otro golpe a Bielsa en un partido marcado por el dolor de Elliott,https://www.clarin.com/deportes/liverpool-leeds-bielsa-goles-resumen-resultado-lesion-harvey-elliott_0_Yz_nTZgyD.html,https://images.clarin.com/2021/09/12/7ZsubL3-A_720x0__1.jpg
30,aMFDVfIIo,Baja inesperada en Boca. Advíncula tendrá que aislarse siete días por tomar un vuelo comercial,https://www.clarin.com/deportes/boca-juniors-luis-advincula-peru_0_aMFDVfIIo.html,https://images.clarin.com/2021/09/12/3q3UTrNfg_720x0__1.jpg
31,fsypbvpPT,Recupera jugadores. Gallardo espera armar su equipo ideal frente a Newell's,https://www.clarin.com/deportes/gallardo-espera-armar-equipo-ideal-frente-newell-s_0_fsypbvpPT.html,https://images.clarin.com/2021/09/12/JoYvgtNem_720x0__1.jpg
32,M6FdKOiQk,Héroe de la F1. El halo salvó la cabeza de Hamilton de ser aplastada por el auto de Verstappen,https://www.clarin.com/deportes/halo-salvo-cabeza-hamilton-accidente-choque-verstappen-gp-italia-monza_0_M6FdKOiQk.html,https://images.clarin.com/2021/09/12/5CXGgTBxy_720x0__1.jpg
33,SwqEsBfes,Raducanu. La obsesiva del estudio que tenía pasaje de vuelta para el final de la qualy y ganó,https://www.clarin.com/deportes/emma-raducanu-obsesiva-estudio-pasaje-vuelta-final-qualy-gano-us-open_0_SwqEsBfes.html,https://images.clarin.com/2021/09/11/_nBU3lYdz_720x0__1.jpg
34,hq6f8S7mG,Leyenda en la lona. Papelón de Holyfield: Belfort le dio una paliza y la pelea duró menos de un round,https://www.clarin.com/deportes/papelon-evander-holyfield-vitor-belfort-dio-paliza-pelea-trump-comentarista-duro-round_0_hq6f8S7mG.html,https://images.clarin.com/2021/09/11/gwRuUooBt_1256x620__2.jpg#1631415540627
35,x-2HWUU3f,"Camino a las PASO 2021. Además de sexo y porro, en la campaña se habló de impuestos, reforma laboral e inflación",https://www.clarin.com/economia/ademas-sexo-faso-candidatas-hot-campana-hablo-impuestos-reforma-laboral-inflacion_0_x-2HWUU3f.html,https://images.clarin.com/2021/09/07/pASNd8cjK_720x0__1.jpg
36,PzfMDujeR,Entretelas de la política. Alberto adelanta festejos ajenos,https://www.clarin.com/economia/alberto-adelanta-festejos-ajenos_0_PzfMDujeR.html,https://images.clarin.com/2021/09/09/bGHTJPhx6_720x0__1.jpg
37,h_YVSWQ_a,"Conflicto bilateral. Además de China, Uruguay negocia más acuerdos por afuera del Mercosur",https://www.clarin.com/economia/ademas-china-uruguay-negocia-acuerdos-afuera-mercosur_0_h_YVSWQ_a.html,https://images.clarin.com/2020/07/20/r7hccy5YA_720x0__1.jpg
38,4ibwrx6KD,"Definiciones polémicas. Melconian y el dólar: ""Es insostenible de acá a noviembre""",https://www.clarin.com/economia/carlos-melconian-dolar-mercado-cambiario-insostenible-aca-noviembre-_0_4ibwrx6KD.html,https://images.clarin.com/2021/07/27/-zbHOEPmA_720x0__1.jpg
39,ema6o5kn6,De Pablo. Sin programa económico alguna devaluación será inevitable,https://www.clarin.com/economia/juan-carlos-pablo-programa-economico-alguna-devaluacion-inevitable_0_ema6o5kn6.html,https://images.clarin.com/2020/08/28/wKlW7_4kP_720x0__1.jpg
40,IcN3XTmXQ,Furor cripto. Por qué esta semana fue histórica para las criptomonedas,https://www.clarin.com/economia/semana-historica-criptomonedas_0_IcN3XTmXQ.html,https://images.clarin.com/2021/07/20/rv2JPJSnH_720x0__1.jpg
41,AY486L-u7,"Entrevista. Osvaldo Gross: ""Damián Betular es bueno pero hay cientos como él""",https://www.clarin.com/gourmet/osvaldo-gross-damian-betular-bueno-cientos-_0_AY486L-u7.html,https://images.clarin.com/2021/09/10/SYmIYL31v_1256x620__2.jpg#1631298691248
42,nfWHQYJXg,Todos los estilos. Bares para beber buen whisky: cinco propuestas distintas en Buenos Aires,https://www.clarin.com/gourmet/bares-beber-buen-whisky-5-propuestas-distintas-buenos-aires_0_nfWHQYJXg.html,https://images.clarin.com/2021/09/10/RWv7DsLpu_1256x620__2.jpg#1631312413581
43,R9mVsnwjc,"Divisa oficial. La Fiesta del ""Chivo"": los salvadoreños intentan comprender el bitcoin",https://www.clarin.com/tecnologia/fiesta-chivo-salvadorenos-intentan-comprender-bitcoin_0_R9mVsnwjc.html,https://images.clarin.com/2021/09/09/RIkq9q94c_720x0__1.jpg
44,HiOz7ZYIE,"Alejarse de los tóxicos. Qué es una ""persona vitamina"" y cómo encontrar la tuya",https://www.clarin.com/relaciones/persona-vitamina-encontrar_0_HiOz7ZYIE.html,https://images.clarin.com/2021/09/10/2thuUCavW_1256x620__2.jpg#1631297507955
45,qW48984KM,Opinión. Cinco pasos de inteligencia emocional para repensar tu pareja,https://www.clarin.com/relaciones/5-pasos-inteligencia-emocional-repensar-pareja_0_qW48984KM.html,https://images.clarin.com/2021/09/10/UsVM3KOx5_1256x620__2.jpg#1631294269340
46,KHllVvTRm,"Ranking. Los signos más ""sabios"" del zodíaco",https://www.clarin.com/astrologia/5-signos-sabios-zodiaco_0_KHllVvTRm.html,https://images.clarin.com/2021/09/10/MiREjFLe1_720x0__1.jpg
47,0pSboXYMG,"En Netflix. Kate, como película de acción, está realmente muy bien",https://www.clarin.com/espectaculos/cine/netflix-kate-pelicula-accion-realmente-bien_0_0pSboXYMG.html,https://images.clarin.com/2021/08/24/VF1EWprNi_720x0__1.jpg
48,hAh6CTdkA,"Ciclos de edad. La crisis de los 40, explicada por la astrología",https://www.clarin.com/astrologia/crisis-40-explicada-astrologia_0_hAh6CTdkA.html,https://images.clarin.com/2021/09/10/xLmzSSZyj_720x0__1.jpg
49,ObUSlYtmn,Usó una estafa piramidal. El actor de Hollywood que engañó a sus amigos y les robó 230 millones de dólares,https://www.clarin.com/viste/zach-avery-actor-hollywood-engano-amigos-robo-230-millones-dolares-estafa-piramidal_0_ObUSlYtmn.html,https://images.clarin.com/2021/09/10/-N1xnwDAG_720x0__1.jpg
50,I-s8bZisY,"Astronomía. Captan las mejores fotos de Kleopatra, el asteroide ""hueso de perro""",https://www.clarin.com/internacional/captan-mejores-fotos-kleopatra-asteroide-hueso-perro-justo-momento-giraba_0_I-s8bZisY.html,https://images.clarin.com/2021/09/11/TAFmQ9VYc_720x0__1.jpg
51,8MGm7va85,¿Qué le pasó?. Ocaso y muerte dudosa: el final del jefe de El Superagente 86,https://www.clarin.com/internacional/espectaculos/ocaso-muerte-esclarecida-abatido-final-edward-platt-jefe-superagente-86_0_8MGm7va85.html,https://images.clarin.com/2021/09/09/peCPUEluU_720x0__1.jpg
52,ZkxvGIUoz,"Canadá. Quemaron en escuelas miles de libros de Tintín, Astérix y Lucky Luke por racistas",https://www.clarin.com/internacional/quemaron-miles-libros-tintin-asterix-lucky-luke-racistas-escuelas-canada_0_ZkxvGIUoz.html,https://images.clarin.com/2019/10/14/FhkCnIvN_720x0__1.jpg
53,W8tn7IURW,Contenido patrocinado. ¿Por qué invertir en Uruguay es tendencia?,https://www.clarin.com/brandstudio/-invertir-uruguay-tendencia-_0_W8tn7IURW.html,https://images.clarin.com/2021/09/10/GH0v_hwRf_720x0__1.jpg
54,REgAuiIQu,"Fórmula premium. Diesel Premium del futuro, para motores cada vez más evolucionados",https://www.clarin.com/brand-studio/diesel-premium-futuro-motores-vez-evolucionados_0_REgAuiIQu.html,https://images.clarin.com/2021/09/01/aW9e2wYZW_720x0__1.jpg
55,UGPxmUaq7,"Comercio exterior. A China, sin escalas: todo sobre el pabellón argentino del ICBC Mall China",https://www.clarin.com/brandstudio/china-escalas-pabellon-argentino-icbc-mall-china_0_UGPxmUaq7.html,https://images.clarin.com/2021/09/06/iAuRpY2NE_720x0__1.jpg
56,jnOuEb5Uc,Fragancia única. Phantom aterrizó en Buenos Aires con un impactante show en el Planetario,https://www.clarin.com/brandstudio/phantom-aterrizo-buenos-aires-impactante-show-planetario_0_jnOuEb5Uc.html,https://images.clarin.com/2021/09/08/1zCIi_C5Z_1256x620__2.jpg#1631123040488
57,MiOb0q3w6,"""Tenés que hacerte fuerte"". La ex ""GH"" que lloró por las Torres Gemelas con Soledad Silveyra contó la verdad sobre el llanto",https://www.clarin.com/fama/ex-gran-hermano-lloro-torres-gemelas-soledad-silveyra-conto-verdad-llanto_0_MiOb0q3w6.html,https://images.clarin.com/2021/09/11/CZN1o2Yyb_720x0__1.jpg
58,yg-Pym63e,"Marcelo Tinelli. Emitió su voto y señaló si se imagina como candidato: ""La rosca política me distancia""",https://www.clarin.com/fama/marcelo-tinelli-emitio-voto-senalo-rosca-politica-distancia-_0_yg-Pym63e.html,https://images.clarin.com/2021/09/12/d-0itJRiu_720x0__1.jpg
59,eVBRQQhP1,"Primera vez como candidata. Cinthia Fernández fue a votar con look deportivo y reflexionó: ""Estoy feliz de no ser cobarde""",https://www.clarin.com/fama/cinthia-fernandez-votar-look-deportivo-reflexiono-feliz-cobarde-_0_eVBRQQhP1.html,https://images.clarin.com/2021/09/12/K9Z__QtGh_720x0__1.jpg
60,5FoNp2lBp,No se calló nada. El comentario con el que Angel de Brito lapidó a Jorge Rial: “Lo dicen hasta sus compañeros...”,https://www.clarin.com/fama/angel-brito-hablo-casado-luego-lapido-jorge-rial_0_5FoNp2lBp.html,https://images.clarin.com/2021/09/11/NVIbEV7Ky_720x0__1.jpg
61,NWBWqkhOs,Crisis sanitaria. Menos casos Covid: hasta cuándo habrá que seguir usando el barbijo en la calle,https://www.clarin.com/sociedad/baja-casos-seguir-usando-barbijo-caminar-calle_0_NWBWqkhOs.html,https://images.clarin.com/2021/08/19/ls6hsiiFa_720x0__1.jpg
62,b3-9YcyqK,Móviles. Los celulares premium que se venden a mejor precio en el país,https://www.clarin.com/tecnologia/celulares-premium-venden-mejor-precio-pais_0_b3-9YcyqK.html,https://images.clarin.com/2021/08/26/IKi4kngLp_720x0__1.jpg
63,2q9ie4r2d,"Especial Clarín. A 20 años del 11-S, el último sobreviviente de las Torres Gemelas",https://www.clarin.com/mundo/ultimo-sobreviviente_0_2q9ie4r2d.html,https://images.clarin.com/2021/09/07/PWjdezPAa_720x0__1.jpg
64,9pOR4nrsx,Billetes engañosos. Dólares falsos: 8 chequeos clave y la nueva app para hacerlos con el celular,https://www.clarin.com/servicios/detectar-dolares-falsos-8-chequeos-clave-nueva-app-hacerlos-celular_0_9pOR4nrsx.html,https://images.clarin.com/2021/07/20/hbCyUfN2Z_720x0__1.jpg
65,-CMNbVAg5,"Recorte de gastos. Prepagas económicas: 5 alternativas ""low cost"", qué ofrecen y cuánto cuestan",https://www.clarin.com/servicios/prepagas-economicas-5-alternativas-low-cost-ofrecen-cuestan_0_-CMNbVAg5.html,https://images.clarin.com/2019/10/30/uZqqurZi_720x0__1.jpg
66,sR_xbLpUK,Escándalo internacional. La inquietante historia detrás de las 12 valijas con droga en la embajada rusa,https://www.clarin.com/policiales/espias-diplomaticos-policias-inquietante-trama-12-narcovalijas-embajada-rusa_0_sR_xbLpUK.html,https://images.clarin.com/2021/09/02/Wt5VOz0v2_720x0__1.jpg
67,j5owUSw_W,En alza. Criptomonedas: ¿cuánta plata se puede ganar con una PC desde el living de casa?,https://www.clarin.com/especiales/criptomonedas-plata-puede-ganar-pc-living-casa-_0_j5owUSw_W.html,https://images.clarin.com/2021/08/16/SZDgaDM6F_720x0__1.jpg
68,nLkI_EbdH,Jagger vs. McCartney. Cuál es la verdad sobre la grieta entre los Beatles y los Rolling Stones,https://www.clarin.com/espectaculos/beatles-vs-rolling-stones-grieta-existio-sigue-abierta_0_nLkI_EbdH.html,https://images.clarin.com/2021/08/30/PyFd0KEYI_720x0__1.jpg
69,R8yXCE_RH,"Delitos en alza. Cómo  son las ciberestafas que llegan por Whatsapp, Facebook o Instagram",https://www.clarin.com/tecnologia/puede-pasar-estafas-whatsapp-facebook-instagram_0_R8yXCE_RH.html,https://images.clarin.com/2021/09/02/ncCHIb4BU_720x0__1.jpg
