n,id,title,url,image
1,uPO3HZOel,Escasez de vacunas. Coronavirus: la región compra millones de dosis de Pfizer y Argentina alimenta el misterio,https://www.clarin.com/sociedad/vacuna-pfizer-region-compra-millones-dosis-covid-argentina-alimenta-mayor-misterio-pandemia_0_uPO3HZOel.html,https://images.clarin.com/2020/11/09/XluYX0V1m_720x0__1.jpg
2,FiyfEv4M_,Del editor. Los días de Alberto: faltan vacunas y sobran motochorros,https://www.clarin.com/opinion/dias-alberto-fernandez-pocas-vacunas-motochorros_0_FiyfEv4M_.html,https://images.clarin.com/2021/03/10/1zw9sdtZ3_720x0__1.jpg
3,0FtaUPAaY,"Coronavirus. Quirós: ""No hay dudas de que está por delante una segunda ola""",https://www.clarin.com/sociedad/coronavirus-fernan-quiros-advirtio-segunda-ola_0_0FtaUPAaY.html,https://images.clarin.com/2021/03/25/gZz1oLBVg_720x0__1.jpg
4,HMcqZy7vB,La deuda con el FMI. Cristina Kirchner ya no oculta diferencias con Guzmán y exige más agresividad,https://www.clarin.com/economia/cristina-oculta-diferencias-guzman-deuda-exige-negociacion-agresiva_0_HMcqZy7vB.html,https://images.clarin.com/2021/03/24/5WHNn9Xn2_720x0__1.jpg
5,qFoZCFR9m,Roce por Venezuela. La reacción de EE.UU. ante la salida de Argentina del Grupo de Lima,https://www.clarin.com/politica/reaccion-unidos-salida-argentina-grupo-lima_0_qFoZCFR9m.html,https://images.clarin.com/2021/03/24/N9sXXDIuz_720x0__1.jpg
6,j4IXM1ttw,Giro diplomático. Felipe Solá y una comunicación al Departamento de Estado,https://www.clarin.com/politica/felipe-sola-comunicamos-departamento-cambios-relacion-venezuela-_0_j4IXM1ttw.html,https://images.clarin.com/2021/01/24/P9UIT-3CY_720x0__1.jpg
7,DMpnnzmDw,En Moreno. Un veterano de Malvinas mató a tiros a una pareja de ladrones y quedó detenido,https://www.clarin.com/policiales/veterano-malvinas-mato-tiros-pareja-ladrones-moreno_0_DMpnnzmDw.html,https://images.clarin.com/2021/03/24/3mFrwrUbQ_1256x620__2.jpg#1616622201602
8,5d2tV5_aW,Walmart. Denuncian un apriete de los Moyano a los nuevos dueños,https://www.clarin.com/economia/fuerte-presion-camioneros-arrinconan-nuevos-duenos-walmart_0_5d2tV5_aW.html,https://images.clarin.com/2021/03/24/IdQ6ak2oj_720x0__1.jpg
9,s4cm_7g2V,"Con Clarín. El Beto Alonso, un mito que encontró paz en el golf y que sueña con aparecer en la Play",https://www.clarin.com/deportes/beto-alonso-mito-viviente-encontro-paz-golf-suena-aparecer-playstation_0_s4cm_7g2V.html,https://images.clarin.com/2021/03/25/PCWy6NYg3_720x0__1.jpg
10,l21tRE-1H,"Consumo. Ofertas, promos y Precios Cuidados: 10 claves para combinar y ahorrar",https://www.clarin.com/servicios/ofertas-promos-precios-cuidados-10-claves-combinarlos-ahorrar-serio-super_0_l21tRE-1H.html,https://images.clarin.com/2021/03/24/OG7F_XDFu_720x0__1.jpg
11,nr13NsGUG,Formulario 572. Vence el plazo para pedir la devolución del dólar ahorro: cómo hacer el trámite,https://www.clarin.com/economia/dolar-ahorro-quedan-pocos-dias-pedir-devolucion-35-_0_nr13NsGUG.html,https://images.clarin.com/2020/08/17/U9cIo3ojS_720x0__1.jpg
12,whZu8Bqrg,Personajes célebres y pulperías. Cinco pueblos bonaerenses para escapadas en Semana Santa,https://www.clarin.com/viajes/cultura-campestre-personajes-celebres-pulperias-5-pueblos-bonaerenses-escapada-semana-santa_0_whZu8Bqrg.html,https://images.clarin.com/2016/04/21/S1ivj8eVl_720x0.jpg
13,WtXIBds0K,Opinión. China no respeta a Estados Unidos... por una buena razón,https://www.clarin.com/new-york-times-international-weekly/china-respeta-unidos-buena-razon_0_WtXIBds0K.html,https://images.clarin.com/2020/05/21/XeM8FUnXk_720x0__1.jpg
14,HUmnQLEUf,Juegos de Tokio. El público extranjero reclama su dinero,https://www.clarin.com/new-york-times-international-weekly/publico-extranjero-quedo-juegos-olimpicos-reclama-dinero-entradas_0_HUmnQLEUf.html,https://images.clarin.com/2021/03/20/e6IOdaOI2_720x0__1.jpg
15,uPO3HZOel,Escasez de vacunas. Coronavirus: la región compra millones de dosis de Pfizer y Argentina alimenta el misterio,https://www.clarin.com/sociedad/vacuna-pfizer-region-compra-millones-dosis-covid-argentina-alimenta-mayor-misterio-pandemia_0_uPO3HZOel.html,https://images.clarin.com/2020/11/09/XluYX0V1m_720x0__1.jpg
16,FiyfEv4M_,Del editor. Los días de Alberto: faltan vacunas y sobran motochorros,https://www.clarin.com/opinion/dias-alberto-fernandez-pocas-vacunas-motochorros_0_FiyfEv4M_.html,https://images.clarin.com/2021/03/10/1zw9sdtZ3_720x0__1.jpg
17,0FtaUPAaY,"Coronavirus. Quirós: ""No hay dudas de que está por delante una segunda ola""",https://www.clarin.com/sociedad/coronavirus-fernan-quiros-advirtio-segunda-ola_0_0FtaUPAaY.html,https://images.clarin.com/2021/03/25/gZz1oLBVg_720x0__1.jpg
18,HMcqZy7vB,La deuda con el FMI. Cristina Kirchner ya no oculta diferencias con Guzmán y exige más agresividad,https://www.clarin.com/economia/cristina-oculta-diferencias-guzman-deuda-exige-negociacion-agresiva_0_HMcqZy7vB.html,https://images.clarin.com/2021/03/24/5WHNn9Xn2_720x0__1.jpg
19,qFoZCFR9m,Roce por Venezuela. La reacción de EE.UU. ante la salida de Argentina del Grupo de Lima,https://www.clarin.com/politica/reaccion-unidos-salida-argentina-grupo-lima_0_qFoZCFR9m.html,https://images.clarin.com/2021/03/24/N9sXXDIuz_720x0__1.jpg
20,j4IXM1ttw,Giro diplomático. Felipe Solá y una comunicación al Departamento de Estado,https://www.clarin.com/politica/felipe-sola-comunicamos-departamento-cambios-relacion-venezuela-_0_j4IXM1ttw.html,https://images.clarin.com/2021/01/24/P9UIT-3CY_720x0__1.jpg
21,DMpnnzmDw,En Moreno. Un veterano de Malvinas mató a tiros a una pareja de ladrones y quedó detenido,https://www.clarin.com/policiales/veterano-malvinas-mato-tiros-pareja-ladrones-moreno_0_DMpnnzmDw.html,https://images.clarin.com/2021/03/24/3mFrwrUbQ_1256x620__2.jpg#1616622201602
22,5d2tV5_aW,Walmart. Denuncian un apriete de los Moyano a los nuevos dueños,https://www.clarin.com/economia/fuerte-presion-camioneros-arrinconan-nuevos-duenos-walmart_0_5d2tV5_aW.html,https://images.clarin.com/2021/03/24/IdQ6ak2oj_720x0__1.jpg
23,D-hIX-p8D,Copa Argentina. Boca goleó y ahora podría cruzarse con River,https://www.clarin.com/deportes/futbol/boca-juniors/boca-defensores-belgrano-hora-formaciones-tv_0_D-hIX-p8D.html,https://images.clarin.com/2021/03/24/rlNh5owRg_720x0__1.jpg
24,2Epo35anq,"Después del cachetazo. Izquierdoz y su pelea con Fabra: ""Boca es lo que más vende""",https://www.clarin.com/deportes/izquierdoz-pelea-fabra-cachetazo-boca_0_2Epo35anq.html,https://images.clarin.com/2021/03/23/CpjBKmeLnR_720x0__1.jpg
25,2YI_g5C-H,Tapia busca resistir. El candidato de Alberto F. se postuló para la AFA y desde Tucumán impulsan a Tinelli,https://www.clarin.com/deportes/candidato-alberto-fernandez-postulo-afa-tucuman-impulsan-marcelo-tinelli_0_2YI_g5C-H.html,https://images.clarin.com/2021/03/24/fJen4WMUI_720x0__1.jpg
26,HX8hKrHOv,"Las otras historias. Cuba, un fútbol que espera milagros y cambia de enfoque",https://www.clarin.com/deportes/futbol-internacional/cuba-futbol-espera-milagros-ahora-enfoque_0_HX8hKrHOv.html,https://images.clarin.com/2021/03/25/RnqcaIaZz_1256x620__2.jpg#1616670274397
27,tXtZOd5YO,Córdoba. Cristian Pavón negó haber violado a la joven que lo denunció,https://www.clarin.com/policiales/cristian-pavon-nego-violado-joven-denuncio_0_tXtZOd5YO.html,https://images.clarin.com/2019/03/29/edm29c8pb_720x0__1.jpg
28,BSfONUWrD,"Los Barros Schelotto. Un arquero, un dirigente y dos cracks: la dinastía suma otro eslabón",https://www.clarin.com/deportes/futbol/gimnasia-y-esgrima-la-plata/barros-schelotto-bautista-debut-gimnasia_0_BSfONUWrD.html,https://images.clarin.com/2021/03/24/bP-IDGfHmh_720x0__1.jpg
29,YQJap3v4L,NBA. Denver sufrió una dura derrota y Campazzo no pudo cambiar la historia,https://www.clarin.com/deportes/nba-denver-sufrio-dura-derrota-facundo-campazzo-pudo-cambiar-historia_0_YQJap3v4L.html,https://images.clarin.com/2021/03/25/0IRSjM9z9_720x0__1.jpg
30,SVDB-d6w2,"Tras otra operación. Del Potro: ""El doctor sabe que quiero estar en los Juegos Olímpicos""",https://www.clarin.com/deportes/potro-iniciar-rehabilitacion-meterle-volver-jugar-_0_SVDB-d6w2.html,https://images.clarin.com/2021/03/23/yO7eBe2jo_1256x620__3.jpg#1616604861980
31,laASOttOj,"A 45 años del Golpe. Larreta recordó el secuestro de su padre en la dictadura: ""Se lo llevaron en un Falcon""",https://www.clarin.com/politica/horacio-rodriguez-larreta-recordo-secuestro-padre-dictadura-militar-llevaron-falcon-verde-_0_laASOttOj.html,https://images.clarin.com/2021/03/24/oZZEJtg9D_720x0__1.jpg
32,2v_mEgtl-,Mercado Inmobiliario. Incipiente reactivación en la venta de departamentos usados,https://www.clarin.com/economia/incipiente-reactivacion-venta-departamentos-usados_0_2v_mEgtl-.html,https://images.clarin.com/2021/03/24/n5TmM7HbA_720x0__1.jpg
33,JoCZlBUe8,"Críticas a la Ciudad. Los citaron en River para darse la segunda dosis, pero las vacunas no estaban",https://www.clarin.com/sociedad/problemas-vacunacion-estadio-river-falta-dosis-sinopharm_0_JoCZlBUe8.html,https://images.clarin.com/2021/03/24/gDCAcWZE4_720x0__1.jpg
34,jZndn4DYD,Nuevos controles. Cuánto costará y cómo será el hisopado al llegar a Ezeiza,https://www.clarin.com/sociedad/coronavirus-costara-hisopado-lleguen-ezeiza_0_jZndn4DYD.html,https://images.clarin.com/2021/01/24/8JaEZLoZ2_1256x620__2.jpg#1616596318201
35,EVSdpfN-V,Adelanto de Clarín. El fin de semana empezará la entrega de vacunas de COVAX para Argentina,https://www.clarin.com/sociedad/fin-semana-empezara-entrega-vacunas-covax_0_EVSdpfN-V.html,https://images.clarin.com/2021/03/24/8d7fm8ds1_1256x620__2.jpg#1616601433013
36,_wAk0RXm2,Tiene Covid. El conmovedor mensaje de Zulemita Menem para su madre internada,https://www.clarin.com/fama/conmovedor-mensaje-zulemita-menem-madre-internada-covid_0__wAk0RXm2.html,https://images.clarin.com/2021/03/24/i3PuuIaBt_720x0__1.jpg
37,Yt03-4k1q,Vacunatorio VIP.  El fiscal Taiano pidió analizar llamadas de Ginés y cuatro colaboradores,https://www.clarin.com/politica/vacunatorio-vip-fiscal-taiano-pidio-analizar-llamadas-gines-gonzalez-garcia-colaboradores_0_Yt03-4k1q.html,https://images.clarin.com/2018/07/03/HkdicLFfQ_720x0__1.jpg
38,ohqxTnckf,Cómo impacta. El Gobierno dice que está cerca de aprobar la vacuna china para mayores de 60 años,https://www.clarin.com/sociedad/vacuna-sinopharm-gobierno-dice-cerca-aprobar-uso-mayores-60-anos_0_ohqxTnckf.html,https://images.clarin.com/2021/03/05/NQ6olIyuo_1256x620__2.jpg#1616610686123
39,NtDB7-IEv,En su 25° aniversario. Pokémon es considerado la propiedad intelectual más valiosa de la historia,https://www.clarin.com/tecnologia/pokemon-considerado-propiedad-intelectual-valiosa-historia_0_NtDB7-IEv.html,https://images.clarin.com/2016/08/05/Hye3NUjTme_720x0.jpg
40,9T09G69jt,"Temen que la gente no vaya. Con la llegada del frío, bares y restaurantes piden ampliar el aforo",https://www.clarin.com/ciudades/frio--temen-gente-deje-ir-bares-restaurantes-piden-ampliacion-aforo_0_9T09G69jt.html,https://images.clarin.com/2021/03/24/Skj72YYa3_720x0__1.jpg
41,tP27Q8Ofu,"En Noruega. P-Volt, el avión eléctrico comercial que podría comenzar a volar en 5 años",https://www.clarin.com/viajes/p-volt-avion-electrico-comercial-podria-comenzar-volar-anos_0_tP27Q8Ofu.html,https://images.clarin.com/2021/03/24/x-j7qotr8_720x0__1.jpg
42,CCasG-R94,Guía personalizada. Hipertensión: qué tipo de ejercicio hacer para bajar la presión arterial,https://www.clarin.com/buena-vida/hipertension-tipo-ejercicio-hacer-bajar-presion-arterial_0_CCasG-R94.html,https://images.clarin.com/2021/03/24/68baWaaeF_720x0__1.jpg
43,GmV9suW-N,"¿Se puede revertir?. Pie plano, una alteración frecuente: qué es y consejos",https://www.clarin.com/buena-vida/pie-plano--alteracion-frecuente-consejos_0_GmV9suW-N.html,https://images.clarin.com/2021/03/24/10tzuBtVU_720x0__1.jpg
44,Q5C42VoHx,Todos los gustos. Cuántos tipos de queso hay en Argentina y cómo distinguirlos,https://www.clarin.com/gourmet/tipos-queso-argentina-distinguir-diferencias_0_Q5C42VoHx.html,https://images.clarin.com/2021/03/24/6su1XbrJZ_720x0__1.jpg
45,hRAaQxf6y,Patrocinado. El mejor momento para comprar en Palermo Soho,https://www.clarin.com/brandstudio/mejor-momento-comprar-palermo-soho_0_hRAaQxf6y.html,https://images.clarin.com/2021/03/18/2Kszwqqc9_720x0__1.jpg
46,ayJW61GhD,Estará en Qatar. El fabuloso hotel ecológico flotante que asombra al mundo,https://www.clarin.com/internacional/qatar-asombra-mundo-fabuloso-innovador-hotel-ecologico-flotante_0_ayJW61GhD.html,https://images.clarin.com/2021/03/23/f5tQJjyIP_720x0__1.jpg
47,E6nlIJbXn,Redes sociales. Quiso mover el mueble del baño y encontró una misteriosa habitación secreta en su casa nueva,https://www.clarin.com/internacional/quiso-mover-mueble-bano-encontro-misteriosa-habitacion-secreta-casa-nueva_0_E6nlIJbXn.html,https://images.clarin.com/2021/03/23/CLMIKUCfv_720x0__1.jpg
48,Rb0jE6cx8,"Caso único. La trataron por tuberculosis, pero tenía un preservativo en un pulmón",https://www.clarin.com/internacional/trataron-tuberculosis-despues-medicos-descubrieron-preservativo-pulmon_0_Rb0jE6cx8.html,https://images.clarin.com/2021/03/24/GjYXiV2pF_720x0__1.jpg
49,9IkDbq3Xx,"Series y películas. Por qué ALF, a pesar de su éxito, dejó de salir al aire en la televisión de los 80",https://www.clarin.com/internacional/alf-pesar-exito-dejo-salir-aire-television-anos-80_0_9IkDbq3Xx.html,https://images.clarin.com/1969/12/31/SkGxRUR7g_1256x620__1.jpg#1616611108504
50,FqHWBbaGq,"Revelador. Hallan en el cerebro ""células zombis"" que continúan creciendo tras la muerte",https://www.clarin.com/internacional/hallan-cerebro-celulas-zombis-continuan-creciendo-despues-muerte_0_FqHWBbaGq.html,https://images.clarin.com/2020/06/23/oPeGUocpV_720x0__1.jpg
51,9VRqMr3IP,"Asombroso. Sin ayuda y por siete años, construyó una increíble casa en el aire",https://www.clarin.com/viste/hombre-construyo-7-anos-ayuda-increible-casa-aire_0_9VRqMr3IP.html,https://images.clarin.com/2021/03/24/shwD-I8xt_720x0__1.jpg
52,JneoUNIe1,"""Aislamiento"". La decisión del Gobierno de abandonar el Grupo de Lima, vista por cuatro analistas",https://www.clarin.com/politica/renuncia-argentina-grupo-lima-dicen-expertos-internacionales_0_JneoUNIe1.html,https://images.clarin.com/2021/03/24/CWfOIwEyD_720x0__1.jpg
53,O4XUAuocY,Arranca el viernes. Qué pasará con Ferrari y otras incógnitas de la nueva temporada de la Fórmula 1,https://www.clarin.com/deportes/pasara-ferrari-incognitas-nueva-temporada-formula-1_0_O4XUAuocY.html,https://images.clarin.com/2021/03/25/-E7uqmHw4_720x0__1.jpg
54,EwThGfZ88,"Fuerte respuesta. El PRO contra Carlotto: ""Renunció a la defensa de los derechos humanos""",https://www.clarin.com/politica/duro-comunicado-pro-estela-carlotto-renuncio-defensa-derechos-humanos-_0_EwThGfZ88.html,https://images.clarin.com/2021/02/27/6Hjrsq3P8_720x0__1.jpg
55,YcHckmuFS,Sputnik V. Partió el noveno vuelo de Aerolíneas para traer vacunas desde Moscú,https://www.clarin.com/sociedad/coronavirus-partio-noveno-vuelo-aerolineas-argentinas-traer-vacunas-moscu_0_YcHckmuFS.html,https://images.clarin.com/2021/03/20/D9V5Rucy-_720x0__1.jpg
56,Ib4ZaqT4K,"""Rechazan a muchos"". Fabián Doman logró que lo vacunaran en Miami y contó su experiencia",https://www.clarin.com/fama/fabian-doman-viajo-miami-vacunarse-advierte-vi-mucha-gente-rechazan-_0_Ib4ZaqT4K.html,https://images.clarin.com/2021/03/24/TJBs3i3VP_720x0__1.jpg
57,YcCW5qhL_,Para extranjeros. España reduce a seis meses el plazo de homologación de títulos universitarios,https://www.clarin.com/sociedad/espana-reduce-meses-plazo-homologacion-titulos-universitarios-extranjeros_0_YcCW5qhL_.html,https://images.clarin.com/2021/03/24/GiDFi8hZV_720x0__1.jpg
58,xc1er5s67,"Ovejeros. Tras recibir clases de ""decoro"", los perros de Biden vuelven a la Casa Blanca",https://www.clarin.com/mundo/recibir-clases-decoro-perros-joe-biden-vuelven-casa-blanca_0_xc1er5s67.html,https://images.clarin.com/2021/03/09/n8ahKLnG5_1256x620__2.jpg#1616674047655
59,MEo1iQAKa,Turismo interno. Cómo aprovechar Semana Santa en San Juan,https://www.clarin.com/brandstudio/aprovechar-semana-santa-san-juan_0_MEo1iQAKa.html,https://images.clarin.com/2021/03/23/cnOIvzOlf_720x0__1.jpg
60,HZnOmQbQy,"Ciencia. Lanzan una máquina para investigar el ""origen de los Tiempos""",https://www.clarin.com/viva/lanzan-maquina-investigar-origen-tiempos-_0_HZnOmQbQy.html,https://images.clarin.com/2021/03/25/Hy-wqc3iZ_720x0__1.jpg
61,c-5UzzSfP,"Poder perpetuo. Narcotráfico en el Bajo Flores: Marcos y Pity, una marca aún vigente",https://www.clarin.com/policiales/narcotrafico-flores-marcos-pity-marca-vigente_0_c-5UzzSfP.html,https://images.clarin.com/2018/11/21/mG3OUrrxh_720x0__1.jpg
62,vldrTZkxx,"Los ""cazavacunas"". Un ejército ""nerd"" que busca acelerar el fin de la pandemia en EE.UU.",https://www.clarin.com/mundo/cazavacunas-ejercito-nerd-busca-acelerar-fin-pandemia-coronavirus-unidos_0_vldrTZkxx.html,https://images.clarin.com/2021/01/27/yxQby2yaG_1256x620__2.jpg#1616667281728
63,rdaAky9hP,"Su cara nos suena. Lauren Graham: no tiene hijos, pero la ficción la hizo una madre experta",https://www.clarin.com/espectaculos/tv/lauren-graham-nacio-hawai-crecio-japon-hijos-ficcion-convirtio-madre-experta_0_rdaAky9hP.html,https://images.clarin.com/2021/03/24/ifg0MTnIT_1256x620__2.jpg#1616623572816
64,0eknqeMIu,Salud. El secreto para envejecer con éxito podría estar en el intestino,https://www.clarin.com/buena-vida/secreto-envejecer-exito-podria-intestino_0_0eknqeMIu.html,https://images.clarin.com/2021/03/24/NWatFrfr-_720x0__1.jpg
65,BTcyb_Maz,"""Escrita hoy a la mañana"". Cómo ven ""La Divina Comedia"" tres de sus traductores argentinos",https://www.clarin.com/cultura/escrita-hoy-manana-ven-divina-comedia-traductores-argentinos_0_BTcyb_Maz.html,https://images.clarin.com/2012/03/22/SyZmc9eRme_720x0.jpg
66,yu3xqUwv3,"Libros recomendados. ""El cielo protector"": un viaje por el Sahara, ¿puede salvar un matrimonio?",https://www.clarin.com/cultura/-cielo-protector-paul-bowles-travesia-sahara-puede-salvar-matrimonio-_0_yu3xqUwv3.html,https://images.clarin.com/2018/07/12/rkpUFUSQm_720x0__1.jpg
67,FoispskEC,Cambios en los hábitos. El lavado de la ropa hoy puede ser más sustentable,https://www.clarin.com/brandstudio/lavado-ropa-hoy-puede-sustentable_0_FoispskEC.html,https://images.clarin.com/2017/08/08/SJodjwwPW_1256x620__3.jpg#1616618080695
