n,id,title,url,image
1,Jc019yCflk,Giro diplomático. El Gobierno se alineó a Estados Unidos para condenar en la OEA el régimen Daniel Ortega en Nicaragua,https://www.clarin.com/politica/gobierno-alineo-unidos-condenar-oea-regimen-daniel-ortega-nicaragua_0_Jc019yCflk.html,https://images.clarin.com/2022/01/10/g_r5fVE_N_720x0__1.jpg
2,ekTk8Rs9XL,La negociación por la deuda. El FMI asegura que trabajan 24 horas al día para alcanzar el acuerdo con la Argentina,https://www.clarin.com/economia/fmi-asegura-trabajan-24-horas-dia-alcanzar-acuerdo-completo-argentina_0_ekTk8Rs9XL.html,https://images.clarin.com/2022/01/04/EwFEuTV4K_720x0__1.jpg
3,dcopQdSV6U,Presunta estafa. Piden la captura de Leonardo Cositorto y allanan oficinas de Generación Zoe en Córdoba,https://www.clarin.com/economia/estafas-piramidales-allanan-sede-generacion-zoe-cordoba-luego-denuncias_0_dcopQdSV6U.html,https://images.clarin.com/2021/10/12/m2gbWAILA_720x0__1.jpg
4,qD0wNy8Gte,En las oficinas Zoe. La bronca de los estafados ante la certeza de que no recuperarán sus ahorros,https://www.clarin.com/economia/oficinas-zoe-belgrano-bronca-inversores-estafados-certeza-recuperaran-ahorros_0_qD0wNy8Gte.html,https://images.clarin.com/2022/02/18/kVrmsAAfm_720x0__1.jpg
5,9gnv76AyoK,Para estudiar o trabajar. Ciudadanía italiana: cómo tener el acta de nacimiento de un abuelo o bisabuelo,https://www.clarin.com/servicios/ciudadania-italiana-conseguir-acta-nacimiento-abuelo-bisabuelo_0_9gnv76AyoK.html,https://images.clarin.com/2021/04/10/bJee8zcEr_720x0__1.jpg
6,8Zy1BA9EAg,Críticas de Macri al Gobierno.  Incendios en Corrientes: JxC reclama la emergencia y Larreta envía ayuda,https://www.clarin.com/politica/mauricio-macri-incendios-corrientes-pidieron-aviones-hidrantes-respondieron-_0_8Zy1BA9EAg.html,https://images.clarin.com/2022/02/18/GcHcneUgB_720x0__1.jpg
7,DRKqO9LlQT,Conmoción. Estalló una fábrica de explosivos para minería en Olavarría: hay tres muertos,https://www.clarin.com/sociedad/explosion-fabrica-olavarria-muertos-herido_0_DRKqO9LlQT.html,https://images.clarin.com/2022/02/18/B_LZn7RWg_720x0__1.jpg
8,ZYQMWBmSpq,Vacaciones polémicas. Volnovich habló de su viaje y dijo que la atacaron por su gestión y por ser mujer,https://www.clarin.com/politica/luana-volnovich-hablo-primera-vez-escandalo-vacaciones-caribe-dijo-atacaron-gestion-mujer_0_ZYQMWBmSpq.html,https://images.clarin.com/2022/02/18/h-lu9_0BZ_720x0__1.jpg
9,r5luzrPus5,"Tensión en la frontera. Biden insiste: aseguró que la invasión rusa a Ucrania está decidida y es ""inminente""",https://www.clarin.com/mundo/joe-biden-convencido-rusia-invadira-ucrania-aseguro-ataque-inminente_0_r5luzrPus5.html,https://images.clarin.com/2022/02/18/58Iufhkpv_720x0__1.jpg
10,xVDwNStxia,Especial Clarín. A tres años de la muerte de Natacha Jaitt: habla el último amigo que la vio viva,https://www.clarin.com/policiales/anos-muerte-natacha-jaitt-habla-ultimo-amigo-vio-vida_0_xVDwNStxia.html,https://images.clarin.com/2022/02/11/EgPOXPI-T_720x0__1.jpg
11,GeksV44jFs,"Bariloche. El detenido por el femicidio de Eduarda: ""La maté, temía por mi vida""",https://www.clarin.com/policiales/femicidio-eduarda-hijos-brasil-extrana-muerte-marido-hombre-acusado-crimen_0_GeksV44jFs.html,https://images.clarin.com/2022/02/18/bsepEyebi_1256x620__2.jpg#1645193770234
12,mRt7feOD2i,Mendoza. Matan a una policía y los sospechosos son colegas y familiares de la víctima,https://www.clarin.com/policiales/femicidio-comisaria-matan-policia-sospechosos-colegas-familiares-victima_0_mRt7feOD2i.html,https://images.clarin.com/2022/02/18/FAjP5aktM_1256x620__2.jpg#1645205383052
13,qc74Y2vo2y,Parte diario. Argentina superó los 125 mil muertos por coronavirus desde el inicio de la pandemia,https://www.clarin.com/sociedad/coronavirus-argentina-pais-supero-125-mil-muertos-conoravirus-inicio-pandemia_0_qc74Y2vo2y.html,https://images.clarin.com/2021/05/13/hzVHOQSq0_720x0__1.jpg
14,wrGTiEASSs,"Análisis de expertos. Covid futuro: la espera de la ""variante Pi"" y el dato de cuándo terminará la pandemia",https://www.clarin.com/sociedad/covid-futuro-espera-variante-pi-dato-terminara-pandemia_0_wrGTiEASSs.html,https://images.clarin.com/2020/06/04/pX8bt0qWN_720x0__1.jpg
15,e1v0dZYMV7,Tras su pelea con Alberto F.. Máximo Kirchner suma espacios en el PJ bonaerense con la mira en 2023,https://www.clarin.com/politica/pelea-alberto-fernandez-maximo-kirchner-suma-espacios-pj-bonaerense-mira-2023_0_e1v0dZYMV7.html,https://images.clarin.com/2021/12/18/Rvln1JVF8_720x0__1.jpg
16,b0pnFMwFTt,Repudio en Italia. El polémico gesto de un jugador de la Fiorentina con la jefa de prensa de su club,https://www.clarin.com/deportes/jugador-fiorentina-jefa-prensa_0_b0pnFMwFTt.html,https://images.clarin.com/2022/02/18/gtkcp6Kmgt_720x0__1.jpg
17,vec8bSnwBB,¡Enamorado!. Diego Leuco blanqueó su romance con la periodista Sofía Martínez,https://www.clarin.com/fama/diego-leuco-blanqueo-romance-periodista-sofia-martinez_0_vec8bSnwBB.html,https://images.clarin.com/2022/02/18/OEhHdhs0w_720x0__1.jpg
18,0JyZFsbXRS,"Smartphones. Celulares tope de gama: los cinco ""tanques"" que llegan al país en 2022",https://www.clarin.com/tecnologia/celulares-tope-gama-5-tanques-llegan-argentina-2022_0_0JyZFsbXRS.html,https://images.clarin.com/2022/02/10/_Hv6BbTss_720x0__1.jpg
19,SVEWqIHZsr,Ponelos en práctica. Los tres hábitos que lograron duplicar la vida de los gatos,https://www.clarin.com/buena-vida/3-habitos-lograron-duplicar-vida-gatos_0_SVEWqIHZsr.html,https://images.clarin.com/2022/02/17/EVPRUHvLw_720x0__1.jpg
20,ImAa5MmFlv,Habló con Clarín. Marcelo Iripino dejó todo y se radicó en Miami: por qué se fue y cómo consiguió la visa,https://www.clarin.com/fama/marcelo-iripino-dejo-argentina-radico-miami-consiguio-visa_0_ImAa5MmFlv.html,https://images.clarin.com/2022/02/08/rgfTnoaBu_720x0__1.jpg
21,tBc6AFU8sc,Dónde enviar el CV. Qatar Airways busca empleados argentinos sin experiencia y paga en dólares,https://www.clarin.com/servicios/qatar-airways-busca-empleados-argentinos-experiencia-paga-dolares-enviar-cv_0_tBc6AFU8sc.html,https://images.clarin.com/2017/06/11/SyKW4X2M-_720x0.jpg
22,f3Zuvg8iIY,"En una entrevista. Papu Gómez elogió a Julián Álvarez pero pidió cautela: ""Le hizo 3 goles a Patronato""",https://www.clarin.com/deportes/papu-gomez-lleno-elogios-julian-alvarez-pidio-cautela-metio-3-goles-patronato-_0_f3Zuvg8iIY.html,https://images.clarin.com/2019/09/18/Q7Ji8tAz9_1256x620__2.jpg#1645210047593
23,cQQlY7tDcz,"Perfil. Quién es Tommy Lee: el hombre que reúne la tríada sexo, droga y rock and roll",https://www.clarin.com/espectaculos/tommy-lee-hombre-reune-triada-sexo-droga-rock-and-roll_0_cQQlY7tDcz.html,https://images.clarin.com/2022/01/26/WaGp9szhs_720x0__1.jpg
24,g47ZLh1OZA,"Serie furor en Netflix. Habló la ex amiga que ayudó a detener a la estafadora de ""Inventando a Anna""",https://www.clarin.com/internacional/espectaculos/inventando-anna-version-ex-amiga-ayudo-arrestar-sorokin-testigo-juicio_0_g47ZLh1OZA.html,https://images.clarin.com/2022/02/13/S4zcwcYCN_720x0__1.jpg
25,vW9Wgr8Ba9,"""Escuela de gladiadores"". El infierno que se vive en Rikers Island, la aterradora cárcel de Nueva York",https://www.clarin.com/internacional/infierno-vive-rikers-island-aterradora-carcel-nueva-york_0_vW9Wgr8Ba9.html,https://images.clarin.com/2022/02/17/pPt-eaxLL_720x0__1.jpg
26,Jc019yCflk,Giro diplomático. El Gobierno se alineó a Estados Unidos para condenar en la OEA el régimen Daniel Ortega en Nicaragua,https://www.clarin.com/politica/gobierno-alineo-unidos-condenar-oea-regimen-daniel-ortega-nicaragua_0_Jc019yCflk.html,https://images.clarin.com/2022/01/10/g_r5fVE_N_720x0__1.jpg
27,ekTk8Rs9XL,La negociación por la deuda. El FMI asegura que trabajan 24 horas al día para alcanzar el acuerdo con la Argentina,https://www.clarin.com/economia/fmi-asegura-trabajan-24-horas-dia-alcanzar-acuerdo-completo-argentina_0_ekTk8Rs9XL.html,https://images.clarin.com/2022/01/04/EwFEuTV4K_720x0__1.jpg
28,dcopQdSV6U,Presunta estafa. Piden la captura de Leonardo Cositorto y allanan oficinas de Generación Zoe en Córdoba,https://www.clarin.com/economia/estafas-piramidales-allanan-sede-generacion-zoe-cordoba-luego-denuncias_0_dcopQdSV6U.html,https://images.clarin.com/2021/10/12/m2gbWAILA_720x0__1.jpg
29,qD0wNy8Gte,En las oficinas Zoe. La bronca de los estafados ante la certeza de que no recuperarán sus ahorros,https://www.clarin.com/economia/oficinas-zoe-belgrano-bronca-inversores-estafados-certeza-recuperaran-ahorros_0_qD0wNy8Gte.html,https://images.clarin.com/2022/02/18/kVrmsAAfm_720x0__1.jpg
30,9gnv76AyoK,Para estudiar o trabajar. Ciudadanía italiana: cómo tener el acta de nacimiento de un abuelo o bisabuelo,https://www.clarin.com/servicios/ciudadania-italiana-conseguir-acta-nacimiento-abuelo-bisabuelo_0_9gnv76AyoK.html,https://images.clarin.com/2021/04/10/bJee8zcEr_720x0__1.jpg
31,8Zy1BA9EAg,Críticas de Macri al Gobierno.  Incendios en Corrientes: JxC reclama la emergencia y Larreta envía ayuda,https://www.clarin.com/politica/mauricio-macri-incendios-corrientes-pidieron-aviones-hidrantes-respondieron-_0_8Zy1BA9EAg.html,https://images.clarin.com/2022/02/18/GcHcneUgB_720x0__1.jpg
32,DRKqO9LlQT,Conmoción. Estalló una fábrica de explosivos para minería en Olavarría: hay tres muertos,https://www.clarin.com/sociedad/explosion-fabrica-olavarria-muertos-herido_0_DRKqO9LlQT.html,https://images.clarin.com/2022/02/18/B_LZn7RWg_720x0__1.jpg
33,T4JcwuHvIz,Polémica familiar. Continúa el escándalo por el velatorio de Gustavo Martínez: dónde y cómo será,https://www.clarin.com/fama/continua-escandalo-velatorio-gustavo-martinez_0_T4JcwuHvIz.html,https://images.clarin.com/2022/02/16/5AM3NSETi_720x0__1.jpg
34,y8mrEO5Heq,Tras 13 años. Robertito Funes Ugarte renunció a C5N: cuál será su futuro televisivo,https://www.clarin.com/fama/robertito-funes-ugarte-renuncio-c5n-nueva-nueva-gente-nueva-vida-_0_y8mrEO5Heq.html,https://images.clarin.com/2022/02/18/8tylq0P3K_720x0__1.jpg
35,DUjviFPcPs,Sorprendente. Descubren en un video un particular detalle de las bailarinas que acompañaban a Antonio Ríos en los 90,https://www.clarin.com/fama/descubren-video-particular-detalle-bailarinas-acompanaban-antonio-rios-90_0_DUjviFPcPs.html,https://images.clarin.com/2022/02/18/vr4Ownq1S_720x0__1.jpg
36,orLedbxqI9,Estalló en las redes. Polémicas declaraciones de Paloma Fort tras la muerte de Gustavo Martínez,https://www.clarin.com/fama/paloma-fort-lamento-muerte-gustavo-martinez-apunto-familia-siento-asco-verguenza-_0_orLedbxqI9.html,https://images.clarin.com/2019/04/03/SiKyKZfAi_720x0__1.jpg
37,ani2TOX4px,Coronavirus. La sorpresa de dos de las provincias con mejores tasas de vacunación,https://www.clarin.com/sociedad/sorpresa-provincias-mejores-tasas-vacunacion-covid_0_ani2TOX4px.html,https://images.clarin.com/2021/08/12/EiwYM_Gc9_720x0__1.jpg
38,mSMb2zkgr6,Consejos útiles. Cuando vence el alquiler: claves para decidir si conviene renovar o no,https://www.clarin.com/servicios/vence-alquiler-claves-decidir-conviene-renovar-buscar-vivienda_0_mSMb2zkgr6.html,https://images.clarin.com/2021/10/12/rlpkIWIxo_720x0__1.jpg
39,UIRtgU0xxn,Oportunidad. Censo 2022: cómo inscribirse para ser voluntario y cuánto pagan,https://www.clarin.com/servicios/censo-2022-inscribirse-voluntario-pagan_0_UIRtgU0xxn.html,https://images.clarin.com/2021/12/09/zii6Bwbwv_720x0__1.jpg
40,MdHQMqnEHr,Adelanto de Clarín. Miden un balotaje para 2023: Fernández y CFK vs. Larreta y Patricia Bullrich,https://www.clarin.com/politica/encuesta-midio-balotaje-2023-alberto-fernandez-cristina-kirchner-vs-horacio-rodriguez-larreta-patricia-bullrich_0_MdHQMqnEHr.html,https://images.clarin.com/2021/05/01/gBleWwOX8_720x0__1.jpg
41,tdoLe5vq9r,"El hombre de las noticias. Carlos Montero, el ex CNN que fue a estudiar a EE.UU. ""un rato"" y se quedó 30 años",https://www.clarin.com/historias/estudiar-unidos-rato-quedo-30-anos-vida-argentino-carlos-montero-ex-cnn_0_tdoLe5vq9r.html,https://images.clarin.com/2022/02/11/mvTXAAddM_720x0__1.jpg
42,Ye7hLgfiBO,Policiales. Bodas de sangre: la historia secreta detrás del triple crimen narco de Rosario,https://www.clarin.com/policiales/bodas-sangre-historia-secreta-detras-triple-crimen-narco-rosario_0_Ye7hLgfiBO.html,https://images.clarin.com/2022/02/04/jgZ1OPKRT_720x0__1.jpg
43,uEFL9rA0bj,Mundo. Enigmas de la Reina eterna: Isabel cumple 70 años en el trono británico y estalla la sucesión,https://www.clarin.com/mundo/enigmas-reina-eterna-isabel-cumple-70-anos-trono-britanico-estalla-sucesion_0_uEFL9rA0bj.html,https://images.clarin.com/2022/01/31/fQCwJghce_720x0__1.jpg
44,m1EdK_wpV,Sociedad. Mundo verdulería: 10 secretos del negocio que explotó en pandemia,https://www.clarin.com/sociedad/mundo-verduleria-10-secretos-negocio-exploto-pandemia_0_m1EdK_wpV.html,https://images.clarin.com/2021/12/20/MSbLfu4yR_720x0__1.jpg
45,3FVyBQy1ak,"Sociedad. El ""nuevo"" Aconcagua: escaladas en burbujas y rescates dramáticos",https://www.clarin.com/especiales/nuevo-aconcagua-retiros-espirituales-escalada-burbuja-verano-omicron_0_3FVyBQy1ak.html,https://images.clarin.com/2022/01/18/cgf90Nj_g_720x0__1.jpg
46,HSEKSx3u0K,"Quinto refuerzo. Boca presentó a Oscar Romero: ""Mi ídolo desde chiquito es Riquelme""",https://www.clarin.com/deportes/boca-presento-oscar-romero-idolo-chiquito-roman-riquelme-_0_HSEKSx3u0K.html,https://images.clarin.com/2022/02/18/KZixy5v_x_720x0__1.jpg
47,TNrmDMcsYV,"Uno más. El Kun Agüero aseguró que estará en Qatar 2022: ""Hablé con Scaloni y Tapia""",https://www.clarin.com/deportes/kun-aguero-aseguro-qatar-2022-hable-scaloni-tapia-_0_TNrmDMcsYV.html,https://images.clarin.com/2020/06/12/jp7wFTVXW_720x0__1.jpg
48,K99MwZacaX,Discriminación en el básquet. Agredieron a un jugador que se declaró homosexual y se frenó el partido,https://www.clarin.com/deportes/discriminacion-basquet-hinchas-agredian-jugador-declaro-homosexual-freno-partido_0_K99MwZacaX.html,https://images.clarin.com/2022/02/18/m_3AzFFF4_720x0__1.jpg
49,KNkXlQ9OmF,Volvió a pelear en 2021. Estuvo a punto de retirarse de las MMA: ganó un torneo y se llevó un millón de dólares,https://www.clarin.com/deportes/punto-retirarse-mma-volvio-2021-gano-torneo-llevo-millon-dolares_0_KNkXlQ9OmF.html,https://images.clarin.com/2022/02/15/4WxP7nWgu_720x0__1.jpg
50,JtF5vg6rtP,Santa Fe. Violento ataque a tiros a la sede de Colón: dejaron pintadas y folletos con códigos QR,https://www.clarin.com/deportes/colon-colon-santa-fe-futbol-argentino-tiros-ataque-sede-colon_0_JtF5vg6rtP.html,https://images.clarin.com/2022/02/18/wVd-6f5gRU_720x0__1.jpg
51,,Vuelve un clásico. Ya podés armar tu equipo de Gran DT: arranca a partir de la fecha 4,,
52,fsJXSrI1sd,Comparador de comisiones. Cuáles son los bancos más caros y los más baratos para abrir una cuenta,https://www.clarin.com/economia/bancos-caros-baratos-abrir-cuenta_0_fsJXSrI1sd.html,https://images.clarin.com/2022/02/07/Pn1pAELWC_720x0__1.jpg
53,QO0izG7oOt,Inversiones. El dueño de los shoppings apuesta al peso: dice que está en mínimos históricos,https://www.clarin.com/economia/presidente-irsa-dice-peso-devaluo-demasiado-armo-fondo-apuesta-recuperacion_0_QO0izG7oOt.html,https://images.clarin.com/2022/02/17/ivXM-ubQd_720x0__1.jpg
54,h2L5Aqs4Ci,Política monetaria. Cuánto rendirán los plazos fijos con la nueva suba de tasas que fijó el BCRA,https://www.clarin.com/economia/banco-central-anuncio-nueva-suba-tasas-plazos-fijos-rendiran-41-5-anual_0_h2L5Aqs4Ci.html,https://images.clarin.com/2021/12/03/mZKRutUkq_720x0__1.jpg
55,nyvRTsnR5k,Para combatir la inflación. Cómo funcionaría la Empresa Nacional de Alimentos que busca crear el Gobierno,https://www.clarin.com/economia/funcionaria-empresa-nacional-alimentos-busca-crear-gobierno_0_nyvRTsnR5k.html,https://images.clarin.com/2022/02/17/XUT8mMdIc_720x0__1.jpg
56,ovQJKUvx08,Corrientes. La dramática labor de un productor para evitar que se queme su campo,https://www.clarin.com/rural/incendios-corrientes-productor-40-horas-apagando-fuego-campo-pudo-salvar-parte-animales_0_ovQJKUvx08.html,https://images.clarin.com/2022/02/17/2ig-zAMcM_720x0__1.jpg
57,Jpfvmz8jzX,Renovables. Luz: los parques eólicos ganan peso en abastecer la demanda,https://www.clarin.com/economia/luz-parques-eolicos-ganan-peso-abastecer-demanda_0_Jpfvmz8jzX.html,https://images.clarin.com/2022/02/18/TZSuwpIan_720x0__1.jpg
