n,id,title,url,image
1,pIn0foh6cE,Narcotráfico. Droga envenenada: la venta al menudeo de cocaína en el AMBA da medio millón de dólares por día,https://www.clarin.com/politica/droga-adulterada-venta-menudeo-cocaina-amba-negocio-medio-millon-dolares-dia_0_pIn0foh6cE.html,https://images.clarin.com/2022/02/02/_oVLeqXeK_720x0__1.jpg
2,xKjf98nEVP,"Viven 200 familias. Denuncias y miedo: cómo es la vida en ""Puerta 8"", el centro de la cocaína adulterada",https://www.clarin.com/sociedad/denuncias-miedo-puerta-8-vida-epicentro-cocaina-envenenada_0_xKjf98nEVP.html,https://images.clarin.com/2022/02/03/DCEdKGLpY_1256x620__2.jpg#1643912673190
3,aAUMAVwnIr,"Fue detenido. De remisero a gerente narco: la historia de ""Paisa"", el supuesto dueño de la droga mortal",https://www.clarin.com/policiales/remisero-gerente-narco-historia-paisa-supuesto-dueno-cocaina-envenenada_0_aAUMAVwnIr.html,https://images.clarin.com/2022/02/03/SsAle6_d-_1256x620__2.jpg#1643922580338
4,an6124KO8R,Ya hay 23 muertos. El relato de un sobreviviente y las críticas a Berni de la esposa de un internado,https://www.clarin.com/policiales/droga-envenenada-hurlingham-vivo-muertos-intoxicados-cocaina-adulterada-buenos-aires-minuto-minuto_0_an6124KO8R.html,https://images.clarin.com/2022/02/03/PZEwbLpZm_720x0__1.jpg
5,CTqJcTtu05,Adelanto de Clarín. Una encuesta midió a Máximo Kirchner para una interna presidencial: le fue muy mal,https://www.clarin.com/politica/encuesta-midio-maximo-kirchner-interna-presidencial-quedo-anteultimo_0_CTqJcTtu05.html,https://images.clarin.com/2021/12/17/Exx-TV1NJ_720x0__1.jpg
6,6J4gAm8RTm,"""Disfrutá como te gusta"". Polémica por una campaña de la Provincia que promovía el ""consumo cuidado""",https://www.clarin.com/politica/droga-envenenada-polemica-redes-campana-gobierno-axel-kicillof-promovia-consumo-cuidado-_0_6J4gAm8RTm.html,https://images.clarin.com/2022/02/03/0vYW7fZsT_720x0__1.jpg
7,ipZabgnkZq,"La droga que mató a Prince. Fentanilo: qué es, sus riesgos y por qué se cree que lo habrían usado en la cocaína",https://www.clarin.com/buena-vida/cocaina-adulterada-fentanilo-riesgos_0_ipZabgnkZq.html,https://images.clarin.com/2019/08/27/KmAAUv2hy_1256x620__2.jpg#1643890606657
8,bcmUvhUKaY,"Hablan de ""provocación"". Desconcierto y preocupación en EE.UU. por el viaje de Alberto F. a Rusia y sus dichos",https://www.clarin.com/politica/desconcierto-preocupacion-unidos-viaje-alberto-fernandez-rusia-declaraciones-reunion-putin_0_bcmUvhUKaY.html,https://images.clarin.com/2022/02/03/k--yH1NDD_720x0__1.jpg
9,EXi2uKdfBM,Escenario. Cómo fue el operativo de Estados Unidos en Siria para matar al líder del ISIS,https://www.clarin.com/mundo/operativo-unidos-siria-matar-lider-isis_0_EXi2uKdfBM.html,https://images.clarin.com/2022/02/03/vCIiwa_6p_720x0__1.jpg
10,t7c6yjOgAD,Por la caída de usuarios. Histórico derrumbe de Facebook: perdió US$ 230.000 millones en un día,https://www.clarin.com/economia/acciones-facebook-hunden-25-pierde-us-200-000-millones-valor_0_t7c6yjOgAD.html,https://images.clarin.com/2022/02/03/d74zdLL1L_720x0__1.jpg
11,fDrQ2Eny3Y,Furor en redes. Un jugador de la Selección publicó una foto desnudo y luego bromeó con su descuido ,https://www.clarin.com/deportes/arquero-juan-musso-publico-error-foto-desnudo-instagram-luego-bromeo-descuido_0_fDrQ2Eny3Y.html,https://images.clarin.com/2021/08/21/lx9BTJjLwv_1256x620__2.jpg#1643899248373
12,xOWf0TTg8o,Consejo del Coco. Basile se metió en la polémica con el Dibu Martínez y le pidió evitar las cargadas,https://www.clarin.com/deportes/basile-colombia-argentina-dibu-rueda_0_xOWf0TTg8o.html,https://images.clarin.com/2022/02/03/m0w5cRU3x_720x0__1.jpg
13,3mqyLOc3FY,Parte diario. Coronavirus: por segundo día hubo más de 300 muertes e informan otros 42.437 casos,https://www.clarin.com/sociedad/coronavirus-argentina-confirman-42-437-contagios-318-muertes-ultimas-24-horas_0_3mqyLOc3FY.html,https://images.clarin.com/2022/01/29/l3pUbAdxn_720x0__1.jpg
14,B240ZoV1r1,Transportaba bananas. Impresionante vuelco de un camión tras sobrepasar a otro en Mendoza,https://www.clarin.com/sociedad/video-impresionante-vuelco-camion-sobrepasar_0_B240ZoV1r1.html,https://images.clarin.com/2022/02/03/uBaRRWSgI_720x0__1.jpg
15,mjXlLWdLhn,Hablar de cáncer. Osvaldo Santoro se anima a contar por primera vez cómo transita la enfermedad,https://www.clarin.com/historias/osvaldo-santoro-recuperado-cancer-garganta-paso-miedo-paraliza-fe-recuperacion-total-_0_mjXlLWdLhn.html,https://images.clarin.com/2022/02/02/ggRmE82dd_720x0__1.jpg
16,RvIITRrbtA,"Una ""pesadilla"".  ""Violaron virtualmente a mi avatar"": la pesadilla de una investigadora en el metaverso",https://www.clarin.com/tecnologia/-violaron-virtualmente-avatar-sacaron-fotos-pesadilla-mujer-metaverso_0_RvIITRrbtA.html,https://images.clarin.com/2022/02/03/I3LaiRwes_720x0__1.jpg
17,aOcy4nNBXP,Entrevista con un youtuber . La polémica respuesta de Villa por la final en Madrid que generó malestar en Boca,https://www.clarin.com/deportes/sebastian-villa-boca-juan-roman-riquelme_0_aOcy4nNBXP.html,https://images.clarin.com/2021/10/27/RiQnPVi8__720x0__1.jpg
18,xh92ydkh5F,Pura potencia. Se viene un duelo de titanes entre Ford y Volkswagen con dos pick ups bestiales,https://www.clarin.com/autos/anticipo-viene-duelo-titanes-ford-volkswagen-pick-ups-bestiales_0_xh92ydkh5F.html,https://images.clarin.com/2022/02/03/GiKsExy2r_720x0__1.jpg
19,4maX0EZjMR,A 40 años. Guerra de Malvinas: el bautismo sangriento del primer enfrentamiento,https://www.clarin.com/viva/40-anos-guerra-malvinas-bautismo-sangriento-primer-enfrentamiento_0_4maX0EZjMR.html,https://images.clarin.com/2022/02/02/AVMsZfNGz_720x0__1.jpg
20,U7cCA27BTk,"Táctica de ahorro. Aumento de la nafta: marca por marca, cómo cargar con descuentos de hasta el 30%",https://www.clarin.com/servicios/aumento-nafta-marca-marca-cargar-siempre-descuentos-30-_0_U7cCA27BTk.html,https://images.clarin.com/2022/02/02/czpMoWxSm_720x0__1.jpg
21,A5WhKTRtYN,Estados Unidos. La misteriosa aerolínea que vuela al Área 51 y nunca vendió un pasaje al público,https://www.clarin.com/internacional/secretos-aerolinea-vuela-siempre-vender-pasaje_0_A5WhKTRtYN.html,https://images.clarin.com/2021/11/21/Ab_-fZoEi_1256x620__2.jpg#1637522107735
22,NqiAEi4Jc4,En Abu Dhabi. El Mundial de Clubes arrancó con un blooper: golazo en contra desde fuera del área,https://www.clarin.com/deportes/mundial-clubes-abrio-telon-triunfo-obvio-golazo-area-_0_NqiAEi4Jc4.html,https://images.clarin.com/2022/02/03/KcZA3Cy3B_1256x620__2.jpg#1643913972649
23,omKYNAT28M,Triple crimen en Rosario. El cantante de cumbia que además es concejal y cantó en el casamiento narco,https://www.clarin.com/policiales/-juanjo-cantante-cumbia-ademas-concejal-canto-casamiento-narco-termino-triple-crimen_0_omKYNAT28M.html,https://images.clarin.com/2022/02/03/UfogCLSXk_720x0__1.jpg
24,hLIMTPIcjJ,Llega desde la Premier. El impactante físico del nuevo refuerzo del Barcelona al que comparan con Hulk,https://www.clarin.com/deportes/impactante-cambio-fisico-adama-traore_0_hLIMTPIcjJ.html,https://images.clarin.com/2022/02/03/hwzhnMNIk_720x0__1.jpg
25,vUjNeV2o9I,Circuito porteño. San Telmo: 14 restaurantes y bares con patio o terraza para comer al aire libre,https://www.clarin.com/gourmet/san-telmo-14-restaurantes-bares-patio-terraza-comer-aire-libre_0_vUjNeV2o9I.html,https://images.clarin.com/2022/02/02/jK4-W1Q_O_1256x620__2.jpg#1643827870233
26,f2mpj0ZPKE,Historias visuales. Las imágenes más destacadas del día en Argentina y el mundo,https://www.clarin.com/fotogalerias/historias-visuales-dia-fotos-imagenes-destacadas-argentina-mundo_5_f2mpj0ZPKE.html,
27,2h5wIEXJ0P,La letra chica del acuerdo. Cómo son los números de Martín Guzmán para cumplir con el déficit fiscal que pedirá el FMI,https://www.clarin.com/economia/numeros-martin-guzman-cumplir-deficit-fiscal-pedira-fmi_0_2h5wIEXJ0P.html,https://images.clarin.com/2020/04/14/SkjKxvW_e_720x0__1.jpg
28,nCEshFz8EC,Mercado cambiario. El dólar blue baja a $216 mientras caen las acciones argentinas,https://www.clarin.com/economia/dolar-blue-mantiene-217-caen-acciones-argentinas_0_nCEshFz8EC.html,https://images.clarin.com/2021/10/22/pN5hRqgGb_720x0__1.jpg
29,MuSl3khpDw,Los nuevos precios. Renovaron el programa para comprar cortes de carne más baratos,https://www.clarin.com/rural/precios-cuidados-renuevan-programa-7-cortes-populares-aumentos-30-_0_MuSl3khpDw.html,https://images.clarin.com/2022/02/03/53RP-HTOk_720x0__1.jpg
30,W9uzNhxHMc,Deuda. Cinco obstáculos a superar para llegar a un acuerdo final con el FMI,https://www.clarin.com/economia/obstaculos-argentina-debe-superar-llegar-acuerdo-final-fmi_0_W9uzNhxHMc.html,https://images.clarin.com/2022/01/07/Ras4M764A_720x0__1.jpg
31,FBQ9B2gKN4,Gira oficial. Guzmán se queda en Rusia en busca de fondos para las reservas,https://www.clarin.com/economia/martin-guzman-queda-rusia-busca-fondos-reservas_0_FBQ9B2gKN4.html,https://images.clarin.com/2022/01/17/Q9DbJ5C7k_720x0__1.jpg
32,WTs9dROFiH,"Llega al 54%. Tras reabrir su paritaria, el sindicato de Comercio logra una suba extra",https://www.clarin.com/economia/reabrir-paritaria-sindicato-comercio-logra-suba-extra-llega-54-anual_0_WTs9dROFiH.html,https://images.clarin.com/2022/02/02/xRTbwB2km_720x0__1.jpg
33,oCdwhlERxi,"Galardón. Toledo de noche, elegida la panorámica más bonita del mundo",https://www.clarin.com/viajes/toledo-noche-elegida-panoramica-bonita-mundo_0_oCdwhlERxi.html,https://images.clarin.com/2022/01/31/yfBCNcJqx_720x0__1.jpg
34,pHgwoHF3Yz,Rumores de cambios. Una de las funciones más usadas de WhatsApp dejaría de ser gratis,https://www.clarin.com/tecnologia/funciones-usadas-whatsapp-dejaria-gratis_0_pHgwoHF3Yz.html,https://images.clarin.com/2018/11/09/iUF6z5aBV_720x0__1.jpg
35,lu38rqmY9F,Cero kilómetro. Crece el mercado de las motos: cómo fue el ranking de las más vendidas en enero,https://www.clarin.com/autos/crece-mercado-motos-ranking-vendidas-enero_0_lu38rqmY9F.html,https://images.clarin.com/2022/02/02/fw7jE5rTP_720x0__1.jpg
36,KN6Vd6wBOs,Estudio. Cáncer de colon: bajar de peso ayuda a prevenir pólipos,https://www.clarin.com/buena-vida/cancer-colon-bajar-peso-ayuda-prevenir-polipos_0_KN6Vd6wBOs.html,https://images.clarin.com/2022/02/02/ta4oKAS-n_720x0__1.jpg
37,HJIe1FaUn5,"Clásico universal. Una joya literaria que cumple 100 años: la odisea de ""Ulises""",https://www.clarin.com/cultura/joya-literaria-cumple-100-anos-odisea-ulises-_0_HJIe1FaUn5.html,https://images.clarin.com/1969/12/31/SJWuw7P0mg_1256x620__1.jpg#1643729881351
38,b5D8MXH4us,Panorama astrológico. Mercurio directo en Capricornio: efectos y oportunidades,https://www.clarin.com/astrologia/mercurio-directo-capricornio-efectos-oportunidades_0_b5D8MXH4us.html,https://images.clarin.com/2022/02/02/w3psGimX4_720x0__1.jpg
39,GwqggIznQr,"Fue hundido en EE.UU.. Polémica tras el supuesto hallazgo del Endeavour, el barco del capitán Cook",https://www.clarin.com/internacional/polemica-supuesto-hallazgo-endeavour-famoso-barco-capitan-cook_0_GwqggIznQr.html,https://images.clarin.com/2022/02/03/_3bDRzDe__720x0__1.jpg
40,gJqnaDHwVs,Operaban sin anestesia. En el corazón de Londres está el quirófano más antiguo en Europa,https://www.clarin.com/viste/corazon-londres-quirofano-antiguo-europa_0_gJqnaDHwVs.html,https://images.clarin.com/2022/02/03/D1V7DbmFM_720x0__1.jpg
41,xYHfvMGTeP,En un musical sobre su padre. La controvertida aparición de los hijos de Michael Jackson en una alfombra roja,https://www.clarin.com/internacional/espectaculos/controvertida-aparicion-hijos-michael-jackson-alfombra-roja_0_xYHfvMGTeP.html,https://images.clarin.com/2022/02/02/PamKQ7KCQ_720x0__1.jpg
42,szy2I62CBf,"""Miss Fitness"" Bolivia. El escándalo que provocó el look de una modelo al ir a buscar a su hijo al colegio",https://www.clarin.com/viste/escandalo-provoco-look-modelo-ir-buscar-hijo-colegio-asco-_0_szy2I62CBf.html,https://images.clarin.com/2022/02/02/H_kMPixed_720x0__1.jpg
43,gmqESTTRjh,"Original estrategia. Sorprendió con su método para entregar su CV, lo llamaron y consiguió empleo",https://www.clarin.com/internacional/sorprendio-metodo-entregar-curriculum-vitae-llamaron-consiguio-empleo_0_gmqESTTRjh.html,https://images.clarin.com/2022/01/31/IxTObIQ3H_720x0__1.jpg
44,mvNv0kVRtI,Plata = privilegios. Desmantelan un puente histórico para que pueda pasar el yate de Jeff Bezos,https://www.clarin.com/viste/desmantelan-puente-historico-pueda-pasar-yate-jeff-bezos_0_mvNv0kVRtI.html,https://images.clarin.com/2022/02/03/lnbmqfTkV_720x0__1.jpg
45,TGjgH38kU1,"Anticipo en la Costa. Peugeot Landtrek, la nueva pickup de la marca francesa que llega este año",https://www.clarin.com/autos/peugeot-landtrek-nueva-pickup-marca-francesa-llega-ano_0_TGjgH38kU1.html,https://images.clarin.com/2022/01/24/Y4MxZCiNB_720x0__1.jpg
46,nbRg8kfyj,"Tests drive, clínicas y música. Ford Summer Energy, la propuesta más original del verano en Pinamar y Cariló",https://www.clarin.com/autos/ford-summer-energy-propuesta-original-verano-pinamar-carilo_0_nbRg8kfyj.html,https://images.clarin.com/2022/01/10/fR20mRASr_720x0__1.jpg
47,v2cuem61Mz,"Presentación en la Costa. Nuevo Citroën C3, el hatch que llega para continuar con el gran éxito de la marca",https://www.clarin.com/autos/nuevo-citroen-c3-hatch-llega-continuar-gran-exito-marca_0_v2cuem61Mz.html,https://images.clarin.com/2022/01/19/EnjbaLe6W_720x0__1.jpg
48,nRk2xh46e,"Adelanto en la Costa. El Fiat que faltaba: cómo es el Pulse, el nuevo SUV de la marca italiana",https://www.clarin.com/autos/fiat-faltaba-pulse-nuevo-suv-marca-italiana_0_nRk2xh46e.html,https://images.clarin.com/2022/01/17/iBAj5ZorO_720x0__1.jpg
49,WhOmyN5V4,Ford Go. Lo último entre las plataformas de carsharing desembarcó en Pinamar y Cariló,https://www.clarin.com/autos/ford-go-ultimo-plataformas-carsharing-desembarco-pinamar-carilo_0_WhOmyN5V4.html,https://images.clarin.com/2022/01/21/tCMDU5RPO_720x0__1.jpg
50,b8JmSpP9L,En Cariló. Volkswagen exhibe los nuevos modelos 100% eléctricos en un espacio interactivo,https://www.clarin.com/brandstudio/volkswagen-exhibe-nuevos-modelos-100-electricos-espacio-interactivo-carilo_0_b8JmSpP9L.html,https://images.clarin.com/2022/01/14/FWgnkAcca_720x0__1.jpg
51,p64wtHpyPX,Escaladores. El montañista más solitario del Everest,https://www.clarin.com/new-york-times-international-weekly/montanista-solitario-everest_0_p64wtHpyPX.html,https://images.clarin.com/2022/02/03/xhRbq1lPv_720x0__1.jpg
52,ZGGEtbydK7,Escenarios de la pandemia. Un día en el 'universo paralelo' de una UCI de Londres,https://www.clarin.com/new-york-times-international-weekly/dia-universo-paralelo-uci-londres_0_ZGGEtbydK7.html,https://images.clarin.com/2022/02/02/hJRF-Plha_1256x620__2.jpg#1643842633180
53,SxnLwYh5qH,Investigación. La vacuna COVID que necesitamos ahora puede no ser una inyección,https://www.clarin.com/new-york-times-international-weekly/vacuna-covid-necesitamos-ahora-puede-inyeccion_0_SxnLwYh5qH.html,https://images.clarin.com/2022/02/02/rMQPapPp6_720x0__1.jpg
54,xS96BeE1AM,Salud. ¿De verdad funciona el rinocornio?,https://www.clarin.com/new-york-times-international-weekly/-verdad-funciona-rinocornio-_0_xS96BeE1AM.html,https://images.clarin.com/2022/02/02/QlEVPeGtJ_720x0__1.jpg
55,eGw5XVZsii,Hurlingham. Encontraron a la mujer con retraso que buscaban hacía más de un mes,https://www.clarin.com/zonales/encontraron-veronica-garcia-mujer-retraso-desaparecida-mes_0_eGw5XVZsii.html,https://images.clarin.com/2022/01/28/GBNzKFSTK_720x0__1.jpg
56,Yl0q7wD5t,Integró la Selección. La defensora que pregunta por qué Gallardo no deja jugar a las mujeres en el Monumental,https://www.clarin.com/zonales/padre-dejaba-jugar-futbol-ahora-figura-river-seleccion_0_Yl0q7wD5t.html,https://images.clarin.com/2022/01/12/Lgj4SdYNv_720x0__1.jpg
57,2ymnZjJpGd,Talentos del Conurbano. La fileteadora que causó sensación en China y sueña con ver su arte en todo Castelar,https://www.clarin.com/zonales/fileteadora-castelar-llego-arte-china-suena-verla-barrio_0_2ymnZjJpGd.html,https://images.clarin.com/2022/01/17/P1oY17Tsf_720x0__1.jpg
58,Ltd-aq7jR,Trujui Rugby. El proyecto de un jugador veterano del GBA y su hijo para no dejar a nadie afuera,https://www.clarin.com/zonales/trujui-rugby-club-nace-mano-apellido-hizo-historia-mariano-moreno_0_Ltd-aq7jR.html,https://images.clarin.com/2022/01/04/DZNHRPOKP_720x0__1.jpg
59,CfbPJ0PcC6,Sincero y movilizado. Sergio Lapegüe se despidió del noticiero de El Trece y explicó los motivos de su renuncia,https://www.clarin.com/fama/sergio-lapegue-despidio-noticiero-trece-explico-motivos-renuncia_0_CfbPJ0PcC6.html,https://images.clarin.com/2022/02/03/LRLb-ygZG_720x0__1.jpg
60,jtpvxqXFcd,"¿Qué le pasaba?. Insólita situación en ""MasterChef"": Malena Guinzburg tuvo un ataque de llanto y de risa al mismo tiempo",https://www.clarin.com/fama/insolita-situacion-masterchef-malena-guinzburg-ataque-llanto-risa-mismo-tiempo_0_jtpvxqXFcd.html,https://images.clarin.com/2022/02/03/I1HoZ5zob_720x0__1.jpg
61,t8XEqSip9W,"Ya está en su casa. Yao Cabrera habló de su estado de salud y lanzó: ""Me querían ver muerto""",https://www.clarin.com/fama/yao-cabrera-hablo-salud-lanzo-querian-ver-muerto-_0_t8XEqSip9W.html,https://images.clarin.com/2022/02/01/9R48D7vSf_720x0__1.jpg
62,Znf9XK3GKp,"Distintas versiones. Jorge Rial y Romina Pereiro, nuevas versiones de crisis: él se fue solo a Miami",https://www.clarin.com/fama/jorge-rial-romina-pereiro-nuevas-versiones-crisis-solo-miami_0_Znf9XK3GKp.html,https://images.clarin.com/2021/06/01/d7vrlghLu_720x0__1.jpg
63,Pw35qk5KuB,Especial Clarín. A veinte años de 20 libros que hicieron historia y no podés dejar de leer,https://www.clarin.com/cultura/veinte-anos-20-libros-hicieron-historia_0_Pw35qk5KuB.html,https://images.clarin.com/2022/01/27/2_bzFCtRx_720x0__1.jpg
64,H74ppau7HM,Nuevo plan Ahora 12. Qué se puede comprar hasta en 24 cuotas con la tasa más baja del mercado,https://www.clarin.com/servicios/ahora-12-productos-pueden-comprar-24-cuotas-tasa-baja-mercado_0_H74ppau7HM.html,https://images.clarin.com/2021/09/16/FeXenxjRg_720x0__1.jpg
65,7xqeI3PkMy,Finanzas virtuales. Ya hay 300 fintechs operando en el país: ¿cuáles  sobrevivirán?,https://www.clarin.com/economia/300-fintechs-operando-pais-sobreviviran-_0_7xqeI3PkMy.html,https://images.clarin.com/2020/01/03/JtIh8p2U_720x0__1.jpg
66,2K72p85uhZ,La pandemia. Ómicron en la Costa: por qué testean a infectados en una plaza llena de chicos jugando,https://www.clarin.com/sociedad/omicron-costa-testean-infectados-plaza-llena-chicos-jugando_0_2K72p85uhZ.html,https://images.clarin.com/2022/02/02/kd8lmJEyW_720x0__1.jpg
67,G6nE9o4P8q,Tarjeta versus apps. Previaje: las 3 formas de gastar el crédito en comercios y cuál conviene,https://www.clarin.com/servicios/previaje-3-formas-pagar-comercios-credito-conviene-elegir_0_G6nE9o4P8q.html,https://images.clarin.com/2022/02/01/LcvTYdv7t_720x0__1.jpg
68,3FVyBQy1ak,"Sociedad. El ""nuevo"" Aconcagua: escaladas en burbujas y rescates dramáticos",https://www.clarin.com/especiales/nuevo-aconcagua-retiros-espirituales-escalada-burbuja-verano-omicron_0_3FVyBQy1ak.html,https://images.clarin.com/2022/01/18/cgf90Nj_g_720x0__1.jpg
69,m1EdK_wpV,Sociedad. Mundo verdulería: 10 secretos del negocio que explotó en pandemia,https://www.clarin.com/sociedad/mundo-verduleria-10-secretos-negocio-exploto-pandemia_0_m1EdK_wpV.html,https://images.clarin.com/2021/12/20/MSbLfu4yR_720x0__1.jpg
70,fJM8dsWAP,Viajes. De Salta a Tierra del Fuego: postales de siete rutas escénicas de la Argentina,https://www.clarin.com/viajes/salta-tierra-fuego-postales-imperdibles-rutas-escenicas-argentina_0_fJM8dsWAP.html,https://images.clarin.com/2021/12/23/_rnz40zJS_720x0__1.jpg
71,RuiIn5s5cJ,A 77 años de su liberación. Holocausto: así era el campo de concentración nazi de Auschwitz,https://www.clarin.com/mundo/holocausto-campo-concentracion-nazi-auschwitz-nuevo-aniversario-liberacion_0_RuiIn5s5cJ.html,https://images.clarin.com/2021/01/27/js5e-EO_z_720x0__1.jpg
72,JYVOMTrOSz,Sólo falta la firma. River insistió y acordó de palabra con San Lorenzo el pase de Andrés Herrera,https://www.clarin.com/deportes/river-insistio-acordo-palabra-san-lorenzo-pase-andres-herrera_0_JYVOMTrOSz.html,https://images.clarin.com/2019/04/13/-udSsMPWY_720x0__1.jpg
73,pwWbMNJrme,"Rumores de conflicto. Alex Vigo, a un paso de salir de River: posteo borrado y pulgar para abajo de Gallardo",https://www.clarin.com/deportes/alex-vigo-paso-salir-river-posteo-instagram-borrado-pulgar-abajo-gallardo_0_pwWbMNJrme.html,https://images.clarin.com/2022/02/03/bC77Cv6cQ_720x0__1.jpg
74,cq3XRNsWrC,Se fue en 2019 a Italia. Boca ganó una demanda en FIFA y cobrará una deuda millonaria por Nández,https://www.clarin.com/deportes/futbol/boca-juniors/boca-gano-demanda-fifa-cobrara-deuda-millonaria-pase-nandez_0_cq3XRNsWrC.html,https://images.clarin.com/2021/12/31/2PYsXmEBh_720x0__1.jpg
75,JiAmeBPIR9,Juegos de Invierno 2022. Historias y sueños de los seis atletas argentinos que competirán en Beijing,https://www.clarin.com/deportes/atletas-argentina-participaran-juegos-olimpicos-invierno-beijing-2022_0_JiAmeBPIR9.html,https://images.clarin.com/2022/02/02/PyGGOGwr0_720x0__1.jpg
76,VHKTorbIR8,"Fuerte testimonio. Londero y la pandemia: depresión, pánico y ""miedo de morirse""",https://www.clarin.com/deportes/fuerte-testimonio-juan-ignacio-londero-efectos-pandemia-depresion-panico-miedo-morirse-_0_VHKTorbIR8.html,https://images.clarin.com/2022/02/03/FvvagslSf_720x0__1.jpg
77,lWOAib0q3F,Lo busca Boca. El representante de Facundo Farías reveló cuánto cobra en Colón y sorprendió a todos,https://www.clarin.com/deportes/representante-facundo-farias-duro-colon-dicen-joya-futbol-argentino-cobra-100-mil-pesos-mes-_0_lWOAib0q3F.html,https://images.clarin.com/2021/12/19/RvD0TJ26B_1256x620__3.jpg#1643844500459
