n,id,title,url,image
1,5Nu3qMY7x,Protestas en la isla. La crisis en Cuba y la censura que Cristina Kirchner impone al Presidente,https://www.clarin.com/opinion/censura_0_5Nu3qMY7x.html,https://images.clarin.com/2021/07/13/hF0Z8C6I8_720x0__1.jpg
2,S_kU-Zh1t,Del editor. Fernández no ve lo que no quiere ver,https://www.clarin.com/opinion/fernandez-ve-quiere-ver_0_S_kU-Zh1t.html,https://images.clarin.com/2021/07/05/nh5ipSbby_720x0__1.jpg
3,L-sHdfa5a,"Ventana al mundo. El régimen cortó Internet, pero los cubanos hallaron una alternativa",https://www.clarin.com/mundo/protestas-cuba-isla-corta-internet-domingo-cubanos-encontraron-alternativa_0_L-sHdfa5a.html,https://images.clarin.com/2021/07/13/HBGOR9fs-_1256x620__2.jpg#1626195138642
4,VnzAWyruO,"Duro testimonio. Un médico cubano en Argentina: ""Tengo amigos desaparecidos en La Habana""",https://www.clarin.com/mundo/-amigos-desaparecidos-habana-angustia-medico-cubano-vive-argentina_0_VnzAWyruO.html,https://images.clarin.com/2021/07/14/dxEsTVpX9_720x0__1.jpg
5,zdx7D89IF,Le realizarán estudios. Internaron a Bolsonaro en un hospital de Brasilia por dolores abdominales,https://www.clarin.com/mundo/internaron-jair-bolsonaro-hospital-brasilia_0_zdx7D89IF.html,https://images.clarin.com/2021/07/14/2-9xpOoe3_720x0__1.jpg
6,dZQLYFUpJ,"Argentinos varados. Aerolínea por aerolínea, cuáles son los vuelos internacionales aprobados",https://www.clarin.com/viajes/aerolinea-aerolinea-vuelos-aprobados-ultimos-cambios-cupo_0_dZQLYFUpJ.html,https://images.clarin.com/2020/11/06/WkbPljR6V_720x0__1.jpg
7,C_1o7V5Xu,La crisis en la cadena. Garbarino: la historia de un salvataje frustrado,https://www.clarin.com/economia/garbarino-historia-salvataje-frustrado_0_C_1o7V5Xu.html,https://images.clarin.com/2021/07/13/AZZtLBilG_720x0__1.jpg
8,UtYZVVE8O,"En Provincia. A diez días del cierre de listas, nadie quiere ser candidato del Frente de Todos",https://www.clarin.com/politica/elecciones-2021-dias-cierre-listas-nadie-quiere-candidato-frente-provincia_0_UtYZVVE8O.html,https://images.clarin.com/2021/06/12/orAhLUYXw_720x0__1.jpg
9,qQUTfbHC4,"Danza de nombres. Versiones, tensión y fijas en los cierres del oficialismo en el interior",https://www.clarin.com/politica/elecciones-2021-versiones-tensiones-numeros-puestos-cierres-frente-interior_0_qQUTfbHC4.html,https://images.clarin.com/2021/07/13/VwbAoEap2_1256x620__2.jpg#1626228976615
10,gyG7_tkX5,"La gran polémica. Era gol de Boca, pero Nacho Fernández apuró al árbitro y el VAR lo anuló",https://www.clarin.com/deportes/copa-libertadores-gol-boca-nacho-fernandez-apuro-arbitro-var-anulo_0_gyG7_tkX5.html,https://images.clarin.com/2021/07/13/L5QC9iFdJ_720x0__1.jpg
11,GZcz5Bv2d,Blend de 5 cepas. Los secretos del vino de Messi y el pedido especial que le hizo a su enólogo,https://www.clarin.com/deportes/secretos-vino-messi-pedido-especial-hizo-enologo-mejor-iniesta-_0_GZcz5Bv2d.html,https://images.clarin.com/2021/07/13/SpqKc6XqJ_720x0__1.jpg
12,mXJCUVJDS,"Línea de la Concepción. La ciudad de Andalucía que ""trabaja"" en Gibraltar y se quiere independizar",https://www.clarin.com/mundo/espana-linea-concepcion-ciudad-andalucia-trabaja-gibraltar-quiere-independizar_0_mXJCUVJDS.html,https://images.clarin.com/2020/12/31/E_jf4SNqr_720x0__1.jpg
13,Km3faQCl4,Covid-19. Cuestionan la teoría de que se escapó de un laboratorio,https://www.clarin.com/new-york-times-international-weekly/grupo-cientificos-opone-teoria-covid-19-escapo-laboratorio_0_Km3faQCl4.html,https://images.clarin.com/2021/07/12/U98mC71sH_1256x620__2.jpg#1626092926322
14,aBbU9dKS7,Modern Love. No se acordaba de que habíamos terminado,https://www.clarin.com/new-york-times-international-weekly/modern-love-acordaba-terminado_0_aBbU9dKS7.html,https://images.clarin.com/2021/07/12/OuKN9shPZ_1256x620__2.jpg#1626093716735
15,jmls429I-,"""No necesitamos otro Miguel Ángel"".  En Italia surgen los robots escultores",https://www.clarin.com/new-york-times-international-weekly/necesitamos-miguel-angel-italia-surgen-robots-escultores_0_jmls429I-.html,https://images.clarin.com/2021/07/12/xscG6148h_1256x620__2.jpg#1626097938975
16,i0zKgBC__,Genética. La coliflor es un fractal difícil de reproducir,https://www.clarin.com/new-york-times-international-weekly/coliflor-fractal-dificil-reproducir_0_i0zKgBC__.html,https://images.clarin.com/2021/07/12/ja-VZu7G0_1256x620__2.jpg#1626100418465
17,9Wf4aHnT_,Nueva York. Adiviná cuánto cuestan las papas fritas más caras del mundo,https://www.clarin.com/viajes/adivina-cuestan-papas-fritas-caras-mundo_0_9Wf4aHnT_.html,https://images.clarin.com/2021/07/13/by2Ww7Yqh_720x0__1.jpg
18,SEB-16eQw,"Angkor. Fue  una ciudad poderosa, pero sus templos pasaron seis siglos tapados por la selva",https://www.clarin.com/internacional/ciudades-poderosas-templos-pasaron-siglos-tapados-selva-angkor-capital-imperio-olvidado_0_SEB-16eQw.html,https://images.clarin.com/1969/12/31/S1HkBbkNl_1256x620__3.jpg#1625845146612
19,QIm0pFoCu,En Las Vegas. Video: el polémico saludo militar de Mel Gibson a Trump que hizo estallar las redes,https://www.clarin.com/internacional/estados-unidos/video-polemico-saludo-militar-mel-gibson-donald-trump-hizo-estallar-redes_0_QIm0pFoCu.html,https://images.clarin.com/2021/07/13/wI34-4oLt_720x0__1.jpg
20,jLefr8nn3,Mirá el video. Una pasajera intentó abrir la puerta en pleno vuelo y la ataron con cinta,https://www.clarin.com/viste/pasajera-avion-atada-amordazada-intentar-abrir-puerta-pleno-vuelo_0_jLefr8nn3.html,https://images.clarin.com/2021/07/13/s2nTrHI0u_720x0__1.jpg
21,0bPK5SXcj,"Canadá. Un hombre, 27 esposas, 150 hijos: secretos de la familia polígama más grande",https://www.clarin.com/internacional/hombre-27-esposas-150-hijos-secretos-familia-poligama-grande-mundo_0_0bPK5SXcj.html,https://images.clarin.com/2021/07/13/4akYxWr8F_720x0__1.jpg
22,kgKI4_85K,Señora de Cao. La mujer más poderosa de Perú que estuvo oculta en una tumba 1.700 años,https://www.clarin.com/viste/senora-cao-mujer-poderosa-peru-oculta-tumba-1-700-anos_0_kgKI4_85K.html,https://images.clarin.com/2017/07/05/SyyH8yoNZ_720x0.jpg
23,cXHrtB_S1,"""Una obra redonda"". Los ricoteros donaron chatarra y el Indio Solari ya tiene su primera estatua",https://www.clarin.com/zonales/matanza-pusieron-estatua-rendirle-tributo-indio-solari_0_cXHrtB_S1.html,https://images.clarin.com/2021/07/13/plBH70JGR_720x0__1.jpg
24,0ey7N-6s_,Generó una revolución. Nicolás Otamendi volvió al humilde barrio de Tigre dónde aprendió a patear,https://www.clarin.com/zonales/barrio-tigre-crecio-otamendi-lleno-orgullo-recuerdos-idolo-anulo-neimar_0_0ey7N-6s_.html,https://images.clarin.com/2021/07/12/KXGZ8sCIf_1256x620__2.jpg#1626121476540
25,uSVEbkEMe,Tres de Febrero. Quiénes son los dos campeones que la rompían en un club barrial,https://www.clarin.com/zonales/copa-america-campeones-maracana-rompian-juntos-club-barrio-gba_0_uSVEbkEMe.html,https://images.clarin.com/2021/07/11/GaAm-t-kb_720x0__1.jpg
26,s91eGeAKq,Norte del GBA. El Tren de la Costa baja a la mitad su boleto y buscan reconvertirlo,https://www.clarin.com/zonales/reinauguraron-estacion-delta-tren-costa-costara-12_0_s91eGeAKq.html,https://images.clarin.com/2021/07/06/E33wb5YYd_720x0__1.jpg
27,Zmphv17DI,Furgoneta office. La contadora que trabaja mientras recorre el país,https://www.clarin.com/zonales/-motorhome-office-hace-meses-trabaja-recorre-pais_0_Zmphv17DI.html,https://images.clarin.com/2021/06/24/FHApMBVh1_720x0__1.jpg
28,-IMCV7rTv,Tiene 31 años. De barrendero a campeón: Brian Castaño va por la gloria en Estados Unidos,https://www.clarin.com/deportes/barrendero-campeon-historia-vida-brian-castano-va-gloria_0_-IMCV7rTv.html,https://images.clarin.com/2018/03/10/rky_MyzKG_1256x620__5.jpg#1626223534131
29,2X8D6SnNH,Violencia en el GBA. La mujer policía que mató a balazos a su tío porque su hermana dijo que la quiso manosear,https://www.clarin.com/policiales/mujer-policia-mato-balazos-tio-hermana-dijo-quiso-manosear_0_2X8D6SnNH.html,https://images.clarin.com/2021/07/13/vY7StYDbr_1256x620__2.jpg#1626210650527
30,RVVDZRIWH,Tras ocho operaciones. Sufre una enfermedad poco frecuente y necesita ayuda para tratarse en Alemania,https://www.clarin.com/sociedad/paso-operaciones-sufre-enfermedad-frecuente-necesita-ayuda-tratarse-alemania_0_RVVDZRIWH.html,https://images.clarin.com/2021/07/14/CiSD2as9z_720x0__1.jpg
31,u25fvlhBw,Ahorros. Plazo fijo tradicional vs. UVA: ventajas y desventajas para proteger el dinero,https://www.clarin.com/servicios/plazo-fijo-tradicional-vs-uva-conviene-ganarle-inflacion_0_u25fvlhBw.html,https://images.clarin.com/2020/11/13/SQWM8kJZi_720x0__1.jpg
32,IyQkzZMLO,Valores Religiosos. Determinan que la práctica religiosa ayuda a enfrentar la pandemia,https://www.clarin.com/sociedad/determinan-practica-religiosa-ayuda-enfrentar-pandemia_0_IyQkzZMLO.html,https://images.clarin.com/2021/07/13/xVFCaAjj1_720x0__1.jpg
33,efdxqE5er,"Online y presencial. El Festival Entre-Nous y lo mejor de Francia, incluido lo nuevo de Polanski",https://www.clarin.com/espectaculos/cine/festival-nous-trae-mejor-francia-incluido-nuevo-roman-polanski_0_efdxqE5er.html,https://images.clarin.com/2021/07/13/tnMql8C6L_720x0__1.jpg
34,O7sxyfAru,Ksenija Sidorova. La acordeonista letona que adora a Piazzolla y aprendió español con series,https://www.clarin.com/espectaculos/musica/ksenija-sidorova-acordeonista-letona-adora-piazzolla-aprendio-castellano-viendo-series-narcos_0_O7sxyfAru.html,https://images.clarin.com/2021/07/14/vvR91w01A_720x0__1.jpg
35,Q3cM3GzVi,"Fiestas electrónicas. Hernán Cattaneo y las drogas: ""Time Warp fue una tragedia evitable""",https://www.clarin.com/viva/hernan-cattaneo-drogas-fiestas-electronicas-time-warp-tragedia-evitable-_0_Q3cM3GzVi.html,https://images.clarin.com/2021/07/13/bqwCHXKB-_720x0__1.jpg
36,bxxmwckU5,"Horror en Hollywood. El aberrante asesinato de La Dalia Negra: una historia de mutilación, sexo y muerte",https://www.clarin.com/internacional/aberrante-asesinato-dalia-negra-historia-mutilacion-sexo-muerte_0_bxxmwckU5.html,https://images.clarin.com/2021/07/14/T2IeaYP_N_720x0__1.jpg
37,H-2VCvGjQ,Copa Libertadores. Boca no pudo con el Mineiro ni con el VAR y la serie se define en Brasil,https://www.clarin.com/deportes/boca-vs-atletico-mineiro-copa-libertadores-previa-alineaciones-directo_0_H-2VCvGjQ.html,https://images.clarin.com/2021/07/13/hNc2kamtJ_720x0__1.jpg
38,6qAResXaW,Duelo de ida. Racing se tuvo que conformar con el empate ante San Pablo,https://www.clarin.com/deportes/san-pablo-vs-racing-copa-libertadores-empate-merecio-algo-mas_0_6qAResXaW.html,https://images.clarin.com/2021/07/13/lgolqa8Zn_720x0__1.jpg
39,Y49VQXn8W,"Un karma para River. Gabriel Milito, la piedra en el zapato de Marcelo Gallardo como DT",https://www.clarin.com/deportes/gabriel-milito-piedra-zapato-marcelo-gallardo-dt_0_Y49VQXn8W.html,https://images.clarin.com/2021/07/13/XxxiA3jkX_1256x620__2.jpg#1626211818544
40,0VZTczKO_,"""Me siento decepcionado"". Federer se bajó de Tokio y no podrá lograr el único título grande que le falta",https://www.clarin.com/deportes/roger-federer-tokio-podra-lograr-unico-titulo-grande-falta_0_0VZTczKO_.html,https://images.clarin.com/2021/07/13/sk-pcN_dH_1256x620__2.jpg#1626195033591
41,NuSxYoRoP,Desde Rosario. El viaje relámpago de Messi para hacer un trámite en la Embajada de EE.UU.,https://www.clarin.com/deportes/viaje-relampago-lionel-messi-buenos-aires-hacer-tramite-embajada-unidos_0_NuSxYoRoP.html,https://images.clarin.com/2021/07/13/S5E07rC0D_720x0__1.jpg
42,w85JpdD08,Duelo de campeones. Chiqui Tapia habló de la posibilidad de jugar un partido oficial ante Italia,https://www.clarin.com/deportes/claudio-chiqui-tapia-dijo-posibilidad-jugar-italia-vamos-hacer-_0_w85JpdD08.html,https://images.clarin.com/2021/07/11/SKCQWHt6k_720x0__1.jpg
43,thTmF8vef,El registro que faltaba. Messi compartió el video de los festejos grabado con su celular,https://www.clarin.com/deportes/messi-compartio-video-festejos-grabado-celular-explotaron-redes_0_thTmF8vef.html,https://images.clarin.com/2021/07/13/Zz2TLycdq_720x0__1.jpg
44,sePjdd9gk,Minuto a minuto. Mercado de pases: las altas y las bajas de todos los equipos de la Liga de Fútbol,https://www.clarin.com/deportes/mercado-pases-71-refuerzos-futbol-argentino_0_sePjdd9gk.html,https://images.clarin.com/2021/07/09/cHYOolsFW_720x0__1.jpg
45,yfTy2lGDS,Maquinita electoral. El Banco Central giró $ 80.000 millones al Tesoro en el arranque del mes,https://www.clarin.com/economia/banco-central-giro-80-000-millones-tesoro-arranque-mes_0_yfTy2lGDS.html,https://images.clarin.com/2013/06/02/r1xoxZmJVl_720x0.jpg
46,43ufAoSl-,50% más que hace un año. Precios Cuidados ya representa el 10% de las ventas de los súper,https://www.clarin.com/economia/precios-cuidados-representa-10-ventas-supermercados-doble-hace-ano_0_43ufAoSl-.html,https://images.clarin.com/2021/07/05/iGUH5Fua-_720x0__1.jpg
47,E4xd5yPYL,Cómo funcionará. La Ciudad prepara su propio sistema de receta médica digital,https://www.clarin.com/ciudades/receta-medica-digital-llego-quedarse-ciudad-propio-sistema-funcionara_0_E4xd5yPYL.html,https://images.clarin.com/2020/03/26/LND7A3iM4_720x0__1.jpg
48,HKsoJkqCK,"Es oficial. Aprueban una suba del 5% retroactiva a julio para telefonía, internet y cable",https://www.clarin.com/economia/enacom-aprobo-aumento-5-retroactivo-julio-telefonia-internet-television-cable_0_HKsoJkqCK.html,https://images.clarin.com/2020/05/26/iG8C5HTDQ_720x0__1.jpg
49,8S6jJqtGD,Elecciones 2021. Tironeos por las candidaturas en el kirchnerismo de la Ciudad,https://www.clarin.com/politica/interna-k-ciudad-matias-lammens-pone-reparos-candidatura-leandro-santoro-pide-alguien-moderado_0_8S6jJqtGD.html,https://images.clarin.com/2019/09/17/lUrT8hGZQ_720x0__1.jpg
50,nPj-3tBQp,"Tragedia de Tigre. Borracho, chocó y mató a dos amigos: piden domiciliaria porque es celíaco",https://www.clarin.com/policiales/borracho-registro-choco-mato-amigos-piden-domiciliaria-celiaco-asmatico_0_nPj-3tBQp.html,https://images.clarin.com/2021/07/13/OWyT1RUYR_720x0__1.jpg
51,1r56_sC4X,Política y medios. El Grupo América le compró en US$ 6 millones el diario El Cronista a De Narváez,https://www.clarin.com/politica/grupo-america-compro-us-6-millones-diario-cronista-francisco-narvaez_0_1r56_sC4X.html,https://images.clarin.com/2012/10/10/SyEzA6sY4x_720x0.jpg
52,12QDtUfOc,Salud. El desafío 30x5 para los chicos: cuánto y qué tipo de ejercicio deben hacer a cada edad,https://www.clarin.com/buena-vida/desafio-30x5-chicos-tipo-ejercicio-deben-hacer-edad_0_12QDtUfOc.html,https://images.clarin.com/2021/07/12/5QrEv2qKi_720x0__1.jpg
53,8okNRqklV,Cuáles son y cuánto cuestan. Los vinos argentinos con medallas de oro y platino en los premios Decanter 2021,https://www.clarin.com/gourmet/cuestan-vinos-argentinos-medallas-oro-platino-premios-decanter-2021_0_8okNRqklV.html,https://images.clarin.com/2021/07/13/T5-KmHl1Y_1256x620__2.jpg#1626222063864
54,BexZsJiaI,Redes sociales. Finsta: las cuentas falsas de Instagram preferidas por adolescentes y famosos,https://www.clarin.com/familias/finsta-cuentas-falsas-instagram-preferidas-adolescentes-famosos_0_BexZsJiaI.html,https://images.clarin.com/2021/07/13/fwip8os9k_720x0__1.jpg
55,15oOfsPsT,"Vínculos. ""Quiero una pareja como la de Messi y Antonela"": riesgos de idealizar el amor",https://www.clarin.com/relaciones/-quiero-pareja-messi-antonela-riesgos-idealizar-amor_0_15oOfsPsT.html,https://images.clarin.com/2021/07/13/ge0Uju7KQ_720x0__1.jpg
56,mT5AH1Qdr,Mindfulness. 5 cosas que hay que saber para empezar a meditar,https://www.clarin.com/buena-vida/5-cosas-saber-empezar-meditar_0_mT5AH1Qdr.html,https://images.clarin.com/2021/07/12/eVqkGwF48_720x0__1.jpg
57,rL76wN1a4,Requisitos. Vacaciones: qué provincias piden test de Covid para ingresar,https://www.clarin.com/viajes/vacaciones-invierno-2021-provincias-piden-test-covid-ingresar_0_rL76wN1a4.html,https://images.clarin.com/2019/12/01/PIHo6qNC_720x0__1.jpg
58,AIFplTor4,Astros. Las predicciones de Jimena La Torre para la segunda mitad de 2021,https://www.clarin.com/astrologia/predicciones-jimena-torre-segunda-mitad-2021_0_AIFplTor4.html,https://images.clarin.com/2019/11/21/J_VHECHD_720x0__1.jpg
59,VJjikTYuR,Bliss. Microsoft lanza una versión renovada del mítico fondo de Windows XP,https://www.clarin.com/tecnologia/microsoft-lanza-version-renovada-bliss-mitico-fondo-pantalla-windows-xp_0_VJjikTYuR.html,https://images.clarin.com/2017/11/21/H1QHhmzxG_720x0.jpg
60,6Pyt2iXSb,Regreso al Vaticano. El papa Francisco salió del hospital 10 días después de ser operado,https://www.clarin.com/mundo/papa-francisco-sale-hospital-llega-vaticano-10-despues-operado_0_6Pyt2iXSb.html,https://images.clarin.com/2021/07/14/IJdc0ID2Y_1256x620__2.jpg#1626257595647
61,yPHKv6p-4,¿Antígenos o PCR?. Covid: cómo mejorar el control para evitar la circulación de la cepa Delta,https://www.clarin.com/sociedad/-antigenos-pcr-puede-mejorar-control-evitar-circulacion-comunitaria-delta_0_yPHKv6p-4.html,https://images.clarin.com/2021/04/30/cdfS3sEan_720x0__1.jpg
62,mGys1yEfp,"Cepa Delta y varados. Quirós criticó a Kicillof: ""El miedo y la culpa generan más dificultad""",https://www.clarin.com/politica/fernan-quiros-diferencio-axel-kicillof-estrategia-miedo-culpa-solo-generan-dificultad-manejo-pandemia-_0_mGys1yEfp.html,https://images.clarin.com/2021/07/14/9g6C_tVAQ_720x0__1.jpg
63,Op8RjMYEb,Coronavirus. Alerta en EE.UU. por la variante Delta: se duplicaron los casos en tres semanas,https://www.clarin.com/mundo/alerta-unidos-avance-variante-delta-duplicaron-casos-coronavirus-semanas_0_Op8RjMYEb.html,https://images.clarin.com/2021/04/07/YeOKplxoa_720x0__1.jpg
64,ubwQBAIj5,De Tandil a Ezeiza. A la joven rescatada cuando tomaba un vuelo le compraron el pasaje en México,https://www.clarin.com/policiales/confirman-joven-rescatada-punto-tomar-vuelo-ezeiza-comprado-pasaje-mexico_0_ubwQBAIj5.html,https://images.clarin.com/2021/07/13/pnoct2w-D_720x0__1.jpg
65,BLm_qduWi,Webs globales. Puerta a puerta y dólar atrasado: qué traer del exterior hasta 60% más barato,https://www.clarin.com/servicios/puerta-puerta-dolar-atrasado-puede-traer-exterior-buen-precio_0_BLm_qduWi.html,https://images.clarin.com/2021/06/22/WLhSLPOGe_720x0__1.jpg
66,5-EyJIXNH,Alivio en agosto. Jubilados: habrá un bono menor para los que ganan entre $ 46.130 y $ 51.130,https://www.clarin.com/economia/jubilados-bono-menor-ganan-46-130-51-130_0_5-EyJIXNH.html,https://images.clarin.com/2020/01/17/OBF9DhDy_720x0__1.jpg
67,Q40aFXzw5,Tristeza. Murió Rodolfo Stoessel: la dolorosa despedida de Tini,https://www.clarin.com/fama/murio-rodolfo-stoessel-dolorosa-despedida-tini_0_Q40aFXzw5.html,https://images.clarin.com/2021/07/13/FWc3Uh4Pt_720x0__1.jpg
