n,id,title,url,image
1,lJpDUvn4Z,Movilizaciones en todo el país. En la protesta del campo también reclamaron por la vacunación y contra las restricciones,https://www.clarin.com/rural/comenzo-protesta-campo-gobierno-pais_0_lJpDUvn4Z.html,https://images.clarin.com/2021/07/09/AiLaJqh84_720x0__1.jpg
2,fDKnXuLeK,"San Nicolás. A caballo y con poncho, así llegó Patricia Bullrich a la manifestación",https://www.clarin.com/rural/caballo-poncho-llego-patricia-bullrich-protesta-campo-gobierno_0_fDKnXuLeK.html,https://images.clarin.com/2021/07/09/3lzOptUu0_720x0__1.jpg
3,2EHK3Px74,"En Bahía Blanca. Original protesta de ganaderos: ofrecieron ""vaca china"" al asador",https://www.clarin.com/economia/original-protesta-ganaderos-ofrecieron-vaca-china-asador_0_2EHK3Px74.html,https://images.clarin.com/2021/07/09/3yx3WjQJx_720x0__1.jpg
4,PrQhlRoKd,"Acto por el 9 de Julio. Alberto Fernández: ""Si alguien espera que claudique ante un laboratorio se equivoca""",https://www.clarin.com/politica/vivo-alberto-fernandez-encabeza-acto-dia-independencia-tucuman-medio-protestas_0_PrQhlRoKd.html,https://images.clarin.com/2021/07/09/AFHngk3mA_720x0__1.jpg
5,kED3kflsd,"Forcejeos y golpes. Incidentes entre manifestantes y la Policía, antes del acto en Tucumán",https://www.clarin.com/politica/incidentes-manifestantes-policia-tucuman-acto-alberto-fernandez_0_kED3kflsd.html,https://images.clarin.com/2021/07/09/je7Qd0NQC_720x0__1.jpg
6,b96-Oy6G0,Dieron su pronóstico. Cuál será el valor del dólar y la inflación a fin de año según los economistas,https://www.clarin.com/economia/encuesta-banco-central-inflacion-junio-quedaria-3-2-_0_b96-Oy6G0.html,https://images.clarin.com/2020/07/28/iYSWSPInX_720x0__1.jpg
7,pNLh1Ag9i,La pandemia. Aún no se definió si se vacunará a todos los chicos: qué dicen los expertos,https://www.clarin.com/sociedad/vacunas-pediatricas-chicos-edades-vacunar-covid_0_pNLh1Ag9i.html,https://images.clarin.com/2021/04/09/07X6alMkF_1256x620__3.jpg#1625773775175
8,_qOPvmhsM,Un año después. Lo que creíamos saber del Covid y qué cambió con las nuevas variantes,https://www.clarin.com/sociedad/creiamos-saber-covid-cambio-nuevas-variantes_0__qOPvmhsM.html,https://images.clarin.com/2021/07/07/1dqZ-0mNb_720x0__1.jpg
9,mTDNygnqn,"Comida, juegos y salubridad. 9 de julio: diez cosas que (casi) no sabías sobre la vida cotidiana en 1816",https://www.clarin.com/cultura/9-julio-cosas-sabias-vida-cotidiana-1816_0_mTDNygnqn.html,https://images.clarin.com/2021/07/06/c_koODPiH_720x0__1.jpg
10,wXrCrtaXH,"Psoriasis, la enfermedad que explotó en la pandemia",https://www.clarin.com/buena-vida/psoriasis-enfermedad-exploto-pandemia_0_wXrCrtaXH.html,https://images.clarin.com/2021/05/31/saNJQi-UR_720x0__1.jpg
11,lJpDUvn4Z,Movilizaciones en todo el país. En la protesta del campo también reclamaron por la vacunación y contra las restricciones,https://www.clarin.com/rural/comenzo-protesta-campo-gobierno-pais_0_lJpDUvn4Z.html,https://images.clarin.com/2021/07/09/AiLaJqh84_720x0__1.jpg
12,fDKnXuLeK,"San Nicolás. A caballo y con poncho, así llegó Patricia Bullrich a la manifestación",https://www.clarin.com/rural/caballo-poncho-llego-patricia-bullrich-protesta-campo-gobierno_0_fDKnXuLeK.html,https://images.clarin.com/2021/07/09/3lzOptUu0_720x0__1.jpg
13,2EHK3Px74,"En Bahía Blanca. Original protesta de ganaderos: ofrecieron ""vaca china"" al asador",https://www.clarin.com/economia/original-protesta-ganaderos-ofrecieron-vaca-china-asador_0_2EHK3Px74.html,https://images.clarin.com/2021/07/09/3yx3WjQJx_720x0__1.jpg
14,PrQhlRoKd,"Acto por el 9 de Julio. Alberto Fernández: ""Si alguien espera que claudique ante un laboratorio se equivoca""",https://www.clarin.com/politica/vivo-alberto-fernandez-encabeza-acto-dia-independencia-tucuman-medio-protestas_0_PrQhlRoKd.html,https://images.clarin.com/2021/07/09/AFHngk3mA_720x0__1.jpg
15,kED3kflsd,"Forcejeos y golpes. Incidentes entre manifestantes y la Policía, antes del acto en Tucumán",https://www.clarin.com/politica/incidentes-manifestantes-policia-tucuman-acto-alberto-fernandez_0_kED3kflsd.html,https://images.clarin.com/2021/07/09/je7Qd0NQC_720x0__1.jpg
16,b96-Oy6G0,Dieron su pronóstico. Cuál será el valor del dólar y la inflación a fin de año según los economistas,https://www.clarin.com/economia/encuesta-banco-central-inflacion-junio-quedaria-3-2-_0_b96-Oy6G0.html,https://images.clarin.com/2020/07/28/iYSWSPInX_720x0__1.jpg
17,pNLh1Ag9i,La pandemia. Aún no se definió si se vacunará a todos los chicos: qué dicen los expertos,https://www.clarin.com/sociedad/vacunas-pediatricas-chicos-edades-vacunar-covid_0_pNLh1Ag9i.html,https://images.clarin.com/2021/04/09/07X6alMkF_1256x620__3.jpg#1625773775175
18,Drkz20AH6,Copa América. Habrá 2.200 hinchas argentinos en el Maracaná: quiénes podrán ir a la cancha,https://www.clarin.com/deportes/final-publico-copa-america-argentina_0_Drkz20AH6.html,https://images.clarin.com/2021/07/08/D78B-HclWF_720x0__1.jpg
19,XrALb2Lh0,Wimbledon 2021. Djokovic se acerca al triunfo y a una nueva final de Grand Slam,https://www.clarin.com/deportes/wimbledon-2021-novak-djokovic-va-victoria-acerque-record_0_XrALb2Lh0.html,https://images.clarin.com/2021/07/09/59deCpco-_1256x620__2.jpg#1625851693490
20,Ti_zKPSaL,Tras un largo silencio. Russo habló sobre el mercado de pases de Boca y dejó su deseo para Messi,https://www.clarin.com/deportes/russo-hablo-mercado-pases-boca-dejo-deseo-messi_0_Ti_zKPSaL.html,https://images.clarin.com/2021/07/09/nVPKO6v3D_720x0__1.jpg
21,0vqag2l35,Argentina vs Brasil. Superestrellas: ¿quién tiene más jerarquía detrás de Messi y Neymar?,https://www.clarin.com/deportes/argentina-brasil_0_0vqag2l35.html,https://images.clarin.com/2021/07/08/-oz9xSXZd_720x0__1.jpg
22,jq_6PPDoM,Copa América. Cuáles son las dudas en la formación de la Selección para la final ante Brasil,https://www.clarin.com/deportes/copa-america-dudas-formacion-seleccion-gran-final-brasil_0_jq_6PPDoM.html,https://images.clarin.com/2021/07/06/a2SFKeo4X_720x0__1.jpg
23,Ygc9Z1owv,"Hay 3 argentinos. Se filtró cuánto cobran los futbolistas del PSG, el nuevo galáctico del fútbol",https://www.clarin.com/deportes/filtro-cobran-futbolistas-psg-nuevo-galactico-futbol_0_Ygc9Z1owv.html,https://images.clarin.com/2021/05/17/xMJk7vG0lC_1256x620__2.jpg#1625845417164
24,zTptptsmT,Lo arreglaron al aire. La última locura de Fantino: se subirá al ring para boxear con el Ninja Horacio,https://www.clarin.com/deportes/ultima-locura-alejandro-fantino-subira-ring-boxear-ninja-horacio_0_zTptptsmT.html,https://images.clarin.com/2021/07/08/WIkyBTSAk_720x0__1.jpg
25,jjIkDvPi3,Finales de la NBA. Los Suns vencieron a los Bucks y lideran la serie 2-0,https://www.clarin.com/deportes/finales-nba-suns-vencieron-bucks-lideran-serie-2-0_0_jjIkDvPi3.html,https://images.clarin.com/2021/07/09/AU4sBoMqk_720x0__1.jpg
26,sePjdd9gk,Minuto a minuto. Mercado de pases: todas las altas y bajas de los equipos de la Liga de Fútbol Profesional,https://www.clarin.com/deportes/mercado-pases-71-refuerzos-futbol-argentino_0_sePjdd9gk.html,https://images.clarin.com/2021/07/09/cHYOolsFW_720x0__1.jpg
27,ZigOHWe7t,Por el Plan Cóndor. Confirman perpetua en Italia para 14 represores sudamericanos,https://www.clarin.com/mundo/fallo-historico-confirman-cadena-perpetua-italia-14-represores-sudamericanos-plan-condor_0_ZigOHWe7t.html,https://images.clarin.com/2021/07/09/CUouPiTva_1256x620__2.jpg#1625842857138
28,Qe-Y42yeG,Delante de su familia. Asesinan de un tiro en el pecho a un policía de la Ciudad ,https://www.clarin.com/policiales/asesinan-tiro-pecho-policia-ciudad-delante-familia-avellaneda_0_Qe-Y42yeG.html,https://images.clarin.com/2021/07/09/WXmu5ZYTM_720x0__1.jpg
29,zEC9ISZEx,Coronavirus. Vacunas: EE.UU. afirma que una tercera dosis no es necesaria,https://www.clarin.com/mundo/vacunas-coronavirus-ee-uu-afirma-tercera-dosis-necesaria_0_zEC9ISZEx.html,https://images.clarin.com/2021/06/07/AeGlU_KlC_1256x620__2.jpg#1625841551161
30,oGm9STMm1,"Polémico ""control"". De Pedro confirmó los operativos de Migraciones y criticó a Clarín",https://www.clarin.com/politica/wado-pedro-confirmo-operativos-migraciones-critico-clarin_0_oGm9STMm1.html,https://images.clarin.com/2021/07/07/I4tCff7ie_720x0__1.jpg
31,JtzN5gjm6,"La vida de un narco. ""Sigo siendo Pablo Escobar"": diálogos entre ""Rengo"" Pacheco y su ex",https://www.clarin.com/policiales/-sigo-pablo-escobar-violentos-dialogos-rengo-pacheco-ex_0_JtzN5gjm6.html,https://images.clarin.com/2021/05/31/voEQ6IDxw_1256x620__2.jpg#1625782939745
32,khAWxN1Kj,Respuesta. Qué cosas no entendió el ministro del Interior,https://www.clarin.com/politica/cosas-entendio-ministro-interior_0_khAWxN1Kj.html,https://images.clarin.com/2020/10/25/Cd0rWD3Ns_720x0__1.jpg
33,hQyy_aO_b,Reunión del G20. Kristalina y Guzmán en Venecia: el curioso aviso del Financial Times,https://www.clarin.com/economia/kristalina-martin-gondola-venecia-curioso-aviso-financial-times_0_hQyy_aO_b.html,https://images.clarin.com/2021/07/09/s-0w1fzTt_1256x620__2.jpg#1625842221560
34,e-6HA8TOU,"Por el 9 de Julio. Kicillof hizo un acto a medianoche y habló de ""renacimiento"" en la Provincia",https://www.clarin.com/politica/axel-kicillof-encabezo-acto-dia-independencia-invitacion-renacimiento-provincia_0_e-6HA8TOU.html,https://images.clarin.com/2021/07/09/_ojoRTJy1_720x0__1.jpg
35,TX0FXfxgG,"Hoteles. El ""campamento 5 estrellas"" en uno de los paisajes más espectaculares del país",https://www.clarin.com/viajes/sorprendente-campamento-estrellas-paisajes-espectaculares-argentina_0_TX0FXfxgG.html,https://images.clarin.com/2021/07/06/FSNUiAq2B_720x0__1.jpg
36,dURNrkweQ,"Día de la Independencia. Locro, pastelitos de membrillo y otras recetas para festejar el 9 de Julio",https://www.clarin.com/gourmet/9-de-julio-locro-pastelitos-de-membrillo-y-otras-recetas-para-festejar-el-dia-de-la-independencia_0_dURNrkweQ.html,https://images.clarin.com/2019/06/29/PLK-geHyl_720x0__1.jpg
37,1wPCFvYIJ,Guía detallada. Revisión de la Sociedad Europea de Cardiología: qué y cuánto comer para cuidar el corazón,https://www.clarin.com/buena-vida/guia-detallada-comer-cuidar-corazon-_0_1wPCFvYIJ.html,https://images.clarin.com/2020/10/20/rKzrDtcVf_720x0__1.jpg
38,fpmpj_JHB,"Miles de seguidores. Ayayi, la influencer virtual que logra más ventas que personas reales",https://www.clarin.com/tecnologia/ayayi-influencer-virtual-suma-miles-seguidores-logra-ventas-personas-reales_0_fpmpj_JHB.html,https://images.clarin.com/2021/07/08/KFXXVfETZ_720x0__1.jpg
39,s3Bj9yk4O,"Ho'oponopono. Diez frases que ayudan a ""solucionar"" problemas",https://www.clarin.com/astrologia/ho-oponopono-10-frases-que-ayudan-a-solucionar-problemas_0_s3Bj9yk4O.html,https://images.clarin.com/2019/04/30/_l8lt_yGI_720x0__1.jpg
40,TKpNOJFW2,Fin de semana largo. Doce salidas para disfrutar con los chicos,https://www.clarin.com/viajes/12-escapadas-disfrutar-chicos_0_TKpNOJFW2.html,https://images.clarin.com/2021/05/18/mS_TqkGVv_720x0__1.jpg
41,pcMo4BSFl,"Divertidos y virales. Querido diario: todos los secretos infantiles, revelados en Instagram",https://www.clarin.com/familias/querido-diario-secretos-infantiles-revelados-instagram_0_pcMo4BSFl.html,https://images.clarin.com/2021/07/08/_1iu1_Ded_720x0__1.jpg
42,wX1aR6LVJ,"Gourmet. Pizzas tradicionales, vegetarianas y veganas en Villa Crespo",https://www.clarin.com/gourmet/nuevas-pizzas-tradicionales-vegetarianas-veganas-villa-crespo_0_wX1aR6LVJ.html,https://images.clarin.com/2021/07/08/0Qim3ug_T_1256x620__3.jpg#1625765082374
43,CY_QtemGu,Clima energético. Luna nueva en Cáncer de julio 2021: entre la soledad y el fuego,https://www.clarin.com/astrologia/luna-nueva-cancer-julio-2021-soledad-fuego_0_CY_QtemGu.html,https://images.clarin.com/2021/07/08/qIwnkG8f9_720x0__1.jpg
44,9loa_zK_q,El Mundo de Mateo.  ¿Quién mató a Luciano Ávalos?,https://www.clarin.com/brandstudio/mundo-mateo-mato-luciano-avalos-_0_9loa_zK_q.html,https://images.clarin.com/2021/06/24/ZlXeeJ4qM_720x0__1.jpg
45,4Rg7Up-BH,The Night Shift. El drama médico que transcurre en el turno noche de un hospital,https://www.clarin.com/brandstudio/the-night-shift-drama-medico-transcurre-turno-noche-hospital_0_4Rg7Up-BH.html,https://images.clarin.com/2021/07/08/Dwp9KV29z_720x0__1.jpg
46,qhBuq0DYE,The Other Guy. La celebrada comedia australiana llega a Flow,https://www.clarin.com/brandstudio/the-guy-celebrada-comedia-australiana-llega-flow_0_qhBuq0DYE.html,https://images.clarin.com/2021/07/08/ROMHAQy9w_1256x620__2.jpg#1625750493502
47,5-zqA7EtG,Cine en casa. Judas y el mesías negro se suma al catálogo de Flow,https://www.clarin.com/brandstudio/judas-mesias-negro-suma-catalogo-flow_0_5-zqA7EtG.html,https://images.clarin.com/2021/07/08/dbEbkmg0Z_720x0__1.jpg
48,Ix2DJnY4l,El Desertor. Una miniserie alemana sobre el sentido de la lealtad,https://www.clarin.com/brandstudio/desertor-miniserie-alemana-sentido-lealtad_0_Ix2DJnY4l.html,https://images.clarin.com/2021/07/08/3o0icdt05_720x0__1.jpg
49,4jISRf2E3,LUCHA DE UN GRANJERO. No vendió su campo y ahora trabaja la tierra en medio de la ciudad,https://www.clarin.com/viste/nego-vender-campo-ahora-trabaja-tierra-medio-ciudad_0_4jISRf2E3.html,https://images.clarin.com/2021/07/08/yuOrnYLib_720x0__1.jpg
50,X6WGgEz2T,Calamity Jane. La vida de la mujer que cruzó el Lejano Oeste como pistolera y artista,https://www.clarin.com/internacional/calamity-jane-fascinante-vida-mujer-cruzo-lejano-oeste-pistolera-artista-variedades_0_X6WGgEz2T.html,https://images.clarin.com/2021/07/07/oknTHNYcz_1256x620__2.jpg#1625682299405
51,tkVwWT7ME,"Lleva 20 años. Pagó solo US$ 1.500 de la hipoteca, halló una trampa legal y no lo pueden desalojar",https://www.clarin.com/viste/hombre-vive-gratis-casa-hace-20-anos-nadie-puede-desalojar_0_tkVwWT7ME.html,https://images.clarin.com/2021/07/06/dlfW4TuZj_720x0__1.jpg
52,XyLgeKkXs,California. Ganó 55 millones de dólares en la lotería y se lo escondió a su familia por diez años,https://www.clarin.com/viste/gano-55-millones-dolares-loteria-escondio-familia-anos_0_XyLgeKkXs.html,https://images.clarin.com/2020/11/01/zZ7fB0pHu_720x0__1.jpg
53,4LZ6ZSMog,¿Mala praxis?. Murió una influencer mexicana durante un tratamiento estético,https://www.clarin.com/internacional/mexico/murio-influencer-tratamiento-estetico_0_4LZ6ZSMog.html,https://images.clarin.com/2021/07/08/zg8u-eCSB_720x0__1.jpg
54,5m-V2duV6,Madre coraje. El drama de Megan Fox: su hijo sufre bullying en la escuela por usar vestidos,https://www.clarin.com/internacional/drama-actriz-megan-fox-hijo-sufre-bullying-escuela-usar-vestidos_0_5m-V2duV6.html,https://images.clarin.com/1969/12/31/Bkgo-OSCQe_1256x620__1.jpg#1625771460847
55,jhD1GudPD,"Elecciones 2021. Hicieron una encuesta sobre aliados y ganaron Manes, Stolbizer y Espert",https://www.clarin.com/politica/hicieron-encuesta-aliados-ganaron-facundo-manes-margarita-stolbizer-jose-luis-espert_0_jhD1GudPD.html,https://images.clarin.com/2021/07/03/LcIq8ro82_720x0__1.jpg
56,M24zrG-2V,"Nueva proclama ultra K. Le piden al Presidente más intervención estatal y ""valentía"" para salir de la crisis",https://www.clarin.com/politica/nueva-proclama-ultra-k-piden-alberto-fernandez-intervencion-estatal-valentia-salir-crisis_0_M24zrG-2V.html,https://images.clarin.com/2021/07/09/xl6oN6_Q9_720x0__1.jpg
57,78acik6Zd,Messi vs. Neymar. La rivalidad de dos amigos que tienen clavada la misma espina,https://www.clarin.com/deportes/final-copa-america-messi-vs-neymar-rivalidad-amigos-clavada-misma-espina_0_78acik6Zd.html,https://images.clarin.com/2021/06/08/wcze6ElHG_720x0__1.jpg
58,VR9AhMnPO,"""Bailá ahora"". De dónde viene y cómo siguió la pelea Messi-Mina",https://www.clarin.com/deportes/futbol-internacional/-baila-ahora-viene-bronca-messi-yerry-mina-siguio-despues-partido-afuera-cancha_0_VR9AhMnPO.html,https://images.clarin.com/2021/07/07/0P4CRNNp1_720x0__1.jpg
59,Ejfvkputn,"Caracas bajo fuego. La banda de ""El Koki"", el azote que tiene de rehén a la capital en Venezuela",https://www.clarin.com/mundo/caracas-fuego-banda-koki-azote-rehen-capital-venezuela_0_Ejfvkputn.html,https://images.clarin.com/2021/07/09/hRVn3iQuK_1256x620__2.jpg#1625846721584
60,-7yENBfo8,"Ahorran hasta 60%. Precios Cuidados: cuáles son las 15 ""gangas"" de la nueva lista",https://www.clarin.com/servicios/precios-cuidados-15-gangas-nueva-lista_0_-7yENBfo8.html,https://images.clarin.com/2021/05/26/pl7KnWW8E_720x0__1.jpg
61,WwQqstRDe,Tensión diplomática. Bolivia acusa a Macri de colaborar con la destitución de Evo y analiza denunciarlo,https://www.clarin.com/politica/bolivia-evalua-denuncia-internacional-mauricio-macri-acusarlo-colaborar-destitucion-evo-morales_0_WwQqstRDe.html,https://images.clarin.com/2021/07/09/dRvSa1mg0_720x0__1.jpg
62,9rdMGTNec,"Tragedia en Llavallol. Se ahorcó frente a la casa de su novio: ""Mi vida está en ruinas por culpa del Gordo""",https://www.clarin.com/policiales/ahorco-frente-casa-novio-vida-ruinas-culpa-gordo-_0_9rdMGTNec.html,https://images.clarin.com/2021/07/08/03_WEqzRk_1256x620__2.jpg#1625778061836
63,FEdFxU27d,"Entrevista exclusiva. Florence Pugh, de youtuber a ser la próxima Black Widow",https://www.clarin.com/espectaculos/cine/entrevista-florence-pugh-youtuber-proxima-black-widow_0_FEdFxU27d.html,https://images.clarin.com/2021/07/08/3FYwE7vqT_720x0__1.jpg
64,CdNJup7xV,Costanera Sur. Así será el nuevo barrio que harán en la ex Ciudad Deportiva de Boca,https://www.clarin.com/ciudades/nuevo-barrio-haran-ex-ciudad-deportiva-boca-juniors_0_CdNJup7xV.html,https://images.clarin.com/2021/07/08/8e_-HdQ1d_720x0__1.jpg
65,YnKh4wsem,Claves para el éxito. Inteligencia emocional financiera: cómo tener una mejor relación con el dinero,https://www.clarin.com/servicios/inteligencia-emocional-financiera-optimizarla-tener-mejor-relacion-dinero_0_YnKh4wsem.html,https://images.clarin.com/2020/08/28/pPhNjParW_720x0__1.jpg
66,ZHDCh3tkR,"Características y precios. Audio HiFi: comparativa de Spotify, Apple, Amazon, YouTube y Deezer",https://www.clarin.com/tecnologia/audio-hifi-llega-plataformas-musica-comparativa-spotify-apple-amazon-youtube-deezer_0_ZHDCh3tkR.html,https://images.clarin.com/2019/11/13/h88HrFUW_720x0__1.jpg
67,pJNMnLEBw,Beneficio. Previaje 2020: hasta cuándo y en qué se puede usar el crédito pendiente,https://www.clarin.com/servicios/previaje-2020-puede-usar-credito-pendiente_0_pJNMnLEBw.html,https://images.clarin.com/2021/06/03/I0V3YsHRC_720x0__1.jpg
68,wflfINi9Y,Cacería en Haití. Quiénes son los detenidos por el asesinato del presidente Moise,https://www.clarin.com/mundo/caceria-haiti-detenidos-ahora-asesinato-presidente-jovenel-moise_0_wflfINi9Y.html,https://images.clarin.com/2021/07/09/kgZWl_2WT_1256x620__2.jpg#1625832605298
69,mgFpzM-pr,"Crimen en Beverly Hills. Eran jóvenes, tenían una vida ostentosa y mataron a sus padres por la herencia",https://www.clarin.com/internacional/jovenes-vida-ostentosa-mataron-padres-herencia-crimen-asombro-beverly-hills_0_mgFpzM-pr.html,https://images.clarin.com/2021/07/09/rCr1gii0w_720x0__1.jpg
70,7wzZb8Qnh,Para verse mejor. Belleza: el activo antiage que hace furor,https://www.clarin.com/viva/belleza-activo-antiage-hace-furor_0_7wzZb8Qnh.html,https://images.clarin.com/2021/07/05/dQjcyC0Pa_720x0__1.jpg
71,wEEOa41Xk,El otro Tinder. Juego de seducción: así se forman las parejas gamers,https://www.clarin.com/buena-vida/juego-seduccion-forman-parejas-gamers_0_wEEOa41Xk.html,https://images.clarin.com/2021/07/08/-TeqEpc-L_720x0__1.jpg
72,FEdFxU27d,"Entrevista exclusiva. Florence Pugh, de youtuber a ser la próxima Black Widow",https://www.clarin.com/espectaculos/cine/entrevista-florence-pugh-youtuber-proxima-black-widow_0_FEdFxU27d.html,https://images.clarin.com/2021/07/08/3FYwE7vqT_720x0__1.jpg
73,CdNJup7xV,Costanera Sur. Así será el nuevo barrio que harán en la ex Ciudad Deportiva de Boca,https://www.clarin.com/ciudades/nuevo-barrio-haran-ex-ciudad-deportiva-boca-juniors_0_CdNJup7xV.html,https://images.clarin.com/2021/07/08/8e_-HdQ1d_720x0__1.jpg
74,YnKh4wsem,Claves para el éxito. Inteligencia emocional financiera: cómo tener una mejor relación con el dinero,https://www.clarin.com/servicios/inteligencia-emocional-financiera-optimizarla-tener-mejor-relacion-dinero_0_YnKh4wsem.html,https://images.clarin.com/2020/08/28/pPhNjParW_720x0__1.jpg
75,ZHDCh3tkR,"Características y precios. Audio HiFi: comparativa de Spotify, Apple, Amazon, YouTube y Deezer",https://www.clarin.com/tecnologia/audio-hifi-llega-plataformas-musica-comparativa-spotify-apple-amazon-youtube-deezer_0_ZHDCh3tkR.html,https://images.clarin.com/2019/11/13/h88HrFUW_720x0__1.jpg
76,pJNMnLEBw,Beneficio. Previaje 2020: hasta cuándo y en qué se puede usar el crédito pendiente,https://www.clarin.com/servicios/previaje-2020-puede-usar-credito-pendiente_0_pJNMnLEBw.html,https://images.clarin.com/2021/06/03/I0V3YsHRC_720x0__1.jpg
77,wflfINi9Y,Cacería en Haití. Quiénes son los detenidos por el asesinato del presidente Moise,https://www.clarin.com/mundo/caceria-haiti-detenidos-ahora-asesinato-presidente-jovenel-moise_0_wflfINi9Y.html,https://images.clarin.com/2021/07/09/kgZWl_2WT_1256x620__2.jpg#1625832605298
78,mgFpzM-pr,"Crimen en Beverly Hills. Eran jóvenes, tenían una vida ostentosa y mataron a sus padres por la herencia",https://www.clarin.com/internacional/jovenes-vida-ostentosa-mataron-padres-herencia-crimen-asombro-beverly-hills_0_mgFpzM-pr.html,https://images.clarin.com/2021/07/09/rCr1gii0w_720x0__1.jpg
79,7wzZb8Qnh,Para verse mejor. Belleza: el activo antiage que hace furor,https://www.clarin.com/viva/belleza-activo-antiage-hace-furor_0_7wzZb8Qnh.html,https://images.clarin.com/2021/07/05/dQjcyC0Pa_720x0__1.jpg
80,wEEOa41Xk,El otro Tinder. Juego de seducción: así se forman las parejas gamers,https://www.clarin.com/buena-vida/juego-seduccion-forman-parejas-gamers_0_wEEOa41Xk.html,https://images.clarin.com/2021/07/08/-TeqEpc-L_720x0__1.jpg
