n,id,title,url,image
1,hN44oZZnw,A tres semanas de las PASO. El Gobierno habla de la pospandemia para dejar atrás el escándalo por la fiesta en Olivos,https://www.clarin.com/politica/alberto-fernandez-busca-dar-vuelta-pagina-escandalo-pidio-pensar-pospandemia_0_hN44oZZnw.html,https://images.clarin.com/2021/08/20/rm8ns4k_W_720x0__1.jpg
2,wlP8Jdz6y,La columna de Lanata. El Olivos-Gate: una ley para nosotros y otra para la gilada,https://www.clarin.com/opinion/olivos-gate-ley-gilada-_0_wlP8Jdz6y.html,https://images.clarin.com/2021/08/17/vwB4of7uh_720x0__1.jpg
3,xx1ADIJXR,Del editor. El reality de Olivos copó la campaña,https://www.clarin.com/opinion/reality-olivos-copo-campana_0_xx1ADIJXR.html,https://images.clarin.com/2021/08/18/4SabUhqav_720x0__1.jpg
4,B3RoFAKxo,Presentó un escrito.  Tamara Pettinato explicó en la Justicia su visita a Olivos y dijo que no cometió delito,https://www.clarin.com/politica/fiesta-olivos-tamara-pettinato-presento-justicia-pidio-sobreseida_0_B3RoFAKxo.html,https://images.clarin.com/2021/08/20/M2lNnMg1S_720x0__1.jpg
5,dPLJsZjAa,"Rumbo a las PASO. Nueva encuesta de Santa Fe, una provincia clave con tres internas muy calientes",https://www.clarin.com/politica/elecciones-2021-nueva-encuesta-santa-fe-provincia-clave-internas-calientes_0_dPLJsZjAa.html,https://images.clarin.com/2017/10/22/BkhBnm9ab_720x0.jpg
6,1KcWQpKeJ,Fue denunciada. La Coalición Cívica difundió una aclaración por el cumpleaños de Lilita Carrió,https://www.clarin.com/politica/coalicion-civica-adelanto-aclaracion-posible-denuncia-kirchnerismo-cumpleanos-carrio_0_1KcWQpKeJ.html,https://images.clarin.com/2020/12/28/d-pZrWFSJ_720x0__1.jpg
7,URA1O89tA,Coronavirus. Descubren una droga que reduce un 99% la carga viral y ya la testean en humanos,https://www.clarin.com/sociedad/masitinib-puede-bala-plata-tratamiento-covid_0_URA1O89tA.html,https://images.clarin.com/2021/04/12/mu8KdqkCd_1256x620__4.jpg#1629471082759
8,uRq5LYQGL,Iniciativa de Turismo. El Gobierno estudia pagar los pasajes de Aerolíneas a turistas extranjeros,https://www.clarin.com/economia/gobierno-descarga-pagar-pasajes-cabotaje-aerolineas-turistas-extranjeros_0_uRq5LYQGL.html,https://images.clarin.com/2021/03/15/0lwd7Akug_720x0__1.jpg
9,BDzKtjS40,Crisis en Afganistán. Qué pasó con el bebé entregado por encima de un muro a soldados de EE.UU.,https://www.clarin.com/mundo/crisis-afganistan-paso-bebe-entregado-encima-muro-soldados-estadounidenses_0_BDzKtjS40.html,https://images.clarin.com/2021/08/20/LqNgB5BoH_1256x620__2.jpg#1629505671152
10,2Dp6DNJjs,"Especial Clarín. 70 años después, los misterios que aún rodean al Renunciamiento de Evita",https://www.clarin.com/politica/70-anos-despues-misterios-rodean-renunciamiento-evita_0_2Dp6DNJjs.html,https://images.clarin.com/2021/08/17/48EgpVOpt_720x0__1.jpg
11,Sh4VSWbCq,Primera versión. Se conoció el motivo de la separación de la China Suárez y Benjamín Vicuña,https://www.clarin.com/fama/conocio-motivo-separacion-china-suarez-benjamin-vicuna-aseguran-tomo-decision_0_Sh4VSWbCq.html,https://images.clarin.com/2021/08/20/DjrjUCEmd_720x0__1.jpg
12,VHKYbq8Nd,"Ante Patronato. A horas de su debut en Boca, Battaglia pierde a una pieza de su primer once titular",https://www.clarin.com/deportes/horas-debut-dt-battaglia-pierde-campuzano-pieza-primer-once-titular-boca_0_VHKYbq8Nd.html,https://images.clarin.com/2021/08/17/1cmmWiHOn_720x0__1.jpg
13,_Izq-roVP,El 9 de septiembre. El Gobierno quiere que la Selección juegue con público 72 horas antes de las PASO,https://www.clarin.com/politica/gobierno-analiza-habilitar-publico-partido-seleccion-jugara-72-horas-paso_0__Izq-roVP.html,https://images.clarin.com/2021/05/30/tgCUKTaBH_720x0__1.jpg
14,Oq0Xgktp0,"Está en la secundaria. La ""Ofelia"" de los libertarios: quién es la candidata de 18 años de Milei en la Ciudad",https://www.clarin.com/politica/delfina-ezeiza-vos-encerraban-enfiestados-farra-_0_Oq0Xgktp0.html,https://images.clarin.com/2021/08/20/p0hPR3qmA_720x0__1.jpg
15,4OBoKZxiJ,Misterio en Córdoba. Lleva 16 años desaparecida: ahora hallaron documentos suyos en un campo de su ex,https://www.clarin.com/sociedad/cordoba-hace-16-anos-trago-tierra-ahora-hallaron-documentos-campo-ex_0_4OBoKZxiJ.html,https://images.clarin.com/2021/08/20/tNgWrLVZk_1256x620__2.jpg#1629481053370
16,EVbABE6xS,0 a 0 en Avellaneda. Independiente no pudo quebrar a Defensa y la punta quedó en juego,https://www.clarin.com/deportes/independiente-vs-defensa-justicia-liga-profesional-minuto-minuto-directo_0_EVbABE6xS.html,https://images.clarin.com/2021/08/20/lfuqZZr8p_720x0__1.jpg
17,JUWgC0oyq,Caos en Medio Oriente. La periodista que mostró el terror tras la toma del poder talibán dejó Afganistán,https://www.clarin.com/mundo/periodista-relato-terror-toma-poder-talibanes-abandono-afganistan_0_JUWgC0oyq.html,https://images.clarin.com/2021/08/20/760fKIFFa_720x0__1.jpg
18,cgjUtcCmk,Tendencia en redes. La esposa de Toni Kroos publicó una foto y armó un insólito revuelo con Mbappé,https://www.clarin.com/deportes/esposa-toni-kroos-subio-foto-instagram-armo-insolito-revuelo-mbappe_0_cgjUtcCmk.html,https://images.clarin.com/2021/08/20/nW5Hp1wVQ_720x0__1.jpg
19,T-psPXf82,Entrevista exclusiva. Úrsula Corberó: el fin de La casa de papel y la cuarentena con los Darín,https://www.clarin.com/viva/ursula-corbero-fin-casa-papel-cuarentena-darin_0_T-psPXf82.html,https://images.clarin.com/2021/08/17/m2Pbkt7Yu_720x0__1.jpg
20,1Myj6BlUZ,Como en la Copa América. Di María volvió a jugar en PSG y metió un golazo que fue una copia de su grito contra Brasil ,https://www.clarin.com/deportes/di-maria-volvio-jugar-psg-sello-triunfo-golazo-copia-grito-final-copa-america-brasil_0_1Myj6BlUZ.html,https://images.clarin.com/2021/08/20/AOVtJ3BoB_720x0__1.jpg
21,VV55WaOrM,Finanzas personales. En qué invertir hasta las elecciones: seis opciones para proteger los ahorros,https://www.clarin.com/servicios/invertir-elecciones-6-opciones-proteger-ahorros_0_VV55WaOrM.html,https://images.clarin.com/2021/08/19/FB1ICEn6i_720x0__1.jpg
22,hCcOcvVLr,Invasión en Nordelta. Carpinchos: cómo son los refugios que arman para que vivan en el country,https://www.clarin.com/zonales/carpinchos-nordelta-refugios-empezaron-armar-vivan-country_0_hCcOcvVLr.html,https://images.clarin.com/2021/08/20/nClDTXsuY_1256x620__2.jpg#1629499563239
23,gutIGLJW4,Tenía 48 años. Murió un reconocido surfista marplatense mientras montaba una ola en México,https://www.clarin.com/deportes/murio-reconocido-surfista-marplatense-montaba-ola-mexico_0_gutIGLJW4.html,https://images.clarin.com/2021/08/20/EYMPQfryO_720x0__1.jpg
24,Hx_1tt_4A,"En la estación de Liniers. Video: caminaba cerca de las vías, lo golpeó el tren y se salvó de milagro",https://www.clarin.com/sociedad/video-hombre-golpeado-tren-salvo-milagro-estacion-liniers_0_Hx_1tt_4A.html,https://images.clarin.com/2021/08/20/W8mZ7PAQR_720x0__1.jpg
25,SdudStapT,"Habló con Clarín. Jason Momoa: ""La Patagonia es uno de mis lugares preferidos de la Tierra""",https://www.clarin.com/espectaculos/cine/exclusivo-jason-momoa-patagonia-lugares-preferidos-tierra-_0_SdudStapT.html,https://images.clarin.com/2021/08/19/jnopnRFEX_720x0__1.jpg
26,,Historias visuales. El Día en Fotos con las 100 mejores imágenes de Argentina y el Mundo,,
27,JvHK3yFyI,"Las fotos de Olivos. El dolor de la familia de Solange, la chica que murió sin despedirse de su padre",https://www.clarin.com/sociedad/ano-solange-musse-haciendo-fiestas-cumpleanos-envenena-_0_JvHK3yFyI.html,https://images.clarin.com/2021/08/17/k2vV4afSL_720x0__1.jpg
28,hN44oZZnw,A tres semanas de las PASO. El Gobierno habla de la pospandemia para dejar atrás el escándalo por la fiesta en Olivos,https://www.clarin.com/politica/alberto-fernandez-busca-dar-vuelta-pagina-escandalo-pidio-pensar-pospandemia_0_hN44oZZnw.html,https://images.clarin.com/2021/08/20/rm8ns4k_W_720x0__1.jpg
29,wlP8Jdz6y,La columna de Lanata. El Olivos-Gate: una ley para nosotros y otra para la gilada,https://www.clarin.com/opinion/olivos-gate-ley-gilada-_0_wlP8Jdz6y.html,https://images.clarin.com/2021/08/17/vwB4of7uh_720x0__1.jpg
30,xx1ADIJXR,Del editor. El reality de Olivos copó la campaña,https://www.clarin.com/opinion/reality-olivos-copo-campana_0_xx1ADIJXR.html,https://images.clarin.com/2021/08/18/4SabUhqav_720x0__1.jpg
31,B3RoFAKxo,Presentó un escrito.  Tamara Pettinato explicó en la Justicia su visita a Olivos y dijo que no cometió delito,https://www.clarin.com/politica/fiesta-olivos-tamara-pettinato-presento-justicia-pidio-sobreseida_0_B3RoFAKxo.html,https://images.clarin.com/2021/08/20/M2lNnMg1S_720x0__1.jpg
32,dPLJsZjAa,"Rumbo a las PASO. Nueva encuesta de Santa Fe, una provincia clave con tres internas muy calientes",https://www.clarin.com/politica/elecciones-2021-nueva-encuesta-santa-fe-provincia-clave-internas-calientes_0_dPLJsZjAa.html,https://images.clarin.com/2017/10/22/BkhBnm9ab_720x0.jpg
33,1KcWQpKeJ,Fue denunciada. La Coalición Cívica difundió una aclaración por el cumpleaños de Lilita Carrió,https://www.clarin.com/politica/coalicion-civica-adelanto-aclaracion-posible-denuncia-kirchnerismo-cumpleanos-carrio_0_1KcWQpKeJ.html,https://images.clarin.com/2020/12/28/d-pZrWFSJ_720x0__1.jpg
34,fnfIz7KaK,"Confirmación. La ANSeS oficializó el aumento de 12,39% para jubilaciones: a cuánto se va la mínima y la AUH",https://www.clarin.com/economia/anses-oficializo-aumento-12-39-jubilaciones-va-minima-auh_0_fnfIz7KaK.html,https://images.clarin.com/2021/04/21/SbGQrvjxf_720x0__1.jpg
35,Vn5Z7GJVD,Alcances de la nueva ley. Alquileres: crece la oferta de seguros de caución como garantías para los contratos,https://www.clarin.com/economia/alquileres-crece-oferta-seguros-caucion-garantias-contratos_0_Vn5Z7GJVD.html,https://images.clarin.com/2021/07/26/b4tpT1ZOc_720x0__1.jpg
36,82ZR5IqBw,Ránking de estudiantes. Cuáles son las empresas preferidas por los jóvenes para trabajar,https://www.clarin.com/economia/google-mercado-libre-pedidosya-empresas-preferidas-jovenes-trabajar_0_82ZR5IqBw.html,https://images.clarin.com/2021/06/26/puQOKmFfJ_720x0__1.jpg
37,oLh2SozeH,Mercado cambiario. El dólar blue se reacomodó a $ 182 y está trece pesos más caro que el ahorro,https://www.clarin.com/economia/dolar-blue-reacomoda-182-trece-caro-dolar-ahorro_0_oLh2SozeH.html,https://images.clarin.com/2019/01/10/VfI-Gd7z3_720x0__1.jpg
38,eENYfFmnn,"""Hay voluntad"". Bolsonaro dijo que Brasil negocia importar gas de Vaca Muerta",https://www.clarin.com/economia/jair-bolsonaro-confirmo-negociaciones-brasil-argentina-importar-gas-vaca-muerta_0_eENYfFmnn.html,https://images.clarin.com/2021/08/20/NO7MBhlI7_720x0__1.jpg
39,BmtuiPKjS,Boletín Oficial. Repro 2 para salarios: extienden el programa pero con cambios,https://www.clarin.com/economia/repro-2-salarios-agosto-extienden-programa-cambios_0_BmtuiPKjS.html,https://images.clarin.com/2020/08/06/i93R7cw0S_720x0__1.jpg
40,HoewvjoSw,"Turismo. Llega Travel Sale 2021, con ofertas y beneficios para viajar",https://www.clarin.com/viajes/llega-travel-sale-2021-ofertas-beneficios-viajar_0_HoewvjoSw.html,https://images.clarin.com/2020/11/24/8rfjRuDIU_720x0__1.jpg
41,-YYmOA2au,Pasión de multitudes. Día Mundial de la Papa Frita: la receta y los tips para que salgan perfectas,https://www.clarin.com/gourmet/dia-mundial-papa-frita-receta-tips-salgan-perfectas_0_-YYmOA2au.html,https://images.clarin.com/2018/06/14/BJ6YbPeZQ_720x0__1.jpg
42,aKJpWsesw,Redes sociales. La verdadera razón por la cual OnlyFans decidió prohibir la pornografía,https://www.clarin.com/tecnologia/verdadera-razon-onlyfans-decidio-prohibir-pornografia_0_aKJpWsesw.html,https://images.clarin.com/2021/08/20/fAMMousNS_720x0__1.jpg
43,DT9qNaY8i,"Nutrición. Menos colesterol, triglicéridos y peso: el mijo, un cereal ""amigo"" del corazón",https://www.clarin.com/buena-vida/colesterol-trigliceridos-peso-mijo-cereal-amigo-corazon_0_DT9qNaY8i.html,https://images.clarin.com/2021/08/18/cFr5iP2kw_720x0__1.jpg
44,DQoXH8T_G,Sabor y turismo. Cinco polos gastronómicos para una escapada al campo,https://www.clarin.com/viajes/5-polos-gastronomicos-escapada-campo_0_DQoXH8T_G.html,https://images.clarin.com/2016/09/29/SymThR9hQe_720x0.jpg
45,o7P_JnsV-,Carta natal. Almas colectivas: ¿a qué generación astrológica pertenecés?,https://www.clarin.com/astrologia/almas-colectivas-generacion-astrologica-perteneces-_0_o7P_JnsV-.html,https://images.clarin.com/2021/08/19/F2aIYqabC_720x0__1.jpg
46,Pu63_Jsd5,Mascotas. Cuáles son las 10 razas de gatos más cariñosas y compañeras,https://www.clarin.com/internacional/10-razas-gatos-carinosas-companeras_0_Pu63_Jsd5.html,https://images.clarin.com/2016/05/19/ryxgJI-yEx_720x0.jpg
47,q-GHsHsra,Viral. Los memes de los carpinchos inundaron los redes tras la polémica en Nordelta,https://www.clarin.com/viste/memes-carpinchos-inundaron-redes-polemica-nordelta_0_q-GHsHsra.html,https://images.clarin.com/2021/08/20/hwCQ3Qqis_720x0__1.jpg
48,0aGNlXkJX,En Estados Unidos. El misterio de una familia: salieron a caminar y los hallaron muertos tras dos días,https://www.clarin.com/viste/misterioso-caso-familia-salieron-caminar-aparecieron-muertos-dias-despues_0_0aGNlXkJX.html,https://images.clarin.com/2021/08/20/qJ3pN_asU_720x0__1.jpg
49,V13ALnv8W,"Gales. El ""hombre silencioso"" que hace 7 años se para frente al tránsito y no deja que avance",https://www.clarin.com/viste/misterioso-hombre-silencioso-hace-7-anos-frente-transito-deja-autos-avancen_0_V13ALnv8W.html,https://images.clarin.com/2021/08/20/ePig57VJe_720x0__1.jpg
50,3QAeUCeVF,"En Italia. El oscuro pasado de Poveglia, la isla donde sólo vive la muerte",https://www.clarin.com/viste/oscuro-pasado-poveglia-isla-italiana-solo-vive-muerte_0_3QAeUCeVF.html,https://images.clarin.com/2020/10/29/64SOUq_Bl_720x0__1.jpg
51,k4yfLfPwu,"Anécdota viral. Se metió a una aplicación de citas y halló al ""match más compatible"": era su hermano",https://www.clarin.com/viste/metio-aplicacion-citas-encontro-match-compatible-hermano_0_k4yfLfPwu.html,https://images.clarin.com/2021/08/19/ixsd-J1uT_720x0__1.jpg
52,Dk8sBTBr6,Para los turistas. San Juan: una promoción para ahorrar en alojamiento y excursiones,https://www.clarin.com/brandstudio/san-juan-promocion-ahorrar-alojamiento-excursiones_0_Dk8sBTBr6.html,https://images.clarin.com/2021/08/19/l6nHLX0-J_720x0__1.jpg
53,yeaKF2IuL,"Consejos de profesionales. Vacunar contra la rabia, la única manera de prevenir",https://www.clarin.com/brandstudio/vacunar-rabia-unica-manera-prevenir_0_yeaKF2IuL.html,https://images.clarin.com/2019/05/08/7lD64CXgk_720x0__1.jpg
54,ZM1ARSoUO,Novedades. Construcción sustentable: ideas y soluciones para las edificaciones del futuro,https://www.clarin.com/brandstudio/construccion-sustentable-ideas-soluciones-edificaciones-futuro_0_ZM1ARSoUO.html,https://images.clarin.com/2021/08/18/SIJ8q_-v7_720x0__1.jpg
55,2YzT9AUbP,Solidaridad. La comunidad multiétnica del Tíbet transmite su tradición de unidad,https://www.clarin.com/brandstudio/comunidad-multietnica-tibet-transmite-tradicion-unidad_0_2YzT9AUbP.html,https://images.clarin.com/2021/08/18/_VKuo04D5_720x0__1.jpg
56,Z0MfxqIg1,Fallo. Las agencias de inteligencia no fueron capaces de predecir el colapso afgano,https://www.clarin.com/new-york-times-international-weekly/agencias-inteligencia-capaces-predecir-colapso-afgano_0_Z0MfxqIg1.html,https://images.clarin.com/2021/08/19/JWN9nCHHh_1256x620__2.jpg#1629409979876
57,gsLNspvak,"Las ""vírgenes consagradas"". Mujeres que se declaran hombres para tener la autonomía de ellos",https://www.clarin.com/new-york-times-international-weekly/virgenes-consagradas-albania-hoy-atreven-vivir-mujeres_0_gsLNspvak.html,https://images.clarin.com/2021/08/18/jcnXcOb_1_1256x620__2.jpg#1629378292785
58,oBrhkMWf_,Ensayo. Una guía para encontrar la fe perdida,https://www.clarin.com/new-york-times-international-weekly/guia-encontrar-fe-perdida_0_oBrhkMWf_.html,https://images.clarin.com/2021/08/19/YUOBdw5Pv_1256x620__2.jpg#1629401452077
59,BaA2u0I8r,Metabolismo. Muchos de lo que creíamos saber está equivocado.,https://www.clarin.com/new-york-times-international-weekly/creemos-saber-metabolismo-puede-equivocado_0_BaA2u0I8r.html,https://images.clarin.com/2021/08/16/DssJXHTb__1256x620__2.jpg#1629126355207
60,72JKF4upJ,"Buscan reactivarla. Cómo será el ""Caminito"" que harán en una tradicional peatonal del GBA",https://www.clarin.com/zonales/buscan-reactivar-tradicional-peatonal-castelar-paseo-gastronomico-cultural_0_72JKF4upJ.html,https://images.clarin.com/2021/07/05/o2T-dKkGh_720x0__1.jpg
61,ygM1L2EhO,"El Joker argentino. Irá a votar disfrazado y propone que todos lo imiten ""en forma de protesta""",https://www.clarin.com/zonales/votara-vestido-joker-propone-vayan-cuarto-oscuro-disfrazados_0_ygM1L2EhO.html,https://images.clarin.com/2021/08/20/JPLxCyTOZ_1256x620__2.jpg#1629490063937
62,e1tVH2r4n,Belgrano Sur. Retomaron la obra para que el tren que cruza La Matanza llegue hasta Constitución,https://www.clarin.com/zonales/retomaron-obra-tren-cruza-matanza-llegue-constitucion_0_e1tVH2r4n.html,https://images.clarin.com/2021/03/29/N3EwNgSAe_720x0__1.jpg
63,dDLsVQ8VX,"En La Matanza. ""Basta de narcos"": vecinos pusieron pasacalles para denunciar la venta de droga",https://www.clarin.com/zonales/-basta-narcos-pasacalles-pusieron-barrio-matanza-denunciar-venta-droga_0_dDLsVQ8VX.html,https://images.clarin.com/2021/08/17/ozyl8iA8n_720x0__1.jpg
64,4Cr6GAGxk,A qué famoso involucran. Escandalosas versiones de infidelidades mutuas entre Vicuña y la China Suárez,https://www.clarin.com/fama/escandalosas-versiones-infidelidades-benjamin-vicuna-china-suarez-famoso-involucran_0_4Cr6GAGxk.html,https://images.clarin.com/2021/08/20/fdWGZ_jdc_720x0__1.jpg
65,83oFkZ_5H,Separación confirmada. La China Suárez citó en un posteo a su supuesto amante famoso: la reacción de Vicuña al verlo,https://www.clarin.com/fama/china-suarez-cito-posteo-wos-supuesto-amante-reaccion-benjamin-vicuna-verlo_0_83oFkZ_5H.html,https://images.clarin.com/2021/08/20/nGjTHsOP3_720x0__1.jpg
66,Ur_g7bjIj,"En ""Intrusos"". Terribles declaraciones de la ex mucama de Vicky Xipolitakis",https://www.clarin.com/fama/terribles-declaraciones-ex-mucama-vicky-xipolitakis_0_Ur_g7bjIj.html,https://images.clarin.com/2021/08/20/MRUU3TRM2_720x0__1.jpg
67,QLbSGRT90,"Careo al aire. Tenso cruce entre Martín Bossi y Evelyn Von Brocke: ""Decías que era un depredador""",https://www.clarin.com/fama/tenso-cruce-aire-martin-bossi-evelyn-von-brocke-decias-depredador-_0_QLbSGRT90.html,https://images.clarin.com/2021/08/20/rrfzlE37C_720x0__1.jpg
68,7LdtkqEz8,"El rastreo del virus. Qué es el ""polvo de Covid"": el vínculo con los falsos positivos y las reinfecciones",https://www.clarin.com/sociedad/polvo-covid-vinculo-falsos-positivos-reinfecciones_0_7LdtkqEz8.html,https://images.clarin.com/2021/01/12/vSERuNiwe_720x0__1.jpg
69,7T_fUo26q,Convivir con un violador. Demi Moore y el relato de una trampa atroz tendida por su propia madre,https://www.clarin.com/historias/convivir-violador-demi-moore-relato-trampa-atroz-tendida-propia-madre_0_7T_fUo26q.html,https://images.clarin.com/2021/08/13/uw-jknhWe_720x0__1.jpg
70,903wcDDXM,Rumbo a las PASO. Dos encuestas en Provincia dan empate entre Juntos por el Cambio y el FdT,https://www.clarin.com/politica/sorpresa-nuevas-encuestas-provincia-dan-empate-frente-juntos-cambio_0_903wcDDXM.html,https://images.clarin.com/2021/08/07/sbxCKJjia_720x0__1.jpg
71,UMnYsqMAs,Mundo fintech. Cómo enviar y recibir dinero del exterior en forma instantánea,https://www.clarin.com/economia/enviar-recibir-dinero-exterior-forma-instantanea_0_UMnYsqMAs.html,https://images.clarin.com/2016/09/19/H1f6ImS07l_720x0.jpg
72,lx_fQKmR8,"Variante Delta. Por qué reina la ilusión de que Manaos sea un ""muro"" ",https://www.clarin.com/sociedad/variante-delta-reina-ilusion-manaos-muro-argentina-pueda-zafar_0_lx_fQKmR8.html,https://images.clarin.com/2021/06/01/6q-syKU9R_720x0__1.jpg
73,OACawFVVN,Qué piden. El unicornio mexicano que busca 120 talentos en Argentina,https://www.clarin.com/servicios/unicornio-mexicano-busca-120-talentos-argentina-piden-pagan_0_OACawFVVN.html,https://images.clarin.com/2021/08/13/t4zbDXADo_720x0__1.jpg
74,j5owUSw_W,En alza. Criptomonedas: ¿cuánto plata se puede ganar con una PC desde el living de casa?,https://www.clarin.com/especiales/criptomonedas-plata-puede-ganar-pc-living-casa-_0_j5owUSw_W.html,https://images.clarin.com/2021/08/16/SZDgaDM6F_720x0__1.jpg
75,cLMOjbE0e,Razones de un boom. Ser vegano: el negocio millonario detrás de un fenómeno imparable,https://www.clarin.com/sociedad/vegano-negocio-millonario-detras-fenomeno-imparable_0_cLMOjbE0e.html,https://images.clarin.com/2021/08/10/qvvDoNwrX_720x0__1.jpg
76,BnHii2BYB,"Historia conmovedora. Olga, la pianista que perdió la memoria pero nunca olvidó una nota",https://www.clarin.com/sociedad/conmovedora-historia-olga-pianista-perdio-memoria-sigue-tocando-sinfonias_0_BnHii2BYB.html,https://images.clarin.com/2021/07/29/msCNVBg57_720x0__1.jpg
77,WV8NLblKxr,"Una ""caja"" política. Peajes, narcotráfico y secretos de estado: por qué la Hidrovía desvela al Gobierno",https://www.clarin.com/politica/peajes-narcotrafico-secretos-hidrovia-desvela-gobierno_0_WV8NLblKxr.html,https://images.clarin.com/2021/08/04/BZBPAPEqR_720x0__1.jpg
78,21eik2LXy,A la espera de Messi. El PSG mantuvo su andar perfecto y manda en la Liga de Francia,https://www.clarin.com/deportes/brest-vs-psg-ligue1-francia-minuto-minuto-directo_0_21eik2LXy.html,https://images.clarin.com/2021/08/20/lEWvwjAot_1256x620__2.jpg#1629494440490
79,yit4NrQ2z,"Guiño para los hinchas de Boca. Ginóbili y sus cuatro anillos brillan en el trailer de Space Jam: ""¿Y si te llama Román?""",https://www.clarin.com/deportes/manu-ginobili-anillos-campeon-nba-roban-protagonismo-publicidad-nueva-space-jam_0_yit4NrQ2z.html,https://images.clarin.com/2021/08/20/uyLY6dxPT_720x0__1.jpg
80,bNMmqviU-,Cambio de vida. La modelo de alta costura que vendió un terreno para competir en el Superbike ,https://www.clarin.com/deportes/virginia-guidetti-modelo-alta-costura-vendio-terreno-competir-superbike-argentino_0_bNMmqviU-.html,https://images.clarin.com/2021/08/20/NTfmQlz0A_720x0__1.jpg
81,BIOvVKS0h,3-0 en Mar del Plata. El Aldosivi de Gago sigue sorprendiendo: goleó a Colón y se prende en el torneo,https://www.clarin.com/deportes/aldosivi-vs-colon-liga-profesional-futbol-previa-alineaciones-directo_0_BIOvVKS0h.html,https://images.clarin.com/2021/08/20/9AMCuOvuG_720x0__1.jpg
82,Tf8jyKQdM,"1-1 en el Sur. Banfield perdía desde los 14 segundos, pero apareció Jesús y lo salvó de la derrota",https://www.clarin.com/deportes/banfield-vs-estudiantes-liga-profesional-minuto-minuto-directo_0_Tf8jyKQdM.html,https://images.clarin.com/2021/08/20/yVIYyhx_B_720x0__1.jpg
83,6zT_DWkTz,"Toyota hizo la pole. Le Mans, la prueba mítica del automovilismo que Pechito López quiere ganar",https://www.clarin.com/deportes/mans-prueba-mitica-automovilismo-pechito-lopez-quiere-ganar-primera-vez_0_6zT_DWkTz.html,https://images.clarin.com/2021/08/18/Y2WUnumdU_1256x620__2.jpg#1629465109277
