n,id,title,url,image
1,Jgw5vh1hg,Tensión entre Nación y Ciudad. El Ministerio Público Fiscal porteño dictaminó a favor de mantener las clases presenciales,https://www.clarin.com/politica/fiscal-general-ciudad-dio-lugar-amparo-cierre-escuelas_0_Jgw5vh1hg.html,https://images.clarin.com/2021/04/17/diTW2ItUL_720x0__1.jpg
2,e3ffkU1U5,"La intimidad del poder. El Presidente y Larreta, a solas: reproches, mentiras y una bomba a punto de estallar",https://www.clarin.com/politica/alberto-fernandez-horacio-rodriguez-larreta-solas-reproches-mentiras-bomba-punto-estallar_0_e3ffkU1U5.html,https://images.clarin.com/2021/04/16/_BMHeErPf_720x0__1.jpg
3,uyBMimaDw,"En redes sociales. Fernández explicó su frase criticada sobre el sistema de salud y un ""relajamiento"" ",https://www.clarin.com/politica/alberto-fernandez-hablo-criticada-frase-relajamiento-sistema-salud-jamas-dije-semejante-cosa-_0_uyBMimaDw.html,https://images.clarin.com/2021/03/27/m4iLX78BT_720x0__1.jpg
4,46_0d341f,"Humor político. La Patria es el otro + 4,8% mensual",https://www.clarin.com/politica/patria--4-8-mensual_0_46_0d341f.html,https://images.clarin.com/2021/04/16/SRQSQdBUA_720x0__1.jpg
5,5J8vLLVra,Pelea del momento. Una encuesta midió a Rodríguez Larreta contra Axel Kicillof en todo el país,https://www.clarin.com/politica/pelea-momento-encuesta-midio-horacio-rodriguez-larreta-axel-kicillof-pais_0_5J8vLLVra.html,https://images.clarin.com/2020/10/11/Lrz-a7CNQ_720x0__1.jpg
6,PfWS-VqLV,A 16.000 km de Londres. La isla donde el Príncipe Felipe es un dios,https://www.clarin.com/opinion/elegidos-dios_0_PfWS-VqLV.html,https://images.clarin.com/2021/04/13/mLSU8lFWO_720x0__1.jpg
7,cZIJ_iEFd,Coronavirus. Para cuándo se espera el pico de casos de la segunda ola en el AMBA,https://www.clarin.com/sociedad/coronavirus-espera-pico-casos-segunda-ola-amba_0_cZIJ_iEFd.html,https://images.clarin.com/2021/04/13/jNZ-QtmnR_1256x620__2.jpg#1618586255093
8,XmakL5CB6,"""En 10 o 15 días"". Kreplak: ""La perspectiva es que estemos en 50 mil casos por día""",https://www.clarin.com/sociedad/nicolas-kreplak-perspectiva-10-15-dias-50-mil-casos-dia-_0_XmakL5CB6.html,https://images.clarin.com/2020/09/06/UGM_OktDT_720x0__1.jpg
9,2QL9QNObv,"Medio siglo de cárcel. La joven condenada por el ataque a una comisaría: ""Me mataron en vida""",https://www.clarin.com/policiales/-mataron-vida-cuenta-prision-joven-condenada-ataque-comisaria-liberar-pareja_0_2QL9QNObv.html,https://images.clarin.com/2018/04/28/HJdnOhv6M_1256x620__2.jpg#1618673136562
10,71BdwgA3q,Turismo. Escapadas: un viaje en el tiempo por castillos y mansiones bonaerenses,https://www.clarin.com/viajes/escapadas-viaje-tiempo-castillos-mansiones-bonaerenses_0_71BdwgA3q.html,https://images.clarin.com/2021/04/16/QmwIR9uWe_720x0__1.jpg
11,oiCqnthUZ,Coronavirus. Quiénes no están protegidos por las vacunas,https://www.clarin.com/new-york-times-international-weekly/vacunas-coronavirus-protegen-pacientes-sistemas-inmunologicos-comprometidos_0_oiCqnthUZ.html,https://images.clarin.com/2021/04/16/ko9P4wEmm_720x0__1.jpg
12,Jgw5vh1hg,Tensión entre Nación y Ciudad. El Ministerio Público Fiscal porteño dictaminó a favor de mantener las clases presenciales,https://www.clarin.com/politica/fiscal-general-ciudad-dio-lugar-amparo-cierre-escuelas_0_Jgw5vh1hg.html,https://images.clarin.com/2021/04/17/diTW2ItUL_720x0__1.jpg
13,e3ffkU1U5,"La intimidad del poder. El Presidente y Larreta, a solas: reproches, mentiras y una bomba a punto de estallar",https://www.clarin.com/politica/alberto-fernandez-horacio-rodriguez-larreta-solas-reproches-mentiras-bomba-punto-estallar_0_e3ffkU1U5.html,https://images.clarin.com/2021/04/16/_BMHeErPf_720x0__1.jpg
14,uyBMimaDw,"En redes sociales. Fernández explicó su frase criticada sobre el sistema de salud y un ""relajamiento"" ",https://www.clarin.com/politica/alberto-fernandez-hablo-criticada-frase-relajamiento-sistema-salud-jamas-dije-semejante-cosa-_0_uyBMimaDw.html,https://images.clarin.com/2021/03/27/m4iLX78BT_720x0__1.jpg
15,46_0d341f,"Humor político. La Patria es el otro + 4,8% mensual",https://www.clarin.com/politica/patria--4-8-mensual_0_46_0d341f.html,https://images.clarin.com/2021/04/16/SRQSQdBUA_720x0__1.jpg
16,5J8vLLVra,Pelea del momento. Una encuesta midió a Rodríguez Larreta contra Axel Kicillof en todo el país,https://www.clarin.com/politica/pelea-momento-encuesta-midio-horacio-rodriguez-larreta-axel-kicillof-pais_0_5J8vLLVra.html,https://images.clarin.com/2020/10/11/Lrz-a7CNQ_720x0__1.jpg
17,PfWS-VqLV,A 16.000 km de Londres. La isla donde el Príncipe Felipe es un dios,https://www.clarin.com/opinion/elegidos-dios_0_PfWS-VqLV.html,https://images.clarin.com/2021/04/13/mLSU8lFWO_720x0__1.jpg
18,cZIJ_iEFd,Coronavirus. Para cuándo se espera el pico de casos de la segunda ola en el AMBA,https://www.clarin.com/sociedad/coronavirus-espera-pico-casos-segunda-ola-amba_0_cZIJ_iEFd.html,https://images.clarin.com/2021/04/13/jNZ-QtmnR_1256x620__2.jpg#1618586255093
19,XmakL5CB6,"""En 10 o 15 días"". Kreplak: ""La perspectiva es que estemos en 50 mil casos por día""",https://www.clarin.com/sociedad/nicolas-kreplak-perspectiva-10-15-dias-50-mil-casos-dia-_0_XmakL5CB6.html,https://images.clarin.com/2020/09/06/UGM_OktDT_720x0__1.jpg
20,P3jt63L1Q,Copa de la Liga Profesional. Estudiantes y Gimnasia chocan en el clásico de La Plata,https://www.clarin.com/deportes/estudiantes-vs-gimnasia-copa-liga-profesional-previa-alineaciones-directo_0_P3jt63L1Q.html,https://images.clarin.com/2019/11/02/w-TY9dbO_720x0__1.jpg
21,4mfUTwauK,Testeo rápido. Boca y un nuevo problema: Cardona y Marcos Rojo contrajeron Covid,https://www.clarin.com/deportes/boca-nuevo-problema-edwin-cardona-marcos-rojo-contrajeron-covid_0_4mfUTwauK.html,https://images.clarin.com/2021/04/06/PjFMy8Qf7_720x0__1.jpg
22,YI0-CgGff,"Liga de España. Con un doblete de Angel Correa, el Atlético goleó y se afianza en la cima",https://www.clarin.com/deportes/doblete-angel-correa-atletico-goleo-afianza-cima-liga-espana_0_YI0-CgGff.html,https://images.clarin.com/2021/04/18/NeIUdAMnn_720x0__1.jpg
23,4liuAomjR,"Sueña con el título. En un final para el infarto, Icardi le dio al PSG un triunfo clave",https://www.clarin.com/deportes/final-infarto-icardi-dio-psg-triunfo-clave-sonar-titulo_0_4liuAomjR.html,https://images.clarin.com/2021/04/18/fef_aljS6_1256x620__2.jpg#1618752317334
24,9QWWBYv5p,"Liga italiana. Sin Cristiano, Juventus se estrelló ante un Atalanta que hizo historia",https://www.clarin.com/deportes/cristiano-ronaldo-juventus-estrello-atalanta-hizo-historia_0_9QWWBYv5p.html,https://images.clarin.com/2021/04/18/l2v-aV1gO_720x0__1.jpg
25,oeW23sRTZ,Mirá el video. Un golpazo que llenó la pista de fragmentos y agresión mutua afuera en la F1,https://www.clarin.com/deportes/golpazo-lleno-pista-proyectiles-agresion-mutua-afuera-choque-russell-bottas_0_oeW23sRTZ.html,https://images.clarin.com/2021/04/18/f_YBake0m_1256x620__2.jpg#1618755518911
26,ijiIH5qoj,Avanza la NextGen. Tsitsipas derrotó a Rublev en Montecarlo y ganó su primer Masters 1000,https://www.clarin.com/deportes/avanza-nextgen-tsitsipas-derroto-rublev-montecarlo-gano-primer-masters-1000_0_ijiIH5qoj.html,https://images.clarin.com/2021/04/18/rcReObL-P_720x0__1.jpg
27,8kyOTA8Kt,Buenas noticias. El regreso de Federer al circuito ya tiene fecha confirmada,https://www.clarin.com/deportes/regreso-federer-circuito-fecha-confirmada_0_8kyOTA8Kt.html,https://images.clarin.com/2019/06/06/tgevJYlLr_1256x620__2.jpg#1618765705674
28,JEW7fVNff,"Cara a cara con Guzmán. ""Cuando el mercado falla, el Estado tiene que intervenir para bajar la inflación""",https://www.clarin.com/economia/martin-guzman-mercado-falla-intervenir-bajar-inflacion-_0_JEW7fVNff.html,https://images.clarin.com/2021/04/17/Hfle6g-OL_720x0__1.jpg
29,_72Mahl6P,En Windsor. La familia real despidió a Felipe en una ceremonia íntima que abre otra etapa,https://www.clarin.com/mundo/familia-real-britanica-despidio-principe-felipe-ceremonia-intima-abre-etapa_0__72Mahl6P.html,https://images.clarin.com/2021/04/17/dUvHejpZ3_720x0__1.jpg
30,KzKrfhGrU,"Llegan mañana. Tras las demoras, cargan en Moscú un nuevo lote de vacunas Sputnik V ",https://www.clarin.com/sociedad/coronavirus-demoras-cargan-moscu-nuevo-lote-vacunas-sputnik-v-llegaran-lunes_0_KzKrfhGrU.html,https://images.clarin.com/2021/03/20/tPy2iWL1N_720x0__1.jpg
31,wAg-Mmf0C,Desde hoy. El peaje de las autopistas de AUSA aumenta un 25%: cuánto se pagará,https://www.clarin.com/ciudades/peaje-autopistas-ausa-aumenta-25-domingo-pagar_0_wAg-Mmf0C.html,https://images.clarin.com/2020/11/04/a1yEyIH3V_720x0__1.jpg
32,6uFfzAFVb,"Cinco años después. La ex Miss Argentina que atropelló y mató, a un paso de volver a la cárcel",https://www.clarin.com/sociedad/ex-miss-argentina-atropello-mato-inspector-transito-quedo-paso-volver-carcel_0_6uFfzAFVb.html,https://images.clarin.com/2019/01/31/aw96YoXlE_1256x620__4.jpg#1618765942282
33,Ie0ocX0Hf,Más restricciones. Francia impone cuarentena obligatoria para los turistas argentinos,https://www.clarin.com/mundo/francia-impone-cuarentena-obligatoria-turistas-argentina-brasil-chile_0_Ie0ocX0Hf.html,https://images.clarin.com/2018/09/26/s9YTiN0JE_720x0__1.jpg
34,k7aS-QRiK,La pandemia. Italia reabre las escuelas este lunes para casi siete millones de alumnos,https://www.clarin.com/mundo/coronavirus-italia-reabre-escuelas-lunes-millones-alumnos_0_k7aS-QRiK.html,https://images.clarin.com/2021/03/23/s0Qd1t_BE_1256x620__2.jpg#1618761979716
35,ldPJ9HFlu,"Entrevista. Mauricio Asta, el jurado ""bueno"" de la tele que trabajó en Disney y sueña con actuar",https://www.clarin.com/gourmet/mauricio-asta-jurado-bueno-tele-trabajo-disney-suena-actuar_0_ldPJ9HFlu.html,https://images.clarin.com/2021/04/09/iOpE04nkE_1256x620__2.jpg#1618002045726
36,aqo9rc3oT,Crisis. Un destino paradisíaco planea ofrecer vacunas contra el coronavirus para atraer turistas,https://www.clarin.com/viajes/destino-paradisiaco-planea-ofrecer-vacunas-coronavirus-atraer-turistas_0_aqo9rc3oT.html,https://images.clarin.com/2021/04/18/z1CA6zr2H_720x0__1.jpg
37,3Lrlk-3iR,Placer. Juguetes sexuales: ranking erótico y cuerpos conectados por apps,https://www.clarin.com/relaciones/juguetes-sexuales-ranking-erotico-cuerpos-conectados_0_3Lrlk-3iR.html,https://images.clarin.com/2021/02/26/ikU5AB76C_720x0__1.jpg
38,idk2ghIwE,Streaming musical. Cuánto cobran los artistas por las reproducciones en Apple y Spotify,https://www.clarin.com/tecnologia/cobran-artistas-cancion-reproduce-apple-spotify_0_idk2ghIwE.html,https://images.clarin.com/2018/02/25/ByE4ujN_M_720x0__1.jpg
39,_9K_4ci-0,"Turismo rural. Maridaje de quesos y vinos, una tendencia en suelo bonaerense",https://www.clarin.com/viajes/escapadas-maridaje-quesos-vinos-tendencia-suelo-bonaerense_0__9K_4ci-0.html,https://images.clarin.com/2021/04/16/6syRfobcA_720x0__1.jpg
40,B40q5unNo,"Ecoturismo. Escapadas de otoño: 8 reservas naturales, un respiro al aire libre",https://www.clarin.com/viajes/escapadas-otono-8-reservas-naturales-respiro-aire-libre_0_B40q5unNo.html,https://images.clarin.com/2021/04/13/fZIErdGbs_720x0__1.jpg
41,k-E9HA5aR,Astronomía. Experiencia sideral: cómo redescubrir la inmensidad del cielo desde tu balcón,https://www.clarin.com/familias/experiencia-sideral-redescubrir-inmensidad-cielo-balcon_0_k-E9HA5aR.html,https://images.clarin.com/2021/04/15/HEhtMbQTl_720x0__1.jpg
42,BccXSUitG,"Para superar. Karmas, defectos y vibraciones densas de cada uno de los 12 signos del zodiaco",https://www.clarin.com/astrologia/karmas-defectos-vibraciones-densas-12-signos-zodiaco_0_BccXSUitG.html,https://images.clarin.com/2021/04/16/BNN1hWgDd_720x0__1.jpg
43,L_Cfcyihq,En San Telmo. Invertí y comenzá a cobrar alquiler hasta la posesión,https://www.clarin.com/mercado-inmobiliario/inverti-san-telmo-comenza-cobrar-alquiler-posesion_0_L_Cfcyihq.html,https://images.clarin.com/2021/03/17/P3bQz9HnN_720x0__1.jpg
44,RnDCXdAqB,Solar Bustamante. Para mudarse con categoría y estilo en una esquina única,https://www.clarin.com/mercado-inmobiliario/solar-bustamante-identidad-palermo-categoria-estilo_0_RnDCXdAqB.html,https://images.clarin.com/2020/09/01/9s-MMDBF9_720x0__1.jpg
45,d7GR8WGdY,Mine Newbery. La nueva estrella de La Imprenta,https://www.clarin.com/mercado-inmobiliario/mine-newbery-proyecto-imperdible-pleno-barrio-imprenta_0_d7GR8WGdY.html,https://images.clarin.com/2020/11/09/61Go-_7CD_720x0__1.jpg
46,m50YRWT_x,Charcas Live. Invertí en pesos y en un producto premium,https://www.clarin.com/mercado-inmobiliario/inverti-pesos-producto-premium_0_m50YRWT_x.html,https://images.clarin.com/2021/03/05/YlVCe0xV2_720x0__1.jpg
47,hRAaQxf6y,Dos ambientes. El mejor momento para comprar en Palermo Soho,https://www.clarin.com/brandstudio/mejor-momento-comprar-palermo-soho_0_hRAaQxf6y.html,https://images.clarin.com/2021/03/18/2Kszwqqc9_720x0__1.jpg
48,pmJJGLeoY,Misterio. La desaparición de un pueblo y sus 1.200 habitantes,https://www.clarin.com/viste/misterio-lleva-90-anos-desaparicion-pueblo-1200-habitantes_0_pmJJGLeoY.html,https://images.clarin.com/2021/04/18/tm0v0ot-K_720x0__1.jpg
49,wUBOGAm48,"Genio excéntrico. Albert Einstein: 7 datos curiosos y desconocidos de su vida personal, a 66 años de su muerte",https://www.clarin.com/internacional/albert-einstein-7-datos-curiosos-desconocidos-vida-personal--66-anos-muerte_0_wUBOGAm48.html,https://images.clarin.com/2021/04/17/GRzzW64Ad_720x0__1.jpg
50,7Oc769Qxi,Charla Nash. La mujer a la que un chimpancé le arrancó cara y manos,https://www.clarin.com/viste/historia-charla-nash-mujer-chimpance-arranco-cara-manos-frenetico-ataque_0_7Oc769Qxi.html,https://images.clarin.com/2021/04/17/jjXrbcTjl_720x0__1.jpg
51,60Eslgunc,Video. Una oveja derriba a un dron con un cabezazo para defender a sus crías,https://www.clarin.com/viste/oveja-derriba-dron-cabezazo-defender-crias_0_60Eslgunc.html,https://images.clarin.com/2021/04/15/FXxRysUON_720x0__1.jpg
52,k5tSAys7M,Pandemia. Descubren un nuevo talón de Aquiles del coronavirus,https://www.clarin.com/internacional/covid-19-descubren-nuevo-talon-aquiles-coronavirus_0_k5tSAys7M.html,https://images.clarin.com/2021/02/26/kb04Vc4jx_720x0__1.jpg
53,D9UwdjZKd,"""Me mordió"". El video del hombre que defiende a su esposa del ataque de un lince rabioso",https://www.clarin.com/viste/-mordio-video-hombre-defiende-esposa-ataque-lince-rabioso_0_D9UwdjZKd.html,https://images.clarin.com/2021/04/16/uqcfJrf4__720x0__1.jpg
54,iHZHeUjKd,"Reportaje exclusivo. María Dueñas habla de ""Sira"", su nuevo libro que tiene a Evita de personaje",https://www.clarin.com/viva/maria-duenas-habla-sira--nuevo-libro-evita-personaje_0_iHZHeUjKd.html,https://images.clarin.com/2021/04/14/aRgWcWrCT_720x0__1.jpg
55,b0B1aJNHC,Personaje. La campeona que puede estar más de 5 minutos sin respirar,https://www.clarin.com/viva/campeona-puede-5-minutos-respirar_0_b0B1aJNHC.html,https://images.clarin.com/2021/04/12/d24EBrAz7_720x0__1.jpg
56,dRp_lRhjS,Aniversario. Bomberos de La Boca: 50 mil días de coraje y vocación,https://www.clarin.com/viva/bomberos-boca-50-mil-dias-coraje-vocacion_0_dRp_lRhjS.html,https://images.clarin.com/2021/04/12/EZNmRq8Vq_720x0__1.jpg
57,E2hFPfHGI,"Anita Martínez. ""Estoy sola, pero administro el Tinder de mis amigas""",https://www.clarin.com/viva/anita-martinez-sola-administro-tinder-amigas-_0_E2hFPfHGI.html,https://images.clarin.com/2019/09/12/WZWhRgJZi_720x0__1.jpg
58,deBedMdue,Invasiones inglesas. Las increíbles hazañas de la reconquista,https://www.clarin.com/viva/invasiones-inglesas-increibles-hazanas-reconquista_0_deBedMdue.html,https://images.clarin.com/2021/04/08/gN2zyfnLX_720x0__1.jpg
59,wGASPWYOh,Consultorio. Atención padres: los peligros del aislamiento adolescente,https://www.clarin.com/viva/atencion-padres-peligros-aislamiento-adolescente_0_wGASPWYOh.html,https://images.clarin.com/2020/12/10/QA0NYZZzJ_720x0__1.jpg
60,jReQcggIE,Economía del Excel. Inflación: vuelven viejos controles que ya fracasaron,https://www.clarin.com/economia/inflacion-vuelven-viejos-controles-fracasaron_0_jReQcggIE.html,https://images.clarin.com/2020/02/17/ljqfhFKe_720x0__1.jpg
61,_NlvyAlYg,Análisis. Controlar la inflación: cómo romper un ciclo de 100 años,https://www.clarin.com/economia/controlar-inflacion-romper-ciclo-100-anos_0__NlvyAlYg.html,https://images.clarin.com/2021/04/14/nYQhkQ7u0_720x0__1.jpg
62,wdwa-l9-s,Mirada Global. La telemedicina arrastra al capitalismo global,https://www.clarin.com/economia/telemedicina-arrastra-capitalismo-global_0_wdwa-l9-s.html,https://images.clarin.com/2020/05/14/EJoMEA_se_720x0__1.jpg
63,ngqU2cuco,Secretos empresarios. Guerra de abogados por el impuesto a la riqueza,https://www.clarin.com/economia/guerra-abogados-juicios-impuesto-riqueza_0_ngqU2cuco.html,https://images.clarin.com/2020/11/18/qvOA0mHRv_720x0__1.jpg
64,eQnWzzXp_,Mundo laboral. Qué beneficios agregaron las empresas y cuáles sacaron por la pandemia,https://www.clarin.com/economia/beneficios-empleados-agregaron-empresas-sacaron-pandemia_0_eQnWzzXp_.html,https://images.clarin.com/2021/04/16/r3A5e-Seg_720x0__1.jpg
65,BKzsLLY74,Estudio británico. Afirman que el cierre de escuelas afecta a niños y que falta evidencia para justificarlo,https://www.clarin.com/sociedad/afirman-cierre-escuelas-afecta-ninos-falta-evidencia-cientifica-justificarlo_0_BKzsLLY74.html,https://images.clarin.com/2020/03/18/FyOt2jwWa_720x0__1.jpg
66,Sx0QAvsuR,Duras críticas. Las crueles imágenes de maltrato animal en un laboratorio que escandalizan a España,https://www.clarin.com/mundo/crueles-imagenes-maltrato-animal-laboratorio-escandalizan-espana_0_Sx0QAvsuR.html,https://images.clarin.com/2021/04/18/thKqUTiVI_720x0__1.jpg
67,WiygcXt4d,Cierre de escuelas. Patricia Bullrich irá a la Justicia para intentar frenar el DNU del Gobierno,https://www.clarin.com/politica/patricia-bullrich-presentara-amparo-cierre-escuelas-restricciones-circulacion_0_WiygcXt4d.html,https://images.clarin.com/2021/03/23/nYirfM9YD_720x0__1.jpg
68,g5Iif1gDa,Giro político. Mario Vargas Llosa: de combatir a Alberto Fujimori a apoyar a su hija Keiko en Perú,https://www.clarin.com/mundo/mario-vargas-llosa-combatir-alberto-fujimori-apoyar-hija-keiko-balotaje-peru_0_g5Iif1gDa.html,https://images.clarin.com/2021/04/18/D4zR1-ah2_720x0__1.jpg
69,hK0AyBfTu,Copa de la Liga. Racing se fue con las manos vacías de su visita a Arsenal de Sarandí,https://www.clarin.com/deportes/arsenal-vs-racing-copa-liga-profesional-horario-tv-formaciones_0_hK0AyBfTu.html,https://images.clarin.com/2021/04/18/cn1W6FT5Z_720x0__1.jpg
70,-_25ds2Wy,Fórmula 1. Verstappen se llevó un GP de Imola caótico gracias a una largada espectacular,https://www.clarin.com/deportes/formula-1-gran-premio-imola-directo_0_-_25ds2Wy.html,https://images.clarin.com/2021/04/18/s7-_XCZXO_720x0__1.jpg
71,nI0ZSr2uy,Batalla de sábado. Rating: ¿quién ganó el cuarto round entre Juana Viale y Andy Kusnetzoff?,https://www.clarin.com/espectaculos/tv/rating-gano-cuarto-round-juana-viale-andy-kusnetzoff-_0_nI0ZSr2uy.html,https://images.clarin.com/2021/04/18/EPqyAMThN_720x0__1.jpg
72,P4X0AUJtS,"Historia de vida. Morena Beltrán, la estudiosa de la táctica: ""Soy una Nerd del fútbol""",https://www.clarin.com/historias/morena-beltran-estudiosa-tactica-nerd-futbol-_0_P4X0AUJtS.html,https://images.clarin.com/2021/04/16/mInWbETVA_720x0__1.jpg
73,7AyEYGnKu,"Circo en Atlanta. El brutal nocaut de Jake Paul, el youtuber que quiere hacer su propia historia en el boxeo",https://www.clarin.com/deportes/jake-paul-ben-askren-nocaut_0_7AyEYGnKu.html,https://images.clarin.com/2021/04/18/zHP6I_c-Hp_1256x620__2.jpg#1618766759484
74,Wv1ZeFBEB,"Un sector en jaque. Las pizzerías, en crisis: cerró el local de La Americana de avenida Corrientes",https://www.clarin.com/ciudades/pizzerias-crisis-restricciones-cerro-local-americana-avenida-corrientes_0_Wv1ZeFBEB.html,https://images.clarin.com/2021/04/17/DocYOxFW-_720x0__1.jpg
75,SHXCfQ6S0,"Horror y giro inesperado. Un asado entre amigos, un hacha y el peor final para una mujer en Mendoza",https://www.clarin.com/policiales/asado-amigos-hacha-peor-final-mujer-cordillera-mendocina_0_SHXCfQ6S0.html,https://images.clarin.com/2021/04/17/cBayRZ25P_1256x620__2.jpg#1618701937398
76,m45RoisE-,"""Fred"" Machado. Cayó el misterioso empresario vinculado con el narco y los vuelos de los Juliá y Báez",https://www.clarin.com/policiales/cayo-fred-machado-misterioso-empresario-vinculado-narcotrafico-vuelos-julia-lazaro-baez_0_m45RoisE-.html,https://images.clarin.com/2021/04/17/UhPvrGhrv_720x0__1.jpg
77,a0YNRGvzi,"Videojuegos. Del Antiguo Egipto al Holocausto, ya hay problemas para representar la Historia",https://www.clarin.com/tecnologia/antiguo-egipto-holocausto-videojuegos-problemas-representar-historia_0_a0YNRGvzi.html,https://images.clarin.com/2021/04/16/jtpi7l5rl_720x0__1.jpg
78,PYPj8qyEy,Crítica. Luis Miguel: cómo son los tres primeros capítulos de la nueva temporada,https://www.clarin.com/espectaculos/tv/luis-miguel-primeros-capitulos-nueva-temporada_0_PYPj8qyEy.html,https://images.clarin.com/2021/04/10/cy30F6xUo_720x0__1.jpg
79,43P2QWa9n,"Premios Oscar 2021. Amor y monstruos, número uno en Netflix",https://www.clarin.com/espectaculos/cine/premios-oscar-2021-amor-monstruos-numero-netflix_0_43P2QWa9n.html,https://images.clarin.com/2021/04/18/r1FgCa5wp_720x0__1.jpg
80,S-mfq8IjN,Entrevista. El verdadero pintor de los cuadros de Shtisel: no lee antes el guión y no tiene religión,https://www.clarin.com/cultura/verdadero-pintor-cuadros-shtisel-lee-guion-religion_0_S-mfq8IjN.html,https://images.clarin.com/2021/04/16/c0-KWHgQm_1256x620__2.jpg#1618712735222
