n,id,title,url,image
1,jy1c4Civ1,"Tras los dichos de Cristina. Fernán Quirós, sobre el sistema de salud: ""No va a ser un iluminado el que resuelva el problema""",https://www.clarin.com/politica/fernan-quiros-dichos-cristina-kirchner-va-iluminado-resuelve-problema-sistema-salud-_0_jy1c4Civ1.html,https://images.clarin.com/2021/05/04/gitFqSivA_720x0__1.jpg
2,nn_kogHpC,Amplio repudio. Escrachan a opositores y difunden sus datos personales en un sitio K,https://www.clarin.com/politica/escrachan-opositores-difunden-datos-personales-sitio-k_0_nn_kogHpC.html,https://images.clarin.com/2021/06/14/6dyR7Zcjl_720x0__1.jpg
3,pTHXKJjbt,En Provincia. La encuesta que sacudió a los K y sacó a Cristina a la cancha,https://www.clarin.com/opinion/encuesta-sacudio-kirchnerismo_0_pTHXKJjbt.html,https://images.clarin.com/2021/06/14/zQitbqBo4_720x0__1.jpg
4,xnlzWDLrS,Del editor. Cristina y su vacuna de la felicidad,https://www.clarin.com/opinion/cristina-vacuna-felicidad_0_xnlzWDLrS.html,https://images.clarin.com/2021/06/14/8SvzJWfBE_720x0__1.jpg
5,QWOCSB5EZ,Covid 2021-2022. Qué son las vacunas de segunda generación y qué rol jugarán en el país,https://www.clarin.com/sociedad/covid-2021-2022-vacunas-segunda-generacion-rol-jugaran-argentina_0_QWOCSB5EZ.html,https://images.clarin.com/2021/05/26/tjGuYdUgx_1256x620__2.jpg#1623436540027
6,SfHRknVE2,Conmoción en Córdoba. Una abuela y su nieto murieron de coronavirus con tres días de diferencia,https://www.clarin.com/sociedad/conmocion-cordoba-abuela-nieto-murieron-coronavirus-dias-diferencia_0_SfHRknVE2.html,https://images.clarin.com/2021/06/15/sjsg_v5cP_720x0__1.jpg
7,5jWzCN2Ts,Encuentro. Quién es la artista que almorzó a solas con el Presidente,https://www.clarin.com/sociedad/artista-mendocina-almorzo-solas-alberto-fernandez-reaccion-presidente_0_5jWzCN2Ts.html,https://images.clarin.com/2021/06/15/bYO6h1C5N_720x0__1.jpg
8,-ne00R49N,Horror en La Matanza. La última imagen de la mujer que iba con su hijo de 5 años y el sospechoso de matarla,https://www.clarin.com/policiales/matanza-nino-5-anos-alerto-vecinos-luego-presenciar-asesinato-madre_0_-ne00R49N.html,https://images.clarin.com/2021/06/15/yNJfvFldz_720x0__1.jpg
9,tHRaVLg_K,Beneficio. Algunos sueldos mayores a $ 150.000 tampoco pagarán Ganancias,https://www.clarin.com/economia/ganancias-confirman-trabajadores-pagaran-impuesto-superen-150-000_0_tHRaVLg_K.html,https://images.clarin.com/2021/02/09/ua3_cJ0ee_720x0__1.jpg
10,Nc29F1Rk3,"Busca inversiones. El Gobierno pasa la gorra entre sectores ""ganadores"" de la economía",https://www.clarin.com/economia/gobierno-pasa-gorra-sectores-ganadores-economia-busca-anuncios-inversion_0_Nc29F1Rk3.html,https://images.clarin.com/2021/06/15/V88iHf6UG_1256x620__2.jpg#1623763215479
11,50XNGDiGF,"Especial Clarín. ""No sirvo más... matame"": la batalla final y la caída de Puerto Argentino",https://www.clarin.com/politica/publicar-malvinas-sirvo-matame-encarnizada-batalla-montes-caida-puerto-argentino_0_50XNGDiGF.html,https://images.clarin.com/2021/06/11/qmsvjh8Ib_720x0__1.jpg
12,jCCoXId-d,Subasta online. Falabella remata el último stock: cómo participar,https://www.clarin.com/economia/falabella-remata-ultimo-stock-participar-puede-comprar_0_jCCoXId-d.html,https://images.clarin.com/2021/04/15/vlPwriDM2_720x0__1.jpg
13,jy1c4Civ1,"Tras los dichos de Cristina. Fernán Quirós, sobre el sistema de salud: ""No va a ser un iluminado el que resuelva el problema""",https://www.clarin.com/politica/fernan-quiros-dichos-cristina-kirchner-va-iluminado-resuelve-problema-sistema-salud-_0_jy1c4Civ1.html,https://images.clarin.com/2021/05/04/gitFqSivA_720x0__1.jpg
14,nn_kogHpC,Amplio repudio. Escrachan a opositores y difunden sus datos personales en un sitio K,https://www.clarin.com/politica/escrachan-opositores-difunden-datos-personales-sitio-k_0_nn_kogHpC.html,https://images.clarin.com/2021/06/14/6dyR7Zcjl_720x0__1.jpg
15,pTHXKJjbt,En Provincia. La encuesta que sacudió a los K y sacó a Cristina a la cancha,https://www.clarin.com/opinion/encuesta-sacudio-kirchnerismo_0_pTHXKJjbt.html,https://images.clarin.com/2021/06/14/zQitbqBo4_720x0__1.jpg
16,xnlzWDLrS,Del editor. Cristina y su vacuna de la felicidad,https://www.clarin.com/opinion/cristina-vacuna-felicidad_0_xnlzWDLrS.html,https://images.clarin.com/2021/06/14/8SvzJWfBE_720x0__1.jpg
17,QWOCSB5EZ,Covid 2021-2022. Qué son las vacunas de segunda generación y qué rol jugarán en el país,https://www.clarin.com/sociedad/covid-2021-2022-vacunas-segunda-generacion-rol-jugaran-argentina_0_QWOCSB5EZ.html,https://images.clarin.com/2021/05/26/tjGuYdUgx_1256x620__2.jpg#1623436540027
18,SfHRknVE2,Conmoción en Córdoba. Una abuela y su nieto murieron de coronavirus con tres días de diferencia,https://www.clarin.com/sociedad/conmocion-cordoba-abuela-nieto-murieron-coronavirus-dias-diferencia_0_SfHRknVE2.html,https://images.clarin.com/2021/06/15/sjsg_v5cP_720x0__1.jpg
19,5jWzCN2Ts,Encuentro. Quién es la artista que almorzó a solas con el Presidente,https://www.clarin.com/sociedad/artista-mendocina-almorzo-solas-alberto-fernandez-reaccion-presidente_0_5jWzCN2Ts.html,https://images.clarin.com/2021/06/15/bYO6h1C5N_720x0__1.jpg
20,-ne00R49N,Horror en La Matanza. La última imagen de la mujer que iba con su hijo de 5 años y el sospechoso de matarla,https://www.clarin.com/policiales/matanza-nino-5-anos-alerto-vecinos-luego-presenciar-asesinato-madre_0_-ne00R49N.html,https://images.clarin.com/2021/06/15/yNJfvFldz_720x0__1.jpg
21,kTB3X-leO,"Misterio resuelto. Qué hizo EE.UU. con los restos de Hideki Tojo, el cerebro del ataque a Pearl Harbor",https://www.clarin.com/mundo/misterio-resuelto-hizo-unidos-restos-hideki-tojo-cerebro-ataque-pearl-harbour-_0_kTB3X-leO.html,https://images.clarin.com/2021/06/14/9d5CWXnZQ_1256x620__2.jpg#1623687499474
22,Cm3lcoqtr,"Duras críticas. Roger Waters rechazó una oferta millonaria de Facebook y llamó ""idiota"" a Zuckerberg",https://www.clarin.com/tecnologia/roger-waters-rechaza-oferta-millonaria-facebook-llama-idiota-mark-zuckerberg_0_Cm3lcoqtr.html,https://images.clarin.com/2021/06/15/KapTmQNGN_720x0__1.jpg
23,6eOjQJqcQ,Amor fraterno y dolor. La emotiva carta de Guido Avelluto por la muerte de su hermano Nicolás,https://www.clarin.com/politica/dolor-guido-avelluto-muerte-nicolas-desconsuela-hermanitos-van-disfrutar-_0_6eOjQJqcQ.html,https://images.clarin.com/2021/06/14/f8SsGls3E_720x0__1.jpg
24,bv8cTbn3t,Brecha de género. Qué pueden hacer las empresas para terminar con la desigualdad,https://www.clarin.com/sociedad/brecha-genero-pueden-hacer-empresas-terminar-desigualdad-_0_bv8cTbn3t.html,https://images.clarin.com/2021/06/15/3rE8_fo2y_720x0__1.jpg
25,Au70U81Mi,Estereotipo del cine. Cruella y Hollywood: ¿el diablo siempre viste a la moda?,https://www.clarin.com/viva/cruella-hollywood-diablo-siempre-viste-moda-_0_Au70U81Mi.html,https://images.clarin.com/2021/06/14/qMDhKKLGN_720x0__1.jpg
26,Rp4bzXn0C,Copa América 2021. Los altos precios de la indumentaria de la Selección: cómo pagar menos,https://www.clarin.com/servicios/copa-america-2021-duros-precios-camiseta-shorts-medias-seleccion-pagar_0_Rp4bzXn0C.html,https://images.clarin.com/2021/06/14/dCoXa7xq5_720x0__1.jpg
27,FKK50Nows,Una voz inigualable. A 25 años de la muerte de Ella Fitzgerald: la reina del jazz que le ganó a la pobreza,https://www.clarin.com/espectaculos/musica/25-anos-muerte-fitzgerald-reina-jazz-nacio-pobreza-discriminacion_0_FKK50Nows.html,https://images.clarin.com/2017/04/23/HyWXiNc0x_720x0.jpg
28,e9-b-9rOb,"Fher Olvera, de Maná. El homenaje que disparó un disco de duetos y una borrachera que terminó en Covid",https://www.clarin.com/espectaculos/musica/fher-olvera-mana-homenaje-disparo-disco-duetos-borrachera-termino-covid_0_e9-b-9rOb.html,https://images.clarin.com/2021/06/14/TL3CYEXTu_720x0__1.jpg
29,oKjIZ7Kc4,Transformación digital. Digital House adquiere Acámica y afianza su liderazgo en formación tecnológica en la región,https://www.clarin.com/brandstudio/digital-house-adquiere-acamica-afianza-liderazgo-formacion-tecnologica-region_0_oKjIZ7Kc4.html,https://images.clarin.com/2021/06/14/bsKfwEhhH_720x0__1.jpg
30,as9-OPvz4,Después de la eliminación. Se terminó la NBA para Campazzo: el año en el que el cordobés creció de golpe,https://www.clarin.com/deportes/termino-nba-facundo-campazzo-ano-cordobes-crecio-golpe_0_as9-OPvz4.html,https://images.clarin.com/2021/06/14/kJhtj-E5h_1256x620__2.jpg#1623706223762
31,G7UasEaWg,Copa América. A la Selección no le alcanzó el gol de Messi y sufrió con los baches en su juego,https://www.clarin.com/deportes/seleccion-intermitencias-alcanzo-golazo-messi-volvio-sufrir-baches-juego-falta-efectividad_0_G7UasEaWg.html,https://images.clarin.com/2021/06/14/gLTW3IgH__720x0__1.jpg
32,-QY7nuntR,"El 1x1 de la Selección. Messi, el punto más alto de un equipo que sigue sin defender bien",https://www.clarin.com/deportes/1x1-argentina-chile-messi-joya-tiro-libre-vez-punto-alto-seleccion-intermitente-sigue-defender-bien_0_-QY7nuntR.html,https://images.clarin.com/2021/06/14/J6yUc0xkI_720x0__1.jpg
33,W0M8jgkSw,En la previa. El homenaje de Conmebol a Maradona,https://www.clarin.com/deportes/futbol-internacional/momentos-emotivos-sentido-homenaje-conmebol-diego-armando-maradona_0_W0M8jgkSw.html,https://images.clarin.com/2021/06/14/4fdWYunpy_720x0__1.jpg
34,wIgEpyOit,Un calco del Diez. El tributo de Messi a Maradona en el festejo de su golazo,https://www.clarin.com/deportes/futbol-internacional/messi-homenajeo-maradona-festejo-golazo_0_wIgEpyOit.html,https://images.clarin.com/2021/06/14/xX9oX7a8z_720x0__1.jpg
35,DBDD5PDMD,Debutó en Chile. Ben Brereton: el inglés que no habla castellano y un pícaro mensaje en Twitter,https://www.clarin.com/deportes/tuit-seleccion-chile-argentina-ingles_0_DBDD5PDMD.html,https://images.clarin.com/2021/06/14/Tbxp5AfmM_1256x620__2.jpg#1623718961317
36,r1eu9vEgz,"Copa América. Con dos goles de Ángel Romero, Paraguay venció a Bolivia en su debut",https://www.clarin.com/deportes/paraguay-vs-bolivia-copa-america-2021-minuto-minuto-directo_0_r1eu9vEgz.html,https://images.clarin.com/2021/06/14/o_DEUhY0G_720x0__1.jpg
37,77xjyjW4T,"Pandemia. En solo dos días, la Copa América acumula 41 casos de coronavirus",https://www.clarin.com/deportes/solo-dias-copa-america-acumula-41-casos-coronavirus_0_77xjyjW4T.html,https://images.clarin.com/2021/06/15/_WnAkTAvO_720x0__1.jpg
38,LmIKuW551,"En redes sociales. Eriksen, desde el hospital: ""Estoy bien, dadas las circunstancias""",https://www.clarin.com/deportes/christian-eriksen-hospital-bien-dadas-circunstancias-_0_LmIKuW551.html,https://images.clarin.com/2021/06/15/h9RDiG_O9_720x0__1.jpg
39,igkrdm62E,Militancia. Pecheras y barbijos con eslogan oficial: el merchandising de la campaña de vacunas,https://www.clarin.com/politica/pecheras-barbijos-eslogan-oficial-singular-merchandising-campana-vacunas_0_igkrdm62E.html,https://images.clarin.com/2021/06/15/Dfz08jCnA_720x0__1.jpg
40,o9SvaLPcU,La segunda ola. 85.000 muertos por Covid en Argentina: cómo hicieron otros países para frenarlo,https://www.clarin.com/mundo/argentina-cuenta-85-000-muertos-covid-hicieron-paises-domar-virus_0_o9SvaLPcU.html,https://images.clarin.com/2020/12/31/XwUmM09Ix_720x0__1.jpg
41,XMkb2xQPT,Italia. Murió tras aplicarse AstraZeneca y ahora darán Pfizer como segunda dosis,https://www.clarin.com/mundo/escandalo-muere-chica-18-anos-aplicarse-astrazeneca-ahora-italia-reemplaza-segunda-dosis-pfizer_0_XMkb2xQPT.html,https://images.clarin.com/2021/03/20/jwlEd1Bp8_720x0__1.jpg
42,HsluewP5q,El tránsito en Ciudad. Choferes de micros de turismo vuelven a cortar la 9 de Julio y hay complicaciones para transitar,https://www.clarin.com/ciudades/choferes-micros-turismo-vuelven-cortar-avenida-9-julio-complicaciones-transitar_0_HsluewP5q.html,https://images.clarin.com/2021/06/15/cUskof17W_720x0__1.jpg
43,HRuswFp-5,Pedido de Biden. En el Gobierno quieren condenar a Nicaragua en la OEA pero aún no deciden,https://www.clarin.com/politica/gobierno-quiere-condenar-nicaragua-debate-oea-martes-decide_0_HRuswFp-5.html,https://images.clarin.com/2021/06/14/W14S4MsFN_720x0__1.jpg
44,G_BGVWbEX,Elecciones en Perú. Cuándo se conocerán los resultados del balotaje entre Castillo y Keiko Fujimori,https://www.clarin.com/mundo/elecciones-peru-conoceran-resultados-balotaje-_0_G_BGVWbEX.html,https://images.clarin.com/2021/06/15/jowfvJWq-_1256x620__2.jpg#1623762539499
45,Un1KWE8u2,Nuevo parte médico. Susana Giménez debió pasar a terapia intermedia y es asistida con oxígeno,https://www.clarin.com/fama/conocio-nuevo-parte-medico-salud-susana-gimenez-internada-coronavirus_0_Un1KWE8u2.html,https://images.clarin.com/2020/05/29/_pfaJFWHz_720x0__1.jpg
46,fSRNJizJl,Tercera edad. Violencia contra los mayores: un mal silenciado que crece en pandemia,https://www.clarin.com/buena-vida/violencia-mayores-mal-silenciado-crece-pandemia_0_fSRNJizJl.html,https://images.clarin.com/2021/06/10/otPg0Y53Y_720x0__1.jpg
47,bQ_bMWZ9c,Nómades digitales. Trabajar a distancia y conocer el mundo: qué destinos lo facilitan,https://www.clarin.com/viajes/trabajar-distancia-conocer-mundo-destinos-facilitan-vida-nomades-digitales_0_bQ_bMWZ9c.html,https://images.clarin.com/2021/06/11/wLc0nM4UL_720x0__1.jpg
48,vXCK6cxfz,Móviles. Cómo saber en qué lugar sacaste cualquier foto con tu celular,https://www.clarin.com/tecnologia/saber-lugar-sacaste-cualquier-foto-celular_0_vXCK6cxfz.html,https://images.clarin.com/2020/11/11/36M7rBFRV_720x0__1.jpg
49,2ZGxOWvf0,Diálogo y empatía. Cómo explicar las injusticias a los chicos,https://www.clarin.com/familias/explicar-injusticias-chicos_0_2ZGxOWvf0.html,https://images.clarin.com/2021/06/14/Q3RdIJZEC_720x0__1.jpg
50,BgI87hvHx,Ranking. Las 10 mejores playas de Europa en un 2021 aún marcado por la pandemia,https://www.clarin.com/viajes/10-mejores-playas-europa-2021_0_BgI87hvHx.html,https://images.clarin.com/2021/06/14/93G-8jF8Z_720x0__1.jpg
51,q_xnpgss0,Estrategias. Anemia: así mejorás la absorción de hierro de los alimentos,https://www.clarin.com/buena-vida/anemia-mejoras-absorcion-hierro-alimentos_0_q_xnpgss0.html,https://images.clarin.com/2021/04/18/OpSjfrQ5q_720x0__1.jpg
52,Q7QIQiIk_,Técnica japonesa. Cómo hacer sushi casero paso a paso,https://www.clarin.com/gourmet/hacer-sushi-casero-paso-paso_0_Q7QIQiIk_.html,https://images.clarin.com/2021/06/14/YRx2NMLot_1256x620__2.jpg#1623714125735
53,aKKbrBSQ4,Patrocinado. Vetifarma: 25 años comprometidos con la producción y sanidad animal,https://www.clarin.com/rural/vetifarma-25-anos-comprometidos-produccion-sanidad-animal_0_aKKbrBSQ4.html,https://images.clarin.com/2021/06/09/HgMnIyJ4o_1256x620__2.jpg#1623265286591
54,T0mfBvffId,"Uno, Riquelme. Tiene 14 hijos varones con el nombre de jugadores que empiezan con R",https://www.clarin.com/viste/14-hijos-varones-nombre-jugador-empieza-r-llama-riquelme_0_T0mfBvffId.html,https://images.clarin.com/2021/06/13/gyGD3SC1r_720x0__1.jpg
55,w3bXdV9KO,"Redes sociales. ""Este es mi primer trago"": la historia de la pareja que se volvió viral por el video de su boda",https://www.clarin.com/viste/primer-trago--historia-pareja-argentina-volvio-viral-imperdible-video-boda_0_w3bXdV9KO.html,https://images.clarin.com/2021/06/13/9oPpqVn8V_720x0__1.jpg
56,5ojDQDC0X,Brasil. Gastó 600.000 dólares para parecerse a Kim Kardashian y ahora está arrepentida,https://www.clarin.com/internacional/gasto-600-000-dolares-cirugias-esteticas-parecerse-kim-kardashian-ahora-arrepentida_0_5ojDQDC0X.html,https://images.clarin.com/2021/06/13/rtncE_qDd_720x0__1.jpg
57,hWdhe1_WF,Pandemia. La historia de la mujer que pasó la cuarentena sola en el Ártico,https://www.clarin.com/internacional/historia-mujer-paso-cuarentena-sola-artico_0_hWdhe1_WF.html,https://images.clarin.com/2021/06/14/JTf9h9hOb_720x0__1.jpg
58,VQo8QELJN,Medida drastica. Un país amenaza con cortar el teléfono a los que no se vacunen contra el Covid,https://www.clarin.com/viste/pais-amenaza-cortar-telefono-vacunen-covid_0_VQo8QELJN.html,https://images.clarin.com/2021/06/13/KsuQ0GhcP_720x0__1.jpg
59,qRm_Xf2BF,Insólito. Un perro se perdió tras un accidente y lo encontraron dos días después pastoreando,https://www.clarin.com/viste/perro-perdio-accidente-encontraron-dias-despues-pastoreando-ovejas_0_qRm_Xf2BF.html,https://images.clarin.com/2021/06/13/dZvKE11nq_720x0__1.jpg
60,cimSQNLBG,Elecciones 2021. José Luis Espert & Cía: el gran cuco liberal se desarmó y la duda es a dónde irán esos votos,https://www.clarin.com/politica/jose-luis-espert-cia-gran-cuco-liberal-desarmo-duda-iran-votos_0_cimSQNLBG.html,https://images.clarin.com/2019/05/30/HmcvdQAhz_720x0__1.jpg
61,PFe45kyfT,Cómo anotarse. Ciudad abrió la inscripción para mayores de 45 años sin factores de riesgo,https://www.clarin.com/ciudades/habilitan-vacunacion-mayores-45-anos-poblacion-general-anotarse_0_PFe45kyfT.html,https://images.clarin.com/2021/06/11/iwbpJZh3T_1256x620__2.jpg#1623710650090
62,mzmCzB_Sm,Contrato polémico. Ocaña: AstraZeneca le impuso al Gobierno condiciones más duras que Pfizer,https://www.clarin.com/politica/graciela-ocana-aseguro-astrazneca-impuso-condiciones-duras-pfizer-traer-vacunas-coronavirus_0_mzmCzB_Sm.html,https://images.clarin.com/2020/01/09/1B6GSJ-c_720x0__1.jpg
63,vvHryd9QQ,"Secuelas del Covid. Fuerte relato de Guillermo Coppola: ""Me ducho con el tanque de oxígeno""",https://www.clarin.com/fama/fuerte-relato-guillermo-coppola-ducho-tanque-oxigeno-_0_vvHryd9QQ.html,https://images.clarin.com/2020/11/30/xFQo5iIgw_720x0__1.jpg
64,F8VHaXjZZ,El hito de Palermo. Quiénes son y cómo se transformaron los goleadores en 90 años de profesionalismo,https://www.clarin.com/deportes/masantonio-scocco-transformaron-goleadores-90-anos-profesionalismo_0_F8VHaXjZZ.html,https://images.clarin.com/2020/09/26/2QFJzhn5i_720x0__1.jpg
65,k9Y56yz3C,Claves para ahorrar. Cómo comprar dólares: alternativas disponibles para proteger los pesos,https://www.clarin.com/servicios/comprar-dolares-4-alternativas-disponibles-proteger-pesos_0_k9Y56yz3C.html,https://images.clarin.com/2021/03/22/VosNxnRmN_720x0__1.jpg
66,QFpUXFELN,Amplio operativo. San Luis: buscan a una nena de 5 años que desapareció de un cumpleaños,https://www.clarin.com/sociedad/desesperada-busqueda-nena-5-anos-desaparecio-cumpleanos-san-luis_0_QFpUXFELN.html,https://images.clarin.com/2021/06/15/xyeUIYWT3_720x0__1.jpg
67,R4Fdv_X7a,Discriminación. Alberto Samid y un nuevo mensaje antisemita en redes sociales,https://www.clarin.com/politica/alberto-samid-nuevo-mensaje-antisemita-redes-sociales_0_R4Fdv_X7a.html,https://images.clarin.com/2021/06/15/dMprpn60I_720x0__1.jpg
68,FezurNqEm,Diseño exclusivo. Nueva Bronco Sport: ya está en Argentina la legendaria SUV 4x4 de Ford,https://www.clarin.com/brandstudio/nueva-bronco-sport-argentina-legendaria-suv-4x4-ford_0_FezurNqEm.html,https://images.clarin.com/2021/06/14/zQ89DvORm_720x0__1.jpg
