n,id,title,url,image
1,WJI2NvHda,"Esperarán hasta mañana. Si suben los contagios, la Ciudad de Buenos Aires aplicará nuevas restricciones a la circulación",https://www.clarin.com/politica/gobierno-provincia-analizan-nuevas-restricciones-ciudad-pide-esperar-martes_0_WJI2NvHda.html,https://images.clarin.com/2021/04/03/TYcZbaR_C_720x0__1.jpg
2,puRdY1Hi5,Al borde del colapso. Segunda ola en la Provincia: el sur del Conurbano siente el impacto más fuerte,https://www.clarin.com/zonales/segunda-ola-coronavirus-provincia-impacto-fuerte-sur-conurbano_0_puRdY1Hi5.html,https://images.clarin.com/2021/04/22/AgF0laZzo_720x0__1.jpg
3,4rG7FxLYa,De la editora. Alberto Fernández y el discurso del odio,https://www.clarin.com/opinion/alberto-f-discurso-odio_0_4rG7FxLYa.html,https://images.clarin.com/2021/04/16/SRQSQdBUA_720x0__1.jpg
4,NZm8RU1wZ,"""Vacuna argentina"". La obsesión oficial contra el Covid que choca con la urgencia por duplicar las dosis diarias",https://www.clarin.com/sociedad/-vacuna-argentina-obsesion-oficial-covid-choca-urgencia-duplicar-dosis-diarias_0_NZm8RU1wZ.html,https://images.clarin.com/2021/04/25/BHeGiSOrQ_720x0__1.jpg
5,bmYNWDr8o,"La semana política. Alberto Fernández no arranca, la vuelta de Randazzo y el ajuste de Martín Guzmán",https://www.clarin.com/politica/alberto-fernandez-arranca-vuelta-florencio-randazzo-ajuste-martin-guzman_0_bmYNWDr8o.html,https://images.clarin.com/2021/04/25/IHAX4VF3z_720x0__1.jpg
6,-dHG4XhSr,"Rindes agrícolas. Microbios inteligentes, el descubrimiento de una firma rosarina que da la vuelta al mundo",https://www.clarin.com/economia/microbios-inteligentes-descubrimiento-firma-rosarina-da-vuelta-mundo_0_-dHG4XhSr.html,https://images.clarin.com/2017/10/03/SJcDoWZ2W_720x0.jpg
7,oYphAB2JF,Uno por uno. La lista de ganadores de los Oscar,https://www.clarin.com/espectaculos/cine/oscar-2021-ganadores-minuto-minuto_0_oYphAB2JF.html,https://images.clarin.com/2021/04/25/z_Y4ueNGT_720x0__1.jpg
8,GlHLb63jr,"Emiliano Vecchio. La cruda confesión del jugador de los ""20 palos en el banco"": ""Viví 3 años en una plaza""",https://www.clarin.com/deportes/cruda-confesion-emiliano-vecchio-jugador-20-palos-banco-vivi-3-anos-plaza-comi-basura-_0_GlHLb63jr.html,https://images.clarin.com/2021/04/25/_zWSxVucv_1256x620__2.jpg#1619372456364
9,ZzBW-ZtEg,Video. La criminal patada que casi rompe a Messi,https://www.clarin.com/deportes/criminal-patada-rompe-lionel-messi_0_ZzBW-ZtEg.html,https://images.clarin.com/2021/04/25/kG5FJdkTX_720x0__1.jpg
10,CGS1DeGbU,"Investigación. Menstruación, vacunas y otros misterios",https://www.clarin.com/new-york-times-international-weekly/menstruacion-vacunas-misterios_0_CGS1DeGbU.html,https://images.clarin.com/2021/04/22/1-cw1vo76_1256x620__2.jpg#1619103848709
11,mVukSod6Q,Desafío. El mundo intenta controlar a las tecnológicas,https://www.clarin.com/new-york-times-international-weekly/mundo-intenta-controlar-tecnologicas_0_mVukSod6Q.html,https://images.clarin.com/2021/04/21/r403_l1gK_1256x620__2.jpg#1619017585512
12,PX5iYzDC1,Psicología. Terapia de pareja: ¿Sólo cuando hay una crisis?,https://www.clarin.com/new-york-times-international-weekly/terapia-pareja-solo-crisis-_0_PX5iYzDC1.html,https://images.clarin.com/2021/04/19/7MYTIuFti_1256x620__2.jpg#1618845068693
13,L4s2nD0_B,Crisis.  El hambre crece entre los jóvenes de Europa,https://www.clarin.com/new-york-times-international-weekly/-dinero-comer-hambre-crece-jovenes-europa_0_L4s2nD0_B.html,https://images.clarin.com/2021/04/22/biyyryB2T_1256x620__2.jpg#1619111167120
14,WJI2NvHda,"Esperarán hasta mañana. Si suben los contagios, la Ciudad de Buenos Aires aplicará nuevas restricciones a la circulación",https://www.clarin.com/politica/gobierno-provincia-analizan-nuevas-restricciones-ciudad-pide-esperar-martes_0_WJI2NvHda.html,https://images.clarin.com/2021/04/03/TYcZbaR_C_720x0__1.jpg
15,puRdY1Hi5,Al borde del colapso. Segunda ola en la Provincia: el sur del Conurbano siente el impacto más fuerte,https://www.clarin.com/zonales/segunda-ola-coronavirus-provincia-impacto-fuerte-sur-conurbano_0_puRdY1Hi5.html,https://images.clarin.com/2021/04/22/AgF0laZzo_720x0__1.jpg
16,4rG7FxLYa,De la editora. Alberto Fernández y el discurso del odio,https://www.clarin.com/opinion/alberto-f-discurso-odio_0_4rG7FxLYa.html,https://images.clarin.com/2021/04/16/SRQSQdBUA_720x0__1.jpg
17,NZm8RU1wZ,"""Vacuna argentina"". La obsesión oficial contra el Covid que choca con la urgencia por duplicar las dosis diarias",https://www.clarin.com/sociedad/-vacuna-argentina-obsesion-oficial-covid-choca-urgencia-duplicar-dosis-diarias_0_NZm8RU1wZ.html,https://images.clarin.com/2021/04/25/BHeGiSOrQ_720x0__1.jpg
18,bmYNWDr8o,"La semana política. Alberto Fernández no arranca, la vuelta de Randazzo y el ajuste de Martín Guzmán",https://www.clarin.com/politica/alberto-fernandez-arranca-vuelta-florencio-randazzo-ajuste-martin-guzman_0_bmYNWDr8o.html,https://images.clarin.com/2021/04/25/IHAX4VF3z_720x0__1.jpg
19,-dHG4XhSr,"Rindes agrícolas. Microbios inteligentes, el descubrimiento de una firma rosarina que da la vuelta al mundo",https://www.clarin.com/economia/microbios-inteligentes-descubrimiento-firma-rosarina-da-vuelta-mundo_0_-dHG4XhSr.html,https://images.clarin.com/2017/10/03/SJcDoWZ2W_720x0.jpg
20,oYphAB2JF,Uno por uno. La lista de ganadores de los Oscar,https://www.clarin.com/espectaculos/cine/oscar-2021-ganadores-minuto-minuto_0_oYphAB2JF.html,https://images.clarin.com/2021/04/25/z_Y4ueNGT_720x0__1.jpg
21,GlHLb63jr,"Emiliano Vecchio. La cruda confesión del jugador de los ""20 palos en el banco"": ""Viví 3 años en una plaza""",https://www.clarin.com/deportes/cruda-confesion-emiliano-vecchio-jugador-20-palos-banco-vivi-3-anos-plaza-comi-basura-_0_GlHLb63jr.html,https://images.clarin.com/2021/04/25/_zWSxVucv_1256x620__2.jpg#1619372456364
22,a8xROKFi8,"La pandemia. Italia suaviza las restricciones: abren cines, bares y habrá más clases presenciales",https://www.clarin.com/mundo/italia-suaviza-restricciones-coronavirus-abren-cines-bares-restaurantes-clases-presenciales_0_a8xROKFi8.html,https://images.clarin.com/2021/04/25/13GhuB0rr_1200x0__2.jpg#1619360402822
23,RbPXtXd60,Con pico de casos. Un gobernador peronista busca reformar la constitución provincial,https://www.clarin.com/politica/pleno-pico-contagios-gobernador-peronista-busca-reformar-constitucion-provincia_0_RbPXtXd60.html,https://images.clarin.com/2020/12/21/T0n4XX-9z_720x0__1.jpg
24,4nUFerra4,Modelo Santa Cruz. Hace 16 meses que no tienen clases presenciales y no hay planes para su vuelta,https://www.clarin.com/politica/modelo-santa-cruz-hace-16-meses-clases-presenciales-planes-vuelvan_0_4nUFerra4.html,https://images.clarin.com/2021/03/14/qz-e5gw1N_720x0__1.jpg
25,rjpGOLuMo,"En Transporte. Fernández y Massa compartirán un acto homenaje a Meoni, y definen la sucesión",https://www.clarin.com/politica/alberto-fernandez-sergio-massa-compartiran-acto-homenaje-mario-meoni-definen-sucesion-transporte_0_rjpGOLuMo.html,https://images.clarin.com/2021/02/13/FDlx9lZEL_720x0__1.jpg
26,Xe8UyM0sh,"Confrontación. La pandemia y la grieta política, en el peor momento",https://www.clarin.com/opinion/pandemia-grieta-politica-peor-momento_0_Xe8UyM0sh.html,https://images.clarin.com/2021/04/20/ZrEjZ0HgS_720x0__1.jpg
27,U-6f6jBvZ,"Narcotráfico. ""El mito de la droga"" en Mar de Plata: un piloto multicampeón que llega a juicio",https://www.clarin.com/policiales/piloto-multicampeon-historia-cocon-sala-dicen-mito-droga-_0_U-6f6jBvZ.html,https://images.clarin.com/2021/04/24/lCRSidKCk_1256x620__2.jpg#1619370275299
28,O99FJktL2,19 días de piquetes. Trabajadores de la salud rechazarán la oferta del gobierno de Neuquén,https://www.clarin.com/politica/conflicto-sur-trabajadores-salud-anticipan-rechazaran-oferta-gobierno-neuquen_0_O99FJktL2.html,https://images.clarin.com/2021/04/24/Qj_fM734I_1256x620__2.jpg#1619387884226
29,Mj3W0B5Uz,Violencia de género. Pilar: una joven fue apuñalada en el abdomen por su pareja y está grave ,https://www.clarin.com/sociedad/pilar-joven-apunalada-abdomen-pareja-internada-grave_0_Mj3W0B5Uz.html,https://images.clarin.com/2021/04/25/FOaQoIXmq_1256x620__2.jpg#1619386977362
30,dO5Y2jwzm,Ranking. Cuál fue el aeropuerto más transitado del mundo en 2020 tras el impacto del Covid,https://www.clarin.com/viajes/aeropuerto-transitado-mundo-2020-impacto-coronavirus_0_dO5Y2jwzm.html,https://images.clarin.com/2021/04/25/pxB6uO-8C_720x0__1.jpg
31,mxYVGjizY,Tendencias. Astroturismo en la Argentina: un viaje a la inmensidad del universo,https://www.clarin.com/viajes/astroturismo-argentina-viaje-inmensidad-universo_0_mxYVGjizY.html,https://images.clarin.com/2021/02/19/ioPTvO52L_720x0__1.jpg
32,HrIiZx6VV,Límites y enojos. Berrinches: cómo calmar a los niños cuando están inquietos,https://www.clarin.com/familias/berrinches-como-calmar-a-los-ninos-cuando-estan-inquietos_0_HrIiZx6VV.html,https://images.clarin.com/2021/04/23/Nm8SMN7HP_720x0__1.jpg
33,TyngqyrtV,"Constelaciones familiares. Cómo ""liberar"" conflictos que nos conectan con otras generaciones",https://www.clarin.com/astrologia/constelaciones-familiares-bert-hellinger_0_TyngqyrtV.html,https://images.clarin.com/2021/04/23/MYFv7rq7e_720x0__1.jpg
34,k7EYwfVtm,Postbióticos. Qué son y en qué se diferencian de los prebióticos y probióticos,https://www.clarin.com/buena-vida/postbioticos-diferencian-prebioticos-probioticos_0_k7EYwfVtm.html,https://images.clarin.com/2021/03/30/T69ay4Q7y_720x0__1.jpg
35,fNeMi6ZBQ,Vida en pareja. Por qué el deseo sexual aumenta después de una pelea,https://www.clarin.com/relaciones/por-que-el-deseo-sexual-aumenta-despues-de-una-pelea_0_fNeMi6ZBQ.html,https://images.clarin.com/2020/11/19/Tz-yrukK7_720x0__1.jpg
36,5GWwOS9D6,Nutrición. Así la alimentación puede ayudarte a combatir el estrés,https://www.clarin.com/buena-vida/alimentacion-puede-ayudarte-combatir-estres_0_5GWwOS9D6.html,https://images.clarin.com/2021/04/25/m9COG7Cvz_720x0__1.jpg
37,XmTUTGtzS,Recetas. Qué cocinar esta semana: menú día por día del 26 de abril al 2 de mayo,https://www.clarin.com/gourmet/cocinar-semana-menu-dia-dia-26-abril-2-mayo_0_XmTUTGtzS.html,https://images.clarin.com/2020/05/19/2un0Jgq5n_720x0__1.jpg
38,uyDA9WRSH,Video. Las misteriosas historias que encierra el subte de Londres,https://www.clarin.com/viste/misteriosas-historias-encierra-subte-londres_0_uyDA9WRSH.html,https://images.clarin.com/2018/01/02/S1j4oct7M_720x0.jpg
39,TyCqM2cEw,Tradición. La increíble tribu de África donde los hombres compiten por ser el más gordo,https://www.clarin.com/internacional/sangre-vaca-leche-increible-tribu-africa-hombres-compiten-gordo_0_TyCqM2cEw.html,https://images.clarin.com/2021/04/23/0GTgkzYTH_1256x620__2.jpg#1619211037504
40,gms6Iv098,"Viral. El hombre que dice ser hijo del príncipe Carlos y Camilla: ""Tengo pruebas""",https://www.clarin.com/viste/hombre-dice-hijo-secreto-principe-carlos-camilla-pruebas-_0_gms6Iv098.html,https://images.clarin.com/2021/04/24/Xho9ky0WP_720x0__1.jpg
41,Ethy7MNXk,Pandemia. Fue a trabajar con 40 grados de fiebre y no dijo nada: contagió a 22 personas,https://www.clarin.com/internacional/espana/trabajar-40-grados-fiebre-dijo-contagio-22-personas-covid-19_0_Ethy7MNXk.html,https://images.clarin.com/2021/01/22/9Lgf4NAnW_720x0__1.jpg
42,WfjA83xYz,Ingenio. Un carpintero creó un pupitre especial para proteger a su hija del Covid-19,https://www.clarin.com/viste/carpintero-creo-pupitre-especial-proteger-hija-covid-19_0_WfjA83xYz.html,https://images.clarin.com/2021/04/25/u8YqpKkfu_720x0__1.jpg
43,P2uOuECrG,Japón. Estafó a 35 mujeres y fingió estar enamorado de todas al mismo tiempo,https://www.clarin.com/viste/dinero-regalos-mentiras-hombre-estafo-35-mujeres-fingio-enamorado-todas-mismo-tiempo_0_P2uOuECrG.html,https://images.clarin.com/2021/04/22/YLF5wmmQr_720x0__1.jpg
44,-_kM2hGO3,"Así se vivió. ""Nomadland"" se consagró en un final extraño",https://www.clarin.com/espectaculos/oscar-2021-vivo-video-entrega-premios-cine_0_-_kM2hGO3.html,https://images.clarin.com/2021/04/26/ORI6FM84x_720x0__1.jpg
45,_cz-Dyo_H,Mala suerte. Quiénes fueron los grandes perdedores en los Oscar 2021,https://www.clarin.com/espectaculos/cine/oscar-2021-grande-perdedores_0__cz-Dyo_H.html,https://images.clarin.com/2021/04/26/ZPkHGlBNl_720x0__1.jpg
46,kPdEGrHyw,En Twitter. La fake news sobre Lali Espósito que fue tendencia en redes,https://www.clarin.com/fama/oscar-2021-fake-news-lali-esposito-tendencia-redes-pesar-ausencia_0_kPdEGrHyw.html,https://images.clarin.com/2018/09/04/SJOiKV3PX_720x0__1.jpg
47,dS_GIOhUl,La gran ganadora. Por qué Nomadland fue elegida mejor película,https://www.clarin.com/espectaculos/cine/-nomadland-llevo-oscar-2021-mejor-pelicula-_0_dS_GIOhUl.html,https://images.clarin.com/2021/04/26/LBGyk7fC6_720x0__1.jpg
48,kk0hNWSXR,Mención. Nombraron a Evita y estallaron los memes peronistas,https://www.clarin.com/espectaculos/oscar-2021-nombraron-evita-ceremonia-estallaron-redes-memes-peronistas_0_kk0hNWSXR.html,https://images.clarin.com/2021/04/25/oP2zY3487_720x0__1.jpg
49,DXjBmRcSr,Recuerdo. Qué celebridades formaron parte del In Memoriam,https://www.clarin.com/espectaculos/oscar-2021-que-celebridades-formaran-parte-del-in-memoriam-la-noche-de-la-premiacion_0_DXjBmRcSr.html,https://images.clarin.com/2021/04/24/kbkg6YnAY_720x0__1.jpg
50,0tPjHpd0x,Pandemia y crisis. Nueva encuesta de la consultora que mide para Máximo y Cristina Kirchner,https://www.clarin.com/politica/nueva-encuesta-consultora-mide-maximo-cristina-kirchner_0_0tPjHpd0x.html,https://images.clarin.com/2019/06/18/ttLkBGwld_720x0__1.jpg
51,3ivBeq7aM,"Humor político. Alberto, soldado heroico",https://www.clarin.com/opinion/alberto-soldado-heroico_0_3ivBeq7aM.html,https://images.clarin.com/2020/12/01/sdkqh6wWD_720x0__1.jpg
52,c0i_J8VrO,"Iniciativa polémica. Martín Soria busca destrabar la ley del Procurador, pero la oposición lo rechaza",https://www.clarin.com/politica/martin-soria-busca-destrabar-ley-procurador-oposicion-ratifica-rechazo_0_c0i_J8VrO.html,https://images.clarin.com/2021/03/15/HKmDPjesf_720x0__1.jpg
53,VgZkQ1_iw,"Plantón opositor. ""No seremos cómplices de la destrucción de la República""",https://www.clarin.com/politica/planton-juntos-cambio-martin-soria-complices-destruccion-republica-_0_VgZkQ1_iw.html,https://images.clarin.com/2021/03/30/FMConAGAk_720x0__1.jpg
54,XxLxp0MKW,Efectivo. Cajeros automáticos: en qué días y horarios hay que evitarlos y cuándo conviene ir,https://www.clarin.com/servicios/cajeros-automaticos-dias-horarios-evitarlos-conviene-ir_0_XxLxp0MKW.html,https://images.clarin.com/2020/03/28/r38Pt0duA_720x0__1.jpg
55,HevJh2fMV,Hot Sale 2021. Todo lo que se puede hacer hoy para no caer en trampas en dos semanas,https://www.clarin.com/servicios/hot-sale-2021-puede-hacer-hoy-caer-trampas-ofertas-enganosas-semanas_0_HevJh2fMV.html,https://images.clarin.com/2020/03/05/_a8tG3QD_720x0__1.jpg
56,wDkAxFbJh,"Amenaza viral. ""Quiero matar al presidente"", el video que escandaliza a Uruguay",https://www.clarin.com/ultimo-momento/-quiero-matar-presidente-video-escandaliza-uruguay-detuvieron-joven_0_wDkAxFbJh.html,https://images.clarin.com/2021/04/25/R-VEZ-DKs_720x0__1.jpg
57,awOxUXVen,"La Matanza. Es policía, trabaja como chofer de una app y mató a un delincuente",https://www.clarin.com/policiales/policia-trabaja-chofer-aplicacion-beat-mato-delincuente-quiso-robarle_0_awOxUXVen.html,https://images.clarin.com/2021/04/25/Of-G8PQF1_720x0__1.jpg
58,rsVCJt-7q,Los sueños de top ten de Lourdes Carlé. La promesa del tenis argentino que hizo una pausa para ir la universidad en EE.UU.,https://www.clarin.com/deportes/suenos-top-ten-lourdes-carle-promesa-tenis-argentino-hizo-pausa-ir-universidad-unidos_0_rsVCJt-7q.html,https://images.clarin.com/2021/04/16/Q5xXneMAG_720x0__1.jpg
59,KcqB_T6yZ,Vacunas contra el Covid. En las villas buscan puerta a puerta a las personas mayores para que reciban sus dosis,https://www.clarin.com/ciudades/vacunacion-covid-villas-buscan-puerta-puerta-personas-mayores-reciban-dosis_0_KcqB_T6yZ.html,https://images.clarin.com/2021/04/21/kulJRL3A0_720x0__1.jpg
60,R8ysXfthX,"Vacunación. El ""reparto equitativo"" no prioriza a provincias con más casos",https://www.clarin.com/sociedad/coronavirus-reparto-equitativo-vacunas-prioriza-provincias-casos_0_R8ysXfthX.html,https://images.clarin.com/2021/02/24/4Nw4damfm_720x0__1.jpg
61,9Qt96_4Kp,"Haciendo historia. Quién fue Saturnino Segurola, ""el gran vacunador""",https://www.clarin.com/viva/saturnino-segurola-gran-vacunador-_0_9Qt96_4Kp.html,https://images.clarin.com/2021/04/22/qD33h9_48_720x0__1.jpg
62,gJ9e0jLdC,Consultorio. Nueve consejos para padres con hijos adolescentes,https://www.clarin.com/viva/consejos-padres-hijos-adolescentes_0_gJ9e0jLdC.html,https://images.clarin.com/2017/01/16/SJObSOqIe_720x0.jpg
63,ll9HnpZ2h,Cáncer de mama. Identifican nuevos genes que controlan la agresividad de células tumorales mamarias,https://www.clarin.com/sociedad/identifican-nuevos-genes-controlan-agresividad-celulas-tumorales-mamarias_0_ll9HnpZ2h.html,https://images.clarin.com/2019/08/27/HrqVmhXu3_720x0__1.jpg
64,HClS5CSQF,Imperdible. Una web permite conocer los mejores castillos y palacios de España,https://www.clarin.com/viajes/imperdible-web-permite-conocer-mejores-castillos-palacios-espana_0_HClS5CSQF.html,https://images.clarin.com/2021/04/25/1Ri7oUyHc_720x0__1.jpg
65,agrjxU7CP,Estados Unidos. Los multimillonarios salarios de los CEO no bajan pese a la pandemia,https://www.clarin.com/mundo/multimillonarios-salarios-ganan-ceo-incluso-empresas-golpeadas-pandemia-coronavirus_0_agrjxU7CP.html,https://images.clarin.com/2021/04/25/gT_Bek2z3_1200x0__2.jpg#1619387617677
66,jLnLj2fHg,En el Monumental. San Lorenzo sorprendió a River y dejó la Zona 1 al rojo vivo,https://www.clarin.com/deportes/river-vs-san-lorenzo-copa-liga-profesional-horario-tv-formaciones_0_jLnLj2fHg.html,https://images.clarin.com/2021/04/25/cK2KGepAe_720x0__1.jpg
67,9CqM9dqqD,Mirá el video. El grosero error de Enzo Pérez que terminó en gol de San Lorenzo,https://www.clarin.com/deportes/grosero-error-enzo-perez-termino-gol-uvita-fernandez-san-lorenzo_0_9CqM9dqqD.html,https://images.clarin.com/2021/04/25/f3nNTLJO2_720x0__1.jpg
68,s11XZBzAo,El pibe de 41 . Torrico regresó tras un año sin atajar como si nunca se hubiera ido,https://www.clarin.com/deportes/pibe-41-ciclon-sebastian-torrico-regreso-ano-atajar-ido_0_s11XZBzAo.html,https://images.clarin.com/2021/04/25/Y_qiEqKfX_720x0__1.jpg
69,c-IoRaJyl,Gol de Cauteruccio. Estudiantes superó a Central en Rosario y quedó segundo en su grupo,https://www.clarin.com/deportes/rosario-central-vs-estudiantes-copa-liga-profesional-horario-tv-formaciones_0_c-IoRaJyl.html,https://images.clarin.com/2021/04/25/uVrnEqucn_1256x620__2.jpg#1619403776694
70,Rdq_C_M8E,"En Avellaneda. Con un grito en el descuento, Racing venció al puntero Colón y sueña",https://www.clarin.com/deportes/racing-vs-colon-copa-liga-profesional-gol-agonico-discutido-triunfo-academia_0_Rdq_C_M8E.html,https://images.clarin.com/2021/04/25/kqCTGCyUt_720x0__1.jpg
71,zwUZaCmlI,"En un partidazo. Con un triplete del uruguayo Santos, Talleres venció a Atlético Tucumán",https://www.clarin.com/deportes/atletico-tucuman-vs-talleres-copa-liga-profesional-horario-tv-formaciones_0_zwUZaCmlI.html,https://images.clarin.com/2021/04/25/i7hbf3Tto_720x0__1.jpg
72,EKuWD3p-g,"España. Barcelona sufrió, pero le ganó a Villarreal y sueña con la Liga",https://www.clarin.com/deportes/villarreal-vs-barcelona-laliga-santander-previa-alineaciones-directo_0_EKuWD3p-g.html,https://images.clarin.com/2021/04/25/l2babX2Wo_720x0__1.jpg
73,O9mxu9vWL,En Bilbao. Perdió el Atlético de Simeone y la liga de España tendrá una definición ajustada,https://www.clarin.com/deportes/athletic-bilbao-vs-atletico-madrid-laliga-espana-minuto-minuto-directo_0_O9mxu9vWL.html,https://images.clarin.com/2021/04/25/rbbgKulTx_1256x620__2.jpg#1619383327283
74,I5A_qxQ3m,ATP 500 de Barcelona. Nadal levantó un match point y le ganó una dura final a Tsitsipas,https://www.clarin.com/deportes/rafa-nadal-levanto-match-point-gano-batalla-horas-tsitsipas-campeon-atp-500-barcelona_0_I5A_qxQ3m.html,https://images.clarin.com/2021/04/25/9giGrtssY_1256x620__2.jpg#1619374173889
