n,id,title,url,image
1,FLRM-Rj1g,Clarín en España. Varados: cancelaron un vuelo sobre la hora y se repiten postales de una desesperación ya vivida,https://www.clarin.com/sociedad/argentinos-varados-espana-cancelaron-vuelo-hora-repiten-postales-desesperacion-vivida_0_FLRM-Rj1g.html,https://images.clarin.com/2021/06/18/hMvnegUPa_1256x620__2.jpg#1625060335667
2,kFzA7PqTE,Este jueves y viernes. Las empresas de salud suspenden por 48 horas la atención de casos no urgentes,https://www.clarin.com/sociedad/empresas-salud-suspenden-48-horas-atencion-casos-urgentes_0_kFzA7PqTE.html,https://images.clarin.com/2020/10/28/e7tG-RIyS_720x0__1.jpg
3,D3oC0_Tfi,"Plan de vacunación. El stock de dosis sin aplicar subió al doble: hay 4,5 millones en heladeras",https://www.clarin.com/sociedad/stock-vacunas-aplicar-subio-doble-junio-4-5-millones-heladeras-variante-delta-acecha_0_D3oC0_Tfi.html,https://images.clarin.com/2021/06/29/9xi_MfMIF_720x0__1.jpg
4,D8ZwTvh3Q,Turnos vacíos. En Provincia dicen que hay gente que solo va a vacunarse si está la que quiere,https://www.clarin.com/politica/coronavirus-funcionaria-kicillof-asegura-gente-solo-presenta-vacunarse-vacuna-prefiere_0_D8ZwTvh3Q.html,https://images.clarin.com/2021/05/15/dS_X-aU5L_1256x620__2.jpg#1625060345190
5,yUSWAf_h5,"Trastienda de su salida. Echaron a Sandra Russo de radio Del Plata: denunció censura y habló de una ""purga K""",https://www.clarin.com/politica/echaron-sandra-russo-radio-plata-denuncio-censura-hablo-purga-k-_0_yUSWAf_h5.html,https://images.clarin.com/2021/06/30/rwdjeHH8j_720x0__1.jpg
6,0ztzTBjX9,Será por 5 meses. Bono especial de $11.000: quiénes lo cobran y cómo recibir el beneficio,https://www.clarin.com/economia/bono-especial-11-000-cobran-recibir-beneficio_0_0ztzTBjX9.html,https://images.clarin.com/2020/12/03/GGCxPAO6I_720x0__1.jpg
7,NflmTlpa5,Cómo son las cuotas. Créditos para construir o mejorar la casa: cuánto prestan hoy los bancos,https://www.clarin.com/servicios/creditos-construir-mejorar-casa-prestan-bancos-cuotas_0_NflmTlpa5.html,https://images.clarin.com/2020/09/14/by8qfi6HW_720x0__1.jpg
8,MYid-vnsZ,Chubut. Asesinato en 40 segundos en un gimnasio: deudas y celos,https://www.clarin.com/policiales/asesinato-40-segundos-gimnasio-deudas-celos-balazos_0_MYid-vnsZ.html,https://images.clarin.com/2021/06/29/Vvn5EDfln_1256x620__2.jpg#1624996280667
9,Dmx_HH0bm,Mar del Plata. El hombre que murió en el vuelco de un micro había asesinado a un herrero y no fue preso,https://www.clarin.com/policiales/hombre-murio-vuelco-micro-chascomus-asesinado-herrero-mar-plata-ido-preso_0_Dmx_HH0bm.html,https://images.clarin.com/2014/09/01/SJXHL2O3Qg_720x0.jpg
10,vDGtV0s0H,"Coronavirus. Tras meses de mantenerlo en secreto, Putin reveló qué vacuna recibió",https://www.clarin.com/mundo/despues-meses-mantenerlo-secreto-vladimir-putin-revelo-vacuna-recibio_0_vDGtV0s0H.html,https://images.clarin.com/2021/03/22/h070FlG6J_720x0__1.jpg
11,nRwsX3vof,Luego de 4 días. Detuvieron a la mujer que provocó el accidente en el Tour de Francia,https://www.clarin.com/deportes/detuvieron-mujer-provoco-accidente-tour-francia_0_nRwsX3vof.html,https://images.clarin.com/2021/06/26/nhz2XEPvl_720x0__1.jpg
12,FLRM-Rj1g,Clarín en España. Varados: cancelaron un vuelo sobre la hora y se repiten postales de una desesperación ya vivida,https://www.clarin.com/sociedad/argentinos-varados-espana-cancelaron-vuelo-hora-repiten-postales-desesperacion-vivida_0_FLRM-Rj1g.html,https://images.clarin.com/2021/06/18/hMvnegUPa_1256x620__2.jpg#1625060335667
13,kFzA7PqTE,Este jueves y viernes. Las empresas de salud suspenden por 48 horas la atención de casos no urgentes,https://www.clarin.com/sociedad/empresas-salud-suspenden-48-horas-atencion-casos-urgentes_0_kFzA7PqTE.html,https://images.clarin.com/2020/10/28/e7tG-RIyS_720x0__1.jpg
14,D3oC0_Tfi,"Plan de vacunación. El stock de dosis sin aplicar subió al doble: hay 4,5 millones en heladeras",https://www.clarin.com/sociedad/stock-vacunas-aplicar-subio-doble-junio-4-5-millones-heladeras-variante-delta-acecha_0_D3oC0_Tfi.html,https://images.clarin.com/2021/06/29/9xi_MfMIF_720x0__1.jpg
15,D8ZwTvh3Q,Turnos vacíos. En Provincia dicen que hay gente que solo va a vacunarse si está la que quiere,https://www.clarin.com/politica/coronavirus-funcionaria-kicillof-asegura-gente-solo-presenta-vacunarse-vacuna-prefiere_0_D8ZwTvh3Q.html,https://images.clarin.com/2021/05/15/dS_X-aU5L_1256x620__2.jpg#1625060345190
16,yUSWAf_h5,"Trastienda de su salida. Echaron a Sandra Russo de radio Del Plata: denunció censura y habló de una ""purga K""",https://www.clarin.com/politica/echaron-sandra-russo-radio-plata-denuncio-censura-hablo-purga-k-_0_yUSWAf_h5.html,https://images.clarin.com/2021/06/30/rwdjeHH8j_720x0__1.jpg
17,0ztzTBjX9,Será por 5 meses. Bono especial de $11.000: quiénes lo cobran y cómo recibir el beneficio,https://www.clarin.com/economia/bono-especial-11-000-cobran-recibir-beneficio_0_0ztzTBjX9.html,https://images.clarin.com/2020/12/03/GGCxPAO6I_720x0__1.jpg
18,NflmTlpa5,Cómo son las cuotas. Créditos para construir o mejorar la casa: cuánto prestan hoy los bancos,https://www.clarin.com/servicios/creditos-construir-mejorar-casa-prestan-bancos-cuotas_0_NflmTlpa5.html,https://images.clarin.com/2020/09/14/by8qfi6HW_720x0__1.jpg
19,MYid-vnsZ,Chubut. Asesinato en 40 segundos en un gimnasio: deudas y celos,https://www.clarin.com/policiales/asesinato-40-segundos-gimnasio-deudas-celos-balazos_0_MYid-vnsZ.html,https://images.clarin.com/2021/06/29/Vvn5EDfln_1256x620__2.jpg#1624996280667
20,vPRBGpuru,"Mercado de pases. Bomba: Rafael Santos Borré, con un pie fuera de River y muy cerca de Alemania",https://www.clarin.com/deportes/bomba-river-rafael-santos-borre-pie-afuera-club_0_vPRBGpuru.html,https://images.clarin.com/2021/03/25/nKcxTYRl8_720x0__1.jpg
21,kHf0rUMCj,"Por las restricciones. Las duplas del beach volley, varadas en Chile tras lograr la plaza para Tokio",https://www.clarin.com/deportes/duplas-beach-volley-masculino-varadas-chile-conseguir-plaza-tokio_0_kHf0rUMCj.html,https://images.clarin.com/2021/06/27/Sid6jBLwZ_1256x620__3.jpg#1625077703480
22,H-liXZymz,"Vence el contrato. Messi y Barcelona: están cerca de acordar, pero Leo aún no dio el visto bueno",https://www.clarin.com/deportes/dia-limite-contrato-lionel-messi-barcelona-vence-miercoles-todavia-sabe-queda-va_0_H-liXZymz.html,https://images.clarin.com/2021/06/29/csDpjWRrB_720x0__1.jpg
23,5Ti7pbNdU,Día clave. El lacónico mensaje de Laporta sobre la continuidad de Messi,https://www.clarin.com/deportes/messi/messi-barcelona-contrato-laporta-vinculo_0_5Ti7pbNdU.html,https://images.clarin.com/2021/06/16/SpNx60eeo_720x0__1.jpg
24,9JqZJh6VH,Béisbol. De Versailles a los Estados Unidos: el pitcher que sueña con las grandes ligas,https://www.clarin.com/deportes/barrio-versailles-unidos-pitcher-suena-grandes-ligas-beisbol_0_9JqZJh6VH.html,https://images.clarin.com/2021/06/29/c6vK0y8Kh_720x0__1.jpg
25,8VxZF5IG3,Helmut Marko. El cerebro detrás de Red Bull que formó a Vettel y apostó por Verstappen,https://www.clarin.com/deportes/historia-helmut-marko-cerebro-detras-red-bull-formo-vettel-aposto-verstappen_0_8VxZF5IG3.html,https://images.clarin.com/2021/06/29/s9ka_DIKW_720x0__1.jpg
26,Pf3uAIyAM,Ante Atlético Tucumán. Los goles del primer amistoso de la pretemporada de Boca ,https://www.clarin.com/deportes/futbol/boca-juniors/goles-primer-amistoso-pretemporada-boca-frente-atletico-tucuman_0_Pf3uAIyAM.html,https://images.clarin.com/2021/06/30/JLDVEH3rH_720x0__1.jpg
27,jyTCcjXPX,Sebastian Korda. El pupilo de Agassi que no teme estar a la sombra de su padre y pisa fuerte,https://www.clarin.com/deportes/sebastian-korda-pupilo-agassi-teme-sombra-padre-pisa-fuerte-nextgen_0_jyTCcjXPX.html,https://images.clarin.com/2021/06/29/cWWe6jlWZ_1256x620__2.jpg#1624986801468
28,600DweJkg,Todos contra todos. Qué declararon los siete imputados por la muerte de Diego Maradona,https://www.clarin.com/policiales/declararon-imputados-muerte-maradona_0_600DweJkg.html,https://images.clarin.com/2021/06/30/m4RpkbmSD_720x0__1.jpg
29,hXo26IJuF,Coronavirus. Ciudad anunciará la inscripción para vacunar a mayores de 35 años,https://www.clarin.com/ciudades/gobierno-porteno-anunciara-fin-semana-inscripcion-vacunar-mayores-35-anos-coronavirus_0_hXo26IJuF.html,https://images.clarin.com/2021/06/18/9nCZkW1s__1256x620__2.jpg#1625068317078
30,na33Z6lsy,Temor y dudas. Brexit y desconcierto: ¿qué pasa con los europeos que viven en Gran Bretaña?,https://www.clarin.com/mundo/temor-desconcierto-nuevo-capitulo-brexit-pasa-europeos-viven-gran-bretana-_0_na33Z6lsy.html,https://images.clarin.com/2021/06/30/HvVIrtSba_720x0__1.jpg
31,xGrpRnNjg,"Mensaje desde Roma. El Papa les pidió a los empresarios ""no esconder la plata en paraísos fiscales""",https://www.clarin.com/politica/papa-pidio-empresarios-argentinos-esconder-plata-paraisos-fiscales-_0_xGrpRnNjg.html,https://images.clarin.com/2021/06/17/HxSNBOq6n_720x0__1.jpg
32,wgE7NejgY,¿Nuevo IFE?. Un director del Nación propone un pago de $8.500 para 9 millones de personas,https://www.clarin.com/politica/director-banco-nacion-propuso-alberto-fernandez-ingreso-universal-8-500-9-millones-personas_0_wgE7NejgY.html,https://images.clarin.com/2018/06/01/r1WKrfJeX_720x0__1.jpg
33,O8De_oaEU,"Por $ 150 millones. Multan a Edenor en medio del proceso de venta a Vila, Manzano y Filiberti",https://www.clarin.com/economia/multan-edenor-150-millones-medio-proceso-venta_0_O8De_oaEU.html,https://images.clarin.com/1969/12/31/rJXNlE_nQx_1256x620__1.jpg#1625061054334
34,P4iyMBj3C,Río Negro. ¿Traición en la Patagonia? Tensión y recelos entre Carreras y Weretilneck,https://www.clarin.com/politica/-traicion-patagonia-tension-recelos-gobernadora-arabela-carreras-ex-alberto-weretilneck_0_P4iyMBj3C.html,https://images.clarin.com/2019/03/23/p9ye5ufu1_720x0__1.jpg
35,KrGJqilcI,Patrocinado. El código secreto del éxito de un Partido Centenario,https://www.clarin.com/brandstudio/codigo-secreto-exito-partido-centenario_0_KrGJqilcI.html,https://images.clarin.com/2021/06/29/cQ-QHnltN_720x0__1.jpg
36,Wja0l1PiP,Psicología. Pandemia y hedonismo: resurge la búsqueda de placer aquí y ahora,https://www.clarin.com/buena-vida/pandemia-hedonismo-resurge-busqueda-placer-ahora_0_Wja0l1PiP.html,https://images.clarin.com/2021/06/29/ZksFP2wCd_720x0__1.jpg
37,6WE36IZ9sa,Nuevas restricciones. Los 7 consejos de Floxie para los argentinos varados en el exterior,https://www.clarin.com/viajes/7-consejos-floxie-argentinos-varados-exterior_0_6WE36IZ9sa.html,https://images.clarin.com/2021/06/29/HjQx1q0i3_720x0__1.jpg
38,N_qZc2_Bo,Salud. La insuficiencia cardíaca se asocia con más riesgo de cáncer: cómo prevenirla,https://www.clarin.com/buena-vida/insuficiencia-cardiaca-asocia-riesgo-cancer-prevenirla_0_N_qZc2_Bo.html,https://images.clarin.com/2021/06/28/tOc8-70Ta_720x0__1.jpg
39,SXFF8-7TX,Ya está operando. Enorme y futurista: así es el nuevo aeropuerto Tianfu en China,https://www.clarin.com/viajes/enorme-futurista-nuevo-aeropuerto-tianfu-china_0_SXFF8-7TX.html,https://images.clarin.com/2021/06/29/oy2pom9ie_720x0__1.jpg
40,NkbesR9ug,"Alimentación. ""Que no te tapen los ojos"": la campaña por el etiquetado frontal de alimentos",https://www.clarin.com/buena-vida/-tapen-ojos-campana-etiquetado-frontal-alimentos_0_NkbesR9ug.html,https://images.clarin.com/2021/06/30/PZAWzTEmu_1256x620__2.jpg#1625061360540
41,5k6L13Lo5,"En la Ciudad. Lucifer, Dios, Andrómeda: los nombres más insólitos de 2021",https://www.clarin.com/familias/lucifer-dios-andromeda-nombres-insolitos-2021_0_5k6L13Lo5.html,https://images.clarin.com/2021/06/17/sF8wF2S-R_720x0__1.jpg
42,Pym1bZuUK,Tránsitos planetarios. Neptuno retrógrado en Piscis: zambullirse en un mar de ilusiones,https://www.clarin.com/astrologia/neptuno-retrogrado-piscis-zambullirse-mar-ilusiones_0_Pym1bZuUK.html,https://images.clarin.com/2021/06/29/LDqipR5a5_720x0__1.jpg
43,EB5fB7P68,"Patrocinado. Corredores inmobiliarios, generando soluciones día a día",https://www.clarin.com/mercado-inmobiliario/corredores-inmobiliarios-generando-soluciones-dia-dia_0_EB5fB7P68.html,https://images.clarin.com/2021/06/29/O9m9eHiT-_720x0__1.jpg
44,rwW78npWa,"Furor en redes. Los memes de Julio Iglesias, los chistes virales de cada invierno",https://www.clarin.com/viste/memes-julio-iglesias-chistes-virales-invierno_0_rwW78npWa.html,https://images.clarin.com/2021/06/30/uuze6i3AX_720x0__1.jpg
45,I6CzokpbM,A principios de 1900. Vivió 23 años en cuarentena y desató una epidemia: la increíble y triste historia de Mary Mallon,https://www.clarin.com/internacional/vivio-23-anos-cuarentena-desato-epidemia-increible-triste-historia-mary-mallon_0_I6CzokpbM.html,https://images.clarin.com/2021/06/25/wyMe6mVZM_720x0__1.jpg
46,yUVzs2MOq,México. Detuvieron a la polémica youtuber YosStop por pornografía infantil,https://www.clarin.com/internacional/yosstop-polemica-youtuber-mexicana-detenida-pornografia-infantil_0_yUVzs2MOq.html,https://images.clarin.com/2021/06/30/O1iTg5ELS_720x0__1.jpg
47,MY5VLYyM6,Cómo sigue. El gran sueño de Vin Diesel para Rápidos y furiosos,https://www.clarin.com/espectaculos/cine/gran-sueno-vin-diesel-rapidos-furiosos_0_MY5VLYyM6.html,https://images.clarin.com/2021/06/24/qwlcn1O5QP_720x0__1.jpg
48,yb1A3evlx,Tenia 7 años. Un niño murió tras ser lanzado 27 veces al suelo en una clase de judo,https://www.clarin.com/viste/nene-7-anos-murio-lanzado-27-veces-suelo-clase-judo_0_yb1A3evlx.html,https://images.clarin.com/2021/06/30/6cfpanr5r_720x0__1.jpg
49,KjjeL49mE,Fabuloso. Los increíbles tatuajes 3D que parecen stickers a punto de despegarse,https://www.clarin.com/viste/increibles-tatuajes-3d-parecen-stickers-punto-despegarse_0_KjjeL49mE.html,https://images.clarin.com/2021/06/30/DkJZ2Q7iw_720x0__1.jpg
50,FGjCXUoZ5,"Gollan, contra los varados. ""Las decisiones de unos pocos no pueden afectar las libertades de millones""",https://www.clarin.com/politica/daniel-gollan-varados-decisiones-pocos-pueden-afectar-libertades-millones-_0_FGjCXUoZ5.html,https://images.clarin.com/2021/06/11/X5_ZPsYnP_720x0__1.jpg
51,L_YV5Ppf_,¿Plagio?. Embargan los derechos de Borges por un juicio a Kodama y la intiman a pagar 888 mil pesos,https://www.clarin.com/cultura/embargan-derechos-borges-juicio-maria-kodama-intiman-pagar-888-mil-pesos_0_L_YV5Ppf_.html,https://images.clarin.com/2019/11/26/TxiVm9PQ_1256x620__3.jpg#1625074161656
52,m6Mb6tIgp,Tensa entrevista. Novaresio cruzó al director del Incucai por las córneas que no llegaron al país,https://www.clarin.com/politica/fuerte-cruce-director-incucai-luis-novaresio-corneas-pudieron-llegar-pais-restriccion-vuelos_0_m6Mb6tIgp.html,https://images.clarin.com/2020/11/10/-MyO7NwqL_720x0__1.jpg
53,07HbH5lkv,Violencia de género. Anulan la condena a Bill Cosby por delitos sexuales y autorizan su liberación,https://www.clarin.com/espectaculos/corte-suprema-pensilvania-anulo-condena-delitos-sexuales-bill-cosby-autorizo-liberacion_0_07HbH5lkv.html,https://images.clarin.com/2021/06/30/5Bu5xR9U4_720x0__1.jpg
54,lvhMeYDVE,"Gestión bajo la lupa. Una encuesta, la sombra de Cristina y el escenario complejo para Alberto F.",https://www.clarin.com/politica/encuesta-sombra-cristina-kirchner-escenario-complejo-alberto-fernandez_0_lvhMeYDVE.html,https://images.clarin.com/2021/06/12/orAhLUYXw_720x0__1.jpg
55,tabeMQOCc,"Se ""autodestruyen"". WhatsApp ya permite enviar fotos y videos que solo se pueden ver una vez",https://www.clarin.com/tecnologia/mensajes-autodestruyen-whatsapp-permite-enviar-fotos-videos-solo-pueden-ver-vez_0_tabeMQOCc.html,https://images.clarin.com/2021/06/30/KyVcSrGmh_720x0__1.jpg
56,bMuweTN1e,"Emergencia Sanitaria. ""Usted se queda calladito"": la pelea en Diputados por los DNU del Presidente",https://www.clarin.com/politica/-callese-boca-pelea-gritos-diputados-decretos-alberto-fernandez-pandemia_0_bMuweTN1e.html,https://images.clarin.com/2021/06/30/71e7E5p9V_720x0__1.jpg
57,CQHTKhm3H,Fenómeno. Decenas de muertos por una ola de calor sin precedentes en Canadá,https://www.clarin.com/mundo/decenas-muertos-ola-calor-precedentes-canada-pasando-_0_CQHTKhm3H.html,https://images.clarin.com/2021/06/30/bS8v3ID4j_1256x620__2.jpg#1625061709953
58,kFeDF5Jo9,Exclusivo. Entrevista a Sophia Di Martino: la bisexualidad y ¿es Lady Loki?,https://www.clarin.com/espectaculos/cine/entrevista-exclusiva-sophia-di-martino--bisexualidad-lady-loki_0_kFeDF5Jo9.html,https://images.clarin.com/2021/06/29/L3xcLz4Je_720x0__1.jpg
59,dbxB0xkOk,"Aniversario. Cien años del Partido Comunista Chino: el gobierno promueve el ""turismo rojo""",https://www.clarin.com/mundo/100-anos-partido-comunista-china-gobierno-promueve-turismo-rojo-fiesta-completa_0_dbxB0xkOk.html,https://images.clarin.com/2021/06/29/Qc1z0co0P_1200x0__2.jpg#1624997812435
60,o774SZqHH,El manejo de la pandemia. Combinar vacunas y cepo a los vuelos: qué dice la OPS sobre estas dos medidas,https://www.clarin.com/sociedad/cepo-vuelos-combinacion-vacunas-dice-ops-medidas_0_o774SZqHH.html,https://images.clarin.com/2021/06/29/0k8PlEEhe_1256x620__2.jpg#1625074497670
61,xS78xKD3X,"De terror. Torturas, canibalismo y sexo incestuoso: la escalofriante historia de Barbora Skrlova",https://www.clarin.com/internacional/torturas-canibalismo-sexo-incestuoso-escalofriante-historia-barbora-skrlova_0_xS78xKD3X.html,https://images.clarin.com/2021/06/29/Ra5xJ6gJX_720x0__1.jpg
62,e8661TobF,Precaución. Los 5 alimentos más peligrosos para la salud que se siguen consumiendo,https://www.clarin.com/internacional/5-alimentos-peligrosos-salud-todavia-siguen-consumiendo_0_e8661TobF.html,https://images.clarin.com/1969/12/31/rJb2IU40ml_1256x620__1.jpg#1624991875393
63,bGWj-MJ8L,Comida de olla. Recetas de invierno: 26 platos para combatir la ola polar,https://www.clarin.com/gourmet/recetas-invierno-26-platos-combatir-ola-polar_0_bGWj-MJ8L.html,https://images.clarin.com/2018/04/05/ryBXF3QoG_1256x620__2.jpg#1625009301893
64,gqqNt_wlF,Aguinaldo. Cómo controlar que te lo hayan pagado bien,https://www.clarin.com/servicios/aguinaldo-controlar-pagado-bien_0_gqqNt_wlF.html,https://images.clarin.com/2021/04/26/tXo23ck9G_720x0__1.jpg
65,e3v81FmzN,Valuada en millones. Subastan la colección de autos clásicos de una fallecida estrella de rock,https://www.clarin.com/autos/subastan-coleccion-autos-clasicos-fallecida-estrella-rock_0_e3v81FmzN.html,https://images.clarin.com/2021/06/30/j9IUNKbzB_720x0__1.jpg
66,KCr9-ryda,"Tendencia. Llegó Meet, el primer Hard Seltzer de producción nacional",https://www.clarin.com/brandstudio/llego-meet-primer-hard-seltzer-produccion-nacional_0_KCr9-ryda.html,https://images.clarin.com/2021/06/24/sMNOFOBS7_720x0__1.jpg
