n,id,title,url,image
1,-U8x9B9w1,"Presupuesto . Luego del revés en el Congreso, Alberto F. convoca a una reunión en Olivos y prepara un decreto",https://www.clarin.com/politica/alberto-fernandez-prepara-decreto-renovar-presupuesto_0_-U8x9B9w1.html,https://images.clarin.com/2021/12/17/gcB_Neyd1_720x0__1.jpg
2,TtBNe-UsS,Congreso. Las dudas que surgen dentro del Frente de Todos tras perder la votación,https://www.clarin.com/politica/frente-dudas-surgen-dentro-bloque-luego-perder-votacion-presupuesto_0_TtBNe-UsS.html,https://images.clarin.com/2021/12/17/9pKCL3pcP_720x0__1.jpg
3,laqV55SLj,Contra la oposición. La provocación de Máximo que hizo caer la vuelta a comisión del Presupuesto,https://www.clarin.com/politica/provocacion-maximo-kirchner-hizo-caer-pase-comision-presupuesto-2022_0_laqV55SLj.html,https://images.clarin.com/2021/12/17/pE0-0KGVI_720x0__1.jpg
4,DEP0dF90u,Análisis. El Frente de Todos pudo ver las señales durante días y siguió avanzando hacia el abismo,https://www.clarin.com/politica/frente-pudo-ver-todas-senales-dias-eligio-seguir-avanzando-derrumbe_0_DEP0dF90u.html,https://images.clarin.com/2021/12/17/cwi4EoAvM_720x0__1.jpg
5,fjRkEezD1,Abrupto final. Máximo y su justificación tras el explosivo discurso que cambió el rumbo de la sesión,https://www.clarin.com/politica/desafiante-frase-maximo-kirchner-discurso-presupuesto-2022-quieren-patita-haga-muertito-pienso-dejar-domestiquen-_0_fjRkEezD1.html,https://images.clarin.com/2021/12/17/cwi4EoAvM_720x0__1.jpg
6,fnx9jbIfB,"Minuto a minuto de la sesión. De Milei a Fernando Iglesias: insultos, cruces y chicanas en un debate maratónico",https://www.clarin.com/politica/presupuesto-2022-vivo-minuto-minuto-debate-diputados_0_fnx9jbIfB.html,https://images.clarin.com/2021/12/17/ONCP906uh_720x0__1.jpg
7,WTd00MWlf,Anticuerpos neutralizantes. Vacuna Sputnik: Rusia recomienda el refuerzo y dice que protege frente a Ómicron,https://www.clarin.com/sociedad/rusia-asegura-sputnik-v-efectiva-frente-variante-omicron_0_WTd00MWlf.html,https://images.clarin.com/2021/08/31/GrqWjmkak_1256x620__4.jpg#1639755983028
8,AIMh-0Ah8,Especial Clarín. A 20 años del 2001: la intimidad del estallido en los días del país roto,https://www.clarin.com/politica/20-anos-2001-intimidad-dias-pais-roto_0_AIMh-0Ah8.html,https://images.clarin.com/2021/12/14/zePsO1lwJ_720x0__1.jpg
9,k2A5EC2qF,Mercado cambiario. El dólar blue vuelve a subir y pasa la barrera de los $ 200,https://www.clarin.com/economia/dolar-blue-vuelve-subir-pasa-barrera-200_0_k2A5EC2qF.html,https://images.clarin.com/2021/10/04/sLkfwJt2C_720x0__1.jpg
10,5oWRvuXJS,Crisis sanitaria. Fiestas y Covid: por qué la OMS pide hacer algo que está prohibido en Argentina,https://www.clarin.com/sociedad/fiestas-covid-oms-pide-hacer-prohibido-argentina_0_5oWRvuXJS.html,https://images.clarin.com/2020/12/17/xgD_3z2Hy_720x0__1.jpg
11,_L7y8vWT8,"El descubridor del Kun. ""Motoneta"" González recuerda los orígenes de Agüero: ""Fui el rey de los boludos""",https://www.clarin.com/deportes/eduardo-motoneta-gonzalez-recuerda-origenes-sergio-aguero-razon-jose-maria-aguilar-rey-boludos-_0__L7y8vWT8.html,https://images.clarin.com/2021/12/16/nHsUjeC0-_720x0__1.jpg
12,75FrosUt6,Tenso momento en Ezeiza. Pasajeros vacunados con Sputnik tuvieron problemas para tomar un vuelo a Brasil,https://www.clarin.com/sociedad/gritos-empujones-ezeiza-pasajeros-vacunados-sputnik-v-problemas-tomar-vuelo-brasil_0_75FrosUt6.html,https://images.clarin.com/2021/12/17/yTwAEa65y_720x0__1.jpg
13,0dU9sjJmI,Informe especial. Cómo será la F1 de 2022: los cambios reglamentarios para que sea más pareja,https://www.clarin.com/deportes/formula-1-cambios-reglamento-2022-mejorar-competitividad_0_0dU9sjJmI.html,https://images.clarin.com/2021/12/16/iSk-h6TqB_1256x620__2.jpg#1639696110378
14,ObGVRG8Z7,"Signos de asfixia. Hallan muerto a un jubilado y sospechan que lo mataron en una ""escena sexual""",https://www.clarin.com/policiales/encuentran-jubilado-muerto-asfixia-sospechan-mataron-escena-sexual-_0_ObGVRG8Z7.html,https://images.clarin.com/2021/08/19/WI-4IF_vC_720x0__1.jpg
15,z0tInYlSs,Defraudación . La contradicción más visible del fallo por Oil: condenas distintas para mismo delito,https://www.clarin.com/politica/contradiccion-visible-fallo-caso-oil-condenas-distintas-mismo-delito_0_z0tInYlSs.html,https://images.clarin.com/2021/12/16/l-vCL5PCq_720x0__1.jpg
16,bUjWlNbDV,Juicio en EE.UU.. Bonistas contra Kicillof: demandan a la Provincia en Nueva York por no pagar ,https://www.clarin.com/economia/bonistas-axel-kicillof-demandan-ee-uu-provincia-buenos-aires-pagar-deuda_0_bUjWlNbDV.html,https://images.clarin.com/2021/12/09/Zn_E9wb5E_720x0__1.jpg
17,J4-7xVulm,Un regreso esperado. Nadal perdió con Murray en su vuelta a las canchas después de cuatro meses,https://www.clarin.com/deportes/rafael-nadal-choca-andy-murray-vuelta-canchas-despues-meses_0_J4-7xVulm.html,https://images.clarin.com/2021/12/17/p5eYpsoHe_720x0__1.jpg
18,kgDal-6Vh,"Los momentos decisivos. El final del gobierno de De la Rúa: la ley Banelco, el corralito y el presidente empastillado",https://www.clarin.com/politica/ley-banelco-corralito-presidente-empastillado_0_kgDal-6Vh.html,https://images.clarin.com/2021/12/15/FJ_dzNAmT_720x0__1.jpg
19,lrKU93pR9,Golpe de suerte. Le dio su CV a Wanda Nara en un evento y ahora trabajará en su nuevo local,https://www.clarin.com/fama/mujer-dio-curriculum-wanda-nara-evento-llamaron-trabajar-nuevo-local-_0_lrKU93pR9.html,https://images.clarin.com/2021/12/17/E7SI23G5__720x0__1.jpg
20,oVnvZ5GDE,Ranking. Los mejores vinos argentinos de 2021: el top 100 del crítico James Suckling,https://www.clarin.com/gourmet/mejores-vinos-argentinos-2021-top-100-critico-james-suckling_0_oVnvZ5GDE.html,https://images.clarin.com/2021/12/17/kKGZL4krF_720x0__1.jpg
21,fFOci32dm,Nueva energías. El mineral del futuro: por qué la batalla mundial por el litio se juega en Bolivia,https://www.clarin.com/mundo/mineral-futuro-batalla-mundial-litio-juega-bolivia_0_fFOci32dm.html,https://images.clarin.com/2021/12/17/o8cvFAmBr_720x0__1.jpg
22,pKRuJrxRk,Por los casos y los viajes. Crecen las colas para testearse y la Ciudad abrirá dos nuevos centros,https://www.clarin.com/ciudades/colas-testearse-ciudad-hacen-17-000-dia-cifra-crece-aumento-casos-viajes_0_pKRuJrxRk.html,https://images.clarin.com/2021/12/17/DqQnKtSsp_1256x620__2.jpg#1639751305063
23,L4Xs-PTDN,"Ránking de inmuebles. Las propiedades más curiosas, pequeñas, grandes y antiguas de la Ciudad",https://www.clarin.com/economia/ranking-inmuebles-propiedades-curiosas-pequenas-llamativas-ciudad_0_L4Xs-PTDN.html,https://images.clarin.com/2021/12/17/kYXwJYpxI_720x0__1.jpg
24,VsO45m84n,Ley de Minería. Más incidentes en Chubut: prendieron fuego la Casa de Gobierno,https://www.clarin.com/sociedad/promulgaron-ley-mineria-incidentes-rawson_0_VsO45m84n.html,https://images.clarin.com/2021/12/16/dDlK0nCIO_1256x620__2.jpg#1639688952128
25,a9_kzTUg4,Ex productor de Hollywood. ¿De la cárcel a la calle?: Harvey Weinstein podría salir en libertad en pocos meses,https://www.clarin.com/espectaculos/-carcel-calle-harvey-weinstein-podria-salir-libertad-pocos-meses_0_a9_kzTUg4.html,https://images.clarin.com/2021/07/29/scwu_TMVX_720x0__1.jpg
26,R5D44w0R5,"Mano a mano con Clarín. Jeta Castagnola, el nuevo crack del polo: ""No me gusta que me comparen con Cambiaso""",https://www.clarin.com/deportes/jeta-castagnola-nuevo-crack-polo-idea-records-gusta-comparen-cambiaso-_0_R5D44w0R5.html,https://images.clarin.com/2021/12/16/mn0AINDjF_720x0__1.jpg
27,pTZCHZKDF,Una obra que sorprende. Colegiales: denunciaron una demolición y construían un templo,https://www.clarin.com/ciudades/obra-sorprende-colegiales-denunciaron-demolicion-construian-templo_0_pTZCHZKDF.html,https://images.clarin.com/2021/12/16/dGnJVMy_i_1256x620__2.jpg#1639693363230
28,eJqRjpiL1U,Resumen. Las 50 fotos de paisajes más destacadas del 2021,https://www.clarin.com/fotogalerias/fotos-paisajes-destacadas-2021_5_eJqRjpiL1U.html,
29,-U8x9B9w1,"Presupuesto . Luego del revés en el Congreso, Alberto F. convoca a una reunión en Olivos y prepara un decreto",https://www.clarin.com/politica/alberto-fernandez-prepara-decreto-renovar-presupuesto_0_-U8x9B9w1.html,https://images.clarin.com/2021/12/17/gcB_Neyd1_720x0__1.jpg
30,TtBNe-UsS,Congreso. Las dudas que surgen dentro del Frente de Todos tras perder la votación,https://www.clarin.com/politica/frente-dudas-surgen-dentro-bloque-luego-perder-votacion-presupuesto_0_TtBNe-UsS.html,https://images.clarin.com/2021/12/17/9pKCL3pcP_720x0__1.jpg
31,laqV55SLj,Contra la oposición. La provocación de Máximo que hizo caer la vuelta a comisión del Presupuesto,https://www.clarin.com/politica/provocacion-maximo-kirchner-hizo-caer-pase-comision-presupuesto-2022_0_laqV55SLj.html,https://images.clarin.com/2021/12/17/pE0-0KGVI_720x0__1.jpg
32,DEP0dF90u,Análisis. El Frente de Todos pudo ver las señales durante días y siguió avanzando hacia el abismo,https://www.clarin.com/politica/frente-pudo-ver-todas-senales-dias-eligio-seguir-avanzando-derrumbe_0_DEP0dF90u.html,https://images.clarin.com/2021/12/17/cwi4EoAvM_720x0__1.jpg
33,fjRkEezD1,Abrupto final. Máximo y su justificación tras el explosivo discurso que cambió el rumbo de la sesión,https://www.clarin.com/politica/desafiante-frase-maximo-kirchner-discurso-presupuesto-2022-quieren-patita-haga-muertito-pienso-dejar-domestiquen-_0_fjRkEezD1.html,https://images.clarin.com/2021/12/17/cwi4EoAvM_720x0__1.jpg
34,fnx9jbIfB,"Minuto a minuto de la sesión. De Milei a Fernando Iglesias: insultos, cruces y chicanas en un debate maratónico",https://www.clarin.com/politica/presupuesto-2022-vivo-minuto-minuto-debate-diputados_0_fnx9jbIfB.html,https://images.clarin.com/2021/12/17/ONCP906uh_720x0__1.jpg
35,WTd00MWlf,Anticuerpos neutralizantes. Vacuna Sputnik: Rusia recomienda el refuerzo y dice que protege frente a Ómicron,https://www.clarin.com/sociedad/rusia-asegura-sputnik-v-efectiva-frente-variante-omicron_0_WTd00MWlf.html,https://images.clarin.com/2021/08/31/GrqWjmkak_1256x620__4.jpg#1639755983028
36,GJwqqTA6p,Tácticas de ahorro. Canasta navideña: 5 claves para armar la mesa de las Fiestas sin gastar una fortuna en el súper,https://www.clarin.com/servicios/canasta-navidena-5-claves-armar-mesa-fiestas-gastar-fortuna-super_0_GJwqqTA6p.html,https://images.clarin.com/2021/12/16/9Z7yKQpjl_720x0__1.jpg
37,PUAovSe1t,"Negociación de la deuda. FMI: no hay fecha para un acuerdo ni para una misión, dicen desde Washington",https://www.clarin.com/economia/fmi-reconocio-fecha-acuerdo-argentina-mision_0_PUAovSe1t.html,https://images.clarin.com/2021/02/04/R17VJZQD__720x0__1.jpg
38,ylqwcZ5JX,"""Volúmenes de equilibrio"". El Gobierno creó un sistema para controlar las exportaciones de maíz y trigo",https://www.clarin.com/rural/gobierno-creo-sistema-controlar-exportaciones-maiz-trigo_0_ylqwcZ5JX.html,https://images.clarin.com/2021/12/17/GdoeCBZno_720x0__1.jpg
39,Fmwq06Qtv,La maquinita no para. El Banco Central le transfirió $ 250 mil millones al Tesoro en una semana,https://www.clarin.com/economia/bcra-transfirio-250-mil-millones-tesoro-semana_0_Fmwq06Qtv.html,https://images.clarin.com/2020/11/14/e4cPLZ8du_720x0__1.jpg
40,L5UKn53t8,Autos. Un argentino manejará la estrategia de Volkswagen en América latina,https://www.clarin.com/economia/argentino-manejara-estrategia-volkswagen-america-latina_0_L5UKn53t8.html,https://images.clarin.com/2020/10/15/5_btXT7h2_720x0__1.jpg
41,mFUQDOQkR,Impuestos. AFIP extiende beneficios a monotributistas,https://www.clarin.com/economia/afip-extiende-beneficios-monotributistas_0_mFUQDOQkR.html,https://images.clarin.com/2021/11/17/0T0_qdwPh_720x0__1.jpg
42,hX7LQtlrh,Asado gourmet en Villa Crespo. Una parrilla tradicional que apuesta a la renovación y la alta calidad,https://www.clarin.com/gourmet/parrilla-tradicional-villa-crespo-apuesta-renovacion-alta-calidad_0_hX7LQtlrh.html,https://images.clarin.com/2021/12/15/BbaCYS_ng_720x0__1.jpg
43,nuXsmDVR8,Día nacional. Esclerosis Múltiple: ¿qué se necesita para llegar a un diagnóstico oportuno?,https://www.clarin.com/buena-vida/esclerosis-multiple-necesita-llegar-diagnostico-oportuno-prevenir-secuelas-_0_nuXsmDVR8.html,https://images.clarin.com/2021/12/16/ydVtlfL0e_720x0__1.jpg
44,CKOzuQbnF,Aplicaciones. WhatsApp: 7 trucos y funciones secretas para aprovechar la app al máximo,https://www.clarin.com/tecnologia/whatsapp-7-trucos-funciones-secretas-aprovechar-app-maximo_0_CKOzuQbnF.html,https://images.clarin.com/2021/05/25/hpiXgIxU4_720x0__1.jpg
45,4LcvFmO1G,En verano. Astroturismo: cita bajo las estrellas en la laguna de Lobos,https://www.clarin.com/viajes/astroturismo-cita-estrellas-laguna-lobos_0_4LcvFmO1G.html,https://images.clarin.com/2021/04/23/w1h88xYSr_720x0__1.jpg
46,LsDZon62W,Test drive. DS 7 Crossback E-Tense: el 4x4 con tres motores y autonomía eléctrica,https://www.clarin.com/autos/ds-7-crossback-tense-anda-4x4-motores-autonomia-electrica_0_LsDZon62W.html,https://images.clarin.com/2021/12/15/NEZPCsHGb_720x0__1.jpg
47,jI2lC3BBn,¿Estás quemado?. Los riesgos de responder un mail fuera de tu horario laboral,https://www.clarin.com/buena-vida/riesgos-responder-mail-horario-laboral_0_jI2lC3BBn.html,https://images.clarin.com/2020/10/22/e7eowoBHn_1256x620__2.jpg#1639673189910
48,3N9XWgVMd,"El crimen de Sydney Loofe. Fue a una cita de Tinder, cayó en un culto sexual y apareció en 14 pedazos",https://www.clarin.com/internacional/cita-tinder-cayo-culto-sexual-aparecio-14-pedazos-crimen-sydney-loofe_0_3N9XWgVMd.html,https://images.clarin.com/2021/12/14/rkF75zkWd_720x0__1.jpg
49,mZWXBcL4A,Poldy Bird. La trágica vida de la escritora que hizo llorar a varias generaciones,https://www.clarin.com/cultura/-va-probar-dios-tragica-vida-poldy-bird-escritora-hizo-llorar-varias-generaciones_0_mZWXBcL4A.html,https://images.clarin.com/2018/12/27/i-zhkZQiO_1256x620__2.jpg#1639661653834
50,kPvjqDQXf,Impactante. Aseguran que una persona que nace en verano vive menos que una nacida en invierno,https://www.clarin.com/internacional/aseguran-persona-nace-verano-vive-nacida-invierno_0_kPvjqDQXf.html,https://images.clarin.com/2021/12/14/wQ1eUk1vg_720x0__1.jpg
51,kHY5y1WIP,Vibración numérica anual. Numerología 2022: predicciones para el año que comienza y vibra en 6,https://www.clarin.com/astrologia/numerologia-2022-predicciones-ano-comienza-vibra-6_0_kHY5y1WIP.html,https://images.clarin.com/2021/12/15/AOImRPgKB_720x0__1.jpg
52,cSGRQM9w0,"Lunaciones. Calendario lunar 2022: todas las fases, eclipses y signos",https://www.clarin.com/astrologia/calendario-lunar-2022-todas-fases-eclipses-signos_0_cSGRQM9w0.html,https://images.clarin.com/2021/12/14/SfvtY9B8W_720x0__1.jpg
53,j7QTv9Wya,En la Ciudad. Nombres de nena: los más populares de 2021,https://www.clarin.com/familias/nombres-nena-populares-2021_0_j7QTv9Wya.html,https://images.clarin.com/2021/12/06/kg01NLSd7_720x0__1.jpg
54,k1afA_tuz,"Agricultura sustentable. Dos Eikon de Oro para Syngenta por TerraBio, su miniserie web",https://www.clarin.com/brandstudio/eikon-oro-syngenta-terrabio-miniserie-web_0_k1afA_tuz.html,https://images.clarin.com/2021/12/10/0WX_XZppk_720x0__1.jpg
55,brZAME4S8,"Estatuilla de plata. Influencers, la campaña de Supervielle, nuevamente premiada",https://www.clarin.com/brandstudio/influencers-campana-supervielle-nuevamente-premiada_0_brZAME4S8.html,https://images.clarin.com/2021/12/10/il9WQI3Fc_720x0__1.jpg
56,QRInrDIIL,Ayuda y capacitación. Eikon de Oro en la categoría Sustentabilidad Social para Coca-Cola,https://www.clarin.com/brandstudio/eikon-oro-categoria-sustentabilidad-social-coca-cola_0_QRInrDIIL.html,https://images.clarin.com/2021/12/10/FuzjeB_YQ_720x0__1.jpg
57,H08uExjw1,Los mejores proyectos. YPF recibe dos premios Eikon por sus campañas que entrelazan a la compañía y sus empleados,https://www.clarin.com/brandstudio/ypf-recibe-premios-eikon-campanas-entrelazan-vida-compania-empleados-pais_0_H08uExjw1.html,https://images.clarin.com/2021/12/09/kdznzQ0-r_720x0__1.jpg
58,oSoNiQsG7,Noche de galardones. El sector de la comunicación se reencontró en los Eikon 2021,https://www.clarin.com/brandstudio/sector-comunicacion-reencontro-eikon-2021_0_oSoNiQsG7.html,https://images.clarin.com/2021/12/09/qcIWcmllT_720x0__1.jpg
59,_sMqtMHVt-,Proyecto único. Una caja negra para registrar el apocalipsis climático,https://www.clarin.com/new-york-times-international-weekly/caja-negra-registrar-apocalipsis-climatico_0__sMqtMHVt-.html,https://images.clarin.com/2021/12/16/wNnn17dD-_720x0__1.jpg
60,XJk2cqbVI,Polémica científica. Los médicos suelen recetar placebos. ¿Pero qué tan bien funcionan?,https://www.clarin.com/new-york-times-international-weekly/medicos-suelen-recetar-placebos-bien-funcionan-_0_XJk2cqbVI.html,https://images.clarin.com/2021/12/16/JbU60tiF3_1256x620__2.jpg#1639679063855
61,ZqCB20mYV,"Intérprete. A todos lados, siempre con su arpa",https://www.clarin.com/new-york-times-international-weekly/lados-siempre-arpa_0_ZqCB20mYV.html,https://images.clarin.com/2021/12/16/tFx29-Pfr_1256x620__2.jpg#1639680450325
62,RqfwJNvPh,Tratamiento. Un replanteo en la atención del cáncer de próstata,https://www.clarin.com/new-york-times-international-weekly/replanteo-atencion-cancer-prostata_0_RqfwJNvPh.html,https://images.clarin.com/2021/12/16/d6QxZPg3m_1256x620__2.jpg#1639675172652
63,kmKNyFRjD,"Rehabilitación. Cómo está ""Coco"", el mono que vivía atado de pie y manos en una casa donde hacían fiestas",https://www.clarin.com/zonales/rehabilitacion-coco-mono-rescatado-departamento-hacian-fiestas-clandestinas-vivia-atado-pies-manos-_0_kmKNyFRjD.html,https://images.clarin.com/2021/12/09/ZdsmjioWE_720x0__1.jpg
64,fbPmQP3Lf,"Femicida de las 113 puñaladas. Fabián Tablado, otra vez libre: sólo pasó un año en la cárcel tras su última condena",https://www.clarin.com/zonales/fabian-tablado-vuelve-recuperar-libertad-pasar-ano-encarcelado-ultima-condena_0_fbPmQP3Lf.html,https://images.clarin.com/2020/02/28/pPI6MDlE_720x0__1.jpg
65,QA6yWqh7O,Moroso con plata. Le retuvieron el Audi porque debía $ 1 millón de patentes: pagó la mitad en el momento,https://www.clarin.com/zonales/retuvieron-audi-control-debia-1-millon-patentes-sacaran-pago-mitad-momento_0_QA6yWqh7O.html,https://images.clarin.com/2021/12/10/2tmsGp6xQ_720x0__1.jpg
66,422a7Jrw2, Aaron Armeya. El joven trans que protagoniza un elogiado documental de identidad de género,https://www.clarin.com/zonales/historia-aaron-armeya-joven-trans-protagoniza-elogiado-documental-identidad-genero_0_422a7Jrw2.html,https://images.clarin.com/2021/12/06/IFiKm1GrJ_1256x620__2.jpg#1638822112168
67,p_IWs0Hwy,"Giro rotundo. Ivo Cutzarida se alejó de la actuación, estudió y cambió su vida por completo: ""Me recibí""",https://www.clarin.com/fama/ivo-cutzarida-aleja-actuacion-apuesta-nueva-profesion-recibi-despues-4-anos-_0_p_IWs0Hwy.html,https://images.clarin.com/2021/12/17/27SUwO_Du_720x0__1.jpg
68,lMf0fLV7R,Tras su descargo público. Verónica Lozano destrozó a Fabián Gianola por un particular detalle del video que grabó,https://www.clarin.com/fama/veronica-lozano-destrozo-fabian-gianola-descargo-publico-obsceno-_0_lMf0fLV7R.html,https://images.clarin.com/2021/12/16/A-oIL3skx_720x0__1.jpg
69,7ZUG8HveP,La historia de Momi Giardina. Dejó de ser bailarina de Tinelli para cumplir un sueño y hoy vive su mejor momento,https://www.clarin.com/fama/dejo-bailarina-showmatch-cumplir-sueno-hoy-vive-mejor-momento-historia-momi-giardina_0_7ZUG8HveP.html,https://images.clarin.com/2021/12/17/x1Ej9DHyI_720x0__1.jpg
70,SpysyVLQU,Ocho meses después. Horacio Cabak contó su verdad sobre el escándalo con Jujuy Jiménez,https://www.clarin.com/fama/horacio-cabak-volvio-hablar-conflicto-sofia-jujuy-jimenez-comparo-antonio-laje_0_SpysyVLQU.html,https://images.clarin.com/2021/12/17/XnDFlcUFf_720x0__1.jpg
71,1WHHSWbks,La pandemia. Ómicron: la OMS recibió datos de una alarmante caída en la eficacia de las vacunas,https://www.clarin.com/sociedad/omicron-oms-recibio-datos-alarmante-caida-eficacia-vacunas_0_1WHHSWbks.html,https://images.clarin.com/2021/12/15/z0KFAeLa7_720x0__1.jpg
72,a4DyOdsYA,Antes de Navidad. Rebajas y cuotas en jugueterías: promos para ahorrar hasta 40%,https://www.clarin.com/servicios/rebajas-cuotas-jugueterias-promos-ahorrar-40-navidad_0_a4DyOdsYA.html,https://images.clarin.com/2021/12/15/NyM8O4wyN_720x0__1.jpg
73,bMUieJR8g,Spam telefónico. Cómo dejar de recibir llamados comerciales y qué hacer si no se cumple,https://www.clarin.com/servicios/dejar-recibir-llamados-comerciales-molestos-hacer-cumple_0_bMUieJR8g.html,https://images.clarin.com/2021/12/15/oVddIB61A_720x0__1.jpg
74,bM7J8M_TO,Segunda vuelta presidencial. Sondeos dan empate exacto en Chile y crece el temor a una definición en la Justicia,https://www.clarin.com/mundo/balotaje-chile-2021-sondeos-dan-empate-exacto-crece-temor-definicion-justicia_0_bM7J8M_TO.html,https://images.clarin.com/2021/12/16/k-Wzz9363_1256x620__2.jpg#1639664658774
75,1-2Ya59-w,Movilidad en auge. Cuánto cuesta asegurar una bicicleta: 5 opciones que arrancan desde $ 71,https://www.clarin.com/servicios/cuesta-asegurar-bicicleta-5-opciones-arrancan-71_0_1-2Ya59-w.html,https://images.clarin.com/2021/08/25/3x3MB2ntt_720x0__1.jpg
76,9KZn_RIDy,Península Mitre. El último lugar de la Argentina que se salva del cambio climático,https://www.clarin.com/especiales/ultimo-lugar-argentina-salva-cambio-climatico_0_9KZn_RIDy.html,https://images.clarin.com/2021/12/09/MXDJDgPHP_720x0__1.jpg
77,CpUhuSgLk,Pasión en miniatura. Autitos de colección: un juego que no es de niños y mueve millones,https://www.clarin.com/autos/autitos-coleccion-juego-ninos-mueve-millones_0_CpUhuSgLk.html,https://images.clarin.com/2021/12/03/clFAGxjmh_720x0__1.jpg
78,YvuxFVzwz,Ruta internacional. Dónde van los relojes de alta gama robados en Argentina,https://www.clarin.com/policiales/van-relojes-alta-gama-robados-argentina_0_YvuxFVzwz.html,https://images.clarin.com/2021/12/02/orU-T-sim_720x0__1.jpg
79,10RDfpYkp,"Especial Clarín. Viaje a la ""fábrica"" del cannabis: cómo se produce el aceite en el primer laboratorio industrial del país",https://www.clarin.com/sociedad/viaje-fabrica-cannabis-produce-aceite-primer-laboratorio-industrial-pais_0_10RDfpYkp.html,https://images.clarin.com/2021/11/23/_jEGmHUd-_720x0__1.jpg
80,6TXrTul0R,"Así fue la gala de la FIA. Un premio para Pechito, el recuerdo de Reutemann y la ausencia de Hamilton",https://www.clarin.com/deportes/premio-pechito-lopez-recuerdo-carlos-reutemann-ausencia-hamilton-gala-fia_0_6TXrTul0R.html,https://images.clarin.com/2021/12/16/aMe9lXkW2_1256x620__2.jpg#1639698429771
81,6CcG_7C94,"Sigue la polémica. Con una carta a Chiqui Tapia, Ferro pide volver a jugar el partido contra Quilmes",https://www.clarin.com/deportes/carta-chiqui-tapia-ferro-pide-volver-jugar-partido-quilmes_0_6CcG_7C94.html,https://images.clarin.com/2021/12/17/NimBNJuFc_720x0__1.jpg
82,Dh9NJvCeP,Problemas para San Lorenzo. Tras la intimación de Jalil Elías varios futbolistas podrían seguir sus pasos,https://www.clarin.com/deportes/problemas-san-lorenzo-intimacion-jalil-elias-varios-futbolistas-podrian-seguir-pasos_0_Dh9NJvCeP.html,https://images.clarin.com/2021/12/17/09e3BA1jK_1256x620__2.jpg#1639752988800
83,nB9JM97cQ,Milagroso regreso. Tiger Woods vuelve a jugar a 10 meses del accidente: lo hará con su hijo de 12 años,https://www.clarin.com/deportes/tiger-woods-vuelve-jugar-10-meses-accidente-hara-hijo-12-anos-exhibicion_0_nB9JM97cQ.html,https://images.clarin.com/2021/12/17/Y2LJcaEcj_720x0__1.jpg
84,OqbUOlho6,"Ante una multitud. La Reserva de Boca gritó campeón: goleada, rabona de Barco y clima de fiesta",https://www.clarin.com/deportes/reserva-boca-grito-campeon-goleada-rabona-barco-clima-fiesta-multitud_0_OqbUOlho6.html,https://images.clarin.com/2021/12/17/UjXa694Qd_1256x620__2.jpg#1639746004668
85,vWATuBJNz,"Fórmula 1. Los diez mejores momentos de la temporada, más allá de Verstappen-Hamilton",https://www.clarin.com/deportes/formula-1-mejores-momentos-temporada-alla-duelo-verstappen-hamilton_0_vWATuBJNz.html,https://images.clarin.com/2021/12/14/PSXUMktfE_1256x620__2.jpg#1639510579042
