n,id,title,url,image
93,sTUO2XMTc,Desastre ecológico. Las aves sufren una extinción milenaria por culpa de los humanos,https://www.clarin.com/viste/aves-sufren-extincion-milenaria-culpa-humanos_0_sTUO2XMTc.html,https://images.clarin.com/2021/03/13/d7q712DT5P_720x0__1.jpg
94,ld0_JcY85,"Estación Espacial. Un raro organismo: no tiene boca, patas ni cerebro, pero se mueve y come",https://www.clarin.com/viste/raro-organismo-estacion-espacial-boca-patas-cerebro-mueve-come_0_ld0_JcY85.html,https://images.clarin.com/2019/10/17/I0glr99R_720x0__1.jpg
95,KrjyvJkDU,"Violencia doméstica en Gran Bretaña. Pidió ayuda por un año, pero al final su novio la mató",https://www.clarin.com/new-york-times-international-weekly/pidio-ayuda-ano-final-mato_0_KrjyvJkDU.html,https://images.clarin.com/2021/08/11/js0Ao0K5O_1256x620__2.jpg#1628711898157
96,RyRbeF6Mw,Covid-19.  Los ancianos pueden tener síntomas fáciles de confundir con otras enfermedades,https://www.clarin.com/new-york-times-international-weekly/covid-19-ancianos-pueden-tener-sintomas-confusos_0_RyRbeF6Mw.html,https://images.clarin.com/2021/08/11/Mot2cvjtV_1256x620__3.jpg#1628690392385
97,uHbe3hVGU,Opinión. Las cosas que la tecnología no puede arreglar,https://www.clarin.com/new-york-times-international-weekly/cosas-tecnologia-puede-arreglar_0_uHbe3hVGU.html,https://images.clarin.com/2021/08/11/1tOSB1gO8_1256x620__2.jpg#1628693445452
98,YTfoU2zMu,Nueva tribu alimentaria. ¿Quiénes son los climatarianos?,https://www.clarin.com/new-york-times-international-weekly/-climatarianos-_0_YTfoU2zMu.html,https://images.clarin.com/2021/08/10/ayXeDZNQj_1256x620__2.jpg#1628691592012
99,uyeCBupUp,Fútbol. El escocés fanático de Chacarita que viralizó la camiseta y sueña verlo de local,https://www.clarin.com/zonales/escoces-fanatico-chacarita-viralizo-camiseta-suena-ver-funebrero-local_0_uyeCBupUp.html,https://images.clarin.com/2021/08/09/1IGnEDbBb_1256x620__3.jpg#1628518880736
100,5t0ZKIPoZ,Denunciada por Lotería. Administraba un bingo ilegal en su casa y la descubrieron por Facebook,https://www.clarin.com/zonales/administraba-bingo-ilegal-casa-descubrieron-facebook_0_5t0ZKIPoZ.html,https://images.clarin.com/2021/08/10/GG6BBpjET_720x0__1.jpg
101,npeqP0l2R,Las votó la gente. Video: cuáles son y dónde están las aclamadas Ocho Maravillas del Conurbano,https://www.clarin.com/zonales/oeste-maravillas-conurbano-_0_npeqP0l2R.html,https://images.clarin.com/2021/08/09/w8tJxcTA9_720x0__1.jpg
102,wfL_drspb,Peleas cotidianas. Videos de la furia del GBA: amenazas con revólver y cuchillo en dos discusiones,https://www.clarin.com/zonales/videos-furia-gba-amenazas-revolver-cuchillo-discusiones-callejeras_0_wfL_drspb.html,https://images.clarin.com/2021/08/05/hl3tWWve7_720x0__1.jpg
103,7yrlzflkl,"Polémica. Escandalosa versión de Dalma Maradona sobre Santiago Lara, supuesto hijo de Diego Maradona",https://www.clarin.com/fama/escandalosa-version-dalma-maradona-santiago-lara-supuesto-hijo-diego-maradona_0_7yrlzflkl.html,https://images.clarin.com/2021/08/12/GmhpFiq-o_720x0__1.jpg
104,U6YEENGAQ,"¿Lo estafó?. Rompió el silencio Gaspar Valverde, el humorista uruguayo que denunció a Álvaro Navia",https://www.clarin.com/fama/rompio-silencio-gaspar-valverde-humorista-uruguayo-denuncio-alvaro-navia_0_U6YEENGAQ.html,https://images.clarin.com/2021/08/12/3utTXKfR0_720x0__1.jpg
105,PfkuRd6nW,"""Tengo mi carácter"". Lali Espósito habló de la participante de ""La Voz Argentina"" que la acusó de plagio",https://www.clarin.com/fama/lali-esposito-hablo-participante-voz-argentina-acuso-plagio_0_PfkuRd6nW.html,https://images.clarin.com/2021/08/12/NU5ygJab-_720x0__1.jpg
106,mplu2Khsu,Puso límites. Gustavo Martínez decretó cuáles son las imágenes que no aparecerán en la serie de Fort,https://www.clarin.com/fama/sentido-pedido-gustavo-martinez-impedir-muestren-imagenes-serie-ricardo-fort_0_mplu2Khsu.html,https://images.clarin.com/2021/08/12/K3Idk3kpo_720x0__1.jpg
107,WrsWZskZJ,"Acusado de violación. La demanda contra el príncipe Andrés, otro capítulo de intrigas reales, sexo y poder",https://www.clarin.com/mundo/demanda-violacion-principe-andres-capitulo-intrigas-reales-sexo-poder_0_WrsWZskZJ.html,https://images.clarin.com/2021/08/12/4l69pJvwQ_1256x620__2.jpg#1628776544445
108,YTyv0j-3j,Internet. Los 5 fraudes más comunes al comprar en Amazon y claves para protegerse,https://www.clarin.com/servicios/5-fraudes-comunes-comprar-amazon-claves-protegerse_0_YTyv0j-3j.html,https://images.clarin.com/2021/07/30/Cm8dGTGcR_720x0__1.jpg
109,415FwzU68,"Mercado inmobiliario. Alquileres, con subas de hasta 100%: cuáles son los barrios más baratos y los más caros",https://www.clarin.com/economia/alquileres-subas-100-barrios-baratos-caros_0_415FwzU68.html,https://images.clarin.com/2021/07/02/Y18CHeWKa_720x0__1.jpg
110,avIuI8lZq,Vacunas contra el Covid. Europa investiga otros efectos secundarios de Pfizer y Moderna,https://www.clarin.com/mundo/europa-investiga-posibles-efectos-secundarios-vacunas-pfizer-moderna_0_avIuI8lZq.html,https://images.clarin.com/2021/07/06/_7RPXQVIx_720x0__1.jpg
111,fj30Y54wX,Elecciones 2021. Nueva encuesta electoral con tres internas muy calientes y famosos,https://www.clarin.com/politica/elecciones-2021-nueva-encuesta-electoral-internas-calientes-candidatos-famosos_0_fj30Y54wX.html,https://images.clarin.com/2018/04/02/r1AWG4liM_720x0__1.jpg
112,GBeWqw9in,Se usa más. Cheque electrónico: cómo funciona y cuáles son sus beneficios,https://www.clarin.com/servicios/cheque-electronico-funciona-beneficios_0_GBeWqw9in.html,https://images.clarin.com/2020/05/13/zO11PSg4u_720x0__1.jpg
113,WV8NLblKxr,"Una ""caja"" política. Peajes, narcotráfico y secretos de estado: por qué la Hidrovía desvela al Gobierno",https://www.clarin.com/politica/peajes-narcotrafico-secretos-hidrovia-desvela-gobierno_0_WV8NLblKxr.html,https://images.clarin.com/2021/08/04/BZBPAPEqR_720x0__1.jpg
114,_rlo26H9H,"Medio ambiente. Cambio climático: el ""virus"" que avanza y nos espera detrás de la pandemia",https://www.clarin.com/sociedad/cambio-climatico-virus-avanza-espera-detras-pandemia_0__rlo26H9H.html,https://images.clarin.com/2021/04/19/0pONQxseU_720x0__1.jpg
115,mPfZC-Otu,Secretos del campo. Todos los usos del maíz: de los pañales al alcohol en gel,https://www.clarin.com/rural/puchero-panales-alcohol-gel-revolucion-maiz_0_mPfZC-Otu.html,https://images.clarin.com/2021/07/28/FpbOIphOn_720x0__1.jpg
116,19-eX440K,Guía de ahorro . Diez claves para bajar gastos de la casa y el auto y pelearle a la inflación,https://www.clarin.com/servicios/guia-ahorro-claves-bajar-gastos-casa-auto-pelearle-inflacion_0_19-eX440K.html,https://images.clarin.com/2021/05/31/7WP8wMbXk_720x0__1.jpg
117,3kgfPjeuw,"El mejor momento de Di María. ""Cumplí todos los sueños en un mes: ganar la Copa América y jugar con Messi en el mismo equipo""",https://www.clarin.com/deportes/di-maria-cumpli-suenos-mes-ganar-copa-america-poder-jugar-messi-mismo-equipo-_0_3kgfPjeuw.html,https://images.clarin.com/2021/08/12/9plvJ7yD2_720x0__1.jpg
118,levh6U__y,"Instalado en París. Messi reveló cómo se enteró de su salida de Barcelona: llanto y el ""bajón"" familiar",https://www.clarin.com/deportes/lionel-messi-revelo-entero-salida-barcelona-llanto-antonela-bajon-familia_0_levh6U__y.html,https://images.clarin.com/2021/08/12/BAl8o8GCS_720x0__1.jpg
119,LzQzXys5j,Pieza clave. El gol de Nacho Fernández complicó al River de Gallardo y agranda la nostalgia,https://www.clarin.com/deportes/gol-nacho-fernandez-complico-river-gallardo-agranda-nostalgia-partida_0_LzQzXys5j.html,https://images.clarin.com/2021/08/12/L7txr6Ogl_720x0__1.jpg
120,N6egeZJXS,En alza. Argentina trepa en el ranking y es una buena señal rumbo a Qatar,https://www.clarin.com/deportes/argentina-trepa-ranking-fifa-copa-america-buena-senal-rumbo-mundial-qatar-2022_0_N6egeZJXS.html,https://images.clarin.com/2021/07/11/Cqsm5HxI2_720x0__1.jpg
121,xhUhhwu5k,Inglaterra. Bielsa confirmó que renovó contrato con Leeds: todos los detalles,https://www.clarin.com/deportes/marcelo-bielsa-confirmo-renovo-contrato-leeds-united-tiempo_0_xhUhhwu5k.html,https://images.clarin.com/2021/08/12/N00lkea8F_720x0__1.jpg
