n,id,title,url,image
1,https://www.infobae.com/politica/2022/01/04/el-gobierno-volvio-a-cuestionar-el-rechazo-de-la-oposicion-a-participar-de-la-reunion-con-guzman-y-apunto-contra-rodriguez-larreta/,El Gobierno volvió a cuestionar el rechazo de la oposición a participar de la reunión con Guzmán y apuntó contra Rodríguez Larreta,https://www.infobae.com/politica/2022/01/04/el-gobierno-volvio-a-cuestionar-el-rechazo-de-la-oposicion-a-participar-de-la-reunion-con-guzman-y-apunto-contra-rodriguez-larreta/,https://cloudfront-us-east-1.images.arcpublishing.com/infobae/2CMPOBTQHVGOREPON627PVYWQY.jpg
2,https://www.infobae.com/america/eeuu/2022/01/04/cdc-de-eeuu-recomiendan-reducir-a-5-meses-el-intervalo-para-la-dosis-de-refuerzo-de-la-vacuna-de-pfizer/,CDC de EEUU recomiendan reducir a 5 meses el intervalo para la dosis de refuerzo de la vacuna de Pfizer,https://www.infobae.com/america/eeuu/2022/01/04/cdc-de-eeuu-recomiendan-reducir-a-5-meses-el-intervalo-para-la-dosis-de-refuerzo-de-la-vacuna-de-pfizer/,https://cloudfront-us-east-1.images.arcpublishing.com/infobae/YXOFVR45BKFECU5R2MMWXH2LOA.jpg
3,https://www.infobae.com/sociedad/policiales/2022/01/04/la-insolita-explicacion-de-la-jueza-sumariada-por-su-encuentro-con-un-preso-nunca-nos-besamos-quiero-escribir-su-historia-en-un-libro/,"La insólita explicación de la jueza sumariada por su encuentro con un preso: “Nunca nos besamos, quiero escribir su historia en un libro”",https://www.infobae.com/sociedad/policiales/2022/01/04/la-insolita-explicacion-de-la-jueza-sumariada-por-su-encuentro-con-un-preso-nunca-nos-besamos-quiero-escribir-su-historia-en-un-libro/,https://cloudfront-us-east-1.images.arcpublishing.com/infobae/4TKVF6JDBBENPBPMPSRLEELQBQ.jpg
4,https://www.infobae.com/sociedad/policiales/2022/01/04/pidieron-la-prision-preventiva-para-el-asesino-al-volante-de-palermo-y-liberaron-a-los-tres-acusados-de-encubrirlo/,Pidieron la prisión preventiva para el asesino al volante de Palermo y liberaron a los tres acusados de encubrirlo,https://www.infobae.com/sociedad/policiales/2022/01/04/pidieron-la-prision-preventiva-para-el-asesino-al-volante-de-palermo-y-liberaron-a-los-tres-acusados-de-encubrirlo/,https://cloudfront-us-east-1.images.arcpublishing.com/infobae/RSQZQ57HXBBWBAZRFG7KYN3ITI.jpg
5,https://www.infobae.com/sociedad/policiales/2022/01/04/tragedia-en-palermo-asi-fue-la-fuga-completa-del-asesino-al-volante-que-mato-a-la-ciclista/,Tragedia en Palermo: así fue la fuga completa del asesino al volante que mató a la ciclista,https://www.infobae.com/sociedad/policiales/2022/01/04/tragedia-en-palermo-asi-fue-la-fuga-completa-del-asesino-al-volante-que-mato-a-la-ciclista/,https://cloudfront-us-east-1.images.arcpublishing.com/infobae/R2IOV7D3JFGUPE4IHFES5Y5IB4.jpg
6,https://www.infobae.com/deportes/2022/01/04/boca-busca-un-goleador-negocia-con-bendetto-pero-dejara-ir-a-varios-delanteros/,"Boca busca un goleador: negocia con Bendetto, pero dejará ir a varios delanteros",https://www.infobae.com/deportes/2022/01/04/boca-busca-un-goleador-negocia-con-bendetto-pero-dejara-ir-a-varios-delanteros/,https://cloudfront-us-east-1.images.arcpublishing.com/infobae/G4MBKMO7AJCVHMM4LDXFBB5G2Y.jpg
7,https://www.infobae.com/teleshow/2022/01/04/el-dramatico-momento-de-camila-perisse-ya-no-quiere-vivir-mas/,El dramático momento de Camila Perissé: “Ya no quiere vivir más”,https://www.infobae.com/teleshow/2022/01/04/el-dramatico-momento-de-camila-perisse-ya-no-quiere-vivir-mas/,https://cloudfront-us-east-1.images.arcpublishing.com/infobae/5BVFC6TCORGATCHHKRCVVW7B5Q.jpg
8,https://www.infobae.com/economia/2022/01/04/limitaran-el-ingreso-de-acompanantes-al-aeroparque-metropolitano-por-el-pico-de-contagios-de-coronavirus/,Limitarán el ingreso de acompañantes al Aeroparque metropolitano por el pico de contagios de coronavirus,https://www.infobae.com/economia/2022/01/04/limitaran-el-ingreso-de-acompanantes-al-aeroparque-metropolitano-por-el-pico-de-contagios-de-coronavirus/,https://cloudfront-us-east-1.images.arcpublishing.com/infobae/DX5O67WLEZARHIXTWYLRGLI4U4.jpg
9,https://www.infobae.com/teleshow/2022/01/04/la-noche-de-mujeres-de-susana-gimenez-en-punta-del-este-cena-con-su-hija-y-amigas-con-vista-al-mar/,La noche de mujeres de Susana Giménez en Punta del Este: cena con su hija y amigas con vista al mar,https://www.infobae.com/teleshow/2022/01/04/la-noche-de-mujeres-de-susana-gimenez-en-punta-del-este-cena-con-su-hija-y-amigas-con-vista-al-mar/,https://cloudfront-us-east-1.images.arcpublishing.com/infobae/AFB6BPTAUBBLZCXKKGVG7ZQYJE.jpg
10,https://www.infobae.com/america/tecno/2022/01/04/blackberry-llega-a-su-fin-los-tradicionales-celulares-dejan-de-funcionar-en-el-mundo/,BlackBerry llega hoy a su fin luego de casi 30 años de historia en la industria móvil,https://www.infobae.com/america/tecno/2022/01/04/blackberry-llega-a-su-fin-los-tradicionales-celulares-dejan-de-funcionar-en-el-mundo/,https://cloudfront-us-east-1.images.arcpublishing.com/infobae/V6W65WFUCUKAUWZ2Q6WHHL6BSU.jpg
11,https://www.infobae.com/fotos/2022/01/04/verano-2022-asi-arranco-la-primera-semana-de-enero-en-mar-del-plata-pinamar-y-punta-del-este/,"Verano 2022: así arrancó la primera semana de enero en Mar del Plata, Pinamar y Punta del Este ",https://www.infobae.com/fotos/2022/01/04/verano-2022-asi-arranco-la-primera-semana-de-enero-en-mar-del-plata-pinamar-y-punta-del-este/,https://cloudfront-us-east-1.images.arcpublishing.com/infobae/KOD6EIV7QFHNRLNFHIBNFZSHGM.jpg
12,https://www.infobae.com/sociedad/policiales/2022/01/04/el-polemico-antecedente-de-la-jueza-mariel-suarez-y-la-atroz-historia-criminal-del-preso-por-el-que-fue-sumariada/,El polémico antecedente de la jueza Mariel Suárez y la atroz historia criminal del preso por el que fue sumariada,https://www.infobae.com/sociedad/policiales/2022/01/04/el-polemico-antecedente-de-la-jueza-mariel-suarez-y-la-atroz-historia-criminal-del-preso-por-el-que-fue-sumariada/,https://cloudfront-us-east-1.images.arcpublishing.com/infobae/36PGOPRYUBAJ5L6IOYB37TOVVM.jpg
13,https://www.infobae.com/america/mundo/2022/01/04/hay-un-millon-de-aislados-por-coronavirus-en-el-reino-unido-que-no-pueden-regresar-a-sus-actividades-tras-las-vacaciones-navidenas/,Hay un millón de aislados por coronavirus en el Reino Unido que no pueden regresar a sus actividades tras las vacaciones navideñas,https://www.infobae.com/america/mundo/2022/01/04/hay-un-millon-de-aislados-por-coronavirus-en-el-reino-unido-que-no-pueden-regresar-a-sus-actividades-tras-las-vacaciones-navidenas/,https://cloudfront-us-east-1.images.arcpublishing.com/infobae/X6D54KRA2FXFZD42TFXX6KBGZI.jpg
14,https://www.infobae.com/economia/2022/01/04/es-millonario-creo-una-academia-de-finanzas-lider-en-europa-y-compartio-los-5-secretos-para-hacerse-rico-sin-importar-cuanto-se-gana/,"Es millonario, creó una academia de finanzas líder en Europa y compartió los 5 secretos para hacerse rico sin importar cuánto se gana",https://www.infobae.com/economia/2022/01/04/es-millonario-creo-una-academia-de-finanzas-lider-en-europa-y-compartio-los-5-secretos-para-hacerse-rico-sin-importar-cuanto-se-gana/,https://cloudfront-us-east-1.images.arcpublishing.com/infobae/NZXOF4S7IKMNNWDMFI57VPEECE.jpg
15,https://www.infobae.com/politica/2022/01/04/causa-gestapo-un-organismo-que-depende-del-procurador-casal-revisara-los-telefonos-y-las-computadoras-secuestradas-en-los-allanamientos/,Causa Gestapo: un organismo que depende del procurador Casal revisará los teléfonos y las computadoras secuestradas en los allanamientos,https://www.infobae.com/politica/2022/01/04/causa-gestapo-un-organismo-que-depende-del-procurador-casal-revisara-los-telefonos-y-las-computadoras-secuestradas-en-los-allanamientos/,https://cloudfront-us-east-1.images.arcpublishing.com/infobae/T4LT4ORAZVGKBJUFXRRYRB7NNQ.jpg
16,https://www.infobae.com/america/eeuu/2022/01/04/estados-unidos-registro-mas-de-un-millon-de-casos-de-covid-19-en-un-dia-record-mundial-desde-el-inicio-de-la-pandemia/,"Estados Unidos registró más de un millón de casos de COVID-19 en un día, récord mundial desde el inicio de la pandemia",https://www.infobae.com/america/eeuu/2022/01/04/estados-unidos-registro-mas-de-un-millon-de-casos-de-covid-19-en-un-dia-record-mundial-desde-el-inicio-de-la-pandemia/,https://cloudfront-us-east-1.images.arcpublishing.com/infobae/IGAXJFWX3DWP37YZ6NL4ADWHEU.jpg
17,https://www.infobae.com/politica/2022/01/04/el-gobierno-porteno-reclamo-la-autorizacion-del-autotest-de-covid-19-ayuda-a-los-que-tienen-la-voluntad-de-testearse/,El gobierno porteño reclamó la autorización del autotest de COVID-19: “Ayuda a los que tienen la voluntad de testearse”,https://www.infobae.com/politica/2022/01/04/el-gobierno-porteno-reclamo-la-autorizacion-del-autotest-de-covid-19-ayuda-a-los-que-tienen-la-voluntad-de-testearse/,https://cloudfront-us-east-1.images.arcpublishing.com/infobae/3KWO6LHW2FBFXM2B6YBDHQREII.jpg
18,https://www.infobae.com/politica/2022/01/04/larreta-le-respondio-a-alberto-fernandez-y-ratifico-que-no-participara-del-encuentro-con-guzman-es-una-reunion-politica-no-es-seria/,"Larreta le respondió a Alberto Fernández y ratificó que no participará del encuentro con Guzmán: “Es una reunión política, no es seria”",https://www.infobae.com/politica/2022/01/04/larreta-le-respondio-a-alberto-fernandez-y-ratifico-que-no-participara-del-encuentro-con-guzman-es-una-reunion-politica-no-es-seria/,https://cloudfront-us-east-1.images.arcpublishing.com/infobae/QA25DECBLNGZZIZG4FCYDJJCOM.jpg
19,https://www.infobae.com/deportes/2022/01/04/misteriosos-y-explosivos-mensajes-de-juan-sebastian-veron-en-redes-sociales-dan-ganas-de-irse-a-la-m/,Misteriosos y explosivos mensajes de Juan Sebastián Verón en redes sociales: “Dan ganas de irse a la m...”,https://www.infobae.com/deportes/2022/01/04/misteriosos-y-explosivos-mensajes-de-juan-sebastian-veron-en-redes-sociales-dan-ganas-de-irse-a-la-m/,https://cloudfront-us-east-1.images.arcpublishing.com/infobae/CIIS45WOEZE7FAHSIUZX2E7YUU.jpg
20,https://www.infobae.com/america/historia-america/2022/01/04/rasputin-el-monje-loco-su-poder-sanador-las-orgias-sus-estremecedoras-profecias-y-su-violento-final/,"Rasputín, el Monje Loco: su poder sanador, las orgías, sus estremecedoras profecías y su violento final",https://www.infobae.com/america/historia-america/2022/01/04/rasputin-el-monje-loco-su-poder-sanador-las-orgias-sus-estremecedoras-profecias-y-su-violento-final/,https://cloudfront-us-east-1.images.arcpublishing.com/infobae/JFZ5CATCKFANNBTBTUXR6NGC3I.jpg
21,https://www.infobae.com/sociedad/policiales/2022/01/04/los-antecedentes-del-asesino-al-volante-que-mato-a-la-ciclista-en-los-bosques-de-palermo/,Los antecedentes del asesino al volante que mató a la ciclista en los Bosques de Palermo,https://www.infobae.com/sociedad/policiales/2022/01/04/los-antecedentes-del-asesino-al-volante-que-mato-a-la-ciclista-en-los-bosques-de-palermo/,https://cloudfront-us-east-1.images.arcpublishing.com/infobae/5PBHCOUZI5CVHJ6SNW2BGKTF54.jpg
22,https://www.infobae.com/america/ciencia-america/2022/01/04/dinamarca-el-pais-modelo-para-mirar-el-futuro-del-covid-19-anuncio-que-en-dos-meses-terminara-la-pandemia/,Dinamarca: el país modelo para mirar el futuro del COVID-19 anunció que en dos meses terminará la pandemia,https://www.infobae.com/america/ciencia-america/2022/01/04/dinamarca-el-pais-modelo-para-mirar-el-futuro-del-covid-19-anuncio-que-en-dos-meses-terminara-la-pandemia/,https://cloudfront-us-east-1.images.arcpublishing.com/infobae/AOYMUHR7Z5F5NWTLE5YM55C7B4.jpg
23,https://www.infobae.com/america/deportes/2022/01/04/en-medio-de-la-polemica-el-australian-open-explico-por-que-habilito-a-djokovic-a-participar-sin-estar-vacunado/,"En medio de la polémica, el Australian Open explicó por qué habilitó a Djokovic a participar sin estar vacunado",https://www.infobae.com/america/deportes/2022/01/04/en-medio-de-la-polemica-el-australian-open-explico-por-que-habilito-a-djokovic-a-participar-sin-estar-vacunado/,https://cloudfront-us-east-1.images.arcpublishing.com/infobae/LDIX6QDRPNBE5PSOS6UJOXBTWM
24,https://www.infobae.com/america/eeuu/2022/01/04/quienes-fueron-los-ricos-y-famosos-estafados-por-la-fundadora-de-theranos-elizabeth-holmes/,"Quiénes fueron los ricos y famosos estafados por la fundadora de Theranos, Elizabeth Holmes",https://www.infobae.com/america/eeuu/2022/01/04/quienes-fueron-los-ricos-y-famosos-estafados-por-la-fundadora-de-theranos-elizabeth-holmes/,https://cloudfront-us-east-1.images.arcpublishing.com/infobae/XOMS5KCDX5DVFLJI56M67FMHAQ.jpg
25,https://www.infobae.com/america/eeuu/2022/01/04/auge-fraude-y-derrumbe-de-elizabeth-holmes-de-recaudar-9-mil-millones-de-dolares-con-una-gota-de-sangre-a-la-carcel/,"Auge, fraude y derrumbe de Elizabeth Holmes: de recaudar 9 mil millones de dólares con una gota de sangre a la cárcel",https://www.infobae.com/america/eeuu/2022/01/04/auge-fraude-y-derrumbe-de-elizabeth-holmes-de-recaudar-9-mil-millones-de-dolares-con-una-gota-de-sangre-a-la-carcel/,https://cloudfront-us-east-1.images.arcpublishing.com/infobae/UV443DYX5BFWLDUW7BZR76MP5M.jpg
26,https://www.infobae.com/economia/2022/01/04/cual-fue-la-increible-cifra-que-gano-warren-buffet-en-un-dia-gracias-a-que-apple-supero-los-usd-3-billones-de-valor-de-mercado/,Cuál fue la increíble cifra que ganó Warren Buffet en un día gracias a que Apple superó los USD 3 billones de valor de mercado,https://www.infobae.com/economia/2022/01/04/cual-fue-la-increible-cifra-que-gano-warren-buffet-en-un-dia-gracias-a-que-apple-supero-los-usd-3-billones-de-valor-de-mercado/,https://cloudfront-us-east-1.images.arcpublishing.com/infobae/GXGEFLTHBEX2FNGN26OOYOW7EA.jpg
27,https://www.infobae.com/historias/2022/01/04/abusos-exorcismo-celos-y-horror-las-adolescentes-que-asesinaron-con-sadismo-a-su-amiga-de-12-anos/,"Abusos, exorcismo, celos y horror: las adolescentes que asesinaron con sadismo a su amiga de 12 años",https://www.infobae.com/historias/2022/01/04/abusos-exorcismo-celos-y-horror-las-adolescentes-que-asesinaron-con-sadismo-a-su-amiga-de-12-anos/,https://cloudfront-us-east-1.images.arcpublishing.com/infobae/UVBJU2B2AJEBFLJSNZ6NVL3QPM.jpg
28,https://www.infobae.com/deportes/2022/01/04/tomas-pochettino-se-hizo-la-revision-medica-y-sera-el-primer-fichaje-de-river-los-otros-dos-refuerzos-que-estan-al-caer/,Tomás Pochettino se hizo la revisión médica y será el primer fichaje de River: los otros dos refuerzos que están al caer  ,https://www.infobae.com/deportes/2022/01/04/tomas-pochettino-se-hizo-la-revision-medica-y-sera-el-primer-fichaje-de-river-los-otros-dos-refuerzos-que-estan-al-caer/,https://cloudfront-us-east-1.images.arcpublishing.com/infobae/YH6ZICLJBVFK5L2JNC3RD7LF6U.jpg
29,https://www.infobae.com/opinion/2022/01/04/por-que-el-gobierno-y-la-oposicion-se-parecen-a-pesar-de-que-son-diferentes/,¿Por qué el Gobierno y la oposición se parecen a pesar de que son diferentes?,https://www.infobae.com/opinion/2022/01/04/por-que-el-gobierno-y-la-oposicion-se-parecen-a-pesar-de-que-son-diferentes/,https://cloudfront-us-east-1.images.arcpublishing.com/infobae/MWFIPHPDBVF5JO7WXTY5673ICU.jpg
30,https://www.infobae.com/teleshow/2022/01/04/las-vacaciones-romanticas-de-sofia-jujuy-jimenez-en-punta-del-este-y-su-novio-polista/,Las vacaciones románticas de Sofía Jujuy Jiménez en Punta del Este y su novio polista,https://www.infobae.com/teleshow/2022/01/04/las-vacaciones-romanticas-de-sofia-jujuy-jimenez-en-punta-del-este-y-su-novio-polista/,https://cloudfront-us-east-1.images.arcpublishing.com/infobae/GLECYZESWZCHNPDZ3D2EZ2UEJ4.JPG
31,https://www.infobae.com/america/mundo/2022/01/04/los-gemelos-bogdanoff-estrellas-de-la-television-francesa-murieron-de-covid-19-con-una-semana-de-diferencia-no-estaban-vacunados/,"Los gemelos Bogdanoff, estrellas de la televisión francesa, murieron de COVID-19 con una semana de diferencia: no estaban vacunados",https://www.infobae.com/america/mundo/2022/01/04/los-gemelos-bogdanoff-estrellas-de-la-television-francesa-murieron-de-covid-19-con-una-semana-de-diferencia-no-estaban-vacunados/,https://cloudfront-us-east-1.images.arcpublishing.com/infobae/4VI4VKZ4PBFH7NPV36B33SONMQ.jpg
32,https://www.infobae.com/economia/2022/01/04/tarifas-2022-las-empresas-de-gas-pidieron-subas-con-un-impacto-cercano-al-30-en-las-facturas/,Tarifas 2022: las empresas de gas pidieron subas con un impacto cercano al 30% en las facturas,https://www.infobae.com/economia/2022/01/04/tarifas-2022-las-empresas-de-gas-pidieron-subas-con-un-impacto-cercano-al-30-en-las-facturas/,https://cloudfront-us-east-1.images.arcpublishing.com/infobae/VMJ3FZCQ7NE4FEZLEDHEWRGW5U.jpg
33,https://www.infobae.com/economia/2022/01/04/criptomonedas-para-turistas-como-viajar-y-pagar-en-cualquier-parte-del-mundo-solo-con-activos-digitales/,Criptomonedas para turistas: como viajar y pagar en cualquier parte del mundo sólo con activos digitales,https://www.infobae.com/economia/2022/01/04/criptomonedas-para-turistas-como-viajar-y-pagar-en-cualquier-parte-del-mundo-solo-con-activos-digitales/,https://cloudfront-us-east-1.images.arcpublishing.com/infobae/WUDUCMYNNBGGTAB7ANJVUIZ5SI.jpg
34,https://www.infobae.com/politica/2022/01/04/alberto-fernandez-le-pidio-a-la-justicia-investigar-sin-demoras-el-uso-de-los-servicios-de-inteligencia-durante-el-macrismo/,Alberto Fernández le pidió a la Justicia “investigar sin demoras” el uso de los servicios de inteligencia durante el macrismo,https://www.infobae.com/politica/2022/01/04/alberto-fernandez-le-pidio-a-la-justicia-investigar-sin-demoras-el-uso-de-los-servicios-de-inteligencia-durante-el-macrismo/,https://cloudfront-us-east-1.images.arcpublishing.com/infobae/3IFZ4BONDZC3BFD6FILJOJBGXE.jpg
35,https://www.infobae.com/sociedad/2022/01/04/incendios-en-puerto-madryn-hay-77000-hectareas-quemadas-y-el-fuego-se-acerca-a-la-peninsula-valdes/,Incendios en Puerto Madryn: hay 77.000 hectáreas quemadas y el fuego se acerca a la península Valdés,https://www.infobae.com/sociedad/2022/01/04/incendios-en-puerto-madryn-hay-77000-hectareas-quemadas-y-el-fuego-se-acerca-a-la-peninsula-valdes/,https://cloudfront-us-east-1.images.arcpublishing.com/infobae/O3CTUEW2SBGIXICFALNYLN52XE.jpg
36,https://www.infobae.com/teleshow/2022/01/04/crece-el-conflicto-entre-cinthia-fernandez-y-matias-defederico-la-panelista-mostro-pruebas-de-presunta-violencia-fisica-y-verbal/,Crece el conflicto entre Cinthia Fernández y Matías Defederico: la panelista mostró pruebas de presunta violencia física y verbal,https://www.infobae.com/teleshow/2022/01/04/crece-el-conflicto-entre-cinthia-fernandez-y-matias-defederico-la-panelista-mostro-pruebas-de-presunta-violencia-fisica-y-verbal/,https://cloudfront-us-east-1.images.arcpublishing.com/infobae/B76ZGPXKYFBGHNFZG4CLZP32KY.jpg
37,https://www.infobae.com/sociedad/2022/01/04/pesca-sobre-la-ruta-los-videos-que-muestran-el-deplorable-estado-de-algunos-caminos-provinciales/,“Pesca sobre la ruta”: los videos que muestran el deplorable estado de algunos caminos provinciales,https://www.infobae.com/sociedad/2022/01/04/pesca-sobre-la-ruta-los-videos-que-muestran-el-deplorable-estado-de-algunos-caminos-provinciales/,https://cloudfront-us-east-1.images.arcpublishing.com/infobae/Q2UCFLYFPREMBOTJVUN3PJAIQ4.JPG
38,https://www.infobae.com/tendencias/2022/01/04/punta-del-este-cuanto-cuesta-comer-en-la-barra/,Punta del Este: cuánto cuesta comer en La Barra,https://www.infobae.com/tendencias/2022/01/04/punta-del-este-cuanto-cuesta-comer-en-la-barra/,https://cloudfront-us-east-1.images.arcpublishing.com/infobae/L4DBK5BNXVAJXHIFZRJCML6UGE.jpeg
39,https://www.infobae.com/sociedad/2022/01/04/la-vida-sobre-ruedas-cuatro-historias-de-sonadores-marplatenses-que-salen-a-recorrer-el-pais/,La vida sobre ruedas: cuatro historias de soñadores marplatenses que salen a recorrer el país,https://www.infobae.com/sociedad/2022/01/04/la-vida-sobre-ruedas-cuatro-historias-de-sonadores-marplatenses-que-salen-a-recorrer-el-pais/,https://cloudfront-us-east-1.images.arcpublishing.com/infobae/JY2CBKW27RAGBISEXQE4XZ2BPE.jpg
40,https://www.infobae.com/teleshow/2022/01/04/nico-furtado-y-ester-exposito-ya-no-ocultan-su-amor-las-fotos-de-sus-vacaciones-en-punta-del-este/,Nico Furtado y Ester Expósito ya no ocultan su amor: las fotos de sus vacaciones en Punta del Este,https://www.infobae.com/teleshow/2022/01/04/nico-furtado-y-ester-exposito-ya-no-ocultan-su-amor-las-fotos-de-sus-vacaciones-en-punta-del-este/,https://cloudfront-us-east-1.images.arcpublishing.com/infobae/T4TWFTZ745EOBB2YRURPMEL63Y.jpg
41,https://www.infobae.com/fotos/2022/01/04/las-espectaculares-fotos-aereas-de-mar-del-plata-que-se-hicieron-virales/,Las espectaculares fotos aéreas de Mar del Plata que se hicieron virales,https://www.infobae.com/fotos/2022/01/04/las-espectaculares-fotos-aereas-de-mar-del-plata-que-se-hicieron-virales/,https://cloudfront-us-east-1.images.arcpublishing.com/infobae/3QTKVA553JH2TA344DHR4PA6NM.jpg
42,https://www.infobae.com/tendencias/2022/01/04/punta-del-este-ale-lacroix-revela-de-que-se-trata-el-desafio-del-club-de-las-5-am-y-que-es-la-regla-del-20-20-20/,Punta del Este: Ale Lacroix revela de qué se trata el Desafío del Club de las 5 AM y qué es la regla del 20-20-20 ,https://www.infobae.com/tendencias/2022/01/04/punta-del-este-ale-lacroix-revela-de-que-se-trata-el-desafio-del-club-de-las-5-am-y-que-es-la-regla-del-20-20-20/,https://cloudfront-us-east-1.images.arcpublishing.com/infobae/WYUONP7WDFA6LLJYD6HAYEAY5U.jpg
43,https://www.infobae.com/politica/2022/01/03/archivos-desclasificados-confirman-que-el-reino-unido-desplego-31-armas-nucleares-durante-la-guerra-de-malvinas/,Archivos desclasificados confirman que buques del Reino Unido transportaron 31 armas nucleares durante la Guerra de Malvinas,https://www.infobae.com/politica/2022/01/03/archivos-desclasificados-confirman-que-el-reino-unido-desplego-31-armas-nucleares-durante-la-guerra-de-malvinas/,https://cloudfront-us-east-1.images.arcpublishing.com/infobae/J6WYVZFAHND4PODEMC6CLAV5DE.jpg
44,https://www.infobae.com/sociedad/2022/01/04/hms-hermes-el-portaaviones-insignia-de-los-britanicos-que-fue-elegido-para-llevar-armas-nucleares-durante-la-guerra-de-malvinas/,"HMS Hermes, el portaaviones insignia de los británicos que fue elegido para llevar armas nucleares durante la Guerra de Malvinas",https://www.infobae.com/sociedad/2022/01/04/hms-hermes-el-portaaviones-insignia-de-los-britanicos-que-fue-elegido-para-llevar-armas-nucleares-durante-la-guerra-de-malvinas/,https://cloudfront-us-east-1.images.arcpublishing.com/infobae/VR5XTN2LHNF5DAMKBY47PZIK6Q.jpg
45,https://www.infobae.com/america/deportes/futbol-europeo/2022/01/04/en-francia-eligieron-al-mejor-equipo-del-mundo-del-2021-dejaron-afuera-a-messi-y-mbappe/,En Francia eligieron al mejor equipo del mundo del 2021: dejaron afuera a Messi y Mbappé,https://www.infobae.com/america/deportes/futbol-europeo/2022/01/04/en-francia-eligieron-al-mejor-equipo-del-mundo-del-2021-dejaron-afuera-a-messi-y-mbappe/,https://cloudfront-us-east-1.images.arcpublishing.com/infobae/A2O3J3K22NFEPKXJT7O7JWG4BU.jpg
46,https://www.infobae.com/opinion/2022/01/04/por-que-mas-estado-y-mas-regulaciones-afectan-a-los-consumidores/,Por qué más Estado y más regulaciones afectan a los consumidores,https://www.infobae.com/opinion/2022/01/04/por-que-mas-estado-y-mas-regulaciones-afectan-a-los-consumidores/,https://cloudfront-us-east-1.images.arcpublishing.com/infobae/2ZVZVBWD7BRMAKEJ5TDBT46Y54.jpg
47,https://www.infobae.com/america/opinion/2022/01/04/las-potencias-se-pronunciaron-por-el-no-uso-de-armas-nucleares/,Las potencias se pronunciaron por el no uso de armas nucleares,https://www.infobae.com/america/opinion/2022/01/04/las-potencias-se-pronunciaron-por-el-no-uso-de-armas-nucleares/,https://cloudfront-us-east-1.images.arcpublishing.com/infobae/U6EO6DMZ25DRVKEVMXLTUVYTJY.jpg
48,https://www.infobae.com/america/deportes/2022/01/04/la-epica-historia-del-atleta-olimpico-que-impresiono-a-hitler-y-sobrevivio-a-un-calvario-durante-la-segunda-guerra-mundial/,La épica historia del atleta olímpico que impresionó a Hitler y sobrevivió a un calvario durante la Segunda Guerra Mundial,https://www.infobae.com/america/deportes/2022/01/04/la-epica-historia-del-atleta-olimpico-que-impresiono-a-hitler-y-sobrevivio-a-un-calvario-durante-la-segunda-guerra-mundial/,https://cloudfront-us-east-1.images.arcpublishing.com/infobae/3RKO3DYRHVDJFDJN6INLJ52GVM.jpg
49,https://www.infobae.com/politica/2022/01/04/se-reaviva-la-tension-entre-halcones-y-palomas-de-juntos-por-el-cambio-por-un-nuevo-acercamiento-con-javier-milei/,Se reaviva la tensión entre halcones y palomas de Juntos por el Cambio por un nuevo acercamiento con Javier Milei,https://www.infobae.com/politica/2022/01/04/se-reaviva-la-tension-entre-halcones-y-palomas-de-juntos-por-el-cambio-por-un-nuevo-acercamiento-con-javier-milei/,https://cloudfront-us-east-1.images.arcpublishing.com/infobae/442I6DTAUBDGXDZ5ANVDCVNPWI.jpg
50,https://www.infobae.com/economia/2022/01/03/creditos-casa-propia-como-acceder-a-un-prestamo-hipotecario-a-tasa-cero-para-construir-en-lote-propio-o-de-un-familiar-directo/,Créditos Casa Propia: cómo acceder a un préstamo hipotecario a tasa cero para construir en lote propio o de un familiar directo,https://www.infobae.com/economia/2022/01/03/creditos-casa-propia-como-acceder-a-un-prestamo-hipotecario-a-tasa-cero-para-construir-en-lote-propio-o-de-un-familiar-directo/,https://cloudfront-us-east-1.images.arcpublishing.com/infobae/LDEZO5DAHBEE3DIOJ42GC6EWSQ.jpg
