n,id,title,url,image
1,https://www.infobae.com/politica/2021/04/08/coronavirus-el-gobierno-carga-las-culpas-sobre-la-sociedad-y-apunta-a-los-jovenes-en-lugar-de-admitir-responsabilidades-propias/,"Coronavirus: el Gobierno carga las culpas sobre la sociedad y apunta a los jóvenes, en lugar de admitir responsabilidades propias",https://www.infobae.com/politica/2021/04/08/coronavirus-el-gobierno-carga-las-culpas-sobre-la-sociedad-y-apunta-a-los-jovenes-en-lugar-de-admitir-responsabilidades-propias/,https://cloudfront-us-east-1.images.arcpublishing.com/infobae/IXE2NJRNZFEVNOSWZITIKOVVFI.jpg
2,https://www.infobae.com/economia/2021/04/08/la-salida-de-falabella-por-que-la-cadena-chilena-se-va-del-pais-pero-sigue-invirtiendo-en-el-resto-de-la-region/,La salida de Falabella: por qué la cadena chilena se va del país pero sigue invirtiendo en el resto de la región,https://www.infobae.com/economia/2021/04/08/la-salida-de-falabella-por-que-la-cadena-chilena-se-va-del-pais-pero-sigue-invirtiendo-en-el-resto-de-la-region/,https://cloudfront-us-east-1.images.arcpublishing.com/infobae/QRTEA3KXTFCO5PKUZTT6GIONNU.jpg
3,https://www.infobae.com/america/deportes/2021/04/08/joe-conforte-de-taxista-a-rey-de-los-burdeles-su-rol-en-el-crimen-de-ringo-bonavena-viajes-a-argentina-con-identidades-falsas-y-el-final-como-profugo-vip-en-brasil/,"Joe Conforte, de taxista a rey de los burdeles: su rol en el crimen de Ringo Bonavena, viajes a Argentina con identidades falsas y el final como prófugo VIP en Brasil",https://www.infobae.com/america/deportes/2021/04/08/joe-conforte-de-taxista-a-rey-de-los-burdeles-su-rol-en-el-crimen-de-ringo-bonavena-viajes-a-argentina-con-identidades-falsas-y-el-final-como-profugo-vip-en-brasil/,https://cloudfront-us-east-1.images.arcpublishing.com/infobae/OY67KNA2WNDKLFHPXVPQQX6B4I.jpg
4,https://www.infobae.com/politica/2021/04/08/alberto-fernandez-y-rodriguez-larreta-cerraron-un-acuerdo-politico-sobre-la-circulacion-nocturna-para-enfrentar-juntos-la-segundo-ola-del-covid-19/,Alberto Fernández y Rodríguez Larreta cerraron un acuerdo político sobre la circulación nocturna para enfrentar juntos la segundo ola del COVID-19,https://www.infobae.com/politica/2021/04/08/alberto-fernandez-y-rodriguez-larreta-cerraron-un-acuerdo-politico-sobre-la-circulacion-nocturna-para-enfrentar-juntos-la-segundo-ola-del-covid-19/,https://cloudfront-us-east-1.images.arcpublishing.com/infobae/HJMUQXENCBGJ7CW6KFR2OM5RH4.jpg
5,https://www.infobae.com/politica/2021/04/08/el-gobierno-asume-que-el-aumento-de-casos-se-profundizara-y-apuesta-a-reforzar-el-plan-de-vacunacion/,El Gobierno asume que el aumento de casos se profundizará y apuesta a reforzar el plan de vacunación,https://www.infobae.com/politica/2021/04/08/el-gobierno-asume-que-el-aumento-de-casos-se-profundizara-y-apuesta-a-reforzar-el-plan-de-vacunacion/,https://cloudfront-us-east-1.images.arcpublishing.com/infobae/LLPDQEAKOTMILNSJ2U64EHBUO4.jpg
6,https://www.infobae.com/deportes/2021/04/08/boca-y-river-disputaran-los-octavos-de-final-de-la-copa-argentina-fecha-y-sede-donde-se-jugaria-el-segundo-superclasico-del-ano/,Boca y River disputarán los octavos de final de la Copa Argentina: fecha y sede donde se jugaría el tercer Superclásico del año,https://www.infobae.com/deportes/2021/04/08/boca-y-river-disputaran-los-octavos-de-final-de-la-copa-argentina-fecha-y-sede-donde-se-jugaria-el-segundo-superclasico-del-ano/,https://cloudfront-us-east-1.images.arcpublishing.com/infobae/E3JDQIYHPYSLCLZ4FGF2XMASGE.jpg
7,https://www.infobae.com/politica/2021/04/08/el-senado-convertira-en-ley-la-modificacion-del-impuesto-a-las-ganancias-y-del-monotributo/,El Senado convertirá en ley la modificación del Impuesto a las Ganancias y del Monotributo,https://www.infobae.com/politica/2021/04/08/el-senado-convertira-en-ley-la-modificacion-del-impuesto-a-las-ganancias-y-del-monotributo/,https://cloudfront-us-east-1.images.arcpublishing.com/infobae/ZUHOVQYCERBRVM5E4VQPBSDONM.jpg
8,https://www.infobae.com/teleshow/infoshow/2021/04/08/tension-amorosa-celeste-muriega-y-hernan-drago-contaron-que-es-lo-que-mas-les-gusta-del-otro/,Tensión amorosa: Celeste Muriega y Hernán Drago contaron qué es lo que más les gusta del otro,https://www.infobae.com/teleshow/infoshow/2021/04/08/tension-amorosa-celeste-muriega-y-hernan-drago-contaron-que-es-lo-que-mas-les-gusta-del-otro/,https://cloudfront-us-east-1.images.arcpublishing.com/infobae/XUB5HPAU4ZFDFNPWS2IXS7TI4U.jpg
9,https://www.infobae.com/teleshow/infoshow/2021/04/08/la-curiosa-devolucion-de-german-martitegui-a-una-preparacion-de-cande-vetrano-en-masterchef-celebrity-2-me-la-untaria-por-todo-el-cuerpo/,La curiosa devolución de Germán Martitegui a una preparación de Cande Vetrano en Masterchef Celebrity 2: “Me la untaría por todo el cuerpo”,https://www.infobae.com/teleshow/infoshow/2021/04/08/la-curiosa-devolucion-de-german-martitegui-a-una-preparacion-de-cande-vetrano-en-masterchef-celebrity-2-me-la-untaria-por-todo-el-cuerpo/,https://cloudfront-us-east-1.images.arcpublishing.com/infobae/Q3UV2FK575GZBLFXI4UOT3USJM.jpg
10,https://www.infobae.com/deportes/2021/04/08/la-metamorfosis-de-federico-girotti-para-transformarse-en-el-9-que-gallardo-necesita-para-river-me-cambio-la-cabeza/,La metamorfosis de Federico Girotti para transformarse en el 9 que Gallardo necesita para River: “Me cambió la cabeza”,https://www.infobae.com/deportes/2021/04/08/la-metamorfosis-de-federico-girotti-para-transformarse-en-el-9-que-gallardo-necesita-para-river-me-cambio-la-cabeza/,https://cloudfront-us-east-1.images.arcpublishing.com/infobae/VYRAAVR3XRC4NGZ4OFS4QM2RFI.jpg
11,https://www.infobae.com/politica/2021/04/08/nuevas-restricciones-por-la-segunda-ola-de-covid-en-argentina-15-dudas-y-preguntas-y-sus-respuestas/,Nuevas restricciones por la segunda ola de COVID en Argentina: 15 dudas y preguntas y sus respuestas,https://www.infobae.com/politica/2021/04/08/nuevas-restricciones-por-la-segunda-ola-de-covid-en-argentina-15-dudas-y-preguntas-y-sus-respuestas/,https://cloudfront-us-east-1.images.arcpublishing.com/infobae/ZR26NYMZLJCSVJBAVUNOIQI2RU.jpg
12,https://www.infobae.com/politica/2021/04/08/santiago-cafiero-las-provincias-la-ciudad-de-buenos-aires-y-los-privados-pueden-comprar-vacunas-por-su-cuenta/,"Santiago Cafiero: “Las provincias, la Ciudad de Buenos Aires y los privados pueden comprar vacunas por su cuenta”",https://www.infobae.com/politica/2021/04/08/santiago-cafiero-las-provincias-la-ciudad-de-buenos-aires-y-los-privados-pueden-comprar-vacunas-por-su-cuenta/,https://cloudfront-us-east-1.images.arcpublishing.com/infobae/T6U7E3QD7BEJJGMNK43EQKNSGM.jpg
13,https://www.infobae.com/politica/2021/04/08/la-segunda-ola-de-coronavirus-complica-los-dialogos-politicos-entre-el-gobierno-y-juntos-por-el-cambio/,La segunda ola de coronavirus complica los diálogos políticos entre el Gobierno y Juntos por el Cambio ,https://www.infobae.com/politica/2021/04/08/la-segunda-ola-de-coronavirus-complica-los-dialogos-politicos-entre-el-gobierno-y-juntos-por-el-cambio/,https://cloudfront-us-east-1.images.arcpublishing.com/infobae/ZGROXHKM3RCQDMCCWQK67PDXHY.jpg
14,https://www.infobae.com/teleshow/infoshow/2021/04/08/el-pibe-de-charles-chaplin-una-pelicula-marcada-por-las-grandes-tragedias-en-la-vida-del-realizador/,"El pibe de Charles Chaplin, una película marcada por las grandes tragedias en la vida del realizador",https://www.infobae.com/teleshow/infoshow/2021/04/08/el-pibe-de-charles-chaplin-una-pelicula-marcada-por-las-grandes-tragedias-en-la-vida-del-realizador/,https://cloudfront-us-east-1.images.arcpublishing.com/infobae/B5TE5L76NNGNFKPWJCXC3ZPYHQ.jpg
15,https://www.infobae.com/politica/2021/04/08/daniel-gollan-hablo-de-las-nuevas-restricciones-el-hombre-es-bueno-pero-si-se-lo-controla-es-mejor/,Daniel Gollan habló de las nuevas restricciones: “El hombre es bueno pero si se lo controla es mejor”,https://www.infobae.com/politica/2021/04/08/daniel-gollan-hablo-de-las-nuevas-restricciones-el-hombre-es-bueno-pero-si-se-lo-controla-es-mejor/,https://cloudfront-us-east-1.images.arcpublishing.com/infobae/GGLNAQXUANGPNFZ5FPX4M56DKI.jpg
16,https://www.infobae.com/america/tendencias-america/2021/04/08/el-consumo-de-carne-en-forma-moderada-es-clave-para-el-desarrollo/,El consumo de carne en forma moderada es clave para el desarrollo,https://www.infobae.com/america/tendencias-america/2021/04/08/el-consumo-de-carne-en-forma-moderada-es-clave-para-el-desarrollo/,https://cloudfront-us-east-1.images.arcpublishing.com/infobae/5F4QNSFVHVADTL5IS3YCKLAOVA.jpg
17,https://www.infobae.com/politica/2021/04/08/el-tenso-cruce-entre-la-ministra-vizzotti-y-cristina-perez-por-el-plan-de-vacunacion-contra-el-coronavirus/,El tenso cruce entre la ministra Vizzotti y Cristina Pérez por el plan de vacunación contra el coronavirus ,https://www.infobae.com/politica/2021/04/08/el-tenso-cruce-entre-la-ministra-vizzotti-y-cristina-perez-por-el-plan-de-vacunacion-contra-el-coronavirus/,https://cloudfront-us-east-1.images.arcpublishing.com/infobae/24X67JOWNFC3VNF3TBCMHQ5AEI.png
18,https://www.infobae.com/politica/2021/04/07/vacunas-caba-tiene-stock-hasta-el-viernes-y-hay-municipios-bonaerenses-que-no-recibieron-dosis-las-ultimas-dos-semanas/,Vacunas: CABA tiene stock hasta el viernes y hay municipios bonaerenses que no recibieron dosis las últimas dos semanas,https://www.infobae.com/politica/2021/04/07/vacunas-caba-tiene-stock-hasta-el-viernes-y-hay-municipios-bonaerenses-que-no-recibieron-dosis-las-ultimas-dos-semanas/,https://cloudfront-us-east-1.images.arcpublishing.com/infobae/DIR3KJV6PNAX5LRCAI76BKFKAU.jpg
19,https://www.infobae.com/america/america-latina/2021/04/07/brasil-detecto-una-nueva-variante-del-coronavirus-en-belo-horizonte/,Brasil detectó una nueva variante del coronavirus en Belo Horizonte,https://www.infobae.com/america/america-latina/2021/04/07/brasil-detecto-una-nueva-variante-del-coronavirus-en-belo-horizonte/,https://cloudfront-us-east-1.images.arcpublishing.com/infobae/RUTSIU4QCBC6PK5ZYL52ARNQJE.jpg
20,https://www.infobae.com/teleshow/infoshow/2021/04/08/del-atendedor-de-boludos-a-ricardo-fort-o-mauro-viale-la-historia-detras-de-los-munecos-del-jurado-de-masterchef-celebrity/,Del “atendedor de boludos” a Ricardo Fort o Mauro Viale: la historia detrás de los muñecos del jurado de Masterchef Celebrity,https://www.infobae.com/teleshow/infoshow/2021/04/08/del-atendedor-de-boludos-a-ricardo-fort-o-mauro-viale-la-historia-detras-de-los-munecos-del-jurado-de-masterchef-celebrity/,https://cloudfront-us-east-1.images.arcpublishing.com/infobae/EIYJ2UKF5VCULH54C7WLWSCGAU.jpg
21,https://www.infobae.com/america/tendencias-america/2021/04/08/el-ebola-esta-de-regreso-cuales-son-las-claves-para-gestionar-con-exito-el-brote/,¿El ébola está de regreso? Cuáles son las claves para gestionar con éxito el brote,https://www.infobae.com/america/tendencias-america/2021/04/08/el-ebola-esta-de-regreso-cuales-son-las-claves-para-gestionar-con-exito-el-brote/,https://cloudfront-us-east-1.images.arcpublishing.com/infobae/667HMMLDDZCQZJQJL6RPCGN5PE.jpg
22,https://www.infobae.com/politica/2021/04/08/en-una-reunion-marcada-por-la-desconfianza-juntos-por-el-cambio-le-exigira-al-gobierno-una-ley-para-posponer-las-paso/,"En una reunión marcada por la desconfianza, Juntos por el Cambio le exigirá al Gobierno una ley para posponer las PASO",https://www.infobae.com/politica/2021/04/08/en-una-reunion-marcada-por-la-desconfianza-juntos-por-el-cambio-le-exigira-al-gobierno-una-ley-para-posponer-las-paso/,https://cloudfront-us-east-1.images.arcpublishing.com/infobae/4IWRN2OEBJH5PFAS5VTUIGFVME.jpg
23,https://www.infobae.com/economia/2021/04/08/la-segunda-ola-del-coronavirus-hace-temblar-el-plan-de-martin-guzman-para-reducir-el-deficit-y-la-inflacion/,La segunda ola del coronavirus hace temblar el plan de Martín Guzmán para reducir el déficit y la inflación,https://www.infobae.com/economia/2021/04/08/la-segunda-ola-del-coronavirus-hace-temblar-el-plan-de-martin-guzman-para-reducir-el-deficit-y-la-inflacion/,https://cloudfront-us-east-1.images.arcpublishing.com/infobae/YZSTBQVBG5FZVNGA322BTCU4GI.jpg
24,https://www.infobae.com/politica/2021/04/07/quien-es-craig-faller-el-enviado-de-biden-a-la-argentina-combatio-a-los-talibanes-y-rechazo-un-golpe-militar-contra-maduro/,"Quién es Craig Faller, el enviado de Biden a la Argentina: combatió a los talibanes y rechazó un golpe militar contra Maduro",https://www.infobae.com/politica/2021/04/07/quien-es-craig-faller-el-enviado-de-biden-a-la-argentina-combatio-a-los-talibanes-y-rechazo-un-golpe-militar-contra-maduro/,https://cloudfront-us-east-1.images.arcpublishing.com/infobae/VW62SIWNTZC7TCCVMDN4SPOSHE.jpg
25,https://www.infobae.com/deportes/2021/04/08/la-comision-directiva-de-boca-le-acepto-la-renuncia-a-mario-pergolini-como-vicepresidente-primero/,La Comisión Directiva de Boca le aceptó la renuncia a Mario Pergolini como vicepresidente primero,https://www.infobae.com/deportes/2021/04/08/la-comision-directiva-de-boca-le-acepto-la-renuncia-a-mario-pergolini-como-vicepresidente-primero/,https://cloudfront-us-east-1.images.arcpublishing.com/infobae/3JFAUG5EDRFKPEPD4L2QKPOQ5Q.jpg
26,https://www.infobae.com/sociedad/policiales/2021/04/07/casacion-absolvio-a-la-mujer-que-habia-sido-condenada-por-resistencia-a-la-autoridad-tras-besar-a-su-esposa/,Casación absolvió a la mujer que había sido condenada por resistencia a la autoridad tras besar a su esposa,https://www.infobae.com/sociedad/policiales/2021/04/07/casacion-absolvio-a-la-mujer-que-habia-sido-condenada-por-resistencia-a-la-autoridad-tras-besar-a-su-esposa/,https://cloudfront-us-east-1.images.arcpublishing.com/infobae/4CJV6DFD7NGWHGYTAOLZ75AP5Y.jpeg
27,https://www.infobae.com/sociedad/policiales/2021/04/07/crimen-de-fernando-baez-sosa-la-justicia-confirmo-la-elevacion-a-juicio-de-los-rugbiers-y-sobreseyo-a-alejo-milanesi/,Crimen de Fernando Báez Sosa: la Justicia confirmó la elevación a juicio de los rugbiers y sobreseyó a Alejo Milanesi,https://www.infobae.com/sociedad/policiales/2021/04/07/crimen-de-fernando-baez-sosa-la-justicia-confirmo-la-elevacion-a-juicio-de-los-rugbiers-y-sobreseyo-a-alejo-milanesi/,https://cloudfront-us-east-1.images.arcpublishing.com/infobae/YZNX6KJATFCX7KYAKN3K2UN6YQ.jpg
28,https://www.infobae.com/sociedad/policiales/2021/04/08/un-gendarme-se-tiroteo-con-cuatro-ladrones-en-la-matanza-uno-murio-y-otro-resulto-herido/,Un gendarme se tiroteó con cuatro ladrones en La Matanza: uno murió y otro resultó herido ,https://www.infobae.com/sociedad/policiales/2021/04/08/un-gendarme-se-tiroteo-con-cuatro-ladrones-en-la-matanza-uno-murio-y-otro-resulto-herido/,https://cloudfront-us-east-1.images.arcpublishing.com/infobae/E7HZUB7ZKVEGJBXNBTWE6XNUTY.jfif
29,https://www.infobae.com/economia/2021/04/08/el-ministro-de-economia-emprende-su-cruzada-por-europa-para-postergar-el-pago-de-la-deuda-con-el-fmi-y-el-club-de-paris/,El ministro de Economía emprende su cruzada por Europa para postergar el pago de la deuda con el FMI y el Club de París,https://www.infobae.com/economia/2021/04/08/el-ministro-de-economia-emprende-su-cruzada-por-europa-para-postergar-el-pago-de-la-deuda-con-el-fmi-y-el-club-de-paris/,https://cloudfront-us-east-1.images.arcpublishing.com/infobae/DA56FXE4BLJYVG5VZ5KDAPRJ5A.jpg
30,https://www.infobae.com/economia/2021/04/08/el-mercado-sintio-el-impacto-del-anuncio-de-nuevas-restricciones-y-aumento-la-demanda-de-dolares/,El mercado sintió el impacto del anuncio de nuevas restricciones y aumentó la demanda de dólares ,https://www.infobae.com/economia/2021/04/08/el-mercado-sintio-el-impacto-del-anuncio-de-nuevas-restricciones-y-aumento-la-demanda-de-dolares/,https://cloudfront-us-east-1.images.arcpublishing.com/infobae/VRIR4ZZ3TRGUTIFB5T737YPSYI.jpg
31,https://www.infobae.com/deportes/2021/04/08/una-interna-sangrienta-y-los-tentaculos-del-narcotrafico-condenaron-por-asesinato-al-lider-de-la-barra-all-boys/,Una interna sangrienta y los tentáculos del narcotráfico: condenaron por asesinato al líder de la barra All Boys,https://www.infobae.com/deportes/2021/04/08/una-interna-sangrienta-y-los-tentaculos-del-narcotrafico-condenaron-por-asesinato-al-lider-de-la-barra-all-boys/,https://cloudfront-us-east-1.images.arcpublishing.com/infobae/RCBE3EYJ7FAHLM2CUJ66W5AE5M.jpg
32,https://www.infobae.com/cultura/2021/04/08/reabrio-el-lacma-en-los-angeles-tickets-en-linea-visitantes-con-cubreboca-y-mucho-arte-contemporaneo/,"Reabrió el LACMA en Los Angeles: tickets en línea, visitantes con cubreboca y mucho arte contemporáneo ",https://www.infobae.com/cultura/2021/04/08/reabrio-el-lacma-en-los-angeles-tickets-en-linea-visitantes-con-cubreboca-y-mucho-arte-contemporaneo/,https://cloudfront-us-east-1.images.arcpublishing.com/infobae/JLFTBVSTOZAU5DBZLBNSMLPOC4.JPG
33,https://www.infobae.com/america/eeuu/2021/04/05/miami-dade-levanta-el-toque-de-queda-los-comercios-podran-permanecer-abiertos-mas-alla-de-la-medianoche/,"Tras el exitoso plan de vacunación, Miami levanta todas las restricciones nocturnas",https://www.infobae.com/america/eeuu/2021/04/05/miami-dade-levanta-el-toque-de-queda-los-comercios-podran-permanecer-abiertos-mas-alla-de-la-medianoche/,https://cloudfront-us-east-1.images.arcpublishing.com/infobae/A5HDMUBWGZGKXNN7NVKLJVVURI.jpg
34,https://www.infobae.com/deportes/2021/04/08/tras-la-inesperada-baja-de-capaldo-por-covid-19-el-consejo-de-futbol-de-boca-acelero-gestiones-por-un-lateral-derecho-extranjero/,"Tras la inesperada baja de Capaldo por COVID-19, el Consejo de Fútbol de Boca aceleró gestiones por un lateral derecho extranjero",https://www.infobae.com/deportes/2021/04/08/tras-la-inesperada-baja-de-capaldo-por-covid-19-el-consejo-de-futbol-de-boca-acelero-gestiones-por-un-lateral-derecho-extranjero/,https://cloudfront-us-east-1.images.arcpublishing.com/infobae/PYVV57KRHJDKNBSXQHKHUK26RQ
35,https://www.infobae.com/teleshow/infoshow/2021/04/07/avanza-la-denuncia-de-thelma-fardin-contra-juan-darthes-el-actor-fue-acusado-formalmente-por-la-justicia-brasilera/,Avanza la denuncia de Thelma Fardín contra Juan Darthés: el actor fue acusado formalmente por la justicia brasileña,https://www.infobae.com/teleshow/infoshow/2021/04/07/avanza-la-denuncia-de-thelma-fardin-contra-juan-darthes-el-actor-fue-acusado-formalmente-por-la-justicia-brasilera/,https://cloudfront-us-east-1.images.arcpublishing.com/infobae/CVMLJ6FORZBJTAV545ZJCZAI24.jpg
36,https://www.infobae.com/economia/2021/04/07/apuesta-de-riesgo-como-funciona-la-estrategia-de-invertir-en-bonos-en-pesos-para-obtener-rentabilidad-de-hasta-10-en-dolares/,Cómo funciona la estrategia de invertir en bonos en pesos para obtener rentabilidad de hasta 10% en dólares,https://www.infobae.com/economia/2021/04/07/apuesta-de-riesgo-como-funciona-la-estrategia-de-invertir-en-bonos-en-pesos-para-obtener-rentabilidad-de-hasta-10-en-dolares/,https://cloudfront-us-east-1.images.arcpublishing.com/infobae/ILKKQ5B5XWYZ4QPR5533XOXENY.jpg
37,https://www.infobae.com/economia/2021/04/08/aunque-la-construccion-viene-en-recuperacion-en-marzo-se-freno-la-venta-de-materiales/,"Aunque la construcción viene en recuperación, en marzo se frenó la venta de materiales",https://www.infobae.com/economia/2021/04/08/aunque-la-construccion-viene-en-recuperacion-en-marzo-se-freno-la-venta-de-materiales/,https://cloudfront-us-east-1.images.arcpublishing.com/infobae/EYS7F5GA3ZEMJGSL2JDDHF37ME.jpg
38,https://www.infobae.com/economia/2021/04/08/inflacion-el-banco-central-termino-marzo-con-una-emision-de-135000-millones-en-marzo/,Inflación: el Banco Central terminó marzo con una emisión de $ 135.000 millones en marzo,https://www.infobae.com/economia/2021/04/08/inflacion-el-banco-central-termino-marzo-con-una-emision-de-135000-millones-en-marzo/,https://cloudfront-us-east-1.images.arcpublishing.com/infobae/5L5SOYV4VNGDHH5K2C745QRGG4.jpg
39,https://www.infobae.com/tendencias/2021/04/08/moda-y-trap-que-hay-detras-de-esta-nueva-fusion-que-fue-protagonista-en-bafweek/,Moda y trap: qué hay detrás de esta nueva fusión que fue protagonista en BAFWEEK,https://www.infobae.com/tendencias/2021/04/08/moda-y-trap-que-hay-detras-de-esta-nueva-fusion-que-fue-protagonista-en-bafweek/,https://cloudfront-us-east-1.images.arcpublishing.com/infobae/4S5YMVWHQ5DA3LG6OLD6FZ64II.jpg
40,https://www.infobae.com/salud/2021/04/08/sufre-hace-anos-de-migranas-y-nadie-le-pudo-dar-una-respuesta-el-porque-puede-estar-en-su-dieta/,¿Sufre hace años de migrañas y nadie le pudo dar una respuesta? El porqué puede estar en su dieta,https://www.infobae.com/salud/2021/04/08/sufre-hace-anos-de-migranas-y-nadie-le-pudo-dar-una-respuesta-el-porque-puede-estar-en-su-dieta/,https://cloudfront-us-east-1.images.arcpublishing.com/infobae/MMCXKKZ4UFDVHAZRPFBZIEFAXY.jpg
41,https://www.infobae.com/educacion/2021/04/07/que-es-una-cosmovision/,Qué es una cosmovisión,https://www.infobae.com/educacion/2021/04/07/que-es-una-cosmovision/,https://cloudfront-us-east-1.images.arcpublishing.com/infobae/7X6GOH4CNRD43JD5LLBCFDQHYM.jpg
42,https://www.infobae.com/educacion/2021/04/07/la-historia-ada-lovelace-una-pionera-de-la-computacion/,"La historia Ada Lovelace, una pionera de la computación",https://www.infobae.com/educacion/2021/04/07/la-historia-ada-lovelace-una-pionera-de-la-computacion/,https://cloudfront-us-east-1.images.arcpublishing.com/infobae/GMG7D4I7FJFLHBPLWLJDKOYH44.jpg
43,https://www.infobae.com/educacion/2021/04/07/usamos-bien-la-palabra-literalmente/,¿Usamos bien la palabra “literalmente”?,https://www.infobae.com/educacion/2021/04/07/usamos-bien-la-palabra-literalmente/,https://cloudfront-us-east-1.images.arcpublishing.com/infobae/WCNCV4WRENFD5ICFMKY7KY72OI.jpg
44,https://www.infobae.com/america/ciencia-america/2021/04/07/el-comite-de-expertos-de-la-ema-dijo-que-los-beneficios-de-la-vacuna-de-astrazeneca-superan-los-riesgos-de-sufrir-trombosis/,"El comité de expertos de la EMA halló vínculos entre la vacuna de AstraZeneca y casos de trombosis, pero dijo que los beneficios superan a los riesgos",https://www.infobae.com/america/ciencia-america/2021/04/07/el-comite-de-expertos-de-la-ema-dijo-que-los-beneficios-de-la-vacuna-de-astrazeneca-superan-los-riesgos-de-sufrir-trombosis/,https://cloudfront-us-east-1.images.arcpublishing.com/infobae/NNN62REMILV3UFB34X5W4KZC2A.jpg
45,https://www.infobae.com/america/ciencia-america/2021/04/07/como-sera-el-recorrido-de-las-46-millones-de-vacunas-de-oxford-astrazeneca-que-llegaran-a-la-argentina-desde-estados-unidos-y-mexico-entre-abril-y-mayo/,"Cómo será el recorrido de las 4,6 millones de vacunas de Oxford-AstraZeneca que llegarán a la Argentina desde Estados Unidos y México entre abril y mayo",https://www.infobae.com/america/ciencia-america/2021/04/07/como-sera-el-recorrido-de-las-46-millones-de-vacunas-de-oxford-astrazeneca-que-llegaran-a-la-argentina-desde-estados-unidos-y-mexico-entre-abril-y-mayo/,https://cloudfront-us-east-1.images.arcpublishing.com/infobae/6RRCITJCPYSG6XO53FWSFBYI6E.jpg
46,https://www.infobae.com/america/mundo/2021/04/07/los-reguladores-del-reino-unido-recomendaron-evitar-la-aplicacion-de-la-vacuna-de-astrazeneca-a-los-menores-de-30-anos/,Los reguladores del Reino Unido recomendaron evitar la aplicación de la vacuna de AstraZeneca a los menores de 30 años,https://www.infobae.com/america/mundo/2021/04/07/los-reguladores-del-reino-unido-recomendaron-evitar-la-aplicacion-de-la-vacuna-de-astrazeneca-a-los-menores-de-30-anos/,https://cloudfront-us-east-1.images.arcpublishing.com/infobae/GMCZT3JKLK4RR4GVJZYICDRNWQ.jpg
47,https://www.infobae.com/america/america-latina/2021/04/07/luis-lacalle-pou-anuncio-que-la-suspension-de-clases-presenciales-en-uruguay-continuara-al-menos-hasta-el-3-de-mayo/,Uruguay registró un nuevo récord de casos de COVID-19 y Lacalle Pou anunció que continuará la suspensión de clases presenciales ,https://www.infobae.com/america/america-latina/2021/04/07/luis-lacalle-pou-anuncio-que-la-suspension-de-clases-presenciales-en-uruguay-continuara-al-menos-hasta-el-3-de-mayo/,https://cloudfront-us-east-1.images.arcpublishing.com/infobae/PN5JT7744BCRJLAX7H675L57KE.jpg
48,https://www.infobae.com/america/ciencia-america/2021/04/07/un-estudio-a-mas-de-200-mil-pacientes-de-covid-19-concluyo-que-un-tercio-sufrio-trastornos-mentales-o-neurologicos/,Un estudio a más de 200 mil pacientes de COVID-19 concluyó que un tercio sufrió trastornos mentales o neurológicos,https://www.infobae.com/america/ciencia-america/2021/04/07/un-estudio-a-mas-de-200-mil-pacientes-de-covid-19-concluyo-que-un-tercio-sufrio-trastornos-mentales-o-neurologicos/,https://cloudfront-us-east-1.images.arcpublishing.com/infobae/EVP7NNJFMZDZLGSYCZYCDMSU5A.jpg
49,https://www.infobae.com/america/deportes/espn/2021/04/07/el-emocionante-festejo-de-paulo-dybala-anoto-el-2-0-frente-al-napoli-y-todo-el-plantel-corrio-a-abrazarlo/,El emocionante festejo de Paulo Dybala: anotó el 2-0 frente al Nápoli y todo el plantel corrió a abrazarlo,https://www.infobae.com/america/deportes/espn/2021/04/07/el-emocionante-festejo-de-paulo-dybala-anoto-el-2-0-frente-al-napoli-y-todo-el-plantel-corrio-a-abrazarlo/,https://cloudfront-us-east-1.images.arcpublishing.com/infobae/WGTFOTICQBDL5KIN35HPZWO5QE
50,https://www.infobae.com/deportes/2021/04/07/no-toques-la-parrilla-nacho-scocco-se-enfurecio-porque-un-amigo-intervino-en-su-asado-y-el-divertido-video-se-hizo-viral/,“¡No toqués la parrilla!”: Nacho Scocco se enfureció porque un amigo intervino en su asado y el divertido video es furor en las redes,https://www.infobae.com/deportes/2021/04/07/no-toques-la-parrilla-nacho-scocco-se-enfurecio-porque-un-amigo-intervino-en-su-asado-y-el-divertido-video-se-hizo-viral/,https://cloudfront-us-east-1.images.arcpublishing.com/infobae/FDQBBD6GWJH3LHMTABCUM7BWYE.jpg
