n,id,title,url,image
1,https://www.infobae.com/politica/2021/08/01/el-gobierno-decidio-usar-las-diferencias-en-juntos-por-el-cambio-para-fortalecer-su-tactica-electoral-y-ocultar-la-tension-interna-en-el-gabinete/,El Gobierno decidió usar las diferencias en Juntos por el Cambio para fortalecer su táctica electoral y ocultar la tensión interna en el Gabinete,https://www.infobae.com/politica/2021/08/01/el-gobierno-decidio-usar-las-diferencias-en-juntos-por-el-cambio-para-fortalecer-su-tactica-electoral-y-ocultar-la-tension-interna-en-el-gabinete/,https://cloudfront-us-east-1.images.arcpublishing.com/infobae/R5ZTVDBPXFG6NGXTWRWQ67BBY4.jpg
2,https://www.infobae.com/sociedad/2021/08/01/documentos-ineditos-las-cartas-que-lopez-rega-guardaba-de-peron-campora-neustadt-y-la-mujer-que-ocupo-su-habitacion-en-olivos/,"Documentos inéditos: las cartas que López Rega guardaba de Perón, Cámpora, Neustadt y la mujer que ocupó su habitación en Olivos",https://www.infobae.com/sociedad/2021/08/01/documentos-ineditos-las-cartas-que-lopez-rega-guardaba-de-peron-campora-neustadt-y-la-mujer-que-ocupo-su-habitacion-en-olivos/,https://cloudfront-us-east-1.images.arcpublishing.com/infobae/RYW65UYJ5JF7BFDW263OQTOODA.jpg
3,https://www.infobae.com/america/deportes/juegos-olimpicos/2021/08/01/argentina-se-juega-la-clasificacion-a-cuartos-de-final-de-los-juegos-olimpicos-en-basquet-ante-el-local-japon-hora-y-tv/,Contundente triunfo de Argentina ante Japón para clasificar a los cuartos de final del básquet masculino en los Juegos Olímpicos,https://www.infobae.com/america/deportes/juegos-olimpicos/2021/08/01/argentina-se-juega-la-clasificacion-a-cuartos-de-final-de-los-juegos-olimpicos-en-basquet-ante-el-local-japon-hora-y-tv/,https://cloudfront-us-east-1.images.arcpublishing.com/infobae/NXFEWIKBVI4A2AEURBGGTU23BI.jpg
4,https://www.infobae.com/politica/2021/08/01/diego-santilli-busca-una-foto-con-facundo-manes-para-llegar-a-una-tregua-en-la-dura-pelea-desatada-en-juntos-por-el-cambio/,Diego Santilli busca una foto con Facundo Manes para llegar a una tregua en la dura pelea desatada en Juntos por el Cambio,https://www.infobae.com/politica/2021/08/01/diego-santilli-busca-una-foto-con-facundo-manes-para-llegar-a-una-tregua-en-la-dura-pelea-desatada-en-juntos-por-el-cambio/,https://cloudfront-us-east-1.images.arcpublishing.com/infobae/TDHYMGRU3NFRFPGSNK5RMO3VPM.jpg
5,https://www.infobae.com/politica/2021/08/01/cual-es-el-patrimonio-de-los-precandidatos-bonaerenses-del-frente-de-todos-y-de-juntos-por-el-cambio/,Cuál es el patrimonio de los precandidatos bonaerenses del Frente de Todos y de Juntos por el Cambio,https://www.infobae.com/politica/2021/08/01/cual-es-el-patrimonio-de-los-precandidatos-bonaerenses-del-frente-de-todos-y-de-juntos-por-el-cambio/,https://cloudfront-us-east-1.images.arcpublishing.com/infobae/EJEL2SI7JZAQFPTIVPW55SRMVE.jpg
6,https://www.infobae.com/america/eeuu/2021/08/01/de-los-164-millones-de-estadounidenses-vacunados-menos-del-01-se-infecto-de-covid-19-y-solo-el-0001-murio/,"De los 164 millones de estadounidenses vacunados, menos del 0,1% se infectó de COVID-19 y solo el 0,001% murió ",https://www.infobae.com/america/eeuu/2021/08/01/de-los-164-millones-de-estadounidenses-vacunados-menos-del-01-se-infecto-de-covid-19-y-solo-el-0001-murio/,https://cloudfront-us-east-1.images.arcpublishing.com/infobae/K4CCYISE3BLLMEKYZS3XK5EQYI.jpg
7,https://www.infobae.com/sociedad/2021/08/01/son-argentinos-y-emigraron-a-hungria-en-busca-de-estabilidad-economica-no-vinimos-para-hacernos-ricos-sino-para-poder-ahorrar/,"Son argentinos y emigraron a Hungría en busca de estabilidad económica: “No vinimos para hacernos ricos, sino para poder ahorrar”",https://www.infobae.com/sociedad/2021/08/01/son-argentinos-y-emigraron-a-hungria-en-busca-de-estabilidad-economica-no-vinimos-para-hacernos-ricos-sino-para-poder-ahorrar/,https://cloudfront-us-east-1.images.arcpublishing.com/infobae/MO34H3FZFJBLBKH7N2GTQ4B6P4.jpg
8,https://www.infobae.com/opinion/2021/07/31/jose-pablo-feinmann-y-la-violacion-en-manada/,José Pablo Feinmann y la violación en manada,https://www.infobae.com/opinion/2021/07/31/jose-pablo-feinmann-y-la-violacion-en-manada/,https://cloudfront-us-east-1.images.arcpublishing.com/infobae/SAPRT35A6VANPGCSUIBAMFMDFI.jpg
9,https://www.infobae.com/opinion/2021/08/01/la-inflacion-lastima-pero-la-falta-de-dolares-mata/,"La inflación lastima, pero la falta de dólares mata",https://www.infobae.com/opinion/2021/08/01/la-inflacion-lastima-pero-la-falta-de-dolares-mata/,https://cloudfront-us-east-1.images.arcpublishing.com/infobae/U2BLTTGW3JDKJICNRQKDKFF2E4.jpeg
10,https://www.infobae.com/opinion/2021/08/01/argentina-patria-y-vida-que-modelo-de-pais-queremos/,Argentina patria y vida: ¿qué modelo de país queremos?,https://www.infobae.com/opinion/2021/08/01/argentina-patria-y-vida-que-modelo-de-pais-queremos/,https://cloudfront-us-east-1.images.arcpublishing.com/infobae/NUF7URISGZHH7DEPK7ZBBP3Y7Y.jpg
11,https://www.infobae.com/deportes/juegos-olimpicos/2021/08/01/los-posibles-rivales-de-argentina-en-basquet-y-cuando-se-jugaran-los-cuartos-de-final-de-los-juegos-olimpicos/,Contra quién jugará Argentina en básquet y cuándo se disputarán los cuartos de final de los Juegos Olímpicos,https://www.infobae.com/deportes/juegos-olimpicos/2021/08/01/los-posibles-rivales-de-argentina-en-basquet-y-cuando-se-jugaran-los-cuartos-de-final-de-los-juegos-olimpicos/,https://cloudfront-us-east-1.images.arcpublishing.com/infobae/LI6RXPJLWQPQGDSPUIJIVJYLYA.jpg
12,https://www.infobae.com/deportes/juegos-olimpicos/2021/08/01/scola-y-deck-se-tiraron-al-piso-para-recuperar-el-balon-y-campazzo-definio-con-un-triple-la-jugada-que-marco-el-triunfo-de-argentina/,Scola y Deck se tiraron al piso para recuperar el balón y Campazzo definió con un triple: la jugada que marcó el triunfo de Argentina,https://www.infobae.com/deportes/juegos-olimpicos/2021/08/01/scola-y-deck-se-tiraron-al-piso-para-recuperar-el-balon-y-campazzo-definio-con-un-triple-la-jugada-que-marco-el-triunfo-de-argentina/,https://cloudfront-us-east-1.images.arcpublishing.com/infobae/7H2TSNDIJRC7RDDBGUMB64UB6U.jpg
13,https://www.infobae.com/economia/2021/08/01/dolar-delta-y-deficit-las-tres-d-que-ponen-en-riesgo-el-plan-del-gobierno-para-llegar-mejor-a-las-elecciones/,"Dólar, Delta y Déficit: las tres “D” que ponen en riesgo el plan del Gobierno para llegar mejor a las elecciones",https://www.infobae.com/economia/2021/08/01/dolar-delta-y-deficit-las-tres-d-que-ponen-en-riesgo-el-plan-del-gobierno-para-llegar-mejor-a-las-elecciones/,https://cloudfront-us-east-1.images.arcpublishing.com/infobae/NOUCQCS6CBEP3BQG3SQT7BONPE.jpg
14,https://www.infobae.com/politica/2021/08/01/el-frente-de-todos-busca-unificar-la-campana-para-esquivar-tensiones-y-recuperar-el-voto-perdido-en-la-provincia-de-buenos-aires/,El Frente de Todos busca unificar la campaña para esquivar tensiones y recuperar el voto perdido en la Provincia de Buenos Aires,https://www.infobae.com/politica/2021/08/01/el-frente-de-todos-busca-unificar-la-campana-para-esquivar-tensiones-y-recuperar-el-voto-perdido-en-la-provincia-de-buenos-aires/,https://cloudfront-us-east-1.images.arcpublishing.com/infobae/VC5BFMQ6XRDUBJQ3SW5UPBWZNU.jpg
15,https://www.infobae.com/economia/2021/08/01/exodo-de-empresas-la-argentina-es-el-segundo-pais-con-peor-desempeno-del-mundo-en-materia-de-inversion-extranjera-directa/,Éxodo de empresas: la Argentina es el segundo país con peor desempeño del mundo en materia de inversión extranjera directa,https://www.infobae.com/economia/2021/08/01/exodo-de-empresas-la-argentina-es-el-segundo-pais-con-peor-desempeno-del-mundo-en-materia-de-inversion-extranjera-directa/,https://cloudfront-us-east-1.images.arcpublishing.com/infobae/VXFPDJ3BIZCCNKOW726PZU2WHA.jpg
16,https://www.infobae.com/politica/2021/07/31/en-un-encuentro-con-estudiantes-de-derecho-alberto-fernandez-propuso-discutir-la-duracion-de-los-jueces-en-sus-cargos/,"En un encuentro con estudiantes de derecho, Alberto Fernández propuso discutir la duración de los jueces en sus cargos",https://www.infobae.com/politica/2021/07/31/en-un-encuentro-con-estudiantes-de-derecho-alberto-fernandez-propuso-discutir-la-duracion-de-los-jueces-en-sus-cargos/,https://cloudfront-us-east-1.images.arcpublishing.com/infobae/X44E7SG6UBGX5LKF4W7R5J554A.png
17,https://www.infobae.com/politica/2021/08/01/el-factor-grabois-su-tension-con-el-gobierno-la-negociacion-con-cristina-kirchner-y-la-amenaza-de-volver-a-la-calle/,"El factor Grabois: su tensión con el Gobierno, la negociación con Cristina Kirchner y la amenaza de volver a la calle ",https://www.infobae.com/politica/2021/08/01/el-factor-grabois-su-tension-con-el-gobierno-la-negociacion-con-cristina-kirchner-y-la-amenaza-de-volver-a-la-calle/,https://cloudfront-us-east-1.images.arcpublishing.com/infobae/X6OB2THDCNCR3NRC5LHIFULSRU.jpg
18,https://www.infobae.com/cultura/2021/08/01/anticipo-exclusivo-de-borges-y-yo-de-jay-parini-el-hombre-que-convivio-una-semana-en-escocia-con-el-gran-escritor-argentino/,"Anticipo exclusivo de “Borges y yo”, de Jay Parini, el hombre que convivió una semana en Escocia con el gran escritor argentino",https://www.infobae.com/cultura/2021/08/01/anticipo-exclusivo-de-borges-y-yo-de-jay-parini-el-hombre-que-convivio-una-semana-en-escocia-con-el-gran-escritor-argentino/,https://cloudfront-us-east-1.images.arcpublishing.com/infobae/WSUF64GE5ZBLPMBQ4DVPCAY2HY.png
19,https://www.infobae.com/teleshow/2021/08/01/un-padre-abandonico-el-accidente-que-casi-le-cuesta-la-vida-su-escandalosa-infidelidad-kevin-hart-y-el-arte-de-convertir-sus-debilidades-en-fortalezas/,"Un padre abandónico, el accidente que casi le cuesta la vida, su escandalosa infidelidad: Kevin Hart y el arte de convertir sus debilidades en fortalezas",https://www.infobae.com/teleshow/2021/08/01/un-padre-abandonico-el-accidente-que-casi-le-cuesta-la-vida-su-escandalosa-infidelidad-kevin-hart-y-el-arte-de-convertir-sus-debilidades-en-fortalezas/,https://cloudfront-us-east-1.images.arcpublishing.com/infobae/M2KOGFP6K5BRNLDQOQ253WD7UQ.jpg
20,https://www.infobae.com/america/deportes/juegos-olimpicos/2021/08/01/alexander-zverev-hizo-historia-en-el-tenis-masculino-y-se-alzo-con-la-medalla-de-oro/,Alexander Zverev hizo historia en los Juegos Olímpicos y se alzó con la medalla de oro en el tenis masculino,https://www.infobae.com/america/deportes/juegos-olimpicos/2021/08/01/alexander-zverev-hizo-historia-en-el-tenis-masculino-y-se-alzo-con-la-medalla-de-oro/,https://cloudfront-us-east-1.images.arcpublishing.com/infobae/2H7FWEDXB77YS7OS4PR2B6BX2I.jpg
21,https://www.infobae.com/america/deportes/juegos-olimpicos/2021/07/31/agenda-de-los-juegos-olimpicos-dia-9-los-leones-van-por-las-semifinales-el-basquet-se-juega-la-ultima-ficha-y-el-voley-debera-vencer-a-estados-unidos/,"Agenda de los Juegos Olímpicos, día 9: Los Leones perdieron con Alemania, el básquet superó a Japón y el vóley deberá vencer a Estados Unidos",https://www.infobae.com/america/deportes/juegos-olimpicos/2021/07/31/agenda-de-los-juegos-olimpicos-dia-9-los-leones-van-por-las-semifinales-el-basquet-se-juega-la-ultima-ficha-y-el-voley-debera-vencer-a-estados-unidos/,https://cloudfront-us-east-1.images.arcpublishing.com/infobae/D2U3SZU6IVEEVOAG3QKZ6XOKII.jpg
22,https://www.infobae.com/deportes/juegos-olimpicos/2021/08/01/los-gladiadores-cayeron-ante-espana-y-se-despidieron-de-los-juegos-olimpicos-carou-y-sebastian-simonet-anunciaron-su-retiro/,Los Gladiadores cayeron ante España y se despidieron de los Juegos Olímpicos: Carou y Sebastián Simonet anunciaron su retiro,https://www.infobae.com/deportes/juegos-olimpicos/2021/08/01/los-gladiadores-cayeron-ante-espana-y-se-despidieron-de-los-juegos-olimpicos-carou-y-sebastian-simonet-anunciaron-su-retiro/,https://cloudfront-us-east-1.images.arcpublishing.com/infobae/2TZQKDNB5U32HKHRQ6O3Y3JXDA.jpg
23,https://www.infobae.com/deportes/juegos-olimpicos/2021/08/01/belen-casetta-tuvo-una-molestia-fisica-durante-su-carrera-y-quedo-eliminada-de-los-juegos-olimpicos-su-desgarrador-testimonio/,Belén Casetta tuvo una molestia física durante su carrera y quedó eliminada de los Juegos Olímpicos: su desgarrador testimonio,https://www.infobae.com/deportes/juegos-olimpicos/2021/08/01/belen-casetta-tuvo-una-molestia-fisica-durante-su-carrera-y-quedo-eliminada-de-los-juegos-olimpicos-su-desgarrador-testimonio/,https://cloudfront-us-east-1.images.arcpublishing.com/infobae/5Y5IQLMWQNFJJELR573QYGMMGA.jpg
24,https://www.infobae.com/deportes/juegos-olimpicos/2021/08/01/la-emocion-de-lange-y-carranza-quienes-disputaran-la-medal-race-de-nacra-17-sin-chances-de-podio-somos-finalistas-olimpicos-no-es-poca-cosa/,"La emoción de Lange y Carranza, quienes disputarán la Medal Race de Nacra 17 sin chances de podio: “Somos finalistas olímpicos, no es poca cosa”",https://www.infobae.com/deportes/juegos-olimpicos/2021/08/01/la-emocion-de-lange-y-carranza-quienes-disputaran-la-medal-race-de-nacra-17-sin-chances-de-podio-somos-finalistas-olimpicos-no-es-poca-cosa/,https://cloudfront-us-east-1.images.arcpublishing.com/infobae/JQ24L2DOWXD6HZ3HUUUZGK5DQU.jpg
25,https://www.infobae.com/politica/2021/08/01/el-frente-de-todos-intenta-correr-la-variante-delta-e-instalar-la-reactivacion-economica-en-el-discurso-de-campana/,El Frente de Todos intenta correr la variante Delta e instalar la reactivación económica en el discurso de campaña,https://www.infobae.com/politica/2021/08/01/el-frente-de-todos-intenta-correr-la-variante-delta-e-instalar-la-reactivacion-economica-en-el-discurso-de-campana/,https://cloudfront-us-east-1.images.arcpublishing.com/infobae/BGTMXQCEQZH5DHTW3PCZ2B35YA.jpg
26,https://www.infobae.com/sociedad/2021/08/01/la-salud-mental-en-juego-la-pandemia-chano-las-deportistas-y-por-que-se-estigmatiza-a-quienes-padecen-problemas-psiquiatricos/,"La salud mental en juego: la pandemia, Chano, las deportistas y por qué se estigmatiza a quienes padecen problemas psiquiátricos",https://www.infobae.com/sociedad/2021/08/01/la-salud-mental-en-juego-la-pandemia-chano-las-deportistas-y-por-que-se-estigmatiza-a-quienes-padecen-problemas-psiquiatricos/,https://cloudfront-us-east-1.images.arcpublishing.com/infobae/Q7ZA7TTWPJC67E2AYQYV4RMRBU.jpg
27,https://www.infobae.com/politica/2021/08/01/jose-luis-espert-la-gente-deberia-votarnos-sin-miedo-aunque-juntos-por-el-cambio-pierda-diputados-a-nuestras-manos/,"José Luis Espert: “La gente debería votarnos sin miedo, aunque Juntos por el Cambio pierda diputados a nuestras manos” ",https://www.infobae.com/politica/2021/08/01/jose-luis-espert-la-gente-deberia-votarnos-sin-miedo-aunque-juntos-por-el-cambio-pierda-diputados-a-nuestras-manos/,https://cloudfront-us-east-1.images.arcpublishing.com/infobae/M2YEBLEMMFF6RJBKSWS7J2JGFE.jpeg
28,https://www.infobae.com/teleshow/2021/08/01/florencia-pena-conto-que-se-comunica-con-su-padre-a-traves-de-los-registros-akashicos-la-muerte-es-un-paso-hacia-un-lugar-mejor/,Florencia Peña contó que se comunica con su padre a través de los registros akáshicos: “La muerte es un paso hacia un lugar mejor ”,https://www.infobae.com/teleshow/2021/08/01/florencia-pena-conto-que-se-comunica-con-su-padre-a-traves-de-los-registros-akashicos-la-muerte-es-un-paso-hacia-un-lugar-mejor/,https://cloudfront-us-east-1.images.arcpublishing.com/infobae/7NDOHLWELRFFREY5SBHVGFSTRM.jpg
29,https://www.infobae.com/economia/2021/08/01/cuanto-pierden-los-argentinos-por-mantener-pesos-a-tasa-cero-en-sus-cajas-de-ahorro-bancaria/,Cuánto pierden los argentinos por mantener pesos a tasa cero en sus cajas de ahorro bancaria,https://www.infobae.com/economia/2021/08/01/cuanto-pierden-los-argentinos-por-mantener-pesos-a-tasa-cero-en-sus-cajas-de-ahorro-bancaria/,https://cloudfront-us-east-1.images.arcpublishing.com/infobae/2AZICOPK2VHPXEN6C5SKCRZSBI.jpg
30,https://www.infobae.com/america/eeuu/2021/08/01/estados-unidos-no-cancelara-la-entregas-de-vacunas-por-razones-geopoliticas/,Estados Unidos no cancelará la entregas de vacunas por razones geopolíticas,https://www.infobae.com/america/eeuu/2021/08/01/estados-unidos-no-cancelara-la-entregas-de-vacunas-por-razones-geopoliticas/,https://cloudfront-us-east-1.images.arcpublishing.com/infobae/JONWFENIENDK5HU7ZIICNZCFJM.jpg
31,https://www.infobae.com/politica/2021/08/01/de-la-ucede-a-manes-la-parabola-de-emilio-monzo-el-cazador-oculto-de-la-politica-argentina/,"De la Ucedé a Manes: la parábola de Emilio Monzó, el cazador oculto de la política argentina",https://www.infobae.com/politica/2021/08/01/de-la-ucede-a-manes-la-parabola-de-emilio-monzo-el-cazador-oculto-de-la-politica-argentina/,https://cloudfront-us-east-1.images.arcpublishing.com/infobae/H2QKX5AMTZC3PHMKFZU4JXVMVU.jpg
32,https://www.infobae.com/politica/2021/08/01/alfredo-cornejo-si-hay-heridos-por-las-internas-deberan-cicatrizar-rapido-porque-el-electorado-pide-unidad/,"Alfredo Cornejo: “Si hay heridos por las internas, deberán cicatrizar rápido porque el electorado pide unidad” ",https://www.infobae.com/politica/2021/08/01/alfredo-cornejo-si-hay-heridos-por-las-internas-deberan-cicatrizar-rapido-porque-el-electorado-pide-unidad/,https://cloudfront-us-east-1.images.arcpublishing.com/infobae/UOTI4GFF2RHQTLMVUSOFICCBVY.jpg
33,https://www.infobae.com/politica/2021/08/01/florencia-carignano-las-restricciones-para-el-ingreso-al-pais-no-son-una-cuestion-de-odio-y-menos-algo-ideologico/,Florencia Carignano: “Las restricciones para el ingreso al país no son una cuestión de odio y menos algo ideológico”,https://www.infobae.com/politica/2021/08/01/florencia-carignano-las-restricciones-para-el-ingreso-al-pais-no-son-una-cuestion-de-odio-y-menos-algo-ideologico/,https://cloudfront-us-east-1.images.arcpublishing.com/infobae/NYOAY3ASXJEEBBL3YGDGYON7NY.jpeg
34,https://www.infobae.com/economia/2021/08/01/en-el-ano-de-la-pandemia-la-argentina-retrocedio-al-puesto-30-entre-las-economias-globales/,En el año de la pandemia la Argentina retrocedió al puesto 30 entre las economías globales,https://www.infobae.com/economia/2021/08/01/en-el-ano-de-la-pandemia-la-argentina-retrocedio-al-puesto-30-entre-las-economias-globales/,https://cloudfront-us-east-1.images.arcpublishing.com/infobae/DUGD7ZAJ2NBQJP6KHYL3CKBACM.jpg
35,https://www.infobae.com/america/america-latina/2021/08/01/cual-es-el-secreto-de-vilcabamba-el-valle-ecuatoriano-donde-las-personas-viven-mas-100-anos/,"Cuál es el secreto de Vilcabamba, el valle ecuatoriano donde las personas viven más 100 años",https://www.infobae.com/america/america-latina/2021/08/01/cual-es-el-secreto-de-vilcabamba-el-valle-ecuatoriano-donde-las-personas-viven-mas-100-anos/,https://cloudfront-us-east-1.images.arcpublishing.com/infobae/NK4YIUJF4NFIZAGVPNTC46CX4I.jpg
36,https://www.infobae.com/sociedad/2021/08/01/por-que-se-toma-cana-con-ruda-el-1-de-agosto-en-el-dia-de-la-pachamama/,"Por qué se toma caña con ruda el 1° de agosto, en el Día de la Pachamama",https://www.infobae.com/sociedad/2021/08/01/por-que-se-toma-cana-con-ruda-el-1-de-agosto-en-el-dia-de-la-pachamama/,https://arc-anglerfish-arc2-prod-infobae.s3.amazonaws.com/public/HRWBWEZD5ZEGLMSHLGXIS4AOWA
37,https://www.infobae.com/cultura/2021/08/01/neruda-callate-tu-a-50-anos-del-nobel-cuestionan-al-poeta-chileno-por-el-relato-de-una-violacion-en-sus-memorias/,"Neruda, cállate tú: a 50 años del Nobel, cuestionan al poeta chileno por el relato de una violación en sus memorias",https://www.infobae.com/cultura/2021/08/01/neruda-callate-tu-a-50-anos-del-nobel-cuestionan-al-poeta-chileno-por-el-relato-de-una-violacion-en-sus-memorias/,https://cloudfront-us-east-1.images.arcpublishing.com/infobae/7EUTHTA3KVAIZGDRPMM373XK6M.png
38,https://www.infobae.com/sociedad/2021/08/01/cien-anos-atras-cuando-todos-los-argentinos-eran-soldados-pero-cada-uno-a-su-hora-y-no-por-toda-la-vida/,"Cien años atrás: cuando todos los argentinos eran soldados, pero “cada uno a su hora y no por toda la vida”",https://www.infobae.com/sociedad/2021/08/01/cien-anos-atras-cuando-todos-los-argentinos-eran-soldados-pero-cada-uno-a-su-hora-y-no-por-toda-la-vida/,https://cloudfront-us-east-1.images.arcpublishing.com/infobae/CKJUFKG4CRF2RJGDTILFMDNTWM.jpg
39,https://www.infobae.com/politica/2021/08/01/fanatico-de-giunta-y-del-boxeo-militante-universitario-y-uno-de-los-mimados-por-cristina-quien-es-el-nuevo-ministro-de-salud-bonaerense/,"Fanático de Giunta y del boxeo, militante universitario, y uno de los mimados por Cristina: quién es el nuevo ministro de Salud bonaerense",https://www.infobae.com/politica/2021/08/01/fanatico-de-giunta-y-del-boxeo-militante-universitario-y-uno-de-los-mimados-por-cristina-quien-es-el-nuevo-ministro-de-salud-bonaerense/,https://cloudfront-us-east-1.images.arcpublishing.com/infobae/ECKRZHCLCJDLNAGFTUL3BA6WFU.jpg
40,https://www.infobae.com/salud/2021/08/01/como-el-uso-de-drogas-impacta-en-el-cerebro-neuronas-exprimidas-y-envejecimiento-prematuro-para-el-gps-del-organismo/,Cómo el uso de drogas impacta en el cerebro: neuronas “exprimidas” y envejecimiento prematuro para el GPS del organismo,https://www.infobae.com/salud/2021/08/01/como-el-uso-de-drogas-impacta-en-el-cerebro-neuronas-exprimidas-y-envejecimiento-prematuro-para-el-gps-del-organismo/,https://cloudfront-us-east-1.images.arcpublishing.com/infobae/DIF4A5L3UNEZ3P7WHYGSR6T7EI.jpg
41,https://www.infobae.com/economia/2021/08/01/ricardo-delgado-director-de-analytica-la-argentina-no-cuenta-con-los-dolares-suficientes-para-que-la-economia-funcione/,"Ricardo Delgado, director de Analytica: “La Argentina no cuenta con los dólares suficientes para que la economía funcione”",https://www.infobae.com/economia/2021/08/01/ricardo-delgado-director-de-analytica-la-argentina-no-cuenta-con-los-dolares-suficientes-para-que-la-economia-funcione/,https://cloudfront-us-east-1.images.arcpublishing.com/infobae/V3IGWLDUEFEV5JYBLXEEY4O4DQ.jpg
42,https://www.infobae.com/opinion/2021/08/01/el-atraso-del-progreso/,El atraso del progreso,https://www.infobae.com/opinion/2021/08/01/el-atraso-del-progreso/,https://cloudfront-us-east-1.images.arcpublishing.com/infobae/KMHF7665MFFSLL6SRIE3T7HVMM.jpg
43,https://www.infobae.com/opinion/2021/08/01/jovenes-y-adultos-mayores-segmentos-clave-en-la-antesala-de-la-campana/,Jóvenes y adultos mayores: segmentos clave en la antesala de la campaña,https://www.infobae.com/opinion/2021/08/01/jovenes-y-adultos-mayores-segmentos-clave-en-la-antesala-de-la-campana/,https://cloudfront-us-east-1.images.arcpublishing.com/infobae/ZQ6PA3DALRH5JBZS7DI4UAFTUU.jpg
44,https://www.infobae.com/opinion/2021/08/01/incendios-en-los-humedales-y-crisis-ambiental/,Incendios en los humedales y crisis ambiental ,https://www.infobae.com/opinion/2021/08/01/incendios-en-los-humedales-y-crisis-ambiental/,https://cloudfront-us-east-1.images.arcpublishing.com/infobae/45PUIJVIWYZDLUCL2KZGCTEL3Y.jpg
45,https://www.infobae.com/opinion/2021/08/01/gracias-totales/,Gracias totales,https://www.infobae.com/opinion/2021/08/01/gracias-totales/,https://cloudfront-us-east-1.images.arcpublishing.com/infobae/QCUHDU2SIJHQLBWODT67JPBWOI.jpg
46,https://www.infobae.com/politica/2021/08/01/el-frente-de-todos-porteno-empieza-a-definir-su-estrategia-cuales-seran-los-principales-ejes-de-la-campana/,El Frente de Todos porteño empieza a definir su estrategia: cuáles serán los principales ejes de la campaña ,https://www.infobae.com/politica/2021/08/01/el-frente-de-todos-porteno-empieza-a-definir-su-estrategia-cuales-seran-los-principales-ejes-de-la-campana/,https://cloudfront-us-east-1.images.arcpublishing.com/infobae/CSE6MB3S7JDS3BUZRYSWFZXS7Y.jpg
47,https://www.infobae.com/economia/2021/08/01/el-nuevo-grito-de-alcorta-quien-es-pamela-rocchi-la-primera-candidata-trans-del-pais-que-busca-presidir-una-comuna-rural/,"El nuevo Grito de Alcorta: quién es Pamela Rocchi, la primera candidata trans del país que busca presidir una comuna rural",https://www.infobae.com/economia/2021/08/01/el-nuevo-grito-de-alcorta-quien-es-pamela-rocchi-la-primera-candidata-trans-del-pais-que-busca-presidir-una-comuna-rural/,https://cloudfront-us-east-1.images.arcpublishing.com/infobae/VPAN4QFBKBA53AVNH7T7W7ETR4.jpeg
48,https://www.infobae.com/teleshow/infoshow/2021/08/01/entre-bromas-anecdotas-cabalas-incumplidas-y-mucha-complicidad-pablo-echarri-fernan-miras-y-mike-amigorena-palpitan-el-estreno-de-art/,"Entre bromas, anécdotas, cábalas incumplidas y mucha complicidad, Pablo Echarri, Fernán Mirás y Mike Amigorena palpitan el estreno de ART",https://www.infobae.com/teleshow/infoshow/2021/08/01/entre-bromas-anecdotas-cabalas-incumplidas-y-mucha-complicidad-pablo-echarri-fernan-miras-y-mike-amigorena-palpitan-el-estreno-de-art/,https://cloudfront-us-east-1.images.arcpublishing.com/infobae/LPFCNXOYB5GF3B6CANEDZNC4FI.jpg
49,https://www.infobae.com/america/mundo/2021/08/01/quien-es-jimmy-barbecue-cherizier-el-ex-policia-que-se-convirtio-en-el-pandillero-mas-temido-de-haiti/,"Quién es Jimmy “Barbecue” Cherizier, el ex policía que se convirtió en el pandillero más temido de Haití",https://www.infobae.com/america/mundo/2021/08/01/quien-es-jimmy-barbecue-cherizier-el-ex-policia-que-se-convirtio-en-el-pandillero-mas-temido-de-haiti/,https://cloudfront-us-east-1.images.arcpublishing.com/infobae/OM3XGL5BHBAJVKPTUDNMOTQOOY.jpg
50,https://www.infobae.com/sociedad/2021/08/01/un-bombero-que-hace-25-anos-salvo-a-dos-hermanitos-en-un-incendio-suena-con-volver-a-verlos-quiero-saber-como-estan/,Un bombero que hace 25 años salvó a dos hermanitos en un incendio sueña con volver a verlos: “Quiero saber cómo están”,https://www.infobae.com/sociedad/2021/08/01/un-bombero-que-hace-25-anos-salvo-a-dos-hermanitos-en-un-incendio-suena-con-volver-a-verlos-quiero-saber-como-estan/,https://cloudfront-us-east-1.images.arcpublishing.com/infobae/H47ACCJLHVC3ZLILDPTOZNSQMI.jpeg
