n,id,title,url,image
1,https://www.infobae.com/politica/2021/03/31/internas-cruzadas-y-una-jugada-oficialista-tensan-el-clima-politico-y-embarran-el-camino-para-una-postergacion-de-las-paso/,Internas cruzadas y una jugada oficialista tensaron el clima político y embarraron el camino para una postergación de las PASO,https://www.infobae.com/politica/2021/03/31/internas-cruzadas-y-una-jugada-oficialista-tensan-el-clima-politico-y-embarran-el-camino-para-una-postergacion-de-las-paso/,https://cloudfront-us-east-1.images.arcpublishing.com/infobae/2R24N6ALTJCM3IF6NFNMFMZG7I.jpg
2,https://www.infobae.com/america/america-latina/2021/03/31/malvinas-el-gobierno-argentino-evalua-rescindir-acuerdos-historicos-con-el-reino-unido/,Malvinas: el gobierno argentino evalúa rescindir acuerdos históricos con el Reino Unido,https://www.infobae.com/america/america-latina/2021/03/31/malvinas-el-gobierno-argentino-evalua-rescindir-acuerdos-historicos-con-el-reino-unido/,https://cloudfront-us-east-1.images.arcpublishing.com/infobae/T5OXYMZ34ZA6VO3S5AYYI2HDPY.jpg
3,https://www.infobae.com/sociedad/2021/03/31/harrods-del-esplendor-a-la-decadencia-la-fabulosa-tienda-que-se-transformo-en-una-metafora-de-la-argentina/,"Harrods, del esplendor a la decadencia: la fabulosa tienda que se transformó en una metáfora de la Argentina",https://www.infobae.com/sociedad/2021/03/31/harrods-del-esplendor-a-la-decadencia-la-fabulosa-tienda-que-se-transformo-en-una-metafora-de-la-argentina/,https://cloudfront-us-east-1.images.arcpublishing.com/infobae/MMEALI54EJGOLOZJ7RL254YQGI.jpg
4,https://www.infobae.com/politica/2021/03/31/covid-19-cuales-son-los-departamentos-con-mayor-riesgo-epidemiologico-de-todo-el-pais/,COVID-19: cuáles son los departamentos con mayor riesgo epidemiológico de todo el país,https://www.infobae.com/politica/2021/03/31/covid-19-cuales-son-los-departamentos-con-mayor-riesgo-epidemiologico-de-todo-el-pais/,https://cloudfront-us-east-1.images.arcpublishing.com/infobae/PGO3VIRD2NAMZJIN36IZ6VCONA.jpg
5,https://www.infobae.com/politica/2021/03/31/el-gobierno-apuesta-a-acelerar-el-plan-de-vacunacion-como-principal-herramienta-para-combatir-la-segunda-ola-de-covid-19/,El Gobierno apuesta a acelerar el plan de vacunación como principal herramienta para combatir la segunda ola de COVID-19,https://www.infobae.com/politica/2021/03/31/el-gobierno-apuesta-a-acelerar-el-plan-de-vacunacion-como-principal-herramienta-para-combatir-la-segunda-ola-de-covid-19/,https://cloudfront-us-east-1.images.arcpublishing.com/infobae/AWESFHNND5G4LKV73NZYVGMSCQ
6,https://www.infobae.com/historias/2021/03/31/lleva-34-anos-preso-pero-una-terrible-duda-rodea-su-caso-es-un-asesino-ninja-o-un-hombre-inocente/,Lleva 34 años preso pero una terrible duda rodea su caso: ¿es un asesino ninja o un hombre inocente?,https://www.infobae.com/historias/2021/03/31/lleva-34-anos-preso-pero-una-terrible-duda-rodea-su-caso-es-un-asesino-ninja-o-un-hombre-inocente/,https://cloudfront-us-east-1.images.arcpublishing.com/infobae/554TLZ7XWZFTDCXKPDEWSFCGB4.jpg
7,https://www.infobae.com/sociedad/2021/03/31/el-bar-donde-cinco-amigos-se-reunian-en-su-adolescencia-cerro-por-la-pandemia-lo-compraron-y-hoy-es-un-exito/,"El bar donde cinco amigos se reunían en su adolescencia cerró por la pandemia, lo compraron y hoy es un éxito",https://www.infobae.com/sociedad/2021/03/31/el-bar-donde-cinco-amigos-se-reunian-en-su-adolescencia-cerro-por-la-pandemia-lo-compraron-y-hoy-es-un-exito/,https://cloudfront-us-east-1.images.arcpublishing.com/infobae/GMQP3KHEERHY3EUCAXHSN7D7CQ.JPG
8,https://www.infobae.com/educacion/2021/03/31/un-sospechoso-milagro-academico-aprobo-8-finales-en-solo-dos-semanas-y-la-justicia-lo-investiga-junto-a-los-profesores/,Un sospechoso milagro académico: aprobó 8 finales en solo dos semanas y la Justicia lo investiga junto a los profesores,https://www.infobae.com/educacion/2021/03/31/un-sospechoso-milagro-academico-aprobo-8-finales-en-solo-dos-semanas-y-la-justicia-lo-investiga-junto-a-los-profesores/,https://cloudfront-us-east-1.images.arcpublishing.com/infobae/DLWMBT5XJRHAHAGC4XKNTKUD5Q.jpg
9,https://www.infobae.com/deportes/2021/03/31/boca-concreto-la-venta-de-dos-futbolistas-e-invertira-casi-10-millones-de-dolares-en-el-proximo-mercado/,Boca concretó la venta de dos futbolistas e invertirá casi 10 millones de dólares en el próximo mercado,https://www.infobae.com/deportes/2021/03/31/boca-concreto-la-venta-de-dos-futbolistas-e-invertira-casi-10-millones-de-dolares-en-el-proximo-mercado/,https://cloudfront-us-east-1.images.arcpublishing.com/infobae/Y54IDBBRE5G4ZNHQCNVKZ4RQZE.jpg
10,https://www.infobae.com/teleshow/infoshow/2021/03/31/rasputin-de-boney-m-idas-vueltas-tragedias-y-un-hit-de-los-70-que-hoy-es-tendencia-en-tiktok/,"“Rasputin” de Boney M.: Idas, vueltas, tragedias y un hit de los 70 que hoy es tendencia en TikTok",https://www.infobae.com/teleshow/infoshow/2021/03/31/rasputin-de-boney-m-idas-vueltas-tragedias-y-un-hit-de-los-70-que-hoy-es-tendencia-en-tiktok/,https://cloudfront-us-east-1.images.arcpublishing.com/infobae/EGAY36SJ3RAWVOSJYAUNQEW7UM.jpg
11,https://www.infobae.com/politica/2021/03/31/en-medio-de-un-clima-enrarecido-juntos-por-el-cambio-debatira-el-martes-proximo-la-propuesta-oficial-de-postergar-las-paso-por-un-mes/,"En medio de un clima enrarecido, Juntos por el Cambio debatirá el martes próximo la propuesta oficial de postergar las PASO por un mes",https://www.infobae.com/politica/2021/03/31/en-medio-de-un-clima-enrarecido-juntos-por-el-cambio-debatira-el-martes-proximo-la-propuesta-oficial-de-postergar-las-paso-por-un-mes/,https://cloudfront-us-east-1.images.arcpublishing.com/infobae/H7LFP7QPYRE2HHPTMFFJRSXAX4.jpg
12,https://www.infobae.com/politica/2021/03/31/maximo-kirchner-propone-a-vidal-y-rodriguez-larreta-un-acuerdo-politico-para-encarar-la-negociacion-con-el-fmi/,Máximo Kirchner propone a Vidal y Rodríguez Larreta un acuerdo político para encarar la negociación con el FMI,https://www.infobae.com/politica/2021/03/31/maximo-kirchner-propone-a-vidal-y-rodriguez-larreta-un-acuerdo-politico-para-encarar-la-negociacion-con-el-fmi/,https://cloudfront-us-east-1.images.arcpublishing.com/infobae/EKZ4YF5U55E5BG3QQ7DKXU4AF4.jpg
13,https://www.infobae.com/sociedad/2021/03/31/el-drama-de-los-que-trabajan-fuera-del-pais-y-temen-quedar-varados-por-la-pandemia/,El drama de los que trabajan fuera del país y temen quedar varados por la pandemia,https://www.infobae.com/sociedad/2021/03/31/el-drama-de-los-que-trabajan-fuera-del-pais-y-temen-quedar-varados-por-la-pandemia/,https://cloudfront-us-east-1.images.arcpublishing.com/infobae/HYZHFJBGZNFHPKGAA5J6ZJKQKQ.jpg
14,https://www.infobae.com/tendencias/2021/03/31/cuantas-veces-deberian-tener-sexo-las-parejas/,¿Cuántas veces deberían tener sexo las parejas?,https://www.infobae.com/tendencias/2021/03/31/cuantas-veces-deberian-tener-sexo-las-parejas/,https://cloudfront-us-east-1.images.arcpublishing.com/infobae/Q7DYD52UKJH2NGLTHNEV6RR3IU.jpg
15,https://www.infobae.com/america/tendencias-america/2021/03/31/el-mito-de-jeff-bezos-y-por-que-amar-tu-trabajo-no-te-hara-mas-feliz/,"El mito de Jeff Bezos, y por qué amar tu trabajo no te hará más feliz",https://www.infobae.com/america/tendencias-america/2021/03/31/el-mito-de-jeff-bezos-y-por-que-amar-tu-trabajo-no-te-hara-mas-feliz/,https://cloudfront-us-east-1.images.arcpublishing.com/infobae/STLJGFCK25FDZFDZHHJIS2SZHI.jpg
16,https://www.infobae.com/economia/2021/03/30/programa-atp-el-gobierno-sale-a-buscar-a-las-empresas-que-incumplieron-la-norma-y-les-exigira-que-devuelvan-los-fondos/,Programa ATP: el Gobierno sale a buscar a las empresas que incumplieron la norma y les exigirá que devuelvan los fondos,https://www.infobae.com/economia/2021/03/30/programa-atp-el-gobierno-sale-a-buscar-a-las-empresas-que-incumplieron-la-norma-y-les-exigira-que-devuelvan-los-fondos/,https://cloudfront-us-east-1.images.arcpublishing.com/infobae/KWAOJ6IOAJF6JGHZ6ZRV34KNCM.jpg
17,https://www.infobae.com/economia/2021/03/31/hoy-es-el-ultimo-dia-para-pedir-la-devolucion-del-35-por-la-compra-de-dolar-ahorro-o-gastos-con-tarjeta-en-dolares/,Hoy es el último día para pedir la devolución del 35% por la compra de dólar ahorro o gastos con tarjeta en dólares,https://www.infobae.com/economia/2021/03/31/hoy-es-el-ultimo-dia-para-pedir-la-devolucion-del-35-por-la-compra-de-dolar-ahorro-o-gastos-con-tarjeta-en-dolares/,https://cloudfront-us-east-1.images.arcpublishing.com/infobae/EBP7ZGK5CZGEDL5BGHALPFM3IY.jpg
18,https://www.infobae.com/america/ciencia-america/2021/03/31/las-personas-vacunadas-contra-el-covid-19-no-transmiten-el-virus-ni-se-enferman-segun-la-directora-de-los-cdc-de-estados-unidos/,"Las personas vacunadas contra el COVID-19 no transmiten el virus ni se enferman, según la directora de los CDC de Estados Unidos",https://www.infobae.com/america/ciencia-america/2021/03/31/las-personas-vacunadas-contra-el-covid-19-no-transmiten-el-virus-ni-se-enferman-segun-la-directora-de-los-cdc-de-estados-unidos/,https://cloudfront-us-east-1.images.arcpublishing.com/infobae/BHU7CO7RCBDQVITOK2OISGXRCA.jpg
19,https://www.infobae.com/politica/2021/03/31/la-justicia-habilito-el-ingreso-de-los-45-argentinos-varados-en-paso-de-los-libres/,La Justicia habilitó el ingreso de los 45 argentinos varados en Paso de los Libres,https://www.infobae.com/politica/2021/03/31/la-justicia-habilito-el-ingreso-de-los-45-argentinos-varados-en-paso-de-los-libres/,https://cloudfront-us-east-1.images.arcpublishing.com/infobae/DBH6W7BJO5FUXICMHTY6A2NY7U.jpg
20,https://www.infobae.com/autos/2021/03/30/volkswagen-o-voltswagen-la-polemica-estrategia-de-marketing-que-pone-en-vilo-a-la-industria-automotriz-y-podria-danar-su-imagen/,¿Volkswagen o Voltswagen? La polémica estrategia de marketing que pone en vilo a la industria automotriz y podría dañar su imagen,https://www.infobae.com/autos/2021/03/30/volkswagen-o-voltswagen-la-polemica-estrategia-de-marketing-que-pone-en-vilo-a-la-industria-automotriz-y-podria-danar-su-imagen/,https://cloudfront-us-east-1.images.arcpublishing.com/infobae/BAKAR26GZRCINCBM5O52B5ELGE.png
21,https://www.infobae.com/america/realeza/2021/03/30/en-su-mansion-y-con-un-equipo-medico-femenino-asi-planea-meghan-markle-el-parto-de-su-hija/,En su mansión y con un equipo médico femenino: así planea Meghan Markle el parto de su hija ,https://www.infobae.com/america/realeza/2021/03/30/en-su-mansion-y-con-un-equipo-medico-femenino-asi-planea-meghan-markle-el-parto-de-su-hija/,https://cloudfront-us-east-1.images.arcpublishing.com/infobae/DF26CPL44FGKLIQRPZAA2TCYMI.jpg
22,https://www.infobae.com/economia/2021/03/31/escalo-la-tension-con-uruguay-el-gobierno-trabo-un-metro-extra-de-dragado-del-rio-de-la-plata-que-mejoraba-el-puerto-de-montevideo/,Escaló la tensión con Uruguay: el Gobierno trabó un metro extra de dragado del Río de la Plata que mejoraba el puerto de Montevideo,https://www.infobae.com/economia/2021/03/31/escalo-la-tension-con-uruguay-el-gobierno-trabo-un-metro-extra-de-dragado-del-rio-de-la-plata-que-mejoraba-el-puerto-de-montevideo/,https://cloudfront-us-east-1.images.arcpublishing.com/infobae/NI2O6NXYHJHODFHL75TLRSRGPE.jpg
23,https://www.infobae.com/politica/2021/03/31/el-kirchnerismo-esta-decidido-a-ir-contra-el-procurador-eduardo-casal-y-estudia-alternativas-en-el-congreso-para-lograr-los-votos/,El kirchnerismo está decidido a ir contra el procurador Eduardo Casal y estudia alternativas en el Congreso para lograr los votos,https://www.infobae.com/politica/2021/03/31/el-kirchnerismo-esta-decidido-a-ir-contra-el-procurador-eduardo-casal-y-estudia-alternativas-en-el-congreso-para-lograr-los-votos/,https://cloudfront-us-east-1.images.arcpublishing.com/infobae/Q7YG5A757BEE7AKJU2J2KYJ7OY.jpg
24,https://www.infobae.com/politica/2021/03/31/impuesto-a-las-ganancias-para-empresas-el-oficialismo-y-la-oposicion-negocian-cambios-para-que-la-suba-impacte-en-menos-companias/,Impuesto a las Ganancias para empresas: el oficialismo y la oposición negocian cambios para que la suba impacte en menos compañías,https://www.infobae.com/politica/2021/03/31/impuesto-a-las-ganancias-para-empresas-el-oficialismo-y-la-oposicion-negocian-cambios-para-que-la-suba-impacte-en-menos-companias/,https://cloudfront-us-east-1.images.arcpublishing.com/infobae/B3JYQHCIKJCLLFFZ4LHEGODDRI.jpg
25,https://www.infobae.com/teleshow/infoshow/2021/03/30/la-crisis-de-llanto-de-cinthia-fernandez-al-hablar-de-su-relacion-con-matias-defederico-me-dice-que-va-a-contar-cosas-y-que-mis-hijas-sentiran-verguenza-de-mi/,La crisis de llanto de Cinthia Fernández: “Defederico me dice que contará cosas y mis hijas sentirán vergüenza de mí”,https://www.infobae.com/teleshow/infoshow/2021/03/30/la-crisis-de-llanto-de-cinthia-fernandez-al-hablar-de-su-relacion-con-matias-defederico-me-dice-que-va-a-contar-cosas-y-que-mis-hijas-sentiran-verguenza-de-mi/,https://cloudfront-us-east-1.images.arcpublishing.com/infobae/TXUNVINPPFF4NL42756EHZALLQ.jpg
26,https://www.infobae.com/america/mundo/2021/03/31/china-se-encuentra-bajo-presion-luego-de-que-la-oms-reavivara-la-teoria-de-que-el-virus-se-filtro-de-un-laboratorio-en-wuhan/,China bajo presión: la OMS revive la teoría de que el virus se filtró de un laboratorio en Wuhan ,https://www.infobae.com/america/mundo/2021/03/31/china-se-encuentra-bajo-presion-luego-de-que-la-oms-reavivara-la-teoria-de-que-el-virus-se-filtro-de-un-laboratorio-en-wuhan/,https://cloudfront-us-east-1.images.arcpublishing.com/infobae/IHAEMKRITVDATOQGWS3PUIVKNM.jpg
27,https://www.infobae.com/teleshow/infoshow/2021/03/31/daniel-araoz-perdio-el-humor-frente-al-jurado-de-masterchef-2-lo-que-ustedes-dicen-me-suena-agresivo-o-desagradable/,Daniel Aráoz perdió el humor frente al jurado de Masterchef Celebrity 2: “Lo que ustedes dicen  me suena agresivo o desagradable”,https://www.infobae.com/teleshow/infoshow/2021/03/31/daniel-araoz-perdio-el-humor-frente-al-jurado-de-masterchef-2-lo-que-ustedes-dicen-me-suena-agresivo-o-desagradable/,https://cloudfront-us-east-1.images.arcpublishing.com/infobae/HVN4WHXSVFDJNFYMNS3LWB4DJE.jpg
28,https://www.infobae.com/america/deportes/2021/03/31/la-uefa-cambia-por-completo-la-champions-league-mas-equipos-y-nuevo-formato/,La UEFA cambia por completo la Champions League: más equipos y nuevo formato,https://www.infobae.com/america/deportes/2021/03/31/la-uefa-cambia-por-completo-la-champions-league-mas-equipos-y-nuevo-formato/,https://cloudfront-us-east-1.images.arcpublishing.com/infobae/UWYMOFZ7IKKL2UJO25L7PT25DA.jpg
29,https://www.infobae.com/economia/2021/03/31/interna-empresarial-con-el-foco-en-la-relacion-con-el-gobierno-resurgieron-tensiones-y-no-hay-consenso-para-la-sucesion-en-la-uia/,"Interna empresarial: con el foco en la relación con el Gobierno, resurgieron tensiones y no hay consenso para la sucesión en la UIA",https://www.infobae.com/economia/2021/03/31/interna-empresarial-con-el-foco-en-la-relacion-con-el-gobierno-resurgieron-tensiones-y-no-hay-consenso-para-la-sucesion-en-la-uia/,https://cloudfront-us-east-1.images.arcpublishing.com/infobae/5SBHZYZDPRCBBH3HPEDERBFMJY.jpg
30,https://www.infobae.com/economia/2021/03/31/devolucion-del-15-en-compras-con-tarjeta-de-debito-el-gobierno-extendio-hasta-el-30-de-junio-el-beneficio-para-jubilados-y-auh/,Devolución del 15% en compras con tarjeta de débito: el Gobierno extendió hasta el 30 de junio el beneficio para jubilados y AUH,https://www.infobae.com/economia/2021/03/31/devolucion-del-15-en-compras-con-tarjeta-de-debito-el-gobierno-extendio-hasta-el-30-de-junio-el-beneficio-para-jubilados-y-auh/,https://cloudfront-us-east-1.images.arcpublishing.com/infobae/33N7VBSSOVG4TDKLNCC7V3MNKY.jpg
31,https://www.infobae.com/politica/2021/03/31/la-advertencia-del-gobierno-bonaerense-frente-a-la-segunda-ola-de-covid-19-si-el-contagio-sigue-de-manera-explosiva-tampoco-se-descarta-volver-a-la-fase-1/,La advertencia del gobierno bonaerense frente a la segunda ola de COVID-19: “Si el contagio sigue de manera explosiva tampoco se descarta volver a la Fase 1”,https://www.infobae.com/politica/2021/03/31/la-advertencia-del-gobierno-bonaerense-frente-a-la-segunda-ola-de-covid-19-si-el-contagio-sigue-de-manera-explosiva-tampoco-se-descarta-volver-a-la-fase-1/,https://cloudfront-us-east-1.images.arcpublishing.com/infobae/QEONMYBVW5AJLE767VE74POONQ.jpg
32,https://www.infobae.com/politica/2021/03/30/piden-una-consulta-popular-para-determinar-si-mendoza-debe-separarse-de-la-argentina/,Piden una consulta popular para determinar si Mendoza debe separarse de la Argentina,https://www.infobae.com/politica/2021/03/30/piden-una-consulta-popular-para-determinar-si-mendoza-debe-separarse-de-la-argentina/,https://cloudfront-us-east-1.images.arcpublishing.com/infobae/SQUAGZZPQFG4RBD5JJJGSPQHDQ.jpg
33,https://www.infobae.com/america/mundo/2021/03/31/murio-el-ladron-de-watergate-quien-fue-g-gordon-liddy-el-admirador-de-hitler-y-seguidor-de-nixon-que-al-salir-de-prision-se-convirtio-en-una-estrella-de-television/,"Murió a los 90 años G.Gordon Liddy, el ladrón de Watergate que se convirtió en un polémico conductor de radio",https://www.infobae.com/america/mundo/2021/03/31/murio-el-ladron-de-watergate-quien-fue-g-gordon-liddy-el-admirador-de-hitler-y-seguidor-de-nixon-que-al-salir-de-prision-se-convirtio-en-una-estrella-de-television/,https://cloudfront-us-east-1.images.arcpublishing.com/infobae/63RU4ZMJGJGITMIQRULNT5HVBM.jpg
34,https://www.infobae.com/economia/2021/03/31/el-impacto-de-la-segunda-ola-afectara-el-rebote-economico-y-las-cifras-fiscales-pero-en-forma-acotada/,El impacto de la “segunda ola” afectará el rebote económico y las cifras fiscales pero en forma acotada,https://www.infobae.com/economia/2021/03/31/el-impacto-de-la-segunda-ola-afectara-el-rebote-economico-y-las-cifras-fiscales-pero-en-forma-acotada/,https://cloudfront-us-east-1.images.arcpublishing.com/infobae/BKUJNXVBEBFD7ACPMZTC7X2AKA
35,https://www.infobae.com/america/deportes/espn/2021/03/31/el-duelo-mas-aspero-de-campazzo-desde-que-irrumpio-en-la-nba-desparramo-a-un-rival-en-una-cortina-y-lo-convirtio-en-tendencia/,El duelo más áspero de Campazzo desde que irrumpió en la NBA: desparramó a un rival en una cortina y lo convirtió en tendencia ,https://www.infobae.com/america/deportes/espn/2021/03/31/el-duelo-mas-aspero-de-campazzo-desde-que-irrumpio-en-la-nba-desparramo-a-un-rival-en-una-cortina-y-lo-convirtio-en-tendencia/,https://cloudfront-us-east-1.images.arcpublishing.com/infobae/42U5G5UAFVF3RNOWVUVFSFMX3Q.jpg
36,https://www.infobae.com/teleshow/infoshow/2021/03/31/la-nueva-ficcion-nordica-el-regreso-del-cazador-de-mafiosos-sicilianos-la-biopic-de-mike-tyson-y-todas-las-novedades-del-mundo-de-las-series/,"La nueva ficción nórdica, el regreso del cazador de mafiosos sicilianos, la biopic de Mike Tyson y todas las novedades del mundo de las series",https://www.infobae.com/teleshow/infoshow/2021/03/31/la-nueva-ficcion-nordica-el-regreso-del-cazador-de-mafiosos-sicilianos-la-biopic-de-mike-tyson-y-todas-las-novedades-del-mundo-de-las-series/,https://cloudfront-us-east-1.images.arcpublishing.com/infobae/AIUMI2NVA5BNFFXK6LA5HJNAV4.jpg
37,https://www.infobae.com/america/deportes/2021/03/31/cuales-son-los-50-nombres-que-lionel-scaloni-tiene-en-mente-para-armar-la-preseleccion-de-cara-a-la-copa-america/,Cuáles son los 50 nombres que Lionel Scaloni tiene en mente para armar la preselección de cara a la Copa América,https://www.infobae.com/america/deportes/2021/03/31/cuales-son-los-50-nombres-que-lionel-scaloni-tiene-en-mente-para-armar-la-preseleccion-de-cara-a-la-copa-america/,https://cloudfront-us-east-1.images.arcpublishing.com/infobae/54J3I4QRQRGJFJN6YSRY5TB6YQ.jpg
38,https://www.infobae.com/america/deportes/2021/03/30/el-plan-b-del-barcelona-si-no-llega-aguero-ira-a-la-carga-por-otro-goleador-argentino-para-retener-a-messi/,El plan B del Barcelona si no llega Agüero: irá a la carga por otro goleador argentino para retener a Messi,https://www.infobae.com/america/deportes/2021/03/30/el-plan-b-del-barcelona-si-no-llega-aguero-ira-a-la-carga-por-otro-goleador-argentino-para-retener-a-messi/,https://cloudfront-us-east-1.images.arcpublishing.com/infobae/SITBWI7BR5DSPFWY7QEO544LWQ.jpg
39,https://www.infobae.com/sociedad/2021/03/30/causa-maradona-la-justicia-pidio-investigar-los-movimientos-bancarios-de-los-medicos-de-diego/,Causa Maradona: la justicia pidió investigar los movimientos bancarios de los médicos de Diego,https://www.infobae.com/sociedad/2021/03/30/causa-maradona-la-justicia-pidio-investigar-los-movimientos-bancarios-de-los-medicos-de-diego/,https://cloudfront-us-east-1.images.arcpublishing.com/infobae/FAQES3JIF5H5TOHWY6VUJ7XR7M.jpg
40,https://www.infobae.com/teleshow/infoshow/2021/03/30/juana-viale-detallo-como-se-mantiene-comunicada-desde-que-dejo-de-usar-celular-soy-mucho-mas-feliz/,Juana Viale detalló cómo se mantiene comunicada desde que dejó de usar celular: “Soy mucho más feliz”,https://www.infobae.com/teleshow/infoshow/2021/03/30/juana-viale-detallo-como-se-mantiene-comunicada-desde-que-dejo-de-usar-celular-soy-mucho-mas-feliz/,https://cloudfront-us-east-1.images.arcpublishing.com/infobae/7SLUVZC3C5EQFPUWEILYGEVIIE.jpg
41,https://www.infobae.com/america/deportes/2021/03/31/por-la-crisis-del-covid-19-en-san-pablo-san-lorenzo-y-defensa-y-justicia-visitaran-a-santos-y-a-palmeiras-en-brasilia/,"Por la crisis del COVID-19 en San Pablo, San Lorenzo y Defensa y Justicia visitarán a Santos y a Palmeiras en Brasilia ",https://www.infobae.com/america/deportes/2021/03/31/por-la-crisis-del-covid-19-en-san-pablo-san-lorenzo-y-defensa-y-justicia-visitaran-a-santos-y-a-palmeiras-en-brasilia/,https://cloudfront-us-east-1.images.arcpublishing.com/infobae/FQ5IBVUO4BAY7MGZMQ27R33GBA.jpg
42,https://www.infobae.com/politica/2021/03/31/confirmaron-una-condena-contra-amado-boudou-debera-pagarle-una-indemnizacion-a-un-empresario-al-que-acuso-de-mafioso/,Confirmaron una condena contra Amado Boudou: deberá pagarle una indemnización a un empresario al que acusó de “mafioso”,https://www.infobae.com/politica/2021/03/31/confirmaron-una-condena-contra-amado-boudou-debera-pagarle-una-indemnizacion-a-un-empresario-al-que-acuso-de-mafioso/,https://cloudfront-us-east-1.images.arcpublishing.com/infobae/XTZX4TQTTREPVCPJ3EIVQTQNE4.jpg
43,https://www.infobae.com/sociedad/policiales/2021/03/30/condenaron-a-mas-de-9-anos-de-carcel-a-eugenio-veppo-por-matar-a-una-agente-de-transito/,Condenaron a 9 años y 3 meses de cárcel a Eugenio Veppo por matar a una agente de tránsito,https://www.infobae.com/sociedad/policiales/2021/03/30/condenaron-a-mas-de-9-anos-de-carcel-a-eugenio-veppo-por-matar-a-una-agente-de-transito/,https://cloudfront-us-east-1.images.arcpublishing.com/infobae/SXPKS7TVRVHXXA7IRLVLPQJB4E.jpg
44,https://www.infobae.com/politica/2021/03/30/en-su-informe-anual-sobre-los-derechos-humanos-estados-unidos-senalo-que-el-sistema-judicial-argentino-es-lento-y-politizado/,"En su informe anual sobre los Derechos Humanos, Estados Unidos señaló que el sistema judicial argentino es “lento y politizado”",https://www.infobae.com/politica/2021/03/30/en-su-informe-anual-sobre-los-derechos-humanos-estados-unidos-senalo-que-el-sistema-judicial-argentino-es-lento-y-politizado/,https://cloudfront-us-east-1.images.arcpublishing.com/infobae/7A3Q6IQ6NX6I32TMMC42W5KUBA.jpg
45,https://www.infobae.com/economia/2021/03/31/la-deuda-externa-bruta-aumento-usd-2508-millones-en-el-cuarto-trimestre-de-2020/,La deuda externa bruta aumentó USD 2.508 millones en el cuarto trimestre de 2020,https://www.infobae.com/economia/2021/03/31/la-deuda-externa-bruta-aumento-usd-2508-millones-en-el-cuarto-trimestre-de-2020/,https://cloudfront-us-east-1.images.arcpublishing.com/infobae/4W3N5WKOZNDKNHSSNWK556U72Q.jpg
46,https://www.infobae.com/economia/2021/03/31/dolar-las-cotizaciones-alternativas-tuvieron-un-rebote-que-preanuncia-que-llegaron-a-un-piso/,Dólar: las cotizaciones alternativas tuvieron un rebote que preanuncia que llegaron a un piso,https://www.infobae.com/economia/2021/03/31/dolar-las-cotizaciones-alternativas-tuvieron-un-rebote-que-preanuncia-que-llegaron-a-un-piso/,https://cloudfront-us-east-1.images.arcpublishing.com/infobae/OGAZIBOU5FAGJFJNKMMBQZMONI.jpg
47,https://www.infobae.com/america/the-new-york-times/2021/03/31/el-lenguaje-inclusivo-prologo-de-una-mayor-inclusion/,"El lenguaje inclusivo, prólogo de una mayor inclusión",https://www.infobae.com/america/the-new-york-times/2021/03/31/el-lenguaje-inclusivo-prologo-de-una-mayor-inclusion/,https://cloudfront-us-east-1.images.arcpublishing.com/infobae/QXH4KETQ7RHKRO6PALVZ3ZEGHE.jpg
48,https://www.infobae.com/gaming/2021/03/31/el-playstation-plus-truck-llegara-a-los-principales-shoppings-de-argentina/,El PlayStation Plus Truck llegará a los principales shoppings de Argentina,https://www.infobae.com/gaming/2021/03/31/el-playstation-plus-truck-llegara-a-los-principales-shoppings-de-argentina/,https://cloudfront-us-east-1.images.arcpublishing.com/infobae/3LAHYJDRN5BVZBPLCQ3RYCD5LY.jpg
49,https://www.infobae.com/sociedad/2021/03/31/el-futbol-no-es-solo-nenes-la-genial-experiencia-de-juntar-varones-y-mujeres-para-jugar-a-la-pelota/,“El fútbol no es sólo nenes”: la genial experiencia de juntar varones y mujeres para jugar a la pelota,https://www.infobae.com/sociedad/2021/03/31/el-futbol-no-es-solo-nenes-la-genial-experiencia-de-juntar-varones-y-mujeres-para-jugar-a-la-pelota/,https://cloudfront-us-east-1.images.arcpublishing.com/infobae/TYD63QCNMNBRZLKYEUFRX2FLY4.jpg
