n,id,title,url,image
1,https://www.infobae.com/politica/2021/05/06/freno-de-alberto-fernandez-a-la-cgt-le-aseguro-que-ya-tiene-decidido-quien-manejara-los-fondos-de-las-obras-sociales/,"Alberto Fernández no designará al candidato de la CGT en la Superintendencia de Salud, pero les dará $11.000 millones a las obras sociales",https://www.infobae.com/politica/2021/05/06/freno-de-alberto-fernandez-a-la-cgt-le-aseguro-que-ya-tiene-decidido-quien-manejara-los-fondos-de-las-obras-sociales/,https://cloudfront-us-east-1.images.arcpublishing.com/infobae/XNNKV6BM25GNNNOZIZYZJCKLSY.jpg
2,https://www.infobae.com/america/mundo/2021/05/06/alemania-sacerdotes-catolicos-desafian-al-papa-francisco-con-una-masiva-ceremonia-de-bendicion-de-parejas-del-mismo-sexo/,Alemania: sacerdotes católicos desafían al papa Francisco con una masiva ceremonia de bendición de parejas del mismo sexo,https://www.infobae.com/america/mundo/2021/05/06/alemania-sacerdotes-catolicos-desafian-al-papa-francisco-con-una-masiva-ceremonia-de-bendicion-de-parejas-del-mismo-sexo/,https://cloudfront-us-east-1.images.arcpublishing.com/infobae/RNU6HGDUPRGPDM72I4FZO2NVFM.jpg
3,https://www.infobae.com/america/ciencia-america/2021/05/06/actividad-fisica-y-covid-19-todo-lo-que-sabemos-hasta-ahora/,Actividad física y COVID-19: por qué ser una persona activa resulta una buena defensa para hacerle frente a la cara más grave del virus ,https://www.infobae.com/america/ciencia-america/2021/05/06/actividad-fisica-y-covid-19-todo-lo-que-sabemos-hasta-ahora/,https://cloudfront-us-east-1.images.arcpublishing.com/infobae/NFKQGB7LURGPZDB2GJJGBRPPAE.jpg
4,https://www.infobae.com/sociedad/2021/05/06/coronavirus-en-argentina-confirmaron-399-nuevas-muertes-y-24086-contagios-en-las-ultimas-24-horas/,Coronavirus en Argentina: confirmaron 399 nuevas muertes y 24.086 contagios en las últimas 24 horas,https://www.infobae.com/sociedad/2021/05/06/coronavirus-en-argentina-confirmaron-399-nuevas-muertes-y-24086-contagios-en-las-ultimas-24-horas/,https://cloudfront-us-east-1.images.arcpublishing.com/infobae/5GRVTBHXWRDVZBGVFPL5X45FZM
5,https://www.infobae.com/america/deportes/2021/05/06/tras-la-reprogramacion-river-enfrentara-en-paraguay-a-independiente-santa-fe-hora-tv-y-formaciones/,River apuesta a un equipo de suplentes ante Independiente Santa Fe por la Copa Libertadores,https://www.infobae.com/america/deportes/2021/05/06/tras-la-reprogramacion-river-enfrentara-en-paraguay-a-independiente-santa-fe-hora-tv-y-formaciones/,https://cloudfront-us-east-1.images.arcpublishing.com/infobae/HQRAZWBXEVDQBIZQACSAPDVHA4.jpg
6,https://www.infobae.com/deportes/2021/05/06/condenaron-a-cinco-anos-de-prision-a-los-secuestradores-de-la-mujer-de-la-doce-por-que-la-justicia-ahora-investigara-a-rafael-di-zeo/,Condenaron a cinco años de prisión a los secuestradores de la “mujer de la Doce”: por qué la Justicia ahora investigará a Rafael Di Zeo,https://www.infobae.com/deportes/2021/05/06/condenaron-a-cinco-anos-de-prision-a-los-secuestradores-de-la-mujer-de-la-doce-por-que-la-justicia-ahora-investigara-a-rafael-di-zeo/,https://cloudfront-us-east-1.images.arcpublishing.com/infobae/JQUIQF6HENFMFH5DY724BCVJCE.jpg
7,https://www.infobae.com/politica/2021/05/06/el-gobierno-convoco-a-una-reunion-a-horacio-rodriguez-larreta-para-negociar-el-traspaso-de-fondos-para-la-policia-de-la-ciudad/,El Gobierno se reunirá con Horacio Rodríguez Larreta para negociar el traspaso de fondos para la Policía de la Ciudad,https://www.infobae.com/politica/2021/05/06/el-gobierno-convoco-a-una-reunion-a-horacio-rodriguez-larreta-para-negociar-el-traspaso-de-fondos-para-la-policia-de-la-ciudad/,https://cloudfront-us-east-1.images.arcpublishing.com/infobae/II4BORNH6VCNNMHVA4OMOPYGLQ.jpg
8,https://www.infobae.com/economia/2021/05/06/exactly-quien-es-el-emprendedor-argentino-al-que-elon-musk-le-respondio-en-twitter-y-luego-envio-su-mensaje-a-todos-los-empleados-de-spacex/,“Exactly”: quién es el emprendedor argentino al que Elon Musk le respondió en Twitter y luego envió su mensaje a todos los empleados de SpaceX,https://www.infobae.com/economia/2021/05/06/exactly-quien-es-el-emprendedor-argentino-al-que-elon-musk-le-respondio-en-twitter-y-luego-envio-su-mensaje-a-todos-los-empleados-de-spacex/,https://cloudfront-us-east-1.images.arcpublishing.com/infobae/V2TUCFD74NBQFAMIGQSJNPOAOM.jpg
9,https://www.infobae.com/economia/2021/05/06/por-una-medida-de-fuerza-a-partir-de-manana-los-colectivos-no-circularan-entre-las-21-y-las-6-de-la-manana/,"Por una medida de fuerza, a partir de mañana los colectivos no circularán entre las 21 y las 6 de la mañana",https://www.infobae.com/economia/2021/05/06/por-una-medida-de-fuerza-a-partir-de-manana-los-colectivos-no-circularan-entre-las-21-y-las-6-de-la-manana/,https://arc-anglerfish-arc2-prod-infobae.s3.amazonaws.com/public/MYTZ4DCH6VCHFN5ED5Q5PDT4TI
10,https://www.infobae.com/politica/2021/05/06/legisladores-de-estados-unidos-solicitan-que-el-fmi-suspenda-el-cobro-de-la-deuda-a-la-argentina-como-consecuencia-del-covid-19/,Legisladores de Estados Unidos solicitaron que el FMI suspenda el cobro de la deuda a la Argentina como consecuencia del COVID-19,https://www.infobae.com/politica/2021/05/06/legisladores-de-estados-unidos-solicitan-que-el-fmi-suspenda-el-cobro-de-la-deuda-a-la-argentina-como-consecuencia-del-covid-19/,https://cloudfront-us-east-1.images.arcpublishing.com/infobae/SZTA7AWRDNH5RHJQGBDFIRQSME.jpeg
11,https://www.infobae.com/politica/2021/05/06/malvinas-abrieron-una-investigacion-para-determinar-si-hay-nuevos-restos-de-soldados-argentinos-enterrados-en-las-islas/,Malvinas: abrieron una investigación para determinar si hay nuevos restos de soldados argentinos enterrados en las islas,https://www.infobae.com/politica/2021/05/06/malvinas-abrieron-una-investigacion-para-determinar-si-hay-nuevos-restos-de-soldados-argentinos-enterrados-en-las-islas/,https://cloudfront-us-east-1.images.arcpublishing.com/infobae/DC7ODTDKKVAKDBFSIBF4CPH3EU.jpg
12,https://www.infobae.com/america/ciencia-america/2021/05/06/alterar-las-dosis-de-las-vacunas-los-expertos-no-ven-problemas-con-la-seguridad-pero-ponen-en-duda-sobre-lo-que-pueda-ocurrir-con-la-inmunidad/,Alterar las dosis de las vacunas: los expertos no ven problemas con la seguridad pero ponen en duda sobre lo que pueda ocurrir con la inmunidad,https://www.infobae.com/america/ciencia-america/2021/05/06/alterar-las-dosis-de-las-vacunas-los-expertos-no-ven-problemas-con-la-seguridad-pero-ponen-en-duda-sobre-lo-que-pueda-ocurrir-con-la-inmunidad/,https://cloudfront-us-east-1.images.arcpublishing.com/infobae/SPYJGI7KOVGNDLCXLAOK5M6NSA.jpg
13,https://www.infobae.com/america/tendencias-america/2021/05/06/divorcio-gris-el-fenomeno-que-puso-de-manifiesto-la-disolucion-del-matrimonio-de-bill-y-melinda-gates/,"Divorcio gris, el fenómeno que puso de manifiesto la disolución del matrimonio de Bill y Melinda Gates",https://www.infobae.com/america/tendencias-america/2021/05/06/divorcio-gris-el-fenomeno-que-puso-de-manifiesto-la-disolucion-del-matrimonio-de-bill-y-melinda-gates/,https://cloudfront-us-east-1.images.arcpublishing.com/infobae/NKTGMRCWVREKRPFOGVLF4JOQXU.jpg
14,https://www.infobae.com/politica/2021/05/06/designaron-a-a-los-representantes-de-la-oposicion-en-los-directorios-del-enacom-y-rta/,Designaron a los representantes de la oposición en los directorios del Enacom y RTA,https://www.infobae.com/politica/2021/05/06/designaron-a-a-los-representantes-de-la-oposicion-en-los-directorios-del-enacom-y-rta/,https://cloudfront-us-east-1.images.arcpublishing.com/infobae/IJPQFXRIGBCVNIRNRKWB5OVJTY.jpg
15,https://www.infobae.com/politica/2021/05/06/vehiculos-de-lujo-que-entraron-de-contrabando-al-pais-fueron-encontrados-en-distintos-allanamientos/,Vehículos de lujo que entraron de contrabando al país fueron encontrados en distintos allanamientos,https://www.infobae.com/politica/2021/05/06/vehiculos-de-lujo-que-entraron-de-contrabando-al-pais-fueron-encontrados-en-distintos-allanamientos/,https://cloudfront-us-east-1.images.arcpublishing.com/infobae/G22FFQHTP5A57IMKMBE5BMFEPM.jpg
16,https://www.infobae.com/america/deportes/2021/05/06/escandalo-en-miami-floyd-mayweather-se-trenzo-a-golpes-con-el-youtuber-jake-paul-hermano-de-su-proximo-rival/,"Escándalo en Miami: Floyd Mayweather se trenzó a golpes con el youtuber Jake Paul, hermano de su próximo rival",https://www.infobae.com/america/deportes/2021/05/06/escandalo-en-miami-floyd-mayweather-se-trenzo-a-golpes-con-el-youtuber-jake-paul-hermano-de-su-proximo-rival/,https://cloudfront-us-east-1.images.arcpublishing.com/infobae/X66B5G2XW5F3RCDFK6THLTM7PA.jpg
17,https://www.infobae.com/america/tendencias-america/2021/05/06/curevac-por-que-esta-vacuna-alemana-se-puede-convertir-en-la-esperanza-para-el-mundo-no-inmunizado/,CureVac: por qué esta vacuna alemana se puede convertir en la esperanza para el mundo no inmunizado,https://www.infobae.com/america/tendencias-america/2021/05/06/curevac-por-que-esta-vacuna-alemana-se-puede-convertir-en-la-esperanza-para-el-mundo-no-inmunizado/,https://cloudfront-us-east-1.images.arcpublishing.com/infobae/7B3V4MGGQXWOKBE4NGHTFZNRSA.jpg
18,https://www.infobae.com/politica/2021/05/06/con-el-guino-de-cristina-kirchner-el-frente-de-todos-avanzara-hoy-en-el-senado-en-su-intento-de-acotar-a-martin-guzman-en-su-negociacion-con-el-fmi/,"Con el guiño de CFK, el Frente de Todos avanzó en el Senado con su intención de limitar a Guzmán en la negociación con el FMI",https://www.infobae.com/politica/2021/05/06/con-el-guino-de-cristina-kirchner-el-frente-de-todos-avanzara-hoy-en-el-senado-en-su-intento-de-acotar-a-martin-guzman-en-su-negociacion-con-el-fmi/,https://cloudfront-us-east-1.images.arcpublishing.com/infobae/5EHNPE7FWRERBN2RRTLRSRMQYA.JPG
19,https://www.infobae.com/coronavirus/2021/05/06/fueron-a-vacunarse-y-recibieron-la-segunda-dosis-de-sputnik-v-en-vez-de-la-primera/,Fueron a vacunarse y recibieron la segunda dosis de Sputnik V en vez de la primera,https://www.infobae.com/coronavirus/2021/05/06/fueron-a-vacunarse-y-recibieron-la-segunda-dosis-de-sputnik-v-en-vez-de-la-primera/,https://cloudfront-us-east-1.images.arcpublishing.com/infobae/ISFZWGQ6WPL5EFKBKYOLQYDU44.jpg
20,https://www.infobae.com/deportes/2021/05/06/grave-denuncia-en-el-futbol-femenino-argentino-jugadoras-presentaron-una-demanda-por-acoso-sexual-contra-un-entrenador/,Grave denuncia en el fútbol femenino argentino: jugadoras presentaron una demanda por acoso sexual contra un entrenador ,https://www.infobae.com/deportes/2021/05/06/grave-denuncia-en-el-futbol-femenino-argentino-jugadoras-presentaron-una-demanda-por-acoso-sexual-contra-un-entrenador/,https://cloudfront-us-east-1.images.arcpublishing.com/infobae/3M6IKAHTS5FHLAUVAGFC7K2DEM.jpg
21,https://www.infobae.com/america/tendencias-america/2021/05/06/cual-sera-el-escenario-de-la-pandemia-en-los-proximos-anos/,Cuál será el escenario de la pandemia en los próximos años,https://www.infobae.com/america/tendencias-america/2021/05/06/cual-sera-el-escenario-de-la-pandemia-en-los-proximos-anos/,https://cloudfront-us-east-1.images.arcpublishing.com/infobae/6543V4PCBUBRSJWILHSIVVJDAY.jpg
22,https://www.infobae.com/politica/2021/05/06/hay-casi-3-millones-de-personas-que-esperan-la-aplicacion-de-la-segunda-dosis-de-la-sputnik-v-en-argentina-pero-solo-quedan-en-stock-220000/,"Hay casi 3 millones de personas que esperan la aplicación de la segunda dosis de la Sputnik V en Argentina, pero solo quedan en stock 220.000",https://www.infobae.com/politica/2021/05/06/hay-casi-3-millones-de-personas-que-esperan-la-aplicacion-de-la-segunda-dosis-de-la-sputnik-v-en-argentina-pero-solo-quedan-en-stock-220000/,https://cloudfront-us-east-1.images.arcpublishing.com/infobae/JFQQ3RBKUFDR7EYKYXEZWXEQ3M.jpg
23,https://www.infobae.com/america/eeuu/2021/05/06/los-cdc-de-estados-unidos-publicaron-sus-instrucciones-para-los-primeros-viajes-de-prueba-en-cruceros/,Los CDC de Estados Unidos publicaron sus instrucciones para los primeros viajes de prueba en cruceros,https://www.infobae.com/america/eeuu/2021/05/06/los-cdc-de-estados-unidos-publicaron-sus-instrucciones-para-los-primeros-viajes-de-prueba-en-cruceros/,https://cloudfront-us-east-1.images.arcpublishing.com/infobae/V2P23DEBQJGSFJ4S52D2ZJSMB4.jpg
24,https://www.infobae.com/politica/2021/05/06/guillermo-moreno-hace-pie-en-el-conurbano-y-critica-con-dureza-a-alberto-fernandez-no-esta-apto-para-gobernar/,Guillermo Moreno se reunió con Julio Zamora en Tigre y después criticó con dureza a Alberto Fernández: “No está apto para gobernar”,https://www.infobae.com/politica/2021/05/06/guillermo-moreno-hace-pie-en-el-conurbano-y-critica-con-dureza-a-alberto-fernandez-no-esta-apto-para-gobernar/,https://cloudfront-us-east-1.images.arcpublishing.com/infobae/VOKAVI3OFBHZ3DBBB2MKLVQZQQ.jpg
25,https://www.infobae.com/economia/2021/05/06/movimiento-multimillonario-de-acciones-que-hizo-bill-gates-el-mismo-dia-en-el-que-anuncio-su-divorcio-de-melinda/,Movimiento multimillonario de acciones: qué hizo Bill Gates el mismo día en el que anunció su divorcio de Melinda,https://www.infobae.com/economia/2021/05/06/movimiento-multimillonario-de-acciones-que-hizo-bill-gates-el-mismo-dia-en-el-que-anuncio-su-divorcio-de-melinda/,https://cloudfront-us-east-1.images.arcpublishing.com/infobae/BF6SLV5TGNP3ULCAP2EF4C7C5E.jpg
26,https://www.infobae.com/america/deportes/2021/05/06/argentinos-juniors-visita-a-atletico-nacional-para-defender-el-liderazgo-de-su-zona-en-la-copa-libertadores-hora-tv-y-formaciones/,Argentinos se impuso ante Atlético Nacional y quedó a un paso de los octavos de final de la Copa Libertadores,https://www.infobae.com/america/deportes/2021/05/06/argentinos-juniors-visita-a-atletico-nacional-para-defender-el-liderazgo-de-su-zona-en-la-copa-libertadores-hora-tv-y-formaciones/,https://cloudfront-us-east-1.images.arcpublishing.com/infobae/A3365BEPANFD5M5Z5L5SFT4D44.jpg
27,https://www.infobae.com/teleshow/2021/05/06/siete-historias-que-muestran-la-belleza-del-que-sufrio-y-lo-trascendio-como-es-pertenecer-el-arte-de-aceptarnos/,Siete historias que muestran la belleza del que sufrió y lo trascendió: cómo es “Pertenecer. El arte de aceptarnos”,https://www.infobae.com/teleshow/2021/05/06/siete-historias-que-muestran-la-belleza-del-que-sufrio-y-lo-trascendio-como-es-pertenecer-el-arte-de-aceptarnos/,https://cloudfront-us-east-1.images.arcpublishing.com/infobae/IPY23VTZF5HVLIHFRJYXRCDSSU.jpg
28,https://www.infobae.com/teleshow/2021/05/06/laurita-fernandez-dio-detalles-de-su-separacion-con-nicolas-cabre-no-congeniamos/,Laurita Fernández dio detalles de su separación de Nicolás Cabré: “No congeniamos”,https://www.infobae.com/teleshow/2021/05/06/laurita-fernandez-dio-detalles-de-su-separacion-con-nicolas-cabre-no-congeniamos/,https://cloudfront-us-east-1.images.arcpublishing.com/infobae/VQI3RKOREFCJDANZ6QQC6AIDNU.jpg
29,https://www.infobae.com/historias/2021/05/06/sigmund-freud-los-oscuros-secretos-de-su-vida-intima-casto-con-su-esposa-sexo-con-su-cunada-y-consumidor-de-cocaina/,"Sigmund Freud, los oscuros secretos de su vida íntima: casto con su esposa, sexo con su cuñada y consumidor de cocaína",https://www.infobae.com/historias/2021/05/06/sigmund-freud-los-oscuros-secretos-de-su-vida-intima-casto-con-su-esposa-sexo-con-su-cunada-y-consumidor-de-cocaina/,https://cloudfront-us-east-1.images.arcpublishing.com/infobae/GU3IXLMZ5FBQBKAUMGARHDGDMQ.jpg
30,https://www.infobae.com/america/deportes/2021/05/06/tras-la-eliminacion-en-champions-el-real-madrid-se-renueva-que-referentes-se-iran-y-cuales-seran-los-refuerzos/,"Tras la eliminación en Champions, el Real Madrid se renueva: qué referentes se irán y cuáles serán los refuerzos",https://www.infobae.com/america/deportes/2021/05/06/tras-la-eliminacion-en-champions-el-real-madrid-se-renueva-que-referentes-se-iran-y-cuales-seran-los-refuerzos/,https://cloudfront-us-east-1.images.arcpublishing.com/infobae/QH75RQK22NEGJE4T6UIMMM44MI.jpg
31,https://www.infobae.com/america/deportes/2021/05/06/eden-hazard-rompio-el-silencio-despues-de-haberse-reido-en-la-eliminacion-del-real-madrid-en-la-champions-league/,Eden Hazard se refirió a su polémica reacción tras la eliminación del Real Madrid en la Champions League,https://www.infobae.com/america/deportes/2021/05/06/eden-hazard-rompio-el-silencio-despues-de-haberse-reido-en-la-eliminacion-del-real-madrid-en-la-champions-league/,https://cloudfront-us-east-1.images.arcpublishing.com/infobae/3PBXZQZCRZAMVP4FF6CXJGLG2Y.jpg
32,https://www.infobae.com/america/ciencia-america/2021/05/06/sputnik-light-rusia-autorizo-la-vacuna-monocomponente-contra-el-covid-19-y-seria-eficaz-contra-las-nuevas-variantes/,Sputnik light: Rusia autorizó su vacuna de una sola dosis contra el COVID-19 y sería eficaz contra las nuevas variantes,https://www.infobae.com/america/ciencia-america/2021/05/06/sputnik-light-rusia-autorizo-la-vacuna-monocomponente-contra-el-covid-19-y-seria-eficaz-contra-las-nuevas-variantes/,https://cloudfront-us-east-1.images.arcpublishing.com/infobae/KGNNP3SPCRCEJJISR26LVLJB2A.jpg
33,https://www.infobae.com/america/tendencias-america/2021/05/06/que-hacer-en-casa-si-se-comparte-el-mismo-espacio-con-un-contagiado-de-covid-19/,Qué hacer en casa si se comparte el mismo espacio con un contagiado de COVID-19,https://www.infobae.com/america/tendencias-america/2021/05/06/que-hacer-en-casa-si-se-comparte-el-mismo-espacio-con-un-contagiado-de-covid-19/,https://cloudfront-us-east-1.images.arcpublishing.com/infobae/ZSUN3XYJEJFRNH7TN7BDFW3C7Q.jpg
34,https://www.infobae.com/politica/2021/05/06/la-justicia-excarcelo-al-pasajero-que-vino-de-miami-con-covid-19-y-fue-detectado-en-un-control-de-ezeiza/,La Justicia excarceló al pasajero que vino de Miami con COVID-19 y fue detectado en un control de Ezeiza ,https://www.infobae.com/politica/2021/05/06/la-justicia-excarcelo-al-pasajero-que-vino-de-miami-con-covid-19-y-fue-detectado-en-un-control-de-ezeiza/,https://cloudfront-us-east-1.images.arcpublishing.com/infobae/2QS5XAQAJJC45DRPFNTU2BXOPU.jpg
35,https://www.infobae.com/politica/2021/05/06/el-gobierno-distribuyo-786600-vacunas-de-sinopharm-contra-el-coronavirus-que-seran-aplicadas-como-segunda-dosis/,El Gobierno distribuyó 786.600 vacunas de Sinopharm contra el coronavirus que serán aplicadas como segunda dosis,https://www.infobae.com/politica/2021/05/06/el-gobierno-distribuyo-786600-vacunas-de-sinopharm-contra-el-coronavirus-que-seran-aplicadas-como-segunda-dosis/,https://cloudfront-us-east-1.images.arcpublishing.com/infobae/TWZBOFH545DFJNOWLFZ6TMXOVM.jpg
36,https://www.infobae.com/politica/2021/05/06/daniel-scioli-se-reunio-con-lula-da-silva-luego-de-que-anularan-todas-las-condenas-en-contra-del-ex-presidente-de-brasil/,Daniel Scioli se reunió con Lula da Silva luego de que anularan todas las condenas en contra del ex presidente de Brasil ,https://www.infobae.com/politica/2021/05/06/daniel-scioli-se-reunio-con-lula-da-silva-luego-de-que-anularan-todas-las-condenas-en-contra-del-ex-presidente-de-brasil/,https://cloudfront-us-east-1.images.arcpublishing.com/infobae/VBXIO67TYFF5FF6SEH5Z7M6NNU.jpeg
37,https://www.infobae.com/deportes-2/2021/05/06/carlos-timoteo-griguol-el-ultimo-de-los-entrenadores-docentes-las-10-mejores-anecdotas-de-su-carrera/,"Carlos Timoteo Griguol, el último de los entrenadores docentes: las 10 mejores anécdotas de su carrera",https://www.infobae.com/deportes-2/2021/05/06/carlos-timoteo-griguol-el-ultimo-de-los-entrenadores-docentes-las-10-mejores-anecdotas-de-su-carrera/,https://cloudfront-us-east-1.images.arcpublishing.com/infobae/F62QXJ24ZFD4VK72G6BZ2VQZYI.jpg
38,https://www.infobae.com/america/deportes/espn/2021/05/06/cavani-volvio-a-anotar-y-llevo-al-manchester-united-a-la-final-de-la-europa-league-ante-el-villarreal-fecha-sede-y-todo-lo-que-hay-que-saber/,"Cavani volvió a anotar y llevó al Manchester United a la final de la Europa League ante el Villarreal: fecha, sede y todo lo que hay que saber",https://www.infobae.com/america/deportes/espn/2021/05/06/cavani-volvio-a-anotar-y-llevo-al-manchester-united-a-la-final-de-la-europa-league-ante-el-villarreal-fecha-sede-y-todo-lo-que-hay-que-saber/,https://cloudfront-us-east-1.images.arcpublishing.com/infobae/C6J4VE4HAUV6HCMZ22WWYIJSP4.jpg
39,https://www.infobae.com/teleshow/2021/05/06/la-nueva-vida-de-fabio-la-mole-moli-a-los-51-anos-volvio-a-trabajar-de-albanil/,La nueva vida de Fabio “La Mole” Moli: a los 51 años volvió a trabajar de albañil,https://www.infobae.com/teleshow/2021/05/06/la-nueva-vida-de-fabio-la-mole-moli-a-los-51-anos-volvio-a-trabajar-de-albanil/,https://cloudfront-us-east-1.images.arcpublishing.com/infobae/LWXF7S3DVRDCXO5BX6ZKYJFKTA.jpg
40,https://www.infobae.com/america/america-latina/2021/05/06/tiros-explosiones-y-tension-en-rio-de-janeiro-un-operativo-policial-contra-el-narcotrafico-dejo-al-menos-25-muertos-en-una-favela/,"Tiros, explosiones y tensión en Río de Janeiro: un operativo policial contra el narcotráfico dejó al menos 25 muertos en una favela",https://www.infobae.com/america/america-latina/2021/05/06/tiros-explosiones-y-tension-en-rio-de-janeiro-un-operativo-policial-contra-el-narcotrafico-dejo-al-menos-25-muertos-en-una-favela/,https://cloudfront-us-east-1.images.arcpublishing.com/infobae/43H47NUMQJAW5AAPU74CLVWHOA.jpg
41,https://www.infobae.com/teleshow/2021/05/06/grego-rossello-mostro-el-proceso-y-el-resultado-de-su-implante-capilar-lo-ideal-seria-aceptarnos-como-somos-pero-es-jodido/,"Grego Rossello mostró el proceso y el resultado de su implante capilar: “Lo ideal sería aceptarnos como somos, pero es jodido”",https://www.infobae.com/teleshow/2021/05/06/grego-rossello-mostro-el-proceso-y-el-resultado-de-su-implante-capilar-lo-ideal-seria-aceptarnos-como-somos-pero-es-jodido/,https://cloudfront-us-east-1.images.arcpublishing.com/infobae/6HSZAILHJRC77FOSTJYPO754IM.jpg
42,https://www.infobae.com/america/soluciones/2021/05/06/como-funciona-la-trama-que-hace-llegar-los-barbijos-del-conicet-a-los-barrios-populares/,¿Cómo funciona la trama que hace llegar los barbijos del Conicet a los barrios populares?,https://www.infobae.com/america/soluciones/2021/05/06/como-funciona-la-trama-que-hace-llegar-los-barbijos-del-conicet-a-los-barrios-populares/,https://cloudfront-us-east-1.images.arcpublishing.com/infobae/RHVD6QFTPNDNTCF7DLCG5P4DYY.jpg
43,https://www.infobae.com/america/colombia/2021/05/05/que-esta-pasando-en-colombia-y-por-que-no-ceden-las-protestas/,Qué está pasando en Colombia y por qué no ceden las protestas,https://www.infobae.com/america/colombia/2021/05/05/que-esta-pasando-en-colombia-y-por-que-no-ceden-las-protestas/,https://cloudfront-us-east-1.images.arcpublishing.com/infobae/F62S4JDKGL2HJJ374OZP7RUBJY.jpg
44,https://www.infobae.com/sociedad/policiales/2021/05/06/tres-arroyos-buscan-a-cinco-presos-que-cortaron-los-barrotes-del-techo-de-una-comisaria-y-se-fugaron/,Tres Arroyos: buscan a cinco presos que cortaron los barrotes del techo de una comisaría y se fugaron,https://www.infobae.com/sociedad/policiales/2021/05/06/tres-arroyos-buscan-a-cinco-presos-que-cortaron-los-barrotes-del-techo-de-una-comisaria-y-se-fugaron/,https://cloudfront-us-east-1.images.arcpublishing.com/infobae/OKCBAZ5KRBDLRNPDX2XGA3MBAM.jpg
45,https://www.infobae.com/teleshow/2021/05/06/la-emocion-de-marcela-banos-en-su-regreso-a-intrusos-tras-la-muerte-de-su-padre-estaba-sufriendo-ya-estamos-en-paz/,"La emoción de Marcela Baños en su regreso a Intrusos tras la muerte de su padre: “Estaba sufriendo, ya estamos en paz”",https://www.infobae.com/teleshow/2021/05/06/la-emocion-de-marcela-banos-en-su-regreso-a-intrusos-tras-la-muerte-de-su-padre-estaba-sufriendo-ya-estamos-en-paz/,https://cloudfront-us-east-1.images.arcpublishing.com/infobae/AJPXTGVBZNEXFBTE274U46TM5M.jpg
46,https://www.infobae.com/gaming/2021/05/06/el-proximo-call-of-duty-promete-explotar-las-capacidades-de-la-nueva-generacion-de-consolas/,El próximo Call of Duty promete explotar las capacidades de la nueva generación de consolas,https://www.infobae.com/gaming/2021/05/06/el-proximo-call-of-duty-promete-explotar-las-capacidades-de-la-nueva-generacion-de-consolas/,https://cloudfront-us-east-1.images.arcpublishing.com/infobae/GITFIKWY7BACRNJ3XCVS3XT32E.jpg
47,https://www.infobae.com/america/tendencias-america/2021/05/06/cuales-son-las-harinas-que-son-beneficiosas-para-la-salud/,Cuáles son las harinas que son beneficiosas para la salud,https://www.infobae.com/america/tendencias-america/2021/05/06/cuales-son-las-harinas-que-son-beneficiosas-para-la-salud/,https://cloudfront-us-east-1.images.arcpublishing.com/infobae/67SLQXUAJ5FIXOP723YSK5HGXI.jpg
48,https://www.infobae.com/america/deportes/2021/05/06/la-increible-historia-del-hijo-piloto-de-margaret-thatcher-se-perdio-6-dias-durante-el-dakar-y-el-suceso-llego-a-la-serie-the-crown-aunque-con-un-claro-error/,"La increíble historia del hijo piloto de Margaret Thatcher: se perdió 6 días durante el Dakar y el suceso llegó a la serie The Crown, aunque con un claro error  ",https://www.infobae.com/america/deportes/2021/05/06/la-increible-historia-del-hijo-piloto-de-margaret-thatcher-se-perdio-6-dias-durante-el-dakar-y-el-suceso-llego-a-la-serie-the-crown-aunque-con-un-claro-error/,https://cloudfront-us-east-1.images.arcpublishing.com/infobae/7RYCABGFUNH7TGCSXI6JIB7QP4.jpg
49,https://www.infobae.com/sociedad/2021/05/06/la-noche-de-buenos-aires-con-restricciones-sin-restaurantes-bares-ni-teatros-una-ciudad-fantasma-habitada-por-la-tristeza/,"Recorrida por Buenos Aires, la ciudad fantasma y prohibida en las doce horas del toque de queda",https://www.infobae.com/sociedad/2021/05/06/la-noche-de-buenos-aires-con-restricciones-sin-restaurantes-bares-ni-teatros-una-ciudad-fantasma-habitada-por-la-tristeza/,https://cloudfront-us-east-1.images.arcpublishing.com/infobae/HYSKAMYCPRBLDCUP7SQJ2QGEOQ.jpg
