n,id,title,url,image
1,https://www.infobae.com/economia/2021/08/06/vuelos-del-exterior-todo-lo-que-se-sabe-del-nuevo-cupo-diario-para-que-argentinos-puedan-regresar-al-pais/,Vuelos del exterior: todo lo que se sabe del nuevo cupo diario para regresar a la Argentina,https://www.infobae.com/economia/2021/08/06/vuelos-del-exterior-todo-lo-que-se-sabe-del-nuevo-cupo-diario-para-que-argentinos-puedan-regresar-al-pais/,https://cloudfront-us-east-1.images.arcpublishing.com/infobae/W7R3JACQ3JCZDBLOSGTVSZZZWM.jpg
2,https://www.infobae.com/america/deportes/juegos-olimpicos/2021/08/06/quien-es-quinn-la-primera-persona-transgenero-no-binaria-en-ganar-una-medalla-olimpica/,"Quién es Quinn, la primera persona transgénero no binaria en ganar una medalla olímpica",https://www.infobae.com/america/deportes/juegos-olimpicos/2021/08/06/quien-es-quinn-la-primera-persona-transgenero-no-binaria-en-ganar-una-medalla-olimpica/,https://cloudfront-us-east-1.images.arcpublishing.com/infobae/FAO5GZLVC5A6PPZ7QLVGS4SMEA.jpg
3,https://www.infobae.com/teleshow/2021/08/06/carlos-rottemberg-dio-detalles-de-su-visita-a-olivos-no-me-podia-juntar-con-mi-familia-pero-si-gestionar-los-protocolos-para-abrir-los-teatros/,"Carlos Rottemberg dio detalles de su visita a Olivos: “No me podía juntar con mi familia, pero sí gestionar los protocolos para abrir los teatros”",https://www.infobae.com/teleshow/2021/08/06/carlos-rottemberg-dio-detalles-de-su-visita-a-olivos-no-me-podia-juntar-con-mi-familia-pero-si-gestionar-los-protocolos-para-abrir-los-teatros/,https://cloudfront-us-east-1.images.arcpublishing.com/infobae/XFCHG2JEUNE7BJY5UF34OJRSOU.jpg
4,https://www.infobae.com/america/deportes/futbol-europeo/2021/08/06/el-presidente-del-barcelona-joan-laporta-habla-sobre-la-salida-de-lionel-messi/,"El presidente del Barcelona confirmó que Messi se va: “Leo quería quedarse, pero no hay margen salarial y no voy a hipotecar al club”",https://www.infobae.com/america/deportes/futbol-europeo/2021/08/06/el-presidente-del-barcelona-joan-laporta-habla-sobre-la-salida-de-lionel-messi/,https://cloudfront-us-east-1.images.arcpublishing.com/infobae/2EZOFJ3M7RE3NLAEGDYEJ33REY.jpg
5,https://www.infobae.com/america/deportes/2021/08/06/como-finalizo-la-negociacion-con-messi-las-otras-ofertas-que-tiene-y-la-frase-sobre-el-fichaje-de-aguero-5-temas-claves-que-explico-joan-laporta/,"Cómo finalizó la negociación con Messi, las otras ofertas que tiene y la frase sobre el fichaje de Agüero: 5 temas claves que explicó Joan Laporta",https://www.infobae.com/america/deportes/2021/08/06/como-finalizo-la-negociacion-con-messi-las-otras-ofertas-que-tiene-y-la-frase-sobre-el-fichaje-de-aguero-5-temas-claves-que-explico-joan-laporta/,https://cloudfront-us-east-1.images.arcpublishing.com/infobae/F72QLIM6JBCULATO7KANGCMPLY
6,https://www.infobae.com/america/deportes/futbol-europeo/2021/08/06/la-actitud-de-aguero-en-la-primera-practica-del-barcelona-tras-la-salida-de-messi-y-su-frase-sobre-la-ferrari-con-la-que-poso/,La actitud de Agüero en la primera práctica del Barcelona tras la salida de Messi y su frase sobre la Ferrari con la que posó ,https://www.infobae.com/america/deportes/futbol-europeo/2021/08/06/la-actitud-de-aguero-en-la-primera-practica-del-barcelona-tras-la-salida-de-messi-y-su-frase-sobre-la-ferrari-con-la-que-poso/,https://cloudfront-us-east-1.images.arcpublishing.com/infobae/OKUYVEPHHZGGFMKBPEBAA3V2FQ.jpg
7,https://www.infobae.com/america/deportes/2021/08/06/la-distancia-no-sera-un-obstaculo-los-primeros-mensajes-de-despedida-para-antonela-roccuzzo-y-lionel-messi-tras-conocerse-su-partida-de-barcelona/,“Intento asimilar todo esto”: los primeros mensajes de despedida para Lionel Messi y Antonela Roccuzzo tras conocerse su partida de Barcelona,https://www.infobae.com/america/deportes/2021/08/06/la-distancia-no-sera-un-obstaculo-los-primeros-mensajes-de-despedida-para-antonela-roccuzzo-y-lionel-messi-tras-conocerse-su-partida-de-barcelona/,https://cloudfront-us-east-1.images.arcpublishing.com/infobae/BDH6RS2HPJGXDL3TPIQVGFEP7E.jpg
8,https://www.infobae.com/america/deportes/2021/08/05/como-funciona-el-tope-salarial-de-la-liga-que-dejo-a-lionel-messi-fuera-del-barcelona/,Cómo funciona el tope salarial de La Liga que dejó a Lionel Messi fuera del Barcelona,https://www.infobae.com/america/deportes/2021/08/05/como-funciona-el-tope-salarial-de-la-liga-que-dejo-a-lionel-messi-fuera-del-barcelona/,https://cloudfront-us-east-1.images.arcpublishing.com/infobae/PV7RCRYQCREDLIBWWICCTITIUA.jpg
9,https://www.infobae.com/coronavirus/2021/08/06/el-gobierno-anuncio-que-a-partir-de-manana-el-cupo-de-ingresos-al-pais-aumentara-a-1700-personas-por-dia/,El Gobierno anunció que a partir de mañana el cupo de ingresos al país aumentará a 1700 personas por día ,https://www.infobae.com/coronavirus/2021/08/06/el-gobierno-anuncio-que-a-partir-de-manana-el-cupo-de-ingresos-al-pais-aumentara-a-1700-personas-por-dia/,https://cloudfront-us-east-1.images.arcpublishing.com/infobae/G36WM4P6SJGIHFXTTCHQ4JL5WQ.jpg
10,https://www.infobae.com/politica/2021/08/06/juan-grabois-advirtio-que-la-paz-social-esta-en-peligro-en-la-argentina/,Juan Grabois advirtió que “la paz social está en peligro” en la Argentina,https://www.infobae.com/politica/2021/08/06/juan-grabois-advirtio-que-la-paz-social-esta-en-peligro-en-la-argentina/,https://cloudfront-us-east-1.images.arcpublishing.com/infobae/MS2Z5DAR3VEZZLF3KPAXICK5YU.jpg
11,https://www.infobae.com/sociedad/policiales/2021/08/06/el-drama-y-el-horror-de-la-mujer-embarazada-de-ezeiza-que-asesino-a-su-pareja-a-punaladas/,El drama y el horror de la mujer embarazada de Ezeiza que asesinó a su pareja a puñaladas ,https://www.infobae.com/sociedad/policiales/2021/08/06/el-drama-y-el-horror-de-la-mujer-embarazada-de-ezeiza-que-asesino-a-su-pareja-a-punaladas/,https://cloudfront-us-east-1.images.arcpublishing.com/infobae/SG24J2G5UVFTJDYOYRQQIKVK6U.jpg
12,https://www.infobae.com/economia/2021/08/06/sigue-el-exodo-de-empresas-la-principal-plataforma-de-reservas-online-de-restaurantes-deja-la-argentina/,Sigue el éxodo de empresas: la principal plataforma de reservas online de restaurantes deja la Argentina,https://www.infobae.com/economia/2021/08/06/sigue-el-exodo-de-empresas-la-principal-plataforma-de-reservas-online-de-restaurantes-deja-la-argentina/,https://cloudfront-us-east-1.images.arcpublishing.com/infobae/ZU22KYFU4JCU7DO3TFJ4I4GG5A.jpg
13,https://www.infobae.com/politica/2021/08/06/el-gobierno-adjudico-a-correo-argentino-el-servicio-de-transmision-y-entrega-de-telegramas-para-las-elecciones/,El Gobierno adjudicó a Correo Argentino el servicio de transmisión y entrega de telegramas para las elecciones,https://www.infobae.com/politica/2021/08/06/el-gobierno-adjudico-a-correo-argentino-el-servicio-de-transmision-y-entrega-de-telegramas-para-las-elecciones/,https://cloudfront-us-east-1.images.arcpublishing.com/infobae/GBD6EXUDDRDERKX3VJO6IV5CQU.jpg
14,https://www.infobae.com/politica/2021/08/06/las-claves-politicas-de-un-discurso-grabado-en-secreto-para-retomar-la-iniciativa-contra-el-covid-19/,Las claves políticas de un discurso grabado en secreto para retomar la iniciativa contra el Covid 19,https://www.infobae.com/politica/2021/08/06/las-claves-politicas-de-un-discurso-grabado-en-secreto-para-retomar-la-iniciativa-contra-el-covid-19/,https://cloudfront-us-east-1.images.arcpublishing.com/infobae/D4RCOZMHHBHTJMB6RUGIZOCAE4.jpg
15,https://www.infobae.com/politica/2021/08/06/alberto-fernandez-recibira-al-asesor-mas-influyente-de-biden-con-la-intencion-politica-de-profundizar-las-relaciones-bilaterales-con-estados-unidos/,El principal asesor de Biden en Seguridad Nacional ya se encuentra en la Casa Rosada para analizar la relación bilateral entre Argentina y Estados Unidos,https://www.infobae.com/politica/2021/08/06/alberto-fernandez-recibira-al-asesor-mas-influyente-de-biden-con-la-intencion-politica-de-profundizar-las-relaciones-bilaterales-con-estados-unidos/,https://cloudfront-us-east-1.images.arcpublishing.com/infobae/DLUBWUFGYBEIRFP7GW3LLXYM5I.jpg
16,https://www.infobae.com/teleshow/2021/08/06/entre-lagrimas-florencia-pena-volvio-a-la-television-despues-de-su-crisis-yo-tambien-perdi-a-mi-papa-en-pandemia-y-tampoco-lo-pude-despedir/,"Entre lágrimas, Florencia Peña volvió a la televisión después de su crisis: “Yo también perdí a mi papá en pandemia y tampoco lo pude despedir”",https://www.infobae.com/teleshow/2021/08/06/entre-lagrimas-florencia-pena-volvio-a-la-television-despues-de-su-crisis-yo-tambien-perdi-a-mi-papa-en-pandemia-y-tampoco-lo-pude-despedir/,https://cloudfront-us-east-1.images.arcpublishing.com/infobae/54RDPK5FWZCWHFD6EJDFLPMLRM.jpg
17,https://www.infobae.com/america/tecno/2021/08/06/paso-a-paso-asi-es-el-robo-de-identidad-en-whatsapp-con-un-sms-fraudulento/,Paso a paso: así es el robo de identidad en WhatsApp con un SMS fraudulento,https://www.infobae.com/america/tecno/2021/08/06/paso-a-paso-asi-es-el-robo-de-identidad-en-whatsapp-con-un-sms-fraudulento/,https://cloudfront-us-east-1.images.arcpublishing.com/infobae/GEEQPGTBSZHUVN277JWJI3WRGM.jpg
18,https://www.infobae.com/deportes/juegos-olimpicos/2021/08/06/el-mensaje-entre-lagrimas-de-agustina-albertario-en-el-vestuario-tras-ganar-la-medalla-de-plata-en-los-juegos-olimpicos/,El mensaje entre lágrimas de Agustina Albertario en el vestuario tras ganar la medalla de plata en los Juegos Olímpicos,https://www.infobae.com/deportes/juegos-olimpicos/2021/08/06/el-mensaje-entre-lagrimas-de-agustina-albertario-en-el-vestuario-tras-ganar-la-medalla-de-plata-en-los-juegos-olimpicos/,https://cloudfront-us-east-1.images.arcpublishing.com/infobae/IWA7LODSKBAJVFH2NFLMJVZJK4.jpg
19,https://www.infobae.com/deportes/juegos-olimpicos/2021/08/06/ejemplar-mensaje-de-retegui-tras-la-derrota-de-las-leonas-todas-las-chicas-estudian-y-eso-es-lo-que-importa-no-solamente-el-hockey/,"Ejemplar mensaje de Retegui tras la derrota de Las Leonas: “Todas las chicas estudian y eso es lo que importa, no solamente el hockey”",https://www.infobae.com/deportes/juegos-olimpicos/2021/08/06/ejemplar-mensaje-de-retegui-tras-la-derrota-de-las-leonas-todas-las-chicas-estudian-y-eso-es-lo-que-importa-no-solamente-el-hockey/,https://cloudfront-us-east-1.images.arcpublishing.com/infobae/CZNOTL2B43PHV7PW2NFYHARTXA.jpg
20,https://www.infobae.com/educacion/2021/08/06/caso-toyota-por-que-la-empresa-no-consigue-jovenes-con-secundario-completo-para-puestos-de-150-mil-pesos/,Caso Toyota: por qué la empresa no consigue jóvenes con secundario completo para puestos de 150 mil pesos,https://www.infobae.com/educacion/2021/08/06/caso-toyota-por-que-la-empresa-no-consigue-jovenes-con-secundario-completo-para-puestos-de-150-mil-pesos/,https://cloudfront-us-east-1.images.arcpublishing.com/infobae/NI7GQJ45V5DMLLAK3XE555SIDQ.jpg
21,https://www.infobae.com/america/ciencia-america/2021/08/06/podrian-ser-signos-de-vida-las-plumas-de-agua-emanadas-de-encelado-la-luna-de-saturno/,"¿Podrían ser signos de vida las plumas de agua emanadas de Encelado, la luna de Saturno?",https://www.infobae.com/america/ciencia-america/2021/08/06/podrian-ser-signos-de-vida-las-plumas-de-agua-emanadas-de-encelado-la-luna-de-saturno/,https://cloudfront-us-east-1.images.arcpublishing.com/infobae/VNK4Y7LM4RBSHA3BE3JVBHIAP4.jpg
22,https://www.infobae.com/sociedad/policiales/2021/08/06/el-perturbador-caso-del-oftalmologo-de-san-juan-denunciado-por-8-mujeres-en-una-semana-lo-acusan-de-abusar-de-ellas-en-su-consultorio/,El perturbador caso del oftalmólogo de San Juan denunciado por 8 mujeres en una semana: lo acusan de abusar de ellas en su consultorio,https://www.infobae.com/sociedad/policiales/2021/08/06/el-perturbador-caso-del-oftalmologo-de-san-juan-denunciado-por-8-mujeres-en-una-semana-lo-acusan-de-abusar-de-ellas-en-su-consultorio/,https://cloudfront-us-east-1.images.arcpublishing.com/infobae/7WKWKOCNSBGVBPOKLJQDGJRDEI.jpg
23,https://www.infobae.com/america/america-latina/2021/08/06/nueve-estados-brasilenos-suspendieron-la-compra-de-37-millones-de-dosis-de-la-vacuna-sputnik-v-contra-el-covid-19/,Nueve estados brasileños suspendieron la compra de 37 millones de dosis de la vacuna Sputnik V contra el COVID-19,https://www.infobae.com/america/america-latina/2021/08/06/nueve-estados-brasilenos-suspendieron-la-compra-de-37-millones-de-dosis-de-la-vacuna-sputnik-v-contra-el-covid-19/,https://cloudfront-us-east-1.images.arcpublishing.com/infobae/74N3IKDRAVCJAJCKYA57FFFE7A.jpg
24,https://www.infobae.com/aroundtherings/espanol/2021/08/06/una-historia-de-exito-para-el-coi-y-thomas-bach-los-nuevos-deportes-olimpicos-y-el-crecimiento-de-las-pruebas-mixtas-en-tokio-2020/,Una historia de éxito para el COI y Thomas Bach: los nuevos deportes olímpicos y el crecimiento de las pruebas mixtas en Tokio 2020 ,https://www.infobae.com/aroundtherings/espanol/2021/08/06/una-historia-de-exito-para-el-coi-y-thomas-bach-los-nuevos-deportes-olimpicos-y-el-crecimiento-de-las-pruebas-mixtas-en-tokio-2020/,https://cloudfront-us-east-1.images.arcpublishing.com/infobae/3W4J3MCWJBHGXKJYLL3RDIUETM.jpg
25,https://www.infobae.com/america/mundo/2021/08/06/el-grupo-terrorista-hezbollah-ataco-israel-con-misiles-desde-el-libano-y-las-fuerzas-de-defensa-responden-con-fuego-se-artilleria/,El grupo terrorista Hezbollah atacó Israel con misiles desde El Líbano y las Fuerzas de Defensa respondieron con fuego de artillería,https://www.infobae.com/america/mundo/2021/08/06/el-grupo-terrorista-hezbollah-ataco-israel-con-misiles-desde-el-libano-y-las-fuerzas-de-defensa-responden-con-fuego-se-artilleria/,https://cloudfront-us-east-1.images.arcpublishing.com/infobae/EL76WKTJ5RBDJNDL7FRW7EXMQA.jpg
26,https://www.infobae.com/politica/2021/08/06/alberto-fernandez-durante-la-pandemia-recibi-a-miles-de-personas-porque-estaba-gobernando-o-querian-que-me-quedara-encerrado-en-mi-casa/,"Alberto Fernández: “Durante la pandemia recibí a miles de personas porque estaba gobernando, ¿o querían que me quedara encerrado en mi casa?”",https://www.infobae.com/politica/2021/08/06/alberto-fernandez-durante-la-pandemia-recibi-a-miles-de-personas-porque-estaba-gobernando-o-querian-que-me-quedara-encerrado-en-mi-casa/,https://cloudfront-us-east-1.images.arcpublishing.com/infobae/YSVEYZJR4VFAZI2N3VVIOUPAI4.jpg
27,https://www.infobae.com/america/eeuu/2021/08/06/el-desempleo-en-estados-unidos-cayo-al-54-su-nivel-mas-bajo-desde-el-inicio-de-la-pandemia-de-coronavirus/,"El desempleo en Estados Unidos cayó al 5,4%, su nivel más bajo desde el inicio de la pandemia de coronavirus",https://www.infobae.com/america/eeuu/2021/08/06/el-desempleo-en-estados-unidos-cayo-al-54-su-nivel-mas-bajo-desde-el-inicio-de-la-pandemia-de-coronavirus/,https://cloudfront-us-east-1.images.arcpublishing.com/infobae/PDQOXTQC6BDCXP7SN5TM3C2Y5A.jpg
28,https://www.infobae.com/america/mundo/2021/08/06/dejo-morir-de-hambre-a-su-bebe-para-irse-de-fiesta-por-seis-dias-a-celebrar-sus-18-anos/,Dejó morir de hambre a su bebé para irse de fiesta por seis días a celebrar sus 18 años,https://www.infobae.com/america/mundo/2021/08/06/dejo-morir-de-hambre-a-su-bebe-para-irse-de-fiesta-por-seis-dias-a-celebrar-sus-18-anos/,https://cloudfront-us-east-1.images.arcpublishing.com/infobae/5WUTZWPPOBFF7BB5HGPUD44M44.jpeg
29,https://www.infobae.com/economia/2021/08/06/se-acelero-la-emision-monetaria-para-asistir-al-tesoro-el-banco-central-tuvo-que-imprimir-otros-40000-millones/,Se aceleró la emisión monetaria para asistir al Tesoro: el Banco Central tuvo que imprimir otros $40.000 millones,https://www.infobae.com/economia/2021/08/06/se-acelero-la-emision-monetaria-para-asistir-al-tesoro-el-banco-central-tuvo-que-imprimir-otros-40000-millones/,https://cloudfront-us-east-1.images.arcpublishing.com/infobae/6IABCZMKWZHYBFI4SWU5IYQVQM.jpg
30,https://www.infobae.com/america/tecno/2021/08/06/huawei-comunico-una-caida-del-29-en-el-primer-semestre-del-ano-el-objetivo-es-sobrevivir/,Huawei comunicó una caída del 29% en el primer semestre del año: “El objetivo es sobrevivir”,https://www.infobae.com/america/tecno/2021/08/06/huawei-comunico-una-caida-del-29-en-el-primer-semestre-del-ano-el-objetivo-es-sobrevivir/,https://cloudfront-us-east-1.images.arcpublishing.com/infobae/4H7CHL3OGBGEBF7LVOF55T63NU.jpg
31,https://www.infobae.com/politica/2021/08/06/gerardo-morales-no-estaria-bueno-que-gane-diego-santilli-porque-no-va-a-mover-el-amperimetro/,Gerardo Morales: “No estaría bueno que gane Diego Santilli porque no va a mover el amperímetro”,https://www.infobae.com/politica/2021/08/06/gerardo-morales-no-estaria-bueno-que-gane-diego-santilli-porque-no-va-a-mover-el-amperimetro/,https://cloudfront-us-east-1.images.arcpublishing.com/infobae/L4TEZNC4OVAK3MAPKFZFMFUTM4.jpg
32,https://www.infobae.com/america/wapo/2021/08/06/un-sistema-oceanico-critico-puede-estar-rumbo-al-colapso-debido-al-cambio-climatico/,Un sistema oceánico crítico puede estar rumbo al colapso debido al cambio climático,https://www.infobae.com/america/wapo/2021/08/06/un-sistema-oceanico-critico-puede-estar-rumbo-al-colapso-debido-al-cambio-climatico/,https://cloudfront-us-east-1.images.arcpublishing.com/infobae/YZTZAD6WKVASZIJ2FIIXV3XD3Y.jpg
33,https://www.infobae.com/america/tecno/2021/08/06/didi-a-un-paso-de-ceder-el-control-de-los-datos-de-sus-usuarios-para-contentar-al-regimen-chino/,"DiDi, a un paso de ceder el control de los datos de sus usuarios para contentar al régimen chino",https://www.infobae.com/america/tecno/2021/08/06/didi-a-un-paso-de-ceder-el-control-de-los-datos-de-sus-usuarios-para-contentar-al-regimen-chino/,https://cloudfront-us-east-1.images.arcpublishing.com/infobae/3TY6XGZSVIGTREEWTEKRJ326MA.jpg
34,https://www.infobae.com/economia/2021/08/06/ganancias-el-gobierno-estudia-reajustar-el-minimo-no-imponible-hasta-un-20-para-evitar-que-las-paritarias-obliguen-a-pagar-el-tributo/,Ganancias: el Gobierno estudia reajustar el mínimo no imponible hasta un 20% para evitar que las paritarias obliguen a pagar el tributo,https://www.infobae.com/economia/2021/08/06/ganancias-el-gobierno-estudia-reajustar-el-minimo-no-imponible-hasta-un-20-para-evitar-que-las-paritarias-obliguen-a-pagar-el-tributo/,https://cloudfront-us-east-1.images.arcpublishing.com/infobae/Z6YBYYL2DFHEFLQB5GGAEILKXI.jpg
35,https://www.infobae.com/sociedad/policiales/2021/08/06/habla-la-madre-de-blas-correas-a-un-ano-de-ser-asesinado-por-la-policia-de-cordoba-los-que-tenian-que-cuidarme-de-la-inseguridad-me-lo-mataron/,"Habla la madre de Blas Correas, a un año de ser asesinado por la Policía de Córdoba: “Los que tenían que cuidarme de la inseguridad me lo mataron”",https://www.infobae.com/sociedad/policiales/2021/08/06/habla-la-madre-de-blas-correas-a-un-ano-de-ser-asesinado-por-la-policia-de-cordoba-los-que-tenian-que-cuidarme-de-la-inseguridad-me-lo-mataron/,https://cloudfront-us-east-1.images.arcpublishing.com/infobae/RSYAOPTRDNCWZOT2KGRYYAV5SU.jpg
36,https://www.infobae.com/teleshow/2021/08/06/el-lado-b-del-amor-estrellas-internacionales-que-mantuvieron-romances-breves-pero-intensos-con-figuras-argentinas/,El lado B del amor: estrellas internacionales que mantuvieron romances breves pero intensos con figuras argentinas,https://www.infobae.com/teleshow/2021/08/06/el-lado-b-del-amor-estrellas-internacionales-que-mantuvieron-romances-breves-pero-intensos-con-figuras-argentinas/,https://cloudfront-us-east-1.images.arcpublishing.com/infobae/4FPNNPLEBNEPHGCG4GBU5R6MGU.jpg
37,https://www.infobae.com/deportes/juegos-olimpicos/2021/08/06/las-leonas-van-por-su-primera-medalla-dorada-en-los-juegos-olimpicos-ante-los-paises-bajos-hora-y-tv/,Las Leonas perdieron ante Países Bajos en la final de los Juegos Olímpicos de Tokio y se quedaron con la medalla de plata,https://www.infobae.com/deportes/juegos-olimpicos/2021/08/06/las-leonas-van-por-su-primera-medalla-dorada-en-los-juegos-olimpicos-ante-los-paises-bajos-hora-y-tv/,https://cloudfront-us-east-1.images.arcpublishing.com/infobae/WOALEORHQCTI36EYJ4HQY6U434.jpg
38,https://www.infobae.com/america/deportes/juegos-olimpicos/2021/08/06/agenda-de-los-juegos-olimpicos-dia-15-el-voley-va-por-la-medalla-de-bronce-en-el-clasico-contra-brasil/,"Agenda de los Juegos Olímpicos, día 15: el vóley va por la medalla de bronce en el clásico contra Brasil",https://www.infobae.com/america/deportes/juegos-olimpicos/2021/08/06/agenda-de-los-juegos-olimpicos-dia-15-el-voley-va-por-la-medalla-de-bronce-en-el-clasico-contra-brasil/,https://cloudfront-us-east-1.images.arcpublishing.com/infobae/A2ET45JEQ5FKA6NZFXJRQZ4NYE.jpg
39,https://www.infobae.com/america/deportes/juegos-olimpicos/2021/08/06/amor-en-los-juegos-olimpicos-de-tokio-el-mensaje-que-le-dedico-sergio-hernandez-a-noel-barrionuevo-antes-de-la-final-de-las-leonas/,Amor en los Juegos Olímpicos de Tokio: los mensajes que le dedicó Sergio Hernández a Noel Barrionuevo antes y después de la final de Las Leonas,https://www.infobae.com/america/deportes/juegos-olimpicos/2021/08/06/amor-en-los-juegos-olimpicos-de-tokio-el-mensaje-que-le-dedico-sergio-hernandez-a-noel-barrionuevo-antes-de-la-final-de-las-leonas/,https://cloudfront-us-east-1.images.arcpublishing.com/infobae/QW3BFXUOIRBJVDOAO5U5ZSLQAM.jpg
40,https://www.infobae.com/america/deportes/juegos-olimpicos/2021/08/06/canada-se-quedo-con-la-medalla-de-oro-en-el-torneo-de-futbol-femenino-tras-vencer-a-suecia-en-los-penales/,Canadá se quedó con la medalla de oro en el torneo de fútbol femenino tras vencer a Suecia en los penales,https://www.infobae.com/america/deportes/juegos-olimpicos/2021/08/06/canada-se-quedo-con-la-medalla-de-oro-en-el-torneo-de-futbol-femenino-tras-vencer-a-suecia-en-los-penales/,https://cloudfront-us-east-1.images.arcpublishing.com/infobae/LAW6YBNSHVBA3DKLH5BFIWZIFY
41,https://www.infobae.com/america/deportes/juegos-olimpicos/2021/08/06/infartante-definicion-italia-le-gano-por-una-cabeza-la-posta-4x100-a-gran-bretana-en-los-juegos-olimpicos/,Infartante definición: Italia le ganó por una cabeza la posta 4x100 a Gran Bretaña en los Juegos Olímpicos,https://www.infobae.com/america/deportes/juegos-olimpicos/2021/08/06/infartante-definicion-italia-le-gano-por-una-cabeza-la-posta-4x100-a-gran-bretana-en-los-juegos-olimpicos/,https://cloudfront-us-east-1.images.arcpublishing.com/infobae/NJMPWFO5DLUES4OBGRL33K42LA.jpg
42,https://www.infobae.com/opinion/2021/08/06/haiti-un-pais-olvidado-traicionado-y-torturado-en-latinoamerica/,"Haití, un país olvidado, traicionado y torturado en Latinoamérica",https://www.infobae.com/opinion/2021/08/06/haiti-un-pais-olvidado-traicionado-y-torturado-en-latinoamerica/,https://cloudfront-us-east-1.images.arcpublishing.com/infobae/ALJPHA5YXZEM7GX7ZQIR5YWQYM.jpg
43,https://www.infobae.com/sociedad/2021/08/06/el-dolor-de-la-madre-de-un-argentino-que-murio-en-el-derrumbe-de-miami-siempre-estaba-la-esperanza-que-se-hubiera-salvado/,El dolor de la madre de un argentino que murió en el derrumbe de Miami: “Siempre estaba la esperanza que se hubiera salvado”,https://www.infobae.com/sociedad/2021/08/06/el-dolor-de-la-madre-de-un-argentino-que-murio-en-el-derrumbe-de-miami-siempre-estaba-la-esperanza-que-se-hubiera-salvado/,https://cloudfront-us-east-1.images.arcpublishing.com/infobae/GLJQG4ZOAJD4TBXNOMDN5WHW2I.jpg
44,https://www.infobae.com/politica/2021/08/06/el-gobierno-podria-avanzar-con-la-estatizacion-de-la-autopista-panamericana-y-el-acceso-oeste/,El Gobierno podría avanzar con la estatización de la Autopista Panamericana y el Acceso Oeste,https://www.infobae.com/politica/2021/08/06/el-gobierno-podria-avanzar-con-la-estatizacion-de-la-autopista-panamericana-y-el-acceso-oeste/,https://cloudfront-us-east-1.images.arcpublishing.com/infobae/3YSDWVN6EJCYLHG244OVLSEEYM.jpg
45,https://www.infobae.com/politica/2021/08/06/el-gobierno-observa-con-preocupacion-la-movilizacion-que-los-cayetanos-realizaran-manana-a-plaza-de-mayo/,El Gobierno observa con preocupación la movilización que “Los Cayetanos” realizarán mañana a Plaza de Mayo ,https://www.infobae.com/politica/2021/08/06/el-gobierno-observa-con-preocupacion-la-movilizacion-que-los-cayetanos-realizaran-manana-a-plaza-de-mayo/,https://cloudfront-us-east-1.images.arcpublishing.com/infobae/WUBTAYE4YRCMLOTE5GJBT3ONL4.jpg
46,https://www.infobae.com/politica/2021/08/06/horacio-rodriguez-larreta-y-diego-santilli-pidieron-a-sus-candidatos-bonaerenses-bajarle-el-tono-al-conflicto-opositor-y-cerrar-filas-contra-el-kirchnerismo/,Horacio Rodríguez Larreta y Diego Santilli pidieron a sus candidatos bonaerenses bajarle el tono al conflicto opositor y cerrar filas contra el kirchnerismo,https://www.infobae.com/politica/2021/08/06/horacio-rodriguez-larreta-y-diego-santilli-pidieron-a-sus-candidatos-bonaerenses-bajarle-el-tono-al-conflicto-opositor-y-cerrar-filas-contra-el-kirchnerismo/,https://cloudfront-us-east-1.images.arcpublishing.com/infobae/TL6GL37HGJEM5LHTLFEQGQBEEY.jpg
47,https://www.infobae.com/politica/2021/08/06/el-gobierno-oficializo-las-designaciones-de-marcela-losardo-y-guillermo-nielsen-como-embajadores/,El Gobierno oficializó las designaciones de Marcela Losardo y Guillermo Nielsen como embajadores,https://www.infobae.com/politica/2021/08/06/el-gobierno-oficializo-las-designaciones-de-marcela-losardo-y-guillermo-nielsen-como-embajadores/,https://cloudfront-us-east-1.images.arcpublishing.com/infobae/WOOZ4RV7UVBFFBICZID7PRJUXE.jpg
48,https://www.infobae.com/sociedad/2021/08/06/veinte-gramos-de-arsenico-y-un-asesinato-por-dinero-como-fue-el-primer-crimen-mediatico-de-buenos-aires-en-1888/,Veinte gramos de arsénico y un asesinato por dinero: cómo fue el primer crimen mediático de Buenos Aires en 1888,https://www.infobae.com/sociedad/2021/08/06/veinte-gramos-de-arsenico-y-un-asesinato-por-dinero-como-fue-el-primer-crimen-mediatico-de-buenos-aires-en-1888/,https://cloudfront-us-east-1.images.arcpublishing.com/infobae/MWP2DL6IO5F4THQTP5VYBORPMA.jpg
