n,id,title,url,image
1,https://www.infobae.com/politica/2021/06/30/el-mensaje-del-papa-franciso-a-los-empresarios-argentinos-hay-que-invertir-en-el-bien-comun-no-esconder-la-plata-en-los-paraisos-fiscales/,"El mensaje del Papa Franciso a los empresarios argentinos: “Hay que invertir en el bien común, no esconder la plata en los paraísos fiscales”",https://www.infobae.com/politica/2021/06/30/el-mensaje-del-papa-franciso-a-los-empresarios-argentinos-hay-que-invertir-en-el-bien-comun-no-esconder-la-plata-en-los-paraisos-fiscales/,https://cloudfront-us-east-1.images.arcpublishing.com/infobae/4VG75N3UPZBR5M4JDKYE645FYM.jpg
2,https://www.infobae.com/sociedad/2021/06/30/argentinos-varados-en-miami-nos-estan-reprogramando-los-vuelos-recien-para-agosto/,Argentinos varados en Miami: “Nos están reprogramando los vuelos recién para agosto”,https://www.infobae.com/sociedad/2021/06/30/argentinos-varados-en-miami-nos-estan-reprogramando-los-vuelos-recien-para-agosto/,https://cloudfront-us-east-1.images.arcpublishing.com/infobae/4NWVHLUYTVEZNAMTGJECXYAESA.jpeg
3,https://www.infobae.com/america/deportes/2021/06/30/tras-cuatro-dias-de-busqueda-detuvieron-a-la-mujer-que-desato-un-accidente-masivo-en-el-tour-de-francia/,"Tras cuatro días de búsqueda, detuvieron a la mujer que desató un accidente masivo en el Tour de Francia",https://www.infobae.com/america/deportes/2021/06/30/tras-cuatro-dias-de-busqueda-detuvieron-a-la-mujer-que-desato-un-accidente-masivo-en-el-tour-de-francia/,https://cloudfront-us-east-1.images.arcpublishing.com/infobae/7EVGE4BWXVGNJIJWMJIH7PSO74.jpg
4,https://www.infobae.com/politica/2021/06/30/el-gobierno-porteno-anunciara-antes-del-fin-de-semana-la-inscripcion-para-vacunar-a-los-mayores-de-35-anos-sin-comorbilidades/,El gobierno porteño anunciará antes del fin de semana la inscripción para vacunar a los mayores de 35 años sin comorbilidades,https://www.infobae.com/politica/2021/06/30/el-gobierno-porteno-anunciara-antes-del-fin-de-semana-la-inscripcion-para-vacunar-a-los-mayores-de-35-anos-sin-comorbilidades/,https://cloudfront-us-east-1.images.arcpublishing.com/infobae/UHBMZDMPSFDN5GZECAODLZCRIU.jpg
5,https://www.infobae.com/economia/2021/06/30/el-unico-plan-del-gobierno-es-fundirnos-el-crudo-relato-de-dos-productoras-ganaderas-por-el-cierre-de-las-exportaciones-de-carne/,“El único plan del Gobierno es fundirnos”: el crudo relato de dos productoras ganaderas por el cierre de las exportaciones de carne,https://www.infobae.com/economia/2021/06/30/el-unico-plan-del-gobierno-es-fundirnos-el-crudo-relato-de-dos-productoras-ganaderas-por-el-cierre-de-las-exportaciones-de-carne/,https://cloudfront-us-east-1.images.arcpublishing.com/infobae/WCE7EXAYFBFEPJCPGCM7QNC2U4.jpg
6,https://www.infobae.com/america/wapo/2021/06/30/la-piscina-del-edificio-derrumbado-en-miami-y-una-nueva-hipotesis-para-explicar-la-tragedia/,La piscina del edificio derrumbado en Miami y una nueva hipótesis para explicar la tragedia,https://www.infobae.com/america/wapo/2021/06/30/la-piscina-del-edificio-derrumbado-en-miami-y-una-nueva-hipotesis-para-explicar-la-tragedia/,https://cloudfront-us-east-1.images.arcpublishing.com/infobae/IKEJBQEOGFHTFMBOFC76DY6GL4.jpg
7,https://www.infobae.com/historias/2021/06/30/torturados-y-quemados-hasta-morir-el-horror-del-cuadruple-crimen-del-empresario-la-mujer-el-hijo-y-la-empleada/,"Torturados y quemados hasta morir: el horror del cuádruple crimen del empresario, la mujer, el hijo y la empleada",https://www.infobae.com/historias/2021/06/30/torturados-y-quemados-hasta-morir-el-horror-del-cuadruple-crimen-del-empresario-la-mujer-el-hijo-y-la-empleada/,https://cloudfront-us-east-1.images.arcpublishing.com/infobae/WDNEHCGOSJAANINNAYIQB233YM.jpg
8,https://www.infobae.com/america/opinion/2021/06/30/america-latina-regresa-poco-a-poco-a-la-autocracia-de-la-mano-de-rusia-y-china/,América Latina regresa poco a poco a la autocracia de la mano de Rusia y China,https://www.infobae.com/america/opinion/2021/06/30/america-latina-regresa-poco-a-poco-a-la-autocracia-de-la-mano-de-rusia-y-china/,https://cloudfront-us-east-1.images.arcpublishing.com/infobae/Y5J4JDTWRZBDXEEXKR7QRM2QPQ
9,https://www.infobae.com/opinion/2021/06/30/con-los-viajes-al-exterior-el-gobierno-se-venga-de-la-clase-media-que-no-puede-domesticar/,"Con los viajes al exterior, el Gobierno se venga de la clase media que no puede domesticar",https://www.infobae.com/opinion/2021/06/30/con-los-viajes-al-exterior-el-gobierno-se-venga-de-la-clase-media-que-no-puede-domesticar/,https://cloudfront-us-east-1.images.arcpublishing.com/infobae/Z5FUYJ3UXJDTNERJJUNGKFWQTE.jpg
10,https://www.infobae.com/sociedad/2021/06/30/perfil-de-gonzalo-diz-el-gerente-bancario-argentino-que-murio-tras-caer-de-un-balcon-de-una-torre-de-miami/,"Perfil de Gonzalo Diz, el gerente bancario argentino que murió tras caer de un balcón de una torre de Miami",https://www.infobae.com/sociedad/2021/06/30/perfil-de-gonzalo-diz-el-gerente-bancario-argentino-que-murio-tras-caer-de-un-balcon-de-una-torre-de-miami/,https://cloudfront-us-east-1.images.arcpublishing.com/infobae/Y3ONACPZVNAHXG6XE2WBJP54WI.jpg
11,https://www.infobae.com/teleshow/2021/06/30/los-dias-de-oriana-sabatini-y-paulo-dybala-en-miami-compras-almuerzo-y-look-casual/,"Los días de Oriana Sabatini y Paulo Dybala en Miami: compras, almuerzo y look casual",https://www.infobae.com/teleshow/2021/06/30/los-dias-de-oriana-sabatini-y-paulo-dybala-en-miami-compras-almuerzo-y-look-casual/,https://cloudfront-us-east-1.images.arcpublishing.com/infobae/AFMWW5IUAVBB3FHLRLUVSG4XCU.jpg
12,https://www.infobae.com/america/deportes/2021/06/30/boxeo-drogas-maratones-sexuales-y-locuras-13-anecdotas-imperdibles-de-mike-tyson-en-su-cumpleanos-n-55/,"Boxeo, drogas, maratones sexuales y locuras: 13 anécdotas imperdibles de Mike Tyson en su cumpleaños N° 55",https://www.infobae.com/america/deportes/2021/06/30/boxeo-drogas-maratones-sexuales-y-locuras-13-anecdotas-imperdibles-de-mike-tyson-en-su-cumpleanos-n-55/,https://cloudfront-us-east-1.images.arcpublishing.com/infobae/BFE2JYPCRWDPZXLWVY5FWLXAD4.jpg
13,https://www.infobae.com/america/deportes/2021/06/30/hoy-se-termina-el-contrato-de-lionel-messi-con-el-barcelona-como-estan-las-negociaciones-y-cual-es-el-requisito-fundamental-para-el-argentino/,Hoy termina el contrato de Lionel Messi con el Barcelona: cómo están las negociaciones y cuál es el único pedido del argentino para continuar,https://www.infobae.com/america/deportes/2021/06/30/hoy-se-termina-el-contrato-de-lionel-messi-con-el-barcelona-como-estan-las-negociaciones-y-cual-es-el-requisito-fundamental-para-el-argentino/,https://cloudfront-us-east-1.images.arcpublishing.com/infobae/XSAO7OTN4WGT3GHD5NARVAYJFU.jpg
14,https://www.infobae.com/politica/2021/06/30/el-gobierno-divulgo-el-motivo-de-viaje-de-las-personas-que-salieron-del-pais-en-el-ultimo-mes/,El Gobierno divulgó el motivo de viaje de las personas que salieron del país en el último mes ,https://www.infobae.com/politica/2021/06/30/el-gobierno-divulgo-el-motivo-de-viaje-de-las-personas-que-salieron-del-pais-en-el-ultimo-mes/,https://cloudfront-us-east-1.images.arcpublishing.com/infobae/FQNDI7EK6HG6GBJ2GDAULPWWJE.jpg
15,https://www.infobae.com/america/america-latina/2021/06/30/radiografia-de-la-medicina-en-cuba-cual-es-la-realidad-detras-de-la-propaganda/,Radiografía de la medicina en Cuba: cuál es la realidad detrás de la propaganda ,https://www.infobae.com/america/america-latina/2021/06/30/radiografia-de-la-medicina-en-cuba-cual-es-la-realidad-detras-de-la-propaganda/,https://cloudfront-us-east-1.images.arcpublishing.com/infobae/7333KERLHUY4E4KLB35DDHHAIM.jpg
16,https://www.infobae.com/teleshow/2021/06/30/flor-de-la-v-en-plena-democracia-a-las-travestis-nos-cazaban-como-si-fueramos-animales/,Flor de la V: “En plena democracia a las travestis nos cazaban como si fuéramos animales”,https://www.infobae.com/teleshow/2021/06/30/flor-de-la-v-en-plena-democracia-a-las-travestis-nos-cazaban-como-si-fueramos-animales/,https://cloudfront-us-east-1.images.arcpublishing.com/infobae/VRNTJBHOBZHAHPDCIPM2WV5IKE.jpg
17,https://www.infobae.com/deportes/2021/06/30/riquelme-recargado-el-mercado-de-boca-la-relacion-con-tevez-dardo-a-gallardo-y-fuerte-careo-con-roberto-leto/,"Riquelme, recargado: el mercado de Boca, la relación con Tevez, dardo a Gallardo y fuerte careo con Roberto Leto",https://www.infobae.com/deportes/2021/06/30/riquelme-recargado-el-mercado-de-boca-la-relacion-con-tevez-dardo-a-gallardo-y-fuerte-careo-con-roberto-leto/,https://cloudfront-us-east-1.images.arcpublishing.com/infobae/HQJBV4NVBVHHJL7B2RWLKWHHIM.jpg
18,https://www.infobae.com/america/mundo/2021/06/30/la-reina-de-belleza-que-descoloco-a-los-jueces-y-cautivo-al-publico-tras-desfilar-con-una-bandera-manchada-de-sangre/,La reina de belleza que descolocó a los jueces y cautivó al público tras desfilar con una bandera manchada de “sangre”,https://www.infobae.com/america/mundo/2021/06/30/la-reina-de-belleza-que-descoloco-a-los-jueces-y-cautivo-al-publico-tras-desfilar-con-una-bandera-manchada-de-sangre/,https://cloudfront-us-east-1.images.arcpublishing.com/infobae/7CJUFOWFTBASNGD65EPLJ5VLHE.jpg
19,https://www.infobae.com/sociedad/2021/06/30/se-define-en-tierra-del-fuego-la-aprobacion-de-una-ley-para-prohibir-los-criaderos-de-salmon-y-proteger-el-ecosistema/,Se define en Tierra del Fuego la aprobación de una ley para prohibir los criaderos de salmón y proteger el ecosistema,https://www.infobae.com/sociedad/2021/06/30/se-define-en-tierra-del-fuego-la-aprobacion-de-una-ley-para-prohibir-los-criaderos-de-salmon-y-proteger-el-ecosistema/,https://cloudfront-us-east-1.images.arcpublishing.com/infobae/SWDLJMMVFVBW7CWJQIRV42BFKA.jpg
20,https://www.infobae.com/teleshow/2021/06/30/de-la-emocion-a-la-furia-karina-la-princesita-canto-con-su-hija-y-su-pareja-pero-estallo-contra-el-jurado-de-la-academia/,"De la emoción a la furia: Karina La Princesita cantó con su hija y su pareja, pero estalló contra el jurado de La Academia",https://www.infobae.com/teleshow/2021/06/30/de-la-emocion-a-la-furia-karina-la-princesita-canto-con-su-hija-y-su-pareja-pero-estallo-contra-el-jurado-de-la-academia/,https://cloudfront-us-east-1.images.arcpublishing.com/infobae/OHXIL3ECYVBPTPH52PFR6UAYR4.jpg
21,https://www.infobae.com/politica/2021/06/30/el-gobierno-pone-el-foco-en-las-restricciones-para-demorar-el-ingreso-de-la-variante-delta-y-mejorar-el-control-de-los-contagios-en-las-provincias/,El Gobierno pone el foco en las restricciones para demorar el ingreso de la variante Delta y mejorar el control de los contagios en las provincias,https://www.infobae.com/politica/2021/06/30/el-gobierno-pone-el-foco-en-las-restricciones-para-demorar-el-ingreso-de-la-variante-delta-y-mejorar-el-control-de-los-contagios-en-las-provincias/,https://cloudfront-us-east-1.images.arcpublishing.com/infobae/QZDETFPACRFW3H7PFCLOA27S6U.jpg
22,https://www.infobae.com/opinion/2021/06/30/cuidados-intensivos-y-covid-salvarse-depende-de-la-cantidad-y-calidad-de-personal-de-salud-por-paciente-critico/,Cuidados intensivos y COVID: “Salvarse depende de la cantidad y calidad de personal de salud por paciente crítico”,https://www.infobae.com/opinion/2021/06/30/cuidados-intensivos-y-covid-salvarse-depende-de-la-cantidad-y-calidad-de-personal-de-salud-por-paciente-critico/,https://cloudfront-us-east-1.images.arcpublishing.com/infobae/QHSMV6D5NFF73L62FLQP65N4Y4
23,https://www.infobae.com/america/soluciones/2021/06/30/como-el-analisis-de-big-data-predijo-la-cantidad-de-pacientes-de-covid-19-en-una-terapia-intensiva/,Cómo el análisis de big data predijo la cantidad de pacientes de COVID-19 en una terapia intensiva,https://www.infobae.com/america/soluciones/2021/06/30/como-el-analisis-de-big-data-predijo-la-cantidad-de-pacientes-de-covid-19-en-una-terapia-intensiva/,https://cloudfront-us-east-1.images.arcpublishing.com/infobae/UWP36LFCEVEMNP4OPVDJFTTKZE.jpg
24,https://www.infobae.com/politica/2021/06/30/covid-19-en-argentina-el-promedio-de-nuevos-casos-diarios-aumento-17-en-los-ultimos-siete-dias-y-enciende-las-alarmas/,COVID-19 en Argentina: el promedio de nuevos casos diarios aumentó 17% en los últimos siete días y enciende las alarmas,https://www.infobae.com/politica/2021/06/30/covid-19-en-argentina-el-promedio-de-nuevos-casos-diarios-aumento-17-en-los-ultimos-siete-dias-y-enciende-las-alarmas/,https://cloudfront-us-east-1.images.arcpublishing.com/infobae/6AT6WLBQEZHXLO4QQ727COG5OI.jpg
25,https://www.infobae.com/sociedad/2021/06/30/hay-un-millon-y-medio-de-personas-de-entre-18-y-59-anos-con-comorbilidades-que-todavia-no-fueron-vacunadas/,Hay un millón y medio de personas de entre 18 y 59 años con comorbilidades que todavía no fueron vacunadas,https://www.infobae.com/sociedad/2021/06/30/hay-un-millon-y-medio-de-personas-de-entre-18-y-59-anos-con-comorbilidades-que-todavia-no-fueron-vacunadas/,https://cloudfront-us-east-1.images.arcpublishing.com/infobae/FFCBF7XTBZCUDP64CJPHU5FGG4.jpg
26,https://www.infobae.com/politica/2021/06/30/las-vacunas-contra-el-coronavirus-que-dona-estados-unidos-no-llegaran-a-la-argentina-pero-si-a-sus-socios-del-mercosur/,Las vacunas contra el coronavirus que dona Estados Unidos no llegarán a la Argentina pero sí a sus socios del Mercosur,https://www.infobae.com/politica/2021/06/30/las-vacunas-contra-el-coronavirus-que-dona-estados-unidos-no-llegaran-a-la-argentina-pero-si-a-sus-socios-del-mercosur/,https://cloudfront-us-east-1.images.arcpublishing.com/infobae/V3A3XOVQ5RYO5ERZT2UI6ZNVXU.jpg
27,https://www.infobae.com/america/deportes/futbol-europeo/2021/06/30/atalanta-pagara-una-cifra-record-por-un-jugador-de-la-seleccion-argentina-sera-la-segunda-mas-cara-en-la-historia-del-club/,Atalanta pagará una cifra récord por un jugador de la selección argentina: será la segunda más cara en la historia del club,https://www.infobae.com/america/deportes/futbol-europeo/2021/06/30/atalanta-pagara-una-cifra-record-por-un-jugador-de-la-seleccion-argentina-sera-la-segunda-mas-cara-en-la-historia-del-club/,https://cloudfront-us-east-1.images.arcpublishing.com/infobae/GTZOU2QCAJEKXJ2RIXIOEEPDSE.jpg
28,https://www.infobae.com/sociedad/2021/06/30/voraz-incendio-en-un-deposito-de-papel-y-cartones-en-quilmes-no-hay-heridos/,Voraz incendio en un depósito de papel y cartones en Quilmes: no hay heridos,https://www.infobae.com/sociedad/2021/06/30/voraz-incendio-en-un-deposito-de-papel-y-cartones-en-quilmes-no-hay-heridos/,https://cloudfront-us-east-1.images.arcpublishing.com/infobae/KVXFNBEZLFEMDJZ2TDIYS2VJ64.jpg
29,https://www.infobae.com/america/eeuu/2021/06/30/se-dieron-a-conocer-las-llamadas-del-primer-rescatista-que-llego-al-champlain-towers-de-miami-tras-el-colapso-se-parece-al-world-trade-center/,Se filtró la desesperante llamada del primer rescatista en llegar al derrumbe de Miami: la dramática comparación que hizo del lugar,https://www.infobae.com/america/eeuu/2021/06/30/se-dieron-a-conocer-las-llamadas-del-primer-rescatista-que-llego-al-champlain-towers-de-miami-tras-el-colapso-se-parece-al-world-trade-center/,https://cloudfront-us-east-1.images.arcpublishing.com/infobae/WJDPCZLPBLQ5GOTTJUEUIL4C2U.jpg
30,https://www.infobae.com/america/deportes/2021/06/30/la-reaccion-de-joan-laporta-cuando-le-preguntaron-por-la-finalizacion-del-contrato-de-lionel-messi-con-barcelona/,La reacción de Joan Laporta cuando le preguntaron por la finalización del contrato de Lionel Messi con Barcelona,https://www.infobae.com/america/deportes/2021/06/30/la-reaccion-de-joan-laporta-cuando-le-preguntaron-por-la-finalizacion-del-contrato-de-lionel-messi-con-barcelona/,https://cloudfront-us-east-1.images.arcpublishing.com/infobae/54HPRORWWNCWJGXYO7BZ734OZA.jpg
31,https://www.infobae.com/tendencias/2021/06/30/como-hablarnos-en-la-cama/,¿Cómo hablarnos en la cama?,https://www.infobae.com/tendencias/2021/06/30/como-hablarnos-en-la-cama/,https://cloudfront-us-east-1.images.arcpublishing.com/infobae/USWYQYII4RGQXJYMXAJQ5WS2XA.jpg
32,https://www.infobae.com/teleshow/2021/06/29/tension-al-aire-entre-soledad-fandino-y-un-panelista-que-le-pregunto-por-sus-ex-parejas-no-sos-novaresio-mi-amor/,"Tensión al aire entre Soledad Fandiño y un panelista que le preguntó por sus ex parejas: “¡No sos Novaresio, mi amor!”",https://www.infobae.com/teleshow/2021/06/29/tension-al-aire-entre-soledad-fandino-y-un-panelista-que-le-pregunto-por-sus-ex-parejas-no-sos-novaresio-mi-amor/,https://cloudfront-us-east-1.images.arcpublishing.com/infobae/D6PVAW5JKNGXXNR6J2OBYGQGOI.jpg
33,https://www.infobae.com/america/deportes/futbol-europeo/2021/06/30/extasis-en-wembley-el-desaforado-festejo-de-lineker-shearer-y-ferdinand-en-la-cara-de-klinsmann-cuando-inglaterra-elimino-a-alemania/,"Éxtasis en Wembley: el desaforado festejo de Lineker, Shearer y Ferdinand en la cara de Klinsmann cuando Inglaterra eliminó a Alemania",https://www.infobae.com/america/deportes/futbol-europeo/2021/06/30/extasis-en-wembley-el-desaforado-festejo-de-lineker-shearer-y-ferdinand-en-la-cara-de-klinsmann-cuando-inglaterra-elimino-a-alemania/,https://cloudfront-us-east-1.images.arcpublishing.com/infobae/UYAZLS6E5FBQNCCP3QSVVHWC5M.jpg
34,https://www.infobae.com/sociedad/2021/06/30/mengele-el-arco-de-la-muerte-y-otras-historias-tragicas-sobre-el-futbol-en-los-campos-de-concentracion-nazis/,"Mengele, el Arco de la Muerte y otras historias trágicas sobre el fútbol en los campos de concentración nazis",https://www.infobae.com/sociedad/2021/06/30/mengele-el-arco-de-la-muerte-y-otras-historias-tragicas-sobre-el-futbol-en-los-campos-de-concentracion-nazis/,https://cloudfront-us-east-1.images.arcpublishing.com/infobae/IWIS74NNBJFYVDHI5OA72QOLAE.jpg
35,https://www.infobae.com/sociedad/2021/06/30/la-llegada-del-graf-zeppelin-a-buenos-aires-miles-de-portenos-viendo-pasar-al-gigante-propaganda-nazi-y-una-hora-y-media-en-tierra/,"La llegada del Graf Zeppelin a Buenos Aires: miles de porteños viendo pasar al gigante, propaganda nazi y una hora y media en tierra",https://www.infobae.com/sociedad/2021/06/30/la-llegada-del-graf-zeppelin-a-buenos-aires-miles-de-portenos-viendo-pasar-al-gigante-propaganda-nazi-y-una-hora-y-media-en-tierra/,https://cloudfront-us-east-1.images.arcpublishing.com/infobae/LVAY54UXHVGXVAQ6QAC2MPCHRA.jpg
36,https://www.infobae.com/sociedad/policiales/2021/06/30/indagaran-por-homicidio-culposo-al-chofer-del-accidente-de-la-ruta-2-que-provoco-dos-muertos/,Indagarán por homicidio culposo al chofer del accidente de la Ruta 2 que provocó dos muertos,https://www.infobae.com/sociedad/policiales/2021/06/30/indagaran-por-homicidio-culposo-al-chofer-del-accidente-de-la-ruta-2-que-provoco-dos-muertos/,https://cloudfront-us-east-1.images.arcpublishing.com/infobae/ULE3GVPT5JFZNMQN3SOAK2ZWJA.jpg
37,https://www.infobae.com/economia/2021/06/30/en-medio-del-subibaja-del-bitcoin-como-se-concretaron-las-primeras-compras-de-propiedades-con-criptomonedas-en-argentina/,"En medio del subibaja del Bitcoin, cómo se concretaron las primeras compras de propiedades con criptomonedas en Argentina",https://www.infobae.com/economia/2021/06/30/en-medio-del-subibaja-del-bitcoin-como-se-concretaron-las-primeras-compras-de-propiedades-con-criptomonedas-en-argentina/,https://cloudfront-us-east-1.images.arcpublishing.com/infobae/XENUX3BD3B7QQ5PIW65CRRR3K4.jpg
38,https://www.infobae.com/economia/2021/06/30/otro-grupo-de-la-muerte-advierten-que-argentina-tiene-la-mayor-carga-impositiva-mundial-sobre-la-economia-formal/,Otro “grupo de la muerte”: advierten que Argentina tiene la mayor carga impositiva mundial sobre la economía formal,https://www.infobae.com/economia/2021/06/30/otro-grupo-de-la-muerte-advierten-que-argentina-tiene-la-mayor-carga-impositiva-mundial-sobre-la-economia-formal/,https://cloudfront-us-east-1.images.arcpublishing.com/infobae/WVYCSWMTBZESBEBKAWX6EZA4FY.jpg
39,https://www.infobae.com/deportes/2021/06/30/un-dia-con-un-sueno-olimpico-argentino-horacio-cifuentes-el-jugador-de-tenis-mesa-que-se-mudo-a-europa-para-ser-profesional-y-se-entreno-con-un-robot/,"Un día con un sueño olímpico argentino: Horacio Cifuentes, el jugador de tenis mesa que se mudó a Europa para ser profesional y se entrenó con un robot",https://www.infobae.com/deportes/2021/06/30/un-dia-con-un-sueno-olimpico-argentino-horacio-cifuentes-el-jugador-de-tenis-mesa-que-se-mudo-a-europa-para-ser-profesional-y-se-entreno-con-un-robot/,https://cloudfront-us-east-1.images.arcpublishing.com/infobae/JV5RTLEY3FFS7P62C7AZGEKH7U.jpg
40,https://www.infobae.com/cultura/2021/06/30/el-teatro-colon-reabre-sus-puertas-al-publico-protocolos-distanciamiento-conciertos-y-ballet/,"El Teatro Colón reabre sus puertas al público: protocolos, distanciamiento, conciertos y ballet",https://www.infobae.com/cultura/2021/06/30/el-teatro-colon-reabre-sus-puertas-al-publico-protocolos-distanciamiento-conciertos-y-ballet/,https://cloudfront-us-east-1.images.arcpublishing.com/infobae/PQI5RYN7P5AKFOWDXBCWKL73NE.jpg
41,https://www.infobae.com/politica/2021/06/30/prejuicios-y-senales-de-castigo-el-gobierno-abrio-otro-frente-de-debate-con-el-caso-de-los-varados-en-el-exterior/,Prejuicios y señales de castigo: el Gobierno abrió otro frente de debate con el caso de los varados en el exterior,https://www.infobae.com/politica/2021/06/30/prejuicios-y-senales-de-castigo-el-gobierno-abrio-otro-frente-de-debate-con-el-caso-de-los-varados-en-el-exterior/,https://cloudfront-us-east-1.images.arcpublishing.com/infobae/YGAEJH2PENGGNNNFV3SEFAA6II
42,https://www.infobae.com/politica/2021/06/30/el-radicalismo-aprovecha-la-disputa-interna-del-pro-y-construye-de-afuera-hacia-adentro-para-ser-opcion-en-2023/,El radicalismo aprovecha la disputa interna del PRO y construye de afuera hacia adentro para ser opción en 2023,https://www.infobae.com/politica/2021/06/30/el-radicalismo-aprovecha-la-disputa-interna-del-pro-y-construye-de-afuera-hacia-adentro-para-ser-opcion-en-2023/,https://cloudfront-us-east-1.images.arcpublishing.com/infobae/DS5FQQ6MMJHSXGUNBDJ2DH4RL4.jpg
43,https://www.infobae.com/politica/2021/06/30/facundo-manes-buscara-desde-la-ucr-derrotar-a-santilli-y-a-macri-con-el-publicista-ramiro-agulla-un-politologo-y-un-economista-de-alto-perfil/,"Facundo Manes buscará desde la UCR derrotar a Santilli y a Macri con el publicista Ramiro Agulla, un politólogo y un economista de alto perfil",https://www.infobae.com/politica/2021/06/30/facundo-manes-buscara-desde-la-ucr-derrotar-a-santilli-y-a-macri-con-el-publicista-ramiro-agulla-un-politologo-y-un-economista-de-alto-perfil/,https://cloudfront-us-east-1.images.arcpublishing.com/infobae/HPVZLNPYI5DVJO4YG5GLXKUC7A.jpg
44,https://www.infobae.com/economia/2021/06/30/se-freno-la-suba-de-reservas-y-el-banco-central-se-prepara-para-un-segundo-semestre-turbulento/,Se frenó la suba de reservas y el Banco Central se prepara para un segundo semestre turbulento,https://www.infobae.com/economia/2021/06/30/se-freno-la-suba-de-reservas-y-el-banco-central-se-prepara-para-un-segundo-semestre-turbulento/,https://cloudfront-us-east-1.images.arcpublishing.com/infobae/PQ3627GECJXYRY3VKCRNUPCIBE.jpg
45,https://www.infobae.com/teleshow/2021/06/30/natalia-oreiro-como-evita-el-regreso-de-okupas-y-el-primer-ministro-de-the-crown-todas-las-noticias-del-mundo-de-las-series/,"Natalia Oreiro como Evita, el regreso de Okupas y el Primer Ministro de The Crown: todas las noticias del mundo de las series",https://www.infobae.com/teleshow/2021/06/30/natalia-oreiro-como-evita-el-regreso-de-okupas-y-el-primer-ministro-de-the-crown-todas-las-noticias-del-mundo-de-las-series/,https://cloudfront-us-east-1.images.arcpublishing.com/infobae/CSTBU3Q535GKLNFDDGFR3XUTGM.jpg
46,https://www.infobae.com/politica/2021/06/30/alberto-samid-pidio-disculpas-por-violar-la-prision-domiciliaria/,Alberto Samid pidió disculpas por violar la prisión domiciliaria,https://www.infobae.com/politica/2021/06/30/alberto-samid-pidio-disculpas-por-violar-la-prision-domiciliaria/,https://cloudfront-us-east-1.images.arcpublishing.com/infobae/ICN4Y5HOVVCA5ERBZDFAHGAZWI.jpg
47,https://www.infobae.com/teleshow/2021/06/30/hernan-drago-conto-que-recibio-una-millonaria-propuesta-politica-por-que-la-rechazo/,Hernán Drago contó que recibió una millonaria propuesta política: por qué la rechazó,https://www.infobae.com/teleshow/2021/06/30/hernan-drago-conto-que-recibio-una-millonaria-propuesta-politica-por-que-la-rechazo/,https://cloudfront-us-east-1.images.arcpublishing.com/infobae/FTKKBAEV3JFN5IF5K4EPQTTHZU.jpg
48,https://www.infobae.com/america/mundo/2021/06/30/tras-meses-de-mantenerlo-en-secreto-vladimir-putin-revelo-que-se-vacuno-contra-el-coronavirus-con-la-formula-sputnik-v/,"Tras meses de mantenerlo en secreto, Vladimir Putin reveló que se vacunó contra el coronavirus con la fórmula Sputnik V ",https://www.infobae.com/america/mundo/2021/06/30/tras-meses-de-mantenerlo-en-secreto-vladimir-putin-revelo-que-se-vacuno-contra-el-coronavirus-con-la-formula-sputnik-v/,https://cloudfront-us-east-1.images.arcpublishing.com/infobae/PU3EQDEHCGHCDPPQUWFC6E3HZE.jpg
49,https://www.infobae.com/america/tendencias-america/2021/06/21/trastorno-de-duelo-prolongado-un-nuevo-sindrome-ocasionado-por-el-covid-19/,Trastorno de duelo prolongado: ¿un nuevo síndrome ocasionado por el COVID-19?,https://www.infobae.com/america/tendencias-america/2021/06/21/trastorno-de-duelo-prolongado-un-nuevo-sindrome-ocasionado-por-el-covid-19/,https://cloudfront-us-east-1.images.arcpublishing.com/infobae/WMAJHHED3NDBLHQ2VSGCMHNF6U.jpg
