n,id,title,url,image
1,https://www.infobae.com/politica/2021/04/07/despues-del-escandalo-el-gobierno-bonaerense-dio-marcha-atras-y-reanudo-la-vacunacion-en-el-estadio-unico-de-la-plata/,"Después del escándalo, el gobierno bonaerense dio marcha atrás y reanudó la vacunación en el Estadio Único de La Plata",https://www.infobae.com/politica/2021/04/07/despues-del-escandalo-el-gobierno-bonaerense-dio-marcha-atras-y-reanudo-la-vacunacion-en-el-estadio-unico-de-la-plata/,https://cloudfront-us-east-1.images.arcpublishing.com/infobae/O2BN6BKK4VCU7JRWHPRNCKILFI.jpg
2,https://www.infobae.com/politica/2021/04/07/la-negociacion-entre-el-gobierno-y-juntos-por-el-cambio-para-aplazar-las-paso-tambien-se-tenso/,La negociación entre el Gobierno y Juntos por el Cambio para aplazar las PASO también se tensó,https://www.infobae.com/politica/2021/04/07/la-negociacion-entre-el-gobierno-y-juntos-por-el-cambio-para-aplazar-las-paso-tambien-se-tenso/,https://cloudfront-us-east-1.images.arcpublishing.com/infobae/JG7FH3N63ZDKFAKIMQ624G63AI.jpg
3,https://www.infobae.com/deportes/2021/04/07/juan-roman-riquelme-y-su-hijo-agustin-deberan-declarar-ante-la-justicia-por-no-respetar-la-cuarentena/,Juan Román Riquelme y su hijo Agustín deberán declarar ante la Justicia por no respetar la cuarentena,https://www.infobae.com/deportes/2021/04/07/juan-roman-riquelme-y-su-hijo-agustin-deberan-declarar-ante-la-justicia-por-no-respetar-la-cuarentena/,https://cloudfront-us-east-1.images.arcpublishing.com/infobae/W357U2MJXZEXJNGDJ6FUKPIBV4.jpg
4,https://www.infobae.com/politica/2021/04/07/el-gobierno-congelo-la-negociacion-con-la-ciudad-de-buenos-aires-y-prepara-un-dnu-con-restricciones-fuertes-en-la-circulacion/,El Gobierno congeló la negociación con la ciudad de Buenos Aires y prepara un DNU con restricciones fuertes en la circulación,https://www.infobae.com/politica/2021/04/07/el-gobierno-congelo-la-negociacion-con-la-ciudad-de-buenos-aires-y-prepara-un-dnu-con-restricciones-fuertes-en-la-circulacion/,https://cloudfront-us-east-1.images.arcpublishing.com/infobae/7Y6L36TZKRBD7NNAIC567XW2QA.jpg
5,https://www.infobae.com/politica/2021/04/07/vamos-a-resistir-la-respuesta-de-patricia-bullrich-a-las-nuevas-restricciones-que-analiza-el-gobierno-nacional/,“Vamos a resistir”: la respuesta de Patricia Bullrich a las nuevas restricciones que analiza el gobierno nacional,https://www.infobae.com/politica/2021/04/07/vamos-a-resistir-la-respuesta-de-patricia-bullrich-a-las-nuevas-restricciones-que-analiza-el-gobierno-nacional/,https://cloudfront-us-east-1.images.arcpublishing.com/infobae/IUYNJ26VVRFYBOFHC47EVCKPLU.jpeg
6,https://www.infobae.com/sociedad/2021/04/07/volvieron-los-controles-de-permisos-para-viajar-en-los-trenes-que-pasara-con-el-transporte-publico-frente-al-rebrote-de-covid-19/,Volvieron los controles de permisos para viajar en los trenes: qué pasará con el transporte público frente al rebrote de COVID-19,https://www.infobae.com/sociedad/2021/04/07/volvieron-los-controles-de-permisos-para-viajar-en-los-trenes-que-pasara-con-el-transporte-publico-frente-al-rebrote-de-covid-19/,https://cloudfront-us-east-1.images.arcpublishing.com/infobae/RQNLQLLPP5F43MCRKVN2ZLLNEQ.jpg
7,https://www.infobae.com/politica/2021/04/07/las-nuevas-medidas-suspenderan-todos-los-viajes-de-egresados-y-reduciran-el-aforo-de-los-restaurantes/,Las nuevas medidas: suspenderán todos los viajes de egresados y reducirán el aforo de los restaurantes ,https://www.infobae.com/politica/2021/04/07/las-nuevas-medidas-suspenderan-todos-los-viajes-de-egresados-y-reduciran-el-aforo-de-los-restaurantes/,https://cloudfront-us-east-1.images.arcpublishing.com/infobae/LTXTROQLOBCBDONWBZAFXVGSMM.jpeg
8,https://www.infobae.com/america/mundo/2021/04/07/los-reguladores-del-reino-unido-recomendaron-evitar-la-aplicacion-de-la-vacuna-de-astrazeneca-a-los-menores-de-30-anos/,Los reguladores del Reino Unido recomendaron evitar la aplicación de la vacuna de AstraZeneca a los menores de 30 años,https://www.infobae.com/america/mundo/2021/04/07/los-reguladores-del-reino-unido-recomendaron-evitar-la-aplicacion-de-la-vacuna-de-astrazeneca-a-los-menores-de-30-anos/,https://cloudfront-us-east-1.images.arcpublishing.com/infobae/GMCZT3JKLK4RR4GVJZYICDRNWQ.jpg
9,https://www.infobae.com/politica/2021/04/07/gesto-de-los-estados-unidos-con-alberto-fernandez-biden-envia-a-la-argentina-al-jefe-del-comando-sur/,Gesto de los Estados Unidos con Alberto Fernández: Biden envía a la Argentina al jefe del Comando Sur ,https://www.infobae.com/politica/2021/04/07/gesto-de-los-estados-unidos-con-alberto-fernandez-biden-envia-a-la-argentina-al-jefe-del-comando-sur/,https://cloudfront-us-east-1.images.arcpublishing.com/infobae/SL5JC5OGYBEH3JUQUE4EIB7UKI.jpg
10,https://www.infobae.com/economia/2021/04/07/el-fmi-expreso-que-analizara-el-pedido-de-argentina-de-bajar-el-costo-de-sus-creditos-pero-con-prudencia-debido-a-su-rol-financiero-global/,"El FMI expresó que analizará el pedido de Argentina de bajar el costo de sus créditos, pero con prudencia debido a su rol financiero global",https://www.infobae.com/economia/2021/04/07/el-fmi-expreso-que-analizara-el-pedido-de-argentina-de-bajar-el-costo-de-sus-creditos-pero-con-prudencia-debido-a-su-rol-financiero-global/,https://cloudfront-us-east-1.images.arcpublishing.com/infobae/FDJE5MDZLRELPONWMWJSBSNORU.jpg
11,https://www.infobae.com/sociedad/policiales/2021/04/07/misterio-e-indignacion-por-la-muerte-de-violeta-la-mujer-de-70-anos-que-dormia-en-un-trailer-en-recoleta-junto-a-sus-gatos/,"Misterio e indignación por la muerte de “Violeta”, la mujer de 70 años que dormía en un tráiler en Recoleta junto a sus gatos",https://www.infobae.com/sociedad/policiales/2021/04/07/misterio-e-indignacion-por-la-muerte-de-violeta-la-mujer-de-70-anos-que-dormia-en-un-trailer-en-recoleta-junto-a-sus-gatos/,https://cloudfront-us-east-1.images.arcpublishing.com/infobae/6TSW5D3YFVCVZNOURUBPSMKTEI.jpg
12,https://www.infobae.com/america/venezuela/2021/04/07/la-oposicion-venezolana-pidio-mas-apoyo-de-argentina-alberto-fernandez-victimiza-a-maduro-y-eso-le-hace-dano-a-su-papel-en-la-region/,La oposición venezolana pidió más apoyo de Argentina: “Alberto Fernández victimiza a Maduro y eso le hace daño a su papel en la región”,https://www.infobae.com/america/venezuela/2021/04/07/la-oposicion-venezolana-pidio-mas-apoyo-de-argentina-alberto-fernandez-victimiza-a-maduro-y-eso-le-hace-dano-a-su-papel-en-la-region/,https://cloudfront-us-east-1.images.arcpublishing.com/infobae/QILIVX6S5RCJVLDM3YJYJPHOW4.jpg
13,https://www.infobae.com/historias/2021/04/07/hacia-reir-a-millones-y-ganaba-fortunas-hasta-que-su-esposa-lo-mato-de-tres-balazos-mientras-dormia/,"Hacía reír a millones y ganaba fortunas, hasta que su esposa lo mató de tres balazos mientras dormía",https://www.infobae.com/historias/2021/04/07/hacia-reir-a-millones-y-ganaba-fortunas-hasta-que-su-esposa-lo-mato-de-tres-balazos-mientras-dormia/,https://cloudfront-us-east-1.images.arcpublishing.com/infobae/O4X6CMK47VA3BJ5TPVJWA6TZ7E.jpg
14,https://www.infobae.com/historias/2021/04/07/vivio-hitler-en-la-argentina-las-mas-increibles-historias-y-teorias-conspirativas-sobre-su-muerte-y-la-supuesta-huida-hacia-la-patagonia/,¿Vivió Hitler en la Argentina? Las más increíbles historias y teorías conspirativas sobre su muerte y la supuesta huida hacia la Patagonia,https://www.infobae.com/historias/2021/04/07/vivio-hitler-en-la-argentina-las-mas-increibles-historias-y-teorias-conspirativas-sobre-su-muerte-y-la-supuesta-huida-hacia-la-patagonia/,https://cloudfront-us-east-1.images.arcpublishing.com/infobae/AVALINBQ25HN3O2XBU5EQACEKA.jpg
15,https://www.infobae.com/teleshow/infoshow/2021/04/07/se-viralizo-la-primera-aparicion-de-damian-betular-en-masterchef-2015-y-los-fans-lo-tildaron-de-irreconocible/,Se viralizó la primera aparición de Damián Betular en Masterchef 2015 y los fans lo tildaron de “irreconocible”,https://www.infobae.com/teleshow/infoshow/2021/04/07/se-viralizo-la-primera-aparicion-de-damian-betular-en-masterchef-2015-y-los-fans-lo-tildaron-de-irreconocible/,https://cloudfront-us-east-1.images.arcpublishing.com/infobae/A33MFUKKSNHNZI4X6FESDECUNU.jpg
16,https://www.infobae.com/teleshow/infoshow/2021/04/07/de-romina-malaspina-a-fredy-villarreal-y-osvaldo-laport-los-famosos-que-cobran-en-dolares-por-un-saludo-personalizado/,De Fredy Villarreal a Osvaldo Laport y Romina Malaspina: los famosos que cobran en dólares por un saludo personalizado,https://www.infobae.com/teleshow/infoshow/2021/04/07/de-romina-malaspina-a-fredy-villarreal-y-osvaldo-laport-los-famosos-que-cobran-en-dolares-por-un-saludo-personalizado/,https://cloudfront-us-east-1.images.arcpublishing.com/infobae/5Z4EPZPDWVCX7LDWZQDAJM4E4I.jpg
17,https://www.infobae.com/deportes/2021/04/06/el-extrano-y-exotico-corte-de-pelo-que-se-hizo-carlos-tevez-que-revoluciono-las-redes-sociales/,El extraño y exótico corte de pelo que se hizo Carlos Tevez que revolucionó las redes sociales,https://www.infobae.com/deportes/2021/04/06/el-extrano-y-exotico-corte-de-pelo-que-se-hizo-carlos-tevez-que-revoluciono-las-redes-sociales/,https://cloudfront-us-east-1.images.arcpublishing.com/infobae/7NEDSBIHCBACDHXUIKBML7RZV4.jpg
18,https://www.infobae.com/america/ciencia-america/2021/04/07/el-comite-de-expertos-de-la-ema-dijo-que-los-beneficios-de-la-vacuna-de-astrazeneca-superan-los-riesgos-de-sufrir-trombosis/,"El comité de expertos de la EMA halló vínculos entre la vacuna de AstraZeneca y casos de trombosis, pero dijo que los beneficios superan a los riesgos",https://www.infobae.com/america/ciencia-america/2021/04/07/el-comite-de-expertos-de-la-ema-dijo-que-los-beneficios-de-la-vacuna-de-astrazeneca-superan-los-riesgos-de-sufrir-trombosis/,https://cloudfront-us-east-1.images.arcpublishing.com/infobae/NNN62REMILV3UFB34X5W4KZC2A.jpg
19,https://www.infobae.com/america/america-latina/2021/04/07/arrestos-fallidos-y-una-cancion-que-enfurece-la-manifestacion-popular-que-desafio-y-puso-a-prueba-al-regimen-cubano/,Arrestos fallidos y una canción que enfurece: la manifestación popular que desafió y puso a prueba al régimen cubano,https://www.infobae.com/america/america-latina/2021/04/07/arrestos-fallidos-y-una-cancion-que-enfurece-la-manifestacion-popular-que-desafio-y-puso-a-prueba-al-regimen-cubano/,https://cloudfront-us-east-1.images.arcpublishing.com/infobae/55NNYMB7PBFHHL6Q76ALRLRYDQ.jpg
20,https://www.infobae.com/america/mundo/2021/04/07/la-campana-mediatica-del-kremlin-contra-alexei-navalny-videos-en-prision-y-una-espia-como-periodista-en-la-carcel/,La campaña mediática del Kremlin contra Alexei Navalny: videos en prisión y una espía como periodista en la cárcel,https://www.infobae.com/america/mundo/2021/04/07/la-campana-mediatica-del-kremlin-contra-alexei-navalny-videos-en-prision-y-una-espia-como-periodista-en-la-carcel/,https://cloudfront-us-east-1.images.arcpublishing.com/infobae/SWZ6EPTBLNDQ3GGTSNCBVV6AVE.jpg
21,https://www.infobae.com/teleshow/infoshow/2021/04/07/nico-vazquez-se-descompuso-luego-de-probar-un-plato-de-gaston-dalmau-en-masterchef-celebrity-me-mato/,Nico Vázquez se descompuso luego de probar un plato de Gastón Dalmau en Masterchef Celebrity: “Me mató”,https://www.infobae.com/teleshow/infoshow/2021/04/07/nico-vazquez-se-descompuso-luego-de-probar-un-plato-de-gaston-dalmau-en-masterchef-celebrity-me-mato/,https://cloudfront-us-east-1.images.arcpublishing.com/infobae/WNK6IX63SNB6NOISKR4BRELFVY.jpg
22,https://www.infobae.com/america/entretenimiento/2021/04/07/khloe-kardashian-y-su-equipo-estan-desesperados-intentando-retirar-esta-foto-de-ella-en-bikini-y-sin-retocar/,Khloé Kardashian y su equipo están desesperados intentando retirar esta foto de ella en bikini y sin retocar,https://www.infobae.com/america/entretenimiento/2021/04/07/khloe-kardashian-y-su-equipo-estan-desesperados-intentando-retirar-esta-foto-de-ella-en-bikini-y-sin-retocar/,https://cloudfront-us-east-1.images.arcpublishing.com/infobae/RCYSVNIE4RFYPOQQKW73REQDJM.jpg
23,https://www.infobae.com/america/mundo/2021/04/07/el-estremecedor-video-que-muestra-el-choque-del-tren-en-taiwan-que-dejo-al-menos-51-muertos/,El estremecedor video que muestra el choque del tren en Taiwán que dejó al menos 51 muertos,https://www.infobae.com/america/mundo/2021/04/07/el-estremecedor-video-que-muestra-el-choque-del-tren-en-taiwan-que-dejo-al-menos-51-muertos/,https://cloudfront-us-east-1.images.arcpublishing.com/infobae/RAKQS6XANNBFLONVDWWANV3W7Y.jpg
24,https://www.infobae.com/america/deportes/futbol-europeo/2021/04/07/el-mejor-fichaje-del-mercado-dos-clubes-de-la-premier-league-pelean-por-quedarse-con-el-kun-aguero/,¿El mejor fichaje del mercado? Dos clubes de la Premier League pelean por quedarse con el Kun Agüero,https://www.infobae.com/america/deportes/futbol-europeo/2021/04/07/el-mejor-fichaje-del-mercado-dos-clubes-de-la-premier-league-pelean-por-quedarse-con-el-kun-aguero/,https://cloudfront-us-east-1.images.arcpublishing.com/infobae/QPBZ2IOPF5A55JLRMENBO35EUA
25,https://www.infobae.com/teleshow/infoshow/2021/04/07/el-mega-baby-shower-de-pampita-ardohain-tea-party-regalos-en-rosa-y-el-anuncio-de-cuatro-padrinos/,"El mega baby shower de Pampita Ardohain: tea party, regalos en rosa y el anuncio de cuatro padrinos",https://www.infobae.com/teleshow/infoshow/2021/04/07/el-mega-baby-shower-de-pampita-ardohain-tea-party-regalos-en-rosa-y-el-anuncio-de-cuatro-padrinos/,https://cloudfront-us-east-1.images.arcpublishing.com/infobae/UWL23ZKWAVBABLN352TBKDH4W4.jpg
26,https://www.infobae.com/sociedad/policiales/2021/04/07/el-kiosko-narco-de-magaly-esther-asi-funcionaba-el-negocio-de-una-dealer-de-cocaina-en-una-villa-de-la-paternal/,El kiosco narco de Magaly Esther: así funcionaba el negocio de una dealer de cocaína en una villa de La Paternal,https://www.infobae.com/sociedad/policiales/2021/04/07/el-kiosko-narco-de-magaly-esther-asi-funcionaba-el-negocio-de-una-dealer-de-cocaina-en-una-villa-de-la-paternal/,https://cloudfront-us-east-1.images.arcpublishing.com/infobae/4FBPDFNH6BBYZBOSSZ2KTLCCWI.jpg
27,https://www.infobae.com/economia/2021/04/07/el-gobierno-busca-recursos-adicionales-entre-los-paises-mas-ricos-del-fmi-para-pagar-la-deuda-y-estabilizar-la-economia/,El Gobierno busca recursos adicionales entre los países más ricos del FMI para pagar la deuda y estabilizar la economía,https://www.infobae.com/economia/2021/04/07/el-gobierno-busca-recursos-adicionales-entre-los-paises-mas-ricos-del-fmi-para-pagar-la-deuda-y-estabilizar-la-economia/,https://cloudfront-us-east-1.images.arcpublishing.com/infobae/JVSETMLSP5FBRD7YIYTQJ6DS2A.jpg
28,https://www.infobae.com/america/deportes/2021/04/07/el-fallo-arbitral-mas-indignante-de-la-historia-del-tenis-le-quitaron-puntos-perdio-el-partido-y-la-culparon-por-el-error/,"El fallo arbitral más indignante de la historia del tenis: le quitaron puntos, perdió el partido y la culparon por el error",https://www.infobae.com/america/deportes/2021/04/07/el-fallo-arbitral-mas-indignante-de-la-historia-del-tenis-le-quitaron-puntos-perdio-el-partido-y-la-culparon-por-el-error/,https://cloudfront-us-east-1.images.arcpublishing.com/infobae/DMTIKD7L7RHGPE5TLXLFSUNMMU.jpg
29,https://www.infobae.com/deportes/2021/04/07/de-ser-campeon-de-tc-2000-y-correr-a-metros-del-estrecho-de-magallanes-a-pasar-anos-arrumbado-en-un-galpon-la-increible-historia-del-auto-recuperado-del-loco-di-palma/,De ser campeón de TC 2000 y correr a metros del Estrecho de Magallanes a pasar años arrumbado en un galpón: la increíble historia del auto recuperado del Loco Di Palma,https://www.infobae.com/deportes/2021/04/07/de-ser-campeon-de-tc-2000-y-correr-a-metros-del-estrecho-de-magallanes-a-pasar-anos-arrumbado-en-un-galpon-la-increible-historia-del-auto-recuperado-del-loco-di-palma/,https://cloudfront-us-east-1.images.arcpublishing.com/infobae/G5T2YQZXFJEBFB2OD3S764MJSU.jpg
30,https://www.infobae.com/deportes/2021/04/07/alerta-roja-en-independiente-por-el-brote-masivo-de-coronavirus-en-el-plantel-a-dias-del-clasico-contra-racing/,Alerta roja en Independiente por el brote masivo de coronavirus en el plantel a días del clásico contra Racing,https://www.infobae.com/deportes/2021/04/07/alerta-roja-en-independiente-por-el-brote-masivo-de-coronavirus-en-el-plantel-a-dias-del-clasico-contra-racing/,https://cloudfront-us-east-1.images.arcpublishing.com/infobae/RX7EHVLTUZDJ3BE2IW3WHPHAVU.jpg
31,https://www.infobae.com/cultura/2021/04/07/josep-bartoli-el-artista-catalan-que-dibujo-a-sus-verdugos-y-enamoro-a-frida-kahlo/,"Josep Bartolí, el artista catalán que dibujó a sus verdugos y enamoró a Frida Kahlo",https://www.infobae.com/cultura/2021/04/07/josep-bartoli-el-artista-catalan-que-dibujo-a-sus-verdugos-y-enamoro-a-frida-kahlo/,https://cloudfront-us-east-1.images.arcpublishing.com/infobae/OZFE4SIJR5DDLGT2JBSLG5PGHQ.jpg
32,https://www.infobae.com/politica/2021/04/07/coronavirus-en-el-amba-cuales-son-los-tres-distritos-que-duplican-la-letalidad-a-nivel-nacional/,Coronavirus en el AMBA: cuáles son los tres distritos que duplican la letalidad a nivel nacional,https://www.infobae.com/politica/2021/04/07/coronavirus-en-el-amba-cuales-son-los-tres-distritos-que-duplican-la-letalidad-a-nivel-nacional/,https://cloudfront-us-east-1.images.arcpublishing.com/infobae/T6EVEEOAG5EJRDGIC5NH6OOTKE.jpg
33,https://www.infobae.com/politica/2021/04/07/los-piquetes-tambien-son-un-foco-de-contagio-y-habria-que-limitarlos/,Los piquetes también son un foco de contagio y habría que limitarlos,https://www.infobae.com/politica/2021/04/07/los-piquetes-tambien-son-un-foco-de-contagio-y-habria-que-limitarlos/,https://cloudfront-us-east-1.images.arcpublishing.com/infobae/MCHPRECTMNCMPN64INX3SRJXQQ.jpg
34,https://www.infobae.com/america/ciencia-america/2021/04/07/como-sera-el-recorrido-de-las-46-millones-de-vacunas-de-oxford-astrazeneca-que-llegaran-a-la-argentina-desde-estados-unidos-y-mexico-entre-abril-y-mayo/,"Cómo será el recorrido de las 4,6 millones de vacunas de Oxford-AstraZeneca que llegarán a la Argentina desde Estados Unidos y México entre abril y mayo",https://www.infobae.com/america/ciencia-america/2021/04/07/como-sera-el-recorrido-de-las-46-millones-de-vacunas-de-oxford-astrazeneca-que-llegaran-a-la-argentina-desde-estados-unidos-y-mexico-entre-abril-y-mayo/,https://cloudfront-us-east-1.images.arcpublishing.com/infobae/6RRCITJCPYSG6XO53FWSFBYI6E.jpg
35,https://www.infobae.com/america/ciencia-america/2021/04/07/los-principales-riesgos-de-diferir-la-segunda-dosis-de-la-vacuna-contra-el-covid-19-segun-anthony-fauci/,"Los principales riesgos de diferir la segunda dosis de la vacuna contra el COVID-19, según Anthony Fauci",https://www.infobae.com/america/ciencia-america/2021/04/07/los-principales-riesgos-de-diferir-la-segunda-dosis-de-la-vacuna-contra-el-covid-19-segun-anthony-fauci/,https://cloudfront-us-east-1.images.arcpublishing.com/infobae/45DKTGLZMPCV6OMT7KZ4AWC62M.jpg
36,https://www.infobae.com/sociedad/2021/04/07/quien-era-chuca-la-abogada-y-defensora-del-pueblo-que-genero-una-conmocion-en-las-redes-sociales/,"Quién era Chuca, la abogada y defensora del Pueblo que generó una conmoción en las redes sociales",https://www.infobae.com/sociedad/2021/04/07/quien-era-chuca-la-abogada-y-defensora-del-pueblo-que-genero-una-conmocion-en-las-redes-sociales/,https://cloudfront-us-east-1.images.arcpublishing.com/infobae/JEYWB6IM3BGZRA7D7TLTGLBKSI.jpg
37,https://www.infobae.com/teleshow/infoshow/2021/04/07/se-conocieron-hace-un-ano-en-indonesia-cuando-ella-quedo-varada-por-la-pandemia-recorrieron-europa-y-hoy-viven-juntos-en-argentina-la-historia-de-amor-de-la-actriz-luli-torn-y-su-novio-belga/,"Se conocieron hace un año en Indonesia cuando ella quedó varada por la pandemia, recorrieron Europa y hoy viven juntos en Argentina: la historia de amor de la actriz Luli Torn y su novio belga",https://www.infobae.com/teleshow/infoshow/2021/04/07/se-conocieron-hace-un-ano-en-indonesia-cuando-ella-quedo-varada-por-la-pandemia-recorrieron-europa-y-hoy-viven-juntos-en-argentina-la-historia-de-amor-de-la-actriz-luli-torn-y-su-novio-belga/,https://cloudfront-us-east-1.images.arcpublishing.com/infobae/WDW47NYY3FE47FUEZMWID5JAKU.jpg
38,https://www.infobae.com/america/mundo/2021/04/07/que-hay-detras-de-la-guerra-y-la-tregua-momentanea-en-la-familia-real-jordana/,Qué hay detrás de la guerra (y la tregua momentánea) en la familia real de Jordania,https://www.infobae.com/america/mundo/2021/04/07/que-hay-detras-de-la-guerra-y-la-tregua-momentanea-en-la-familia-real-jordana/,https://cloudfront-us-east-1.images.arcpublishing.com/infobae/B7PBWMXWRJCIFOCHS34XCT74WM.jpg
39,https://www.infobae.com/sociedad/2021/04/07/cayo-un-bebe-de-un-quinto-piso-en-puerto-madero/,Dramático rescate en Puerto Madero de una nena que cayó de un quinto piso ,https://www.infobae.com/sociedad/2021/04/07/cayo-un-bebe-de-un-quinto-piso-en-puerto-madero/,https://cloudfront-us-east-1.images.arcpublishing.com/infobae/77PDRX57QRBOVMEHAEBENFPMII.png
40,https://www.infobae.com/deportes/2021/04/07/el-dream-team-que-planea-riquelme-en-boca-para-ir-en-busca-de-la-septima-copa-libertadores/,El Dream Team que planea Riquelme en Boca para ir en busca de la séptima Copa Libertadores  ,https://www.infobae.com/deportes/2021/04/07/el-dream-team-que-planea-riquelme-en-boca-para-ir-en-busca-de-la-septima-copa-libertadores/,https://cloudfront-us-east-1.images.arcpublishing.com/infobae/HKZS7O7UHRAZZK37RR7MOASF3Q.jpg
41,https://www.infobae.com/sociedad/2021/04/07/canibalismo-traicion-odio-y-venganza-11-mitos-y-verdades-del-motin-de-sierra-chica/,"Canibalismo, traición, odio y venganza: 11 mitos y verdades del motín de Sierra Chica",https://www.infobae.com/sociedad/2021/04/07/canibalismo-traicion-odio-y-venganza-11-mitos-y-verdades-del-motin-de-sierra-chica/,https://cloudfront-us-east-1.images.arcpublishing.com/infobae/MXPUZPJ5SNAENGKX4SCKGJLIMM.jpg
42,https://www.infobae.com/cultura/2021/04/07/tres-escritores-argentinos-consagrados-en-la-granta-en-espanol/,"Tres escritores argentinos, consagrados en la “Granta en Español”",https://www.infobae.com/cultura/2021/04/07/tres-escritores-argentinos-consagrados-en-la-granta-en-espanol/,https://cloudfront-us-east-1.images.arcpublishing.com/infobae/KJNM7ONHOFCOHG5EO45W22H4NM.jpg
43,https://www.infobae.com/politica/2021/04/07/la-justicia-le-devolvio-a-cristina-kirchner-la-administracion-de-los-sauces-hotesur-y-otras-sociedades-que-estaban-intervenidas/,"La justicia le devolvió a Cristina Kirchner la administración de Los Sauces, Hotesur y otras sociedades que estaban intervenidas",https://www.infobae.com/politica/2021/04/07/la-justicia-le-devolvio-a-cristina-kirchner-la-administracion-de-los-sauces-hotesur-y-otras-sociedades-que-estaban-intervenidas/,https://cloudfront-us-east-1.images.arcpublishing.com/infobae/5WLN767HCFDMZAJXPM4DDKVT2I.jpeg
44,https://www.infobae.com/politica/2021/04/07/en-el-debate-sobre-las-paso-la-cupula-de-juntos-por-el-cambio-logro-un-empate-interno-que-le-dara-oxigeno-en-la-pelea-de-fondo-con-el-gobierno/,"En el debate sobre las PASO, la cúpula de Juntos por el Cambio logró un empate interno que le dará oxígeno en la pelea de fondo con el Gobierno",https://www.infobae.com/politica/2021/04/07/en-el-debate-sobre-las-paso-la-cupula-de-juntos-por-el-cambio-logro-un-empate-interno-que-le-dara-oxigeno-en-la-pelea-de-fondo-con-el-gobierno/,https://cloudfront-us-east-1.images.arcpublishing.com/infobae/7YBXGKQEKRFZTFO5H3A5WOG7SY.jpg
45,https://www.infobae.com/economia/2021/04/07/el-fmi-pronostico-una-recuperacion-del-58-para-la-economia-argentina-pero-privados-creen-que-puede-llegar-al-8/,"El FMI pronosticó una recuperación del 5,8% para la economía argentina, pero privados creen que puede llegar al 8%",https://www.infobae.com/economia/2021/04/07/el-fmi-pronostico-una-recuperacion-del-58-para-la-economia-argentina-pero-privados-creen-que-puede-llegar-al-8/,https://cloudfront-us-east-1.images.arcpublishing.com/infobae/ONSNC5FCGNHMNH6XVMMLGKATCA
46,https://www.infobae.com/salud/2021/04/07/tras-varios-dias-de-largas-colas-para-hisoparse-la-ciudad-extendio-el-horario-de-las-unidades-febriles-y-sumo-centros-de-testeo/,Coronavirus: dónde pueden hisoparse gratis los porteños que tienen síntomas,https://www.infobae.com/salud/2021/04/07/tras-varios-dias-de-largas-colas-para-hisoparse-la-ciudad-extendio-el-horario-de-las-unidades-febriles-y-sumo-centros-de-testeo/,https://cloudfront-us-east-1.images.arcpublishing.com/infobae/BKTP7VVP4JED7CFI5AX3PEHYXA.jpg
47,https://www.infobae.com/tendencias/2021/04/07/inhibidores-y-facilitadores-como-responder-y-comprender-al-otro-ante-una-situacion-sexual/,Inhibidores y facilitadores: cómo responder y comprender al otro ante una situación sexual,https://www.infobae.com/tendencias/2021/04/07/inhibidores-y-facilitadores-como-responder-y-comprender-al-otro-ante-una-situacion-sexual/,https://cloudfront-us-east-1.images.arcpublishing.com/infobae/PFPQN3SKDZD35CZVQNHPHWEZTM.jpg
48,https://www.infobae.com/salud/2021/04/07/por-la-pandemia-solo-el-40-de-los-argentinos-continuo-con-sus-controles-medicos/,"Por la pandemia, solo el 40% de los argentinos continuó con sus controles médicos",https://www.infobae.com/salud/2021/04/07/por-la-pandemia-solo-el-40-de-los-argentinos-continuo-con-sus-controles-medicos/,https://cloudfront-us-east-1.images.arcpublishing.com/infobae/7T24DU5GNBFEFDRUISSHDFQSBQ.jpg
49,https://www.infobae.com/economia/2021/04/06/alivio-fiscal-para-las-empresas-el-gobierno-modificara-el-impuesto-a-las-ganancias-y-menos-estaran-en-la-escala-mas-alta/,Alivio fiscal para las empresas: el Gobierno modificará el impuesto a las Ganancias para sociedades y menos estarán en la escala más alta,https://www.infobae.com/economia/2021/04/06/alivio-fiscal-para-las-empresas-el-gobierno-modificara-el-impuesto-a-las-ganancias-y-menos-estaran-en-la-escala-mas-alta/,https://cloudfront-us-east-1.images.arcpublishing.com/infobae/B3JYQHCIKJCLLFFZ4LHEGODDRI.jpg
