n,id,title,url,image
106,https://www.infobae.com/america/entretenimiento/2023/01/18/era-para-mi-jennifer-lopez-revelo-por-que-no-consiguio-el-iconico-beso-con-britney-spears/,“Era para mí”: Jennifer Lopez reveló por qué no consiguió el icónico beso con Britney Spears ,https://www.infobae.com/america/entretenimiento/2023/01/18/era-para-mi-jennifer-lopez-revelo-por-que-no-consiguio-el-iconico-beso-con-britney-spears/,https://cloudfront-us-east-1.images.arcpublishing.com/infobae/ULBYZDLF33GKSELI57DQ5VQCOI.jpg
107,https://www.infobae.com/teleshow/2023/01/18/quien-es-camila-la-hermana-de-thiago-de-gran-hermano-que-juega-afuera-de-la-casa-peleas-mediaticas-casos-policiales-y-enfrentamiento-con-una-famosa-actriz/,"Quién es Camila, la hermana de Thiago de Gran Hermano que juega afuera de la casa: peleas mediáticas, casos policiales y enfrentamiento con una famosa actriz",https://www.infobae.com/teleshow/2023/01/18/quien-es-camila-la-hermana-de-thiago-de-gran-hermano-que-juega-afuera-de-la-casa-peleas-mediaticas-casos-policiales-y-enfrentamiento-con-una-famosa-actriz/,https://cloudfront-us-east-1.images.arcpublishing.com/infobae/G4FNWARLKJEIFMGJBSAOGW45XM.jpg
108,https://www.infobae.com/deportes/2023/01/18/alexis-vega-fuera-de-las-canchas-durante-ocho-semanas-tras-su-operacion/,Alexis Vega fuera de las canchas durante ocho semanas tras su operación,https://www.infobae.com/deportes/2023/01/18/alexis-vega-fuera-de-las-canchas-durante-ocho-semanas-tras-su-operacion/,https://cloudfront-us-east-1.images.arcpublishing.com/infobae/7EPP64CNIFAUHI5SAHBGMUNTZQ.jpg
109,https://www.infobae.com/deportes/2023/01/18/rector-de-la-uanl-retoma-planes-para-el-nuevo-estadio-de-los-tigres/,Rector de la UANL retoma planes para el nuevo estadio de los Tigres,https://www.infobae.com/deportes/2023/01/18/rector-de-la-uanl-retoma-planes-para-el-nuevo-estadio-de-los-tigres/,https://cloudfront-us-east-1.images.arcpublishing.com/infobae/UQO5EKGLMZENPBLBNXRDOPB6NQ.jpg
110,https://www.infobae.com/deportes/2023/01/18/emotiva-carta-de-lionel-messi-a-un-mes-de-ser-campeon-del-mundo-con-argentina-nunca-imagine-la-locura-de-la-gente-en-los-festejos/,Emotiva carta de Lionel Messi a un mes de ser campeón del mundo con Argentina: “Nunca imaginé la locura de la gente en los festejos”,https://www.infobae.com/deportes/2023/01/18/emotiva-carta-de-lionel-messi-a-un-mes-de-ser-campeon-del-mundo-con-argentina-nunca-imagine-la-locura-de-la-gente-en-los-festejos/,https://cloudfront-us-east-1.images.arcpublishing.com/infobae/UVB3ZDZ22RDYTMXY2GATV3ZXOI.jpg
111,https://www.infobae.com/deportes/2023/01/18/el-posteo-de-scaloni-y-los-mensajes-de-los-jugadores-de-la-seleccion-a-un-mes-del-titulo-en-el-mundial-no-habra-nada-igual/,El posteo de Scaloni y los mensajes de los jugadores de la Selección a un mes del título en el Mundial: “No habrá nada igual”,https://www.infobae.com/deportes/2023/01/18/el-posteo-de-scaloni-y-los-mensajes-de-los-jugadores-de-la-seleccion-a-un-mes-del-titulo-en-el-mundial-no-habra-nada-igual/,https://cloudfront-us-east-1.images.arcpublishing.com/infobae/WZPHK2A5GOCWSPAVRYE2HXNRR4.jpg
112,https://www.infobae.com/mexico/2023/01/18/chicharito-hernandez-reafirmo-su-deseo-por-regresar-con-la-seleccion-nacional-para-el-mundial-de-2026/,Chicharito Hernández reafirmó su deseo por regresar con la Selección Nacional para el Mundial de 2026,https://www.infobae.com/mexico/2023/01/18/chicharito-hernandez-reafirmo-su-deseo-por-regresar-con-la-seleccion-nacional-para-el-mundial-de-2026/,https://cloudfront-us-east-1.images.arcpublishing.com/infobae/VIZP6CLYQ5GQNCT453KOLLMGAQ.jpg
