n,id,title,url,image
1,https://www.infobae.com/politica/2021/12/05/nervios-intrigas-y-contactos-secretos-por-que-juntos-por-el-cambio-se-pelea-como-si-hubiera-perdido-las-elecciones/,"Nervios, intrigas y contactos secretos: por qué Juntos por el Cambio se pelea como si hubiera perdido las elecciones",https://www.infobae.com/politica/2021/12/05/nervios-intrigas-y-contactos-secretos-por-que-juntos-por-el-cambio-se-pelea-como-si-hubiera-perdido-las-elecciones/,https://cloudfront-us-east-1.images.arcpublishing.com/infobae/U7FU2DM7MJGXBEE3OZ4OLDBCGU.png
2,https://www.infobae.com/politica/2021/12/05/citaron-a-indagatoria-por-enriquecimiento-ilicito-al-segundo-de-jose-lopez-en-la-secretaria-de-obras-publicas-durante-el-kirchnerismo/,Citaron a indagatoria por enriquecimiento ilícito al segundo de José López en la Secretaría de Obras Públicas durante el kirchnerismo,https://www.infobae.com/politica/2021/12/05/citaron-a-indagatoria-por-enriquecimiento-ilicito-al-segundo-de-jose-lopez-en-la-secretaria-de-obras-publicas-durante-el-kirchnerismo/,https://cloudfront-us-east-1.images.arcpublishing.com/infobae/K46FKZGVM5DZHOHMQJ5OOVUMCQ.jpg
3,https://www.infobae.com/historias/2021/12/05/lo-mande-a-matar-porque-me-irritaba-una-esposa-despechada-y-tres-balazos-para-el-heredero-de-los-gucci/,“Lo mandé a matar porque me irritaba”: una esposa despechada y tres balazos para el heredero de los Gucci,https://www.infobae.com/historias/2021/12/05/lo-mande-a-matar-porque-me-irritaba-una-esposa-despechada-y-tres-balazos-para-el-heredero-de-los-gucci/,https://cloudfront-us-east-1.images.arcpublishing.com/infobae/BZGOMHOGXNEBPFKKYTVKZASRCY.jpg
4,https://www.infobae.com/opinion/2021/12/05/las-tenues-senales-de-vida-en-un-presidente-que-parecia-terminado/,Las tenues señales de vida en un presidente que parecía terminado,https://www.infobae.com/opinion/2021/12/05/las-tenues-senales-de-vida-en-un-presidente-que-parecia-terminado/,https://cloudfront-us-east-1.images.arcpublishing.com/infobae/OXOGS4CHW5AOHBHDI76LXJ32WI
5,https://www.infobae.com/opinion/2021/12/05/el-gobierno-en-narnia-y-la-oposicion-en-titanes-en-el-ring/,El Gobierno en Narnia y la oposición en Titanes en el Ring,https://www.infobae.com/opinion/2021/12/05/el-gobierno-en-narnia-y-la-oposicion-en-titanes-en-el-ring/,https://cloudfront-us-east-1.images.arcpublishing.com/infobae/75JF5OF4WVHVNMUDN2HEME55UE.jpg
6,https://www.infobae.com/sociedad/policiales/2021/12/05/balearon-el-frente-de-una-empresa-en-rosario-100-mil-pesos-por-mes-o-los-matamos-a-todos/,Balearon el frente de una empresa en Rosario: “100 mil pesos por mes o los matamos a todos”,https://www.infobae.com/sociedad/policiales/2021/12/05/balearon-el-frente-de-una-empresa-en-rosario-100-mil-pesos-por-mes-o-los-matamos-a-todos/,https://cloudfront-us-east-1.images.arcpublishing.com/infobae/DRFXP6UNGRGZNEPFWO76EYP5ZE.PNG
7,https://www.infobae.com/sociedad/policiales/2021/12/05/el-cielo-llora-porque-no-debias-irte-el-emotivo-video-homenaje-del-padre-de-lucio-dupuy-a-una-semana-del-asesinato/,“El cielo llora porque no debías irte”: el emotivo video homenaje del padre de Lucio Dupuy a una semana del asesinato,https://www.infobae.com/sociedad/policiales/2021/12/05/el-cielo-llora-porque-no-debias-irte-el-emotivo-video-homenaje-del-padre-de-lucio-dupuy-a-una-semana-del-asesinato/,https://cloudfront-us-east-1.images.arcpublishing.com/infobae/SX45RGEZARGJDJXIS63IOBM2PE.jpg
8,https://www.infobae.com/politica/2021/12/05/uno-de-los-jueces-que-sobreseyo-a-cristina-kirchner-fue-bochado-en-la-facultad-de-derecho-y-perdio-su-cargo-como-profesor/,Uno de los jueces que sobreseyó a Cristina Kirchner fue “bochado” en la Facultad de Derecho y perdió su cargo como profesor,https://www.infobae.com/politica/2021/12/05/uno-de-los-jueces-que-sobreseyo-a-cristina-kirchner-fue-bochado-en-la-facultad-de-derecho-y-perdio-su-cargo-como-profesor/,https://cloudfront-us-east-1.images.arcpublishing.com/infobae/VXKDRVG2PVFGLMLDJYMFGV2RYA.jpg
9,https://www.infobae.com/deportes/2021/12/05/las-primeras-cuatro-medidas-de-jorge-brito-como-nuevo-presidente-de-river-plate/,Las cuatro medidas que pondrá en marcha Jorge Brito durante sus primeros días como presidente de River Plate,https://www.infobae.com/deportes/2021/12/05/las-primeras-cuatro-medidas-de-jorge-brito-como-nuevo-presidente-de-river-plate/,https://cloudfront-us-east-1.images.arcpublishing.com/infobae/V7NJOLG3EZG3JDMDG44J26WTRI.png
10,https://www.infobae.com/deportes/2021/12/05/secreto-de-estado-como-julio-grondona-uso-su-poder-en-la-fifa-para-rescatar-del-embargo-a-la-fragata-libertad/,Secreto de Estado: cómo Julio Grondona usó su poder en la FIFA para rescatar del embargo a la Fragata Libertad ,https://www.infobae.com/deportes/2021/12/05/secreto-de-estado-como-julio-grondona-uso-su-poder-en-la-fifa-para-rescatar-del-embargo-a-la-fragata-libertad/,https://cloudfront-us-east-1.images.arcpublishing.com/infobae/JNVJLKL4BBAA3DEIRMXPIT2GLE.jpg
11,https://www.infobae.com/vidriera/2021/12/05/35-fotos-empresarios-embajadores-y-famosos-en-la-semifinal-del-abierto-de-polo-de-palermo/,"35 fotos: empresarios, embajadores y famosos en la semifinal del Abierto de Polo de Palermo",https://www.infobae.com/vidriera/2021/12/05/35-fotos-empresarios-embajadores-y-famosos-en-la-semifinal-del-abierto-de-polo-de-palermo/,https://cloudfront-us-east-1.images.arcpublishing.com/infobae/7BIPMML3UZAC3LJHHD5KC7O7GI.jpg
12,https://www.infobae.com/sociedad/2021/12/04/en-vivo-la-uba-festeja-su-bicentenario-con-un-mega-concierto-gratuito-y-grandes-figuras/,La UBA festejó su Bicentenario con un mega concierto gratuito y grandes figuras,https://www.infobae.com/sociedad/2021/12/04/en-vivo-la-uba-festeja-su-bicentenario-con-un-mega-concierto-gratuito-y-grandes-figuras/,https://cloudfront-us-east-1.images.arcpublishing.com/infobae/PEYR3D5R7RA5PKDW3VAATYA6RA.jpg
13,https://www.infobae.com/fotos/2021/12/04/uba200-en-concierto-las-mejores-fotos-de-un-festejo-inolvidable/,50 fotos del concierto con el que la Universidad de Buenos Aires celebró su Bicentenario,https://www.infobae.com/fotos/2021/12/04/uba200-en-concierto-las-mejores-fotos-de-un-festejo-inolvidable/,https://cloudfront-us-east-1.images.arcpublishing.com/infobae/AKNP6MXGOBGULDG7D6YAZIFSFA.jpg
14,https://www.infobae.com/politica/2021/12/05/peronismo-barro-y-misericordia-quien-es-y-que-quiere-maria-migliore-la-ministra-popular-de-rodriguez-larreta/,"Peronismo, barro y misericordia: quién es y qué quiere María Migliore, la ministra popular de Rodríguez Larreta",https://www.infobae.com/politica/2021/12/05/peronismo-barro-y-misericordia-quien-es-y-que-quiere-maria-migliore-la-ministra-popular-de-rodriguez-larreta/,https://cloudfront-us-east-1.images.arcpublishing.com/infobae/3HX7GVPCWJHPRG5QSZPXDQU52Q.jpg
15,https://www.infobae.com/teleshow/2021/12/05/las-grandes-tristezas-y-los-momentos-limites-que-superaron-susana-gimenez-flavia-palmiero-monica-ayos-y-graciela-alfano/,"Las grandes tristezas y los momentos límites que superaron Susana Giménez, Flavia Palmiero, Mónica Ayos y Graciela Alfano",https://www.infobae.com/teleshow/2021/12/05/las-grandes-tristezas-y-los-momentos-limites-que-superaron-susana-gimenez-flavia-palmiero-monica-ayos-y-graciela-alfano/,https://cloudfront-us-east-1.images.arcpublishing.com/infobae/CNT4EFQCVVG4DF7CYSVWCVIEI4.jpg
16,https://www.infobae.com/deportes/2021/12/04/asi-quedo-la-tabla-anual-tras-el-empate-de-boca-que-necesita-para-clasificarse-a-la-libertadores-2022/,Así quedó la Tabla Anual tras el empate de Boca: cómo se definirán los boletos a la Copa Libertadores y Sudamericana,https://www.infobae.com/deportes/2021/12/04/asi-quedo-la-tabla-anual-tras-el-empate-de-boca-que-necesita-para-clasificarse-a-la-libertadores-2022/,https://cloudfront-us-east-1.images.arcpublishing.com/infobae/UGOPXXHNUFAE3KLDROHBQGPQXE.jpg
17,https://www.infobae.com/cultura/2021/12/05/adelanto-de-la-cultura-de-la-cancelacion-del-juicio-publico-a-la-era-del-clickbait-de-juan-gabriel-batalla/,"Adelanto de “La cultura de la cancelación: del juicio público a la era del clickbait”, de Juan Gabriel Batalla",https://www.infobae.com/cultura/2021/12/05/adelanto-de-la-cultura-de-la-cancelacion-del-juicio-publico-a-la-era-del-clickbait-de-juan-gabriel-batalla/,https://cloudfront-us-east-1.images.arcpublishing.com/infobae/5BS4YISMXRH7TELAP5SXACZRUU.jpg
18,https://www.infobae.com/opinion/2021/12/05/levando-anclas-un-programa-antiinflacionario-que-no-sera/,"Levando anclas, un programa antiinflacionario que no será",https://www.infobae.com/opinion/2021/12/05/levando-anclas-un-programa-antiinflacionario-que-no-sera/,https://cloudfront-us-east-1.images.arcpublishing.com/infobae/WX4P6ZAIYRDWZG7BZ4URQGNJYU.jpg
19,https://www.infobae.com/opinion/2021/12/05/los-fernandez-se-debaten-entre-la-impericia-y-la-soberbia-mientras-evitan-hablar-de-su-divorcio/,"Los Fernández se debaten entre la impericia y la soberbia, mientras evitan hablar de su divorcio",https://www.infobae.com/opinion/2021/12/05/los-fernandez-se-debaten-entre-la-impericia-y-la-soberbia-mientras-evitan-hablar-de-su-divorcio/,https://cloudfront-us-east-1.images.arcpublishing.com/infobae/5YW7LGZT6JFCXKEAVJFA4BWIV4
20,https://www.infobae.com/reportajes/2021/12/05/santiago-maratea-con-maria-laura-santillan-estan-cambiando-las-tendencias-lo-bueno-vende/,Santiago Maratea con María Laura Santillán: “Están Cambiando las tendencias; lo bueno vende”,https://www.infobae.com/reportajes/2021/12/05/santiago-maratea-con-maria-laura-santillan-estan-cambiando-las-tendencias-lo-bueno-vende/,https://cloudfront-us-east-1.images.arcpublishing.com/infobae/CHWKHV2RT5CHPIG4EQVJP55TNI.jpg
21,https://www.infobae.com/america/mundo/2021/12/05/los-megaproyectos-mas-inutiles-y-caros-del-mundo/,Los megaproyectos más inútiles y caros del mundo,https://www.infobae.com/america/mundo/2021/12/05/los-megaproyectos-mas-inutiles-y-caros-del-mundo/,https://cloudfront-us-east-1.images.arcpublishing.com/infobae/TJF655KGZNGYTAKAZQS3MXSE5U.jpg
22,https://www.infobae.com/deportes/2021/12/05/un-hombre-murio-durante-la-maraton-de-cordoba/,Un hombre murió durante la maratón de Córdoba,https://www.infobae.com/deportes/2021/12/05/un-hombre-murio-durante-la-maraton-de-cordoba/,https://cloudfront-us-east-1.images.arcpublishing.com/infobae/EZTECDX5RBBMXLLG3KBBQGCVAU.jpg
23,https://www.infobae.com/deportes/2021/12/05/jorge-brito-logro-una-victoria-aplastante-en-unas-elecciones-record-y-se-convirtio-en-el-nuevo-presidente-de-river-plate/,Jorge Brito logró una victoria aplastante en unas elecciones récord y se convirtió en el nuevo presidente de River Plate,https://www.infobae.com/deportes/2021/12/05/jorge-brito-logro-una-victoria-aplastante-en-unas-elecciones-record-y-se-convirtio-en-el-nuevo-presidente-de-river-plate/,https://cloudfront-us-east-1.images.arcpublishing.com/infobae/AWTAXPJ2JJHGLDYA43TLHOTSEY.JPG
24,https://www.infobae.com/deportes/2021/12/05/del-nino-que-idolatraba-a-ortega-al-empresario-que-debera-conducir-a-un-river-historico-quien-es-el-nuevo-presidente-jorge-brito/,"Del niño que idolatraba a Ortega, al empresario que conducirá un momento histórico: Jorge Brito, el nuevo presidente de River Plate",https://www.infobae.com/deportes/2021/12/05/del-nino-que-idolatraba-a-ortega-al-empresario-que-debera-conducir-a-un-river-historico-quien-es-el-nuevo-presidente-jorge-brito/,https://cloudfront-us-east-1.images.arcpublishing.com/infobae/FRV6N5U255HO5NFYHAAVWRV4LM.jpeg
25,https://www.infobae.com/deportes/2021/12/05/hay-un-estilo-que-debe-quedar-asi-se-vivio-la-eleccion-historica-que-consagro-a-jorge-brito-como-presidente-de-river-plate/,“Hay un estilo que debe quedar”: así se vivió la elección histórica que consagró a Jorge Brito como presidente de River Plate,https://www.infobae.com/deportes/2021/12/05/hay-un-estilo-que-debe-quedar-asi-se-vivio-la-eleccion-historica-que-consagro-a-jorge-brito-como-presidente-de-river-plate/,https://cloudfront-us-east-1.images.arcpublishing.com/infobae/3HJDDKF5JZG5ZOMDGK74OO4UUM.jpg
26,https://www.infobae.com/fotos/2021/12/05/20-fotos-de-las-elecciones-historicas-de-river-plate-que-consagraron-a-jorge-brito-como-nuevo-presidente/,24 fotos de las elecciones históricas de River Plate que consagraron a Jorge Brito como nuevo presidente,https://www.infobae.com/fotos/2021/12/05/20-fotos-de-las-elecciones-historicas-de-river-plate-que-consagraron-a-jorge-brito-como-nuevo-presidente/,https://cloudfront-us-east-1.images.arcpublishing.com/infobae/B3YARZPZOZEWDEVGNM72G4W33Q.jpg
27,https://www.infobae.com/politica/2021/12/05/alejandro-vilca-el-recolector-de-basura-que-asumira-como-diputado-no-quiero-que-lo-que-vivio-mi-familia-le-pase-a-otros/,"Alejandro Vilca, el recolector de basura que asumirá como diputado: “No quiero que lo que vivió mi familia le pase a otros”",https://www.infobae.com/politica/2021/12/05/alejandro-vilca-el-recolector-de-basura-que-asumira-como-diputado-no-quiero-que-lo-que-vivio-mi-familia-le-pase-a-otros/,https://cloudfront-us-east-1.images.arcpublishing.com/infobae/RKQHSYM2IFECJCVYVIRUM6TCIY.jpg
28,https://www.infobae.com/historias/2021/12/05/el-gran-sueno-de-disney-una-inversion-millonaria-y-un-debut-desastroso-pero-con-mas-rating-que-el-hombre-en-la-luna/,El gran sueño de Disney: una inversión millonaria y un debut desastroso pero con más rating que el hombre en la luna,https://www.infobae.com/historias/2021/12/05/el-gran-sueno-de-disney-una-inversion-millonaria-y-un-debut-desastroso-pero-con-mas-rating-que-el-hombre-en-la-luna/,https://cloudfront-us-east-1.images.arcpublishing.com/infobae/GO2VXVKAWJDD3E2MQVMZOVHZYQ.jpg
29,https://www.infobae.com/america/deportes/2021/12/05/maxima-tension-en-la-f1-hamilton-saldra-desde-la-pole-en-un-gp-de-arabia-saudi-en-el-que-verstappen-puede-gritar-campeon/,Máxima tensión en la F1: Hamilton saldrá desde la pole en un GP de Arabia Saudita en el que Verstappen puede gritar campeón,https://www.infobae.com/america/deportes/2021/12/05/maxima-tension-en-la-f1-hamilton-saldra-desde-la-pole-en-un-gp-de-arabia-saudi-en-el-que-verstappen-puede-gritar-campeon/,https://cloudfront-us-east-1.images.arcpublishing.com/infobae/HADV4YX5DTCCC2OZ343UXSC3I4.jpg
30,https://www.infobae.com/sociedad/2021/12/05/espien-a-menem-el-periodista-argentino-que-trabajo-para-la-inteligencia-checoslovaca-durante-la-decada-del-90/,Espíen a Menem: el periodista argentino que trabajó para la Inteligencia checoslovaca durante la década del 90,https://www.infobae.com/sociedad/2021/12/05/espien-a-menem-el-periodista-argentino-que-trabajo-para-la-inteligencia-checoslovaca-durante-la-decada-del-90/,https://cloudfront-us-east-1.images.arcpublishing.com/infobae/XH236HNHHVAOVOTOT3IKAQLBIE.jpg
31,https://www.infobae.com/politica/2021/12/05/mientras-prepara-su-apelacion-por-el-caso-del-ara-san-juan-macri-podria-quedar-involucrado-en-otra-causa-de-espionaje/,"Mientras prepara su apelación por el caso del Ara San Juan, Macri podría quedar involucrado en otra causa de espionaje",https://www.infobae.com/politica/2021/12/05/mientras-prepara-su-apelacion-por-el-caso-del-ara-san-juan-macri-podria-quedar-involucrado-en-otra-causa-de-espionaje/,https://cloudfront-us-east-1.images.arcpublishing.com/infobae/OONSIUSRQBD3ZNUYRSJLCX67NA.jpg
32,https://www.infobae.com/economia/2021/12/05/el-fmi-le-exige-al-gobierno-un-plan-para-acumular-reservas-y-sincerar-rapido-el-precio-del-dolar-oficial/,El FMI le exige al Gobierno un plan para acumular reservas y sincerar rápido el precio del dólar oficial,https://www.infobae.com/economia/2021/12/05/el-fmi-le-exige-al-gobierno-un-plan-para-acumular-reservas-y-sincerar-rapido-el-precio-del-dolar-oficial/,https://cloudfront-us-east-1.images.arcpublishing.com/infobae/GZ3R4M4OGZGWZO23M5EU2PXV4Q.PNG
33,https://www.infobae.com/turismo/2021/12/05/tres-destinos-de-cercania-pueblos-para-disfrutar-de-la-tranquilidad-la-naturaleza-y-la-buena-cocina/,"Tres destinos de cercanía: pueblos para disfrutar de la tranquilidad, la naturaleza y la buena cocina",https://www.infobae.com/turismo/2021/12/05/tres-destinos-de-cercania-pueblos-para-disfrutar-de-la-tranquilidad-la-naturaleza-y-la-buena-cocina/,https://cloudfront-us-east-1.images.arcpublishing.com/infobae/BOUVKWWSRRDR5OHBVOL5ZOZLH4.jpg
34,https://www.infobae.com/sociedad/2021/12/05/se-colgaron-del-techo-de-un-auto-y-recorrieron-seis-cuadras-a-alta-velocidad-por-el-centro-de-la-plata/,Se colgaron del techo de un auto y recorrieron seis cuadras a alta velocidad por el centro de La Plata  ,https://www.infobae.com/sociedad/2021/12/05/se-colgaron-del-techo-de-un-auto-y-recorrieron-seis-cuadras-a-alta-velocidad-por-el-centro-de-la-plata/,https://cloudfront-us-east-1.images.arcpublishing.com/infobae/3C35CSJOYFGNHDAZONY5GQBBVY.jpg
35,https://www.infobae.com/deportes/2021/12/05/marcos-di-palma-hizo-950-kilometros-en-bicicleta-para-homenajear-a-guillermo-ortelli/,Marcos Di Palma hizo 950 kilómetros en bicicleta para homenajear a Guillermo Ortelli,https://www.infobae.com/deportes/2021/12/05/marcos-di-palma-hizo-950-kilometros-en-bicicleta-para-homenajear-a-guillermo-ortelli/,https://cloudfront-us-east-1.images.arcpublishing.com/infobae/6LEATXOATREKPKUHRLKQ4UYDKQ.jpg
36,https://www.infobae.com/politica/2021/12/05/el-gobierno-y-el-fmi-inician-una-semana-clave-de-negociacion-para-definir-un-programa-que-tenga-respaldo-en-el-congreso/,El Gobierno y el FMI inician una semana clave de negociación para definir un programa que tenga respaldo en el Congreso,https://www.infobae.com/politica/2021/12/05/el-gobierno-y-el-fmi-inician-una-semana-clave-de-negociacion-para-definir-un-programa-que-tenga-respaldo-en-el-congreso/,https://cloudfront-us-east-1.images.arcpublishing.com/infobae/5B67L2VMI5FAFM7WWDRCD5O4YQ.jfif
37,https://www.infobae.com/politica/2021/12/05/pese-a-la-pandemia-alberto-fernandez-mantuvo-el-mismo-ritmo-de-nombramientos-de-jueces-que-mauricio-macri/,"Pese a la pandemia, Alberto Fernández mantuvo el mismo ritmo de nombramientos de jueces que Mauricio Macri",https://www.infobae.com/politica/2021/12/05/pese-a-la-pandemia-alberto-fernandez-mantuvo-el-mismo-ritmo-de-nombramientos-de-jueces-que-mauricio-macri/,https://cloudfront-us-east-1.images.arcpublishing.com/infobae/W5E46IHPKNERBO34ID7XZQPDZA.jpg
38,https://www.infobae.com/educacion/2021/12/05/soledad-acuna-el-cierre-de-escuelas-genero-un-dano-enorme-y-no-alcanza-con-solo-con-la-reapertura/,Soledad Acuña: “El cierre de escuelas generó un daño enorme y no alcanza solo con la reapertura”,https://www.infobae.com/educacion/2021/12/05/soledad-acuna-el-cierre-de-escuelas-genero-un-dano-enorme-y-no-alcanza-con-solo-con-la-reapertura/,https://cloudfront-us-east-1.images.arcpublishing.com/infobae/QUNBURCCMZFIXBLFBEUMJUYXRM.jpg
39,https://www.infobae.com/economia/2021/12/05/promociones-y-cuotas-que-ofreceran-supermercados-y-shoppings-para-impulsar-las-ventas-en-el-mes-de-las-fiestas/,Promociones y cuotas: qué ofrecerán supermercados y shoppings para impulsar las ventas en el mes de las Fiestas,https://www.infobae.com/economia/2021/12/05/promociones-y-cuotas-que-ofreceran-supermercados-y-shoppings-para-impulsar-las-ventas-en-el-mes-de-las-fiestas/,https://cloudfront-us-east-1.images.arcpublishing.com/infobae/OOBLULVVMVGDXKCSSE6IN5K4SI.jpg
40,https://www.infobae.com/politica/2021/12/05/axel-kicillof-empodera-a-sergio-berni-con-el-presupuesto-2022-moviles-fondos-y-10-mil-nuevos-policias/,"Axel Kicillof empodera a Sergio Berni con el Presupuesto 2022: móviles, fondos y 10 mil nuevos policías",https://www.infobae.com/politica/2021/12/05/axel-kicillof-empodera-a-sergio-berni-con-el-presupuesto-2022-moviles-fondos-y-10-mil-nuevos-policias/,https://cloudfront-us-east-1.images.arcpublishing.com/infobae/7KVPIE3RXFGRVMVOR4SFXBTE4Y.jpg
41,https://www.infobae.com/america/deportes/2021/12/05/la-curiosa-revelacion-de-luis-suarez-sobre-lionel-messi-me-dijo-que-sufre-mucho/,La curiosa revelación de Luis Suárez sobre Lionel Messi: “Me dijo que sufre mucho”,https://www.infobae.com/america/deportes/2021/12/05/la-curiosa-revelacion-de-luis-suarez-sobre-lionel-messi-me-dijo-que-sufre-mucho/,https://cloudfront-us-east-1.images.arcpublishing.com/infobae/24B5PZF54WCRVMIX2Z6KQJMTAI.jpg
42,https://www.infobae.com/politica/2021/12/05/el-gobierno-y-la-oposicion-esperan-al-cierre-de-las-negociaciones-con-el-fmi-para-definir-la-agenda-parlamentaria-sobre-la-deuda/,El Gobierno y la oposición esperan al cierre de las negociaciones con el FMI para definir la agenda parlamentaria sobre la deuda,https://www.infobae.com/politica/2021/12/05/el-gobierno-y-la-oposicion-esperan-al-cierre-de-las-negociaciones-con-el-fmi-para-definir-la-agenda-parlamentaria-sobre-la-deuda/,https://cloudfront-us-east-1.images.arcpublishing.com/infobae/DTNFTYPKMBCQTGXZNUH27GTEAI.jpg
43,https://www.infobae.com/america/mundo/2021/12/05/el-papa-francisco-llego-al-campamento-de-lesbos-y-denuncio-el-naufragio-de-la-civilizacion-por-el-abandono-de-los-migrantes/,El papa Francisco llegó al campamento de Lesbos y denunció el “naufragio de la civilización” por el abandono de los migrantes,https://www.infobae.com/america/mundo/2021/12/05/el-papa-francisco-llego-al-campamento-de-lesbos-y-denuncio-el-naufragio-de-la-civilizacion-por-el-abandono-de-los-migrantes/,https://cloudfront-us-east-1.images.arcpublishing.com/infobae/F4C2MPY3S73NFNISAYN36Q7DWU.jpg
44,https://www.infobae.com/sociedad/2021/12/05/noah-mamet-presento-su-linea-de-vinos-gran-diplomat-invierto-en-la-argentina-porque-creo-en-el-futuro-del-pais/,"Noah Mamet presentó su línea de vinos, Gran Diplomat: “Invierto en la Argentina porque creo en el futuro del país”",https://www.infobae.com/sociedad/2021/12/05/noah-mamet-presento-su-linea-de-vinos-gran-diplomat-invierto-en-la-argentina-porque-creo-en-el-futuro-del-pais/,https://cloudfront-us-east-1.images.arcpublishing.com/infobae/JKJQKNWVTJHJJE3PL34L7TXWIY.jpg
45,https://www.infobae.com/fotos/2021/12/05/49-fotos-de-la-noche-de-los-templos-que-invito-a-conocer-la-riqueza-religiosa-y-arquitectonica-de-distintos-credos/,"54 fotos de la Noche de los Templos, que invitó a conocer la riqueza religiosa y arquitectónica de distintos credos",https://www.infobae.com/fotos/2021/12/05/49-fotos-de-la-noche-de-los-templos-que-invito-a-conocer-la-riqueza-religiosa-y-arquitectonica-de-distintos-credos/,https://cloudfront-us-east-1.images.arcpublishing.com/infobae/OG3DBUVF4BGMNI7FRKOA5QLDRA.JPG
46,https://www.infobae.com/historias/2021/12/05/nelson-mandela-la-lucha-por-la-libertad-y-el-poema-invictus-que-lo-salvo-durante-los-terribles-anos-de-prision/,Nelson Mandela: la lucha por la libertad y el poema Invictus que lo salvó durante los terribles años de prisión,https://www.infobae.com/historias/2021/12/05/nelson-mandela-la-lucha-por-la-libertad-y-el-poema-invictus-que-lo-salvo-durante-los-terribles-anos-de-prision/,https://cloudfront-us-east-1.images.arcpublishing.com/infobae/35QCJBAGGBFZLGENSQUKVPWQEQ.jpg
47,https://www.infobae.com/economia/2021/12/05/la-negociacion-con-el-fmi-en-zona-critica-las-claves-del-acuerdo-que-busca-el-gobierno/,"La negociación con el FMI, en zona crítica: las claves del acuerdo que busca el Gobierno",https://www.infobae.com/economia/2021/12/05/la-negociacion-con-el-fmi-en-zona-critica-las-claves-del-acuerdo-que-busca-el-gobierno/,https://cloudfront-us-east-1.images.arcpublishing.com/infobae/33SSYSPNBZF5RL4MNL3ZYWG6P4
48,https://www.infobae.com/economia/2021/12/05/desconfianza-advierten-que-el-pais-no-podra-endeudarse-a-tasas-bajas-sin-un-plan-economico-creible/,Desconfianza: advierten que el país no podrá endeudarse a tasas bajas sin un plan económico creíble,https://www.infobae.com/economia/2021/12/05/desconfianza-advierten-que-el-pais-no-podra-endeudarse-a-tasas-bajas-sin-un-plan-economico-creible/,https://cloudfront-us-east-1.images.arcpublishing.com/infobae/JR6RQH6VVNH2VCYQ3QD73J4SRI.jpg
49,https://www.infobae.com/economia/2021/12/05/subibaja-cripto-que-monedas-digitales-prefieren-los-argentinos-y-cual-es-el-mapa-de-las-plataformas-locales/,Subibaja cripto: qué monedas digitales prefieren los argentinos y cuál es el mapa de las plataformas locales,https://www.infobae.com/economia/2021/12/05/subibaja-cripto-que-monedas-digitales-prefieren-los-argentinos-y-cual-es-el-mapa-de-las-plataformas-locales/,https://cloudfront-us-east-1.images.arcpublishing.com/infobae/RMZHSF4QT4U6GCWJTZ3ZLUFBBY.jpg
50,https://www.infobae.com/sociedad/2021/12/05/ahora-se-pudre-todo-cuando-rucci-preanuncio-la-tragedia-del-peronismo-por-la-candidatura-de-campora-a-presidente/,“Ahora se pudre todo”: cuando Rucci preanunció la tragedia del peronismo por la candidatura de Cámpora a presidente,https://www.infobae.com/sociedad/2021/12/05/ahora-se-pudre-todo-cuando-rucci-preanuncio-la-tragedia-del-peronismo-por-la-candidatura-de-campora-a-presidente/,https://cloudfront-us-east-1.images.arcpublishing.com/infobae/V7YWMC22GFBZ3CTHLWPLCMEOZA.jpg
51,https://www.infobae.com/politica/2021/12/05/alfredo-cornejo-volvio-a-hablar-sobre-la-posible-separacion-de-mendoza-no-es-posible-con-esta-constitucion/,Alfredo Cornejo volvió a hablar sobre la posible separación de Mendoza: “No es posible con esta Constitución”,https://www.infobae.com/politica/2021/12/05/alfredo-cornejo-volvio-a-hablar-sobre-la-posible-separacion-de-mendoza-no-es-posible-con-esta-constitucion/,https://cloudfront-us-east-1.images.arcpublishing.com/infobae/PNF75SZBCJCAHK3H5D462ODJHQ.jfif
52,https://www.infobae.com/teleshow/2021/12/05/fabian-vena-revelo-como-le-conto-a-victor-hugo-morales-que-estaba-de-novio-con-su-hija-paula/,Fabián Vena reveló cómo le contó a Víctor Hugo Morales que estaba de novio con su hija Paula,https://www.infobae.com/teleshow/2021/12/05/fabian-vena-revelo-como-le-conto-a-victor-hugo-morales-que-estaba-de-novio-con-su-hija-paula/,https://cloudfront-us-east-1.images.arcpublishing.com/infobae/PRLCWTLZ6ZEIZBHYBCNW6ZV2GM.jpg
