n,id,title,url,image
1,https://www.infobae.com/economia/2023/01/18/los-detalles-y-objetivos-secretos-del-inesperado-anuncio-de-massa-para-recomprar-deuda-como-lo-penso-y-que-busca-lograr/,Los detalles y objetivos secretos del inesperado anuncio de Massa para recomprar deuda: cómo lo pensó y qué busca lograr,https://www.infobae.com/economia/2023/01/18/los-detalles-y-objetivos-secretos-del-inesperado-anuncio-de-massa-para-recomprar-deuda-como-lo-penso-y-que-busca-lograr/,https://cloudfront-us-east-1.images.arcpublishing.com/infobae/JUPM3HWVDVHPZI2KDL2RLFDJTE.jpg
2,https://www.infobae.com/sociedad/policiales/2023/01/18/el-juicio-a-los-rugbiers-minuto-a-minuto-comienza-la-ultima-jornada-de-testigos/,"El juicio a los rugbiers, minuto a minuto: habla Blas Cinalli, el acusado que se jactó por chat del crimen de Báez Sosa",https://www.infobae.com/sociedad/policiales/2023/01/18/el-juicio-a-los-rugbiers-minuto-a-minuto-comienza-la-ultima-jornada-de-testigos/,https://cloudfront-us-east-1.images.arcpublishing.com/infobae/KFQYVIFF6NEODGKWFL2DA7V7MI.jpeg
3,https://www.infobae.com/politica/2023/01/18/horacio-rodriguez-larreta-volvio-a-hablar-del-temblor-esencial-tomo-agua-con-las-dos-manos-pierdo-al-yenga-y-las-selfies-me-salen-movidas/,"Horacio Rodríguez Larreta volvió a hablar del temblor esencial, la afección que tolera: “Pierdo al yenga y las selfies me salen movidas”",https://www.infobae.com/politica/2023/01/18/horacio-rodriguez-larreta-volvio-a-hablar-del-temblor-esencial-tomo-agua-con-las-dos-manos-pierdo-al-yenga-y-las-selfies-me-salen-movidas/,https://cloudfront-us-east-1.images.arcpublishing.com/infobae/OLTZAVFWCVEQXNHZUJGGM4V22A.jpg
4,https://www.infobae.com/economia/2023/01/18/dolar-hoy-en-vivo-a-cuanto-abre-este-miercoles-18-de-enero-y-cual-es-el-precio-minuto-a-minuto/,Dólar hoy en vivo: la cotización libre baja a $376 y cae $14 el contado con liquidación”,https://www.infobae.com/economia/2023/01/18/dolar-hoy-en-vivo-a-cuanto-abre-este-miercoles-18-de-enero-y-cual-es-el-precio-minuto-a-minuto/,https://cloudfront-us-east-1.images.arcpublishing.com/infobae/U45CCWWY5ZC4DBF42FVQCMQRHQ.jpeg
5,https://www.infobae.com/economia/2023/01/18/tras-la-recompra-de-bonos-en-dolares-del-gobierno-el-bcra-sube-las-tasas-a-corto-plazo-para-contener-al-dolar-bolsa/,"Tras la recompra de bonos en dólares del Gobierno, el BCRA subió las tasas de corto plazo para contener al dólar MEP y al CCL",https://www.infobae.com/economia/2023/01/18/tras-la-recompra-de-bonos-en-dolares-del-gobierno-el-bcra-sube-las-tasas-a-corto-plazo-para-contener-al-dolar-bolsa/,https://cloudfront-us-east-1.images.arcpublishing.com/infobae/VT6HSFRC3SPPNVVNPGSZXKV56M.jpg
6,https://www.infobae.com/economia/2023/01/18/como-afectara-la-recompra-de-deuda-anunciada-por-sergio-massa-en-el-precio-del-dolar-y-los-bonos/,Cómo afectará la recompra de deuda anunciada por Sergio Massa en el precio del dólar y los bonos,https://www.infobae.com/economia/2023/01/18/como-afectara-la-recompra-de-deuda-anunciada-por-sergio-massa-en-el-precio-del-dolar-y-los-bonos/,https://cloudfront-us-east-1.images.arcpublishing.com/infobae/JUPM3HWVDVHPZI2KDL2RLFDJTE.jpg
7,https://www.infobae.com/deportes/2023/01/18/emotiva-carta-de-lionel-messi-a-un-mes-de-ser-campeon-del-mundo-con-argentina-nunca-imagine-la-locura-de-la-gente-en-los-festejos/,Emotiva carta de Lionel Messi a un mes de ser campeón del mundo con Argentina: “Nunca imaginé la locura de la gente en los festejos”,https://www.infobae.com/deportes/2023/01/18/emotiva-carta-de-lionel-messi-a-un-mes-de-ser-campeon-del-mundo-con-argentina-nunca-imagine-la-locura-de-la-gente-en-los-festejos/,https://cloudfront-us-east-1.images.arcpublishing.com/infobae/UVB3ZDZ22RDYTMXY2GATV3ZXOI.jpg
8,https://www.infobae.com/deportes/2023/01/18/una-increible-premonicion-la-intimidad-del-festejo-y-las-promesas-de-los-futbolistas-todo-lo-que-no-se-vio-de-la-final-entre-argentina-y-francia/,"Una increíble premonición, la intimidad del festejo y las promesas de los futbolistas: todo lo que no se vio de la final entre Argentina y Francia",https://www.infobae.com/deportes/2023/01/18/una-increible-premonicion-la-intimidad-del-festejo-y-las-promesas-de-los-futbolistas-todo-lo-que-no-se-vio-de-la-final-entre-argentina-y-francia/,https://cloudfront-us-east-1.images.arcpublishing.com/infobae/URKMDPFBTJFS7DYVX2JRAVYJEY.jpg
9,https://www.infobae.com/sociedad/policiales/2023/01/18/pensar-lo-que-sufrio-nuestro-nietito-es-horrendo-la-lucha-de-los-abuelos-de-lucio-dupuy-a-pocos-dias-del-veredicto/,“Pensar lo que sufrió nuestro nietito es horrendo”: la lucha de los abuelos de Lucio Dupuy a pocos días del veredicto,https://www.infobae.com/sociedad/policiales/2023/01/18/pensar-lo-que-sufrio-nuestro-nietito-es-horrendo-la-lucha-de-los-abuelos-de-lucio-dupuy-a-pocos-dias-del-veredicto/,https://cloudfront-us-east-1.images.arcpublishing.com/infobae/O2IHD6OJMRCUFE4YO3AJEN72ZM.png
10,https://www.infobae.com/economia/campo/2023/01/18/el-impactante-mapa-que-muestra-como-avanzan-los-estragos-de-la-sequia-ya-son-175-millones-de-hectareas-las-afectadas/,El impactante mapa que muestra como avanzan los estragos de la sequía: ya son 175 millones de hectáreas las afectadas,https://www.infobae.com/economia/campo/2023/01/18/el-impactante-mapa-que-muestra-como-avanzan-los-estragos-de-la-sequia-ya-son-175-millones-de-hectareas-las-afectadas/,https://cloudfront-us-east-1.images.arcpublishing.com/infobae/OPCI3HB5AFAHTNIMPJ2XB5NT6M.jpg
11,https://www.infobae.com/sociedad/2023/01/18/fue-victima-de-pornoextorsion-y-tras-superar-una-etapa-oscura-hizo-de-sus-videos-intimos-un-negocio-millonario/,Fue víctima de pornoextorsión y tras superar una etapa oscura hizo de sus videos íntimos un negocio millonario,https://www.infobae.com/sociedad/2023/01/18/fue-victima-de-pornoextorsion-y-tras-superar-una-etapa-oscura-hizo-de-sus-videos-intimos-un-negocio-millonario/,https://cloudfront-us-east-1.images.arcpublishing.com/infobae/ISNARTXI5BH2XOHUXN3HTTI45M.jpg
12,https://www.infobae.com/teleshow/2023/01/18/las-fotos-retro-de-marcos-de-gran-hermano-que-causaron-furor-en-las-redes/,Las fotos retro de Marcos de Gran Hermano que causaron furor en las redes,https://www.infobae.com/teleshow/2023/01/18/las-fotos-retro-de-marcos-de-gran-hermano-que-causaron-furor-en-las-redes/,https://cloudfront-us-east-1.images.arcpublishing.com/infobae/WODX3S3LPNC2RI7UFP6D5WMVKY.png
13,https://www.infobae.com/leamos/2023/01/18/a-ocho-anos-de-la-muerte-de-nisman-tres-claves-para-leer-la-novela-que-imagina-quien-y-como-lo-mato/,"A ocho años de la muerte de Nisman, tres claves para leer la novela que imagina quién y cómo lo mató",https://www.infobae.com/leamos/2023/01/18/a-ocho-anos-de-la-muerte-de-nisman-tres-claves-para-leer-la-novela-que-imagina-quien-y-como-lo-mato/,https://cloudfront-us-east-1.images.arcpublishing.com/infobae/BQ5VOHY7EFASPGZMCGIQT5O7LI.jpg
14,https://www.infobae.com/politica/2023/01/18/la-oposicion-recordo-al-fiscal-nisman-a-ocho-anos-de-su-muerte-y-pidio-que-se-esclarezca-el-caso/,La oposición recordó al fiscal Nisman a ocho años de su muerte y pidió que se esclarezca el caso,https://www.infobae.com/politica/2023/01/18/la-oposicion-recordo-al-fiscal-nisman-a-ocho-anos-de-su-muerte-y-pidio-que-se-esclarezca-el-caso/,https://cloudfront-us-east-1.images.arcpublishing.com/infobae/JFG3AFXUOJBXXGQIVERW3NKAPA.jpg
15,https://www.infobae.com/politica/2023/01/18/el-titular-de-la-daia-insistio-en-que-alberto-nisman-fue-asesinado-y-aseguro-que-en-la-causa-hay-impunidad/,El titular de la DAIA insistió en que Alberto Nisman fue asesinado y aseguró que en la causa “hay impunidad”,https://www.infobae.com/politica/2023/01/18/el-titular-de-la-daia-insistio-en-que-alberto-nisman-fue-asesinado-y-aseguro-que-en-la-causa-hay-impunidad/,https://cloudfront-us-east-1.images.arcpublishing.com/infobae/EUA43J54A5A3BOBG5S34IFBGZY.jpg
16,https://www.infobae.com/politica/2023/01/18/avanza-la-construccion-de-un-puerto-del-regimen-chino-en-tierra-del-fuego-el-objetivo-detras-del-desembarco/,Avanza la construcción de un puerto del régimen chino en Tierra del Fuego: el objetivo detrás del desembarco,https://www.infobae.com/politica/2023/01/18/avanza-la-construccion-de-un-puerto-del-regimen-chino-en-tierra-del-fuego-el-objetivo-detras-del-desembarco/,https://cloudfront-us-east-1.images.arcpublishing.com/infobae/4YOSAJLNTVC6TG5LSLEPHSOHSU.jpg
17,https://www.infobae.com/politica/2023/01/18/patricia-bullrich-se-reunira-con-mauricio-macri-en-el-sur-y-tendra-su-foto-con-radicales/,Patricia Bullrich se reunirá con Mauricio Macri en el sur y tendrá su foto con radicales,https://www.infobae.com/politica/2023/01/18/patricia-bullrich-se-reunira-con-mauricio-macri-en-el-sur-y-tendra-su-foto-con-radicales/,https://cloudfront-us-east-1.images.arcpublishing.com/infobae/BOCNT775I5DKTOZPIPBZXFSQFE.jpg
18,https://www.infobae.com/sociedad/2023/01/18/sobrevivio-a-una-tragedia-aerea-y-fue-anos-despues-el-director-de-esa-misma-aerolinea-la-noche-en-que-mar-del-plata-no-durmio/,"Sobrevivió a una tragedia aérea y fue, años después, el director de esa misma aerolínea: “la noche en que Mar del Plata no durmió”",https://www.infobae.com/sociedad/2023/01/18/sobrevivio-a-una-tragedia-aerea-y-fue-anos-despues-el-director-de-esa-misma-aerolinea-la-noche-en-que-mar-del-plata-no-durmio/,https://cloudfront-us-east-1.images.arcpublishing.com/infobae/2V6CIZASUZBIPEGM2RBZGYXN4I.jpg
19,https://www.infobae.com/teleshow/2023/01/18/tras-ganar-10-millones-de-pesos-alexis-quedo-afuera-de-los-8-escalones-la-pregunta-que-lo-elimino/,"Tras ganar 10 millones de pesos, Alexis quedó afuera de Los 8 escalones: la pregunta que lo eliminó",https://www.infobae.com/teleshow/2023/01/18/tras-ganar-10-millones-de-pesos-alexis-quedo-afuera-de-los-8-escalones-la-pregunta-que-lo-elimino/,https://cloudfront-us-east-1.images.arcpublishing.com/infobae/UXJNFV5VGRGTHMKXFOJRANFPYA.jpg
20,https://www.infobae.com/sociedad/2023/01/18/villa-gesell-a-pleno-recibio-mas-de-380-mil-turistas-y-supero-el-95-de-ocupacion/,"Villa Gesell, a pleno: recibió más de 380 mil turistas y superó el 95% de ocupación",https://www.infobae.com/sociedad/2023/01/18/villa-gesell-a-pleno-recibio-mas-de-380-mil-turistas-y-supero-el-95-de-ocupacion/,https://cloudfront-us-east-1.images.arcpublishing.com/infobae/JX7I77MSIJCGBP6XCEBHUFDNOE.jpg
21,https://www.infobae.com/sociedad/2023/01/18/es-argentino-y-se-mudo-con-su-familia-a-punta-del-este-la-vida-es-muy-tranquila-y-se-puede-caminar-a-cualquier-hora-sin-problema/,Es argentino y se mudó con su familia a Punta del Este: “La vida es muy tranquila y se puede caminar a cualquier hora sin problema”,https://www.infobae.com/sociedad/2023/01/18/es-argentino-y-se-mudo-con-su-familia-a-punta-del-este-la-vida-es-muy-tranquila-y-se-puede-caminar-a-cualquier-hora-sin-problema/,https://cloudfront-us-east-1.images.arcpublishing.com/infobae/A377J3ELR5EL7DEPLAFLHACUJI.jpg
22,https://www.infobae.com/sociedad/2023/01/18/pinamar-volvieron-las-tapiocas-y-solo-unos-valientes-se-metieron-al-mar/,Pinamar: volvieron las tapiocas y solo unos “valientes” se metieron al mar,https://www.infobae.com/sociedad/2023/01/18/pinamar-volvieron-las-tapiocas-y-solo-unos-valientes-se-metieron-al-mar/,https://cloudfront-us-east-1.images.arcpublishing.com/infobae/BTSILI4BHVB2TOU2FGP4WS76TI.jpg
23,https://www.infobae.com/tendencias/2023/01/18/camperas-biker-pantalones-cargo-y-otras-prendas-infalibles-del-verano-2023/,"Camperas biker, pantalones cargo y otras prendas infalibles del verano 2023",https://www.infobae.com/tendencias/2023/01/18/camperas-biker-pantalones-cargo-y-otras-prendas-infalibles-del-verano-2023/,https://cloudfront-us-east-1.images.arcpublishing.com/infobae/MSWYOLEBTVFLDJDCWJSYEY75GA.jpg
24,https://www.infobae.com/sociedad/2023/01/18/guardavidas-santafesino-fue-atacado-en-una-playa-de-brasil-por-ser-argentino-le-rompieron-una-costilla/,Guardavidas santafesino fue atacado en una playa de Brasil por ser argentino: le rompieron una costilla,https://www.infobae.com/sociedad/2023/01/18/guardavidas-santafesino-fue-atacado-en-una-playa-de-brasil-por-ser-argentino-le-rompieron-una-costilla/,https://cloudfront-us-east-1.images.arcpublishing.com/infobae/DW4GJJKIAFCN3JRKRRKZNA6ZFA.jpg
25,https://www.infobae.com/deportes/2023/01/18/julian-alvarez-develo-el-emotivo-mensaje-que-le-mando-marcelo-gallardo-durante-el-mundial-de-qatar/,Julián Álvarez develó el emotivo mensaje que le mandó Marcelo Gallardo durante el Mundial de Qatar,https://www.infobae.com/deportes/2023/01/18/julian-alvarez-develo-el-emotivo-mensaje-que-le-mando-marcelo-gallardo-durante-el-mundial-de-qatar/,https://cloudfront-us-east-1.images.arcpublishing.com/infobae/BDQCONB7PFCKFKB66EIWHJR4RU.jpg
26,https://www.infobae.com/politica/2023/01/18/estados-unidos-cuestiono-la-embestida-del-gobierno-a-la-corte-suprema-y-pidio-respetar-la-democracia-y-la-separacion-de-poderes/,Estados Unidos cuestionó la embestida del Gobierno a la Corte Suprema y pidió “respetar la democracia y la separación de poderes”,https://www.infobae.com/politica/2023/01/18/estados-unidos-cuestiono-la-embestida-del-gobierno-a-la-corte-suprema-y-pidio-respetar-la-democracia-y-la-separacion-de-poderes/,https://cloudfront-us-east-1.images.arcpublishing.com/infobae/2NTFMHKWKZFZLP25FS7R6S5GXE.jpg
27,https://www.infobae.com/educacion/2023/01/18/que-hizo-una-escuela-publica-chilena-para-convertirse-en-la-mas-innovadora-del-mundo/,Qué hizo una escuela pública chilena para convertirse en la más innovadora del mundo,https://www.infobae.com/educacion/2023/01/18/que-hizo-una-escuela-publica-chilena-para-convertirse-en-la-mas-innovadora-del-mundo/,https://cloudfront-us-east-1.images.arcpublishing.com/infobae/C7UGSIUG7ZELZHG3ECZXJQLPG4.jpg
28,https://www.infobae.com/deportes/2023/01/18/17-frases-de-la-filosofia-aimar-el-lider-silencioso-del-campeon-del-mundo-futbol-salvaje-redes-sociales-y-la-censura-a-los-creativos/,"17 frases de la filosofía Aimar, el líder silencioso del campeón del mundo: fútbol salvaje, redes sociales y la censura a los creativos",https://www.infobae.com/deportes/2023/01/18/17-frases-de-la-filosofia-aimar-el-lider-silencioso-del-campeon-del-mundo-futbol-salvaje-redes-sociales-y-la-censura-a-los-creativos/,https://cloudfront-us-east-1.images.arcpublishing.com/infobae/RD3MKKCHQND7NI367XZ7UP6BAI.jpg
29,https://www.infobae.com/teleshow/2023/01/18/flor-de-la-v-y-claudia-fernandez-disfrutaron-de-la-playa-en-punta-del-este-con-sus-familias/,Flor de la V y Claudia Fernández disfrutaron de la playa en Punta del Este con sus familias,https://www.infobae.com/teleshow/2023/01/18/flor-de-la-v-y-claudia-fernandez-disfrutaron-de-la-playa-en-punta-del-este-con-sus-familias/,https://cloudfront-us-east-1.images.arcpublishing.com/infobae/F7JWBY2IK5DXJAS5RZD4A7F2ZY.jpg
30,https://www.infobae.com/sociedad/policiales/2023/01/18/el-dueno-de-una-parrilla-en-rosario-denuncio-que-sicarios-le-exigen-una-abultada-coima-para-no-tirotearle-el-local/,El dueño de una parrilla en Rosario denunció que sicarios le exigen una abultada coima para no tirotearle el local,https://www.infobae.com/sociedad/policiales/2023/01/18/el-dueno-de-una-parrilla-en-rosario-denuncio-que-sicarios-le-exigen-una-abultada-coima-para-no-tirotearle-el-local/,https://cloudfront-us-east-1.images.arcpublishing.com/infobae/DX3F3JDAJFEZ7FTWZSADPES6SY.jpg
31,https://www.infobae.com/sociedad/2023/01/18/hoy-abriste-los-ojos-evoluciona-una-de-las-argentinas-que-sobrevivio-al-choque-fatal-en-punta-del-este/,“Hoy abriste los ojos”: evoluciona una de las argentinas que sobrevivió al choque fatal en Punta del Este,https://www.infobae.com/sociedad/2023/01/18/hoy-abriste-los-ojos-evoluciona-una-de-las-argentinas-que-sobrevivio-al-choque-fatal-en-punta-del-este/,https://cloudfront-us-east-1.images.arcpublishing.com/infobae/LI675SVCBZF6XINUYDJKP6DTRU.jpg
32,https://www.infobae.com/sociedad/2023/01/18/de-la-cara-de-guerra-y-los-tanques-a-la-rendicion-los-secretos-de-la-ultima-aventura-de-rico-como-carapintada/,De “la cara de guerra” y los tanques a la rendición: los secretos de la última aventura de Rico como carapintada,https://www.infobae.com/sociedad/2023/01/18/de-la-cara-de-guerra-y-los-tanques-a-la-rendicion-los-secretos-de-la-ultima-aventura-de-rico-como-carapintada/,https://cloudfront-us-east-1.images.arcpublishing.com/infobae/Z4RQWFN46NDCDPJTBU3YDOMP3A.jpg
33,https://www.infobae.com/america/america-latina/2023/01/18/indice-de-china-cual-es-el-pais-de-america-latina-con-mayor-penetracion-del-regimen-de-xi-jinping-y-como-lo-hace/,Índice de China: cuál es el país de América Latina con mayor penetración del régimen de Xi Jinping y cómo lo hace,https://www.infobae.com/america/america-latina/2023/01/18/indice-de-china-cual-es-el-pais-de-america-latina-con-mayor-penetracion-del-regimen-de-xi-jinping-y-como-lo-hace/,https://cloudfront-us-east-1.images.arcpublishing.com/infobae/AKIN4LWARFHHFF547ULA2HZGRQ.jpg
34,https://www.infobae.com/america/mundo/2023/01/18/un-helicoptero-se-estrello-cerca-de-un-jardin-de-ninos-en-ucrania-hay-al-menos-16-muertos-entre-ellos-el-ministro-de-interior/,"Un helicóptero se estrelló cerca de un jardín de niños en Ucrania: hay al menos 14 muertos, entre ellos el ministro de Interior",https://www.infobae.com/america/mundo/2023/01/18/un-helicoptero-se-estrello-cerca-de-un-jardin-de-ninos-en-ucrania-hay-al-menos-16-muertos-entre-ellos-el-ministro-de-interior/,https://cloudfront-us-east-1.images.arcpublishing.com/infobae/FSZ2TNKMBLGMZJJJDHDMXDOTUE.jpg
35,https://www.infobae.com/teleshow/2023/01/18/amalia-granata-se-mostro-en-malla-en-punta-del-este-y-recibio-repudiables-criticas-sobre-su-cuerpo-su-respuesta/,Amalia Granata se mostró en malla en Punta del Este y recibió repudiables críticas sobre su cuerpo: su respuesta,https://www.infobae.com/teleshow/2023/01/18/amalia-granata-se-mostro-en-malla-en-punta-del-este-y-recibio-repudiables-criticas-sobre-su-cuerpo-su-respuesta/,https://cloudfront-us-east-1.images.arcpublishing.com/infobae/HFERS2476FDMZAQCDSAIAC6OIE.png
36,https://www.infobae.com/teleshow/2023/01/18/arnaldo-andre-prefiero-no-estar-trabajando-a-hacer-cualquier-cosa/,Arnaldo André: “Prefiero no estar trabajando a hacer cualquier cosa”,https://www.infobae.com/teleshow/2023/01/18/arnaldo-andre-prefiero-no-estar-trabajando-a-hacer-cualquier-cosa/,https://cloudfront-us-east-1.images.arcpublishing.com/infobae/IJYG3PIXPZDLXEJLYSWGWZ6Y7U.jpg
37,https://www.infobae.com/politica/2023/01/18/no-puedo-ser-hipocrita-las-razones-del-gobernador-de-mendoza-para-no-recibir-este-miercoles-a-alberto-fernandez/,“No puedo ser hipócrita”: las razones del gobernador de Mendoza para no recibir este miércoles a Alberto Fernández,https://www.infobae.com/politica/2023/01/18/no-puedo-ser-hipocrita-las-razones-del-gobernador-de-mendoza-para-no-recibir-este-miercoles-a-alberto-fernandez/,https://cloudfront-us-east-1.images.arcpublishing.com/infobae/2ORH7EGT3JHOXL2IC47S7FRMDQ.jpg
38,https://www.infobae.com/historias/2023/01/18/el-misterioso-caso-de-la-beba-de-10-meses-que-desaparecio-una-noche-mientras-dormia-en-su-casa/,El misterioso caso de la beba de 10 meses que desapareció una noche mientras dormía en su casa,https://www.infobae.com/historias/2023/01/18/el-misterioso-caso-de-la-beba-de-10-meses-que-desaparecio-una-noche-mientras-dormia-en-su-casa/,https://cloudfront-us-east-1.images.arcpublishing.com/infobae/GFMTYCKXFRECFA6Z4LFSFCP3QA.jpg
39,https://www.infobae.com/autos/2023/01/18/cinco-consejos-para-cargar-adecuadamente-el-equipaje-en-el-auto-rumbo-a-las-vacaciones/,Cinco consejos para cargar adecuadamente el equipaje en el auto rumbo a las vacaciones,https://www.infobae.com/autos/2023/01/18/cinco-consejos-para-cargar-adecuadamente-el-equipaje-en-el-auto-rumbo-a-las-vacaciones/,https://cloudfront-us-east-1.images.arcpublishing.com/infobae/ANBEJ22DLBCLTKZPTZOH3VV3OI.jpg
40,https://www.infobae.com/salud/2022/06/13/cinco-razones-para-sospechar-que-se-padece-cancer-de-prostata/,Cáncer de próstata: los cinco indicios de la enfermedad,https://www.infobae.com/salud/2022/06/13/cinco-razones-para-sospechar-que-se-padece-cancer-de-prostata/,https://cloudfront-us-east-1.images.arcpublishing.com/infobae/475KHGGSWREVNNRH2VOAIYFLLQ.jpg
41,https://www.infobae.com/america/mundo/2023/01/18/covid-en-china-preven-36000-muertes-diarias-durante-el-ano-nuevo-lunar/,COVID en China: prevén 36.000 muertes diarias durante el Año Nuevo Lunar,https://www.infobae.com/america/mundo/2023/01/18/covid-en-china-preven-36000-muertes-diarias-durante-el-ano-nuevo-lunar/,https://cloudfront-us-east-1.images.arcpublishing.com/infobae/F2PWKNJFKODP2GFVEILFYHW4SA.jpg
42,https://www.infobae.com/sociedad/policiales/2023/01/18/robaron-un-avion-en-chaco-y-se-estrellaron-en-un-descampado-murieron-cinco-personas/,Robaron un avión en Chaco y se estrellaron en un descampado: murieron cinco personas,https://www.infobae.com/sociedad/policiales/2023/01/18/robaron-un-avion-en-chaco-y-se-estrellaron-en-un-descampado-murieron-cinco-personas/,https://cloudfront-us-east-1.images.arcpublishing.com/infobae/NYMYRQMS3NCWFAFURBDYICLG2Y.webp
43,https://www.infobae.com/politica/2023/01/18/axel-kicillof-desembarca-con-una-recorrida-en-clave-electoral-en-el-municipio-predilecto-de-la-dirigencia-pro/,Axel Kicillof desembarca con una recorrida en clave electoral en el municipio predilecto de la dirigencia PRO,https://www.infobae.com/politica/2023/01/18/axel-kicillof-desembarca-con-una-recorrida-en-clave-electoral-en-el-municipio-predilecto-de-la-dirigencia-pro/,https://cloudfront-us-east-1.images.arcpublishing.com/infobae/TCMKHAUBTVDNNMFMNVNGTCRVWQ.jpg
44,https://www.infobae.com/america/eeuu/2023/01/18/pronostican-que-miami-sera-uno-de-los-mercados-inmobiliarios-mas-buscados-en-los-estados-unidos-en-2023/,Pronostican que Miami será uno de los mercados inmobiliarios más buscados en los Estados Unidos en 2023,https://www.infobae.com/america/eeuu/2023/01/18/pronostican-que-miami-sera-uno-de-los-mercados-inmobiliarios-mas-buscados-en-los-estados-unidos-en-2023/,https://arc-anglerfish-arc2-prod-infobae.s3.amazonaws.com/public/JO656OIAFRHKFNVSD4PTRKPWUM
45,https://www.infobae.com/sociedad/policiales/2023/01/18/el-juicio-a-los-rugbiers-minuto-a-minuto-comienza-la-ultima-jornada-de-testigos/,"El juicio a los rugbiers, minuto a minuto: habla Blas Cinalli, el acusado que se jactó por chat del crimen de Báez Sosa",https://www.infobae.com/sociedad/policiales/2023/01/18/el-juicio-a-los-rugbiers-minuto-a-minuto-comienza-la-ultima-jornada-de-testigos/,https://cloudfront-us-east-1.images.arcpublishing.com/infobae/KFQYVIFF6NEODGKWFL2DA7V7MI.jpeg
46,https://www.infobae.com/deportes/2023/01/18/emotiva-carta-de-lionel-messi-a-un-mes-de-ser-campeon-del-mundo-con-argentina-nunca-imagine-la-locura-de-la-gente-en-los-festejos/,Emotiva carta de Lionel Messi a un mes de ser campeón del mundo con Argentina: “Nunca imaginé la locura de la gente en los festejos”,https://www.infobae.com/deportes/2023/01/18/emotiva-carta-de-lionel-messi-a-un-mes-de-ser-campeon-del-mundo-con-argentina-nunca-imagine-la-locura-de-la-gente-en-los-festejos/,https://cloudfront-us-east-1.images.arcpublishing.com/infobae/UVB3ZDZ22RDYTMXY2GATV3ZXOI.jpg
47,https://www.infobae.com/economia/2023/01/18/recompra-de-bonos-se-desploma-el-riesgo-pais-y-vuelve-a-los-1800-puntos-basicos/,Recompra de bonos: se desploma el riesgo país y vuelve a los 1.700 puntos básicos,https://www.infobae.com/economia/2023/01/18/recompra-de-bonos-se-desploma-el-riesgo-pais-y-vuelve-a-los-1800-puntos-basicos/,https://cloudfront-us-east-1.images.arcpublishing.com/infobae/5IYDRBEHBZKVFJ77AVFAE2T4T4.jpg
48,https://www.infobae.com/economia/2023/01/18/mercados-la-bolsa-retrocede-en-pesos-pero-gana-terreno-en-moneda-dura-en-medio-de-la-caida-de-los-dolares-bursatiles/,Mercados: la Bolsa retrocede en pesos pero gana terreno en moneda dura en medio de la caída de los dólares bursátiles,https://www.infobae.com/economia/2023/01/18/mercados-la-bolsa-retrocede-en-pesos-pero-gana-terreno-en-moneda-dura-en-medio-de-la-caida-de-los-dolares-bursatiles/,https://cloudfront-us-east-1.images.arcpublishing.com/infobae/OZRBOUFO7UIYPZ2YJNDVMACODQ.jpg
49,https://www.infobae.com/america/mundo/2023/01/18/qatargate-el-parlamento-europeo-destituyo-a-la-vicepresidenta-acusada-de-corrupcion-y-lavado-de-dinero/,Qatargate: el Parlamento Europeo destituyó a la vicepresidenta acusada de corrupción y lavado de dinero,https://www.infobae.com/america/mundo/2023/01/18/qatargate-el-parlamento-europeo-destituyo-a-la-vicepresidenta-acusada-de-corrupcion-y-lavado-de-dinero/,https://cloudfront-us-east-1.images.arcpublishing.com/infobae/BNZHR5AKKBDTHBDAMFL7TA5ACQ.jpg
50,https://www.infobae.com/america/entretenimiento/2023/01/18/era-para-mi-jennifer-lopez-revelo-por-que-no-consiguio-el-iconico-beso-con-britney-spears/,“Era para mí”: Jennifer Lopez reveló por qué no consiguió el icónico beso con Britney Spears ,https://www.infobae.com/america/entretenimiento/2023/01/18/era-para-mi-jennifer-lopez-revelo-por-que-no-consiguio-el-iconico-beso-con-britney-spears/,https://cloudfront-us-east-1.images.arcpublishing.com/infobae/ULBYZDLF33GKSELI57DQ5VQCOI.jpg
51,https://www.infobae.com/deportes/2023/01/18/el-cambio-estetico-de-ultimo-momento-en-el-monumental-y-como-avanzan-las-obras-en-river-plate/,El cambio estético de último momento en el Monumental y cómo avanzan las obras en River Plate,https://www.infobae.com/deportes/2023/01/18/el-cambio-estetico-de-ultimo-momento-en-el-monumental-y-como-avanzan-las-obras-en-river-plate/,https://cloudfront-us-east-1.images.arcpublishing.com/infobae/GN332PDVC5BDTG6DAZEUQCTLZE.jfif
