n,id,title,url,image
1,https://www.infobae.com/economia/2021/12/01/negociacion-con-el-fmi-una-delegacion-argentina-partira-el-sabado-hacia-washington/,Negociación con el FMI: una delegación argentina partirá el sábado hacia Washington,https://www.infobae.com/economia/2021/12/01/negociacion-con-el-fmi-una-delegacion-argentina-partira-el-sabado-hacia-washington/,https://cloudfront-us-east-1.images.arcpublishing.com/infobae/TDS4VJTYUJGQXLIDMCBCAOGLQE.jpg
2,https://www.infobae.com/sociedad/policiales/2021/12/01/realizan-en-barracas-la-reconstruccion-del-crimen-de-lucas-gonzalez/,Suspendieron la reconstrucción del crimen de Lucas González por un planteo de los policías acusados,https://www.infobae.com/sociedad/policiales/2021/12/01/realizan-en-barracas-la-reconstruccion-del-crimen-de-lucas-gonzalez/,https://cloudfront-us-east-1.images.arcpublishing.com/infobae/H27IAIWIJZGHFBN6C2ZTA5DYEE.jpeg
3,https://www.infobae.com/deportes/2021/12/01/las-confesiones-de-un-ex-miembro-del-clan-maradona-del-increible-gesto-con-los-limpiavidrios-al-dia-que-camuflo-un-millon-de-dolares-para-entrar-al-pais/,Las confesiones de un ex miembro del clan Maradona: del increíble gesto con los limpiavidrios al día que camufló un millón de dólares para entrar al país,https://www.infobae.com/deportes/2021/12/01/las-confesiones-de-un-ex-miembro-del-clan-maradona-del-increible-gesto-con-los-limpiavidrios-al-dia-que-camuflo-un-millon-de-dolares-para-entrar-al-pais/,https://cloudfront-us-east-1.images.arcpublishing.com/infobae/P7CFQH7AANGGZH4QEPBG3CZ2WI.jpg
4,https://www.infobae.com/politica/2021/12/01/el-oficialismo-vuelve-a-la-carga-y-ahora-busca-sesionar-en-la-camara-de-diputados-el-lunes-proximo/,El oficialismo vuelve a la carga y ahora busca sesionar en Diputados antes de que asuman los nuevos legisladores,https://www.infobae.com/politica/2021/12/01/el-oficialismo-vuelve-a-la-carga-y-ahora-busca-sesionar-en-la-camara-de-diputados-el-lunes-proximo/,https://cloudfront-us-east-1.images.arcpublishing.com/infobae/BFC4FK3ULVHJZHB3W56GE2WFSU.jpg
5,https://www.infobae.com/sociedad/policiales/2021/11/30/cuales-son-los-interrogantes-sobre-el-crimen-de-lucio-dupuy-que-desvelan-a-los-investigadores/,"Abusos sexuales, el rol de la madre y cuánto sufrió Lucio Dupuy: las dudas que desvelan a los investigadores",https://www.infobae.com/sociedad/policiales/2021/11/30/cuales-son-los-interrogantes-sobre-el-crimen-de-lucio-dupuy-que-desvelan-a-los-investigadores/,https://cloudfront-us-east-1.images.arcpublishing.com/infobae/DDHPL53RQZDAHAYFIJAB3SK3XE.jpg
6,https://www.infobae.com/sociedad/policiales/2021/12/01/quien-era-la-disenadora-argentina-victima-de-un-femicidio-en-miami/,Quién era la diseñadora argentina víctima de un femicidio en Miami,https://www.infobae.com/sociedad/policiales/2021/12/01/quien-era-la-disenadora-argentina-victima-de-un-femicidio-en-miami/,https://cloudfront-us-east-1.images.arcpublishing.com/infobae/OZQX66GEXND63AHVJBQFOR6J6M.jpg
7,https://www.infobae.com/economia/2021/12/01/los-precios-en-bariloche-cuanto-costara-pasar-15-dias-en-uno-de-los-destinos-mas-buscados/,Los precios en Bariloche: cuánto costará pasar 15 días en uno de los destinos más buscados,https://www.infobae.com/economia/2021/12/01/los-precios-en-bariloche-cuanto-costara-pasar-15-dias-en-uno-de-los-destinos-mas-buscados/,https://cloudfront-us-east-1.images.arcpublishing.com/infobae/5ES4JWPASNE3BP52PBHTHXQK7A.jpeg
8,https://www.infobae.com/america/mundo/2021/12/01/estas-son-las-diez-ciudades-mas-caras-del-mundo-para-vivir/,Estas son las diez ciudades más caras del mundo para vivir,https://www.infobae.com/america/mundo/2021/12/01/estas-son-las-diez-ciudades-mas-caras-del-mundo-para-vivir/,https://cloudfront-us-east-1.images.arcpublishing.com/infobae/OJIOQKJWGNEFXCC6WTONKMPBIU.jpg
9,https://www.infobae.com/sociedad/2021/12/01/punta-tombo-un-conflicto-familiar-desencadeno-la-masacre-de-292-pinguinos-y-huevos-de-pichon/,Punta Tombo: un conflicto familiar desencadenó la masacre de 292 pingüinos y huevos de pichón,https://www.infobae.com/sociedad/2021/12/01/punta-tombo-un-conflicto-familiar-desencadeno-la-masacre-de-292-pinguinos-y-huevos-de-pichon/,https://cloudfront-us-east-1.images.arcpublishing.com/infobae/Q5YPEJMNSBHNTBGMDL3BNFYQ2U.jpg
10,https://www.infobae.com/america/deportes/futbol-europeo/2021/12/01/insolito-apoyo-publico-de-cristiano-ronaldo-a-un-incendiario-comentario-contra-lionel-messi-por-el-balon-de-oro/,Insólito apoyo público de Cristiano Ronaldo a un incendiario comentario contra Lionel Messi por el Balón de Oro,https://www.infobae.com/america/deportes/futbol-europeo/2021/12/01/insolito-apoyo-publico-de-cristiano-ronaldo-a-un-incendiario-comentario-contra-lionel-messi-por-el-balon-de-oro/,https://cloudfront-us-east-1.images.arcpublishing.com/infobae/CK4EXSA4FJBHTBIZOLGNHWMBFU
11,https://www.infobae.com/historias/2021/12/01/truman-capote-y-la-fiesta-del-siglo-invitados-exclusivos-colados-y-una-traicion-que-el-escritor-pagaria-muy-cara/,"Truman Capote y la Fiesta del Siglo: invitados exclusivos, colados y una traición que el escritor pagaría muy cara",https://www.infobae.com/historias/2021/12/01/truman-capote-y-la-fiesta-del-siglo-invitados-exclusivos-colados-y-una-traicion-que-el-escritor-pagaria-muy-cara/,https://cloudfront-us-east-1.images.arcpublishing.com/infobae/BOCD5PBPJFADJJZWUQOP2UKZDE.jpg
12,https://www.infobae.com/deportes/2021/12/01/el-plan-de-boca-para-mejorar-el-drenaje-de-la-bombonera-en-tiempo-record-y-evitar-la-mudanza/,El plan de Boca para mejorar el drenaje de la Bombonera en tiempo récord y evitar la mudanza,https://www.infobae.com/deportes/2021/12/01/el-plan-de-boca-para-mejorar-el-drenaje-de-la-bombonera-en-tiempo-record-y-evitar-la-mudanza/,https://cloudfront-us-east-1.images.arcpublishing.com/infobae/BGXPM3PZG5DPNM5RQDY6V7IQNU.jpg
13,https://www.infobae.com/america/eeuu/2021/12/01/los-accionistas-de-microsoft-se-rebelaron-contra-el-directorio-y-exigieron-una-investigacion-tras-las-acusaciones-de-acoso-sexual-contra-bill-gates/,Los accionistas de Microsoft se rebelaron contra el directorio y exigieron una investigación tras las denuncias de acoso sexual contra Bill Gates,https://www.infobae.com/america/eeuu/2021/12/01/los-accionistas-de-microsoft-se-rebelaron-contra-el-directorio-y-exigieron-una-investigacion-tras-las-acusaciones-de-acoso-sexual-contra-bill-gates/,https://cloudfront-us-east-1.images.arcpublishing.com/infobae/UVGGUQ4C4FHHTE4MUAAXQTO7SE.jpg
14,https://www.infobae.com/teleshow/2021/12/01/calu-rivero-y-anita-co-declaran-en-la-causa-contra-juan-darthes-las-acusaciones-que-empujaron-la-denuncia-de-thelma-fardin/,Calu Rivero y Anita Co declaran en la causa contra Juan Darthés: las acusaciones que empujaron la denuncia de Thelma Fardin,https://www.infobae.com/teleshow/2021/12/01/calu-rivero-y-anita-co-declaran-en-la-causa-contra-juan-darthes-las-acusaciones-que-empujaron-la-denuncia-de-thelma-fardin/,https://cloudfront-us-east-1.images.arcpublishing.com/infobae/WJ4G2NJOGZFLVGVSRLFXZZX3TI.jpg
15,https://www.infobae.com/sociedad/2021/12/01/habilitaron-la-descarga-del-certificado-digital-de-vacunacion-contra-el-covid-19/,Habilitaron la descarga del certificado digital de vacunación contra el COVID-19,https://www.infobae.com/sociedad/2021/12/01/habilitaron-la-descarga-del-certificado-digital-de-vacunacion-contra-el-covid-19/,https://cloudfront-us-east-1.images.arcpublishing.com/infobae/IPHZXVFPRVHRDFOPIOBU7F5IMM.jpg
16,https://www.infobae.com/deportes/2021/12/01/con-jorge-brito-a-la-cabeza-el-oficialismo-de-river-plate-cerro-su-campana-electoral/,"Con Jorge Brito a la cabeza, el oficialismo de River Plate cerró su campaña electoral",https://www.infobae.com/deportes/2021/12/01/con-jorge-brito-a-la-cabeza-el-oficialismo-de-river-plate-cerro-su-campana-electoral/,https://cloudfront-us-east-1.images.arcpublishing.com/infobae/ZEORI6KCCRAI5FMIC2DDUSFNTU.jpg
17,https://www.infobae.com/sociedad/2021/12/01/los-balines-dan-de-rebote-a-la-pibita-el-parte-del-erp-tras-asesinar-al-capitan-viola-y-su-hija-de-3-anos/,“Los balines dan de rebote a la pibita”: el parte del ERP tras asesinar al capitán Viola y su hija de 3 años,https://www.infobae.com/sociedad/2021/12/01/los-balines-dan-de-rebote-a-la-pibita-el-parte-del-erp-tras-asesinar-al-capitan-viola-y-su-hija-de-3-anos/,https://cloudfront-us-east-1.images.arcpublishing.com/infobae/BDI7Y6VKKJGR3MLR3OVZEXDLYU.jpg
18,https://www.infobae.com/america/mundo/2021/12/01/francia-reanudara-los-vuelos-con-el-sur-de-africa-e-impondra-nuevos-requisitos-a-los-viajeros-que-lleguen-desde-fuera-de-la-ue/,Francia reanudará los vuelos con el sur de África e impondrá nuevos requisitos a los viajeros que lleguen desde fuera de la UE,https://www.infobae.com/america/mundo/2021/12/01/francia-reanudara-los-vuelos-con-el-sur-de-africa-e-impondra-nuevos-requisitos-a-los-viajeros-que-lleguen-desde-fuera-de-la-ue/,https://cloudfront-us-east-1.images.arcpublishing.com/infobae/U2LG7SNRZFA57L7I3TSAPRQX4E.jpg
19,https://www.infobae.com/economia/2021/12/01/en-noviembre-el-banco-central-perdio-la-tercera-parte-de-los-dolares-que-dejara-la-cosecha-fina/,En noviembre el Banco Central perdió la tercera parte de los dólares que dejará la cosecha fina,https://www.infobae.com/economia/2021/12/01/en-noviembre-el-banco-central-perdio-la-tercera-parte-de-los-dolares-que-dejara-la-cosecha-fina/,https://cloudfront-us-east-1.images.arcpublishing.com/infobae/P3JS7X7WHRGUHNQMFAJZFIHMWU.jpg
20,https://www.infobae.com/politica/2021/12/01/el-gobierno-navega-entre-contradicciones-y-prejuicios-ideologicos-frente-a-la-necesidad-de-cerrar-con-el-fmi/,El Gobierno navega entre contradicciones y prejuicios ideológicos frente a la necesidad de cerrar con el FMI,https://www.infobae.com/politica/2021/12/01/el-gobierno-navega-entre-contradicciones-y-prejuicios-ideologicos-frente-a-la-necesidad-de-cerrar-con-el-fmi/,https://cloudfront-us-east-1.images.arcpublishing.com/infobae/6WBSCHNJ3FAFBCTUVPQ63TPASA
21,https://www.infobae.com/politica/2021/12/01/eutanasia-los-detalles-del-proyecto-que-la-ucr-presento-en-el-congreso-para-legalizar-la-interrupcion-voluntaria-de-la-vida/,Eutanasia: los detalles del proyecto que la UCR presentó en el Congreso para legalizar la interrupción voluntaria de la vida,https://www.infobae.com/politica/2021/12/01/eutanasia-los-detalles-del-proyecto-que-la-ucr-presento-en-el-congreso-para-legalizar-la-interrupcion-voluntaria-de-la-vida/,https://cloudfront-us-east-1.images.arcpublishing.com/infobae/E3IRY5JEOND4BE4I5S6QLP6CNE.jpg
22,https://www.infobae.com/sociedad/policiales/2021/12/01/un-colectivo-en-lanus-la-ultima-pista-de-nancy-videla-la-mujer-que-volvia-del-trabajo-y-nunca-llego-a-su-casa/,"Un colectivo en Lanús: la última pista de Nancy Videla, la mujer que volvía del trabajo y nunca llegó a su casa",https://www.infobae.com/sociedad/policiales/2021/12/01/un-colectivo-en-lanus-la-ultima-pista-de-nancy-videla-la-mujer-que-volvia-del-trabajo-y-nunca-llego-a-su-casa/,https://cloudfront-us-east-1.images.arcpublishing.com/infobae/UTWYJYUULFEWXO22GHBRYSENWY.jpg
23,https://www.infobae.com/america/deportes/futbol-europeo/2021/12/01/la-batalla-de-manchester-por-la-joya-de-river-city-y-united-tienen-en-la-mira-a-julian-alvarez/,La batalla de Manchester por la joya de River: City y United tienen en la mira a Julián Álvarez,https://www.infobae.com/america/deportes/futbol-europeo/2021/12/01/la-batalla-de-manchester-por-la-joya-de-river-city-y-united-tienen-en-la-mira-a-julian-alvarez/,https://cloudfront-us-east-1.images.arcpublishing.com/infobae/OTQWJWRIDVAYHJ4GM3EP63KKYU
24,https://www.infobae.com/america/deportes/espn/2021/12/01/momento-de-furia-de-insaurralde-metio-una-patada-recibio-la-roja-y-tomo-del-cuello-al-arbitro-mastrangelo/,"Momento de furia de Insaurralde: metió una patada, recibió la roja y tomó del cuello al árbitro Mastrángelo",https://www.infobae.com/america/deportes/espn/2021/12/01/momento-de-furia-de-insaurralde-metio-una-patada-recibio-la-roja-y-tomo-del-cuello-al-arbitro-mastrangelo/,https://cloudfront-us-east-1.images.arcpublishing.com/infobae/63UZHR33XFHXHIFY6AO3SPHXOA.JPG
25,https://www.infobae.com/america/eeuu/2021/12/01/estados-unidos-endurecera-los-requisitos-para-los-viajeros-internacionales-por-la-variante-omicron-de-coronavirus/,Estados Unidos endurecerá los requisitos para los viajeros internacionales por la variante Ómicron de coronavirus,https://www.infobae.com/america/eeuu/2021/12/01/estados-unidos-endurecera-los-requisitos-para-los-viajeros-internacionales-por-la-variante-omicron-de-coronavirus/,https://cloudfront-us-east-1.images.arcpublishing.com/infobae/QLC2NIE3362PL7SSG3HEYWKDCM.jpg
26,https://www.infobae.com/politica/2021/11/30/elisa-carrio-y-horacio-rodriguez-larreta-se-reunieron-a-solas-y-en-secreto-para-bajar-las-tensiones-en-la-relacion/,Rodríguez Larreta se reunió en secreto con Macri y habló con Carrió para bajar las tensiones en la relación,https://www.infobae.com/politica/2021/11/30/elisa-carrio-y-horacio-rodriguez-larreta-se-reunieron-a-solas-y-en-secreto-para-bajar-las-tensiones-en-la-relacion/,https://cloudfront-us-east-1.images.arcpublishing.com/infobae/NJUHRORPTRH6DK5ANCVSULZSIU.jpg
27,https://www.infobae.com/historias/2021/12/01/la-lucha-de-rosa-parks-se-nego-a-ceder-su-asiento-a-un-blanco-y-se-convirtio-en-simbolo-contra-el-racismo/,La lucha de Rosa Parks: se negó a ceder su asiento a un blanco y se convirtió en símbolo contra el racismo,https://www.infobae.com/historias/2021/12/01/la-lucha-de-rosa-parks-se-nego-a-ceder-su-asiento-a-un-blanco-y-se-convirtio-en-simbolo-contra-el-racismo/,https://cloudfront-us-east-1.images.arcpublishing.com/infobae/MAZKAUBAJFGSXCAXCG4HLFQKXU.jpg
28,https://www.infobae.com/teleshow/2021/12/01/eugenia-tobal-intima-el-escandalo-entre-wanda-nara-y-la-china-suarez-su-tuit-borrado-sobre-javier-milei-y-la-maternidad/,"Eugenia Tobal, íntima: el escándalo entre Wanda Nara y la China Suárez, su tuit borrado sobre Javier Milei y la maternidad",https://www.infobae.com/teleshow/2021/12/01/eugenia-tobal-intima-el-escandalo-entre-wanda-nara-y-la-china-suarez-su-tuit-borrado-sobre-javier-milei-y-la-maternidad/,https://cloudfront-us-east-1.images.arcpublishing.com/infobae/JHABOUPAOFFQZCDDRDODD7AJWQ.jpg
29,https://www.infobae.com/sociedad/2021/12/01/la-vida-de-un-portador-de-vih-que-salio-dos-veces-del-closet-no-le-tenia-miedo-al-virus-sino-a-lo-que-dijeran-de-mi/,La vida de un portador de VIH que salió dos veces del clóset: “No le tenía miedo al virus sino a lo que dijeran de mí”,https://www.infobae.com/sociedad/2021/12/01/la-vida-de-un-portador-de-vih-que-salio-dos-veces-del-closet-no-le-tenia-miedo-al-virus-sino-a-lo-que-dijeran-de-mi/,https://cloudfront-us-east-1.images.arcpublishing.com/infobae/TBWHM67OLNH5BP2H5D3F3S3UIU.jpeg
30,https://www.infobae.com/america/ciencia-america/2021/12/01/omicron-cuanto-influyo-la-baja-vacunacion-de-sudafrica-en-el-origen-de-la-variante/,Ómicron: cuánto influyó la baja vacunación de Sudáfrica en el origen de la variante,https://www.infobae.com/america/ciencia-america/2021/12/01/omicron-cuanto-influyo-la-baja-vacunacion-de-sudafrica-en-el-origen-de-la-variante/,https://cloudfront-us-east-1.images.arcpublishing.com/infobae/GJ7BRZWFG2RYLMBA2BKNVAAAOI.jpg
31,https://www.infobae.com/america/deportes/futbol-europeo/2021/12/01/ibrahimovic-confeso-que-un-documental-sobre-maradona-lo-empujo-a-tomar-un-cambio-decisivo-en-su-carrera/,Ibrahimovic confesó que un documental sobre Maradona lo empujó a tomar un cambio decisivo en su carrera,https://www.infobae.com/america/deportes/futbol-europeo/2021/12/01/ibrahimovic-confeso-que-un-documental-sobre-maradona-lo-empujo-a-tomar-un-cambio-decisivo-en-su-carrera/,https://cloudfront-us-east-1.images.arcpublishing.com/infobae/RL42OITWF5WWNZCLL2HWSO3K2U.jpg
32,https://www.infobae.com/vidriera/2021/12/01/en-fotos-alan-faena-festejo-su-cumpleanos-en-miami-con-un-asado-y-un-invitado-super-top-roonie-wood/,"En fotos: Alan Faena festejó su cumpleaños en Miami con un gran asado y un invitado súper top, Roonie Wood",https://www.infobae.com/vidriera/2021/12/01/en-fotos-alan-faena-festejo-su-cumpleanos-en-miami-con-un-asado-y-un-invitado-super-top-roonie-wood/,https://cloudfront-us-east-1.images.arcpublishing.com/infobae/N2BR4CRAC5HY7J5WDMFADK2S2U.jpg
33,https://www.infobae.com/politica/2021/12/01/la-cgt-le-pedira-al-ministro-guzman-que-el-acuerdo-con-el-fmi-se-haga-con-crecimiento-y-sin-ajuste/,La CGT le pedirá al ministro Guzmán que el acuerdo con el FMI “se haga con crecimiento y sin ajuste”,https://www.infobae.com/politica/2021/12/01/la-cgt-le-pedira-al-ministro-guzman-que-el-acuerdo-con-el-fmi-se-haga-con-crecimiento-y-sin-ajuste/,https://cloudfront-us-east-1.images.arcpublishing.com/infobae/Y4SRWHYNX5HARHN6E6U5ZAKCEQ.jpeg
34,https://www.infobae.com/america/ciencia-america/2021/12/01/alberto-cormillot-en-primera-persona-60-anos-con-la-ciencia-me-hacen-falta-muchos-anos-mas-para-seguir-aprendiendo-ensenando-y-criando-a-mi-hijo/,"Alberto Cormillot en primera persona, 60 años con la ciencia: “Me hacen falta muchos años más para seguir aprendiendo, enseñando y criando a mi hijo”",https://www.infobae.com/america/ciencia-america/2021/12/01/alberto-cormillot-en-primera-persona-60-anos-con-la-ciencia-me-hacen-falta-muchos-anos-mas-para-seguir-aprendiendo-ensenando-y-criando-a-mi-hijo/,https://cloudfront-us-east-1.images.arcpublishing.com/infobae/OUAMSKFLEBCJTGJF5746XUKCHU.jpg
35,https://www.infobae.com/economia/2021/12/01/mas-presion-para-el-dolar-el-banco-central-emitira-250000-millones-adicionales-hasta-fin-de-ano/,Más presión para el dólar: el Banco Central emitirá $ 250.000 millones adicionales hasta fin de año,https://www.infobae.com/economia/2021/12/01/mas-presion-para-el-dolar-el-banco-central-emitira-250000-millones-adicionales-hasta-fin-de-ano/,https://cloudfront-us-east-1.images.arcpublishing.com/infobae/SBX7EZBW5ZHIPGHKZ2UEKIEC7Y.jpg
36,https://www.infobae.com/economia/2021/12/01/otra-senal-del-gobierno-al-empresariado-enviara-a-su-plana-mayor-a-la-conferencia-anual-de-la-uia/,Otra señal del Gobierno al empresariado: enviará a su plana mayor a la conferencia anual de la UIA,https://www.infobae.com/economia/2021/12/01/otra-senal-del-gobierno-al-empresariado-enviara-a-su-plana-mayor-a-la-conferencia-anual-de-la-uia/,https://cloudfront-us-east-1.images.arcpublishing.com/infobae/3KOJF3W5NZBV7PU5PSAYYFQ2L4.jpg
37,https://www.infobae.com/america/tendencias-america/2021/12/01/empanadas-argentinas-con-sabor-estadounidense-en-miami-se-las-encuentra/,¿Empanadas argentinas con sabor estadounidense? En Miami se las encuentra,https://www.infobae.com/america/tendencias-america/2021/12/01/empanadas-argentinas-con-sabor-estadounidense-en-miami-se-las-encuentra/,https://cloudfront-us-east-1.images.arcpublishing.com/infobae/MKNR5BEDKZHKNH2OFYECB4TC5U.jpg
38,https://www.infobae.com/sociedad/2021/12/01/paso-hambre-fue-cartonero-e-ideo-un-proyecto-para-que-los-chicos-dejen-la-calle-y-estudien/,"Pasó hambre, fue cartonero e ideó un proyecto para que los chicos dejen la calle y estudien",https://www.infobae.com/sociedad/2021/12/01/paso-hambre-fue-cartonero-e-ideo-un-proyecto-para-que-los-chicos-dejen-la-calle-y-estudien/,https://cloudfront-us-east-1.images.arcpublishing.com/infobae/AEHN33KICNFJNI2ZPNXB3YAPBY.jpg
39,https://www.infobae.com/vidriera/2021/12/01/25-fotos-el-acto-de-asuncion-del-consejo-directivo-de-la-daia/,25 fotos: el acto de asunción del consejo directivo de la DAIA,https://www.infobae.com/vidriera/2021/12/01/25-fotos-el-acto-de-asuncion-del-consejo-directivo-de-la-daia/,https://cloudfront-us-east-1.images.arcpublishing.com/infobae/2VHG7J6WPZDZVNGEDJBGGWXHQE.jpg
40,https://www.infobae.com/economia/2021/12/01/fabian-kon-ceo-del-banco-galicia-la-argentina-es-un-pais-que-no-tiene-moneda/,"Fabián Kon, CEO del Banco Galicia: “La Argentina es un país que no tiene moneda”",https://www.infobae.com/economia/2021/12/01/fabian-kon-ceo-del-banco-galicia-la-argentina-es-un-pais-que-no-tiene-moneda/,https://cloudfront-us-east-1.images.arcpublishing.com/infobae/4VLJJJGDPFGG5L6ZKI6IZ43LK4.jpg
41,https://www.infobae.com/salud/2021/12/01/cuales-son-las-razones-por-las-que-en-una-semana-aumentaron-un-40-los-contagios-de-covid-19-en-argentina/,Cuáles son las razones por las que en una semana aumentaron un 40% los contagios de COVID-19 en Argentina,https://www.infobae.com/salud/2021/12/01/cuales-son-las-razones-por-las-que-en-una-semana-aumentaron-un-40-los-contagios-de-covid-19-en-argentina/,https://cloudfront-us-east-1.images.arcpublishing.com/infobae/3XFP37ZUOZHKTDROCGJHTR73ZU.jpg
42,https://www.infobae.com/america/ciencia-america/2021/12/01/cientificos-de-harvard-disenaron-un-chip-para-estudiar-la-infeccion-intestinal-por-covid-19/,Científicos de Harvard diseñaron un chip para estudiar la infección intestinal por COVID-19 ,https://www.infobae.com/america/ciencia-america/2021/12/01/cientificos-de-harvard-disenaron-un-chip-para-estudiar-la-infeccion-intestinal-por-covid-19/,https://cloudfront-us-east-1.images.arcpublishing.com/infobae/C6VFOWUA2VDWRKX4SFUWBCEUJI.jpg
43,https://www.infobae.com/sociedad/2021/12/01/son-mis-eternos-ninos-egresaron-en-1974-y-47-anos-despues-se-volvieron-a-reunir-con-su-seno/,“Son mis eternos niños”: egresaron en 1974 y 47 años después se volvieron a reunir con su “seño”,https://www.infobae.com/sociedad/2021/12/01/son-mis-eternos-ninos-egresaron-en-1974-y-47-anos-despues-se-volvieron-a-reunir-con-su-seno/,https://cloudfront-us-east-1.images.arcpublishing.com/infobae/CMEFQKQBSZEONJ3BOPKUJKGQNM.jpg
44,https://www.infobae.com/teleshow/2021/12/01/yotuel-se-reunio-con-joe-biden-le-explique-que-patria-y-vida-es-la-parte-emotiva-de-la-libertad-de-cuba/,Yotuel se reunió con Joe Biden: “Le expliqué que Patria y Vida es la parte emotiva de la libertad de Cuba”,https://www.infobae.com/teleshow/2021/12/01/yotuel-se-reunio-con-joe-biden-le-explique-que-patria-y-vida-es-la-parte-emotiva-de-la-libertad-de-cuba/,https://cloudfront-us-east-1.images.arcpublishing.com/infobae/7JKP75BD5RH5HEO3MTDELG2QMA.jpg
45,https://www.infobae.com/sociedad/2021/12/01/thelma-fardin-declaro-durante-cuatro-horas-ante-la-justicia-brasilena-en-la-causa-por-estupro-agravado-contra-juan-darthes/,Thelma Fardín declaró durante cuatro horas ante la justicia brasileña en la causa por estupro agravado contra Juan Darthés,https://www.infobae.com/sociedad/2021/12/01/thelma-fardin-declaro-durante-cuatro-horas-ante-la-justicia-brasilena-en-la-causa-por-estupro-agravado-contra-juan-darthes/,https://cloudfront-us-east-1.images.arcpublishing.com/infobae/OM633PZQ3FEXBJVVYYFTEAC7YI.jpg
46,https://www.infobae.com/cultura/2021/12/01/hernan-vanoli-y-su-dias-como-aprendiz-de-taxidermista-en-estados-unidos-el-pais-donde-la-guerra-es-arte/,"Hernán Vanoli y sus días como aprendiz de taxidermista en Estados Unidos, el país donde su arte es la guerra",https://www.infobae.com/cultura/2021/12/01/hernan-vanoli-y-su-dias-como-aprendiz-de-taxidermista-en-estados-unidos-el-pais-donde-la-guerra-es-arte/,https://cloudfront-us-east-1.images.arcpublishing.com/infobae/5TMFLGTT4ZD33ICLVAWCN7XDKA.png
47,https://www.infobae.com/teleshow/2021/12/01/bradley-cooper-e-irina-shayk-vuelven-a-estar-juntos-y-kristen-stewart-se-animo-al-rosa-neon-celebrities-en-un-click/,Bradley Cooper e Irina Shayk vuelven a estar juntos y Kristen Stewart se animó al rosa neón: celebrities en un click,https://www.infobae.com/teleshow/2021/12/01/bradley-cooper-e-irina-shayk-vuelven-a-estar-juntos-y-kristen-stewart-se-animo-al-rosa-neon-celebrities-en-un-click/,https://cloudfront-us-east-1.images.arcpublishing.com/infobae/RIIKJAO37RGYBEP5UA6MTLFCII.jpg
48,https://www.infobae.com/economia/2021/12/01/se-renueva-el-cupo-mensual-de-usd-200-a-que-precio-vende-cada-banco-al-dolar-mas-barato-del-mercado/,Se renueva el cupo mensual de USD 200: a qué precio vende cada banco al dólar más barato del mercado,https://www.infobae.com/economia/2021/12/01/se-renueva-el-cupo-mensual-de-usd-200-a-que-precio-vende-cada-banco-al-dolar-mas-barato-del-mercado/,https://cloudfront-us-east-1.images.arcpublishing.com/infobae/UBUDGWEV6REAZOPHPW57TI7IPY.jpg
49,https://www.infobae.com/educacion/2021/12/01/tras-los-malos-resultados-internacionales-hoy-mediran-cuanto-aprendieron-los-chicos-durante-la-pandemia/,"Tras los malos resultados internacionales, hoy medirán cuánto aprendieron los chicos durante la pandemia",https://www.infobae.com/educacion/2021/12/01/tras-los-malos-resultados-internacionales-hoy-mediran-cuanto-aprendieron-los-chicos-durante-la-pandemia/,https://cloudfront-us-east-1.images.arcpublishing.com/infobae/VDOMGBZOMJEI3F2ORBSMLIJI3E.jpg
50,https://www.infobae.com/tendencias/2021/12/01/llega-el-4-festival-de-cocina-israeli-para-disfrutar-de-la-fusion-de-sabores-de-una-gastronomia-milenaria/,"Llega el 4° Festival de Cocina Israelí, para disfrutar de la fusión de sabores de una gastronomía milenaria",https://www.infobae.com/tendencias/2021/12/01/llega-el-4-festival-de-cocina-israeli-para-disfrutar-de-la-fusion-de-sabores-de-una-gastronomia-milenaria/,https://cloudfront-us-east-1.images.arcpublishing.com/infobae/JYCPCPXITNDPLEYSXTJ2PGRZDM.jpg
51,https://www.infobae.com/sociedad/policiales/2021/12/01/tras-el-crimen-de-lucio-dupuy-convocan-a-una-marcha-en-plaza-de-mayo-contra-el-maltrato-infantil/,"Tras el crimen de Lucio Dupuy, convocan a una marcha en Plaza de Mayo contra el maltrato infantil",https://www.infobae.com/sociedad/policiales/2021/12/01/tras-el-crimen-de-lucio-dupuy-convocan-a-una-marcha-en-plaza-de-mayo-contra-el-maltrato-infantil/,https://cloudfront-us-east-1.images.arcpublishing.com/infobae/43JENWHCDNEWLGAGNCUPSSFTLM.png
