n,id,title,url,image
1,https://www.infobae.com/politica/2021/08/03/los-distritos-prioritarios-y-el-objetivo-de-votos-que-esperan-sacar-que-dice-el-manual-de-campana-electoral-del-frente-de-todos/,Los distritos prioritarios y el objetivo de votos que esperan sacar: qué dice el manual de campaña electoral del Frente de Todos,https://www.infobae.com/politica/2021/08/03/los-distritos-prioritarios-y-el-objetivo-de-votos-que-esperan-sacar-que-dice-el-manual-de-campana-electoral-del-frente-de-todos/,https://cloudfront-us-east-1.images.arcpublishing.com/infobae/HIWXXT3YN5APHKIHS4ZSAOHDRU.jpg
2,https://www.infobae.com/sociedad/2021/08/03/es-abogado-se-fue-a-trabajar-de-delivery-a-berlin-y-ahorro-15000-euros-en-un-ano/,"Es abogado, se fue a trabajar de delivery a Berlín y ahorró 15.000 euros en un año",https://www.infobae.com/sociedad/2021/08/03/es-abogado-se-fue-a-trabajar-de-delivery-a-berlin-y-ahorro-15000-euros-en-un-ano/,https://cloudfront-us-east-1.images.arcpublishing.com/infobae/67F7HFPCTJG3TFEVLNZNB2HHZM.jpg
3,https://www.infobae.com/america/tendencias-america/2021/08/03/alimentacion-y-covid-19-cuales-son-los-nutrientes-que-fortalecen-el-sistema-inmune/,Alimentación y COVID-19: cuáles son los nutrientes que fortalecen el sistema inmune,https://www.infobae.com/america/tendencias-america/2021/08/03/alimentacion-y-covid-19-cuales-son-los-nutrientes-que-fortalecen-el-sistema-inmune/,https://cloudfront-us-east-1.images.arcpublishing.com/infobae/NL4EMHF35NCONDRLFS7YFG7TVE.jpg
4,https://www.infobae.com/salud/ciencia/2021/08/03/el-fabricante-ruso-de-sputnik-avalo-que-la-argentina-fabrique-mas-de-3-millones-de-dosis-del-segundo-componente-que-estaran-disponibles-este-mes/,El fabricante ruso de Sputnik avaló que la Argentina produzca más de 3 millones de dosis del segundo componente que estarán disponibles este mes,https://www.infobae.com/salud/ciencia/2021/08/03/el-fabricante-ruso-de-sputnik-avalo-que-la-argentina-fabrique-mas-de-3-millones-de-dosis-del-segundo-componente-que-estaran-disponibles-este-mes/,https://cloudfront-us-east-1.images.arcpublishing.com/infobae/PX53M45B7VCGVL3IJ3UIEM46GQ.jpg
5,https://www.infobae.com/economia/2021/08/03/luz-amarilla-para-el-gobierno-el-precio-internacional-de-la-soja-cae-casi-12-dolares-y-cotiza-por-debajo-de-los-usd-510-la-tonelada/,Luz amarilla para el Gobierno: el precio internacional de la soja cae casi 12 dólares y cotiza por debajo de los USD 510 la tonelada,https://www.infobae.com/economia/2021/08/03/luz-amarilla-para-el-gobierno-el-precio-internacional-de-la-soja-cae-casi-12-dolares-y-cotiza-por-debajo-de-los-usd-510-la-tonelada/,https://cloudfront-us-east-1.images.arcpublishing.com/infobae/5M5CHPQIGFHZJBEH2JJQLAQH7U.jpg
6,https://www.infobae.com/america/deportes/juegos-olimpicos/2021/08/03/emocionante-momento-en-los-juegos-olimpicos-luis-scola-salio-de-la-cancha-y-frenaron-el-partido-para-que-todo-el-estadio-lo-ovacione/,Emotivo momento en los Juegos Olímpicos: Luis Scola salió de la cancha y frenaron el partido para que todo el estadio lo ovacione,https://www.infobae.com/america/deportes/juegos-olimpicos/2021/08/03/emocionante-momento-en-los-juegos-olimpicos-luis-scola-salio-de-la-cancha-y-frenaron-el-partido-para-que-todo-el-estadio-lo-ovacione/,https://cloudfront-us-east-1.images.arcpublishing.com/infobae/AL4KHSJP4BDQTE4V3QZLRI2BE4
7,https://www.infobae.com/america/deportes/juegos-olimpicos/2021/08/03/la-seleccion-argentina-de-basquet-buscara-un-lugar-en-semifinales-ante-australia-hora-y-tv/,"En la despedida de Luis Scola, la selección argentina de básquet jugó un mal partido ante Australia y quedó eliminada de los Juegos Olímpicos",https://www.infobae.com/america/deportes/juegos-olimpicos/2021/08/03/la-seleccion-argentina-de-basquet-buscara-un-lugar-en-semifinales-ante-australia-hora-y-tv/,https://cloudfront-us-east-1.images.arcpublishing.com/infobae/BAJSMONQGPUDMY5L4LZQ5QHTDE.jpg
8,https://www.infobae.com/america/deportes/juegos-olimpicos/2021/08/03/luis-fue-el-mejor-y-mas-increible-jugador-que-haya-nacido-en-nuestro-territorio-el-elogio-del-oveja-hernandez-tras-la-despedida-de-scola/,“Luis fue el mejor y más increíble jugador que haya nacido en nuestro territorio”: el elogio del Oveja Hernández tras la despedida de Scola,https://www.infobae.com/america/deportes/juegos-olimpicos/2021/08/03/luis-fue-el-mejor-y-mas-increible-jugador-que-haya-nacido-en-nuestro-territorio-el-elogio-del-oveja-hernandez-tras-la-despedida-de-scola/,https://cloudfront-us-east-1.images.arcpublishing.com/infobae/SLT35ZVSJDEJ5KZB7VBF5UJSMQ.jpg
9,https://www.infobae.com/economia/2021/08/03/insolito-record-para-una-fabrica-de-pampero-en-la-rioja-funciono-solo-44-dias-y-tuvo-que-cerrar-por-un-conflicto-gremial/,Insólito récord para una fábrica de Pampero en La Rioja: funcionó solo 44 días y tuvo que cerrar por un conflicto gremial,https://www.infobae.com/economia/2021/08/03/insolito-record-para-una-fabrica-de-pampero-en-la-rioja-funciono-solo-44-dias-y-tuvo-que-cerrar-por-un-conflicto-gremial/,https://cloudfront-us-east-1.images.arcpublishing.com/infobae/BTYB4VKY3FC45PZEF2BTVNIAWA.jpg
10,https://www.infobae.com/politica/2021/08/03/es-una-de-las-profesiones-mejor-remunerada-del-pais-y-tiene-plena-salida-laboral-pero-no-hay-interesados-en-estudiarla/,"Es una de las profesiones mejor remunerada del país y tiene plena salida laboral, pero no hay interesados en estudiarla",https://www.infobae.com/politica/2021/08/03/es-una-de-las-profesiones-mejor-remunerada-del-pais-y-tiene-plena-salida-laboral-pero-no-hay-interesados-en-estudiarla/,https://arc-anglerfish-arc2-prod-infobae.s3.amazonaws.com/public/7N4DJQNLTBFBXKPGUQODUGFUWE
11,https://www.infobae.com/america/deportes/juegos-olimpicos/2021/08/03/acusan-al-equipo-danes-de-ciclismo-de-hacer-trampa-en-los-juegos-olimpicos-el-detalle-que-senalan-en-sus-piernas/,Acusan al equipo danés de ciclismo de hacer trampa en los Juegos Olímpicos: el detalle que señalan en sus piernas,https://www.infobae.com/america/deportes/juegos-olimpicos/2021/08/03/acusan-al-equipo-danes-de-ciclismo-de-hacer-trampa-en-los-juegos-olimpicos-el-detalle-que-senalan-en-sus-piernas/,https://cloudfront-us-east-1.images.arcpublishing.com/infobae/LOA67XQZ5IBUVMUPOAF4XKTRUA.jpg
12,https://www.infobae.com/teleshow/2021/08/03/marcelo-mazarello-critico-a-florencia-pena-por-su-visita-a-alberto-fernandez-yo-no-podia-despedir-a-mi-papa-pero-si-se-podia-ir-a-olivos/,"Marcelo Mazarello criticó a Florencia Peña por su visita a Alberto Fernández: “Yo no podía despedir a mi papá, pero sí se podía ir a Olivos”",https://www.infobae.com/teleshow/2021/08/03/marcelo-mazarello-critico-a-florencia-pena-por-su-visita-a-alberto-fernandez-yo-no-podia-despedir-a-mi-papa-pero-si-se-podia-ir-a-olivos/,https://cloudfront-us-east-1.images.arcpublishing.com/infobae/DY4QJ6PAJJCC7DEE2B2F7PNEOE.jpg
13,https://www.infobae.com/politica/2021/08/03/tras-su-viaje-a-peru-alberto-fernandez-debera-permanecer-un-dia-mas-aislado-le-daran-el-alta-el-jueves/,"Tras su viaje a Perú, Alberto Fernández deberá permanecer un día más aislado: le darán el alta el jueves",https://www.infobae.com/politica/2021/08/03/tras-su-viaje-a-peru-alberto-fernandez-debera-permanecer-un-dia-mas-aislado-le-daran-el-alta-el-jueves/,https://cloudfront-us-east-1.images.arcpublishing.com/infobae/YDWUCV3G3RAINL35UJ6IEMOAOI.jpg
14,https://www.infobae.com/sociedad/policiales/2021/08/03/un-hombre-de-luis-guillon-se-descompenso-mientras-manejaba-su-familia-lo-encontro-4-dias-despues-en-una-morgue-de-villa-soldati/,Un hombre de Luis Guillón se descompensó mientras manejaba: su familia lo encontró 4 días después en una morgue de Villa Soldati,https://www.infobae.com/sociedad/policiales/2021/08/03/un-hombre-de-luis-guillon-se-descompenso-mientras-manejaba-su-familia-lo-encontro-4-dias-despues-en-una-morgue-de-villa-soldati/,https://cloudfront-us-east-1.images.arcpublishing.com/infobae/BK5Y5327OZGZBECYDBCKRAN5SA.jpg
15,https://www.infobae.com/america/eeuu/2021/08/03/la-investigacion-de-la-fiscalia-de-nueva-york-confirmo-que-el-gobernador-andrew-cuomo-acoso-sexualmente-a-multiples-mujeres/,La investigación de la Fiscalía de Nueva York confirmó que el gobernador Andrew Cuomo acosó sexualmente a múltiples mujeres,https://www.infobae.com/america/eeuu/2021/08/03/la-investigacion-de-la-fiscalia-de-nueva-york-confirmo-que-el-gobernador-andrew-cuomo-acoso-sexualmente-a-multiples-mujeres/,https://cloudfront-us-east-1.images.arcpublishing.com/infobae/FV36ZICNPJ4RZKBL2GO4LDLN7Q.jpg
16,https://www.infobae.com/deportes/juegos-olimpicos/2021/08/03/la-seleccion-argentina-de-voley-busca-las-semifinales-de-los-juegos-olimpicos-ante-italia/,La selección argentina de vóley logró un triunfo histórico ante Italia y jugará las semifinales de los Juegos Olímpicos,https://www.infobae.com/deportes/juegos-olimpicos/2021/08/03/la-seleccion-argentina-de-voley-busca-las-semifinales-de-los-juegos-olimpicos-ante-italia/,https://cloudfront-us-east-1.images.arcpublishing.com/infobae/KSL7QGBX6ZKF3KWINYQTJQEQ2E.jpg
17,https://www.infobae.com/deportes/juegos-olimpicos/2021/08/03/los-dos-puntos-que-dieron-vuelta-el-partido-y-el-desaforado-festejo-de-hugo-conte-en-el-triunfo-de-la-seleccion-de-voley/,Los dos puntos que dieron vuelta el partido y el desaforado festejo de Hugo Conte en el triunfo de la selección de vóley  ,https://www.infobae.com/deportes/juegos-olimpicos/2021/08/03/los-dos-puntos-que-dieron-vuelta-el-partido-y-el-desaforado-festejo-de-hugo-conte-en-el-triunfo-de-la-seleccion-de-voley/,https://cloudfront-us-east-1.images.arcpublishing.com/infobae/KPJCKTMBGFFZLFOVO5ZAON3LCA.jpg
18,https://www.infobae.com/aroundtherings/espanol/2021/08/03/lo-busco-el-padre-lo-busca-el-hijo-el-voleibol-les-da-una-tercera-oportunidad-a-los-conte/,"Lo buscó el padre, lo busca el hijo: el voleibol les da una tercera oportunidad a los Conte",https://www.infobae.com/aroundtherings/espanol/2021/08/03/lo-busco-el-padre-lo-busca-el-hijo-el-voleibol-les-da-una-tercera-oportunidad-a-los-conte/,https://cloudfront-us-east-1.images.arcpublishing.com/infobae/CPJQK5DEEXHKJHX37S44WCCFRE.jpg
19,https://www.infobae.com/america/deportes/juegos-olimpicos/2021/08/03/el-pedido-del-dt-de-la-seleccion-argentina-de-voley-tras-el-triunfo-historico-en-tokio-hay-que-apoyar-a-los-clubes-que-no-se-mueran/,"El pedido del DT de la selección argentina de vóley tras el triunfo histórico en Tokio: “Hay que apoyar a los clubes, que no se mueran”",https://www.infobae.com/america/deportes/juegos-olimpicos/2021/08/03/el-pedido-del-dt-de-la-seleccion-argentina-de-voley-tras-el-triunfo-historico-en-tokio-hay-que-apoyar-a-los-clubes-que-no-se-mueran/,https://cloudfront-us-east-1.images.arcpublishing.com/infobae/6AU3D5RIMZGV57HL5GRQ4ZVQNA.jpg
20,https://www.infobae.com/tecno/2021/08/03/nuevo-boom-con-criptomonedas-como-es-la-plataforma-creada-por-argentinos-que-impulsa-la-inversion-en-inmuebles-digitales/,Nuevo boom con criptomonedas: cómo es la plataforma creada por argentinos que impulsa la inversión en “inmuebles digitales”,https://www.infobae.com/tecno/2021/08/03/nuevo-boom-con-criptomonedas-como-es-la-plataforma-creada-por-argentinos-que-impulsa-la-inversion-en-inmuebles-digitales/,https://cloudfront-us-east-1.images.arcpublishing.com/infobae/5YOI4QI5TNG4ND4USHYVDUKQOU.jpg
21,https://www.infobae.com/teleshow/2021/08/03/pampita-a-solas-con-teleshow-en-su-regreso-a-showmatch-horarios-flexibles-y-roberto-en-el-camarin-las-claves-para-volver-a-11-dias-del-nacimiento-de-ana/,"Pampita, a solas con Teleshow: las claves para volver a ShowMatch a solo 11 días del nacimiento de Ana",https://www.infobae.com/teleshow/2021/08/03/pampita-a-solas-con-teleshow-en-su-regreso-a-showmatch-horarios-flexibles-y-roberto-en-el-camarin-las-claves-para-volver-a-11-dias-del-nacimiento-de-ana/,https://cloudfront-us-east-1.images.arcpublishing.com/infobae/MZM2T6PR5ZF5NJLYFWGCJDNVKU.jpg
22,https://www.infobae.com/teleshow/2021/08/03/la-categorica-respuesta-que-le-dio-soledad-pastorutti-a-su-marido-cuando-le-cuestiono-el-vestuario-que-usa-en-la-voz-argentina/,La categórica respuesta que le dio Soledad Pastorutti a su marido cuando le cuestionó el vestuario que usa en La Voz Argentina,https://www.infobae.com/teleshow/2021/08/03/la-categorica-respuesta-que-le-dio-soledad-pastorutti-a-su-marido-cuando-le-cuestiono-el-vestuario-que-usa-en-la-voz-argentina/,https://cloudfront-us-east-1.images.arcpublishing.com/infobae/GMP2GN75D5F3ZNDIKO35QXPDFA.jpg
23,https://www.infobae.com/educacion/2021/08/03/lanzan-becas-para-estudiantes-argentinos-que-quieran-hacer-un-posgrado-en-reino-unido/,Lanzan becas para estudiantes argentinos que quieran hacer un posgrado en Reino Unido,https://www.infobae.com/educacion/2021/08/03/lanzan-becas-para-estudiantes-argentinos-que-quieran-hacer-un-posgrado-en-reino-unido/,https://cloudfront-us-east-1.images.arcpublishing.com/infobae/VBXPFGX5QBG3DAG4MFFF7H2N7I.jpg
24,https://www.infobae.com/economia/2021/08/03/quien-es-y-como-piensa-el-funcionario-de-biden-que-definira-el-futuro-de-las-criptomonedas-en-estados-unidos/,Quién es y cómo piensa el funcionario de Biden que definirá el futuro de las criptomonedas en Estados Unidos,https://www.infobae.com/economia/2021/08/03/quien-es-y-como-piensa-el-funcionario-de-biden-que-definira-el-futuro-de-las-criptomonedas-en-estados-unidos/,https://cloudfront-us-east-1.images.arcpublishing.com/infobae/OROW473OWDPVTV2SIHXTJAV7UU.jpg
25,https://www.infobae.com/teleshow/2021/08/03/santiago-borda-el-participante-de-la-voz-que-debio-ser-hospitalizado-denuncio-a-su-pareja-por-violencia/,"Santiago Borda, el participante de La Voz que debió ser hospitalizado, denunció a su pareja por violencia",https://www.infobae.com/teleshow/2021/08/03/santiago-borda-el-participante-de-la-voz-que-debio-ser-hospitalizado-denuncio-a-su-pareja-por-violencia/,https://cloudfront-us-east-1.images.arcpublishing.com/infobae/7S3VTFGG2FFPHOHX7CW7XFPYZM.jpg
26,https://www.infobae.com/america/eeuu/2021/08/03/el-pentagono-fue-cerrado-de-emergencia-por-un-tiroteo-en-la-zona-de-la-estacion-de-metro/,El Pentágono fue cerrado de emergencia por un tiroteo en la zona de la estación de metro,https://www.infobae.com/america/eeuu/2021/08/03/el-pentagono-fue-cerrado-de-emergencia-por-un-tiroteo-en-la-zona-de-la-estacion-de-metro/,https://cloudfront-us-east-1.images.arcpublishing.com/infobae/ZIGEDTARIZDSXOAN6G7YLCMOTI.jpg
27,https://www.infobae.com/sociedad/policiales/2021/08/03/un-nene-de-7-anos-fue-a-pescar-con-su-padrastro-a-una-tosquera-y-se-ahogaron-encontraron-los-cuerpos-en-el-agua/,Un nene de 7 años fue a pescar con su padrastro a una tosquera y se ahogaron: encontraron los cuerpos en el agua,https://www.infobae.com/sociedad/policiales/2021/08/03/un-nene-de-7-anos-fue-a-pescar-con-su-padrastro-a-una-tosquera-y-se-ahogaron-encontraron-los-cuerpos-en-el-agua/,https://cloudfront-us-east-1.images.arcpublishing.com/infobae/F4ZAIPZ3V5D4LLBHMQDRPPYEG4.jpg
28,https://www.infobae.com/opinion/2021/08/03/todo-lo-que-tiene-para-ofrecer-el-populismo-k-es-poder-comprar-un-par-de-zapatos-en-12-cuotas/,Todo lo que tiene para ofrecer el populismo K es poder comprar un par de zapatos en 12 cuotas,https://www.infobae.com/opinion/2021/08/03/todo-lo-que-tiene-para-ofrecer-el-populismo-k-es-poder-comprar-un-par-de-zapatos-en-12-cuotas/,https://cloudfront-us-east-1.images.arcpublishing.com/infobae/Y4K7BQINSJDXZA4FK775XQYBWM.jpeg
29,https://www.infobae.com/deportes/juegos-olimpicos/2021/08/03/el-llanto-de-facundo-campazzo-en-el-banco-de-suplentes-y-su-mensaje-para-luis-scola-tras-la-derrota-ante-australia/,El llanto de Facundo Campazzo en el banco de suplentes y su mensaje para Luis Scola tras la derrota ante Australia,https://www.infobae.com/deportes/juegos-olimpicos/2021/08/03/el-llanto-de-facundo-campazzo-en-el-banco-de-suplentes-y-su-mensaje-para-luis-scola-tras-la-derrota-ante-australia/,https://cloudfront-us-east-1.images.arcpublishing.com/infobae/KCQTTVAFXVA3DOLLTYJSN2KVQI.jpg
30,https://www.infobae.com/deportes/juegos-olimpicos/2021/08/03/sigo-un-poco-tocado-manu-ginobili-se-emociono-con-las-imagenes-del-retiro-de-luis-scola-de-la-seleccion-argentina/,“Sigo un poco tocado”: Manu Ginóbili se emocionó con las imágenes del retiro de Luis Scola de la selección argentina,https://www.infobae.com/deportes/juegos-olimpicos/2021/08/03/sigo-un-poco-tocado-manu-ginobili-se-emociono-con-las-imagenes-del-retiro-de-luis-scola-de-la-seleccion-argentina/,https://cloudfront-us-east-1.images.arcpublishing.com/infobae/435LGSY7N5AK3FUISQ3ST62F7Q
31,https://www.infobae.com/america/opinion/2021/08/03/el-abandono-de-simone-biles/,El abandono de Simone Biles,https://www.infobae.com/america/opinion/2021/08/03/el-abandono-de-simone-biles/,https://cloudfront-us-east-1.images.arcpublishing.com/infobae/EBI2RDBP6BLOM3CGGBTO54DMZI.jpg
32,https://www.infobae.com/america/deportes/juegos-olimpicos/2021/08/03/lo-mas-destacado-del-dia-11-de-los-juegos-olimpicos-el-regreso-de-biles-el-epico-triunfo-del-voley-y-la-eliminacion-del-basquet/,"Lo más destacado del día 11 de los Juegos Olímpicos: el regreso de Biles, el épico triunfo del vóley y la eliminación del básquet",https://www.infobae.com/america/deportes/juegos-olimpicos/2021/08/03/lo-mas-destacado-del-dia-11-de-los-juegos-olimpicos-el-regreso-de-biles-el-epico-triunfo-del-voley-y-la-eliminacion-del-basquet/,https://cloudfront-us-east-1.images.arcpublishing.com/infobae/P2IXMOXFNBGHJLA5SUVCRRFZQQ.jpg
33,https://www.infobae.com/america/deportes/juegos-olimpicos/2021/08/03/elaine-thompson-herah-la-mas-rapida-de-los-juegos-olimpicos-de-tokio-gano-los-200-metros-y-sumo-otra-medalla-dorada/,"Elaine Thompson-Herah, la más rápida de los Juegos Olímpicos de Tokio: ganó los 200 metros y sumó otra medalla dorada",https://www.infobae.com/america/deportes/juegos-olimpicos/2021/08/03/elaine-thompson-herah-la-mas-rapida-de-los-juegos-olimpicos-de-tokio-gano-los-200-metros-y-sumo-otra-medalla-dorada/,https://cloudfront-us-east-1.images.arcpublishing.com/infobae/RDU2D26RTQHQ4J6AK4ZS3NOCEM.jpg
34,https://www.infobae.com/economia/2021/08/03/ganancias-este-mes-el-gobierno-actualizara-por-decreto-el-minimo-no-imponible-que-estara-vigente-desde-septiembre/,"Ganancias: este mes, el Gobierno actualizará por decreto el mínimo no imponible que estará vigente desde septiembre",https://www.infobae.com/economia/2021/08/03/ganancias-este-mes-el-gobierno-actualizara-por-decreto-el-minimo-no-imponible-que-estara-vigente-desde-septiembre/,https://cloudfront-us-east-1.images.arcpublishing.com/infobae/B5AIHQAH5ZD3DFVRJ3W2E4FK4E.jpg
35,https://www.infobae.com/politica/2021/08/03/cuales-son-cuatro-opciones-que-evaluan-ciudad-y-provincia-para-reemplazar-la-segunda-dosis-de-sputnik-v-esta-semana-habra-un-anuncio-en-conjunto/,Cuáles son las cuatro opciones que evalúan Ciudad y Provincia para reemplazar la segunda dosis de Sputnik V: esta semana habrá un anuncio en conjunto ,https://www.infobae.com/politica/2021/08/03/cuales-son-cuatro-opciones-que-evaluan-ciudad-y-provincia-para-reemplazar-la-segunda-dosis-de-sputnik-v-esta-semana-habra-un-anuncio-en-conjunto/,https://cloudfront-us-east-1.images.arcpublishing.com/infobae/XOHL5PT7SVAOXIKBNKOSLX6U6A.jpg
36,https://www.infobae.com/america/eeuu/2021/08/03/nueva-york-tendra-un-pase-sanitario-para-vacunados-en-restaurantes-gimnasios-y-otros-espacios-cerrados/,"Nueva York tendrá un pase sanitario para vacunados en restaurantes, gimnasios y otros espacios cerrados",https://www.infobae.com/america/eeuu/2021/08/03/nueva-york-tendra-un-pase-sanitario-para-vacunados-en-restaurantes-gimnasios-y-otros-espacios-cerrados/,https://cloudfront-us-east-1.images.arcpublishing.com/infobae/PPM7RUWI4MRZ2FFD3BNHOSPC5I.jpg
37,https://www.infobae.com/salud/2021/08/03/por-que-la-pandemia-produjo-el-aumento-de-los-casos-de-miopia-en-ninos/,Por qué la pandemia produjo el aumento de los casos de miopía en niños,https://www.infobae.com/salud/2021/08/03/por-que-la-pandemia-produjo-el-aumento-de-los-casos-de-miopia-en-ninos/,https://arc-anglerfish-arc2-prod-infobae.s3.amazonaws.com/public/CUPMWOUU3VH7BAVTUN7S2MSS6Q
38,https://www.infobae.com/teleshow/2021/08/03/dos-participantes-del-team-sole-hicieron-llorar-al-jurado-de-la-voz-argentina-sabia-que-iba-a-sufrir-mucho-hoy/,Dos participantes del Team Sole hicieron llorar al jurado de La Voz Argentina: “Sabía que iba a sufrir mucho hoy”,https://www.infobae.com/teleshow/2021/08/03/dos-participantes-del-team-sole-hicieron-llorar-al-jurado-de-la-voz-argentina-sabia-que-iba-a-sufrir-mucho-hoy/,https://cloudfront-us-east-1.images.arcpublishing.com/infobae/3LFLPDYUZFCCBCZQULMG2GVBTM.png
39,https://www.infobae.com/america/deportes/futbol-europeo/2021/08/03/la-intimidad-de-las-vacaciones-de-la-familia-messi-el-salto-del-argentino-y-su-hijo-desde-un-enorme-yate-y-la-visita-a-una-isla-magica/,La intimidad de las vacaciones de la familia Messi: el video del salto de Leo con Thiago desde un yate y la visita a una isla “mágica”,https://www.infobae.com/america/deportes/futbol-europeo/2021/08/03/la-intimidad-de-las-vacaciones-de-la-familia-messi-el-salto-del-argentino-y-su-hijo-desde-un-enorme-yate-y-la-visita-a-una-isla-magica/,https://cloudfront-us-east-1.images.arcpublishing.com/infobae/EFGWKQSZSFASTLGHILKYIC3XVI.jpg
40,https://www.infobae.com/politica/2021/08/03/gerardo-morales-les-dije-al-presidente-y-a-maximo-kirchner-que-antes-de-indultar-a-milagro-sala-me-peguen-un-tiro-en-la-cabeza/,Gerardo Morales: “Les dije al Presidente y a Máximo Kirchner que antes de indultar a Milagro Sala me peguen un tiro en la cabeza”,https://www.infobae.com/politica/2021/08/03/gerardo-morales-les-dije-al-presidente-y-a-maximo-kirchner-que-antes-de-indultar-a-milagro-sala-me-peguen-un-tiro-en-la-cabeza/,https://cloudfront-us-east-1.images.arcpublishing.com/infobae/SWSIEPF2LZEMLOWQUTIT25D3QI.jpg
41,https://www.infobae.com/politica/2021/08/03/campana-larretista-y-apoyo-de-la-pata-peronista-no-k-la-estrategia-de-los-intendentes-del-pro-para-vencer-a-facundo-manes/,“Campaña larretista” y apoyo de la pata peronista no K: la estrategia de los intendentes del PRO para vencer a Facundo Manes en las PASO,https://www.infobae.com/politica/2021/08/03/campana-larretista-y-apoyo-de-la-pata-peronista-no-k-la-estrategia-de-los-intendentes-del-pro-para-vencer-a-facundo-manes/,https://cloudfront-us-east-1.images.arcpublishing.com/infobae/MUGR6PMZ2FATHGBYHF2JSNG2JQ.jpg
42,https://www.infobae.com/politica/2021/08/03/ruta-del-dinero-k-el-abogado-argentino-residente-en-suiza-senalado-como-testaferro-de-lazaro-baez-nego-conocer-el-origen-ilegal-del-dinero-del-empresario/,"Ruta del dinero K: el abogado argentino residente en Suiza, señalado como testaferro de Lázaro Báez, negó conocer el origen ilegal del dinero del empresario",https://www.infobae.com/politica/2021/08/03/ruta-del-dinero-k-el-abogado-argentino-residente-en-suiza-senalado-como-testaferro-de-lazaro-baez-nego-conocer-el-origen-ilegal-del-dinero-del-empresario/,https://cloudfront-us-east-1.images.arcpublishing.com/infobae/PJOI62WWYVDEBN4JSWW7GNYSIQ.jpg
43,https://www.infobae.com/economia/2021/08/02/el-fmi-aprobo-una-ayuda-extra-por-la-pandemia-la-argentina-recibira-usd-4300-millones-el-23-de-agosto/,El FMI aprobó una ayuda extra por la pandemia: la Argentina recibirá USD 4.300 millones el 23 de agosto,https://www.infobae.com/economia/2021/08/02/el-fmi-aprobo-una-ayuda-extra-por-la-pandemia-la-argentina-recibira-usd-4300-millones-el-23-de-agosto/,https://cloudfront-us-east-1.images.arcpublishing.com/infobae/BRQXZ5HX6NERVPQAKS6FZ5WJAE.jpg
44,https://www.infobae.com/america/mexico/2021/08/03/que-salgan-los-demonios-del-homosexualismo-el-testimonio-de-una-sobreviviente-de-las-terapias-de-conversion-a-la-que-le-practicaron-un-exorcismo/,“Que salgan los demonios del homosexualismo”: el testimonio de una sobreviviente a un exorcismo de las terapias de conversión,https://www.infobae.com/america/mexico/2021/08/03/que-salgan-los-demonios-del-homosexualismo-el-testimonio-de-una-sobreviviente-de-las-terapias-de-conversion-a-la-que-le-practicaron-un-exorcismo/,https://cloudfront-us-east-1.images.arcpublishing.com/infobae/XA6TENKCVRCZZCG4QF6MNFMRAU.jpg
45,https://www.infobae.com/america/tendencias-america/2021/08/03/confirman-que-es-eficaz-y-seguro-combinar-vacunas-contra-el-covid-19-de-astrazeneca-con-pfizer-o-moderna/,Confirman que es eficaz y seguro combinar vacunas contra el COVID-19 de AstraZeneca con Pfizer o Moderna,https://www.infobae.com/america/tendencias-america/2021/08/03/confirman-que-es-eficaz-y-seguro-combinar-vacunas-contra-el-covid-19-de-astrazeneca-con-pfizer-o-moderna/,https://cloudfront-us-east-1.images.arcpublishing.com/infobae/ULM7XXVJ4YHGSFAUZI4JI3IIBE.jpg
46,https://www.infobae.com/america/ciencia-america/2021/08/03/mas-de-2300-adolescentes-con-factores-de-riesgo-ya-se-vacunaron-contra-el-covid-19-en-argentina/,Más de 2.300 adolescentes con factores de riesgo ya se vacunaron contra el COVID-19 en Argentina,https://www.infobae.com/america/ciencia-america/2021/08/03/mas-de-2300-adolescentes-con-factores-de-riesgo-ya-se-vacunaron-contra-el-covid-19-en-argentina/,https://cloudfront-us-east-1.images.arcpublishing.com/infobae/5MXL6RY5DZHSNFSJNU4ZKPNIXI.jpg
47,https://www.infobae.com/america/ciencia-america/2021/08/03/neurociencia-infantil-y-coronavirus-la-pandemia-de-los-cerebros-quietos/,Neurociencia infantil y coronavirus: la pandemia de los “cerebros quietos”,https://www.infobae.com/america/ciencia-america/2021/08/03/neurociencia-infantil-y-coronavirus-la-pandemia-de-los-cerebros-quietos/,https://cloudfront-us-east-1.images.arcpublishing.com/infobae/OMZQJFU275FIVNPYPJHMTZFDDI.jpg
