n,id,title,url,image
1,https://www.infobae.com/america/ciencia-america/2021/07/25/vacunas-y-variantes-que-tan-efectivo-resulta-cada-inoculante-ante-el-abanico-de-mutaciones-que-presenta-el-covid-19/,Vacunas vs variantes: qué tan efectivo resulta cada inoculante ante el abanico de cepas del COVID-19 ,https://www.infobae.com/america/ciencia-america/2021/07/25/vacunas-y-variantes-que-tan-efectivo-resulta-cada-inoculante-ante-el-abanico-de-mutaciones-que-presenta-el-covid-19/,https://cloudfront-us-east-1.images.arcpublishing.com/infobae/EGCFUQ57ZNETZPBCO6VJ3YZVAA.jpg
2,https://www.infobae.com/politica/2021/07/26/nicolas-kreplak-asumira-como-ministro-de-salud-bonaerense-en-reemplazo-de-daniel-gollan/,Nicolás Kreplak asumirá como ministro de Salud bonaerense en reemplazo de Daniel Gollan,https://www.infobae.com/politica/2021/07/26/nicolas-kreplak-asumira-como-ministro-de-salud-bonaerense-en-reemplazo-de-daniel-gollan/,https://cloudfront-us-east-1.images.arcpublishing.com/infobae/6WKGDKJVZRG47G7JPSK3HXWJ3M.jpg
3,https://www.infobae.com/sociedad/2021/07/25/vacaciones-de-invierno-cuales-fueron-las-ciudades-mas-visitadas-de-la-argentina-durante-la-primera-semana/,Vacaciones de invierno: cuáles fueron las ciudades más visitadas de la Argentina durante la primera semana,https://www.infobae.com/sociedad/2021/07/25/vacaciones-de-invierno-cuales-fueron-las-ciudades-mas-visitadas-de-la-argentina-durante-la-primera-semana/,https://arc-anglerfish-arc2-prod-infobae.s3.amazonaws.com/public/H3XZZNOGL5EH7BJ247EABYY5WI
4,https://www.infobae.com/politica/2021/07/25/elecciones-legislativas-quienes-son-los-ganadores-y-los-perdedores-del-cierre-de-listas/,Elecciones legislativas: quiénes son los ganadores y los perdedores del cierre de listas,https://www.infobae.com/politica/2021/07/25/elecciones-legislativas-quienes-son-los-ganadores-y-los-perdedores-del-cierre-de-listas/,https://cloudfront-us-east-1.images.arcpublishing.com/infobae/MXIV4AEW4BFEPIYYA6R4TTGGLQ.jpg
5,https://www.infobae.com/politica/2021/07/25/duro-cruce-de-la-jueza-maria-servini-con-la-camara-electoral-por-las-reglas-para-designar-a-las-autoridades-de-mesa/,Duro cruce de la jueza María Servini con la Cámara Electoral por las reglas para designar a las autoridades de mesa,https://www.infobae.com/politica/2021/07/25/duro-cruce-de-la-jueza-maria-servini-con-la-camara-electoral-por-las-reglas-para-designar-a-las-autoridades-de-mesa/,https://cloudfront-us-east-1.images.arcpublishing.com/infobae/LH4RQFKFTBCJPFGPTFRAEINDJY.jpg
6,https://www.infobae.com/deportes/2021/07/25/river-plate-buscara-ante-union-su-primer-triunfo-en-la-liga-profesional-hora-tv-y-formaciones/,River Plate goleó 4-0 a Unión en el Monumental y logró su primer triunfo en la Copa de la Liga Profesional ,https://www.infobae.com/deportes/2021/07/25/river-plate-buscara-ante-union-su-primer-triunfo-en-la-liga-profesional-hora-tv-y-formaciones/,https://cloudfront-us-east-1.images.arcpublishing.com/infobae/5VKXZWKT2BDMLBIBUJQVZLDY7A.jpg
7,https://www.infobae.com/america/deportes/juegos-olimpicos/2021/07/26/la-historia-de-delfina-pignatiello-la-esperanza-de-la-natacion-que-penso-en-el-retiro-y-se-convirtio-en-influencer-de-su-generacion/,"La historia de Delfina Pignatiello, la esperanza de la natación que pensó en el retiro y se convirtió en influencer de su generación",https://www.infobae.com/america/deportes/juegos-olimpicos/2021/07/26/la-historia-de-delfina-pignatiello-la-esperanza-de-la-natacion-que-penso-en-el-retiro-y-se-convirtio-en-influencer-de-su-generacion/,https://cloudfront-us-east-1.images.arcpublishing.com/infobae/54O45TSLMBBODMEQDSTQ7CTXXM.jpg
8,https://www.infobae.com/america/deportes/2021/07/26/el-album-completo-de-las-vacaciones-de-los-messi-en-miami-y-republica-dominicana/,El álbum completo de las vacaciones de los Messi en Miami y República Dominicana,https://www.infobae.com/america/deportes/2021/07/26/el-album-completo-de-las-vacaciones-de-los-messi-en-miami-y-republica-dominicana/,https://cloudfront-us-east-1.images.arcpublishing.com/infobae/IKSLMGXOWNHHBFV644QLB6E2LI.png
9,https://www.infobae.com/deportes/juegos-olimpicos/2021/07/26/amor-olimpico-el-momento-en-el-que-el-entrenador-de-belen-perez-maurice-le-propuso-casamiento-a-la-esgrimista-tras-quedar-eliminada-de-tokio-2020/,Amor olímpico: el momento en el que el entrenador de Belén Pérez Maurice le propuso casamiento a la esgrimista tras quedar eliminada de Tokio 2020,https://www.infobae.com/deportes/juegos-olimpicos/2021/07/26/amor-olimpico-el-momento-en-el-que-el-entrenador-de-belen-perez-maurice-le-propuso-casamiento-a-la-esgrimista-tras-quedar-eliminada-de-tokio-2020/,https://cloudfront-us-east-1.images.arcpublishing.com/infobae/RXYCAI2X7NCJZGJE7PT2Y6GIKA.jpg
10,https://www.infobae.com/teleshow/2021/07/26/un-participante-de-la-voz-argentina-confeso-tener-problemas-para-distinguir-a-mau-y-ricky-lo-estuve-averiguando/,Un participante de La Voz Argentina confesó tener problemas para distinguir a Mau y Ricky: “Lo estuve averiguando”,https://www.infobae.com/teleshow/2021/07/26/un-participante-de-la-voz-argentina-confeso-tener-problemas-para-distinguir-a-mau-y-ricky-lo-estuve-averiguando/,https://cloudfront-us-east-1.images.arcpublishing.com/infobae/IF46BYIPJ5CC5CC24NLY6WDTJI.jpg
11,https://www.infobae.com/america/deportes/juegos-olimpicos/2021/07/25/agenda-de-los-juegos-olimpicos-dia-3-pignatiello-la-seleccion-de-basquet-y-el-clasico-con-brasil-en-voley-se-robaran-las-miradas/,"Agenda de los Juegos Olímpicos, día 3: A la espera de Pignatiello y la selección de básquet, Los Pumas 7 derrotaron a Australia y Podoroska se mide con Aleksandrova",https://www.infobae.com/america/deportes/juegos-olimpicos/2021/07/25/agenda-de-los-juegos-olimpicos-dia-3-pignatiello-la-seleccion-de-basquet-y-el-clasico-con-brasil-en-voley-se-robaran-las-miradas/,https://cloudfront-us-east-1.images.arcpublishing.com/infobae/IJHLUHDTTFGX7KHG5KNHXUZZBU.jpg
12,https://www.infobae.com/teleshow/2021/07/26/gloria-carra-recordo-un-hecho-aberrante-que-vivio-en-la-epoca-que-hacia-senorita-maestra-para-mi-fue-re-violento/,Gloria Carrá recordó un hecho aberrante que vivió en la época que hacía Señorita Maestra: “Para mí fue re violento”,https://www.infobae.com/teleshow/2021/07/26/gloria-carra-recordo-un-hecho-aberrante-que-vivio-en-la-epoca-que-hacia-senorita-maestra-para-mi-fue-re-violento/,https://cloudfront-us-east-1.images.arcpublishing.com/infobae/KUKT4LA4HJBETNKGFWXCSJCMVQ.png
13,https://www.infobae.com/politica/2021/07/25/manana-abrira-la-inscripcion-para-que-se-vacunen-chicos-de-12-en-la-provincia-los-padres-tendran-que-firmar-una-declaracion-jurada/,Esta semana abrirá la inscripción para que se vacunen chicos de 12 años en la Provincia: los padres tendrán que firmar una declaración jurada ,https://www.infobae.com/politica/2021/07/25/manana-abrira-la-inscripcion-para-que-se-vacunen-chicos-de-12-en-la-provincia-los-padres-tendran-que-firmar-una-declaracion-jurada/,https://cloudfront-us-east-1.images.arcpublishing.com/infobae/AB3YNM3GJFH3RA5BFE4DNIZ2GQ.jpg
14,https://www.infobae.com/politica/2021/07/26/el-fuerte-cruce-entre-jose-luis-espert-y-guillermo-moreno-preso-deberias-estar-vos/,Fuerte cruce entre José Luis Espert y Guillermo Moreno: “Preso deberías estar vos”,https://www.infobae.com/politica/2021/07/26/el-fuerte-cruce-entre-jose-luis-espert-y-guillermo-moreno-preso-deberias-estar-vos/,https://cloudfront-us-east-1.images.arcpublishing.com/infobae/ISHCKHE6D5AO5LFO3BM5KBEMXI.jpg
15,https://www.infobae.com/teleshow/2021/07/26/las-lagrimas-de-chiche-gelblung-al-recordar-la-intuicion-de-su-mama-me-pusieron-una-bomba-en-mi-casa-y-me-llamo-a-los-dos-minutos/,Las lágrimas de Chiche Gelblung al recordar la intuición de su mamá: “Me pusieron una bomba en mi casa y me llamó a los dos minutos”,https://www.infobae.com/teleshow/2021/07/26/las-lagrimas-de-chiche-gelblung-al-recordar-la-intuicion-de-su-mama-me-pusieron-una-bomba-en-mi-casa-y-me-llamo-a-los-dos-minutos/,https://cloudfront-us-east-1.images.arcpublishing.com/infobae/3BV24NZBIZHLJAWM5KKFYIDSW4.png
16,https://www.infobae.com/deportes/2021/07/25/dolor-en-el-automovilismo-murio-agustina-di-palma-hija-de-patricio-y-nieta-del-recordado-luis-ruben/,"Dolor en el automovilismo: murió Agustina Di Palma, hija de Patricio y nieta del recordado Luis Rubén ",https://www.infobae.com/deportes/2021/07/25/dolor-en-el-automovilismo-murio-agustina-di-palma-hija-de-patricio-y-nieta-del-recordado-luis-ruben/,https://cloudfront-us-east-1.images.arcpublishing.com/infobae/MOS2MCQJ5VD7ZFAXRAMNGH5H5E.jpg
17,https://www.infobae.com/politica/2021/07/25/victoria-tolosa-paz-soy-de-la-ciudad-de-la-plata-la-que-aspiro-a-gobernar-en-2023/,"Victoria Tolosa Paz: “Soy de la ciudad de La Plata, la que aspiro a gobernar en 2023”",https://www.infobae.com/politica/2021/07/25/victoria-tolosa-paz-soy-de-la-ciudad-de-la-plata-la-que-aspiro-a-gobernar-en-2023/,https://cloudfront-us-east-1.images.arcpublishing.com/infobae/BRR2MPI5H5ANTJGSCAHNOVAFUQ.jpg
18,https://www.infobae.com/deportes/2021/07/25/un-chanfle-perfecto-y-el-taco-para-asistir-en-el-gol-de-la-fecha-las-dos-perlas-de-matias-suarez-en-la-victoria-de-river-ante-union/,Un chanfle perfecto y el taco para asistir en el gol de la fecha: las dos perlas de Matías Suárez en la victoria de River ante Unión  ,https://www.infobae.com/deportes/2021/07/25/un-chanfle-perfecto-y-el-taco-para-asistir-en-el-gol-de-la-fecha-las-dos-perlas-de-matias-suarez-en-la-victoria-de-river-ante-union/,https://cloudfront-us-east-1.images.arcpublishing.com/infobae/RSFN2AOGZA7KNWN7H3VNXF2MKQ.jpg
19,https://www.infobae.com/deportes/2021/07/25/el-doble-fuera-de-juego-por-el-que-debio-haberse-anulado-el-primer-gol-de-river-plate-ante-union/,El doble fuera de juego por el que debió haberse anulado el primer gol de River Plate ante Unión,https://www.infobae.com/deportes/2021/07/25/el-doble-fuera-de-juego-por-el-que-debio-haberse-anulado-el-primer-gol-de-river-plate-ante-union/,https://cloudfront-us-east-1.images.arcpublishing.com/infobae/ZYS4A7XLKJEFBFNSODQIFUG4CI.jpg
20,https://www.infobae.com/deportes/2021/07/26/el-golazo-de-matias-suarez-el-buen-momento-de-zuculini-y-el-nivel-de-river-plate-11-frases-de-marcelo-gallardo/,"El golazo de Matías Suárez, el buen momento de Zuculini y el nivel de River Plate: 11 frases de Marcelo Gallardo",https://www.infobae.com/deportes/2021/07/26/el-golazo-de-matias-suarez-el-buen-momento-de-zuculini-y-el-nivel-de-river-plate-11-frases-de-marcelo-gallardo/,https://cloudfront-us-east-1.images.arcpublishing.com/infobae/KJ7IMHJSCBEZXFYHZASXNHVD2U.jpg
21,https://www.infobae.com/america/mundo/2021/07/25/israel-ataco-una-base-militar-del-grupo-terrorista-hamas-en-respuesta-al-lanzamiento-de-globos-incendiarios-desde-gaza/,Israel atacó una base militar del grupo terrorista Hamas en respuesta al lanzamiento de globos incendiarios desde Gaza,https://www.infobae.com/america/mundo/2021/07/25/israel-ataco-una-base-militar-del-grupo-terrorista-hamas-en-respuesta-al-lanzamiento-de-globos-incendiarios-desde-gaza/,https://cloudfront-us-east-1.images.arcpublishing.com/infobae/6L4SYMZJANHFOPFKEU2S2LYROY.jpg
22,https://www.infobae.com/america/fotos/2021/07/25/putin-desafio-a-occidente-con-una-imponente-desfile-naval-en-san-petersburgo-la-armada-rusa-puede-dar-un-golpe-militar-a-cualquier-adversario/,Putin desafió a Occidente con un imponente desfile naval en San Petersburgo: “La Armada rusa puede dar un golpe militar a cualquier adversario” ,https://www.infobae.com/america/fotos/2021/07/25/putin-desafio-a-occidente-con-una-imponente-desfile-naval-en-san-petersburgo-la-armada-rusa-puede-dar-un-golpe-militar-a-cualquier-adversario/,https://cloudfront-us-east-1.images.arcpublishing.com/infobae/3NOCICCNMFCRBNH6PBUD5REVQU.jpg
23,https://www.infobae.com/teleshow/2021/07/26/dani-la-chepi-conto-como-hizo-para-superar-su-adiccion-al-alcohol-no-me-gustaba-lo-que-veia-en-el-espejo/,Dani La Chepi contó cómo hizo para superar su adicción al alcohol: “No me gustaba lo que veía en el espejo”,https://www.infobae.com/teleshow/2021/07/26/dani-la-chepi-conto-como-hizo-para-superar-su-adiccion-al-alcohol-no-me-gustaba-lo-que-veia-en-el-espejo/,https://cloudfront-us-east-1.images.arcpublishing.com/infobae/OXSU4RNE2RBJBCMMNNEKIJYMKQ.png
24,https://www.infobae.com/teleshow/2021/07/25/cande-tinelli-hablo-de-la-salud-de-su-mama-no-puedo-negar-que-estoy-triste-es-como-que-se-detiene-el-tiempo/,"Cande Tinelli habló de la salud de su mamá: “No puedo negar que estoy triste, es como que se detiene el tiempo”",https://www.infobae.com/teleshow/2021/07/25/cande-tinelli-hablo-de-la-salud-de-su-mama-no-puedo-negar-que-estoy-triste-es-como-que-se-detiene-el-tiempo/,https://cloudfront-us-east-1.images.arcpublishing.com/infobae/AKIZMOCP7BBODEDREUGAD34BZY.png
25,https://www.infobae.com/teleshow/2021/07/25/daniela-lopilato-furiosa-por-una-agresion-que-recibio-en-las-redes-por-personas-como-estas-abundan-los-trastornos-alimentarios/,Daniela Lopilato furiosa por una agresión que recibió en las redes: “Por personas como éstas abundan los trastornos alimentarios”,https://www.infobae.com/teleshow/2021/07/25/daniela-lopilato-furiosa-por-una-agresion-que-recibio-en-las-redes-por-personas-como-estas-abundan-los-trastornos-alimentarios/,https://cloudfront-us-east-1.images.arcpublishing.com/infobae/BLSGOGP5ARAHBO3VT6QGCICPHA.jpg
26,https://www.infobae.com/deportes/juegos-olimpicos/2021/07/26/los-pumas-7-sorprendieron-a-australia-y-lograron-un-importante-triunfo-en-su-debut-en-el-grupo-de-la-muerte-de-los-juegos-olimpicos/,Los Pumas 7 sorprendieron a Australia y lograron un importante triunfo en su debut en el Grupo de la Muerte de los Juegos Olímpicos,https://www.infobae.com/deportes/juegos-olimpicos/2021/07/26/los-pumas-7-sorprendieron-a-australia-y-lograron-un-importante-triunfo-en-su-debut-en-el-grupo-de-la-muerte-de-los-juegos-olimpicos/,https://cloudfront-us-east-1.images.arcpublishing.com/infobae/NQJ2B3JB65GQTE7FTKW32AEJJA.jpg
27,https://www.infobae.com/opinion/2021/07/25/es-la-politica-idiota-generaron-en-la-ultima-decada-1500-por-ciento-de-inflacion-y-millones-de-pobres/,"Es la política, idiota: generaron en la última década 1.500 por ciento de inflación y millones de pobres",https://www.infobae.com/opinion/2021/07/25/es-la-politica-idiota-generaron-en-la-ultima-decada-1500-por-ciento-de-inflacion-y-millones-de-pobres/,https://cloudfront-us-east-1.images.arcpublishing.com/infobae/4747R2GRWZEYZNZVV2VLUPMVJ4.jpg
28,https://www.infobae.com/sociedad/2021/07/25/video-impresionante-incendio-de-un-auto-a-metros-de-una-estacion-de-servicio/,Video: impresionante incendio de un auto a metros de una estación de servicio,https://www.infobae.com/sociedad/2021/07/25/video-impresionante-incendio-de-un-auto-a-metros-de-una-estacion-de-servicio/,https://cloudfront-us-east-1.images.arcpublishing.com/infobae/WKMYH2VONFA2JO6LOGDRRRCSYQ.jpg
29,https://www.infobae.com/deportes/2021/07/26/boca-volvio-a-pedir-la-postergacion-del-partido-ante-san-lorenzo-cual-seria-la-respuesta-de-la-liga-profesional/,Boca volvió a pedir la postergación del partido ante San Lorenzo: cuál sería la respuesta de la Liga Profesional,https://www.infobae.com/deportes/2021/07/26/boca-volvio-a-pedir-la-postergacion-del-partido-ante-san-lorenzo-cual-seria-la-respuesta-de-la-liga-profesional/,https://cloudfront-us-east-1.images.arcpublishing.com/infobae/PEGL2IM3XFCVJFNPINJBU74ZCA.JPG
30,https://www.infobae.com/politica/2021/07/25/daniel-gollan-afirmo-que-no-renunciara-a-su-cargo-de-ministro-hasta-las-elecciones-todavia-estamos-con-el-manejo-de-la-pandemia/,Daniel Gollan afirmó que no renunciará a su cargo de ministro hasta las elecciones: “Todavía estamos con el manejo de la pandemia”,https://www.infobae.com/politica/2021/07/25/daniel-gollan-afirmo-que-no-renunciara-a-su-cargo-de-ministro-hasta-las-elecciones-todavia-estamos-con-el-manejo-de-la-pandemia/,https://cloudfront-us-east-1.images.arcpublishing.com/infobae/XAXPX7QL4VH6HJ3TE6DNWBJH7M.jpg
31,https://www.infobae.com/politica/2021/07/25/maria-eugenia-vidal-critico-la-candidatura-de-daniel-gollan-el-equipo-de-salud-tiene-que-estar-con-la-gente-la-pandemia-no-termino/,"María Eugenia Vidal criticó la candidatura de Daniel Gollan: “El equipo de salud tiene que estar con la gente, la pandemia no terminó”",https://www.infobae.com/politica/2021/07/25/maria-eugenia-vidal-critico-la-candidatura-de-daniel-gollan-el-equipo-de-salud-tiene-que-estar-con-la-gente-la-pandemia-no-termino/,https://cloudfront-us-east-1.images.arcpublishing.com/infobae/BGLCEYF3FBGSVOXRX25OS2YMYA.jpg
32,https://www.infobae.com/opinion/2021/07/25/cristina-kirchner-lanzo-la-campana-del-frente-de-todos-con-un-guino-al-fmi-mientras-la-oposicion-acapara-la-centralidad/,Cristina Kirchner lanzó la campaña del Frente de Todos con un guiño al FMI mientras la oposición acapara la centralidad,https://www.infobae.com/opinion/2021/07/25/cristina-kirchner-lanzo-la-campana-del-frente-de-todos-con-un-guino-al-fmi-mientras-la-oposicion-acapara-la-centralidad/,https://cloudfront-us-east-1.images.arcpublishing.com/infobae/BYJQGXVVEFAJHKVN3YZXITG36U.jpg
33,https://www.infobae.com/politica/2021/07/25/cierre-de-listas-con-reemplazos-en-los-gabinetes-los-cambios-que-se-realizaron-en-los-gobiernos-de-nacion-provincia-y-caba/,"Cierre de listas con reemplazos en los gabinetes: los cambios que se realizaron en los gobiernos de Nación, provincia y ciudad de Buenos Aires",https://www.infobae.com/politica/2021/07/25/cierre-de-listas-con-reemplazos-en-los-gabinetes-los-cambios-que-se-realizaron-en-los-gobiernos-de-nacion-provincia-y-caba/,https://cloudfront-us-east-1.images.arcpublishing.com/infobae/65VQTGWO6BBQFGXSEDEAJ2DUPM.jpg
34,https://www.infobae.com/politica/2021/07/25/detras-de-escena-del-cierre-de-listas-del-frente-de-todos-entre-las-firmas-en-casa-rosada-y-un-acto-de-unidad-en-la-provincia-organizado-a-contrarreloj/,"Detrás de escena del cierre de listas del Frente de Todos, entre las firmas en Casa Rosada  y un acto “de unidad” en la Provincia organizado contrarreloj",https://www.infobae.com/politica/2021/07/25/detras-de-escena-del-cierre-de-listas-del-frente-de-todos-entre-las-firmas-en-casa-rosada-y-un-acto-de-unidad-en-la-provincia-organizado-a-contrarreloj/,https://cloudfront-us-east-1.images.arcpublishing.com/infobae/VC5BFMQ6XRDUBJQ3SW5UPBWZNU.jpg
35,https://www.infobae.com/politica/2021/07/25/euforia-contenida-en-juntos-por-el-cambio-como-hizo-rodriguez-larreta-para-conformar-a-casi-todos-en-las-listas-y-por-que-los-radicales-se-rebelaron-contra-el-pro/,Euforia contenida en Juntos por el Cambio: cómo hizo Rodríguez Larreta para conformar a casi todos en las listas y por qué los radicales se rebelaron contra el PRO,https://www.infobae.com/politica/2021/07/25/euforia-contenida-en-juntos-por-el-cambio-como-hizo-rodriguez-larreta-para-conformar-a-casi-todos-en-las-listas-y-por-que-los-radicales-se-rebelaron-contra-el-pro/,https://cloudfront-us-east-1.images.arcpublishing.com/infobae/N5BSVXXF6JGPPN75R6235PHYBU.jpg
36,https://www.infobae.com/america/deportes/juegos-olimpicos/2021/07/25/insolita-decision-del-var-en-los-juegos-olimpicos-echaron-a-un-jugador-de-brasil-que-ni-siquiera-cometio-infraccion/,Insólita decisión del VAR en los Juegos Olímpicos: echaron a un jugador de Brasil que ni siquiera cometió infracción,https://www.infobae.com/america/deportes/juegos-olimpicos/2021/07/25/insolita-decision-del-var-en-los-juegos-olimpicos-echaron-a-un-jugador-de-brasil-que-ni-siquiera-cometio-infraccion/,https://cloudfront-us-east-1.images.arcpublishing.com/infobae/MJAAP44OOBGZ3JBLQWKKGT3GI4
37,https://www.infobae.com/america/deportes/juegos-olimpicos/2021/07/26/asi-fue-la-batalla-mas-vertiginosa-que-definio-una-medalla-de-oro-en-taekwondo-el-vigente-campeon-mundial-cayo-derrotado-en-los-ultimos-8-segundos/,Así fue la batalla más vertiginosa que definió una medalla de oro en taekwondo: el vigente campeón mundial cayó derrotado en los últimos 8 segundos,https://www.infobae.com/america/deportes/juegos-olimpicos/2021/07/26/asi-fue-la-batalla-mas-vertiginosa-que-definio-una-medalla-de-oro-en-taekwondo-el-vigente-campeon-mundial-cayo-derrotado-en-los-ultimos-8-segundos/,https://cloudfront-us-east-1.images.arcpublishing.com/infobae/CFWWHYASS4EKEJD6XG4JG23UYQ.jpg
38,https://www.infobae.com/deportes/juegos-olimpicos/2021/07/25/argentina-va-por-la-recuperacion-ante-egipto-en-el-futbol-masculino-de-los-juegos-olimpicos-hora-tv-y-formaciones/,Argentina venció 1-0 a Egipto y sumó tres puntos vitales en su grupo de los Juegos Olímpicos,https://www.infobae.com/deportes/juegos-olimpicos/2021/07/25/argentina-va-por-la-recuperacion-ante-egipto-en-el-futbol-masculino-de-los-juegos-olimpicos-hora-tv-y-formaciones/,https://cloudfront-us-east-1.images.arcpublishing.com/infobae/YRGP36IEOZSOTE2UKFQE3T2RDA.jpg
39,https://www.infobae.com/america/deportes/juegos-olimpicos/2021/07/25/increible-momento-en-los-juegos-olimpicos-un-levantador-de-pesas-gano-el-oro-con-una-tecnica-nunca-antes-vista/,Increíble momento en los Juegos Olímpicos: un levantador de pesas ganó el oro con una técnica nunca antes vista,https://www.infobae.com/america/deportes/juegos-olimpicos/2021/07/25/increible-momento-en-los-juegos-olimpicos-un-levantador-de-pesas-gano-el-oro-con-una-tecnica-nunca-antes-vista/,https://cloudfront-us-east-1.images.arcpublishing.com/infobae/6RG2KYJ43JCFPLCJ6ODLC3GXOY.jpg
40,https://www.infobae.com/deportes/2021/07/26/conmovedor-cierre-en-triatlon-gano-el-oro-en-tokio-pero-se-descompenso-por-el-esfuerzo-tras-cruzar-la-meta-y-tuvo-que-ser-asistido/,"Conmovedor cierre en triatlón: ganó el oro en Tokio, pero se descompensó por el esfuerzo tras cruzar la meta y tuvo que ser asistido",https://www.infobae.com/deportes/2021/07/26/conmovedor-cierre-en-triatlon-gano-el-oro-en-tokio-pero-se-descompenso-por-el-esfuerzo-tras-cruzar-la-meta-y-tuvo-que-ser-asistido/,https://cloudfront-us-east-1.images.arcpublishing.com/infobae/EQBM3HVIVSKQULTPRRYGWK2GFY.jpg
41,https://www.infobae.com/sociedad/2021/07/25/entrevista-a-loyds-creci-en-una-familia-acomodada-pero-deje-todo-para-ser-escritor-elegi-ser-pobre/,"Entrevista a Loyds: “Crecí en una familia acomodada, pero dejé todo para ser escritor, ¡elegí ser pobre!”",https://www.infobae.com/sociedad/2021/07/25/entrevista-a-loyds-creci-en-una-familia-acomodada-pero-deje-todo-para-ser-escritor-elegi-ser-pobre/,https://cloudfront-us-east-1.images.arcpublishing.com/infobae/ZVNTGPPWZNHO5JFGIX2DUMQOPY.JPG
42,https://www.infobae.com/sociedad/2021/07/25/la-mama-de-johnny-anticipo-de-la-novela-de-loyds/,"“La mamá de Johnny”, anticipo de la novela de Loyds",https://www.infobae.com/sociedad/2021/07/25/la-mama-de-johnny-anticipo-de-la-novela-de-loyds/,https://cloudfront-us-east-1.images.arcpublishing.com/infobae/DKVU6CBS6VDKXBMA65PEHJVPZY.jpg
43,https://www.infobae.com/deportes/2021/07/25/defensa-godoy-cruz-patronato-sarmiento-rosario-central-velez-y-estudiantes-independiente-le-daran-continuidad-a-la-segunda-fecha-del-torneo-argentino-hora-tv-y-formaciones/,Independiente le ganó 1-0 como visitante a Estudiantes por la segunda fecha de la Liga Profesional,https://www.infobae.com/deportes/2021/07/25/defensa-godoy-cruz-patronato-sarmiento-rosario-central-velez-y-estudiantes-independiente-le-daran-continuidad-a-la-segunda-fecha-del-torneo-argentino-hora-tv-y-formaciones/,https://cloudfront-us-east-1.images.arcpublishing.com/infobae/BEIBXUMCERAAHOZBNDTPKEJMDE.jpg
44,https://www.infobae.com/economia/2021/07/25/el-activo-mas-importante-de-elon-musk-por-que-el-valor-marca-de-tesla-aumento-275-el-ultimo-ano/,El activo más importante de Elon Musk: por qué el valor-marca de Tesla aumentó 275% el último año,https://www.infobae.com/economia/2021/07/25/el-activo-mas-importante-de-elon-musk-por-que-el-valor-marca-de-tesla-aumento-275-el-ultimo-ano/,https://cloudfront-us-east-1.images.arcpublishing.com/infobae/KW5DEVBYB6PWF447FEMWOIG3QY.jpg
45,https://www.infobae.com/historias/2021/07/25/la-novedad-de-la-bomba-atomica-y-el-engano-de-stalin-a-truman-y-churchill-asi-fue-el-comienzo-de-la-guerra-fria/,La novedad de la bomba atómica y el engaño de Stalin a Truman y Churchill: así fue el comienzo de la Guerra Fría,https://www.infobae.com/historias/2021/07/25/la-novedad-de-la-bomba-atomica-y-el-engano-de-stalin-a-truman-y-churchill-asi-fue-el-comienzo-de-la-guerra-fria/,https://cloudfront-us-east-1.images.arcpublishing.com/infobae/MSDIOPUAXVD4LPDRWGBKDUIJ2E.jpg
46,https://www.infobae.com/opinion/2021/07/25/poner-plata-en-el-bolsillo-de-la-gente-genera-demanda-de-dolares-que-no-hay/,Poner plata en el bolsillo de la gente genera demanda de dólares que no hay,https://www.infobae.com/opinion/2021/07/25/poner-plata-en-el-bolsillo-de-la-gente-genera-demanda-de-dolares-que-no-hay/,https://cloudfront-us-east-1.images.arcpublishing.com/infobae/W3DS6KMDEJDOPDB6N6RXU4SKYA
47,https://www.infobae.com/america/mexico/2021/07/25/la-oscura-decada-de-los-zetas-auge-y-caida-del-cartel-mas-despiadado-de-la-historia/,La oscura década de los Zetas: auge y caída del cártel más despiadado de la historia,https://www.infobae.com/america/mexico/2021/07/25/la-oscura-decada-de-los-zetas-auge-y-caida-del-cartel-mas-despiadado-de-la-historia/,https://cloudfront-us-east-1.images.arcpublishing.com/infobae/WVLZAGB2YVH6PN4XSW6GZZUBHE.jpg
48,https://www.infobae.com/america/america-latina/2021/07/25/el-cantautor-pablo-milanes-condeno-la-represion-del-regimen-cubano-es-irresponsable-y-absurda/,El cantautor Pablo Milanés condenó la represión del régimen cubano: “Es irresponsable y absurda”,https://www.infobae.com/america/america-latina/2021/07/25/el-cantautor-pablo-milanes-condeno-la-represion-del-regimen-cubano-es-irresponsable-y-absurda/,https://cloudfront-us-east-1.images.arcpublishing.com/infobae/LJ33ARS25VEGLEBSDILSYJOSZQ.jpg
