n,id,title,url,image
103,https://www.infobae.com/america/entretenimiento/2021/04/08/lo-que-quiero-compartir-es-mi-eleccion-la-contundente-respuesta-de-khloe-kardashian-ante-la-foto-de-ella-en-bikini-y-sin-retocar/,“Lo que quiero compartir es mi elección”: la contundente respuesta de Khloé Kardashian ante la foto de ella en bikini y sin retocar,https://www.infobae.com/america/entretenimiento/2021/04/08/lo-que-quiero-compartir-es-mi-eleccion-la-contundente-respuesta-de-khloe-kardashian-ante-la-foto-de-ella-en-bikini-y-sin-retocar/,https://cloudfront-us-east-1.images.arcpublishing.com/infobae/CSMX2CADVNEXHA6MZWKBFIFZFY.jpg
104,https://www.infobae.com/america/deportes/2021/04/08/se-posterga-el-comienzo-de-roland-garros-debido-a-la-crisis-sanitaria-que-atraviesa-francia/,Se posterga el comienzo de Roland Garros debido a la crisis sanitaria que atraviesa Francia,https://www.infobae.com/america/deportes/2021/04/08/se-posterga-el-comienzo-de-roland-garros-debido-a-la-crisis-sanitaria-que-atraviesa-francia/,https://cloudfront-us-east-1.images.arcpublishing.com/infobae/55YSGFTQNBG23P4QVIPKRMPHXQ.jpg
105,https://www.infobae.com/america/deportes/2021/04/08/joe-conforte-de-taxista-a-rey-de-los-burdeles-su-rol-en-el-crimen-de-ringo-bonavena-viajes-a-argentina-con-identidades-falsas-y-el-final-como-profugo-vip-en-brasil/,"Joe Conforte, de taxista a rey de los burdeles: su rol en el crimen de Ringo Bonavena, viajes a Argentina con identidades falsas y el final como prófugo VIP en Brasil",https://www.infobae.com/america/deportes/2021/04/08/joe-conforte-de-taxista-a-rey-de-los-burdeles-su-rol-en-el-crimen-de-ringo-bonavena-viajes-a-argentina-con-identidades-falsas-y-el-final-como-profugo-vip-en-brasil/,https://cloudfront-us-east-1.images.arcpublishing.com/infobae/OY67KNA2WNDKLFHPXVPQQX6B4I.jpg
106,https://www.infobae.com/america/deportes/espn/2021/04/08/del-gran-elogio-de-popovich-a-la-lujosa-asistencia-para-green-campazzo-fue-titular-en-el-triunfo-de-denver-nuggets-ante-san-antonio-spurs/,Del gran elogio de Popovich a la lujosa asistencia para Green: Campazzo fue titular en el triunfo de Denver Nuggets ante San Antonio Spurs,https://www.infobae.com/america/deportes/espn/2021/04/08/del-gran-elogio-de-popovich-a-la-lujosa-asistencia-para-green-campazzo-fue-titular-en-el-triunfo-de-denver-nuggets-ante-san-antonio-spurs/,https://cloudfront-us-east-1.images.arcpublishing.com/infobae/AA4MINW24ZHNFEAEIU4TSO6O24
107,https://www.infobae.com/america/deportes/2021/04/08/america-doblego-a-olimpia-y-se-llevo-la-ida-de-los-octavos-de-final-de-la-concachampions/,América doblegó a Olimpia y se llevó la ida de los Octavos de Final de la Concachampions ,https://www.infobae.com/america/deportes/2021/04/08/america-doblego-a-olimpia-y-se-llevo-la-ida-de-los-octavos-de-final-de-la-concachampions/,https://cloudfront-us-east-1.images.arcpublishing.com/infobae/PCWUIXRTJJFMVB6O4QNIATM33I.jfif
108,https://www.infobae.com/america/deportes/espn/2021/04/08/este-es-el-documental-que-revelara-las-amenazas-y-desfalcos-dentro-de-la-cooperativa-cruz-azul/,Este es el documental que revelará las amenazas y desfalcos dentro de la Cooperativa Cruz Azul,https://www.infobae.com/america/deportes/espn/2021/04/08/este-es-el-documental-que-revelara-las-amenazas-y-desfalcos-dentro-de-la-cooperativa-cruz-azul/,https://cloudfront-us-east-1.images.arcpublishing.com/infobae/ZK3Q65HURJFSLLV4P53ONDPNUM.jpg
