n,id,title,url,image
1,https://www.infobae.com/educacion/2021/07/20/el-gobierno-bonaerense-proyecta-que-todos-los-municipios-retomen-la-presencialidad-en-las-aulas-tras-el-receso-escolar-pero-no-flexibilizara-el-protocolo/,"El gobierno bonaerense proyecta que todos los municipios retomen la presencialidad en las aulas tras el receso escolar, pero no flexibilizará el protocolo",https://www.infobae.com/educacion/2021/07/20/el-gobierno-bonaerense-proyecta-que-todos-los-municipios-retomen-la-presencialidad-en-las-aulas-tras-el-receso-escolar-pero-no-flexibilizara-el-protocolo/,https://cloudfront-us-east-1.images.arcpublishing.com/infobae/IVKLYKBZERGNFHFUFZS6RLIZEU.jpg
2,https://www.infobae.com/politica/2021/07/20/larreta-teme-una-fuga-de-votos-hacia-el-radicalismo-disidente-y-busca-que-se-baje-la-lista-en-la-ciudad-de-buenos-aires/,Larreta teme una fuga de votos hacia el radicalismo disidente y busca que se baje la lista porteña impulsada por Luis Brandoni,https://www.infobae.com/politica/2021/07/20/larreta-teme-una-fuga-de-votos-hacia-el-radicalismo-disidente-y-busca-que-se-baje-la-lista-en-la-ciudad-de-buenos-aires/,https://cloudfront-us-east-1.images.arcpublishing.com/infobae/WRH27GKN5NG3TIWFVKQFCF3RDE
3,https://www.infobae.com/america/eeuu/2021/07/20/en-vivo-jeff-bezos-viaja-al-espacio-con-su-nave-new-shepard/,Histórico: Jeff Bezos realizó con éxito el primer vuelo al espacio con la nave New Shepard,https://www.infobae.com/america/eeuu/2021/07/20/en-vivo-jeff-bezos-viaja-al-espacio-con-su-nave-new-shepard/,https://cloudfront-us-east-1.images.arcpublishing.com/infobae/WI3PXZ4SZFGHNEJDL7DEGIWQWI.jpg
4,https://www.infobae.com/economia/2021/07/20/dolar-hoy-la-cotizacion-libre-sigue-a-180-y-se-mantiene-en-su-mayor-nivel-desde-octubre-pasado/,Dólar hoy: la cotización libre sube a $182 y marca otro récord en lo que va del año,https://www.infobae.com/economia/2021/07/20/dolar-hoy-la-cotizacion-libre-sigue-a-180-y-se-mantiene-en-su-mayor-nivel-desde-octubre-pasado/,https://cloudfront-us-east-1.images.arcpublishing.com/infobae/EU7ASIESANFTBOZ54VYV67TVHQ.jpg
5,https://www.infobae.com/politica/2021/07/20/covid-19-por-que-argentina-sigue-teniendo-400-muertos-en-promedio-por-dia-pese-al-avance-de-la-vacunacion/,"COVID-19: por qué Argentina sigue teniendo 400 muertos en promedio por día, pese al avance de la vacunación",https://www.infobae.com/politica/2021/07/20/covid-19-por-que-argentina-sigue-teniendo-400-muertos-en-promedio-por-dia-pese-al-avance-de-la-vacunacion/,https://cloudfront-us-east-1.images.arcpublishing.com/infobae/IVZZNMLDZVHCBBQYFR3PQUYIMQ
6,https://www.infobae.com/sociedad/policiales/2021/07/20/nueva-moda-del-delito-asi-operan-las-bandas-portenas-que-roban-autos-clasicos-y-los-venden-a-miles-de-dolares-en-internet/,Nueva moda del delito: así operan las bandas porteñas que roban autos clásicos y los venden a miles de dólares en Internet,https://www.infobae.com/sociedad/policiales/2021/07/20/nueva-moda-del-delito-asi-operan-las-bandas-portenas-que-roban-autos-clasicos-y-los-venden-a-miles-de-dolares-en-internet/,https://cloudfront-us-east-1.images.arcpublishing.com/infobae/G5DU45FRQNCA7LRSPSPQS5ZCBM.jpg
7,https://www.infobae.com/economia/2021/07/20/mural-el-octavo-unicornio-argentino-la-startup-que-digitalizo-las-pizarras-de-las-salas-de-reunion-ya-vale-usd-2000-millones/,"Mural, el octavo unicornio argentino: la startup que digitalizó las pizarras de las salas de reunión ya vale USD 2.000 millones",https://www.infobae.com/economia/2021/07/20/mural-el-octavo-unicornio-argentino-la-startup-que-digitalizo-las-pizarras-de-las-salas-de-reunion-ya-vale-usd-2000-millones/,https://cloudfront-us-east-1.images.arcpublishing.com/infobae/DF63BSLB7VEP7POL7EA5OFTKTY.jpg
8,https://www.infobae.com/sociedad/policiales/2021/07/20/encontraron-muerto-al-director-de-cine-denunciado-en-cordoba-por-abuso-de-menores-horas-antes-publico-un-video-perturbador/,Encontraron muerto al director de cine denunciado en Córdoba por abuso de menores: horas antes publicó un video perturbador,https://www.infobae.com/sociedad/policiales/2021/07/20/encontraron-muerto-al-director-de-cine-denunciado-en-cordoba-por-abuso-de-menores-horas-antes-publico-un-video-perturbador/,https://cloudfront-us-east-1.images.arcpublishing.com/infobae/WAN2LPKUJ5FJRDXIP7FBYHLQ3A.jpg
9,https://www.infobae.com/politica/2021/07/20/alberto-fernandez-y-cristina-kirchner-no-coinciden-en-la-propuesta-electoral-para-buenos-aires-y-crece-la-tension-en-el-gobierno/,Alberto Fernández y Cristina Kirchner no coinciden en la propuesta electoral para Buenos Aires y crece la tensión en el Gobierno,https://www.infobae.com/politica/2021/07/20/alberto-fernandez-y-cristina-kirchner-no-coinciden-en-la-propuesta-electoral-para-buenos-aires-y-crece-la-tension-en-el-gobierno/,https://cloudfront-us-east-1.images.arcpublishing.com/infobae/R6OLYST4GNF45KP7IXPASHKLBI.jpg
10,https://www.infobae.com/america/deportes/2021/07/20/la-foto-del-permitido-de-messi-que-genero-una-catarata-de-memes-el-dardo-a-cristiano-ronaldo/,La foto del “permitido” de Messi que generó una catarata de memes: el dardo a Cristiano Ronaldo ,https://www.infobae.com/america/deportes/2021/07/20/la-foto-del-permitido-de-messi-que-genero-una-catarata-de-memes-el-dardo-a-cristiano-ronaldo/,https://cloudfront-us-east-1.images.arcpublishing.com/infobae/D5NY6O23GJEORPFKHJK2E2LAPA.png
11,https://www.infobae.com/america/deportes/2021/07/20/el-nino-de-12-anos-que-hizo-historia-en-los-x-games-destrozo-un-record-de-tony-hawk-y-se-convirtio-en-el-mas-joven-en-ganar-una-medalla-de-oro/,El niño de 12 años que hizo historia en los X Games: destrozó un récord de Tony Hawk y se convirtió en el más joven en ganar una medalla de oro  ,https://www.infobae.com/america/deportes/2021/07/20/el-nino-de-12-anos-que-hizo-historia-en-los-x-games-destrozo-un-record-de-tony-hawk-y-se-convirtio-en-el-mas-joven-en-ganar-una-medalla-de-oro/,https://cloudfront-us-east-1.images.arcpublishing.com/infobae/NJ2SFITUA5GFZF4YPXN4X6M6NM.jpg
12,https://www.infobae.com/economia/2021/07/20/la-triste-despedida-de-zorrito-von-quintiero-a-bruni-su-restaurante-cansado-de-los-impuestos-y-la-pymedemia/,"La triste despedida de Zorrito Von Quintiero a Bruni, su restaurante, cansado de los impuestos, la cuota sindical y la “pymedemia”",https://www.infobae.com/economia/2021/07/20/la-triste-despedida-de-zorrito-von-quintiero-a-bruni-su-restaurante-cansado-de-los-impuestos-y-la-pymedemia/,https://cloudfront-us-east-1.images.arcpublishing.com/infobae/5ZKR5VWEUZH35H2K2KH5VUZH4M.jpg
13,https://www.infobae.com/economia/2021/07/20/bruni-el-restaurante-donde-tocaba-charly-garcia-y-el-que-francella-elegia-para-sus-cumpleanos/,Bruni: el restaurante donde tocaba Charly García y el que Francella elegía para sus cumpleaños,https://www.infobae.com/economia/2021/07/20/bruni-el-restaurante-donde-tocaba-charly-garcia-y-el-que-francella-elegia-para-sus-cumpleanos/,https://cloudfront-us-east-1.images.arcpublishing.com/infobae/BJ7Z3FLYJFBTVOD2RHP4WOVB3M.jpg
14,https://www.infobae.com/salud/2021/07/20/por-que-las-vacunas-contra-el-covid-19-de-moderna-que-llegaron-a-la-argentina-se-autorizan-por-un-mecanismo-diferente-a-las-otras-dosis/,Por qué las vacunas contra el COVID-19 de Moderna que llegaron a la Argentina se autorizan por un mecanismo diferente a las otras dosis,https://www.infobae.com/salud/2021/07/20/por-que-las-vacunas-contra-el-covid-19-de-moderna-que-llegaron-a-la-argentina-se-autorizan-por-un-mecanismo-diferente-a-las-otras-dosis/,https://cloudfront-us-east-1.images.arcpublishing.com/infobae/BSN4YJJWY7L3YIFKODNZWXTL6M.jpg
15,https://www.infobae.com/america/deportes/2021/07/20/el-problema-fisico-de-max-verstappen-por-el-violento-accidente-que-sufrio-tras-el-toque-de-lewis-hamilton/,El problema físico de Max Verstappen por el violento accidente que sufrió tras el toque de Lewis Hamilton,https://www.infobae.com/america/deportes/2021/07/20/el-problema-fisico-de-max-verstappen-por-el-violento-accidente-que-sufrio-tras-el-toque-de-lewis-hamilton/,https://cloudfront-us-east-1.images.arcpublishing.com/infobae/OUJPMLK7FTFTOWAD7UKNG66KUU.jpg
16,https://www.infobae.com/teleshow/2021/07/20/mirtha-legrand-hablo-de-su-regreso-a-la-television-de-salud-estoy-esplendida-pero-voy-a-volver-cuando-me-sienta-segura/,"Mirtha Legrand habló de su regreso a la televisión: “De salud estoy espléndida, pero voy a volver cuando me sienta segura”",https://www.infobae.com/teleshow/2021/07/20/mirtha-legrand-hablo-de-su-regreso-a-la-television-de-salud-estoy-esplendida-pero-voy-a-volver-cuando-me-sienta-segura/,https://cloudfront-us-east-1.images.arcpublishing.com/infobae/6HRJIUKNPVGKPKPHU4GS3PAV6I.jpg
17,https://www.infobae.com/teleshow/2021/07/20/cabito-massa-alcantara-presento-a-su-novia-uno-de-sus-sostenes-en-su-internacion-antes-eras-mi-amiga-ahora-sos-mi-amor/,"Cabito Massa Alcántara presentó a su novia, uno de sus sostenes en su internación: “Antes eras mi amiga; ahora sos mi amor”",https://www.infobae.com/teleshow/2021/07/20/cabito-massa-alcantara-presento-a-su-novia-uno-de-sus-sostenes-en-su-internacion-antes-eras-mi-amiga-ahora-sos-mi-amor/,https://cloudfront-us-east-1.images.arcpublishing.com/infobae/ACWO7ABOJNCDRI6TS7ZLCID3NE.jpg
18,https://www.infobae.com/politica/2021/07/20/adolfo-rubinstein-la-salud-publica-no-fue-una-prioridad-del-gobierno-anterior/,Adolfo Rubinstein: “La salud pública no fue una prioridad del gobierno anterior”,https://www.infobae.com/politica/2021/07/20/adolfo-rubinstein-la-salud-publica-no-fue-una-prioridad-del-gobierno-anterior/,https://cloudfront-us-east-1.images.arcpublishing.com/infobae/FYMS57MFWVDVTKN2BD7VBLITBA.jpg
19,https://www.infobae.com/politica/2021/07/20/a-partir-de-hoy-amado-boudou-puede-salir-en-libertad-condicional/,A partir de hoy Amado Boudou puede salir en libertad condicional,https://www.infobae.com/politica/2021/07/20/a-partir-de-hoy-amado-boudou-puede-salir-en-libertad-condicional/,https://cloudfront-us-east-1.images.arcpublishing.com/infobae/BX6EK7Z4ARCY7FAODHCP6CZYBU.jpg
20,https://www.infobae.com/politica/2021/07/20/arde-la-interna-de-juntos-por-el-cambio-en-cordoba-macri-quiere-imponer-sus-candidatos-y-hay-expectativa-por-mario-negri/,Arde la interna de Juntos por el Cambio en Córdoba: Macri quiere imponer sus candidatos y hay expectativa por Mario Negri ,https://www.infobae.com/politica/2021/07/20/arde-la-interna-de-juntos-por-el-cambio-en-cordoba-macri-quiere-imponer-sus-candidatos-y-hay-expectativa-por-mario-negri/,https://cloudfront-us-east-1.images.arcpublishing.com/infobae/FUECFCIV2RFHREA7QDWBWG7JTU.jpg
21,https://www.infobae.com/deportes/2021/07/20/la-catarsis-de-soldano-tras-su-salida-de-boca-como-el-coaching-lo-ayudo-ante-las-criticas-el-valor-del-jugador-de-equipo-y-por-que-iria-de-nuevo-de-8/,"La catarsis de Soldano tras su salida de Boca: cómo el coaching lo ayudó ante las críticas, el valor del “jugador de equipo” y por qué iría de nuevo de 8",https://www.infobae.com/deportes/2021/07/20/la-catarsis-de-soldano-tras-su-salida-de-boca-como-el-coaching-lo-ayudo-ante-las-criticas-el-valor-del-jugador-de-equipo-y-por-que-iria-de-nuevo-de-8/,https://cloudfront-us-east-1.images.arcpublishing.com/infobae/KSFL56JFHJGI5AYJ53R6QZBGNM.jpg
22,https://www.infobae.com/coronavirus/2021/07/20/fernan-quiros-confirmo-a-que-grupo-le-aplicaran-las-dosis-de-moderna/,Fernán Quirós confirmó a qué grupo le aplicarán las dosis de Moderna y habló del pasaporte sanitario en CABA,https://www.infobae.com/coronavirus/2021/07/20/fernan-quiros-confirmo-a-que-grupo-le-aplicaran-las-dosis-de-moderna/,https://cloudfront-us-east-1.images.arcpublishing.com/infobae/2QM3EQAZO5FC3LQSKWY5EYLYYM.jpg
23,https://www.infobae.com/politica/2021/07/20/como-funcionara-el-pase-sanitario-con-el-que-se-flexibilizaran-las-restricciones-en-la-provincia-de-buenos-aires/,Cómo funcionará el pase sanitario con el que se flexibilizarán las restricciones en la provincia de Buenos Aires,https://www.infobae.com/politica/2021/07/20/como-funcionara-el-pase-sanitario-con-el-que-se-flexibilizaran-las-restricciones-en-la-provincia-de-buenos-aires/,https://cloudfront-us-east-1.images.arcpublishing.com/infobae/QV3BCNPR6FCGFBKQY2YEIYOJYA.jpg
24,https://www.infobae.com/tendencias/2021/07/20/familias-elegidas-compuestas-por-amigos-la-amistad-se-reconfigura-en-pandemia-como-una-trinchera-para-enfrentar-al-caos-de-lo-impredecible/,“Familias elegidas” compuestas por amigos: la amistad se reconfigura en pandemia como una trinchera para enfrentar al caos de lo impredecible  ,https://www.infobae.com/tendencias/2021/07/20/familias-elegidas-compuestas-por-amigos-la-amistad-se-reconfigura-en-pandemia-como-una-trinchera-para-enfrentar-al-caos-de-lo-impredecible/,https://cloudfront-us-east-1.images.arcpublishing.com/infobae/FSX2AWZH2ZAEPLNOKFNELRPHXA.jpg
25,https://www.infobae.com/salud/2021/07/20/covid-19-la-mirada-de-cinco-expertos-acerca-de-la-causa-por-la-que-argentina-no-logra-reducir-el-promedio-de-400-muertes-diarias/,COVID-19: la mirada de cinco expertos acerca de la causa por la que Argentina no logra reducir el promedio de 400 muertes diarias,https://www.infobae.com/salud/2021/07/20/covid-19-la-mirada-de-cinco-expertos-acerca-de-la-causa-por-la-que-argentina-no-logra-reducir-el-promedio-de-400-muertes-diarias/,https://cloudfront-us-east-1.images.arcpublishing.com/infobae/IZIWDUAZABAQZKMJLZQAHM5OXQ.jpg
26,https://www.infobae.com/america/deportes/2021/07/20/hoy-comienzan-los-juegos-olimpicos-el-deporte-que-dara-el-primer-paso-cuando-sera-la-ceremonia-inaugural-y-la-entrega-de-las-primeras-medallas/,"Comienzan los Juegos Olímpicos: el deporte que dará el primer paso, cuándo será la ceremonia inaugural y la entrega de las primeras medallas",https://www.infobae.com/america/deportes/2021/07/20/hoy-comienzan-los-juegos-olimpicos-el-deporte-que-dara-el-primer-paso-cuando-sera-la-ceremonia-inaugural-y-la-entrega-de-las-primeras-medallas/,https://cloudfront-us-east-1.images.arcpublishing.com/infobae/77MBJRYW6VC5TEYX4MCP4KP3T4
27,https://www.infobae.com/politica/2021/07/20/santiago-canton-en-formosa-no-existe-el-estado-de-derecho-el-de-insfran-es-un-gobierno-autoritario-y-feudal/,"Santiago Cantón: “En Formosa no existe el Estado de Derecho, el de Insfrán es un gobierno autoritario y feudal”",https://www.infobae.com/politica/2021/07/20/santiago-canton-en-formosa-no-existe-el-estado-de-derecho-el-de-insfran-es-un-gobierno-autoritario-y-feudal/,https://cloudfront-us-east-1.images.arcpublishing.com/infobae/Z56HC2YJDZFZJK4XJYSST3ZLMI.jpg
28,https://www.infobae.com/economia/2021/07/20/como-comprar-dolares-con-ledes-el-paso-por-paso-de-la-via-de-dolarizacion-que-evade-las-nuevas-trabas-cambiarias/,Cómo comprar dólares con Ledes: el paso por paso de la vía de dolarización que evade las nuevas trabas cambiarias,https://www.infobae.com/economia/2021/07/20/como-comprar-dolares-con-ledes-el-paso-por-paso-de-la-via-de-dolarizacion-que-evade-las-nuevas-trabas-cambiarias/,https://cloudfront-us-east-1.images.arcpublishing.com/infobae/EWJPPILBPI4DKKVHCRUPRDSUZM.jpg
29,https://www.infobae.com/sociedad/2021/07/20/la-muerte-de-una-amiga-el-bullying-y-la-obligacion-de-la-delgadez-la-bailarina-que-cambio-la-danza-clasica-por-el-pole-dance/,"La muerte de una amiga, el bullying y la obligación de la delgadez: la bailarina que cambió la danza clásica por el pole dance",https://www.infobae.com/sociedad/2021/07/20/la-muerte-de-una-amiga-el-bullying-y-la-obligacion-de-la-delgadez-la-bailarina-que-cambio-la-danza-clasica-por-el-pole-dance/,https://cloudfront-us-east-1.images.arcpublishing.com/infobae/WVGQWWBCXZE6XHWYF3CVLLPKMM.jpg
30,https://www.infobae.com/opinion/2021/07/20/cuidado-porque-el-relato-puede-ser-un-pene-de-madera/,Cuidado porque el relato puede ser un pene de madera,https://www.infobae.com/opinion/2021/07/20/cuidado-porque-el-relato-puede-ser-un-pene-de-madera/,https://cloudfront-us-east-1.images.arcpublishing.com/infobae/XS7JV6KUXZGXDPM2KB4NG2JREY.jpg
31,https://www.infobae.com/sociedad/2021/07/20/el-hombre-que-creia-que-al-calendario-le-faltaban-dias-de-celebracion-envio-mil-cartas-a-cien-paises-y-fundo-el-dia-del-amigo/,"El hombre que creía que al calendario le faltaban días de celebración, envió mil cartas a cien países y fundó el Día del Amigo",https://www.infobae.com/sociedad/2021/07/20/el-hombre-que-creia-que-al-calendario-le-faltaban-dias-de-celebracion-envio-mil-cartas-a-cien-paises-y-fundo-el-dia-del-amigo/,https://cloudfront-us-east-1.images.arcpublishing.com/infobae/4442LNVW4VFSHFPIQWBIZKHSOM.jpg
32,https://www.infobae.com/politica/2021/07/20/el-juez-roberto-boico-aparto-a-un-perito-cuestionado-por-cristina-kirchner-por-sus-me-gusta-en-twitter/,El juez Roberto Boico apartó a un perito cuestionado por Cristina Kirchner por sus “me gusta” en Twitter,https://www.infobae.com/politica/2021/07/20/el-juez-roberto-boico-aparto-a-un-perito-cuestionado-por-cristina-kirchner-por-sus-me-gusta-en-twitter/,https://cloudfront-us-east-1.images.arcpublishing.com/infobae/DFP6F3KFG5GHFD7NYSNBMZWIUE.jpg
33,https://www.infobae.com/sociedad/policiales/2021/07/20/detuvieron-a-un-sospechoso-por-el-brutal-crimen-del-docente-de-san-miguel-es-un-ex-novio-de-la-victima/,Detuvieron a un sospechoso por el brutal crimen del docente de San Miguel: es un ex novio de la víctima,https://www.infobae.com/sociedad/policiales/2021/07/20/detuvieron-a-un-sospechoso-por-el-brutal-crimen-del-docente-de-san-miguel-es-un-ex-novio-de-la-victima/,https://cloudfront-us-east-1.images.arcpublishing.com/infobae/635BBEXM4VC7VL6FN3UPTVJ2FA.jpg
34,https://www.infobae.com/historias/2021/07/20/mi-lucha-el-libro-atroz-que-hizo-millonario-a-hitler-un-compendio-de-antisemitismo-y-mentiras-sobre-su-vida/,"Mi Lucha, el libro atroz que hizo millonario a Hitler: un compendio de antisemitismo y mentiras sobre su vida",https://www.infobae.com/historias/2021/07/20/mi-lucha-el-libro-atroz-que-hizo-millonario-a-hitler-un-compendio-de-antisemitismo-y-mentiras-sobre-su-vida/,https://cloudfront-us-east-1.images.arcpublishing.com/infobae/7NAC5E3ZERDW7BQAV53UZA5QI4.jpg
35,https://www.infobae.com/sociedad/2021/07/20/la-fuga-de-pelicula-de-lopez-rega-casi-una-batalla-en-olivos-y-el-temor-de-isabel-peron-por-un-golpe-militar/,La fuga de película de López Rega: casi una batalla en Olivos y el temor de Isabel Perón por un golpe militar,https://www.infobae.com/sociedad/2021/07/20/la-fuga-de-pelicula-de-lopez-rega-casi-una-batalla-en-olivos-y-el-temor-de-isabel-peron-por-un-golpe-militar/,https://cloudfront-us-east-1.images.arcpublishing.com/infobae/DI2RS6L7BJHAFASZ334K3GU2HM.jpg
36,https://www.infobae.com/teleshow/2021/07/20/juan-carlos-altavista-dejo-la-escuela-en-tercer-grado-para-actuar-creo-minguito-pensando-en-su-padre-y-termino-muriendo-en-un-set-de-grabacion/,"Juan Carlos Altavista: dejó la escuela en tercer grado para actuar, creó Minguito pensando en su padre y terminó muriendo en un set de grabación",https://www.infobae.com/teleshow/2021/07/20/juan-carlos-altavista-dejo-la-escuela-en-tercer-grado-para-actuar-creo-minguito-pensando-en-su-padre-y-termino-muriendo-en-un-set-de-grabacion/,https://cloudfront-us-east-1.images.arcpublishing.com/infobae/RA5MRVBQJNE2DJO6JAGLQYMHJI.jpg
37,https://www.infobae.com/america/soluciones/2021/07/20/como-se-lucha-en-el-mundo-contra-el-matrimonio-infantil/,Cómo se lucha en el mundo contra el matrimonio infantil,https://www.infobae.com/america/soluciones/2021/07/20/como-se-lucha-en-el-mundo-contra-el-matrimonio-infantil/,https://cloudfront-us-east-1.images.arcpublishing.com/infobae/GYFUAESSKNAGZDWNPKJ7WQKWRA.jpg
38,https://www.infobae.com/opinion/2021/07/20/por-que-en-la-argentina-ocurren-crisis-cambiarias-en-forma-sistematica/,Por qué en la Argentina ocurren crisis cambiarias en forma sistemática,https://www.infobae.com/opinion/2021/07/20/por-que-en-la-argentina-ocurren-crisis-cambiarias-en-forma-sistematica/,https://cloudfront-us-east-1.images.arcpublishing.com/infobae/KG7KUX6KAIWVJAVUILBCBOCBBE.jpg
39,https://www.infobae.com/america/mundo/2021/07/20/estas-son-las-mejores-aerolineas-del-mundo-para-viajar-en-2021/,Estas son las mejores aerolíneas del mundo para viajar en 2021,https://www.infobae.com/america/mundo/2021/07/20/estas-son-las-mejores-aerolineas-del-mundo-para-viajar-en-2021/,https://cloudfront-us-east-1.images.arcpublishing.com/infobae/GAD777K6WRETXKCBCVFBBW6BM4.jpg
40,https://www.infobae.com/america/deportes/futbol-europeo/2021/07/20/conmocion-en-la-premier-league-un-futbolista-fue-arrestado-por-presuntos-delitos-sexuales-contra-menores/,Conmoción en la Premier League: un futbolista fue arrestado por presuntos delitos sexuales contra menores,https://www.infobae.com/america/deportes/futbol-europeo/2021/07/20/conmocion-en-la-premier-league-un-futbolista-fue-arrestado-por-presuntos-delitos-sexuales-contra-menores/,https://cloudfront-us-east-1.images.arcpublishing.com/infobae/XSETC3G52ZP27QQBW2VVV4ZPAM.jpg
41,https://www.infobae.com/deportes/2021/07/20/fue-el-maximo-goleador-de-las-inferiores-de-san-lorenzo-jugo-un-mundial-sub-17-e-hizo-gritar-como-en-el-86-a-maradona-pero-se-retiro-a-los-29-anos-y-fundo-su-propio-club/,"Fue el máximo goleador de las Inferiores de San Lorenzo, jugó un Mundial Sub 17 e hizo gritar “como en el 86″ a Maradona, pero se retiró a los 29 años y fundó su propio club ",https://www.infobae.com/deportes/2021/07/20/fue-el-maximo-goleador-de-las-inferiores-de-san-lorenzo-jugo-un-mundial-sub-17-e-hizo-gritar-como-en-el-86-a-maradona-pero-se-retiro-a-los-29-anos-y-fundo-su-propio-club/,https://cloudfront-us-east-1.images.arcpublishing.com/infobae/HXA3CA2FBFFS3JH7AUA6OOP4II.jpg
42,https://www.infobae.com/deportes/2021/07/20/ariel-ortega-sorprendio-en-el-senior-de-river-con-otro-golazo-que-se-hizo-viral-en-las-redes/,Ariel Ortega sorprendió en el senior de River con otro golazo que se hizo viral en las redes,https://www.infobae.com/deportes/2021/07/20/ariel-ortega-sorprendio-en-el-senior-de-river-con-otro-golazo-que-se-hizo-viral-en-las-redes/,https://cloudfront-us-east-1.images.arcpublishing.com/infobae/NSOLYISCKZADBB65FXBRHXANTY.jpg
43,https://www.infobae.com/america/wapo/2021/07/19/un-pez-gigante-que-aparecio-en-la-costa-del-norte-de-eeuu-intriga-a-los-cientificos/,Un pez gigante que apareció en la costa del norte de EEUU intriga a los científicos,https://www.infobae.com/america/wapo/2021/07/19/un-pez-gigante-que-aparecio-en-la-costa-del-norte-de-eeuu-intriga-a-los-cientificos/,https://cloudfront-us-east-1.images.arcpublishing.com/infobae/O7S53ZPOSBBDBJRL7RVRWNRBHI.jpg
44,https://www.infobae.com/politica/2021/07/20/florencio-randazzo-critico-a-horacio-rodriguez-larreta-por-permitir-los-piquetes-en-la-ciudad-yo-los-sacaria-con-la-policia/,Florencio Randazzo criticó a Horacio Rodríguez Larreta por permitir los piquetes en la Ciudad: “Yo los sacaría con la Policía”,https://www.infobae.com/politica/2021/07/20/florencio-randazzo-critico-a-horacio-rodriguez-larreta-por-permitir-los-piquetes-en-la-ciudad-yo-los-sacaria-con-la-policia/,https://cloudfront-us-east-1.images.arcpublishing.com/infobae/2HBT6NDDNNEEJAAIHEGLEIAUGA.JPG
45,https://www.infobae.com/america/wapo/2021/07/20/de-joven-no-pudo-usar-el-vestido-de-novia-de-sus-suenos-por-el-racismo-ahora-a-sus-94-anos-lo-hizo/,De joven no pudo usar el vestido de novia de sus sueños por el racismo; ahora a sus 94 años lo hizo,https://www.infobae.com/america/wapo/2021/07/20/de-joven-no-pudo-usar-el-vestido-de-novia-de-sus-suenos-por-el-racismo-ahora-a-sus-94-anos-lo-hizo/,https://cloudfront-us-east-1.images.arcpublishing.com/infobae/JX7SWKBZZVACXKO34FQAELWXW4.jpg
46,https://www.infobae.com/economia/2021/07/20/mas-controles-sobre-el-dolar-sondeos-oficiales-por-pagos-al-exterior-encienden-luz-de-alerta-en-empresas/,Más controles sobre el dólar: sondeos oficiales por pagos al exterior encienden luz de alerta en empresas ,https://www.infobae.com/economia/2021/07/20/mas-controles-sobre-el-dolar-sondeos-oficiales-por-pagos-al-exterior-encienden-luz-de-alerta-en-empresas/,https://cloudfront-us-east-1.images.arcpublishing.com/infobae/RKDIIQUPNYOQVUQUEUJPYMZ4RM.jpg
47,https://www.infobae.com/teleshow/2021/07/20/el-ferrocarril-subterraneo-una-serie-que-combina-realidad-y-fantasia-para-contar-la-historia-de-una-red-de-escape-en-los-anos-de-la-esclavitud/,El ferrocarril subterráneo: una serie que combina realidad y fantasía para contar la historia de una red de escape en los años de la esclavitud,https://www.infobae.com/teleshow/2021/07/20/el-ferrocarril-subterraneo-una-serie-que-combina-realidad-y-fantasia-para-contar-la-historia-de-una-red-de-escape-en-los-anos-de-la-esclavitud/,https://cloudfront-us-east-1.images.arcpublishing.com/infobae/3JZGIHESONBLFPSMOTUTAEHB3E.jpg
48,https://www.infobae.com/economia/2021/07/20/creditos-hipotecarios-cuales-son-los-nuevos-montos-financiables-del-programa-casa-propia/,Créditos hipotecarios: cuáles son los nuevos montos financiables del programa Casa Propia,https://www.infobae.com/economia/2021/07/20/creditos-hipotecarios-cuales-son-los-nuevos-montos-financiables-del-programa-casa-propia/,https://cloudfront-us-east-1.images.arcpublishing.com/infobae/HEMBKA6AHNAUVFVYYMOZLTT3NQ.jpg
49,https://www.infobae.com/teleshow/2021/07/20/el-director-bruno-stagnaro-descubre-los-secretos-de-okupas-la-eleccion-de-rodrigo-de-la-serna-el-lenguaje-tumbero-y-por-que-se-nego-a-hacer-una-segunda-parte/,"El director Bruno Stagnaro descubre los secretos de Okupas: la elección de Rodrigo de la Serna, el lenguaje tumbero y por qué se negó a hacer una segunda parte",https://www.infobae.com/teleshow/2021/07/20/el-director-bruno-stagnaro-descubre-los-secretos-de-okupas-la-eleccion-de-rodrigo-de-la-serna-el-lenguaje-tumbero-y-por-que-se-nego-a-hacer-una-segunda-parte/,https://cloudfront-us-east-1.images.arcpublishing.com/infobae/QYNHTAYPIZFT3P5WSNMPZWQX5E.jpg
