n,id,title,url,image
1,https://www.infobae.com/politica/2021/04/08/coronavirus-el-gobierno-carga-las-culpas-sobre-la-sociedad-y-apunta-a-los-jovenes-en-lugar-de-admitir-responsabilidades-propias/,Coronavirus: el Gobierno carga las culpas sobre la sociedad en lugar de admitir responsabilidades propias,https://www.infobae.com/politica/2021/04/08/coronavirus-el-gobierno-carga-las-culpas-sobre-la-sociedad-y-apunta-a-los-jovenes-en-lugar-de-admitir-responsabilidades-propias/,https://cloudfront-us-east-1.images.arcpublishing.com/infobae/FV3ALLJOJZHDZPWY4P6Y6PZGNI.jpeg
2,https://www.infobae.com/economia/2021/04/08/la-salida-de-falabella-por-que-la-cadena-chilena-se-va-del-pais-pero-sigue-invirtiendo-en-el-resto-de-la-region/,La salida de Falabella: por qué la cadena chilena se va del país pero sigue invirtiendo en el resto de la región,https://www.infobae.com/economia/2021/04/08/la-salida-de-falabella-por-que-la-cadena-chilena-se-va-del-pais-pero-sigue-invirtiendo-en-el-resto-de-la-region/,https://cloudfront-us-east-1.images.arcpublishing.com/infobae/QRTEA3KXTFCO5PKUZTT6GIONNU.jpg
3,https://www.infobae.com/america/deportes/2021/04/08/joe-conforte-de-taxista-a-rey-de-los-burdeles-su-rol-en-el-crimen-de-ringo-bonavena-viajes-a-argentina-con-identidades-falsas-y-el-final-como-profugo-vip-en-brasil/,"Joe Conforte, de taxista a rey de los burdeles: su rol en el crimen de Ringo Bonavena, viajes a Argentina con identidades falsas y el final como prófugo VIP en Brasil",https://www.infobae.com/america/deportes/2021/04/08/joe-conforte-de-taxista-a-rey-de-los-burdeles-su-rol-en-el-crimen-de-ringo-bonavena-viajes-a-argentina-con-identidades-falsas-y-el-final-como-profugo-vip-en-brasil/,https://cloudfront-us-east-1.images.arcpublishing.com/infobae/OY67KNA2WNDKLFHPXVPQQX6B4I.jpg
4,https://www.infobae.com/politica/2021/04/08/santiago-cafiero-las-provincias-la-ciudad-de-buenos-aires-y-los-privados-pueden-comprar-vacunas-por-su-cuenta/,"Santiago Cafiero: “Las provincias, la Ciudad de Buenos Aires y los privados pueden comprar vacunas por su cuenta”",https://www.infobae.com/politica/2021/04/08/santiago-cafiero-las-provincias-la-ciudad-de-buenos-aires-y-los-privados-pueden-comprar-vacunas-por-su-cuenta/,https://cloudfront-us-east-1.images.arcpublishing.com/infobae/T6U7E3QD7BEJJGMNK43EQKNSGM.jpg
5,https://www.infobae.com/politica/2021/04/07/suspension-de-viajes-al-exterior-cierre-de-bares-y-restaurantes-y-restriccion-para-circular-cuales-son-las-nuevas-medidas-del-gobierno/,"Suspensión de reuniones sociales, cierre de bares y restaurantes y restricción para circular: las nuevas medidas del Gobierno",https://www.infobae.com/politica/2021/04/07/suspension-de-viajes-al-exterior-cierre-de-bares-y-restaurantes-y-restriccion-para-circular-cuales-son-las-nuevas-medidas-del-gobierno/,https://cloudfront-us-east-1.images.arcpublishing.com/infobae/IXE2NJRNZFEVNOSWZITIKOVVFI.jpg
6,https://www.infobae.com/sociedad/2021/04/08/quienes-pueden-viajar-en-transporte-publico-y-como-sacar-el-permiso-para-circular/,Quiénes pueden viajar en transporte público y cómo sacar el permiso para circular,https://www.infobae.com/sociedad/2021/04/08/quienes-pueden-viajar-en-transporte-publico-y-como-sacar-el-permiso-para-circular/,https://cloudfront-us-east-1.images.arcpublishing.com/infobae/YCQPAY7FH5HZ5P4Y3WU455QHIU.jpg
7,https://www.infobae.com/politica/2021/04/08/alberto-fernandez-y-rodriguez-larreta-cerraron-un-acuerdo-politico-sobre-la-circulacion-nocturna-para-enfrentar-juntos-la-segundo-ola-del-covid-19/,Alberto Fernández y Rodríguez Larreta cerraron un acuerdo político sobre la circulación nocturna para enfrentar juntos la segunda ola del COVID-19,https://www.infobae.com/politica/2021/04/08/alberto-fernandez-y-rodriguez-larreta-cerraron-un-acuerdo-politico-sobre-la-circulacion-nocturna-para-enfrentar-juntos-la-segundo-ola-del-covid-19/,https://cloudfront-us-east-1.images.arcpublishing.com/infobae/HJMUQXENCBGJ7CW6KFR2OM5RH4.jpg
8,https://www.infobae.com/politica/2021/04/08/nuevas-restricciones-por-la-segunda-ola-de-covid-en-argentina-15-dudas-y-preguntas-y-sus-respuestas/,Nuevas restricciones por la segunda ola de COVID en Argentina: 15 dudas  y sus respuestas,https://www.infobae.com/politica/2021/04/08/nuevas-restricciones-por-la-segunda-ola-de-covid-en-argentina-15-dudas-y-preguntas-y-sus-respuestas/,https://cloudfront-us-east-1.images.arcpublishing.com/infobae/ZR26NYMZLJCSVJBAVUNOIQI2RU.jpg
9,https://www.infobae.com/politica/2021/04/08/el-senado-convertira-en-ley-la-modificacion-del-impuesto-a-las-ganancias-y-del-monotributo/,El Senado convertirá en ley la modificación del Impuesto a las Ganancias y del Monotributo,https://www.infobae.com/politica/2021/04/08/el-senado-convertira-en-ley-la-modificacion-del-impuesto-a-las-ganancias-y-del-monotributo/,https://cloudfront-us-east-1.images.arcpublishing.com/infobae/ZUHOVQYCERBRVM5E4VQPBSDONM.jpg
10,https://www.infobae.com/historias/2021/04/08/las-sedujo-les-robo-3-millones-de-euros-y-las-convirtio-en-cadaveres-emocionales-el-estafador-serial-que-odiaba-a-las-mujeres/,"Las sedujo, les robó 3 millones de euros y las convirtió en “cadáveres emocionales”: el estafador serial que odiaba a las mujeres",https://www.infobae.com/historias/2021/04/08/las-sedujo-les-robo-3-millones-de-euros-y-las-convirtio-en-cadaveres-emocionales-el-estafador-serial-que-odiaba-a-las-mujeres/,https://cloudfront-us-east-1.images.arcpublishing.com/infobae/FU265BQHWZDQJBLEXAKKWB5OCI.jpg
11,https://www.infobae.com/economia/2021/04/08/la-condena-del-arrastre-estadistico-que-es-y-por-que-explica-que-este-ano-casi-no-habra-crecimiento-economico/,La condena del “arrastre estadístico”: qué es y por qué explica que este año casi no habrá crecimiento económico,https://www.infobae.com/economia/2021/04/08/la-condena-del-arrastre-estadistico-que-es-y-por-que-explica-que-este-ano-casi-no-habra-crecimiento-economico/,https://cloudfront-us-east-1.images.arcpublishing.com/infobae/55D6PT3WZVFWXP3YL2BKQUTBP4.jpg
12,https://www.infobae.com/teleshow/infoshow/2021/04/08/tension-amorosa-celeste-muriega-y-hernan-drago-contaron-que-es-lo-que-mas-les-gusta-del-otro/,Tensión amorosa: Celeste Muriega y Hernán Drago contaron qué es lo que más les gusta del otro,https://www.infobae.com/teleshow/infoshow/2021/04/08/tension-amorosa-celeste-muriega-y-hernan-drago-contaron-que-es-lo-que-mas-les-gusta-del-otro/,https://cloudfront-us-east-1.images.arcpublishing.com/infobae/XUB5HPAU4ZFDFNPWS2IXS7TI4U.jpg
13,https://www.infobae.com/deportes/2021/04/08/boca-y-river-disputaran-los-octavos-de-final-de-la-copa-argentina-fecha-y-sede-donde-se-jugaria-el-segundo-superclasico-del-ano/,Boca y River disputarán los octavos de final de la Copa Argentina: fecha y sede donde se jugaría el tercer Superclásico del año,https://www.infobae.com/deportes/2021/04/08/boca-y-river-disputaran-los-octavos-de-final-de-la-copa-argentina-fecha-y-sede-donde-se-jugaria-el-segundo-superclasico-del-ano/,https://cloudfront-us-east-1.images.arcpublishing.com/infobae/E3JDQIYHPYSLCLZ4FGF2XMASGE.jpg
14,https://www.infobae.com/deportes/2021/04/08/la-metamorfosis-de-federico-girotti-para-transformarse-en-el-9-que-gallardo-necesita-para-river-me-cambio-la-cabeza/,La metamorfosis de Federico Girotti para transformarse en el 9 que Gallardo necesita para River: “Me cambió la cabeza”,https://www.infobae.com/deportes/2021/04/08/la-metamorfosis-de-federico-girotti-para-transformarse-en-el-9-que-gallardo-necesita-para-river-me-cambio-la-cabeza/,https://cloudfront-us-east-1.images.arcpublishing.com/infobae/VYRAAVR3XRC4NGZ4OFS4QM2RFI.jpg
15,https://www.infobae.com/america/deportes/2021/04/08/se-posterga-el-comienzo-de-roland-garros-debido-a-la-crisis-sanitaria-que-atraviesa-francia/,Se posterga el comienzo de Roland Garros debido a la crisis sanitaria que atraviesa Francia,https://www.infobae.com/america/deportes/2021/04/08/se-posterga-el-comienzo-de-roland-garros-debido-a-la-crisis-sanitaria-que-atraviesa-francia/,https://cloudfront-us-east-1.images.arcpublishing.com/infobae/55YSGFTQNBG23P4QVIPKRMPHXQ.jpg
16,https://www.infobae.com/america/mundo/2021/04/08/el-abogado-de-alexei-navalny-denuncio-que-el-lider-opositor-ruso-perdio-la-sensibilidad-de-las-manos-mientras-se-mantiene-en-huelga-de-hambre/,El abogado de Alexei Navalny denunció que el líder opositor ruso perdió la sensibilidad de las manos mientras se mantiene en huelga de hambre  ,https://www.infobae.com/america/mundo/2021/04/08/el-abogado-de-alexei-navalny-denuncio-que-el-lider-opositor-ruso-perdio-la-sensibilidad-de-las-manos-mientras-se-mantiene-en-huelga-de-hambre/,https://cloudfront-us-east-1.images.arcpublishing.com/infobae/TQUR6HAOR23P2SG5LACCP2MKF4.jpg
17,https://www.infobae.com/sociedad/2021/04/08/la-historia-del-argentino-condenado-a-pena-de-muerte-en-estados-unidos-un-gualicho-maldito-un-brutal-crimen-y-la-inyeccion-letal/,"La historia del argentino condenado a pena de muerte en Estados Unidos: un “gualicho” maldito, un brutal crimen y la inyección letal",https://www.infobae.com/sociedad/2021/04/08/la-historia-del-argentino-condenado-a-pena-de-muerte-en-estados-unidos-un-gualicho-maldito-un-brutal-crimen-y-la-inyeccion-letal/,https://cloudfront-us-east-1.images.arcpublishing.com/infobae/5XFKNF64ZZB2RNTLS6XBYTEW3U.jpg
18,https://www.infobae.com/politica/2021/04/08/el-gobierno-asume-que-el-aumento-de-casos-se-profundizara-y-apuesta-a-reforzar-el-plan-de-vacunacion/,El Gobierno asume que el aumento de casos se profundizará y apuesta a reforzar el plan de vacunación,https://www.infobae.com/politica/2021/04/08/el-gobierno-asume-que-el-aumento-de-casos-se-profundizara-y-apuesta-a-reforzar-el-plan-de-vacunacion/,https://cloudfront-us-east-1.images.arcpublishing.com/infobae/LLPDQEAKOTMILNSJ2U64EHBUO4.jpg
19,https://www.infobae.com/politica/2021/04/08/la-segunda-ola-de-coronavirus-complica-los-dialogos-politicos-entre-el-gobierno-y-juntos-por-el-cambio/,La segunda ola de coronavirus complica los diálogos políticos entre el Gobierno y Juntos por el Cambio ,https://www.infobae.com/politica/2021/04/08/la-segunda-ola-de-coronavirus-complica-los-dialogos-politicos-entre-el-gobierno-y-juntos-por-el-cambio/,https://cloudfront-us-east-1.images.arcpublishing.com/infobae/ZGROXHKM3RCQDMCCWQK67PDXHY.jpg
20,https://www.infobae.com/america/america-latina/2021/04/08/el-frustrado-intento-de-detencion-al-rapero-maykel-osorbo-muestra-como-la-sociedad-cubana-desafia-a-la-dictadura-castrista/,El video que muestra cómo vecinos se enfrentaron a la dictadura cubana e impidieron el arresto del rapero Maykel Osorbo: “¡Abusadores! ¡Asesinos!”,https://www.infobae.com/america/america-latina/2021/04/08/el-frustrado-intento-de-detencion-al-rapero-maykel-osorbo-muestra-como-la-sociedad-cubana-desafia-a-la-dictadura-castrista/,https://cloudfront-us-east-1.images.arcpublishing.com/infobae/ITG3UDBI25FOVI43NBPYOO364M.jpg
21,https://www.infobae.com/sociedad/policiales/2021/04/07/casacion-absolvio-a-la-mujer-que-habia-sido-condenada-por-resistencia-a-la-autoridad-tras-besar-a-su-esposa/,Casación absolvió a la mujer que había sido condenada por resistencia a la autoridad tras besar a su esposa,https://www.infobae.com/sociedad/policiales/2021/04/07/casacion-absolvio-a-la-mujer-que-habia-sido-condenada-por-resistencia-a-la-autoridad-tras-besar-a-su-esposa/,https://cloudfront-us-east-1.images.arcpublishing.com/infobae/4CJV6DFD7NGWHGYTAOLZ75AP5Y.jpeg
22,https://www.infobae.com/sociedad/policiales/2021/04/07/crimen-de-fernando-baez-sosa-la-justicia-confirmo-la-elevacion-a-juicio-de-los-rugbiers-y-sobreseyo-a-alejo-milanesi/,Crimen de Fernando Báez Sosa: la Justicia confirmó la elevación a juicio de los rugbiers y sobreseyó a Alejo Milanesi,https://www.infobae.com/sociedad/policiales/2021/04/07/crimen-de-fernando-baez-sosa-la-justicia-confirmo-la-elevacion-a-juicio-de-los-rugbiers-y-sobreseyo-a-alejo-milanesi/,https://cloudfront-us-east-1.images.arcpublishing.com/infobae/YZNX6KJATFCX7KYAKN3K2UN6YQ.jpg
23,https://www.infobae.com/economia/2021/04/08/aunque-la-construccion-viene-en-recuperacion-en-marzo-se-freno-la-venta-de-materiales/,"Aunque la construcción viene en recuperación, en marzo se frenó la venta de materiales",https://www.infobae.com/economia/2021/04/08/aunque-la-construccion-viene-en-recuperacion-en-marzo-se-freno-la-venta-de-materiales/,https://cloudfront-us-east-1.images.arcpublishing.com/infobae/EYS7F5GA3ZEMJGSL2JDDHF37ME.jpg
24,https://www.infobae.com/sociedad/policiales/2021/04/08/la-justicia-de-entre-rios-condeno-a-un-policia-que-le-ordeno-a-una-ex-agente-ir-a-trabajar-en-minifalda-y-colaless/,La Justicia de Entre Ríos condenó a un policía que le ordenó a una ex agente ir a trabajar en “minifalda y colaless”,https://www.infobae.com/sociedad/policiales/2021/04/08/la-justicia-de-entre-rios-condeno-a-un-policia-que-le-ordeno-a-una-ex-agente-ir-a-trabajar-en-minifalda-y-colaless/,https://arc-anglerfish-arc2-prod-infobae.s3.amazonaws.com/public/WJ7DOABHTNCABPNFWF2ELDKLYQ
25,https://www.infobae.com/politica/2021/04/07/vacunas-caba-tiene-stock-hasta-el-viernes-y-hay-municipios-bonaerenses-que-no-recibieron-dosis-las-ultimas-dos-semanas/,Vacunas: CABA tiene stock hasta el viernes y hay municipios bonaerenses que no recibieron dosis las últimas dos semanas,https://www.infobae.com/politica/2021/04/07/vacunas-caba-tiene-stock-hasta-el-viernes-y-hay-municipios-bonaerenses-que-no-recibieron-dosis-las-ultimas-dos-semanas/,https://cloudfront-us-east-1.images.arcpublishing.com/infobae/DIR3KJV6PNAX5LRCAI76BKFKAU.jpg
26,https://www.infobae.com/politica/2021/04/08/cordoba-suspendieron-la-campana-de-vacunacion-en-la-capital-porque-nacion-envio-dosis-equivocadas/,Córdoba: suspendieron la campaña de vacunación en la capital porque Nación envió dosis equivocadas,https://www.infobae.com/politica/2021/04/08/cordoba-suspendieron-la-campana-de-vacunacion-en-la-capital-porque-nacion-envio-dosis-equivocadas/,https://cloudfront-us-east-1.images.arcpublishing.com/infobae/B52YQ5FA2NFFDNYRYWHYZTXXV4.jpg
27,https://www.infobae.com/politica/2021/04/08/daniel-gollan-hablo-de-las-nuevas-restricciones-el-hombre-es-bueno-pero-si-se-lo-controla-es-mejor/,Daniel Gollan habló de las nuevas restricciones: “El hombre es bueno pero si se lo controla es mejor”,https://www.infobae.com/politica/2021/04/08/daniel-gollan-hablo-de-las-nuevas-restricciones-el-hombre-es-bueno-pero-si-se-lo-controla-es-mejor/,https://cloudfront-us-east-1.images.arcpublishing.com/infobae/GGLNAQXUANGPNFZ5FPX4M56DKI.jpg
28,https://www.infobae.com/politica/2021/04/08/el-tenso-cruce-entre-la-ministra-vizzotti-y-cristina-perez-por-el-plan-de-vacunacion-contra-el-coronavirus/,El tenso cruce entre la ministra Vizzotti y Cristina Pérez por el plan de vacunación contra el coronavirus ,https://www.infobae.com/politica/2021/04/08/el-tenso-cruce-entre-la-ministra-vizzotti-y-cristina-perez-por-el-plan-de-vacunacion-contra-el-coronavirus/,https://cloudfront-us-east-1.images.arcpublishing.com/infobae/24X67JOWNFC3VNF3TBCMHQ5AEI.png
29,https://www.infobae.com/teleshow/infoshow/2021/04/08/el-pibe-de-charles-chaplin-una-pelicula-marcada-por-las-grandes-tragedias-en-la-vida-del-realizador/,"El pibe de Charles Chaplin, una película marcada por las grandes tragedias en la vida del realizador",https://www.infobae.com/teleshow/infoshow/2021/04/08/el-pibe-de-charles-chaplin-una-pelicula-marcada-por-las-grandes-tragedias-en-la-vida-del-realizador/,https://cloudfront-us-east-1.images.arcpublishing.com/infobae/B5TE5L76NNGNFKPWJCXC3ZPYHQ.jpg
30,https://www.infobae.com/teleshow/infoshow/2021/04/08/la-curiosa-devolucion-de-german-martitegui-a-una-preparacion-de-cande-vetrano-en-masterchef-celebrity-2-me-la-untaria-por-todo-el-cuerpo/,La curiosa devolución de Germán Martitegui a una preparación de Cande Vetrano en Masterchef Celebrity 2: “Me la untaría por todo el cuerpo”,https://www.infobae.com/teleshow/infoshow/2021/04/08/la-curiosa-devolucion-de-german-martitegui-a-una-preparacion-de-cande-vetrano-en-masterchef-celebrity-2-me-la-untaria-por-todo-el-cuerpo/,https://cloudfront-us-east-1.images.arcpublishing.com/infobae/Q3UV2FK575GZBLFXI4UOT3USJM.jpg
31,https://www.infobae.com/sociedad/2021/04/08/se-fue-de-francia-se-enamoro-de-la-argentina-y-monto-un-hostel-en-jujuy-este-es-un-pais-para-aventureros/,"Se fue de Francia, se enamoró de la Argentina y montó un hostel en Jujuy: “Este es un país para aventureros”",https://www.infobae.com/sociedad/2021/04/08/se-fue-de-francia-se-enamoro-de-la-argentina-y-monto-un-hostel-en-jujuy-este-es-un-pais-para-aventureros/,https://cloudfront-us-east-1.images.arcpublishing.com/infobae/UI2UT224LNDUNENRTRX5DYBSUE.jpg
32,https://www.infobae.com/sociedad/2021/04/08/el-horror-del-gueto-de-varsovia-una-beba-salvada-de-los-nazis-dentro-de-un-bolso-y-la-lucha-de-su-padre-para-hallarla-tras-la-guerra/,El horror del Gueto de Varsovia: una beba salvada de los nazis dentro de un bolso y la lucha de su padre para hallarla tras la guerra,https://www.infobae.com/sociedad/2021/04/08/el-horror-del-gueto-de-varsovia-una-beba-salvada-de-los-nazis-dentro-de-un-bolso-y-la-lucha-de-su-padre-para-hallarla-tras-la-guerra/,https://cloudfront-us-east-1.images.arcpublishing.com/infobae/YQLZXMWJZJEB7H57SNTJI5IMUM.jpg
33,https://www.infobae.com/politica/2021/04/08/en-una-reunion-marcada-por-la-desconfianza-juntos-por-el-cambio-le-exigira-al-gobierno-una-ley-para-posponer-las-paso/,"En una reunión marcada por la desconfianza, Juntos por el Cambio le exigirá al Gobierno una ley para posponer las PASO",https://www.infobae.com/politica/2021/04/08/en-una-reunion-marcada-por-la-desconfianza-juntos-por-el-cambio-le-exigira-al-gobierno-una-ley-para-posponer-las-paso/,https://cloudfront-us-east-1.images.arcpublishing.com/infobae/4IWRN2OEBJH5PFAS5VTUIGFVME.jpg
34,https://www.infobae.com/economia/2021/04/08/la-segunda-ola-del-coronavirus-hace-temblar-el-plan-de-martin-guzman-para-reducir-el-deficit-y-la-inflacion/,La segunda ola del coronavirus hace temblar el plan de Martín Guzmán para reducir el déficit y la inflación,https://www.infobae.com/economia/2021/04/08/la-segunda-ola-del-coronavirus-hace-temblar-el-plan-de-martin-guzman-para-reducir-el-deficit-y-la-inflacion/,https://cloudfront-us-east-1.images.arcpublishing.com/infobae/YZSTBQVBG5FZVNGA322BTCU4GI.jpg
35,https://www.infobae.com/teleshow/infoshow/2021/04/08/del-atendedor-de-boludos-a-ricardo-fort-o-mauro-viale-la-historia-detras-de-los-munecos-del-jurado-de-masterchef-celebrity/,Del “atendedor de boludos” a Ricardo Fort o Mauro Viale: la historia detrás de los muñecos del jurado de Masterchef Celebrity,https://www.infobae.com/teleshow/infoshow/2021/04/08/del-atendedor-de-boludos-a-ricardo-fort-o-mauro-viale-la-historia-detras-de-los-munecos-del-jurado-de-masterchef-celebrity/,https://cloudfront-us-east-1.images.arcpublishing.com/infobae/EIYJ2UKF5VCULH54C7WLWSCGAU.jpg
36,https://www.infobae.com/teleshow/infoshow/2021/04/07/veronica-ojeda-rompio-el-silencio-morla-no-toques-a-dieguito-fernando-cuando-me-tocan-a-mi-hijo-yo-mato/,"Verónica Ojeda rompió el silencio: “Morla, no toques a Dieguito Fernando, cuando me tocan a mi hijo, yo mato”",https://www.infobae.com/teleshow/infoshow/2021/04/07/veronica-ojeda-rompio-el-silencio-morla-no-toques-a-dieguito-fernando-cuando-me-tocan-a-mi-hijo-yo-mato/,https://cloudfront-us-east-1.images.arcpublishing.com/infobae/HRD5MOGB3FDHVH55TBO4YMAXH4.jpg
37,https://www.infobae.com/sociedad/policiales/2021/04/08/un-gendarme-se-tiroteo-con-cuatro-ladrones-en-la-matanza-uno-murio-y-otro-resulto-herido/,Un gendarme se tiroteó con cuatro ladrones en La Matanza: uno murió y otro resultó herido ,https://www.infobae.com/sociedad/policiales/2021/04/08/un-gendarme-se-tiroteo-con-cuatro-ladrones-en-la-matanza-uno-murio-y-otro-resulto-herido/,https://cloudfront-us-east-1.images.arcpublishing.com/infobae/E7HZUB7ZKVEGJBXNBTWE6XNUTY.jfif
38,https://www.infobae.com/america/entretenimiento/2021/04/08/sexo-a-lo-bestia-y-drogas-que-dijo-miguel-bose-sobre-su-perdida-de-voz-y-los-excesos-en-su-vida/,“Sexo a lo bestia y drogas”: qué dijo Miguel Bosé sobre su pérdida de voz y los excesos en su vida,https://www.infobae.com/america/entretenimiento/2021/04/08/sexo-a-lo-bestia-y-drogas-que-dijo-miguel-bose-sobre-su-perdida-de-voz-y-los-excesos-en-su-vida/,https://cloudfront-us-east-1.images.arcpublishing.com/infobae/V5BTYDWIS5HI7MZZYNZT47T66E.jpg
39,https://www.infobae.com/america/tendencias-america/2021/04/08/el-consumo-de-carne-en-forma-moderada-es-clave-para-el-desarrollo/,El consumo de carne en forma moderada es clave para el desarrollo,https://www.infobae.com/america/tendencias-america/2021/04/08/el-consumo-de-carne-en-forma-moderada-es-clave-para-el-desarrollo/,https://cloudfront-us-east-1.images.arcpublishing.com/infobae/5F4QNSFVHVADTL5IS3YCKLAOVA.jpg
40,https://www.infobae.com/politica/2021/04/07/quien-es-craig-faller-el-enviado-de-biden-a-la-argentina-combatio-a-los-talibanes-y-rechazo-un-golpe-militar-contra-maduro/,"Quién es Craig Faller, el enviado de Biden a la Argentina: combatió a los talibanes y rechazó un golpe militar contra Maduro",https://www.infobae.com/politica/2021/04/07/quien-es-craig-faller-el-enviado-de-biden-a-la-argentina-combatio-a-los-talibanes-y-rechazo-un-golpe-militar-contra-maduro/,https://cloudfront-us-east-1.images.arcpublishing.com/infobae/VW62SIWNTZC7TCCVMDN4SPOSHE.jpg
41,https://www.infobae.com/america/tendencias-america/2021/04/08/el-ebola-esta-de-regreso-cuales-son-las-claves-para-gestionar-con-exito-el-brote/,¿El ébola está de regreso? Cuáles son las claves para gestionar con éxito el brote,https://www.infobae.com/america/tendencias-america/2021/04/08/el-ebola-esta-de-regreso-cuales-son-las-claves-para-gestionar-con-exito-el-brote/,https://cloudfront-us-east-1.images.arcpublishing.com/infobae/667HMMLDDZCQZJQJL6RPCGN5PE.jpg
42,https://www.infobae.com/economia/2021/04/08/el-ministro-de-economia-emprende-su-cruzada-por-europa-para-postergar-el-pago-de-la-deuda-con-el-fmi-y-el-club-de-paris/,El ministro de Economía emprende su cruzada por Europa para postergar el pago de la deuda con el FMI y el Club de París,https://www.infobae.com/economia/2021/04/08/el-ministro-de-economia-emprende-su-cruzada-por-europa-para-postergar-el-pago-de-la-deuda-con-el-fmi-y-el-club-de-paris/,https://cloudfront-us-east-1.images.arcpublishing.com/infobae/DA56FXE4BLJYVG5VZ5KDAPRJ5A.jpg
43,https://www.infobae.com/economia/2021/04/08/el-mercado-sintio-el-impacto-del-anuncio-de-nuevas-restricciones-y-aumento-la-demanda-de-dolares/,El mercado sintió el impacto del anuncio de nuevas restricciones y aumentó la demanda de dólares ,https://www.infobae.com/economia/2021/04/08/el-mercado-sintio-el-impacto-del-anuncio-de-nuevas-restricciones-y-aumento-la-demanda-de-dolares/,https://cloudfront-us-east-1.images.arcpublishing.com/infobae/VRIR4ZZ3TRGUTIFB5T737YPSYI.jpg
44,https://www.infobae.com/deportes/2021/04/08/una-interna-sangrienta-y-los-tentaculos-del-narcotrafico-condenaron-por-asesinato-al-lider-de-la-barra-all-boys/,Una interna sangrienta y los tentáculos del narcotráfico: condenaron por asesinato al líder de la barra All Boys,https://www.infobae.com/deportes/2021/04/08/una-interna-sangrienta-y-los-tentaculos-del-narcotrafico-condenaron-por-asesinato-al-lider-de-la-barra-all-boys/,https://cloudfront-us-east-1.images.arcpublishing.com/infobae/RCBE3EYJ7FAHLM2CUJ66W5AE5M.jpg
45,https://www.infobae.com/cultura/2021/04/08/reabrio-el-lacma-en-los-angeles-tickets-en-linea-visitantes-con-cubreboca-y-mucho-arte-contemporaneo/,"Reabrió el LACMA en Los Angeles: tickets en línea, visitantes con cubreboca y mucho arte contemporáneo ",https://www.infobae.com/cultura/2021/04/08/reabrio-el-lacma-en-los-angeles-tickets-en-linea-visitantes-con-cubreboca-y-mucho-arte-contemporaneo/,https://cloudfront-us-east-1.images.arcpublishing.com/infobae/JLFTBVSTOZAU5DBZLBNSMLPOC4.JPG
46,https://www.infobae.com/america/eeuu/2021/04/05/miami-dade-levanta-el-toque-de-queda-los-comercios-podran-permanecer-abiertos-mas-alla-de-la-medianoche/,"Tras el exitoso plan de vacunación, Miami levanta todas las restricciones nocturnas",https://www.infobae.com/america/eeuu/2021/04/05/miami-dade-levanta-el-toque-de-queda-los-comercios-podran-permanecer-abiertos-mas-alla-de-la-medianoche/,https://cloudfront-us-east-1.images.arcpublishing.com/infobae/A5HDMUBWGZGKXNN7NVKLJVVURI.jpg
47,https://www.infobae.com/deportes/2021/04/08/tras-la-inesperada-baja-de-capaldo-por-covid-19-el-consejo-de-futbol-de-boca-acelero-gestiones-por-un-lateral-derecho-extranjero/,"Tras la inesperada baja de Capaldo por COVID-19, el Consejo de Fútbol de Boca aceleró gestiones por un lateral derecho extranjero",https://www.infobae.com/deportes/2021/04/08/tras-la-inesperada-baja-de-capaldo-por-covid-19-el-consejo-de-futbol-de-boca-acelero-gestiones-por-un-lateral-derecho-extranjero/,https://cloudfront-us-east-1.images.arcpublishing.com/infobae/PYVV57KRHJDKNBSXQHKHUK26RQ
48,https://www.infobae.com/america/america-latina/2021/04/08/el-frustrado-intento-de-detencion-al-rapero-maykel-osorbo-muestra-como-la-sociedad-cubana-desafia-a-la-dictadura-castrista/,El video que muestra cómo vecinos se enfrentaron a la dictadura cubana e impidieron el arresto del rapero Maykel Osorbo: “¡Abusadores! ¡Asesinos!”,https://www.infobae.com/america/america-latina/2021/04/08/el-frustrado-intento-de-detencion-al-rapero-maykel-osorbo-muestra-como-la-sociedad-cubana-desafia-a-la-dictadura-castrista/,https://cloudfront-us-east-1.images.arcpublishing.com/infobae/ITG3UDBI25FOVI43NBPYOO364M.jpg
