n,id,title,url,image
1,2667064,Análisis. La educación en un país pobre: un conflicto estratégico,https://www.lanacion.com.ar/politica/la-educacion-en-un-pais-pobre-un-conflicto-estrategico-nid20042021/,https://bucket1.glanacion.com/anexos/fotos/96/3720996.jpg
2,2667690,Docentes. Larreta: ''Ojalá el Gobierno nos hubiera dado vacunas más rápido'',https://www.lanacion.com.ar/sociedad/coronavirus-y-docentes-horacio-rodriguez-larreta-ojala-el-gobierno-nos-hubiera-dado-vacunas-mas-nid20042021/,https://bucket1.glanacion.com/anexos/fotos/95/3721695.jpg
3,2667010,Opinión. La invención de un enemigo impensado,https://www.lanacion.com.ar/politica/la-invencion-de-un-enemigo-impensado-nid19042021/,https://bucket1.glanacion.com/anexos/fotos/30/3720930.jpg
4,2666658,Coronavirus. Cuáles son los riesgos de no ponerse la segunda dosis de la vacuna,https://www.lanacion.com.ar/el-mundo/coronavirus-cuales-son-los-riesgos-de-no-ponerse-la-segunda-dosis-de-la-vacuna-nid19042021/,https://bucket1.glanacion.com/anexos/fotos/59/3720559.jpg
5,2666724,Covid. La Ciudad habilitó  la inscripción para vacunar a los mayores de 65,https://www.lanacion.com.ar/sociedad/coronavirus-la-ciudad-habilitara-manana-la-inscripcion-para-vacunar-a-los-mayores-de-65-nid19042021/,https://bucket1.glanacion.com/anexos/fotos/27/3720727.jpg
6,2666609,El increíble hallazgo arqueológico en la casa donde Rosas vivió más de 40 años,https://www.lanacion.com.ar/turismo/el-increible-hallazgo-arqueologico-en-la-casa-de-monserrat-donde-rosas-vivio-mas-de-40-anos-nid19042021/,https://bucket1.glanacion.com/anexos/fotos/22/3720422.jpg
7,2667699,Bajo el ala de Cristina. Cómo afrontará el año electoral el Instituto Patria,https://www.lanacion.com.ar/politica/bajo-el-ala-de-cristina-kirchner-el-instituto-patria-se-expandio-en-pandemia-y-ya-piensa-en-las-nid20042021/,https://bucket1.glanacion.com/anexos/fotos/41/3721741.jpg
8,2666764,CABA. Un fallo determinó que las clases presenciales no sean obligatorias,https://www.lanacion.com.ar/politica/clases-un-fallo-determino-que-la-presencialidad-en-las-escuelas-portenas-no-sean-obligatoria-nid19042021/,https://bucket1.glanacion.com/anexos/fotos/55/3720755.jpg
9,2666546,Bloqueos. Se agrava el desabastecimiento en la zona de Vaca Muerta,https://www.lanacion.com.ar/economia/industria/paradoja-argentina-falta-nafta-en-la-principal-provincia-petrolera-del-pais-nid19042021/,https://bucket1.glanacion.com/anexos/fotos/13/3720313.jpg
10,2667023,Casa propia. Cómo son los créditos hipotecarios que anunciará el Gobierno,https://www.lanacion.com.ar/economia/el-gobierno-anunciara-hoy-87000-creditos-para-la-construccion-nid20042021/,https://bucket1.glanacion.com/anexos/fotos/43/3720943.jpg
11,2666773,Oscar 2021. Por qué debería ganar cada una de las ocho nominadas a mejor película,https://www.lanacion.com.ar/espectaculos/cine/oscar-2021-que-pelicula-deberia-quedarse-con-el-mayor-premio-de-la-noche-nid19042021/,https://bucket1.glanacion.com/anexos/fotos/90/3720790.gif
12,2666720,Tras la misión de Biden. La Argentina compra aviones a los Estados Unidos,https://www.lanacion.com.ar/politica/tras-la-visita-del-enviado-de-joe-biden-la-argentina-compra-aviones-a-los-estados-unidos-nid19042021/,https://bucket1.glanacion.com/anexos/fotos/26/3720726.jpg
13,2666782,Los detalles. El Gobierno oficializó el nuevo registro para exportar carne,https://www.lanacion.com.ar/economia/campo/ganaderia/el-gobierno-formalizara-el-nuevo-registro-para-exportar-carne-los-detalles-nid19042021/,https://bucket1.glanacion.com/anexos/fotos/62/3720962.jpg
14,2667646,"La vuelta de Vidal. Diálogos con Larreta, tensiones con Macri y el ""Plan B""",https://www.lanacion.com.ar/politica/la-vuelta-de-maria-eugenia-vidal-los-dialogos-con-larreta-las-tensiones-con-macri-y-el-plan-b-nid20042021/,https://bucket1.glanacion.com/anexos/fotos/92/3721592.jpeg
15,2666814,Clases. El Gobierno presentará hoy un escrito ante la Corte para defender el DNU,https://www.lanacion.com.ar/politica/el-gobierno-ultima-detalles-de-la-defensa-del-dnu-que-presentara-manana-ante-la-corte-nid19042021/,https://bucket1.glanacion.com/anexos/fotos/12/3720812.jpg
16,2667060,Campazzo. Un león en defensa y peleado con el aro en el loco triunfo de Denver,https://www.lanacion.com.ar/deportes/basquetbol/facundo-campazzo-del-arranque-pesimo-a-un-final-con-fiesta-en-el-alocado-triunfo-de-denver-sobre-nid20042021/,https://bucket1.glanacion.com/anexos/fotos/88/3720988.jpg
17,2663950,A la oficina. Por qué las compañías tecnológicas ya no quieren el trabajo remoto,https://www.lanacion.com.ar/tecnologia/a-la-oficina-por-que-las-companias-tecnologicas-ya-no-quieren-que-sus-empleados-trabajen-de-forma-nid16042021/,https://bucket1.glanacion.com/anexos/fotos/80/3716380.jpg
18,2666456,Maravillas ocultas. 7 destinos de Argentina que seguro no conocés,https://www.lanacion.com.ar/revista-ohlala/maravillas-ocultas-7-destinos-de-argentina-que-seguro-no-conoces-nid19042021/,https://bucket1.glanacion.com/anexos/fotos/10/3720010.jpg
19,2666650,Superliga europea. La fuerte frase de Bielsa y la reacción del DT de Liverpool,https://www.lanacion.com.ar/deportes/futbol/superliga-de-europa-el-contundente-rechazo-de-marcelo-bielsa-al-nuevo-torneo-la-reaccion-de-jurgen-nid19042021/,https://bucket1.glanacion.com/anexos/fotos/35/3720535.jpg
20,2667080,"Redes. El polémico tuit de Baradel, que comparó a Patricia Bullrich con Videla",https://www.lanacion.com.ar/politica/el-polemico-tuit-de-roberto-baradel-que-comparo-a-patricia-bullrich-con-videla-nid20042021/,https://bucket1.glanacion.com/anexos/fotos/17/3721017.jpg
21,2666734,The New York Times. La dura mirada sobre el avance de la pobreza en el país,https://www.lanacion.com.ar/economia/la-dura-mirada-del-new-york-times-sobre-el-avance-de-la-pobreza-en-la-argentina-nid19042021/,https://bucket1.glanacion.com/anexos/fotos/13/3720713.jpg
22,2666545,Propiedades. Las oportunidades están en los departamentos a estrenar,https://www.lanacion.com.ar/propiedades/inversiones/oportunidad-cuanto-hay-de-rebaja-en-los-departamentos-a-estrenar-y-por-que-nid19042021/,https://bucket1.glanacion.com/anexos/fotos/12/3720312.jpg
23,2667066,Tinnitus. En qué consiste la enfermedad que afecta la carrera de Luis Miguel,https://www.lanacion.com.ar/espectaculos/series-de-tv/tinnitus-en-que-consiste-la-enfermedad-que-afecta-la-carrera-de-luis-miguel-nid20042021/,https://bucket1.glanacion.com/anexos/fotos/97/3720997.jpg
24,2666700,Cambios de época´. Por qué ya no llamarán a Isabel por su histórico apodo,https://www.lanacion.com.ar/lifestyle/cambios-en-la-corona-por-que-ya-no-llamaran-a-isabel-por-su-apodo-nid19042021/,https://bucket1.glanacion.com/anexos/fotos/42/3720642.jpg
25,2667020,Los aprendizajes de la rebelión de los padres,https://www.lanacion.com.ar/opinion/los-aprendizajes-de-la-rebelion-de-los-padres-nid20042021/,https://bucket1.glanacion.com/anexos/fotos/00/3721000.jpg
26,2665322,"Riesgo muy alto. Segunda ola, inflación y elecciones, el peligroso combo de 2021",https://www.lanacion.com.ar/economia/segunda-ola-inflacion-y-elecciones-un-combo-complicado-nid18042021/,
27,2667031,"Larreta ganó los primeros rounds, pero la pelea no terminó",https://www.lanacion.com.ar/opinion/rodriguez-larreta-gano-los-primeros-rounds-pero-la-pelea-no-termino-nid20042021/,
28,2667019,"Visión, trabajo, calidad;  la fórmula de siempre",https://www.lanacion.com.ar/opinion/vision-trabajo-calidad-la-formula-de-siempre-nid20042021/,
29,2667025,Desvergonzada maniobra para colonizar el Ministerio Público,https://www.lanacion.com.ar/editoriales/desvergonzada-maniobra-para-colonizar-el-ministerio-publico-nid20042021/,
30,2667022,El censo también es esencial,https://www.lanacion.com.ar/editoriales/el-censo-tambien-es-esencial-nid20042021/,
31,2666649,Internada. Servini le pidió a Hornos que renuncie a la presidencia de Casación,https://www.lanacion.com.ar/politica/internada-por-covid-la-jueza-maria-servini-le-pidio-a-gustavo-hornos-que-renuncie-a-la-presidencia-nid19042021/,https://bucket1.glanacion.com/anexos/fotos/33/3720533.jpg
32,2667691,Herido en combate. Murió el presidente de Chad tras pelear contra rebeldes,https://www.lanacion.com.ar/el-mundo/herido-en-batalla-murio-el-presidente-de-chad-tras-combatir-contra-rebeldes-nid20042021/,https://bucket1.glanacion.com/anexos/fotos/97/3721697.jpg
33,2666762,"No tenía ni siquiera luz, se graduó en cinco carreras y da clases en Oxford",https://www.lanacion.com.ar/sociedad/de-la-pobreza-a-oxford-la-historia-del-argentino-que-enfrento-a-la-adversidad-nid19042021/,https://bucket1.glanacion.com/anexos/fotos/53/3720753.jpeg
34,2666532,Momias del Everest. El crudo final de los escaladores que murieron en el monte,https://www.lanacion.com.ar/el-mundo/momias-del-everest-el-crudo-final-de-los-escaladores-que-murieron-en-el-monte-nid19042021/,https://bucket1.glanacion.com/anexos/fotos/85/3720285.jpg
35,2666614,En Madrid. El restaurante argentino que sorprende con recetas de Israel,https://www.lanacion.com.ar/lifestyle/el-restaurante-argentino-que-sorprende-en-madrid-con-recetas-de-israel-nid19042021/,https://bucket1.glanacion.com/anexos/fotos/39/3720439.jpg
36,2666716,¿Un nuevo femicidio? Búsqueda desesperada de una pareja en Los Toldos,https://www.lanacion.com.ar/seguridad/desesperada-busqueda-de-una-pareja-en-los-toldos-temen-que-se-trate-de-un-femicidio-nid19042021/,https://bucket1.glanacion.com/anexos/fotos/04/3720704.jpg
37,2666621,"El desopilante cruce entre Christian Martin y tres ""borrachines""",https://www.lanacion.com.ar/deportes/christian-martin-fue-interrumpido-por-tres-jovenes-ingleses-mientras-hacia-un-movil-nid19042021/,https://bucket1.glanacion.com/anexos/fotos/70/3720470.jpg
38,2666497,Superfetación. El caso de la mujer que estaba embarazada y volvió a gestar,https://www.lanacion.com.ar/el-mundo/superfetacion-el-caso-de-la-mujer-que-estaba-embarazada-y-volvio-a-gestar-nid19042021/,https://bucket1.glanacion.com/anexos/fotos/69/3720169.jpg
39,2666702,"Polémica. Flor Peña, sobre Erica Rivas: ''Lo que ella dice no fue lo que pasó''",https://www.lanacion.com.ar/espectaculos/personajes/florencia-pena-sobre-las-declaraciones-de-erica-rivas-lo-que-ella-dice-no-fue-lo-que-paso-nid19042021/,https://bucket1.glanacion.com/anexos/fotos/44/3720644.jpg
40,2666626,A meses de quedar libre. El Kun disfruta de Manchester de una forma particular,https://www.lanacion.com.ar/deportes/a-pocos-meses-de-quedar-sin-club-el-kun-aguero-pasea-tranquilo-por-manchester-junto-a-su-novia-sofia-nid19042021/,https://bucket1.glanacion.com/anexos/fotos/78/3720478.jpg
41,2666089,Cecilia Dopazo sufrió un percance durante una entrevista: ''Sigan como si nada'',https://www.lanacion.com.ar/espectaculos/television/cecilia-dopazo-sufrio-un-percance-durante-una-entrevista-sigan-como-si-nada-nid18042021/,https://bucket1.glanacion.com/anexos/fotos/72/3719472.jpg
42,2666655,Dura historia. La joven chef que no podrá volver a comer,https://www.lanacion.com.ar/lifestyle/la-joven-chef-que-no-podra-volver-a-comer-nid19042021/,https://bucket1.glanacion.com/anexos/fotos/52/3720552.jpg
43,2666594,Covid. Dos nuevos hitos en la vacunación aumentan el optimismo en EE.UU.,https://www.lanacion.com.ar/el-mundo/la-mitad-de-los-adultos-ya-se-vacunaron-en-eeuu-que-empieza-a-inmunizar-a-todos-los-mayores-de-16-nid19042021/,https://bucket1.glanacion.com/anexos/fotos/94/3720394.png
44,2667688,"Mendoza. ''Estamos al borde del colapso y muy cansados'', denuncian los médicos",https://www.lanacion.com.ar/sociedad/coronavirus-en-mendoza-estamos-al-borde-del-colapso-y-muy-cansados-denuncian-los-medicos-nid20042021/,https://bucket1.glanacion.com/anexos/fotos/92/3721692.jpg
45,2667658,De padre a hijo. El emotivo mensaje que Adolfito Cambiaso le dedicó a Poroto,https://www.lanacion.com.ar/deportes/polo/de-padre-a-hijo-el-emotivo-mensaje-que-adolfito-cambiaso-le-dedico-a-poroto-nid20042021/,https://bucket1.glanacion.com/anexos/fotos/19/3721619.jpg
46,2666552,Sarmiento. Su esperado primer discurso afirmando la importancia de la educación,https://www.lanacion.com.ar/lifestyle/sarmiento-su-esperado-primer-discurso-afirmando-la-importancia-de-la-educacion-nid19042021/,https://bucket1.glanacion.com/anexos/fotos/27/3720327.jpg
47,2667686,Cuentos por teléfono: una idea de la Biblioteca Argentina de Rosario para imitar,https://www.lanacion.com.ar/cultura/suena-el-telefono-y-se-escuchan-cuentos-una-idea-de-la-biblioteca-argentina-para-imitar-y-reinventar-nid20042021/,https://bucket1.glanacion.com/anexos/fotos/68/3721668.jpg
48,2667689,Covid: bioquímicos bonaerenses rechazan la venta de testeos caseros,https://www.lanacion.com.ar/sociedad/el-plan-b-para-la-pandemia-es-la-concientizacion-social-y-seriedad-profesional-nid20042021/,https://bucket1.glanacion.com/anexos/fotos/93/3721693.jpg
49,2666822,"María Eugenia Vidal: ''Voy a ponerle el cuerpo a esta elección""",https://www.lanacion.com.ar/politica/maria-eugenia-vidal-voy-a-ponerle-el-cuerpo-a-esta-eleccion-nid19042021/,https://bucket1.glanacion.com/anexos/fotos/29/3720829.jpg
50,2666787,Sobre su papá. Jony Viale: ''La última vez que lo vi fue en la ambulancia'',https://www.lanacion.com.ar/espectaculos/jony-viale-sobre-su-papa-la-ultima-vez-que-lo-vi-fue-en-la-ambulancia-nid19042021/,https://bucket1.glanacion.com/anexos/fotos/98/3720798.jpg
51,2666481,Medio ambiente. Qué están haciendo las organizaciones para ser agentes de cambio,https://www.lanacion.com.ar/economia/negocios/futuro-sostenible-que-estan-haciendo-las-organizaciones-para-ser-agentes-de-cambio-nid19042021/,https://bucket1.glanacion.com/anexos/fotos/76/3720176.jpg
52,2666646,"""Toto"" Caputo. Deuda, FMI y en qué invertir, según el exministro de Finanzas",https://www.lanacion.com.ar/economia/luis-toto-caputo-su-relacion-con-el-fmi-la-razon-de-por-que-se-endeudaron-y-su-vision-sobre-el-nid19042021/,https://bucket1.glanacion.com/anexos/fotos/26/3720526.jpg
53,2666641,"''Impotencia"". La bronca de un productor por la rotura de dos silobolsas",https://www.lanacion.com.ar/economia/campo/no-hicimos-mal-a-nadie-la-bronca-de-un-productor-por-la-rotura-de-dos-silobolsas-nid19042021/,https://bucket1.glanacion.com/anexos/fotos/14/3720514.jpg
54,2666625,Ahorros. Depositá tus ahorros en este banco digital y ganá plata con la mejor tasa,https://www.lanacion.com.ar/economia/deposita-tus-ahorros-en-este-banco-digital-y-gana-plata-con-la-mejor-tasa-del-mercado-nid19042021/,https://bucket1.glanacion.com/anexos/fotos/77/3720477.png
55,2666771,"Rodaje. Mi primer beso, el polémico film que se convirtió en un éxito inesperado",https://www.lanacion.com.ar/espectaculos/cine/mi-primer-beso-la-pelicula-que-genero-polemica-y-hasta-un-boicot-pero-se-convirtio-en-un-exito-nid19042021/,https://bucket1.glanacion.com/anexos/fotos/65/3720765.jpg
56,2666728,Pablo Lescano. Su propuesta amorosa a Jennifer Lopez que revolucionó las redes,https://www.lanacion.com.ar/espectaculos/personajes/la-propuesta-amorosa-de-pablo-lescano-a-jennifer-lopez-que-revoluciono-las-redes-nid19042021/,https://bucket1.glanacion.com/anexos/fotos/02/3720702.jpg
57,2666689,"TV. Nicole Neumann y Fabián Cubero, unidos por la salud de una de sus hijas",https://www.lanacion.com.ar/espectaculos/personajes/nicole-neumann-y-fabian-cubero-unidos-por-la-salud-de-una-de-sus-hijas-nid19042021/,https://bucket1.glanacion.com/anexos/fotos/06/3720606.jpg
58,2667697,"Superliga. Infantino, Ceferin y una ronda de amenazas en el congreso de la UEFA",https://www.lanacion.com.ar/deportes/futbol/superliga-europea-gianni-infantino-amenaza-a-los-clubes-rebeldes-y-aleksander-ceferin-los-invita-a-nid20042021/,https://bucket1.glanacion.com/anexos/fotos/13/3721713.jpg
59,2667684,Nicolas Abot. El mochilero del gol que vive con lo puesto,https://www.lanacion.com.ar/deportes/futbol/jugar-y-vivir-con-lo-puesto-nicolas-abot-el-abreu-argentino-nid20042021/,https://bucket1.glanacion.com/anexos/fotos/62/3721662.jpg
60,2667676,Delfina Pignatiello. El festejo íntimo del cumpleaños 21 de la joya de la natación,https://www.lanacion.com.ar/deportes/delfina-pignatiello-el-cumpleanos-21-de-la-gran-esperanza-argentina-de-natacion-nid20042021/,https://bucket1.glanacion.com/anexos/fotos/39/3721639.jpg
61,2666718,"Baja de precios. Por qué ya no hay mercado para contraofertas ""agresivas""",https://www.lanacion.com.ar/propiedades/casas-y-departamentos/propiedades-se-acorta-la-brecha-entre-el-precio-publicado-y-el-que-se-paga-nid19042021/,https://bucket1.glanacion.com/anexos/fotos/84/3720684.jpg
62,2664145,Propiedades. Cuánto cuesta un departamento sobre el agua,https://www.lanacion.com.ar/propiedades/casas-y-departamentos/propiedades-cuanto-cuesta-vivir-a-la-vera-del-rio-o-el-mar-nid16042021/,https://bucket1.glanacion.com/anexos/fotos/45/3716845.jpg
63,2666553,Acelga. Recetas con la hortaliza comodín que se adapta a todos los menús,https://www.lanacion.com.ar/lifestyle/acelga-recetas-con-la-hortaliza-comodin-que-se-adapta-a-todos-los-menues-nid19042021/,https://bucket1.glanacion.com/anexos/fotos/31/3720331.jpg
64,2666511,Miniescáner. Muestran cómo un celular puede servir de detector de metales,https://www.lanacion.com.ar/tecnologia/como-convertir-telefonos-moviles-de-ultima-generacion-en-miniescaneres-nid19042021/,https://bucket1.glanacion.com/anexos/fotos/17/3720217.jpg
65,2664373,Especial deco. Cómo renovar un espacio para integrarlo,https://www.lanacion.com.ar/la-nacion-revista/como-renovar-un-espacio-para-integrarlo-nid17042021/,https://bucket1.glanacion.com/anexos/fotos/05/3717205.jpg
66,2666627,Yayagram. Crean un equipo para ayudar a los adultos mayores a usar Telegram,https://www.lanacion.com.ar/tecnologia/yayagram-crean-un-equipo-para-ayudar-a-los-adultos-mayores-a-usar-telegram-nid19042021/,https://bucket1.glanacion.com/anexos/fotos/82/3720482.jpg
67,2662865,Trastornos de sueño. Cómo dormir mejor con técnicas del Yoga Nidra,https://www.lanacion.com.ar/revista-ohlala/como-dormir-mejor-gracias-al-yoga-nidra-nid15042021/,https://bucket1.glanacion.com/anexos/fotos/13/3714913.jpg
68,2666697,La comida del futuro. Claves para entender qué es el plant based,https://www.lanacion.com.ar/lifestyle/la-comida-del-futuro-claves-para-entender-que-es-el-plant-based-nid19042021/,https://bucket1.glanacion.com/anexos/fotos/30/3720630.jpg
69,2666551,Corridas de toros. Crónica de una pasión perdida en Buenos Aires,https://www.lanacion.com.ar/turismo/viajes/plazas-de-toros-en-buenos-aires-cronica-de-una-pasion-perdida-nid19042021/,https://bucket1.glanacion.com/anexos/fotos/20/3720320.jpg
70,2666622,Harari. ''El 2020 fue testigo de un fracaso total del liderazgo global'',https://www.lanacion.com.ar/economia/harari-el-2020-fue-testigo-de-un-fracaso-total-del-liderazgo-global-nid19042021/,https://bucket1.glanacion.com/anexos/fotos/71/3720471.jpg
71,2665094,Huerta de otoño. Cinco aromáticas para empezar a cultivar ahora,https://www.lanacion.com.ar/revista-jardin/huerta-de-otono-cinco-plantas-aromaticas-para-empezar-a-cultivar-en-esta-epoca-del-ano-nid17042021/,https://bucket1.glanacion.com/anexos/fotos/75/3718075.jpg
72,2666469,Vacunas. ¿Se podría haber llegado a más población con el plan original?,https://www.lanacion.com.ar/sociedad/se-podria-haber-vacunado-mejor-a-la-poblacion-de-riesgo-con-la-misma-cantidad-de-vacunas-nid19042021/,https://bucket1.glanacion.com/anexos/fotos/42/3720042.jpg
73,2494593,Led Zeppelin. El legendario debut en 1969 que inauguró otra forma de hacer rock,,https://bucket1.glanacion.com/anexos/fotos/17/3463717.jpg
74,2337795,"Waco. La secta del ""mesías pecador"" que desató una masacre con 76 víctimas",,https://bucket1.glanacion.com/anexos/fotos/06/3203506.jpg
75,2666089,Cecilia Dopazo sufrió un percance durante una entrevista: ''Sigan como si nada'',https://www.lanacion.com.ar/espectaculos/television/cecilia-dopazo-sufrio-un-percance-durante-una-entrevista-sigan-como-si-nada-nid18042021/,https://bucket1.glanacion.com/anexos/fotos/72/3719472.jpg
76,2666674,En medio del rebrote. El descargo de Stefi Roitman tras convocar a una fiesta,https://www.lanacion.com.ar/espectaculos/el-descargo-de-stefi-roitman-tras-las-criticas-por-convocar-a-una-fiesta-en-medio-del-rebrote-de-nid19042021/,https://bucket1.glanacion.com/anexos/fotos/86/3720586.png
77,2666643,En redes. Federico Amador compartió su nueva y desconocida profesión,https://www.lanacion.com.ar/espectaculos/federico-amador-compartio-con-sus-seguidores-su-nueva-y-extrana-profesion-nid19042021/,https://bucket1.glanacion.com/anexos/fotos/17/3720517.png
78,2666025,"""Hay mucha saña"". Raúl Cascini le respondió al ""Pollo"" Vignolo sin nombrarlo",https://www.lanacion.com.ar/deportes/raul-cascini-le-respondio-a-sebastian-vignolo-sin-nombrarlo-y-dijo-que-hay-mucha-sana-en-sus-nid18042021/,https://bucket1.glanacion.com/anexos/fotos/27/3719327.jpg
79,2666693,"Sorpresa. El jugado cambio de look de Momo, el hijo de Jimena Barón",https://www.lanacion.com.ar/espectaculos/el-jugado-cambio-de-look-de-momo-el-hijo-de-jimena-baron-nid19042021/,https://bucket1.glanacion.com/anexos/fotos/13/3720613.png
