n,id,title,url,image
1,2633864,Fuerte interna. La furia de Berni y el insulto al número dos de Frederic,https://www.lanacion.com.ar/seguridad/sergio-berni-vos-y-tu-ministra-son-unos-cagones-nid18032021/,https://bucket1.glanacion.com/anexos/fotos/12/3669212.jpeg
2,2634000,Primer Tiempo. Mauricio Macri presenta su libro,https://www.lanacion.com.ar/politica/primer-tiempo-quienes-acompanan-a-macri-en-la-presentacion-de-su-libro-nid18032021/,https://bucket1.glanacion.com/anexos/fotos/43/3669543.jpeg
3,2634012,En fotos. Los políticos y famosos que fueron a la presentación del libro de Macri,https://www.lanacion.com.ar/politica/en-fotos-los-politicos-y-famosos-que-fueron-a-la-presentacion-del-libro-de-macri-nid18032021/,https://bucket1.glanacion.com/anexos/fotos/64/3669564.jpg
4,2633984,"Apareció la niña. Así era el lugar donde vivía, en Barrio Cildañez",https://www.lanacion.com.ar/seguridad/aparecio-maia-asi-era-el-lugar-donde-vivia-en-barrio-cildanez-nid18032021/,https://bucket1.glanacion.com/anexos/fotos/02/3669502.jpg
5,2633865,Durísima. La crítica de Sergio Berni a Sabina Frederic,https://www.lanacion.com.ar/seguridad/aparecio-maia-durisima-critica-de-sergio-berni-a-sabina-frederic-nid18032021/,https://bucket1.glanacion.com/anexos/fotos/13/3669213.jpg
6,2633999,"Santa Fe. Tras el escándalo, Perotti desplazó al ministro Marcelo Sain",https://www.lanacion.com.ar/seguridad/santa-fe-tras-el-escandalo-perotti-desplazo-al-ministro-de-seguridad-marcelo-sain-nid18032021/,https://bucket1.glanacion.com/anexos/fotos/42/3669542.jpg
7,2633884,"Respuesta. Frederic criticó a Berni: ''Es un problema de ego""",https://www.lanacion.com.ar/politica/aparecio-maia-el-gobierno-nacional-apunto-contra-berni-esta-loco-nid18032021/,https://bucket1.glanacion.com/anexos/fotos/63/3669263.jpg
8,2633783,Video. El momento en el que la policía encontró a la niña,https://www.lanacion.com.ar/seguridad/aparecio-maia-asi-fue-el-momento-del-hallazgo-nid18032021/,https://bucket1.glanacion.com/anexos/fotos/23/3669023.jpg
9,2633889,Primeros pasos. El video de Messi que conmueve a los hinchas del Barcelona,https://www.lanacion.com.ar/deportes/guno-del-barcelona-los-primeros-pasos-de-lionel-messi-en-el-club-en-un-nuevo-video-que-conmueve-a-nid18032021/,https://bucket1.glanacion.com/anexos/fotos/74/3669274.jpg
10,2633880,Coronavirus. Nuevas medidas: acuerdan reducir los vuelos al exterior,https://www.lanacion.com.ar/politica/coronavirus-acuerdan-reducir-los-vuelos-al-exterior-para-evitar-contagios-nid18032021/,https://bucket1.glanacion.com/anexos/fotos/43/3669243.jpg
11,2633800,Tras el hallazgo. El mensaje de María Eugenia Vidal sobre la niña,https://www.lanacion.com.ar/seguridad/aparecio-maia-el-mensaje-de-maria-eugenia-vidal-tras-el-hallazgo-de-la-nina-nid18032021/,https://bucket1.glanacion.com/anexos/fotos/62/3669062.jpg
12,2633937,Expectativas. Cae el interés en una inversión estrella por el freno al dólar,https://www.lanacion.com.ar/economia/del-estrellato-al-ocaso-los-bonos-dollar-link-victimas-del-freno-al-dolar-nid18032021/,https://bucket1.glanacion.com/anexos/fotos/78/3669378.jpg
13,2633882,Blooper. Burgos dijo ''Esto es Europa'' y se cayó un banner,https://www.lanacion.com.ar/deportes/german-burgos-y-un-blooper-en-su-presentacion-en-newells-dijo-esto-es-europa-y-se-cayo-un-banner-nid18032021/,https://bucket1.glanacion.com/anexos/fotos/48/3669248.jpg
14,2633949,Por supuestas presiones. Servini citó a indagatoria a Pepín Rodríguez Simón,https://www.lanacion.com.ar/politica/la-jueza-maria-servini-cito-a-indagatoria-a-fabian-rodriguez-simon-nid18032021/,https://bucket1.glanacion.com/anexos/fotos/05/3669405.jpg
15,2633974,Coronavirus. Se sumaron 155 muertos y 8328 nuevos contagios,https://www.lanacion.com.ar/sociedad/coronavirus-en-la-argentina-se-sumaron-155-muertos-y-8328-nuevos-contagios-nid18032021/,https://bucket1.glanacion.com/anexos/fotos/72/3669472.jpg
16,2633887,"Vacunas en ""cuarentena"". Las congelaron creyendo que eran rusas y no servirían",https://www.lanacion.com.ar/sociedad/vacunas-en-cuarentena-las-congelaron-creyendo-que-eran-rusas-y-no-servirian-mas-nid18032021/,https://bucket1.glanacion.com/anexos/fotos/70/3669270.jpeg
17,2633928,Viajes. Los insólitos archivos de las declaraciones juradas de los pasajeros,https://www.lanacion.com.ar/sociedad/viajes-al-exterior-los-insolitos-archivos-que-adjuntan-los-pasajeros-en-sus-declaraciones-juradas-nid18032021/,https://bucket1.glanacion.com/anexos/fotos/50/3669350.jpg
18,2634001,"Hito. Con la mitad de la población con dos dosis, Israel sueña con un repunte",https://www.lanacion.com.ar/el-mundo/otro-hito-con-la-mitad-de-la-poblacion-con-las-dos-dosis-israel-suena-con-un-repunte-nid18032021/,https://bucket1.glanacion.com/anexos/fotos/44/3669544.jpg
19,2633998,Wall Street recibió a Guzmán con amargura y escepticismo,https://www.lanacion.com.ar/economia/wall-street-recibio-a-guzman-con-amargura-y-escepticismo-nid18032021/,https://bucket1.glanacion.com/anexos/fotos/41/3669541.jpg
20,2633991,La oposición insiste para que Cristina no cobre las pensiones vitalicias,https://www.lanacion.com.ar/politica/la-oposicion-insiste-para-que-cristina-no-cobre-las-pensiones-vitalicias-nid18032021/,https://bucket1.glanacion.com/anexos/fotos/24/3669524.png
21,2633987,Impacto. El drama del exjugador de la NBA que actuó en la película de Jordan,https://www.lanacion.com.ar/deportes/el-terrible-accidente-de-shawn-bradley-el-exjugador-de-la-nba-que-actuo-en-la-pelicula-space-jam-nid18032021/,https://bucket1.glanacion.com/anexos/fotos/09/3669509.jpg
22,2632965,Tras el Covid-19. Las secuelas que interfieren en la calidad de vida,https://www.lanacion.com.ar/sociedad/secuelas-detectan-sintomas-a-largo-plazo-en-pacientes-que-padecieron-covid-nid17032021/,https://bucket1.glanacion.com/anexos/fotos/12/3668112.gif
23,2621191,Departamentos. Los barrios porteños más afectados por la baja de precios,https://www.lanacion.com.ar/propiedades/casas-y-departamentos/departamentos-los-barrios-portenos-mas-afectados-por-la-baja-de-precios-nid05032021/,https://bucket1.glanacion.com/anexos/fotos/51/3668051.jpg
24,2633958,"EE.UU. La triple amenaza que enfrenta Miami por la pandemia y el ""spring break""",https://www.lanacion.com.ar/el-mundo/miami-la-triple-amenaza-que-enfrenta-por-la-pandemia-y-el-spring-break-nid18032021/,https://bucket1.glanacion.com/anexos/fotos/25/3669425.jpg
25,2633066,"Escribano, una biografía indispensable",https://www.lanacion.com.ar/opinion/escribano-una-biografia-indispensable-nid18032021/,https://bucket1.glanacion.com/anexos/fotos/22/3668222.jpg
26,2633073,Efectos jurídicos de emojis y likes,https://www.lanacion.com.ar/opinion/efectos-juridicos-de-emojis-y-likes-nid18032021/,
27,2633068,Un problema recurrente: el gasto público,https://www.lanacion.com.ar/opinion/un-problema-recurrente-el-gasto-publico-nid18032021/,
28,2633009,Fernández entra a la campaña envuelto en las banderas del populismo,https://www.lanacion.com.ar/politica/alberto-fernandez-entra-a-la-campana-envuelto-en-las-banderas-del-populismo-nid18032021/,
29,2633078,Disparen contra jueces y fiscales,https://www.lanacion.com.ar/editoriales/disparen-contra-jueces-y-fiscales-nid18032021/,
30,2633067,El programa de Biden,https://www.lanacion.com.ar/editoriales/el-programa-de-biden-nid18032021/,
31,2634004,Adiós a El Cairo. Egipto prepara la mudanza a su fastuosa nueva capital,https://www.lanacion.com.ar/el-mundo/adios-a-el-cairo-egipto-prepara-la-mudanza-a-su-fastuosa-nueva-capital-nid18032021/,https://bucket1.glanacion.com/anexos/fotos/50/3669550.jpg
32,2633985,Bolsonaro calificó de ''imbéciles'' a quienes exigen la compra de más vacunas,https://www.lanacion.com.ar/el-mundo/jair-bolsonaro-califico-de-imbeciles-a-quienes-exigen-la-compra-de-mas-vacunas-nid18032021/,https://bucket1.glanacion.com/anexos/fotos/06/3669506.png
33,2633982,"Precios. Por qué YPF puede aumentar, pero el resto no",https://www.lanacion.com.ar/economia/por-que-ypf-puede-aumentar-sus-precios-pero-el-resto-de-las-empresas-no-nid18032021/,https://bucket1.glanacion.com/anexos/fotos/93/3669493.jpg
34,2633080,MasterChef Celebrity. La noche de furia de Donato de Santis,https://www.lanacion.com.ar/espectaculos/television/masterchef-celebrity-la-noche-de-furia-de-donato-de-santis-nid18032021/,https://bucket1.glanacion.com/anexos/fotos/31/3668231.jpg
35,2633004,Natasha Richardson. El trágico accidente y el dolor de Liam Neeson,https://www.lanacion.com.ar/espectaculos/personajes/12-anos-sin-natasha-richardson-el-tragico-accidente-y-el-infinito-dolor-de-liam-neeson-nid18032021/,https://bucket1.glanacion.com/anexos/fotos/34/3668134.jpg
36,2633860,AstraZeneca. La Unión Europea concluye que la vacuna es ''segura y eficaz'',https://www.lanacion.com.ar/el-mundo/astrazeneca-la-union-europea-concluye-que-la-vacuna-es-segura-y-eficaz-nid18032021/,https://bucket1.glanacion.com/anexos/fotos/08/3669208.jpg
37,2633869,Sara Carbonero. Rompió el silencio tras anunciar su separación de Iker Casillas,https://www.lanacion.com.ar/espectaculos/sara-carbonero-rompio-el-silencio-tras-anunciar-su-separacion-de-iker-casillas-nid18032021/,https://bucket1.glanacion.com/anexos/fotos/20/3669220.png
38,2633804,Investigación. El imperio de US$ 28.000 millones de la familia real británica,https://www.lanacion.com.ar/el-mundo/investigacion-como-es-el-imperio-de-28000-millones-de-dolares-que-administra-la-familia-real-nid18032021/,https://bucket1.glanacion.com/anexos/fotos/69/3669069.png
39,2633943,La Pampa. Puso una casilla rural para que sus hijos puedan asistir al colegio,https://www.lanacion.com.ar/economia/campo/en-la-pampa-le-puso-una-casilla-a-sus-hijos-para-que-puedan-asistir-al-colegio-nid18032021/,https://bucket1.glanacion.com/anexos/fotos/95/3669395.png
40,2632872,Messi y CR7. Los lujosos estilos de vida de los reyes de fútbol,https://www.lanacion.com.ar/deportes/lionel-messi-y-cristiano-ronaldo-como-son-sus-lujosas-vidas-en-mansiones-yates-y-autos-de-alta-gama-nid17032021/,https://bucket1.glanacion.com/anexos/fotos/36/3667836.jpg
41,2632747,"""Merecías otro final"". Belu Lucius, furiosa con la UAR por el trato a Desio",https://www.lanacion.com.ar/deportes/merecias-otro-final-belu-lucius-furiosa-con-la-uar-por-el-trato-a-javier-ortega-desio-nid17032021/,https://bucket1.glanacion.com/anexos/fotos/79/3667279.jpg
42,2633837,Icardi y Wanda Nara. El rumor que un exfutbolista lanzó sobre su vida íntima,https://www.lanacion.com.ar/deportes/el-rumor-que-un-exfutbolista-italiano-lanzo-sobre-la-vida-intima-de-mauro-icardi-y-wanda-nara-nid18032021/,https://bucket1.glanacion.com/anexos/fotos/50/3669150.jpg
43,2632960,Jony Viale. Sobre la economía: ''Se sigue destrozando a la clase media'',https://www.lanacion.com.ar/espectaculos/jonatan-viale-critico-la-politica-economica-mientras-se-destroza-a-la-clase-media-nid17032021/,https://bucket1.glanacion.com/anexos/fotos/87/3668087.jpg
44,2633059,"Alfredo Leuco. ''Cristina Kirchner robó, no es una perseguida política''",https://www.lanacion.com.ar/politica/alfredo-leuco-cristina-kirchner-robo-no-es-una-perseguida-politica-nid18032021/,https://bucket1.glanacion.com/anexos/fotos/10/3668210.jpg
45,2633815,Semana Santa. El Gobierno evitará dictar restricciones que limiten el turismo,https://www.lanacion.com.ar/politica/semana-santa-el-gobierno-quiere-evitar-restricciones-que-limiten-el-turismo-nid18032021/,https://bucket1.glanacion.com/anexos/fotos/07/3669107.jpg
46,2633839,Diputados. Crece la presión del kirchnerismo para sacar al procurador Casal,https://www.lanacion.com.ar/politica/diputados-crece-la-presion-del-kirchnerismo-para-aprobar-las-reformas-judiciales-y-sacar-al-nid18032021/,https://bucket1.glanacion.com/anexos/fotos/52/3669152.jpg
47,2633798,Intrigas y vacunas vip. Los planes subterráneos para cambiar la Corte bonaerense,https://www.lanacion.com.ar/politica/intrigas-y-vacunas-vip-los-planes-subterraneos-para-cambiar-la-integracion-de-la-suprema-corte-nid18032021/,https://bucket1.glanacion.com/anexos/fotos/54/3669054.jpg
48,2633901,Fabricante de Nike. Quieren venderles medias argentinas a toda la región,https://www.lanacion.com.ar/economia/negocios/us5-millones-un-fabricante-de-nike-expande-su-produccion-para-exportar-nid18032021/,https://bucket1.glanacion.com/anexos/fotos/07/3669307.jpg
49,2633861,Histórico. La yerba argentina llegará a un mercado de 1300 millones de personas,https://www.lanacion.com.ar/economia/historico-el-mercado-de-1300-millones-de-habitantes-que-se-le-abre-a-la-yerba-argentina-nid18032021/,https://bucket1.glanacion.com/anexos/fotos/09/3669209.jpg
50,2633625,Negocio. Europa pagará más por la soja certificada de la Argentina,https://www.lanacion.com.ar/economia/campo/europa-pagara-un-valor-diferencial-por-la-soja-certificada-de-la-argentina-nid18032021/,https://bucket1.glanacion.com/anexos/fotos/00/3668800.jpg
51,2634003,A nuevo. De Sofía Pachano a Lourdes Sánchez: las increíbles cocinas de las famosas,https://www.lanacion.com.ar/espectaculos/personajes/de-sofia-pachano-a-lourdes-sanchez-las-increibles-cocinas-de-las-famosas-nid18032021/,https://bucket1.glanacion.com/anexos/fotos/48/3669548.jpg
52,2633881,Series. Si te gustó Mad Men... te va a gustar Los elegidos de la gloria,https://www.lanacion.com.ar/espectaculos/series-de-tv/series-si-te-gusto-mad-men-te-va-a-gustar-los-elegidos-de-la-gloria-nid18032021/,https://bucket1.glanacion.com/anexos/fotos/44/3669244.jpg
53,2633997,Bafici 2021. Los imperdibles documentales rockeros de Penelope Spheeris,https://www.lanacion.com.ar/espectaculos/bafici-2021-los-imperdibles-documentales-rockeros-de-penelope-spheeris-nid18032021/,https://bucket1.glanacion.com/anexos/fotos/37/3669537.jpg
54,2633932,Alberto Cormillot. Un hombre de 82 años que se siente de 40,https://www.lanacion.com.ar/espectaculos/personajes/alberto-cormillot-sobre-su-paternidad-a-los-82-anos-hay-un-cliche-sobre-los-adultos-mayores-se-los-nid18032021/,https://bucket1.glanacion.com/anexos/fotos/63/3669363.jpg
55,2633993,Abuso sexual. Una mujer acusó al actor Armie Hammer de haberla violado,https://www.lanacion.com.ar/espectaculos/personajes/una-mujer-acuso-al-actor-armie-hammer-de-haberla-violado-nid18032021/,https://bucket1.glanacion.com/anexos/fotos/27/3669527.jpg
56,2634010,Increíble. El 99 de Dinamo Zagreb hizo un hat-trick y echó al Tottenham de Mou,https://www.lanacion.com.ar/deportes/el-tottenham-de-jose-mourinho-eliminado-de-la-europa-league-por-el-dinamo-zagreb-el-genial-hat-trick-nid18032021/,https://bucket1.glanacion.com/anexos/fotos/62/3669562.jpg
57,2633972,Cappa. El ''fútbol corrupto y tramposo'' y qué opina del término ''vende humo'',https://www.lanacion.com.ar/deportes/angel-cappa-su-frase-sobre-el-futbol-corrupto-y-tramposo-y-que-opina-del-termino-vende-humo-nid18032021/,https://bucket1.glanacion.com/anexos/fotos/61/3669461.jpg
58,2633938,Fórmula 1 e Indy Car. Grosjean va a fondo: en qué se diferencian los autos,https://www.lanacion.com.ar/deportes/formula-1-e-indy-car-unas-vueltas-con-romain-grosjean-para-conocer-diferencias-entre-los-autos-nid18032021/,https://bucket1.glanacion.com/anexos/fotos/80/3669380.jpg
59,2367126,Tortas fritas: una receta fácil para preparar un clásico argentino,,https://bucket1.glanacion.com/anexos/fotos/93/2670193.jpg
60,2305356,Chocolate: recetas frescas para los días de calor,,https://bucket1.glanacion.com/anexos/fotos/48/3137048.jpg
61,1942148,Panqueques ¿Cómo preparar masa para los diferentes estilos?,,https://bucket1.glanacion.com/anexos/fotos/67/2277167.jpg
62,2631737,Zona Norte. Cuánto cuesta el metro cuadrado de una casa en Nordelta,https://www.lanacion.com.ar/propiedades/casas-y-departamentos/zona-norte-cuanto-cuesta-el-metro-cuadrado-de-una-casa-en-nordelta-nid16032021/,https://bucket1.glanacion.com/anexos/fotos/82/3665882.jpg
63,2632754,¿Cómo hacen? Construyen una casa que puede sumar un piso en un día,https://www.lanacion.com.ar/propiedades/como-hacen-construyen-una-casa-que-puede-sumar-un-piso-en-un-dia-nid17032021/,https://bucket1.glanacion.com/anexos/fotos/95/3667295.jpg
64,2632891,Avocado toast. 3 recetas de huevos para poner sobre la palta,https://www.lanacion.com.ar/lifestyle/avocado-toast-3-recetas-de-huevos-para-poner-sobre-la-palta-nid17032021/,https://bucket1.glanacion.com/anexos/fotos/20/3667920.jpg
65,2633957,Whatsapp. Deja de funcionar en este modelo de iPhone con iOS 9,https://www.lanacion.com.ar/tecnologia/sin-soporte-whatsapp-deja-de-funcionar-en-este-modelo-de-iphone-con-ios-9-nid18032021/,https://bucket1.glanacion.com/anexos/fotos/24/3669424.jpg
66,2632772,En San Isidro. Una casa transparente con foco en los ambientes que se comparten,https://www.lanacion.com.ar/revista-living/en-san-isidro-una-casa-transparente-con-foco-en-los-ambientes-que-se-comparten-nid17032021/,https://bucket1.glanacion.com/anexos/fotos/37/3667337.jpg
67,2633892,Subtitulado. Chrome suma transcripciones automáticas para cualquier audio o video,https://www.lanacion.com.ar/tecnologia/con-subtitulos-google-chrome-suma-las-transcripciones-automaticas-en-tiempo-rea-nid18032021/,https://bucket1.glanacion.com/anexos/fotos/81/3669281.jpg
68,2631864,"Alejandro Rozitchner: ""Leer, ¿para qué?""",https://www.lanacion.com.ar/lifestyle/alejandro-rozitchner-leer-para-que-nid16032021/,https://bucket1.glanacion.com/anexos/fotos/12/3666212.jpg
69,2623869,"Nuevos casamientos. Con menos invitados, por zoom o con un pícnic",https://www.lanacion.com.ar/revista-ohlala/con-menos-invitados-por-zoom-o-con-un-picnic-asi-son-los-nuevos-casamientos-nid08032021/,https://bucket1.glanacion.com/anexos/fotos/34/3653534.jpg
70,2630792,"Tiburones: Llena de ellos, la llaman la capital mundial de los ataques",https://www.lanacion.com.ar/lifestyle/new-smyrna-beach-la-capital-mundial-de-los-ataques-de-tiburones-nid15032021/,https://bucket1.glanacion.com/anexos/fotos/62/3664562.jpg
71,2632853,Espectacular. Show de 400 drones y un nuevo Nissan Kicks,https://www.lanacion.com.ar/lifestyle/espectacular-show-de-drones-una-pantalla-gigante-en-el-cielo-para-presentar-el-nuevo-nissan-kicks-nid17032021/,https://bucket1.glanacion.com/anexos/fotos/48/3667748.jpg
72,2632693,"Vacunas. Lady Montagu, la pionera que trajo la idea desde Turquía a Occidente",https://www.lanacion.com.ar/turismo/viajes/lady-montagu-la-viajera-que-trajo-la-primera-vacuna-desde-turquia-nid17032021/,https://bucket1.glanacion.com/anexos/fotos/26/3667426.jpg
73,2633776,Influencers. Por qué los chicos sueñan con ese trabajo de grandes,https://www.lanacion.com.ar/sociedad/por-que-los-chicos-antes-querian-ser-astronautas-y-ahora-quieren-ser-influencers-nid18032021/,https://bucket1.glanacion.com/anexos/fotos/91/3668991.jpg
74,2632679,Microcentro. ¿Podrá recuperarse del vacío que le impuso la cuarentena?,https://www.lanacion.com.ar/sociedad/hay-vuelta-atras-para-el-microcentro-desierto-que-dejo-la-cuarentena-nid17032021/,https://bucket1.glanacion.com/anexos/fotos/94/3667094.jpg
75,2632909,Acertijo. ¿Podés descifrar cuál es el número que reemplaza a la incógnita?,https://www.lanacion.com.ar/lifestyle/acertijo-podes-descifrar-cual-es-el-numero-que-reemplaza-a-la-incognita-nid17032021/,https://bucket1.glanacion.com/anexos/fotos/83/3667983.jpg
76,2633925,China Suárez Compartió un difícil momento que atraviesa con su hijo Amancio,https://www.lanacion.com.ar/espectaculos/personajes/una-suplica-la-china-suarez-compartio-un-dificil-momento-que-atraviesa-con-su-hijo-amancio-nid18032021/,https://bucket1.glanacion.com/anexos/fotos/43/3669343.jpg
77,2632830,Molesto y enojado. La dura advertencia de Gustavo López a Germán Burgos,https://www.lanacion.com.ar/deportes/la-dura-advertencia-de-gustavo-lopez-a-german-burgos-ahora-nos-vas-a-conocer-nid17032021/,https://bucket1.glanacion.com/anexos/fotos/84/3667584.jpg
78,2634005,"A los 56. Con rastas y abdominales marcados, Lenny Kravitz mostró su cuerpo",https://www.lanacion.com.ar/lifestyle/con-rastas-y-abdominales-marcados-lenny-kravitz-mostro-su-cuerpo-y-revoluciono-las-redes-nid18032021/,https://bucket1.glanacion.com/anexos/fotos/53/3669553.jpg
79,2633986,"Pampita Embarazada de 5 meses, se robó todas las miradas",https://www.lanacion.com.ar/espectaculos/pampita-embarazada-de-5-meses-se-robo-todas-las-miradas-con-un-audaz-vestido-nid18032021/,https://bucket1.glanacion.com/anexos/fotos/07/3669507.jpg
80,2633970,En vuelo. ''Espero que este avión se estrelle'': la furia de una pasajera,https://www.lanacion.com.ar/el-mundo/espero-que-este-avion-se-estrelle-el-ataque-de-furia-de-una-pasajera-mientras-exigia-whisky-nid18032021/,https://bucket1.glanacion.com/anexos/fotos/50/3669450.jpg
