n,id,title,url,image
1,2681275,Fallo. La Corte dijo que el DNU sobre las clases violó la autonomía de la Ciudad,https://www.lanacion.com.ar/politica/la-corte-suprema-sostuvo-que-el-decreto-que-suspendio-las-clases-presenciales-violo-la-autonomia-de-nid04052021/,https://bucket1.glanacion.com/anexos/fotos/93/3740593.jpg
2,2681287,"Textuales. El voto de Rosenkrantz, con duros reproches al decreto de Fernández",https://www.lanacion.com.ar/politica/el-fallo-de-la-corte-suprema-la-emergencia-no-es-una-franquicia-para-ignorar-el-derecho-vigente-dijo-nid04052021/,https://bucket1.glanacion.com/anexos/fotos/10/3740610.jpg
3,2681319,Clases. Satisfacción y cautela en el gobierno de Larreta por el fallo de la Corte,https://www.lanacion.com.ar/politica/clases-satisfaccion-y-cautela-en-el-gobierno-de-horacio-rodriguez-larreta-por-el-fallo-de-la-corte-nid04052021/,https://bucket1.glanacion.com/anexos/fotos/70/3740670.jpg
4,2681236,"Clases en la Ciudad. Antes del fallo, el gobierno bonaerense habló de ""aberración""",https://www.lanacion.com.ar/politica/carlos-bianco-dijo-que-seria-injusto-que-la-corte-falle-a-favor-de-la-ciudad-nid04052021/,https://bucket1.glanacion.com/anexos/fotos/63/3740563.jpg
5,2681143,"Covid. Tras el fallo, el Presidente se muestra con Trotta",https://www.lanacion.com.ar/politica/a-la-espera-del-fallo-de-la-corte-el-presidente-hablara-de-educacion-y-presencialidad-junto-a-trotta-nid04052021/,https://bucket1.glanacion.com/anexos/fotos/57/3740457.jpg
6,2681322,Corte. El fallo completo sobre la autonomía porteña y las clases presenciales,https://www.lanacion.com.ar/politica/corte-suprema-el-fallo-completo-sobre-la-autonomia-de-la-ciudad-y-las-clases-presenciales-nid04052021/,https://bucket1.glanacion.com/anexos/fotos/79/3740679.jpg
7,2681337,"Tenía 71 años. Murió Eugenio Zanarini, el superintendente de Servicios de Salud",https://www.lanacion.com.ar/politica/murio-eugenio-zanarini-el-superintendente-de-servicios-de-salud-designado-por-gines-gonzalez-garcia-nid04052021/,https://bucket1.glanacion.com/anexos/fotos/90/3740690.jpg
8,2681176,Covid en Provincia. Seis municipios pasaron a fase 2 y rigen multas millonarias,https://www.lanacion.com.ar/politica/coronavirus-en-la-provincia-seis-municipios-pasaron-a-fase-2-y-establecieron-multas-millonarias-por-nid04052021/,https://bucket1.glanacion.com/anexos/fotos/67/3740467.jpg
9,2681235,"Gira. Fernández acorta el viaje, suma a Guzmán a la comitiva y visitará al Papa",https://www.lanacion.com.ar/politica/alberto-fernandez-acorta-la-gira-europea-suma-a-martin-guzman-a-la-comitiva-y-visitara-al-papa-nid04052021/,https://bucket1.glanacion.com/anexos/fotos/28/3740528.jpg
10,2681250,Vacunas. ''Hay una estampida de gente que quiere comprar pasajes a Miami'',https://www.lanacion.com.ar/turismo/turismo-y-vacunas-hay-una-estampida-de-gente-que-quiere-comprar-pasajes-a-miami-nid04052021/,https://bucket1.glanacion.com/anexos/fotos/57/3740557.jpg
11,2681175,Hidrovía. El kirchnerismo recibe con críticas al nuevo ministro de Transporte,https://www.lanacion.com.ar/politica/el-kirchnerismo-recibe-al-flamante-ministro-de-transporte-con-criticas-por-la-prorroga-de-la-nid04052021/,https://bucket1.glanacion.com/anexos/fotos/68/3740468.jpg
12,2681187,Pacto con Irán. Cristina pidió la nulidad de la causa por la que será juzgada,https://www.lanacion.com.ar/politica/memorandum-con-iran-cristina-kirchner-pidio-la-nulidad-de-la-causa-por-la-que-sera-juzgada-nid04052021/,https://bucket1.glanacion.com/anexos/fotos/89/3740489.jpg
13,2681147,Coronavirus. Quirós informó cuándo se darán las segundas dosis de las vacunas,https://www.lanacion.com.ar/sociedad/coronavirus-en-caba-fernan-quiros-esperamos-que-antes-del-invierno-podamos-completar-con-la-nid04052021/,https://bucket1.glanacion.com/anexos/fotos/32/3740432.jpg
14,2681168,Coronavirus. ¿Qué prioridad deberían tener las embarazadas para vacunarse?,https://www.lanacion.com.ar/sociedad/coronavirus-que-prioridad-deberian-tener-las-embarazadas-para-vacunarse-nid04052021/,https://bucket1.glanacion.com/anexos/fotos/85/3740585.jpg
15,2681162,Testigos falsos. Benefician a dos acusados de operar contra el juez Casanello,https://www.lanacion.com.ar/politica/testigos-falsos-la-casacion-beneficio-al-abogado-y-al-fiscal-acusados-de-operar-contra-el-juez-nid04052021/,https://bucket1.glanacion.com/anexos/fotos/47/3740447.jpg
16,2681178,Asia. El sorpresivo insulto de Filipinas por el avance de China,https://www.lanacion.com.ar/el-mundo/el-sorpresivo-insulto-de-filipinas-por-el-avance-de-china-en-asia-nid04052021/,https://bucket1.glanacion.com/anexos/fotos/76/3740476.png
17,2680592,"Impacto. ""Volvió"" el héroe de la Copa Davis... con un triunfo sensacional",https://www.lanacion.com.ar/deportes/impacto-el-triunfo-de-2021-y-algo-mas-federico-delbonis-sorprendio-a-pablo-carreno-busta-en-madrid-nid03052021/,https://bucket1.glanacion.com/anexos/fotos/45/3739845.jpg
18,2681082,México. Video: el momento exacto en que un tren se desplomó,https://www.lanacion.com.ar/el-mundo/mexico-el-momento-exacto-en-que-un-tren-se-desplomo-y-provoco-la-muerte-de-23-personas-nid04052021/,https://bucket1.glanacion.com/anexos/fotos/84/3740384.jpg
19,2680548,Es furor en Amazon. Una casa se vende a US$10.000 y se arma en dos días,https://www.lanacion.com.ar/propiedades/casas-y-departamentos/furor-en-amazon-una-casa-que-se-vende-a-us10000-y-se-arma-en-dos-dias-nid03052021/,https://bucket1.glanacion.com/anexos/fotos/48/3739748.jpg
20,2680485,Éxodo en pandemia. Sacaron la ciudadanía europea y estos son sus consejos,https://www.lanacion.com.ar/sociedad/exodo-en-pandemia-sacaron-la-ciudadania-europea-y-ahora-ayudan-gratis-a-otros-argentinos-nid03052021/,https://bucket1.glanacion.com/anexos/fotos/14/3739414.png
21,2681148,"Tenía 75 años. Murió Rodolfo García, músico entrañable y pionero del rock nacional",https://www.lanacion.com.ar/espectaculos/musica/murio-rodolfo-garcia-musico-entranable-y-pionero-del-rock-nacional-nid04052021/,https://bucket1.glanacion.com/anexos/fotos/33/3740433.jpg
22,2680693,"Se fueron de Argentina. ""Buscamos poder vivir en lugar de solo sobrevivir''",https://www.lanacion.com.ar/lifestyle/nos-fuimos-de-argentina-para-poder-vivir-en-lugar-de-solo-sobrevivir-nid03052021/,https://bucket1.glanacion.com/anexos/fotos/52/3739952.jpg
23,2680716,"Triana. Un paraíso secreto con mucha historia, en las Sierras de Córdoba",https://www.lanacion.com.ar/lifestyle/triana-un-paraiso-secreto-en-las-sierras-de-cordoba-nid03052021/,https://bucket1.glanacion.com/anexos/fotos/77/3739977.jpg
24,2681177,Vivía en Miami. Tuvo un ACV y su enfermedad la condujo al negocio de su vida,https://www.lanacion.com.ar/economia/negocios/vivia-en-miami-tuvo-un-acv-y-su-enfermedad-la-condujo-al-negocio-de-su-vida-nid04052021/,https://bucket1.glanacion.com/anexos/fotos/70/3740470.jpg
25,2680363,Coronavirus. Bill Gates volvió a pronosticar cuándo terminará la pandemia,https://www.lanacion.com.ar/sociedad/bill-gates-volvio-a-pronosticar-cuando-terminara-la-pandemia-de-coronavirus-nid03052021/,https://bucket1.glanacion.com/anexos/fotos/30/3739230.jpg
26,2680833,"El Gobierno, ante su crisis más grave",https://www.lanacion.com.ar/politica/el-gobierno-ante-su-crisis-mas-grave-nid04052021/,https://bucket1.glanacion.com/anexos/fotos/00/3740100.jpg
27,2680780,"Buenos Aires, una provincia ''cerrada hasta nuevo aviso''",https://www.lanacion.com.ar/opinion/buenos-aires-una-provincia-cerrada-hasta-nuevo-aviso-nid04052021/,
28,2680765,La UBA kirchnerista y los dilemas del pluralismo esquivo,https://www.lanacion.com.ar/politica/la-uba-kirchnerista-y-los-dilemas-del-pluralismo-esquivo-nid03052021/,
29,2680776,Lo que verdaderamente está salvando a la Argentina,https://www.lanacion.com.ar/opinion/lo-que-verdaderamente-esta-salvando-a-la-argentina-nid04052021/,
30,2680785,¿Redes comunitarias o partidarias?,https://www.lanacion.com.ar/editoriales/redes-comunitarias-o-partidarias-nid04052021/,
31,2680777,Nicaragua: ataques a la prensa,https://www.lanacion.com.ar/editoriales/nicaragua-ataques-a-la-prensa-nid04052021/,
32,2681219,"""Amenaza manejable''. Los pronósticos de expertos sobre el futuro del Covid",https://www.lanacion.com.ar/el-mundo/una-amenaza-manejable-los-pronosticos-de-los-expertos-sobre-el-futuro-del-coronavirus-nid04052021/,https://bucket1.glanacion.com/anexos/fotos/11/3740511.png
33,2681336,Lo afirman en Israel. ¿Existe una variante chilena del Covid-19?,https://www.lanacion.com.ar/el-mundo/coronavirus-existe-una-variante-chilena-del-covid-19-dudas-y-acusaciones-de-israel-nid04052021/,https://bucket1.glanacion.com/anexos/fotos/89/3740689.jpg
34,2681005,Informe. La soja y el maíz tienen el ''poder de compra'' más alto en 15 años,https://www.lanacion.com.ar/economia/campo/la-soja-y-el-maiz-tienen-el-poder-de-compra-mas-alto-en-15-anos-nid04052021/,https://bucket1.glanacion.com/anexos/fotos/69/3740269.jpg
35,2681169,Misterio en Teherán. Muere una diplomática suiza tras caer de 17 pisos,https://www.lanacion.com.ar/el-mundo/misterio-en-teheran-muere-una-diplomatica-suiza-tras-caer-de-17-pisos-nid04052021/,https://bucket1.glanacion.com/anexos/fotos/55/3740455.jpg
36,2681273,"Pandemia. Sin miedo, los chinos llenan la calle durante un feriado largo",https://www.lanacion.com.ar/el-mundo/sin-miedo-a-la-pandemia-los-chinos-llenan-la-calle-durante-un-feriado-largo-nid04052021/,https://bucket1.glanacion.com/anexos/fotos/88/3740588.jpg
37,2681263,"Moreno. ''El presidente no está apto para gobernar, ya se le vio la hilacha''",https://www.lanacion.com.ar/politica/guillermo-moreno-el-presidente-no-esta-apto-para-gobernar-ya-se-le-vio-la-hilacha-nid04052021/,https://bucket1.glanacion.com/anexos/fotos/77/3740577.jpg
38,2680573,Bill y Melinda Gates. La historia de amor nacida en los pasillos de Microsoft,https://www.lanacion.com.ar/lifestyle/la-historia-de-amor-de-bill-y-melinda-gates-del-primer-rechazo-a-la-separacion-tras-27-anos-juntos-nid03052021/,https://bucket1.glanacion.com/anexos/fotos/62/3739862.jpg
39,2681253,"""Disfrutando"". Con un toque argentino, el romántico paseo de Antonella y Messi",https://www.lanacion.com.ar/deportes/disfrutando-el-romantico-paseo-de-antonela-roccuzzo-y-lionel-messi-en-la-playa-de-barcelona-con-un-nid04052021/,https://bucket1.glanacion.com/anexos/fotos/66/3740566.jpg
40,2681232,Romina Malaspina. Anunció que deja el periodismo: ''Llegó el momento'',https://www.lanacion.com.ar/espectaculos/romina-malaspina-anuncio-que-deja-el-periodismo-llego-el-momento-de-cerrar-una-etapa-nid04052021/,https://bucket1.glanacion.com/anexos/fotos/18/3740518.jpg
41,2680645,El fin de una época. Demolerán el Hotel Pennsylvania,https://www.lanacion.com.ar/el-mundo/el-fin-de-una-epoca-demoleran-el-historico-hotel-pennsylvania-de-nueva-york-nid03052021/,https://bucket1.glanacion.com/anexos/fotos/06/3739906.jpg
42,2681277,"Insólito. La ""señora mayor"" que salvó a Real: Marcelo puede jugar la Champions",https://www.lanacion.com.ar/deportes/futbol/champions-league-marcelo-la-senora-que-lo-reemplazo-como-autoridad-de-mesa-y-el-viaje-a-londres-para-nid04052021/,https://bucket1.glanacion.com/anexos/fotos/98/3740598.jpg
43,2681252,"Netflix. El primer avance de 1899, la nueva serie de los creadores de Dark",https://www.lanacion.com.ar/espectaculos/netflix-revelo-el-primer-avance-de-1899-la-nueva-serie-de-los-creadores-de-dark-nid04052021/,https://bucket1.glanacion.com/anexos/fotos/64/3740564.png
44,2681307,Dólar hoy. Siguen subiendo las cotizaciones financieras,https://www.lanacion.com.ar/economia/dolar/dolar-hoy-los-financieros-siguen-subiendo-y-el-ccl-supera-los-158-nid04052021/,https://bucket1.glanacion.com/anexos/fotos/51/3740651.jpeg
45,2681234,Madeleine McCann. El emotivo mensaje de sus padres antes de su 18° cumpleaños,https://www.lanacion.com.ar/el-mundo/madeleine-mccann-el-emotivo-mensaje-de-sus-padres-antes-de-su-18-cumpleanos-nid04052021/,https://bucket1.glanacion.com/anexos/fotos/27/3740527.jpg
46,2681233,Capusotto poeta. El contraste entre el humorista y el autor de versos sombríos,https://www.lanacion.com.ar/cultura/diego-capusotto-la-poesia-inventa-un-lenguaje-el-humor-lo-derrumba-nid04052021/,https://bucket1.glanacion.com/anexos/fotos/19/3740519.jpg
47,2680690,Costumbres perdidas. Los noviazgos en los años 50,https://www.lanacion.com.ar/lifestyle/costumbres-perdidas-los-noviazgos-en-los-anos-50-nid03052021/,https://bucket1.glanacion.com/anexos/fotos/49/3739949.jpg
48,2680791,"Juega igual. Independiente, con 8 menos y dirigido por el entrenador de arqueros",https://www.lanacion.com.ar/deportes/futbol/copa-sudamericana-independiente-esta-varado-en-brasil-por-cuestiones-sanitarias-y-podria-postergarse-nid04052021/,https://bucket1.glanacion.com/anexos/fotos/37/3740437.jpg
49,2681244,Precios. Piden liberar el ''férreo control'' a la harina de trigo,https://www.lanacion.com.ar/economia/campo/agricultura/precios-piden-liberar-el-ferreo-control-a-la-harina-de-trigo-nid04052021/,https://bucket1.glanacion.com/anexos/fotos/33/3740533.png
50,2681308,Coronavirus. La fuerte discusión entre Carnota y un colectivero,https://www.lanacion.com.ar/sociedad/el-entredicho-de-fernando-carnota-con-un-colectivero-que-se-manifestaba-para-pedir-aumento-salarial-nid04052021/,https://bucket1.glanacion.com/anexos/fotos/58/3740658.jpg
51,2680625,Tiene 35 años. Intenso ida y vuelta entre Feinmann y una diputada que se vacunó,https://www.lanacion.com.ar/politica/intenso-ida-y-vuelta-entre-eduardo-feinmann-y-una-diputada-que-se-vacuno-nid03052021/,https://bucket1.glanacion.com/anexos/fotos/88/3739888.jpg
52,2680671,Jony Viale. ''El Titanic se hunde pero ellos se pelean por Federico Basualdo'',https://www.lanacion.com.ar/politica/jony-viale-el-titanic-se-hunde-pero-ellos-se-pelean-por-federico-basualdo-nid03052021/,https://bucket1.glanacion.com/anexos/fotos/16/3739916.jpg
53,2676362,Código QR: el método de pago que se consolida como el más elegido,https://www.lanacion.com.ar/economia/negocios/codigo-qr-el-metodo-de-pago-que-se-consolida-como-el-mas-elegido-nid28042021/,https://bucket1.glanacion.com/anexos/fotos/04/3733604.jpg
54,2680593,Lanzamiento. Así son las nuevas versiones del Peugeot 208 que se venden en el país,https://www.lanacion.com.ar/autos/al-volante/el-peugeot-208-ya-tiene-sus-versiones-picantes-en-la-argentina-nid03052021/,https://bucket1.glanacion.com/anexos/fotos/39/3739839.jpg
55,2680572,Impuesto a la riqueza. Las dudas de los tributaristas sobre las cifras oficiales,https://www.lanacion.com.ar/economia/impuesto-a-la-riqueza-tributaristas-plantean-dudas-sobre-las-cifras-oficiales-nid03052021/,https://bucket1.glanacion.com/anexos/fotos/09/3739809.jpg
56,2680364,Sequía. La cuenta que explica lo que pierde el productor mientras gana el Estado,https://www.lanacion.com.ar/economia/campo/como-explicas-las-cuentas-de-un-productor-para-ilustrar-la-perdida-por-la-sequia-nid03052021/,https://bucket1.glanacion.com/anexos/fotos/33/3739233.jpg
57,2680672,¿Qué es de la vida de...? Alberto Fernández de Rosa y sus 60 años de historias,https://www.lanacion.com.ar/espectaculos/personajes/que-es-de-la-vida-de-alberto-fernandez-de-rosa-nid03052021/,https://bucket1.glanacion.com/anexos/fotos/19/3739919.jpg
58,2681220,No va más. Laurita Fernández confirmó su separación de Nicolás Cabré,https://www.lanacion.com.ar/espectaculos/personajes/laurita-fernandez-confirmo-su-separacion-de-nicolas-cabre-nid04052021/,https://bucket1.glanacion.com/anexos/fotos/16/3740516.jpg
59,2681355,"Tras vacunarse. Darín: ''Me preocupa el entorno, porque acá nadie se salva solo""",https://www.lanacion.com.ar/espectaculos/personajes/ricardo-darin-despues-de-vacunarse-me-preocupa-el-entorno-porque-aca-nadie-se-salva-solo-nid04052021/,https://bucket1.glanacion.com/anexos/fotos/18/3740718.jpg
60,2681161,Red Hot Chili Peppers. Vendieron sus canciones por 140 millones de dólares,https://www.lanacion.com.ar/espectaculos/musica/red-hot-chili-peppers-vendio-su-catalogo-de-canciones-por-140-millones-de-dolares-nid04052021/,https://bucket1.glanacion.com/anexos/fotos/43/3740443.jpg
61,2681305,Streaming. El día de mañana: atrapante serie con un protagonista lleno de enigmas,https://www.lanacion.com.ar/espectaculos/series-de-tv/streaming-el-dia-de-manana-es-una-atrapante-serie-espanola-con-un-protagonista-carismatico-y-lleno-nid04052021/,https://bucket1.glanacion.com/anexos/fotos/48/3740648.jpg
62,2680293,"Libertadores. Boca visita a Barcelona: horario, TV y formaciones",https://www.lanacion.com.ar/deportes/futbol/boca-juniors/barcelona-boca-copa-libertadores-nid03052021/,https://bucket1.glanacion.com/anexos/fotos/34/3739134.jpg
63,2680817,"Campazzo. Un récord en robos, latigazos y bombazos que no alcanzaron ante Lakers",https://www.lanacion.com.ar/deportes/basquetbol/robos-latigazos-y-bombazos-de-tres-puntos-de-facundo-campazzo-en-la-noche-en-la-que-los-angeles-nid04052021/,https://bucket1.glanacion.com/anexos/fotos/52/3740352.jpg
64,2681109,"El nuevo IM. Campeón italiano, con dueño chino y le habla al hincha en inglés",https://www.lanacion.com.ar/deportes/futbol/inter-milan-un-club-italiano-con-dueno-chino-y-que-le-habla-a-los-hinchas-en-ingles-nid04052021/,https://bucket1.glanacion.com/anexos/fotos/02/3740402.jpg
65,2680634,En un año. Cuál es la zona en la que las ventas crecieron más de 120%,https://www.lanacion.com.ar/propiedades/casas-y-departamentos/propiedades-cual-es-la-zona-en-la-que-las-ventas-subieron-120-en-un-ano-nid03052021/,https://bucket1.glanacion.com/anexos/fotos/92/3739892.jpg
66,2661692,Aburrido en vacaciones: tiene 11 años y con US$1500 se construyó esta casa,https://www.lanacion.com.ar/propiedades/a-los-11-anos-con-us1500-construyo-una-pequena-casa-en-su-jardin-para-vivir-solo-nid14042021/,https://bucket1.glanacion.com/anexos/fotos/46/3740346.jpg
67,2680061,Colonial y moderna. Visitamos la casa de la diseñadora de interiores Ani Clement,https://www.lanacion.com.ar/revista-living/colonial-y-moderna-visitamos-la-casa-de-la-disenadora-de-interiores-ani-clement-nid03052021/,https://bucket1.glanacion.com/anexos/fotos/48/3738848.jpg
68,2681251,Sable de luz. Disney dio más detalles sobre la espada láser realista que diseñó,https://www.lanacion.com.ar/tecnologia/en-el-dia-de-star-wars-disney-dio-mas-detalles-sobre-el-sable-de-luz-que-se-vera-en-los-parques-de-nid04052021/,https://bucket1.glanacion.com/anexos/fotos/59/3740559.gif
69,2680499,Recetas. Comer ''veggie'' sin perder salud con buñuelos de acelga y manzana,https://www.lanacion.com.ar/lifestyle/alimentacion-comer-veggie-sin-perder-nuestra-salud-nutricional-nid03052021/,https://bucket1.glanacion.com/anexos/fotos/37/3739437.jpeg
70,2680521,Discord en PlayStation. El servicio de chat llegará a las consolas de Sony en 2022,https://www.lanacion.com.ar/tecnologia/disponible-en-playstation-discord-integrara-su-servicio-de-mensajeria-en-las-consolas-de-videojuegos-nid03052021/,https://bucket1.glanacion.com/anexos/fotos/06/3739506.jpg
71,2675726,Horóscopo de mayo. ¿Qué traen los astros para este nuevo mes?,https://www.lanacion.com.ar/revista-ohlala/horoscopo-de-mayo-que-traen-los-astros-para-este-nuevo-mes-nid27042021/,https://bucket1.glanacion.com/anexos/fotos/90/3732790.jpg
72,2680064,Teleros. Diez protagonistas del Camino de los Artesanos,https://www.lanacion.com.ar/turismo/diez-teleros-elegidos-en-el-camino-de-los-artesanos-nid03052021/,https://bucket1.glanacion.com/anexos/fotos/80/3738880.jpg
73,2680492,Vidas privadas. ¿Existe una correlación entre la edad y la infidelidad?,https://www.lanacion.com.ar/lifestyle/vidas-privadas-existe-una-correlacion-entre-la-edad-y-la-infidelidad-nid03052021/,https://bucket1.glanacion.com/anexos/fotos/21/3739421.jpg
74,2680489,Tus gigas son tuyos. Una guía para que hagas lo que quieras con tus datos,https://www.lanacion.com.ar/lifestyle/tus-gigas-son-tuyos-una-guia-para-que-hagas-lo-que-quieras-con-tus-datos-nid03052021/,https://bucket1.glanacion.com/anexos/fotos/16/3739416.jpg
75,2680460,Agobiados. Madres y padres en busca de la energía perdida,https://www.lanacion.com.ar/lifestyle/agobiados-madres-y-padres-en-busca-de-la-energia-perdida-nid03052021/,https://bucket1.glanacion.com/anexos/fotos/80/3739380.jpg
76,2680177,Testeos en Ezeiza. Así fue la investigación que develó un contrato irregular,https://www.lanacion.com.ar/sociedad/como-se-hizo-la-investigacion-que-develo-irregularidades-en-ezeiza-del-laboratorio-labpax-nid03052021/,https://bucket1.glanacion.com/anexos/fotos/90/3738990.jpg
77,2680282,"Heroínas. The Nevers y Mare of Easttown, series con protagonistas muy inusuales",https://www.lanacion.com.ar/espectaculos/the-nevers-y-mare-of-easttown-dos-series-sobre-heroinas-de-la-fantasia-a-la-cruda-realidad-nid03052021/,https://bucket1.glanacion.com/anexos/fotos/12/3739112.jpg
78,2680494,Rareza. Así cambian los ojos de los astronautas tras un año en el espacio,https://www.lanacion.com.ar/ciencia/asi-cambian-los-ojos-de-los-astronautas-tras-un-ano-en-el-espacio-nid03052021/,https://bucket1.glanacion.com/anexos/fotos/27/3739427.jpg
79,2680233,Regreso. Cómo es el llamativo entrenamiento matutino de Claudio Caniggia,https://www.lanacion.com.ar/deportes/claudio-caniggia-con-lentes-oscuros-y-david-guetta-entrena-en-la-calle-a-casi-10-anos-de-su-retiro-nid03052021/,https://bucket1.glanacion.com/anexos/fotos/60/3739060.jpg
80,2680581,Inglaterra. Pensó que había descubierto botellas de leche y eran granadas,https://www.lanacion.com.ar/el-mundo/penso-que-habia-descubierto-botellas-de-leche-en-su-jardin-y-eran-granadas-activas-nid03052021/,https://bucket1.glanacion.com/anexos/fotos/27/3739827.jpg
81,2680597,Ex amores. Cande Ruggeri confesó el apodo que le puso a Cachete Sierra,https://www.lanacion.com.ar/espectaculos/candela-ruggeri-confeso-el-apodo-que-le-puso-a-cachete-sierra-junto-a-sus-amigas-nid03052021/,https://bucket1.glanacion.com/anexos/fotos/49/3739849.png
82,2680500,Lencería y pelo rubio. La impresionante producción de fotos de Billie Eilish,https://www.lanacion.com.ar/espectaculos/lenceria-y-pelo-rubio-la-impresionante-produccion-de-fotos-de-billie-eilish-nid03052021/,https://bucket1.glanacion.com/anexos/fotos/38/3739438.jpg
83,2680536,"""Hoy sí"". Juana Viale revivió la famosa pelea de Mirtha y Silvana Suárez",https://www.lanacion.com.ar/espectaculos/juana-viale-revivio-con-paulina-cocina-la-famosa-pelea-de-mirtha-y-silvana-suarez-nid03052021/,https://bucket1.glanacion.com/anexos/fotos/36/3739636.jpg
