n,id,title,url,image
1,2671697,Coronavirus. Récord de muertos: reportaron 557 en el día y más de 2000 fallecidos,https://www.lanacion.com.ar/sociedad/coronavirus-record-de-muertos-reportaron-557-en-el-dia-y-mas-de-2000-fallecidos-en-una-semana-nid23042021/,https://bucket1.glanacion.com/anexos/fotos/67/3727267.jpg
2,2671632,"Al límite. Brasil: devastado por el Covid, se enfrenta a una epidemia de hambre",https://www.lanacion.com.ar/el-mundo/brasil-al-limite-devastado-por-el-coronavirus-se-enfrenta-a-una-epidemia-de-hambre-nid23042021/,https://bucket1.glanacion.com/anexos/fotos/53/3727153.jpg
3,2671667,Tensión. Neuquén: petroleros amenazan con liberar los cortes,https://www.lanacion.com.ar/economia/tension-en-neuquen-petroleros-amenazan-con-liberar-los-cortes-nid23042021/,https://bucket1.glanacion.com/anexos/fotos/11/3727211.jpg
4,2671678,Con Pfizer. La UE cerrará el mayor negocio de vacunas del mundo,https://www.lanacion.com.ar/el-mundo/con-pfizer-la-ue-cerrara-el-mayor-negocio-de-vacunas-del-mundo-nid23042021/,https://bucket1.glanacion.com/anexos/fotos/26/3727226.jpg
5,2671538,Glaciar Perito Moreno. Impresionante desprendimiento de un bloque gigante de hielo,https://www.lanacion.com.ar/sociedad/glaciar-perito-moreno-impresionante-desprendimiento-de-un-bloque-gigante-de-hielo-nid23042021/,https://bucket1.glanacion.com/anexos/fotos/07/3727007.jpg
6,2671556,"Covid. Fernández, otra vez contra la Ciudad y sus cifras: ""Se trata de vivir""",https://www.lanacion.com.ar/politica/coronavirus-alberto-fernandez-volvio-a-cargar-contra-la-ciudad-y-defendio-sus-estadisticas-solo-se-nid23042021/,https://bucket1.glanacion.com/anexos/fotos/90/3727190.jpg
7,2671658,Santa Fe. Es funcionario y armó una fiesta clandestina porque su hija se graduó,https://www.lanacion.com.ar/sociedad/santa-fe-un-funcionario-judicial-armo-una-fiesta-clandestina-para-celebrar-que-su-hija-se-recibio-de-nid23042021/,https://bucket1.glanacion.com/anexos/fotos/91/3727191.jpg
8,2671489,Dólar. Sube el blue: continúa en alza y escala otros $5,https://www.lanacion.com.ar/economia/dolar/dolar-hoy-el-blue-sigue-en-alza-y-escala-otros-3-nid23042021/,https://bucket1.glanacion.com/anexos/fotos/78/3726978.jpg
9,2671509,Retenciones. La fuerte respuesta del campo a Paula Español,https://www.lanacion.com.ar/economia/campo/ganaderia/a-paula-espanol-la-fuerte-respuesta-del-campo-por-las-retenciones-nid23042021/,https://bucket1.glanacion.com/anexos/fotos/06/3727006.jpg
10,2671676,''La Boca está vacía''. La advertencia de Bullrich por la caída de la economía,https://www.lanacion.com.ar/politica/la-boca-esta-vacia-la-advertencia-de-patricia-bullrich-por-la-caida-de-la-actividad-economica-nid23042021/,https://bucket1.glanacion.com/anexos/fotos/23/3727223.jpg
11,2671593,Coronavirus. Murió el productor teatral Daniel Comba,https://www.lanacion.com.ar/espectaculos/teatro/coronavirus-murio-el-productor-teatral-daniel-comba-nid23042021/,https://bucket1.glanacion.com/anexos/fotos/63/3727063.jpg
12,2364565,"Coronavirus. CABA: el mapa de la pandemia, comuna por comuna",,https://bucket1.glanacion.com/anexos/fotos/52/3350952.jpg
13,2671437,Vacunación. Qué condiciones de riesgo tienen prioridad en la próxima fase,https://www.lanacion.com.ar/sociedad/coronavirus-que-condiciones-de-riesgo-tienen-prioridad-en-la-proxima-fase-de-vacunacion-nid23042021/,https://bucket1.glanacion.com/anexos/fotos/75/3726875.jpg
14,2671511,"Encuesta. En pleno conflicto, Larreta mejoró su imagen y Kicillof la empeoró",https://www.lanacion.com.ar/politica/encuesta-en-pleno-conflicto-larreta-mejoro-su-imagen-y-kicillof-empeoro-nid23042021/,https://bucket1.glanacion.com/anexos/fotos/83/3726983.jpg
15,2671436,"Campazzo. Por primera vez en el programa de Shaquille O'Neal por su ""avivada""",https://www.lanacion.com.ar/deportes/basquetbol/facundo-campazzo-por-primera-vez-en-el-clasico-shaqtina-fooly-de-manera-positiva-nid23042021/,https://bucket1.glanacion.com/anexos/fotos/73/3726873.jpg
16,2671505,Canal de Suez. Por qué la tripulación del Ever Given sigue atrapada en el barco,https://www.lanacion.com.ar/el-mundo/canal-de-suez-por-que-la-tripulacion-del-ever-given-sigue-atrapada-en-el-barco-y-podria-pasar-anos-nid23042021/,https://bucket1.glanacion.com/anexos/fotos/67/3726967.jpg
17,2671684,Tucumán. Manzur justificó otra vacunación vip,https://www.lanacion.com.ar/politica/tucuman-cuatro-funcionarios-se-vacunaron-contra-el-covid-y-el-gobernador-los-defendio-nid23042021/,https://bucket1.glanacion.com/anexos/fotos/28/3727228.jpg
18,2671199,"Turismo y vacunas. Son argentinos, van a Miami a descansar y se inoculan gratis",https://www.lanacion.com.ar/sociedad/coronavirus-son-argentinos-viajaron-a-estados-unidos-por-turismo-y-aprovecharon-a-vacunarse-gratis-nid23042021/,https://bucket1.glanacion.com/anexos/fotos/34/3726534.jpg
19,2671470,Nueva jueza. Capuchetti acumula expedientes sensibles y gana protagonismo,https://www.lanacion.com.ar/politica/maria-eugenia-capuchetti-quien-es-la-jueza-que-con-el-caso-espionaje-gana-protagonismo-y-acumula-nid23042021/,https://bucket1.glanacion.com/anexos/fotos/15/3726915.jpg
20,2670498,Jugando al Rugby. Tras una grave lesión: ''Pensé que mamá y papá me iban a matar'',https://www.lanacion.com.ar/lifestyle/tras-una-grave-lesion-jugando-al-rugby-pense-que-mama-y-papa-me-iban-a-matar-nid22042021/,https://bucket1.glanacion.com/anexos/fotos/02/3725802.jpg
21,2671638,Solución. Cómo reducir el cansancio que causa la pantalla del celular,https://www.lanacion.com.ar/tecnologia/una-solucion-simple-y-automatica-para-reducir-el-cansancio-de-la-vista-causado-por-las-pantallas-nid23042021/,https://bucket1.glanacion.com/anexos/fotos/18/3727218.jpg
22,2671663,Coronavirus. Falleció un auxiliar docente de la Ciudad,https://www.lanacion.com.ar/politica/coronavirus-murio-un-auxiliar-docente-de-la-ciudad-nid23042021/,https://bucket1.glanacion.com/anexos/fotos/04/3727204.jpeg
23,2670646,TV. ¿Qué veo este fin de semana? Tres series para ver desde casa,https://www.lanacion.com.ar/espectaculos/series-de-tv/que-veo-este-fin-de-semana-el-caso-wall-una-comedia-familiar-y-heroinas-steampunk-nid22042021/,https://bucket1.glanacion.com/anexos/fotos/69/3725969.jpg
24,2670716,¿Nos encaminamos hacia una nueva tormenta perfecta?,https://www.lanacion.com.ar/opinion/nos-encaminamos-hacia-una-nueva-tormenta-perfecta-nid23042021/,https://bucket1.glanacion.com/anexos/fotos/41/3726041.jpg
25,2670717,"Kicillof, la respuesta de Cristina a los problemas de Alberto",https://www.lanacion.com.ar/opinion/kicillof-la-respuesta-de-cristina-a-los-problemas-de-alberto-nid23042021/,
26,2669321,Los impulsos reaccionarios de Alberto Fernández,https://www.lanacion.com.ar/politica/los-impulsos-reaccionarios-de-alberto-fernandez-nid21042021/,
27,2669402,¿Y si apelamos a la libertad para el regreso a las aulas?,https://www.lanacion.com.ar/opinion/y-si-apelamos-a-la-libertad-para-el-regreso-a-las-aulas-nid22042021/,
28,2670722,Tarifas: volver a tropezar con la misma piedra,https://www.lanacion.com.ar/editoriales/tarifas-volver-a-tropezar-con-la-misma-piedra-nid23042021/,
29,2670715,El ''vacunagate'' peruano,https://www.lanacion.com.ar/editoriales/el-vacunagate-peruano-nid23042021/,
30,2671600,Criptomonedas. Un fraude multimillonario en Turquía golpea al bitcoin,https://www.lanacion.com.ar/el-mundo/criptomonedas-un-fraude-multimillonario-en-turquia-golpea-al-bitcoin-nid23042021/,https://bucket1.glanacion.com/anexos/fotos/81/3727081.jpg
31,2671592,Mediterráneo. Otro trágico naufragio: 130 muertos y acusaciones a la UE,https://www.lanacion.com.ar/el-mundo/otro-tragico-naufragio-en-el-mediterraneo-130-muertos-y-acusaciones-a-la-ue-nid23042021/,https://bucket1.glanacion.com/anexos/fotos/62/3727062.jpg
32,2671662,"Pandemia. Cerró Fausto, una emblemática fábrica de pastas y pizzas de Mataderos",https://www.lanacion.com.ar/buenos-aires/pandemia-cerro-fausto-una-emblematica-fabrica-de-pastas-y-pizzas-de-mataderos-nid23042021/,https://bucket1.glanacion.com/anexos/fotos/01/3727201.jpg
33,2670728,Día Mundial del Libro. Grandes lectores recomiendan sus títulos preferidos,https://www.lanacion.com.ar/cultura/dia-mundial-del-libro-grandes-lectores-recomiendan-sus-titulos-preferidos-nid23042021/,https://bucket1.glanacion.com/anexos/fotos/53/3726053.jpg
34,2671635,Pandemia. Soledad Aquino se contagió de covid durante una internación,https://www.lanacion.com.ar/espectaculos/personajes/soledad-aquino-contrajo-coronavirus-durante-su-internacion-por-una-hemorragia-digestiva-nid23042021/,https://bucket1.glanacion.com/anexos/fotos/64/3727164.jpg
35,2670763,Ilegal. La Anmat prohibió un aceite de girasol,https://www.lanacion.com.ar/sociedad/la-anmat-prohibio-un-aceite-de-girasol-nid23042021/,https://bucket1.glanacion.com/anexos/fotos/92/3726092.jpg
36,2671451,Marcela y Elisa. El 'matrimonio sin hombre' que shockeó a la Argentina del 1900,https://www.lanacion.com.ar/lifestyle/marcela-y-elisa-el-matrimonio-sin-hombre-que-shockeo-a-la-argentina-del-1900-nid23042021/,https://bucket1.glanacion.com/anexos/fotos/90/3726890.png
37,2670368,"India Ortega. A los 15, la nieta de Palito, hija de Emanuel, debutó como modelo",https://www.lanacion.com.ar/revista-hola/india-ortega-a-los-15-la-nieta-de-palito-hija-de-emanuel-debuto-como-modelo-nid22042021/,https://bucket1.glanacion.com/anexos/fotos/76/3725576.jpg
38,2671507,Fotos. El lujoso penthouse de Bette Midler y su esposo argentino en Nueva York,https://www.lanacion.com.ar/espectaculos/el-lujoso-penthouse-que-bette-midler-y-su-esposo-argentino-vendieron-por-us50-millones-nid23042021/,https://bucket1.glanacion.com/anexos/fotos/75/3726975.jpg
39,2671469,Pandemia. Brancatelli confirmó que tiene coronavirus: qué pasará con Intratables,https://www.lanacion.com.ar/espectaculos/television/diego-brancatelli-confirmo-que-tiene-coronavirus-que-pasara-con-intratables-nid23042021/,https://bucket1.glanacion.com/anexos/fotos/12/3726912.png
40,2670676,"Vacunación. Graciela Alfano, lapidaria con Susana Giménez",https://www.lanacion.com.ar/espectaculos/personajes/graciela-alfano-lapidaria-con-susana-gimenez-si-estuviera-en-argentina-ya-la-habrian-vacunado-nid22042021/,https://bucket1.glanacion.com/anexos/fotos/88/3725988.jpg
41,2671546,Ranking. Netflix Argentina: las 10 series y películas más vistas de hoy,https://www.lanacion.com.ar/espectaculos/ranking-de-netflix-argentina-las-10-series-y-peliculas-mas-vistas-este-23-de-abril-nid23042021/,https://bucket1.glanacion.com/anexos/fotos/19/3727019.jpg
42,2671380,"Resiliencia. Historias de vida, aceptación y superación",https://www.lanacion.com.ar/lifestyle/resiliencia-historias-de-vida-aceptacion-y-superacion-nid23042021/,https://bucket1.glanacion.com/anexos/fotos/66/3726766.jpg
43,2670760,Sputnik V criolla. Los puntos oscuros detrás de la vacuna rusa en la Argentina,https://www.lanacion.com.ar/lnmas/sputnik-v-criolla-los-puntos-oscuros-detras-de-la-vacuna-rusa-en-la-argentina-nid23042021/,https://bucket1.glanacion.com/anexos/fotos/89/3726089.jpg
44,2670582,Carrió. ''Soy la última garantía en la provincia de Buenos Aires'',https://www.lanacion.com.ar/politica/elisa-carrio-sobre-su-posible-candidatura-soy-la-ultima-garantia-en-la-provincia-de-buenos-aires-nid22042021/,https://bucket1.glanacion.com/anexos/fotos/23/3725923.jpg
45,2670595,Jony Viale. ''¿Qué gana Alberto Fernández comportándose como un barrabrava?'',https://www.lanacion.com.ar/politica/jony-viale-que-gana-alberto-fernandez-comportandose-como-un-barrabrava-nid22042021/,https://bucket1.glanacion.com/anexos/fotos/27/3725927.jpg
46,2670644,"Alfredo Leuco. ""Baradel y Pablo Moyano son los 'Patrones del mal' del trabajo""",https://www.lanacion.com.ar/politica/alfredo-leuco-duro-con-baradel-y-pablo-moyano-son-los-patrones-del-mal-del-trabajo-nid22042021/,https://bucket1.glanacion.com/anexos/fotos/67/3725967.jpg
47,2670413,A prueba. Trabajo remoto: las 10 predicciones de la oficina que viene,https://www.lanacion.com.ar/propiedades/inmuebles-comerciales/el-trabajo-remoto-a-prueba-las-10-predicciones-de-la-oficina-que-viene-nid22042021/,https://bucket1.glanacion.com/anexos/fotos/29/3725629.jpg
48,2670351,Créditos Casa Propia. En dos días se inscribieron más de 38.000 personas,https://www.lanacion.com.ar/propiedades/construccion-y-diseno/creditos-casa-propia-en-dos-dias-se-inscribieron-mas-de-38000-personas-nid22042021/,https://bucket1.glanacion.com/anexos/fotos/46/3725546.jpg
49,2671472,Blanqueo construcción. La CNV habilitó la venta de dólares a valor VEP,https://www.lanacion.com.ar/propiedades/construccion-y-diseno/blanqueo-para-la-construccion-la-cnv-habilito-la-venta-de-dolares-a-valor-vep-nid23042021/,https://bucket1.glanacion.com/anexos/fotos/18/3726918.jpg
50,2671382,Inauguración. Buenos Aires ya tiene su primera Estación de Futuro,https://www.lanacion.com.ar/economia/inauguracion-buenos-aires-ya-tiene-su-primera-estacion-de-futuro-nid23042021/,https://bucket1.glanacion.com/anexos/fotos/74/3726774.jpg
51,2671537,Autos. Volkswagen comienza la producción de su nuevo SUV en la Argentina,https://www.lanacion.com.ar/autos/autos-volkswagen-comienza-la-produccion-del-nuevo-suv-taos-en-argentina-nid23042021/,https://bucket1.glanacion.com/anexos/fotos/05/3727005.jpg
52,2671450,Cambio de manos. El Noble tiene un nuevo propietario,https://www.lanacion.com.ar/economia/la-cadena-de-empanadas-el-noble-fue-comprada-por-el-director-de-andesmar-nid23042021/,https://bucket1.glanacion.com/anexos/fotos/89/3726889.jpg
53,2670429,"Era digital. Wayra, el programa que potencia a las startups más innovadoras",https://www.lanacion.com.ar/economia/era-digital-wayra-el-programa-que-viene-potenciando-a-las-startups-mas-innovadoras-nid22042021/,https://bucket1.glanacion.com/anexos/fotos/66/3725666.jpg
54,2671448,Premios Oscar 2021. Elton John abre a beneficio el acceso a su cotizada fiesta,https://www.lanacion.com.ar/espectaculos/personajes/premios-oscar-2021-elton-john-abre-a-beneficio-el-acceso-a-su-fiesta-la-mas-cotizada-de-la-noche-nid23042021/,https://bucket1.glanacion.com/anexos/fotos/87/3726887.jpg
55,2671690,Sorpresa. Russell Crowe revela qué personaje interpretará en Thor: Love & Thunder,https://www.lanacion.com.ar/espectaculos/cine/russell-crowe-revelo-que-personaje-interpretara-en-thor-love-thunder-nid23042021/,https://bucket1.glanacion.com/anexos/fotos/56/3727256.jpg
56,2671491,"Rod Stewart. Continúa en proceso de recuperación, seis meses después de operarse",https://www.lanacion.com.ar/espectaculos/personajes/rod-stewart-continua-en-proceso-de-recuperacion-seis-meses-despues-de-operarse-nid23042021/,https://bucket1.glanacion.com/anexos/fotos/45/3726945.jpg
57,2671408,Netflix 2021. Entre el estreno de El reino y el regreso de varias series,https://www.lanacion.com.ar/espectaculos/series-de-tv/el-estreno-de-el-reino-y-el-regreso-de-varias-series-entre-las-novedades-de-netflix-para-este-ano-nid23042021/,https://bucket1.glanacion.com/anexos/fotos/29/3726829.jpg
58,2671666,Netflix. Sombra y hueso busca explorar un camino similar al de Game of Thrones,https://www.lanacion.com.ar/espectaculos/series-de-tv/netflix-sombra-y-hueso-busca-explorar-un-camino-similar-al-de-game-of-thrones-nid23042021/,https://bucket1.glanacion.com/anexos/fotos/09/3727209.jpg
59,2671649,Schwartzman. La derrota ante Carreño Busta que le impidió desafiar a Nadal,https://www.lanacion.com.ar/deportes/diego-schwartzman-quedo-eliminado-ante-pablo-carreno-busta-en-los-cuartos-de-final-del-atp-500-de-nid23042021/,https://bucket1.glanacion.com/anexos/fotos/83/3727183.jpg
60,2671390,Paire. Duro castigo al tenista francés por su comportamiento en la Argentina,https://www.lanacion.com.ar/deportes/el-duro-castigo-que-recibio-benoit-paire-de-la-federacion-francesa-de-tenis-por-su-mal-nid23042021/,https://bucket1.glanacion.com/anexos/fotos/82/3726782.jpg
61,2671557,"Dybala. ""¿Cuántos seguidores tenés?"": la insólita anécdota contra Chile",https://www.lanacion.com.ar,https://bucket1.glanacion.com/anexos/fotos/27/3727027.jpg
62,2670439,Darles sentido a los ambientes: cómo poner en práctica esta tendencia,https://www.lanacion.com.ar/lifestyle/darle-sentido-a-los-ambientes-como-poner-en-practica-esta-tendencia-nid22042021/,https://bucket1.glanacion.com/anexos/fotos/81/3725681.jpg
63,2670482,Mesas de luz. Ideas para elegir modelos funcionales y con buen diseño,https://www.lanacion.com.ar/revista-living/mesas-de-luz-ideas-para-elegir-modelos-funcionales-y-con-buen-diseno-nid23042021/,https://bucket1.glanacion.com/anexos/fotos/69/3725769.jpg
64,2670271,Whatsapp. Con esta actualización vas a poder escuchar los audios más rápido,https://www.lanacion.com.ar/tecnologia/whatsapp-habilita-la-reproduccion-de-audios-acelerados-nid22042021/,https://bucket1.glanacion.com/anexos/fotos/23/3725423.jpg
65,2670382,El chef que logró estrellas Michelin porque su madre temía que muriera de hambre,https://www.lanacion.com.ar/lifestyle/el-chef-que-logro-estrellas-michelin-porque-su-madre-temia-que-muriera-de-hambre-nid22042021/,https://bucket1.glanacion.com/anexos/fotos/01/3725601.jpg
66,2670231,Horóscopo. ¿Qué dice tu ascendente para el fin de semana del 23 de abril?,https://www.lanacion.com.ar/lifestyle/horoscopo-que-dice-tu-ascendente-para-el-fin-de-semana-del-23-de-abril-nid22042021/,https://bucket1.glanacion.com/anexos/fotos/64/3725364.jpg
67,2670374,"A escondidas. Se enamoraron, planearon una vida juntos pero algo sucedió",https://www.lanacion.com.ar/lifestyle/a-escondidas-se-enamoraron-planearon-una-vida-juntos-pero-algo-sucedio-nid22042021/,https://bucket1.glanacion.com/anexos/fotos/90/3725590.jpg
68,2671447,MagicDNA. El software que permite diseñar robots de ADN en minutos,https://www.lanacion.com.ar/tecnologia/magicdna-el-software-que-permite-disenar-robots-de-adn-en-minutos-nid23042021/,https://bucket1.glanacion.com/anexos/fotos/83/3726883.png
69,2671691,"¡Todos a leer!: en el día del libro, experiencias en casa para disfrutar leyendo",https://www.lanacion.com.ar/lifestyle/todos-a-leer-en-el-dia-del-libro-experiencias-en-casa-para-disfrutar-leyendo-nid23042021/,https://bucket1.glanacion.com/anexos/fotos/57/3727257.jpg
70,2667730,Anya Taylor-Joy. 5 datos curiosos de la protagonista argentina de Gambito de dama,https://www.lanacion.com.ar/revista-ohlala/5-curiosidades-de-la-protagonista-argentina-de-gambito-de-dama-nid20042021/,https://bucket1.glanacion.com/anexos/fotos/24/3721824.jpg
71,2670522,Moda. Las zapatillas blancas que se convirtieron en un ícono,https://www.lanacion.com.ar/lifestyle/moda-las-zapatillas-blancas-que-se-convirtieron-en-un-icono-nid22042021/,https://bucket1.glanacion.com/anexos/fotos/72/3725872.jpg
72,2670476,Disfrutar al máximo. El perfume ideal para celebrar la eterna juventud,https://www.lanacion.com.ar/lifestyle/disfrutar-al-maximo-el-perfume-ideal-para-celebrar-la-eterna-juventud-nid22042021/,https://bucket1.glanacion.com/anexos/fotos/57/3725757.jpg
73,2671381,Santa Teresa. Cómo se vive en una playa del país más feliz de América latina,https://www.lanacion.com.ar/sociedad/asi-viven-cuatro-argentinos-en-santa-teresa-una-playa-en-la-feliz-costa-rica-nid23042021/,https://bucket1.glanacion.com/anexos/fotos/69/3726769.jpg
74,2182482,"Marca personal. Cómo podés desarrollarla (ya la tenés, lo sepas o no)",,https://bucket1.glanacion.com/anexos/fotos/10/2792710.jpg
75,2667745,Flexibles y plegables. Cómo son las nuevas pantallas y cuándo las vas a usar,https://www.lanacion.com.ar/tecnologia/pantallas-plegables-flexibles-y-que-se-enrollan-que-son-y-cuando-las-vas-a-usar-nid20042021/,https://bucket1.glanacion.com/anexos/fotos/63/3721863.webp
76,2670545,Denuncia. Le hicieron un tratamiento con botox pero le arruinaron la sonrisa,https://www.lanacion.com.ar/lifestyle/le-hicieron-un-tratamiento-con-botox-pero-le-arruinaron-la-sonrisa-nid22042021/,https://bucket1.glanacion.com/anexos/fotos/80/3725880.jpg
77,2670531,En fotos. Cómo es por dentro la casa de la legendaria Agatha Christie,https://www.lanacion.com.ar/lifestyle/la-escena-del-crimen-como-es-por-dentro-la-casa-de-la-legendaria-escritora-agatha-christie-nid22042021/,https://bucket1.glanacion.com/anexos/fotos/59/3725859.jpg
78,2670552,Bronca real. Los tres miembros de la corona que se niegan a perdonar a Harry,https://www.lanacion.com.ar/lifestyle/bronca-en-la-corona-los-tres-miembros-de-la-realeza-que-se-niegan-a-perdonar-a-harry-nid22042021/,https://bucket1.glanacion.com/anexos/fotos/87/3725887.jpg
79,2670575,"""Siempre lo hice"". Pampita reveló cuál es su particular tradición con sus hijos",https://www.lanacion.com.ar/espectaculos/la-particular-tradicion-familiar-de-pampita-lo-hice-con-todos-mis-hijos-nid22042021/,https://bucket1.glanacion.com/anexos/fotos/16/3725916.jpg
80,2670453,Ciencia. Hallan ''el arma secreta'' con la que el Homo Sapiens evitó la extinción,https://www.lanacion.com.ar/ciencia/hallan-el-arma-secreta-con-la-que-el-homo-sapiens-desplazo-a-los-neandertales-y-evito-la-extincion-nid22042021/,https://bucket1.glanacion.com/anexos/fotos/12/3725712.jpg
81,2670358,Misterio. El mensaje de la hija de Luis Miguel sobre la serie de Netflix,https://www.lanacion.com.ar/espectaculos/el-misterioso-mensaje-de-michelle-salas-la-hija-de-luis-miguel-tras-el-estreno-de-la-segunda-nid22042021/,https://bucket1.glanacion.com/anexos/fotos/57/3725557.png
