n,id,title,url,image
1,2671470,Nueva jueza. Capuchetti acumula expedientes sensibles y gana protagonismo,https://www.lanacion.com.ar/politica/maria-eugenia-capuchetti-quien-es-la-jueza-que-con-el-caso-espionaje-gana-protagonismo-y-acumula-nid23042021/,https://bucket1.glanacion.com/anexos/fotos/14/3726914.jpg
2,2671489,Dólar. Súbe el blue: continúa en alza y escala otros $4,https://www.lanacion.com.ar/economia/dolar/dolar-hoy-el-blue-sigue-en-alza-y-escala-otros-3-nid23042021/,https://bucket1.glanacion.com/anexos/fotos/44/3726944.jpg
3,2671474,"Covid. Kicillof cruzó a la oposición por la pandemia: ''Por favor, recapaciten''",https://www.lanacion.com.ar/politica/axel-kicillof-cruzo-a-la-oposicion-por-la-pandemia-por-favor-recapaciten-nid23042021/,https://bucket1.glanacion.com/anexos/fotos/23/3726923.jpg
4,2671437,Vacunación. Qué condiciones de riesgo tienen prioridad en la próxima fase,https://www.lanacion.com.ar/sociedad/coronavirus-que-condiciones-de-riesgo-tienen-prioridad-en-la-proxima-fase-de-vacunacion-nid23042021/,https://bucket1.glanacion.com/anexos/fotos/75/3726875.jpg
5,2671419,Vacunas. Operativo en el PAMI y en el ministerio porteño tras las denuncias,https://www.lanacion.com.ar/sociedad/coronavirus-operativos-en-el-pami-y-en-el-ministerio-de-salud-porteno-por-las-denuncias-sobre-la-nid23042021/,https://bucket1.glanacion.com/anexos/fotos/06/3726906.jpg
6,2670641,Más tensión en el sur. Alarma por la protesta que paraliza a la Patagonia,https://www.lanacion.com.ar/economia/tras-15-dias-de-protestas-vaca-muerta-se-convirtio-en-una-zona-fantasma-nid22042021/,https://bucket1.glanacion.com/anexos/fotos/98/3726798.jpg
7,2671199,"Turismo y vacunas. Son argentinos, van a Miami a descansar y se inoculan gratis",https://www.lanacion.com.ar/sociedad/coronavirus-son-argentinos-viajaron-a-estados-unidos-por-turismo-y-aprovecharon-a-vacunarse-gratis-nid23042021/,https://bucket1.glanacion.com/anexos/fotos/34/3726534.jpg
8,2364565,"Coronavirus. CABA: el mapa de la pandemia, comuna por comuna",,https://bucket1.glanacion.com/anexos/fotos/52/3350952.jpg
9,2671417,Adiós al rastreo. Uruguay cambia la estrategia en contactos estrechos,https://www.lanacion.com.ar/el-mundo/adios-al-rastreo-por-que-uruguay-cambia-la-estrategia-sobre-los-contactos-estrechos-nid23042021/,https://bucket1.glanacion.com/anexos/fotos/47/3726847.jpg
10,2671483,"""Impunidad"". Tinelli denunció amenazas por los resultados de San Lorenzo",https://www.lanacion.com.ar/deportes/futbol/marcelo-tinelli-denuncio-amenazas-por-los-resultados-de-san-lorenzo-nid23042021/,https://bucket1.glanacion.com/anexos/fotos/36/3726936.jpg
11,2670724,Análisis. La aprobación del Gobierno cae a su nivel más bajo,https://www.lanacion.com.ar/opinion/la-aprobacion-del-gobierno-cae-a-su-nivel-mas-bajo-nid23042021/,https://bucket1.glanacion.com/anexos/fotos/44/3726044.jpg
12,2670716,¿Nos encaminamos hacia una nueva tormenta perfecta?,https://www.lanacion.com.ar/opinion/nos-encaminamos-hacia-una-nueva-tormenta-perfecta-nid23042021/,https://bucket1.glanacion.com/anexos/fotos/41/3726041.jpg
13,2671481,"Clases. Tras un fuerte debate parlamentario, el oficialismo ratificó el DNU",https://www.lanacion.com.ar/politica/clases-tras-un-fuerte-debate-parlamentario-el-oficialismo-ratifico-el-decreto-presidencial-nid23042021/,https://bucket1.glanacion.com/anexos/fotos/32/3726932.jpg
14,2670492,Detenido en Núñez. El bajo perfil del ladrón de joyas buscado en Europa,https://www.lanacion.com.ar/seguridad/pink-panthers-el-bajo-perfil-del-ladron-de-joyas-fugado-de-europa-que-llego-hasta-nunez-por-el-amor-nid22042021/,https://bucket1.glanacion.com/anexos/fotos/01/3725801.jpg
15,2671436,"Campazzo. Por primera vez en el programa de Shaquille O'Neal por su ""avivada""",https://www.lanacion.com.ar/deportes/basquetbol/facundo-campazzo-por-primera-vez-en-el-clasico-shaqtina-fooly-de-manera-positiva-nid23042021/,https://bucket1.glanacion.com/anexos/fotos/73/3726873.jpg
16,2670646,TV. ¿Qué veo este fin de semana? Tres series para ver desde casa,https://www.lanacion.com.ar/espectaculos/series-de-tv/que-veo-este-fin-de-semana-el-caso-wall-una-comedia-familiar-y-heroinas-steampunk-nid22042021/,https://bucket1.glanacion.com/anexos/fotos/69/3725969.jpg
17,2671475,"Reconocida. Murió Diana Rabinovich, la psicoanalista argentina que tradujo a Lacan",https://www.lanacion.com.ar/cultura/murio-diana-rabinovich-la-destacada-psicoanalista-que-tradujo-a-lacan-nid23042021/,https://bucket1.glanacion.com/anexos/fotos/33/3726933.jpg
18,2671505,Canal de Suez. Por qué la tripulación del Ever Given sigue atrapada en el barco,https://www.lanacion.com.ar/el-mundo/canal-de-suez-por-que-la-tripulacion-del-ever-given-sigue-atrapada-en-el-barco-y-podria-pasar-anos-nid23042021/,https://bucket1.glanacion.com/anexos/fotos/67/3726967.jpg
19,2671418,''Ideólogo''. Por qué Máximo Kirchner no firmó un proyecto de biocombustibles,https://www.lanacion.com.ar/economia/campo/ideologo-por-que-maximo-kirchner-no-firmo-un-proyecto-de-biocombustibles-nid23042021/,https://bucket1.glanacion.com/anexos/fotos/48/3726848.jpg
20,2670498,Jugando al Rugby. Tras una grave lesión: ''Pensé que mamá y papá me iban a matar'',https://www.lanacion.com.ar/lifestyle/tras-una-grave-lesion-jugando-al-rugby-pense-que-mama-y-papa-me-iban-a-matar-nid22042021/,https://bucket1.glanacion.com/anexos/fotos/02/3725802.jpg
21,2671482,Tras un peritaje. Pity Álvarez: la defensa pidió su sobreseimiento,https://www.lanacion.com.ar/seguridad/pity-alvarez-tras-un-peritaje-psiquiatrico-y-psicologico-la-defensa-pidio-su-sobreseimiento-nid23042021/,https://bucket1.glanacion.com/anexos/fotos/34/3726934.jpg
22,2671496,Impresionante. Enormes bloques de hielo destruyen un paseo fluvial en Rusia,https://www.lanacion.com.ar/el-mundo/impresionante-enormes-bloques-de-hielo-destruyen-un-paseo-fluvial-en-rusia-nid23042021/,https://bucket1.glanacion.com/anexos/fotos/49/3726949.jpg
23,2671452,Recoleta. Una ambulancia chocó contra un auto y se incrustó en un local,https://www.lanacion.com.ar/sociedad/impresionante-choque-en-recoleta-entre-una-ambulancia-impacto-contra-un-auto-y-se-incrusto-en-un-nid23042021/,https://bucket1.glanacion.com/anexos/fotos/97/3726897.jpg
24,2670763,Ilegal. La Anmat prohibió un aceite de girasol,https://www.lanacion.com.ar/sociedad/la-anmat-prohibio-un-aceite-de-girasol-nid23042021/,https://bucket1.glanacion.com/anexos/fotos/92/3726092.jpg
25,2670749,"Escenario. La guerra llegó demasiado lejos, pero aún quedan varias batallas",https://www.lanacion.com.ar/politica/la-guerra-llego-demasiado-lejos-pero-aun-quedan-varias-batallas-nid23042021/,https://bucket1.glanacion.com/anexos/fotos/78/3726078.jpg
26,2670717,"Kicillof, la respuesta de Cristina a los problemas de Alberto",https://www.lanacion.com.ar/opinion/kicillof-la-respuesta-de-cristina-a-los-problemas-de-alberto-nid23042021/,
27,2669321,Los impulsos reaccionarios de Alberto Fernández,https://www.lanacion.com.ar/politica/los-impulsos-reaccionarios-de-alberto-fernandez-nid21042021/,
28,2669402,¿Y si apelamos a la libertad para el regreso a las aulas?,https://www.lanacion.com.ar/opinion/y-si-apelamos-a-la-libertad-para-el-regreso-a-las-aulas-nid22042021/,
29,2670722,Tarifas: volver a tropezar con la misma piedra,https://www.lanacion.com.ar/editoriales/tarifas-volver-a-tropezar-con-la-misma-piedra-nid23042021/,
30,2670715,El ''vacunagate'' peruano,https://www.lanacion.com.ar/editoriales/el-vacunagate-peruano-nid23042021/,
31,2671473,"""Devastador"". Explosión de casos y desborde sanitario: la crisis azota a la India",https://www.lanacion.com.ar/el-mundo/explosion-de-casos-y-desborde-sanitario-a-que-se-debe-la-crisis-que-azota-a-la-india-nid23042021/,https://bucket1.glanacion.com/anexos/fotos/28/3726928.jpg
32,2671488,Moreno: violento asalto a una mujer embarazada que estaba con sus hijos,https://www.lanacion.com.ar/seguridad/moreno-violento-asalto-a-una-mujer-embarazada-que-estaba-con-sus-hijos-nid23042021/,https://bucket1.glanacion.com/anexos/fotos/43/3726943.jpg
33,2671313,PASO. La trastienda del aval final de Juntos por el Cambio a la postergación,https://www.lanacion.com.ar/politica/la-trastienda-del-aval-final-de-juntos-por-el-cambio-a-la-postergacion-de-las-elecciones-nid23042021/,https://bucket1.glanacion.com/anexos/fotos/32/3726732.jpg
34,2671461,Plan Básico Universal. Quieren que en un mes llegue a 3 millones de personas,https://www.lanacion.com.ar/tecnologia/plan-basico-universal-el-gobierno-busca-agilizar-la-adopcion-de-la-tarifa-social-para-usuarios-de-nid23042021/,https://bucket1.glanacion.com/anexos/fotos/04/3726904.jpg
35,2670728,Día Mundial del Libro. Grandes lectores recomiendan sus títulos preferidos,https://www.lanacion.com.ar/cultura/dia-mundial-del-libro-grandes-lectores-recomiendan-sus-titulos-preferidos-nid23042021/,https://bucket1.glanacion.com/anexos/fotos/53/3726053.jpg
36,2670222,Oumuamua. El misterioso objeto espacial que divide a la ciencia,https://www.lanacion.com.ar/ciencia/oumuamua-el-misterioso-objeto-espacial-que-divide-a-la-ciencia-nid22042021/,https://bucket1.glanacion.com/anexos/fotos/41/3725341.jpg
37,2671451,Marcela y Elisa. El 'matrimonio sin hombre' que shockeó a la Argentina del 1900,https://www.lanacion.com.ar/lifestyle/marcela-y-elisa-el-matrimonio-sin-hombre-que-shockeo-a-la-argentina-del-1900-nid23042021/,https://bucket1.glanacion.com/anexos/fotos/90/3726890.png
38,2670368,"India Ortega. A los 15, la nieta de Palito, hija de Emanuel, debutó como modelo",https://www.lanacion.com.ar/revista-hola/india-ortega-a-los-15-la-nieta-de-palito-hija-de-emanuel-debuto-como-modelo-nid22042021/,https://bucket1.glanacion.com/anexos/fotos/76/3725576.jpg
39,2671498,"""Necesita operarse"". El reclamo de Flor Peña por la salud de su madre",https://www.lanacion.com.ar/espectaculos/el-dramatico-reclamo-de-florencia-pena-por-la-salud-de-su-madre-necesita-operarse-ahora-nid23042021/,https://bucket1.glanacion.com/anexos/fotos/54/3726954.png
40,2671469,Pandemia. Brancatelli confirmó que tiene coronavirus: qué pasará con Intratables,https://www.lanacion.com.ar/espectaculos/television/diego-brancatelli-confirmo-que-tiene-coronavirus-que-pasara-con-intratables-nid23042021/,https://bucket1.glanacion.com/anexos/fotos/12/3726912.png
41,2670676,"Vacunación. Graciela Alfano, lapidaria con Susana Giménez",https://www.lanacion.com.ar/espectaculos/personajes/graciela-alfano-lapidaria-con-susana-gimenez-si-estuviera-en-argentina-ya-la-habrian-vacunado-nid22042021/,https://bucket1.glanacion.com/anexos/fotos/88/3725988.jpg
42,2670750,Bienvenidos a bordo. Caro Haldemann reveló el problema que tiene con Pampita,https://www.lanacion.com.ar/espectaculos/television/bienvenidos-a-bordo-caro-haldemann-revelo-el-problema-que-tiene-con-pampita-nid23042021/,https://bucket1.glanacion.com/anexos/fotos/79/3726079.jpg
43,2671380,"Resiliencia. Historias de vida, aceptación y superación",https://www.lanacion.com.ar/lifestyle/resiliencia-historias-de-vida-aceptacion-y-superacion-nid23042021/,https://bucket1.glanacion.com/anexos/fotos/66/3726766.jpg
44,2670760,Sputnik V criolla. Los puntos oscuros detrás de la vacuna rusa en la Argentina,https://www.lanacion.com.ar/lnmas/sputnik-v-criolla-los-puntos-oscuros-detras-de-la-vacuna-rusa-en-la-argentina-nid23042021/,https://bucket1.glanacion.com/anexos/fotos/89/3726089.jpg
45,2670582,Carrió. ''Soy la última garantía en la provincia de Buenos Aires'',https://www.lanacion.com.ar/politica/elisa-carrio-sobre-su-posible-candidatura-soy-la-ultima-garantia-en-la-provincia-de-buenos-aires-nid22042021/,https://bucket1.glanacion.com/anexos/fotos/23/3725923.jpg
46,2670595,Jony Viale. ''¿Qué gana Alberto Fernández comportándose como un barrabrava?'',https://www.lanacion.com.ar/politica/jony-viale-que-gana-alberto-fernandez-comportandose-como-un-barrabrava-nid22042021/,https://bucket1.glanacion.com/anexos/fotos/27/3725927.jpg
47,2670644,"Alfredo Leuco. ""Baradel y Pablo Moyano son los 'Patrones del mal' del trabajo""",https://www.lanacion.com.ar/politica/alfredo-leuco-duro-con-baradel-y-pablo-moyano-son-los-patrones-del-mal-del-trabajo-nid22042021/,https://bucket1.glanacion.com/anexos/fotos/67/3725967.jpg
48,2670413,A prueba. Trabajo remoto: las 10 predicciones de la oficina que viene,https://www.lanacion.com.ar/propiedades/inmuebles-comerciales/el-trabajo-remoto-a-prueba-las-10-predicciones-de-la-oficina-que-viene-nid22042021/,https://bucket1.glanacion.com/anexos/fotos/29/3725629.jpg
49,2670351,Créditos Casa Propia. En dos días se inscribieron más de 38.000 personas,https://www.lanacion.com.ar/propiedades/construccion-y-diseno/creditos-casa-propia-en-dos-dias-se-inscribieron-mas-de-38000-personas-nid22042021/,https://bucket1.glanacion.com/anexos/fotos/46/3725546.jpg
50,2671382,Inauguración. Buenos Aires ya tiene su primera Estación de Futuro,https://www.lanacion.com.ar/economia/inauguracion-buenos-aires-ya-tiene-su-primera-estacion-de-futuro-nid23042021/,https://bucket1.glanacion.com/anexos/fotos/74/3726774.jpg
51,2671450,Cambio de manos. El Noble tiene un nuevo propietario,https://www.lanacion.com.ar/economia/la-cadena-de-empanadas-el-noble-fue-comprada-por-el-director-de-andesmar-nid23042021/,https://bucket1.glanacion.com/anexos/fotos/89/3726889.jpg
52,2670441,Biocombustibles. El kirchnerismo presentó un proyecto y se reaviva una polémica,https://www.lanacion.com.ar/economia/campo/biocombustibles-maximo-kirchner-presento-un-proyecto-y-se-reaviva-una-polemica-nid22042021/,https://bucket1.glanacion.com/anexos/fotos/87/3725687.jpg
53,2670429,"Era digital. Wayra, el programa que potencia a las startups más innovadoras",https://www.lanacion.com.ar/economia/era-digital-wayra-el-programa-que-viene-potenciando-a-las-startups-mas-innovadoras-nid22042021/,https://bucket1.glanacion.com/anexos/fotos/66/3725666.jpg
54,2671408,Netflix 2021. Entre el estreno de El reino y el regreso de varias series,https://www.lanacion.com.ar/espectaculos/series-de-tv/el-estreno-de-el-reino-y-el-regreso-de-varias-series-entre-las-novedades-de-netflix-para-este-ano-nid23042021/,https://bucket1.glanacion.com/anexos/fotos/29/3726829.jpg
55,2671491,"Rod Stewart. Continúa en proceso de recuperación, seis meses después de operarse",https://www.lanacion.com.ar/espectaculos/personajes/rod-stewart-continua-en-proceso-de-recuperacion-seis-meses-despues-de-operarse-nid23042021/,https://bucket1.glanacion.com/anexos/fotos/45/3726945.jpg
56,2671476,"Julia Mengolini. ""No hago apología de la droga""",https://www.lanacion.com.ar/espectaculos/personajes/julia-mengolini-no-hago-apologia-de-la-droga-nid23042021/,https://bucket1.glanacion.com/anexos/fotos/25/3726925.jpg
57,2671390,Paire. Duro castigo al tenista francés por su comportamiento en la Argentina,https://www.lanacion.com.ar/deportes/el-duro-castigo-que-recibio-benoit-paire-de-la-federacion-francesa-de-tenis-por-su-mal-nid23042021/,https://bucket1.glanacion.com/anexos/fotos/82/3726782.jpg
58,2670703,"Al ataque. Por su actitud, River gana respeto en Brasil, pero también se expone",https://www.lanacion.com.ar/deportes/futbol/la-actitud-ofensiva-hace-que-river-gane-respeto-en-brasil-aunque-tambien-lo-expone-a-perder-puntos-nid22042021/,https://bucket1.glanacion.com/anexos/fotos/19/3726019.jpg
59,2670654,Gallardo. La explicación sobre qué pasó con River frente a Fluminense,https://www.lanacion.com.ar/deportes/futbol/no-me-preocupa-lo-que-paso-la-explicacion-de-gallardo-sobre-el-empate-de-river-con-fluminense-nid22042021/,https://bucket1.glanacion.com/anexos/fotos/76/3725976.jpg
60,2670439,Darles sentido a los ambientes: cómo poner en práctica esta tendencia,https://www.lanacion.com.ar/lifestyle/darle-sentido-a-los-ambientes-como-poner-en-practica-esta-tendencia-nid22042021/,https://bucket1.glanacion.com/anexos/fotos/81/3725681.jpg
61,2670471,Caribe porteño. Tres platos clásicos colombianos para disfrutar en Buenos Aires,https://www.lanacion.com.ar/lifestyle/caribe-porteno-tres-platos-clasicos-colombianos-para-disfrutar-en-buenos-aires-nid22042021/,https://bucket1.glanacion.com/anexos/fotos/47/3725747.jpg
62,2670252,Protegé tu voz. 10 consejos para que te escuchen mejor en las videollamadas,https://www.lanacion.com.ar/tecnologia/10-consejos-para-mejorar-la-voz-en-reuniones-o-clases-en-linea-y-evitar-dolores-de-garganta-nid22042021/,https://bucket1.glanacion.com/anexos/fotos/96/3725396.jpg
63,2670164,Huerta de otoño. Cuatro flores comestibles para sumar color a tus platos,https://www.lanacion.com.ar/revista-jardin/huerta-de-otono-cuatro-flores-comestibles-para-sumar-color-a-tus-platos-nid22042021/,https://bucket1.glanacion.com/anexos/fotos/25/3725225.jpg
64,2667730,Anya Taylor-Joy. 5 datos curiosos de la protagonista argentina de Gambito de dama,https://www.lanacion.com.ar/revista-ohlala/5-curiosidades-de-la-protagonista-argentina-de-gambito-de-dama-nid20042021/,https://bucket1.glanacion.com/anexos/fotos/23/3721823.jpg
65,2670381,Tiktok. Un fallo en la app hizo que cualquiera pudiera ver porno y violencia,https://www.lanacion.com.ar/tecnologia/tiktok-un-fallo-en-la-aplicacion-hizo-que-cualquiera-pudiera-toparse-con-porno-y-violencia-extrema-nid22042021/,https://bucket1.glanacion.com/anexos/fotos/97/3725597.jpg
66,2670231,Horóscopo. ¿Qué dice tu ascendente para el fin de semana del 23 de abril?,https://www.lanacion.com.ar/lifestyle/horoscopo-que-dice-tu-ascendente-para-el-fin-de-semana-del-23-de-abril-nid22042021/,https://bucket1.glanacion.com/anexos/fotos/64/3725364.jpg
67,2669162,Agua. Tendencias y curiosidades de la bebida más consumida en el mundo,https://www.lanacion.com.ar/lifestyle/agua-tendencias-y-curiosidades-de-la-bebida-mas-consumida-en-el-mundo-nid21042021/,https://bucket1.glanacion.com/anexos/fotos/04/3724104.jpg
68,2670522,Moda. Las zapatillas blancas que se convirtieron en un ícono,https://www.lanacion.com.ar/lifestyle/moda-las-zapatillas-blancas-que-se-convirtieron-en-un-icono-nid22042021/,https://bucket1.glanacion.com/anexos/fotos/72/3725872.jpg
69,2670476,Disfrutar al máximo. El perfume ideal para celebrar la eterna juventud,https://www.lanacion.com.ar/lifestyle/disfrutar-al-maximo-el-perfume-ideal-para-celebrar-la-eterna-juventud-nid22042021/,https://bucket1.glanacion.com/anexos/fotos/57/3725757.jpg
70,2671381,Santa Teresa. Cómo se vive en una playa del país más feliz de América latina,https://www.lanacion.com.ar/sociedad/asi-viven-cuatro-argentinos-en-santa-teresa-una-playa-en-la-feliz-costa-rica-nid23042021/,https://bucket1.glanacion.com/anexos/fotos/69/3726769.jpg
71,2182482,"Marca personal. Cómo podés desarrollarla (ya la tenés, lo sepas o no)",,https://bucket1.glanacion.com/anexos/fotos/10/2792710.jpg
72,2667745,Flexibles y plegables. Cómo son las nuevas pantallas y cuándo las vas a usar,https://www.lanacion.com.ar/tecnologia/pantallas-plegables-flexibles-y-que-se-enrollan-que-son-y-cuando-las-vas-a-usar-nid20042021/,https://bucket1.glanacion.com/anexos/fotos/63/3721863.webp
73,2670545,Denuncia. Le hicieron un tratamiento con botox pero le arruinaron la sonrisa,https://www.lanacion.com.ar/lifestyle/le-hicieron-un-tratamiento-con-botox-pero-le-arruinaron-la-sonrisa-nid22042021/,https://bucket1.glanacion.com/anexos/fotos/80/3725880.jpg
74,2670531,En fotos. Cómo es por dentro la casa de la legendaria Agatha Christie,https://www.lanacion.com.ar/lifestyle/la-escena-del-crimen-como-es-por-dentro-la-casa-de-la-legendaria-escritora-agatha-christie-nid22042021/,https://bucket1.glanacion.com/anexos/fotos/59/3725859.jpg
75,2670552,Bronca real. Los tres miembros de la corona que se niegan a perdonar a Harry,https://www.lanacion.com.ar/lifestyle/bronca-en-la-corona-los-tres-miembros-de-la-realeza-que-se-niegan-a-perdonar-a-harry-nid22042021/,https://bucket1.glanacion.com/anexos/fotos/87/3725887.jpg
76,2670575,"""Siempre lo hice"". Pampita reveló cuál es su particular tradición con sus hijos",https://www.lanacion.com.ar/espectaculos/la-particular-tradicion-familiar-de-pampita-lo-hice-con-todos-mis-hijos-nid22042021/,https://bucket1.glanacion.com/anexos/fotos/16/3725916.jpg
77,2670453,Ciencia. Hallan ''el arma secreta'' con la que el Homo Sapiens evitó la extinción,https://www.lanacion.com.ar/ciencia/hallan-el-arma-secreta-con-la-que-el-homo-sapiens-desplazo-a-los-neandertales-y-evito-la-extincion-nid22042021/,https://bucket1.glanacion.com/anexos/fotos/12/3725712.jpg
78,2670358,Misterio. El mensaje de la hija de Luis Miguel sobre la serie de Netflix,https://www.lanacion.com.ar/espectaculos/el-misterioso-mensaje-de-michelle-salas-la-hija-de-luis-miguel-tras-el-estreno-de-la-segunda-nid22042021/,https://bucket1.glanacion.com/anexos/fotos/57/3725557.png
