n,id,title,url,image
1,2719845,Pandemia. Empezaron a regir las restricciones para el fin de semana,https://www.lanacion.com.ar/sociedad/como-seran-las-restricciones-por-covid-en-caba-y-provincia-de-buenos-aires-este-fin-de-semana-del-5-nid03062021/,https://bucket1.glanacion.com/anexos/fotos/95/3791995.jpg
2,2720896,"Impacto. Brasil gana siempre, pero sus jugadores podrían bajarse de la Copa",https://www.lanacion.com.ar/deportes/futbol/brasil-ecuador-por-las-eliminatorias-nid04062021/,https://bucket1.glanacion.com/anexos/fotos/84/3791984.jpg
3,2721516,Campeones argentinos. Así quedó la tabla histórica después del título de Colón,https://www.lanacion.com.ar/deportes/futbol/ranking-de-campeones-argentinos-asi-quedo-la-tabla-historica-despues-del-titulo-de-colon-nid04062021/,https://bucket1.glanacion.com/anexos/fotos/37/3791837.jpg
4,2721532,Vacunas vip. González García: ''Explicar un poco hubiera amortiguado el lío'',https://www.lanacion.com.ar/politica/gines-gonzalez-garcia-sobre-las-vacunas-vip-me-hubiera-gustado-explicar-un-poco-hubiera-amortiguado-nid04062021/,https://bucket1.glanacion.com/anexos/fotos/53/3791853.jpg
5,2721382,Covid. El Gobierno anunció cuál será el próximo grupo que se vacunará en el país,https://www.lanacion.com.ar/sociedad/coronavirus-el-gobierno-anuncio-cual-sera-el-proximo-grupo-que-se-vacunara-en-el-pais-nid04062021/,https://bucket1.glanacion.com/anexos/fotos/43/3791643.jpg
6,2721389,"Anuncio. Tevez se va de Boca: ""Pensé que nunca iba a llegar este momento""",https://www.lanacion.com.ar/deportes/futbol/carlos-tevez-anuncio-que-se-va-de-boca-pense-que-nunca-iba-a-llegar-este-momento-nid04062021/,https://bucket1.glanacion.com/anexos/fotos/32/3791732.jpg
7,2719800,Histórico. Colón goleó 3-0 a Racing: se consagró campeón argentino por primera vez,https://www.lanacion.com.ar/deportes/futbol/racing-colon-copa-de-la-liga-profesional-final-nid03062021/,https://bucket1.glanacion.com/anexos/fotos/38/3791838.jpg
8,2721560,TV. Axel Kicillof invitó a Fabián Doman a sumarse al Frente de Todos,https://www.lanacion.com.ar/politica/axel-kicillof-ya-vacune-a-una-ciudad-de-buenos-aires-y-media-nid04062021/,https://bucket1.glanacion.com/anexos/fotos/02/3791902.jpg
9,2721470,''Es trágico''. La crítica de Frederic a Bullrich por el caso Chocobar,https://www.lanacion.com.ar/politica/es-tragico-la-critica-de-sabina-frederic-a-patricia-bullrich-por-el-caso-chocobar-nid04062021/,https://bucket1.glanacion.com/anexos/fotos/93/3791793.jpg
10,2721400,"Elecciones. Con acusaciones y críticas, Pro enfrenta un clima de máxima tensión",https://www.lanacion.com.ar/politica/oposicion-con-acusaciones-y-criticas-pro-enfrenta-un-clima-de-maxima-tension-por-el-armado-electoral-nid04062021/,https://bucket1.glanacion.com/anexos/fotos/71/3791671.jpeg
11,2721289,AFIP. Desconcierto e indignación entre monotributistas por una medida,https://www.lanacion.com.ar/economia/desconcierto-e-indignacion-entre-monotributistas-por-una-medida-de-la-afip-nid04062021/,https://bucket1.glanacion.com/anexos/fotos/87/3791487.jpg
12,2721593,AFI. Fernández prorrogó por otros 180 días la intervención de Caamaño,https://www.lanacion.com.ar/politica/alberto-fernandez-prorrogo-por-otros-180-dias-la-intervencion-de-cristina-caamano-en-la-afi-nid05062021/,https://bucket1.glanacion.com/anexos/fotos/49/3791949.jpg
13,2721521,Blooper. Al Pulga Rodríguez le dieron un vaso enorme... y tuvo un accidente,https://www.lanacion.com.ar/deportes/pulga-rodriguez-el-campeon-accidentado-al-capitan-de-colon-se-le-rompio-un-enorme-vaso-de-cerveza-en-nid04062021/,https://bucket1.glanacion.com/anexos/fotos/41/3791841.png
14,2721502,"Carne. La Argentina sigue al tope de un ranking mundial, pero asombra un detalle",https://www.lanacion.com.ar/economia/campo/ganaderia/carne-la-argentina-sigue-al-tope-de-un-ranking-mundial-pero-come-40-menos-nid04062021/,https://bucket1.glanacion.com/anexos/fotos/25/3791825.jpg
15,2717210,"Vacunas. Cuáles se aplican en el país, cuáles llegarán y qué resultados muestran",https://www.lanacion.com.ar/sociedad/vacunas-lo-que-hay-que-saber-sobre-todas-las-que-se-aplican-en-el-mundo-nid01062021/,https://bucket1.glanacion.com/anexos/fotos/83/3786283.gif
16,2721337,Descuido. El chiste peronista de Fernández durante el Zoom con Putin,https://www.lanacion.com.ar/politica/descuido-el-chiste-peronista-de-alberto-fernandez-durante-el-zoom-con-vladimir-putin-nid04062021/,https://bucket1.glanacion.com/anexos/fotos/85/3791585.jpg
17,2721421,Sugestivo. El mensaje que publicó Pergolini antes de que Tevez anunciara el adiós,https://www.lanacion.com.ar/deportes/mario-pergolini-no-espero-al-anuncio-saludo-en-redes-a-carlos-tevez-antes-de-la-conferencia-nid04062021/,https://bucket1.glanacion.com/anexos/fotos/16/3791716.jpg
18,2721057,Figura. El desconocido de los 20 millones de euros que asombró en la selección,https://www.lanacion.com.ar/deportes/futbol/argentina-chile-una-garantia-cristian-romero-el-debutante-que-fue-figura-y-le-dio-solidez-a-la-nid04062021/,https://bucket1.glanacion.com/anexos/fotos/53/3791153.jpg
19,2721025,Detenida. El motivo por el que arrestaron a una tenista rusa en Roland Garros,https://www.lanacion.com.ar/deportes/tenis/roland-garros-detuvieron-a-una-tenista-rusa-acusada-de-arreglar-partidos-nid04062021/,https://bucket1.glanacion.com/anexos/fotos/90/3791090.jpg
20,2721312,Covid. Los millennials que vuelven al pueblo italiano que vende casas a un euro,https://www.lanacion.com.ar/el-mundo/italia-los-millennials-que-por-el-covid-vuelven-al-pueblo-que-vende-casas-a-un-euro-nid04062021/,https://bucket1.glanacion.com/anexos/fotos/23/3791523.png
21,2721267,"""¿Perdieron el corazón?"". La crítica de Randazzo a Cristina Kirchner y Massa",https://www.lanacion.com.ar/politica/perdieron-el-sentido-comun-o-el-corazon-florencio-randazzo-contra-cristina-kirchner-y-sergio-massa-nid04062021/,https://bucket1.glanacion.com/anexos/fotos/14/3791414.jpg
22,2720996,Aviones supersónicos. United Airlines volará de Nueva York a Londres en 3 horas,https://www.lanacion.com.ar/lifestyle/united-airlines-compra-aviones-supersonicos-que-volarian-de-nueva-york-a-londres-en-3-horas-y-media-nid04062021/,https://bucket1.glanacion.com/anexos/fotos/32/3791132.jpg
23,2721141,Qué tenía. Remodelaban un teatro y hallaron una billetera perdida en 1975,https://www.lanacion.com.ar/el-mundo/remodelaban-un-teatro-y-encontraron-una-billetera-perdida-hace-casi-medio-siglo-que-habia-adentro-nid04062021/,https://bucket1.glanacion.com/anexos/fotos/55/3791255.jpg
24,2720152,"''No rompan nada'', el plan en marcha del oficialismo",https://www.lanacion.com.ar/politica/no-rompan-nada-el-plan-en-marcha-del-oficialismo-nid04062021/,https://bucket1.glanacion.com/anexos/fotos/67/3790167.jpg
25,2720150,El viaje de Pablo Moyano al centro del kirchnerismo,https://www.lanacion.com.ar/opinion/el-viaje-de-pablo-moyano-al-centro-del-kirchnerismo-nid04062021/,
26,2720170,El escenario económico más temido,https://www.lanacion.com.ar/opinion/el-escenario-economico-mas-temido-nid04062021/,
27,2720808,La desproporción entre el gasto militar y la ayuda para la población marginal,https://www.lanacion.com.ar/opinion/la-increible-desproporcion-entre-los-gastos-militares-y-la-ayuda-para-la-poblacion-marginal-nid04062021/,
28,2720157,El respeto a los símbolos patrios,https://www.lanacion.com.ar/editoriales/el-respeto-a-los-simbolos-patrios-nid04062021/,
29,2720148,"Colombia y Venezuela, una frontera caliente",https://www.lanacion.com.ar/editoriales/colombia-y-venezuela-una-frontera-caliente-nid04062021/,
30,2721048,Medio Ambiente. Qué tan cerca están los proyectos de convertirse en ley,https://www.lanacion.com.ar/comunidad/monitor-legislativo-ambiental-nid04062021/,https://bucket1.glanacion.com/anexos/fotos/36/3791136.gif
31,2589486,Humedales. La agonía de un ecosistema ''sin marketing'' pero clave para el país,https://www.lanacion.com.ar/sociedad/naturaleza-la-agonia-de-un-ecosistema-sin-marketing-pero-clave-para-el-pais-nid02022021/,https://bucket1.glanacion.com/anexos/fotos/38/3791138.jpg
32,2721266,Video. ¿Cómo se sanciona una ley en el Congreso?,https://www.lanacion.com.ar/politica/como-se-sanciona-una-ley-en-el-congreso-nid04062021/,https://bucket1.glanacion.com/anexos/fotos/13/3791413.png
33,2721226,$27 millones. Un intendente le cobrará al campo una tasa de salud,https://www.lanacion.com.ar/economia/campo/un-intendente-k-le-cobrara-al-campo-una-nueva-tasa-por-salud-nid04062021/,https://bucket1.glanacion.com/anexos/fotos/63/3791363.jpeg
34,2720052,Qué es de la vida de... Catherine Bach: la actriz que impuso su estilo en los 80,https://www.lanacion.com.ar/espectaculos/que-es-de-la-vida-de-catherine-bach-la-actriz-que-impuso-su-propio-estilo-en-la-moda-de-los-80-nid04062021/,https://bucket1.glanacion.com/anexos/fotos/33/3790033.jpg
35,2721461,Precios. Las cifras de inflación que proyecta el mercado para este año,https://www.lanacion.com.ar/economia/precios-el-mercado-proyecta-mas-inflacion-y-espera-que-este-ano-cierre-por-arriba-del-48-nid04062021/,https://bucket1.glanacion.com/anexos/fotos/77/3791777.jpg
36,2721031,En Uruguay. Las definiciones de Bulgheroni tras una reunión con Lacalle Pou,https://www.lanacion.com.ar/economia/alejandro-bulgheroni-las-definiciones-del-argentino-tras-su-reunion-con-lacalle-pou-nid04062021/,https://bucket1.glanacion.com/anexos/fotos/14/3791114.jpg
37,2721252,"Entrevista. Díaz Ayuso: ""La izquierda pretende decirle a la gente cómo vivir""",https://www.lanacion.com.ar/el-mundo/isabel-diaz-ayuso-la-izquierda-pretende-decirle-a-la-gente-como-vivir-que-comer-y-como-comprar-nid04062021/,https://bucket1.glanacion.com/anexos/fotos/92/3791392.png
38,2720049,Dunkerque. El milagro que salvó a los aliados de una matanza nazi,https://www.lanacion.com.ar/el-mundo/dunkerque-el-milagro-que-salvo-a-los-aliados-de-una-matanza-nazi-nid03062021/,https://bucket1.glanacion.com/anexos/fotos/00/3790000.jpg
39,2721316,Netflix. La historia de los hijos de Luis Miguel que no aparecen en la serie,https://www.lanacion.com.ar/espectaculos/la-historia-de-los-hijos-de-luis-miguel-que-no-aparecen-en-la-serie-de-netflix-nid04062021/,https://bucket1.glanacion.com/anexos/fotos/31/3791531.png
40,2721333,Reino Unido. Con vista al lago y sin rejas: la cárcel que genera polémica,https://www.lanacion.com.ar/el-mundo/con-vista-al-lago-y-sin-rejas-la-carcel-que-genera-polemica-en-reino-unido-nid04062021/,https://bucket1.glanacion.com/anexos/fotos/79/3791579.png
41,2721269,Misterio resuelto. Cómo es el rincón de la vecindad del Chavo que nadie vio,https://www.lanacion.com.ar/espectaculos/misterio-resuelto-como-es-la-parte-de-la-vecindad-del-chavo-que-nadie-habia-visto-nid04062021/,https://bucket1.glanacion.com/anexos/fotos/22/3791422.jpg
42,2613211,"""No te enamores"". Una advertencia a tiempo no pudo frenar su historia de amor",https://www.lanacion.com.ar/lifestyle/poco-ortodoxa-el-entorno-la-rechazo-quedo-embarazada-y-sucedio-lo-inesperado-nid25022021/,https://bucket1.glanacion.com/anexos/fotos/95/3789995.jpg
43,2721285,Ranking. Netflix Argentina: las 10 series y películas más vistas de hoy,https://www.lanacion.com.ar/espectaculos/ranking-de-netflix-argentina-las-10-series-y-peliculas-mas-vistas-este-4-de-junio-nid04062021/,https://bucket1.glanacion.com/anexos/fotos/56/3791456.png
44,2721202,"TV. Cabak: ""Me echaron de Polémica por no querer hablar de mi vida privada""",https://www.lanacion.com.ar/espectaculos/personajes/horacio-cabak-sobre-su-salida-de-polemica-en-el-bar-me-echaron-porque-no-queria-hablar-de-mi-vida-nid04062021/,https://bucket1.glanacion.com/anexos/fotos/15/3791315.jpg
45,2719951,''¡Lean lo que votan!''. El fuerte cruce entre Cafiero y Naidenoff,https://www.lanacion.com.ar/politica/lean-lo-que-votan-fuerte-cruce-entre-cafiero-y-naidenoff-nid03062021/,https://bucket1.glanacion.com/anexos/fotos/18/3789818.jpg
46,2721101,Elecciones. Bullrich contra Vidal: ''No podemos seguir esperando que se decida'',https://www.lanacion.com.ar/politica/patricia-bullrich-cruzo-a-maria-eugenia-vidal-por-su-indefinicion-electoral-no-ayuda-a-juntos-por-el-nid04062021/,https://bucket1.glanacion.com/anexos/fotos/12/3302312.jpg
47,2721253,Tiene 34. Vio que faltaba algo en el país y creó un negocio millonario,https://www.lanacion.com.ar/economia/negocios/tiene-34-vio-que-faltaba-algo-en-el-pais-y-creo-un-negocio-millonario-nid04062021/,https://bucket1.glanacion.com/anexos/fotos/95/3791395.jpg
48,2716838,Autos 0km. Cuáles fueron los modelos más vendidos de mayo y sus precios,https://www.lanacion.com.ar/autos/al-volante/precios-y-versiones-de-los-autos-mas-vendidos-de-mayo-nid01062021/,https://bucket1.glanacion.com/anexos/fotos/92/3785592.jpg
49,2719752,Cepo. Los frigoríficos alertan que se necesita una rápida solución,https://www.lanacion.com.ar/economia/campo/cepo-a-la-carne-los-frigorificos-alertan-que-se-necesita-una-rapida-solucion-nid03062021/,https://bucket1.glanacion.com/anexos/fotos/30/3789130.jpg
50,2720997,"Viggiano. Habla del amor, de su trabajo y de por qué se bajó de Mi cuñado",https://www.lanacion.com.ar/espectaculos/personajes/patricia-viggiano-se-reconcilio-con-su-marido-tras-dos-anos-distanciados-es-mas-lindo-estar-juntos-nid04062021/,https://bucket1.glanacion.com/anexos/fotos/58/3791058.jpg
51,2721436,"MasterChef. El manager de Alex Caniggia: ""A él no le gusta perder a nada""",https://www.lanacion.com.ar/espectaculos/personajes/el-manager-de-alex-caniggia-tras-la-salida-del-mediatico-de-masterchef-celebrity-a-el-no-le-gusta-nid04062021/,https://bucket1.glanacion.com/anexos/fotos/33/3791733.jpg
52,2721099,Romance. Argentino radicado en Miami: quién es el nuevo novio de Tesouro,https://www.lanacion.com.ar/espectaculos/personajes/empresario-argentino-radicado-en-miami-quien-es-el-nuevo-novio-de-floppy-tesouro-nid04062021/,https://bucket1.glanacion.com/anexos/fotos/37/3791237.jpg
53,2721403,El último Apache. El éxito y los conflictos que marcan a fuego el adiós de Tevez,https://www.lanacion.com.ar/deportes/futbol/carlos-tevez-en-boca-la-ultima-historia-del-10-un-regreso-marcado-entre-el-exito-y-los-conflictos-nid04062021/,https://bucket1.glanacion.com/anexos/fotos/82/3791682.jpg
54,2719991,En vivo. Juega Brasil: así está la tabla de las eliminatorias para Qatar 2022,https://www.lanacion.com.ar/deportes/futbol/posiciones-de-las-eliminatorias-sudamericanas-qatar-2022-nid03062021/,https://bucket1.glanacion.com/anexos/fotos/07/3789907.jpg
55,2721254,Juega el Peque. Horario y TV de Schwartzman por la tercera rueda en París,https://www.lanacion.com.ar/deportes/diego-schwartzman-phillip-kohlschreiber-horario-y-tv-del-partido-por-la-tercera-rueda-de-roland-nid04062021/,https://bucket1.glanacion.com/anexos/fotos/99/3791399.jpg
56,2719974,"20 claves. Precios, los barrios más caros y los más baratos, todo sobre el mercado",https://www.lanacion.com.ar/propiedades/casas-y-departamentos/propiedades-20-claves-para-entender-que-esta-pasando-en-el-mercado-inmobiliario-nid03062021/,https://bucket1.glanacion.com/anexos/fotos/86/3789886.jpg
57,2719985,En el peor momento.. Este es el hotel que Cristiano Ronaldo abrirá  en Madrid,https://www.lanacion.com.ar/propiedades/inmuebles-comerciales/madrid-cristiano-ronaldo-abrira-un-hotel-de-lujo-en-la-gran-via-nid03062021/,https://bucket1.glanacion.com/anexos/fotos/98/3789898.jpg
58,2720159,Irreconocible. Una cocina que sumó metros y vista hacia el jardín,https://www.lanacion.com.ar/lifestyle/irreconocible-giro-total-en-una-cocina-que-sumo-metros-luz-natural-y-vista-hacia-el-jardin-nid04062021/,https://bucket1.glanacion.com/anexos/fotos/76/3790176.jpg
59,2721338,La picada perfecta. El ABC de un clásico argentino,https://www.lanacion.com.ar/lifestyle/la-pica-perfecta-el-abc-de-un-clasico-argentino-nid04062021/,https://bucket1.glanacion.com/anexos/fotos/86/3791586.jpeg
60,2719666,Lo sustentable. Más en boga que nunca: cinco beneficios eco friendly,https://www.lanacion.com.ar/lifestyle/lo-sustentable-mas-en-boga-que-nunca-cinco-beneficios-eco-friendly-nid03062021/,https://bucket1.glanacion.com/anexos/fotos/80/3788980.png
61,2714622,"Billy Bond. ''Charly se está poniendo viejo, Spinetta se murió, ¿cuántos quedan?",https://www.lanacion.com.ar/revista-rolling-stone/billy-bond-charly-se-esta-poniendo-viejo-spinetta-se-murio-cuantos-quedan-nid31052021/,https://bucket1.glanacion.com/anexos/fotos/45/3782945.jpg
62,2720886,"Chile. Cómo sigue, pese al récord de vacunación de principios de año",https://www.lanacion.com.ar/sociedad/despues-del-record-de-vacunacion-como-esta-chile-hoy-nid04062021/,https://bucket1.glanacion.com/anexos/fotos/20/3790920.jpg
63,2716780,Jey Mammon. Una charla para conocer su vida y su camino musical,https://www.lanacion.com.ar/espectaculos/personajes/el-camino-musical-de-jey-mammon-nid01062021/,https://bucket1.glanacion.com/anexos/fotos/85/3785485.jpg
64,2720961,¿Se enganchan o no? Series con intriga romántica a las que le falta un lance,https://www.lanacion.com.ar/espectaculos/de-moonlighting-a-lucifer-series-con-intriga-romantica-a-las-que-le-falta-un-lance-nid04062021/,https://bucket1.glanacion.com/anexos/fotos/22/3791022.jpg
65,2721510,"Video. El Superman brasileño, atropellado al parar un colectivo con sus ""poderes""",https://www.lanacion.com.ar/lifestyle/insolito-el-superman-brasileno-fue-atropellado-al-intentar-parar-un-colectivo-con-sus-poderes-nid04062021/,https://bucket1.glanacion.com/anexos/fotos/36/3791836.png
66,2719860,Desafío. Diego Boneta protagonizará otra biopic tras interpretar a Luis Miguel,https://www.lanacion.com.ar/espectaculos/diego-boneta-protagonizara-otra-biopic-tras-el-exito-de-la-serie-de-luis-miguel-nid03062021/,https://bucket1.glanacion.com/anexos/fotos/35/3789335.jpg
67,2720005,Bitcoin. Quién es quién en la guerra de las criptomonedas,https://www.lanacion.com.ar/tecnologia/bitcoin-quien-es-quien-en-la-guerra-de-las-criptomonedas-y-como-te-puede-afectar-nid03062021/,https://bucket1.glanacion.com/anexos/fotos/40/3789940.jpg
68,2719873,"La Plata. Robó una perra, se arrepintió y la devolvió con una nota pidiendo perdón",https://www.lanacion.com.ar/sociedad/la-plata-robo-una-perra-se-arrepintio-y-la-devolvio-con-una-nota-pidiendo-perdon-nid03062021/,https://bucket1.glanacion.com/anexos/fotos/64/3789364.png
69,2719997,"Tesoro. Apolo 11, la cueva africana que conserva obras de arte de 30.000 años",https://www.lanacion.com.ar/lifestyle/apolo-11-la-cueva-africana-que-conserva-obras-de-arte-de-30000-anos-nid03062021/,https://bucket1.glanacion.com/anexos/fotos/16/3789916.jpg
70,2719889,"Desplante. El hijo de Flor Peña la criticó en vivo: ''Me traés por el rating""",https://www.lanacion.com.ar/espectaculos/el-desplante-en-vivo-del-hijo-de-flor-pena-me-traes-para-levantar-el-rating-nid03062021/,https://bucket1.glanacion.com/anexos/fotos/42/3789442.png
