n,id,title,url,image
1,2636038,Caso M. Se negó a declarar el acusado por el secuestro de la niña de siete años,https://www.lanacion.com.ar/seguridad/se-nego-a-declarar-el-detenido-acusado-por-el-secuestro-de-la-nina-de-siete-anos-nid20032021/,https://bucket1.glanacion.com/anexos/fotos/50/3672550.jpg
2,2635985,Preocupación. En el Gobierno reconocen que solo tienen vacunas para 10 días,https://www.lanacion.com.ar/politica/en-el-gobierno-reconocen-que-solo-tienen-vacunas-para-10-dias-y-que-no-saben-cuando-ingresaran-mas-nid20032021/,https://bucket1.glanacion.com/anexos/fotos/62/3672462.jpg
3,2636033,"""Cianuro o plomo''. Un detenido por amenazar al embajador de Alemania",https://www.lanacion.com.ar/seguridad/renuncie-cianuro-o-plomo-un-detenido-por-amenazar-en-instagram-al-embajador-de-alemania-nid20032021/,https://bucket1.glanacion.com/anexos/fotos/37/3672537.jpg
4,2635977,Covid. El tuit de Gollan sobre la vacunación del Indio Solari que generó polémica,https://www.lanacion.com.ar/politica/el-polemico-tuit-de-daniel-gollan-sobre-la-vacunacion-del-indio-solari-nid20032021/,https://bucket1.glanacion.com/anexos/fotos/47/3672447.jpg
5,2636034,Colapso en Brasil. Por primera vez faltó oxígeno en San Pablo,https://www.lanacion.com.ar/el-mundo/colapso-en-brasil-por-primera-vez-falto-oxigeno-en-san-pablo-para-tratar-pacientes-con-coronavirus-nid20032021/,https://bucket1.glanacion.com/anexos/fotos/43/3672543.jpg
6,2636030,Revelación. La nueva explicación de lo que hizo Tiger al volante en el accidente,https://www.lanacion.com.ar/deportes/tiger-woods-segun-los-investigadores-no-freno-durante-el-momento-del-accidente-nid20032021/,https://bucket1.glanacion.com/anexos/fotos/30/3672530.jpg
7,2636045,Redes. El cruce entre Patricia Bullrich y Mayra Mendoza por la compra de vacunas,https://www.lanacion.com.ar/politica/el-cruce-entre-patricia-bullrich-y-mayra-mendoza-por-la-compra-de-vacunas-nid20032021/,https://bucket1.glanacion.com/anexos/fotos/59/3672559.jpg
8,2635158,Tensión. La presión de los aliados del Gobierno para ir contra Mercado Libre,https://www.lanacion.com.ar/politica/la-presion-de-los-aliados-para-ir-contra-mercado-libre-nid20032021/,https://bucket1.glanacion.com/anexos/fotos/74/3671474.jpg
9,2636036,En la exESMA. Fernández participa de un homenaje a trabajadores desaparecidos,https://www.lanacion.com.ar/politica/fernandez-participa-en-la-exesma-de-un-homenaje-a-trabajadores-desaparecidos-nid20032021/,https://bucket1.glanacion.com/anexos/fotos/47/3672547.jpg
10,2636031,En números. Un año de cuarentena: el impacto sobre la imagen presidencial,https://www.lanacion.com.ar/politica/un-ano-de-cuarentena-en-numeros-el-impacto-sobre-la-imagen-presidencial-la-economia-y-la-educacion-nid20032021/,https://bucket1.glanacion.com/anexos/fotos/34/3672534.jpg
11,2635961,"Vacunas. La Argentina, en una lista del New York Times sobre el reparto desigual",https://www.lanacion.com.ar/politica/vacunas-vip-la-argentina-en-una-lista-de-the-new-york-times-sobre-las-inequidades-de-los-operativos-nid20032021/,https://bucket1.glanacion.com/anexos/fotos/05/3672405.jpg
12,2635970,Susto en el tenis. Un terremoto sorprendió a Zverev en pleno partido,https://www.lanacion.com.ar/deportes/susto-en-acapulco-un-terremoto-sorprendio-a-zverev-en-su-partido-contra-koepfer-nid20032021/,https://bucket1.glanacion.com/anexos/fotos/23/3672423.jpg
13,2635279,"NBA. Campazzo: dos robos decisivos y el salto de sus compañeros para una ""volcada""",https://www.lanacion.com.ar/deportes/la-mosca-campazzo-volo-en-el-final-y-fue-determinante-para-el-triunfo-de-denver-nuggets-contra-nid20032021/,https://bucket1.glanacion.com/anexos/fotos/35/3671635.jpg
14,2635251,Agenda de TV. Se define el Seis Naciones y juegan Independiente y River,https://www.lanacion.com.ar/deportes/agenda-de-tv-del-sabado-river-independiente-lautaro-olympique-y-la-definicion-del-seis-naciones-nid20032021/,https://bucket1.glanacion.com/anexos/fotos/96/3671596.jpg
15,2636023,"Figura. Moroni revive a un campeón inglés y vive de la ""nafta"" de los Pumas",https://www.lanacion.com.ar/deportes/matias-moroni-sangre-argentina-para-levantar-a-leicester-tigers-un-legendario-campeon-ingles-nid20032021/,https://bucket1.glanacion.com/anexos/fotos/28/3672528.jpg
16,2631656,En el colchón. ¿Sigue siendo negocio guardar los dólares para construir una casa?,https://www.lanacion.com.ar/propiedades/suba-de-costos-guardar-dolares-para-construir-una-casa-deja-de-ser-negocio-nid16032021/,https://bucket1.glanacion.com/anexos/fotos/65/3665665.jpg
17,2635952,"Interna. Frederic cruzó a Berni y remarcó: ""El Presidente me respalda a mí""",https://www.lanacion.com.ar/politica/sabina-frederic-tras-el-cruce-con-sergio-berni-el-presidente-me-respalda-a-mi-es-quien-me-eligio-nid20032021/,https://bucket1.glanacion.com/anexos/fotos/84/3672384.jpg
18,2635946,Capitolio. El trumpista vinculado con la dictadura argentina detenido en EE.UU.,https://www.lanacion.com.ar/el-mundo/freddie-klein-el-trumpista-vinculado-con-la-ultima-dictadura-argentina-que-esta-detenido-por-el-nid20032021/,https://bucket1.glanacion.com/anexos/fotos/73/3672373.jpg
19,2635220,A 45 años. El golpe más organizado y brutal de la historia argentina,https://www.lanacion.com.ar/ideas/el-golpe-mas-organizado-y-brutal-de-la-historia-argentina-nid20032021/,https://bucket1.glanacion.com/anexos/fotos/43/3671543.jpg
20,2636024,"Lo dejó en el banco. Cornejo a Macri: ""En el segundo tiempo hay que hacer cambios""",https://www.lanacion.com.ar/politica/cornejo-dejo-en-el-banco-a-macri-en-el-segundo-tiempo-hay-que-hacer-cambios-nid20032021/,https://bucket1.glanacion.com/anexos/fotos/14/3672514.jpg
21,2633872,Bielsa. Leeds rompió un embrujo y el propio club hizo una broma con Titanic...,https://www.lanacion.com.ar/deportes/fulham-leeds-united-premier-league-el-partido-de-la-jornada-29-nid18032021/,https://bucket1.glanacion.com/anexos/fotos/36/3671436.jpg
22,2635975,Uruguay. Desarticulan una fiesta clandestina organizada por un argentino,https://www.lanacion.com.ar/sociedad/uruguay-desarticulan-una-fiesta-clandestina-organizada-por-un-argentino-nid20032021/,https://bucket1.glanacion.com/anexos/fotos/41/3672441.jpg
23,2635948,Erupción en Islandia. Las impactantes imágenes de ríos de lava,https://www.lanacion.com.ar/economia/erupcion-en-islandia-las-impactantes-imagenes-de-rios-de-lava-cerca-de-reikiavik-nid20032021/,https://bucket1.glanacion.com/anexos/fotos/77/3672377.png
24,2635987,''En pesos devaluados''. Lali Espósito reveló la cifra exacta de sus ahorros,https://www.lanacion.com.ar/espectaculos/lali-esposito-revelo-la-cifra-millonaria-que-tiene-ahorrada-en-pesos-devaluados-nid20032021/,https://bucket1.glanacion.com/anexos/fotos/71/3672471.png
25,2635236,El Estado fracasa  dos veces,https://www.lanacion.com.ar/opinion/el-estado-fracasa-dos-veces-nid20032021/,https://bucket1.glanacion.com/anexos/fotos/08/3671608.jpg
26,2635235,La fase superadora del relato,https://www.lanacion.com.ar/opinion/la-fase-superadora-del-relato-nid20032021/,
27,2635222,Los desafíos de la crianza en tiempos de incertidumbre,https://www.lanacion.com.ar/ideas/los-desafios-de-la-crianza-en-tiempos-de-incertidumbre-nid20032021/,
28,2635195,Medios concentrados: concentrados en pegar,https://www.lanacion.com.ar/opinion/medios-concentrados-concentrados-en-pegar-nid20032021/,
29,2635245,El que se mueve engancha una changuita,https://www.lanacion.com.ar/editoriales/el-que-se-mueve-engancha-una-changuita-nid20032021/,
30,2635237,Colapsa Venezuela,https://www.lanacion.com.ar/editoriales/colapsa-venezuela-nid20032021/,
31,2635969,"Bolivia. Iban a llevar a Áñez a un hospital, pero la trasladaron de prisión",https://www.lanacion.com.ar/el-mundo/bolivia-le-dijeron-a-jeanine-anez-que-la-iban-a-llevar-a-un-hospital-pero-la-trasladaron-de-prision-nid20032021/,https://bucket1.glanacion.com/anexos/fotos/22/3672422.png
32,2635039,Desde abril. Adiós a los cajeros gratis: cuál será el costo de usarlos,https://www.lanacion.com.ar/economia/adios-a-los-cajeros-gratis-desde-abril-todo-volvera-a-ser-como-antes-nid19032021/,https://bucket1.glanacion.com/anexos/fotos/91/3670991.jpg
33,2635974,Coronavirus. En Miami podrá vacunarse cualquier persona mayor de 40 años,https://www.lanacion.com.ar/el-mundo/coronavirus-en-miami-podra-vacunarse-cualquier-persona-mayor-de-40-anos-nid20032021/,https://bucket1.glanacion.com/anexos/fotos/40/3672440.jpg
34,2635950,"TV. Murió Carlos Rivkin, actor de las ficciones argentinas más exitosas",https://www.lanacion.com.ar/espectaculos/murio-carlos-rivkin-el-actor-que-participo-de-los-programas-mas-exitosos-de-la-tv-argentina-nid20032021/,https://bucket1.glanacion.com/anexos/fotos/79/3672379.png
35,2635978,Tras la ruptura. El sorpresivo mensaje de Sara Carbonero a Iker Casillas,https://www.lanacion.com.ar/deportes/el-sorpresivo-mensaje-de-sara-carbonero-a-iker-casillas-tras-la-ruptura-nid20032021/,https://bucket1.glanacion.com/anexos/fotos/48/3672448.png
36,2635998,"""Indio"" Solari vacunado. La fuerte reacción de Novaresio por el tuit de Gollan",https://www.lanacion.com.ar/politica/la-fuerte-reaccion-de-luis-novaresio-por-el-tuit-de-daniel-gollan-sobre-la-vacunacion-del-indio-nid20032021/,https://bucket1.glanacion.com/anexos/fotos/87/3672487.jpg
37,2635029,Deep Nostalgia. La app que ''revive'' a tus familiares,https://www.lanacion.com.ar/sabado/deep-nostalgia-la-app-que-revive-a-tus-familiares-nid19032021/,https://bucket1.glanacion.com/anexos/fotos/39/3671039.jpg
38,2627835,Joyas porteñas. La confitería en la que merendaba Borges,https://www.lanacion.com.ar/lifestyle/joyas-portenas-la-confiteria-en-la-que-merendaba-borges-nid12032021/,https://bucket1.glanacion.com/anexos/fotos/90/3660290.jpg
39,2634970,Vida híbrida. Cómo  lo virtual convive con lo presencial,https://www.lanacion.com.ar/sabado/vida-hibrida-como-lo-virtual-convive-con-lo-presencial-nid19032021/,https://bucket1.glanacion.com/anexos/fotos/78/3670878.jpg
40,2636035,Acertijo. ¿Qué número ocupa el lugar central de la figura?,https://www.lanacion.com.ar/lifestyle/acertijo-que-numero-ocupa-el-lugar-central-de-la-figura-nid20032021/,https://bucket1.glanacion.com/anexos/fotos/44/3672544.jpg
41,2635967,''Me veía deforme''. Cinthia Fernández habló de su lucha contra la vigorexia,https://www.lanacion.com.ar/espectaculos/cinthia-fernandez-hablo-de-su-lucha-contra-la-vigorexia-me-veia-deforme-nid20032021/,https://bucket1.glanacion.com/anexos/fotos/20/3672420.jpg
42,2635152,"Análisis. ''Un gobierno anormal, en un país devastado''",https://www.lanacion.com.ar/politica/luis-majul-un-gobierno-anormal-en-un-pais-devastado-nid20032021/,https://bucket1.glanacion.com/anexos/fotos/70/3671470.jpg
43,2635128,Jony Viale. ''En la Argentina mentir es gratis'',https://www.lanacion.com.ar/espectaculos/el-duro-editorial-de-jony-viale-mentir-es-gratis-en-la-argentina-nid19032021/,https://bucket1.glanacion.com/anexos/fotos/42/3671442.png
44,2635092,Interna peronista. Fracasó la conciliación entre Máximo Kirchner y Fernando Gray,https://www.lanacion.com.ar/politica/interna-peronista-fracaso-la-conciliacion-entre-maximo-kirchner-y-fernando-gray-y-resolvera-la-nid19032021/,https://bucket1.glanacion.com/anexos/fotos/57/3671357.jpg
45,2635100,Formosa. Insfrán apeló el fallo sobre la libre circulación y desafía a la Nación,https://www.lanacion.com.ar/politica/insfran-apelo-el-fallo-judicial-que-permite-la-libre-circulacion-y-desafia-las-advertencias-de-la-nid19032021/,https://bucket1.glanacion.com/anexos/fotos/77/3671377.jpg
46,2635249,Marketing 2021. La hora de la sintonía fina,https://www.lanacion.com.ar/economia/negocios/marketing-2021-la-hora-de-la-sintonia-fina-nid20032021/,https://bucket1.glanacion.com/anexos/fotos/89/3671589.jpg
47,2635087,Audición. Un sentido vital para la conducción,https://www.lanacion.com.ar/autos/al-volante/audicion-un-sentido-vital-para-la-conduccion-nid19032021/,https://bucket1.glanacion.com/anexos/fotos/50/3671350.jpg
48,2635023,Entre Ríos. Una productora denunció a un gremio por violar la propiedad privada,https://www.lanacion.com.ar/economia/campo/una-productora-denuncio-a-un-gremio-rural-por-violacion-de-la-propiedad-privada-nid19032021/,https://bucket1.glanacion.com/anexos/fotos/62/3670962.png
49,2636026,En fotos. De la vuelta de Brandoni al teatro a la salida de Pampita con amigos,https://www.lanacion.com.ar/espectaculos/personajes/en-fotos-de-la-vuelta-de-brandoni-al-teatro-a-la-salida-de-pampita-con-amigos-nid20032021/,https://bucket1.glanacion.com/anexos/fotos/17/3672517.jpg
50,2635986,Coronavirus. Adriana Salgueiro reveló que dio positivo al hisopado,https://www.lanacion.com.ar/espectaculos/personajes/coronavirus-adriana-salgueiro-revelo-que-dio-positivo-al-hisopado-nid20032021/,https://bucket1.glanacion.com/anexos/fotos/66/3672466.jpg
51,2635960,Emily Lucius. El drama de decir la edad: ''No insistan porque no lo voy a decir,https://www.lanacion.com.ar/espectaculos/personajes/emily-lucius-y-el-drama-de-decir-la-edad-no-insistan-porque-no-lo-voy-a-decir-nid20032021/,https://bucket1.glanacion.com/anexos/fotos/03/3672403.jpg
52,2635250,Romance. Cande Tinelli se divierte junto a Coti Sorokin en España,https://www.lanacion.com.ar/espectaculos/personajes/cande-tinelli-se-divierte-junto-a-coti-sorokin-en-espana-nid20032021/,https://bucket1.glanacion.com/anexos/fotos/95/3671595.jpg
53,2634947,La estrella de Bia. Isabela Souza: ''Extraño mucho la Argentina'',https://www.lanacion.com.ar/espectaculos/television/isabela-souza-la-estrella-de-bia-extrano-mucho-la-argentina-nid19032021/,https://bucket1.glanacion.com/anexos/fotos/40/3670840.jpg
54,2636042,"Brillante. Dos clases de definición de Benzema, para la historia de Real Madrid",https://www.lanacion.com.ar/deportes/karim-benzema-que-llevo-a-real-madrid-a-la-victoria-ante-celta-con-dos-definiciones-de-crack-y-su-nid20032021/,https://bucket1.glanacion.com/anexos/fotos/55/3672555.jpg
55,2635110,Ayrton Senna. La moneda que le costó medio millón de dólares en su contrato,https://www.lanacion.com.ar/deportes/ayrton-senna-y-la-moneda-que-le-costo-medio-millon-de-dolares-en-su-contrato-nid19032021/,https://bucket1.glanacion.com/anexos/fotos/93/3671393.png
56,2635964,Golf semidesnudo. El campeón que se quedó en boxers y pegó desde el pantano,https://www.lanacion.com.ar/deportes/wesley-bryan-el-campeon-del-pga-tour-se-metio-al-barro-y-pego-un-tiro-en-boxers-en-el-honda-classic-nid20032021/,https://bucket1.glanacion.com/anexos/fotos/19/3672419.jpg
57,2633988,Nueva vida Cambiaron 23 metros por un colectivo que compraron por US$5000,https://www.lanacion.com.ar/propiedades/nueva-vida-cambiaron-23-metros-por-un-colectivo-que-compraron-por-us5000-nid18032021/,https://bucket1.glanacion.com/anexos/fotos/11/3669511.jpg
58,2635159,Palermo Green. Cómo es el proyecto que dará forma al nuevo barrio,https://www.lanacion.com.ar/propiedades/construccion-y-diseno/palermo-green-como-es-el-proyecto-que-dara-forma-al-nuevo-barrio-nid20032021/,https://bucket1.glanacion.com/anexos/fotos/76/3671476.jpg
59,2634919,Huerta en casa. Por qué te recomendamos sembrar puerros,https://www.lanacion.com.ar/revista-jardin/en-la-huerta-como-cultivar-puerros-la-verdura-rustica-y-versatil-que-se-adapta-a-todo-nid19032021/,https://bucket1.glanacion.com/anexos/fotos/69/3670769.jpg
60,2635227,Obsolescencia programada. Una situación de la que casi no se habla,https://www.lanacion.com.ar/tecnologia/una-obsolescencia-programada-de-la-que-casi-no-se-habla-nid20032021/,https://bucket1.glanacion.com/anexos/fotos/56/3671556.jpg
61,2634901,Semana Santa. Dónde y cuánto cuesta escaparse cerca de la ciudad,https://www.lanacion.com.ar/turismo/semana-santa-donde-y-cuanto-cuesta-escaparse-cerca-de-la-ciudad-nid19032021/,https://bucket1.glanacion.com/anexos/fotos/32/3670732.jpg
62,2635224,Alcatel 1T10 Smart. Probamos la tableta de 10 pulgadas y Android 10,https://www.lanacion.com.ar/tecnologia/alcatel-1t10-smart-probamos-la-tableta-de-10-pulgadas-y-android-10-nid20032021/,https://bucket1.glanacion.com/anexos/fotos/53/3671553.jpg
63,2635040,Día del macaron. Mauricio Asta y Damián Betular comparten sus recetas,https://www.lanacion.com.ar/lifestyle/dia-del-macaron-mauricio-asta-y-damian-betular-comparten-sus-recetas-nid19032021/,https://bucket1.glanacion.com/anexos/fotos/96/3670996.jpg
64,2635038,"Dafne Schilling: ''Podés tener un montón de planes, pero la vida tiene otros''",https://www.lanacion.com.ar/sabado/dafne-schilling-podes-tener-un-monton-de-planes-pero-la-vida-tiene-otros-nid19032021/,https://bucket1.glanacion.com/anexos/fotos/90/3670990.jpg
65,2634884,Decí whiskey. Jameson le pone sonrisas y disfrute a San Patricio,https://www.lanacion.com.ar/lifestyle/deci-whiskey-jameson-le-pone-sonrisas-y-disfrute-a-san-patricio-nid19032021/,https://bucket1.glanacion.com/anexos/fotos/52/3670652.png
66,2632729,De 9 a 21. Looks para una mujer todoterreno,https://www.lanacion.com.ar/moda-y-belleza/de-9-a-21-looks-para-una-mujer-todoterreno-nid17032021/,https://bucket1.glanacion.com/anexos/fotos/32/3667232.png
67,2635020,El adiós a las mascotas. Doulas que acompañan en el final,https://www.lanacion.com.ar/sabado/el-adios-a-las-mascotas-doulas-que-acompanan-en-el-final-nid19032021/,https://bucket1.glanacion.com/anexos/fotos/52/3670952.jpg
68,2171213,Notificaciones: Domá el celular y evitá que te desconcentren,,https://bucket1.glanacion.com/anexos/fotos/82/2767282.jpg
69,2632679,Microcentro. ¿Podrá recuperarse del vacío que le impuso la cuarentena?,https://www.lanacion.com.ar/sociedad/hay-vuelta-atras-para-el-microcentro-desierto-que-dejo-la-cuarentena-nid17032021/,https://bucket1.glanacion.com/anexos/fotos/94/3667094.jpg
70,2635137,Pedido. Julieta Prandi: ''Mis hijos merecen una vida normal'',https://www.lanacion.com.ar/espectaculos/el-desesperado-pedido-de-julieta-prandi-mis-hijos-merecen-una-vida-normal-nid19032021/,https://bucket1.glanacion.com/anexos/fotos/53/3671453.jpg
71,2635016,El nuevo ''Ken humano''. Tiene 40 años y ya se hizo mil cirugías estéticas,https://www.lanacion.com.ar/lifestyle/el-nuevo-ken-humano-tiene-40-anos-y-ya-se-hizo-mil-cirugias-esteticas-nid19032021/,https://bucket1.glanacion.com/anexos/fotos/45/3670945.jpg
72,2635072,Irreconocible. Billie Eilish dejó el pelo verde y mostró su nuevo look,https://www.lanacion.com.ar/lifestyle/billie-eilish-irreconocible-dejo-el-pelo-verde-y-mostro-su-nuevo-look-nid19032021/,https://bucket1.glanacion.com/anexos/fotos/42/3671242.jpg
73,2635068,"""Fue bizarro"". Beto Casella contó un detalle de una audiencia con Yanina Latorre",https://www.lanacion.com.ar/espectaculos/fue-bizarro-beto-casella-revelo-un-insolito-episodio-que-vivio-en-una-audiencia-con-yanina-latorre-nid19032021/,https://bucket1.glanacion.com/anexos/fotos/10/3671210.jpg
74,2635069,Turismo extremo. Asan salchichas en un volcán y posan entre ''bombas de lava'',https://www.lanacion.com.ar/el-mundo/turismo-extremo-asan-salchichas-en-un-volcan-y-posan-entre-bombas-de-lava-nid19032021/,https://bucket1.glanacion.com/anexos/fotos/17/3671217.jpg
75,2635061,En Miami. Rocío Guirao Díaz mostró el interior de su nueva casa,https://www.lanacion.com.ar/lifestyle/rocio-guirao-diaz-mostro-el-interior-de-su-casa-en-miami-nid19032021/,https://bucket1.glanacion.com/anexos/fotos/23/3671123.jpg
